{
  "title":"How to Store Circular Knitting Needles",
  "url":"https://www.wikihow.com/Store-Circular-Knitting-Needles",
  "category_hierarchy":[
    "Hobbies and Crafts",
    "Crafts",
    "Needlework",
    "Knitting and Crochet",
    "Knitting",
    "Knitting Tools and Accessories"
  ],
  "methods":[
    {
      "name":"Making Your Own Storage",
      "steps":[
        {
          "headline":"Store your circular needles in a cookie tin for a decorative option.",
          "description":"You can find large cookie tins year-round, but they are especially popular during the holidays. Once you've eaten all of the cookies, you can use the tin to store your needles."
        },
        {
          "headline":"Use plastic page protectors for storage if you have a lot of needles.",
          "description":"Plastic page protectors, like the kinds used for reports, are perfect for keeping your circular needles organized. You can then keep the protectors in a 3-ring binder. Mark the size of the needles on the plastic to help keep track of them."
        },
        {
          "headline":"Sew pockets onto backing to create your own hanging organizer.",
          "description":"Hanging storage is extremely convenient, but you don't necessarily have to buy one that's pre-made. Cut out squares of fabric a little larger than your needles and sew them onto a pretty backing fabric, leaving the top side open to create a pocket. Making your own organizer allows you to customize the sizes of the pockets to fit your preference for needles."
        },
        {
          "headline":"Loop needles around the neck of a clothes hanger for another hanging option.",
          "description":"If you only have a few needles, a clothes hanger can be the perfect solution. Once the needles are looped around the clothes hanger, you can hang it from a hook on the back of the door, or store it in a closet. Wrap the clothes hanger with ribbon to give this look a decorative touch."
        },
        {
          "headline":"Repurpose a duffel bag to hold your needles and yarn together.",
          "description":"Most overnight bags have large pockets on the outside, perfect for holding your circular knitting needles. They may even have multiple pockets to keep your different-sized needles separate. Although a duffel bag might not be big enough to hold a very large yarn collection, it can be used to hold whichever project you're working on."
        }
      ]
    },
    {
      "name":"Using a Storage Case or Organizer",
      "steps":[
        {
          "headline":"Get a knitting needle case to keep all of your needles organized in one place.",
          "description":"You can find cases for knitting needles at specialty sewing shops. If you use both straight and circular needles, a case is a great way to keep all of your needles in one place. Many cases have pockets in multiple sizes for all of your different knitting needles."
        },
        {
          "headline":"Select a roll-up case if you need to take your needles on the go.",
          "description":"Made similar to a travel jewelry case, these fabric organizers are made with large pockets for holding your circular needles. When you're ready to travel, just roll up the case and toss it into your suitcase!"
        },
        {
          "headline":"Opt for a hanging organizer if you want to conserve space.",
          "description":"You can purchase hanging organizers with sewn pockets, similar to a hanging shoe organizer. These hanging organizers are perfect for keeping your needles out of the way, such as hanging on the back of a closet door."
        }
      ]
    }
  ],
  "text":" Making Your Own Storage Store your circular needles in a cookie tin for a decorative option. You can find large cookie tins year-round, but they are especially popular during the holidays. Once you've eaten all of the cookies, you can use the tin to store your needles. Use plastic page protectors for storage if you have a lot of needles. Plastic page protectors, like the kinds used for reports, are perfect for keeping your circular needles organized. You can then keep the protectors in a 3-ring binder. Mark the size of the needles on the plastic to help keep track of them. Sew pockets onto backing to create your own hanging organizer. Hanging storage is extremely convenient, but you don't necessarily have to buy one that's pre-made. Cut out squares of fabric a little larger than your needles and sew them onto a pretty backing fabric, leaving the top side open to create a pocket. Making your own organizer allows you to customize the sizes of the pockets to fit your preference for needles. Loop needles around the neck of a clothes hanger for another hanging option. If you only have a few needles, a clothes hanger can be the perfect solution. Once the needles are looped around the clothes hanger, you can hang it from a hook on the back of the door, or store it in a closet. Wrap the clothes hanger with ribbon to give this look a decorative touch. Repurpose a duffel bag to hold your needles and yarn together. Most overnight bags have large pockets on the outside, perfect for holding your circular knitting needles. They may even have multiple pockets to keep your different-sized needles separate. Although a duffel bag might not be big enough to hold a very large yarn collection, it can be used to hold whichever project you're working on. Using a Storage Case or Organizer Get a knitting needle case to keep all of your needles organized in one place. You can find cases for knitting needles at specialty sewing shops. If you use both straight and circular needles, a case is a great way to keep all of your needles in one place. Many cases have pockets in multiple sizes for all of your different knitting needles. Select a roll-up case if you need to take your needles on the go. Made similar to a travel jewelry case, these fabric organizers are made with large pockets for holding your circular needles. When you're ready to travel, just roll up the case and toss it into your suitcase! Opt for a hanging organizer if you want to conserve space. You can purchase hanging organizers with sewn pockets, similar to a hanging shoe organizer. These hanging organizers are perfect for keeping your needles out of the way, such as hanging on the back of a closet door.",
  "tyn_model":[
    "needles",
    "clothes hanger",
    "circular needles",
    "plastic page protectors",
    "duffel bag",
    "cookie tin",
    "3-ring binder",
    "fabric",
    "ribbon",
    "yarn",
    "overnight bags",
    "storage case",
    "knitting needle case",
    "fabric organizers",
    "organizer",
    "organizers"
  ],
  "tyn_section":[

  ]
}