{
  "title":"How to Plant Jackfruit",
  "url":"https://www.wikihow.com/Plant-Jackfruit",
  "category_hierarchy":[
    "Home and Garden",
    "Gardening",
    "Planting and Growing",
    "Growing Fruit"
  ],
  "parts":[
    {
      "name":"Germinating Seeds in Pots",
      "steps":[
        {
          "headline":"Purchase jackfruit seeds.",
          "description":"Check with your local nursery or an Asian market to see if they carry jackfruit seeds. If not, you can find seeds available to purchase online. If you have access to ripe jackfruit, you can also harvest seeds from the fruit. Rinse the seeds with warm water to remove the sticky pulp."
        },
        {
          "headline":"Soak the seeds in water for 24 hours.",
          "description":"Place your seeds in a bowl or container with lukewarm water. Let them sit for a full day before sowing them. Soaking seeds will speed up the germination process and make your seedlings grow faster."
        },
        {
          "headline":"Fill a 1 US gal (3.8 L) pot with potting mix.",
          "description":"Use a plastic pot with drainage holes so water can easily flow out from the bottom. Use a well-draining potting mix with perlite, sand, and organic compost to achieve the best drainage in your pot. Premixed potting soil can be purchased at gardening stores, or you can make your own."
        },
        {
          "headline":"Plant 3 seeds 1 in (2.5 cm) deep in the soil.",
          "description":"Space the seeds evenly near the center of the pot. Don\u2019t let the seeds grow near the edges, otherwise the roots may not develop fully. Cover the seeds and press down slightly to compact the potting mix. You can plant more seeds in the pot, but they will be competing for resources and may not grow as well."
        },
        {
          "headline":"Water the seeds every day.",
          "description":"Keep the soil moist, but make sure that it is not overwatered. Stick your finger into the soil up to the first knuckle to feel if it's wet. If it isn\u2019t, water the seeds. Even though jackfruit grows in humid, tropical regions with a lot of rainfall, too much water can cause the seeds and roots to rot. Try to use untreated or distilled water when starting off your seedlings."
        },
        {
          "headline":"Keep the pot in a warm, sunny area.",
          "description":"If you can, keep the pot outdoors during the warmest parts of the day. When the temperature gets near freezing, bring the pot indoors and keep it on a windowsill or near a window so it receives sunlight. A heat lamp indoors is a great substitute if the weather outside is not cooperating."
        },
        {
          "headline":"Thin down to 1 healthy seedling after they\u2019ve started germinating.",
          "description":"It will take 2-3 weeks for your seedlings to germinate. Look for seedlings that have grown the tallest and have healthy looking leaves. Remove the weaker seedlings by gently pulling them out of the soil. Avoid using seedlings that are spindly or have grown near the edge of the pot. Their root systems will not have spread and developed fully."
        }
      ]
    },
    {
      "name":"Transplanting the Seedling Outside",
      "steps":[
        {
          "headline":"Move the seedling outside after it forms 3 to 4 true leaves.",
          "description":"The seedling usually takes 3-4 weeks to germinate and you\u2019ll begin to see leaves forming. True leaves will look large and green without ridges and grow taller than the seed leaves."
        },
        {
          "headline":"Find an area 30 feet (9.1 m) away from other trees to plant the tree.",
          "description":"Jackfruit trees can grow up to 100 feet (30 m) tall if left alone, so they need space to develop and grow. Keep your planting area away from other trees so they aren\u2019t competing for resources. Avoid planting a tree near your house since the roots will grow out and could cause underground damage. Find an area away from high winds so your tree can develop safely."
        },
        {
          "headline":"Dig a 2 \u00d7 2 \u00d7 2 ft (0.61 \u00d7 0.61 \u00d7 0.61 m) hole in well-draining soil.",
          "description":"Use a shovel to dig a square- or circular-shaped hole. Inspect the soil to see if it has sand or clay mixed in since this will help it drain quickly. Jackfruit prefer soil that is between 5 - 7 pH. Add compost into the soil to give your seedling natural nutrients. You can always make your soil drain better by mixing in sand or compost."
        },
        {
          "headline":"Remove the seedling from the pot carefully and place it in the ground.",
          "description":"Squeeze the edges of the pot to loosen the soil. Grab the seedling by the base and gently pull and twist to remove it from the pot. Keep the base of the seedling level with the ground."
        },
        {
          "headline":"Fill the soil in around the tree, making a mound at the base of the trunk.",
          "description":"Pat the topsoil with the bottom of your shovel to compact it onto the roots. Form a cone-shaped mound around the trunk of the tree so water can run off the soil. You can immediately add mulch around the tree if you want to retain moisture for longer."
        }
      ]
    },
    {
      "name":"Caring for Your Tree",
      "steps":[
        {
          "headline":"Water your tree every day.",
          "description":"Newly planted trees need to have water so their roots can establish. Use a garden hose to water at the base of your tree\u2019s trunk. Make sure the soil is damp 1.5 inches (3.8 cm) deep, but do not overwater. During dry periods, water your tree twice a day."
        },
        {
          "headline":"Remove weeds around the tree once a month.",
          "description":"Pull weeds by hand if you can to avoid using herbicides that could damage your tree. You can also make your own weed killer with vinegar or rock salt to kill the weeds surrounding the tree. Weeds will take essential nutrients from the soil if they are left in the ground. Mulching around the tree will help prevent weed growth. If you use herbicides or pesticides to protect your tree, make sure to wash the fruit completely before you eat them."
        },
        {
          "headline":"Layer mulch around the tree if temperatures drop below 35 \u00b0F (2 \u00b0C).",
          "description":"Only jackfruit trees that have acclimated to the climate can survive during the frost and winter. Place more mulch around the tree to insulate the roots for the winter."
        },
        {
          "headline":"Fertilize the tree every 6 months.",
          "description":"During your tree's first year, use 30 grams (1.1 oz) of a fertilizer that\u2019s an 8:4:2:1 ratio of nitrogen, phosphorus, potassium, and magnesium. Every 6 months for the first 2 years, double the amount of fertilizer you use with the same mix. After your tree is 2 years old, use 1 kilogram (2.2 lb) of a fertilizer with a 4:2:4:1 ratio. Water the tree immediately after you fertilize so it can soak into the soil."
        },
        {
          "headline":"Use an organic pesticide to deter bugs.",
          "description":"Although jackfruit is resistant to most fungal diseases, the jackfruit borer is an insect that can destroy every part of your tree. Spray the tree with a natural pesticide so it does not damage the tree. Purchase a natural pesticide from your local garden store or make your own at home. If you notice fruit flies around your tree, wrap the developing fruits with paper bags or newspapers. Wash all your fruit thoroughly after spraying pesticides."
        },
        {
          "headline":"Prune the jackfruit tree in spring to keep your tree below 20 feet (6.1 m).",
          "description":"Jackfruit will grow tall and produce fruit that\u2019s out of reach. Every season, use a pair of loppers or hand shears to trim your tree back to control the size. When the tree reaches 12 feet (3.7 m) tall, cut the trunk back by one-third to promote outward growth rather than upward growth."
        },
        {
          "headline":"Harvest fruit after 3 to 4 years.",
          "description":"After the third or fourth year, your tree will begin developing viable fruit. Within 4 to 5 months, young fruit will begin to ripen and can be picked from the tree. They will have a sweet odor and have a green or yellowish tint. Unripe fruit can be picked as used as a meat substitute after 2-3 months. Ripe jackfruit has a sweeter flavor and can be eaten alone or in recipes."
        }
      ]
    }
  ],
  "text":" Germinating Seeds in Pots Purchase jackfruit seeds. Check with your local nursery or an Asian market to see if they carry jackfruit seeds. If not, you can find seeds available to purchase online. If you have access to ripe jackfruit, you can also harvest seeds from the fruit. Rinse the seeds with warm water to remove the sticky pulp. Soak the seeds in water for 24 hours. Place your seeds in a bowl or container with lukewarm water. Let them sit for a full day before sowing them. Soaking seeds will speed up the germination process and make your seedlings grow faster. Fill a 1 US gal (3.8 L) pot with potting mix. Use a plastic pot with drainage holes so water can easily flow out from the bottom. Use a well-draining potting mix with perlite, sand, and organic compost to achieve the best drainage in your pot. Premixed potting soil can be purchased at gardening stores, or you can make your own. Plant 3 seeds 1 in (2.5 cm) deep in the soil. Space the seeds evenly near the center of the pot. Don\u2019t let the seeds grow near the edges, otherwise the roots may not develop fully. Cover the seeds and press down slightly to compact the potting mix. You can plant more seeds in the pot, but they will be competing for resources and may not grow as well. Water the seeds every day. Keep the soil moist, but make sure that it is not overwatered. Stick your finger into the soil up to the first knuckle to feel if it's wet. If it isn\u2019t, water the seeds. Even though jackfruit grows in humid, tropical regions with a lot of rainfall, too much water can cause the seeds and roots to rot. Try to use untreated or distilled water when starting off your seedlings. Keep the pot in a warm, sunny area. If you can, keep the pot outdoors during the warmest parts of the day. When the temperature gets near freezing, bring the pot indoors and keep it on a windowsill or near a window so it receives sunlight. A heat lamp indoors is a great substitute if the weather outside is not cooperating. Thin down to 1 healthy seedling after they\u2019ve started germinating. It will take 2-3 weeks for your seedlings to germinate. Look for seedlings that have grown the tallest and have healthy looking leaves. Remove the weaker seedlings by gently pulling them out of the soil. Avoid using seedlings that are spindly or have grown near the edge of the pot. Their root systems will not have spread and developed fully. Transplanting the Seedling Outside Move the seedling outside after it forms 3 to 4 true leaves. The seedling usually takes 3-4 weeks to germinate and you\u2019ll begin to see leaves forming. True leaves will look large and green without ridges and grow taller than the seed leaves. Find an area 30 feet (9.1 m) away from other trees to plant the tree. Jackfruit trees can grow up to 100 feet (30 m) tall if left alone, so they need space to develop and grow. Keep your planting area away from other trees so they aren\u2019t competing for resources. Avoid planting a tree near your house since the roots will grow out and could cause underground damage. Find an area away from high winds so your tree can develop safely. Dig a 2 \u00d7 2 \u00d7 2 ft (0.61 \u00d7 0.61 \u00d7 0.61 m) hole in well-draining soil. Use a shovel to dig a square- or circular-shaped hole. Inspect the soil to see if it has sand or clay mixed in since this will help it drain quickly. Jackfruit prefer soil that is between 5 - 7 pH. Add compost into the soil to give your seedling natural nutrients. You can always make your soil drain better by mixing in sand or compost. Remove the seedling from the pot carefully and place it in the ground. Squeeze the edges of the pot to loosen the soil. Grab the seedling by the base and gently pull and twist to remove it from the pot. Keep the base of the seedling level with the ground. Fill the soil in around the tree, making a mound at the base of the trunk. Pat the topsoil with the bottom of your shovel to compact it onto the roots. Form a cone-shaped mound around the trunk of the tree so water can run off the soil. You can immediately add mulch around the tree if you want to retain moisture for longer. Caring for Your Tree Water your tree every day. Newly planted trees need to have water so their roots can establish. Use a garden hose to water at the base of your tree\u2019s trunk. Make sure the soil is damp 1.5 inches (3.8 cm) deep, but do not overwater. During dry periods, water your tree twice a day. Remove weeds around the tree once a month. Pull weeds by hand if you can to avoid using herbicides that could damage your tree. You can also make your own weed killer with vinegar or rock salt to kill the weeds surrounding the tree. Weeds will take essential nutrients from the soil if they are left in the ground. Mulching around the tree will help prevent weed growth. If you use herbicides or pesticides to protect your tree, make sure to wash the fruit completely before you eat them. Layer mulch around the tree if temperatures drop below 35 \u00b0F (2 \u00b0C). Only jackfruit trees that have acclimated to the climate can survive during the frost and winter. Place more mulch around the tree to insulate the roots for the winter. Fertilize the tree every 6 months. During your tree's first year, use 30 grams (1.1 oz) of a fertilizer that\u2019s an 8:4:2:1 ratio of nitrogen, phosphorus, potassium, and magnesium. Every 6 months for the first 2 years, double the amount of fertilizer you use with the same mix. After your tree is 2 years old, use 1 kilogram (2.2 lb) of a fertilizer with a 4:2:4:1 ratio. Water the tree immediately after you fertilize so it can soak into the soil. Use an organic pesticide to deter bugs. Although jackfruit is resistant to most fungal diseases, the jackfruit borer is an insect that can destroy every part of your tree. Spray the tree with a natural pesticide so it does not damage the tree. Purchase a natural pesticide from your local garden store or make your own at home. If you notice fruit flies around your tree, wrap the developing fruits with paper bags or newspapers. Wash all your fruit thoroughly after spraying pesticides. Prune the jackfruit tree in spring to keep your tree below 20 feet (6.1 m). Jackfruit will grow tall and produce fruit that\u2019s out of reach. Every season, use a pair of loppers or hand shears to trim your tree back to control the size. When the tree reaches 12 feet (3.7 m) tall, cut the trunk back by one-third to promote outward growth rather than upward growth. Harvest fruit after 3 to 4 years. After the third or fourth year, your tree will begin developing viable fruit. Within 4 to 5 months, young fruit will begin to ripen and can be picked from the tree. They will have a sweet odor and have a green or yellowish tint. Unripe fruit can be picked as used as a meat substitute after 2-3 months. Ripe jackfruit has a sweeter flavor and can be eaten alone or in recipes.",
  "tyn_model":[
    "water",
    "pot",
    "potting mix",
    "mulch",
    "fertilizer",
    "\u00d7 2",
    "\u00d7 0.61",
    "soil",
    "shovel",
    "compost",
    "natural pesticide",
    "bowl",
    "perlite,",
    "organic compost",
    "potting soil",
    "heat lamp",
    "garden hose",
    "weeds",
    "weed killer",
    "vinegar",
    "rock salt",
    "phosphorus",
    "potassium",
    "magnesium",
    "organic pesticide",
    "jackfruit borer",
    "pesticides",
    "loppers",
    "jackfruit"
  ],
  "tyn_section":[

  ]
}