{
  "title":"How to Make Espresso Without a Machine",
  "url":"https://www.wikihow.com/Make-Espresso-Without-a-Machine",
  "category_hierarchy":[
    "Food and Entertaining",
    "Drinks",
    "Coffee",
    "Espresso Based Coffee"
  ],
  "methods":[
    {
      "name":"Using a French Press",
      "steps":[
        {
          "headline":"Place finely-ground coffee on the bottom of the French press.",
          "description":"Remove the plunger and lid from the French Press and scoop in 1 to 2 tablespoons (5 to 10 g) of grounds for a single shot of espresso. The more grounds you use, the stronger the flavor of the coffee will be. French presses can be purchased at your local kitchen supply store. Use ground espresso beans to get the fullest flavors, though any type of coffee grounds will work."
        },
        {
          "headline":"Bloom the grounds with 0.5  fl oz (15 ml) of hot water in the press.",
          "description":"Heat water in the microwave or over the stove until it is 200 \u00b0F (93 \u00b0C), or just below a boil. Pour the water onto the coffee grounds in the press. Blooming the coffee will release carbon dioxide and make the coffee more flavorful as it brews. Swirl the French press to mix the water with the blooms to activate the flavors."
        },
        {
          "headline":"Pour the rest of the hot water into the press and stir it.",
          "description":"The amount of water added will depend on how much espresso you want to add. Add another 1.5 fluid ounces (44 mL) of water to make a single shot of espresso. Swirl the French press thoroughly so the grounds mix in the water."
        },
        {
          "headline":"Let it steep for 3 to 4 minutes.",
          "description":"Place the lid and plunger back on top of the press, making sure it\u2019s not in contact with your brewing coffee. This helps trap the heat and will keep your coffee at the right temperature. You can let the coffee steep longer if you want a more flavorful brew, but it may make your espresso taste more bitter."
        },
        {
          "headline":"Depress the plunger slowly to separate the grounds from the coffee.",
          "description":"Use enough pressure to move the plunger down through the coffee. The mesh of the plunger will filter out any grounds floating in your espresso and push them to the bottom of the press. Once the plunger is at the bottom, you can serve your espresso hot by pouring it from the spout on your French press into a mug . Do not force the plunger down since it could break your French press or shoot hot coffee out from the top. Add milk or thick cream to the espresso to cut down on the bitter flavor."
        }
      ]
    },
    {
      "name":"Brewing with a Moka Pot",
      "steps":[
        {
          "headline":"Fill the bottom reservoir of the moka pot with water.",
          "description":"Pour water into the bottom portion until it is just below the round hole located on the inside of the pot. Use at least 5 to 6 fluid ounces (150 to 180 mL) of water so it doesn\u2019t boil off or burn your espresso. Moka pots can be purchased online or at your local kitchen specialty store. They come in various sizes depending on how much coffee you plan on brewing with them. Choose a smaller size if you want to make only 1 cup or a larger size if you want to make more."
        },
        {
          "headline":"Add grounds to the coffee chamber.",
          "description":"Use 1 to 2 tablespoons (5 to 10 g) of grounds for every 2 fluid ounces (59 ml) of espresso you want. Don\u2019t pack the coffee grounds too tight in the chamber or else it will be more difficult for the water to pass through it. Make sure the grounds are level with the top of the chamber to give your espresso the most flavor and caffeine. Use fine grounds to make your espresso. It will take longer than coarse grounds, but more flavor will be added to the water."
        },
        {
          "headline":"Reassemble the moka pot and place it on the stove over medium heat.",
          "description":"Place the coffee chamber inside the bottom reservoir and then screw on the top of the pot. Keep the pot at the edge of the burner so the handle doesn\u2019t get too hot when you try to pick it up later."
        },
        {
          "headline":"Let the coffee brew for 4 to 5 minutes.",
          "description":"Make sure the lid of the moka pot is closed while it brews so it retains heat. Once you hear a gurgling sound from your pot, take it off of the heat so you don\u2019t have espresso with a burnt flavor. As the water heats in the bottom reservoir, the pressure builds up and forces the water into the through the coffee grounds and into the top pot."
        },
        {
          "headline":"Serve the espresso in a mug.",
          "description":"Pour the espresso into a small mug as soon as it\u2019s finished so you can enjoy it while it\u2019s still hot. Add cream or milk to lessen the bitterness if you want, and sip it slowly to enjoy the full flavors. Steam or heat the milk in order to make a latte."
        }
      ]
    }
  ],
  "text":" Using a French Press Place finely-ground coffee on the bottom of the French press. Remove the plunger and lid from the French Press and scoop in 1 to 2 tablespoons (5 to 10 g) of grounds for a single shot of espresso. The more grounds you use, the stronger the flavor of the coffee will be. French presses can be purchased at your local kitchen supply store. Use ground espresso beans to get the fullest flavors, though any type of coffee grounds will work. Bloom the grounds with 0.5  fl oz (15 ml) of hot water in the press. Heat water in the microwave or over the stove until it is 200 \u00b0F (93 \u00b0C), or just below a boil. Pour the water onto the coffee grounds in the press. Blooming the coffee will release carbon dioxide and make the coffee more flavorful as it brews. Swirl the French press to mix the water with the blooms to activate the flavors. Pour the rest of the hot water into the press and stir it. The amount of water added will depend on how much espresso you want to add. Add another 1.5 fluid ounces (44 mL) of water to make a single shot of espresso. Swirl the French press thoroughly so the grounds mix in the water. Let it steep for 3 to 4 minutes. Place the lid and plunger back on top of the press, making sure it\u2019s not in contact with your brewing coffee. This helps trap the heat and will keep your coffee at the right temperature. You can let the coffee steep longer if you want a more flavorful brew, but it may make your espresso taste more bitter. Depress the plunger slowly to separate the grounds from the coffee. Use enough pressure to move the plunger down through the coffee. The mesh of the plunger will filter out any grounds floating in your espresso and push them to the bottom of the press. Once the plunger is at the bottom, you can serve your espresso hot by pouring it from the spout on your French press into a mug . Do not force the plunger down since it could break your French press or shoot hot coffee out from the top. Add milk or thick cream to the espresso to cut down on the bitter flavor. Brewing with a Moka Pot Fill the bottom reservoir of the moka pot with water. Pour water into the bottom portion until it is just below the round hole located on the inside of the pot. Use at least 5 to 6 fluid ounces (150 to 180 mL) of water so it doesn\u2019t boil off or burn your espresso. Moka pots can be purchased online or at your local kitchen specialty store. They come in various sizes depending on how much coffee you plan on brewing with them. Choose a smaller size if you want to make only 1 cup or a larger size if you want to make more. Add grounds to the coffee chamber. Use 1 to 2 tablespoons (5 to 10 g) of grounds for every 2 fluid ounces (59 ml) of espresso you want. Don\u2019t pack the coffee grounds too tight in the chamber or else it will be more difficult for the water to pass through it. Make sure the grounds are level with the top of the chamber to give your espresso the most flavor and caffeine. Use fine grounds to make your espresso. It will take longer than coarse grounds, but more flavor will be added to the water. Reassemble the moka pot and place it on the stove over medium heat. Place the coffee chamber inside the bottom reservoir and then screw on the top of the pot. Keep the pot at the edge of the burner so the handle doesn\u2019t get too hot when you try to pick it up later. Let the coffee brew for 4 to 5 minutes. Make sure the lid of the moka pot is closed while it brews so it retains heat. Once you hear a gurgling sound from your pot, take it off of the heat so you don\u2019t have espresso with a burnt flavor. As the water heats in the bottom reservoir, the pressure builds up and forces the water into the through the coffee grounds and into the top pot. Serve the espresso in a mug. Pour the espresso into a small mug as soon as it\u2019s finished so you can enjoy it while it\u2019s still hot. Add cream or milk to lessen the bitterness if you want, and sip it slowly to enjoy the full flavors. Steam or heat the milk in order to make a latte.",
  "tyn_model":[
    "water",
    "french press",
    "plunger",
    "moka pot",
    "milk",
    "coffee grounds",
    "hot water",
    "grounds",
    "pot",
    "french presses",
    "espresso beans",
    "microwave",
    "thick cream",
    "moka pots",
    "stove",
    "burner",
    "cream"
  ],
  "tyn_section":[

  ]
}