{
  "title":"How to Harvest Buttercrunch Lettuce",
  "url":"https://www.wikihow.com/Harvest-Buttercrunch-Lettuce",
  "category_hierarchy":[
    "Home and Garden",
    "Gardening",
    "Planting and Growing",
    "Growing Vegetables",
    "Growing Lettuce"
  ],
  "methods":[
    {
      "name":"Harvesting the Head of Buttercrunch Lettuce",
      "steps":[
        {
          "headline":"Harvest lettuce heads when the lettuce is fully grown.",
          "description":"Easy to harvest, Buttercrunch lettuce will take between 55 to 60 days to reach maturity. When fully grown it forms rich green, compact heads of fan-shaped leaves. A mature head of lettuce will be firm to the touch and 6 to 8 inches in diameter. Buttercrunch lettuce takes a while to run to seed so there is plenty of time after it matures for harvesting."
        },
        {
          "headline":"Use a sharp knife or pruning shears to harvest the lettuce head.",
          "description":"With one hand, lift up the outside leaves of the lettuce and with the other cut the head of the lettuce off at the base of the plant. Make your cut at a point that will keep all the lettuce leaves intact and the roots embedded in the ground. Use a long handled kitchen knife with a thin blade. Do not pull on the lettuce plant or you will disturb the roots."
        },
        {
          "headline":"Leave behind a short stub to re-sprout.",
          "description":"Do not pull or dig out the entire lettuce. You want to leave the roots of the vegetable plant behind so you can harvest it again. The whole plant will keep growing and be ready for harvesting again in two to three weeks if you leave an inch above ground."
        }
      ]
    },
    {
      "name":"Harvesting Buttercrunch Lettuce Leaves",
      "steps":[
        {
          "headline":"Plan to harvest leaves as soon as they\u2019re big enough to use in a salad.",
          "description":"Buttercrunch lettuce is tasty and ready to eat at any size. Baby Buttercrunch lettuce leaves are usually ready to harvest in 24 days."
        },
        {
          "headline":"Pick lettuce leaves as you need them.",
          "description":"Buttercrunch lettuce is a lettuce that forms a loose head. Its leaves grow from the centre, so picking leaves from the outside of the plant allows these centre leaves to grow larger. Start picking outer leaves on demand when they are 2 to 3 inches long, or wait until they are fully grown and large enough to eat."
        },
        {
          "headline":"Use your fingers to remove leaves from the head of the lettuce.",
          "description":"Detach outer lettuce leaves from the base of the Buttercrunch lettuce plant in a pincer movement. Dig in with your thumb and turn your hand to twist the lettuce leaf off. You can continue picking leaves this way until the plant goes to seed and you have to replace it with a new seedling."
        },
        {
          "headline":"Trim lettuce leaves off with scissors or gardening shears.",
          "description":"Use scissors to cut individual lettuce leaves off close to the base. As long as you don't disturb the crown of the Buttercrunch lettuce, lettuce leaves will keep growing back to be harvested, over and over again. This harvesting technique is commonly known as a \u2018cut-and-come-again\u2019 method. Be careful when cutting. If you cut into or below the crown, the plant might die."
        }
      ]
    },
    {
      "name":"Storing the Harvested Lettuce",
      "steps":[
        {
          "headline":"Rinse and wash harvested Buttercrunch lettuce before storing it.",
          "description":"Always wash harvested lettuce in cold water before eating and storing it. This will remove any dirt, insects and insecticides that have become trapped in and on the lettuce leaves. While washing your lettuce, remove any damaged leaves. Pests to watch out for when rinsing lettuce include slugs, aphids, and small green caterpillars."
        },
        {
          "headline":"Dry Buttercrunch lettuce after washing it.",
          "description":"Shake any excess water off the lettuce head and gently pat it dry with a paper towel. If drying just the leaves, spread them out over a paper towel. Let them air dry or place another towel on top and gently press down to mop up any moisture. Be careful not to bruise any of the leaves. A salad spinner is a great alternative for drying lettuce before eating or storing."
        },
        {
          "headline":"Wrap clean lettuce in a dry paper towel.",
          "description":"Wrapping Buttercrunch lettuce heads in a paper towel will stop them from wilting and getting slimy, as will layering lettuce leaves between paper towels. Place your paper-wrapped lettuce into a loosely closed plastic bag or cloth bag for storing. You may have to replace the paper towels after a few days if they become too wet."
        },
        {
          "headline":"Store the washed and dried lettuce in the refrigerator.",
          "description":"Lettuce does not store well for long periods and is best eaten fresh. To keep lettuce for longer than a day or two, store it in the crisper drawer of your refrigerator. Refrigerate lettuce immediately after harvesting. Clean, properly stored loose lettuce leaves should keep in the fridge for up to 10 days. Heads of lettuce have a longer fridge life and will last up to three weeks."
        }
      ]
    }
  ],
  "text":" Harvesting the Head of Buttercrunch Lettuce Harvest lettuce heads when the lettuce is fully grown. Easy to harvest, Buttercrunch lettuce will take between 55 to 60 days to reach maturity. When fully grown it forms rich green, compact heads of fan-shaped leaves. A mature head of lettuce will be firm to the touch and 6 to 8 inches in diameter. Buttercrunch lettuce takes a while to run to seed so there is plenty of time after it matures for harvesting. Use a sharp knife or pruning shears to harvest the lettuce head. With one hand, lift up the outside leaves of the lettuce and with the other cut the head of the lettuce off at the base of the plant. Make your cut at a point that will keep all the lettuce leaves intact and the roots embedded in the ground. Use a long handled kitchen knife with a thin blade. Do not pull on the lettuce plant or you will disturb the roots. Leave behind a short stub to re-sprout. Do not pull or dig out the entire lettuce. You want to leave the roots of the vegetable plant behind so you can harvest it again. The whole plant will keep growing and be ready for harvesting again in two to three weeks if you leave an inch above ground. Harvesting Buttercrunch Lettuce Leaves Plan to harvest leaves as soon as they\u2019re big enough to use in a salad. Buttercrunch lettuce is tasty and ready to eat at any size. Baby Buttercrunch lettuce leaves are usually ready to harvest in 24 days. Pick lettuce leaves as you need them. Buttercrunch lettuce is a lettuce that forms a loose head. Its leaves grow from the centre, so picking leaves from the outside of the plant allows these centre leaves to grow larger. Start picking outer leaves on demand when they are 2 to 3 inches long, or wait until they are fully grown and large enough to eat. Use your fingers to remove leaves from the head of the lettuce. Detach outer lettuce leaves from the base of the Buttercrunch lettuce plant in a pincer movement. Dig in with your thumb and turn your hand to twist the lettuce leaf off. You can continue picking leaves this way until the plant goes to seed and you have to replace it with a new seedling. Trim lettuce leaves off with scissors or gardening shears. Use scissors to cut individual lettuce leaves off close to the base. As long as you don't disturb the crown of the Buttercrunch lettuce, lettuce leaves will keep growing back to be harvested, over and over again. This harvesting technique is commonly known as a \u2018cut-and-come-again\u2019 method. Be careful when cutting. If you cut into or below the crown, the plant might die. Storing the Harvested Lettuce Rinse and wash harvested Buttercrunch lettuce before storing it. Always wash harvested lettuce in cold water before eating and storing it. This will remove any dirt, insects and insecticides that have become trapped in and on the lettuce leaves. While washing your lettuce, remove any damaged leaves. Pests to watch out for when rinsing lettuce include slugs, aphids, and small green caterpillars. Dry Buttercrunch lettuce after washing it. Shake any excess water off the lettuce head and gently pat it dry with a paper towel. If drying just the leaves, spread them out over a paper towel. Let them air dry or place another towel on top and gently press down to mop up any moisture. Be careful not to bruise any of the leaves. A salad spinner is a great alternative for drying lettuce before eating or storing. Wrap clean lettuce in a dry paper towel. Wrapping Buttercrunch lettuce heads in a paper towel will stop them from wilting and getting slimy, as will layering lettuce leaves between paper towels. Place your paper-wrapped lettuce into a loosely closed plastic bag or cloth bag for storing. You may have to replace the paper towels after a few days if they become too wet. Store the washed and dried lettuce in the refrigerator. Lettuce does not store well for long periods and is best eaten fresh. To keep lettuce for longer than a day or two, store it in the crisper drawer of your refrigerator. Refrigerate lettuce immediately after harvesting. Clean, properly stored loose lettuce leaves should keep in the fridge for up to 10 days. Heads of lettuce have a longer fridge life and will last up to three weeks.",
  "tyn_model":[
    "lettuce",
    "buttercrunch lettuce",
    "paper towel",
    "scissors",
    "water",
    "paper towels",
    "knife",
    "pruning shears",
    "kitchen knife",
    "gardening shears",
    "\u2018cut",
    "\u2019 method",
    "salad spinner",
    "refrigerator"
  ],
  "tyn_section":[

  ]
}