{
  "title":"How to Contact Steam Support",
  "url":"https://www.wikihow.com/Contact-Steam-Support",
  "category_hierarchy":[
    "Hobbies and Crafts",
    "Games",
    "Video Games",
    "Steam Games"
  ],
  "methods":[
    {
      "name":"Submitting a Ticket",
      "steps":[
        {
          "headline":"Sign into your Steam account at https://help.steampowered.com/en/.",
          "description":"For any Steam issue that you\u2019re having that\u2019s not unlocking your account, go to the Steam support home page. Sign in using your Steam Account name and password by clicking the box on the left that says \u201cSign into Steam.\u201d\nAfter you enter your name and password, click \u201clogin.\u201d"
        },
        {
          "headline":"Create a support account if you don\u2019t already have one.",
          "description":"If you have never submitted a ticket for support help, click \u201cCreate account\u201d in the upper right corner of the screen to make a support account. This account is different than your regular Steam account, so you don\u2019t already have one unless you have specifically contacted Steam support in the past. If you have submitted a ticket to Steam support in the past, you can log in to your existing support account by clicking \u201cSign in to your support account\u201d in the upper right corner of the screen."
        },
        {
          "headline":"Choose \u201cSteam\u201d to get to the Steam section of support.",
          "description":"The next page allows you to choose if your problem is with a \u201cGame\u201d or with \u201cSteam.\u201d Select Steam to view some troubleshooting articles under topics including account issues, billing, how-to\u2019s, and a Steam glossary. Try browsing the articles posted to see if your question can be answered without you sending a ticket to support."
        },
        {
          "headline":"Click \u201cContact Steam Support\u201d to submit a ticket to Steam support.",
          "description":"If browsing articles doesn\u2019t answer your question, you can submit a ticket describing your problem directly to a support person. Clicking \u201cContact Steam Support\u201d will bring you to the page where you submit a ticket. The \u201cContact Steam Support\u201d button is on the right of the page, underneath \u201cCan\u2019t find the solution?\u201d"
        },
        {
          "headline":"Fill in all boxes on the Ask a Question page.",
          "description":"The ticket page has 2 boxes where you type the subject of your problem, and then your question. Be as specific as possible when describing your problem so the person reading it can help you the best they can. For instance, if you are having trouble trading games and got a message in your account saying your trading privileges were removed, type something like \u201cAccount is trade banned\u201d in the subject. Then explain the messages you are getting and things you cannot do in the large question box. Remember to be polite when asking your questions, since the support person reading them would like to help you the best they can."
        },
        {
          "headline":"Select answers for the other drop-down menu boxes on the page.",
          "description":"The rest of the page has questions that prompt you to choose an answer from a drop-down menu: Language, Your Email Address, Product, Category, Additional Information, and Operating System. Choose an answer from each menu that most applies to you. If your email address has been compromised and that is part of the problem you\u2019re reporting, click \u201cAdd Alternate Email Address\u201d under the Your Email Address drop-down menu to provide Steam with a new address to reach you. You may have to provide a CD Key if you have never connected a method of payment to your account. This information should be available to you in previous emails from Steam."
        },
        {
          "headline":"Click \u201cSubmit Question\u201d at the bottom of the page when you\u2019re finished.",
          "description":"When you have competed the ticket page, submit your question by clicking the green \u201cSubmit Question\u201d box at the bottom of the screen. The Steam support team should respond to your ticket via email in the next couple of business days."
        }
      ]
    },
    {
      "name":"Unlocking Your Account",
      "steps":[
        {
          "headline":"Go to https://help.steampowered.com/en/ to access Steam\u2019s support site.",
          "description":"To see different options of support that Steam provides, use an internet browser of your choice to go their home support page. The support page gives you the option to either sign in, or to fix problems that you\u2019re having with signing in."
        },
        {
          "headline":"Click \u201cHelp, I can\u2019t sign in.\u201d This page gives you 2 options: to sign into your account or to get help signing in.",
          "description":"If you\u2019re unable to get into your account, click the button on the right to be sent to the page of options for help with unlocking it. Clicking \u201cSign in\u201d on the left will take you to the troubleshooting pages where you can browse articles or submit a ticket. Choose this one if you are still able to sign into your account."
        },
        {
          "headline":"Choose the first option if you forgot your name or password.",
          "description":"On the next page you\u2019ll see a list of 4 options. Click the top one, \u201cI forgot my Steam Account name or password\u201d if you simply forgot how to get into your account. When you click the top option, you\u2019ll be directed to enter your name, email address, or phone number on the next page to unlock your account."
        },
        {
          "headline":"Pick the second option if your account was stolen.",
          "description":"If you think that someone has been using your account, click the second option. On the next page you\u2019ll find directions for recovering and securing your account."
        },
        {
          "headline":"Choose the third option if you need a Steam Guard code.",
          "description":"If you are not receiving the Guard code that you need for unlocking your account, click the option that says \u201cI\u2019m not receiving a Steam Guard code.\u201d The next page will have directions for verifying and updating your email address. You will also be directed on how to add Steam support email addresses to your contacts so that you receive emails from them in the future."
        },
        {
          "headline":"Pick the fourth option if you need a Steam Guard Mobile Authenticator.",
          "description":"Click \u201cI deleted or lost my Steam Guard Mobile Authenticator\u201d if this has happened to you. You will be directed to enter your name, email address, or phone number on the next page to proceed."
        }
      ]
    }
  ],
  "text":" Submitting a Ticket Sign into your Steam account at https://help.steampowered.com/en/. For any Steam issue that you\u2019re having that\u2019s not unlocking your account, go to the Steam support home page. Sign in using your Steam Account name and password by clicking the box on the left that says \u201cSign into Steam.\u201d\nAfter you enter your name and password, click \u201clogin.\u201d Create a support account if you don\u2019t already have one. If you have never submitted a ticket for support help, click \u201cCreate account\u201d in the upper right corner of the screen to make a support account. This account is different than your regular Steam account, so you don\u2019t already have one unless you have specifically contacted Steam support in the past. If you have submitted a ticket to Steam support in the past, you can log in to your existing support account by clicking \u201cSign in to your support account\u201d in the upper right corner of the screen. Choose \u201cSteam\u201d to get to the Steam section of support. The next page allows you to choose if your problem is with a \u201cGame\u201d or with \u201cSteam.\u201d Select Steam to view some troubleshooting articles under topics including account issues, billing, how-to\u2019s, and a Steam glossary. Try browsing the articles posted to see if your question can be answered without you sending a ticket to support. Click \u201cContact Steam Support\u201d to submit a ticket to Steam support. If browsing articles doesn\u2019t answer your question, you can submit a ticket describing your problem directly to a support person. Clicking \u201cContact Steam Support\u201d will bring you to the page where you submit a ticket. The \u201cContact Steam Support\u201d button is on the right of the page, underneath \u201cCan\u2019t find the solution?\u201d Fill in all boxes on the Ask a Question page. The ticket page has 2 boxes where you type the subject of your problem, and then your question. Be as specific as possible when describing your problem so the person reading it can help you the best they can. For instance, if you are having trouble trading games and got a message in your account saying your trading privileges were removed, type something like \u201cAccount is trade banned\u201d in the subject. Then explain the messages you are getting and things you cannot do in the large question box. Remember to be polite when asking your questions, since the support person reading them would like to help you the best they can. Select answers for the other drop-down menu boxes on the page. The rest of the page has questions that prompt you to choose an answer from a drop-down menu: Language, Your Email Address, Product, Category, Additional Information, and Operating System. Choose an answer from each menu that most applies to you. If your email address has been compromised and that is part of the problem you\u2019re reporting, click \u201cAdd Alternate Email Address\u201d under the Your Email Address drop-down menu to provide Steam with a new address to reach you. You may have to provide a CD Key if you have never connected a method of payment to your account. This information should be available to you in previous emails from Steam. Click \u201cSubmit Question\u201d at the bottom of the page when you\u2019re finished. When you have competed the ticket page, submit your question by clicking the green \u201cSubmit Question\u201d box at the bottom of the screen. The Steam support team should respond to your ticket via email in the next couple of business days. Unlocking Your Account Go to https://help.steampowered.com/en/ to access Steam\u2019s support site. To see different options of support that Steam provides, use an internet browser of your choice to go their home support page. The support page gives you the option to either sign in, or to fix problems that you\u2019re having with signing in. Click \u201cHelp, I can\u2019t sign in.\u201d This page gives you 2 options: to sign into your account or to get help signing in. If you\u2019re unable to get into your account, click the button on the right to be sent to the page of options for help with unlocking it. Clicking \u201cSign in\u201d on the left will take you to the troubleshooting pages where you can browse articles or submit a ticket. Choose this one if you are still able to sign into your account. Choose the first option if you forgot your name or password. On the next page you\u2019ll see a list of 4 options. Click the top one, \u201cI forgot my Steam Account name or password\u201d if you simply forgot how to get into your account. When you click the top option, you\u2019ll be directed to enter your name, email address, or phone number on the next page to unlock your account. Pick the second option if your account was stolen. If you think that someone has been using your account, click the second option. On the next page you\u2019ll find directions for recovering and securing your account. Choose the third option if you need a Steam Guard code. If you are not receiving the Guard code that you need for unlocking your account, click the option that says \u201cI\u2019m not receiving a Steam Guard code.\u201d The next page will have directions for verifying and updating your email address. You will also be directed on how to add Steam support email addresses to your contacts so that you receive emails from them in the future. Pick the fourth option if you need a Steam Guard Mobile Authenticator. Click \u201cI deleted or lost my Steam Guard Mobile Authenticator\u201d if this has happened to you. You will be directed to enter your name, email address, or phone number on the next page to proceed.",
  "tyn_model":[
    "steam",
    "steam guard",
    "steam support",
    "\u201csign",
    "\u201d in",
    "\u201ccontact",
    "\u201ci",
    "\u201csteam",
    "\u201d to",
    "\u201csubmit",
    "\u201d if",
    "steam account",
    "\u201d\n",
    "\u201clogin",
    "\u201d create",
    "\u201ccreate",
    "\u201cgame",
    "\u201d or",
    "\u201d select",
    "\u201d will",
    "\u201d button",
    "\u201cca",
    "\u201d fill",
    "\u201caccount",
    "\u201cadd",
    "\u201d under",
    "\u201d at",
    "\u201d box",
    "\u201chelp",
    "\u201d this",
    "\u201d on",
    "\u201d the"
  ],
  "tyn_section":[

  ]
}