{
  "title":"How to Get Rust Stains out of Clothes",
  "url":"https://www.wikihow.com/Get-Rust-Stains-out-of-Clothes",
  "category_hierarchy":[
    "Home and Garden",
    "Housekeeping",
    "Laundry",
    "Cleaning Clothes"
  ],
  "methods":[
    {
      "name":"Using Commercial Rust Remover",
      "steps":[
        {
          "headline":"Purchase a commercial rust stain remover.",
          "description":"You can check your local grocery store, home improvement store, hardware store, or an online supplier for rust stain removers to select from. You will be able to find them in the laundry aisle at supermarkets or the home goods section."
        },
        {
          "headline":"Apply rust remover to the stain.",
          "description":"You should use just enough to fully cover the stain, however big it may be. You may let it sit in the material for a few minutes if necessary. Carefully read any directions or warnings prior to application as it may tell you the exact measurement or time to leave on the material."
        },
        {
          "headline":"Rinse and rinse again.",
          "description":"You\u2019ll want to give your clothes a thorough rinse with clean, cold water. A second rinse will remove the harmful acids that may linger and deteriorate the material of your clothes. Then, launder your clothes as normal. The main component in rust removers is an acid that will lift the rust stain from your clothes. Acids present in commercial rust removers such as oxalic or hydrofluoric acid will cause damage to skin and household appliances."
        }
      ]
    },
    {
      "name":"Applying Lemon and Salt",
      "steps":[
        {
          "headline":"Cover the stain with lemon and salt.",
          "description":"Liberally sprinkle the stained area with salt. Afterwards, fully saturate only the stain with lemon juice. This process is safe for white or unbleached fabrics such as linen. Colored or delicate fabrics such as rayon, silk, wool, leather, and suede are to be taken to a dry cleaner. You may also substitute lemon juice with white vinegar. Vinegar is a good choice if the stain has been present for some time."
        },
        {
          "headline":"Soak and blot the stain.",
          "description":"Allow it to sit for about five to ten minutes. Blot stain with a clean white towel."
        },
        {
          "headline":"Dry the spot in the sun.",
          "description":"After thoroughly coating the stain with the salt and lemon juice, place material outside in the sun under a towel until dry. It is recommended to check every hour to make sure the lemon doesn\u2019t bleach your fabric for up to three hours or until the stain has faded. To finish, give it a good rinse with cold water before washing as normal, since lemon may leave a stain or bleach light clothing. If sunlight is not available you can also simply air dry until the spot is completely dry!"
        }
      ]
    },
    {
      "name":"Utilizing Rhubarb Juice",
      "steps":[
        {
          "headline":"Boil the rhubarb.",
          "description":"Get a pot that is large enough to contain the stained clothing article. Fill it halfway to three-quarters with water and add rhubarb stalks. Bring water to a boil for 20 minutes. Unlike lemon and salt, rhubarb is not as well known for removing rust stains, but it\u2019s gentle on fabric and will safely remove the stain. Rhubarb, a plant whose stalks which are used mostly for food and medicine, is known to be a natural mordant, which is what allows dyes to bind to fabrics so that dyes don't fade too quickly. However, it does not dye fabrics on its own."
        },
        {
          "headline":"Soak the stained garment in water.",
          "description":"After removing the pot from the heat, take out the rhubarb. Soak for a few hours or until the stain is no longer visible."
        },
        {
          "headline":"Wash as normal.",
          "description":"Carefully inspect that the rust discoloration is completely gone. If so, rinse thoroughly before laundering."
        }
      ]
    }
  ],
  "text":" Using Commercial Rust Remover Purchase a commercial rust stain remover. You can check your local grocery store, home improvement store, hardware store, or an online supplier for rust stain removers to select from. You will be able to find them in the laundry aisle at supermarkets or the home goods section. Apply rust remover to the stain. You should use just enough to fully cover the stain, however big it may be. You may let it sit in the material for a few minutes if necessary. Carefully read any directions or warnings prior to application as it may tell you the exact measurement or time to leave on the material. Rinse and rinse again. You\u2019ll want to give your clothes a thorough rinse with clean, cold water. A second rinse will remove the harmful acids that may linger and deteriorate the material of your clothes. Then, launder your clothes as normal. The main component in rust removers is an acid that will lift the rust stain from your clothes. Acids present in commercial rust removers such as oxalic or hydrofluoric acid will cause damage to skin and household appliances. Applying Lemon and Salt Cover the stain with lemon and salt. Liberally sprinkle the stained area with salt. Afterwards, fully saturate only the stain with lemon juice. This process is safe for white or unbleached fabrics such as linen. Colored or delicate fabrics such as rayon, silk, wool, leather, and suede are to be taken to a dry cleaner. You may also substitute lemon juice with white vinegar. Vinegar is a good choice if the stain has been present for some time. Soak and blot the stain. Allow it to sit for about five to ten minutes. Blot stain with a clean white towel. Dry the spot in the sun. After thoroughly coating the stain with the salt and lemon juice, place material outside in the sun under a towel until dry. It is recommended to check every hour to make sure the lemon doesn\u2019t bleach your fabric for up to three hours or until the stain has faded. To finish, give it a good rinse with cold water before washing as normal, since lemon may leave a stain or bleach light clothing. If sunlight is not available you can also simply air dry until the spot is completely dry! Utilizing Rhubarb Juice Boil the rhubarb. Get a pot that is large enough to contain the stained clothing article. Fill it halfway to three-quarters with water and add rhubarb stalks. Bring water to a boil for 20 minutes. Unlike lemon and salt, rhubarb is not as well known for removing rust stains, but it\u2019s gentle on fabric and will safely remove the stain. Rhubarb, a plant whose stalks which are used mostly for food and medicine, is known to be a natural mordant, which is what allows dyes to bind to fabrics so that dyes don't fade too quickly. However, it does not dye fabrics on its own. Soak the stained garment in water. After removing the pot from the heat, take out the rhubarb. Soak for a few hours or until the stain is no longer visible. Wash as normal. Carefully inspect that the rust discoloration is completely gone. If so, rinse thoroughly before laundering.",
  "tyn_model":[
    "water",
    "lemon",
    "salt",
    "rhubarb",
    "lemon juice",
    "rust removers",
    "pot",
    "rust stain removers",
    "rust remover",
    "hydrofluoric acid",
    "dry cleaner",
    "white vinegar",
    "vinegar",
    "towel",
    "fabric",
    "rhubarb juice"
  ],
  "tyn_section":[

  ]
}