{
  "title":"How to Bake Cakes in Springform Pans",
  "url":"https://www.wikihow.com/Bake-Cakes-in-Springform-Pans",
  "category_hierarchy":[
    "Food and Entertaining",
    "Recipes",
    "Baking",
    "Cakes"
  ],
  "parts":[
    {
      "name":"Picking and Assembling the Pan",
      "steps":[
        {
          "headline":"Use a silicon pan for cakes that use runny batters.",
          "description":"Silicon pans with glass bottoms protect against leaks better than most metal pans. Leakage from your pan can ruin your cake and make an unwanted mess in the oven. Silicon pans peel off the cake much like a wrapper and are easy to store due to their flexibility."
        },
        {
          "headline":"Use a metal pan for cakes that have a crust.",
          "description":"The crust needs to be compressed against a supportive pan to take shape and bake properly. Pan sizes vary so choose one that fits your purpose."
        },
        {
          "headline":"Assemble the pan by attaching the outer ring to the base and securing the side lock.",
          "description":"Make sure the outer ring is tight and will not come loose. Apply pressure on the base once the pan is assembled to ensure proper locking."
        },
        {
          "headline":"Check the pan for any leaks.",
          "description":"Fill your springform pan with water and hold over the sink to inspect it for leaks. Leakage can occur where the outer ring attaches to the base and sometimes near the sidewall latch. If leakage occurs, wrap your pan in 2 layers of tin foil. Expect most springform pans to leak a little bit."
        },
        {
          "headline":"Grease the pan to ensure quality cooking and prevent the cake from sticking.",
          "description":"Apply butter or cooking spray to your entire pan. Even with nonstick pans, it is a good idea to gently coat to the pan to prevent your cake from sticking. Parchment paper can also be placed on the base of the pan to further prevent sticking on the bottom. The parchment paper will help you release the cake from the pan after baking so you don't have to cut on the base."
        }
      ]
    },
    {
      "name":"Putting the Cake in the Oven",
      "steps":[
        {
          "headline":"Fill the pan with the proper ingredients for your recipe.",
          "description":"If your cake has layers, gently add the ingredients of each layer to avoid the layers getting mixed together. This will ensure your cake looks great and cooks as it is supposed to. Springform pans work great for cheesecakes, kuchens with fruit toppings, and tortes since you don't have to flip the pan over to remove the cake."
        },
        {
          "headline":"Place cheesecakes and custards in a water bath.",
          "description":"Wrap the springform pan in two layers of tin foil and place into another large shallow pan filled with warm water. You can also place your pan in a slightly larger cake pan before putting it into the water bath to avoid exposure to excessive moisture. A water bath creates moisture in the oven while baking to keep delicate cakes from drying out or cracking"
        },
        {
          "headline":"Heat your oven to the appropriate temperature.",
          "description":"Baking at the right temperature is vital to the texture and taste of your cake. Every cake will cook differently so be sure to follow your recipe for the appropriate temperature and cook time."
        },
        {
          "headline":"Place your springform pan in the oven.",
          "description":"Set a timer and check your pan as needed to ensure proper cooking. Take note of the color of your pan because darker pans will absorb more heat which can cook your cake faster. Adjust your time appropriately."
        }
      ]
    },
    {
      "name":"Cooling and Serving the Cake",
      "steps":[
        {
          "headline":"Pull your cake out of the oven.",
          "description":"Depending on what kind of cake you are baking, there will be indications of when it is cooked properly. For most cakes insert a toothpick into the top of the cake to see if any batter sticks. If nothing is on the toothpick, the cake is done. To check cheesecakes, gently shake the pan. If only a small portion in the middle of the cake is jiggly, it is done."
        },
        {
          "headline":"Run a knife between the cake and edge of the pan to prevent sticking.",
          "description":"It is important to do this right when the pan comes out of the oven before the cake cools and expands. If you are using a nonstick pan, use a rubber spatula instead of a knife to avoid damaging the non-stick coating of the pan."
        },
        {
          "headline":"Cool off the cake by putting it on a cooling rack.",
          "description":"Once the cake is cool, you can then open the side lock of the pan. Opening the side lock to soon can ruin the shape of your cake. Depending on the type of cake, it may be advised to keep the ring on and set the cake in the refrigerator overnight."
        },
        {
          "headline":"Remove the outer ring.",
          "description":"Carefully release the side lock and lift the outer ring upward to detach it from the base. Be sure to use both hands when removing the outer ring to avoid damaging the cake. You can also set the base of the pan on a jar and pull the outer ring downward to remove the cake."
        },
        {
          "headline":"Serve your amazing cake.",
          "description":"Add any additional toppings to the cake before serving. You can serve the cake directly on the base of the pan or carefully slide it onto a platter of your choice. If you have a metal base, cut the cake carefully to avoid damaging the pan coating."
        }
      ]
    }
  ],
  "text":" Picking and Assembling the Pan Use a silicon pan for cakes that use runny batters. Silicon pans with glass bottoms protect against leaks better than most metal pans. Leakage from your pan can ruin your cake and make an unwanted mess in the oven. Silicon pans peel off the cake much like a wrapper and are easy to store due to their flexibility. Use a metal pan for cakes that have a crust. The crust needs to be compressed against a supportive pan to take shape and bake properly. Pan sizes vary so choose one that fits your purpose. Assemble the pan by attaching the outer ring to the base and securing the side lock. Make sure the outer ring is tight and will not come loose. Apply pressure on the base once the pan is assembled to ensure proper locking. Check the pan for any leaks. Fill your springform pan with water and hold over the sink to inspect it for leaks. Leakage can occur where the outer ring attaches to the base and sometimes near the sidewall latch. If leakage occurs, wrap your pan in 2 layers of tin foil. Expect most springform pans to leak a little bit. Grease the pan to ensure quality cooking and prevent the cake from sticking. Apply butter or cooking spray to your entire pan. Even with nonstick pans, it is a good idea to gently coat to the pan to prevent your cake from sticking. Parchment paper can also be placed on the base of the pan to further prevent sticking on the bottom. The parchment paper will help you release the cake from the pan after baking so you don't have to cut on the base. Putting the Cake in the Oven Fill the pan with the proper ingredients for your recipe. If your cake has layers, gently add the ingredients of each layer to avoid the layers getting mixed together. This will ensure your cake looks great and cooks as it is supposed to. Springform pans work great for cheesecakes, kuchens with fruit toppings, and tortes since you don't have to flip the pan over to remove the cake. Place cheesecakes and custards in a water bath. Wrap the springform pan in two layers of tin foil and place into another large shallow pan filled with warm water. You can also place your pan in a slightly larger cake pan before putting it into the water bath to avoid exposure to excessive moisture. A water bath creates moisture in the oven while baking to keep delicate cakes from drying out or cracking Heat your oven to the appropriate temperature. Baking at the right temperature is vital to the texture and taste of your cake. Every cake will cook differently so be sure to follow your recipe for the appropriate temperature and cook time. Place your springform pan in the oven. Set a timer and check your pan as needed to ensure proper cooking. Take note of the color of your pan because darker pans will absorb more heat which can cook your cake faster. Adjust your time appropriately. Cooling and Serving the Cake Pull your cake out of the oven. Depending on what kind of cake you are baking, there will be indications of when it is cooked properly. For most cakes insert a toothpick into the top of the cake to see if any batter sticks. If nothing is on the toothpick, the cake is done. To check cheesecakes, gently shake the pan. If only a small portion in the middle of the cake is jiggly, it is done. Run a knife between the cake and edge of the pan to prevent sticking. It is important to do this right when the pan comes out of the oven before the cake cools and expands. If you are using a nonstick pan, use a rubber spatula instead of a knife to avoid damaging the non-stick coating of the pan. Cool off the cake by putting it on a cooling rack. Once the cake is cool, you can then open the side lock of the pan. Opening the side lock to soon can ruin the shape of your cake. Depending on the type of cake, it may be advised to keep the ring on and set the cake in the refrigerator overnight. Remove the outer ring. Carefully release the side lock and lift the outer ring upward to detach it from the base. Be sure to use both hands when removing the outer ring to avoid damaging the cake. You can also set the base of the pan on a jar and pull the outer ring downward to remove the cake. Serve your amazing cake. Add any additional toppings to the cake before serving. You can serve the cake directly on the base of the pan or carefully slide it onto a platter of your choice. If you have a metal base, cut the cake carefully to avoid damaging the pan coating.",
  "tyn_model":[
    "oven",
    "pan",
    "water",
    "springform pan",
    "silicon pans",
    "tin foil",
    "springform pans",
    "parchment paper",
    "knife",
    "silicon pan",
    "pans",
    "sink",
    "butter",
    "cooking spray",
    "cake pan",
    "water bath",
    "toothpick",
    "rubber spatula",
    "refrigerator",
    "jar",
    "cake"
  ],
  "tyn_section":[

  ]
}