{
  "title":"How to Troubleshoot Failed Biscuits or Cookies",
  "url":"https://www.wikihow.com/Troubleshoot-Failed-Biscuits-or-Cookies",
  "category_hierarchy":[
    "Food and Entertaining",
    "Recipes",
    "Baking",
    "Cookies and Biscuits"
  ],
  "methods":[
    {
      "name":"Too soft",
      "steps":[
        {
          "headline":"Consider the cooking time.",
          "description":"If not cooked long enough, the biscuits or cookies can remain too soft."
        },
        {
          "headline":"Check the baking tray or sheet.",
          "description":"The baking tray or sheet is important when baking biscuits or cookies. Too slim a base, and they can burn; sides that are too high, and the biscuits or cookies can cook unevenly, leaving some of them too soft."
        },
        {
          "headline":"Review your storage methods.",
          "description":"If the biscuits or cookies came out fine but have gone soft since, some of the following might be the cause:\nThe biscuits or cookies were not allowed to cool on the tray/sheet. Resist moving them too quickly from the tray/sheet - a little of the cooking time continues the tray/sheet. Simply loosen them, leave on the tray/sheet to cool for a short time, then move to the wire cooling rack to cool completely. The biscuits or cookies were placed in their storage container before they had fully cooled down. Warmth brings moisture with it and if you transfer biscuits or cookies that are even only slightly warm to an airtight container, you effectively trap the moisture in, creating a perfect softening environment. Wait until the biscuits or cookies are cold before storing. The storage container is not airtight. Any air getting into a container will cause biscuits and cookies to soften. Replace with an airtight container."
        }
      ]
    },
    {
      "name":"Too hard",
      "steps":[
        {
          "headline":"Review your measurements.",
          "description":"Inaccurate measurement that results in the addition of too much of the dry ingredients can result in overly hardened baked goods."
        },
        {
          "headline":"Check the time allowed for baking.",
          "description":"Anything left in the oven too long will overcook and harden, biscuits and cookies included."
        },
        {
          "headline":"Review the temperature.",
          "description":"If the temperature was too hot, this will have brought about hardening."
        }
      ]
    },
    {
      "name":"Incredible spreadables",
      "steps":[
        {
          "headline":"Review your mixing method.",
          "description":"If butter and sugar are over-creamed, this can cause spreading during baking."
        },
        {
          "headline":"Check the ingredients.",
          "description":"Lack of adequate dry ingredients can cause spread because the mixture is too soft to begin with."
        },
        {
          "headline":"Review the raising (rising) agent used.",
          "description":"If you have overdone the raising agent, this can cause the biscuits or cookies to rise too quickly, with the result of fast spread before enough time has occurred to set them by baking. Always err on the side of less when it comes to raising agents in biscuits and cookies."
        }
      ]
    },
    {
      "name":"Browned or burnt bases",
      "steps":[
        {
          "headline":"Check the baking tray or sheet.",
          "description":"If it is too thin, it will easily burn the biscuits or cookies."
        },
        {
          "headline":"Review the positioning of the baking tray or sheet.",
          "description":"If it baked on the base of the oven, it's more likely to overcook. Also, if the tray or sheet was not rotated during cooking, some biscuits or cookies may be overdone on one side of the tray."
        },
        {
          "headline":"Review the length of baking.",
          "description":"If you left them in too long, obviously they were overdone!"
        },
        {
          "headline":"Review the temperature.",
          "description":"If the temperature is too hot, the biscuits or cookies will burn."
        }
      ]
    }
  ],
  "text":" Too soft Consider the cooking time. If not cooked long enough, the biscuits or cookies can remain too soft. Check the baking tray or sheet. The baking tray or sheet is important when baking biscuits or cookies. Too slim a base, and they can burn; sides that are too high, and the biscuits or cookies can cook unevenly, leaving some of them too soft. Review your storage methods. If the biscuits or cookies came out fine but have gone soft since, some of the following might be the cause:\nThe biscuits or cookies were not allowed to cool on the tray/sheet. Resist moving them too quickly from the tray/sheet - a little of the cooking time continues the tray/sheet. Simply loosen them, leave on the tray/sheet to cool for a short time, then move to the wire cooling rack to cool completely. The biscuits or cookies were placed in their storage container before they had fully cooled down. Warmth brings moisture with it and if you transfer biscuits or cookies that are even only slightly warm to an airtight container, you effectively trap the moisture in, creating a perfect softening environment. Wait until the biscuits or cookies are cold before storing. The storage container is not airtight. Any air getting into a container will cause biscuits and cookies to soften. Replace with an airtight container. Too hard Review your measurements. Inaccurate measurement that results in the addition of too much of the dry ingredients can result in overly hardened baked goods. Check the time allowed for baking. Anything left in the oven too long will overcook and harden, biscuits and cookies included. Review the temperature. If the temperature was too hot, this will have brought about hardening. Incredible spreadables Review your mixing method. If butter and sugar are over-creamed, this can cause spreading during baking. Check the ingredients. Lack of adequate dry ingredients can cause spread because the mixture is too soft to begin with. Review the raising (rising) agent used. If you have overdone the raising agent, this can cause the biscuits or cookies to rise too quickly, with the result of fast spread before enough time has occurred to set them by baking. Always err on the side of less when it comes to raising agents in biscuits and cookies. Browned or burnt bases Check the baking tray or sheet. If it is too thin, it will easily burn the biscuits or cookies. Review the positioning of the baking tray or sheet. If it baked on the base of the oven, it's more likely to overcook. Also, if the tray or sheet was not rotated during cooking, some biscuits or cookies may be overdone on one side of the tray. Review the length of baking. If you left them in too long, obviously they were overdone! Review the temperature. If the temperature is too hot, the biscuits or cookies will burn.",
  "tyn_model":[
    "biscuits",
    "tray",
    "baking tray",
    "airtight container",
    "oven",
    "butter",
    "sugar"
  ],
  "tyn_section":[

  ]
}