{
  "title":"How to Buy Robux",
  "url":"https://www.wikihow.com/Buy-Robux",
  "category_hierarchy":[
    "Hobbies and Crafts",
    "Games",
    "Video Games",
    "PC Games",
    "Online Games",
    "Roblox"
  ],
  "methods":[
    {
      "name":"Using a Computer",
      "steps":[
        {
          "headline":"Go to https://www.roblox.com/upgrades/robux in a web browser.",
          "description":"If you're not already signed in, click Log In at the top-right corner of the page to sign in now. If you don't have a credit or debit card, you can use cash at any store that sells Roblox or Rixty cards. See Roblox's card page (https://www.roblox.com/gamecards) to see where Roblox cards are available near you, or Rixty's location finder (https://www.rixty.com/wheretobuy) to find the nearest place to get a Rixty card."
        },
        {
          "headline":"Click the price next to the amount of Robux you want to buy.",
          "description":"This brings you to a list of payment methods."
        },
        {
          "headline":"Select a payment method and click Continue.",
          "description":""
        },
        {
          "headline":"Enter your payment details.",
          "description":"If you chose to pay with a credit or debit card, enter the details from the card. If you're using a Roblox or Rixty card, enter the PIN from the card and click Redeem. If you selected PayPal, follow the on-screen instructions to sign into your PayPal account and complete your payment. If you're paying with a credit or debit card, you'll also have to enter your email address."
        },
        {
          "headline":"Click Pay now or Submit Order.",
          "description":"It's the green button below your payment info. Once your payment is processed, your Robux will be added to your account in the game."
        }
      ]
    },
    {
      "name":"Using a Phone or Tablet",
      "steps":[
        {
          "headline":"Open Roblox on your Android, iPhone, or iPad.",
          "description":"It's the icon with two Roblox characters that says \"ROBLOX\" inside. You'll usually find it on the home screen or in the app drawer."
        },
        {
          "headline":"Tap the R$ icon.",
          "description":"It's near the top-right corner. Your current balance appears at the top."
        },
        {
          "headline":"Tap the amount of Robux you want to buy.",
          "description":"The price for each package appears next to the amount of Robux you're buying. The pop-up will appear, asking you to confirm your purchase. If you want to cancel the purchase, tap Cancel (iPhone/iPad) or the back button (Android)."
        },
        {
          "headline":"Follow the on-screen instructions to pay for your Robux.",
          "description":"If you're using an Android, you'll be billed by your Google Play account. If you're using an iPhone or iPad, you will be billed by the App Store. Once you confirm, your Robux will be added to your balance."
        }
      ]
    }
  ],
  "text":" Using a Computer Go to https://www.roblox.com/upgrades/robux in a web browser. If you're not already signed in, click Log In at the top-right corner of the page to sign in now. If you don't have a credit or debit card, you can use cash at any store that sells Roblox or Rixty cards. See Roblox's card page (https://www.roblox.com/gamecards) to see where Roblox cards are available near you, or Rixty's location finder (https://www.rixty.com/wheretobuy) to find the nearest place to get a Rixty card. Click the price next to the amount of Robux you want to buy. This brings you to a list of payment methods. Select a payment method and click Continue.  Enter your payment details. If you chose to pay with a credit or debit card, enter the details from the card. If you're using a Roblox or Rixty card, enter the PIN from the card and click Redeem. If you selected PayPal, follow the on-screen instructions to sign into your PayPal account and complete your payment. If you're paying with a credit or debit card, you'll also have to enter your email address. Click Pay now or Submit Order. It's the green button below your payment info. Once your payment is processed, your Robux will be added to your account in the game. Using a Phone or Tablet Open Roblox on your Android, iPhone, or iPad. It's the icon with two Roblox characters that says \"ROBLOX\" inside. You'll usually find it on the home screen or in the app drawer. Tap the R$ icon. It's near the top-right corner. Your current balance appears at the top. Tap the amount of Robux you want to buy. The price for each package appears next to the amount of Robux you're buying. The pop-up will appear, asking you to confirm your purchase. If you want to cancel the purchase, tap Cancel (iPhone/iPad) or the back button (Android). Follow the on-screen instructions to pay for your Robux. If you're using an Android, you'll be billed by your Google Play account. If you're using an iPhone or iPad, you will be billed by the App Store. Once you confirm, your Robux will be added to your balance.",
  "tyn_model":[
    "robux",
    "paypal",
    "computer",
    "roblox or rixty",
    "roblox"
  ],
  "tyn_section":[

  ]
}