{
  "title":"How to Cook Pizza on a Pizza Stone",
  "url":"https://www.wikihow.com/Cook-Pizza-on-a-Pizza-Stone",
  "category_hierarchy":[
    "Food and Entertaining",
    "Recipes",
    "Sandwiches and Quick Meals",
    "Pizza"
  ],
  "parts":[
    {
      "name":"Making Your Dough",
      "steps":[
        {
          "headline":"Get your ingredients.",
          "description":"Of course, you can skip this entire part and buy pre-made pizza dough at the store. But if you\u2019re looking for the full pizza stone experience, this recipe makes a great Brooklyn Style pizza dough. This recipe makes two pizzas. If you only want one, place half the dough in the freezer when you place the other half in the refrigerator. 1 tsp. active dry yeast\n1/4 cup cold water\n1 cup cold water\n1 tsp. salt\n3 cups bread flour\n3 tsp. extra virgin olive oil"
        },
        {
          "headline":"Sprinkle yeast over warm water in a large bowl.",
          "description":"Let it sit for 5-8 minutes. This will create a bubbling action, or proof, which test the effectiveness of the yeast."
        },
        {
          "headline":"Stir in the salt and cold water.",
          "description":"Once you\u2019ve allowed your mixture to proof, mix in the salt and cold water. Follow this with the flour. Stir flour in 1 cup at a time until your dough is together enough to remove from the bowl."
        },
        {
          "headline":"Knead dough.",
          "description":"On a floured surface, knead your dough until it is smooth. It will take 10-15 minutes. Once you\u2019ve gotten the desired smoothness, divide your dough into two even pieces and form each one into a tight ball. Coat each ball with extra virgin olive oil by brushing it evenly over them."
        },
        {
          "headline":"Let the dough rise.",
          "description":"Place your dough balls in sealed containers with enough room for the dough to rise. They shouldn\u2019t take up more than half of the bowl. Let them sit in the refrigerator for at least 16 hours and then remove them an hour before you\u2019re ready to use them."
        }
      ]
    },
    {
      "name":"Topping and Cooking Your Pizza",
      "steps":[
        {
          "headline":"Preheat your oven.",
          "description":"With the pizza stone on the bottom rack of your oven, preheat it to 550 degrees."
        },
        {
          "headline":"Dust your dough with flour.",
          "description":"Using one ball of at a time, lightly dust your dough with flour. Stretch gradually on a flat, floured surface until it is about as big as your pizza stone (typically about 14\u201d). A cutting board, a flat baking sheet, or a peel will work for your surface. A peel is a wide flat tool for your pizza. The front edge is typically tapered so that your pizza can slide easily on and off of it."
        },
        {
          "headline":"Top your pizza.",
          "description":"Once your dough is stretched to the desired size, spread your sauce and add your cheese. Top with the vegetables, meats, and seasonings of your choice."
        },
        {
          "headline":"Place your pizza on the stone.",
          "description":"This will be much easier if you\u2019ve properly floured your flat surface. Place the tip of your flat surface on the back of the preheated stone and slide your surface out of the oven so that your pizza is left on the stone. If your pizza seems to stick, try using a back and forth jerking motion to help it."
        },
        {
          "headline":"Bake your pizza.",
          "description":"Your pizza will only have to bake for 4-6 minutes in the oven. Watch it carefully and remove it when the crust begin to brown. Remove the pizza by again sliding your flat surface beneath the pizza."
        },
        {
          "headline":"Cut and enjoy.",
          "description":"Be careful, the pizza will be extremely hot. Let it sit for a couple minutes before cutting to avoid burning yourself. You now have a crispy stone oven-style pizza."
        }
      ]
    },
    {
      "name":"Caring for Your Pizza Stone",
      "steps":[
        {
          "headline":"Let the stone cool.",
          "description":"Turn the oven off after you\u2019ve cooked your pizza. Let the stone cool completely before you take it out. This will take hours, so feel free to wait until the morning to clean your stone."
        },
        {
          "headline":"Use a soft brush, soap, and water.",
          "description":"Place the cooled stone in your sink and clean it just as you would any other dish. Brush off any loose bits of food and scrub away anything that has melted to the surface. Don\u2019t let it sit in water for too long because the material is porous and will absorb the water. If this happens, your stone could crack the next time you try to use it."
        },
        {
          "headline":"Dry your stone.",
          "description":"Use a dishtowel to wipe your stone dry and let it sit out on the counter to dry completely. Some staining is completely normal. As long as you scrub off any food, your stone is perfectly fine to re-use again and again."
        },
        {
          "headline":"Finished.",
          "description":""
        }
      ]
    }
  ],
  "text":" Making Your Dough Get your ingredients. Of course, you can skip this entire part and buy pre-made pizza dough at the store. But if you\u2019re looking for the full pizza stone experience, this recipe makes a great Brooklyn Style pizza dough. This recipe makes two pizzas. If you only want one, place half the dough in the freezer when you place the other half in the refrigerator. 1 tsp. active dry yeast\n1/4 cup cold water\n1 cup cold water\n1 tsp. salt\n3 cups bread flour\n3 tsp. extra virgin olive oil Sprinkle yeast over warm water in a large bowl. Let it sit for 5-8 minutes. This will create a bubbling action, or proof, which test the effectiveness of the yeast. Stir in the salt and cold water. Once you\u2019ve allowed your mixture to proof, mix in the salt and cold water. Follow this with the flour. Stir flour in 1 cup at a time until your dough is together enough to remove from the bowl. Knead dough. On a floured surface, knead your dough until it is smooth. It will take 10-15 minutes. Once you\u2019ve gotten the desired smoothness, divide your dough into two even pieces and form each one into a tight ball. Coat each ball with extra virgin olive oil by brushing it evenly over them. Let the dough rise. Place your dough balls in sealed containers with enough room for the dough to rise. They shouldn\u2019t take up more than half of the bowl. Let them sit in the refrigerator for at least 16 hours and then remove them an hour before you\u2019re ready to use them. Topping and Cooking Your Pizza Preheat your oven. With the pizza stone on the bottom rack of your oven, preheat it to 550 degrees. Dust your dough with flour. Using one ball of at a time, lightly dust your dough with flour. Stretch gradually on a flat, floured surface until it is about as big as your pizza stone (typically about 14\u201d). A cutting board, a flat baking sheet, or a peel will work for your surface. A peel is a wide flat tool for your pizza. The front edge is typically tapered so that your pizza can slide easily on and off of it. Top your pizza. Once your dough is stretched to the desired size, spread your sauce and add your cheese. Top with the vegetables, meats, and seasonings of your choice. Place your pizza on the stone. This will be much easier if you\u2019ve properly floured your flat surface. Place the tip of your flat surface on the back of the preheated stone and slide your surface out of the oven so that your pizza is left on the stone. If your pizza seems to stick, try using a back and forth jerking motion to help it. Bake your pizza. Your pizza will only have to bake for 4-6 minutes in the oven. Watch it carefully and remove it when the crust begin to brown. Remove the pizza by again sliding your flat surface beneath the pizza. Cut and enjoy. Be careful, the pizza will be extremely hot. Let it sit for a couple minutes before cutting to avoid burning yourself. You now have a crispy stone oven-style pizza. Caring for Your Pizza Stone Let the stone cool. Turn the oven off after you\u2019ve cooked your pizza. Let the stone cool completely before you take it out. This will take hours, so feel free to wait until the morning to clean your stone. Use a soft brush, soap, and water. Place the cooled stone in your sink and clean it just as you would any other dish. Brush off any loose bits of food and scrub away anything that has melted to the surface. Don\u2019t let it sit in water for too long because the material is porous and will absorb the water. If this happens, your stone could crack the next time you try to use it. Dry your stone. Use a dishtowel to wipe your stone dry and let it sit out on the counter to dry completely. Some staining is completely normal. As long as you scrub off any food, your stone is perfectly fine to re-use again and again. Finished. ",
  "tyn_model":[
    "oven",
    "cold water",
    "water",
    "flour",
    "salt",
    "pizza dough",
    "refrigerator",
    "extra virgin olive oil",
    "bowl",
    "pizza stone",
    "peel",
    "active dry yeast",
    "bread flour",
    "yeast",
    "large bowl",
    "\u201d)",
    "cutting board",
    "baking sheet",
    "cheese",
    "vegetables",
    "seasonings",
    "pizza",
    "soap",
    "dishtowel",
    "food"
  ],
  "tyn_section":[

  ]
}