{
  "title":"How to Dry Wood Fast",
  "url":"https://www.wikihow.com/Dry-Wood-Fast",
  "category_hierarchy":[
    "Hobbies and Crafts",
    "Woodworking",
    "Wood"
  ],
  "methods":[
    {
      "name":"Using a Microwave Oven for Small Wood Pieces",
      "steps":[
        {
          "headline":"Weigh your wood samples using a postal scale.",
          "description":"Electronic postal or pocket scales can be purchased from office suppliers and big-box stores. Set it to measure grams, place your wood onto it, and take note of your wood's weight. If you'd like to keep your scale clean, place a container onto the scale, hit \"Tare,\" and then place the wood in. Use a scale that has an accuracy within 0.1% for the best results. Otherwise, accuracy should be at least within 0.035 ounces (0.99 g)."
        },
        {
          "headline":"Measure the moisture content (MC) with a moisture meter.",
          "description":"For pin-type moisture meters, press the 2 tips into the wood and activate it for the moisture reading. For pinless meters, press the base of its scanning plate against the wood and turn the meter on. Record the moisture content, which will be a percentage between 0 and 100. Purchase moisture meters from home hardware stores and online suppliers."
        },
        {
          "headline":"Microwave 15% to 25% MC wood at the lowest setting for 45 to 60 seconds.",
          "description":"Place 3 to 5 paper towels onto the microwave oven's plate and place your wood on top. Most ovens come with a \"Low\" setting and a \"Defrost\" setting that is slightly higher. Set it to \"Low\" and look out for smoke\u2014this is a sign that you have burnt away some of the wood weight and volume and any moisture measurements will be inaccurate. Never let wood pieces touch if you're heating multiple samples or they can light on fire."
        },
        {
          "headline":"Heat 30% MC or above wood for 1.5 to 3 minutes at the second-lowest heat level.",
          "description":"For most microwaves, the next heat level above \"Low\" is \"Defrost.\" Layer 5 paper towels onto the microwave oven's plate, place your wood on top, and set your microwave to \"Defrost.\" If you don't mind waiting, you can set it to the lowest setting, and wait about 4 minutes instead. If you smell smoke or burning on \"Defrost,\" switch to the \"Low\" heat setting."
        },
        {
          "headline":"Weigh your samples after the first round of heating.",
          "description":"Following the first round of heating, weigh your samples on the scale and record the weights. When drying wood, you will notice each piece loses weight, which is a sign that moisture is leaving. The goal is to continue heating your wood pieces until there is no weight change and each of their moisture contents is stable. Remember that different types of wood dry at different rates. Don't be surprised if some pieces lose moisture slower or faster than others."
        },
        {
          "headline":"Continue heating your wood and weighing it until there are no weight changes.",
          "description":"Heat the wood in intervals of 45 to 60 seconds with a 1-minute rest in between each. For highly accurate scales, you shouldn't be able to detect variation more than 0.1 gram once the drying process is done. For gram scales, stop when you get about 5 or 6 readings that are the same. Moisture meters can also detect moisture content, but the weight method is the most accurate. Calculate the moisture content following the final heating by using the following formula: (Wet Weight \u2013 Oven Dry Weight / Over Dry Weight) x 100."
        }
      ]
    },
    {
      "name":"Using a Conventional Oven for Medium Pieces",
      "steps":[
        {
          "headline":"Preheat your oven to 217 \u00b0F (103 \u00b0C) and monitor its temperature.",
          "description":"After setting the heat, place one kitchen rack on the bottom and another in the center. Now, place a large baking pan on the bottom rack and put an oven thermometer onto the center rack in one of its far corners. If your oven doesn\u2019t let you set the temperature to 217 \u00b0F (103 \u00b0C), set it to the closest increment, such as 215 \u00b0F (102 \u00b0C)."
        },
        {
          "headline":"Adjust your oven settings until it hits 217 \u00b0F (103 \u00b0C).",
          "description":"Monitor your oven thermometer every 10 minutes. If it's too high, lower the temperature, and if it's too low, increase it. Always adjust the temperature by the smallest increments for optimal accuracy. Turn on your kitchen fan if it has one\u2014this will ensure optimal airflow."
        },
        {
          "headline":"Place your wood onto the center rack for 1 hour.",
          "description":"Be sure that none of the pieces are touching. For smaller pieces, lay them perpendicular to each rung of the oven rack to prevent them from falling through. Continue monitoring the oven thermometer every 10 to 15 minutes and adjust temperature accordingly."
        },
        {
          "headline":"Test your wood's moisture content (MC) after 1 hour and reheat for 15 minutes increments as necessary.",
          "description":"After 1 hour has passed, remove 2 to 3 wood pieces of varying sizes from the oven. Measure their moisture content using a moisture meter. Continue heating the pieces for 15-minute intervals until the desired MC or until the moisture levels do not decrease anymore. Purchase moisture meters from home hardware stores and online suppliers."
        }
      ]
    },
    {
      "name":"Speeding up the Drying Process for Large Lumber",
      "steps":[
        {
          "headline":"Process your logs as fast as possible.",
          "description":"If you have just cut down a tree, make the wood into lumber as soon as you can. Processing opens up the wood and helps the drying process, which can prevent stain and rot from affecting the wood."
        },
        {
          "headline":"Store your wood in a shaded location with ample airflow.",
          "description":"Try and find an indoor location like a hayloft or shed or an outdoor location that is in the shade. Avoid locations like garages which likely don't have enough airflow. Never store wood in the basement or inside boxes as they dry, they definitely won't have enough airflow. Remember that your wood needs to dry in an area with a similar moisture content that the finished product will be exposed to. For example, if you plan to use the wood to make a chair that will be placed in a dry area of your home, store it in an area with similarly low moisture content\nPoint an electric household fan toward your wood between your cutting sessions to improve airflow. This circulation will help your wood dry in at least half the time that it normally would."
        },
        {
          "headline":"Seal off the ends of each piece of lumber immediately after cutting to prevent moisture decay.",
          "description":"Exposed ends can lead to drying that is too fast, which paves the way for end-grain cracking and splits. And since moisture escapes wood 10 to 12 times quicker from the ends, leaving them exposed is damaging to the wood. Apply paraffin wax, shellac, polyurethane, or latex paint to the ends in a uniform manner so that both are completely covered. Try to do so as soon as possible\u2014within minutes\u2014for the best results. Purchase specially formulated end grain sealers from woodworking or home hardware stores if you don't mind paying a bit more money."
        },
        {
          "headline":"Stack your lumber uniformly to expose all sides to airflow.",
          "description":"When you're cutting your lumber, cut the pieces to the same lengths and thicknesses. Afterward, these equal dimensions will make it easier to stack them in a manner that exposes each side to air. Use small pieces of \u20444 by \u20442 inch (1.9 cm \u00d7 14.0 cm) wood, also known as stickers, to create space between each side and increase ventilation. Use spacers every 12 inches (30 cm) for thinner pieces and 16 inch (41 cm) or 24 inch (61 cm) spacing for thicker pieces."
        },
        {
          "headline":"Cover the top of your wood with a tarp or plastic sheeting.",
          "description":"Don't cover the entire pile of wood to the ground\u2014this will hold in moisture. By just covering the top, you can ensure that each piece is adequately shaded without trapping moisture. Skip this step if you're storing your wood indoors or somewhere with adequate shade."
        },
        {
          "headline":"Measure the moisture content (MC) of your wood with a moisture meter.",
          "description":"If you're using a pin-type moisture meter, press the 2 tips of the device into your wood. Afterward, turn it on and examine the moisture reading. For pinless meters, press the base of the scanning plane to the wood and activate it. Moisture readings are a percentage between 0 and 100. Buy both types of moisture meters from online suppliers and home hardware stores."
        }
      ]
    }
  ],
  "text":" Using a Microwave Oven for Small Wood Pieces Weigh your wood samples using a postal scale. Electronic postal or pocket scales can be purchased from office suppliers and big-box stores. Set it to measure grams, place your wood onto it, and take note of your wood's weight. If you'd like to keep your scale clean, place a container onto the scale, hit \"Tare,\" and then place the wood in. Use a scale that has an accuracy within 0.1% for the best results. Otherwise, accuracy should be at least within 0.035 ounces (0.99 g). Measure the moisture content (MC) with a moisture meter. For pin-type moisture meters, press the 2 tips into the wood and activate it for the moisture reading. For pinless meters, press the base of its scanning plate against the wood and turn the meter on. Record the moisture content, which will be a percentage between 0 and 100. Purchase moisture meters from home hardware stores and online suppliers. Microwave 15% to 25% MC wood at the lowest setting for 45 to 60 seconds. Place 3 to 5 paper towels onto the microwave oven's plate and place your wood on top. Most ovens come with a \"Low\" setting and a \"Defrost\" setting that is slightly higher. Set it to \"Low\" and look out for smoke\u2014this is a sign that you have burnt away some of the wood weight and volume and any moisture measurements will be inaccurate. Never let wood pieces touch if you're heating multiple samples or they can light on fire. Heat 30% MC or above wood for 1.5 to 3 minutes at the second-lowest heat level. For most microwaves, the next heat level above \"Low\" is \"Defrost.\" Layer 5 paper towels onto the microwave oven's plate, place your wood on top, and set your microwave to \"Defrost.\" If you don't mind waiting, you can set it to the lowest setting, and wait about 4 minutes instead. If you smell smoke or burning on \"Defrost,\" switch to the \"Low\" heat setting. Weigh your samples after the first round of heating. Following the first round of heating, weigh your samples on the scale and record the weights. When drying wood, you will notice each piece loses weight, which is a sign that moisture is leaving. The goal is to continue heating your wood pieces until there is no weight change and each of their moisture contents is stable. Remember that different types of wood dry at different rates. Don't be surprised if some pieces lose moisture slower or faster than others. Continue heating your wood and weighing it until there are no weight changes. Heat the wood in intervals of 45 to 60 seconds with a 1-minute rest in between each. For highly accurate scales, you shouldn't be able to detect variation more than 0.1 gram once the drying process is done. For gram scales, stop when you get about 5 or 6 readings that are the same. Moisture meters can also detect moisture content, but the weight method is the most accurate. Calculate the moisture content following the final heating by using the following formula: (Wet Weight \u2013 Oven Dry Weight / Over Dry Weight) x 100. Using a Conventional Oven for Medium Pieces Preheat your oven to 217 \u00b0F (103 \u00b0C) and monitor its temperature. After setting the heat, place one kitchen rack on the bottom and another in the center. Now, place a large baking pan on the bottom rack and put an oven thermometer onto the center rack in one of its far corners. If your oven doesn\u2019t let you set the temperature to 217 \u00b0F (103 \u00b0C), set it to the closest increment, such as 215 \u00b0F (102 \u00b0C). Adjust your oven settings until it hits 217 \u00b0F (103 \u00b0C). Monitor your oven thermometer every 10 minutes. If it's too high, lower the temperature, and if it's too low, increase it. Always adjust the temperature by the smallest increments for optimal accuracy. Turn on your kitchen fan if it has one\u2014this will ensure optimal airflow. Place your wood onto the center rack for 1 hour. Be sure that none of the pieces are touching. For smaller pieces, lay them perpendicular to each rung of the oven rack to prevent them from falling through. Continue monitoring the oven thermometer every 10 to 15 minutes and adjust temperature accordingly. Test your wood's moisture content (MC) after 1 hour and reheat for 15 minutes increments as necessary. After 1 hour has passed, remove 2 to 3 wood pieces of varying sizes from the oven. Measure their moisture content using a moisture meter. Continue heating the pieces for 15-minute intervals until the desired MC or until the moisture levels do not decrease anymore. Purchase moisture meters from home hardware stores and online suppliers. Speeding up the Drying Process for Large Lumber Process your logs as fast as possible. If you have just cut down a tree, make the wood into lumber as soon as you can. Processing opens up the wood and helps the drying process, which can prevent stain and rot from affecting the wood. Store your wood in a shaded location with ample airflow. Try and find an indoor location like a hayloft or shed or an outdoor location that is in the shade. Avoid locations like garages which likely don't have enough airflow. Never store wood in the basement or inside boxes as they dry, they definitely won't have enough airflow. Remember that your wood needs to dry in an area with a similar moisture content that the finished product will be exposed to. For example, if you plan to use the wood to make a chair that will be placed in a dry area of your home, store it in an area with similarly low moisture content\nPoint an electric household fan toward your wood between your cutting sessions to improve airflow. This circulation will help your wood dry in at least half the time that it normally would. Seal off the ends of each piece of lumber immediately after cutting to prevent moisture decay. Exposed ends can lead to drying that is too fast, which paves the way for end-grain cracking and splits. And since moisture escapes wood 10 to 12 times quicker from the ends, leaving them exposed is damaging to the wood. Apply paraffin wax, shellac, polyurethane, or latex paint to the ends in a uniform manner so that both are completely covered. Try to do so as soon as possible\u2014within minutes\u2014for the best results. Purchase specially formulated end grain sealers from woodworking or home hardware stores if you don't mind paying a bit more money. Stack your lumber uniformly to expose all sides to airflow. When you're cutting your lumber, cut the pieces to the same lengths and thicknesses. Afterward, these equal dimensions will make it easier to stack them in a manner that exposes each side to air. Use small pieces of \u20444 by \u20442 inch (1.9 cm \u00d7 14.0 cm) wood, also known as stickers, to create space between each side and increase ventilation. Use spacers every 12 inches (30 cm) for thinner pieces and 16 inch (41 cm) or 24 inch (61 cm) spacing for thicker pieces. Cover the top of your wood with a tarp or plastic sheeting. Don't cover the entire pile of wood to the ground\u2014this will hold in moisture. By just covering the top, you can ensure that each piece is adequately shaded without trapping moisture. Skip this step if you're storing your wood indoors or somewhere with adequate shade. Measure the moisture content (MC) of your wood with a moisture meter. If you're using a pin-type moisture meter, press the 2 tips of the device into your wood. Afterward, turn it on and examine the moisture reading. For pinless meters, press the base of the scanning plane to the wood and activate it. Moisture readings are a percentage between 0 and 100. Buy both types of moisture meters from online suppliers and home hardware stores.",
  "tyn_model":[
    "oven",
    "moisture meter",
    "moisture meters",
    "lumber",
    "microwave oven",
    "scales",
    "scale",
    "\u2014this",
    "oven thermometer",
    "paper towels",
    "wood",
    "container",
    "microwaves",
    "microwave",
    "\u2013 oven",
    "baking pan",
    "logs",
    "electric household fan",
    "paraffin wax",
    "latex paint",
    "\u2014within",
    "\u2014for",
    "end grain sealers",
    "\u00d7 14.0",
    "stickers",
    "tarp",
    "plastic sheeting"
  ],
  "tyn_section":[

  ]
}