{
  "title":"How to Complete a Mortal Kombat Finisher",
  "url":"https://www.wikihow.com/Complete-a-Mortal-Kombat-Finisher",
  "category_hierarchy":[
    "Hobbies and Crafts",
    "Games",
    "Video Games",
    "Multi Platform Games",
    "Mortal Kombat"
  ],
  "methods":[
    {
      "name":"Fatalities or Heroic Brutality",
      "steps":[
        {
          "headline":"Pick your character, game, and learn their fatalities.",
          "description":"They are many fatality lists on the internet, make sure you include which game it is and your character. Also, remember that MK 1,2, and 3 have easier to do fatalities. Also, Heroic brutalities can only be done in Mortal Kombat vs DC universe by the DC characters."
        },
        {
          "headline":"Work your way up.",
          "description":"start with simple combos, then go into special moves, then into the large combos, then once you defeat the opponent try."
        },
        {
          "headline":"Keep trying 'til you do it.",
          "description":"Play arcade and keep trying it when you defeat them, and the announcer says \"finish him/her\"."
        },
        {
          "headline":"Other ways.",
          "description":"In chess combat on MK: Deception you perform a fatality once you defeat the leader automatically with any character or class."
        }
      ]
    },
    {
      "name":"Hara-Kiri",
      "steps":[
        {
          "headline":"Remember  this can only be done on Mortal Kombat Deception.",
          "description":"Also pick your character and find out their combination to do the finisher."
        },
        {
          "headline":"Learn how to time it.",
          "description":"Once you've been defeated and the announcer says \"finish him/her\" try to press 5 random things before your opponent can finish you. It doesn't have to a hara-kiri, but you may get lucky and improve your timing attempting it."
        },
        {
          "headline":"Find the right opponent.",
          "description":"You need somebody that won't finish you off as soon as they can. Have a friend help or use the first couple of arcade computer opponents. Remember you have to be defeated to attempt this."
        },
        {
          "headline":"Do it.",
          "description":"Perform the hara-kiri and keep doing it until you get it right, this is the only way to get it right."
        },
        {
          "headline":"Other ways: Keep playing against the computer and if you get lucky they might do it.",
          "description":""
        }
      ]
    },
    {
      "name":"Brutality",
      "steps":[
        {
          "headline":"Realize a few things.",
          "description":"A brutality is different from a heroic brutality. Also, it is a very hard to accomplish, it's a 11 button combo!, and isn't that satisfying. Find out if a brutality is even attempt able on one of your MK games. Try to be able to do a fatality or a hara-kiri before even trying this or else the chances of failure outweigh you. After reading over this continue."
        },
        {
          "headline":"Work your way up.",
          "description":"start with simple combos, then go into special moves, then into the large combos, and try to complete every large combo your character has."
        },
        {
          "headline":"Split it up.",
          "description":"practice it in parts, and try to add another button as you get better."
        },
        {
          "headline":"Try it.",
          "description":"Keep doing it, until you get it!"
        }
      ]
    }
  ],
  "text":" Fatalities or Heroic Brutality Pick your character, game, and learn their fatalities. They are many fatality lists on the internet, make sure you include which game it is and your character. Also, remember that MK 1,2, and 3 have easier to do fatalities. Also, Heroic brutalities can only be done in Mortal Kombat vs DC universe by the DC characters. Work your way up. start with simple combos, then go into special moves, then into the large combos, then once you defeat the opponent try. Keep trying 'til you do it. Play arcade and keep trying it when you defeat them, and the announcer says \"finish him/her\". Other ways. In chess combat on MK: Deception you perform a fatality once you defeat the leader automatically with any character or class. Hara-Kiri Remember  this can only be done on Mortal Kombat Deception. Also pick your character and find out their combination to do the finisher. Learn how to time it. Once you've been defeated and the announcer says \"finish him/her\" try to press 5 random things before your opponent can finish you. It doesn't have to a hara-kiri, but you may get lucky and improve your timing attempting it. Find the right opponent. You need somebody that won't finish you off as soon as they can. Have a friend help or use the first couple of arcade computer opponents. Remember you have to be defeated to attempt this. Do it. Perform the hara-kiri and keep doing it until you get it right, this is the only way to get it right. Other ways: Keep playing against the computer and if you get lucky they might do it.  Brutality Realize a few things. A brutality is different from a heroic brutality. Also, it is a very hard to accomplish, it's a 11 button combo!, and isn't that satisfying. Find out if a brutality is even attempt able on one of your MK games. Try to be able to do a fatality or a hara-kiri before even trying this or else the chances of failure outweigh you. After reading over this continue. Work your way up. start with simple combos, then go into special moves, then into the large combos, and try to complete every large combo your character has. Split it up. practice it in parts, and try to add another button as you get better. Try it. Keep doing it, until you get it!",
  "tyn_model":[
    "brutality",
    "mortal kombat vs dc universe",
    "chess",
    "mortal kombat deception",
    "arcade computer"
  ],
  "tyn_section":[

  ]
}