{
  "title":"How to Remove a Coffee Stain from Carpet",
  "url":"https://www.wikihow.com/Remove-a-Coffee-Stain-from-Carpet",
  "category_hierarchy":[
    "Food and Entertaining",
    "Drinks",
    "Coffee"
  ],
  "parts":[
    {
      "name":"Choosing a Cleaning Solution",
      "steps":[
        {
          "headline":"Try lemon juice.",
          "description":"Add two cups (473 mL) lukewarm water and \u00bc cup (59 mL) of lemon juice to a bucket or bowl. Swirl or agitate to solution to mix it fully. Fresh squeezed lemon juice is best."
        },
        {
          "headline":"Mix vinegar and dish soap.",
          "description":"Add one tablespoon (14.8 mL) of dish soap, one tablespoon (14.8 mL) of white vinegar, and two cups (473 mL) warm water to a bucket. Agitate the solution to ensure it is fully mixed. EXPERT TIP\t\t\t\t\t\t\t\t\t\t\t\t\t\t\t\t\t\t\t\t\t\t\t\t\t\t\t\t\t\t\tBridgett Price\t\t\t\t\t\t\t\t\t\t\t\t\t\t\t\tCleaning Guru & Co-Owner, Maid Easy\t\t\t\t\t\t\t\tBridgett Price is a Cleaning Guru and Co-Owner of Maideasy, a maid service company that services the Phoeniz, Arizona metropolitan area. She holds a Master of Management from the University of Phoenix, specializing in digital and traditional marketing. Bridgett Price\t\t\tCleaning Guru & Co-Owner, Maid Easy\t\t\t\tDish soap and water may be effective at removing minor stains, as well. Bridgett Price of Maid Easy says: \"Try mixing a splash of liquid dish detergent into a cup of warm water. Then, get a towel or a white cloth and blot the area until the stain lifts. Don't rub, because that will rub the stain into the carpet fabrics. If the stain is really stubborn, add a little vinegar to the mixture to help remove it.\""
        },
        {
          "headline":"Use club soda.",
          "description":"Be sure to choose a club soda without any additional flavoring or color. You can pour a small amount of club soda directly on the stain, or transfer the club soda to a spray bottle and spritz it on the stain."
        }
      ]
    },
    {
      "name":"Applying the Solution",
      "steps":[
        {
          "headline":"Remove excess moisture first.",
          "description":"Apply paper towels to the stain to absorb as much of the coffee as possible. Don\u2019t rub the stain, or it may spread. Gently press the paper towels into the carpet to soak up the coffee. You can also use a clean, absorbent towel if you wish."
        },
        {
          "headline":"Test the solution on an inconspicuous area.",
          "description":"To be sure the cleaning solution won\u2019t fade the color of your carpet, test a small amount of the solution on a small area. Apply the solution and wait 20 minutes. Check the spot for color changes. If there is a negative reaction, try a different cleaning solution."
        },
        {
          "headline":"Apply the solution to your carpet.",
          "description":"Use a clean towel dipped in the cleaning solution. Press the towel onto the stained area. Frequently change the area of towel you are using, or get a clean towel, to ensure you aren\u2019t further dirtying the carpet. Be sure to get the entire stain, including the edges and any errant drops."
        },
        {
          "headline":"Blot the wet area.",
          "description":"Gently press down on the carpet with a clean, dry towel. Use the towel to remove the stain and any excess moisture from your carpet. Use a clean portion of the towel each time."
        }
      ]
    },
    {
      "name":"Rinsing and Drying Your Carpet",
      "steps":[
        {
          "headline":"Flush the area with water.",
          "description":"This removes the cleaning solution from your carpet as well as ensures all the coffee is removed. Pour water directly onto the area, or dip a clean towel in water and apply it to your carpet. You could also spray the area using a spray bottle filled with water."
        },
        {
          "headline":"Remove excess moisture.",
          "description":"Blot the entire area to remove as much water as possible. Use a clean towel to press down on your carpet and soak up the moisture. Be sure to frequently change the towel for maximum absorbency."
        },
        {
          "headline":"Allow the carpet to dry.",
          "description":"Place a clean towel over the wet area. Cover the towel with a plastic bag and place a heavy item on top. You can use a heavy pan, paper weight, or other item. Leave the weight on for several hours to allow the towel to soak up the moisture. Remove the weight, bag, and towel, then allow the area to fully air dry."
        }
      ]
    }
  ],
  "text":" Choosing a Cleaning Solution Try lemon juice. Add two cups (473 mL) lukewarm water and \u00bc cup (59 mL) of lemon juice to a bucket or bowl. Swirl or agitate to solution to mix it fully. Fresh squeezed lemon juice is best. Mix vinegar and dish soap. Add one tablespoon (14.8 mL) of dish soap, one tablespoon (14.8 mL) of white vinegar, and two cups (473 mL) warm water to a bucket. Agitate the solution to ensure it is fully mixed. EXPERT TIP\t\t\t\t\t\t\t\t\t\t\t\t\t\t\t\t\t\t\t\t\t\t\t\t\t\t\t\t\t\t\tBridgett Price\t\t\t\t\t\t\t\t\t\t\t\t\t\t\t\tCleaning Guru & Co-Owner, Maid Easy\t\t\t\t\t\t\t\tBridgett Price is a Cleaning Guru and Co-Owner of Maideasy, a maid service company that services the Phoeniz, Arizona metropolitan area. She holds a Master of Management from the University of Phoenix, specializing in digital and traditional marketing. Bridgett Price\t\t\tCleaning Guru & Co-Owner, Maid Easy\t\t\t\tDish soap and water may be effective at removing minor stains, as well. Bridgett Price of Maid Easy says: \"Try mixing a splash of liquid dish detergent into a cup of warm water. Then, get a towel or a white cloth and blot the area until the stain lifts. Don't rub, because that will rub the stain into the carpet fabrics. If the stain is really stubborn, add a little vinegar to the mixture to help remove it.\" Use club soda. Be sure to choose a club soda without any additional flavoring or color. You can pour a small amount of club soda directly on the stain, or transfer the club soda to a spray bottle and spritz it on the stain. Applying the Solution Remove excess moisture first. Apply paper towels to the stain to absorb as much of the coffee as possible. Don\u2019t rub the stain, or it may spread. Gently press the paper towels into the carpet to soak up the coffee. You can also use a clean, absorbent towel if you wish. Test the solution on an inconspicuous area. To be sure the cleaning solution won\u2019t fade the color of your carpet, test a small amount of the solution on a small area. Apply the solution and wait 20 minutes. Check the spot for color changes. If there is a negative reaction, try a different cleaning solution. Apply the solution to your carpet. Use a clean towel dipped in the cleaning solution. Press the towel onto the stained area. Frequently change the area of towel you are using, or get a clean towel, to ensure you aren\u2019t further dirtying the carpet. Be sure to get the entire stain, including the edges and any errant drops. Blot the wet area. Gently press down on the carpet with a clean, dry towel. Use the towel to remove the stain and any excess moisture from your carpet. Use a clean portion of the towel each time. Rinsing and Drying Your Carpet Flush the area with water. This removes the cleaning solution from your carpet as well as ensures all the coffee is removed. Pour water directly onto the area, or dip a clean towel in water and apply it to your carpet. You could also spray the area using a spray bottle filled with water. Remove excess moisture. Blot the entire area to remove as much water as possible. Use a clean towel to press down on your carpet and soak up the moisture. Be sure to frequently change the towel for maximum absorbency. Allow the carpet to dry. Place a clean towel over the wet area. Cover the towel with a plastic bag and place a heavy item on top. You can use a heavy pan, paper weight, or other item. Leave the weight on for several hours to allow the towel to soak up the moisture. Remove the weight, bag, and towel, then allow the area to fully air dry.",
  "tyn_model":[
    "towel",
    "water",
    "club soda",
    "lemon juice",
    "dish soap",
    "vinegar",
    "cleaning guru",
    "paper towels",
    "lukewarm water",
    "bowl",
    "white vinegar",
    "warm water",
    "bucket",
    "maideasy, a maid service company",
    "maid easy",
    "liquid dish detergent",
    "spray bottle",
    "cleaning solution",
    "bag"
  ],
  "tyn_section":[

  ]
}