{
  "title":"How to Use Green Onions",
  "url":"https://www.wikihow.com/Use-Green-Onions",
  "category_hierarchy":[
    "Food and Entertaining",
    "Recipes",
    "Fruits and Vegetables",
    "Onions"
  ],
  "methods":[
    {
      "name":"Chopping Green Onions",
      "steps":[
        {
          "headline":"Rinse the green onions under cool water.",
          "description":"Remove any wilted or damaged green ends. Peel off any slimy skin from the white bases."
        },
        {
          "headline":"Trim off the stringy roots from the bottom of the white base and discard.",
          "description":"Lay several onions on the cutting board with the white bases facing the same way. Slice about \u20448 inch (0.32 cm) to \u20444 inch (0.64 cm) above the roots with a sharp knife. Throw away the roots. Don\u2019t cut off the entire white base. The white part of the green onion is also edible."
        },
        {
          "headline":"Trim the green tops, taking off about 2 inches (5.1 cm).",
          "description":"Lay a handful of green onions on a cutting board with the green tops all facing one direction. Slice off the ends of the green tops. Throw away the parts you\u2019ve trimmed off."
        },
        {
          "headline":"Cut the green onions crosswise into \u20442 in (1.3 cm) to 1 in (2.5 cm) slices.",
          "description":"Lay the trimmed green onions on a cutting board. Using a rocking motion, cut them crosswise with a knife, going all the way from the white base up the trimmed stalk. To finely mince the green onions, go over them again, slicing with the same rocking motion. Continue back and forth until you have the right size pieces."
        },
        {
          "headline":"Store your green onions in plastic for up to 5 days in the refrigerator.",
          "description":"Wrap the green onions in plastic or put them in a plastic bag. Keep them in the crisper drawer of your refrigerator for up to five days. You can typically tell that a green onion has gone bad if it turns soft or changes color. It may also start to smell. Throw away any onions that look or smell bad."
        }
      ]
    },
    {
      "name":"Using Raw Green Onions",
      "steps":[
        {
          "headline":"Garnish with green onions to add color and flavor to your favorite dishes.",
          "description":"Use thinly sliced green onions to add the finishing touch to foods like meats, soups, dips, or deviled eggs."
        },
        {
          "headline":"Toss raw green onions into salad for an extra crunch.",
          "description":"Chop green onions and add them to a salad. They will add a mild onion flavor and a satisfying crunch. If you want to have a hint of onion flavor without the crunchy texture, be sure to very finely mince the onions before adding them to the salad. The white bases of the green onion have a more powerful onion flavor, so you may want to omit them from your salad and just add the milder green parts."
        },
        {
          "headline":"Enhance an egg or tuna salad sandwich with green onions.",
          "description":"Mix chopped green onions into the tuna or egg salad after you have combined all the other ingredients. Tuck the tuna or egg salad between two slices of bread and enjoy. Wrap the tuna or egg salad in a large leaf of lettuce or serve over a salad for a low carb version."
        },
        {
          "headline":"Serve long green onion slices as part of a raw vegetable tray.",
          "description":"If you are putting together a vegetable appetizer tray, consider adding green onions to the array of raw veggies. To do this, slice off enough of the green stems to leave about a 3 in (7.6 cm) to 4 in (10 cm) piece. Green onions work great on a vegetable tray with carrots, celery, tomatoes, and a cheesy dip."
        },
        {
          "headline":"Wrap a green onion in cream cheese and deli meat for a fun appetizer.",
          "description":"To do this, take ten trimmed green onions and scoop a teaspoon of cream cheese onto the ends, covering the white bases. Place each cream cheese covered end on top of a slice of deli meat. Fold the bottom part of the meat onto the bottom of the base, then roll the rest of the meat around the onion. If you don\u2019t plan to serve your meat-wrapped green onions right away, refrigerate them until you are ready."
        },
        {
          "headline":"Substitute green onions for chives in your recipe.",
          "description":"If you have a recipe that calls for snipped fresh chives, you can use green onions instead. Be sure to finely mince them."
        }
      ]
    },
    {
      "name":"Cooking with Green Onions",
      "steps":[
        {
          "headline":"Cook green onions in meat or vegetable stir-fry.",
          "description":"Put 1 inch (2.5 cm) slices of green onions into your stir fry dish. Add them about 1 or 2 minutes before the dish is done, since green onions cook very quickly."
        },
        {
          "headline":"Use green onions to add flavor and texture to scrambled eggs.",
          "description":"Just before you add the eggs to the pan to make scrambled eggs, add in a handful of chopped green onions to the egg mixture. Make sure they are thinly sliced. If you are making an omelette, add larger pieces of green onions, about \u20442 in (1.3 cm) long, on one side of the pan before you fold the omelette in half. If you want to have your green onions a little softer, saute them with vegetable oil over medium-high heat for about 2-3 minutes before adding them to the eggs."
        },
        {
          "headline":"Grill green onions as a side dish.",
          "description":"Green onions make a great side dish served with meat or fish. To make them, simply sprinkle trimmed green onions with salt and pepper. Grill over medium-high heat for 4-5 minutes on each side. Don\u2019t worry if you end up with some extra crispy or charred bits when you grill the onions. You can always crumble or chop those parts into small pieces and add to salsas, dips, or salads to give them a smokey flavor. If you don\u2019t want to eat them on their own, try mincing the grilled green onions and adding them to cream cheese for a savory and flavorful dip."
        },
        {
          "headline":"Add subtle onion flavor to baked goods.",
          "description":"You can always mix in chopped green onions to your dough before putting it in the oven. Try it with pizza dough, cornbread, or biscuits. It works best with savory dishes. Try adding chopped green onions to your Thanksgiving stuffing before putting it in the oven."
        },
        {
          "headline":"Dry green onions and turn them into onion powder.",
          "description":"Grill your green onions or char them directly on the burners of a gas stove. Let them dry overnight in the oven at the lowest temperature. Then, grind them into a fine powder in the food processor. Use the onion powder for spice rubs, marinades, or onion dip."
        }
      ]
    }
  ],
  "text":" Chopping Green Onions Rinse the green onions under cool water. Remove any wilted or damaged green ends. Peel off any slimy skin from the white bases. Trim off the stringy roots from the bottom of the white base and discard. Lay several onions on the cutting board with the white bases facing the same way. Slice about \u20448 inch (0.32 cm) to \u20444 inch (0.64 cm) above the roots with a sharp knife. Throw away the roots. Don\u2019t cut off the entire white base. The white part of the green onion is also edible. Trim the green tops, taking off about 2 inches (5.1 cm). Lay a handful of green onions on a cutting board with the green tops all facing one direction. Slice off the ends of the green tops. Throw away the parts you\u2019ve trimmed off. Cut the green onions crosswise into \u20442 in (1.3 cm) to 1 in (2.5 cm) slices. Lay the trimmed green onions on a cutting board. Using a rocking motion, cut them crosswise with a knife, going all the way from the white base up the trimmed stalk. To finely mince the green onions, go over them again, slicing with the same rocking motion. Continue back and forth until you have the right size pieces. Store your green onions in plastic for up to 5 days in the refrigerator. Wrap the green onions in plastic or put them in a plastic bag. Keep them in the crisper drawer of your refrigerator for up to five days. You can typically tell that a green onion has gone bad if it turns soft or changes color. It may also start to smell. Throw away any onions that look or smell bad. Using Raw Green Onions Garnish with green onions to add color and flavor to your favorite dishes. Use thinly sliced green onions to add the finishing touch to foods like meats, soups, dips, or deviled eggs. Toss raw green onions into salad for an extra crunch. Chop green onions and add them to a salad. They will add a mild onion flavor and a satisfying crunch. If you want to have a hint of onion flavor without the crunchy texture, be sure to very finely mince the onions before adding them to the salad. The white bases of the green onion have a more powerful onion flavor, so you may want to omit them from your salad and just add the milder green parts. Enhance an egg or tuna salad sandwich with green onions. Mix chopped green onions into the tuna or egg salad after you have combined all the other ingredients. Tuck the tuna or egg salad between two slices of bread and enjoy. Wrap the tuna or egg salad in a large leaf of lettuce or serve over a salad for a low carb version. Serve long green onion slices as part of a raw vegetable tray. If you are putting together a vegetable appetizer tray, consider adding green onions to the array of raw veggies. To do this, slice off enough of the green stems to leave about a 3 in (7.6 cm) to 4 in (10 cm) piece. Green onions work great on a vegetable tray with carrots, celery, tomatoes, and a cheesy dip. Wrap a green onion in cream cheese and deli meat for a fun appetizer. To do this, take ten trimmed green onions and scoop a teaspoon of cream cheese onto the ends, covering the white bases. Place each cream cheese covered end on top of a slice of deli meat. Fold the bottom part of the meat onto the bottom of the base, then roll the rest of the meat around the onion. If you don\u2019t plan to serve your meat-wrapped green onions right away, refrigerate them until you are ready. Substitute green onions for chives in your recipe. If you have a recipe that calls for snipped fresh chives, you can use green onions instead. Be sure to finely mince them. Cooking with Green Onions Cook green onions in meat or vegetable stir-fry. Put 1 inch (2.5 cm) slices of green onions into your stir fry dish. Add them about 1 or 2 minutes before the dish is done, since green onions cook very quickly. Use green onions to add flavor and texture to scrambled eggs. Just before you add the eggs to the pan to make scrambled eggs, add in a handful of chopped green onions to the egg mixture. Make sure they are thinly sliced. If you are making an omelette, add larger pieces of green onions, about \u20442 in (1.3 cm) long, on one side of the pan before you fold the omelette in half. If you want to have your green onions a little softer, saute them with vegetable oil over medium-high heat for about 2-3 minutes before adding them to the eggs. Grill green onions as a side dish. Green onions make a great side dish served with meat or fish. To make them, simply sprinkle trimmed green onions with salt and pepper. Grill over medium-high heat for 4-5 minutes on each side. Don\u2019t worry if you end up with some extra crispy or charred bits when you grill the onions. You can always crumble or chop those parts into small pieces and add to salsas, dips, or salads to give them a smokey flavor. If you don\u2019t want to eat them on their own, try mincing the grilled green onions and adding them to cream cheese for a savory and flavorful dip. Add subtle onion flavor to baked goods. You can always mix in chopped green onions to your dough before putting it in the oven. Try it with pizza dough, cornbread, or biscuits. It works best with savory dishes. Try adding chopped green onions to your Thanksgiving stuffing before putting it in the oven. Dry green onions and turn them into onion powder. Grill your green onions or char them directly on the burners of a gas stove. Let them dry overnight in the oven at the lowest temperature. Then, grind them into a fine powder in the food processor. Use the onion powder for spice rubs, marinades, or onion dip.",
  "tyn_model":[
    "green onions",
    "green onion",
    "onions",
    "cream cheese",
    "cutting board",
    "tuna",
    "chives",
    "eggs",
    "onion powder",
    "water",
    "sharp knife",
    "knife",
    "refrigerator",
    "deviled eggs",
    "tuna or egg salad",
    "bread",
    "lettuce",
    "vegetable appetizer tray",
    "vegetable tray",
    "carrots",
    "celery",
    "tomatoes",
    "deli meat",
    "vegetable stir-fry",
    "stir fry dish",
    "scrambled eggs",
    "egg",
    "vegetable oil",
    "salt and pepper",
    "grilled green onions",
    "oven",
    "pizza dough",
    "gas stove",
    "food processor",
    "onion dip"
  ],
  "tyn_section":[

  ]
}