{
  "title":"How to Make a Kuwaiti Saffron Cake",
  "url":"https://www.wikihow.com/Make-a-Kuwaiti-Saffron-Cake",
  "category_hierarchy":[
    "Food and Entertaining",
    "Recipes",
    "Baking",
    "Cakes"
  ],
  "parts":[
    {
      "name":"Preparing",
      "steps":[
        {
          "headline":"Preheat the oven.",
          "description":"\u200eSet your oven to the recommended temperature on the cake mix box."
        },
        {
          "headline":"Prepare the saffron flavoring.",
          "description":"To do this, put 1 teaspoon of saffron in the amount of water \u200ethe cake box asks for, making sure the water is warm and stirring until the water turns yellow. \u200eThis will make the saffron flavor and coloring in the cake more intense. If your cake mix does \u200enot ask for water, you can skip this step. \u200e"
        },
        {
          "headline":"Butter and flour the pan you are using.",
          "description":"\u200eThis is important to keep the cake from sticking to the pan. You can also \u200euse nonstick cooking spray instead, as long as the pan is coated properly. The exact dimensions of the pan \u200edo not matter, but use a rectangular pan, if you have one."
        }
      ]
    },
    {
      "name":"Making the Cake",
      "steps":[
        {
          "headline":"Mix the yellow cake as instructed on the back of the box.",
          "description":"Use some minor alterations to the instructions:\u200e \nWhen instructed to add the water, add the water saffron mixture you made earlier. If the \u200erecipe doesn\u2019t call for water, add one teaspoon of saffron directly to the cake mixture. \u200e\nAdd 1/4 teaspoon of cardamom if you want. This step is optional because it does not change the taste \u200ethat much, and ground cardamom is hard to find in a lot of the grocery stores.\u200e\nAfter you finish mixing the basic cake mixture, add 2 tablespoons of flour. It is \u200eimportant for you to add the flour after you\u2019re done with mixing the cake \u200ecompletely, because adding the flour will thicken the mixture to almost a doughy \u200econsistency, making it harder to mix. This step is important because it makes the cake denser and less crumbly, \u200ewhich will help the cake hold its shape when the sauce is added later \u200eon. \u200e"
        },
        {
          "headline":"Add the cake mixture into prepared pan.",
          "description":"Pour the cake mixture until it reaches a quarter of the height of the pan. If more than that is added, the cake to sauce ratio will be off."
        },
        {
          "headline":"Put it in the oven for the recommended time on the box.",
          "description":"Check for readiness throughout the baking time. \u200e\nTo check for readiness, insert toothpick into the cake when you think it might be done. If the toothpick comes out clean, it means \u200eyour cake is ready. \u200e"
        },
        {
          "headline":"Make the tres leches sauce while the cake is in the oven.",
          "description":"This sauce is a basic tres leches, or three milk sauce. \u200e\nCombine the 2 cups of milk with the \u200e1 cup of evaporated milk and 1 cup sweet and condensed milk in a pot on medium heat. Keep \u200ewhisking the mixture until it comes to a boil, being careful not to burn it. Turn off the heat and \u200eadd one teaspoon of saffron, and whisk for 30 more seconds. This amount will only be enough for the cake to absorb. If you want some extra sauce on the side, don't be afraid to make extra with the ratio of 2 cups of milk to every 1 cup each of evaporated milk and sweet and condensed milk in mind. Be sure to use full fat milk."
        },
        {
          "headline":"Take the cake out of the oven once it's done.",
          "description":"Let it rest for 10-15 minutes. \u200eIf you try to work with it too early, it will start crumbling. \u200e"
        },
        {
          "headline":"Add the sauce.",
          "description":"After the cake has fully rested, make small holes by poking it with a toothpick or a wooden \u200eskewer. You want the saffron milk sauce to soak into the cake to make it moist and extra spongy.\u200e Pour the sauce over the cake."
        },
        {
          "headline":"Put the cake in the fridge and let chill for at least 6 hours.",
          "description":"You need the cake to become one with the milk mixture. This cake is like revenge, sweet and \u200ebest served cold. \u200e"
        },
        {
          "headline":"Make whipped cream.",
          "description":"To make the whipped cream, use 1 powdered whipped cream packet, 1/4 cup of \u200epowdered sugar, and 2 cups of cream. Mix them all together until soft peaks form and then \u200echill in the fridge for about 30 minutes.\u200e"
        }
      ]
    },
    {
      "name":"Serving",
      "steps":[
        {
          "headline":"Spread chilled whipped cream on chilled cake making an even layer.",
          "description":"Add saffron as shown above, a pinch for \u200eeach potential slice, and then chill in the fridge for 30 more minutes.\u200e"
        },
        {
          "headline":"Plate and serve.",
          "description":"Cut the cake into squares and make sure to cut off the edges, so no brown pieces of cake \u200eshow. This is for aesthetic purposes only. \u200eServe cold in a bowl with some extra sauce, and a cup of coffee or tea, and enjoy. \u200e"
        }
      ]
    }
  ],
  "text":" Preparing Preheat the oven. \u200eSet your oven to the recommended temperature on the cake mix box. Prepare the saffron flavoring. To do this, put 1 teaspoon of saffron in the amount of water \u200ethe cake box asks for, making sure the water is warm and stirring until the water turns yellow. \u200eThis will make the saffron flavor and coloring in the cake more intense. If your cake mix does \u200enot ask for water, you can skip this step. \u200e Butter and flour the pan you are using. \u200eThis is important to keep the cake from sticking to the pan. You can also \u200euse nonstick cooking spray instead, as long as the pan is coated properly. The exact dimensions of the pan \u200edo not matter, but use a rectangular pan, if you have one. Making the Cake Mix the yellow cake as instructed on the back of the box. Use some minor alterations to the instructions:\u200e \nWhen instructed to add the water, add the water saffron mixture you made earlier. If the \u200erecipe doesn\u2019t call for water, add one teaspoon of saffron directly to the cake mixture. \u200e\nAdd 1/4 teaspoon of cardamom if you want. This step is optional because it does not change the taste \u200ethat much, and ground cardamom is hard to find in a lot of the grocery stores.\u200e\nAfter you finish mixing the basic cake mixture, add 2 tablespoons of flour. It is \u200eimportant for you to add the flour after you\u2019re done with mixing the cake \u200ecompletely, because adding the flour will thicken the mixture to almost a doughy \u200econsistency, making it harder to mix. This step is important because it makes the cake denser and less crumbly, \u200ewhich will help the cake hold its shape when the sauce is added later \u200eon. \u200e Add the cake mixture into prepared pan. Pour the cake mixture until it reaches a quarter of the height of the pan. If more than that is added, the cake to sauce ratio will be off. Put it in the oven for the recommended time on the box. Check for readiness throughout the baking time. \u200e\nTo check for readiness, insert toothpick into the cake when you think it might be done. If the toothpick comes out clean, it means \u200eyour cake is ready. \u200e Make the tres leches sauce while the cake is in the oven. This sauce is a basic tres leches, or three milk sauce. \u200e\nCombine the 2 cups of milk with the \u200e1 cup of evaporated milk and 1 cup sweet and condensed milk in a pot on medium heat. Keep \u200ewhisking the mixture until it comes to a boil, being careful not to burn it. Turn off the heat and \u200eadd one teaspoon of saffron, and whisk for 30 more seconds. This amount will only be enough for the cake to absorb. If you want some extra sauce on the side, don't be afraid to make extra with the ratio of 2 cups of milk to every 1 cup each of evaporated milk and sweet and condensed milk in mind. Be sure to use full fat milk. Take the cake out of the oven once it's done. Let it rest for 10-15 minutes. \u200eIf you try to work with it too early, it will start crumbling. \u200e Add the sauce. After the cake has fully rested, make small holes by poking it with a toothpick or a wooden \u200eskewer. You want the saffron milk sauce to soak into the cake to make it moist and extra spongy.\u200e Pour the sauce over the cake. Put the cake in the fridge and let chill for at least 6 hours. You need the cake to become one with the milk mixture. This cake is like revenge, sweet and \u200ebest served cold. \u200e Make whipped cream. To make the whipped cream, use 1 powdered whipped cream packet, 1/4 cup of \u200epowdered sugar, and 2 cups of cream. Mix them all together until soft peaks form and then \u200echill in the fridge for about 30 minutes.\u200e Serving Spread chilled whipped cream on chilled cake making an even layer. Add saffron as shown above, a pinch for \u200eeach potential slice, and then chill in the fridge for 30 more minutes.\u200e Plate and serve. Cut the cake into squares and make sure to cut off the edges, so no brown pieces of cake \u200eshow. This is for aesthetic purposes only. \u200eServe cold in a bowl with some extra sauce, and a cup of coffee or tea, and enjoy. \u200e",
  "tyn_model":[
    "water",
    "oven",
    "cake",
    "saffron",
    "flour",
    "milk",
    "whipped cream",
    "\u200e\n",
    "cake mix",
    "cardamom",
    "\u200e add",
    "\u200e make",
    "evaporated milk",
    "sweet and condensed milk",
    "fridge",
    "\u200e butter",
    "nonstick cooking spray",
    "water saffron",
    "sauce",
    "toothpick",
    "tres leches sauce",
    "pot",
    "whisk",
    "full fat milk",
    "saffron milk",
    "\u200epowdered sugar",
    "cream",
    "bowl",
    "tea"
  ],
  "tyn_section":[

  ]
}