{
  "title":"How to Get Rid of Pantry Bugs",
  "url":"https://www.wikihow.com/Get-Rid-of-Pantry-Bugs",
  "category_hierarchy":[
    "Home and Garden",
    "Housekeeping",
    "Pest Control"
  ],
  "methods":[
    {
      "name":"Clearing the Infestation",
      "steps":[
        {
          "headline":"Inspect all of the food packages stored in your pantry and cupboards for bugs.",
          "description":"Grain beetles and weevils are tiny black or brown bugs. Indian meal moths are gray with brown or bronze wings. Also, look for silk webbing left behind by moth larvae. Pay special attention to packages of flour, rice, and other grain-derived products. Remember that the pests might not always be visible right away, so stir around the contents of packages or empty them out onto a baking sheet to check. Don\u2019t assume that because a package is well-sealed it doesn\u2019t have bugs. Many types of pantry pests can squeeze through very small spaces to get at your food."
        },
        {
          "headline":"Throw away any infested food and open packages.",
          "description":"If you find infested foodstuffs in your pantry, it\u2019s best to throw away all other open packages that were in your pantry as well. Even if you don\u2019t see bugs, it is highly likely that they have been laying eggs in other open packages. If you really don\u2019t want to throw away all of your open packages of pantry goods, you can freeze the ones that you didn\u2019t see bugs in for 3-4 days to kill larvae."
        },
        {
          "headline":"Remove everything from your pantry and vacuum the shelves.",
          "description":"Get into all the shelves, corners, and crevices of your pantry with the hose of a vacuum cleaner. This will suck up any remaining bugs or cocoons, as well as spilled crumbs or grains."
        },
        {
          "headline":"Wash the shelves with warm soapy water and a clean cloth or sponge.",
          "description":"Do this to clean up any remaining crumbs, dust, and bugs or cocoons that the vacuum missed. Get into any corners or cracks as best as you can. Wash any food storage containers with soap and water before returning them to the pantry."
        },
        {
          "headline":"Wipe down all the shelves with a 50-50 water and white vinegar solution.",
          "description":"Vinegar acts as a repellent to deter pantry bugs from coming back. It will also kill any bugs that may still be hiding in your cupboards! Do not use pesticides, bleach, or ammonia to wipe down the pantry. These chemicals will prevent infestations but can be dangerous if they touch any of your food."
        },
        {
          "headline":"Remove the trash from the house immediately.",
          "description":"Tie up any bags of trash where you threw out contaminated food items and take them out of the house. If you leave them in the kitchen there is a high chance that the bugs will re-infest your pantry. Wash out your kitchen trash can as well with soap and water. Take trash out of your kitchen frequently to lower the likelihood of attracting pests. If you dumped any infested food into your garbage disposal, run the garbage disposal under hot water for 1 minute."
        }
      ]
    },
    {
      "name":"Preventing Future Infestations",
      "steps":[
        {
          "headline":"Wipe up any spills or crumbs from countertops, shelves, and floors right away.",
          "description":"Always keep your kitchen and pantry as clean as possible. The longer spills or crumbs stay out, the more  likely pantry pests are to come looking for a snack. Use soap and water or a disinfecting countertop spray with a clean cloth or sponge to clean up messes."
        },
        {
          "headline":"Purchase packaged foods that show no signs of damage.",
          "description":"Examine packages of dried goods in the store for signs of a broken seal before taking them home. Even a small hole or tear means that pantry pests could already have infested the package. Try to buy amounts of flour, rice, and other grains that you can use up in 2-4 months. The longer something sits in your pantry the more likely it is to get infested."
        },
        {
          "headline":"Store food in your pantry in airtight glass, plastic, or metal storage containers.",
          "description":"Purchase some good-quality storage containers with strong seals to keep your grains and other pantry goods in. Remember that pantry pests can squeeze through very small spaces, so an airtight seal is your best ally. Mason jars are a great airtight option for storing grains and other food, and also look great for organizing your pantry! If you can store anything from your pantry in the fridge, put it in there to keep it away from bugs."
        },
        {
          "headline":"Put bay leaves in your pantry and in food packages to repel moths.",
          "description":"Sprinkle bay leaves on the shelves of your pantry, or keep some in an open container on a shelf. Put 1 or 2 in open packages or containers of rice, flour, and other grains."
        },
        {
          "headline":"Clean your pantry regularly every 3-6 months.",
          "description":"Even if you don\u2019t have an infestation, take everything out of your pantry and throw away any old food items that could attract pests. Wash the shelves with warm water and soap, then wipe them down with a 50-50 water and vinegar solution. If you have a recurring problem with pantry pests, call in a professional pest control expert to help you resolve and prevent the problem. EXPERT TIP\t\t\t\t\t\t\t\t\t\t\t\t\t\t\t\t\t\t\t\t\t\t\t\t\t\t\t\t\t\t\tScott McCombe\t\t\t\t\t\t\t\t\t\t\t\t\t\t\t\tPest Control Specialist\t\t\t\t\t\t\t\tScott McCombe is the CEO of Summit Environmental Solutions (SES), a family-owned local pest solutions, animal control, and home insulation company based in Northern Virginia. Founded in 1991, SES has an A+ rating with the Better Business Bureau and has been awarded \"Best of the Best 2017,\" \u201cTop Rated Professional,\u201d and \u201cElite Service Award\" by HomeAdvisor. Scott McCombe\t\t\tPest Control Specialist\t\t\t\tPesticides may be helpful for handling an infestation. Install pheromone traps labeled for pantry bugs to help break the reproductive cycle. If needed, you may also use a limited, targeted application of residual pesticide and insect growth regulator (IGR)."
        }
      ]
    }
  ],
  "text":" Clearing the Infestation Inspect all of the food packages stored in your pantry and cupboards for bugs. Grain beetles and weevils are tiny black or brown bugs. Indian meal moths are gray with brown or bronze wings. Also, look for silk webbing left behind by moth larvae. Pay special attention to packages of flour, rice, and other grain-derived products. Remember that the pests might not always be visible right away, so stir around the contents of packages or empty them out onto a baking sheet to check. Don\u2019t assume that because a package is well-sealed it doesn\u2019t have bugs. Many types of pantry pests can squeeze through very small spaces to get at your food. Throw away any infested food and open packages. If you find infested foodstuffs in your pantry, it\u2019s best to throw away all other open packages that were in your pantry as well. Even if you don\u2019t see bugs, it is highly likely that they have been laying eggs in other open packages. If you really don\u2019t want to throw away all of your open packages of pantry goods, you can freeze the ones that you didn\u2019t see bugs in for 3-4 days to kill larvae. Remove everything from your pantry and vacuum the shelves. Get into all the shelves, corners, and crevices of your pantry with the hose of a vacuum cleaner. This will suck up any remaining bugs or cocoons, as well as spilled crumbs or grains. Wash the shelves with warm soapy water and a clean cloth or sponge. Do this to clean up any remaining crumbs, dust, and bugs or cocoons that the vacuum missed. Get into any corners or cracks as best as you can. Wash any food storage containers with soap and water before returning them to the pantry. Wipe down all the shelves with a 50-50 water and white vinegar solution. Vinegar acts as a repellent to deter pantry bugs from coming back. It will also kill any bugs that may still be hiding in your cupboards! Do not use pesticides, bleach, or ammonia to wipe down the pantry. These chemicals will prevent infestations but can be dangerous if they touch any of your food. Remove the trash from the house immediately. Tie up any bags of trash where you threw out contaminated food items and take them out of the house. If you leave them in the kitchen there is a high chance that the bugs will re-infest your pantry. Wash out your kitchen trash can as well with soap and water. Take trash out of your kitchen frequently to lower the likelihood of attracting pests. If you dumped any infested food into your garbage disposal, run the garbage disposal under hot water for 1 minute. Preventing Future Infestations Wipe up any spills or crumbs from countertops, shelves, and floors right away. Always keep your kitchen and pantry as clean as possible. The longer spills or crumbs stay out, the more  likely pantry pests are to come looking for a snack. Use soap and water or a disinfecting countertop spray with a clean cloth or sponge to clean up messes. Purchase packaged foods that show no signs of damage. Examine packages of dried goods in the store for signs of a broken seal before taking them home. Even a small hole or tear means that pantry pests could already have infested the package. Try to buy amounts of flour, rice, and other grains that you can use up in 2-4 months. The longer something sits in your pantry the more likely it is to get infested. Store food in your pantry in airtight glass, plastic, or metal storage containers. Purchase some good-quality storage containers with strong seals to keep your grains and other pantry goods in. Remember that pantry pests can squeeze through very small spaces, so an airtight seal is your best ally. Mason jars are a great airtight option for storing grains and other food, and also look great for organizing your pantry! If you can store anything from your pantry in the fridge, put it in there to keep it away from bugs. Put bay leaves in your pantry and in food packages to repel moths. Sprinkle bay leaves on the shelves of your pantry, or keep some in an open container on a shelf. Put 1 or 2 in open packages or containers of rice, flour, and other grains. Clean your pantry regularly every 3-6 months. Even if you don\u2019t have an infestation, take everything out of your pantry and throw away any old food items that could attract pests. Wash the shelves with warm water and soap, then wipe them down with a 50-50 water and vinegar solution. If you have a recurring problem with pantry pests, call in a professional pest control expert to help you resolve and prevent the problem. EXPERT TIP\t\t\t\t\t\t\t\t\t\t\t\t\t\t\t\t\t\t\t\t\t\t\t\t\t\t\t\t\t\t\tScott McCombe\t\t\t\t\t\t\t\t\t\t\t\t\t\t\t\tPest Control Specialist\t\t\t\t\t\t\t\tScott McCombe is the CEO of Summit Environmental Solutions (SES), a family-owned local pest solutions, animal control, and home insulation company based in Northern Virginia. Founded in 1991, SES has an A+ rating with the Better Business Bureau and has been awarded \"Best of the Best 2017,\" \u201cTop Rated Professional,\u201d and \u201cElite Service Award\" by HomeAdvisor. Scott McCombe\t\t\tPest Control Specialist\t\t\t\tPesticides may be helpful for handling an infestation. Install pheromone traps labeled for pantry bugs to help break the reproductive cycle. If needed, you may also use a limited, targeted application of residual pesticide and insect growth regulator (IGR).",
  "tyn_model":[
    "water",
    "soap",
    "flour",
    "rice",
    "food",
    "vacuum",
    "sponge",
    "vinegar",
    "bay leaves",
    "pest control specialist",
    "grain beetles",
    "baking sheet",
    "vacuum cleaner",
    "white vinegar",
    "bleach",
    "ammonia",
    "garbage disposal",
    "mason jars",
    "fridge",
    "pest control expert",
    "summit environmental solutions",
    "pest solutions, animal control, and home insulation",
    "better business bureau",
    "\u201ctop",
    "\u201d and",
    "\u201celite service award\"",
    "pesticides",
    "pheromone traps",
    "pesticide",
    "insect growth regulator"
  ],
  "tyn_section":[

  ]
}