{
  "title":"How to Season Pork Tenderloin",
  "url":"https://www.wikihow.com/Season-Pork-Tenderloin",
  "category_hierarchy":[
    "Food and Entertaining",
    "Recipes",
    "Meat",
    "Pork"
  ],
  "methods":[
    {
      "name":"Savory Pork Tenderloin Rub",
      "steps":[
        {
          "headline":"Combine garlic powder, oregano, cumin, coriander, and thyme in a bowl.",
          "description":"Use 1 teaspoon (3 grams) of garlic powder, 1 teaspoon (1 gram) of oregano, 1 teaspoon (2 grams) of cumin, 1 teaspoon (0.6 grams) of coriander, and 1 teaspoon (0.9 grams) of thyme. After you add the spices to the bowl, whisk them with a fork until they\u2019re thoroughly combined. This recipe should be enough for around 1 pound (0.45 kg) of pork tenderloin. You can use more or less of each seasoning depending on how much meat you\u2019re cooking."
        },
        {
          "headline":"Sprinkle the seasoning over the pork tenderloin.",
          "description":"Don\u2019t worry about covering both sides of the tenderloin yet. Just get all of the seasoning onto the pork in an even layer.Tip: Make sure your hands are dry before you sprinkle the seasoning on or it will stick to them."
        },
        {
          "headline":"Rub the seasoning into both sides of the pork with your hands.",
          "description":"Make sure all of the meat is covered with the seasoning. As you rub it in, press the meat gently so the seasoning sticks to it."
        },
        {
          "headline":"Set the pork tenderloin aside until you\u2019re ready to cook it.",
          "description":"Once you\u2019ve covered the meat with the rub, it\u2019s ready to go. Avoid handling the meat more than necessary so you\u2019re not lifting off the seasoning with your hands. You can cook pork tenderloin in the oven, on the grill, on the stovetop, or in a smoker."
        }
      ]
    },
    {
      "name":"Spicy Cajun Seasoning Mix",
      "steps":[
        {
          "headline":"Pour some vegetable oil into a bowl.",
          "description":"Use 2 tablespoons (30 mL) of vegetable oil. Make sure the bowl you\u2019re using is large enough to combine seasonings in so none of your seasoning mix spills over the side when you\u2019re stirring it later."
        },
        {
          "headline":"Add paprika, oregano, onion flakes, thyme, garlic powder, and cayenne pepper.",
          "description":"Use 1 tablespoon (6.8 grams) of paprika, 2 teaspoons (2 grams) of dried oregano, 2 teaspoons (1.3 grams) of dried onion flakes, 1 teaspoon (0.9 grams) of dried thyme, 1/2 teaspoon (1.6 grams) of garlic powder, and 1/2 teaspoon (0.85 grams) of cayenne pepper. After you add the seasonings to the bowl, stir them into the vegetable oil using a spoon.Tip: You can use more or less paprika and cayenne pepper depending on how spicy you want your pork tenderloin to be. The more you use, the spicier it will be."
        },
        {
          "headline":"Rub the seasoning mix over the pork tenderloin before cooking it.",
          "description":"You can use your hands to rub the mixture into the pork. Just make sure it\u2019s evenly coated. When you\u2019re finished, the pork tenderloin is ready to be cooked. To cook pork tenderloin, you can use an oven, grill, stovetop, or a smoker."
        }
      ]
    },
    {
      "name":"Sweet and Spicy Glaze",
      "steps":[
        {
          "headline":"Mix soy sauce, minced ginger, and minced garlic in a bowl.",
          "description":"Use 1 tablespoon (15 mL) of soy sauce, 1 teaspoon (5 grams) of minced ginger, and 1 teaspoon (5 grams) of minced garlic. For the best flavor, use freshly-minced ginger and garlic, but you can use store-bought minced ginger and garlic as well."
        },
        {
          "headline":"Spread the mixture over the pork tenderloin before cooking it.",
          "description":"You can use a spoon or other cooking utensil to spread the soy sauce mixture over the meat. Make sure you coat all sides of the pork with the mixture so it\u2019s evenly seasoned.Did you know? There are a variety of ways that you can cook pork tenderloin, like in the oven, in a pan on the stovetop, on the grill, or in a smoker."
        },
        {
          "headline":"Add salsa and raspberry preserves to the pork right before it\u2019s finished cooking.",
          "description":"Use \u20443 cup (79 mL) of fresh or store-bought salsa and 1 tablespoon (15 mL) of seedless raspberry preserves. You can spread the salsa and preserves over the top of the meat, or you can add them to the pan if you\u2019re cooking the pork tenderloin on the stove top. Like the soy sauce, ginger, and garlic, the salsa will give the pork a spicy kick, while the raspberry preserves will add a touch of sweetness to your dish."
        }
      ]
    },
    {
      "name":"Citrus and Herb Marinade",
      "steps":[
        {
          "headline":"Combine lemon zest, lemon juice, olive oil, and Dijon mustard in a sealable bag.",
          "description":"Use the zest from 1 lemon, \u20444 cup (180 mL) of lemon juice, \u20442 cup (120 mL) of olive oil, and 2 teaspoons (9.9 mL) of Dijon mustard. Make sure the sealable plastic bag you use is large enough to hold the pork tenderloin you\u2019ll be marinating. A 1-gallon bag should work. If you\u2019re using freshly squeezed lemon juice, you\u2019ll need 4-6 lemons to get \u20444 cup (180 mL) of juice. If you\u2019re marinating multiple pork tenderloins, you may need to split the ingredients up between 2 bags."
        },
        {
          "headline":"Add minced garlic, rosemary, salt, and thyme to the bag.",
          "description":"Use 6 minced garlic cloves, 1 1/2 tablespoons (5 grams) of rosemary, 2 teaspoons (12 grams) of salt, and 1 tablespoon (3 grams) of thyme. After you add the garlic and seasonings, seal the bag and shake it up a bit to mix everything together."
        },
        {
          "headline":"Put the pork tenderloin in the bag with the marinade.",
          "description":"Make sure the pork tenderloin is completely in the bag. Then, press out the excess air with your hands and seal it. You may need to shake the bag a few times to coat all of the meat with the marinade."
        },
        {
          "headline":"Marinate the pork for at least 3 hours in the fridge.",
          "description":"The longer you marinate the pork tenderloin,  the more flavorful it will be. If possible, leave the meat in the fridge overnight. However, if you\u2019re in a rush, 3 hours should be enough. When the pork tenderloin is done marinating, you can cook it on the grill, on the stovetop, in the oven, or in a smoker.Warning: Avoid marinating the tenderloin for longer than overnight. If you marinate it for too long, the citrus juice in the marinade can change the texture of the meat."
        }
      ]
    }
  ],
  "text":" Savory Pork Tenderloin Rub Combine garlic powder, oregano, cumin, coriander, and thyme in a bowl. Use 1 teaspoon (3 grams) of garlic powder, 1 teaspoon (1 gram) of oregano, 1 teaspoon (2 grams) of cumin, 1 teaspoon (0.6 grams) of coriander, and 1 teaspoon (0.9 grams) of thyme. After you add the spices to the bowl, whisk them with a fork until they\u2019re thoroughly combined. This recipe should be enough for around 1 pound (0.45 kg) of pork tenderloin. You can use more or less of each seasoning depending on how much meat you\u2019re cooking. Sprinkle the seasoning over the pork tenderloin. Don\u2019t worry about covering both sides of the tenderloin yet. Just get all of the seasoning onto the pork in an even layer.Tip: Make sure your hands are dry before you sprinkle the seasoning on or it will stick to them. Rub the seasoning into both sides of the pork with your hands. Make sure all of the meat is covered with the seasoning. As you rub it in, press the meat gently so the seasoning sticks to it. Set the pork tenderloin aside until you\u2019re ready to cook it. Once you\u2019ve covered the meat with the rub, it\u2019s ready to go. Avoid handling the meat more than necessary so you\u2019re not lifting off the seasoning with your hands. You can cook pork tenderloin in the oven, on the grill, on the stovetop, or in a smoker. Spicy Cajun Seasoning Mix Pour some vegetable oil into a bowl. Use 2 tablespoons (30 mL) of vegetable oil. Make sure the bowl you\u2019re using is large enough to combine seasonings in so none of your seasoning mix spills over the side when you\u2019re stirring it later. Add paprika, oregano, onion flakes, thyme, garlic powder, and cayenne pepper. Use 1 tablespoon (6.8 grams) of paprika, 2 teaspoons (2 grams) of dried oregano, 2 teaspoons (1.3 grams) of dried onion flakes, 1 teaspoon (0.9 grams) of dried thyme, 1/2 teaspoon (1.6 grams) of garlic powder, and 1/2 teaspoon (0.85 grams) of cayenne pepper. After you add the seasonings to the bowl, stir them into the vegetable oil using a spoon.Tip: You can use more or less paprika and cayenne pepper depending on how spicy you want your pork tenderloin to be. The more you use, the spicier it will be. Rub the seasoning mix over the pork tenderloin before cooking it. You can use your hands to rub the mixture into the pork. Just make sure it\u2019s evenly coated. When you\u2019re finished, the pork tenderloin is ready to be cooked. To cook pork tenderloin, you can use an oven, grill, stovetop, or a smoker. Sweet and Spicy Glaze Mix soy sauce, minced ginger, and minced garlic in a bowl. Use 1 tablespoon (15 mL) of soy sauce, 1 teaspoon (5 grams) of minced ginger, and 1 teaspoon (5 grams) of minced garlic. For the best flavor, use freshly-minced ginger and garlic, but you can use store-bought minced ginger and garlic as well. Spread the mixture over the pork tenderloin before cooking it. You can use a spoon or other cooking utensil to spread the soy sauce mixture over the meat. Make sure you coat all sides of the pork with the mixture so it\u2019s evenly seasoned.Did you know? There are a variety of ways that you can cook pork tenderloin, like in the oven, in a pan on the stovetop, on the grill, or in a smoker. Add salsa and raspberry preserves to the pork right before it\u2019s finished cooking. Use \u20443 cup (79 mL) of fresh or store-bought salsa and 1 tablespoon (15 mL) of seedless raspberry preserves. You can spread the salsa and preserves over the top of the meat, or you can add them to the pan if you\u2019re cooking the pork tenderloin on the stove top. Like the soy sauce, ginger, and garlic, the salsa will give the pork a spicy kick, while the raspberry preserves will add a touch of sweetness to your dish. Citrus and Herb Marinade Combine lemon zest, lemon juice, olive oil, and Dijon mustard in a sealable bag. Use the zest from 1 lemon, \u20444 cup (180 mL) of lemon juice, \u20442 cup (120 mL) of olive oil, and 2 teaspoons (9.9 mL) of Dijon mustard. Make sure the sealable plastic bag you use is large enough to hold the pork tenderloin you\u2019ll be marinating. A 1-gallon bag should work. If you\u2019re using freshly squeezed lemon juice, you\u2019ll need 4-6 lemons to get \u20444 cup (180 mL) of juice. If you\u2019re marinating multiple pork tenderloins, you may need to split the ingredients up between 2 bags. Add minced garlic, rosemary, salt, and thyme to the bag. Use 6 minced garlic cloves, 1 1/2 tablespoons (5 grams) of rosemary, 2 teaspoons (12 grams) of salt, and 1 tablespoon (3 grams) of thyme. After you add the garlic and seasonings, seal the bag and shake it up a bit to mix everything together. Put the pork tenderloin in the bag with the marinade. Make sure the pork tenderloin is completely in the bag. Then, press out the excess air with your hands and seal it. You may need to shake the bag a few times to coat all of the meat with the marinade. Marinate the pork for at least 3 hours in the fridge. The longer you marinate the pork tenderloin,  the more flavorful it will be. If possible, leave the meat in the fridge overnight. However, if you\u2019re in a rush, 3 hours should be enough. When the pork tenderloin is done marinating, you can cook it on the grill, on the stovetop, in the oven, or in a smoker.Warning: Avoid marinating the tenderloin for longer than overnight. If you marinate it for too long, the citrus juice in the marinade can change the texture of the meat.",
  "tyn_model":[
    "pork tenderloin",
    "garlic",
    "thyme",
    "bowl",
    "garlic powder",
    "grill",
    "soy sauce",
    "ginger",
    "salsa",
    "oregano",
    "vegetable oil",
    "seasonings",
    "paprika",
    "cayenne pepper",
    "raspberry preserves",
    "lemon juice",
    "cumin",
    "coriander",
    "seasoning",
    "pork",
    "spoon",
    "oven",
    "smoker",
    "olive oil",
    "dijon mustard",
    "rosemary",
    "salt",
    "spices",
    "fork",
    "seasoning mix",
    "onion flakes",
    "dried oregano",
    "dried onion",
    "dried thyme",
    "minced ginger",
    "cooking utensil",
    "lemon zest",
    "sealable bag",
    "sealable plastic bag",
    "marinade",
    "citrus"
  ],
  "tyn_section":[

  ]
}