{
  "title":"How to Clean the Steam Iron and Its Base Plate",
  "url":"https://www.wikihow.com/Clean-the-Steam-Iron-and-Its-Base-Plate",
  "category_hierarchy":[
    "Home and Garden",
    "Housekeeping",
    "Cleaning"
  ],
  "parts":[
    {
      "name":"Cleaning Inside of Your Steam Iron",
      "steps":[
        {
          "headline":"Mix one half cup of water and one half cup of distilled white vinegar.",
          "description":"Making a vinegar-based cleaning solution  that can disinfect, descale, and deodorize is an economic way to clean inside of your iron. This is also the easiest way to clean parts of the iron that are otherwise unreachable."
        },
        {
          "headline":"Fill the water reservoir of the iron with the cleaning solution, and turn the iron on to heat.",
          "description":"Set the iron on its hottest setting. If your iron does not have a temperature dial, switch it to cotton on the fabric settings."
        },
        {
          "headline":"Run the cleaning solution through the inside of the iron when the iron is hot.",
          "description":"This is accomplished by holding down the steam button while pressing the iron into a hand towel on the ironing board. Vent the steam in 20-30 second bursts in this manner for a total of one and a half minutes."
        },
        {
          "headline":"Empty any remaining cleaning solution from the reservoir.",
          "description":"If there is any solution left after venting, be sure to discard or repurpose it for something else. It has already run through the iron and is not needed in the following step."
        },
        {
          "headline":"Fill the reservoir with fresh water and repeat the steaming process.",
          "description":"This will ensure that all of the vinegar is removed from the iron\u2019s ductwork and reservoir. Drain any remaining water from the reservoir."
        }
      ]
    },
    {
      "name":"Cleaning Your Iron's Base Plate",
      "steps":[
        {
          "headline":"Mix equal parts table salt and distilled white vinegar.",
          "description":"The resulting slurry will act as a mild abrasive and help to remove stubborn buildup on the base plate of the iron. This is particularly useful when an iron\u2019s base plate is scorched and no longer glides over the ironing board smoothly. EXPERT TIP\t\t\t\t\t\t\t\t\t\t\t\t\t\t\t\t\t\t\t\t\t\t\t\t\t\t\t\t\t\t\tBridgett Price\t\t\t\t\t\t\t\t\t\t\t\t\t\t\t\tCleaning Guru & Co-Owner, Maid Easy\t\t\t\t\t\t\t\tBridgett Price is a Cleaning Guru and Co-Owner of Maideasy, a maid service company that services the Phoeniz, Arizona metropolitan area. She holds a Master of Management from the University of Phoenix, specializing in digital and traditional marketing. Bridgett Price\t\t\tCleaning Guru & Co-Owner, Maid Easy\t\t\t\tTry these alternative cleaning solutions: To clean the bottom of an iron, mix water with either dish soap or baking soda. The baking soda paste is especially effective for cleaning an iron. Apply your solution to the iron plate and let it sit, then scrub the iron in a circular motion to loosen any rust or grime that's built up."
        },
        {
          "headline":"Apply the cleaning solution and wipe the base plate with a soft damp cloth.",
          "description":"Spread an even layer of the slurry onto the base plate of the iron and gently wipe it with a dampened hand towel in a scrubbing motion. Remove any excess."
        },
        {
          "headline":"Reapply and repeat as many times as necessary until clean.",
          "description":"Continue scrubbing and removing buildup in a soft but deliberate manner being careful not to scratch the base plate. Damage to non-stick surfaces can lead to permanent discoloration and rust."
        },
        {
          "headline":"Pay special attention to cleaning the steam ducts on the base plate of the iron.",
          "description":"Over time these can become clogged with minerals found in ordinary tap water. If your iron is having trouble producing steam, get rid of scale buildup in or around the steam ducts by using a toothbrush, toothpick, cotton swab, or other soft object to remove any visible residue from the area. EXPERT TIP\t\t\t\t\t\t\t\t\t\t\t\t\t\t\t\t\t\t\t\t\t\t\t\t\t\t\t\t\t\t\tBridgett Price\t\t\t\t\t\t\t\t\t\t\t\t\t\t\t\tCleaning Guru & Co-Owner, Maid Easy\t\t\t\t\t\t\t\tBridgett Price is a Cleaning Guru and Co-Owner of Maideasy, a maid service company that services the Phoeniz, Arizona metropolitan area. She holds a Master of Management from the University of Phoenix, specializing in digital and traditional marketing. Bridgett Price\t\t\tCleaning Guru & Co-Owner, Maid Easy\t\t\t\tOur Expert Agrees: To clean out the holes in the iron plate, run a very fine toothpick through each hole in a circular motion, then lift it out to pull the grime onto the iron plate."
        },
        {
          "headline":"Use a store-bought iron cleaner if the base plate is not made of non-stick material.",
          "description":"Some steam irons will have non-coated base or sole plates. Though these can be cleaned with the aforementioned salt and vinegar solution, they may benefit from a commercial iron cleaner as well. An extra-fine abrasive may be used as a last resort."
        }
      ]
    },
    {
      "name":"Maintaining Your Iron",
      "steps":[
        {
          "headline":"Remove any melted-on plastic from your iron.",
          "description":"Chill the iron by placing its base plate in a shallow bowl of ice water. This will firm up the plastic and allow for easy removal. Scrape any plastic away with a dull plastic knife, plastic spatula, or credit card edge."
        },
        {
          "headline":"Use dryer sheets to keep your iron sparkling and smelling nice.",
          "description":"Run a hot iron over a dryer sheet and then a hand towel. Alternate back and forth between the two. This will improve the luster of your iron by removing oils and small particles of scorched cloth or dust."
        },
        {
          "headline":"Fill your iron\u2019s reservoir with the appropriate kind of water.",
          "description":"Depending upon the hardness of your local tap water, the durability of certain internal parts of your iron, and the frequency of use, your iron may call for specific kinds of water. Spring water is always appropriate; however, an equitable and less expensive option is filtered tap water."
        },
        {
          "headline":"Check the power cord regularly.",
          "description":"Note any damage, fraying, or kinks in the iron\u2019s cord. Damage to this area might be a potential fire hazard. If damaged, discontinue use until the cord is repaired."
        },
        {
          "headline":"Store the iron properly.",
          "description":"Never put unnecessary stress on the iron by storing it on its side or back. An iron should be stored sitting upright in an area where it is stable and will not fall. This is also a safety precaution and ensures that if the iron were heated, the base plate would not be touching a cloth surface that can be damaged as it heats."
        }
      ]
    }
  ],
  "text":" Cleaning Inside of Your Steam Iron Mix one half cup of water and one half cup of distilled white vinegar. Making a vinegar-based cleaning solution  that can disinfect, descale, and deodorize is an economic way to clean inside of your iron. This is also the easiest way to clean parts of the iron that are otherwise unreachable. Fill the water reservoir of the iron with the cleaning solution, and turn the iron on to heat. Set the iron on its hottest setting. If your iron does not have a temperature dial, switch it to cotton on the fabric settings. Run the cleaning solution through the inside of the iron when the iron is hot. This is accomplished by holding down the steam button while pressing the iron into a hand towel on the ironing board. Vent the steam in 20-30 second bursts in this manner for a total of one and a half minutes. Empty any remaining cleaning solution from the reservoir. If there is any solution left after venting, be sure to discard or repurpose it for something else. It has already run through the iron and is not needed in the following step. Fill the reservoir with fresh water and repeat the steaming process. This will ensure that all of the vinegar is removed from the iron\u2019s ductwork and reservoir. Drain any remaining water from the reservoir. Cleaning Your Iron's Base Plate Mix equal parts table salt and distilled white vinegar. The resulting slurry will act as a mild abrasive and help to remove stubborn buildup on the base plate of the iron. This is particularly useful when an iron\u2019s base plate is scorched and no longer glides over the ironing board smoothly. EXPERT TIP\t\t\t\t\t\t\t\t\t\t\t\t\t\t\t\t\t\t\t\t\t\t\t\t\t\t\t\t\t\t\tBridgett Price\t\t\t\t\t\t\t\t\t\t\t\t\t\t\t\tCleaning Guru & Co-Owner, Maid Easy\t\t\t\t\t\t\t\tBridgett Price is a Cleaning Guru and Co-Owner of Maideasy, a maid service company that services the Phoeniz, Arizona metropolitan area. She holds a Master of Management from the University of Phoenix, specializing in digital and traditional marketing. Bridgett Price\t\t\tCleaning Guru & Co-Owner, Maid Easy\t\t\t\tTry these alternative cleaning solutions: To clean the bottom of an iron, mix water with either dish soap or baking soda. The baking soda paste is especially effective for cleaning an iron. Apply your solution to the iron plate and let it sit, then scrub the iron in a circular motion to loosen any rust or grime that's built up. Apply the cleaning solution and wipe the base plate with a soft damp cloth. Spread an even layer of the slurry onto the base plate of the iron and gently wipe it with a dampened hand towel in a scrubbing motion. Remove any excess. Reapply and repeat as many times as necessary until clean. Continue scrubbing and removing buildup in a soft but deliberate manner being careful not to scratch the base plate. Damage to non-stick surfaces can lead to permanent discoloration and rust. Pay special attention to cleaning the steam ducts on the base plate of the iron. Over time these can become clogged with minerals found in ordinary tap water. If your iron is having trouble producing steam, get rid of scale buildup in or around the steam ducts by using a toothbrush, toothpick, cotton swab, or other soft object to remove any visible residue from the area. EXPERT TIP\t\t\t\t\t\t\t\t\t\t\t\t\t\t\t\t\t\t\t\t\t\t\t\t\t\t\t\t\t\t\tBridgett Price\t\t\t\t\t\t\t\t\t\t\t\t\t\t\t\tCleaning Guru & Co-Owner, Maid Easy\t\t\t\t\t\t\t\tBridgett Price is a Cleaning Guru and Co-Owner of Maideasy, a maid service company that services the Phoeniz, Arizona metropolitan area. She holds a Master of Management from the University of Phoenix, specializing in digital and traditional marketing. Bridgett Price\t\t\tCleaning Guru & Co-Owner, Maid Easy\t\t\t\tOur Expert Agrees: To clean out the holes in the iron plate, run a very fine toothpick through each hole in a circular motion, then lift it out to pull the grime onto the iron plate. Use a store-bought iron cleaner if the base plate is not made of non-stick material. Some steam irons will have non-coated base or sole plates. Though these can be cleaned with the aforementioned salt and vinegar solution, they may benefit from a commercial iron cleaner as well. An extra-fine abrasive may be used as a last resort. Maintaining Your Iron Remove any melted-on plastic from your iron. Chill the iron by placing its base plate in a shallow bowl of ice water. This will firm up the plastic and allow for easy removal. Scrape any plastic away with a dull plastic knife, plastic spatula, or credit card edge. Use dryer sheets to keep your iron sparkling and smelling nice. Run a hot iron over a dryer sheet and then a hand towel. Alternate back and forth between the two. This will improve the luster of your iron by removing oils and small particles of scorched cloth or dust. Fill your iron\u2019s reservoir with the appropriate kind of water. Depending upon the hardness of your local tap water, the durability of certain internal parts of your iron, and the frequency of use, your iron may call for specific kinds of water. Spring water is always appropriate; however, an equitable and less expensive option is filtered tap water. Check the power cord regularly. Note any damage, fraying, or kinks in the iron\u2019s cord. Damage to this area might be a potential fire hazard. If damaged, discontinue use until the cord is repaired. Store the iron properly. Never put unnecessary stress on the iron by storing it on its side or back. An iron should be stored sitting upright in an area where it is stable and will not fall. This is also a safety precaution and ensures that if the iron were heated, the base plate would not be touching a cloth surface that can be damaged as it heats.",
  "tyn_model":[
    "iron",
    "water",
    "iron plate",
    "distilled white vinegar",
    "ironing board",
    "cleaning guru",
    "maideasy,",
    "maid service company",
    "baking soda",
    "iron cleaner",
    "vinegar-based cleaning solution",
    "cleaning solution",
    "vinegar",
    "table salt",
    "dish soap",
    "tap water",
    "steam irons",
    "salt and vinegar",
    "ice water",
    "plastic spatula",
    "dryer sheets",
    "hot iron",
    "dryer sheet",
    "hand towel"
  ],
  "tyn_section":[

  ]
}