{
  "title":"How to Grow Sweet Potatoes",
  "url":"https://www.wikihow.com/Grow-Sweet-Potatoes",
  "category_hierarchy":[
    "Home and Garden",
    "Gardening",
    "Planting and Growing",
    "Growing Vegetables",
    "Growing Potatoes"
  ],
  "methods":[
    {
      "name":"Starting Your Slips",
      "steps":[
        {
          "headline":"Choose a sweet potato.",
          "description":"Slips are small sprouts that are grown from pre-existing sweet potato plants. You can choose to order these online or from a garden center, but you can also grow them at home easily. Find a mature, healthy sweet potato plant from the store or a friend\u2019s garden. The most common and popular sweet potato varieties (available at most stores) are Beauregard, \u2018bunch\u2019 Porto Ricos, and centennials."
        },
        {
          "headline":"Make sure you have the right climate.",
          "description":"Sweet potatoes are a tropical plant. This means that they grow well in USDA hardiness zones 9, 10, and 11. This area includes most of the southern and south-western United States. If starting your own slips, start sprouting them in March or April. Slips should be planted in the ground in May or June."
        },
        {
          "headline":"Prepare your potato.",
          "description":"When you\u2019ve gotten your hands on 1-2 healthy sweet potatoes, stick them in the sink and wash them well. Then, cut your potato in half. If the potato is particularly large, consider cutting it into thirds or fourths."
        },
        {
          "headline":"Fill a jar with water.",
          "description":"The way your slip-growing works, is that you\u2019ll place your potato half in/half out of a container of water. Use a jar or a glass cup with an opening large enough to fit your potato, and fill the whole thing with water."
        },
        {
          "headline":"Place your potato in the water.",
          "description":"Stick 4-5 toothpicks out of the sides of your potato equidistant apart and near the middle, like spokes on a wheel. Place the potato into the jar/glass of water with the cut side down, with the toothpicks holding half of the potato out by balancing it on the rim of the glass. Do this for every slice of potato that you have, with each section in a different jar."
        },
        {
          "headline":"Add some light and heat.",
          "description":"Move the jar with the potato onto a windowsill that gets a lot of sunlight."
        },
        {
          "headline":"Let your slips grow.",
          "description":"Wait for 2-4 weeks for the small leafy slips to begin sprouting out of the top of the potato."
        },
        {
          "headline":"Harvest the slips.",
          "description":"When the top of your potato is covered in slips, carefully twist each one off individually. They won\u2019t have roots yet and will resemble small leaves with a short stem."
        },
        {
          "headline":"Put your slips in water.",
          "description":"Fill a shallow bowl with a bit of water, around 1\u201d or less depending on the number of slips you have. Set the slips in the bowl so that the stem is submerged in the water. Leave them like this for several days, until roots have formed from the bottom. Add fresh water once a day or so to keep the slips healthy. If any of the slips are not forming roots or begin to wilt, throw them out."
        },
        {
          "headline":"Get your slips out for planting.",
          "description":"After 2-3 days, your slips should have developed roots at the bottom. At this point, dump out the water in the bowl and bring your slips out for planting. These are best placed directly into your garden rather than in individual planters to keep the roots intact."
        }
      ]
    },
    {
      "name":"Preparing Your Garden",
      "steps":[
        {
          "headline":"Choose a garden plot.",
          "description":"Sweet potatoes grow primarily underground, but their vines grow above the ground. Each vine can grow to be over ten feet long. Make sure your garden plot has plenty of room for the vines. Sweet potatoes prefer a warm environment, so try to choose an area that gets a lot of sunlight (especially if you live in the north) and is well drained."
        },
        {
          "headline":"Till the earth.",
          "description":"Being tubers, sweet potatoes will grow deep in the earth. Make sure they\u2019ll have an easy time of it by tilling the soil about 12 inches (30.5 cm) deep. Get the soil as loose and light as possible, incorporating gardening soil if necessary."
        },
        {
          "headline":"Prepare the soil.",
          "description":"As will all fruit and vegetable planting, having nutrient rich soil is necessary for a bountiful harvest. Add a layer of good planting soil or compost. Remove any large rocks that might be present. Check the pH of your soil. If the pH is not neutral, adjust the pH with peat moss or wood ash to compensate for acidity or alkalinity until it is neutral. This is called amending the soil. You can buy pH testing kits for your garden at a garden center or store."
        },
        {
          "headline":"Know when to plant.",
          "description":"Because of their heat-loving tendencies, sweet potatoes need to have warm soil in order to flourish. Wait till at least a month after the most recent frost, in the beginning of spring, to plant your slips."
        },
        {
          "headline":"Choose a mulch.",
          "description":"Help your sweet potatoes to grow by adding mulch over the top to trap heat. If you are in a particularly cold area, get some black plastic mulch or a similar heat-trapper to place over the potato plants after planting."
        }
      ]
    },
    {
      "name":"Planting Your Sweet Potatoes",
      "steps":[
        {
          "headline":"Dig your holes.",
          "description":"Sweet potato slips need a bit more space than some other garden vegetables, so dig your holes 12\u201324 inches (30.5\u201361.0 cm) apart each. They need be only as deep as the root ball on the bottom of the slips and about \u00bd an inch up the base of the plant."
        },
        {
          "headline":"Plant your potatoes.",
          "description":"Place each small slip in your pre-dug holes and cover the stems with soil about \u00bd of an inch up the base. The leafy part of the potato plant will begin to sprawl in vines outwards while the roots will produce the tubers between 6\u201312 inches (15.2\u201330.5 cm) deep in the soil."
        },
        {
          "headline":"Add your mulch.",
          "description":"Protect your sweet potatoes from cold weather by adding your chosen mulch to the top. This will also help to block out weeds and prevent too much vine growth, which steal energy from tuber growth."
        },
        {
          "headline":"Water the plants.",
          "description":"At first planting the sweet potatoes will require a lot of water. Over time, you should reduce the amount that you water them until they receive moisture only about once a week. Begin watering daily, knocking off days from your watering schedule as each week progresses."
        },
        {
          "headline":"Wait for the tubers to develop.",
          "description":"Sweet potatoes have a relatively long fruiting period, becoming ripe and ready to harvest in the early fall (hence their association with Thanksgiving). Continue watering on a weekly basis, and weeding the beds if necessary to keep the plants healthy."
        },
        {
          "headline":"Harvest the sweet potatoes.",
          "description":"After about 120 days after planting, the sweet potatoes should have reached full maturity. When possible, wait until the last possible time (the last warm weather before a frost) to harvest the sweet potatoes, as this will result in larger and more tasteful tubers."
        },
        {
          "headline":"Cure the sweet potatoes.",
          "description":"One of the most important steps, sweet potatoes must be cured after harvest. This will help them to develop their flavor (they won\u2019t have much immediately after being dug up) and to grow a tougher skin - literally. Place the sweet potatoes in an area with a temperature of 85\u201395 \u00b0F (29\u201335 \u00b0C) with 80-90% humidity for 5-10 days. After this, they should be ready to eat! Consider using a small space heater and a humidifier in a large closet or small room to cure the potatoes."
        },
        {
          "headline":"Store your sweet potatoes.",
          "description":"One of the best things about these lovely tubers is that they will remain fresh and good to eat for many months if stored properly. Keep the potatoes in temperatures hovering around 70 degrees (that means no refrigeration!) in an open, dry area. Never store your sweet potatoes in a plastic bag or tightly sealed container."
        }
      ]
    }
  ],
  "text":" Starting Your Slips Choose a sweet potato. Slips are small sprouts that are grown from pre-existing sweet potato plants. You can choose to order these online or from a garden center, but you can also grow them at home easily. Find a mature, healthy sweet potato plant from the store or a friend\u2019s garden. The most common and popular sweet potato varieties (available at most stores) are Beauregard, \u2018bunch\u2019 Porto Ricos, and centennials. Make sure you have the right climate. Sweet potatoes are a tropical plant. This means that they grow well in USDA hardiness zones 9, 10, and 11. This area includes most of the southern and south-western United States. If starting your own slips, start sprouting them in March or April. Slips should be planted in the ground in May or June. Prepare your potato. When you\u2019ve gotten your hands on 1-2 healthy sweet potatoes, stick them in the sink and wash them well. Then, cut your potato in half. If the potato is particularly large, consider cutting it into thirds or fourths. Fill a jar with water. The way your slip-growing works, is that you\u2019ll place your potato half in/half out of a container of water. Use a jar or a glass cup with an opening large enough to fit your potato, and fill the whole thing with water. Place your potato in the water. Stick 4-5 toothpicks out of the sides of your potato equidistant apart and near the middle, like spokes on a wheel. Place the potato into the jar/glass of water with the cut side down, with the toothpicks holding half of the potato out by balancing it on the rim of the glass. Do this for every slice of potato that you have, with each section in a different jar. Add some light and heat. Move the jar with the potato onto a windowsill that gets a lot of sunlight. Let your slips grow. Wait for 2-4 weeks for the small leafy slips to begin sprouting out of the top of the potato. Harvest the slips. When the top of your potato is covered in slips, carefully twist each one off individually. They won\u2019t have roots yet and will resemble small leaves with a short stem. Put your slips in water. Fill a shallow bowl with a bit of water, around 1\u201d or less depending on the number of slips you have. Set the slips in the bowl so that the stem is submerged in the water. Leave them like this for several days, until roots have formed from the bottom. Add fresh water once a day or so to keep the slips healthy. If any of the slips are not forming roots or begin to wilt, throw them out. Get your slips out for planting. After 2-3 days, your slips should have developed roots at the bottom. At this point, dump out the water in the bowl and bring your slips out for planting. These are best placed directly into your garden rather than in individual planters to keep the roots intact. Preparing Your Garden Choose a garden plot. Sweet potatoes grow primarily underground, but their vines grow above the ground. Each vine can grow to be over ten feet long. Make sure your garden plot has plenty of room for the vines. Sweet potatoes prefer a warm environment, so try to choose an area that gets a lot of sunlight (especially if you live in the north) and is well drained. Till the earth. Being tubers, sweet potatoes will grow deep in the earth. Make sure they\u2019ll have an easy time of it by tilling the soil about 12 inches (30.5 cm) deep. Get the soil as loose and light as possible, incorporating gardening soil if necessary. Prepare the soil. As will all fruit and vegetable planting, having nutrient rich soil is necessary for a bountiful harvest. Add a layer of good planting soil or compost. Remove any large rocks that might be present. Check the pH of your soil. If the pH is not neutral, adjust the pH with peat moss or wood ash to compensate for acidity or alkalinity until it is neutral. This is called amending the soil. You can buy pH testing kits for your garden at a garden center or store. Know when to plant. Because of their heat-loving tendencies, sweet potatoes need to have warm soil in order to flourish. Wait till at least a month after the most recent frost, in the beginning of spring, to plant your slips. Choose a mulch. Help your sweet potatoes to grow by adding mulch over the top to trap heat. If you are in a particularly cold area, get some black plastic mulch or a similar heat-trapper to place over the potato plants after planting. Planting Your Sweet Potatoes Dig your holes. Sweet potato slips need a bit more space than some other garden vegetables, so dig your holes 12\u201324 inches (30.5\u201361.0 cm) apart each. They need be only as deep as the root ball on the bottom of the slips and about \u00bd an inch up the base of the plant. Plant your potatoes. Place each small slip in your pre-dug holes and cover the stems with soil about \u00bd of an inch up the base. The leafy part of the potato plant will begin to sprawl in vines outwards while the roots will produce the tubers between 6\u201312 inches (15.2\u201330.5 cm) deep in the soil. Add your mulch. Protect your sweet potatoes from cold weather by adding your chosen mulch to the top. This will also help to block out weeds and prevent too much vine growth, which steal energy from tuber growth. Water the plants. At first planting the sweet potatoes will require a lot of water. Over time, you should reduce the amount that you water them until they receive moisture only about once a week. Begin watering daily, knocking off days from your watering schedule as each week progresses. Wait for the tubers to develop. Sweet potatoes have a relatively long fruiting period, becoming ripe and ready to harvest in the early fall (hence their association with Thanksgiving). Continue watering on a weekly basis, and weeding the beds if necessary to keep the plants healthy. Harvest the sweet potatoes. After about 120 days after planting, the sweet potatoes should have reached full maturity. When possible, wait until the last possible time (the last warm weather before a frost) to harvest the sweet potatoes, as this will result in larger and more tasteful tubers. Cure the sweet potatoes. One of the most important steps, sweet potatoes must be cured after harvest. This will help them to develop their flavor (they won\u2019t have much immediately after being dug up) and to grow a tougher skin - literally. Place the sweet potatoes in an area with a temperature of 85\u201395 \u00b0F (29\u201335 \u00b0C) with 80-90% humidity for 5-10 days. After this, they should be ready to eat! Consider using a small space heater and a humidifier in a large closet or small room to cure the potatoes. Store your sweet potatoes. One of the best things about these lovely tubers is that they will remain fresh and good to eat for many months if stored properly. Keep the potatoes in temperatures hovering around 70 degrees (that means no refrigeration!) in an open, dry area. Never store your sweet potatoes in a plastic bag or tightly sealed container.",
  "tyn_model":[
    "sweet potatoes",
    "water",
    "potato",
    "sweet potato",
    "jar",
    "mulch",
    "bowl",
    "potatoes",
    "\u2018bunch",
    "\u2019 porto",
    "container",
    "glass",
    "\u201d or",
    "compost",
    "peat moss",
    "wood ash",
    "garden center or store",
    "black plastic mulch",
    "heat-trapper",
    "soil",
    "humidifier"
  ],
  "tyn_section":[

  ]
}