{
  "title":"How to Wash Your Car Using Less Water",
  "url":"https://www.wikihow.com/Wash-Your-Car-Using-Less-Water",
  "category_hierarchy":[
    "Home and Garden",
    "DIY"
  ],
  "methods":[
    {
      "name":"Using One Cup of Water",
      "steps":[
        {
          "headline":"Purchase a waterless car cleaner.",
          "description":"There are various waterless car cleaners on the market. Take a look at critical and user reviews for different brands. Relate customer experiences and choose the brand that you trust the most. Waterless car cleaners can be purchased at some department stores, most major automotive retailers, and online. Some popular brands of waterless car wash include, Meguiar\u2019s Wash & Wax Anywhere, WOW Classic & Sports Box Kit, and Eco Touch Waterless Car Wash. Some car washes like Eco Touch Waterless Car Wash use eco-friendly or biodegradable ingredients that aren't harmful to the environment."
        },
        {
          "headline":"Dampen a microfiber towel with a waterless car cleaning solution.",
          "description":"Soak a microfiber tower with a cleaning solution produced specifically to clean cars. Waterless cleaning solutions allow you to wash your car with minimal or no water. Make sure that cloth is completely saturated before beginning to clean your car. Microfiber cloth is non-abrasive and works better than regular rags at cleaning your car and preserving its paint. Do not use a household soap or dish detergent because it could strip the protective wax from your car."
        },
        {
          "headline":"Spray your car with the same cleaning solution.",
          "description":"Fill a spray bottle or use one that comes with your product to moisten a small section of the car that you want to clean. You should only need three to four sprays for this. Do not spray over the entirety of the car because the solution could dry before you get to wipe it. Work in small concentrated sections of the car before moving onto another section. Get a car cleaning solution that helps break down dirt rather than moving it."
        },
        {
          "headline":"Wipe your car in a circular motion with your cloth.",
          "description":"Take the cloth saturated with your cleaning solution and work it into the surface of the car. You should start to see the solution start to sud or streak across where you are wiping. Go over each area for around 10-30 seconds. Start in small areas and move around the car. For example, you can start on the hood of the car then move your way to the passenger side door."
        },
        {
          "headline":"Rinse off the cleaning solution with a damp microfiber cloth.",
          "description":"Place your microfiber cloth in a bucket filled with a cup of water, or run it under your sink for five seconds. Once it's saturated, go over the areas that you scrubbed with your cleaning solution. Continue to do this until the remainder of the solution is off your car, and there is no leftover residue or fogginess."
        },
        {
          "headline":"Dry the area with a dry microfiber cloth.",
          "description":"Once the area is rinsed, work the area in a circular motion with a dry microfiber cloth. Once you're done drying it, the area that you've cleaned should look shiny and reflective. Make sure that you dry each section thoroughly so that you aren't leaving any chemicals behind on your paint. As an alternative, you can also use a squeegee to help dry areas of your car."
        },
        {
          "headline":"Repeat until your car is completely clean.",
          "description":"Repeat the process and move to different portions of your car until the entirety of the car is clean. During this process, you may have to use a lot of microfiber cloth, so make sure to be as conservative as possible and reuse them when you can."
        }
      ]
    },
    {
      "name":"Reducing Your Water Usage",
      "steps":[
        {
          "headline":"Purchase a nozzle for your hose.",
          "description":"If you don't have a bucket and must use a hose, make sure that you buy a nozzle that will allow you to regulate water flow. The average hose will waste 10 gallons of water per minute, meaning that for a 10-minute wash, you'll have used 100 gallons of water. A turnoff nozzle will allow you to rinse your car quickly and turn off your hose while you scrub again. You can purchase a nozzle for your hose at most home and gardening and department stores. The cost of hose nozzles range from $14 to $20."
        },
        {
          "headline":"Research eco-friendly car washes in your area.",
          "description":"The average car wash uses less water on average than doing it yourself. Search for eco-friendly car wash businesses that actively try to reduce their water usage. There are also other car washes that recycle harmful chemicals like dust, sediment, and detergents and prevent them from entering the stormwater system. Some cities that experience regular droughts have banned residential car washing. On average, professional car washes will only use 14-18 gallons of water to wash your car. EXPERT TIP\t\"Eco-friendly car washes may use as little as 7 gallons of water to wash your car.\" Kathryn Kellogg\t\t\t\t\tAuthor, 101 Ways to Go Zero Waste\t\t\t\t\t\t\t\tKathryn Kellogg is the founder of goingzerowaste.com, a lifestyle website dedicated to breaking eco-friendly living down into a simple step-by-step process with lots of positivity and love. She's the author of 101 Ways to Go Zero Waste and spokesperson for plastic-free living for National Geographic. Kathryn KelloggAuthor, 101 Ways to Go Zero Waste"
        },
        {
          "headline":"Use a bucket of water instead of an open hose.",
          "description":"Using a bucket and a wet sponge or rag to rinse your vehicle will help you save water. Fill your buckets with three gallons or less of water. Instead of washing your car down with a garden hose, rinse your car by using a wet rag or sponge dipped in clean water. When your water gets dirty, empty it out and get a fresh bucket. Separating your buckets of water by soapy and clear water will prevent you from having to replace it continually. EXPERT TIP\t\t\t\t\t\t\t\t\t\t\t\t\t\t\t\t\t\t\t\t\t\t\t\t\t\t\t\t\t\t\tKathryn Kellogg\t\t\t\t\t\t\t\t\t\t\t\t\t\t\t\tAuthor, 101 Ways to Go Zero Waste\t\t\t\t\t\t\t\tKathryn Kellogg is the founder of goingzerowaste.com, a lifestyle website dedicated to breaking eco-friendly living down into a simple step-by-step process with lots of positivity and love. She's the author of 101 Ways to Go Zero Waste and spokesperson for plastic-free living for National Geographic. Kathryn Kellogg\t\t\tAuthor, 101 Ways to Go Zero Waste\t\t\t\tWashing your car at home can help you conserve water. Kathryn Kellogg, author of 101 Ways to Go Zero Waste, says: \"If you want to waste less water while washing your car, fill a bucket with water and biodegradable soap. Sponge down the car with the soapy water, then rinse off the car and dry it with a towel.\""
        },
        {
          "headline":"Wash your car less.",
          "description":"An easy way to reduce the amount of water you're using to wash your car is simply to lessen the frequency in which you are washing it. Determine how much time elapses between washings and adjust it to a longer span of time. For instance, if you wash your car every two weeks, consider trying to go without a car wash for two months. Citizens in Los Angeles, California took a pledge not to wash their cars for 60 days as a response to an ongoing drought."
        },
        {
          "headline":"Wash your car in a shaded area.",
          "description":"Sunlight can cause water to evaporate quicker, which could increase the amount of water you need to use to rinse off your car. Find some shade, such as under foliage or an outdoor roof."
        }
      ]
    }
  ],
  "text":" Using One Cup of Water Purchase a waterless car cleaner. There are various waterless car cleaners on the market. Take a look at critical and user reviews for different brands. Relate customer experiences and choose the brand that you trust the most. Waterless car cleaners can be purchased at some department stores, most major automotive retailers, and online. Some popular brands of waterless car wash include, Meguiar\u2019s Wash & Wax Anywhere, WOW Classic & Sports Box Kit, and Eco Touch Waterless Car Wash. Some car washes like Eco Touch Waterless Car Wash use eco-friendly or biodegradable ingredients that aren't harmful to the environment. Dampen a microfiber towel with a waterless car cleaning solution. Soak a microfiber tower with a cleaning solution produced specifically to clean cars. Waterless cleaning solutions allow you to wash your car with minimal or no water. Make sure that cloth is completely saturated before beginning to clean your car. Microfiber cloth is non-abrasive and works better than regular rags at cleaning your car and preserving its paint. Do not use a household soap or dish detergent because it could strip the protective wax from your car. Spray your car with the same cleaning solution. Fill a spray bottle or use one that comes with your product to moisten a small section of the car that you want to clean. You should only need three to four sprays for this. Do not spray over the entirety of the car because the solution could dry before you get to wipe it. Work in small concentrated sections of the car before moving onto another section. Get a car cleaning solution that helps break down dirt rather than moving it. Wipe your car in a circular motion with your cloth. Take the cloth saturated with your cleaning solution and work it into the surface of the car. You should start to see the solution start to sud or streak across where you are wiping. Go over each area for around 10-30 seconds. Start in small areas and move around the car. For example, you can start on the hood of the car then move your way to the passenger side door. Rinse off the cleaning solution with a damp microfiber cloth. Place your microfiber cloth in a bucket filled with a cup of water, or run it under your sink for five seconds. Once it's saturated, go over the areas that you scrubbed with your cleaning solution. Continue to do this until the remainder of the solution is off your car, and there is no leftover residue or fogginess. Dry the area with a dry microfiber cloth. Once the area is rinsed, work the area in a circular motion with a dry microfiber cloth. Once you're done drying it, the area that you've cleaned should look shiny and reflective. Make sure that you dry each section thoroughly so that you aren't leaving any chemicals behind on your paint. As an alternative, you can also use a squeegee to help dry areas of your car. Repeat until your car is completely clean. Repeat the process and move to different portions of your car until the entirety of the car is clean. During this process, you may have to use a lot of microfiber cloth, so make sure to be as conservative as possible and reuse them when you can. Reducing Your Water Usage Purchase a nozzle for your hose. If you don't have a bucket and must use a hose, make sure that you buy a nozzle that will allow you to regulate water flow. The average hose will waste 10 gallons of water per minute, meaning that for a 10-minute wash, you'll have used 100 gallons of water. A turnoff nozzle will allow you to rinse your car quickly and turn off your hose while you scrub again. You can purchase a nozzle for your hose at most home and gardening and department stores. The cost of hose nozzles range from $14 to $20. Research eco-friendly car washes in your area. The average car wash uses less water on average than doing it yourself. Search for eco-friendly car wash businesses that actively try to reduce their water usage. There are also other car washes that recycle harmful chemicals like dust, sediment, and detergents and prevent them from entering the stormwater system. Some cities that experience regular droughts have banned residential car washing. On average, professional car washes will only use 14-18 gallons of water to wash your car. EXPERT TIP\t\"Eco-friendly car washes may use as little as 7 gallons of water to wash your car.\" Kathryn Kellogg\t\t\t\t\tAuthor, 101 Ways to Go Zero Waste\t\t\t\t\t\t\t\tKathryn Kellogg is the founder of goingzerowaste.com, a lifestyle website dedicated to breaking eco-friendly living down into a simple step-by-step process with lots of positivity and love. She's the author of 101 Ways to Go Zero Waste and spokesperson for plastic-free living for National Geographic. Kathryn KelloggAuthor, 101 Ways to Go Zero Waste Use a bucket of water instead of an open hose. Using a bucket and a wet sponge or rag to rinse your vehicle will help you save water. Fill your buckets with three gallons or less of water. Instead of washing your car down with a garden hose, rinse your car by using a wet rag or sponge dipped in clean water. When your water gets dirty, empty it out and get a fresh bucket. Separating your buckets of water by soapy and clear water will prevent you from having to replace it continually. EXPERT TIP\t\t\t\t\t\t\t\t\t\t\t\t\t\t\t\t\t\t\t\t\t\t\t\t\t\t\t\t\t\t\tKathryn Kellogg\t\t\t\t\t\t\t\t\t\t\t\t\t\t\t\tAuthor, 101 Ways to Go Zero Waste\t\t\t\t\t\t\t\tKathryn Kellogg is the founder of goingzerowaste.com, a lifestyle website dedicated to breaking eco-friendly living down into a simple step-by-step process with lots of positivity and love. She's the author of 101 Ways to Go Zero Waste and spokesperson for plastic-free living for National Geographic. Kathryn Kellogg\t\t\tAuthor, 101 Ways to Go Zero Waste\t\t\t\tWashing your car at home can help you conserve water. Kathryn Kellogg, author of 101 Ways to Go Zero Waste, says: \"If you want to waste less water while washing your car, fill a bucket with water and biodegradable soap. Sponge down the car with the soapy water, then rinse off the car and dry it with a towel.\" Wash your car less. An easy way to reduce the amount of water you're using to wash your car is simply to lessen the frequency in which you are washing it. Determine how much time elapses between washings and adjust it to a longer span of time. For instance, if you wash your car every two weeks, consider trying to go without a car wash for two months. Citizens in Los Angeles, California took a pledge not to wash their cars for 60 days as a response to an ongoing drought. Wash your car in a shaded area. Sunlight can cause water to evaporate quicker, which could increase the amount of water you need to use to rinse off your car. Find some shade, such as under foliage or an outdoor roof.",
  "tyn_model":[
    "water",
    "microfiber cloth",
    "bucket",
    "hose",
    "buckets",
    "waterless car cleaner",
    "waterless car cleaners",
    "eco touch waterless car wash.",
    "microfiber towel",
    "waterless car cleaning solution",
    "microfiber tower",
    "household soap",
    "spray bottle",
    "car cleaning solution",
    "cloth",
    "paint",
    "squeegee",
    "nozzle",
    "hose nozzles",
    "car wash",
    "eco-friendly living down",
    "garden hose",
    "sponge",
    "eco-friendly living",
    "biodegradable soap"
  ],
  "tyn_section":[

  ]
}