{
  "title":"How to Clean Keycaps",
  "url":"https://www.wikihow.com/Clean-Keycaps",
  "category_hierarchy":[
    "Home and Garden",
    "Housekeeping",
    "Cleaning"
  ],
  "parts":[
    {
      "name":"Removing the Keycaps",
      "steps":[
        {
          "headline":"Take a photo of your keyboard so you remember where the keys go.",
          "description":"You don\u2019t want to forget this layout once you\u2019re ready to put the keycaps back on. If you're not able to take your own photo, look up an online image of a similar keyboard so you know where everything goes."
        },
        {
          "headline":"Unplug the keyboard from the computer.",
          "description":"If you have a newer computer, it's probably plugged into a USB port. If it's an older computer, look for the purple-colored connector called a PS/2. If the keyboard is plugged into a PS/2 port, make sure to shut down your computer before unplugging it."
        },
        {
          "headline":"Use a wire keycap puller to remove the keycaps.",
          "description":"This is safer than using a tool like a screwdriver. Wire keycap pullers are less likely to scratch the keys than plastic ones. They have a handle and two wire loops, and are simple to use. You can find inexpensive options on sites like Amazon. Place the wire loops opposite each other diagonally on the key and gently wiggle back and forth while pulling up."
        },
        {
          "headline":"Avoid removing large keycaps.",
          "description":"This includes the spacebar, enter, and shift. These keys may have wires to stabilize them, making them more difficult to remove. You can dampen a microfiber cloth to wipe the keycaps you don\u2019t remove."
        }
      ]
    },
    {
      "name":"Leaving the Keycaps to Soak",
      "steps":[
        {
          "headline":"Place the keycaps in a bowl of warm water.",
          "description":"Don\u2019t make the water too hot. You can also add a couple of denture tablets to the bowl to help remove oils from the keycaps. Dish soap is another option, but it can be harder to rinse away. Do not use bleach, as it can fade plastics."
        },
        {
          "headline":"Let the keycaps soak for 6 hours.",
          "description":"You can use some of this time to clean the keyboard itself by shaking it out over a trash can. Loosen up stubborn gunk with a stiff-bristle brush or Q-tip. Avoid the switch stems when brushing. This will keep particles from becoming lodged too deep. Use a handheld vacuum to suck up loose debris."
        },
        {
          "headline":"Rinse the keycaps in the sink.",
          "description":"Make sure you get any residue from the denture cleaner or dish soap off the keys. You can use a strainer for this step. If there\u2019s still some grime on any of the keycaps, use a toothbrush to scrub it off."
        },
        {
          "headline":"Leave the keycaps out to air dry.",
          "description":"Make sure you lay the the keycaps stem up while they dry, so the water can evaporate. You may want to leave them out for 24 hours, to make sure they\u2019re completely dry and won\u2019t damage your computer. Don\u2019t use a paper towel to dry the keycaps, as this can scratch the surface and leave particles behind."
        }
      ]
    },
    {
      "name":"Putting the Keycaps Back",
      "steps":[
        {
          "headline":"Match the placement of the keycaps to the photo of your keyboard.",
          "description":"Make sure you put all the keys back carefully in their proper places and facing the correct direction. To pop the keycaps back on, just push them straight down over the switch."
        },
        {
          "headline":"Reattach the keyboard to the computer.",
          "description":"If you have a PS/2 connector, remember to match up the color (usually purple) to the correct port. Turn your computer back on if it's shut down. Now your keyboard is clean and ready to use."
        },
        {
          "headline":"Clean your keyboard regularly without removing the keycaps.",
          "description":"You can do this once a week or whenever things are starting to look dirty. Use a handheld vacuum or a damp microfiber cloth. Dry it off with another cloth, not a paper towel. Make sure the keyboard is unplugged before you clean it. If you prefer, you can use a cleaning wipe."
        },
        {
          "headline":"Avoid eating or drinking near your keyboard.",
          "description":"This will prevent crumbs and other build-up, so you won't have to clean the keycaps as often. Keeping drinks away from your keyboard will also prevent damaging spills."
        }
      ]
    }
  ],
  "text":" Removing the Keycaps Take a photo of your keyboard so you remember where the keys go. You don\u2019t want to forget this layout once you\u2019re ready to put the keycaps back on. If you're not able to take your own photo, look up an online image of a similar keyboard so you know where everything goes. Unplug the keyboard from the computer. If you have a newer computer, it's probably plugged into a USB port. If it's an older computer, look for the purple-colored connector called a PS/2. If the keyboard is plugged into a PS/2 port, make sure to shut down your computer before unplugging it. Use a wire keycap puller to remove the keycaps. This is safer than using a tool like a screwdriver. Wire keycap pullers are less likely to scratch the keys than plastic ones. They have a handle and two wire loops, and are simple to use. You can find inexpensive options on sites like Amazon. Place the wire loops opposite each other diagonally on the key and gently wiggle back and forth while pulling up. Avoid removing large keycaps. This includes the spacebar, enter, and shift. These keys may have wires to stabilize them, making them more difficult to remove. You can dampen a microfiber cloth to wipe the keycaps you don\u2019t remove. Leaving the Keycaps to Soak Place the keycaps in a bowl of warm water. Don\u2019t make the water too hot. You can also add a couple of denture tablets to the bowl to help remove oils from the keycaps. Dish soap is another option, but it can be harder to rinse away. Do not use bleach, as it can fade plastics. Let the keycaps soak for 6 hours. You can use some of this time to clean the keyboard itself by shaking it out over a trash can. Loosen up stubborn gunk with a stiff-bristle brush or Q-tip. Avoid the switch stems when brushing. This will keep particles from becoming lodged too deep. Use a handheld vacuum to suck up loose debris. Rinse the keycaps in the sink. Make sure you get any residue from the denture cleaner or dish soap off the keys. You can use a strainer for this step. If there\u2019s still some grime on any of the keycaps, use a toothbrush to scrub it off. Leave the keycaps out to air dry. Make sure you lay the the keycaps stem up while they dry, so the water can evaporate. You may want to leave them out for 24 hours, to make sure they\u2019re completely dry and won\u2019t damage your computer. Don\u2019t use a paper towel to dry the keycaps, as this can scratch the surface and leave particles behind. Putting the Keycaps Back Match the placement of the keycaps to the photo of your keyboard. Make sure you put all the keys back carefully in their proper places and facing the correct direction. To pop the keycaps back on, just push them straight down over the switch. Reattach the keyboard to the computer. If you have a PS/2 connector, remember to match up the color (usually purple) to the correct port. Turn your computer back on if it's shut down. Now your keyboard is clean and ready to use. Clean your keyboard regularly without removing the keycaps. You can do this once a week or whenever things are starting to look dirty. Use a handheld vacuum or a damp microfiber cloth. Dry it off with another cloth, not a paper towel. Make sure the keyboard is unplugged before you clean it. If you prefer, you can use a cleaning wipe. Avoid eating or drinking near your keyboard. This will prevent crumbs and other build-up, so you won't have to clean the keycaps as often. Keeping drinks away from your keyboard will also prevent damaging spills.",
  "tyn_model":[
    "computer",
    "keyboard",
    "water",
    "microfiber cloth",
    "bowl",
    "dish soap",
    "vacuum",
    "usb",
    "wire keycap puller",
    "screwdriver",
    "denture tablets",
    "bleach",
    "stiff-bristle brush",
    "q-tip",
    "denture cleaner",
    "strainer",
    "toothbrush",
    "drinks"
  ],
  "tyn_section":[

  ]
}