{
  "title":"How to Clean a Milk Frother",
  "url":"https://www.wikihow.com/Clean-a-Milk-Frother",
  "category_hierarchy":[
    "Home and Garden",
    "Housekeeping",
    "Cleaning"
  ],
  "parts":[
    {
      "name":"Cleaning a Handheld Milk Frother",
      "steps":[
        {
          "headline":"Turn your milk frother off.",
          "description":"Turn your milk frother off. Unplug it if the tool runs on electricity. Let the device cool down."
        },
        {
          "headline":"Hold the dirty wand with the whisk under a faucet and hand-wash it with warm water.",
          "description":"Be gentle when you clean around the coil so that you don't break it. Use a brush to clean the coil, if it holds any milk residue. If the wand has any limestone deposits, soak its whisking part in warm water with lemon juice/citric acid or other cleaners that eliminate milk buildup. You may also submerge the dirty whisk in a vessel with warm water and let the device spin for several seconds."
        },
        {
          "headline":"Place the frother in warm soapy water and turn it on.",
          "description":"Give your frother a periodic thorough cleaning with a thick cleaning detergent to prevent the formation of milk deposits. Sanitation with a detergent extends the service life of the tool."
        },
        {
          "headline":"Add some soapy solution in a vessel with hot water.",
          "description":"Dip the whisk into the soapy water and turn the frother on for several seconds. Keep the electric parts of the frother away from water. You may use dish liquid or liquid soap."
        },
        {
          "headline":"Rinse the frother under running water or immerse it in a vessel with pure water and turn it on.",
          "description":"Let the device work for 10-15 seconds to wash away the remnants of the cleaning agent. You can repeat this stage several times. Use clear water each time. Give the wand a thorough rinsing if any detergent has been used."
        },
        {
          "headline":"Turn the frother on to let the whisk dry.",
          "description":"If there are dirty spots on the handle, wipe it with a damp cloth. Clean the cord with a wet fabric and dry it with a clean paper towel."
        }
      ]
    },
    {
      "name":"Cleaning an Electric Milk Frother",
      "steps":[
        {
          "headline":"Turn the frother off.",
          "description":"Make sure that all the items that you are going to clean are not heated up. Unplug the tool from the outlet."
        },
        {
          "headline":"Dismantle all of the removable parts.",
          "description":"Put them aside, somewhere away from the sink. Remove the milk jug from the base. Detach other removable parts of the frother, like the frothing and heating disks. Both the base and the pitcher are not compatible with dishwashers and should be hand-washed. If the lid of the device has a seal, remove it, as well."
        },
        {
          "headline":"Rinse the carafe inside with warm running water.",
          "description":"If there is any caked milk remaining on the bottom, wash it off with a non-abrasive sponge. You may use dish liquid or any other soft detergent. If you notice any limestone deposits, scrub them gently. You can also use citric acid or lemon juice. You can also use citric acid or lemon juice. Apply other cleaners that break down milk protein buildup. Don\u2019t scratch the non-stick surface inside the carafe."
        },
        {
          "headline":"Pour some liquid in the carafe and leave it to soak for 1-2 hours, then give the jar a good rinse with pure water.",
          "description":"You may also make a paste from bicarbonate of soda and water. Apply it on the bottom of the carafe for 10-15 minutes. Do not use knives or other metal objects to clean the burnt milk residue. Don\u2019t expose the electric part of the device to moisture."
        },
        {
          "headline":"Rinse it with warm water.",
          "description":"All the detached attachments should be hand-washed separately with warm soapy water."
        },
        {
          "headline":"Clean the frothing disks under a tap with warm water.",
          "description":"If necessary, add dish soap and clean them with a brush. Do not damage the fragile whisks during cleanup."
        },
        {
          "headline":"Clean the exterior with a soft cloth.",
          "description":"Don\u2019t use any chemicals for cleaning the stainless steel, because they may cause rust and discoloration."
        },
        {
          "headline":"Wipe the device with a dry cloth before storing.",
          "description":"Dab all the screws with kitchen roll paper. Make sure that they are all dry before storing."
        },
        {
          "headline":"Assemble all of the parts after they are dry.",
          "description":"Place the disks in their position or in the storage compartment. Attach the seal back to the lid."
        }
      ]
    }
  ],
  "text":" Cleaning a Handheld Milk Frother Turn your milk frother off. Turn your milk frother off. Unplug it if the tool runs on electricity. Let the device cool down. Hold the dirty wand with the whisk under a faucet and hand-wash it with warm water. Be gentle when you clean around the coil so that you don't break it. Use a brush to clean the coil, if it holds any milk residue. If the wand has any limestone deposits, soak its whisking part in warm water with lemon juice/citric acid or other cleaners that eliminate milk buildup. You may also submerge the dirty whisk in a vessel with warm water and let the device spin for several seconds. Place the frother in warm soapy water and turn it on. Give your frother a periodic thorough cleaning with a thick cleaning detergent to prevent the formation of milk deposits. Sanitation with a detergent extends the service life of the tool. Add some soapy solution in a vessel with hot water. Dip the whisk into the soapy water and turn the frother on for several seconds. Keep the electric parts of the frother away from water. You may use dish liquid or liquid soap. Rinse the frother under running water or immerse it in a vessel with pure water and turn it on. Let the device work for 10-15 seconds to wash away the remnants of the cleaning agent. You can repeat this stage several times. Use clear water each time. Give the wand a thorough rinsing if any detergent has been used. Turn the frother on to let the whisk dry. If there are dirty spots on the handle, wipe it with a damp cloth. Clean the cord with a wet fabric and dry it with a clean paper towel. Cleaning an Electric Milk Frother Turn the frother off. Make sure that all the items that you are going to clean are not heated up. Unplug the tool from the outlet. Dismantle all of the removable parts. Put them aside, somewhere away from the sink. Remove the milk jug from the base. Detach other removable parts of the frother, like the frothing and heating disks. Both the base and the pitcher are not compatible with dishwashers and should be hand-washed. If the lid of the device has a seal, remove it, as well. Rinse the carafe inside with warm running water. If there is any caked milk remaining on the bottom, wash it off with a non-abrasive sponge. You may use dish liquid or any other soft detergent. If you notice any limestone deposits, scrub them gently. You can also use citric acid or lemon juice. You can also use citric acid or lemon juice. Apply other cleaners that break down milk protein buildup. Don\u2019t scratch the non-stick surface inside the carafe. Pour some liquid in the carafe and leave it to soak for 1-2 hours, then give the jar a good rinse with pure water. You may also make a paste from bicarbonate of soda and water. Apply it on the bottom of the carafe for 10-15 minutes. Do not use knives or other metal objects to clean the burnt milk residue. Don\u2019t expose the electric part of the device to moisture. Rinse it with warm water. All the detached attachments should be hand-washed separately with warm soapy water. Clean the frothing disks under a tap with warm water. If necessary, add dish soap and clean them with a brush. Do not damage the fragile whisks during cleanup. Clean the exterior with a soft cloth. Don\u2019t use any chemicals for cleaning the stainless steel, because they may cause rust and discoloration. Wipe the device with a dry cloth before storing. Dab all the screws with kitchen roll paper. Make sure that they are all dry before storing. Assemble all of the parts after they are dry. Place the disks in their position or in the storage compartment. Attach the seal back to the lid.",
  "tyn_model":[
    "water",
    "whisk",
    "lemon juice",
    "milk frother",
    "dish liquid",
    "milk",
    "citric acid",
    "carafe",
    "thick cleaning detergent",
    "liquid soap",
    "cleaning agent",
    "electric milk frother",
    "milk jug",
    "pitcher",
    "dishwashers",
    "sponge",
    "soda",
    "soapy water",
    "tap",
    "dish soap",
    "kitchen roll paper"
  ],
  "tyn_section":[

  ]
}