{
  "title":"How to Drink Camel Milk",
  "url":"https://www.wikihow.com/Drink-Camel-Milk",
  "category_hierarchy":[
    "Food and Entertaining",
    "Drinks",
    "Smoothies Shakes and Milk"
  ],
  "parts":[
    {
      "name":"Drinking Camel Milk Plain",
      "steps":[
        {
          "headline":"Enjoy camel milk as its own beverage.",
          "description":"Camel milk tastes similar to cow milk, so there is no need to add anything to offset the taste. It is also healthier than milk from other animals because it has less lactose, the sugar found in milk. Make sure to only drink the pasteurized version, as consuming raw camel milk can leave you exposed to animal-based pathogens."
        },
        {
          "headline":"Consume camel milk at any time of day.",
          "description":"Camel milk is a filling beverage, which means it can be had as a snack whenever you are craving it. Many people drink camel milk as part of their breakfast, while others enjoy it best as a midnight treat. There is no limit to how much camel milk you can have in a day. Camel milk is effective when consumed midday, as it can give you a boost of energy."
        },
        {
          "headline":"Use camel milk before or after exercising.",
          "description":"Camel milk provides the energy and nutrition needed to get through a long day. Drinking it before or after working out is a great way to keep your heart healthy. Camel milk can both get you ready for a strenuous workout and replenish your body after you've hit the gym. The enzymes found in camel milk help your body fight off bacteria."
        }
      ]
    },
    {
      "name":"Mixing Camel Milk with other Drinks and Food",
      "steps":[
        {
          "headline":"Put camel milk in your coffee.",
          "description":"Camel milk mixes seamlessly with coffee and is a great way to kickstart your day. A healthy way to keep your productivity up, camel milk is perfect for anyone feeling sluggish mid-week."
        },
        {
          "headline":"Dip cookies into camel milk.",
          "description":"Camel milk contains a small hint of saltiness, which helps it harmonize with cookies. Chocolate chip cookies work well, as dipping them in camel milk creates a delicious and balanced sweet-and-salty snack. You can't go wrong with other cookies, as the sweetness is what is key to having it with camel milk."
        },
        {
          "headline":"Cook with camel milk when recipes call for milk.",
          "description":"Camel milk can be used in place of cow milk when it comes to cooking. Any dish that you would prepare using cow milk can be made with camel milk. This includes various cheeses and yogurt. Camel milk makes Feta cheese in particular especially tasty."
        }
      ]
    },
    {
      "name":"Buying and Storing Camel Milk",
      "steps":[
        {
          "headline":"Try to find camel milk in health food stores.",
          "description":"Though camel milk is not yet widely available in the United States, it can be found in some grocery chains and health food stores. Whole Foods sells the product in its stores across the country, while California is home to many smaller shops that sell camel milk."
        },
        {
          "headline":"Buy camel milk online if you can't find any in local stores.",
          "description":"The easiest way for most people to get camel milk is to purchase it on the internet, as many companies that make the product also sell it online. Keep in mind that camels produce less milk than other animals, like cows, so it is not cheap. Camels can produce up to two gallons of milk per day, while cows can give around 12 gallons of milk per day."
        },
        {
          "headline":"Refrigerate the camel milk you buy.",
          "description":"Camel milk must be stored at 40 degrees Fahrenheit or colder. Camel milk generally has a longer shelf life than cow milk, so it can be kept in your fridge for a few weeks without spoiling. Fresh camel milk can keep for up to a week, while cow milk can turn sour within two days."
        },
        {
          "headline":"Purchase camel milk carefully.",
          "description":"Camel milk is still something of a niche beverage, so shop for it smartly. Whereas a gallon of cow milk goes for a little more than three dollars on average, a 16-ounce bottle of camel milk can run you about 18 dollars. Camel milk is also available in powder form, but a 200-gram packet can costs nearly 80 dollars. These prices do not account for taxes or shipping and handling fees."
        }
      ]
    }
  ],
  "text":" Drinking Camel Milk Plain Enjoy camel milk as its own beverage. Camel milk tastes similar to cow milk, so there is no need to add anything to offset the taste. It is also healthier than milk from other animals because it has less lactose, the sugar found in milk. Make sure to only drink the pasteurized version, as consuming raw camel milk can leave you exposed to animal-based pathogens. Consume camel milk at any time of day. Camel milk is a filling beverage, which means it can be had as a snack whenever you are craving it. Many people drink camel milk as part of their breakfast, while others enjoy it best as a midnight treat. There is no limit to how much camel milk you can have in a day. Camel milk is effective when consumed midday, as it can give you a boost of energy. Use camel milk before or after exercising. Camel milk provides the energy and nutrition needed to get through a long day. Drinking it before or after working out is a great way to keep your heart healthy. Camel milk can both get you ready for a strenuous workout and replenish your body after you've hit the gym. The enzymes found in camel milk help your body fight off bacteria. Mixing Camel Milk with other Drinks and Food Put camel milk in your coffee. Camel milk mixes seamlessly with coffee and is a great way to kickstart your day. A healthy way to keep your productivity up, camel milk is perfect for anyone feeling sluggish mid-week. Dip cookies into camel milk. Camel milk contains a small hint of saltiness, which helps it harmonize with cookies. Chocolate chip cookies work well, as dipping them in camel milk creates a delicious and balanced sweet-and-salty snack. You can't go wrong with other cookies, as the sweetness is what is key to having it with camel milk. Cook with camel milk when recipes call for milk. Camel milk can be used in place of cow milk when it comes to cooking. Any dish that you would prepare using cow milk can be made with camel milk. This includes various cheeses and yogurt. Camel milk makes Feta cheese in particular especially tasty. Buying and Storing Camel Milk Try to find camel milk in health food stores. Though camel milk is not yet widely available in the United States, it can be found in some grocery chains and health food stores. Whole Foods sells the product in its stores across the country, while California is home to many smaller shops that sell camel milk. Buy camel milk online if you can't find any in local stores. The easiest way for most people to get camel milk is to purchase it on the internet, as many companies that make the product also sell it online. Keep in mind that camels produce less milk than other animals, like cows, so it is not cheap. Camels can produce up to two gallons of milk per day, while cows can give around 12 gallons of milk per day. Refrigerate the camel milk you buy. Camel milk must be stored at 40 degrees Fahrenheit or colder. Camel milk generally has a longer shelf life than cow milk, so it can be kept in your fridge for a few weeks without spoiling. Fresh camel milk can keep for up to a week, while cow milk can turn sour within two days. Purchase camel milk carefully. Camel milk is still something of a niche beverage, so shop for it smartly. Whereas a gallon of cow milk goes for a little more than three dollars on average, a 16-ounce bottle of camel milk can run you about 18 dollars. Camel milk is also available in powder form, but a 200-gram packet can costs nearly 80 dollars. These prices do not account for taxes or shipping and handling fees.",
  "tyn_model":[
    "camel milk",
    "milk",
    "coffee",
    "cow milk",
    "cookies",
    "chocolate chip cookies",
    "yogurt",
    "feta cheese",
    "camels"
  ],
  "tyn_section":[

  ]
}