{
  "title":"How to Clean Pewter",
  "url":"https://www.wikihow.com/Clean-Pewter",
  "category_hierarchy":[
    "Home and Garden",
    "Housekeeping",
    "Cleaning"
  ],
  "methods":[
    {
      "name":"Washing with Soap and Water",
      "steps":[
        {
          "headline":"Dust your decorative pewter pieces.",
          "description":"This should be done regularly even while you\u2019re not washing or polishing the pewter. Use a duster or a soft cloth such as a microfiber cloth to remove all the dust clinging to the pieces. The more you do this, the longer you\u2019ll preserve the finish and the less you\u2019ll need to wash and polish the pieces."
        },
        {
          "headline":"Fill a bucket with hot water.",
          "description":"Warm water is acceptable, but hot water will make removing grime easier. You can also fill a sink or use running water from the tap."
        },
        {
          "headline":"Add soap.",
          "description":"Choose a mild dishwashing liquid. Avoid using anything abrasive, as these products will wear away at the finish and scratch the pewter. Squirt a little soap in your bucket or water container. Baby shampoo is also a non-abrasive detergent that can be used to clean pewter."
        },
        {
          "headline":"Wash the pieces.",
          "description":"Dip a sponge into your soapy water and squeeze out the excess. Wipe your pewter to remove the grime. You can also use a soft cloth to spread the soap and try to work it into the stains."
        },
        {
          "headline":"Rinse.",
          "description":"Use warm water to remove any leftover grime and soap. Small enough objects such as food plates can be placed under a running faucet. You may also try using a clean, soft cloth to remove the excess so it doesn\u2019t damage the pewter over time."
        },
        {
          "headline":"Dry thoroughly.",
          "description":"Take a clean, soft cloth and wipe the surface of the pewter piece. Ensure that all the water and soap have been removed before you stop. All of the grime should have been washed off along with the soap and water at this point."
        }
      ]
    },
    {
      "name":"Cleaning Non-Oxidized Pewter Deeply",
      "steps":[
        {
          "headline":"Mix vinegar and flour.",
          "description":"Get a container. Put in a cup of white vinegar and half a cup of white flour. Mix these ingredients until they form a paste that you can use on the pewter as a polish. You can also buy polish in stores. Choose a mildly abrasive polish designed for pewter rather than other metals."
        },
        {
          "headline":"Add salt.",
          "description":"Salt should only be added for paste to be used on satin pewter. Satin pewter looks grainy compared to modern, polished pewter. Add one teaspoon of salt to your bowl. Mix it into your paste to make it more abrasive."
        },
        {
          "headline":"Apply the paste.",
          "description":"Use a soft cloth to pick up the paste and put it on the pewter. Move the cloth with circular motions. Spread the paste over the surface of the pewter and allow it to sit for 30 minutes. Never use the paste or any other polish on antique, oxidized pewter. These pieces were intentionally made to be darker and polishing them damages the finish and their value. Polish gently. Remember that this is pewter. It won\u2019t look as shiny and reflective as a metal such as silver."
        },
        {
          "headline":"Brush satin pewter with steel wool.",
          "description":"Steel wool should You can apply the polish with steel wool or use the steel wool while the polish is fresh. Very gently, move the steel wool in the direction of the grain. Avoid pressing hard so you don\u2019t leave scratches. This will make satin pewter look new again. Only use steel wool on satin pewter unless you\u2019re trying to repair deep scratches on polished pewter. This process should only be done once a year at most."
        },
        {
          "headline":"Rinse off the paste.",
          "description":"Use warm water to wash away the paste. Place the pewter object under a running faucet or use soft, damp cloth. Make sure you\u2019ve removed all of the paste so that it doesn\u2019t abrade the pewter."
        },
        {
          "headline":"Dry the pewter.",
          "description":"Take a clean, soft cloth. Move it over the surface of your pewter object to remove all water. You may also leave cleaned pewter to dry in open air, but using a cloth ensures that you\u2019ve removed all of the paste."
        }
      ]
    },
    {
      "name":"Polishing Pewter",
      "steps":[
        {
          "headline":"Boil linseed oil.",
          "description":"All you need is a little bit of the oil to make a second, optional paste. Place it in a pan or pot on the oven and leave it until it is hot and ready to be mixed to form a paste. This paste will serve as a more potent cleaner to abrade stains."
        },
        {
          "headline":"Mix in rottenstone.",
          "description":"Rottenstone is a powdered limestone. Look in a home care center for it. Add an equal amount of it to the linseed oil. Again, all you need is a small amount, enough to spread out along the surface of your pewter. This paste is great for dull and matte finishes, but should never be used on oxidized pewter."
        },
        {
          "headline":"Cool the paste.",
          "description":"Turn off the stove and remove the pot with the paste if you wish. Let the paste rest until you can use it without burning yourself or damaging the pewter with heat. It\u2019s better to let the paste go cold rather than apply it while hot."
        },
        {
          "headline":"Apply the paste.",
          "description":"Use a soft cloth to pick up the paste and transfer it to the surface of your pewter. With circular motions, move the rag to distribute the paste over the entire surface of your object."
        },
        {
          "headline":"Rinse immediately.",
          "description":"Move your pewter item to a faucet of warm water. Let the water rinse off any trace of the pace. Alternatively, place a soft cloth in warm water and use it to wash away the paste. The paste must be taken off so that it doesn\u2019t abrade the pewter."
        },
        {
          "headline":"Dry thoroughly.",
          "description":"Get another soft, clean cloth for drying. Rub the cloth all along the surface of the pewter, making sure to remove every last bit of water. This will ensure that the water doesn\u2019t do any damage and that all the paste is removed."
        }
      ]
    }
  ],
  "text":" Washing with Soap and Water Dust your decorative pewter pieces. This should be done regularly even while you\u2019re not washing or polishing the pewter. Use a duster or a soft cloth such as a microfiber cloth to remove all the dust clinging to the pieces. The more you do this, the longer you\u2019ll preserve the finish and the less you\u2019ll need to wash and polish the pieces. Fill a bucket with hot water. Warm water is acceptable, but hot water will make removing grime easier. You can also fill a sink or use running water from the tap. Add soap. Choose a mild dishwashing liquid. Avoid using anything abrasive, as these products will wear away at the finish and scratch the pewter. Squirt a little soap in your bucket or water container. Baby shampoo is also a non-abrasive detergent that can be used to clean pewter. Wash the pieces. Dip a sponge into your soapy water and squeeze out the excess. Wipe your pewter to remove the grime. You can also use a soft cloth to spread the soap and try to work it into the stains. Rinse. Use warm water to remove any leftover grime and soap. Small enough objects such as food plates can be placed under a running faucet. You may also try using a clean, soft cloth to remove the excess so it doesn\u2019t damage the pewter over time. Dry thoroughly. Take a clean, soft cloth and wipe the surface of the pewter piece. Ensure that all the water and soap have been removed before you stop. All of the grime should have been washed off along with the soap and water at this point. Cleaning Non-Oxidized Pewter Deeply Mix vinegar and flour. Get a container. Put in a cup of white vinegar and half a cup of white flour. Mix these ingredients until they form a paste that you can use on the pewter as a polish. You can also buy polish in stores. Choose a mildly abrasive polish designed for pewter rather than other metals. Add salt. Salt should only be added for paste to be used on satin pewter. Satin pewter looks grainy compared to modern, polished pewter. Add one teaspoon of salt to your bowl. Mix it into your paste to make it more abrasive. Apply the paste. Use a soft cloth to pick up the paste and put it on the pewter. Move the cloth with circular motions. Spread the paste over the surface of the pewter and allow it to sit for 30 minutes. Never use the paste or any other polish on antique, oxidized pewter. These pieces were intentionally made to be darker and polishing them damages the finish and their value. Polish gently. Remember that this is pewter. It won\u2019t look as shiny and reflective as a metal such as silver. Brush satin pewter with steel wool. Steel wool should You can apply the polish with steel wool or use the steel wool while the polish is fresh. Very gently, move the steel wool in the direction of the grain. Avoid pressing hard so you don\u2019t leave scratches. This will make satin pewter look new again. Only use steel wool on satin pewter unless you\u2019re trying to repair deep scratches on polished pewter. This process should only be done once a year at most. Rinse off the paste. Use warm water to wash away the paste. Place the pewter object under a running faucet or use soft, damp cloth. Make sure you\u2019ve removed all of the paste so that it doesn\u2019t abrade the pewter. Dry the pewter. Take a clean, soft cloth. Move it over the surface of your pewter object to remove all water. You may also leave cleaned pewter to dry in open air, but using a cloth ensures that you\u2019ve removed all of the paste. Polishing Pewter Boil linseed oil. All you need is a little bit of the oil to make a second, optional paste. Place it in a pan or pot on the oven and leave it until it is hot and ready to be mixed to form a paste. This paste will serve as a more potent cleaner to abrade stains. Mix in rottenstone. Rottenstone is a powdered limestone. Look in a home care center for it. Add an equal amount of it to the linseed oil. Again, all you need is a small amount, enough to spread out along the surface of your pewter. This paste is great for dull and matte finishes, but should never be used on oxidized pewter. Cool the paste. Turn off the stove and remove the pot with the paste if you wish. Let the paste rest until you can use it without burning yourself or damaging the pewter with heat. It\u2019s better to let the paste go cold rather than apply it while hot. Apply the paste. Use a soft cloth to pick up the paste and transfer it to the surface of your pewter. With circular motions, move the rag to distribute the paste over the entire surface of your object. Rinse immediately. Move your pewter item to a faucet of warm water. Let the water rinse off any trace of the pace. Alternatively, place a soft cloth in warm water and use it to wash away the paste. The paste must be taken off so that it doesn\u2019t abrade the pewter. Dry thoroughly. Get another soft, clean cloth for drying. Rub the cloth all along the surface of the pewter, making sure to remove every last bit of water. This will ensure that the water doesn\u2019t do any damage and that all the paste is removed.",
  "tyn_model":[
    "water",
    "pewter",
    "steel wool",
    "soap",
    "salt",
    "polish",
    "linseed oil",
    "microfiber cloth",
    "bucket",
    "baby shampoo",
    "sponge",
    "vinegar",
    "flour",
    "container",
    "white vinegar",
    "white flour",
    "bowl",
    "cloth",
    "polishing pewter",
    "oven",
    "stove",
    "pot",
    "rag"
  ],
  "tyn_section":[

  ]
}