{
  "title":"How to Use a Reference Photo in Your Artwork",
  "url":"https://www.wikihow.com/Use-a-Reference-Photo-in-Your-Artwork",
  "category_hierarchy":[
    "Hobbies and Crafts",
    "Drawing"
  ],
  "methods":[
    {
      "name":"Planning Your Reference Photos",
      "steps":[
        {
          "headline":"Determine how you will use your photo.",
          "description":"Some options are:\nDuplicating the photograph using visual tracing. Referencing the photo for shapes, shadows, visual texture, light direction, etc. Picking out elements whereby you use only a part of the image for reference or tracing."
        },
        {
          "headline":"Develop an idea of what you want your end result to be.",
          "description":"You might end up using Photoshop for manipulation or wanting to create your own reference photos."
        },
        {
          "headline":"Sketch it out on paper or on a tablet.",
          "description":"It doesn't have to be pretty, but you will want to take into consideration the following:\nDirection of light in relation to the subject\nDirection, quality, and color of light\n\nYour subject and the subject's motions (if any)\nYour subject's pose\nComposition of the shot (or shots)"
        },
        {
          "headline":"Know ahead of times the basic shots that you will need.",
          "description":"As your project evolves, you will find yourself needing more shots (or different ones)."
        },
        {
          "headline":"Take your photo.",
          "description":"They don't have to be perfect. These are reference photos, after all."
        }
      ]
    },
    {
      "name":"Using the Photo Reference for Sketching",
      "steps":[
        {
          "headline":"Keep your work tilted towards you.",
          "description":"Use something like a drafting and drawing table. This will lessen the chance that your work will be distorted."
        },
        {
          "headline":"Keep your photograph close to where you will be referencing it.",
          "description":"That means working directly beside it. This will also keep your eyes level when moving from your reference photo to your sketch."
        },
        {
          "headline":"Pay attention and focus on your work.",
          "description":"While drawing, place your finger on the reference photo where you are sketching it on the paper."
        },
        {
          "headline":"Take your time.",
          "description":"Make sure that your finger stays on the photo where you are sketching on the paper."
        },
        {
          "headline":"Use straight lines and angles in your work.",
          "description":"Breaking your image down into a grid with horizontal and vertical lines can really simplify your work."
        }
      ]
    }
  ],
  "text":" Planning Your Reference Photos Determine how you will use your photo. Some options are:\nDuplicating the photograph using visual tracing. Referencing the photo for shapes, shadows, visual texture, light direction, etc. Picking out elements whereby you use only a part of the image for reference or tracing. Develop an idea of what you want your end result to be. You might end up using Photoshop for manipulation or wanting to create your own reference photos. Sketch it out on paper or on a tablet. It doesn't have to be pretty, but you will want to take into consideration the following:\nDirection of light in relation to the subject\nDirection, quality, and color of light\n\nYour subject and the subject's motions (if any)\nYour subject's pose\nComposition of the shot (or shots) Know ahead of times the basic shots that you will need. As your project evolves, you will find yourself needing more shots (or different ones). Take your photo. They don't have to be perfect. These are reference photos, after all. Using the Photo Reference for Sketching Keep your work tilted towards you. Use something like a drafting and drawing table. This will lessen the chance that your work will be distorted. Keep your photograph close to where you will be referencing it. That means working directly beside it. This will also keep your eyes level when moving from your reference photo to your sketch. Pay attention and focus on your work. While drawing, place your finger on the reference photo where you are sketching it on the paper. Take your time. Make sure that your finger stays on the photo where you are sketching on the paper. Use straight lines and angles in your work. Breaking your image down into a grid with horizontal and vertical lines can really simplify your work.",
  "tyn_model":[
    "paper",
    "photoshop",
    "tablet",
    "drafting and drawing table",
    "photograph"
  ],
  "tyn_section":[

  ]
}