{
  "title":"How to Drink Bacardi",
  "url":"https://www.wikihow.com/Drink-Bacardi",
  "category_hierarchy":[
    "Food and Entertaining",
    "Drinks",
    "Alcoholic Drinks"
  ],
  "methods":[
    {
      "name":"Drinking Bacardi Straight or \u201cNeat\u201d",
      "steps":[
        {
          "headline":"Choose one of Bacardi's full-bodied rums, such as the Reserva Limitada.",
          "description":"Bacardi's Premium Label line of rums have the strongest flavor and are best for drinking Bacardi straight. For a milder flavor, you can choose a lighter Premium label rum, such as the Gran Reserva Diez. Also, if straight rum is too harsh for you, you can choose from a number of sweet, fruit-infused Bacardi labels. Bacardi produces hundreds of rums and several are available in the United States. Experiment and find your favorite! Bacardi offers eight options of fruit-infused rums, including mango, banana, and coconut."
        },
        {
          "headline":"Pour about 1 ounce of Bacardi rum into an old-fashioned or \u201crocks\u201d glass.",
          "description":"If you don\u2019t have any \u201crocks\u201d glasses, you can use a small tumbler, shot glass, or juice glass. Since this is a straight liquor without anything added to dilute it, only pour yourself a small amount at a time."
        },
        {
          "headline":"Take small sips and pace yourself for your health and well-being.",
          "description":"Remember that this is straight alcohol and depending on which type of Bacardi you chose, it could be very strong and get you intoxicated very quickly."
        },
        {
          "headline":"Use all your senses to really experience the full profile of your rum.",
          "description":"Look at the liquid and smell it. Take note of the colors and the scent. It may just look clear and smell like nothing at first, but the more you do this, the more you will notice differences between your drinks and learn what is pleasing to your palate and what is not. Similar to other aged alcohols, rum has complexities. The finer and more aged the rum, the more flavors it will hold. And the more you drink it, the more you will notice the flavor of minerals and hints of fruits or vegetables."
        }
      ]
    },
    {
      "name":"Enjoying Fruity Cocktails",
      "steps":[
        {
          "headline":"Choose a plain Bacardi label, such as Bacardi Gold, for most cocktails.",
          "description":"You can also choose a fruit-infused version, but it will affect the overall flavor of the cocktail. For a smooth rum with an almond and vanilla aftertaste, try Bacardi Superior. Or go with the Bacardi Black for a more intense rum flavor."
        },
        {
          "headline":"Remember your beach vacation with a coconut-flavored Pina Colada.To make, slightly mash four pineapple chunks in a cocktail shaker.",
          "description":"Mix 35 ml of coconut water, 25 ml of pineapple juice, and 2 tsp of sugar until the sugar dissolves. Then, add 50 ml of Bacardi rum and enough ice to fill the shaker. Shake it up to mix all the ingredients well and serve in a hurricane glass. For added festivity, garnish with a pineapple and serve."
        },
        {
          "headline":"Dive into a Caribbean Rum Punch.",
          "description":"In fact, make two: one for you and one for your friend. Mix 1/2 oz. lime juice, 4 oz. orange juice, 4 oz. pineapple juice, 1 1/2 oz. dark rum, 1 1/2 oz. light rum, and a splash of grenadine. Pour over ice into two tall glasses and sprinkle nutmeg on top to add a little spice. You can add fresh fruit for visual appeal and flavor. Try an orange slice or a cherry."
        },
        {
          "headline":"Create the perfect minty Mojito to cool you off on a hot day.Crush 12 mint leaves and the juice from \u00bd lime in a tall glass.",
          "description":"Pour in 2 tbsp of simple syrup, 1 \u00bd oz. of your favorite Bacardi rum, and enough club soda and ice to fill the glass. Stir the mixture gently and garnish with a lime wedge and a fresh sprig of mint."
        },
        {
          "headline":"Get on the Banana Daiquiri Boat.",
          "description":"Banana and Bacardi is so good, you will almost definitely want more than one. Add 1 1/2 \u2013 2 oz. light rum, 1 tbsp triple sec, 1 banana, 1 1/2 oz. lime juice, 1 tsp sugar, and 1 cup crushed ice to a blender and blend until smooth. Garnish with a cherry and a little umbrella for added flair."
        }
      ]
    },
    {
      "name":"Mixing Bacardi with Your Favorite Soft Drink",
      "steps":[
        {
          "headline":"Quench your thirst with a traditional Rum & Coke.",
          "description":"This is a quick, easy, and sweet drink for a hot summer\u2019s day. Stir together 1 part Bacardi rum and 3 parts Coke in a small glass. If it's a really hot day, cool it off with a few ice cubes or whiskey stones. You can add more rum and less Coke according to your taste."
        },
        {
          "headline":"Celebrate Cuba\u2019s freedom with a lime-infused Cuba Libre.",
          "description":"Start with a tall glass 3/4 full of ice. Add 1 part Bacardi rum, 3 parts Coke, and the juice from 2 lime wedges. To finish, drop in the lime wedges and stir gently. The Cuba Libre is the national drink of Cuban independence."
        },
        {
          "headline":"Experiment with any cola or other soft drink.",
          "description":"Bacardi is a mild and smooth spirit and pairs well with lots of soft drinks. Try Bacardi with Sprite, Dr. Pepper, or mix it with root beer."
        }
      ]
    }
  ],
  "text":" Drinking Bacardi Straight or \u201cNeat\u201d Choose one of Bacardi's full-bodied rums, such as the Reserva Limitada. Bacardi's Premium Label line of rums have the strongest flavor and are best for drinking Bacardi straight. For a milder flavor, you can choose a lighter Premium label rum, such as the Gran Reserva Diez. Also, if straight rum is too harsh for you, you can choose from a number of sweet, fruit-infused Bacardi labels. Bacardi produces hundreds of rums and several are available in the United States. Experiment and find your favorite! Bacardi offers eight options of fruit-infused rums, including mango, banana, and coconut. Pour about 1 ounce of Bacardi rum into an old-fashioned or \u201crocks\u201d glass. If you don\u2019t have any \u201crocks\u201d glasses, you can use a small tumbler, shot glass, or juice glass. Since this is a straight liquor without anything added to dilute it, only pour yourself a small amount at a time. Take small sips and pace yourself for your health and well-being. Remember that this is straight alcohol and depending on which type of Bacardi you chose, it could be very strong and get you intoxicated very quickly. Use all your senses to really experience the full profile of your rum. Look at the liquid and smell it. Take note of the colors and the scent. It may just look clear and smell like nothing at first, but the more you do this, the more you will notice differences between your drinks and learn what is pleasing to your palate and what is not. Similar to other aged alcohols, rum has complexities. The finer and more aged the rum, the more flavors it will hold. And the more you drink it, the more you will notice the flavor of minerals and hints of fruits or vegetables. Enjoying Fruity Cocktails Choose a plain Bacardi label, such as Bacardi Gold, for most cocktails. You can also choose a fruit-infused version, but it will affect the overall flavor of the cocktail. For a smooth rum with an almond and vanilla aftertaste, try Bacardi Superior. Or go with the Bacardi Black for a more intense rum flavor. Remember your beach vacation with a coconut-flavored Pina Colada.To make, slightly mash four pineapple chunks in a cocktail shaker. Mix 35 ml of coconut water, 25 ml of pineapple juice, and 2 tsp of sugar until the sugar dissolves. Then, add 50 ml of Bacardi rum and enough ice to fill the shaker. Shake it up to mix all the ingredients well and serve in a hurricane glass. For added festivity, garnish with a pineapple and serve. Dive into a Caribbean Rum Punch. In fact, make two: one for you and one for your friend. Mix 1/2 oz. lime juice, 4 oz. orange juice, 4 oz. pineapple juice, 1 1/2 oz. dark rum, 1 1/2 oz. light rum, and a splash of grenadine. Pour over ice into two tall glasses and sprinkle nutmeg on top to add a little spice. You can add fresh fruit for visual appeal and flavor. Try an orange slice or a cherry. Create the perfect minty Mojito to cool you off on a hot day.Crush 12 mint leaves and the juice from \u00bd lime in a tall glass. Pour in 2 tbsp of simple syrup, 1 \u00bd oz. of your favorite Bacardi rum, and enough club soda and ice to fill the glass. Stir the mixture gently and garnish with a lime wedge and a fresh sprig of mint. Get on the Banana Daiquiri Boat. Banana and Bacardi is so good, you will almost definitely want more than one. Add 1 1/2 \u2013 2 oz. light rum, 1 tbsp triple sec, 1 banana, 1 1/2 oz. lime juice, 1 tsp sugar, and 1 cup crushed ice to a blender and blend until smooth. Garnish with a cherry and a little umbrella for added flair. Mixing Bacardi with Your Favorite Soft Drink Quench your thirst with a traditional Rum & Coke. This is a quick, easy, and sweet drink for a hot summer\u2019s day. Stir together 1 part Bacardi rum and 3 parts Coke in a small glass. If it's a really hot day, cool it off with a few ice cubes or whiskey stones. You can add more rum and less Coke according to your taste. Celebrate Cuba\u2019s freedom with a lime-infused Cuba Libre. Start with a tall glass 3/4 full of ice. Add 1 part Bacardi rum, 3 parts Coke, and the juice from 2 lime wedges. To finish, drop in the lime wedges and stir gently. The Cuba Libre is the national drink of Cuban independence. Experiment with any cola or other soft drink. Bacardi is a mild and smooth spirit and pairs well with lots of soft drinks. Try Bacardi with Sprite, Dr. Pepper, or mix it with root beer.",
  "tyn_model":[
    "bacardi",
    "rum",
    "bacardi rum",
    "ice",
    "coke",
    "sugar",
    "rums",
    "pineapple",
    "pineapple juice",
    "lime",
    "tall glass",
    "banana",
    "\u201cneat",
    "\u201d choose",
    "bacardi labels",
    "coconut",
    "old-fashioned or \u201crocks",
    "\u201d glass",
    "\u201crocks",
    "\u201d glasses",
    "tumbler",
    "shot glass",
    "juice glass",
    "liquor",
    "alcohol",
    "bacardi gold",
    "bacardi superior",
    "bacardi black",
    "pina colada",
    "cocktail shaker",
    "coconut water",
    "shaker",
    "hurricane glass",
    "caribbean rum",
    "orange juice",
    "dark rum",
    "grenadine",
    "tall glasses",
    "simple syrup",
    "club soda",
    "lime wedge",
    "mint",
    "\u2013 2",
    "light rum",
    "triple sec",
    "lime juice",
    "crushed ice",
    "blender",
    "cherry",
    "ice cubes",
    "whiskey stones",
    "cuba libre",
    "lime wedges",
    "cola",
    "soft drink",
    "soft drinks",
    "sprite",
    "dr. pepper",
    "root beer"
  ],
  "tyn_section":[

  ]
}