{
  "title":"How to Drink Crown Royal",
  "url":"https://www.wikihow.com/Drink-Crown-Royal",
  "category_hierarchy":[
    "Food and Entertaining",
    "Drinks",
    "Alcoholic Drinks"
  ],
  "methods":[
    {
      "name":"Drinking Crown Royal Neat",
      "steps":[
        {
          "headline":"Use a whiskey glass or rocks glass for the best flavor.",
          "description":"It\u2019s perfectly fine to drink out of whatever you have on hand, but some glasses are better than others at highlighting the flavor of the Crown Royal. A specialty whiskey glass is the best option, as the curvature of the glass concentrates the vapors and flavors of the whiskey. If you don\u2019t have a whiskey glass, any short glass tumbler will work. Other materials like plastic can taint the flavor of the whiskey. If possible, whiskey should always be served in a glass."
        },
        {
          "headline":"Pour a small amount of Crown Royal into the glass.",
          "description":"Drinks served neat are intended to be enjoyed slowly so you can experience all of the flavors, so you don\u2019t need much. Pour about 2  fl oz (59 mL) into the glass, or roughly the height of two fingers."
        },
        {
          "headline":"Take small sips.",
          "description":"Roll the Crown Royal around in your mouth and try to see which flavors you can discern. Crown Royal is made by blending different whiskeys, so there are a number of different flavors you can discover. It might just taste strongly of alcohol at first, but over time you will be able to notice the nuances. Try sniffing the whiskey a few times first to open up your palate!"
        },
        {
          "headline":"Chill your Crown Royal.",
          "description":"Put your bottle in the freezer for several hours, or serve the Crown Royal over ice. Serving it cold softens the initial impact, and opens up different flavor nuances. Try whiskey stones to chill your drink without diluting the flavor. You can find whiskey stones at any home goods store."
        }
      ]
    },
    {
      "name":"Mixing Crown Royal Cocktails",
      "steps":[
        {
          "headline":"Try an Old Fashioned for a strong cocktail on the sweeter side.",
          "description":"An Old Fashioned is a classic cocktail made by muddling bitters and simple syrup. It\u2019s typically served in a rocks glass with a twist of citrus as a garnish. Fill a large mixing glass with ice. Add 1  fl oz (30 mL) of Crown Royal with .25  fl oz (7.4 mL) of simple syrup and 1-3 dashes of bitters and stir to combine. Strain into a small tumbler or rocks glass filled with fresh ice. Garnish with a twist of lemon or orange."
        },
        {
          "headline":"Mix a Manhattan for a strong, slightly bitter cocktail.",
          "description":"A Manhattan is another classic whiskey cocktail. It\u2019s similar to an Old Fashioned, but it's a little less sweet. Instead of sweetening the cocktail with simple syrup it\u2019s sweetened with vermouth and maraschino cherries. Fill a large mixing glass with ice, and add 2  fl oz (59 mL) of Crown Royal, 1  fl oz (30 mL) of sweet vermouth, and 3-4 dashes of bitters. Stir to combine. Place a maraschino cherry and a small amount of cherry juice from the jar in the bottom of a small glass tumbler. strain the drink from the mixing glass into the tumbler and enjoy."
        },
        {
          "headline":"Make a Crown Royal Press for a whiskey-forward flavor with spicy citrus notes.",
          "description":"This drink blends the oak, vanilla, and fruit notes of Crown Royal with bitters, lemon juice, and a touch of citrus soda to create a drink that\u2019s similar to a Whiskey Sour, but less sweet. Fill a small glass tumbler with ice. Pour in 1.5  fl oz (44 mL) of Crown Royal, 3 dashes of bitters, and the juice squeezed from two lemon wedges. Stir to combine. Add a splash of your favorite lemon-lime soda, then drop in one of the lemon wedges and enjoy."
        },
        {
          "headline":"Blend Crown Royal with apple and ginger beer for a bubbly, refreshing cocktail.",
          "description":"A Crown Royal Apple Envy is a sweet fall cocktail made with sliced apples and ginger beer. The sweetness of the apple and the spice of the gingerbeer enhance the oak notes of the Crown Royal for a cocktail that\u2019s crisp and delicious. Chop two thick slices of apple into small pieces and muddle with 1 teaspoon of simple syrup. Fill a small glass tumbler with ice, and add 2  fl oz (59 mL) of Crown Royal. Add the apple and syrup mixture into the tumbler and stir. Top with a splash of ginger beer and garnish with an apple slice."
        }
      ]
    },
    {
      "name":"Experimenting With Different Varieties of Crown Royal",
      "steps":[
        {
          "headline":"Stick with the Signature Series for a multipurpose whiskey.",
          "description":"If you\u2019re looking for a whiskey that\u2019s just as good in cocktails as it is neat, then the Signature Series varieties are a reliable bet. For an award-winning whiskey on the more affordable end, try the Northern Harvest Rye variety. It was named Whiskey of the Year in Jim Murray\u2019s Whiskey Bible 2016."
        },
        {
          "headline":"Splurge on a Master Series variety.",
          "description":"If you have a little extra money and prefer your whiskey neat, consider trying one of Crown Royal\u2019s Signature series varieties. The prices are steeper, but the flavors are more complex than the less expensive varieties. If you\u2019re looking for a smoother whiskey, try the Crown Royal XO. For a rare treat, try Crown Royal XR from La Salle. This variety was blended with the last of the whiskey from the famous La Salle Distillery."
        },
        {
          "headline":"Change up your favorite cocktails with flavored Crown Royal.",
          "description":"In addition to the Signature Series and Master Series, Crown Royal offers a flavor series with options like Apple, Peach, Vanilla, Salted Caramel, and Texas Mesquite. Try different combinations in your favorite cocktails to see what works best, or sip them on their own for a change of pace."
        }
      ]
    }
  ],
  "text":" Drinking Crown Royal Neat Use a whiskey glass or rocks glass for the best flavor. It\u2019s perfectly fine to drink out of whatever you have on hand, but some glasses are better than others at highlighting the flavor of the Crown Royal. A specialty whiskey glass is the best option, as the curvature of the glass concentrates the vapors and flavors of the whiskey. If you don\u2019t have a whiskey glass, any short glass tumbler will work. Other materials like plastic can taint the flavor of the whiskey. If possible, whiskey should always be served in a glass. Pour a small amount of Crown Royal into the glass. Drinks served neat are intended to be enjoyed slowly so you can experience all of the flavors, so you don\u2019t need much. Pour about 2  fl oz (59 mL) into the glass, or roughly the height of two fingers. Take small sips. Roll the Crown Royal around in your mouth and try to see which flavors you can discern. Crown Royal is made by blending different whiskeys, so there are a number of different flavors you can discover. It might just taste strongly of alcohol at first, but over time you will be able to notice the nuances. Try sniffing the whiskey a few times first to open up your palate! Chill your Crown Royal. Put your bottle in the freezer for several hours, or serve the Crown Royal over ice. Serving it cold softens the initial impact, and opens up different flavor nuances. Try whiskey stones to chill your drink without diluting the flavor. You can find whiskey stones at any home goods store. Mixing Crown Royal Cocktails Try an Old Fashioned for a strong cocktail on the sweeter side. An Old Fashioned is a classic cocktail made by muddling bitters and simple syrup. It\u2019s typically served in a rocks glass with a twist of citrus as a garnish. Fill a large mixing glass with ice. Add 1  fl oz (30 mL) of Crown Royal with .25  fl oz (7.4 mL) of simple syrup and 1-3 dashes of bitters and stir to combine. Strain into a small tumbler or rocks glass filled with fresh ice. Garnish with a twist of lemon or orange. Mix a Manhattan for a strong, slightly bitter cocktail. A Manhattan is another classic whiskey cocktail. It\u2019s similar to an Old Fashioned, but it's a little less sweet. Instead of sweetening the cocktail with simple syrup it\u2019s sweetened with vermouth and maraschino cherries. Fill a large mixing glass with ice, and add 2  fl oz (59 mL) of Crown Royal, 1  fl oz (30 mL) of sweet vermouth, and 3-4 dashes of bitters. Stir to combine. Place a maraschino cherry and a small amount of cherry juice from the jar in the bottom of a small glass tumbler. strain the drink from the mixing glass into the tumbler and enjoy. Make a Crown Royal Press for a whiskey-forward flavor with spicy citrus notes. This drink blends the oak, vanilla, and fruit notes of Crown Royal with bitters, lemon juice, and a touch of citrus soda to create a drink that\u2019s similar to a Whiskey Sour, but less sweet. Fill a small glass tumbler with ice. Pour in 1.5  fl oz (44 mL) of Crown Royal, 3 dashes of bitters, and the juice squeezed from two lemon wedges. Stir to combine. Add a splash of your favorite lemon-lime soda, then drop in one of the lemon wedges and enjoy. Blend Crown Royal with apple and ginger beer for a bubbly, refreshing cocktail. A Crown Royal Apple Envy is a sweet fall cocktail made with sliced apples and ginger beer. The sweetness of the apple and the spice of the gingerbeer enhance the oak notes of the Crown Royal for a cocktail that\u2019s crisp and delicious. Chop two thick slices of apple into small pieces and muddle with 1 teaspoon of simple syrup. Fill a small glass tumbler with ice, and add 2  fl oz (59 mL) of Crown Royal. Add the apple and syrup mixture into the tumbler and stir. Top with a splash of ginger beer and garnish with an apple slice. Experimenting With Different Varieties of Crown Royal Stick with the Signature Series for a multipurpose whiskey. If you\u2019re looking for a whiskey that\u2019s just as good in cocktails as it is neat, then the Signature Series varieties are a reliable bet. For an award-winning whiskey on the more affordable end, try the Northern Harvest Rye variety. It was named Whiskey of the Year in Jim Murray\u2019s Whiskey Bible 2016. Splurge on a Master Series variety. If you have a little extra money and prefer your whiskey neat, consider trying one of Crown Royal\u2019s Signature series varieties. The prices are steeper, but the flavors are more complex than the less expensive varieties. If you\u2019re looking for a smoother whiskey, try the Crown Royal XO. For a rare treat, try Crown Royal XR from La Salle. This variety was blended with the last of the whiskey from the famous La Salle Distillery. Change up your favorite cocktails with flavored Crown Royal. In addition to the Signature Series and Master Series, Crown Royal offers a flavor series with options like Apple, Peach, Vanilla, Salted Caramel, and Texas Mesquite. Try different combinations in your favorite cocktails to see what works best, or sip them on their own for a change of pace.",
  "tyn_model":[
    "crown royal",
    "whiskey",
    "bitters",
    "ice",
    "simple syrup",
    "whiskey glass",
    "rocks glass",
    "tumbler",
    "mixing glass",
    "ginger beer",
    "glass",
    "whiskey stones",
    "glass tumbler",
    "apple",
    "crown royal cocktails",
    "old fashioned",
    "tumbler or",
    "manhattan",
    "vermouth",
    "maraschino cherries",
    "sweet vermouth",
    "maraschino cherry",
    "cherry juice",
    "small glass tumbler",
    "crown royal press",
    "lemon juice",
    "citrus soda",
    "whiskey sour",
    "lemon-lime soda",
    "lemon",
    "crown royal apple envy",
    "apples",
    "syrup",
    "la salle distillery",
    "salted caramel"
  ],
  "tyn_section":[

  ]
}