{
  "title":"How to Change Your Name on PS4",
  "url":"https://www.wikihow.com/Change-Your-Name-on-PS4",
  "category_hierarchy":[
    "Hobbies and Crafts",
    "Games",
    "Video Games",
    "PlayStation Video Game Consoles",
    "PlayStation 4"
  ],
  "methods":[
    {
      "name":"Changing Your Online ID on PS4 via Your Console",
      "steps":[
        {
          "headline":"Press the PS button.",
          "description":"This brings you to the PS4's main menu screen."
        },
        {
          "headline":"Press up, then move right or left to highlight Profile.",
          "description":""
        },
        {
          "headline":"Press X to open the Profile page.",
          "description":""
        },
        {
          "headline":"Move right to highlight the three dots.",
          "description":"The dots are right next to your profile name."
        },
        {
          "headline":"Press X, then press X again to select Edit Profile.",
          "description":""
        },
        {
          "headline":"Scroll down to highlight Online ID and press X.",
          "description":""
        },
        {
          "headline":"Press right to select the I Accept option and press X.",
          "description":"This takes you to the Important Information screen. Some games may not act as expected after you change your Online ID."
        },
        {
          "headline":"Press right to select Continue and press X.",
          "description":""
        },
        {
          "headline":"Enter your password in the text field and select Done.",
          "description":""
        },
        {
          "headline":"Press X to enter a new Online ID.",
          "description":"PS4 usernames must be unique, so if you pick a name that somebody's already chosen, you'll have to choose again. This screen shows you suggestions of available usernames on the right side of the screen. You can pick any of them by highlighting it and pressing X.\nSony allows you to pick a new Online ID once for free. If you want to switch your Online ID again, you'll be charged either $4.99 (if you're a PS Plus member) or $9.99 (if you're not a member) per change."
        },
        {
          "headline":"Select Confirm.",
          "description":"This takes you to the Change Online ID page."
        },
        {
          "headline":"Choose how you want to display your name.",
          "description":"You can choose to display both your old ID and your new ID for 30 days, which can help your PS4 friends recognize you."
        },
        {
          "headline":"Select Confirm and press X.",
          "description":"Your Online ID is updated."
        }
      ]
    },
    {
      "name":"Changing Your Online ID via Computer",
      "steps":[
        {
          "headline":"Open a browser and go to Sony's sign in page.",
          "description":""
        },
        {
          "headline":"Enter the sign in information associated with your PSN account.",
          "description":""
        },
        {
          "headline":"Click PSN Profile.",
          "description":"This option is located on the left side of the screen."
        },
        {
          "headline":"Click the Edit option next to your current Online ID.",
          "description":"This brings you to the Important Information page that summarizes potential issues with a name change."
        },
        {
          "headline":"Click I Accept, then Continue.",
          "description":""
        },
        {
          "headline":"Click in the text field and enter a new Online ID.",
          "description":"You can also click directly on one of the suggested Online IDs that appear below the Change Online ID text field."
        },
        {
          "headline":"Click Check Availability.",
          "description":"PS4 usernames must be unique, so if you pick a name that somebody's already chosen, you'll have to choose again."
        },
        {
          "headline":"Choose Continue when you've picked an available name.",
          "description":"Your Online ID is updated. Sony allows you to pick a new Online ID once for free. If you want to switch your Online ID again, you'll be charged either $4.99 (if you're a PS Plus member) or $9.99 (if you're not a member) per change. If this isn't the first time you've changed your ID, you'll be charged for the ID change upon clicking Continue."
        }
      ]
    }
  ],
  "text":" Changing Your Online ID on PS4 via Your Console Press the PS button. This brings you to the PS4's main menu screen. Press up, then move right or left to highlight Profile.  Press X to open the Profile page.  Move right to highlight the three dots. The dots are right next to your profile name. Press X, then press X again to select Edit Profile.  Scroll down to highlight Online ID and press X.  Press right to select the I Accept option and press X. This takes you to the Important Information screen. Some games may not act as expected after you change your Online ID. Press right to select Continue and press X.  Enter your password in the text field and select Done.  Press X to enter a new Online ID. PS4 usernames must be unique, so if you pick a name that somebody's already chosen, you'll have to choose again. This screen shows you suggestions of available usernames on the right side of the screen. You can pick any of them by highlighting it and pressing X.\nSony allows you to pick a new Online ID once for free. If you want to switch your Online ID again, you'll be charged either $4.99 (if you're a PS Plus member) or $9.99 (if you're not a member) per change. Select Confirm. This takes you to the Change Online ID page. Choose how you want to display your name. You can choose to display both your old ID and your new ID for 30 days, which can help your PS4 friends recognize you. Select Confirm and press X. Your Online ID is updated. Changing Your Online ID via Computer Open a browser and go to Sony's sign in page.  Enter the sign in information associated with your PSN account.  Click PSN Profile. This option is located on the left side of the screen. Click the Edit option next to your current Online ID. This brings you to the Important Information page that summarizes potential issues with a name change. Click I Accept, then Continue.  Click in the text field and enter a new Online ID. You can also click directly on one of the suggested Online IDs that appear below the Change Online ID text field. Click Check Availability. PS4 usernames must be unique, so if you pick a name that somebody's already chosen, you'll have to choose again. Choose Continue when you've picked an available name. Your Online ID is updated. Sony allows you to pick a new Online ID once for free. If you want to switch your Online ID again, you'll be charged either $4.99 (if you're a PS Plus member) or $9.99 (if you're not a member) per change. If this isn't the first time you've changed your ID, you'll be charged for the ID change upon clicking Continue.",
  "tyn_model":[
    "ps4",
    "ps4 usernames"
  ],
  "tyn_section":[

  ]
}