{
  "title":"How to Drink Bombay Sapphire",
  "url":"https://www.wikihow.com/Drink-Bombay-Sapphire",
  "category_hierarchy":[
    "Food and Entertaining",
    "Drinks",
    "Alcoholic Drinks"
  ],
  "methods":[
    {
      "name":"Making a Gin and Tonic",
      "steps":[
        {
          "headline":"Gently squeeze a lime slice over the ice in the glass.",
          "description":"Adding lime now ensures that it will be well incorporated into the cocktail. If you don't have a lime, lemon provides that citrus tang just as well, and is often used interchangeably.Tip: If shooting for an elegant touch, try serving your creation in a wine glass, such as one used for burgundy. Don't worry if you don't have \"correct\" glasses. Medium-sized ice tea glasses work just fine."
        },
        {
          "headline":"Pour the Bombay Sapphire into the glass and stir to chill the gin.",
          "description":"If you don't have a good stirring rod and are looking to buy basic accessories for your home bar, consider making it one of your first purchases. If you don't yet have one, not to worry, as even a kitchen spoon can do the job."
        },
        {
          "headline":"Fill the glass with a good tonic.",
          "description":"If you know how, pouring the tonic down the stirring rod is an excellent technique to retain the bubbly effervescence of the tonic. If you don't have this technique under your felt, tipping the glass so that you pour tonic down the inner surface of the glass has the same effect. Garnish with a lime slice."
        }
      ]
    },
    {
      "name":"Making a Moscow Mule",
      "steps":[
        {
          "headline":"Pour the Bombay Sapphire into the glass and stir to chill the gin before proceeding.",
          "description":"Gin is best icy cold, unlike liquors such as scotch, which are often served at room temperature.Tip: Rocks glasses are a great choice here. They are short, wide, and have a heavy bottom."
        },
        {
          "headline":"Add the lime juice and ginger beer.",
          "description":"Stir until well mixed. In a pinch, you can substitute lemon juice for the lime juice. Spicier than mere ginger ale, ginger beer is a non-alcoholic beverage found among speciality sodas in upscale grocery stores."
        },
        {
          "headline":"Garnish with a lime  (or lemon) slice.",
          "description":"While lime wedges are good because they're so squeezable, you can play with other garnish shapes such as half slices or wheels, or whatever suits your fancy."
        }
      ]
    },
    {
      "name":"Make a Laverstoke sharing cocktail",
      "steps":[
        {
          "headline":"Pour the Bombay Sapphire, vermouth and elderflower liqueur into the pitcher to combine all the alcohols.",
          "description":"Adding ingredients in the right order can be important when making mixed drinks. Add these first to prevent the alcohol from remaining on the top of your drink."
        },
        {
          "headline":"Fill the pitcher completely with ice.",
          "description":"Squeeze 4 lime wedges over the ice. After squeezing, drop the slices onto the ice. Citrus fruit and Bombay Sapphire go perfectly together in this and other drinks, as the sharp citrus taste complements the astringency of the gin."
        },
        {
          "headline":"Fill the pitcher with 12 parts of ginger ale.",
          "description":"Stir just enough to combine the ingredients without sacrificing the effervescence of the ginger ale."
        },
        {
          "headline":"Pour into individual glasses.",
          "description":"Garnish each glass with sliced ginger and a mint spring. The Laverstoke sharing cocktail is perfect to celebrate a promotion, engagement, or any occasion in which dear friends come together to recognize something special."
        }
      ]
    }
  ],
  "text":" Making a Gin and Tonic Gently squeeze a lime slice over the ice in the glass. Adding lime now ensures that it will be well incorporated into the cocktail. If you don't have a lime, lemon provides that citrus tang just as well, and is often used interchangeably.Tip: If shooting for an elegant touch, try serving your creation in a wine glass, such as one used for burgundy. Don't worry if you don't have \"correct\" glasses. Medium-sized ice tea glasses work just fine. Pour the Bombay Sapphire into the glass and stir to chill the gin. If you don't have a good stirring rod and are looking to buy basic accessories for your home bar, consider making it one of your first purchases. If you don't yet have one, not to worry, as even a kitchen spoon can do the job. Fill the glass with a good tonic. If you know how, pouring the tonic down the stirring rod is an excellent technique to retain the bubbly effervescence of the tonic. If you don't have this technique under your felt, tipping the glass so that you pour tonic down the inner surface of the glass has the same effect. Garnish with a lime slice. Making a Moscow Mule Pour the Bombay Sapphire into the glass and stir to chill the gin before proceeding. Gin is best icy cold, unlike liquors such as scotch, which are often served at room temperature.Tip: Rocks glasses are a great choice here. They are short, wide, and have a heavy bottom. Add the lime juice and ginger beer. Stir until well mixed. In a pinch, you can substitute lemon juice for the lime juice. Spicier than mere ginger ale, ginger beer is a non-alcoholic beverage found among speciality sodas in upscale grocery stores. Garnish with a lime  (or lemon) slice. While lime wedges are good because they're so squeezable, you can play with other garnish shapes such as half slices or wheels, or whatever suits your fancy. Make a Laverstoke sharing cocktail Pour the Bombay Sapphire, vermouth and elderflower liqueur into the pitcher to combine all the alcohols. Adding ingredients in the right order can be important when making mixed drinks. Add these first to prevent the alcohol from remaining on the top of your drink. Fill the pitcher completely with ice. Squeeze 4 lime wedges over the ice. After squeezing, drop the slices onto the ice. Citrus fruit and Bombay Sapphire go perfectly together in this and other drinks, as the sharp citrus taste complements the astringency of the gin. Fill the pitcher with 12 parts of ginger ale. Stir just enough to combine the ingredients without sacrificing the effervescence of the ginger ale. Pour into individual glasses. Garnish each glass with sliced ginger and a mint spring. The Laverstoke sharing cocktail is perfect to celebrate a promotion, engagement, or any occasion in which dear friends come together to recognize something special.",
  "tyn_model":[
    "lime",
    "gin",
    "ice",
    "bombay sapphire",
    "glass",
    "tonic",
    "ginger ale",
    "pitcher",
    "lemon",
    "stirring rod",
    "lime juice",
    "ginger beer",
    "wine glass",
    "tea glasses",
    "kitchen spoon",
    "scotch",
    "lemon juice",
    "lime  (",
    "laverstoke sharing",
    "vermouth",
    "elderflower liqueur",
    "ginger",
    "laverstoke sharing cocktail"
  ],
  "tyn_section":[

  ]
}