{
  "title":"How to Make Sweet and Sour Pork",
  "url":"https://www.wikihow.com/Make-Sweet-and-Sour-Pork",
  "category_hierarchy":[
    "Food and Entertaining",
    "Recipes",
    "Meat",
    "Pork"
  ],
  "methods":[
    {
      "name":"On the Stove",
      "steps":[
        {
          "headline":"Heat 2 tablespoons of olive oil in a frying pan.",
          "description":"You could use another variety of oil, but olive is one of the healthier ones and still tastes great. Throw in the cubes of pork and lightly brown over medium heat. When they're a nice golden color, turn off the heat and drain away the oil. Keep the pork on the stove in your frying pan; you'll be revisiting it in a second. But if you'd like, you can take a paper towel to the pieces briefly to soak up any excess oil."
        },
        {
          "headline":"Drain the pineapple, but reserve the juice.",
          "description":"So open the can and transfer the juice into its own bowl. Save that sugary, fruity goodness!"
        },
        {
          "headline":"Combine the pineapple juice, water, vinegar, soy sauce, brown sugar, and salt.",
          "description":"Stir it until it's well combined. If there are any other flavors you'd like to add yourself, add them in at this point. Garlic? Pepper? Green onion? Plum sauce? Honey?"
        },
        {
          "headline":"Pour the mixture over the pork in the skillet.",
          "description":"Mix it well and turn the heat back on to medium-low, or at the point your stovetop keeps a nice simmer. Cover and keep simmering for 1 hour, or until meat is tender. That means an excuse for a chef taste test!"
        },
        {
          "headline":"In a cup, combine cornstarch and 2 tablespoons water.",
          "description":"Stir until smooth -- it should have the consistency of paste. Add the cornstarch mixture to your simmering pork and mix in thoroughly."
        },
        {
          "headline":"Cook over low heat, stirring constantly, until mixture is thickened and bubbly.",
          "description":"Add pineapple chunks, onion and green pepper. Put the cover back on and simmer your creation for 10 minutes more, or until vegetables are tender. The pepper should take a bit longer to cook through than the onion; when you go try your vegetables, be sure to try the pepper, too."
        },
        {
          "headline":"Serve your dish over rice.",
          "description":"If you're going traditional, that is. wikiHow has a good How to Make Fried Rice recipe, though you could also combine it with quinoa or stir-fried vegetables. Or you could eat it as is! It's delicious as a main dish or an accent to any larger meal. If you're going for rice, brown is healthier than white. How to Cook Rice can get you started -- but it's generally 1 part rice to 2 parts water and that's it. Who knew you were such a chef?"
        }
      ]
    },
    {
      "name":"In the Oven",
      "steps":[
        {
          "headline":"Combine egg, sugar and soy sauce in a small bowl.",
          "description":"Roll your pork cubes in this mixture and be sure to give each a good, even coating. You could roll them all one by one or you could just throw them all in there and go for it -- they'll be getting coated in cornstarch here in a second."
        },
        {
          "headline":"Put 1/4 cup corn starch in its own bowl.",
          "description":"You'll need to do these all one at a time. Roll each cube lightly in the corn starch, coating each piece entirely. Don't try to do it with a spoon or chopsticks -- just get in there with your fingers! The process will go a lot faster."
        },
        {
          "headline":"Place the covered pork on a sprayed cookie sheet or baking dish and bake at 350\u00b0 for 25 minutes.",
          "description":"For you Celsius fans, that's 176\u00b0. And an even 1500 seconds, if you were curious. While your pork is baking, if you'd like to prepare a rice dish, do so now. Quinoa works, too! Both take about the same amount of time. It's 1 part grain to 2 parts water and simmer -- that's all!"
        },
        {
          "headline":"Quarter the onion and bell pepper.",
          "description":"Cut the celery stalks into 1\" pieces. If you'd like to add any more vegetables, have at it! The more color in your dish, the better. Try adding red bell pepper, carrots, cherry tomatoes, mushrooms, and broccoli, too."
        },
        {
          "headline":"Heat a tablespoon or two of oil in a frying pan.",
          "description":"Canola or vegetable oils work, but olive or safflower oil is much healthier. Once heated, throw in your veggies and start sauteing. Cover your pan to let it steam and to use less oil. Stir it occasionally, heating up all sides of your stir-fry, browning evenly."
        },
        {
          "headline":"In a saucepan, combine remaining sugar, water, cider vinegar, salt and ketchup.",
          "description":"Bring the concoction to a boil, then reduce the heat to medium low, simmering gently and stirring occasionally. If you'd like to add any other flavors, now's a good time to do so. Maybe a dash of honey or a touch of peanut sauce?"
        },
        {
          "headline":"Add the can of crushed pineapple and let simmer until pork is done.",
          "description":"This should only be 10-15 minutes; the pineapple can become overcooked if you leave it in for much longer."
        },
        {
          "headline":"Combine pork, vegetables and sauce in a large bowl or your baking dish.",
          "description":"Then you can do with it as you please! Combine it with rice or whatever your heart desires. Add peas, carrots, and an egg to your rice to feel like Chinese got delivered right to your doorstep."
        }
      ]
    },
    {
      "name":"In the Crockpot",
      "steps":[
        {
          "headline":"Drain the pineapple, but reserve the juice.",
          "description":"The pineapple juice is an integral part of the sweet, tanginess of the dish. But don't throw out the pineapple! Refrigerate the chunks until you need to pull them back out. Which will be shortly!"
        },
        {
          "headline":"Place the cubed pork in your slow cooker, along with the green bell pepper and sliced onion.",
          "description":"Other veggies are welcome, but know that potatoes and carrots take a bit longer to cook through than most other veggies."
        },
        {
          "headline":"In a bowl, combine the brown sugar, cornstarch, pineapple juice (add water to make 3/4 cup if necessary), vinegar, water, soy sauce, and salt.",
          "description":"Mix it together until smooth and pour over the contents in your crockpot. Cover and cook on the low setting for 8 hours. Add the pineapple chunks about 45 minutes before the end of the cooking time. Stir and get ready to serve!"
        },
        {
          "headline":"Prepare rice or another side to join with your pork.",
          "description":"The sweet and sour pork will be great by itself, but it's even better with white or brown rice, egg noodles or quinoa. It just takes 15 minutes or so with some boiled water and you're set!"
        }
      ]
    }
  ],
  "text":" On the Stove Heat 2 tablespoons of olive oil in a frying pan. You could use another variety of oil, but olive is one of the healthier ones and still tastes great. Throw in the cubes of pork and lightly brown over medium heat. When they're a nice golden color, turn off the heat and drain away the oil. Keep the pork on the stove in your frying pan; you'll be revisiting it in a second. But if you'd like, you can take a paper towel to the pieces briefly to soak up any excess oil. Drain the pineapple, but reserve the juice. So open the can and transfer the juice into its own bowl. Save that sugary, fruity goodness! Combine the pineapple juice, water, vinegar, soy sauce, brown sugar, and salt. Stir it until it's well combined. If there are any other flavors you'd like to add yourself, add them in at this point. Garlic? Pepper? Green onion? Plum sauce? Honey? Pour the mixture over the pork in the skillet. Mix it well and turn the heat back on to medium-low, or at the point your stovetop keeps a nice simmer. Cover and keep simmering for 1 hour, or until meat is tender. That means an excuse for a chef taste test! In a cup, combine cornstarch and 2 tablespoons water. Stir until smooth -- it should have the consistency of paste. Add the cornstarch mixture to your simmering pork and mix in thoroughly. Cook over low heat, stirring constantly, until mixture is thickened and bubbly. Add pineapple chunks, onion and green pepper. Put the cover back on and simmer your creation for 10 minutes more, or until vegetables are tender. The pepper should take a bit longer to cook through than the onion; when you go try your vegetables, be sure to try the pepper, too. Serve your dish over rice. If you're going traditional, that is. wikiHow has a good How to Make Fried Rice recipe, though you could also combine it with quinoa or stir-fried vegetables. Or you could eat it as is! It's delicious as a main dish or an accent to any larger meal. If you're going for rice, brown is healthier than white. How to Cook Rice can get you started -- but it's generally 1 part rice to 2 parts water and that's it. Who knew you were such a chef? In the Oven Combine egg, sugar and soy sauce in a small bowl. Roll your pork cubes in this mixture and be sure to give each a good, even coating. You could roll them all one by one or you could just throw them all in there and go for it -- they'll be getting coated in cornstarch here in a second. Put 1/4 cup corn starch in its own bowl. You'll need to do these all one at a time. Roll each cube lightly in the corn starch, coating each piece entirely. Don't try to do it with a spoon or chopsticks -- just get in there with your fingers! The process will go a lot faster. Place the covered pork on a sprayed cookie sheet or baking dish and bake at 350\u00b0 for 25 minutes. For you Celsius fans, that's 176\u00b0. And an even 1500 seconds, if you were curious. While your pork is baking, if you'd like to prepare a rice dish, do so now. Quinoa works, too! Both take about the same amount of time. It's 1 part grain to 2 parts water and simmer -- that's all! Quarter the onion and bell pepper. Cut the celery stalks into 1\" pieces. If you'd like to add any more vegetables, have at it! The more color in your dish, the better. Try adding red bell pepper, carrots, cherry tomatoes, mushrooms, and broccoli, too. Heat a tablespoon or two of oil in a frying pan. Canola or vegetable oils work, but olive or safflower oil is much healthier. Once heated, throw in your veggies and start sauteing. Cover your pan to let it steam and to use less oil. Stir it occasionally, heating up all sides of your stir-fry, browning evenly. In a saucepan, combine remaining sugar, water, cider vinegar, salt and ketchup. Bring the concoction to a boil, then reduce the heat to medium low, simmering gently and stirring occasionally. If you'd like to add any other flavors, now's a good time to do so. Maybe a dash of honey or a touch of peanut sauce? Add the can of crushed pineapple and let simmer until pork is done. This should only be 10-15 minutes; the pineapple can become overcooked if you leave it in for much longer. Combine pork, vegetables and sauce in a large bowl or your baking dish. Then you can do with it as you please! Combine it with rice or whatever your heart desires. Add peas, carrots, and an egg to your rice to feel like Chinese got delivered right to your doorstep. In the Crockpot Drain the pineapple, but reserve the juice. The pineapple juice is an integral part of the sweet, tanginess of the dish. But don't throw out the pineapple! Refrigerate the chunks until you need to pull them back out. Which will be shortly! Place the cubed pork in your slow cooker, along with the green bell pepper and sliced onion. Other veggies are welcome, but know that potatoes and carrots take a bit longer to cook through than most other veggies. In a bowl, combine the brown sugar, cornstarch, pineapple juice (add water to make 3/4 cup if necessary), vinegar, water, soy sauce, and salt. Mix it together until smooth and pour over the contents in your crockpot. Cover and cook on the low setting for 8 hours. Add the pineapple chunks about 45 minutes before the end of the cooking time. Stir and get ready to serve! Prepare rice or another side to join with your pork. The sweet and sour pork will be great by itself, but it's even better with white or brown rice, egg noodles or quinoa. It just takes 15 minutes or so with some boiled water and you're set!",
  "tyn_model":[
    "rice",
    "pineapple",
    "water",
    "cornstarch",
    "onion",
    "frying pan",
    "pork",
    "soy sauce",
    "salt",
    "pepper",
    "quinoa",
    "carrots",
    "oil",
    "pineapple juice",
    "vinegar",
    "brown sugar",
    "sugar",
    "corn starch",
    "vegetables",
    "crockpot",
    "olive oil",
    "olive",
    "stove",
    "paper towel",
    "garlic",
    "green onion",
    "plum sauce",
    "skillet",
    "green pepper",
    "stir-fried vegetables",
    "oven",
    "egg",
    "small bowl",
    "spoon",
    "cookie sheet or baking dish",
    "rice dish",
    "celery",
    "cherry tomatoes",
    "mushrooms",
    "broccoli",
    "canola or",
    "vegetable oils",
    "olive or",
    "stir-fry",
    "saucepan",
    "cider vinegar",
    "ketchup",
    "peanut sauce",
    "crushed pineapple",
    "large bowl",
    "baking dish",
    "peas",
    "slow cooker",
    "green bell pepper",
    "potatoes",
    "bowl",
    "boiled water"
  ],
  "tyn_section":[

  ]
}