{
  "title":"How to Insert a Shape in Photoshop",
  "url":"https://www.wikihow.com/Insert-a-Shape-in-Photoshop",
  "category_hierarchy":[
    "Hobbies and Crafts",
    "Drawing",
    "Drawing Shapes"
  ],
  "methods":[
    {
      "name":"Drawing a Shape",
      "steps":[
        {
          "headline":"Open your Photoshop project.",
          "description":"You can do this from the Photoshop File menu. Alternatively, you can open Windows File Explorer or Finder, right-click the file, select Open With, and then Photoshop."
        },
        {
          "headline":"Click on the Shape Tool icon.",
          "description":"This is in the menu along the left of the application window."
        },
        {
          "headline":"Click a Shape Tool.",
          "description":"You can choose a preset line, square, rectangle, polygon, ellipse, or circle. You can create a custom shape by clicking the sloppy star icon."
        },
        {
          "headline":"Click and hold over the canvas.",
          "description":"This will start your shape."
        },
        {
          "headline":"Drag your mouse to create the shape.",
          "description":"Your shape doesn't have to be perfect, as you can edit your shape once it's created on the canvas."
        },
        {
          "headline":"Edit the shape.",
          "description":"You can access the Move Tool from the menu on the left, or you can press M. When your cursor is over the shape, it will turn into a cross-hair icon with four arrows pointing out. This allows you to move the shape to a different location. To resize the shape, drag-and-drop the handles on any of its sides. You can change the shape's color by clicking on the colored boxes in the menu along the left side of the application window."
        }
      ]
    },
    {
      "name":"Inserting a Shape from Another File",
      "steps":[
        {
          "headline":"Open your Photoshop project.",
          "description":"You can do this from the Photoshop File menu. Alternatively, you can open Windows File Explorer or Finder, right-click the file, select Open With, and then Photoshop."
        },
        {
          "headline":"Open the file with the shape you want to insert.",
          "description":"You can do this the same way you opened the current project."
        },
        {
          "headline":"Drag and drop the shape to your Photoshop project.",
          "description":"This will be easiest to accomplish if you have the project and image/shape open side-by-side. You can access the Move Tool from the menu on the left, or you can press M. When your cursor is over the image/shape, it will turn into a cross-hair icon with four arrows pointing out. To resize the shape, drag-and-drop the handles on any of its sides."
        }
      ]
    }
  ],
  "text":" Drawing a Shape Open your Photoshop project. You can do this from the Photoshop File menu. Alternatively, you can open Windows File Explorer or Finder, right-click the file, select Open With, and then Photoshop. Click on the Shape Tool icon. This is in the menu along the left of the application window. Click a Shape Tool. You can choose a preset line, square, rectangle, polygon, ellipse, or circle. You can create a custom shape by clicking the sloppy star icon. Click and hold over the canvas. This will start your shape. Drag your mouse to create the shape. Your shape doesn't have to be perfect, as you can edit your shape once it's created on the canvas. Edit the shape. You can access the Move Tool from the menu on the left, or you can press M. When your cursor is over the shape, it will turn into a cross-hair icon with four arrows pointing out. This allows you to move the shape to a different location. To resize the shape, drag-and-drop the handles on any of its sides. You can change the shape's color by clicking on the colored boxes in the menu along the left side of the application window. Inserting a Shape from Another File Open your Photoshop project. You can do this from the Photoshop File menu. Alternatively, you can open Windows File Explorer or Finder, right-click the file, select Open With, and then Photoshop. Open the file with the shape you want to insert. You can do this the same way you opened the current project. Drag and drop the shape to your Photoshop project. This will be easiest to accomplish if you have the project and image/shape open side-by-side. You can access the Move Tool from the menu on the left, or you can press M. When your cursor is over the image/shape, it will turn into a cross-hair icon with four arrows pointing out. To resize the shape, drag-and-drop the handles on any of its sides.",
  "tyn_model":[
    "photoshop",
    "canvas",
    "mouse",
    "photoshop file"
  ],
  "tyn_section":[

  ]
}