{
  "title":"How to Preserve Onions",
  "url":"https://www.wikihow.com/Preserve-Onions",
  "category_hierarchy":[
    "Food and Entertaining",
    "Recipes",
    "Fruits and Vegetables",
    "Onions"
  ],
  "methods":[
    {
      "name":"Curing and Storing Whole Onions",
      "steps":[
        {
          "headline":"Cure freshly-harvested onions by laying them in a dry place.",
          "description":"Spread your onions in a single layer in a warm, dry place, like the floor of a garage. Wait until the necks of the onions are no longer green and the stems are dry. This may take more than a week! Once your onions are cured, trim their roots off with scissors. The onions are ready to store. If you\u2019ve bought your onions at the supermarket, they\u2019re already cured."
        },
        {
          "headline":"Place the onions in mesh bags.",
          "description":"The mesh will make sure they stay dry. If you have lots of onions that you want to keep organized after a harvest, sort the onions by size and place them in separate mesh bags. Do not wash your onions before storing them. The dampness from washing the onions would be the perfect habitat for mold."
        },
        {
          "headline":"Store the onions in a cool, dark, dry spot.",
          "description":"The ideal temperature is between 32\u00b0 F (0\u00b0C) and 40\u00b0 F (4.4\u00b0C). A garage, shed, cellar, or dark closet will do. If you have a root cellar, it may be slightly warmer, but that\u2019s all right. Mild onions should be used within a few weeks. Pungent onions can last months in storage."
        },
        {
          "headline":"Use a dehumidifier if you live in a humid climate.",
          "description":"High humidity causes onions to sprout, rot, and grow mold. A dehumidifier will keep the humidity down and make sure your onions stay good. Check your onions regularly for soft spots and sprouting. Even if you don\u2019t live in a particularly humid climate, make sure that you\u2019re storing your onions in a well-ventilated place, to prevent rot."
        }
      ]
    },
    {
      "name":"Dehydrating Onions",
      "steps":[
        {
          "headline":"Peel the onions and slice them into \u20448 in (0.32 cm) rings thick.",
          "description":"Peel off the outer paper shells of the onions, then cut off the tops and root ends of each one. Place an onion on a cutting board, then slice it into \u20448 in (0.32 cm) using a large, non-serrated knife. Remember to always use caution when you're using a knife. Hold the onion securely with your free hand so it doesn't slip when you're cutting it. As you do that, be sure to keep your fingers curled in toward the palm of your hand so you don't cut yourself."
        },
        {
          "headline":"Place the onion slices in a dehydrator at 140\u00b0F (60\u00b0C) until they\u2019re nearly dry.",
          "description":"Check their drying progress every hour. Depending on the onions and humidity, it may take 3 to 9 hours to get the onion rings almost all the way dry. Stop before they are entirely dry to prevent browning them."
        },
        {
          "headline":"Turn the temperature down to 130\u00b0F (54\u00b0C) and dry the onions another hour.",
          "description":"Turning the temperature down will keep the onions from browning. Keep testing for dryness every ten minutes, and take the onions out when they are all the way dry. If you don\u2019t own a dehydrator, try drying your onions in the oven. Spread the rings on a cookie sheet and leave them in a slightly warm oven for many hours, checking dryness regularly."
        },
        {
          "headline":"Remove the onions from the dehydrator, cool, and store them.",
          "description":"Make sure the onions are completely cool before you place them into a sealed container. Store your dehydrated onions in a cool, dry place. Properly stored, dehydrated onions can last up to 2 years!"
        }
      ]
    },
    {
      "name":"Freezing Onions",
      "steps":[
        {
          "headline":"Chop of the root ends and the onion tops.",
          "description":"Place the onions on a cutting board, and cut off the tops and roots with a large, unserrated knife. Make sure keep your fingers away from the knife blade."
        },
        {
          "headline":"Slice the onion in half and peel.",
          "description":"Place the onion upright on the flat surface that you\u2019ve made by cutting off the onion top. Slice the onion vertically down the middle. This will make it easier to peel. Then peel off the papery outer layers of the onion. Stop peeling when the layers are fleshy, but don't worry if you've peeled a few extra layers by accident."
        },
        {
          "headline":"Puree the onions in a blender or food processor.",
          "description":"Depending on the strength of your blender, you may need to chop your onions into smaller pieces before putting them into the blender. Blend until there are no chunks and it's a nice, smooth consistency."
        },
        {
          "headline":"Pour the puree into ice cube trays and freeze.",
          "description":"Let the cubes freeze overnight. Once they are all frozen, take them out of the ice cube tray. They should be totally solid, so if they still seem mushy, freeze them for longer."
        },
        {
          "headline":"Transfer the cubes of onion puree into a plastic bag in your freezer.",
          "description":"This will free up your ice cube trays for making ice. Your frozen onion cubes will be great for soups and gravies. Make sure you wash your trays thoroughly before using again. They are going to have quite the scent! Use frozen onions within a month or two for best flavor."
        }
      ]
    }
  ],
  "text":" Curing and Storing Whole Onions Cure freshly-harvested onions by laying them in a dry place. Spread your onions in a single layer in a warm, dry place, like the floor of a garage. Wait until the necks of the onions are no longer green and the stems are dry. This may take more than a week! Once your onions are cured, trim their roots off with scissors. The onions are ready to store. If you\u2019ve bought your onions at the supermarket, they\u2019re already cured. Place the onions in mesh bags. The mesh will make sure they stay dry. If you have lots of onions that you want to keep organized after a harvest, sort the onions by size and place them in separate mesh bags. Do not wash your onions before storing them. The dampness from washing the onions would be the perfect habitat for mold. Store the onions in a cool, dark, dry spot. The ideal temperature is between 32\u00b0 F (0\u00b0C) and 40\u00b0 F (4.4\u00b0C). A garage, shed, cellar, or dark closet will do. If you have a root cellar, it may be slightly warmer, but that\u2019s all right. Mild onions should be used within a few weeks. Pungent onions can last months in storage. Use a dehumidifier if you live in a humid climate. High humidity causes onions to sprout, rot, and grow mold. A dehumidifier will keep the humidity down and make sure your onions stay good. Check your onions regularly for soft spots and sprouting. Even if you don\u2019t live in a particularly humid climate, make sure that you\u2019re storing your onions in a well-ventilated place, to prevent rot. Dehydrating Onions Peel the onions and slice them into \u20448 in (0.32 cm) rings thick. Peel off the outer paper shells of the onions, then cut off the tops and root ends of each one. Place an onion on a cutting board, then slice it into \u20448 in (0.32 cm) using a large, non-serrated knife. Remember to always use caution when you're using a knife. Hold the onion securely with your free hand so it doesn't slip when you're cutting it. As you do that, be sure to keep your fingers curled in toward the palm of your hand so you don't cut yourself. Place the onion slices in a dehydrator at 140\u00b0F (60\u00b0C) until they\u2019re nearly dry. Check their drying progress every hour. Depending on the onions and humidity, it may take 3 to 9 hours to get the onion rings almost all the way dry. Stop before they are entirely dry to prevent browning them. Turn the temperature down to 130\u00b0F (54\u00b0C) and dry the onions another hour. Turning the temperature down will keep the onions from browning. Keep testing for dryness every ten minutes, and take the onions out when they are all the way dry. If you don\u2019t own a dehydrator, try drying your onions in the oven. Spread the rings on a cookie sheet and leave them in a slightly warm oven for many hours, checking dryness regularly. Remove the onions from the dehydrator, cool, and store them. Make sure the onions are completely cool before you place them into a sealed container. Store your dehydrated onions in a cool, dry place. Properly stored, dehydrated onions can last up to 2 years! Freezing Onions Chop of the root ends and the onion tops. Place the onions on a cutting board, and cut off the tops and roots with a large, unserrated knife. Make sure keep your fingers away from the knife blade. Slice the onion in half and peel. Place the onion upright on the flat surface that you\u2019ve made by cutting off the onion top. Slice the onion vertically down the middle. This will make it easier to peel. Then peel off the papery outer layers of the onion. Stop peeling when the layers are fleshy, but don't worry if you've peeled a few extra layers by accident. Puree the onions in a blender or food processor. Depending on the strength of your blender, you may need to chop your onions into smaller pieces before putting them into the blender. Blend until there are no chunks and it's a nice, smooth consistency. Pour the puree into ice cube trays and freeze. Let the cubes freeze overnight. Once they are all frozen, take them out of the ice cube tray. They should be totally solid, so if they still seem mushy, freeze them for longer. Transfer the cubes of onion puree into a plastic bag in your freezer. This will free up your ice cube trays for making ice. Your frozen onion cubes will be great for soups and gravies. Make sure you wash your trays thoroughly before using again. They are going to have quite the scent! Use frozen onions within a month or two for best flavor.",
  "tyn_model":[
    "onions",
    "onion",
    "dehydrator",
    "blender",
    "mesh bags",
    "dehumidifier",
    "knife",
    "oven",
    "ice cube trays",
    "scissors",
    "cookie sheet",
    "knife blade",
    "food processor",
    "ice cube tray",
    "plastic bag"
  ],
  "tyn_section":[

  ]
}