{
  "title":"How to Clean Metal Jewelry",
  "url":"https://www.wikihow.com/Clean-Metal-Jewelry",
  "category_hierarchy":[
    "Home and Garden",
    "Housekeeping",
    "Cleaning"
  ],
  "methods":[
    {
      "name":"Cleaning Stainless Steel Jewelry",
      "steps":[
        {
          "headline":"Soak your stainless steel in soapy water and rub it clean.",
          "description":"Fill a bowl with warm water and add a few drops of mild, liquid soap. Soak your jewelry for a few minutes, and then rub it with a soft cloth, not a paper tissue. If your jewelry has grooves or engravings, use a soft toothbrush to clean all the detailing."
        },
        {
          "headline":"Wash with baking soda, water, and a soft toothbrush if it\u2019s still dirty.",
          "description":"First mix a little bit of baking soda and water together to make a paste\u2014the exact proportions don\u2019t matter. Gently rub the jewelry with the paste. You can also use a simple toothpaste that doesn\u2019t contain silica or whitening agents."
        },
        {
          "headline":"Rinse in warm water and dry with a lint-free cloth.",
          "description":"Rinse it with warm water until all the soap or paste is gone. Wipe the jewelry down thoroughly with a dry, soft cloth, taking care to ensure there are no water droplets left on your jewelry."
        },
        {
          "headline":"Store stainless steel jewelry separately from other metals.",
          "description":"Even though it doesn\u2019t tarnish as easily as silver, it can still get scratched. It\u2019s best to keep your jewelry in individual plastic bags or fabric pouches. Even if you are storing earrings, it\u2019s best to keep each one in its own little bag."
        }
      ]
    },
    {
      "name":"Polishing Silver Jewelry",
      "steps":[
        {
          "headline":"Soak your silver to remove dirt or oil.",
          "description":"Prepare a solution of warm water and a few drops of ammonia- and phosphate-free dish soap in a bowl. Soak your silver in the bowl for a minute, then remove and dry with a soft cotton cloth. If there are stubborn dirt spots remaining, brush them gently using a soft, baby toothbrush. If you want to clean a diamond ring, it won\u2019t hurt the diamond to soak it. If your silver is tarnished as well as dirty, move on to polishing it."
        },
        {
          "headline":"Rub your silver with a dry microfiber cloth to remove tarnish.",
          "description":"You can use a silver cloth, lint-free flannel, or another soft cloth, but not a paper tissue. Rub in long motions, rather than little circles. Often just the act of rubbing the silver will remove the tarnish. As your polishing cloth darkens, move it so you are rubbing with a clean section of the cloth."
        },
        {
          "headline":"Polish your silver with home-made silver cleaner if it\u2019s still tarnished.",
          "description":"Line the bottom of a glass baking dish with aluminum foil. Fill the container with about a cup of steaming hot water. Add about 1 tablespoon of baking soda and 1 tablespoon of salt. Wait until all the baking soda and salt is dissolved, then drop the silver in. You should see the mixture bubbling after you but the silver in, which shows the reaction\u2019s working. Turn the jewelry over after a few minutes so the other side touches the aluminum."
        },
        {
          "headline":"Remove tarnish with a store-bought silver polish as a last resort.",
          "description":"Wear gloves and be sure to follow the instructions on the polish. If you\u2019re using a silver dip, quickly dip the silver in. If using a paste, rub it on with a cloth using straight line motions. Take care when polishing silver-plated jewelry, because you don\u2019t want to wear through the plating. Be careful if there are gemstones, because the polish might remove a gem\u2019s protective coating."
        },
        {
          "headline":"Rinse and dry your jewelry.",
          "description":"Whether you\u2019ve cleaned your silver with soapy water, homemade silver cleaner, or polish, you should thoroughly rinse your silver after cleaning it. Then, dry the silver with a clean, soft cloth, rather than a paper tissue or towel."
        },
        {
          "headline":"Store your silver in individual, air-tight bags to prevent future tarnish.",
          "description":"You can keep the jewelry in plastic bags, but a tarnish-resistant flannel bag will work even better. Don\u2019t put more than one piece of silver jewelry in the same bag, because they might tangle and scratch each other. You can also throw a silica gel packet into each bag for extra protection."
        }
      ]
    },
    {
      "name":"Cleaning Costume Jewelry",
      "steps":[
        {
          "headline":"Brush your costume jewelry with a mixture of baby shampoo and water.",
          "description":"Use a microfiber cloth (like the kind used for cleaning eyeglasses) or a soft, new toothbrush. Rub very gently, because you don\u2019t want to rub through the plating. Carefully remove the verdigris, the green plaque that builds up on costume jewelry. Jewelry cleansers are too harsh for costume jewelry, so it\u2019s best to stick to gentle detergents like baby shampoo."
        },
        {
          "headline":"Rinse the jewelry quickly in cool water.",
          "description":"The fake gems in costume jewelry are normally glued on, so if you keep the piece wet for too long, the water will loosen the glue. If there are rhinestone on your jewelry, soaking them might remove the foil that keeps the rhinestones shiny."
        },
        {
          "headline":"Dry with a towel or a cool blow dryer.",
          "description":"Dry the piece immediately after rinsing with a soft, clean cloth. You can use a blow dryer on a cool setting to make sure it\u2019s totally dry. If you use a warm setting, the glue holding the gems might melt of the jewelry might warp. Keeping your costume jewelry dry will help it last much longer, so take it off before swimming or bathing."
        }
      ]
    },
    {
      "name":"Washing Gold Jewelry",
      "steps":[
        {
          "headline":"Soak the gold in a soapy water solution for 1 minute.",
          "description":"Fill a bowl with warm water and a few drops of liquid soap. Make this solution in a bowl, rather than the sink, so you don\u2019t risk losing anything down the drain. If you\u2019re cleaning a small piece of jewelry, you may want to put it in a strainer before submerging it, so you can easily take it out again. If you\u2019re cleaning a diamond ring, you may want to soak for 20 minutes."
        },
        {
          "headline":"Lay the gold jewelry on a soft cloth and clean with a soft toothbrush.",
          "description":"Use a soft, new toothbrush and work the bristles into any little crevices on your jewelry. A toothbrush will be able to reach places that you can\u2019t clean simply with your hands. A toothbrush made for babies is a good option, because they tend to be softer. Don\u2019t use a toothbrush that\u2019s been previously used for brushing teeth!"
        },
        {
          "headline":"Soak the gold in an ammonia solution if it\u2019s still dirty.",
          "description":"Add six parts water and one part ammonia to a bowl. You only need enough of this solution so that your gold can totally submerge. Put the gold in the bowl, and soak it for up to a minute. Don\u2019t leave it too long, because the ammonia can damage the gold."
        },
        {
          "headline":"Rinse the jewelry under running water and dry it with a soft cloth.",
          "description":"Don\u2019t dry your gold jewelry with paper towels or tissues. Instead, use a soft cotton cloth or a microfiber cloth, like the kind you would use to clean eyeglasses. Don\u2019t leave drops of water, because they can make the jewelry tarnish quicker."
        },
        {
          "headline":"Keep your gold clean by keeping it away from lotion, chlorine, and soap.",
          "description":"Take off gold jewelry before you take a bath or go for a swim. Before using household cleaners, you should remove any gold jewelry on your hands, or wear gloves over the jewelry. Remember, gold is a soft metal that scratches easily, so don\u2019t let it rub up against other metals."
        }
      ]
    }
  ],
  "text":" Cleaning Stainless Steel Jewelry Soak your stainless steel in soapy water and rub it clean. Fill a bowl with warm water and add a few drops of mild, liquid soap. Soak your jewelry for a few minutes, and then rub it with a soft cloth, not a paper tissue. If your jewelry has grooves or engravings, use a soft toothbrush to clean all the detailing. Wash with baking soda, water, and a soft toothbrush if it\u2019s still dirty. First mix a little bit of baking soda and water together to make a paste\u2014the exact proportions don\u2019t matter. Gently rub the jewelry with the paste. You can also use a simple toothpaste that doesn\u2019t contain silica or whitening agents. Rinse in warm water and dry with a lint-free cloth. Rinse it with warm water until all the soap or paste is gone. Wipe the jewelry down thoroughly with a dry, soft cloth, taking care to ensure there are no water droplets left on your jewelry. Store stainless steel jewelry separately from other metals. Even though it doesn\u2019t tarnish as easily as silver, it can still get scratched. It\u2019s best to keep your jewelry in individual plastic bags or fabric pouches. Even if you are storing earrings, it\u2019s best to keep each one in its own little bag. Polishing Silver Jewelry Soak your silver to remove dirt or oil. Prepare a solution of warm water and a few drops of ammonia- and phosphate-free dish soap in a bowl. Soak your silver in the bowl for a minute, then remove and dry with a soft cotton cloth. If there are stubborn dirt spots remaining, brush them gently using a soft, baby toothbrush. If you want to clean a diamond ring, it won\u2019t hurt the diamond to soak it. If your silver is tarnished as well as dirty, move on to polishing it. Rub your silver with a dry microfiber cloth to remove tarnish. You can use a silver cloth, lint-free flannel, or another soft cloth, but not a paper tissue. Rub in long motions, rather than little circles. Often just the act of rubbing the silver will remove the tarnish. As your polishing cloth darkens, move it so you are rubbing with a clean section of the cloth. Polish your silver with home-made silver cleaner if it\u2019s still tarnished. Line the bottom of a glass baking dish with aluminum foil. Fill the container with about a cup of steaming hot water. Add about 1 tablespoon of baking soda and 1 tablespoon of salt. Wait until all the baking soda and salt is dissolved, then drop the silver in. You should see the mixture bubbling after you but the silver in, which shows the reaction\u2019s working. Turn the jewelry over after a few minutes so the other side touches the aluminum. Remove tarnish with a store-bought silver polish as a last resort. Wear gloves and be sure to follow the instructions on the polish. If you\u2019re using a silver dip, quickly dip the silver in. If using a paste, rub it on with a cloth using straight line motions. Take care when polishing silver-plated jewelry, because you don\u2019t want to wear through the plating. Be careful if there are gemstones, because the polish might remove a gem\u2019s protective coating. Rinse and dry your jewelry. Whether you\u2019ve cleaned your silver with soapy water, homemade silver cleaner, or polish, you should thoroughly rinse your silver after cleaning it. Then, dry the silver with a clean, soft cloth, rather than a paper tissue or towel. Store your silver in individual, air-tight bags to prevent future tarnish. You can keep the jewelry in plastic bags, but a tarnish-resistant flannel bag will work even better. Don\u2019t put more than one piece of silver jewelry in the same bag, because they might tangle and scratch each other. You can also throw a silica gel packet into each bag for extra protection. Cleaning Costume Jewelry Brush your costume jewelry with a mixture of baby shampoo and water. Use a microfiber cloth (like the kind used for cleaning eyeglasses) or a soft, new toothbrush. Rub very gently, because you don\u2019t want to rub through the plating. Carefully remove the verdigris, the green plaque that builds up on costume jewelry. Jewelry cleansers are too harsh for costume jewelry, so it\u2019s best to stick to gentle detergents like baby shampoo. Rinse the jewelry quickly in cool water. The fake gems in costume jewelry are normally glued on, so if you keep the piece wet for too long, the water will loosen the glue. If there are rhinestone on your jewelry, soaking them might remove the foil that keeps the rhinestones shiny. Dry with a towel or a cool blow dryer. Dry the piece immediately after rinsing with a soft, clean cloth. You can use a blow dryer on a cool setting to make sure it\u2019s totally dry. If you use a warm setting, the glue holding the gems might melt of the jewelry might warp. Keeping your costume jewelry dry will help it last much longer, so take it off before swimming or bathing. Washing Gold Jewelry Soak the gold in a soapy water solution for 1 minute. Fill a bowl with warm water and a few drops of liquid soap. Make this solution in a bowl, rather than the sink, so you don\u2019t risk losing anything down the drain. If you\u2019re cleaning a small piece of jewelry, you may want to put it in a strainer before submerging it, so you can easily take it out again. If you\u2019re cleaning a diamond ring, you may want to soak for 20 minutes. Lay the gold jewelry on a soft cloth and clean with a soft toothbrush. Use a soft, new toothbrush and work the bristles into any little crevices on your jewelry. A toothbrush will be able to reach places that you can\u2019t clean simply with your hands. A toothbrush made for babies is a good option, because they tend to be softer. Don\u2019t use a toothbrush that\u2019s been previously used for brushing teeth! Soak the gold in an ammonia solution if it\u2019s still dirty. Add six parts water and one part ammonia to a bowl. You only need enough of this solution so that your gold can totally submerge. Put the gold in the bowl, and soak it for up to a minute. Don\u2019t leave it too long, because the ammonia can damage the gold. Rinse the jewelry under running water and dry it with a soft cloth. Don\u2019t dry your gold jewelry with paper towels or tissues. Instead, use a soft cotton cloth or a microfiber cloth, like the kind you would use to clean eyeglasses. Don\u2019t leave drops of water, because they can make the jewelry tarnish quicker. Keep your gold clean by keeping it away from lotion, chlorine, and soap. Take off gold jewelry before you take a bath or go for a swim. Before using household cleaners, you should remove any gold jewelry on your hands, or wear gloves over the jewelry. Remember, gold is a soft metal that scratches easily, so don\u2019t let it rub up against other metals.",
  "tyn_model":[
    "water",
    "bowl",
    "baking soda",
    "silver",
    "toothbrush",
    "jewelry",
    "ammonia",
    "microfiber cloth",
    "salt",
    "soapy water",
    "baby shampoo",
    "blow dryer",
    "stainless steel",
    "mild, liquid soap",
    "\u2014the",
    "stainless steel jewelry",
    "dish soap",
    "silver cloth",
    "polishing cloth",
    "home-made silver cleaner",
    "baking dish",
    "aluminum foil",
    "steaming hot water",
    "silver polish",
    "silver cleaner",
    "polish",
    "silica gel",
    "jewelry cleansers",
    "towel",
    "liquid soap",
    "strainer",
    "lotion",
    "chlorine",
    "soap",
    "household cleaners",
    "gloves",
    "gold"
  ],
  "tyn_section":[

  ]
}