{
  "title":"How to Remove Rust from Aluminum",
  "url":"https://www.wikihow.com/Remove-Rust-from-Aluminum",
  "category_hierarchy":[
    "Home and Garden",
    "Housekeeping",
    "Cleaning"
  ],
  "methods":[
    {
      "name":"Removing Stains with Steel Wool",
      "steps":[
        {
          "headline":"Get the correct steel wool.",
          "description":"Steel wool comes in several different levels of abrasiveness. The level that should be used for stains grade 0000 to 000000, and it should be very fine. Steel wool that is too fine won't be effective, and steel wool that is too abrasive is not necessary."
        },
        {
          "headline":"Try the steel wool on a small area.",
          "description":"Aluminum may or may not be damaged by steel wool depending on the specific piece. If steel wool is going to work, then it should not leave heavy scratches and damage on the small area. If it does leave damage, try another method in this article."
        },
        {
          "headline":"Rub out the stains, similar to if you were to use a sponge or sandpaper.",
          "description":"Keep going until the steel wool manages to scrape away all of the rust. The metal should now look cleaner than it did before after the rust has been removed. This will also remove powder that forms as a result of oxidization of aluminum."
        },
        {
          "headline":"Give it a wash for final measure.",
          "description":"It is a good idea to wash the aluminum after you have finished using steel wool on it. These will ensure that it is clean."
        }
      ]
    },
    {
      "name":"Using a Commercial Rust Remover",
      "steps":[
        {
          "headline":"Get a commercial rust remover.",
          "description":"Even though you are cleaning stains, you still need to use a cleaner meant for cleaning rust. This is a great option for highly polished and shiny aluminum. The steel wool could do damage to polished aluminum."
        },
        {
          "headline":"Get a cloth, nylon scrubbing pad, or something you know won't damage the metal.",
          "description":"If you are working with polished aluminum, use a very gentle option. Don't use something too abrasive, or you could leave scratches. For older less shiny aluminum, you will usually be fine with something a little bit more rough."
        },
        {
          "headline":"Rub well until the rust starts dissolving.",
          "description":"The rust stain will start to fall apart and come off of the metal when you have been rubbing for long enough. After all of the rust is off, you are getting closer to a clean, shiny aluminum without stains."
        },
        {
          "headline":"Give it a final wash to make sure all of the rust is gone.",
          "description":"This should be done after a cleaning procedure for good measure. You should be left with an unstained aluminum after the washing is done."
        }
      ]
    },
    {
      "name":"Rubbing Away Stains with a Simple Foil Ball",
      "steps":[
        {
          "headline":"Create a fairly large ball out of aluminum foil.",
          "description":"Make sure that the shiny side of the aluminum foil is facing outwards, and that it will be big enough to scrape away the rust."
        },
        {
          "headline":"Begin the cleaning process by scrubbing all over the rust.",
          "description":"Keep going until the foil ball starts destroying it and the rust fully comes off. Depending on your situation, you may have to be somewhat vigorous. You may want test on a small area to see if it scratches."
        },
        {
          "headline":"Give it a final wash. Once again, this should be done after a cleaning procedure.",
          "description":"You can either soak the object in something like a bucket or do it in the sink. This helps to remove the last trace of a rust stain."
        }
      ]
    }
  ],
  "text":" Removing Stains with Steel Wool Get the correct steel wool. Steel wool comes in several different levels of abrasiveness. The level that should be used for stains grade 0000 to 000000, and it should be very fine. Steel wool that is too fine won't be effective, and steel wool that is too abrasive is not necessary. Try the steel wool on a small area. Aluminum may or may not be damaged by steel wool depending on the specific piece. If steel wool is going to work, then it should not leave heavy scratches and damage on the small area. If it does leave damage, try another method in this article. Rub out the stains, similar to if you were to use a sponge or sandpaper. Keep going until the steel wool manages to scrape away all of the rust. The metal should now look cleaner than it did before after the rust has been removed. This will also remove powder that forms as a result of oxidization of aluminum. Give it a wash for final measure. It is a good idea to wash the aluminum after you have finished using steel wool on it. These will ensure that it is clean. Using a Commercial Rust Remover Get a commercial rust remover. Even though you are cleaning stains, you still need to use a cleaner meant for cleaning rust. This is a great option for highly polished and shiny aluminum. The steel wool could do damage to polished aluminum. Get a cloth, nylon scrubbing pad, or something you know won't damage the metal. If you are working with polished aluminum, use a very gentle option. Don't use something too abrasive, or you could leave scratches. For older less shiny aluminum, you will usually be fine with something a little bit more rough. Rub well until the rust starts dissolving. The rust stain will start to fall apart and come off of the metal when you have been rubbing for long enough. After all of the rust is off, you are getting closer to a clean, shiny aluminum without stains. Give it a final wash to make sure all of the rust is gone. This should be done after a cleaning procedure for good measure. You should be left with an unstained aluminum after the washing is done. Rubbing Away Stains with a Simple Foil Ball Create a fairly large ball out of aluminum foil. Make sure that the shiny side of the aluminum foil is facing outwards, and that it will be big enough to scrape away the rust. Begin the cleaning process by scrubbing all over the rust. Keep going until the foil ball starts destroying it and the rust fully comes off. Depending on your situation, you may have to be somewhat vigorous. You may want test on a small area to see if it scratches. Give it a final wash. Once again, this should be done after a cleaning procedure. You can either soak the object in something like a bucket or do it in the sink. This helps to remove the last trace of a rust stain.",
  "tyn_model":[
    "steel wool",
    "aluminum",
    "aluminum foil",
    "sponge",
    "rust remover",
    "cleaner",
    "cloth",
    "foil ball",
    "foil",
    "bucket"
  ],
  "tyn_section":[

  ]
}