{
  "title":"How to Make Chicken Stock",
  "url":"https://www.wikihow.com/Make-Chicken-Stock",
  "category_hierarchy":[
    "Food and Entertaining",
    "Recipes",
    "Meat",
    "Poultry Recipes",
    "Chicken"
  ],
  "methods":[
    {
      "name":"Whole Roasted Chicken Stock",
      "steps":[
        {
          "headline":"Prepare the chicken carcass.",
          "description":"In order to make sure you don't waste meat, plan to make stock using a chicken carcass after you've made roasted chicken. Clean the carcass of meat, so only the bones remain. You can make this recipe with a pre-roasted chicken. Just read the ingredients and make sure the chicken doesn't contain additives. You can make this recipe with a fresh, uncooked chicken; just be sure to remove the meat first, and save it for later."
        },
        {
          "headline":"Boil the chicken carcass.",
          "description":"Place it in a large dutch oven or stockpot. Fill the pot to within 2 inches (5.1 cm) of the brim with water, so that the water covers the chicken carcass entirely. Place the stockpot on the stove and turn the burner to high. Bring the water to a boil."
        },
        {
          "headline":"Reduce the heat and add the vegetables.",
          "description":"Turn the burner down to medium or so, so the liquid comes to a consistent simmer. Add the celery, carrots, onions, parsley and bay leaves."
        },
        {
          "headline":"Cook the stock.",
          "description":"Keeping the liquid at a low simmer, cook the stock for 4 hours, uncovered. Monitor the pot to make sure it doesn't overflow, and skim off the foam every once in a while."
        },
        {
          "headline":"Remove the stock from heat.",
          "description":"Once the liquid has reduced by at least a third and turned a golden color, remove the stock from heat."
        },
        {
          "headline":"Strain the stock.",
          "description":"Place a large strainer over a bowl and pour the stock through the strainer to remove the bones and vegetables."
        },
        {
          "headline":"Remove the fat.",
          "description":"Cover the bowl of stock and put it in the refrigerator for an hour or two. As it cools, the fat will rise to the top. Use a spoon to skim it off the top before using the stock or storing it."
        }
      ]
    },
    {
      "name":"Quick Chicken Backs Stock",
      "steps":[
        {
          "headline":"Get chicken backs from your butcher.",
          "description":"This cut is usually really cheap, so it's a great choice if you don't want to pay for a whole chicken to roast. Chicken backs aren't always kept in view at the meat counter, so you might have to ask your butcher for some."
        },
        {
          "headline":"Brown the chicken backs.",
          "description":"Heat the oil in a large stockpot or dutch oven to medium high heat. When the oil is hot, put the chicken backs skin-side down in the oil. Saut\u00e9 the chicken backs until the skin becomes brown and crispy. Turn them over and saut\u00e9 the other side for a few minutes."
        },
        {
          "headline":"Cover the chicken backs with water and bring it to a boil.",
          "description":"Fill the stockpot with water so that it covers the chicken backs by about 1 inch (2.5 cm). Turn up the heat to high and bring the water to a rolling boil."
        },
        {
          "headline":"Reduce the heat and add the vegetables.",
          "description":"Throw in the celery, carrots, onion, parsley and bay leaves. Turn the heat down so the stock comes to a steady simmer."
        },
        {
          "headline":"Cook the stock.",
          "description":"Cook the stock at a simmer for about an hour, uncovered"
        },
        {
          "headline":"Strain the stock.",
          "description":"Place a strainer over a bowl and pour the stock through the strainer to remove the chicken backs and vegetables."
        },
        {
          "headline":"Remove the fat.",
          "description":"If you wish, cover the bowl and put the stock in the refrigerator until it cools down. Skim off the fat layer with a spoon and discard."
        }
      ]
    },
    {
      "name":"Using and Storing Homemade Chicken Stock",
      "steps":[
        {
          "headline":"Use it in soup.",
          "description":"Any soup you can dream up - from  chicken noodle to  broccoli to asparagus - tastes better when it's made with homemade stock. Substitute your homemade stock cup for cup for whatever your recipe requires."
        },
        {
          "headline":"Use it in risotto.",
          "description":"This is another dish that tastes infinitely better when it's made with homemade stock."
        },
        {
          "headline":"Store it for later.",
          "description":"Chicken stock takes a lot of time and effort to make, so you may want to make a huge batch you can store for later use. Put it in a food storage container that's tightly sealed, and freeze it for up to 5 months. You can freeze the stock in convenient portions that you can thaw out when you want to make a batch of soup by freezing it in 1 - 2 cup food containers. Freeze the stock in ice cube trays if you need it for recipes that require just a little stock."
        },
        {
          "headline":"Finished.",
          "description":""
        }
      ]
    }
  ],
  "text":" Whole Roasted Chicken Stock Prepare the chicken carcass. In order to make sure you don't waste meat, plan to make stock using a chicken carcass after you've made roasted chicken. Clean the carcass of meat, so only the bones remain. You can make this recipe with a pre-roasted chicken. Just read the ingredients and make sure the chicken doesn't contain additives. You can make this recipe with a fresh, uncooked chicken; just be sure to remove the meat first, and save it for later. Boil the chicken carcass. Place it in a large dutch oven or stockpot. Fill the pot to within 2 inches (5.1 cm) of the brim with water, so that the water covers the chicken carcass entirely. Place the stockpot on the stove and turn the burner to high. Bring the water to a boil. Reduce the heat and add the vegetables. Turn the burner down to medium or so, so the liquid comes to a consistent simmer. Add the celery, carrots, onions, parsley and bay leaves. Cook the stock. Keeping the liquid at a low simmer, cook the stock for 4 hours, uncovered. Monitor the pot to make sure it doesn't overflow, and skim off the foam every once in a while. Remove the stock from heat. Once the liquid has reduced by at least a third and turned a golden color, remove the stock from heat. Strain the stock. Place a large strainer over a bowl and pour the stock through the strainer to remove the bones and vegetables. Remove the fat. Cover the bowl of stock and put it in the refrigerator for an hour or two. As it cools, the fat will rise to the top. Use a spoon to skim it off the top before using the stock or storing it. Quick Chicken Backs Stock Get chicken backs from your butcher. This cut is usually really cheap, so it's a great choice if you don't want to pay for a whole chicken to roast. Chicken backs aren't always kept in view at the meat counter, so you might have to ask your butcher for some. Brown the chicken backs. Heat the oil in a large stockpot or dutch oven to medium high heat. When the oil is hot, put the chicken backs skin-side down in the oil. Saut\u00e9 the chicken backs until the skin becomes brown and crispy. Turn them over and saut\u00e9 the other side for a few minutes. Cover the chicken backs with water and bring it to a boil. Fill the stockpot with water so that it covers the chicken backs by about 1 inch (2.5 cm). Turn up the heat to high and bring the water to a rolling boil. Reduce the heat and add the vegetables. Throw in the celery, carrots, onion, parsley and bay leaves. Turn the heat down so the stock comes to a steady simmer. Cook the stock. Cook the stock at a simmer for about an hour, uncovered Strain the stock. Place a strainer over a bowl and pour the stock through the strainer to remove the chicken backs and vegetables. Remove the fat. If you wish, cover the bowl and put the stock in the refrigerator until it cools down. Skim off the fat layer with a spoon and discard. Using and Storing Homemade Chicken Stock Use it in soup. Any soup you can dream up - from  chicken noodle to  broccoli to asparagus - tastes better when it's made with homemade stock. Substitute your homemade stock cup for cup for whatever your recipe requires. Use it in risotto. This is another dish that tastes infinitely better when it's made with homemade stock. Store it for later. Chicken stock takes a lot of time and effort to make, so you may want to make a huge batch you can store for later use. Put it in a food storage container that's tightly sealed, and freeze it for up to 5 months. You can freeze the stock in convenient portions that you can thaw out when you want to make a batch of soup by freezing it in 1 - 2 cup food containers. Freeze the stock in ice cube trays if you need it for recipes that require just a little stock. Finished. ",
  "tyn_model":[
    "stock",
    "chicken",
    "water",
    "strainer",
    "bowl",
    "stockpot",
    "oil",
    "pot",
    "burner",
    "vegetables",
    "celery",
    "carrots",
    "parsley",
    "bay leaves",
    "refrigerator",
    "spoon",
    "large dutch oven",
    "stove",
    "onions",
    "chicken backs stock",
    "large stockpot or dutch oven",
    "onion",
    "chicken noodle to",
    "broccoli",
    "chicken stock",
    "food storage container",
    "food containers",
    "ice cube trays"
  ],
  "tyn_section":[

  ]
}