{
  "title":"How to Hem Jeans",
  "url":"https://www.wikihow.com/Hem-Jeans",
  "category_hierarchy":[
    "Hobbies and Crafts",
    "Crafts",
    "Sewing",
    "Sewing Skills",
    "Hemming"
  ],
  "methods":[
    {
      "name":"Keeping the Original Hem",
      "steps":[
        {
          "headline":"Decide where to hem.",
          "description":"Try on your jeans and decide where you would like to hem them. Generally, jeans should fall about an inch above the floor. This will prevent you from tripping and also avoid making your jeans look like they are a size too small. Feel free to alter the length to meet your personal preferences though."
        },
        {
          "headline":"Fold up the bottom.",
          "description":"Create a cuff where you want the jeans to be hemmed. Crease the fold so it lies flat and double-check that you've folded it up by the correct amount. Once you've done this on one side, measure just below the preexisting hem and use that measurement to create an equal fold on the other leg."
        },
        {
          "headline":"Pin the hem in place.",
          "description":"Place straight pins around the circumference of the pant leg to hold it in place. Check to be sure the seams line up on each pant leg as well as that they are even with each other."
        },
        {
          "headline":"Sew the hem.",
          "description":"Stitch around the circumference of the pant leg just below the stitching for the existing hem. You can use a sewing machine or do this by hand. To be clear, you will be sewing the cuff to the pant leg and later will fold it inside the leg. This will allow you to take out the hem later if you grow taller or want the pants longer at a later point in time."
        },
        {
          "headline":"Unfold the hem.",
          "description":"Tuck the excess fabric of the folded cuff up into the leg of the jeans, folding the original hem down so its outer side shows once again. This should leave you a small loop of fabric along the bottom edge of the jeans inside the leg. Try on the jeans to make sure they are at the correct length. If you don't expect to want to lengthen the jeans at any point, then you can also cut the excess fabric. Cut the excess fabric about 1 inch away from the new seam you have created."
        },
        {
          "headline":"Iron the jeans.",
          "description":"Use an iron to flatten out the hem you've created along the bottom edge. This will smooth out the loop of fabric tucked into the leg, and leave your jeans looking the perfect length with no tell-tale hemming signs."
        }
      ]
    },
    {
      "name":"Creating a New Hem",
      "steps":[
        {
          "headline":"Mark your jeans where you'd like the new hem to be.",
          "description":"The best way to do this is to put your jeans on (or have the person who will be wearing the jeans put them on) and fold the cuff under until the jeans are the length you'd like them to be. Then, use a piece of chalk to mark the spot where the new hem should end."
        },
        {
          "headline":"Measure and mark two more lines.",
          "description":"Measure \u00bd\u201d from the hem line and draw a line above it that is running parallel to the first one. Then, measure and mark another \u00bd\u201d below the original line and draw the line so it is parallel to the original one as well. Now you should have three lines total. These lines will serve as a guide for you to sew the new hem."
        },
        {
          "headline":"Cut along the bottom line.",
          "description":"Cut off the bottom of the jeans and the old hem. To do this, cut in a straight line along the bottom line that you made. Discard the material that you cut off."
        },
        {
          "headline":"Fold the new hem under.",
          "description":"Next, fold along the center chalk line to create the new hem. You may also want to pin along the new hem to hold it in place while you sew. Check to make sure that the hem is even all the way around before you sew."
        },
        {
          "headline":"Sew the new hem.",
          "description":"Using some gold denim thread, or the thread color of your choice, sew around the area you pinned to hold the new hem in place. Use a straight stitch and try to keep it as even as possible. Remove the pins as you go. After you sew around both hems, your jeans will be ready to wear!"
        }
      ]
    },
    {
      "name":"Ensuring a Successful Project",
      "steps":[
        {
          "headline":"Wash the jeans first if they are new.",
          "description":"Denim will shrink a bit the first time you wash it, so it is a good idea to do a pre-wash before hemming your jeans. This will help to ensure that you do not make the hem too short. Make sure to follow the instructions on the label for washing your jeans."
        },
        {
          "headline":"Use a new needle.",
          "description":"It is important to change your sewing machine needle after every four hours of sewing or after finishing a major project to ensure that it is sharp enough to do the job. If you have not changed the needle in a while, then put in a new needle before you begin sewing the new hem."
        },
        {
          "headline":"Go slow.",
          "description":"Denim and other bulky fabrics can be a bit harder to sew. They may get caught more easily, or not move as efficiently through the presser foot. To ensure that your stitches are even and straight, sew slowly. Start by applying very light pressure on the pedal to get the stitches started and then only increase the speed slightly if the fabric seems to be moving along well. If the fabric gets stuck, then you can always use the hand wheel to help move it along."
        }
      ]
    }
  ],
  "text":" Keeping the Original Hem Decide where to hem. Try on your jeans and decide where you would like to hem them. Generally, jeans should fall about an inch above the floor. This will prevent you from tripping and also avoid making your jeans look like they are a size too small. Feel free to alter the length to meet your personal preferences though. Fold up the bottom. Create a cuff where you want the jeans to be hemmed. Crease the fold so it lies flat and double-check that you've folded it up by the correct amount. Once you've done this on one side, measure just below the preexisting hem and use that measurement to create an equal fold on the other leg. Pin the hem in place. Place straight pins around the circumference of the pant leg to hold it in place. Check to be sure the seams line up on each pant leg as well as that they are even with each other. Sew the hem. Stitch around the circumference of the pant leg just below the stitching for the existing hem. You can use a sewing machine or do this by hand. To be clear, you will be sewing the cuff to the pant leg and later will fold it inside the leg. This will allow you to take out the hem later if you grow taller or want the pants longer at a later point in time. Unfold the hem. Tuck the excess fabric of the folded cuff up into the leg of the jeans, folding the original hem down so its outer side shows once again. This should leave you a small loop of fabric along the bottom edge of the jeans inside the leg. Try on the jeans to make sure they are at the correct length. If you don't expect to want to lengthen the jeans at any point, then you can also cut the excess fabric. Cut the excess fabric about 1 inch away from the new seam you have created. Iron the jeans. Use an iron to flatten out the hem you've created along the bottom edge. This will smooth out the loop of fabric tucked into the leg, and leave your jeans looking the perfect length with no tell-tale hemming signs. Creating a New Hem Mark your jeans where you'd like the new hem to be. The best way to do this is to put your jeans on (or have the person who will be wearing the jeans put them on) and fold the cuff under until the jeans are the length you'd like them to be. Then, use a piece of chalk to mark the spot where the new hem should end. Measure and mark two more lines. Measure \u00bd\u201d from the hem line and draw a line above it that is running parallel to the first one. Then, measure and mark another \u00bd\u201d below the original line and draw the line so it is parallel to the original one as well. Now you should have three lines total. These lines will serve as a guide for you to sew the new hem. Cut along the bottom line. Cut off the bottom of the jeans and the old hem. To do this, cut in a straight line along the bottom line that you made. Discard the material that you cut off. Fold the new hem under. Next, fold along the center chalk line to create the new hem. You may also want to pin along the new hem to hold it in place while you sew. Check to make sure that the hem is even all the way around before you sew. Sew the new hem. Using some gold denim thread, or the thread color of your choice, sew around the area you pinned to hold the new hem in place. Use a straight stitch and try to keep it as even as possible. Remove the pins as you go. After you sew around both hems, your jeans will be ready to wear! Ensuring a Successful Project Wash the jeans first if they are new. Denim will shrink a bit the first time you wash it, so it is a good idea to do a pre-wash before hemming your jeans. This will help to ensure that you do not make the hem too short. Make sure to follow the instructions on the label for washing your jeans. Use a new needle. It is important to change your sewing machine needle after every four hours of sewing or after finishing a major project to ensure that it is sharp enough to do the job. If you have not changed the needle in a while, then put in a new needle before you begin sewing the new hem. Go slow. Denim and other bulky fabrics can be a bit harder to sew. They may get caught more easily, or not move as efficiently through the presser foot. To ensure that your stitches are even and straight, sew slowly. Start by applying very light pressure on the pedal to get the stitches started and then only increase the speed slightly if the fabric seems to be moving along well. If the fabric gets stuck, then you can always use the hand wheel to help move it along.",
  "tyn_model":[
    "jeans",
    "fabric",
    "sewing machine",
    "iron",
    "denim",
    "straight pins",
    "chalk",
    "\u201d from",
    "\u201d below",
    "thread",
    "fabrics"
  ],
  "tyn_section":[

  ]
}