{
  "title":"How to Host a What Not to Wear Party",
  "url":"https://www.wikihow.com/Host-a-What-Not-to-Wear-Party",
  "category_hierarchy":[
    "Food and Entertaining",
    "Parties",
    "Theme Parties"
  ],
  "methods":[
    {
      "name":"Steps",
      "steps":[
        {
          "headline":"You can do this party one of two ways:",
          "description":"Make it just like the show, and invite one of your friends/family members that makes fashion faux-pas a little too often, then surprise them by saying they they're going to get a fashion makeover! This is a great idea for a surprise birthday party, because then all the guests could get the birthday person fashionable clothes or gift cards to cool stores. Tell all your guests to wear their most horrible outfits. Floor-length skirts, see-through shirts, unmatched colours and patterns, old lady dresses, nurse's shoes, and bad makeup. Also, tell them to bring their favourite/most fashionable outfits. This is a good theme for younger kids/teenagers because it gets the guests more involved. If you want, you can mix components of both parties."
        },
        {
          "headline":"For both parties, assign your own family/friends to be the cast of \"What not to Wear\".",
          "description":"If possible, get a man and a woman and assign them as the hosts (Clinton Kelly and Stacy London), then a woman to be the makeup artist (Carmine), and possibly even a man to be the hairstylist (Ted Gibson). However, it's not recommended to have your hairstylist actually cut anyone's hair. Instead, have them braid their hair, or curl, crimp, or straighten it."
        },
        {
          "headline":"For both parties, decorate your house/party space just like the \"What not to Wear\" studio.",
          "description":"Make sure to have a place for your guests to get their makeup done by your very own Carmine. Place pictures of fashionable outfits around your house as well."
        },
        {
          "headline":"At the end of either party theme, eat cake/snacks, chat, dance, or do whatever you please now that everyone looks great, and you can go to bed knowing that you had a great party!",
          "description":""
        }
      ]
    },
    {
      "name":"\"What not to Wear\" Replica Theme",
      "steps":[
        {
          "headline":"When you send out invitations to your guests, tell them to send you pictures of your 'Fashion Faux-Pas Person' (the FF-PP) wearing their worst outfits.",
          "description":""
        },
        {
          "headline":"Once the party starts, sit your 'Fashion Faux-Pas Person' (FF-PP) down, and tell them that you've been secretly filming them for the past 2 weeks (or however long you want).",
          "description":"Then show them the pictures that your friends/family sent in of them. Then tell them that they're going to get a huge makeover!"
        },
        {
          "headline":"Go through your FF-PP's outfits and 'throw them away' (You don't have to if you don't want to).",
          "description":""
        },
        {
          "headline":"Instead of going shopping for new outfits like they do on the show, open your guests' presents (if they've gotten the birthday person clothes and gift cards).",
          "description":"That will be their new wardrobe."
        },
        {
          "headline":"Give your FF-PP a makeover!",
          "description":"Do their makeup, nails, and hair."
        },
        {
          "headline":"Reveal your made-over FF-PP to your guests.",
          "description":""
        }
      ]
    },
    {
      "name":"Worst-Dressed to Best-Dressed Theme",
      "steps":[
        {
          "headline":"Send out invitations with the 'What not to Wear' logo on them, as well as pictures of Clinton Kelly and Stacy London, the hosts of the show.",
          "description":"You can also have pictures of horrible outfits and put big red 'X's over them."
        },
        {
          "headline":"Once everyone has arrived at the party, award your 'Worst-dressed Person' with a prize (something fashion-related, such as a pair of cute earrings).",
          "description":""
        },
        {
          "headline":"Have a 'worst-dressed' photo shoot.",
          "description":"This is a lot of fun."
        },
        {
          "headline":"Have 'Stacy' and 'Clinton' critique everyone's outfits, just like on the show.",
          "description":""
        },
        {
          "headline":"Tell your guests to get dressed in their favourite/most fashionable outfits.",
          "description":"If somebody forgets theirs, lend them one of your chic outfits!"
        },
        {
          "headline":"After your guests are all dressed up, it's time for a makeover!",
          "description":"Have some makeup on-hand, as well as some nail polish for manicures. Also, give them to option of curling, straightening, and/or crimping their hair."
        },
        {
          "headline":"After everyone's makeovers are finished, announce the \"Best-Dressed Award\".",
          "description":"Give them a prize similar to the winner of the \"Worst-Dressed Award\"."
        },
        {
          "headline":"Once the \"Best-Dressed Award\" has been handed out, it's time for a photo shoot!",
          "description":"Take pictures of your guests in their best outfits."
        },
        {
          "headline":"Have your guests be revealed to 'Stacy' and 'Clinton'.",
          "description":"Make sure that Stacy and Clinton both say positive stuff about the guest's outfits. Make sure that the person playing Stacy London says \"Shut up!\" frequently (she says \"Shut up!\" whenever she's impressed with an outfit)."
        },
        {
          "headline":"Reveal your pictures of your guests in their worst outfits (Before) and their best outfits (after).",
          "description":"This will be a lot of fun and will get a lot of laughs."
        }
      ]
    }
  ],
  "text":" Steps You can do this party one of two ways: Make it just like the show, and invite one of your friends/family members that makes fashion faux-pas a little too often, then surprise them by saying they they're going to get a fashion makeover! This is a great idea for a surprise birthday party, because then all the guests could get the birthday person fashionable clothes or gift cards to cool stores. Tell all your guests to wear their most horrible outfits. Floor-length skirts, see-through shirts, unmatched colours and patterns, old lady dresses, nurse's shoes, and bad makeup. Also, tell them to bring their favourite/most fashionable outfits. This is a good theme for younger kids/teenagers because it gets the guests more involved. If you want, you can mix components of both parties. For both parties, assign your own family/friends to be the cast of \"What not to Wear\". If possible, get a man and a woman and assign them as the hosts (Clinton Kelly and Stacy London), then a woman to be the makeup artist (Carmine), and possibly even a man to be the hairstylist (Ted Gibson). However, it's not recommended to have your hairstylist actually cut anyone's hair. Instead, have them braid their hair, or curl, crimp, or straighten it. For both parties, decorate your house/party space just like the \"What not to Wear\" studio. Make sure to have a place for your guests to get their makeup done by your very own Carmine. Place pictures of fashionable outfits around your house as well. At the end of either party theme, eat cake/snacks, chat, dance, or do whatever you please now that everyone looks great, and you can go to bed knowing that you had a great party!  \"What not to Wear\" Replica Theme When you send out invitations to your guests, tell them to send you pictures of your 'Fashion Faux-Pas Person' (the FF-PP) wearing their worst outfits.  Once the party starts, sit your 'Fashion Faux-Pas Person' (FF-PP) down, and tell them that you've been secretly filming them for the past 2 weeks (or however long you want). Then show them the pictures that your friends/family sent in of them. Then tell them that they're going to get a huge makeover! Go through your FF-PP's outfits and 'throw them away' (You don't have to if you don't want to).  Instead of going shopping for new outfits like they do on the show, open your guests' presents (if they've gotten the birthday person clothes and gift cards). That will be their new wardrobe. Give your FF-PP a makeover! Do their makeup, nails, and hair. Reveal your made-over FF-PP to your guests.  Worst-Dressed to Best-Dressed Theme Send out invitations with the 'What not to Wear' logo on them, as well as pictures of Clinton Kelly and Stacy London, the hosts of the show. You can also have pictures of horrible outfits and put big red 'X's over them. Once everyone has arrived at the party, award your 'Worst-dressed Person' with a prize (something fashion-related, such as a pair of cute earrings).  Have a 'worst-dressed' photo shoot. This is a lot of fun. Have 'Stacy' and 'Clinton' critique everyone's outfits, just like on the show.  Tell your guests to get dressed in their favourite/most fashionable outfits. If somebody forgets theirs, lend them one of your chic outfits! After your guests are all dressed up, it's time for a makeover! Have some makeup on-hand, as well as some nail polish for manicures. Also, give them to option of curling, straightening, and/or crimping their hair. After everyone's makeovers are finished, announce the \"Best-Dressed Award\". Give them a prize similar to the winner of the \"Worst-Dressed Award\". Once the \"Best-Dressed Award\" has been handed out, it's time for a photo shoot! Take pictures of your guests in their best outfits. Have your guests be revealed to 'Stacy' and 'Clinton'. Make sure that Stacy and Clinton both say positive stuff about the guest's outfits. Make sure that the person playing Stacy London says \"Shut up!\" frequently (she says \"Shut up!\" whenever she's impressed with an outfit). Reveal your pictures of your guests in their worst outfits (Before) and their best outfits (after). This will be a lot of fun and will get a lot of laughs.",
  "tyn_model":[
    "makeup",
    "nail polish"
  ],
  "tyn_section":[

  ]
}