{
  "title":"How to Grow Habanero",
  "url":"https://www.wikihow.com/Grow-Habanero",
  "category_hierarchy":[
    "Home and Garden",
    "Gardening",
    "Planting and Growing"
  ],
  "methods":[
    {
      "name":"Planting the Seeds",
      "steps":[
        {
          "headline":"Plant habanero seeds indoors 6-10 weeks before the last frost.",
          "description":"Unless you live near the equator, your climate likely isn\u2019t able to grow habanero plants from seeds outside. Start your seeds inside where the temperature is more controlled, planting them at least 6 weeks before the first frost of the season.Look for the seeds at your local gardening store or from a reputable online source."
        },
        {
          "headline":"Fill a container with well-draining, moist soil.",
          "description":"Choose a container that\u2019s roughly 5 inches (13 cm) wide and place small rocks at the bottom of the container to help with the drainage. Fill it with organic potting soil that\u2019s labeled as \u201cwell-draining\u201d or \u201cloamy,\u201d meaning the soil has a mix of sand, silt, and clay. Dampen the soil by holding the container under running water and let the excess water drain out.Check to be sure your plastic or clay pot has holes in it for draining. Add a compost to your soil to make it super nutrient-rich."
        },
        {
          "headline":"Place a seed in the center of each container that you've prepared.",
          "description":"Use your finger to push the seed down lightly into the soil so it's not just resting on the top. If you're worried about the seed sprouting, press 2 seeds down in each container, spacing them at least 4 in (10 cm) apart.Avoid pushing the seeds too far down in the soil\u2014place them deep enough so that they\u2019re barely covered by the soil. If both seeds sprout, you'll need to separate the plants into different pots so they have enough room to continue growing."
        },
        {
          "headline":"Put the container in a spot that gets at least 6 hours of sunlight daily.",
          "description":"If you have a big that gets lots of morning and early afternoon sunlight, this is the perfect spot. Find the area that gets the most sunlight each day and place your container in this location to make sure the habanero grows."
        },
        {
          "headline":"Water the seeds whenever the top of the soil is dry.",
          "description":"After you've planted the seeds, it's still important not to give them too much water so they'll grow properly. Touch the soil each morning to see if it's dry, and if it is, saturate the soil thoroughly to be sure the water gets all the way to the bottom of the plant.Watering the seeds in the morning is best so that they'll be hydrated during the hottest part of the day."
        },
        {
          "headline":"Heat the seedlings using a plant light or propagation mat to help them grow.",
          "description":"Even if you have a sunny window, extra light and heat will help habanero seeds grow faster and stronger. Purchase a clip-on plant light or set your container on a heated mat to help the seeds germinate and grow better.Keep the plant 6\u201312 in (15\u201330 cm) away from the light, depending on how strong it is and whether it emits a lot of heat. If you\u2019re mainly using an artificial light for your plants, keep the light on for 16 hours a day or more."
        }
      ]
    },
    {
      "name":"Transplanting the Plant",
      "steps":[
        {
          "headline":"Move the habanero plant to a larger pot when it has 6-8 leaves.",
          "description":"This is often when your plant\u2019s roots have outgrown its pot. Once the habanero has about 8 leaves, it\u2019s time to take the root clump out of its current container and move it into a larger one.For example, if it\u2019s currently in a pot that\u2019s 5 in (13 cm) wide, you might transfer it into a new one that\u2019s 10 in (25 cm) wide. This will take about 40 days once the seed is planted."
        },
        {
          "headline":"Fill a larger pot with potting soil and dig a hole for the roots.",
          "description":"Place loamy, well-draining potting soil into the new pot, filling it up about halfway. Create a hole in the soil big enough for the root clump to fit, estimating its size if needed."
        },
        {
          "headline":"Place the plant in the new pot and add more soil on top of the roots.",
          "description":"Set the root ball down in the new soil, making sure it\u2019s deep enough that the bottom of the stems are near the top of the pot. Sprinkle more potting soil into the pot, filling in any gaps and the sides of the root ball."
        },
        {
          "headline":"Water the plant thoroughly so the new soil is damp.",
          "description":"Fill a cup with water and water the base of the plant, saturating the soil so it\u2019s super damp. Let the excess water drain out of the bottom of the pot so the roots don\u2019t stay soggy.The water will help compact the soil. If it presses it down a lot, add a little more soil to the pot."
        },
        {
          "headline":"Transition the plant to the outdoors slowly so it can adjust.",
          "description":"Instead of immediately putting the habanero plant outside, put it out for a couple of hours one day, and then a few more hours a couple of days later, and so on until the plant is fully adjusted. This will make sure that your habanero transitions well from indoors to outdoors."
        },
        {
          "headline":"Put the plant outside permanently once the frost has ended.",
          "description":"Only set your habanero plant outside after there\u2019s no threat of frost and the weather has gotten warmer. Place your plant outside in an area that gets a lot of access to morning sun when it\u2019s fully adjusted."
        },
        {
          "headline":"Transplant the peppers to a garden if you have the right growing conditions.",
          "description":"If you want your habanero plant in your garden instead of in a pot, locate a spot that's sunny the majority of the day and dig a hole that's a little bigger than the plant's root ball using a shovel. Place the root ball in the hole in your garden and fill in any gaps with fresh soil. Give the plant a good watering and be sure to check on it every day or two to ensure it's not too dry."
        }
      ]
    },
    {
      "name":"Keeping the Peppers Healthy",
      "steps":[
        {
          "headline":"Wait to water the soil until it dries out completely to avoid soggy roots.",
          "description":"This is usually every 2-3 days if the plant is getting lots of sunlight. When you touch the soil and it\u2019s dry, water the plant thoroughly by soaking it and letting the excess water drain out.Overwatering your habanero can lead to the plant getting diseases or tasting super bitter."
        },
        {
          "headline":"Fertilize your habanero once it\u2019s 6 weeks old.",
          "description":"After about a month and a half, your plant is mature enough to handle fertilizer. Choose a fertilizer that doesn\u2019t have too much nitrogen and that\u2019s organic. Follow the instructions on the fertilizer so you know how often to give it to the habanero as well as how much to use.Try using 11-3-8 mix fertilizer on your habanero. Some fertilizers recommend that you use them once every 2 weeks."
        },
        {
          "headline":"Get rid of pests on your outdoor plant using an insecticidal soap.",
          "description":"Most pests don\u2019t tend to go towards habanero plants, but if you do see some bugs on your plant, apply an insecticidal soap to help get rid of them. Another option is spraying the plant with a hose to wash the bugs off.Purchase an insecticidal soap at your local home improvement or gardening store. Insecticidal soaps won't harm you or most animals if it's ingested (but you should wash off your peppers with clean water once you pick them! )."
        },
        {
          "headline":"Prune the shoots if you want a bushier habanero plant.",
          "description":"Pruning your habanero plant isn\u2019t required, but it\u2019s a good way to give your plant a fuller shape while encouraging pepper production. Trim the shoots where the leaves begin to branch out using a pair of gardening shears or clean scissors right at the base of the node.The node is the part of the plant where the leaves, stems, or flowers sprout and grow. Use your fingers to pinch off the flowers so the plant focuses its energy on the peppers."
        },
        {
          "headline":"Check your peppers for signs of splitting apart due to too much sun.",
          "description":"While habanero plants love sunlight and thrive in it, too much direct harsh sunlight can cause sunscald, which is essentially when the plant gets burned. Sunscald is when the peppers start to split due to the heat.Most plants that are getting at least 6 hours of normal sunlight each day will be okay. Your plant\u2019s leaves will help protect the fruit from sunscald."
        },
        {
          "headline":"Bring your habanero plant indoors once the weather turns cold.",
          "description":"Your plant won\u2019t last outdoors in the cold weather. To preserve it, bring it inside easily if it\u2019s already in a pot or fill a pot with soil and dig up the roots carefully to bring your habanero plant indoors if it was in the ground.During the colder months, you won\u2019t need to water your habanero plant as much."
        }
      ]
    },
    {
      "name":"Harvesting and Storing the Habanero",
      "steps":[
        {
          "headline":"Pick the fruits when they\u2019re green if you want a mild habanero pepper.",
          "description":"Habanero peppers can be picked as soon as they\u2019re ripe and turn green. Green habanero peppers have a bit of spice but are still considered mild. Pull the green peppers off of the plant using your fingers to harvest them easily.Your habanero peppers should turn green and be ready for picking about 75 days after you plant the seeds."
        },
        {
          "headline":"Wait for the peppers to turn orange or red for spicier ones.",
          "description":"Though different kinds of peppers will turn different colors when they're spicy, for many peppers, the darker red the pepper, the spicier it will be. Pluck orange peppers off of the plant for spicy ones or wait until they turn red for even spicier peppers. Use your fingers to pull them off of the plant gently.When the peppers are ripe, they\u2019ll come off of the plant easily. The peppers will turn orange and red roughly 90 days after you plant the seeds."
        },
        {
          "headline":"Harvest your habanero before the cool weather comes if they\u2019re outside.",
          "description":"Pluck all of your peppers off of the plant while the weather is still warm. Once it gets colder outside, the cold and frost can cause the plant to wilt or die, ruining your peppers.If you\u2019re growing your peppers indoors and are using plant lights, you can wait longer to pick the peppers if you\u2019d like."
        },
        {
          "headline":"Store your habanero in a dry spot for roughly 3 weeks to save it for later.",
          "description":"If you want to store the peppers after you pick them, place them in a sealed container and place them in a spot that\u2019s cool and dry, like your pantry or on a shelf. You can also dry peppers using a dehydrator or oven on low heat and store them out on the counter.The peppers will last up to 3 weeks before they start to spoil in a container. It\u2019s also possible to freeze the peppers and store them for several months in the freezer."
        }
      ]
    }
  ],
  "text":" Planting the Seeds Plant habanero seeds indoors 6-10 weeks before the last frost. Unless you live near the equator, your climate likely isn\u2019t able to grow habanero plants from seeds outside. Start your seeds inside where the temperature is more controlled, planting them at least 6 weeks before the first frost of the season.Look for the seeds at your local gardening store or from a reputable online source. Fill a container with well-draining, moist soil. Choose a container that\u2019s roughly 5 inches (13 cm) wide and place small rocks at the bottom of the container to help with the drainage. Fill it with organic potting soil that\u2019s labeled as \u201cwell-draining\u201d or \u201cloamy,\u201d meaning the soil has a mix of sand, silt, and clay. Dampen the soil by holding the container under running water and let the excess water drain out.Check to be sure your plastic or clay pot has holes in it for draining. Add a compost to your soil to make it super nutrient-rich. Place a seed in the center of each container that you've prepared. Use your finger to push the seed down lightly into the soil so it's not just resting on the top. If you're worried about the seed sprouting, press 2 seeds down in each container, spacing them at least 4 in (10 cm) apart.Avoid pushing the seeds too far down in the soil\u2014place them deep enough so that they\u2019re barely covered by the soil. If both seeds sprout, you'll need to separate the plants into different pots so they have enough room to continue growing. Put the container in a spot that gets at least 6 hours of sunlight daily. If you have a big that gets lots of morning and early afternoon sunlight, this is the perfect spot. Find the area that gets the most sunlight each day and place your container in this location to make sure the habanero grows. Water the seeds whenever the top of the soil is dry. After you've planted the seeds, it's still important not to give them too much water so they'll grow properly. Touch the soil each morning to see if it's dry, and if it is, saturate the soil thoroughly to be sure the water gets all the way to the bottom of the plant.Watering the seeds in the morning is best so that they'll be hydrated during the hottest part of the day. Heat the seedlings using a plant light or propagation mat to help them grow. Even if you have a sunny window, extra light and heat will help habanero seeds grow faster and stronger. Purchase a clip-on plant light or set your container on a heated mat to help the seeds germinate and grow better.Keep the plant 6\u201312 in (15\u201330 cm) away from the light, depending on how strong it is and whether it emits a lot of heat. If you\u2019re mainly using an artificial light for your plants, keep the light on for 16 hours a day or more. Transplanting the Plant Move the habanero plant to a larger pot when it has 6-8 leaves. This is often when your plant\u2019s roots have outgrown its pot. Once the habanero has about 8 leaves, it\u2019s time to take the root clump out of its current container and move it into a larger one.For example, if it\u2019s currently in a pot that\u2019s 5 in (13 cm) wide, you might transfer it into a new one that\u2019s 10 in (25 cm) wide. This will take about 40 days once the seed is planted. Fill a larger pot with potting soil and dig a hole for the roots. Place loamy, well-draining potting soil into the new pot, filling it up about halfway. Create a hole in the soil big enough for the root clump to fit, estimating its size if needed. Place the plant in the new pot and add more soil on top of the roots. Set the root ball down in the new soil, making sure it\u2019s deep enough that the bottom of the stems are near the top of the pot. Sprinkle more potting soil into the pot, filling in any gaps and the sides of the root ball. Water the plant thoroughly so the new soil is damp. Fill a cup with water and water the base of the plant, saturating the soil so it\u2019s super damp. Let the excess water drain out of the bottom of the pot so the roots don\u2019t stay soggy.The water will help compact the soil. If it presses it down a lot, add a little more soil to the pot. Transition the plant to the outdoors slowly so it can adjust. Instead of immediately putting the habanero plant outside, put it out for a couple of hours one day, and then a few more hours a couple of days later, and so on until the plant is fully adjusted. This will make sure that your habanero transitions well from indoors to outdoors. Put the plant outside permanently once the frost has ended. Only set your habanero plant outside after there\u2019s no threat of frost and the weather has gotten warmer. Place your plant outside in an area that gets a lot of access to morning sun when it\u2019s fully adjusted. Transplant the peppers to a garden if you have the right growing conditions. If you want your habanero plant in your garden instead of in a pot, locate a spot that's sunny the majority of the day and dig a hole that's a little bigger than the plant's root ball using a shovel. Place the root ball in the hole in your garden and fill in any gaps with fresh soil. Give the plant a good watering and be sure to check on it every day or two to ensure it's not too dry. Keeping the Peppers Healthy Wait to water the soil until it dries out completely to avoid soggy roots. This is usually every 2-3 days if the plant is getting lots of sunlight. When you touch the soil and it\u2019s dry, water the plant thoroughly by soaking it and letting the excess water drain out.Overwatering your habanero can lead to the plant getting diseases or tasting super bitter. Fertilize your habanero once it\u2019s 6 weeks old. After about a month and a half, your plant is mature enough to handle fertilizer. Choose a fertilizer that doesn\u2019t have too much nitrogen and that\u2019s organic. Follow the instructions on the fertilizer so you know how often to give it to the habanero as well as how much to use.Try using 11-3-8 mix fertilizer on your habanero. Some fertilizers recommend that you use them once every 2 weeks. Get rid of pests on your outdoor plant using an insecticidal soap. Most pests don\u2019t tend to go towards habanero plants, but if you do see some bugs on your plant, apply an insecticidal soap to help get rid of them. Another option is spraying the plant with a hose to wash the bugs off.Purchase an insecticidal soap at your local home improvement or gardening store. Insecticidal soaps won't harm you or most animals if it's ingested (but you should wash off your peppers with clean water once you pick them! ). Prune the shoots if you want a bushier habanero plant. Pruning your habanero plant isn\u2019t required, but it\u2019s a good way to give your plant a fuller shape while encouraging pepper production. Trim the shoots where the leaves begin to branch out using a pair of gardening shears or clean scissors right at the base of the node.The node is the part of the plant where the leaves, stems, or flowers sprout and grow. Use your fingers to pinch off the flowers so the plant focuses its energy on the peppers. Check your peppers for signs of splitting apart due to too much sun. While habanero plants love sunlight and thrive in it, too much direct harsh sunlight can cause sunscald, which is essentially when the plant gets burned. Sunscald is when the peppers start to split due to the heat.Most plants that are getting at least 6 hours of normal sunlight each day will be okay. Your plant\u2019s leaves will help protect the fruit from sunscald. Bring your habanero plant indoors once the weather turns cold. Your plant won\u2019t last outdoors in the cold weather. To preserve it, bring it inside easily if it\u2019s already in a pot or fill a pot with soil and dig up the roots carefully to bring your habanero plant indoors if it was in the ground.During the colder months, you won\u2019t need to water your habanero plant as much. Harvesting and Storing the Habanero Pick the fruits when they\u2019re green if you want a mild habanero pepper. Habanero peppers can be picked as soon as they\u2019re ripe and turn green. Green habanero peppers have a bit of spice but are still considered mild. Pull the green peppers off of the plant using your fingers to harvest them easily.Your habanero peppers should turn green and be ready for picking about 75 days after you plant the seeds. Wait for the peppers to turn orange or red for spicier ones. Though different kinds of peppers will turn different colors when they're spicy, for many peppers, the darker red the pepper, the spicier it will be. Pluck orange peppers off of the plant for spicy ones or wait until they turn red for even spicier peppers. Use your fingers to pull them off of the plant gently.When the peppers are ripe, they\u2019ll come off of the plant easily. The peppers will turn orange and red roughly 90 days after you plant the seeds. Harvest your habanero before the cool weather comes if they\u2019re outside. Pluck all of your peppers off of the plant while the weather is still warm. Once it gets colder outside, the cold and frost can cause the plant to wilt or die, ruining your peppers.If you\u2019re growing your peppers indoors and are using plant lights, you can wait longer to pick the peppers if you\u2019d like. Store your habanero in a dry spot for roughly 3 weeks to save it for later. If you want to store the peppers after you pick them, place them in a sealed container and place them in a spot that\u2019s cool and dry, like your pantry or on a shelf. You can also dry peppers using a dehydrator or oven on low heat and store them out on the counter.The peppers will last up to 3 weeks before they start to spoil in a container. It\u2019s also possible to freeze the peppers and store them for several months in the freezer.",
  "tyn_model":[
    "peppers",
    "water",
    "container",
    "habanero",
    "pot",
    "fertilizer",
    "insecticidal soap",
    "habanero peppers",
    "soil",
    "potting soil",
    "rocks",
    "organic potting soil",
    "\u201cwell",
    "\u201d or",
    "\u201cloamy",
    "\u201d meaning",
    "compost",
    "\u2014place",
    "plant light or propagation mat",
    "clip-on plant light",
    "potting",
    "habanero plant",
    "garden",
    "shovel",
    "fertilizers",
    "insecticidal soaps",
    "pepper",
    "gardening shears",
    "clean scissors",
    "habanero pepper",
    "dehydrator",
    "oven"
  ],
  "tyn_section":[

  ]
}