{
  "title":"How to Delete Xbox Profiles",
  "url":"https://www.wikihow.com/Delete-Xbox-Profiles",
  "category_hierarchy":[
    "Hobbies and Crafts",
    "Games",
    "Video Games",
    "Xbox"
  ],
  "methods":[
    {
      "name":"Deleting a Profile",
      "steps":[
        {
          "headline":"Open the Settings.",
          "description":"Press the Guide button, and then navigate to the Settings menu. Select System Settings."
        },
        {
          "headline":"Open the Storage menu.",
          "description":"You will see a list of attached storage devices. From here, select All Devices. A list of categories will appear."
        },
        {
          "headline":"Open Game Profiles.",
          "description":"This category should be towards the top of the list. IN this section, you will see every profile that is currently associated with the system."
        },
        {
          "headline":"Delete the profile.",
          "description":"Select the profile that you want to delete and press the A button. A new menu will open with a Delete option. When you press Delete, you will be given two choices. You can delete the profile only while continuing to store the save games and achievements, or you can delete the entire profile and all associated data. If you just received the Xbox and are deleting the accounts of users who won\u2019t be using the machine anymore, delete all the data to make more room for your own."
        }
      ]
    },
    {
      "name":"Downloading a Profile",
      "steps":[
        {
          "headline":"Press the Guide button.",
          "description":"From the window that opens, you should be able to select Download Profile. If you can\u2019t see this option, it means you are signed in with another profile. To sign out, press the X button."
        },
        {
          "headline":"Enter your account.",
          "description":"Enter your Microsoft account information. This is the email address that you used to sign up for Xbox LIVE, Hotmail, or other Windows services. After you enter your account, you will be asked for your password. The Microsoft account used to be called your Windows Live ID. They are the same thing now. If the account is a Child account, you will need the parent/guardian\u2019s account information."
        },
        {
          "headline":"Select the storage destination.",
          "description":"The most common place to store profiles is on the hard drive. The Xbox will automatically put the profile in the correct directories. Once you select the destination, the profile will begin downloading. This may take a while depending on the speed of the connection."
        },
        {
          "headline":"Choose whether or not to remember the password.",
          "description":"By default, the password for the account you download will not be remembered, and will need to be reentered the next time the account tries to sign in. If you are the owner of the Xbox, or it belongs to a trusted friend, you can save the password to make signing in easier in the future."
        }
      ]
    }
  ],
  "text":" Deleting a Profile Open the Settings. Press the Guide button, and then navigate to the Settings menu. Select System Settings. Open the Storage menu. You will see a list of attached storage devices. From here, select All Devices. A list of categories will appear. Open Game Profiles. This category should be towards the top of the list. IN this section, you will see every profile that is currently associated with the system. Delete the profile. Select the profile that you want to delete and press the A button. A new menu will open with a Delete option. When you press Delete, you will be given two choices. You can delete the profile only while continuing to store the save games and achievements, or you can delete the entire profile and all associated data. If you just received the Xbox and are deleting the accounts of users who won\u2019t be using the machine anymore, delete all the data to make more room for your own. Downloading a Profile Press the Guide button. From the window that opens, you should be able to select Download Profile. If you can\u2019t see this option, it means you are signed in with another profile. To sign out, press the X button. Enter your account. Enter your Microsoft account information. This is the email address that you used to sign up for Xbox LIVE, Hotmail, or other Windows services. After you enter your account, you will be asked for your password. The Microsoft account used to be called your Windows Live ID. They are the same thing now. If the account is a Child account, you will need the parent/guardian\u2019s account information. Select the storage destination. The most common place to store profiles is on the hard drive. The Xbox will automatically put the profile in the correct directories. Once you select the destination, the profile will begin downloading. This may take a while depending on the speed of the connection. Choose whether or not to remember the password. By default, the password for the account you download will not be remembered, and will need to be reentered the next time the account tries to sign in. If you are the owner of the Xbox, or it belongs to a trusted friend, you can save the password to make signing in easier in the future.",
  "tyn_model":[
    "xbox",
    "microsoft account",
    "windows live id."
  ],
  "tyn_section":[

  ]
}