{
  "title":"How to Get Jirachi in Pok\u00e9mon",
  "url":"https://www.wikihow.com/Get-Jirachi-in-Pok%C3%A9mon",
  "category_hierarchy":[
    "Hobbies and Crafts",
    "Games",
    "Video Games",
    "Multi Platform Games",
    "Pokemon Video Games"
  ],
  "methods":[
    {
      "name":"Using Pok\u00e9mon Colosseum Bonus Disc (US)",
      "steps":[
        {
          "headline":"Configure your party in Pok\u00e9mon Ruby or Sapphire.",
          "description":"You will need to have one open space in your party in order to receive Jirachi. Once your party is configured correctly, shut down the Game Boy."
        },
        {
          "headline":"Connect the Game Boy Advance to the GameCube.",
          "description":"You must use the special adapter cable that will allow the two systems to be connected."
        },
        {
          "headline":"Start the Bonus Disc.",
          "description":"Load up the Pok\u00e9mon Colosseum Bonus Disc into the GameCube. You will be taken to the main menu of the Bonus Disc. Scroll to the right and select \u201cJirachi Special Gift\u201d."
        },
        {
          "headline":"Wait for the transfer.",
          "description":"Once you select the Jirachi item in the menu, you will be prompted to connect your Game Boy. You will see some loading screens on both the GameCube and the Game Boy. The transfer will take about 30 seconds."
        },
        {
          "headline":"Use your new Jirachi.",
          "description":"Once the transfer is complete, Jirachi will be in your party and ready to use! You can use the Bonus Disc to add a Jirachi to as many Pok\u00e9mon games as you want, but can only use it once per game. If you start a new game, you can use it again. Once you have Jirachi, you can trade it to your newer versions of Pok\u00e9mon."
        }
      ]
    },
    {
      "name":"Using Pok\u00e9mon Channel (Europe and Australia)",
      "steps":[
        {
          "headline":"Beat the Pok\u00e9mon Channel game for GameCube.",
          "description":"In order to access Jirachi, you will need to watch all of the programming, which will give you the Starlight Projector. This will let you go to Camp Starlight, where you can watch the Pichu Movie."
        },
        {
          "headline":"Beat the game (Ruby, Sapphire, or Emerald) on your Game Boy Advance.",
          "description":"In order to get Jirachi on your game, you will need to have beaten the Elite 4. This essentially means that you have beaten the game. You will need a free space in your party before you can receive Jirachi."
        },
        {
          "headline":"Open the Options menu in the Pok\u00e9mon Channel main menu.",
          "description":"Professor Oak will appear, and then Jirachi will show up. After a short introduction movie, click Yes to begin the transfer. You will be warned that the Elite 4 need to be beaten before transferring Jirachi. Click Yes again to proceed. You will be asked if you have space in your party for Jirachi. Click Yes if you have 5 or less Pok\u00e9mon in your party."
        },
        {
          "headline":"Connect the Game Boy Advance to the GameCube.",
          "description":"You must use the special adapter cable that will allow the two systems to be connected. Click Yes once they are connected. Turn on the power for the Game Boy when prompted."
        },
        {
          "headline":"Wait for the transfer to complete.",
          "description":"This should only take a few seconds. You will see an image of Jirachi on your Game Boy screen. Turn the Game Boy off when prompted."
        },
        {
          "headline":"Use your new Jirachi.",
          "description":"Once the transfer is complete, Jirachi will be in your party and ready to use! You can use Pok\u00e9mon Channel to add a Jirachi to as many Pok\u00e9mon games as you want, but can only use it once per game. If you start a new game, you can use it again. Once you have Jirachi, you can trade it to your newer versions of Pok\u00e9mon."
        }
      ]
    },
    {
      "name":"Using Pro Action Replay",
      "steps":[
        {
          "headline":"Add the Jirachi code to your Action Replay.",
          "description":"You can use your computer to quickly enter the code into the Action Replay. This will be a lot easier than typing it using the onscreen keyboard. Enter the following code into your text editor: \n\n\n94000130 FCFF0000 B2000024 00000000 E00197A0 000000DC 00000001\n33870000 F01530B2 026E36D9 8185F12F 394F086E 1DF86AEC 905EEBF0 \nDAFB095 5C0A553D 3721CEFD F667CF37 0A2975E9 72DD0EF1 09D907CF \nBBBC1CA CD22C8F9 B08C29D2 5177CD9F E00D99E1 A228C447 404A60CC \nD838CB6 2197B170 4787AC60 8EE17296 E42449D4 BA321662 8D82E60D \n70FE1C6 C6354F4D 48BF4BC2 68F57371 09A73A7F AC2141C6 1FAAD2EB \n6B979FE 37AA4AEA DE590C20 92F95736 223B7937 2B1BA63E 7DBEC167 \n06E4E6B C32A2FD8 FD182D54 1445EF82 D793BB96 8BD4CE98 A85758D7 \nC74D431 26D85409 68A98C29 C1B333EB D8372D49 00000000 D2000000 \n000000"
        },
        {
          "headline":"Empty your party.",
          "description":"Jirachi will be added to the second slot in your party, so empty your party for the moment to avoid conflicts."
        },
        {
          "headline":"Press L + R. This will create a level 5 Jirachi in your party.",
          "description":"You can repeat this code as many times as you\u2019d like. Remember to empty your party each time. Once you have Jirachi, you can trade it to your newer versions of Pok\u00e9mon."
        }
      ]
    }
  ],
  "text":" Using Pok\u00e9mon Colosseum Bonus Disc (US) Configure your party in Pok\u00e9mon Ruby or Sapphire. You will need to have one open space in your party in order to receive Jirachi. Once your party is configured correctly, shut down the Game Boy. Connect the Game Boy Advance to the GameCube. You must use the special adapter cable that will allow the two systems to be connected. Start the Bonus Disc. Load up the Pok\u00e9mon Colosseum Bonus Disc into the GameCube. You will be taken to the main menu of the Bonus Disc. Scroll to the right and select \u201cJirachi Special Gift\u201d. Wait for the transfer. Once you select the Jirachi item in the menu, you will be prompted to connect your Game Boy. You will see some loading screens on both the GameCube and the Game Boy. The transfer will take about 30 seconds. Use your new Jirachi. Once the transfer is complete, Jirachi will be in your party and ready to use! You can use the Bonus Disc to add a Jirachi to as many Pok\u00e9mon games as you want, but can only use it once per game. If you start a new game, you can use it again. Once you have Jirachi, you can trade it to your newer versions of Pok\u00e9mon. Using Pok\u00e9mon Channel (Europe and Australia) Beat the Pok\u00e9mon Channel game for GameCube. In order to access Jirachi, you will need to watch all of the programming, which will give you the Starlight Projector. This will let you go to Camp Starlight, where you can watch the Pichu Movie. Beat the game (Ruby, Sapphire, or Emerald) on your Game Boy Advance. In order to get Jirachi on your game, you will need to have beaten the Elite 4. This essentially means that you have beaten the game. You will need a free space in your party before you can receive Jirachi. Open the Options menu in the Pok\u00e9mon Channel main menu. Professor Oak will appear, and then Jirachi will show up. After a short introduction movie, click Yes to begin the transfer. You will be warned that the Elite 4 need to be beaten before transferring Jirachi. Click Yes again to proceed. You will be asked if you have space in your party for Jirachi. Click Yes if you have 5 or less Pok\u00e9mon in your party. Connect the Game Boy Advance to the GameCube. You must use the special adapter cable that will allow the two systems to be connected. Click Yes once they are connected. Turn on the power for the Game Boy when prompted. Wait for the transfer to complete. This should only take a few seconds. You will see an image of Jirachi on your Game Boy screen. Turn the Game Boy off when prompted. Use your new Jirachi. Once the transfer is complete, Jirachi will be in your party and ready to use! You can use Pok\u00e9mon Channel to add a Jirachi to as many Pok\u00e9mon games as you want, but can only use it once per game. If you start a new game, you can use it again. Once you have Jirachi, you can trade it to your newer versions of Pok\u00e9mon. Using Pro Action Replay Add the Jirachi code to your Action Replay. You can use your computer to quickly enter the code into the Action Replay. This will be a lot easier than typing it using the onscreen keyboard. Enter the following code into your text editor: \n\n\n94000130 FCFF0000 B2000024 00000000 E00197A0 000000DC 00000001\n33870000 F01530B2 026E36D9 8185F12F 394F086E 1DF86AEC 905EEBF0 \nDAFB095 5C0A553D 3721CEFD F667CF37 0A2975E9 72DD0EF1 09D907CF \nBBBC1CA CD22C8F9 B08C29D2 5177CD9F E00D99E1 A228C447 404A60CC \nD838CB6 2197B170 4787AC60 8EE17296 E42449D4 BA321662 8D82E60D \n70FE1C6 C6354F4D 48BF4BC2 68F57371 09A73A7F AC2141C6 1FAAD2EB \n6B979FE 37AA4AEA DE590C20 92F95736 223B7937 2B1BA63E 7DBEC167 \n06E4E6B C32A2FD8 FD182D54 1445EF82 D793BB96 8BD4CE98 A85758D7 \nC74D431 26D85409 68A98C29 C1B333EB D8372D49 00000000 D2000000 \n000000 Empty your party. Jirachi will be added to the second slot in your party, so empty your party for the moment to avoid conflicts. Press L + R. This will create a level 5 Jirachi in your party. You can repeat this code as many times as you\u2019d like. Remember to empty your party each time. Once you have Jirachi, you can trade it to your newer versions of Pok\u00e9mon.",
  "tyn_model":[
    "jirachi",
    "game boy",
    "gamecube",
    "pok\u00e9mon channel",
    "game boy advance",
    "pok\u00e9mon colosseum bonus",
    "pok\u00e9mon",
    "\u201cjirachi",
    "\u201d.",
    "bonus disc",
    "computer"
  ],
  "tyn_section":[

  ]
}