{
  "title":"How to Turn a Regular Recipe Into a Low Fat Recipe",
  "url":"https://www.wikihow.com/Turn-a-Regular-Recipe-Into-a-Low-Fat-Recipe",
  "category_hierarchy":[
    "Food and Entertaining",
    "Recipes"
  ],
  "methods":[
    {
      "name":"Meat",
      "steps":[
        {
          "headline":"Purchase extra lean ground beef.",
          "description":"You will not find your meat floating in grease as you cook it, and you will still gain the benefits offered from red meat."
        },
        {
          "headline":"Use ground turkey in place of hamburger.",
          "description":"The taste of ground turkey is slightly different than that of beef, but the health benefits of the exchange are worth any difference in taste. When used in casseroles or dishes where the meat is mixed in with other ingredients, any flavor difference is hardly distinguishable."
        },
        {
          "headline":"Opt for white meat instead of dark meat poultry.",
          "description":"The white meat contains less fat than the dark. Also, turkey has less fat than chicken, but both are great low-fat meat options."
        },
        {
          "headline":"Remove the skins from any chicken or turkey used.",
          "description":"You can remove it before or after cooking. Though skin helps retain moisture in the meat while cooking and adds moisture because of its fat content, the skin itself contains no nutritional value, only fat, and can be discarded."
        },
        {
          "headline":"Replace pork with turkey products.",
          "description":"Use turkey ham instead of pork ham--you will be surprised at how close to \"real\" ham the turkey ham is. Consider switching to turkey bacon instead of \"real\" bacon too."
        },
        {
          "headline":"Get the tuna that is packaged in water instead of the tuna that is packaged in oil.",
          "description":"The difference in flavor between the two is of no consequence, but the difference in the amount of fat is great."
        }
      ]
    },
    {
      "name":"Dairy and Other Baking Items",
      "steps":[
        {
          "headline":"Switch to skim milk instead of 2% or whole.",
          "description":""
        },
        {
          "headline":"Substitute applesauce for butter or oils in baked goods recipes.",
          "description":"The switch-off is in equivalent amounts. Most baked good recipes need a little bit of fat. Consider substituting half the fat at first and experimenting from there with the percentage of fat you switch out."
        },
        {
          "headline":"Use egg substitute in place of real eggs.",
          "description":"The replacement of 1/4 cup of egg substitute per each egg called for in the recipe lowers the fat in the recipe but does little to effect the texture or flavor of your baked goods."
        },
        {
          "headline":"Coat pans with spay oil instead of pouring tablespoons of vegetable oil into the pan to cook with.",
          "description":"Use water or stock to cook food with to keep things from sticking to the bottom instead of the butter or oil a recipe calls for."
        },
        {
          "headline":"Replace the cream in cream soup recipes with low-fat plain yogurt and regular milk.",
          "description":"Replacing with yogurt works well also in cakes and most baked goods."
        },
        {
          "headline":"Exchange regular items for low-fat items in recipes.",
          "description":"When mixed in with other ingredients, some items respond the same in the recipe without carrying all the fat with them. In recipes, use low-fat cheeses, yogurts, mayonnaise, salad dressings, sour cream, cream cheese and cream soups."
        }
      ]
    }
  ],
  "text":" Meat Purchase extra lean ground beef. You will not find your meat floating in grease as you cook it, and you will still gain the benefits offered from red meat. Use ground turkey in place of hamburger. The taste of ground turkey is slightly different than that of beef, but the health benefits of the exchange are worth any difference in taste. When used in casseroles or dishes where the meat is mixed in with other ingredients, any flavor difference is hardly distinguishable. Opt for white meat instead of dark meat poultry. The white meat contains less fat than the dark. Also, turkey has less fat than chicken, but both are great low-fat meat options. Remove the skins from any chicken or turkey used. You can remove it before or after cooking. Though skin helps retain moisture in the meat while cooking and adds moisture because of its fat content, the skin itself contains no nutritional value, only fat, and can be discarded. Replace pork with turkey products. Use turkey ham instead of pork ham--you will be surprised at how close to \"real\" ham the turkey ham is. Consider switching to turkey bacon instead of \"real\" bacon too. Get the tuna that is packaged in water instead of the tuna that is packaged in oil. The difference in flavor between the two is of no consequence, but the difference in the amount of fat is great. Dairy and Other Baking Items Switch to skim milk instead of 2% or whole.  Substitute applesauce for butter or oils in baked goods recipes. The switch-off is in equivalent amounts. Most baked good recipes need a little bit of fat. Consider substituting half the fat at first and experimenting from there with the percentage of fat you switch out. Use egg substitute in place of real eggs. The replacement of 1/4 cup of egg substitute per each egg called for in the recipe lowers the fat in the recipe but does little to effect the texture or flavor of your baked goods. Coat pans with spay oil instead of pouring tablespoons of vegetable oil into the pan to cook with. Use water or stock to cook food with to keep things from sticking to the bottom instead of the butter or oil a recipe calls for. Replace the cream in cream soup recipes with low-fat plain yogurt and regular milk. Replacing with yogurt works well also in cakes and most baked goods. Exchange regular items for low-fat items in recipes. When mixed in with other ingredients, some items respond the same in the recipe without carrying all the fat with them. In recipes, use low-fat cheeses, yogurts, mayonnaise, salad dressings, sour cream, cream cheese and cream soups.",
  "tyn_model":[
    "turkey",
    "ground turkey",
    "chicken",
    "tuna",
    "water",
    "butter",
    "ground beef",
    "beef",
    "poultry",
    "pork",
    "turkey ham",
    "turkey bacon",
    "oil",
    "skim milk",
    "applesauce",
    "baked goods recipes",
    "baked good recipes",
    "eggs",
    "spay oil",
    "vegetable oil",
    "cream soup",
    "low-fat plain yogurt",
    "regular milk",
    "yogurt",
    "low-fat cheeses",
    "mayonnaise",
    "salad dressings",
    "sour cream",
    "cream cheese",
    "cream soups"
  ],
  "tyn_section":[

  ]
}