{
  "title":"How to Download Demos from the PlayStation Store",
  "url":"https://www.wikihow.com/Download-Demos-from-the-PlayStation-Store",
  "category_hierarchy":[
    "Hobbies and Crafts",
    "Games",
    "Video Games",
    "PlayStation Video Game Consoles"
  ],
  "methods":[
    {
      "name":"On PS4",
      "steps":[
        {
          "headline":"Turn on your console.",
          "description":"To do so, you can either press the \"On\" button in the front of the console, or press the PS button on a connected controller."
        },
        {
          "headline":"Select your profile and press X.",
          "description":"Doing this logs you into your PlayStation 4."
        },
        {
          "headline":"Select PlayStation Store and press X.",
          "description":"It's one tab left of the home page."
        },
        {
          "headline":"Scroll down to select Games and press X.",
          "description":"You'll do so in menu bar on the left side of the screen."
        },
        {
          "headline":"Select Demos and press X.",
          "description":"It's an option on the left side of the screen."
        },
        {
          "headline":"Select a demo you'd like to download and press X.",
          "description":"Any games listed on this page have a free demo available."
        },
        {
          "headline":"Select Try Free Demo and press X.",
          "description":"This option is below the game's icon on the left side of the screen. Once you press X, your selected demo will begin downloading. Once the demo finishes downloading, it will be available from the home page as well as your PS4's game library."
        }
      ]
    },
    {
      "name":"On PS3",
      "steps":[
        {
          "headline":"Turn on your PlayStation 3.",
          "description":"You can do this by pressing the console's \"On\" switch or by pressing a connected controller's PS button."
        },
        {
          "headline":"Select a profile and press X.",
          "description":"This will sign you into your PlayStation 3's home page."
        },
        {
          "headline":"Scroll down to select PlayStation Store and press X.",
          "description":"This will open the PlayStation store."
        },
        {
          "headline":"Scroll down to select Games and press X.",
          "description":"You'll do so in menu bar on the left side of the screen."
        },
        {
          "headline":"Select Demos and press X.",
          "description":"This option is on the left side of the screen."
        },
        {
          "headline":"Select a game you'd like to try and press X.",
          "description":"You can download a free demo for any game listed on this page."
        },
        {
          "headline":"Select Try Free Demo and press X.",
          "description":"This option is below the game's icon on the left side of the screen. Once you press X, your selected demo will begin downloading. Once the demo finishes downloading, it will be available in your PS3's game library."
        }
      ]
    },
    {
      "name":"On Desktop",
      "steps":[
        {
          "headline":"Go to the PlayStation Store website.",
          "description":"It's located at https://store.playstation.com/."
        },
        {
          "headline":"Click the Games tab.",
          "description":"This option is near the top of the page, just right of the \"PlayStation Store\" logo. If you aren't logged into your PlayStation Network on this computer, first click Sign In in the top-right corner of the page and enter your account email address and password."
        },
        {
          "headline":"Scroll down and click All Demos By Title.",
          "description":"It's on the left side of the page beneath the \"Demos\" heading. Doing so will open a list of all available demos on the PlayStation Network."
        },
        {
          "headline":"Click a demo you'd like to try.",
          "description":"This will take you to the demo's page, where you can use screenshots and reviews to determine for yourself whether or not you want to download it. To sort demos by device, scroll down and click your PlayStation's box (e.g., PS3 or PS4) beneath the \"Device\" heading on the left side of the page."
        },
        {
          "headline":"Click Try Free Demo.",
          "description":"It's just below your selected game's icon."
        },
        {
          "headline":"Click Confirm Purchase.",
          "description":"This option is on the right side of the page. You're not paying for this demo, of course--this is just to confirm that you want to download it to your PS3 or PS4."
        },
        {
          "headline":"Click Download to your PS#.",
          "description":"This option is in the bottom-right side of the page under the \"Your New Content\" heading. Clicking this button will prompt the demo to begin downloading to your PS3 or PS4. If your PlayStation is on and you're signed into your PSN account on it, you'll see a notification window pop up on your TV alerting you that the download has started. If your PlayStation is in Rest Mode, your download will still commence."
        }
      ]
    }
  ],
  "text":" On PS4 Turn on your console. To do so, you can either press the \"On\" button in the front of the console, or press the PS button on a connected controller. Select your profile and press X. Doing this logs you into your PlayStation 4. Select PlayStation Store and press X. It's one tab left of the home page. Scroll down to select Games and press X. You'll do so in menu bar on the left side of the screen. Select Demos and press X. It's an option on the left side of the screen. Select a demo you'd like to download and press X. Any games listed on this page have a free demo available. Select Try Free Demo and press X. This option is below the game's icon on the left side of the screen. Once you press X, your selected demo will begin downloading. Once the demo finishes downloading, it will be available from the home page as well as your PS4's game library. On PS3 Turn on your PlayStation 3. You can do this by pressing the console's \"On\" switch or by pressing a connected controller's PS button. Select a profile and press X. This will sign you into your PlayStation 3's home page. Scroll down to select PlayStation Store and press X. This will open the PlayStation store. Scroll down to select Games and press X. You'll do so in menu bar on the left side of the screen. Select Demos and press X. This option is on the left side of the screen. Select a game you'd like to try and press X. You can download a free demo for any game listed on this page. Select Try Free Demo and press X. This option is below the game's icon on the left side of the screen. Once you press X, your selected demo will begin downloading. Once the demo finishes downloading, it will be available in your PS3's game library. On Desktop Go to the PlayStation Store website. It's located at https://store.playstation.com/. Click the Games tab. This option is near the top of the page, just right of the \"PlayStation Store\" logo. If you aren't logged into your PlayStation Network on this computer, first click Sign In in the top-right corner of the page and enter your account email address and password. Scroll down and click All Demos By Title. It's on the left side of the page beneath the \"Demos\" heading. Doing so will open a list of all available demos on the PlayStation Network. Click a demo you'd like to try. This will take you to the demo's page, where you can use screenshots and reviews to determine for yourself whether or not you want to download it. To sort demos by device, scroll down and click your PlayStation's box (e.g., PS3 or PS4) beneath the \"Device\" heading on the left side of the page. Click Try Free Demo. It's just below your selected game's icon. Click Confirm Purchase. This option is on the right side of the page. You're not paying for this demo, of course--this is just to confirm that you want to download it to your PS3 or PS4. Click Download to your PS#. This option is in the bottom-right side of the page under the \"Your New Content\" heading. Clicking this button will prompt the demo to begin downloading to your PS3 or PS4. If your PlayStation is on and you're signed into your PSN account on it, you'll see a notification window pop up on your TV alerting you that the download has started. If your PlayStation is in Rest Mode, your download will still commence.",
  "tyn_model":[
    "playstation store",
    "playstation",
    "playstation 3",
    "playstation network",
    "playstation 4",
    "ps4",
    "ps3's"
  ],
  "tyn_section":[

  ]
}