{
  "title":"How to Cook a Chicken Leg",
  "url":"https://www.wikihow.com/Cook-a-Chicken-Leg",
  "category_hierarchy":[
    "Food and Entertaining",
    "Recipes",
    "Meat",
    "Poultry Recipes",
    "Chicken"
  ],
  "methods":[
    {
      "name":"Pan-Fried Chicken Legs",
      "steps":[
        {
          "headline":"Marinate the chicken.",
          "description":"Mix together the spices and 3 tbsp. of olive oil and rub the chicken in the spices to improve its flavor. Let the chicken soak in the marinade for at least one hour in the refrigerator before you begin to fry it. The longer you leave the chicken in the marinade, the deeper the color and flavor will penetrate the chicken."
        },
        {
          "headline":"Warm a pan with olive oil over medium heat.",
          "description":"Add at least 2 tbsp. of olive oil to the pan, just enough to thinly coat the bottom of the pan. Wait until the oil is sizzling, which should take about 1-2 minutes."
        },
        {
          "headline":"Place the chicken in the pan and let it sizzle for 5-10 minutes.",
          "description":"Fry the chicken until the bottom has darkened and begun to turn crispy and brown."
        },
        {
          "headline":"Turn the chicken over and cook the other side.",
          "description":"Cook the chicken on its other side until it's the same color and consistency as the first side of the chicken. To check that it's done, you can cut into the thickest part of the drumstick. The juices should run clear and the meat should be opaque throughout -- not pink."
        },
        {
          "headline":"Remove the chicken from the pan and let it cool.",
          "description":"Place it on a plate for at least 10 minutes until it has cooled down."
        },
        {
          "headline":"Serve.",
          "description":"Enjoy this tasty chicken while it's hot. You can eat it on its own or pair it with a nice portion of veggies and potatoes."
        }
      ]
    },
    {
      "name":"Poached Chicken Legs",
      "steps":[
        {
          "headline":"Prepare the stock.",
          "description":"To prepare the stock, finely chop the leek, onion, and garlic. Then, place the stock pot on the burner until medium-low heat and add the olive oil to the pot. Then, place the chopped ingredients into the pot and sweat them out. Then, add the chopped carrots, celery, and bay leaf and chicken stock to the pot."
        },
        {
          "headline":"Cover the pot and let it simmer for an hour.",
          "description":"As it simmers, add salt and pepper to taste. Then, reduce the heat so between 170 - 180 \u00baF (76 - 82 \u00baC)."
        },
        {
          "headline":"Add the chicken legs to the stock.",
          "description":"Gently move the chicken around in the liquid if pieces of chicken are touching each other. You do not want raw sides, and you do not want to have a funny piece of chicken, set in a rough shape from another piece of chicken squashing it while it was cooking."
        },
        {
          "headline":"Cook the chicken for 25-30 minutes or until they're tender.",
          "description":"Make sure the internal temperature of the chicken reaches 165\u00ba F (74\u00ba C) before you eat it. When it's done, place it on a plate and let it cool for 5-10 minutes."
        },
        {
          "headline":"Serve.",
          "description":"Enjoy this poached chicken on its own or with a side of veggies or mashed potatoes."
        }
      ]
    },
    {
      "name":"Baked Chicken Legs",
      "steps":[
        {
          "headline":"Preheat your oven to 400\u00b0F (204\u00b0C).",
          "description":""
        },
        {
          "headline":"Coat the bottom of the roasting pan with olive oil.",
          "description":"You should use about 2-3 tbsp. of olive oil to do this."
        },
        {
          "headline":"Prepare the chicken.",
          "description":"Rinse the chicken legs in water and pat them dry with paper towels. Then, Rub some olive oil over the chicken pieces. Rub the olive oil over the chicken pieces to prevent them from burning and to give them an even richer flavor. After that, sprinkle both sides of the chicken pieces with salt and freshly ground pepper."
        },
        {
          "headline":"Arrange the pieces in the roasting pan skin-side up.",
          "description":"Leave a little bit of room between the pieces so they aren't crowded in the pan."
        },
        {
          "headline":"Cook the chicken for 30 minutes.",
          "description":"Place the pan in the oven and begin to cook the chicken."
        },
        {
          "headline":"Lower the heat to 350\u00b0F (176\u00b0C) and cook the legs for 10-30 more minutes.",
          "description":"You should cook the legs for about 14-15 minutes for each pound of chicken. Cook them until the juices run clear instead of pink when they're poked with a sharp knife. The internal temperature of the chicken should reach 165\u00baF (74\u00ba C). If the pieces aren't browning as much as you like, you can broil them for the last five minutes."
        },
        {
          "headline":"Remove from heat.",
          "description":"Remove the chicken from the roasting pan and place it on an aluminum plate, tenting it with foil. Let it rest for at least 5-10 minutes before you serve it."
        },
        {
          "headline":"Serve.",
          "description":"Enjoy this delicious baked chicken on its own while it's hot."
        }
      ]
    }
  ],
  "text":" Pan-Fried Chicken Legs Marinate the chicken. Mix together the spices and 3 tbsp. of olive oil and rub the chicken in the spices to improve its flavor. Let the chicken soak in the marinade for at least one hour in the refrigerator before you begin to fry it. The longer you leave the chicken in the marinade, the deeper the color and flavor will penetrate the chicken. Warm a pan with olive oil over medium heat. Add at least 2 tbsp. of olive oil to the pan, just enough to thinly coat the bottom of the pan. Wait until the oil is sizzling, which should take about 1-2 minutes. Place the chicken in the pan and let it sizzle for 5-10 minutes. Fry the chicken until the bottom has darkened and begun to turn crispy and brown. Turn the chicken over and cook the other side. Cook the chicken on its other side until it's the same color and consistency as the first side of the chicken. To check that it's done, you can cut into the thickest part of the drumstick. The juices should run clear and the meat should be opaque throughout -- not pink. Remove the chicken from the pan and let it cool. Place it on a plate for at least 10 minutes until it has cooled down. Serve. Enjoy this tasty chicken while it's hot. You can eat it on its own or pair it with a nice portion of veggies and potatoes. Poached Chicken Legs Prepare the stock. To prepare the stock, finely chop the leek, onion, and garlic. Then, place the stock pot on the burner until medium-low heat and add the olive oil to the pot. Then, place the chopped ingredients into the pot and sweat them out. Then, add the chopped carrots, celery, and bay leaf and chicken stock to the pot. Cover the pot and let it simmer for an hour. As it simmers, add salt and pepper to taste. Then, reduce the heat so between 170 - 180 \u00baF (76 - 82 \u00baC). Add the chicken legs to the stock. Gently move the chicken around in the liquid if pieces of chicken are touching each other. You do not want raw sides, and you do not want to have a funny piece of chicken, set in a rough shape from another piece of chicken squashing it while it was cooking. Cook the chicken for 25-30 minutes or until they're tender. Make sure the internal temperature of the chicken reaches 165\u00ba F (74\u00ba C) before you eat it. When it's done, place it on a plate and let it cool for 5-10 minutes. Serve. Enjoy this poached chicken on its own or with a side of veggies or mashed potatoes. Baked Chicken Legs Preheat your oven to 400\u00b0F (204\u00b0C).  Coat the bottom of the roasting pan with olive oil. You should use about 2-3 tbsp. of olive oil to do this. Prepare the chicken. Rinse the chicken legs in water and pat them dry with paper towels. Then, Rub some olive oil over the chicken pieces. Rub the olive oil over the chicken pieces to prevent them from burning and to give them an even richer flavor. After that, sprinkle both sides of the chicken pieces with salt and freshly ground pepper. Arrange the pieces in the roasting pan skin-side up. Leave a little bit of room between the pieces so they aren't crowded in the pan. Cook the chicken for 30 minutes. Place the pan in the oven and begin to cook the chicken. Lower the heat to 350\u00b0F (176\u00b0C) and cook the legs for 10-30 more minutes. You should cook the legs for about 14-15 minutes for each pound of chicken. Cook them until the juices run clear instead of pink when they're poked with a sharp knife. The internal temperature of the chicken should reach 165\u00baF (74\u00ba C). If the pieces aren't browning as much as you like, you can broil them for the last five minutes. Remove from heat. Remove the chicken from the roasting pan and place it on an aluminum plate, tenting it with foil. Let it rest for at least 5-10 minutes before you serve it. Serve. Enjoy this delicious baked chicken on its own while it's hot.",
  "tyn_model":[
    "chicken",
    "olive oil",
    "pan",
    "stock",
    "roasting pan",
    "plate",
    "pot",
    "salt",
    "oven",
    "refrigerator",
    "oil",
    "drumstick",
    "potatoes",
    "leek",
    "onion",
    "garlic",
    "stock pot",
    "carrots",
    "celery",
    "bay leaf",
    "chicken stock",
    "pepper",
    "mashed potatoes",
    "water",
    "paper towels",
    "freshly ground pepper",
    "foil"
  ],
  "tyn_section":[

  ]
}