{
  "title":"How to Grow Yarrow",
  "url":"https://www.wikihow.com/Grow-Yarrow",
  "category_hierarchy":[
    "Home and Garden",
    "Gardening",
    "Planting and Growing",
    "Growing Herbs and Spices"
  ],
  "parts":[
    {
      "name":"Planting Yarrow Seeds",
      "steps":[
        {
          "headline":"Sow seeds in fall or early spring.",
          "description":"Yarrow seeds need a cold, wet period to germinate, so you should sow the seeds in fall or early spring to give them time to begin blooming during spring and summer. The germination period usually lasts about two weeks. You also have the option of transplanting"
        },
        {
          "headline":"Conduct the germination process indoors.",
          "description":"If you choose to plant the seeds in late spring, you\u2019ll want to complete a process called stratification that duplicates the cold, wet period needed to prepare temperate zone seeds for growing. Wrap the seeds in a wet paper towel and seal them in a plastic bag or put them in wet sand and refrigerate them for 4 weeks prior to planting."
        },
        {
          "headline":"Position the seeds no deeper than 0.25 inches (0.64 cm) below the surface.",
          "description":"Some light is needed for the germination process, so you don\u2019t want to plant the seeds too deep."
        },
        {
          "headline":"Space the seeds 1\u20132 feet (0.30\u20130.61 m) apart.",
          "description":"Yarrow produces large, robust roots, so you need to make sure you give the plant room to grow."
        },
        {
          "headline":"Transplant a mature yarrow if you're not using seeds.",
          "description":"Like most perennials, yarrows can easily be transplanted from a pot to its new home. Dig a hole twice the size of the pot and make sure to water the plant and the new location thoroughly before transfer. Filling the hole with water until it takes longer than 20 minutes for the water to soak into the ground is a great way to make sure there is enough moisture. For the best results, transplant yarrow in the fall or spring. The root ball should be even with the surface."
        },
        {
          "headline":"Choose a sunny location to plant.",
          "description":"Yarrow can tolerate some shade, but a full-sun area is ideal for the best growth. Too much shade can lead to flimsy stems, foliar disease, or rot. Be aware that a humid climate can contribute to powdery mildew disease, which is mostly cosmetic but still something to consider."
        },
        {
          "headline":"Avoid soil with excessive moisture.",
          "description":"Yarrow grows best in drier soil but will still flourish in moist soil if it is properly drained. If you notice that the soil retains a lot of water or always looks wet, it\u2019s probably not a good location to plant yarrow. Soils composed of sand tend to drain sufficiently, whereas clay-based soils do not. Creating a berm or raised bed with a mixture of clay and coarse sand can allow for better drainage if necessary."
        },
        {
          "headline":"Give yarrow space.",
          "description":"The roots become extremely dense once the plant matures. This can be beneficial for keeping weeds at bay but harmful for other plants. You can take advantage of yarrow\u2019s aggressive nature by using it to fill in areas of the garden where other plants can\u2019t seem to grow, like sharp inclines or rocky soil."
        }
      ]
    },
    {
      "name":"Caring for Yarrow",
      "steps":[
        {
          "headline":"Water your yarrow deeply at least once a week the first summer.",
          "description":"Although yarrow likes dry soil, watering helps the plant develop its thick roots and sets the stage for longevity and growth. If rainfall is more than an inch per week, you can let nature take care of this step. Once the plant has been established, no extra watering is required if located outside, especially on a an irrigated lawn. Apply fertilizer to your yarrow, if needed."
        },
        {
          "headline":"Cut back the plant after the first frost.",
          "description":"To stimulate new growth and enhance the appearance of yarrow, it is recommended that you cut the stems down to 1-2 inches above the surface after its first winter. Cut the stems at an angle to avoid water buildup in the stem."
        },
        {
          "headline":"Dig up the plants and divide them every 3-4 years.",
          "description":"Because yarrow can easily reseed and grows quickly, it can start to become unruly every few years. By thinning it out, you control which areas it spreads to and when. Using a gardening fork, start at the crown of the plant and gently work your way outward to lift the plant out of the ground. Then, divide into a few stalks per bunch by pulling or cutting if necessary and transplant the smaller bundles to their new home."
        },
        {
          "headline":"Allow for good airflow.",
          "description":"Yarrow is prone to fungal disease, especially in humid climates. By making sure the leaves and blooms have good airflow, you can help prevent it."
        }
      ]
    },
    {
      "name":"Making Use of Yarrow",
      "steps":[
        {
          "headline":"Plant yarrow as a fire barrier.",
          "description":"Yarrow doesn\u2019t burn very easily, so it is sometimes used in areas that are prone to fires as a way to slow down a spreading fire. In fact, it is often the first plant to begin regrowth in the disturbed area and will actually flourish in these conditions."
        },
        {
          "headline":"Prevent erosion.",
          "description":"Yarrow thrives in areas with dry, thin soil which are prone to erosion. That characteristic combined with its deep, thick roots make it the perfect plant for this type of area."
        },
        {
          "headline":"Cut the blooms and dry them for decoration.",
          "description":"Yarrow is often used in flower arrangements because the blooms last a long time once they\u2019ve been cut. The also retain their shape and color well after being dried. Just hang them upside down in a dark, dry room, and enjoy them long after they have been cut."
        }
      ]
    }
  ],
  "text":" Planting Yarrow Seeds Sow seeds in fall or early spring. Yarrow seeds need a cold, wet period to germinate, so you should sow the seeds in fall or early spring to give them time to begin blooming during spring and summer. The germination period usually lasts about two weeks. You also have the option of transplanting Conduct the germination process indoors. If you choose to plant the seeds in late spring, you\u2019ll want to complete a process called stratification that duplicates the cold, wet period needed to prepare temperate zone seeds for growing. Wrap the seeds in a wet paper towel and seal them in a plastic bag or put them in wet sand and refrigerate them for 4 weeks prior to planting. Position the seeds no deeper than 0.25 inches (0.64 cm) below the surface. Some light is needed for the germination process, so you don\u2019t want to plant the seeds too deep. Space the seeds 1\u20132 feet (0.30\u20130.61 m) apart. Yarrow produces large, robust roots, so you need to make sure you give the plant room to grow. Transplant a mature yarrow if you're not using seeds. Like most perennials, yarrows can easily be transplanted from a pot to its new home. Dig a hole twice the size of the pot and make sure to water the plant and the new location thoroughly before transfer. Filling the hole with water until it takes longer than 20 minutes for the water to soak into the ground is a great way to make sure there is enough moisture. For the best results, transplant yarrow in the fall or spring. The root ball should be even with the surface. Choose a sunny location to plant. Yarrow can tolerate some shade, but a full-sun area is ideal for the best growth. Too much shade can lead to flimsy stems, foliar disease, or rot. Be aware that a humid climate can contribute to powdery mildew disease, which is mostly cosmetic but still something to consider. Avoid soil with excessive moisture. Yarrow grows best in drier soil but will still flourish in moist soil if it is properly drained. If you notice that the soil retains a lot of water or always looks wet, it\u2019s probably not a good location to plant yarrow. Soils composed of sand tend to drain sufficiently, whereas clay-based soils do not. Creating a berm or raised bed with a mixture of clay and coarse sand can allow for better drainage if necessary. Give yarrow space. The roots become extremely dense once the plant matures. This can be beneficial for keeping weeds at bay but harmful for other plants. You can take advantage of yarrow\u2019s aggressive nature by using it to fill in areas of the garden where other plants can\u2019t seem to grow, like sharp inclines or rocky soil. Caring for Yarrow Water your yarrow deeply at least once a week the first summer. Although yarrow likes dry soil, watering helps the plant develop its thick roots and sets the stage for longevity and growth. If rainfall is more than an inch per week, you can let nature take care of this step. Once the plant has been established, no extra watering is required if located outside, especially on a an irrigated lawn. Apply fertilizer to your yarrow, if needed. Cut back the plant after the first frost. To stimulate new growth and enhance the appearance of yarrow, it is recommended that you cut the stems down to 1-2 inches above the surface after its first winter. Cut the stems at an angle to avoid water buildup in the stem. Dig up the plants and divide them every 3-4 years. Because yarrow can easily reseed and grows quickly, it can start to become unruly every few years. By thinning it out, you control which areas it spreads to and when. Using a gardening fork, start at the crown of the plant and gently work your way outward to lift the plant out of the ground. Then, divide into a few stalks per bunch by pulling or cutting if necessary and transplant the smaller bundles to their new home. Allow for good airflow. Yarrow is prone to fungal disease, especially in humid climates. By making sure the leaves and blooms have good airflow, you can help prevent it. Making Use of Yarrow Plant yarrow as a fire barrier. Yarrow doesn\u2019t burn very easily, so it is sometimes used in areas that are prone to fires as a way to slow down a spreading fire. In fact, it is often the first plant to begin regrowth in the disturbed area and will actually flourish in these conditions. Prevent erosion. Yarrow thrives in areas with dry, thin soil which are prone to erosion. That characteristic combined with its deep, thick roots make it the perfect plant for this type of area. Cut the blooms and dry them for decoration. Yarrow is often used in flower arrangements because the blooms last a long time once they\u2019ve been cut. The also retain their shape and color well after being dried. Just hang them upside down in a dark, dry room, and enjoy them long after they have been cut.",
  "tyn_model":[
    "yarrow",
    "water",
    "yarrows",
    "pot",
    "clay",
    "watering",
    "fertilizer",
    "gardening fork"
  ],
  "tyn_section":[

  ]
}