{
  "title":"How to Make a Gin Bucket",
  "url":"https://www.wikihow.com/Make-a-Gin-Bucket",
  "category_hierarchy":[
    "Food and Entertaining",
    "Drinks",
    "Alcoholic Drinks",
    "Spirits and Liqueurs"
  ],
  "parts":[
    {
      "name":"Selecting Ingredients",
      "steps":[
        {
          "headline":"Choose your gin.",
          "description":"This is largely a matter of personal preference or budget, but some recipes call for Gordon\u2019s, some call for G'Vine, and others simply call for generic gin. Like many drink recipes, the gin bucket has many variations, and you can experiment with them all until you find your favorite! G'Vine has a smooth floral taste because it\u2019s infused with vine flowers, and this floral taste goes well with the citrus component in the gin bucket. Gordon\u2019s is recommended by some because it\u2019s a traditional gin and has the classic gin bite."
        },
        {
          "headline":"Pick your soda.",
          "description":"Debates about what kind of soda are best for the gin bucket can get heated, but again this element of the drink is something you can experiment with until you find your desired combination. Among the most popular sodas are:\nFresca\nOrange dry soda\nSprite\n7-Up\nLemonade or limeade concentrate\nSan Pellegrino Limonata"
        },
        {
          "headline":"Gather your citrus fruits.",
          "description":"You can use any combination of citrus fruits you like, and any combination of those fruits for juicing or garnishing. The fruits that show up in most recipes are:\nLemon\nLime\nGrapefruit\nOrange"
        },
        {
          "headline":"Add any extras.",
          "description":"A basic gin bucket recipe doesn\u2019t call for anything other than soda, gin, and citrus fruits, but there are other ingredients you can add for additional flavors and to make the drink more complex, such as 12 ounces (355 ml) of Brut sparkling wine."
        }
      ]
    },
    {
      "name":"Mixing the Gin Bucket",
      "steps":[
        {
          "headline":"Fill a bucket with ice.",
          "description":"You can use a clean metal bucket, an ice bucket, a drink pitcher, or even a large cooler bucket that\u2019s designed for liquids. Fill the bucket about halfway with ice."
        },
        {
          "headline":"Cut and juice the citrus.",
          "description":"Choose the three citrus fruits you want for juicing and which two you want for garnish slices. Juice the three fruits of your choice and pour the juice over top of the ice. Slice the remaining fruit into wheels and set them aside."
        },
        {
          "headline":"Combine the remaining ingredients in your bucket.",
          "description":"Pour in the gin, the soda, and any additional ingredients you're adding. Stir the mixture well with a large wooden spoon. Garnish with the fruit wheels."
        },
        {
          "headline":"Serve immediately.",
          "description":"At a tailgate party, this beverage is usually served with two turkey basters in the bucket, and the drinks are consumed right from the turkey basters. For a different take on this tradition, use a clean turkey baster to serve the gin punch into individual glasses. Otherwise, use a ladle or punch bowl spoon to distribute the punch among your guests."
        }
      ]
    }
  ],
  "text":" Selecting Ingredients Choose your gin. This is largely a matter of personal preference or budget, but some recipes call for Gordon\u2019s, some call for G'Vine, and others simply call for generic gin. Like many drink recipes, the gin bucket has many variations, and you can experiment with them all until you find your favorite! G'Vine has a smooth floral taste because it\u2019s infused with vine flowers, and this floral taste goes well with the citrus component in the gin bucket. Gordon\u2019s is recommended by some because it\u2019s a traditional gin and has the classic gin bite. Pick your soda. Debates about what kind of soda are best for the gin bucket can get heated, but again this element of the drink is something you can experiment with until you find your desired combination. Among the most popular sodas are:\nFresca\nOrange dry soda\nSprite\n7-Up\nLemonade or limeade concentrate\nSan Pellegrino Limonata Gather your citrus fruits. You can use any combination of citrus fruits you like, and any combination of those fruits for juicing or garnishing. The fruits that show up in most recipes are:\nLemon\nLime\nGrapefruit\nOrange Add any extras. A basic gin bucket recipe doesn\u2019t call for anything other than soda, gin, and citrus fruits, but there are other ingredients you can add for additional flavors and to make the drink more complex, such as 12 ounces (355 ml) of Brut sparkling wine. Mixing the Gin Bucket Fill a bucket with ice. You can use a clean metal bucket, an ice bucket, a drink pitcher, or even a large cooler bucket that\u2019s designed for liquids. Fill the bucket about halfway with ice. Cut and juice the citrus. Choose the three citrus fruits you want for juicing and which two you want for garnish slices. Juice the three fruits of your choice and pour the juice over top of the ice. Slice the remaining fruit into wheels and set them aside. Combine the remaining ingredients in your bucket. Pour in the gin, the soda, and any additional ingredients you're adding. Stir the mixture well with a large wooden spoon. Garnish with the fruit wheels. Serve immediately. At a tailgate party, this beverage is usually served with two turkey basters in the bucket, and the drinks are consumed right from the turkey basters. For a different take on this tradition, use a clean turkey baster to serve the gin punch into individual glasses. Otherwise, use a ladle or punch bowl spoon to distribute the punch among your guests.",
  "tyn_model":[
    "gin",
    "gin bucket",
    "soda",
    "bucket",
    "ice",
    "gordon",
    "7-up",
    "lemonade or limeade",
    "citrus fruits",
    "lemon",
    "lime",
    "orange",
    "ice bucket",
    "drink pitcher",
    "citrus",
    "large wooden spoon",
    "fruit wheels",
    "turkey baster",
    "ladle",
    "punch bowl spoon"
  ],
  "tyn_section":[

  ]
}