{
  "title":"How to Play on a Game Boy Advance SP",
  "url":"https://www.wikihow.com/Play-on-a-Game-Boy-Advance-SP",
  "category_hierarchy":[
    "Hobbies and Crafts",
    "Games",
    "Video Games",
    "Nintendo Video Game Consoles",
    "Nintendo Game Boy",
    "Nintendo GBA"
  ],
  "parts":[
    {
      "name":"Charging the Game Boy Advance SP",
      "steps":[
        {
          "headline":"Find the charging port.",
          "description":"You'll find this along the top edge of the SP while the screen is closed. It is rectangular and is located towards the right side."
        },
        {
          "headline":"Connect the charging cable to the port.",
          "description":"The charging cable can only be inserted in one direction. Make sure not to force it in."
        },
        {
          "headline":"Plug the charger into an outlet.",
          "description":"Make sure that the prongs are fully extended."
        },
        {
          "headline":"Wait until the charging light turns off.",
          "description":"The charging light on the side of the Game Boy will stay lit while the device is charging. It will turn off once it is fully charged. You can play while the Game Boy is charging, but it will charge much slower."
        }
      ]
    },
    {
      "name":"Inserting a Game",
      "steps":[
        {
          "headline":"Close the screen.",
          "description":"It's good practice to close the screen when manipulating the Game Boy to increase stability."
        },
        {
          "headline":"Flip the Game Boy so that you're looking at the back.",
          "description":"The labels should be facing up so that you can read them."
        },
        {
          "headline":"Find the cartridge slot.",
          "description":"You'll find this slot on the back of the Game Boy, along the bottom edge. When you're holding the system as if to play it, the cartridge is upside down on the back."
        },
        {
          "headline":"Insert the cartridge with the label facing out.",
          "description":"The label should be facing away from the Game Boy system. You can play Game Boy Advance, Game Boy Color, and Game Boy games. Game Boy and Game Boy Color cartridges will stick out further than Game Boy Advance cartridges, which are flush when inserted."
        },
        {
          "headline":"Press firmly until the cartridge clicks into place.",
          "description":"Don't force the cartridge in, you should just need some firm pressure to lock it into place."
        },
        {
          "headline":"Open the screen.",
          "description":""
        },
        {
          "headline":"Push the Power switch towards the screen.",
          "description":"This will turn the Game Boy Advance SP on. The Power switch can be found along the right edge."
        }
      ]
    },
    {
      "name":"Playing the Game",
      "steps":[
        {
          "headline":"Refer to the game's manual for game-specific instructions.",
          "description":"Each game controls differently, but there are only a few buttons so you can likely figure out the controls if you don't have access to the manual. Besides the A and B buttons on the face, you also have the L and R shoulder buttons. Most games use the Start and Select buttons for pausing and menus, but won't use them as controls during gameplay."
        },
        {
          "headline":"Press the Backlight button to adjust the brightness.",
          "description":"This small button is directly below the screen. Pressing it will turn the backlight on or off. The backlight is useful in low-light conditions to help you see the screen, but will reduce battery life."
        },
        {
          "headline":"Connect headphones using a special adapter.",
          "description":"In order to use headphones on the Game Boy Advance SP, you'll need to connect the headphone adapter to the EXT2 port along the top edge. This is the same port as the charging cable. After connecting the adapter, you can plug headphones into the 3.5mm jack on the other end."
        },
        {
          "headline":"Slide the power switch off after you're finished playing.",
          "description":"Slide the switch back towards you to turn the system off. The Game Boy Advance SP will not turn off automatically when the screen is closed."
        },
        {
          "headline":"Slide the game cartridge out of the slot.",
          "description":"You may have to apply a little pressure while sliding to pop it out. Never remove a cartridge while the system is turned on."
        },
        {
          "headline":"Close the screen to store or travel.",
          "description":"Keeping the screen closed will help prevent damage to the Game Boy when being stored or during travel. Remember, the system does not turn off automatically when the screen is closed."
        }
      ]
    }
  ],
  "text":" Charging the Game Boy Advance SP Find the charging port. You'll find this along the top edge of the SP while the screen is closed. It is rectangular and is located towards the right side. Connect the charging cable to the port. The charging cable can only be inserted in one direction. Make sure not to force it in. Plug the charger into an outlet. Make sure that the prongs are fully extended. Wait until the charging light turns off. The charging light on the side of the Game Boy will stay lit while the device is charging. It will turn off once it is fully charged. You can play while the Game Boy is charging, but it will charge much slower. Inserting a Game Close the screen. It's good practice to close the screen when manipulating the Game Boy to increase stability. Flip the Game Boy so that you're looking at the back. The labels should be facing up so that you can read them. Find the cartridge slot. You'll find this slot on the back of the Game Boy, along the bottom edge. When you're holding the system as if to play it, the cartridge is upside down on the back. Insert the cartridge with the label facing out. The label should be facing away from the Game Boy system. You can play Game Boy Advance, Game Boy Color, and Game Boy games. Game Boy and Game Boy Color cartridges will stick out further than Game Boy Advance cartridges, which are flush when inserted. Press firmly until the cartridge clicks into place. Don't force the cartridge in, you should just need some firm pressure to lock it into place. Open the screen.  Push the Power switch towards the screen. This will turn the Game Boy Advance SP on. The Power switch can be found along the right edge. Playing the Game Refer to the game's manual for game-specific instructions. Each game controls differently, but there are only a few buttons so you can likely figure out the controls if you don't have access to the manual. Besides the A and B buttons on the face, you also have the L and R shoulder buttons. Most games use the Start and Select buttons for pausing and menus, but won't use them as controls during gameplay. Press the Backlight button to adjust the brightness. This small button is directly below the screen. Pressing it will turn the backlight on or off. The backlight is useful in low-light conditions to help you see the screen, but will reduce battery life. Connect headphones using a special adapter. In order to use headphones on the Game Boy Advance SP, you'll need to connect the headphone adapter to the EXT2 port along the top edge. This is the same port as the charging cable. After connecting the adapter, you can plug headphones into the 3.5mm jack on the other end. Slide the power switch off after you're finished playing. Slide the switch back towards you to turn the system off. The Game Boy Advance SP will not turn off automatically when the screen is closed. Slide the game cartridge out of the slot. You may have to apply a little pressure while sliding to pop it out. Never remove a cartridge while the system is turned on. Close the screen to store or travel. Keeping the screen closed will help prevent damage to the Game Boy when being stored or during travel. Remember, the system does not turn off automatically when the screen is closed.",
  "tyn_model":[
    "game boy",
    "game boy advance",
    "headphones",
    "game boy color",
    "charger",
    "cartridge",
    "game boy and",
    "cartridges",
    "headphone adapter"
  ],
  "tyn_section":[

  ]
}