{
  "title":"How to Clean and Disinfect Ice Trays",
  "url":"https://www.wikihow.com/Clean-and-Disinfect-Ice-Trays",
  "category_hierarchy":[
    "Home and Garden",
    "Housekeeping",
    "Cleaning"
  ],
  "methods":[
    {
      "name":"Using Baking Soda",
      "steps":[
        {
          "headline":"Hold your ice trays under warm water.",
          "description":"Turn on the warm water tap and hold the ice trays under the stream. This will remove loose debris from the trays and melt any ice or frost residue."
        },
        {
          "headline":"Make a cleaning solution with baking soda and warm water.",
          "description":"Measure out two teaspoons of baking soda and \u00bd cup (60 mL) warm water. Dump them in a medium-sized bowl. Use a spoon the mix them together."
        },
        {
          "headline":"Pour the cleaning solution into the trays.",
          "description":"Fill up each little cube section in your trays with the baking soda solution. Allow the trays to soak in the solution for a few minutes. Set any remaining solution aside; you may need to use more of it."
        },
        {
          "headline":"Scrub the trays with a clean washcloth.",
          "description":"With the trays still filled with the solution, use a washcloth to scrub each cube section. Be sure to get down into the nooks and crannies. Use the washcloth to go over the plastic between and around the cube sections, as well."
        },
        {
          "headline":"Rinse the trays with warm water.",
          "description":"Turn on your warm water tap and hold the trays underneath it to rinse away the baking soda solution. Keep rinsing until you no longer see any baking soda residue and the water runs clear."
        },
        {
          "headline":"Dry the trays.",
          "description":"You can put them on a dish rack to dry, or simply use a clean cloth the dry them. Once the trays are dry, refill them with water and place them in your freezer as you normally would to make ice."
        },
        {
          "headline":"Place an open box of baking soda in your freezer.",
          "description":"Ice trays (and the ice inside them) absorb odors from other items in your freezer over time. This often results in bad-tasting ice cubes. An open box of baking soda will soak up odors in your freezer and drastically reduce what your ice trays absorb. Replace the backing soda with a new box every 30 days for best results. Make sure all of the food in your freezer is packaged tightly to reduce odors."
        }
      ]
    },
    {
      "name":"Using Vinegar",
      "steps":[
        {
          "headline":"Wash the trays in warm soapy water.",
          "description":"Fill your sink with warm water and your usual dish detergent. Place the ice trays in the water. Use a cloth or sponge to scrub the trays to remove loose debris and any lingering ice residue. Rinse them thoroughly with clean warm water."
        },
        {
          "headline":"Fill a large bowl with vinegar and water.",
          "description":"Measure out 1 cup (120 mL) of white vinegar and pour it into a very large bowl or bucket. Add a gallon of water to the container. Mix the solution with a spoon."
        },
        {
          "headline":"Submerge the ice trays in the solution.",
          "description":"Push the trays down several times so that they\u2019re completely submerged in the solution. Some ice trays may stubbornly continue to float. If this is happening to you, put something on top of the trays to weigh them down."
        },
        {
          "headline":"Allow the trays to soak for two to six hours.",
          "description":"Once they\u2019re submerged in the vinegar solution, let the trays soak for a minimum of two hours. You may want to put the bowl or bucket in a safe place where small children or pets can\u2019t get into them."
        },
        {
          "headline":"Rinse the trays with clean water.",
          "description":"Remove the trays from the vinegar solution. Dump the solution down your sink drain. Hold the trays under your faucet and rinse them thoroughly with clean water."
        },
        {
          "headline":"Dry the ice trays.",
          "description":"Place them on your dish-drying rack, or you can wipe them dry with a clean towel. Don\u2019t forget to dry the underside of the trays, as well. Once completely dry, refill them with clean water and freeze them as you normally would."
        }
      ]
    }
  ],
  "text":" Using Baking Soda Hold your ice trays under warm water. Turn on the warm water tap and hold the ice trays under the stream. This will remove loose debris from the trays and melt any ice or frost residue. Make a cleaning solution with baking soda and warm water. Measure out two teaspoons of baking soda and \u00bd cup (60 mL) warm water. Dump them in a medium-sized bowl. Use a spoon the mix them together. Pour the cleaning solution into the trays. Fill up each little cube section in your trays with the baking soda solution. Allow the trays to soak in the solution for a few minutes. Set any remaining solution aside; you may need to use more of it. Scrub the trays with a clean washcloth. With the trays still filled with the solution, use a washcloth to scrub each cube section. Be sure to get down into the nooks and crannies. Use the washcloth to go over the plastic between and around the cube sections, as well. Rinse the trays with warm water. Turn on your warm water tap and hold the trays underneath it to rinse away the baking soda solution. Keep rinsing until you no longer see any baking soda residue and the water runs clear. Dry the trays. You can put them on a dish rack to dry, or simply use a clean cloth the dry them. Once the trays are dry, refill them with water and place them in your freezer as you normally would to make ice. Place an open box of baking soda in your freezer. Ice trays (and the ice inside them) absorb odors from other items in your freezer over time. This often results in bad-tasting ice cubes. An open box of baking soda will soak up odors in your freezer and drastically reduce what your ice trays absorb. Replace the backing soda with a new box every 30 days for best results. Make sure all of the food in your freezer is packaged tightly to reduce odors. Using Vinegar Wash the trays in warm soapy water. Fill your sink with warm water and your usual dish detergent. Place the ice trays in the water. Use a cloth or sponge to scrub the trays to remove loose debris and any lingering ice residue. Rinse them thoroughly with clean warm water. Fill a large bowl with vinegar and water. Measure out 1 cup (120 mL) of white vinegar and pour it into a very large bowl or bucket. Add a gallon of water to the container. Mix the solution with a spoon. Submerge the ice trays in the solution. Push the trays down several times so that they\u2019re completely submerged in the solution. Some ice trays may stubbornly continue to float. If this is happening to you, put something on top of the trays to weigh them down. Allow the trays to soak for two to six hours. Once they\u2019re submerged in the vinegar solution, let the trays soak for a minimum of two hours. You may want to put the bowl or bucket in a safe place where small children or pets can\u2019t get into them. Rinse the trays with clean water. Remove the trays from the vinegar solution. Dump the solution down your sink drain. Hold the trays under your faucet and rinse them thoroughly with clean water. Dry the ice trays. Place them on your dish-drying rack, or you can wipe them dry with a clean towel. Don\u2019t forget to dry the underside of the trays, as well. Once completely dry, refill them with clean water and freeze them as you normally would.",
  "tyn_model":[
    "water",
    "baking soda",
    "ice trays",
    "vinegar",
    "washcloth",
    "spoon",
    "ice",
    "dish rack",
    "ice cubes",
    "soda",
    "dish detergent",
    "sponge",
    "white vinegar",
    "bowl",
    "dish-drying rack"
  ],
  "tyn_section":[

  ]
}