{
  "title":"How to Download Free Games on Nintendo DS",
  "url":"https://www.wikihow.com/Download-Free-Games-on-Nintendo-DS",
  "category_hierarchy":[
    "Hobbies and Crafts",
    "Games",
    "Video Games",
    "Nintendo Video Game Consoles",
    "Nintendo DS"
  ],
  "parts":[
    {
      "name":"Setting up the Equipment",
      "steps":[
        {
          "headline":"Buy an R4 SDHC card.",
          "description":"An R4 SDHC card is the substitute for a game card when loading your own games on a DS. This is what you'll plug into the DS in order to load your downloaded games. The easiest way to find an R4 SDHC card that will work with your DS is by typing r4 sdhc nintendo ds into an online store's search."
        },
        {
          "headline":"Buy a microSD card.",
          "description":"The microSD card is actually where the games will be stored, so try to find a two-gigabyte (2 GB) card if possible. You can find microSD cards online as well as in most tech stores. Most microSD cards come with an adapter that allows you to open the SD card on a computer. If your selected microSD card doesn't include an adapter, you'll need to buy one as well."
        },
        {
          "headline":"Plug the microSD card into the included adapter card.",
          "description":"At the top of the microSD's adapter card, there should be a small slot into which you'll insert the microSD card. The microSD card only fits one way, so don't force it. If the microSD card won't fit into the adapter card, flip the microSD card over and try again."
        },
        {
          "headline":"Plug the microSD card's adapter card into your computer.",
          "description":"There should be a wide, flat slot on the side of your computer (laptop) or on the CPU box (desktop) into which the adapter card fits. If you use a Mac, you may need a USB-C to SD card adapter."
        },
        {
          "headline":"Format the card.",
          "description":"Before you can add files to the microSD card, you'll need to make sure that the card's format is correct:\nOn Windows, select FAT32 as the file system. On Mac, select MS-DOS (FAT) as the file system."
        },
        {
          "headline":"Download a ROM for your selected game.",
          "description":"A ROM is a game file; by placing these game files on your SD card and then using the card with your DS, you'll be able to select games directly off of the card. The easiest way to download ROMs is by searching for your game title followed by \"ds rom\", selecting a reputable site, and clicking the \"Download\" button or link. Keep in mind that downloading ROMs for games that you don't already own is piracy, which is illegal in most places. Make sure that you only download from sites that you can trust based on user feedback and reviews. You don't want to accidentally download a virus."
        },
        {
          "headline":"Wait for your ROM to finish downloading.",
          "description":"Once the ROM for your game has finished downloading onto your computer, you can proceed with adding the ROM to your microSD on a Windows or Mac computer."
        }
      ]
    },
    {
      "name":"Adding Games on Windows",
      "steps":[
        {
          "headline":"Make sure that the microSD card is plugged in.",
          "description":"If you unplugged the adapter card (or the microSD card from the adapter card) from your computer, re-plug in the card before continuing."
        },
        {
          "headline":"Open Start .",
          "description":"Click the Windows logo in the bottom-left corner of the screen."
        },
        {
          "headline":"Open File Explorer .",
          "description":"Click the folder-shaped icon in the lower-left side of the window."
        },
        {
          "headline":"Go to the downloaded ROM's location.",
          "description":"On the left side of the File Explorer window, click the folder to which your ROM was downloaded. For example, if your downloaded files normally go to the Downloads folder, you'd click Downloads here."
        },
        {
          "headline":"Select the ROM.",
          "description":"Click the ROM file that you just downloaded."
        },
        {
          "headline":"Copy the ROM.",
          "description":"Press Ctrl+C to copy the ROM."
        },
        {
          "headline":"Select your SD card's folder.",
          "description":"Click your SD card's name in the lower-left side of the File Explorer window. You may have to scroll down to find the SD card. Alternatively, you can click the This PC folder and then double-click your SD card's name under the \"Devices and drives\" heading."
        },
        {
          "headline":"Paste in the ROM.",
          "description":"Click a blank space in the SD card's window, then press Ctrl+V to paste in the ROM. You should see the ROM's file icon appear in the window."
        },
        {
          "headline":"Eject the SD card.",
          "description":"Click the flash drive-shaped icon in the bottom-right corner of the screen, then click the Eject option in the pop-up menu. Once you receive a notification, you can physically remove the SD card from your computer. You may first have to click ^ in the lower-right corner of the screen to see the flash drive icon."
        }
      ]
    },
    {
      "name":"Adding Games on Mac",
      "steps":[
        {
          "headline":"Make sure that the microSD card is plugged in.",
          "description":"If you unplugged the adapter card (or the microSD card from the adapter card) from your computer, re-plug in the card before continuing."
        },
        {
          "headline":"Open Finder.",
          "description":"Click the blue, face-like app icon in your Mac's Dock."
        },
        {
          "headline":"Go to the downloaded ROM's location.",
          "description":"On the left side of the Finder window, click the folder to which your ROM folder was downloaded. For most browsers, the default download location is the Downloads folder."
        },
        {
          "headline":"Select your ROM.",
          "description":"Find the ROM file and click it."
        },
        {
          "headline":"Copy the ROM.",
          "description":"Press \u2318 Command+C to do so."
        },
        {
          "headline":"Click your SD card's name.",
          "description":"In the lower-left side of the Finder window, you should see a \"Devices\" heading, under which your SD card should be listed. Clicking this opens the SD card's window."
        },
        {
          "headline":"Paste in your ROM file.",
          "description":"Click the SD card window, then press \u2318 Command+V. You should see the ROM file appear in the window."
        },
        {
          "headline":"Eject the SD card.",
          "description":"Click the triangle-shaped \"Eject\" icon to the right of the SD card's name in the Finder, then remove the card from your Mac when prompted."
        }
      ]
    },
    {
      "name":"Playing Downloaded Games",
      "steps":[
        {
          "headline":"Plug the microSD card into the R4 card.",
          "description":"There should be a small slot at the top of the R4 card into which the microSD card fits. As with the microSD card's adapter card, the microSD card only fits one way."
        },
        {
          "headline":"Insert the R4 card into your Nintendo DS.",
          "description":"The R4 card should fit into the slot into which you usually insert your games' cards. Make sure that the microSD card is snugly inserted into the R4 card as well. On the original DS, you may first have to plug a card reader into the bottom of the DS."
        },
        {
          "headline":"Turn on your DS.",
          "description":"Press the \"Power\" button to turn on the DS."
        },
        {
          "headline":"Select the \"MicroSD Card\" option.",
          "description":"Once the DS finishes powering on, you should see a \"MicroSD Card\" option (or something similar) on the bottom screen."
        },
        {
          "headline":"Select your game.",
          "description":"The game that you downloaded in ROM format should be displayed here. Select it to open it on your DS and begin playing!"
        }
      ]
    }
  ],
  "text":" Setting up the Equipment Buy an R4 SDHC card. An R4 SDHC card is the substitute for a game card when loading your own games on a DS. This is what you'll plug into the DS in order to load your downloaded games. The easiest way to find an R4 SDHC card that will work with your DS is by typing r4 sdhc nintendo ds into an online store's search. Buy a microSD card. The microSD card is actually where the games will be stored, so try to find a two-gigabyte (2 GB) card if possible. You can find microSD cards online as well as in most tech stores. Most microSD cards come with an adapter that allows you to open the SD card on a computer. If your selected microSD card doesn't include an adapter, you'll need to buy one as well. Plug the microSD card into the included adapter card. At the top of the microSD's adapter card, there should be a small slot into which you'll insert the microSD card. The microSD card only fits one way, so don't force it. If the microSD card won't fit into the adapter card, flip the microSD card over and try again. Plug the microSD card's adapter card into your computer. There should be a wide, flat slot on the side of your computer (laptop) or on the CPU box (desktop) into which the adapter card fits. If you use a Mac, you may need a USB-C to SD card adapter. Format the card. Before you can add files to the microSD card, you'll need to make sure that the card's format is correct:\nOn Windows, select FAT32 as the file system. On Mac, select MS-DOS (FAT) as the file system. Download a ROM for your selected game. A ROM is a game file; by placing these game files on your SD card and then using the card with your DS, you'll be able to select games directly off of the card. The easiest way to download ROMs is by searching for your game title followed by \"ds rom\", selecting a reputable site, and clicking the \"Download\" button or link. Keep in mind that downloading ROMs for games that you don't already own is piracy, which is illegal in most places. Make sure that you only download from sites that you can trust based on user feedback and reviews. You don't want to accidentally download a virus. Wait for your ROM to finish downloading. Once the ROM for your game has finished downloading onto your computer, you can proceed with adding the ROM to your microSD on a Windows or Mac computer. Adding Games on Windows Make sure that the microSD card is plugged in. If you unplugged the adapter card (or the microSD card from the adapter card) from your computer, re-plug in the card before continuing. Open Start . Click the Windows logo in the bottom-left corner of the screen. Open File Explorer . Click the folder-shaped icon in the lower-left side of the window. Go to the downloaded ROM's location. On the left side of the File Explorer window, click the folder to which your ROM was downloaded. For example, if your downloaded files normally go to the Downloads folder, you'd click Downloads here. Select the ROM. Click the ROM file that you just downloaded. Copy the ROM. Press Ctrl+C to copy the ROM. Select your SD card's folder. Click your SD card's name in the lower-left side of the File Explorer window. You may have to scroll down to find the SD card. Alternatively, you can click the This PC folder and then double-click your SD card's name under the \"Devices and drives\" heading. Paste in the ROM. Click a blank space in the SD card's window, then press Ctrl+V to paste in the ROM. You should see the ROM's file icon appear in the window. Eject the SD card. Click the flash drive-shaped icon in the bottom-right corner of the screen, then click the Eject option in the pop-up menu. Once you receive a notification, you can physically remove the SD card from your computer. You may first have to click ^ in the lower-right corner of the screen to see the flash drive icon. Adding Games on Mac Make sure that the microSD card is plugged in. If you unplugged the adapter card (or the microSD card from the adapter card) from your computer, re-plug in the card before continuing. Open Finder. Click the blue, face-like app icon in your Mac's Dock. Go to the downloaded ROM's location. On the left side of the Finder window, click the folder to which your ROM folder was downloaded. For most browsers, the default download location is the Downloads folder. Select your ROM. Find the ROM file and click it. Copy the ROM. Press \u2318 Command+C to do so. Click your SD card's name. In the lower-left side of the Finder window, you should see a \"Devices\" heading, under which your SD card should be listed. Clicking this opens the SD card's window. Paste in your ROM file. Click the SD card window, then press \u2318 Command+V. You should see the ROM file appear in the window. Eject the SD card. Click the triangle-shaped \"Eject\" icon to the right of the SD card's name in the Finder, then remove the card from your Mac when prompted. Playing Downloaded Games Plug the microSD card into the R4 card. There should be a small slot at the top of the R4 card into which the microSD card fits. As with the microSD card's adapter card, the microSD card only fits one way. Insert the R4 card into your Nintendo DS. The R4 card should fit into the slot into which you usually insert your games' cards. Make sure that the microSD card is snugly inserted into the R4 card as well. On the original DS, you may first have to plug a card reader into the bottom of the DS. Turn on your DS. Press the \"Power\" button to turn on the DS. Select the \"MicroSD Card\" option. Once the DS finishes powering on, you should see a \"MicroSD Card\" option (or something similar) on the bottom screen. Select your game. The game that you downloaded in ROM format should be displayed here. Select it to open it on your DS and begin playing!",
  "tyn_model":[
    "microsd card",
    "sd card",
    "ds",
    "r4 sdhc card",
    "microsd cards",
    "file explorer",
    "flash drive",
    "finder",
    "mac",
    "usb-c to sd card",
    "virus",
    "\u2318 command+c",
    "\u2318 command+v.",
    "nintendo ds",
    "card reader"
  ],
  "tyn_section":[

  ]
}