{
  "title":"How to Slow Cook a Roast",
  "url":"https://www.wikihow.com/Slow-Cook-a-Roast",
  "category_hierarchy":[
    "Food and Entertaining",
    "Recipes",
    "Meat"
  ],
  "methods":[
    {
      "name":"Using a Slow Cooker to Cook a Roast",
      "steps":[
        {
          "headline":"Buy a quality cut of meat.",
          "description":"Select a cut from a tough muscle group such as the chuck or rump. These muscle groups contain a large amount of connective tissue as well as moderate amounts of fat to break down and create a juicy tender meat when cooked slowly. A few cuts that typically yield the best results:\nChuck Roast\nChuck Shoulder\nRump Roast\nBrisket\nEye of Round"
        },
        {
          "headline":"Season your meat.",
          "description":"Rub the outside of the roast with coarse salt and pepper. Some fresh herbs or spices, such as thyme or red pepper, can also add great flavor to your meat. Let the meat sit out and reach room temperature prior to cooking."
        },
        {
          "headline":"Chop vegetables to cook with the meat.",
          "description":"Use a variety of hard vegetables such as carrots, potatoes, celery, and onions cut into \u00be inch pieces. Place a layer of vegetables on the bottom of the crock pot. Add the remaining vegetables after placing the meat in the pan."
        },
        {
          "headline":"Place meat, fat side up, in the crock pot.",
          "description":"Surround the meat with the remaining vegetables."
        },
        {
          "headline":"Add liquid and seasoning to the pot.",
          "description":"There are many options to add flavor to your roast and make a juicy meal. Beef stock, red wine, and cream of vegetable condensed soups are all great choices. You can experiment with flavors and combinations to make the roast your own. Start with this basic recipe for seasoning:\n1 package of Onion Soup/Dip mix\n1 can of condensed Cream of Mushroom soup\n\u00bd cup red wine (Merlot or Cabernet)\n\u00bd cup beef stock"
        },
        {
          "headline":"Cook the roast on low for about 5-7 hours.",
          "description":"Cook your meat for about 2 hours per pound of weight. Depending on the size of your roast you will need to adjust the cooking time."
        },
        {
          "headline":"Serve the roast.",
          "description":"Slice the meat against the grain for the most tender bites. Serve pieces of meat with spoonfuls of vegetables topped with the juices from cooking. Add salt and pepper to taste, and enjoy your delicious meal!"
        }
      ]
    },
    {
      "name":"Cooking a Roast in the Oven",
      "steps":[
        {
          "headline":"Select a quality cut of meat.",
          "description":"Slow cooking allows for lots of versatility in your choice of meat. Pork and beef tenderloin or prime rib are delicious options for slow cooking in an oven."
        },
        {
          "headline":"Preheat the oven to 250\u00baF (120\u00b0C).",
          "description":"You will adjust the temperature when the roast is put in the oven. Ensuring that your oven is heated before your put in the roast will help ensure even cooking from start to finish."
        },
        {
          "headline":"Brown the outside of the meat to sear in the juices.",
          "description":"Place a large pan over medium high heat on the stove top. Place the meat in the hot pan and sear the meat on all sides. Allow the meat to cook for about thirty seconds on all sides to quickly brown the outer layer of the meat."
        },
        {
          "headline":"Place the meat in a shallow baking pan with a wire rack on the bottom.",
          "description":"The rack raises the meat off the bottom of the pan to allow for better air circulation and even cooking. It also keeps the meat from stewing in the juices and becoming soggy on the bottom. If a pan with a rack is not available, place the meat on sturdy foods such as potatoes or carrots to keep it from getting too wet."
        },
        {
          "headline":"Turn the oven down to 200\u00baF (93\u00b0C) and cook for about 1 hour per pound.",
          "description":"Check your meat with a thermometer after 2.5 hours for a 2.5 pound roast. Follow these guidelines for doneness when checking temperature:\n130\u00baF (54\u00b0C) Rare\n135\u00baF (57\u00b0C) Medium Rare\n150\u00baF (65\u00b0C) Medium\n160\u00baF (71\u00b0C) Well Done\nNOTE: Your meat will continue to cook slightly after removing from the oven. The final temperature may change after you take it out of the oven."
        },
        {
          "headline":"Allow meat to rest for 15 minutes prior to slicing.",
          "description":"Resting meat ensures that you get a moist cut when you slice the roast. Avoid cutting the meat early to prevent all the juices and flavor from seeping out."
        },
        {
          "headline":"Slice the meat against the grain and serve.",
          "description":"After several hours of cooking it is now time to enjoy your roast. Cut perpendicular to the grain of the muscle to get the most tender bites."
        }
      ]
    }
  ],
  "text":" Using a Slow Cooker to Cook a Roast Buy a quality cut of meat. Select a cut from a tough muscle group such as the chuck or rump. These muscle groups contain a large amount of connective tissue as well as moderate amounts of fat to break down and create a juicy tender meat when cooked slowly. A few cuts that typically yield the best results:\nChuck Roast\nChuck Shoulder\nRump Roast\nBrisket\nEye of Round Season your meat. Rub the outside of the roast with coarse salt and pepper. Some fresh herbs or spices, such as thyme or red pepper, can also add great flavor to your meat. Let the meat sit out and reach room temperature prior to cooking. Chop vegetables to cook with the meat. Use a variety of hard vegetables such as carrots, potatoes, celery, and onions cut into \u00be inch pieces. Place a layer of vegetables on the bottom of the crock pot. Add the remaining vegetables after placing the meat in the pan. Place meat, fat side up, in the crock pot. Surround the meat with the remaining vegetables. Add liquid and seasoning to the pot. There are many options to add flavor to your roast and make a juicy meal. Beef stock, red wine, and cream of vegetable condensed soups are all great choices. You can experiment with flavors and combinations to make the roast your own. Start with this basic recipe for seasoning:\n1 package of Onion Soup/Dip mix\n1 can of condensed Cream of Mushroom soup\n\u00bd cup red wine (Merlot or Cabernet)\n\u00bd cup beef stock Cook the roast on low for about 5-7 hours. Cook your meat for about 2 hours per pound of weight. Depending on the size of your roast you will need to adjust the cooking time. Serve the roast. Slice the meat against the grain for the most tender bites. Serve pieces of meat with spoonfuls of vegetables topped with the juices from cooking. Add salt and pepper to taste, and enjoy your delicious meal! Cooking a Roast in the Oven Select a quality cut of meat. Slow cooking allows for lots of versatility in your choice of meat. Pork and beef tenderloin or prime rib are delicious options for slow cooking in an oven. Preheat the oven to 250\u00baF (120\u00b0C). You will adjust the temperature when the roast is put in the oven. Ensuring that your oven is heated before your put in the roast will help ensure even cooking from start to finish. Brown the outside of the meat to sear in the juices. Place a large pan over medium high heat on the stove top. Place the meat in the hot pan and sear the meat on all sides. Allow the meat to cook for about thirty seconds on all sides to quickly brown the outer layer of the meat. Place the meat in a shallow baking pan with a wire rack on the bottom. The rack raises the meat off the bottom of the pan to allow for better air circulation and even cooking. It also keeps the meat from stewing in the juices and becoming soggy on the bottom. If a pan with a rack is not available, place the meat on sturdy foods such as potatoes or carrots to keep it from getting too wet. Turn the oven down to 200\u00baF (93\u00b0C) and cook for about 1 hour per pound. Check your meat with a thermometer after 2.5 hours for a 2.5 pound roast. Follow these guidelines for doneness when checking temperature:\n130\u00baF (54\u00b0C) Rare\n135\u00baF (57\u00b0C) Medium Rare\n150\u00baF (65\u00b0C) Medium\n160\u00baF (71\u00b0C) Well Done\nNOTE: Your meat will continue to cook slightly after removing from the oven. The final temperature may change after you take it out of the oven. Allow meat to rest for 15 minutes prior to slicing. Resting meat ensures that you get a moist cut when you slice the roast. Avoid cutting the meat early to prevent all the juices and flavor from seeping out. Slice the meat against the grain and serve. After several hours of cooking it is now time to enjoy your roast. Cut perpendicular to the grain of the muscle to get the most tender bites.",
  "tyn_model":[
    "oven",
    "vegetables",
    "carrots",
    "potatoes",
    "crock pot",
    "pan",
    "beef stock",
    "red wine",
    "slow cooker",
    "rump roast",
    "brisket",
    "salt and pepper",
    "celery",
    "onions",
    "pot",
    "cream of vegetable condensed soups",
    "onion soup",
    "cream of mushroom soup",
    "pepper",
    "beef tenderloin",
    "prime rib",
    "large pan",
    "stove",
    "baking pan",
    "wire rack",
    "thermometer"
  ],
  "tyn_section":[

  ]
}