{
  "title":"How to Make Refreshing Cold Coffee",
  "url":"https://www.wikihow.com/Make-Refreshing-Cold-Coffee",
  "category_hierarchy":[
    "Food and Entertaining",
    "Drinks",
    "Coffee",
    "Iced Coffee"
  ],
  "methods":[
    {
      "name":"Chilling Regular Coffee",
      "steps":[
        {
          "headline":"Know that pouring coffee over plain ice cubes often leads to watery, unappealing coffee.",
          "description":"The reason why most coffee shops use cold brewing to make iced coffee is that it prevents your coffee from losing flavor to the ice. However, there are several ways to get delicious iced coffee without waiting 12 hours for a cold brew."
        },
        {
          "headline":"Brew your coffee double strength and pour it over a full glass of ice.",
          "description":"The simplest way to get great tasting, refreshing cold coffee is to brew it twice as strong and let the ice dilute the coffee. Simply brew your coffee like normal, using twice as many grounds (or half as much water) as you normally would. Let the coffee cool for 2-3 minutes before pouring it over a full glass of ice. You may need to add more ice to the drink to keep it cool, as some of it will melt quickly."
        },
        {
          "headline":"Make coffee ice cubes and add them to hot coffee.",
          "description":"These marvelous little cubes will keep your coffee cold without diluting it. You should consider getting a new ice tray, or dedicating one to coffee cubes, as it will leave a faint coffee flavor in the tray. Brew a fresh pot of regular strength coffee. Let it cool to room temperature. Pour the coffee into an ice tray and freeze overnight. Use the coffee cubes to chill your hot coffee."
        },
        {
          "headline":"Chill a pot of coffee in the fridge.",
          "description":"The simplest, easiest way to get cold coffee is to take a fresh pot of coffee, pour some in a mug, and place the mug in the refrigerator. Make sure the top is covered to prevent the coffee from picking up other smells in the fridge and ruining the taste. While this is may not get your coffee cold enough to call \"iced,\" you can add some coffee ice cubes to help make your drink refreshingly chill."
        },
        {
          "headline":"Add any sugar while the coffee is still hot.",
          "description":"Sugar dissolves best in hot liquids, so add it before chilling your drink to get the best results. You can add milk or cream at any time, but it is usually best to add it right before serving."
        }
      ]
    },
    {
      "name":"Cold-Brewing Coffee",
      "steps":[
        {
          "headline":"Know that cold-brewing is the best way to get flavorful, undiluted cold coffee.",
          "description":"When you make cold-brew, you avoid diluting your coffee with ice cubes or letting hot coffee sit out and get cold, which ruins its flavor. Cold brewed coffee has less acidity than traditionally made coffee, and less bitterness."
        },
        {
          "headline":"Mix the ground coffee and water together in a pitcher.",
          "description":"Stir them until there are no lumps left in the coffee. You should aim for roughly 4.5 times more water than coffee, so if you want 8 cups of coffee, use 8 cups water and 1.5 cups of grounds. If you grind your own coffee, grind it as finely as you can. This is best for cold-brew."
        },
        {
          "headline":"Add any sugar before chilling your coffee.",
          "description":"The sugar will dissolve better in warm water and will stay in the drink as it chills. If you try to add sugar to cold coffee the chances are good that you will be left with undissolved sugar at the bottom of your cup."
        },
        {
          "headline":"Cover the pitcher with plastic wrap.",
          "description":"If the pitcher has a top, you can also use that instead."
        },
        {
          "headline":"Chill the coffee in the refrigerator for at least 12 hours, or overnight.",
          "description":"This is when the coffee actually brews. Because there is no heat involved, it takes much longer to brew than a normal cup off coffee, but the taste is worth it."
        },
        {
          "headline":"Place a coffee filter in a mesh strainer and rest it over a medium bowl.",
          "description":"A combination of a filter and mesh strainer should get rid of most grounds in your coffee. Set up the strainer above a bowl, or another pitcher, to catch the coffee."
        },
        {
          "headline":"Slowly pour your cold-brew through the strainer.",
          "description":"The coffee will slowly trickle out the bottom of the strainer and the grounds will remain on top. Pour slowly, and never try to force or press the coffee through the filter. When you are done, throw out the coffee grounds and serve."
        },
        {
          "headline":"Alternatively, make cold brew in a French Press instead of a pitcher.",
          "description":"Simply mix the water and coffee grounds in the pot and put the lid on. Do not push down the plunger. Refrigerate the coffee overnight, then push down the plunger and serve in the morning."
        }
      ]
    },
    {
      "name":"Variations",
      "steps":[
        {
          "headline":"Blend your coffee with ice for a quick frappe.",
          "description":"A frappe is a whipped, frozen coffee drink invented in Greece and made popular by Starbucks as a \"Frappuccino.\" Simply toss your coffee in a blender with 6-8 large cubes of ice, 1/2 cup of milk, and blend until there are only small chips of ice left in the drink. Consider adding:\nChocolate syrup or cocoa powder. Caramel syrup. Vanilla or almond extract. Crushed cookies\nCondensed or chocolate milk. Kahlua, brandy, or Irish Cream."
        },
        {
          "headline":"Add spices to your iced coffee for a new flavor.",
          "description":"You can add them before chilling your pot of cold-brew or right before serving. Spiced coffee goes well with 1/2 cup condensed or regular milk as well. Some suggestions include:\n1-2 teaspoons of orange zest with 2-3 crushed pods of cardamon. 1 teaspoon of cinnamon, ground cloves, and nutmeg. 1 tablespoon honey and 5-10 crushed, chopped mint leaves. Sprinkle of sea salt and 1-2 teaspoons cocoa powder."
        },
        {
          "headline":"Pour hot espresso over a scoop of ice cream for a delicious affogato.",
          "description":"This dessert treat is a wonderfully sweet take on refreshing, cold coffee. Brew a pot of espresso. Place one scoop of ice cream at the bottom of a coffee cup and slowly pour the espresso over the top. Enjoy with a spoon."
        }
      ]
    }
  ],
  "text":" Chilling Regular Coffee Know that pouring coffee over plain ice cubes often leads to watery, unappealing coffee. The reason why most coffee shops use cold brewing to make iced coffee is that it prevents your coffee from losing flavor to the ice. However, there are several ways to get delicious iced coffee without waiting 12 hours for a cold brew. Brew your coffee double strength and pour it over a full glass of ice. The simplest way to get great tasting, refreshing cold coffee is to brew it twice as strong and let the ice dilute the coffee. Simply brew your coffee like normal, using twice as many grounds (or half as much water) as you normally would. Let the coffee cool for 2-3 minutes before pouring it over a full glass of ice. You may need to add more ice to the drink to keep it cool, as some of it will melt quickly. Make coffee ice cubes and add them to hot coffee. These marvelous little cubes will keep your coffee cold without diluting it. You should consider getting a new ice tray, or dedicating one to coffee cubes, as it will leave a faint coffee flavor in the tray. Brew a fresh pot of regular strength coffee. Let it cool to room temperature. Pour the coffee into an ice tray and freeze overnight. Use the coffee cubes to chill your hot coffee. Chill a pot of coffee in the fridge. The simplest, easiest way to get cold coffee is to take a fresh pot of coffee, pour some in a mug, and place the mug in the refrigerator. Make sure the top is covered to prevent the coffee from picking up other smells in the fridge and ruining the taste. While this is may not get your coffee cold enough to call \"iced,\" you can add some coffee ice cubes to help make your drink refreshingly chill. Add any sugar while the coffee is still hot. Sugar dissolves best in hot liquids, so add it before chilling your drink to get the best results. You can add milk or cream at any time, but it is usually best to add it right before serving. Cold-Brewing Coffee Know that cold-brewing is the best way to get flavorful, undiluted cold coffee. When you make cold-brew, you avoid diluting your coffee with ice cubes or letting hot coffee sit out and get cold, which ruins its flavor. Cold brewed coffee has less acidity than traditionally made coffee, and less bitterness. Mix the ground coffee and water together in a pitcher. Stir them until there are no lumps left in the coffee. You should aim for roughly 4.5 times more water than coffee, so if you want 8 cups of coffee, use 8 cups water and 1.5 cups of grounds. If you grind your own coffee, grind it as finely as you can. This is best for cold-brew. Add any sugar before chilling your coffee. The sugar will dissolve better in warm water and will stay in the drink as it chills. If you try to add sugar to cold coffee the chances are good that you will be left with undissolved sugar at the bottom of your cup. Cover the pitcher with plastic wrap. If the pitcher has a top, you can also use that instead. Chill the coffee in the refrigerator for at least 12 hours, or overnight. This is when the coffee actually brews. Because there is no heat involved, it takes much longer to brew than a normal cup off coffee, but the taste is worth it. Place a coffee filter in a mesh strainer and rest it over a medium bowl. A combination of a filter and mesh strainer should get rid of most grounds in your coffee. Set up the strainer above a bowl, or another pitcher, to catch the coffee. Slowly pour your cold-brew through the strainer. The coffee will slowly trickle out the bottom of the strainer and the grounds will remain on top. Pour slowly, and never try to force or press the coffee through the filter. When you are done, throw out the coffee grounds and serve. Alternatively, make cold brew in a French Press instead of a pitcher. Simply mix the water and coffee grounds in the pot and put the lid on. Do not push down the plunger. Refrigerate the coffee overnight, then push down the plunger and serve in the morning. Variations Blend your coffee with ice for a quick frappe. A frappe is a whipped, frozen coffee drink invented in Greece and made popular by Starbucks as a \"Frappuccino.\" Simply toss your coffee in a blender with 6-8 large cubes of ice, 1/2 cup of milk, and blend until there are only small chips of ice left in the drink. Consider adding:\nChocolate syrup or cocoa powder. Caramel syrup. Vanilla or almond extract. Crushed cookies\nCondensed or chocolate milk. Kahlua, brandy, or Irish Cream. Add spices to your iced coffee for a new flavor. You can add them before chilling your pot of cold-brew or right before serving. Spiced coffee goes well with 1/2 cup condensed or regular milk as well. Some suggestions include:\n1-2 teaspoons of orange zest with 2-3 crushed pods of cardamon. 1 teaspoon of cinnamon, ground cloves, and nutmeg. 1 tablespoon honey and 5-10 crushed, chopped mint leaves. Sprinkle of sea salt and 1-2 teaspoons cocoa powder. Pour hot espresso over a scoop of ice cream for a delicious affogato. This dessert treat is a wonderfully sweet take on refreshing, cold coffee. Brew a pot of espresso. Place one scoop of ice cream at the bottom of a coffee cup and slowly pour the espresso over the top. Enjoy with a spoon.",
  "tyn_model":[
    "ice",
    "sugar",
    "coffee",
    "water",
    "pitcher",
    "milk",
    "strainer",
    "ice cubes",
    "coffee ice cubes",
    "ice tray",
    "coffee cubes",
    "refrigerator",
    "mesh strainer",
    "cocoa powder",
    "ice cream",
    "cold brewing",
    "regular strength coffee",
    "fridge",
    "mug",
    "cream",
    "plastic wrap",
    "coffee filter",
    "medium bowl",
    "bowl",
    "cold-",
    "cold brew",
    "french press",
    "coffee grounds",
    "blender",
    "chocolate syrup",
    "caramel syrup",
    "vanilla or almond extract",
    "condensed or chocolate milk",
    "brandy",
    "irish cream",
    "spices",
    "iced coffee",
    "cold-brew",
    "condensed or",
    "orange zest",
    "cardamon",
    "cinnamon",
    "nutmeg",
    "honey",
    "sea salt",
    "spoon"
  ],
  "tyn_section":[

  ]
}