{
  "title":"How to Make Rice Wine",
  "url":"https://www.wikihow.com/Make-Rice-Wine",
  "category_hierarchy":[
    "Food and Entertaining",
    "Drinks",
    "Alcoholic Drinks",
    "Wine"
  ],
  "parts":[
    {
      "name":"Cooking the Rice",
      "steps":[
        {
          "headline":"Rinse the rice.",
          "description":"Measure out 2 cups (24 ounces) of rice in a measuring cup. Then rinse the rice several times in a large bowl until the water is clear as opposed to murky. Try to use sticky or glutinous rice, which is more authentic and creates a slightly different flavor than regular rice."
        },
        {
          "headline":"Soak the rice for an hour.",
          "description":"After rinsing, soak your rice in hot water for about an hour, as sticky rice cooks better after it has been soaked. Then use a strainer or sieve to strain the rice and remove the water."
        },
        {
          "headline":"Boil water in the bottom of a steamer.",
          "description":"Pour around two cups of water in the bottom of a steamer. Bring the water to a boil. If you don\u2019t have a steamer, you can simply boil water in a medium sized pot."
        },
        {
          "headline":"Steam the rice.",
          "description":"After the water begins to boil, place the rice in the top compartment of a steamer and let it steam for around 25 minutes. If you don\u2019t have a steamer, place the sieve of rice above the boiling water, making sure that the rice doesn\u2019t touch the boiling water. Cover the top of the sieve with a pot lid and steam for 25 minutes."
        },
        {
          "headline":"Check that the rice has finished steaming.",
          "description":"After 25 minutes, take off the lid of the steamer and taste the rice. If it is still hard or slightly crunchy, use a spoon to flip the rice over and let it steam more, checking every five minutes or so to see if it\u2019s done. Once the rice has finished steaming, remove it from the heat."
        },
        {
          "headline":"Spread the rice on a cooking sheet.",
          "description":"After the rice has finished steaming, spoon it out onto a cooking sheet and spread it in a thin layer to help it cool. It\u2019s essential to let the rice cool before beginning the fermentation process, and spreading the rice helps it to lose heat more rapidly."
        }
      ]
    },
    {
      "name":"Beginning Fermentation",
      "steps":[
        {
          "headline":"Crush the yeast ball.",
          "description":"Take the yeast ball and place it in a small bowl. Use a pestle or the bottom of a large spoon to crush the yeast ball. Break apart the ball until it has become a fine powder."
        },
        {
          "headline":"Combine the yeast powder and the rice.",
          "description":"After you have finished crushing the yeast, sprinkle it evenly over the rice. Toss using your hands or a spoon to integrate and combine the yeast with the rice. Make sure that the rice has cooled and is just slightly warmer than room temperature."
        },
        {
          "headline":"Place the rice in an airtight container.",
          "description":"After you have mixed the yeast and the rice, it\u2019s time to start the process of storing and fermenting the rice! Place the rice in an airtight container, or several airtight containers depending on the size of the containers you are using."
        },
        {
          "headline":"Store the rice in a warm place.",
          "description":"Do your best to keep the rice warm for a few days. You can keep the container of rice in the oven on low heat (100 degrees F or 37.7 degrees C), or simply place a heating pad around the jar. The heat helps to encourage the process of fermentation."
        }
      ]
    },
    {
      "name":"Testing and Straining the Rice Wine",
      "steps":[
        {
          "headline":"Taste the wine after a few days.",
          "description":"After a few days, you should notice liquid is accumulating at the bottom of the container. This is the rice wine. The wine is ready to drink as soon as it forms, so you can try the wine as soon as you see it accumulating. If you like the taste, pour out the liquid from the container and keep the rice mixture inside. You can use the small amount of wine you made in recipes, or simply drink it by itself. The taste of the wine changes the longer it ferments. When the wine first appears at the bottom of the container, it will taste fruity and slightly zingy. As you let the wine ferment, it becomes less effervescent and more sweet and smooth."
        },
        {
          "headline":"Let the wine ferment for at least a month.",
          "description":"Store the rice in a warm and dry place for around a month. You don\u2019t need to keep it in the oven or in the heating pad past a few days, as long as the weather is warm or you store it in a relatively warm place in your house. You will notice that the longer you ferment your wine, the clearer and less cloudy it will become."
        },
        {
          "headline":"Strain the rice mixture.",
          "description":"After a month, the fermentation process will be complete. Use a piece of cheesecloth or a very fine strainer to strain the wine, and collect the liquid in a jar or container. This will get rid of any excess rice grains or hulls still in your fermentation container. You can drink or use your rice wine as soon as you wish, so if you want to enjoy it as soon as you strain it, you can do so!"
        },
        {
          "headline":"Place the container of rice wine in the refrigerator.",
          "description":"After you have poured the rice wine into a container, seal the top and place it in the refrigerator. Although you can drink rice wine at room temperature, always store it in the fridge, as this will help it to last longer."
        },
        {
          "headline":"Pour off the clarified wine and enjoy.",
          "description":"A few days after you put it in the refrigerator, you should notice that a layer of sediment forms at the bottom of the wine container. It is not necessary to remove this sediment, but some choose to do so to improve the appearance of the wine and make the texture of the liquid more uniform. If you wish, pour the clarified wine out of the container and leave the sediment on the bottom behind. Then pour the sediment down the sink and pour the clarified wine back into the container."
        },
        {
          "headline":"Enjoy your wine.",
          "description":"Use your wine in cooking, drink it by itself, or keep it in the fridge to alter and mature the flavor! Don\u2019t worry if you see the wine becoming darker the longer you age it; this is perfectly normal. Use the wine in savory dishes, desserts, or enjoy a glassful for a delicious departure from the usual grape-based wine."
        }
      ]
    }
  ],
  "text":" Cooking the Rice Rinse the rice. Measure out 2 cups (24 ounces) of rice in a measuring cup. Then rinse the rice several times in a large bowl until the water is clear as opposed to murky. Try to use sticky or glutinous rice, which is more authentic and creates a slightly different flavor than regular rice. Soak the rice for an hour. After rinsing, soak your rice in hot water for about an hour, as sticky rice cooks better after it has been soaked. Then use a strainer or sieve to strain the rice and remove the water. Boil water in the bottom of a steamer. Pour around two cups of water in the bottom of a steamer. Bring the water to a boil. If you don\u2019t have a steamer, you can simply boil water in a medium sized pot. Steam the rice. After the water begins to boil, place the rice in the top compartment of a steamer and let it steam for around 25 minutes. If you don\u2019t have a steamer, place the sieve of rice above the boiling water, making sure that the rice doesn\u2019t touch the boiling water. Cover the top of the sieve with a pot lid and steam for 25 minutes. Check that the rice has finished steaming. After 25 minutes, take off the lid of the steamer and taste the rice. If it is still hard or slightly crunchy, use a spoon to flip the rice over and let it steam more, checking every five minutes or so to see if it\u2019s done. Once the rice has finished steaming, remove it from the heat. Spread the rice on a cooking sheet. After the rice has finished steaming, spoon it out onto a cooking sheet and spread it in a thin layer to help it cool. It\u2019s essential to let the rice cool before beginning the fermentation process, and spreading the rice helps it to lose heat more rapidly. Beginning Fermentation Crush the yeast ball. Take the yeast ball and place it in a small bowl. Use a pestle or the bottom of a large spoon to crush the yeast ball. Break apart the ball until it has become a fine powder. Combine the yeast powder and the rice. After you have finished crushing the yeast, sprinkle it evenly over the rice. Toss using your hands or a spoon to integrate and combine the yeast with the rice. Make sure that the rice has cooled and is just slightly warmer than room temperature. Place the rice in an airtight container. After you have mixed the yeast and the rice, it\u2019s time to start the process of storing and fermenting the rice! Place the rice in an airtight container, or several airtight containers depending on the size of the containers you are using. Store the rice in a warm place. Do your best to keep the rice warm for a few days. You can keep the container of rice in the oven on low heat (100 degrees F or 37.7 degrees C), or simply place a heating pad around the jar. The heat helps to encourage the process of fermentation. Testing and Straining the Rice Wine Taste the wine after a few days. After a few days, you should notice liquid is accumulating at the bottom of the container. This is the rice wine. The wine is ready to drink as soon as it forms, so you can try the wine as soon as you see it accumulating. If you like the taste, pour out the liquid from the container and keep the rice mixture inside. You can use the small amount of wine you made in recipes, or simply drink it by itself. The taste of the wine changes the longer it ferments. When the wine first appears at the bottom of the container, it will taste fruity and slightly zingy. As you let the wine ferment, it becomes less effervescent and more sweet and smooth. Let the wine ferment for at least a month. Store the rice in a warm and dry place for around a month. You don\u2019t need to keep it in the oven or in the heating pad past a few days, as long as the weather is warm or you store it in a relatively warm place in your house. You will notice that the longer you ferment your wine, the clearer and less cloudy it will become. Strain the rice mixture. After a month, the fermentation process will be complete. Use a piece of cheesecloth or a very fine strainer to strain the wine, and collect the liquid in a jar or container. This will get rid of any excess rice grains or hulls still in your fermentation container. You can drink or use your rice wine as soon as you wish, so if you want to enjoy it as soon as you strain it, you can do so! Place the container of rice wine in the refrigerator. After you have poured the rice wine into a container, seal the top and place it in the refrigerator. Although you can drink rice wine at room temperature, always store it in the fridge, as this will help it to last longer. Pour off the clarified wine and enjoy. A few days after you put it in the refrigerator, you should notice that a layer of sediment forms at the bottom of the wine container. It is not necessary to remove this sediment, but some choose to do so to improve the appearance of the wine and make the texture of the liquid more uniform. If you wish, pour the clarified wine out of the container and leave the sediment on the bottom behind. Then pour the sediment down the sink and pour the clarified wine back into the container. Enjoy your wine. Use your wine in cooking, drink it by itself, or keep it in the fridge to alter and mature the flavor! Don\u2019t worry if you see the wine becoming darker the longer you age it; this is perfectly normal. Use the wine in savory dishes, desserts, or enjoy a glassful for a delicious departure from the usual grape-based wine.",
  "tyn_model":[
    "rice",
    "water",
    "steamer",
    "rice wine",
    "container",
    "yeast",
    "wine",
    "refrigerator",
    "clarified wine",
    "strainer",
    "spoon",
    "cooking sheet",
    "airtight container",
    "fridge",
    "measuring cup",
    "large bowl",
    "sieve",
    "pot lid",
    "small bowl",
    "pestle",
    "large spoon",
    "airtight containers",
    "oven",
    "heating pad",
    "jar",
    "cheesecloth",
    "wine container",
    "grape-based wine"
  ],
  "tyn_section":[

  ]
}