{
  "title":"How to Make Brownies from Scratch",
  "url":"https://www.wikihow.com/Make-Brownies-from-Scratch",
  "category_hierarchy":[
    "Food and Entertaining",
    "Recipes",
    "Baking",
    "Cakes",
    "Brownies"
  ],
  "methods":[
    {
      "name":"Fluffy Brownies",
      "steps":[
        {
          "headline":"Preheat the oven to 350 degrees.",
          "description":""
        },
        {
          "headline":"Melt the butter and unsweetened chocolate.",
          "description":"Place the butter and chocolate together in a microwave-safe dish. Put the dish in the microwave and cook it in 30-second increments until the mixture is melted. Use a spoon to stir the mixture to combine it."
        },
        {
          "headline":"Mix the dry ingredients.",
          "description":"Place the flour, sugar, baking powder and salt in a mixing bowl. Use a whisk to mix the ingredients together until they are fully incorporated."
        },
        {
          "headline":"Add the wet ingredients.",
          "description":"Pour in the chocolate and butter mixture, milk, eggs and vanilla. Use a spoon to stir the mixture together until the batter is smooth and lump-free."
        },
        {
          "headline":"Pour the batter into a baking pan.",
          "description":"Either grease the pan or line it with parchment paper to keep the brownies from sticking. Pour the batter into the pan and use the back of the spoon to smooth the top."
        },
        {
          "headline":"Bake the brownies.",
          "description":"Place the pan in the oven and bake the brownies for 25 minutes, or until a toothpick or fork comes out clean when inserted in the center of the pan. Remove the brownies from the oven and let them cool for a few minutes before cutting."
        }
      ]
    },
    {
      "name":"Chewy Brownies",
      "steps":[
        {
          "headline":"Preheat the oven to 350 degrees.",
          "description":""
        },
        {
          "headline":"Melt the butter, cocoa and sugar together.",
          "description":"Place these three ingredients in the top part of a double boiler over medium heat. As the ingredients begin to heat, stir constantly. Keep stirring until the butter is melted and the sugar and cocoa have dissolved into the butter. Remove the mixture from heat when it's ready and let it cool for a few minutes before adding the next ingredients. If you don't have a double boiler, make your own: place a small saucepan into a larger saucepan filled with an inch or two of water. Put the ingredients in the smaller saucepan. Place the contraption over medium heat and stir. To test whether the mixture is ready for the next step, dip your finger into the chocolate. If it doesn't feel very hot, keep cooking it. If you feel the need to remove your finger, it's ready."
        },
        {
          "headline":"Add the eggs and vanilla.",
          "description":"Use a wooden spoon to quickly beat the eggs and vanilla into the mixture. It will become smooth, glossy and pudding-like. Keep beating until the eggs are fully incorporated into the chocolate mixture."
        },
        {
          "headline":"Stir in the flour.",
          "description":"Use the wooden spoon to gently stir the flour into the brownie mixture until you no longer see any white spots. Beat the mixture for a minute or two until it's completely smooth."
        },
        {
          "headline":"Pour the batter into a baking pan.",
          "description":"An 8 x 8 inch pan is the perfect size for these rich chocolate brownies. Either grease the pan or line it with parchment paper to keep the brownies from sticking, then pour the batter into the pan and use the back of the spoon to smooth the surface. If you want to add a topping, sprinkle it over the top. You can use coconut, chopped nuts, or another topping of your choice. To make thicker brownies, use a smaller pan."
        },
        {
          "headline":"Bake the brownies.",
          "description":"Place the baking pan in the oven and bake the brownies for about 40 minutes, or until a toothpick or fork comes out clean when poked into the center of the pan. Remove the brownies from the oven and let them cool slightly before cutting."
        }
      ]
    },
    {
      "name":"Quick Microwave Brownies",
      "steps":[
        {
          "headline":"Mix the ingredients.",
          "description":"Place all of the ingredients together in a bowl. Use a spoon or a whisk to mix them together until the batter is completely smooth and lump-free."
        },
        {
          "headline":"Pour the batter into a microwave-safe dish.",
          "description":"Use a glass or ceramic dish that is safe to use in the microwave. Grease it first so the brownies don't stick to the pan. Pour the batter into the dish and use the back of a spoon to smooth the top."
        },
        {
          "headline":"Cook the brownies.",
          "description":"Place the dish in the microwave and microwave on high for four minutes. Check the brownies; if the top still looks moist, cook for another minute. Keep checking the brownies and cooking them until the top of the brownies are no longer wet. Insert a toothpick in the center of the brownies; if it comes out mostly clean, they're ready to eat. Remove the brownies from the microwave and let them cool for a few minutes before cutting them."
        }
      ]
    }
  ],
  "text":" Fluffy Brownies Preheat the oven to 350 degrees.  Melt the butter and unsweetened chocolate. Place the butter and chocolate together in a microwave-safe dish. Put the dish in the microwave and cook it in 30-second increments until the mixture is melted. Use a spoon to stir the mixture to combine it. Mix the dry ingredients. Place the flour, sugar, baking powder and salt in a mixing bowl. Use a whisk to mix the ingredients together until they are fully incorporated. Add the wet ingredients. Pour in the chocolate and butter mixture, milk, eggs and vanilla. Use a spoon to stir the mixture together until the batter is smooth and lump-free. Pour the batter into a baking pan. Either grease the pan or line it with parchment paper to keep the brownies from sticking. Pour the batter into the pan and use the back of the spoon to smooth the top. Bake the brownies. Place the pan in the oven and bake the brownies for 25 minutes, or until a toothpick or fork comes out clean when inserted in the center of the pan. Remove the brownies from the oven and let them cool for a few minutes before cutting. Chewy Brownies Preheat the oven to 350 degrees.  Melt the butter, cocoa and sugar together. Place these three ingredients in the top part of a double boiler over medium heat. As the ingredients begin to heat, stir constantly. Keep stirring until the butter is melted and the sugar and cocoa have dissolved into the butter. Remove the mixture from heat when it's ready and let it cool for a few minutes before adding the next ingredients. If you don't have a double boiler, make your own: place a small saucepan into a larger saucepan filled with an inch or two of water. Put the ingredients in the smaller saucepan. Place the contraption over medium heat and stir. To test whether the mixture is ready for the next step, dip your finger into the chocolate. If it doesn't feel very hot, keep cooking it. If you feel the need to remove your finger, it's ready. Add the eggs and vanilla. Use a wooden spoon to quickly beat the eggs and vanilla into the mixture. It will become smooth, glossy and pudding-like. Keep beating until the eggs are fully incorporated into the chocolate mixture. Stir in the flour. Use the wooden spoon to gently stir the flour into the brownie mixture until you no longer see any white spots. Beat the mixture for a minute or two until it's completely smooth. Pour the batter into a baking pan. An 8 x 8 inch pan is the perfect size for these rich chocolate brownies. Either grease the pan or line it with parchment paper to keep the brownies from sticking, then pour the batter into the pan and use the back of the spoon to smooth the surface. If you want to add a topping, sprinkle it over the top. You can use coconut, chopped nuts, or another topping of your choice. To make thicker brownies, use a smaller pan. Bake the brownies. Place the baking pan in the oven and bake the brownies for about 40 minutes, or until a toothpick or fork comes out clean when poked into the center of the pan. Remove the brownies from the oven and let them cool slightly before cutting. Quick Microwave Brownies Mix the ingredients. Place all of the ingredients together in a bowl. Use a spoon or a whisk to mix them together until the batter is completely smooth and lump-free. Pour the batter into a microwave-safe dish. Use a glass or ceramic dish that is safe to use in the microwave. Grease it first so the brownies don't stick to the pan. Pour the batter into the dish and use the back of a spoon to smooth the top. Cook the brownies. Place the dish in the microwave and microwave on high for four minutes. Check the brownies; if the top still looks moist, cook for another minute. Keep checking the brownies and cooking them until the top of the brownies are no longer wet. Insert a toothpick in the center of the brownies; if it comes out mostly clean, they're ready to eat. Remove the brownies from the microwave and let them cool for a few minutes before cutting them.",
  "tyn_model":[
    "oven",
    "butter",
    "spoon",
    "microwave",
    "chocolate",
    "eggs",
    "flour",
    "sugar",
    "vanilla",
    "baking pan",
    "saucepan",
    "microwave-safe dish",
    "whisk",
    "parchment paper",
    "cocoa",
    "double boiler",
    "unsweetened chocolate",
    "baking powder",
    "salt",
    "mixing bowl",
    "milk",
    "water",
    "wooden spoon",
    "coconut",
    "microwave brownies",
    "bowl",
    "toothpick"
  ],
  "tyn_section":[

  ]
}