{
  "title":"How to Clean a Coffee Maker",
  "url":"https://www.wikihow.com/Clean-a-Coffee-Maker",
  "category_hierarchy":[
    "Food and Entertaining",
    "Drinks",
    "Coffee",
    "Coffee Accessories"
  ],
  "methods":[
    {
      "name":"Cleaning Your Coffee Maker After Each Use",
      "steps":[
        {
          "headline":"Disassemble the coffee maker.",
          "description":"Remove any parts that come off, such as the pot, the brew basket, and any other removable parts. These part should be cleaned separately from the rest of the coffee maker."
        },
        {
          "headline":"Wash the removable parts.",
          "description":"Submerge the removable parts in warm, soapy water, and wash them using a dish rag. You can wash removable parts of your coffee maker the same way you would wash dishes. Glass pots can be very breakable. When washing your coffee maker's pot, treat the glass gingerly. Some coffee makers may have parts that can be washed in a dishwasher. Check the instructions manual, if you still have it. If you're unsure if your coffee maker can be washed in the dishwasher, err on the side of caution and hand wash it."
        },
        {
          "headline":"Wipe down the outside of the machine.",
          "description":"Take a wet, soapy rag and give the outside of the machine a good wipe down. Wipe down the sides and remove any coffee grinds from the warming plate. When you're down, wipe off any soap suds with a clean, damp rag."
        },
        {
          "headline":"Reassemble your machine.",
          "description":"After all the parts are dry, you can put your coffee machine back together. It is ready to use again. Make a habit of cleaning your coffee maker like this after each use."
        }
      ]
    },
    {
      "name":"Deep Cleaning Your Coffee Maker",
      "steps":[
        {
          "headline":"Add a vinegar and water solution to your coffee maker.",
          "description":"Make a mixture using half white vinegar and half water. The precise amounts will vary depending on the size of your coffee maker, but make roughly enough to fill the reservoir. Pour the mixture into the reservoir like you normally would with water when making coffee. EXPERT TIP\t\t\t\t\t\t\t\t\t\t\t\t\t\t\t\t\t\t\t\t\t\t\t\t\t\t\t\t\t\t\tMarcus Shields\t\t\t\t\t\t\t\t\t\t\t\t\t\t\t\tCleaning Guru & Owner, Maideasy\t\t\t\t\t\t\t\tMarcus is the owner of Maid Easy, a local residential cleaning company in Phoenix, Arizona. His cleaning roots date back to his grandmother who cleaned homes for valley residents in the 60\u2019s through the 70\u2019s. After working in tech for over a decade, he came back to the cleaning industry and opened Maid Easy to pass his family\u2019s tried and true methods to home dwellers across the Phoenix Metro Area. Marcus Shields\t\t\tCleaning Guru & Owner, Maideasy\t\t\t\tRunning a vinegar cycle will help clean the inside of your coffee pot. Marcus Shields of Maideasy says: \"Mix two parts warm water and one part vinegar. Run the vinegar through the coffee pot on a regular cycle. It will clean all of the components inside the coffee maker, and it will also remove any reside from the inside of your coffee pot. When you're done, just rinse out the pot.\""
        },
        {
          "headline":"Let the coffee machine run half a brew cycle.",
          "description":"Turn the coffee machine on. Keep an eye on it as it brews. Once about half the pot is full with the filtered vinegar/water mixture, turn the pot off."
        },
        {
          "headline":"Let the coffee maker sit for an hour.",
          "description":"Set a timer for an hour. Let the coffee pot sit for this time frame. This will give the vinegar time to sit in the machine and clean out any mold."
        },
        {
          "headline":"Complete the brew cycle.",
          "description":"After letting the coffee maker sit for an hour, turn the machine back on. Let it run the rest of the brew cycle. When done, all the vinegar/water mixture should be filtered into the pot. You can pour this mixture down the sink."
        },
        {
          "headline":"Run two brew cycles with plain water.",
          "description":"Fill your coffee pot with clean water. Pour this into the reservoir and run a complete brew cycle. When it's done, pour the water out and run one more brew cycle with clean water. This should clean any vinegar out of your coffee maker."
        },
        {
          "headline":"Wipe down the coffee maker.",
          "description":"After disinfecting the coffee maker, take a clean, damp rag. Wipe down the exterior of the machine to remove any dirt and debris. You should also make sure to remove coffee grinds from the warming plate. EXPERT TIP\t\t\t\t\t\t\t\t\t\t\t\t\t\t\t\t\t\t\t\t\t\t\t\t\t\t\t\t\t\t\tMarcus Shields\t\t\t\t\t\t\t\t\t\t\t\t\t\t\t\tCleaning Guru & Owner, Maideasy\t\t\t\t\t\t\t\tMarcus is the owner of Maid Easy, a local residential cleaning company in Phoenix, Arizona. His cleaning roots date back to his grandmother who cleaned homes for valley residents in the 60\u2019s through the 70\u2019s. After working in tech for over a decade, he came back to the cleaning industry and opened Maid Easy to pass his family\u2019s tried and true methods to home dwellers across the Phoenix Metro Area. Marcus Shields\t\t\tCleaning Guru & Owner, Maideasy\t\t\t\tDeep clean your coffee pot about once a month. Marcus Shields of Maideasy says: \"If you use your coffee filter on a daily basis, you should deep clean it every month. With coffee makers, it tends to be out of sight out of mind, but mold can grow inside of the machine. Since your coffee comes out black, you can't see it, but you're ingesting it.\""
        }
      ]
    },
    {
      "name":"Avoiding Common Mistakes",
      "steps":[
        {
          "headline":"Read your instruction's manual.",
          "description":"If you still have the instructions manual, read it before cleaning your coffee maker. Most coffee makers can safely be cleaned with a vinegar/water mixture, but it's always a good idea to check first. If you don't have the instructions manual, try looking up your model online. You may be able to find an instructions manual on the Internet."
        },
        {
          "headline":"Leave the reservoir lid open.",
          "description":"Many people keep the reservoir lid closed. However, it's a good idea to leave it open when not in use. This will help dry out the machine, preventing mold and bacteria from growing in a moist environment."
        },
        {
          "headline":"Rinse the brew basket in the sink regularly.",
          "description":"The brew basket is very susceptible to mold as it gets wet during the brewing process. Make sure you rinse out the brew basket after each use and make a habit of cleaning it each time you do dishes. This will keep your coffee maker mold and germ free."
        }
      ]
    }
  ],
  "text":" Cleaning Your Coffee Maker After Each Use Disassemble the coffee maker. Remove any parts that come off, such as the pot, the brew basket, and any other removable parts. These part should be cleaned separately from the rest of the coffee maker. Wash the removable parts. Submerge the removable parts in warm, soapy water, and wash them using a dish rag. You can wash removable parts of your coffee maker the same way you would wash dishes. Glass pots can be very breakable. When washing your coffee maker's pot, treat the glass gingerly. Some coffee makers may have parts that can be washed in a dishwasher. Check the instructions manual, if you still have it. If you're unsure if your coffee maker can be washed in the dishwasher, err on the side of caution and hand wash it. Wipe down the outside of the machine. Take a wet, soapy rag and give the outside of the machine a good wipe down. Wipe down the sides and remove any coffee grinds from the warming plate. When you're down, wipe off any soap suds with a clean, damp rag. Reassemble your machine. After all the parts are dry, you can put your coffee machine back together. It is ready to use again. Make a habit of cleaning your coffee maker like this after each use. Deep Cleaning Your Coffee Maker Add a vinegar and water solution to your coffee maker. Make a mixture using half white vinegar and half water. The precise amounts will vary depending on the size of your coffee maker, but make roughly enough to fill the reservoir. Pour the mixture into the reservoir like you normally would with water when making coffee. EXPERT TIP\t\t\t\t\t\t\t\t\t\t\t\t\t\t\t\t\t\t\t\t\t\t\t\t\t\t\t\t\t\t\tMarcus Shields\t\t\t\t\t\t\t\t\t\t\t\t\t\t\t\tCleaning Guru & Owner, Maideasy\t\t\t\t\t\t\t\tMarcus is the owner of Maid Easy, a local residential cleaning company in Phoenix, Arizona. His cleaning roots date back to his grandmother who cleaned homes for valley residents in the 60\u2019s through the 70\u2019s. After working in tech for over a decade, he came back to the cleaning industry and opened Maid Easy to pass his family\u2019s tried and true methods to home dwellers across the Phoenix Metro Area. Marcus Shields\t\t\tCleaning Guru & Owner, Maideasy\t\t\t\tRunning a vinegar cycle will help clean the inside of your coffee pot. Marcus Shields of Maideasy says: \"Mix two parts warm water and one part vinegar. Run the vinegar through the coffee pot on a regular cycle. It will clean all of the components inside the coffee maker, and it will also remove any reside from the inside of your coffee pot. When you're done, just rinse out the pot.\" Let the coffee machine run half a brew cycle. Turn the coffee machine on. Keep an eye on it as it brews. Once about half the pot is full with the filtered vinegar/water mixture, turn the pot off. Let the coffee maker sit for an hour. Set a timer for an hour. Let the coffee pot sit for this time frame. This will give the vinegar time to sit in the machine and clean out any mold. Complete the brew cycle. After letting the coffee maker sit for an hour, turn the machine back on. Let it run the rest of the brew cycle. When done, all the vinegar/water mixture should be filtered into the pot. You can pour this mixture down the sink. Run two brew cycles with plain water. Fill your coffee pot with clean water. Pour this into the reservoir and run a complete brew cycle. When it's done, pour the water out and run one more brew cycle with clean water. This should clean any vinegar out of your coffee maker. Wipe down the coffee maker. After disinfecting the coffee maker, take a clean, damp rag. Wipe down the exterior of the machine to remove any dirt and debris. You should also make sure to remove coffee grinds from the warming plate. EXPERT TIP\t\t\t\t\t\t\t\t\t\t\t\t\t\t\t\t\t\t\t\t\t\t\t\t\t\t\t\t\t\t\tMarcus Shields\t\t\t\t\t\t\t\t\t\t\t\t\t\t\t\tCleaning Guru & Owner, Maideasy\t\t\t\t\t\t\t\tMarcus is the owner of Maid Easy, a local residential cleaning company in Phoenix, Arizona. His cleaning roots date back to his grandmother who cleaned homes for valley residents in the 60\u2019s through the 70\u2019s. After working in tech for over a decade, he came back to the cleaning industry and opened Maid Easy to pass his family\u2019s tried and true methods to home dwellers across the Phoenix Metro Area. Marcus Shields\t\t\tCleaning Guru & Owner, Maideasy\t\t\t\tDeep clean your coffee pot about once a month. Marcus Shields of Maideasy says: \"If you use your coffee filter on a daily basis, you should deep clean it every month. With coffee makers, it tends to be out of sight out of mind, but mold can grow inside of the machine. Since your coffee comes out black, you can't see it, but you're ingesting it.\" Avoiding Common Mistakes Read your instruction's manual. If you still have the instructions manual, read it before cleaning your coffee maker. Most coffee makers can safely be cleaned with a vinegar/water mixture, but it's always a good idea to check first. If you don't have the instructions manual, try looking up your model online. You may be able to find an instructions manual on the Internet. Leave the reservoir lid open. Many people keep the reservoir lid closed. However, it's a good idea to leave it open when not in use. This will help dry out the machine, preventing mold and bacteria from growing in a moist environment. Rinse the brew basket in the sink regularly. The brew basket is very susceptible to mold as it gets wet during the brewing process. Make sure you rinse out the brew basket after each use and make a habit of cleaning it each time you do dishes. This will keep your coffee maker mold and germ free.",
  "tyn_model":[
    "coffee maker",
    "water",
    "vinegar",
    "coffee pot",
    "coffee makers",
    "coffee machine",
    "dish rag",
    "rag",
    "white vinegar",
    "filtered vinegar",
    "plate",
    "maid easy",
    "coffee filter"
  ],
  "tyn_section":[

  ]
}