{
  "title":"How to Evolve Sneasel",
  "url":"https://www.wikihow.com/Evolve-Sneasel",
  "category_hierarchy":[
    "Hobbies and Crafts",
    "Games",
    "Video Games",
    "Multi Platform Games",
    "Pokemon Video Games"
  ],
  "parts":[
    {
      "name":"Evolving Sneasel",
      "steps":[
        {
          "headline":"Transfer your Sneasel to a Generation IV or later game.",
          "description":"Sneasel was introduced in Generation II, but its evolution Weavile wasn't created until Generation IV. This means you won't be able to evolve Sneasel unless you're playing a Generation IV or later game. You can't transfer Generation II Pok\u00e9mon to later Generations. To transfer your Generation III Pok\u00e9mon to Generation IV, you'll need to beat the Generation IV game and then transfer the Generation III Pok\u00e9mon over using Pal Park."
        },
        {
          "headline":"Find a Razor Claw.",
          "description":"This item is required to evolve Sneasel. You can only find it in Generation IV and later. Game\nLocation\nDetails\n\nDiamondPearlPlatinum\n\n\n Route 224Victory RoadBattle TowerTeam Galactic HQ (Pt)  \n\n\n\n Click for details\n\n\nHeartGoldSoulSilver\n\n\n Battle Frontier  \n\n\n\n Click for details\n\n\nBlackWhite\n\n\n Route 13Battle Subway  \n\n\n\n Click for details\n\n\nBlack 2White 2\n\n\n Giant ChasmBattle SubwayWorld Tournament  \n\n\n\n Click for details\n\n\nXY\n\n\n Battle Maison, PokeMileage Club  \n\n\n\n Click for details\n\n\nOmega RubyAlpha Sapphire\n\n\n Battle ResortMirage Forest  \n\n\n\n Click for details"
        },
        {
          "headline":"Have Sneasel hold the Razor Claw.",
          "description":"Sneasel will need to be holding this in order to evolve into Weavile."
        },
        {
          "headline":"Level up Sneasel at Night.",
          "description":"Sneasel needs to gain a level during the nighttime in order to evolve. It doesn't matter what level Sneasel is, as long as it is night and it is holding the Razor Claw. Generation\nNight Time\n\nIV\n\n\n 8 PM - 4 AM\n\n\nV\n\n\n Spring: 8 PM - 5 AMSummer: 9 PM - 4 AMAutumn: 8 PM - 6 AMWinter: 7 PM - 7 AM\n\n\nVI\n\n\n 8 PM - 4 AM\n\n\nYou can level Sneasel up through battle or by using a Rare Candy. If you change the clock on your system, you won't be able to perform any time-based evolutions for 24 hours."
        }
      ]
    },
    {
      "name":"Finding Razor Claws",
      "steps":[
        {
          "headline":"Find a Razor Claw in Diamond, Pearl, and Platinum.",
          "description":"Since this was the first Generation that Weavile appears in, you'll find the most Razor Claws in these games. There are several different places that you can find the Razor Claw: \nRoute 224 - Surf off of the southern beach along the middle of the route and head south. Follow the rocks down and you'll come across a small patch of land. You'll be able to find the Razor Claw here. Victory Road - You can find the Razor Claw in the large cave south of the Pok\u00e9mon League. you'll need the Rock Climb ability to reach it. Battle Tower - You'll need to earn 48 BP in the Battle Tower/Frontier in order to get the Razor Fang. You won't be able to access the Battle Tower/Frontier until you have entered the Hall of Fame. Team Galactic HQ (Platinum only) - Enter the Team Galactic HQ and walk towards the front desk. Head to the room on the right and walk onto the second \"column\" of flooring. Face down and start searching the floor. You should be able to find the Razor Claw hidden on the ground."
        },
        {
          "headline":"Look for the Razor Claws in Black and White.",
          "description":"There are a couple of different places that you can find the Razor Claws in these two games: \nRoute 13 - Find the Treasure Hunter near the shack where the old man teaches you Ultimate Moves. Once a day, the Treasure Hunter will give you a random item. One of the items he can give you is the Razor Claw. Battle Subway - You can get the Razor Claw for 48 BP. The Battle Subway is available in Nimbasa after you have completed the main story."
        },
        {
          "headline":"Find one of the many Razor Claws in Black 2 and White 2.",
          "description":"There are even more places to find Razor Claws in these sequels: \nGiant Chasm - You can find a Razor Claw in the Crater Forest section of the giant Chasm, right after you exit the Cave. Battle Subway - Like Black and White, you can earn a Razor Claw from the Battle Subway. You'll only need 8 BP to get it this time. Pok\u00e9mon World Tournament - This facility can be found to the south of Driftveil City, and is a place where elite trainers gather to battle for glory and BP. You'll need 8 BP to get a Razor Claw, which means you'll have to win eight lower-level tournaments."
        },
        {
          "headline":"Find one of the two Razor Claws in X and Y.",
          "description":"There are two different ways to get your hands on Razor Claws in these games: \nBattle Maison - The Battle Maison is similar to the Battle Tower or Battle Subway form previous games. It can be found in Kiloude City after beating the game. You'll need to earn 48 BP in order to get the Razor Claw. PokeMileage Club - You'll need to play the Balloon Popping game (Level 3). The Razor Claw is one of the prizes available for winning Level 3."
        },
        {
          "headline":"Track down a Razor Claw in Omega Ruby and Alpha Sapphire.",
          "description":"The newest Pok\u00e9mon games still have a couple of Razor Claws for you to find: \nBattle Resort - The Battle Resort becomes available after you have beaten the game and completed the Delta Episode. You'll receive an S.S. ticket, which allows you to take the S.S. Tidal to the Battle Resort. There is a Battle Maison that allows you to get a Razor Claw for 48 BP. Mirage Forest - The Razor Claw can also be found in one of the Mirage Forests. these can appear daily, though there may be a Mirage Island, Cave, or Mountain instead. You will need to Soar with Latias or Latios to reach it. The only Mirage Forest which contains a Razor Claw is the one that appears north of Route 111. The Razor Claw will be randomly hidden in the northwestern patch of tall grass."
        }
      ]
    }
  ],
  "text":" Evolving Sneasel Transfer your Sneasel to a Generation IV or later game. Sneasel was introduced in Generation II, but its evolution Weavile wasn't created until Generation IV. This means you won't be able to evolve Sneasel unless you're playing a Generation IV or later game. You can't transfer Generation II Pok\u00e9mon to later Generations. To transfer your Generation III Pok\u00e9mon to Generation IV, you'll need to beat the Generation IV game and then transfer the Generation III Pok\u00e9mon over using Pal Park. Find a Razor Claw. This item is required to evolve Sneasel. You can only find it in Generation IV and later. Game\nLocation\nDetails\n\nDiamondPearlPlatinum\n\n\n Route 224Victory RoadBattle TowerTeam Galactic HQ (Pt)  \n\n\n\n Click for details\n\n\nHeartGoldSoulSilver\n\n\n Battle Frontier  \n\n\n\n Click for details\n\n\nBlackWhite\n\n\n Route 13Battle Subway  \n\n\n\n Click for details\n\n\nBlack 2White 2\n\n\n Giant ChasmBattle SubwayWorld Tournament  \n\n\n\n Click for details\n\n\nXY\n\n\n Battle Maison, PokeMileage Club  \n\n\n\n Click for details\n\n\nOmega RubyAlpha Sapphire\n\n\n Battle ResortMirage Forest  \n\n\n\n Click for details Have Sneasel hold the Razor Claw. Sneasel will need to be holding this in order to evolve into Weavile. Level up Sneasel at Night. Sneasel needs to gain a level during the nighttime in order to evolve. It doesn't matter what level Sneasel is, as long as it is night and it is holding the Razor Claw. Generation\nNight Time\n\nIV\n\n\n 8 PM - 4 AM\n\n\nV\n\n\n Spring: 8 PM - 5 AMSummer: 9 PM - 4 AMAutumn: 8 PM - 6 AMWinter: 7 PM - 7 AM\n\n\nVI\n\n\n 8 PM - 4 AM\n\n\nYou can level Sneasel up through battle or by using a Rare Candy. If you change the clock on your system, you won't be able to perform any time-based evolutions for 24 hours. Finding Razor Claws Find a Razor Claw in Diamond, Pearl, and Platinum. Since this was the first Generation that Weavile appears in, you'll find the most Razor Claws in these games. There are several different places that you can find the Razor Claw: \nRoute 224 - Surf off of the southern beach along the middle of the route and head south. Follow the rocks down and you'll come across a small patch of land. You'll be able to find the Razor Claw here. Victory Road - You can find the Razor Claw in the large cave south of the Pok\u00e9mon League. you'll need the Rock Climb ability to reach it. Battle Tower - You'll need to earn 48 BP in the Battle Tower/Frontier in order to get the Razor Fang. You won't be able to access the Battle Tower/Frontier until you have entered the Hall of Fame. Team Galactic HQ (Platinum only) - Enter the Team Galactic HQ and walk towards the front desk. Head to the room on the right and walk onto the second \"column\" of flooring. Face down and start searching the floor. You should be able to find the Razor Claw hidden on the ground. Look for the Razor Claws in Black and White. There are a couple of different places that you can find the Razor Claws in these two games: \nRoute 13 - Find the Treasure Hunter near the shack where the old man teaches you Ultimate Moves. Once a day, the Treasure Hunter will give you a random item. One of the items he can give you is the Razor Claw. Battle Subway - You can get the Razor Claw for 48 BP. The Battle Subway is available in Nimbasa after you have completed the main story. Find one of the many Razor Claws in Black 2 and White 2. There are even more places to find Razor Claws in these sequels: \nGiant Chasm - You can find a Razor Claw in the Crater Forest section of the giant Chasm, right after you exit the Cave. Battle Subway - Like Black and White, you can earn a Razor Claw from the Battle Subway. You'll only need 8 BP to get it this time. Pok\u00e9mon World Tournament - This facility can be found to the south of Driftveil City, and is a place where elite trainers gather to battle for glory and BP. You'll need 8 BP to get a Razor Claw, which means you'll have to win eight lower-level tournaments. Find one of the two Razor Claws in X and Y. There are two different ways to get your hands on Razor Claws in these games: \nBattle Maison - The Battle Maison is similar to the Battle Tower or Battle Subway form previous games. It can be found in Kiloude City after beating the game. You'll need to earn 48 BP in order to get the Razor Claw. PokeMileage Club - You'll need to play the Balloon Popping game (Level 3). The Razor Claw is one of the prizes available for winning Level 3. Track down a Razor Claw in Omega Ruby and Alpha Sapphire. The newest Pok\u00e9mon games still have a couple of Razor Claws for you to find: \nBattle Resort - The Battle Resort becomes available after you have beaten the game and completed the Delta Episode. You'll receive an S.S. ticket, which allows you to take the S.S. Tidal to the Battle Resort. There is a Battle Maison that allows you to get a Razor Claw for 48 BP. Mirage Forest - The Razor Claw can also be found in one of the Mirage Forests. these can appear daily, though there may be a Mirage Island, Cave, or Mountain instead. You will need to Soar with Latias or Latios to reach it. The only Mirage Forest which contains a Razor Claw is the one that appears north of Route 111. The Razor Claw will be randomly hidden in the northwestern patch of tall grass.",
  "tyn_model":[
    "razor claw",
    "sneasel",
    "razor claws",
    "treasure hunter",
    "surf",
    "rocks",
    "rock climb",
    "balloon popping game"
  ],
  "tyn_section":[

  ]
}