{
  "title":"How to Make Udon",
  "url":"https://www.wikihow.com/Make-Udon",
  "category_hierarchy":[
    "Food and Entertaining",
    "Recipes",
    "Pasta and Noodles"
  ],
  "methods":[
    {
      "name":"Making Homemade Udon",
      "steps":[
        {
          "headline":"Sift the flour in a large bowl to remove any chunks.",
          "description":"If you're using a blend of flours, lightly whisk them together to break up clumps and ensure it is all well-mixed. Sifting makes sure all the flour blends into your dough without unappetizing bits of uncooked flour."
        },
        {
          "headline":"Dissolve the salt in the hot water in a small bowl.",
          "description":"This ensures that the salt is evenly distributed. If you have a kitchen thermometer, the water wants to be roughly 110F -- warm but not too hot to touch."
        },
        {
          "headline":"Make a small hole in the flour mixture and pour in half your water.",
          "description":"Using a scooping motion, start combining the flour and water until you have a mixture resembling wet sand -- it should only take a minute or so. You want to almost toss the water in the dough instead of pressing or beating it in."
        },
        {
          "headline":"Continue adding the water slowly, tossing and mixing by hand until you have a shaggy dough.",
          "description":"Once the water is incorporated the first time, add half of the remaining water and mix. When done, add whatever water remains, mixing until the dough starts to form strands and holds a vague shape. Mixing in the water and flour can also be done with a stand mixer. Simply use the dough hook attachment and mix at medium speed for five minutes. Start after adding the first half of water, adding the rest slowly as the machine runs"
        },
        {
          "headline":"Form a ball with the dough and place it in a gallon-sized plastic bag.",
          "description":"Squeeze all of the air out of the bag, seal it, and then wrap it in a towel -- you're reaching the fun part! Udon, traditionally, is kneaded by foot, as this allows you to get much more pressure on the dough to get a chewy final texture."
        },
        {
          "headline":"Using your whole foot, not just the heel, walk on the dough until flat.",
          "description":"Rotate and turn as you do, ensuring you're really working the dough evenly. Keep stepping until the dough expands to take up the whole bag. If you want to knead by hand, know that you'll need to knead for 10-15 minutes to get the right texture for these springy noodles. They need vigorous work to stretch the gluten that gives you the necessary chewiness."
        },
        {
          "headline":"Remove the dough from the bag, fold it into thirds, and place it back into the bag.",
          "description":"Knead the dough again until flat, then take it out, fold it  up, and do it all again. You should knead the dough with your feet a total of three times."
        },
        {
          "headline":"Let the dough rest in the bag for 4-6 hours.",
          "description":"Put it in a warm, dry place to sit and relax. This stage takes all of the gluten you beat into a tough, gummy pulp and lets it relax into a more chewable and delicious final texture."
        },
        {
          "headline":"Roll the dough into a rectangle.",
          "description":"The thickness is up to you, and the thickness of this dough rectangle will be the thickness of your final noodles. Use a rolling pin and a lightly floured surface to make a nice, neat rectangle."
        },
        {
          "headline":"Sprinkle the dough lightly with flour, and then fold it into thirds upon itself.",
          "description":"This is just like you did with the kneading. When done, you should have a long, thick slab of three-layered dough. Don't press the layers into each other. Simply fold them on top of one another"
        },
        {
          "headline":"Slice across the short ends of the rectangle to make noodles.",
          "description":"Simply start cutting on one end of the dough rectangle, leaving the noodles as thick as you'd like. Most restaurants aim for about a 1/4\" or less, but you can cut them to your heart's desire."
        },
        {
          "headline":"Boil the noodles for 3-4 minutes in cold water, stirring regularly.",
          "description":"Before putting them in the water, unfold the noodles from their rolled up form. As soon as the noodles hit the pot, use chopsticks or a spoon to ensure they don't clump and sit together. Add a dash of salt and boil until the noodles start floating to the top and have a tender, chewy texture."
        },
        {
          "headline":"Drain the noodles and run immediately under cold water.",
          "description":"This has a two-fold effect: it stops the noodles from continuing to cook in the hot water trapped inside, and it removes the unappealing coating of slimy starch that forms around the noodles. Give them a good, cold rinse for 2-3 minutes, and you're ready to serve. When rinsing the noodles, use your hands to give them a light toss, removing excess starch."
        }
      ]
    },
    {
      "name":"Trying Out Variations",
      "steps":[
        {
          "headline":"Serve as either a soup noodle or the base of its own dish.",
          "description":"Udon noodles are just at home in a ramen broth as they are the star of the show, plated cold with veggies, soy sauce, and your meat of choice. While many recipes use Udon as a substitute for ramen noodles, they are thick and versatile enough to carry a dish much like spaghetti does in Italian cuisine. Try it with:\nGinger honey glaze\nRamen broth\nStir fry\n\nJapanese-style curry"
        },
        {
          "headline":"Substitute in a 1/4 cup of tapioca starch/flour for a slightly airier, sweeter noodle.",
          "description":"There is a lot of chatter about tapioca flour among online chefs, with many recipes swearing by it and just as many saying it's unnecessary. IF you make a lot of udon noodles, give it a try. The flour has a slight sweetness and no gluten in it, meaning the noodles are a bit lighter and less chewy."
        },
        {
          "headline":"Let the dough sit in the refrigerator overnight instead of a warm place for a few hours.",
          "description":"This will lead to a slower relaxation stage, but it also means you can prepare the noodles in advance and wait until the next day to heat them. The following afternoon, simply remove the dough ball and flatten it, cutting the noodles and cooking like normal. Note, if the noodles are still cold, they may take an additional minute to cook. It will not, however, be much longer, so stay near the pot."
        },
        {
          "headline":"Freeze the uncooked noodle to save them for 2-3 months.",
          "description":"Place the cut noodles on a baking sheet and put it in the freezer. Once the dough is hard and frozen, put the noodles in a zip-lock bag and squeeze the air out. These noodles will now last for a few months. When ready to cook them, simply toss them directly into the hot water and cook like normal. Note that they may take a little longer to cook, but not much longer."
        }
      ]
    }
  ],
  "text":" Making Homemade Udon Sift the flour in a large bowl to remove any chunks. If you're using a blend of flours, lightly whisk them together to break up clumps and ensure it is all well-mixed. Sifting makes sure all the flour blends into your dough without unappetizing bits of uncooked flour. Dissolve the salt in the hot water in a small bowl. This ensures that the salt is evenly distributed. If you have a kitchen thermometer, the water wants to be roughly 110F -- warm but not too hot to touch. Make a small hole in the flour mixture and pour in half your water. Using a scooping motion, start combining the flour and water until you have a mixture resembling wet sand -- it should only take a minute or so. You want to almost toss the water in the dough instead of pressing or beating it in. Continue adding the water slowly, tossing and mixing by hand until you have a shaggy dough. Once the water is incorporated the first time, add half of the remaining water and mix. When done, add whatever water remains, mixing until the dough starts to form strands and holds a vague shape. Mixing in the water and flour can also be done with a stand mixer. Simply use the dough hook attachment and mix at medium speed for five minutes. Start after adding the first half of water, adding the rest slowly as the machine runs Form a ball with the dough and place it in a gallon-sized plastic bag. Squeeze all of the air out of the bag, seal it, and then wrap it in a towel -- you're reaching the fun part! Udon, traditionally, is kneaded by foot, as this allows you to get much more pressure on the dough to get a chewy final texture. Using your whole foot, not just the heel, walk on the dough until flat. Rotate and turn as you do, ensuring you're really working the dough evenly. Keep stepping until the dough expands to take up the whole bag. If you want to knead by hand, know that you'll need to knead for 10-15 minutes to get the right texture for these springy noodles. They need vigorous work to stretch the gluten that gives you the necessary chewiness. Remove the dough from the bag, fold it into thirds, and place it back into the bag. Knead the dough again until flat, then take it out, fold it  up, and do it all again. You should knead the dough with your feet a total of three times. Let the dough rest in the bag for 4-6 hours. Put it in a warm, dry place to sit and relax. This stage takes all of the gluten you beat into a tough, gummy pulp and lets it relax into a more chewable and delicious final texture. Roll the dough into a rectangle. The thickness is up to you, and the thickness of this dough rectangle will be the thickness of your final noodles. Use a rolling pin and a lightly floured surface to make a nice, neat rectangle. Sprinkle the dough lightly with flour, and then fold it into thirds upon itself. This is just like you did with the kneading. When done, you should have a long, thick slab of three-layered dough. Don't press the layers into each other. Simply fold them on top of one another Slice across the short ends of the rectangle to make noodles. Simply start cutting on one end of the dough rectangle, leaving the noodles as thick as you'd like. Most restaurants aim for about a 1/4\" or less, but you can cut them to your heart's desire. Boil the noodles for 3-4 minutes in cold water, stirring regularly. Before putting them in the water, unfold the noodles from their rolled up form. As soon as the noodles hit the pot, use chopsticks or a spoon to ensure they don't clump and sit together. Add a dash of salt and boil until the noodles start floating to the top and have a tender, chewy texture. Drain the noodles and run immediately under cold water. This has a two-fold effect: it stops the noodles from continuing to cook in the hot water trapped inside, and it removes the unappealing coating of slimy starch that forms around the noodles. Give them a good, cold rinse for 2-3 minutes, and you're ready to serve. When rinsing the noodles, use your hands to give them a light toss, removing excess starch. Trying Out Variations Serve as either a soup noodle or the base of its own dish. Udon noodles are just at home in a ramen broth as they are the star of the show, plated cold with veggies, soy sauce, and your meat of choice. While many recipes use Udon as a substitute for ramen noodles, they are thick and versatile enough to carry a dish much like spaghetti does in Italian cuisine. Try it with:\nGinger honey glaze\nRamen broth\nStir fry\n\nJapanese-style curry Substitute in a 1/4 cup of tapioca starch/flour for a slightly airier, sweeter noodle. There is a lot of chatter about tapioca flour among online chefs, with many recipes swearing by it and just as many saying it's unnecessary. IF you make a lot of udon noodles, give it a try. The flour has a slight sweetness and no gluten in it, meaning the noodles are a bit lighter and less chewy. Let the dough sit in the refrigerator overnight instead of a warm place for a few hours. This will lead to a slower relaxation stage, but it also means you can prepare the noodles in advance and wait until the next day to heat them. The following afternoon, simply remove the dough ball and flatten it, cutting the noodles and cooking like normal. Note, if the noodles are still cold, they may take an additional minute to cook. It will not, however, be much longer, so stay near the pot. Freeze the uncooked noodle to save them for 2-3 months. Place the cut noodles on a baking sheet and put it in the freezer. Once the dough is hard and frozen, put the noodles in a zip-lock bag and squeeze the air out. These noodles will now last for a few months. When ready to cook them, simply toss them directly into the hot water and cook like normal. Note that they may take a little longer to cook, but not much longer.",
  "tyn_model":[
    "water",
    "flour",
    "noodles",
    "salt",
    "udon",
    "bag",
    "pot",
    "udon noodles",
    "ramen broth",
    "stand mixer",
    "dough hook attachment",
    "gallon-sized plastic bag",
    "towel",
    "rolling pin",
    "spoon",
    "soy sauce",
    "ramen noodles",
    "spaghetti",
    "stir fry",
    "tapioca starch",
    "tapioca flour",
    "refrigerator",
    "baking sheet",
    "freezer",
    "zip-lock bag",
    "hot water"
  ],
  "tyn_section":[

  ]
}