{
  "title":"How to Chill Champagne",
  "url":"https://www.wikihow.com/Chill-Champagne",
  "category_hierarchy":[
    "Food and Entertaining",
    "Drinks",
    "Alcoholic Drinks",
    "Wine"
  ],
  "methods":[
    {
      "name":"Chilling in an Ice Bucket",
      "steps":[
        {
          "headline":"Chill vintage champagne between 54 and 57 degrees Fahrenheit.",
          "description":"Vintage champagne, which comes with years printed on the label, should be served between 54 and 57 degrees Fahrenheit. This temperature is best achieved by using an ice bucket. An ice bucket usually has a slightly warmer temperature than you would get in your fridge."
        },
        {
          "headline":"Fill a bucket with half ice and half water.",
          "description":"Grab a bucket big enough to contain a bottle of champagne. Fill the bucket with ice. Submerge the champagne bottle into the ice, so just the tip of the bottle sticks out. You can use a small thermometer to test the temperature of your ice bucket. You can add more ice to chill the bucket more. You can also add a small amount of water if the bucket needs to cool down. EXPERT TIP\t\t\t\t\t\t\t\t\t\t\t\t\t\t\t\t\t\tMurphy Perng\t\t\t\t\tCertified Wine Consultant\t\t\t\t\t\t\t\tMurphy Perng is a Wine Consultant and the Founder and Host of Matter of Wine, a business that produces educational wine events, including team-building experiences and networking events. Based in Los Angeles, California, Murphy has collaborated with brands such as Equinox, Buzzfeed, WeWork, and Stage & Table, to name a few. Murphy possesses her WSET (Wine & Spirit Education Trust) Level 3 Advanced Certification. Murphy Perng\t\t\tCertified Wine Consultant\t\t\t\tOur Expert Agrees: When you're chilling champagne, filling the bucket with half ice and half water will help the cold transfer into the champagne bottle more quickly than if you just used ice alone."
        },
        {
          "headline":"Leave the champagne bottle in the bucket for 20 to 30 minutes.",
          "description":"Simply let the champagne bottle sit in the bucket. You can set a timer on your phone or just keep an eye on the clock."
        },
        {
          "headline":"Pop the cork and serve.",
          "description":"After 20 to 30 minutes have passed, you can pop the cork on the champagne bottle. Make sure to aim the tip of the bottle away from any expensive objects before popping the cork. To serve, tilt the bottle at a 45 degree angle, hold the glass steady with your other hand, and fill it three quarters of the way full with champagne."
        }
      ]
    },
    {
      "name":"Chilling in the Fridge",
      "steps":[
        {
          "headline":"Check the temperature of your fridge and adjust as needed.",
          "description":"You should store non-vintage champagne in the fridge. Non-vintage brands of champagne need to cool slightly more than vintage varieties. Remember, non-vintage champagne is champagne that has no year printed on the label. This should be stored between 40 and 45 degrees Fahrenheit. Use a thermometer to check the temperature of your fridge. Turn the temperature in the fridge up or down as needed."
        },
        {
          "headline":"Place the champagne bottle in the fridge.",
          "description":"You want to set the bottle down horizontally. You should also strive to choose a cool, dark place in your fridge to store the bottle, such as near the back."
        },
        {
          "headline":"Leave the bottle in the fridge for a couple of hours.",
          "description":"If you're serving champagne at a party, this requires some planning ahead. Make sure you plan to pop the champagne bottle in the fridge for a couple of hours before guests arrive."
        },
        {
          "headline":"Avoid storing champagne in the freezer.",
          "description":"Some people advocate storing champagne in the freezer to chill it faster. This method is not recommended. This can kill the bubbles in the champagne, which can affect its taste and texture. If you do want to store your champagne in the freezer, do not let it sit for more than 15 minutes."
        }
      ]
    },
    {
      "name":"Using Quick Chill Methods",
      "steps":[
        {
          "headline":"Add some ice to a bucket.",
          "description":"If you're in a pinch and need to chill champagne quickly, you can add salt to ice to speed up the chilling process. The salt draws heat out of the bottle of champagne, making it cool faster. To start, add some ice to a bucket of water. Add enough ice that, after adding about half a cup of water, you can submerge a bottle of champagne."
        },
        {
          "headline":"Pour a generous amount of salt over the ice.",
          "description":"Take a salt container and open the lid. Quickly shake the container over the ice, getting a generous amount in the bucket."
        },
        {
          "headline":"Add water.",
          "description":"About half a cup of tap water will usually do. You'll need to add enough that the ice is floating in the water, sort of like cereal in milk."
        },
        {
          "headline":"Leave the bottle for a few minutes.",
          "description":"The champagne will cool quickly using this method. You only need to leave the bottle in the ice for a few minutes. It should cool off sufficiently in roughly 3 to 5 minutes."
        },
        {
          "headline":"Serve your champagne.",
          "description":"Remember to point the bottle away from breakable objects when un-corking the champagne. Tilt the bottle at a 45 degree angle when serving and fill a cup about three quarters of the way full."
        }
      ]
    }
  ],
  "text":" Chilling in an Ice Bucket Chill vintage champagne between 54 and 57 degrees Fahrenheit. Vintage champagne, which comes with years printed on the label, should be served between 54 and 57 degrees Fahrenheit. This temperature is best achieved by using an ice bucket. An ice bucket usually has a slightly warmer temperature than you would get in your fridge. Fill a bucket with half ice and half water. Grab a bucket big enough to contain a bottle of champagne. Fill the bucket with ice. Submerge the champagne bottle into the ice, so just the tip of the bottle sticks out. You can use a small thermometer to test the temperature of your ice bucket. You can add more ice to chill the bucket more. You can also add a small amount of water if the bucket needs to cool down. EXPERT TIP\t\t\t\t\t\t\t\t\t\t\t\t\t\t\t\t\t\tMurphy Perng\t\t\t\t\tCertified Wine Consultant\t\t\t\t\t\t\t\tMurphy Perng is a Wine Consultant and the Founder and Host of Matter of Wine, a business that produces educational wine events, including team-building experiences and networking events. Based in Los Angeles, California, Murphy has collaborated with brands such as Equinox, Buzzfeed, WeWork, and Stage & Table, to name a few. Murphy possesses her WSET (Wine & Spirit Education Trust) Level 3 Advanced Certification. Murphy Perng\t\t\tCertified Wine Consultant\t\t\t\tOur Expert Agrees: When you're chilling champagne, filling the bucket with half ice and half water will help the cold transfer into the champagne bottle more quickly than if you just used ice alone. Leave the champagne bottle in the bucket for 20 to 30 minutes. Simply let the champagne bottle sit in the bucket. You can set a timer on your phone or just keep an eye on the clock. Pop the cork and serve. After 20 to 30 minutes have passed, you can pop the cork on the champagne bottle. Make sure to aim the tip of the bottle away from any expensive objects before popping the cork. To serve, tilt the bottle at a 45 degree angle, hold the glass steady with your other hand, and fill it three quarters of the way full with champagne. Chilling in the Fridge Check the temperature of your fridge and adjust as needed. You should store non-vintage champagne in the fridge. Non-vintage brands of champagne need to cool slightly more than vintage varieties. Remember, non-vintage champagne is champagne that has no year printed on the label. This should be stored between 40 and 45 degrees Fahrenheit. Use a thermometer to check the temperature of your fridge. Turn the temperature in the fridge up or down as needed. Place the champagne bottle in the fridge. You want to set the bottle down horizontally. You should also strive to choose a cool, dark place in your fridge to store the bottle, such as near the back. Leave the bottle in the fridge for a couple of hours. If you're serving champagne at a party, this requires some planning ahead. Make sure you plan to pop the champagne bottle in the fridge for a couple of hours before guests arrive. Avoid storing champagne in the freezer. Some people advocate storing champagne in the freezer to chill it faster. This method is not recommended. This can kill the bubbles in the champagne, which can affect its taste and texture. If you do want to store your champagne in the freezer, do not let it sit for more than 15 minutes. Using Quick Chill Methods Add some ice to a bucket. If you're in a pinch and need to chill champagne quickly, you can add salt to ice to speed up the chilling process. The salt draws heat out of the bottle of champagne, making it cool faster. To start, add some ice to a bucket of water. Add enough ice that, after adding about half a cup of water, you can submerge a bottle of champagne. Pour a generous amount of salt over the ice. Take a salt container and open the lid. Quickly shake the container over the ice, getting a generous amount in the bucket. Add water. About half a cup of tap water will usually do. You'll need to add enough that the ice is floating in the water, sort of like cereal in milk. Leave the bottle for a few minutes. The champagne will cool quickly using this method. You only need to leave the bottle in the ice for a few minutes. It should cool off sufficiently in roughly 3 to 5 minutes. Serve your champagne. Remember to point the bottle away from breakable objects when un-corking the champagne. Tilt the bottle at a 45 degree angle when serving and fill a cup about three quarters of the way full.",
  "tyn_model":[
    "champagne",
    "ice",
    "water",
    "bucket",
    "champagne bottle",
    "fridge",
    "ice bucket",
    "salt",
    "wine consultant",
    "wine & spirit education trust) level 3 advanced certification. murphy perng\t\t\tcertified wine consultant\t\t\t\tour",
    "thermometer",
    "freezer",
    "salt container",
    "tap water"
  ],
  "tyn_section":[

  ]
}