{
  "title":"How to Recycle Packing Peanuts",
  "url":"https://www.wikihow.com/Recycle-Packing-Peanuts",
  "category_hierarchy":[
    "Home and Garden",
    "Housekeeping",
    "Household Waste Disposal",
    "Recycling"
  ],
  "methods":[
    {
      "name":"Returning Packing Peanuts",
      "steps":[
        {
          "headline":"Ask companies to take them back.",
          "description":"If you receive a package with packing peanuts, inquire as to whether the company will take them back. They are likely to agree as they will be able to reuse them for another customer, saving the company money."
        },
        {
          "headline":"Find a drop-off center.",
          "description":"Though you likely cannot recycle packing peanuts in your bins at home or at the local drop-off center, there are places you can drop them off for recycle. The Alliance of Foam Packaging Recyclers has a list of places to drop-off packing peanuts by state (U.S. only) on the AFPR website\n\nThe Plastic Loose Fill Council also lists drop-off locations by state (U.S. only)."
        },
        {
          "headline":"Send them to a recycling center.",
          "description":"Though you may have to pay for shipping, many companies, such as the EPS Industrial Alliance, will take your packing peanuts for free."
        }
      ]
    },
    {
      "name":"Donating Packing Peanuts",
      "steps":[
        {
          "headline":"Donate them to shipping companies.",
          "description":"If the company who sent them to you won\u2019t take them back, inquire at businesses that do lots of shipping if they will take your packing peanuts. Moving companies might also agree to take them. UPS stores in many areas will gladly take these peanuts off your hands."
        },
        {
          "headline":"Give them to friends.",
          "description":"Ask your friends and family if they have any use for packing peanuts. If anyone you know is moving or ships a lot of items, they may need these peanuts for their own uses."
        },
        {
          "headline":"Post an ad online.",
          "description":"Sites like Craigslist are great for getting rid of things you don\u2019t need. Post an ad saying you have free packing peanuts for whoever will come pick them up. Just be wary of scams; you may wish to meet the person who\u2019d like to get the packing peanuts at a location other than your home."
        },
        {
          "headline":"Give them to a nearby school or community center.",
          "description":"Schools and centers are often grateful to receive free items. Ask a local school or community center if they could use packing peanuts for craft projects or even for shipping."
        }
      ]
    },
    {
      "name":"Reusing Packing Peanuts",
      "steps":[
        {
          "headline":"Store your packing peanuts.",
          "description":"You may one day have a use for these packing peanuts, so store them until you do. They are lightweight and like to blow around, creating a mess, so try storing them in a box, garbage bag, or even an old pair of pantyhose to keep them contained."
        },
        {
          "headline":"Put them in the bottom of a planter.",
          "description":"They will allow your plant to drain properly and are hidden from view. Because they are very light in weight, they will also make the planter easier to move and lift."
        },
        {
          "headline":"Keep your keys from sinking.",
          "description":"When you are out on the water, thread a few polystyrene packing peanuts through your key chain. They will help keep your keys afloat."
        },
        {
          "headline":"Make pillows or cushions.",
          "description":"Stuff a zippered pillowcase with packing peanuts to make a cushion for your pet. It will provide a lightweight, cool place for your pet to rest. You can also use them as fillers for bean bag chairs."
        },
        {
          "headline":"Sew packing peanuts into costumes at Halloween or other holidays.",
          "description":"Use them to make a fat belly, rippling muscles, or to stuff a scarecrow. The light weight makes them easy for children to wear."
        },
        {
          "headline":"Decorate your Christmas tree with packing peanuts.",
          "description":"Instead of using popcorn, string packing peanuts together. You can even add glitter or color to make them more festive."
        },
        {
          "headline":"Make a craft project.",
          "description":"If you have children, they could make a snowman, a snake, or any other creation from the peanuts. Simply glue them together and decorate them how you wish."
        },
        {
          "headline":"Insulate coolers or lunchboxes.",
          "description":"Fill a zipper-locked plastic bag with packing peanuts and stick it in an ice chest. The ice in the cooler will last longer and the contents will stay cold longer. Use a small zip-closure plastic storage bag filled with packing peanuts and ice as a way to keep food cool in a lunch bag. Avoid using packing peanuts for building insulation as they are not treated with flame retardant."
        },
        {
          "headline":"Pin things to packing peanuts.",
          "description":"Glue a small magnet to a packing peanut and attach it to your refrigerator. Use a pin to attach notes and lists."
        },
        {
          "headline":"Turn them into stamps.",
          "description":"Stamp pages of scrapbooks or homemade cards with packing peanuts dipped in paint. Many of the peanuts already resemble letters or you can cut them into shapes. For example, some come in an \u201cS\u201d or \u201cC\u201d shape, but you could cut them in half to make a half-moon stamper. You could also cut them to resemble squares or triangles, or even glue two pieces together to make circles."
        },
        {
          "headline":"Cover sharp-pointed tools.",
          "description":"Use packing peanuts to cover sharp tips, such as those on needle-nose pliers or even screwdrivers. This will keep someone from accidentally getting jabbed or poked when rummaging around in the toolbox."
        }
      ]
    }
  ],
  "text":" Returning Packing Peanuts Ask companies to take them back. If you receive a package with packing peanuts, inquire as to whether the company will take them back. They are likely to agree as they will be able to reuse them for another customer, saving the company money. Find a drop-off center. Though you likely cannot recycle packing peanuts in your bins at home or at the local drop-off center, there are places you can drop them off for recycle. The Alliance of Foam Packaging Recyclers has a list of places to drop-off packing peanuts by state (U.S. only) on the AFPR website\n\nThe Plastic Loose Fill Council also lists drop-off locations by state (U.S. only). Send them to a recycling center. Though you may have to pay for shipping, many companies, such as the EPS Industrial Alliance, will take your packing peanuts for free. Donating Packing Peanuts Donate them to shipping companies. If the company who sent them to you won\u2019t take them back, inquire at businesses that do lots of shipping if they will take your packing peanuts. Moving companies might also agree to take them. UPS stores in many areas will gladly take these peanuts off your hands. Give them to friends. Ask your friends and family if they have any use for packing peanuts. If anyone you know is moving or ships a lot of items, they may need these peanuts for their own uses. Post an ad online. Sites like Craigslist are great for getting rid of things you don\u2019t need. Post an ad saying you have free packing peanuts for whoever will come pick them up. Just be wary of scams; you may wish to meet the person who\u2019d like to get the packing peanuts at a location other than your home. Give them to a nearby school or community center. Schools and centers are often grateful to receive free items. Ask a local school or community center if they could use packing peanuts for craft projects or even for shipping. Reusing Packing Peanuts Store your packing peanuts. You may one day have a use for these packing peanuts, so store them until you do. They are lightweight and like to blow around, creating a mess, so try storing them in a box, garbage bag, or even an old pair of pantyhose to keep them contained. Put them in the bottom of a planter. They will allow your plant to drain properly and are hidden from view. Because they are very light in weight, they will also make the planter easier to move and lift. Keep your keys from sinking. When you are out on the water, thread a few polystyrene packing peanuts through your key chain. They will help keep your keys afloat. Make pillows or cushions. Stuff a zippered pillowcase with packing peanuts to make a cushion for your pet. It will provide a lightweight, cool place for your pet to rest. You can also use them as fillers for bean bag chairs. Sew packing peanuts into costumes at Halloween or other holidays. Use them to make a fat belly, rippling muscles, or to stuff a scarecrow. The light weight makes them easy for children to wear. Decorate your Christmas tree with packing peanuts. Instead of using popcorn, string packing peanuts together. You can even add glitter or color to make them more festive. Make a craft project. If you have children, they could make a snowman, a snake, or any other creation from the peanuts. Simply glue them together and decorate them how you wish. Insulate coolers or lunchboxes. Fill a zipper-locked plastic bag with packing peanuts and stick it in an ice chest. The ice in the cooler will last longer and the contents will stay cold longer. Use a small zip-closure plastic storage bag filled with packing peanuts and ice as a way to keep food cool in a lunch bag. Avoid using packing peanuts for building insulation as they are not treated with flame retardant. Pin things to packing peanuts. Glue a small magnet to a packing peanut and attach it to your refrigerator. Use a pin to attach notes and lists. Turn them into stamps. Stamp pages of scrapbooks or homemade cards with packing peanuts dipped in paint. Many of the peanuts already resemble letters or you can cut them into shapes. For example, some come in an \u201cS\u201d or \u201cC\u201d shape, but you could cut them in half to make a half-moon stamper. You could also cut them to resemble squares or triangles, or even glue two pieces together to make circles. Cover sharp-pointed tools. Use packing peanuts to cover sharp tips, such as those on needle-nose pliers or even screwdrivers. This will keep someone from accidentally getting jabbed or poked when rummaging around in the toolbox.",
  "tyn_model":[
    "packing peanuts",
    "peanuts",
    "planter",
    "ice",
    "foam packaging recyclers",
    "plastic loose fill council",
    "industrial alliance",
    "water",
    "polystyrene packing peanuts",
    "ice chest",
    "zip-closure plastic storage bag",
    "packing peanut",
    "\u201cs",
    "\u201d or",
    "\u201cc",
    "\u201d shape",
    "screwdrivers"
  ],
  "tyn_section":[

  ]
}