{
  "title":"How to Draw a Girl",
  "url":"https://www.wikihow.com/Draw-a-Girl",
  "category_hierarchy":[
    "Hobbies and Crafts",
    "Drawing",
    "Drawing People",
    "Drawing Children"
  ],
  "methods":[
    {
      "name":"A Girl in Uniform",
      "steps":[
        {
          "headline":"Sketch a circle for the head and a small oblong for the body.",
          "description":""
        },
        {
          "headline":"Sketch the guidelines for the face as well as the chin and the jaw line.",
          "description":""
        },
        {
          "headline":"Add the extremities (arms and the legs).",
          "description":""
        },
        {
          "headline":"Sketch 2 circles  for the eyes.",
          "description":""
        },
        {
          "headline":"Sketch the draft of the hair.",
          "description":"It depends on you."
        },
        {
          "headline":"Sketch the basic draft for the girl\u2019s clothes.",
          "description":""
        },
        {
          "headline":"Sketch the other details of the uniform.",
          "description":""
        },
        {
          "headline":"Draw the basic outline of the girl.",
          "description":""
        },
        {
          "headline":"Erase the draft and put in more details.",
          "description":""
        },
        {
          "headline":"Color the girl.",
          "description":""
        }
      ]
    },
    {
      "name":"A Cartoon Girl",
      "steps":[
        {
          "headline":"Sketch the head.",
          "description":"Draw a circle and a curved line under that for the chin. Add guidelines like those shown to help you with the facial features. The proportions for the face are up to you, and will vary depending on whether you want it to be realistic or cartoony. The illustrations show a cute, cartoon girl (so the proportions are not very realistic)."
        },
        {
          "headline":"Add two circles for the eyes and two thin curved lines above that for the eyebrows.",
          "description":"Draw two half-circles for the ears, on the same guideline as the eyes."
        },
        {
          "headline":"Add a small nose and tiny pair of lips.",
          "description":"They can be larger or look different, however, if you want a less cartoonish or cute-looking girl."
        },
        {
          "headline":"Sketch in the hair.",
          "description":"Draw bangs for her and make her hair short, or keep it long and wavy. Use your imagination."
        },
        {
          "headline":"Now sketch in the body.",
          "description":"Draw a small neck for her, a circle for the upper body and an oval for the lower body."
        },
        {
          "headline":"For the arms and legs, draw 2 connected ovals each.",
          "description":"Draw small circles for the hands and feet. Put in cute little ovals for her fingers. You don\u2019t have to include the detail of fingernails, but if you do, make them fairly short and emphasize them later by coloring them in (to serve as nail polish)."
        },
        {
          "headline":"Sketch in her dress.",
          "description":"Add a pattern if you want, or just draw a simple dress. Draw some shoes and add a floppy hat or a ribbon for her hair."
        },
        {
          "headline":"Add final lines and any additional details, like eyelashes, ribbons, etc.",
          "description":"The specifics are up to you--again, be creative!"
        },
        {
          "headline":"Outline the little girl and erase the guidelines.",
          "description":"You can also add some sort of background or another outside element to your drawing at this point, such as shadowing."
        },
        {
          "headline":"Color her and her clothes in.",
          "description":"You\u2019re done!"
        }
      ]
    }
  ],
  "text":" A Girl in Uniform Sketch a circle for the head and a small oblong for the body.  Sketch the guidelines for the face as well as the chin and the jaw line.  Add the extremities (arms and the legs).  Sketch 2 circles  for the eyes.  Sketch the draft of the hair. It depends on you. Sketch the basic draft for the girl\u2019s clothes.  Sketch the other details of the uniform.  Draw the basic outline of the girl.  Erase the draft and put in more details.  Color the girl.  A Cartoon Girl Sketch the head. Draw a circle and a curved line under that for the chin. Add guidelines like those shown to help you with the facial features. The proportions for the face are up to you, and will vary depending on whether you want it to be realistic or cartoony. The illustrations show a cute, cartoon girl (so the proportions are not very realistic). Add two circles for the eyes and two thin curved lines above that for the eyebrows. Draw two half-circles for the ears, on the same guideline as the eyes. Add a small nose and tiny pair of lips. They can be larger or look different, however, if you want a less cartoonish or cute-looking girl. Sketch in the hair. Draw bangs for her and make her hair short, or keep it long and wavy. Use your imagination. Now sketch in the body. Draw a small neck for her, a circle for the upper body and an oval for the lower body. For the arms and legs, draw 2 connected ovals each. Draw small circles for the hands and feet. Put in cute little ovals for her fingers. You don\u2019t have to include the detail of fingernails, but if you do, make them fairly short and emphasize them later by coloring them in (to serve as nail polish). Sketch in her dress. Add a pattern if you want, or just draw a simple dress. Draw some shoes and add a floppy hat or a ribbon for her hair. Add final lines and any additional details, like eyelashes, ribbons, etc. The specifics are up to you--again, be creative! Outline the little girl and erase the guidelines. You can also add some sort of background or another outside element to your drawing at this point, such as shadowing. Color her and her clothes in. You\u2019re done!",
  "tyn_model":[
    "imagination",
    "nail polish",
    "ribbon"
  ],
  "tyn_section":[

  ]
}