{
  "title":"How to Draw a Cheetah",
  "url":"https://www.wikihow.com/Draw-a-Cheetah",
  "category_hierarchy":[
    "Hobbies and Crafts",
    "Drawing"
  ],
  "methods":[
    {
      "name":"Creating a Cartoon Cheetah",
      "steps":[
        {
          "headline":"Draw the head.",
          "description":"Sketch a simple circle with an oval for the mouth and two round-sided triangles for the ears. Make sure the head isn't too oversized for your paper since you still have to fit in the rest of the cheetah's body in proportion to it."
        },
        {
          "headline":"Add in guidelines for the facial features.",
          "description":"There should be two concentric arcs swooping from the snout to the ears, as well as small circles for the eye(s)/nose and a line to depict a slight snarl."
        },
        {
          "headline":"Draw the body.",
          "description":"Use shapes as guides for it. Draw three ovals: a small one for the neck, a large one for the upper body, and a medium one for the back. Add in circles to connect these shapes. Remember, a cheetah's body is longer in comparison to other big cats, so incorporate that into your drawing."
        },
        {
          "headline":"Sketch the legs.",
          "description":"Each leg has three ovals again, a large one at the top and two smaller ones at the bottom. Draw larger versions of these for the back legs."
        },
        {
          "headline":"Draw circles for the paws.",
          "description":"Don't forget to add a long tail! At this point, you might be running out of room on the page, so if you want your cheetah's tail can be raised up in alarm or curled between his legs."
        },
        {
          "headline":"Add details and outline your cheetah.",
          "description":"Don't forget to add its trademark spots! The image here displays generous application of fairly small spots onto the cheetah, but they can be as big/little/plentiful/sparse as you like. And in fact, they don't even need to be spots, since some cheetahs have splotchy markings and some don't have any pattern on their coats all. After that erase anything outside your black line."
        },
        {
          "headline":"Erase guidelines, color in your drawing.",
          "description":"Use yellow/gold for the majority of the body, with dark brown/black for the spots. You're done!"
        }
      ]
    },
    {
      "name":"Drawing a Traditional Cheetah",
      "steps":[
        {
          "headline":"Draw a small circle for the cheetah's head.",
          "description":"Draw also a horizontal oblong for the body."
        },
        {
          "headline":"Draw the limbs using straight lines and simple shapes \u2013 trapezoids and rectangles.",
          "description":"Draw straight lines which connect to the body for the rear limbs."
        },
        {
          "headline":"Draw the body using curves and refine the drawing to resemble a cheetah's body.",
          "description":"Draw the tail using curve lines which connect to the body."
        },
        {
          "headline":"Draw details for the cheetah's face \u2013eyes, nose, and mouth.",
          "description":"Draw also the ears and snout."
        },
        {
          "headline":"Trace with a pen and erase unnecessary sketches.",
          "description":"Refine the drawing and draw the spots or round rosettes."
        },
        {
          "headline":"Color using your imagination!",
          "description":""
        }
      ]
    }
  ],
  "text":" Creating a Cartoon Cheetah Draw the head. Sketch a simple circle with an oval for the mouth and two round-sided triangles for the ears. Make sure the head isn't too oversized for your paper since you still have to fit in the rest of the cheetah's body in proportion to it. Add in guidelines for the facial features. There should be two concentric arcs swooping from the snout to the ears, as well as small circles for the eye(s)/nose and a line to depict a slight snarl. Draw the body. Use shapes as guides for it. Draw three ovals: a small one for the neck, a large one for the upper body, and a medium one for the back. Add in circles to connect these shapes. Remember, a cheetah's body is longer in comparison to other big cats, so incorporate that into your drawing. Sketch the legs. Each leg has three ovals again, a large one at the top and two smaller ones at the bottom. Draw larger versions of these for the back legs. Draw circles for the paws. Don't forget to add a long tail! At this point, you might be running out of room on the page, so if you want your cheetah's tail can be raised up in alarm or curled between his legs. Add details and outline your cheetah. Don't forget to add its trademark spots! The image here displays generous application of fairly small spots onto the cheetah, but they can be as big/little/plentiful/sparse as you like. And in fact, they don't even need to be spots, since some cheetahs have splotchy markings and some don't have any pattern on their coats all. After that erase anything outside your black line. Erase guidelines, color in your drawing. Use yellow/gold for the majority of the body, with dark brown/black for the spots. You're done! Drawing a Traditional Cheetah Draw a small circle for the cheetah's head. Draw also a horizontal oblong for the body. Draw the limbs using straight lines and simple shapes \u2013 trapezoids and rectangles. Draw straight lines which connect to the body for the rear limbs. Draw the body using curves and refine the drawing to resemble a cheetah's body. Draw the tail using curve lines which connect to the body. Draw details for the cheetah's face \u2013eyes, nose, and mouth. Draw also the ears and snout. Trace with a pen and erase unnecessary sketches. Refine the drawing and draw the spots or round rosettes. Color using your imagination! ",
  "tyn_model":[
    "cheetah",
    "paper",
    "cats",
    "cheetahs",
    "\u2013 trapezoids",
    "\u2013eyes",
    "pen",
    "color"
  ],
  "tyn_section":[

  ]
}