{
  "title":"How to Trade Pok\u00e9mon on DS",
  "url":"https://www.wikihow.com/Trade-Pok%C3%A9mon-on-DS",
  "category_hierarchy":[
    "Hobbies and Crafts",
    "Games",
    "Video Games",
    "Multi Platform Games",
    "Pokemon Video Games"
  ],
  "methods":[
    {
      "name":"Generation V",
      "steps":[
        {
          "headline":"Defeat the first Gym Leader.",
          "description":"In order to receive the equipment that you need to trade, you'll need to defeat the first Gym Leader. In Black and White, this is the trio of trainers in the Striaton Gym. In Black 2 and White 2, you'll need to defeat Cheren at the Aspertia Gym. In Black and White, you'll receive an elemental monkey in the Dreamyard which will make the fight for your first badge much easier. Try to catch a Purrloin on Route 2 as well. In Black 2 and White 2, make sure to catch and train a few Pok\u00e9mon on your way to Aspertia City. Try to find a Riolu in Floccesy Ranch to make the battle against Cheren a snap."
        },
        {
          "headline":"Receive the C-Gear.",
          "description":"This item is required in order to connect to other players using the IR feature in the game cartridge. In Black and White, you'll need to find Fennel in Striaton City. You'll be tasked with getting Dream Mist from the Dreamyard. Use the Cut move that you're given to cut the tree in the Dreamyard. After the story sequence and the fight with Team Plasma, you'll be given the Dream Mist. Return to Fennel and exchange it for the C-Gear."
        },
        {
          "headline":"Get in the same room as your trading partner.",
          "description":"You'll need to be within about 10 feet (3 m) of your trading partner. Once you have the C-Gear, you can trade at any time. You'll have access to all of the Pok\u00e9mon you've collected, so you don't need to worry about bringing the right Pok\u00e9mon in your party."
        },
        {
          "headline":"Open the C-Gear and select \"IR\".",
          "description":"Select the \"Trade\" option from the menu that appears."
        },
        {
          "headline":"Point your game at your trading partner's game.",
          "description":"Your trading partner will need to go through the same process. Once the two DSs are connected, you'll be able to start trading. Make sure that you are close enough for the IR signal to connect. If you can't get the connection working, try using the Union Room (see the next section). The Union Room is also better for trading with strangers in public places, as you don't need to synchronize the IR connection."
        },
        {
          "headline":"Trade Pok\u00e9mon.",
          "description":"One of the major upgrades to the trading process is complete access to all of your Pok\u00e9mon. Select the Pok\u00e9mon that you want to offer for trade and it will appear in the trade window. Once your partner has selected a Pok\u00e9mon, it will appear in the other window. After you both accept the trade, the Pok\u00e9mon will be traded."
        }
      ]
    },
    {
      "name":"Generation IV",
      "steps":[
        {
          "headline":"Beat the first Gym.",
          "description":"In order to trade, you must have earned at least one Gym badge. This should only take a little while, since the first Gym is pretty close to the start of the game. Capture several Pok\u00e9mon on your way to the first Gym. Try to get several different types of Pok\u00e9mon so that you can handle different types of opponents. Level up your Pok\u00e9mon before fighting the Gym Leader. By gaining a few levels for each of your Pok\u00e9mon, you'll make short work of the Gym Leader."
        },
        {
          "headline":"Have at least two Pok\u00e9mon in your party before trading.",
          "description":"You won't be able to enter the trading area, called the \"Union Room\", unless you have at least two Pok\u00e9mon in your party. You can swap out your Pok\u00e9mon using a PC, which you can find in most Pok\u00e9mon Centers."
        },
        {
          "headline":"Be within 30 feet (9.1 m) of your trade partner.",
          "description":"The DS and 3DS include a wireless capability that allows them to connect to other systems within a 30 foot (9.1 m) area. When using this method, you'll need to enter the Union Room in a Pok\u00e9mon Center. Ensure that the Wireless switch for each your DS systems is enabled so that they can find each other. The DS Pok\u00e9mon games used to have the ability to connect to the Nintendo Wi-Fi service and use the Global Trade System to trade with anyone in the world. Nintendo has discontinued this service, so the only Pok\u00e9mon games that can trade over the internet are Generation Vi on the 3DS (click here for instructions)."
        },
        {
          "headline":"Enter the Union Room.",
          "description":"You can enter the Union Room on the second floor of any Pok\u00e9mon Center. Your trade partner doesn't need to use the same Pok\u00e9mon Center, as all Union Rooms are connected."
        },
        {
          "headline":"Talk to your trade partner.",
          "description":"Approach your trade partner's player in the Union Room and select \"Trade\" in the conversation window. This will bring up the trade menu."
        },
        {
          "headline":"Trade your Pok\u00e9mon.",
          "description":"In the Union room, you can only trade the Pok\u00e9mon that you currently have in your party. Select the Pok\u00e9mon that you want to offer to trade and it will appear in the trade window. Once your partner has selected a Pok\u00e9mon, it will appear in the other window. After both of you confirm that you want to make the trade, the Pok\u00e9mon will be traded."
        }
      ]
    },
    {
      "name":"Generation IV to V",
      "steps":[
        {
          "headline":"Understand the process.",
          "description":"You normally cannot trade Pok\u00e9mon between the two Generations of games. You can transfer small batches of Pok\u00e9mon at a time from your Generation IV game to your Generation V game (but not vice versa). This is a one-way process, and the Pok\u00e9mon will be erased from your Generation IV game after being transferred. You'll need two DS systems in order to make this transfer."
        },
        {
          "headline":"Remove any items your Generation IV Pok\u00e9mon may be holding.",
          "description":"Any items that are being held by Pok\u00e9mon will be lost when they are transferred, so make sure you remove any items that you want to keep."
        },
        {
          "headline":"Beat your Generation V game.",
          "description":"In order to transfer your old Pok\u00e9mon to your Generation V game, you'll need to have beaten the game first and collected all of the Gym Badges. This is to prevent you from getting an unfair advantage by importing a bunch of leveled-up Pok\u00e9mon."
        },
        {
          "headline":"Head to Route 15 and enter the Pok\u00e9mon Transfer Lab.",
          "description":"You can find this facility in the same spot regardless of what Generation V game you're playing. When you go to the Lab for the first time, you'll be taken through several conversations."
        },
        {
          "headline":"Select \"DS Download Play\" when prompted.",
          "description":"You will then be instructed to continue the process on the second DS system"
        },
        {
          "headline":"Insert the cartridge you want to transfer from into the second DS and select \"DS Download Play\".",
          "description":"This will be on the main menu of the second DS, before you start the game."
        },
        {
          "headline":"Select your \"Poke Transfer ID\" option.",
          "description":"It may take a few moments to download."
        },
        {
          "headline":"Select the six Pok\u00e9mon that you want to transfer.",
          "description":"You can select nearly any of your Pok\u00e9mon from your PC in the Generation IV game. You cannot select any Pok\u00e9mon that has learned a Hidden Move, but you can use the Move Deleter function to let the Pok\u00e9mon forget it. You also can't transfer any Pok\u00e9mon from your active Generation IV party, so move them to your PC first."
        },
        {
          "headline":"Use the crossbow on the bottom screen to attempt to catch the Pok\u00e9mon.",
          "description":"Tap and drag the crossbow back to aim and set the power. Release it to send a Poke Ball flying into the top screen. If it hits a Pok\u00e9mon, you'll capture it. If a Pok\u00e9mon is hiding behind a bush, hit the bush to make it start hopping. You only have a certain amount of time to complete this, but you can do this as many times as you'd like."
        },
        {
          "headline":"Confirm that you want to transfer the captured Pok\u00e9mon.",
          "description":"Once the game ends, you'll be asked to confirm the transfer. Remember, this is a one-way move, so make sure you want to proceed."
        }
      ]
    }
  ],
  "text":" Generation V Defeat the first Gym Leader. In order to receive the equipment that you need to trade, you'll need to defeat the first Gym Leader. In Black and White, this is the trio of trainers in the Striaton Gym. In Black 2 and White 2, you'll need to defeat Cheren at the Aspertia Gym. In Black and White, you'll receive an elemental monkey in the Dreamyard which will make the fight for your first badge much easier. Try to catch a Purrloin on Route 2 as well. In Black 2 and White 2, make sure to catch and train a few Pok\u00e9mon on your way to Aspertia City. Try to find a Riolu in Floccesy Ranch to make the battle against Cheren a snap. Receive the C-Gear. This item is required in order to connect to other players using the IR feature in the game cartridge. In Black and White, you'll need to find Fennel in Striaton City. You'll be tasked with getting Dream Mist from the Dreamyard. Use the Cut move that you're given to cut the tree in the Dreamyard. After the story sequence and the fight with Team Plasma, you'll be given the Dream Mist. Return to Fennel and exchange it for the C-Gear. Get in the same room as your trading partner. You'll need to be within about 10 feet (3 m) of your trading partner. Once you have the C-Gear, you can trade at any time. You'll have access to all of the Pok\u00e9mon you've collected, so you don't need to worry about bringing the right Pok\u00e9mon in your party. Open the C-Gear and select \"IR\". Select the \"Trade\" option from the menu that appears. Point your game at your trading partner's game. Your trading partner will need to go through the same process. Once the two DSs are connected, you'll be able to start trading. Make sure that you are close enough for the IR signal to connect. If you can't get the connection working, try using the Union Room (see the next section). The Union Room is also better for trading with strangers in public places, as you don't need to synchronize the IR connection. Trade Pok\u00e9mon. One of the major upgrades to the trading process is complete access to all of your Pok\u00e9mon. Select the Pok\u00e9mon that you want to offer for trade and it will appear in the trade window. Once your partner has selected a Pok\u00e9mon, it will appear in the other window. After you both accept the trade, the Pok\u00e9mon will be traded. Generation IV Beat the first Gym. In order to trade, you must have earned at least one Gym badge. This should only take a little while, since the first Gym is pretty close to the start of the game. Capture several Pok\u00e9mon on your way to the first Gym. Try to get several different types of Pok\u00e9mon so that you can handle different types of opponents. Level up your Pok\u00e9mon before fighting the Gym Leader. By gaining a few levels for each of your Pok\u00e9mon, you'll make short work of the Gym Leader. Have at least two Pok\u00e9mon in your party before trading. You won't be able to enter the trading area, called the \"Union Room\", unless you have at least two Pok\u00e9mon in your party. You can swap out your Pok\u00e9mon using a PC, which you can find in most Pok\u00e9mon Centers. Be within 30 feet (9.1 m) of your trade partner. The DS and 3DS include a wireless capability that allows them to connect to other systems within a 30 foot (9.1 m) area. When using this method, you'll need to enter the Union Room in a Pok\u00e9mon Center. Ensure that the Wireless switch for each your DS systems is enabled so that they can find each other. The DS Pok\u00e9mon games used to have the ability to connect to the Nintendo Wi-Fi service and use the Global Trade System to trade with anyone in the world. Nintendo has discontinued this service, so the only Pok\u00e9mon games that can trade over the internet are Generation Vi on the 3DS (click here for instructions). Enter the Union Room. You can enter the Union Room on the second floor of any Pok\u00e9mon Center. Your trade partner doesn't need to use the same Pok\u00e9mon Center, as all Union Rooms are connected. Talk to your trade partner. Approach your trade partner's player in the Union Room and select \"Trade\" in the conversation window. This will bring up the trade menu. Trade your Pok\u00e9mon. In the Union room, you can only trade the Pok\u00e9mon that you currently have in your party. Select the Pok\u00e9mon that you want to offer to trade and it will appear in the trade window. Once your partner has selected a Pok\u00e9mon, it will appear in the other window. After both of you confirm that you want to make the trade, the Pok\u00e9mon will be traded. Generation IV to V Understand the process. You normally cannot trade Pok\u00e9mon between the two Generations of games. You can transfer small batches of Pok\u00e9mon at a time from your Generation IV game to your Generation V game (but not vice versa). This is a one-way process, and the Pok\u00e9mon will be erased from your Generation IV game after being transferred. You'll need two DS systems in order to make this transfer. Remove any items your Generation IV Pok\u00e9mon may be holding. Any items that are being held by Pok\u00e9mon will be lost when they are transferred, so make sure you remove any items that you want to keep. Beat your Generation V game. In order to transfer your old Pok\u00e9mon to your Generation V game, you'll need to have beaten the game first and collected all of the Gym Badges. This is to prevent you from getting an unfair advantage by importing a bunch of leveled-up Pok\u00e9mon. Head to Route 15 and enter the Pok\u00e9mon Transfer Lab. You can find this facility in the same spot regardless of what Generation V game you're playing. When you go to the Lab for the first time, you'll be taken through several conversations. Select \"DS Download Play\" when prompted. You will then be instructed to continue the process on the second DS system Insert the cartridge you want to transfer from into the second DS and select \"DS Download Play\". This will be on the main menu of the second DS, before you start the game. Select your \"Poke Transfer ID\" option. It may take a few moments to download. Select the six Pok\u00e9mon that you want to transfer. You can select nearly any of your Pok\u00e9mon from your PC in the Generation IV game. You cannot select any Pok\u00e9mon that has learned a Hidden Move, but you can use the Move Deleter function to let the Pok\u00e9mon forget it. You also can't transfer any Pok\u00e9mon from your active Generation IV party, so move them to your PC first. Use the crossbow on the bottom screen to attempt to catch the Pok\u00e9mon. Tap and drag the crossbow back to aim and set the power. Release it to send a Poke Ball flying into the top screen. If it hits a Pok\u00e9mon, you'll capture it. If a Pok\u00e9mon is hiding behind a bush, hit the bush to make it start hopping. You only have a certain amount of time to complete this, but you can do this as many times as you'd like. Confirm that you want to transfer the captured Pok\u00e9mon. Once the game ends, you'll be asked to confirm the transfer. Remember, this is a one-way move, so make sure you want to proceed.",
  "tyn_model":[
    "pok\u00e9mon",
    "c-gear",
    "fennel",
    "crossbow",
    "cheren",
    "elemental monkey",
    "purrloin",
    "riolu",
    "mist",
    "plasma",
    "dream mist",
    "game",
    "pok\u00e9mon transfer lab",
    "cartridge"
  ],
  "tyn_section":[

  ]
}