{
  "title":"How to Convince Your Parents to Get You a Wii",
  "url":"https://www.wikihow.com/Convince-Your-Parents-to-Get-You-a-Wii",
  "category_hierarchy":[
    "Hobbies and Crafts",
    "Games",
    "Video Games",
    "Nintendo Video Game Consoles",
    "Nintendo Wii"
  ],
  "parts":[
    {
      "name":"Persuasion techniques",
      "steps":[
        {
          "headline":"Come up with good reasons for getting a Wii.",
          "description":"This is the first hurdle\u2013\u2013convincing your parents that having a Wii is worth the cost and the time you'll spend on it. Some reasons might include:\nThere are exercise games you can play, which will help to keep you fit indoors during the colder months. You can tell them it is better than most game consoles because you exercise a little. It also helps with hand-eye coordination. It's more affordable than some of the other game consoles. Find some of the games you plan to play on it to show your parents. This may help convince them that the games are suitable and not too violent or too mature, depending on what you select. You see having a Wii as one option among other activities, and that you will still participate in sport, playing outdoors, reading, doing hobbies, etc. Reassure them that you won't spend all of your time on the Wii."
        },
        {
          "headline":"Come up with a sensible budget for paying for the Wii.",
          "description":"This is a chance to show your parents that you're responsible and willing to help either pay for some of the Wii or to do things in return for being given a Wii. When negotiating, first offer your parents the conditions possible fair options for you to contribute toward a Wii. These could include:\nPaying for part of it yourself. This will show your parents how much you want the game system. You could also offer to treat the entire purchase as a loan and pay it back over time. Promising to pay for the games and other add-ons to the Wii out of your own funds."
        },
        {
          "headline":"Come up with some other trade-offs in return for getting a Wii.",
          "description":"These could include:\nImproving your grades. Doing extra chores. Quitting doing something that aggravates your parents. Any other incentive that would make your parent happy."
        },
        {
          "headline":"Show your parents that you are responsible.",
          "description":"Do your chores, take out the garbage and clean your room without being asked to do so. Get good grades, do your homework as soon as you arrive from school, behave in class, etc."
        }
      ]
    },
    {
      "name":"Asking for the Wii",
      "steps":[
        {
          "headline":"Ask your parents nicely for a Wii.",
          "description":"Don't whine or beg, ask them maturely, as if you were an adult. If they say yes, read no further! But, if they said no, you will have to begin negotiations."
        },
        {
          "headline":"Give your parents power.",
          "description":"This may be the most important step. Agree on how many hours you can play the Wii before you even get it and what days you can play it on. Give them the right to take away the Wii if you fail to fulfill the conditions you offered them. Promise that you will get off when they tell you to. Tell them they can play it whenever they want to."
        },
        {
          "headline":"Keep offering incentives and power until your parents agree, even if you can only play it for an hour a month.",
          "description":"You can work out a new deal once you have the Wii and your parents see how responsible you are."
        },
        {
          "headline":"Make a written contract.",
          "description":"Put a deal on the contract and have both you and  your parents sign it. Make a copy of it so both parents have one."
        },
        {
          "headline":"Follow the rules of your agreement and have fun playing the Wii.",
          "description":"After a week or two, you can try to re-negotiate again if you choose to."
        }
      ]
    }
  ],
  "text":" Persuasion techniques Come up with good reasons for getting a Wii. This is the first hurdle\u2013\u2013convincing your parents that having a Wii is worth the cost and the time you'll spend on it. Some reasons might include:\nThere are exercise games you can play, which will help to keep you fit indoors during the colder months. You can tell them it is better than most game consoles because you exercise a little. It also helps with hand-eye coordination. It's more affordable than some of the other game consoles. Find some of the games you plan to play on it to show your parents. This may help convince them that the games are suitable and not too violent or too mature, depending on what you select. You see having a Wii as one option among other activities, and that you will still participate in sport, playing outdoors, reading, doing hobbies, etc. Reassure them that you won't spend all of your time on the Wii. Come up with a sensible budget for paying for the Wii. This is a chance to show your parents that you're responsible and willing to help either pay for some of the Wii or to do things in return for being given a Wii. When negotiating, first offer your parents the conditions possible fair options for you to contribute toward a Wii. These could include:\nPaying for part of it yourself. This will show your parents how much you want the game system. You could also offer to treat the entire purchase as a loan and pay it back over time. Promising to pay for the games and other add-ons to the Wii out of your own funds. Come up with some other trade-offs in return for getting a Wii. These could include:\nImproving your grades. Doing extra chores. Quitting doing something that aggravates your parents. Any other incentive that would make your parent happy. Show your parents that you are responsible. Do your chores, take out the garbage and clean your room without being asked to do so. Get good grades, do your homework as soon as you arrive from school, behave in class, etc. Asking for the Wii Ask your parents nicely for a Wii. Don't whine or beg, ask them maturely, as if you were an adult. If they say yes, read no further! But, if they said no, you will have to begin negotiations. Give your parents power. This may be the most important step. Agree on how many hours you can play the Wii before you even get it and what days you can play it on. Give them the right to take away the Wii if you fail to fulfill the conditions you offered them. Promise that you will get off when they tell you to. Tell them they can play it whenever they want to. Keep offering incentives and power until your parents agree, even if you can only play it for an hour a month. You can work out a new deal once you have the Wii and your parents see how responsible you are. Make a written contract. Put a deal on the contract and have both you and  your parents sign it. Make a copy of it so both parents have one. Follow the rules of your agreement and have fun playing the Wii. After a week or two, you can try to re-negotiate again if you choose to.",
  "tyn_model":[
    "wii"
  ],
  "tyn_section":[

  ]
}