{
  "title":"How to Make Pineapple Jam",
  "url":"https://www.wikihow.com/Make-Pineapple-Jam",
  "category_hierarchy":[
    "Food and Entertaining",
    "Recipes",
    "Jams Preserves and Condiments",
    "Jams and Jellies"
  ],
  "methods":[
    {
      "name":"Making Pineapple Jam From Fresh Pineapple",
      "steps":[
        {
          "headline":"Remove the skin of the pineapple.",
          "description":"Before cutting into the pineapple, give it a rinse in the sink. Then, Peel a Pineapple by laying it on its side and cutting off the top and the very bottom. Set the pineapple upright and slice off the outside skin in strips."
        },
        {
          "headline":"Cut the pineapple into small pieces.",
          "description":"Slice the pineapple into small, 1 inch cubes. You don\u2019t have to be precise, as you will be blending the pineapple. Just make sure that the pieces are small enough to put in a food processor or blender. Cut out any little knots or seeds that you may come across while cutting the pineapple."
        },
        {
          "headline":"Blend the pineapple chunks.",
          "description":"Drop the pineapple pieces into a blender or food processor. Blend until the pineapple reaches a smooth, somewhat pulpy consistency. Remove any seeds or rough pieces from the mixture."
        },
        {
          "headline":"Squeeze in the lemon juice.",
          "description":"Wash the two lemons and cut them in half. Either in a lemon juicer or by hand, squeeze the lemon juice into the pineapple mixture. Stir with a spoon."
        },
        {
          "headline":"Mix in the sugar.",
          "description":"Pour the five cups of sugar into the pineapple mixture. Stir thoroughly so that the sugar is fully incorporated into the pineapple and dissolves. Let the mixture sit for fifteen minutes or so."
        },
        {
          "headline":"Bring the pectin and water to a boil in a saucepan.",
          "description":"Combine one packet of pectin and one cup (240 ml) of water in a small saucepan, then bring the mixture to a boil on medium heat. Boil for one minute, then remove the saucepan from the stove. Pectin is a fruit extract that helps to thicken and bind jams and jellies. Different varieties of pectin sometimes call for different amounts of water to be added. Check and follow the instructions on your packet if you are supposed to use a different amount of water than one cup."
        },
        {
          "headline":"Combine the pectin and the pineapple mixture.",
          "description":"Pour the pectin into the pineapple mixture and stir for one minute. You should notice that the mixture has thickened considerably and has a more jam-like texture than before. The jam is now ready to be canned or to be eaten once it has cooled down!"
        }
      ]
    },
    {
      "name":"Making Pineapple Jam From Canned Pineapples",
      "steps":[
        {
          "headline":"Combine pineapple and sugar in a saucepan.",
          "description":"Open the can of pineapple and pour the fruit and the juice into a large saucepan. Then add the 2 cups (480 ml) of sugar and stir with a large spoon to combine."
        },
        {
          "headline":"Bring the mixture to a boil.",
          "description":"Heat the pineapple and sugar mixture over medium heat. Stir regularly to ensure equal heating. Keep stirring until the mixture reaches a boil."
        },
        {
          "headline":"Cook for 20 minutes.",
          "description":"Once the mixture has reached a boil, set a timer for 20 minutes and stir the jam constantly. As you reach the 20 minute mark, you should notice that the jam has started to thicken considerably."
        },
        {
          "headline":"Take the jam off the stove when completely thickened.",
          "description":"After 20 minutes, spoon up some of the mixture and assess whether it has reached the thickness and consistency of jam. If it is still thin or runny, keep cooking until it has reached an optimal level of thickness. You can also stick a thermometer into the jam. If it has reached 220 degrees F (104 degrees C), it has reached the jelling stage and should be ready."
        }
      ]
    },
    {
      "name":"Canning and Storing the Jam",
      "steps":[
        {
          "headline":"Sterilize the canning jars.",
          "description":"If you plan on canning and keeping the pineapple jam for a long time, you will have to make an environment that will allow the jam to keep. Sterilize Bottles and Jars for Canning to ensure that the jam won\u2019t spoil after a couple months. Make sure to use the canning jars that have the rings and the screw-on top. These jars provide an airtight seal and are optimal for canning. If you plan to eat the jam within the next few weeks, you don\u2019t have to bother with the canning process: you can simply pour the jam into a jar and keep it refrigerated."
        },
        {
          "headline":"Pour the jam into jars.",
          "description":"After you have finished making the jam and sterilizing the jars, pour the jam immediately into the sterilized jars. You can use a funnel or measuring cup to transfer the jam from the pot to the jar if you are worried about spilling. Don\u2019t fill up the jars completely. Leave about a \u00bc inch (0.6 cm) of space at the top."
        },
        {
          "headline":"Clean the rims of the jars.",
          "description":"Because jam is sticky, it can make jars extremely hard to open if it gets stuck on the rim. Before you close the jars, use a clean towel to wipe the rims and remove any excess jam."
        },
        {
          "headline":"Close the jars and place them in a boiling water bath.",
          "description":"Place the jars in a large pot of water on the stove. Make sure that the jars are completely covered in water, with at least 2 inches of water above the tops of each jar. Boil them for five minutes, then remove the jars using a pair of tongs. You should see a small indent at the top of the jars after you take them out of the bath. This means that they are sealed and won\u2019t spoil for about 18 months! Again, you can skip this step if you plan on eating the jam within the next month or so."
        },
        {
          "headline":"Store the jam.",
          "description":"Let the jars cool on the counter until they reach room temperature. Then store them either on the shelf or in your refrigerator. If you went through the sterilization and canning process, the jam is usually best eaten after two weeks, as it can be a bit runny if eaten in the days following canning."
        },
        {
          "headline":"Finished.",
          "description":""
        }
      ]
    }
  ],
  "text":" Making Pineapple Jam From Fresh Pineapple Remove the skin of the pineapple. Before cutting into the pineapple, give it a rinse in the sink. Then, Peel a Pineapple by laying it on its side and cutting off the top and the very bottom. Set the pineapple upright and slice off the outside skin in strips. Cut the pineapple into small pieces. Slice the pineapple into small, 1 inch cubes. You don\u2019t have to be precise, as you will be blending the pineapple. Just make sure that the pieces are small enough to put in a food processor or blender. Cut out any little knots or seeds that you may come across while cutting the pineapple. Blend the pineapple chunks. Drop the pineapple pieces into a blender or food processor. Blend until the pineapple reaches a smooth, somewhat pulpy consistency. Remove any seeds or rough pieces from the mixture. Squeeze in the lemon juice. Wash the two lemons and cut them in half. Either in a lemon juicer or by hand, squeeze the lemon juice into the pineapple mixture. Stir with a spoon. Mix in the sugar. Pour the five cups of sugar into the pineapple mixture. Stir thoroughly so that the sugar is fully incorporated into the pineapple and dissolves. Let the mixture sit for fifteen minutes or so. Bring the pectin and water to a boil in a saucepan. Combine one packet of pectin and one cup (240 ml) of water in a small saucepan, then bring the mixture to a boil on medium heat. Boil for one minute, then remove the saucepan from the stove. Pectin is a fruit extract that helps to thicken and bind jams and jellies. Different varieties of pectin sometimes call for different amounts of water to be added. Check and follow the instructions on your packet if you are supposed to use a different amount of water than one cup. Combine the pectin and the pineapple mixture. Pour the pectin into the pineapple mixture and stir for one minute. You should notice that the mixture has thickened considerably and has a more jam-like texture than before. The jam is now ready to be canned or to be eaten once it has cooled down! Making Pineapple Jam From Canned Pineapples Combine pineapple and sugar in a saucepan. Open the can of pineapple and pour the fruit and the juice into a large saucepan. Then add the 2 cups (480 ml) of sugar and stir with a large spoon to combine. Bring the mixture to a boil. Heat the pineapple and sugar mixture over medium heat. Stir regularly to ensure equal heating. Keep stirring until the mixture reaches a boil. Cook for 20 minutes. Once the mixture has reached a boil, set a timer for 20 minutes and stir the jam constantly. As you reach the 20 minute mark, you should notice that the jam has started to thicken considerably. Take the jam off the stove when completely thickened. After 20 minutes, spoon up some of the mixture and assess whether it has reached the thickness and consistency of jam. If it is still thin or runny, keep cooking until it has reached an optimal level of thickness. You can also stick a thermometer into the jam. If it has reached 220 degrees F (104 degrees C), it has reached the jelling stage and should be ready. Canning and Storing the Jam Sterilize the canning jars. If you plan on canning and keeping the pineapple jam for a long time, you will have to make an environment that will allow the jam to keep. Sterilize Bottles and Jars for Canning to ensure that the jam won\u2019t spoil after a couple months. Make sure to use the canning jars that have the rings and the screw-on top. These jars provide an airtight seal and are optimal for canning. If you plan to eat the jam within the next few weeks, you don\u2019t have to bother with the canning process: you can simply pour the jam into a jar and keep it refrigerated. Pour the jam into jars. After you have finished making the jam and sterilizing the jars, pour the jam immediately into the sterilized jars. You can use a funnel or measuring cup to transfer the jam from the pot to the jar if you are worried about spilling. Don\u2019t fill up the jars completely. Leave about a \u00bc inch (0.6 cm) of space at the top. Clean the rims of the jars. Because jam is sticky, it can make jars extremely hard to open if it gets stuck on the rim. Before you close the jars, use a clean towel to wipe the rims and remove any excess jam. Close the jars and place them in a boiling water bath. Place the jars in a large pot of water on the stove. Make sure that the jars are completely covered in water, with at least 2 inches of water above the tops of each jar. Boil them for five minutes, then remove the jars using a pair of tongs. You should see a small indent at the top of the jars after you take them out of the bath. This means that they are sealed and won\u2019t spoil for about 18 months! Again, you can skip this step if you plan on eating the jam within the next month or so. Store the jam. Let the jars cool on the counter until they reach room temperature. Then store them either on the shelf or in your refrigerator. If you went through the sterilization and canning process, the jam is usually best eaten after two weeks, as it can be a bit runny if eaten in the days following canning. Finished. ",
  "tyn_model":[
    "pineapple",
    "water",
    "sugar",
    "pectin",
    "jars",
    "jam",
    "pineapple jam",
    "saucepan",
    "food processor",
    "blender",
    "lemon",
    "stove",
    "canning jars",
    "lemon juicer",
    "spoon",
    "small saucepan",
    "large saucepan",
    "large spoon",
    "thermometer",
    "jar",
    "funnel",
    "pot",
    "refrigerator",
    "canning"
  ],
  "tyn_section":[

  ]
}