{
  "title":"How to Choose an Orchid Plant",
  "url":"https://www.wikihow.com/Choose-an-Orchid-Plant",
  "category_hierarchy":[
    "Home and Garden",
    "Gardening",
    "Planting and Growing",
    "Growing Flowers",
    "Orchids"
  ],
  "parts":[
    {
      "name":"Selecting a Type of Orchid",
      "steps":[
        {
          "headline":"Choose a Phalaenopsis for a great beginner plant.",
          "description":"Phalaenopsis, or moth orchids, generally thrive in warmer temperatures of around 60\u201365 \u00b0F (16\u201318 \u00b0C) at night and 70\u201380 \u00b0F (21\u201327 \u00b0C) degrees during the day. They also enjoy an intermediate amount of light, and only need to be watered every 4-7 days. They also have some of the longest and most frequent blooms from winter to spring."
        },
        {
          "headline":"Select Dendrobium orchids for a unique look.",
          "description":"This is a popular genus that offers long-lasting blooms. They can withstand warmer weather with proper ventilation and humidity. They also prefer a pot that is taller than it is wide. They need more frequent watering around twice a week, and represent one of the few orchids that can bloom outside."
        },
        {
          "headline":"Take home a Miltonia orchid for a resilient and colorful flower.",
          "description":"Miltonias have many species that thrive in various environments. They generally like to be left in 1 spot, and need around 2 hours of bright, diffused light per day. They should be watered once a week in winter, and twice a week in summer."
        },
        {
          "headline":"Purchase a Paphiopedilum orchid for a summer bloom that needs little light.",
          "description":"Paphs, or lady slippers, are well-loved because they require similar care to African Violets. These tropical beauties thrive in medium to warm environments and require watering about every 5 days."
        },
        {
          "headline":"Take home Oncidium orchids for brightly colored, fragranced blooms.",
          "description":"Oncidiums like warm weather, can be kept in direct sunlight, and can also bloom with artificial light. Water every 2 to 10 days or when the potting medium is halfway dry. These lovely plants often bloom several times a year, usually in spring and fall."
        },
        {
          "headline":"Consider an Odontoglossum for a challenging yet rewarding bloom.",
          "description":"Odontoglossums are beautiful plant that require lots of light, but need daytime temperatures kept between 75\u201380 \u00b0F (24\u201327 \u00b0C), with nighttime temperatures around 55\u201358 \u00b0F (13\u201314 \u00b0C) . They require frequent watering every 2-7 days, or just when the potting medium begins to dry and require perfect drainage systems."
        },
        {
          "headline":"Research specific orchid needs.",
          "description":"Once you\u2019ve picked a variety that you like, try to read as much as possible about its care. Each species is unique and some may have more demanding needs than you first think."
        }
      ]
    },
    {
      "name":"Selecting a Healthy Orchid",
      "steps":[
        {
          "headline":"Purchase a mature plant.",
          "description":"Younger plants or seedlings may seem like a good value, but some orchids can take years of advanced care before blooming. To avoid this, select a plant that has visible blooms or at least flower spikes."
        },
        {
          "headline":"Check for signs of disease.",
          "description":"Black, brown, or yellow spots, or wet spots on the leaves are all signs of orchid health problems. Try to avoid plants with these issues and instead go for healthy-looking orchids."
        },
        {
          "headline":"Look for signs of pests.",
          "description":"White webbing on the plant can be indicative of spider mites that can harm the orchid, or even harm other plants housed nearby."
        },
        {
          "headline":"Look for vibrant leaves.",
          "description":"Limp or wrinkly leaves can be a sign of poor care. The leaves should be thick, lustrous, and even rubbery. They should also be a uniform green unless it is a mottled species."
        },
        {
          "headline":"Ensure that orchids are draining properly.",
          "description":"Orchids that have roots sitting in water or are too wet will most likely start to rot without immediate attention."
        },
        {
          "headline":"Look for other cosmetic flaws.",
          "description":"Holes or torn leaves can mean other pests or careless workers."
        },
        {
          "headline":"Look for colorful orchids.",
          "description":"The coloration of the leaves, shoots, and blooms should be vibrant and saturated. Dull or pale orchids may be weak or malnourished."
        },
        {
          "headline":"Feel for damp soil.",
          "description":"The potting medium should be barely damp to damp. If the potting medium is too dry, they are not receiving enough water, if they receive too much it may not drain effectively and can cause rot."
        }
      ]
    },
    {
      "name":"Making Your Purchase",
      "steps":[
        {
          "headline":"Determine your budget.",
          "description":"Orchids can vary greatly in price. Some can be purchased for a few dollars at local markets, while others are prized plants costing hundreds of dollars. Factor in the type of care you will need to give the orchid such as special potting medium or fertilizer."
        },
        {
          "headline":"Try to make your purchase from a nursery.",
          "description":"Although you can find orchids in many supermarkets, it is often helpful to have knowledgeable staff to guide your purchase. Additionally, it is more likely that the plants are receiving quality care in a nursery than small market."
        },
        {
          "headline":"Look for well-cared-for orchids.",
          "description":"Supermarkets can still be an excellent place to buy orchids as they are usually much cheaper. Try to make sure the orchids are well cared-for. Make sure the area looks clean and well lit. Try to see if staff can answer questions about orchid care; if they can't, it may be a sign that the orchids are not receiving exemplary care. Orchids should be in a shallow pot with fast-draining, water retentive potting medium which should be slightly damp to the touch."
        },
        {
          "headline":"Purchase a pot and medium appropriate to your plant.",
          "description":"If possible, it is a good idea to purchase a better pot, potting medium, or fertilizer than what comes standard from the store. Some appropriate media include peat moss, bark, pebbles, potting soil, or sphagnum moss. Ask staff to help you complete your purchase with these essentials."
        }
      ]
    }
  ],
  "text":" Selecting a Type of Orchid Choose a Phalaenopsis for a great beginner plant. Phalaenopsis, or moth orchids, generally thrive in warmer temperatures of around 60\u201365 \u00b0F (16\u201318 \u00b0C) at night and 70\u201380 \u00b0F (21\u201327 \u00b0C) degrees during the day. They also enjoy an intermediate amount of light, and only need to be watered every 4-7 days. They also have some of the longest and most frequent blooms from winter to spring. Select Dendrobium orchids for a unique look. This is a popular genus that offers long-lasting blooms. They can withstand warmer weather with proper ventilation and humidity. They also prefer a pot that is taller than it is wide. They need more frequent watering around twice a week, and represent one of the few orchids that can bloom outside. Take home a Miltonia orchid for a resilient and colorful flower. Miltonias have many species that thrive in various environments. They generally like to be left in 1 spot, and need around 2 hours of bright, diffused light per day. They should be watered once a week in winter, and twice a week in summer. Purchase a Paphiopedilum orchid for a summer bloom that needs little light. Paphs, or lady slippers, are well-loved because they require similar care to African Violets. These tropical beauties thrive in medium to warm environments and require watering about every 5 days. Take home Oncidium orchids for brightly colored, fragranced blooms. Oncidiums like warm weather, can be kept in direct sunlight, and can also bloom with artificial light. Water every 2 to 10 days or when the potting medium is halfway dry. These lovely plants often bloom several times a year, usually in spring and fall. Consider an Odontoglossum for a challenging yet rewarding bloom. Odontoglossums are beautiful plant that require lots of light, but need daytime temperatures kept between 75\u201380 \u00b0F (24\u201327 \u00b0C), with nighttime temperatures around 55\u201358 \u00b0F (13\u201314 \u00b0C) . They require frequent watering every 2-7 days, or just when the potting medium begins to dry and require perfect drainage systems. Research specific orchid needs. Once you\u2019ve picked a variety that you like, try to read as much as possible about its care. Each species is unique and some may have more demanding needs than you first think. Selecting a Healthy Orchid Purchase a mature plant. Younger plants or seedlings may seem like a good value, but some orchids can take years of advanced care before blooming. To avoid this, select a plant that has visible blooms or at least flower spikes. Check for signs of disease. Black, brown, or yellow spots, or wet spots on the leaves are all signs of orchid health problems. Try to avoid plants with these issues and instead go for healthy-looking orchids. Look for signs of pests. White webbing on the plant can be indicative of spider mites that can harm the orchid, or even harm other plants housed nearby. Look for vibrant leaves. Limp or wrinkly leaves can be a sign of poor care. The leaves should be thick, lustrous, and even rubbery. They should also be a uniform green unless it is a mottled species. Ensure that orchids are draining properly. Orchids that have roots sitting in water or are too wet will most likely start to rot without immediate attention. Look for other cosmetic flaws. Holes or torn leaves can mean other pests or careless workers. Look for colorful orchids. The coloration of the leaves, shoots, and blooms should be vibrant and saturated. Dull or pale orchids may be weak or malnourished. Feel for damp soil. The potting medium should be barely damp to damp. If the potting medium is too dry, they are not receiving enough water, if they receive too much it may not drain effectively and can cause rot. Making Your Purchase Determine your budget. Orchids can vary greatly in price. Some can be purchased for a few dollars at local markets, while others are prized plants costing hundreds of dollars. Factor in the type of care you will need to give the orchid such as special potting medium or fertilizer. Try to make your purchase from a nursery. Although you can find orchids in many supermarkets, it is often helpful to have knowledgeable staff to guide your purchase. Additionally, it is more likely that the plants are receiving quality care in a nursery than small market. Look for well-cared-for orchids. Supermarkets can still be an excellent place to buy orchids as they are usually much cheaper. Try to make sure the orchids are well cared-for. Make sure the area looks clean and well lit. Try to see if staff can answer questions about orchid care; if they can't, it may be a sign that the orchids are not receiving exemplary care. Orchids should be in a shallow pot with fast-draining, water retentive potting medium which should be slightly damp to the touch. Purchase a pot and medium appropriate to your plant. If possible, it is a good idea to purchase a better pot, potting medium, or fertilizer than what comes standard from the store. Some appropriate media include peat moss, bark, pebbles, potting soil, or sphagnum moss. Ask staff to help you complete your purchase with these essentials.",
  "tyn_model":[
    "orchids",
    "potting medium",
    "orchid",
    "pot",
    "water",
    "fertilizer",
    "phalaenopsis",
    "nursery",
    "potting soil"
  ],
  "tyn_section":[

  ]
}