{
  "title":"How to Control Your Beyblade",
  "url":"https://www.wikihow.com/Control-Your-Beyblade",
  "category_hierarchy":[
    "Hobbies and Crafts",
    "Toys",
    "Action Toys",
    "Beyblade"
  ],
  "methods":[
    {
      "name":"Preparing the Beyblade",
      "steps":[
        {
          "headline":"Purchase a spin control Beyblade.",
          "description":"The full name of the model you need is the IR Spin Control Beyblade Extreme Top System (XTS) by Hasbro. There are nine different Beyblades in the IR Spin Control series to choose from."
        },
        {
          "headline":"Load batteries into the controller.",
          "description":"As it says on the box, the Beyblade itself comes with batteries in it, but the controller doesn't. You'll need two AAA batteries and a small Phillips head screwdriver. Unscrew the screws on the handle of the controller with a screwdriver. Put the batteries in and then screw the screws back in. Avoid screwing them in too tight as the metal screws can strip the plastic threads."
        },
        {
          "headline":"Match the frequencies of the Beyblade and the controller.",
          "description":"There's a switch on the Beyblade and a switch on the controller. These determine the frequencies that they operate on and they need to match, so switch both the Beyblade and the controller to either the first or second position."
        }
      ]
    },
    {
      "name":"Controlling the Beyblade",
      "steps":[
        {
          "headline":"Spin the Beyblade.",
          "description":"Attach the Beyblade to the controller. The Beyblade should easily click into place on the right side of the controller. Then put the ripcord into place and let it rip!"
        },
        {
          "headline":"Use the buttons on the controller to control the Beyblade.",
          "description":"The left and right buttons change the direction the Beyblade spins in. The top right button gives it a quick boost in speed. The top left button activates the Beyblade's special move, which varies depending on which model you chose."
        },
        {
          "headline":"Keep controlling it until the IR power runs out.",
          "description":"There's a row of lights on the top of the controller which indicates how much controlling time you have left before you have to resin the Beyblade. Practice controlling your Beyblade until you've got a handle on it and then go out and battle!"
        }
      ]
    }
  ],
  "text":" Preparing the Beyblade Purchase a spin control Beyblade. The full name of the model you need is the IR Spin Control Beyblade Extreme Top System (XTS) by Hasbro. There are nine different Beyblades in the IR Spin Control series to choose from. Load batteries into the controller. As it says on the box, the Beyblade itself comes with batteries in it, but the controller doesn't. You'll need two AAA batteries and a small Phillips head screwdriver. Unscrew the screws on the handle of the controller with a screwdriver. Put the batteries in and then screw the screws back in. Avoid screwing them in too tight as the metal screws can strip the plastic threads. Match the frequencies of the Beyblade and the controller. There's a switch on the Beyblade and a switch on the controller. These determine the frequencies that they operate on and they need to match, so switch both the Beyblade and the controller to either the first or second position. Controlling the Beyblade Spin the Beyblade. Attach the Beyblade to the controller. The Beyblade should easily click into place on the right side of the controller. Then put the ripcord into place and let it rip! Use the buttons on the controller to control the Beyblade. The left and right buttons change the direction the Beyblade spins in. The top right button gives it a quick boost in speed. The top left button activates the Beyblade's special move, which varies depending on which model you chose. Keep controlling it until the IR power runs out. There's a row of lights on the top of the controller which indicates how much controlling time you have left before you have to resin the Beyblade. Practice controlling your Beyblade until you've got a handle on it and then go out and battle!",
  "tyn_model":[
    "beyblade",
    "controller",
    "batteries",
    "spin control beyblade",
    "ir spin control beyblade extreme top system",
    "phillips head screwdriver",
    "screwdriver"
  ],
  "tyn_section":[

  ]
}