{
  "title":"How to Synchronize a Wii Remote to the Console",
  "url":"https://www.wikihow.com/Synchronize-a-Wii-Remote-to-the-Console",
  "category_hierarchy":[
    "Hobbies and Crafts",
    "Games",
    "Video Games",
    "Nintendo Video Game Consoles",
    "Nintendo Wii"
  ],
  "methods":[
    {
      "name":"Standard Mode",
      "steps":[
        {
          "headline":"Press the Power button on the Wii console.",
          "description":"It should turn blue. As soon as it does, it's on and ready to sync."
        },
        {
          "headline":"Open the SD card slot cover on the front of the Wii console.",
          "description":"It's the panel on the front next to the eject button. You'll see a red button to the left of the SD slot."
        },
        {
          "headline":"Remove the battery cover on the back of the to-be-synced Wii remote.",
          "description":"If there aren't any batteries in place (or the batteries are dead), place new ones in now."
        },
        {
          "headline":"Press and release the SYNC button just below the batteries on the Wii Remote.",
          "description":"Use the tip of a pen or paper clip if need be. You do not need to hold the button down; it will activate after a quick push."
        },
        {
          "headline":"Press and release the SYNC button on the console while the Player LED lights are still blinking on the Wii remote.",
          "description":"If the LED lights on the Wii remote have stopped blinking, just push the SYNC button one more time. When the player LED blinking stops, the process is complete. You'll see an LED illuminated on your remote, indicating that remote's player number. This procedure must be repeated for each remote you'd like synced up."
        }
      ]
    },
    {
      "name":"One-Time Mode",
      "steps":[
        {
          "headline":"Know the purpose of one-time mode synchronization.",
          "description":"This is much different than syncing in the standard mode and is not permanent. One-Time Mode synchronization lets you use your remote on a different Wii console (say a friend's) or a different remote on your console. You can also use it to change the order of players without turning off the Wii and starting over. This does not get rid of the settings in Standard Mode. Once you turn the power off, the settings used in One-Time Mode will go away, never to return. If you accidentally turn the power off, you will have to start the process all over again, as your Standard settings have taken effect."
        },
        {
          "headline":"Press the HOME button.",
          "description":"Be sure you're using a Wii remote that is synchronized with the Wii console you're currently using. Make sure both the console and the remote are on and working."
        },
        {
          "headline":"Select the Wii Remote Settings option from the Home Button menu.",
          "description":"Your other options are \"Wii Menu,\" \"Operations Guide,\" \"Reset,\" and \"Close.\""
        },
        {
          "headline":"Select the Reconnect option.",
          "description":"This is also where you change the volume and rumble. It's only temporary. If you're syncing to someone else's console, your remote will unsync when the power is turned off."
        },
        {
          "headline":"Press the 1 and 2 Buttons at the same time.",
          "description":"Important: Use the Wii remote that you want to synchronize with the console. Should be a no-brainer, but you never know. The Player LED will blink during the syncing process. When the blinking stops, the connection is complete. If you are syncing multiple Wii Remotes, press the 1 and 2 Buttons on the Wii Remote you want to be player 1. Immediately after (without a significant pause), press the 1 and 2 buttons on the remote you want to be player 2. The order in which you push the buttons determines the order of the players in multiplayer games."
        }
      ]
    }
  ],
  "text":" Standard Mode Press the Power button on the Wii console. It should turn blue. As soon as it does, it's on and ready to sync. Open the SD card slot cover on the front of the Wii console. It's the panel on the front next to the eject button. You'll see a red button to the left of the SD slot. Remove the battery cover on the back of the to-be-synced Wii remote. If there aren't any batteries in place (or the batteries are dead), place new ones in now. Press and release the SYNC button just below the batteries on the Wii Remote. Use the tip of a pen or paper clip if need be. You do not need to hold the button down; it will activate after a quick push. Press and release the SYNC button on the console while the Player LED lights are still blinking on the Wii remote. If the LED lights on the Wii remote have stopped blinking, just push the SYNC button one more time. When the player LED blinking stops, the process is complete. You'll see an LED illuminated on your remote, indicating that remote's player number. This procedure must be repeated for each remote you'd like synced up. One-Time Mode Know the purpose of one-time mode synchronization. This is much different than syncing in the standard mode and is not permanent. One-Time Mode synchronization lets you use your remote on a different Wii console (say a friend's) or a different remote on your console. You can also use it to change the order of players without turning off the Wii and starting over. This does not get rid of the settings in Standard Mode. Once you turn the power off, the settings used in One-Time Mode will go away, never to return. If you accidentally turn the power off, you will have to start the process all over again, as your Standard settings have taken effect. Press the HOME button. Be sure you're using a Wii remote that is synchronized with the Wii console you're currently using. Make sure both the console and the remote are on and working. Select the Wii Remote Settings option from the Home Button menu. Your other options are \"Wii Menu,\" \"Operations Guide,\" \"Reset,\" and \"Close.\" Select the Reconnect option. This is also where you change the volume and rumble. It's only temporary. If you're syncing to someone else's console, your remote will unsync when the power is turned off. Press the 1 and 2 Buttons at the same time. Important: Use the Wii remote that you want to synchronize with the console. Should be a no-brainer, but you never know. The Player LED will blink during the syncing process. When the blinking stops, the connection is complete. If you are syncing multiple Wii Remotes, press the 1 and 2 Buttons on the Wii Remote you want to be player 1. Immediately after (without a significant pause), press the 1 and 2 buttons on the remote you want to be player 2. The order in which you push the buttons determines the order of the players in multiplayer games.",
  "tyn_model":[
    "wii remote",
    "remote",
    "sync button",
    "wii console",
    "sd card slot",
    "wii",
    "wii menu",
    "wii remotes"
  ],
  "tyn_section":[

  ]
}