{
  "title":"How to Obtain a Crobat in Pok\u00e9mon",
  "url":"https://www.wikihow.com/Obtain-a-Crobat-in-Pok%C3%A9mon",
  "category_hierarchy":[
    "Hobbies and Crafts",
    "Games",
    "Video Games",
    "Multi Platform Games",
    "Pokemon Video Games"
  ],
  "methods":[
    {
      "name":"Evolution",
      "steps":[
        {
          "headline":"Know that Golbat evolves into Crobat with maximum friendship.",
          "description":"Pok\u00e9mon that also evolve with max friendship (under certain conditions) are Meowth (in its Alola Form in 7th generation Pok\u00e9mon games), Chansey, Eevee, Pichu, Cleffa, Igglybuff, Togepi, Azurill, Budew, Buneary, Chingling, Munchlax, Riolu, Woobat, Swadloon, and Type: Null, into Persian (in its Alola Form), Blissey, Espeon/Umbreon, Clefairy, Togetic, Marill, Roselia, Lopunny, Chimecho, Snorlax, Lucario, Swoobat, Leavanny, and Silvally, respectively."
        },
        {
          "headline":"Obtain a Golbat.",
          "description":"Golbat evolves from Zubat, which can be caught at many caves throughout your adventure."
        },
        {
          "headline":"Train it to become stronger.",
          "description":"Feed it a lot of vitamins such as Protein or Iron to increase both friendship and stats, and use it in battles as often as possible. Try not to let it faint a lot."
        },
        {
          "headline":"Find other ways to increase its happiness.",
          "description":"Massages/haircuts can quickly raise happiness in 4th generation Pok\u00e9mon games, and in 5th generation games, you can feed it Sweet Hearts."
        },
        {
          "headline":"Give your Golbat a Soothe Bell.",
          "description":"This increases the happiness more quickly."
        },
        {
          "headline":"Level it up once it has hit max happiness.",
          "description":"It can often be difficult to tell, but there are people in every Pok\u00e9mon game that can measure your Pok\u00e9mon's happiness. If that particular person says that Golbat is extremely happy with you, it's time to level it up."
        },
        {
          "headline":"Enjoy your Crobat!",
          "description":""
        }
      ]
    },
    {
      "name":"Catching It",
      "steps":[
        {
          "headline":"Make sure you have Pok\u00e9mon Black/White, Pok\u00e9mon Black 2/White 2, or Pok\u00e9mon Sun/Moon.",
          "description":"Crobat can be caught in the wild in these games."
        },
        {
          "headline":"Obtain good Poke Balls in order to catch it.",
          "description":"They should probably be Dusk Balls, since they work tremendously at night or in caves."
        },
        {
          "headline":"Go to Route 13 or Giant Chasm (Black/White), Dreamyard (Black 2/White 2), or Resolution Cave (Sun/Moon).",
          "description":""
        },
        {
          "headline":"Wander around in the grass/cave until you find a Crobat.",
          "description":"This may take some time. In Pok\u00e9mon Sun and Moon, you will have to encounter a Golbat, and wait until it calls a Crobat as its ally Pok\u00e9mon. Use an Adrenaline Orb during the battle to make the Golbat call ally Pok\u00e9mon more often. Once it calls a Crobat as its ally Pok\u00e9mon, knock out the Golbat."
        },
        {
          "headline":"Once you are in battle with it, wear down its HP.",
          "description":"Don't accidentally knock it out."
        },
        {
          "headline":"Catch it!",
          "description":""
        },
        {
          "headline":"If it works, enjoy, but if it doesn't, keep trying.",
          "description":""
        }
      ]
    },
    {
      "name":"Local Trade",
      "steps":[
        {
          "headline":"Make sure the friend you want to trade with has a Crobat.",
          "description":""
        },
        {
          "headline":"Have the Pok\u00e9mon you want to trade to your friend in your party.",
          "description":""
        },
        {
          "headline":"Enter the Union Room (or engage IR communication).",
          "description":"Your friend must to the same."
        },
        {
          "headline":"Start the trade.",
          "description":"You may have to do this by running up to your friend in-game and talking to him/her."
        },
        {
          "headline":"Offer the Pok\u00e9mon you want to trade.",
          "description":"Your friend should offer Crobat."
        },
        {
          "headline":"Accept the trade, and enjoy your Crobat!",
          "description":""
        }
      ]
    },
    {
      "name":"Internet Trade",
      "steps":[
        {
          "headline":"Make sure you have a good connection to the Internet.",
          "description":"Due to the shutdown of Nintendo Wi-Fi Connection, 5th generation Pok\u00e9mon games will no longer be able to connect to the Internet. Therefore, this only works in 6th and 7th generation Pok\u00e9mon games."
        },
        {
          "headline":"Have a good Pok\u00e9mon in your party.",
          "description":""
        },
        {
          "headline":"Offer your Pok\u00e9mon on the GTS in exchange for a Crobat.",
          "description":"If you don't have a Crobat in your Pok\u00e9dex, tap the \"What Pok\u00e9mon?\" option and enter Crobat in the provided text box. Do not put a level restriction or any other restriction on it."
        },
        {
          "headline":"If you have a good Pok\u00e9mon, the trade should happen within about one day, so keep waiting if you haven't gotten a Crobat yet.",
          "description":""
        },
        {
          "headline":"Once you have gotten a Crobat, enjoy!",
          "description":""
        }
      ]
    }
  ],
  "text":" Evolution Know that Golbat evolves into Crobat with maximum friendship. Pok\u00e9mon that also evolve with max friendship (under certain conditions) are Meowth (in its Alola Form in 7th generation Pok\u00e9mon games), Chansey, Eevee, Pichu, Cleffa, Igglybuff, Togepi, Azurill, Budew, Buneary, Chingling, Munchlax, Riolu, Woobat, Swadloon, and Type: Null, into Persian (in its Alola Form), Blissey, Espeon/Umbreon, Clefairy, Togetic, Marill, Roselia, Lopunny, Chimecho, Snorlax, Lucario, Swoobat, Leavanny, and Silvally, respectively. Obtain a Golbat. Golbat evolves from Zubat, which can be caught at many caves throughout your adventure. Train it to become stronger. Feed it a lot of vitamins such as Protein or Iron to increase both friendship and stats, and use it in battles as often as possible. Try not to let it faint a lot. Find other ways to increase its happiness. Massages/haircuts can quickly raise happiness in 4th generation Pok\u00e9mon games, and in 5th generation games, you can feed it Sweet Hearts. Give your Golbat a Soothe Bell. This increases the happiness more quickly. Level it up once it has hit max happiness. It can often be difficult to tell, but there are people in every Pok\u00e9mon game that can measure your Pok\u00e9mon's happiness. If that particular person says that Golbat is extremely happy with you, it's time to level it up. Enjoy your Crobat!  Catching It Make sure you have Pok\u00e9mon Black/White, Pok\u00e9mon Black 2/White 2, or Pok\u00e9mon Sun/Moon. Crobat can be caught in the wild in these games. Obtain good Poke Balls in order to catch it. They should probably be Dusk Balls, since they work tremendously at night or in caves. Go to Route 13 or Giant Chasm (Black/White), Dreamyard (Black 2/White 2), or Resolution Cave (Sun/Moon).  Wander around in the grass/cave until you find a Crobat. This may take some time. In Pok\u00e9mon Sun and Moon, you will have to encounter a Golbat, and wait until it calls a Crobat as its ally Pok\u00e9mon. Use an Adrenaline Orb during the battle to make the Golbat call ally Pok\u00e9mon more often. Once it calls a Crobat as its ally Pok\u00e9mon, knock out the Golbat. Once you are in battle with it, wear down its HP. Don't accidentally knock it out. Catch it!  If it works, enjoy, but if it doesn't, keep trying.  Local Trade Make sure the friend you want to trade with has a Crobat.  Have the Pok\u00e9mon you want to trade to your friend in your party.  Enter the Union Room (or engage IR communication). Your friend must to the same. Start the trade. You may have to do this by running up to your friend in-game and talking to him/her. Offer the Pok\u00e9mon you want to trade. Your friend should offer Crobat. Accept the trade, and enjoy your Crobat!  Internet Trade Make sure you have a good connection to the Internet. Due to the shutdown of Nintendo Wi-Fi Connection, 5th generation Pok\u00e9mon games will no longer be able to connect to the Internet. Therefore, this only works in 6th and 7th generation Pok\u00e9mon games. Have a good Pok\u00e9mon in your party.  Offer your Pok\u00e9mon on the GTS in exchange for a Crobat. If you don't have a Crobat in your Pok\u00e9dex, tap the \"What Pok\u00e9mon?\" option and enter Crobat in the provided text box. Do not put a level restriction or any other restriction on it. If you have a good Pok\u00e9mon, the trade should happen within about one day, so keep waiting if you haven't gotten a Crobat yet.  Once you have gotten a Crobat, enjoy! ",
  "tyn_model":[
    "crobat",
    "golbat",
    "pok\u00e9mon",
    "meowth",
    "azurill",
    "budew",
    "clefairy",
    "marill",
    "zubat",
    "vitamins",
    "protein",
    "iron",
    "adrenaline orb",
    "pok\u00e9dex"
  ],
  "tyn_section":[

  ]
}