{
  "title":"How to Care for a Sick Teddy Bear",
  "url":"https://www.wikihow.com/Care-for-a-Sick-Teddy-Bear",
  "category_hierarchy":[
    "Hobbies and Crafts",
    "Toys",
    "Traditional Toys",
    "Teddy Bears"
  ],
  "parts":[
    {
      "name":"Caring for Teddy at Home",
      "steps":[
        {
          "headline":"Bandage him/her up, lay him/her in his/her bed or in your bed.",
          "description":"Make sure to give him/her lots of blankets so he/she doesn't get cold!"
        },
        {
          "headline":"Make him/her some medicine.",
          "description":"You can do so by putting some water in a small cup. Every hour or two, give him/her about 2-3 small spoonfuls of medicine."
        },
        {
          "headline":"Put a small pile of toys next to him/her in case he/she gets bored.",
          "description":"Either put on some nice music, tell him/her to take a nap, or put on a nice movie for him/her to watch."
        },
        {
          "headline":"Kiss and cuddle him/her.",
          "description":"Love will help him/her get better faster."
        },
        {
          "headline":"Do something special together, when he or she recovers.Make sure he/she spends at least one day resting.",
          "description":"The next day, you can put him/her in his/her play area. He/she should have the casts on for at least 3 or 4 days. On the third day or so, you can take him/her outside for some fresh air, but don't keep him/her out to long or he/she won't get better!"
        }
      ]
    },
    {
      "name":"Caring for Teddy at Hospital",
      "steps":[
        {
          "headline":"Make a wristband for your teddy.",
          "description":"Take some white paper and write your teddy's name on it! Then use some clear tape to attach it to your bear. This wristband will be so the doctors can identify your teddy."
        },
        {
          "headline":"Make your teddy a hospital room.",
          "description":"Get an old shoe box or any kind of old box that your teddy fits in line it with soft felt or cloth and make a pillow out of an old shirt. Or you could let your teddy use your bed! Also, put down some tissues and a book to read for your teddy so he or she won't get bored."
        },
        {
          "headline":"Make a medical kit out of household objects and then use it to do some tests.",
          "description":"Give your teddy an X-ray to see if he or she has any broken bones, and check his or her eyes and ears to make sure they're healthy! And don't forget to check his or her tonsils!"
        },
        {
          "headline":"Give your teddy medicine.",
          "description":"Put together water, sugar, pepper, salt and maybe some juice to make some medicine for your teddy. This will make him or her feel better! Remember to give it one tablespoon a day!"
        },
        {
          "headline":"Make a cast for your teddy.",
          "description":"This is only for broken bones! To do this, take some coloured pre-wrap and wrap it around the arm or the leg, depending on what bone is broken. Then, get some clear or white tape and tape it together so it won't unwrap itself when you play with it. After about 6 days the teddy bear equivalent of 6 weeks take the cast off. The teddy will be all healed and ready to play again."
        },
        {
          "headline":"Celebrate when your teddy is all better!",
          "description":"Yay! Send him or her back home with some lollipops and a small book."
        }
      ]
    }
  ],
  "text":" Caring for Teddy at Home Bandage him/her up, lay him/her in his/her bed or in your bed. Make sure to give him/her lots of blankets so he/she doesn't get cold! Make him/her some medicine. You can do so by putting some water in a small cup. Every hour or two, give him/her about 2-3 small spoonfuls of medicine. Put a small pile of toys next to him/her in case he/she gets bored. Either put on some nice music, tell him/her to take a nap, or put on a nice movie for him/her to watch. Kiss and cuddle him/her. Love will help him/her get better faster. Do something special together, when he or she recovers.Make sure he/she spends at least one day resting. The next day, you can put him/her in his/her play area. He/she should have the casts on for at least 3 or 4 days. On the third day or so, you can take him/her outside for some fresh air, but don't keep him/her out to long or he/she won't get better! Caring for Teddy at Hospital Make a wristband for your teddy. Take some white paper and write your teddy's name on it! Then use some clear tape to attach it to your bear. This wristband will be so the doctors can identify your teddy. Make your teddy a hospital room. Get an old shoe box or any kind of old box that your teddy fits in line it with soft felt or cloth and make a pillow out of an old shirt. Or you could let your teddy use your bed! Also, put down some tissues and a book to read for your teddy so he or she won't get bored. Make a medical kit out of household objects and then use it to do some tests. Give your teddy an X-ray to see if he or she has any broken bones, and check his or her eyes and ears to make sure they're healthy! And don't forget to check his or her tonsils! Give your teddy medicine. Put together water, sugar, pepper, salt and maybe some juice to make some medicine for your teddy. This will make him or her feel better! Remember to give it one tablespoon a day! Make a cast for your teddy. This is only for broken bones! To do this, take some coloured pre-wrap and wrap it around the arm or the leg, depending on what bone is broken. Then, get some clear or white tape and tape it together so it won't unwrap itself when you play with it. After about 6 days the teddy bear equivalent of 6 weeks take the cast off. The teddy will be all healed and ready to play again. Celebrate when your teddy is all better! Yay! Send him or her back home with some lollipops and a small book.",
  "tyn_model":[
    "water",
    "medicine",
    "white paper",
    "clear tape",
    "tissues",
    "sugar",
    "pepper",
    "salt",
    "juice",
    "clear or white tape",
    "teddy bear equivalent of 6 weeks"
  ],
  "tyn_section":[

  ]
}