{
  "title":"How to Use Almond Milk",
  "url":"https://www.wikihow.com/Use-Almond-Milk",
  "category_hierarchy":[
    "Food and Entertaining",
    "Drinks",
    "Smoothies Shakes and Milk"
  ],
  "methods":[
    {
      "name":"Drinks with almond milk",
      "steps":[
        {
          "headline":"Drink almond milk.",
          "description":"Almond milk can be drunk in the same way as milk. It can usually be found in 3 flavors: plain, vanilla and chocolate. The plain variety can be sweetened or unsweetened. Manufacturers recommend shaking the container of almond milk prior to drinking it as there may be some settlement at the bottom. Almond milk, in any flavor, can also be added to coffee or tea, just like normal milk or cream."
        },
        {
          "headline":"Use almond milk in smoothies.",
          "description":"Almond milk can be used in smoothies instead of traditional dairy products. Simply combine fruit (frozen is best) and the almond milk in a blender and pulse it until it is combined. You can adjust the amount of almond milk to make your smoothie more or less thick."
        },
        {
          "headline":"Make Indian style kesar-badaam using almond milk:",
          "description":"Add a pinch of saffron (kesar) to half a cup of luke warm regular or almond milk and let it rest till you prepare the rest of the ingredients. This lets the colour and flavour infuse with the milk. Blanche 1-2 blanched de-seeded dry dates (add as per your taste)."
        },
        {
          "headline":"Grind these dates with one pod of green cardamom and 2-3 almonds and 2-3 cashew nuts.",
          "description":""
        },
        {
          "headline":"Roast 2-3 pistachio nuts and 1 almond and chop them into slivers.",
          "description":"Pour 1 1/2 cups of chilled almond (badaam) milk in a blender. Add the ground ingredients and sugar (optional) and blend for few seconds."
        },
        {
          "headline":"Add the half-cup of saffron with milk and mix.",
          "description":""
        },
        {
          "headline":"Garnish with slivers of roasted nuts and serve.",
          "description":"Note: It is better to blend the dates alone first and then add the other ingredients, as dates may not crush up well when blended along with the milk."
        }
      ]
    },
    {
      "name":"Using almond milk as a supplement",
      "steps":[
        {
          "headline":"Combine almond milk with protein powder.",
          "description":"Compared to cow's milk, almond milk is low in protein. Most varieties have about 1g of protein per 1 cup (8 oz) serving. Two percent cow's milk, however, has around 8g of protein for the same size serving. Almond milk mixes well with protein powders, making it a good choice for those who want to increase their protein intake without drinking cow's milk."
        },
        {
          "headline":"Consume almond milk for its nutritional or dietary value.",
          "description":"Almond milk has no saturated fat, and has roughly half the fat of 2 percent milk. There is no cholesterol in it and it is naturally high in calcium. Almond milk has 15 percent more of your daily calcium requirements compared to 1 percent milk. Homemade almond milk is an acceptable milk substitute for those who are following raw food diets."
        }
      ]
    }
  ],
  "text":" Drinks with almond milk Drink almond milk. Almond milk can be drunk in the same way as milk. It can usually be found in 3 flavors: plain, vanilla and chocolate. The plain variety can be sweetened or unsweetened. Manufacturers recommend shaking the container of almond milk prior to drinking it as there may be some settlement at the bottom. Almond milk, in any flavor, can also be added to coffee or tea, just like normal milk or cream. Use almond milk in smoothies. Almond milk can be used in smoothies instead of traditional dairy products. Simply combine fruit (frozen is best) and the almond milk in a blender and pulse it until it is combined. You can adjust the amount of almond milk to make your smoothie more or less thick. Make Indian style kesar-badaam using almond milk: Add a pinch of saffron (kesar) to half a cup of luke warm regular or almond milk and let it rest till you prepare the rest of the ingredients. This lets the colour and flavour infuse with the milk. Blanche 1-2 blanched de-seeded dry dates (add as per your taste). Grind these dates with one pod of green cardamom and 2-3 almonds and 2-3 cashew nuts.  Roast 2-3 pistachio nuts and 1 almond and chop them into slivers. Pour 1 1/2 cups of chilled almond (badaam) milk in a blender. Add the ground ingredients and sugar (optional) and blend for few seconds. Add the half-cup of saffron with milk and mix.  Garnish with slivers of roasted nuts and serve. Note: It is better to blend the dates alone first and then add the other ingredients, as dates may not crush up well when blended along with the milk. Using almond milk as a supplement Combine almond milk with protein powder. Compared to cow's milk, almond milk is low in protein. Most varieties have about 1g of protein per 1 cup (8 oz) serving. Two percent cow's milk, however, has around 8g of protein for the same size serving. Almond milk mixes well with protein powders, making it a good choice for those who want to increase their protein intake without drinking cow's milk. Consume almond milk for its nutritional or dietary value. Almond milk has no saturated fat, and has roughly half the fat of 2 percent milk. There is no cholesterol in it and it is naturally high in calcium. Almond milk has 15 percent more of your daily calcium requirements compared to 1 percent milk. Homemade almond milk is an acceptable milk substitute for those who are following raw food diets.",
  "tyn_model":[
    "almond milk",
    "milk",
    "cow's milk",
    "blender",
    "saffron",
    "cream",
    "dairy products",
    "fruit",
    "regular or almond milk",
    "dates",
    "green cardamom",
    "almonds",
    "cashew nuts",
    "pistachio nuts",
    "almond",
    "chilled almond (badaam) milk",
    "sugar",
    "protein powder",
    "protein powders",
    "2 percent milk"
  ],
  "tyn_section":[

  ]
}