{
  "title":"How to Cook Squirrel",
  "url":"https://www.wikihow.com/Cook-Squirrel",
  "category_hierarchy":[
    "Food and Entertaining",
    "Recipes",
    "Meat"
  ],
  "methods":[
    {
      "name":"Frying Squirrel",
      "steps":[
        {
          "headline":"Place the squirrel pieces in a large saucepan and cover with water.",
          "description":"Place the saucepan on the stove and bring to a boil, then reduce the heat to a simmer. Allow the squirrel meat to simmer until tender, about an hour and a half. Be sure to simmer, not boil the meat; it should not be falling off the bone when you remove it from heat. If you have an older squirrel, it may take longer for the meat to become tender."
        },
        {
          "headline":"Drain the squirrel meat.",
          "description":"Pat it dry with paper towels to remove extra moisture. Set the pieces on a plate."
        },
        {
          "headline":"Mix the flour, garlic powder, cayenne pepper, and a few pinches of salt and black pepper in a bowl.",
          "description":""
        },
        {
          "headline":"Pour oil into a frying pan.",
          "description":"Heat the oil over medium high heat. The oil should cover the bottom of the pan and come 1/4 way up the sides. To deep fry the squirrel pieces, heat an inch of oil into a dutch oven or large saucepan. To test whether the oil is hot enough to fry, dip the handle of a wooden spoon into the oil. When the oil bubbles rapidly around the spoon, it's ready to fry."
        },
        {
          "headline":"Dredge the squirrel pieces in the flour mixture.",
          "description":"Coat the pieces one at a time, and lay them in the frying pan. Repeat until all the squirrel pieces have been dredged and are cooking in the pan."
        },
        {
          "headline":"Turn the squirrel pieces over to fry on the other side.",
          "description":"Cook until the breading is golden brown."
        },
        {
          "headline":"Set the squirrel pieces on paper towels and allow them to drain.",
          "description":"Serve with foods that usually accompany fried chicken: mashed potatoes, corn, or green beans. Eat carefully, since the squirrel pieces have tiny bones."
        }
      ]
    },
    {
      "name":"Stewing Squirrel",
      "steps":[
        {
          "headline":"Mix the flour and a few pinches of salt and pepper in a bowl.",
          "description":"Dredge the squirrel pieces in the mixture, coating them on all sides. Set the pieces on a plate."
        },
        {
          "headline":"Place a Dutch oven or stewpot over medium heat.",
          "description":"Melt the butter in the pot."
        },
        {
          "headline":"Place the squirrel pieces in the pot.",
          "description":"Let them cook on each side for two to three minutes, until they are completely brown."
        },
        {
          "headline":"Cover the squirrel pieces with 7 cups of water.",
          "description":"Be careful, since the water will bubble when it hits the hot pot."
        },
        {
          "headline":"Add the thyme, potatoes, corn, onions, tomatoes, and a pinch of salt and pepper.",
          "description":"Bring the contents of the pot to a boil."
        },
        {
          "headline":"Reduce the heat to a simmer and cover the pot.",
          "description":"Cook the stew until the squirrel meat is tender, about 2 hours. Serve with bread. Eat carefully, since the squirrel pieces have tiny bones."
        }
      ]
    },
    {
      "name":"Grilling Squirrel",
      "steps":[
        {
          "headline":"Place the squirrel pieces in a large nonreactive bowl.",
          "description":"Cover them with water and a few teaspoons of salt. Place a lid on the bowl and refrigerate overnight. This step helps to tenderize the meat. If you have a young squirrel, you may skip this step. You may skip this step if you want to grill a squirrel over a fire in the woods and don't have time to soak it first."
        },
        {
          "headline":"Light the grill.",
          "description":"Set up a charcoal grill with low, steady heat. If you're camping in the woods, build a fire and allow it it to burn down until you have hot, slow-burning embers to cook over."
        },
        {
          "headline":"Drain the squirrel meat and season with salt and pepper.",
          "description":""
        },
        {
          "headline":"Lay the squirrel pieces on the grill.",
          "description":"Cook over low heat for an hour, turning the pieces occasionally. If you're cooking over an outdoor fire, skewer the pieces on metal skewers or cleaned sticks. Cook for an hour, rotating occasionally. For barbecued squirrel, baste the squirrel pieces with barbecue sauce every fifteen minutes until the meat is cooked."
        }
      ]
    }
  ],
  "text":" Frying Squirrel Place the squirrel pieces in a large saucepan and cover with water. Place the saucepan on the stove and bring to a boil, then reduce the heat to a simmer. Allow the squirrel meat to simmer until tender, about an hour and a half. Be sure to simmer, not boil the meat; it should not be falling off the bone when you remove it from heat. If you have an older squirrel, it may take longer for the meat to become tender. Drain the squirrel meat. Pat it dry with paper towels to remove extra moisture. Set the pieces on a plate. Mix the flour, garlic powder, cayenne pepper, and a few pinches of salt and black pepper in a bowl.  Pour oil into a frying pan. Heat the oil over medium high heat. The oil should cover the bottom of the pan and come 1/4 way up the sides. To deep fry the squirrel pieces, heat an inch of oil into a dutch oven or large saucepan. To test whether the oil is hot enough to fry, dip the handle of a wooden spoon into the oil. When the oil bubbles rapidly around the spoon, it's ready to fry. Dredge the squirrel pieces in the flour mixture. Coat the pieces one at a time, and lay them in the frying pan. Repeat until all the squirrel pieces have been dredged and are cooking in the pan. Turn the squirrel pieces over to fry on the other side. Cook until the breading is golden brown. Set the squirrel pieces on paper towels and allow them to drain. Serve with foods that usually accompany fried chicken: mashed potatoes, corn, or green beans. Eat carefully, since the squirrel pieces have tiny bones. Stewing Squirrel Mix the flour and a few pinches of salt and pepper in a bowl. Dredge the squirrel pieces in the mixture, coating them on all sides. Set the pieces on a plate. Place a Dutch oven or stewpot over medium heat. Melt the butter in the pot. Place the squirrel pieces in the pot. Let them cook on each side for two to three minutes, until they are completely brown. Cover the squirrel pieces with 7 cups of water. Be careful, since the water will bubble when it hits the hot pot. Add the thyme, potatoes, corn, onions, tomatoes, and a pinch of salt and pepper. Bring the contents of the pot to a boil. Reduce the heat to a simmer and cover the pot. Cook the stew until the squirrel meat is tender, about 2 hours. Serve with bread. Eat carefully, since the squirrel pieces have tiny bones. Grilling Squirrel Place the squirrel pieces in a large nonreactive bowl. Cover them with water and a few teaspoons of salt. Place a lid on the bowl and refrigerate overnight. This step helps to tenderize the meat. If you have a young squirrel, you may skip this step. You may skip this step if you want to grill a squirrel over a fire in the woods and don't have time to soak it first. Light the grill. Set up a charcoal grill with low, steady heat. If you're camping in the woods, build a fire and allow it it to burn down until you have hot, slow-burning embers to cook over. Drain the squirrel meat and season with salt and pepper.  Lay the squirrel pieces on the grill. Cook over low heat for an hour, turning the pieces occasionally. If you're cooking over an outdoor fire, skewer the pieces on metal skewers or cleaned sticks. Cook for an hour, rotating occasionally. For barbecued squirrel, baste the squirrel pieces with barbecue sauce every fifteen minutes until the meat is cooked.",
  "tyn_model":[
    "oil",
    "water",
    "pot",
    "flour",
    "bowl",
    "salt and pepper",
    "squirrel",
    "paper towels",
    "plate",
    "frying pan",
    "corn",
    "grill",
    "large saucepan",
    "saucepan",
    "stove",
    "garlic powder",
    "cayenne pepper",
    "salt and black pepper",
    "dutch oven or large saucepan",
    "wooden spoon",
    "fried chicken",
    "mashed potatoes",
    "green beans",
    "dutch oven",
    "butter",
    "hot pot",
    "thyme",
    "potatoes",
    "onions",
    "tomatoes",
    "bread",
    "salt",
    "charcoal grill",
    "barbecue sauce"
  ],
  "tyn_section":[

  ]
}