{
  "title":"How to Make Poha (Indian Snack)",
  "url":"https://www.wikihow.com/Make-Poha-(Indian-Snack)",
  "category_hierarchy":[
    "Food and Entertaining",
    "Recipes",
    "World Cuisines",
    "Indian Cuisine"
  ],
  "methods":[
    {
      "name":"Making Breakfast Poha",
      "steps":[
        {
          "headline":"Rinse 2-3 cups of poha in water and let it soak for 3-4 minutes.",
          "description":"When the poha can be lightly mashed between your fingers, it is ready. There is no need to soak it for a long time. Soaking the rice now makes it tender when you cook it later."
        },
        {
          "headline":"Cook one cup of diced potatoes for two minutes in the microwave.",
          "description":"This will partially cook the inside of the potatoes, as they take a long time to cook in the oil by themselves. Your potatoes should be roughly 1/2-inch cubes."
        },
        {
          "headline":"Drain the water from the rice.",
          "description":"In a fine mesh colander, drain the water and press the poha lightly with your fingers to get out any excess water. Transfer it to a bowl when you are done and set it aside to use later."
        },
        {
          "headline":"Heat 1 tsp of oil on medium in a large wok or saucepan.",
          "description":"If you have a wok, use that. However, a normal saucepan will work fine as a substitute. The pan will be lightly smoking when it is hot enough, as if small bits of steam were coming off the surface."
        },
        {
          "headline":"Add 1 tsp mustard seeds to the oil until the crackle.",
          "description":"The seeds will start to dance and hiss, usually after 25-30 seconds. Once they've started to crackle a bit you can move on to other ingredients. If you do not have a microwave, add the potatoes now. If you are adding a pinch of asafoetida to the recipe, add it now."
        },
        {
          "headline":"Add the diced onions, green chilies, and partially cooked potato.",
          "description":"Chop up a small onion and 1-2 green chilies and throw them in the pan, along with the potatoes from the microwave. Stir well and let them cook for two or three minutes. The onions should be translucent (mostly clear) when you are done."
        },
        {
          "headline":"Add the four curry leaves, spices, 1/2 cup peanuts, and 1/2 tsp sugar.",
          "description":"Add everything except the cilantro and lemon to the wok and stir together. Let them cook, well mixed, for a minute or two. Make sure the potatoes are completely cooked before moving on -- you should be able to easily pierce an entire potato chunk with a fork or toothpick. For spices, start with a pinch of salt, 3/4 tsp turmeric, and curry powder, garam masala, chile powder, and/or garlic powder to taste."
        },
        {
          "headline":"Add the rice and stir well.",
          "description":"Mix everything into the poha and lower the heat to medium-low. Keep cooking everything together until the poha is hot and ready to serve."
        },
        {
          "headline":"Garnish with cilantro and lemon juice and serve hot.",
          "description":"While optional, lemon and cilantro will give a nice fresh burst of flavor at the end of the dish."
        }
      ]
    },
    {
      "name":"Variations",
      "steps":[
        {
          "headline":"Know that poha is a very customizable, versatile recipe.",
          "description":"Because of its relative simplicity, there is a lot you can add to poha to suit your tastes. Some additional spices to consider alongside the onions include:\n3 pods green cardamom\n1 tsp ground or freshly cut ginger\n1/2 tsp chili powder\nA pinch asafoetida (found at Indian grocer)\n1/2 tsp garam masala"
        },
        {
          "headline":"Fry the potatoes ahead of time to make \"batata poha.\"",
          "description":"This recipe gets a light, crispy texture to the potatoes that matches well with the peanuts. Use an extra 1/2 tb of oil and fry the potatoes in the oil before they are a light golden color on the outside, then add the mustard seed and continue with the recipe. Do not fully cook the potatoes before continuing -- they will continue to cook with the onions and spices."
        },
        {
          "headline":"Add 1/2 cup cooked chickpeas, or chana for a heartier poha.",
          "description":"Chickpeas, known as \"chana\" in Indian cuisine, can go in right before the onions, getting a nice golden brown outside in the final dish. For some people, chana is essential to a good poha recipe."
        },
        {
          "headline":"Try adding 1 cup of green peas for a more vegetable-based Poha.",
          "description":"Though not in many traditional poha recipes, modern chefs have begun to incorporate a variety of vegetables from around the world into poha with wonderful results. The light sweetness and quick cooking time of green peas make them perfect for poha. Try adding 1/2 cup of chopped tomatoes right before serving as well."
        },
        {
          "headline":"Serve with a little bit of yogurt to counteract the spicy kick of hot poha.",
          "description":"This little breakfast tip is a perfect pairing of savory and spicy. Add a scoop of plain yogurt your bowl right before serving if you think it is too hot, or if you want a little tangy flavor in the poha."
        }
      ]
    }
  ],
  "text":" Making Breakfast Poha Rinse 2-3 cups of poha in water and let it soak for 3-4 minutes. When the poha can be lightly mashed between your fingers, it is ready. There is no need to soak it for a long time. Soaking the rice now makes it tender when you cook it later. Cook one cup of diced potatoes for two minutes in the microwave. This will partially cook the inside of the potatoes, as they take a long time to cook in the oil by themselves. Your potatoes should be roughly 1/2-inch cubes. Drain the water from the rice. In a fine mesh colander, drain the water and press the poha lightly with your fingers to get out any excess water. Transfer it to a bowl when you are done and set it aside to use later. Heat 1 tsp of oil on medium in a large wok or saucepan. If you have a wok, use that. However, a normal saucepan will work fine as a substitute. The pan will be lightly smoking when it is hot enough, as if small bits of steam were coming off the surface. Add 1 tsp mustard seeds to the oil until the crackle. The seeds will start to dance and hiss, usually after 25-30 seconds. Once they've started to crackle a bit you can move on to other ingredients. If you do not have a microwave, add the potatoes now. If you are adding a pinch of asafoetida to the recipe, add it now. Add the diced onions, green chilies, and partially cooked potato. Chop up a small onion and 1-2 green chilies and throw them in the pan, along with the potatoes from the microwave. Stir well and let them cook for two or three minutes. The onions should be translucent (mostly clear) when you are done. Add the four curry leaves, spices, 1/2 cup peanuts, and 1/2 tsp sugar. Add everything except the cilantro and lemon to the wok and stir together. Let them cook, well mixed, for a minute or two. Make sure the potatoes are completely cooked before moving on -- you should be able to easily pierce an entire potato chunk with a fork or toothpick. For spices, start with a pinch of salt, 3/4 tsp turmeric, and curry powder, garam masala, chile powder, and/or garlic powder to taste. Add the rice and stir well. Mix everything into the poha and lower the heat to medium-low. Keep cooking everything together until the poha is hot and ready to serve. Garnish with cilantro and lemon juice and serve hot. While optional, lemon and cilantro will give a nice fresh burst of flavor at the end of the dish. Variations Know that poha is a very customizable, versatile recipe. Because of its relative simplicity, there is a lot you can add to poha to suit your tastes. Some additional spices to consider alongside the onions include:\n3 pods green cardamom\n1 tsp ground or freshly cut ginger\n1/2 tsp chili powder\nA pinch asafoetida (found at Indian grocer)\n1/2 tsp garam masala Fry the potatoes ahead of time to make \"batata poha.\" This recipe gets a light, crispy texture to the potatoes that matches well with the peanuts. Use an extra 1/2 tb of oil and fry the potatoes in the oil before they are a light golden color on the outside, then add the mustard seed and continue with the recipe. Do not fully cook the potatoes before continuing -- they will continue to cook with the onions and spices. Add 1/2 cup cooked chickpeas, or chana for a heartier poha. Chickpeas, known as \"chana\" in Indian cuisine, can go in right before the onions, getting a nice golden brown outside in the final dish. For some people, chana is essential to a good poha recipe. Try adding 1 cup of green peas for a more vegetable-based Poha. Though not in many traditional poha recipes, modern chefs have begun to incorporate a variety of vegetables from around the world into poha with wonderful results. The light sweetness and quick cooking time of green peas make them perfect for poha. Try adding 1/2 cup of chopped tomatoes right before serving as well. Serve with a little bit of yogurt to counteract the spicy kick of hot poha. This little breakfast tip is a perfect pairing of savory and spicy. Add a scoop of plain yogurt your bowl right before serving if you think it is too hot, or if you want a little tangy flavor in the poha.",
  "tyn_model":[
    "potatoes",
    "oil",
    "onions",
    "water",
    "spices",
    "rice",
    "microwave",
    "cilantro",
    "lemon",
    "saucepan",
    "wok",
    "green chilies",
    "potato",
    "peanuts",
    "garam masala",
    "chickpeas",
    "green peas",
    "fine mesh colander",
    "bowl",
    "large wok",
    "mustard seeds",
    "small onion",
    "pan",
    "curry leaves",
    "sugar",
    "salt",
    "turmeric",
    "curry powder",
    "chile powder",
    "garlic powder",
    "poha",
    "green cardamom",
    "ginger",
    "chili powder",
    "mustard",
    "vegetables",
    "tomatoes",
    "yogurt",
    "plain yogurt"
  ],
  "tyn_section":[

  ]
}