{
  "title":"How to Make Corn Casserole",
  "url":"https://www.wikihow.com/Make-Corn-Casserole",
  "category_hierarchy":[
    "Food and Entertaining",
    "Recipes",
    "Fruits and Vegetables",
    "Maize"
  ],
  "methods":[
    {
      "name":"Making Corn Casserole",
      "steps":[
        {
          "headline":"Preheat your oven to 350\u00baF.",
          "description":""
        },
        {
          "headline":"Melt your butter in a microwavable glass dish.",
          "description":"Liquefy the butter with short, 30 second intervals. The butter does not need to be hot, just completely melted."
        },
        {
          "headline":"Mix the corns, sour cream, corn muffin mixes, butter, and salt in a large bowl.",
          "description":"Using a whisk or spatula, blend all of the ingredients together so that they are combined with no chunks of muffin mix or sour cream. If you want to add spices like garlic powder, black pepper, or hot sauce, add them now."
        },
        {
          "headline":"Lightly grease a 9x13 inch baking dish.",
          "description":"Using cooking spray or a small pat of butter, grease an oven-safe dish so that the casserole does not stick when you serve it. You can use a paper towel to evenly spread a light coating of butter across the dish."
        },
        {
          "headline":"Spoon the casserole mix into the dish.",
          "description":"Once all of the mixture is in the bowl, use a rubber spatula or spoon to evenly distribute it across the pan. The top should be relatively flat."
        },
        {
          "headline":"Bake for 45-60 minutes.",
          "description":"When done, the casserole will be a light golden brown on top. If you prefer a heartier, drier casserole than you can leave it in the oven for closer to an hour."
        },
        {
          "headline":"Sprinkle shredded cheese on top before serving.",
          "description":"You can also add the cheese as the casserole finishes cooking -- just apply the cheese to the top of the casserole 5 minutes before you plan on taking it out of the oven."
        }
      ]
    },
    {
      "name":"Variations",
      "steps":[
        {
          "headline":"Coat the top of the casserole with breadcrumbs before cooking.",
          "description":"This will create a crunchy, tasty crust on the top of the casserole that complements the soft interior perfectly."
        },
        {
          "headline":"Add eggs to the batter to cook a richer casserole.",
          "description":"Many casserole recipes call for eggs because the fat and protein binds the ingredients together, leading to a richer tasting casserole. To add eggs, beat them together with a whisk and add them directly into the casserole with the other ingredients. Never add the eggs to the hot butter, as this can partially cook them before they mix in with everything."
        },
        {
          "headline":"Add cream cheese or shredded cheddar for a cheesy, decadent corn casserole.",
          "description":"Simply add the cheese to the rest of the ingredients as you blend them in. You can soften cream cheese to make it easier to mix by leaving it on the counter 20-30 minutes before you begin to cook."
        },
        {
          "headline":"Try out a spicy Mexican corn casserole.",
          "description":"This variation on corn casserole makes a great side dish at parties and sporting events. To make it, add 1/2 cup diced jalapenos, bell peppers and green onions to the mix along with a tablespoon of garlic powder, chili powder, and/or crushed chipotle. Top the casserole with 1 cup of shredded pepper jack or cheddar cheese for the last 5 minutes of cooking for a gooey, cheesy upper crust."
        },
        {
          "headline":"Add cooked bacon and chopped scallions for a decadent side dish.",
          "description":"This rich but tasty version of corn casserole requires 4-5 chopped slices of bacon and 1/2 cup chopped scallions tossed in with the other ingredients. However, the casserole will not get hot enough to cook the bacon, so you need to cook the bacon beforehand. Garnish with cheddar cheese and/or a handful of fresh scallions."
        },
        {
          "headline":"Sweeten the recipe to make a corn pudding dessert.",
          "description":"The natural sweetness of the corn makes it easy to adapt into a classic southern dessert -- corn pudding. To adjust the recipe for dessert:\nAdd 1/2 cup sugar, 4 beaten eggs, and 1/2 cup milk. Cook at 400\u00baF for 1 hour."
        }
      ]
    }
  ],
  "text":" Making Corn Casserole Preheat your oven to 350\u00baF.  Melt your butter in a microwavable glass dish. Liquefy the butter with short, 30 second intervals. The butter does not need to be hot, just completely melted. Mix the corns, sour cream, corn muffin mixes, butter, and salt in a large bowl. Using a whisk or spatula, blend all of the ingredients together so that they are combined with no chunks of muffin mix or sour cream. If you want to add spices like garlic powder, black pepper, or hot sauce, add them now. Lightly grease a 9x13 inch baking dish. Using cooking spray or a small pat of butter, grease an oven-safe dish so that the casserole does not stick when you serve it. You can use a paper towel to evenly spread a light coating of butter across the dish. Spoon the casserole mix into the dish. Once all of the mixture is in the bowl, use a rubber spatula or spoon to evenly distribute it across the pan. The top should be relatively flat. Bake for 45-60 minutes. When done, the casserole will be a light golden brown on top. If you prefer a heartier, drier casserole than you can leave it in the oven for closer to an hour. Sprinkle shredded cheese on top before serving. You can also add the cheese as the casserole finishes cooking -- just apply the cheese to the top of the casserole 5 minutes before you plan on taking it out of the oven. Variations Coat the top of the casserole with breadcrumbs before cooking. This will create a crunchy, tasty crust on the top of the casserole that complements the soft interior perfectly. Add eggs to the batter to cook a richer casserole. Many casserole recipes call for eggs because the fat and protein binds the ingredients together, leading to a richer tasting casserole. To add eggs, beat them together with a whisk and add them directly into the casserole with the other ingredients. Never add the eggs to the hot butter, as this can partially cook them before they mix in with everything. Add cream cheese or shredded cheddar for a cheesy, decadent corn casserole. Simply add the cheese to the rest of the ingredients as you blend them in. You can soften cream cheese to make it easier to mix by leaving it on the counter 20-30 minutes before you begin to cook. Try out a spicy Mexican corn casserole. This variation on corn casserole makes a great side dish at parties and sporting events. To make it, add 1/2 cup diced jalapenos, bell peppers and green onions to the mix along with a tablespoon of garlic powder, chili powder, and/or crushed chipotle. Top the casserole with 1 cup of shredded pepper jack or cheddar cheese for the last 5 minutes of cooking for a gooey, cheesy upper crust. Add cooked bacon and chopped scallions for a decadent side dish. This rich but tasty version of corn casserole requires 4-5 chopped slices of bacon and 1/2 cup chopped scallions tossed in with the other ingredients. However, the casserole will not get hot enough to cook the bacon, so you need to cook the bacon beforehand. Garnish with cheddar cheese and/or a handful of fresh scallions. Sweeten the recipe to make a corn pudding dessert. The natural sweetness of the corn makes it easy to adapt into a classic southern dessert -- corn pudding. To adjust the recipe for dessert:\nAdd 1/2 cup sugar, 4 beaten eggs, and 1/2 cup milk. Cook at 400\u00baF for 1 hour.",
  "tyn_model":[
    "butter",
    "eggs",
    "bacon",
    "oven",
    "scallions",
    "sour cream",
    "whisk",
    "garlic powder",
    "cream cheese",
    "corn pudding",
    "corn casserole",
    "microwavable glass dish",
    "corns",
    "corn muffin mixes",
    "salt",
    "large bowl",
    "spatula",
    "muffin mix",
    "black pepper",
    "hot sauce",
    "baking dish",
    "cooking spray",
    "paper towel",
    "bowl",
    "rubber spatula",
    "spoon",
    "shredded cheese",
    "breadcrumbs",
    "jalapenos",
    "bell peppers",
    "green onions",
    "chili powder",
    "pepper jack or cheddar cheese",
    "cheddar",
    "corn",
    "sugar",
    "milk"
  ],
  "tyn_section":[

  ]
}