{
  "title":"How to Make Veal Osso Buco",
  "url":"https://www.wikihow.com/Make-Veal-Osso-Buco",
  "category_hierarchy":[
    "Food and Entertaining",
    "Recipes",
    "Meat"
  ],
  "methods":[
    {
      "name":"Making an Easy Veal Osso Buco",
      "steps":[
        {
          "headline":"Pre-heat the oven to 350F.",
          "description":"Veal osso buco is a braised dish, meaning it is cooked over direct heat (stovetop) and then slowly finished by cooking in a liquid bath (oven), keeping the meat tender. While you'll start the dish on the stovetop, you want the oven to be ready for you."
        },
        {
          "headline":"Season your veal shanks with salt and pepper, then dust lightly with flour.",
          "description":"Rub salt and ground black pepper on all sides of the veal shanks. Place a small amount of flour on a plate and then dip the veal shanks into it, brushing off any excess. You simply want a thin dusting of flour."
        },
        {
          "headline":"Warm up 2 tablespoons of olive oil on medium heat in a large dutch oven.",
          "description":"Dutch ovens are the thick, heavy pots with an enamel coating over them. The come with big heavy lids and are safe for the both the stovetop and the stove. The oil should sizzle as soon as the meat hits it, otherwise it was not hot enough yet."
        },
        {
          "headline":"Cook all sides of the veal until browned, about 10 minutes per shank.",
          "description":"You'll likely have to cook them veal in two batches. Once the oil is hot, put the veal in and let it cook for 4-5 minutes before turning. When each piece is evenly browned on the outside, return it to a clean plate to wait. Remember -- this is only browning the outsides. The meat is not finished cooking yet, and you don't want to overcook it on the stove."
        },
        {
          "headline":"Melt 1-2 tablespoons of butter into the pot.",
          "description":"With the veal finished, it is time to make your vegetable braising sauce. The butter will provide some fat and creaminess to cook the veggies in."
        },
        {
          "headline":"Add one small diced onion, one diced carrot, and one diced celery stalk to the pot and cook until tender.",
          "description":"Add a pinch of salt as the veggies hit the pan, then stir and cook for 5-6 minutes, or until everything is soft and translucent. Depending on your stove, this could take up to 10 minutes, so don't rush it. If you're a fan of garlic, 2-3 whole peeled cloves as well, cooking with everything else. Some recipes also call for 1 chopped leak, if you desire it."
        },
        {
          "headline":"Add the wine, bringing to a brief boil, and let it cook for about two minutes.",
          "description":"You want to let the wine cook until about half of it is gone. As soon as it hits the pan, use your wooden spoon to scrape up the browned, cooked bits on the bottom of the pot. This process is called \"deglazing.\" While red wine is more traditional, white makes a slightly different, but equally delicious, dish."
        },
        {
          "headline":"Add your stock, canned tomato, thyme, rosemary, and bay leaves, then nestle in the veal shanks.",
          "description":"Start with the rest of your ingredients, then tuck the veal in so that they are almost completely surrounded and covered with liquid. The pot will be packed, but that is a good thing. Make sure the liquid covered at least three-quarters of each shank."
        },
        {
          "headline":"Bring to a boil, cover the pot, then transfer everything quickly to the preheated oven.",
          "description":"Bring your liquid around the veal to a boil, then cut the heat to the stove. Cover the pot and slide it into the oven for an hour."
        },
        {
          "headline":"Flip the veal shanks after an hour of cooking, then cook for another hour.",
          "description":"Use this time to look at the liquid as well. If it is getting low (lower than three-quarters down the veal), add another half cup or so of stock to bring the levels back up."
        },
        {
          "headline":"Remove the veal once it is tender enough to tear apart with a fork.",
          "description":"Place it on a platter and cover it loosely with tin foil. The meat should be unbelievably tender, with the veal falling off the bone and the meat pulling away without resistance. Once it's done, turn off the oven and pull the veal shanks out, setting aside. Meat should always \"stand\" after cooking. As it cools, liquid inside the meat reabsorbs into the protein fibers, leading to a more tender and flavorful dish."
        },
        {
          "headline":"Cook the remaining liquid back on the stovetop on medium heat until it thickens to your liking.",
          "description":"This usually only takes 4-5 minutes, depending on how thick you like your osso buco, so don't worry about the veal getting cold. Since the sauce pours right on top of the meat, you don't want it to be watery-thin. Furthermore, the longer sauce cooks, the richer and more flavorful it becomes. If you've overcooked it a bit, never fear! A quarter-cup of water stirred in over low heat will bring it back to life."
        },
        {
          "headline":"Plate one veal shank per person, topping with vegetables and sauce just before serving.",
          "description":"Simply ladle up a heap of your braising vegetables and liquid and pour it over the meat to serve it. Alternatively, place the veal shanks back in the liquid and serve the whole thing family style, letting the meat fall off the bone and into the delicious serving sauce."
        }
      ]
    },
    {
      "name":"Taking Your Dish to the Next Level",
      "steps":[
        {
          "headline":"Tie the shanks up before cooking to keep the shanks together and prevent falling apart.",
          "description":"Simply use some kitchen twine to tie the veal shanks up across the width. The goal is to bind the meat to the bone in the center, which will keep it intact for a full shank per person. Cut the twine off right before serving."
        },
        {
          "headline":"Create a fragrant bouquet garni to impart a subtle herbal flavor.",
          "description":"This french technique isn't as difficult as it seems. To make one, simply combine the following herbs in a loose-leaf tea bag, tied up cheesecloth, or muslin bag. Tie the bag up tightly and dunk it into the liquid as it cooks, then remove it once the veal comes out of the oven. This allows you to get all of the herbal flavors without the strands of loose herbs and greens in the sauce."
        },
        {
          "headline":"Serve the classic dish with its famous topping, a fresh gremolata.",
          "description":"This simple parsley-based topping will be served with just about any restaurant osso buco you can find, and you can whip it up quickly and easily at home for a fresh green condiment. To make gremolata:\nPeel an entire lemon. Mince the peels into small pieces\nFinely mince three cloves of fresh garlic\nChop 1/4 cup fresh parsley. Combine garlic, lemon peel, and parsley. Chill for 30 minutes and use."
        },
        {
          "headline":"Choose your deglazing liquids wisely to vary the taste of your dish.",
          "description":"Deglazing is the wine you pour right after the tomato paste, helping you scrape up the flavorful brown bits on the bottom of the pan to make your veal sauce. Depending on your tastes, you can use a variety of liquids, and which one you use will affect the final flavor:\n\nWhite wine tends to be lighter and crisper, frequently with citrus tones. Red wine tends to have a deeper, more savory flavor, lending more richness to the dish\nSmell a wine before adding it -- the flavors and scents you pick up will subtly influence the final dish."
        },
        {
          "headline":"Strain and clarify the braising liquid for a smooth, restaurant-quality sauce.",
          "description":"This step is definitely optional, but will  take your osso buco to the next level. Once the dish leaves the oven, let it cool slowly to room temperature. When done, remove the shanks and strain the liquid through a fine mesh strainer, saving the vegetables for later. You can then bring the sauce to a boil quickly, reducing the heat after it boils and simmering for 10-15 minutes. As it does, use a skimmer or spoon to remove any foam or grease from the surface. After the sauce has thickened, add the veggies and veal back in and warm together before serving."
        }
      ]
    }
  ],
  "text":" Making an Easy Veal Osso Buco Pre-heat the oven to 350F. Veal osso buco is a braised dish, meaning it is cooked over direct heat (stovetop) and then slowly finished by cooking in a liquid bath (oven), keeping the meat tender. While you'll start the dish on the stovetop, you want the oven to be ready for you. Season your veal shanks with salt and pepper, then dust lightly with flour. Rub salt and ground black pepper on all sides of the veal shanks. Place a small amount of flour on a plate and then dip the veal shanks into it, brushing off any excess. You simply want a thin dusting of flour. Warm up 2 tablespoons of olive oil on medium heat in a large dutch oven. Dutch ovens are the thick, heavy pots with an enamel coating over them. The come with big heavy lids and are safe for the both the stovetop and the stove. The oil should sizzle as soon as the meat hits it, otherwise it was not hot enough yet. Cook all sides of the veal until browned, about 10 minutes per shank. You'll likely have to cook them veal in two batches. Once the oil is hot, put the veal in and let it cook for 4-5 minutes before turning. When each piece is evenly browned on the outside, return it to a clean plate to wait. Remember -- this is only browning the outsides. The meat is not finished cooking yet, and you don't want to overcook it on the stove. Melt 1-2 tablespoons of butter into the pot. With the veal finished, it is time to make your vegetable braising sauce. The butter will provide some fat and creaminess to cook the veggies in. Add one small diced onion, one diced carrot, and one diced celery stalk to the pot and cook until tender. Add a pinch of salt as the veggies hit the pan, then stir and cook for 5-6 minutes, or until everything is soft and translucent. Depending on your stove, this could take up to 10 minutes, so don't rush it. If you're a fan of garlic, 2-3 whole peeled cloves as well, cooking with everything else. Some recipes also call for 1 chopped leak, if you desire it. Add the wine, bringing to a brief boil, and let it cook for about two minutes. You want to let the wine cook until about half of it is gone. As soon as it hits the pan, use your wooden spoon to scrape up the browned, cooked bits on the bottom of the pot. This process is called \"deglazing.\" While red wine is more traditional, white makes a slightly different, but equally delicious, dish. Add your stock, canned tomato, thyme, rosemary, and bay leaves, then nestle in the veal shanks. Start with the rest of your ingredients, then tuck the veal in so that they are almost completely surrounded and covered with liquid. The pot will be packed, but that is a good thing. Make sure the liquid covered at least three-quarters of each shank. Bring to a boil, cover the pot, then transfer everything quickly to the preheated oven. Bring your liquid around the veal to a boil, then cut the heat to the stove. Cover the pot and slide it into the oven for an hour. Flip the veal shanks after an hour of cooking, then cook for another hour. Use this time to look at the liquid as well. If it is getting low (lower than three-quarters down the veal), add another half cup or so of stock to bring the levels back up. Remove the veal once it is tender enough to tear apart with a fork. Place it on a platter and cover it loosely with tin foil. The meat should be unbelievably tender, with the veal falling off the bone and the meat pulling away without resistance. Once it's done, turn off the oven and pull the veal shanks out, setting aside. Meat should always \"stand\" after cooking. As it cools, liquid inside the meat reabsorbs into the protein fibers, leading to a more tender and flavorful dish. Cook the remaining liquid back on the stovetop on medium heat until it thickens to your liking. This usually only takes 4-5 minutes, depending on how thick you like your osso buco, so don't worry about the veal getting cold. Since the sauce pours right on top of the meat, you don't want it to be watery-thin. Furthermore, the longer sauce cooks, the richer and more flavorful it becomes. If you've overcooked it a bit, never fear! A quarter-cup of water stirred in over low heat will bring it back to life. Plate one veal shank per person, topping with vegetables and sauce just before serving. Simply ladle up a heap of your braising vegetables and liquid and pour it over the meat to serve it. Alternatively, place the veal shanks back in the liquid and serve the whole thing family style, letting the meat fall off the bone and into the delicious serving sauce. Taking Your Dish to the Next Level Tie the shanks up before cooking to keep the shanks together and prevent falling apart. Simply use some kitchen twine to tie the veal shanks up across the width. The goal is to bind the meat to the bone in the center, which will keep it intact for a full shank per person. Cut the twine off right before serving. Create a fragrant bouquet garni to impart a subtle herbal flavor. This french technique isn't as difficult as it seems. To make one, simply combine the following herbs in a loose-leaf tea bag, tied up cheesecloth, or muslin bag. Tie the bag up tightly and dunk it into the liquid as it cooks, then remove it once the veal comes out of the oven. This allows you to get all of the herbal flavors without the strands of loose herbs and greens in the sauce. Serve the classic dish with its famous topping, a fresh gremolata. This simple parsley-based topping will be served with just about any restaurant osso buco you can find, and you can whip it up quickly and easily at home for a fresh green condiment. To make gremolata:\nPeel an entire lemon. Mince the peels into small pieces\nFinely mince three cloves of fresh garlic\nChop 1/4 cup fresh parsley. Combine garlic, lemon peel, and parsley. Chill for 30 minutes and use. Choose your deglazing liquids wisely to vary the taste of your dish. Deglazing is the wine you pour right after the tomato paste, helping you scrape up the flavorful brown bits on the bottom of the pan to make your veal sauce. Depending on your tastes, you can use a variety of liquids, and which one you use will affect the final flavor:\n\nWhite wine tends to be lighter and crisper, frequently with citrus tones. Red wine tends to have a deeper, more savory flavor, lending more richness to the dish\nSmell a wine before adding it -- the flavors and scents you pick up will subtly influence the final dish. Strain and clarify the braising liquid for a smooth, restaurant-quality sauce. This step is definitely optional, but will  take your osso buco to the next level. Once the dish leaves the oven, let it cool slowly to room temperature. When done, remove the shanks and strain the liquid through a fine mesh strainer, saving the vegetables for later. You can then bring the sauce to a boil quickly, reducing the heat after it boils and simmering for 10-15 minutes. As it does, use a skimmer or spoon to remove any foam or grease from the surface. After the sauce has thickened, add the veggies and veal back in and warm together before serving.",
  "tyn_model":[
    "veal",
    "oven",
    "pot",
    "wine",
    "flour",
    "garlic",
    "vegetables",
    "parsley",
    "salt",
    "plate",
    "stove",
    "oil",
    "butter",
    "red wine",
    "stock",
    "osso buco",
    "lemon",
    "veal osso buco",
    "salt and pepper",
    "ground black pepper",
    "olive oil",
    "dutch oven",
    "dutch ovens",
    "vegetable braising sauce",
    "onion",
    "carrot",
    "celery",
    "wooden spoon",
    "canned tomato",
    "thyme",
    "rosemary",
    "bay",
    "fork",
    "platter",
    "tin foil",
    "stovetop",
    "water",
    "sauce",
    "serving sauce",
    "kitchen twine",
    "twine",
    "herbs",
    "loose-leaf tea bag",
    "muslin bag",
    "tomato",
    "liquids",
    "white wine",
    "fine mesh strainer",
    "skimmer",
    "spoon",
    "veggies"
  ],
  "tyn_section":[

  ]
}