{
  "title":"How to Beat Minecraft",
  "url":"https://www.wikihow.com/Beat-Minecraft",
  "category_hierarchy":[
    "Hobbies and Crafts",
    "Games",
    "Video Games",
    "PC Games",
    "Online Games",
    "Minecraft"
  ],
  "parts":[
    {
      "name":"Gathering Supplies",
      "steps":[
        {
          "headline":"Stockpile supplies.",
          "description":"This is a pretty crucial step, and there are several very specific supplies you will need to locate the stronghold, and to access the end game. For this tutorial you will need to have at least basic knowledge of the ins and outs of Minecraft."
        },
        {
          "headline":"Mine ores.",
          "description":"You will need to find at least 5 diamonds, 64 iron, and several stacks of coal. You will need seven diamonds if you want a sword, pickaxe and an enchantment table, and even more if you want armor. This step could take a very long time."
        },
        {
          "headline":"Craft tools and armor.",
          "description":"You will need at least 1 diamond sword, 1 diamond pick, 1 full set of iron armor, a bow, arrows, and several stacks of torches."
        },
        {
          "headline":"Mine obsidian.",
          "description":"You will need it for the Nether portal. Only diamond picks can mine obsidian. You can also use obsidian in the crafting of an enchantment table, which can help a lot when fighting the dragon or simply playing the game in general."
        },
        {
          "headline":"Gather Enderpearls.",
          "description":"Enderpearls can be gathered by killing endermen. Enderpearls have several uses so gather at least 20 of them. Some of their uses are:\nTeleportation. Right-click with an ender pearl selected to throw the ender pearl, and be teleported to its landing site. This can be quite useful in areas such as ravines, large caves, and the Nether. Eye of Ender ingredient. You use ender pearls to craft ender eyes."
        },
        {
          "headline":"Craft Eyes of Ender.",
          "description":"These are crucial in helping you locate and unlock the endgame. You can craft an Eye of Ender by combining blaze powder and an ender pearl in the crafting grid. This is a shapeless recipe, and the ingredients can be placed anywhere in the crafting grid. Blaze powder is crafted by dropping a blaze rod anywhere in the crafting grid."
        }
      ]
    },
    {
      "name":"Using Nether Portals",
      "steps":[
        {
          "headline":"Build and light a Nether Portal.",
          "description":"To create a Nether Portal, you'll need at least ten obsidian blocks. Make a hollow standing rectangle, 5 blocks high and 4 blocks long (corners are not necessary; you can use any block as a stand-in). Then strike the inside of the rectangle with flint and steel. The empty inner space should turn purple and start to make interesting sounds."
        },
        {
          "headline":"Enter the Nether.",
          "description":"Stand in the portal and wait 4 seconds to be transported into the Nether. Make sure you have your flint and steel for relighting the portal in case it breaks from a ghast and plenty of food to keep yourself well-fed."
        },
        {
          "headline":"Find a Nether Fortress.",
          "description":"A Nether Fortress is a structure in the Nether that contains Nether Wart and a Blaze spawner. They can be somewhat hard to find, so it could take a while."
        },
        {
          "headline":"Kill Blazes and gather Nether Wart.",
          "description":"Blazes drop Blaze rods, which are needed for making potions and getting to the endgame. You will need a lot of Blaze rods. Nether Wart is a key ingredient in potions, and it only grows on Soul Sand, so collect some Soul Sand (it's brown with a face-like pattern) and try farming it in your base. Nether Wart can be found naturally occurring in nether fortresses in two small patches alongside stairs going upwards."
        },
        {
          "headline":"Craft a brewing stand.",
          "description":"This will let you brew potions, which will help during the final boss fight."
        }
      ]
    },
    {
      "name":"Locating a Stronghold",
      "steps":[
        {
          "headline":"Throw an Eye of Ender.",
          "description":"It will fly up and move in the direction of the nearest stronghold, a very rare underground structure. You throw an Eye of Ender by right-clicking while holding the Eye (or by tapping \"Use\" on Pocket Edition)."
        },
        {
          "headline":"Repeat the previous step until a stronghold is located.",
          "description":"You will know you have found a stronghold when the Eye of Ender starts flying towards the ground. The Eyes have a 1 in 5 chance of being destroyed after each use so bring a lot of them."
        },
        {
          "headline":"Excavate the stronghold.",
          "description":"You will probably have to dig a bit to find the stronghold."
        },
        {
          "headline":"Secure the area.",
          "description":"The stronghold will be full of mobs, so clear it out and light it up. Don't dig straight down, as the End Portal frame is suspended directly over a shallow lava pool! If you aren't above the frame itself, you could fall into a deep dark cave and take fall damage, along with a potential attack from various hostile monsters."
        }
      ]
    },
    {
      "name":"Entering the End",
      "steps":[
        {
          "headline":"Locate an End Portal.",
          "description":"Each stronghold has exactly one End Portal. This is what you will use to get to The End."
        },
        {
          "headline":"Activate the Portal.",
          "description":"You activate the portal by filling the \"frame\" with Eyes of Ender. To do this, equip the eye, then use an empty block on the frame. Repeat this until all twelve blocks contain eyes."
        },
        {
          "headline":"Jump into the Portal.",
          "description":"This will take you to The End. You will not be harmed by the lava under the portal when you are jumping into an activated portal, but if it is not activated you will likely burn to death and lose all your equipment!"
        }
      ]
    },
    {
      "name":"Fighting the Dragon",
      "steps":[
        {
          "headline":"Get ready to fight the boss.",
          "description":"The End boss is called the Ender Dragon. She (yes, she was officially confirmed to be female) flies around the End skies. You must kill her to beat the game. Watch out for Endermen, they spawn heavily in this dimension. Saving, exiting, and reloading while in the End, if you have not yet killed the dragon, will cause a second dragon to spawn. Make sure you have enough time to finish the battle."
        },
        {
          "headline":"Locate the dragon.",
          "description":"She may take a moment to appear, so take this time to prepare, by sorting your inventory and such. You may spawn underground. If this is the case, just dig your way out."
        },
        {
          "headline":"Destroy the Ender Crystals.",
          "description":"These crystals, located atop the obsidian towers in the End, heal the Ender Dragon. You can destroy them with any attack, including a snowball. Using a close-range weapon is not recommended, since the crystals explode when hit. Some crystals are defended by iron bars."
        },
        {
          "headline":"Kill the dragon.",
          "description":"You can damage the dragon using a sword, bow and arrows, or explosive items. The dragon is immune to lava, fire, and splash potions, but potions that buff your stats are very useful. Since trying to sleep in the End or Nether results in an explosion, you can use beds to damage the ender dragon. Just place it in front of you, stand back, and then try to sleep when the dragon comes close. In Computer Edition, the dragon is invulnerable to arrows while it is perched on top of the  portal."
        },
        {
          "headline":"Collect the loot.",
          "description":"The Enderdragon drops up to 70 levels of XP, and opens the exit portal."
        },
        {
          "headline":"Jump into the exit portal.",
          "description":""
        },
        {
          "headline":"Beat the Game!",
          "description":"Now you have \"beaten Minecraft,\" you'll spawn in your world's normal spawn after the credits, with all of your gear and a large number of extra experience levels! You can go back to the End whenever you want now, provided you can reach the portal. Several valuable things can be found there, such as the Endermen and their valuable Ender Pearls, and the Obsidian and End Stone blocks, which are some of the most blast-resistant blocks in the game that you can use. The 1.9 update to the Java Edition (known as the Combat Update) added End Cities and End Ships."
        }
      ]
    }
  ],
  "text":" Gathering Supplies Stockpile supplies. This is a pretty crucial step, and there are several very specific supplies you will need to locate the stronghold, and to access the end game. For this tutorial you will need to have at least basic knowledge of the ins and outs of Minecraft. Mine ores. You will need to find at least 5 diamonds, 64 iron, and several stacks of coal. You will need seven diamonds if you want a sword, pickaxe and an enchantment table, and even more if you want armor. This step could take a very long time. Craft tools and armor. You will need at least 1 diamond sword, 1 diamond pick, 1 full set of iron armor, a bow, arrows, and several stacks of torches. Mine obsidian. You will need it for the Nether portal. Only diamond picks can mine obsidian. You can also use obsidian in the crafting of an enchantment table, which can help a lot when fighting the dragon or simply playing the game in general. Gather Enderpearls. Enderpearls can be gathered by killing endermen. Enderpearls have several uses so gather at least 20 of them. Some of their uses are:\nTeleportation. Right-click with an ender pearl selected to throw the ender pearl, and be teleported to its landing site. This can be quite useful in areas such as ravines, large caves, and the Nether. Eye of Ender ingredient. You use ender pearls to craft ender eyes. Craft Eyes of Ender. These are crucial in helping you locate and unlock the endgame. You can craft an Eye of Ender by combining blaze powder and an ender pearl in the crafting grid. This is a shapeless recipe, and the ingredients can be placed anywhere in the crafting grid. Blaze powder is crafted by dropping a blaze rod anywhere in the crafting grid. Using Nether Portals Build and light a Nether Portal. To create a Nether Portal, you'll need at least ten obsidian blocks. Make a hollow standing rectangle, 5 blocks high and 4 blocks long (corners are not necessary; you can use any block as a stand-in). Then strike the inside of the rectangle with flint and steel. The empty inner space should turn purple and start to make interesting sounds. Enter the Nether. Stand in the portal and wait 4 seconds to be transported into the Nether. Make sure you have your flint and steel for relighting the portal in case it breaks from a ghast and plenty of food to keep yourself well-fed. Find a Nether Fortress. A Nether Fortress is a structure in the Nether that contains Nether Wart and a Blaze spawner. They can be somewhat hard to find, so it could take a while. Kill Blazes and gather Nether Wart. Blazes drop Blaze rods, which are needed for making potions and getting to the endgame. You will need a lot of Blaze rods. Nether Wart is a key ingredient in potions, and it only grows on Soul Sand, so collect some Soul Sand (it's brown with a face-like pattern) and try farming it in your base. Nether Wart can be found naturally occurring in nether fortresses in two small patches alongside stairs going upwards. Craft a brewing stand. This will let you brew potions, which will help during the final boss fight. Locating a Stronghold Throw an Eye of Ender. It will fly up and move in the direction of the nearest stronghold, a very rare underground structure. You throw an Eye of Ender by right-clicking while holding the Eye (or by tapping \"Use\" on Pocket Edition). Repeat the previous step until a stronghold is located. You will know you have found a stronghold when the Eye of Ender starts flying towards the ground. The Eyes have a 1 in 5 chance of being destroyed after each use so bring a lot of them. Excavate the stronghold. You will probably have to dig a bit to find the stronghold. Secure the area. The stronghold will be full of mobs, so clear it out and light it up. Don't dig straight down, as the End Portal frame is suspended directly over a shallow lava pool! If you aren't above the frame itself, you could fall into a deep dark cave and take fall damage, along with a potential attack from various hostile monsters. Entering the End Locate an End Portal. Each stronghold has exactly one End Portal. This is what you will use to get to The End. Activate the Portal. You activate the portal by filling the \"frame\" with Eyes of Ender. To do this, equip the eye, then use an empty block on the frame. Repeat this until all twelve blocks contain eyes. Jump into the Portal. This will take you to The End. You will not be harmed by the lava under the portal when you are jumping into an activated portal, but if it is not activated you will likely burn to death and lose all your equipment! Fighting the Dragon Get ready to fight the boss. The End boss is called the Ender Dragon. She (yes, she was officially confirmed to be female) flies around the End skies. You must kill her to beat the game. Watch out for Endermen, they spawn heavily in this dimension. Saving, exiting, and reloading while in the End, if you have not yet killed the dragon, will cause a second dragon to spawn. Make sure you have enough time to finish the battle. Locate the dragon. She may take a moment to appear, so take this time to prepare, by sorting your inventory and such. You may spawn underground. If this is the case, just dig your way out. Destroy the Ender Crystals. These crystals, located atop the obsidian towers in the End, heal the Ender Dragon. You can destroy them with any attack, including a snowball. Using a close-range weapon is not recommended, since the crystals explode when hit. Some crystals are defended by iron bars. Kill the dragon. You can damage the dragon using a sword, bow and arrows, or explosive items. The dragon is immune to lava, fire, and splash potions, but potions that buff your stats are very useful. Since trying to sleep in the End or Nether results in an explosion, you can use beds to damage the ender dragon. Just place it in front of you, stand back, and then try to sleep when the dragon comes close. In Computer Edition, the dragon is invulnerable to arrows while it is perched on top of the  portal. Collect the loot. The Enderdragon drops up to 70 levels of XP, and opens the exit portal. Jump into the exit portal.  Beat the Game! Now you have \"beaten Minecraft,\" you'll spawn in your world's normal spawn after the credits, with all of your gear and a large number of extra experience levels! You can go back to the End whenever you want now, provided you can reach the portal. Several valuable things can be found there, such as the Endermen and their valuable Ender Pearls, and the Obsidian and End Stone blocks, which are some of the most blast-resistant blocks in the game that you can use. The 1.9 update to the Java Edition (known as the Combat Update) added End Cities and End Ships.",
  "tyn_model":[
    "dragon",
    "ender",
    "obsidian",
    "potions",
    "sword",
    "enderpearls",
    "ender pearl",
    "blaze powder",
    "flint",
    "steel",
    "blaze rods",
    "lava",
    "ender dragon",
    "ores",
    "diamonds",
    "iron",
    "coal",
    "pickaxe",
    "tools",
    "armor",
    "bow",
    "arrows",
    "torches",
    "diamond picks",
    "ender pearls",
    "blaze rod",
    "obsidian blocks",
    "food",
    "nether wart",
    "sand",
    "soul sand",
    "portal",
    "obsidian towers",
    "snowball",
    "beds",
    "enderdragon",
    "end stone"
  ],
  "tyn_section":[

  ]
}