{
  "title":"How to Make Air Dry Clay",
  "url":"https://www.wikihow.com/Make-Air-Dry-Clay",
  "category_hierarchy":[
    "Hobbies and Crafts",
    "Crafts",
    "Clay Projects",
    "Making Clay"
  ],
  "methods":[
    {
      "name":"Making Clay from Scratch",
      "steps":[
        {
          "headline":"Gather your supplies.",
          "description":"This recipe for air dry clay can be made with ingredients you probably already have around the house. Check your pantry and assemble the following supplies:\n2 cups baking soda\n1 cup cornstarch\n1 1/2 cups cold water\nFood coloring (gel or liquid)\nOld pot\nWhisk\nBowl"
        },
        {
          "headline":"Add the baking soda and cornstarch to the pot.",
          "description":"Use a spoon or a whisk to stir them together until the mixture is completely incorporated."
        },
        {
          "headline":"Stir in the water.",
          "description":"Whisk it until you no longer see any lumps, and the mixture is completely smooth."
        },
        {
          "headline":"Stir in the food coloring.",
          "description":"Add a few drops of food coloring to change the dough from white to red, blue, green, orange, or any other color you like. Just a few drops will turn the dough a pastel color. If you want a deeper color, add more food coloring until you're happy with the way it looks."
        },
        {
          "headline":"Heat the dough over medium heat.",
          "description":"Stir it constantly as it heats to keep it from sticking to the bottom of the pot."
        },
        {
          "headline":"Whisk the dough until it thickens.",
          "description":"It will begin to bubble, then thicken and form a ball after about five minutes of whisking. When it's difficult to move the whisk through the dough, remove it from heat."
        },
        {
          "headline":"Cool the dough.",
          "description":"Transfer the hot dough to a bowl. Cover it with a wet dishcloth to keep the atmosphere in the bowl moist, and let it sit until the dough is completely cool."
        },
        {
          "headline":"Knead the dough until it's smooth.",
          "description":"As you knead, pay attention to the texture. If the dough seems sticky, add more cornstarch to help it thicken. If it's too thick, knead in a teaspoon of water."
        },
        {
          "headline":"Mold and dry the dough.",
          "description":"Make stars, fake food, dinosaurs, Christmas decorations or flowers. The sky's the limit! When you're finished, set your creations on a tray to dry. This clay may take 24 to 48 hours to completely dry. When it's dry, you can decorate the object with acrylic paint."
        }
      ]
    },
    {
      "name":"Making Clay with Glue",
      "steps":[
        {
          "headline":"Gather your supplies.",
          "description":"This quick, no-cook recipe is a great go-to choice when you don't want to spend much time putting your clay together. All you need are the following supplies:\n2 cups cornstarch\n1 cup white school glue\nFood coloring (gel or liquid)\nBowl"
        },
        {
          "headline":"Put the cornstarch in the bowl.",
          "description":"2 cups is a good amount to start with. With this simple recipe, you can easily add more; you'll just need more glue as well."
        },
        {
          "headline":"Add the glue slowly.",
          "description":"Add small amounts of glue to the container while stirring. Keep adding glue until the mixture reaches a good consistency\u2014it should end up being about two parts cornstarch, one part glue. If it's too crumbly, add more glue. If it's too sticky, add more cornstarch."
        },
        {
          "headline":"Color your clay.",
          "description":"Add food coloring to the bowl and knead it in with your hands. If you want the clay to have a richer hue, add more coloring until it looks the way you want it to. If you want to make clay in several colors, separate the batch into two or more parts and color each one separately."
        },
        {
          "headline":"Use the clay.",
          "description":"You can use sandcastle molds and cookie cutters, or you can let your imagination run wild. Once you're satisfied with what you've made, set it in a cool, dry place to harden. In a few hours you can paint it and then voila! Your very own air dry clay creation."
        }
      ]
    },
    {
      "name":"Making Cold Porcelain Clay",
      "steps":[
        {
          "headline":"Gather your supplies.",
          "description":"Cold porcelain clay is a great alternative to polymer air dry clay for craft projects like clay candle holders, jewelry and other small sculpted items. It's a delicate clay that shrinks up a bit as it dries. Here's what you'll need:\n1 cup cornstarch\n1 cup school grade white glue\n2 tablespoons white vinegar\n2 tablespoons canola oil\nPlastic wrap\nMicrowave-safe bowl\nExtra oil so the clay won't stick to your hands"
        },
        {
          "headline":"Place the ingredients in the microwave-safe bowl.",
          "description":"Add the wet ingredients first: the glue, vinegar and canola oil. Then stir in the cornstarch until the mixture is completely smooth with no lumps. The texture will be gooey."
        },
        {
          "headline":"Microwave on high for 15 seconds.",
          "description":"Remove the bowl and stir the mixture, which will be hot and still gooey."
        },
        {
          "headline":"Microwave on high for another 15 seconds.",
          "description":"Remove the bowl and stir the mixture. The surface should now be slightly firm instead of gooey."
        },
        {
          "headline":"Microwave on high for a third time.",
          "description":"Give it 10 or 15 more seconds, then remove the bowl and check the mixture. The clay should have pulled together to form a sticky, lumpy ball. If the clay still looks gooey, microwave it for another 15 seconds. The finished clay should still be sticky and pliable; if it seems dry, you've overcooked it."
        },
        {
          "headline":"Knead the clay.",
          "description":"After it has cooled for a few moments, oil your hands with cooking oil and knead the clay for about three minutes, until it is smooth and stretchy in texture. Form it into a ball, then pull it apart to test it. The dough is ready when it stretches and forms a peak when you pull off a piece. If it breaks into bits, it's overcooked."
        },
        {
          "headline":"Wrap it in plastic wrap for storage.",
          "description":"If you're not going to use it right away, store it in tightly-wrapped plastic wrap to keep the moisture content high."
        }
      ]
    }
  ],
  "text":" Making Clay from Scratch Gather your supplies. This recipe for air dry clay can be made with ingredients you probably already have around the house. Check your pantry and assemble the following supplies:\n2 cups baking soda\n1 cup cornstarch\n1 1/2 cups cold water\nFood coloring (gel or liquid)\nOld pot\nWhisk\nBowl Add the baking soda and cornstarch to the pot. Use a spoon or a whisk to stir them together until the mixture is completely incorporated. Stir in the water. Whisk it until you no longer see any lumps, and the mixture is completely smooth. Stir in the food coloring. Add a few drops of food coloring to change the dough from white to red, blue, green, orange, or any other color you like. Just a few drops will turn the dough a pastel color. If you want a deeper color, add more food coloring until you're happy with the way it looks. Heat the dough over medium heat. Stir it constantly as it heats to keep it from sticking to the bottom of the pot. Whisk the dough until it thickens. It will begin to bubble, then thicken and form a ball after about five minutes of whisking. When it's difficult to move the whisk through the dough, remove it from heat. Cool the dough. Transfer the hot dough to a bowl. Cover it with a wet dishcloth to keep the atmosphere in the bowl moist, and let it sit until the dough is completely cool. Knead the dough until it's smooth. As you knead, pay attention to the texture. If the dough seems sticky, add more cornstarch to help it thicken. If it's too thick, knead in a teaspoon of water. Mold and dry the dough. Make stars, fake food, dinosaurs, Christmas decorations or flowers. The sky's the limit! When you're finished, set your creations on a tray to dry. This clay may take 24 to 48 hours to completely dry. When it's dry, you can decorate the object with acrylic paint. Making Clay with Glue Gather your supplies. This quick, no-cook recipe is a great go-to choice when you don't want to spend much time putting your clay together. All you need are the following supplies:\n2 cups cornstarch\n1 cup white school glue\nFood coloring (gel or liquid)\nBowl Put the cornstarch in the bowl. 2 cups is a good amount to start with. With this simple recipe, you can easily add more; you'll just need more glue as well. Add the glue slowly. Add small amounts of glue to the container while stirring. Keep adding glue until the mixture reaches a good consistency\u2014it should end up being about two parts cornstarch, one part glue. If it's too crumbly, add more glue. If it's too sticky, add more cornstarch. Color your clay. Add food coloring to the bowl and knead it in with your hands. If you want the clay to have a richer hue, add more coloring until it looks the way you want it to. If you want to make clay in several colors, separate the batch into two or more parts and color each one separately. Use the clay. You can use sandcastle molds and cookie cutters, or you can let your imagination run wild. Once you're satisfied with what you've made, set it in a cool, dry place to harden. In a few hours you can paint it and then voila! Your very own air dry clay creation. Making Cold Porcelain Clay Gather your supplies. Cold porcelain clay is a great alternative to polymer air dry clay for craft projects like clay candle holders, jewelry and other small sculpted items. It's a delicate clay that shrinks up a bit as it dries. Here's what you'll need:\n1 cup cornstarch\n1 cup school grade white glue\n2 tablespoons white vinegar\n2 tablespoons canola oil\nPlastic wrap\nMicrowave-safe bowl\nExtra oil so the clay won't stick to your hands Place the ingredients in the microwave-safe bowl. Add the wet ingredients first: the glue, vinegar and canola oil. Then stir in the cornstarch until the mixture is completely smooth with no lumps. The texture will be gooey. Microwave on high for 15 seconds. Remove the bowl and stir the mixture, which will be hot and still gooey. Microwave on high for another 15 seconds. Remove the bowl and stir the mixture. The surface should now be slightly firm instead of gooey. Microwave on high for a third time. Give it 10 or 15 more seconds, then remove the bowl and check the mixture. The clay should have pulled together to form a sticky, lumpy ball. If the clay still looks gooey, microwave it for another 15 seconds. The finished clay should still be sticky and pliable; if it seems dry, you've overcooked it. Knead the clay. After it has cooled for a few moments, oil your hands with cooking oil and knead the clay for about three minutes, until it is smooth and stretchy in texture. Form it into a ball, then pull it apart to test it. The dough is ready when it stretches and forms a peak when you pull off a piece. If it breaks into bits, it's overcooked. Wrap it in plastic wrap for storage. If you're not going to use it right away, store it in tightly-wrapped plastic wrap to keep the moisture content high.",
  "tyn_model":[
    "clay",
    "bowl",
    "cornstarch",
    "glue",
    "food coloring",
    "whisk",
    "plastic wrap",
    "baking soda",
    "pot",
    "water",
    "canola oil",
    "microwave-safe bowl",
    "cold water",
    "old pot",
    "spoon",
    "tray",
    "acrylic paint",
    "white school glue",
    "\u2014it",
    "cold porcelain clay",
    "white glue",
    "white vinegar",
    "oil",
    "vinegar",
    "microwave",
    "cooking oil"
  ],
  "tyn_section":[

  ]
}