{
  "title":"How to Play Pok\u00e9mon",
  "url":"https://www.wikihow.com/Play-Pok%C3%A9mon",
  "category_hierarchy":[
    "Hobbies and Crafts",
    "Games",
    "Video Games",
    "Multi Platform Games",
    "Pokemon Video Games"
  ],
  "methods":[
    {
      "name":"Learning to Play the Pok\u00e9mon TCG",
      "steps":[
        {
          "headline":"Shuffle your deck and draw 7 cards to start the game.",
          "description":"You and your opponent should each have your own deck made up of 60 cards. Don't show anyone your cards after you draw them. Keep them in your hand, and set the rest of the deck facedown in a pile on your righthand side. Although you start with 7 cards, there's no limit to how many cards you can keep in your hand at any time. You draw a new card at the beginning of each turn, and there are additional cards in the deck that let you pick more up. You can also play Pok\u00e9mon TCG online for free and import any physical cards you own. All physical cards come with codes that you can input online to play with the cards and learn more about them. Visit http://www.pokemon.com/us/pokemon-tcg/play-online. This is a great way to practice and learn the rules. Pok\u00e9mon TCG is traditionally a two-player game, but you can search online for three-player variations."
        },
        {
          "headline":"Choose a basic, active Pok\u00e9mon to play with.",
          "description":"The top lefthand corner of your Pok\u00e9mon cards will tell you if your card is \u201cbasic,\u201d \u201cstage 1,\u201d or \u201cstage 2.\u201d Look through the 7 cards you drew, and place your active Pok\u00e9mon in the middle of the playing area before doing anything else with the rest of your cards. If you don't get a basic Pok\u00e9mon in your first 7 cards, you have to discard your hand back into your deck, shuffle the cards, and draw 7 new ones. If that happens, your opponent gets to draw 1 new card from their deck and add it to their hand. There are also EX and GX cards, which have more powers and special abilities. The active Pok\u00e9mon in the middle of the table is the only one that can attack or be attacked. Read your cards thoroughly to understand each Pok\u00e9mon's ability, hit points (how much it takes to \u201cknock them out\u201d), and any weaknesses or resistances."
        },
        {
          "headline":"Bench up to 5 basic Pok\u00e9mon by laying them facedown in front of you.",
          "description":"Once the game play starts, turn your benched cards so they are face up. As the game continues, you can keep benching basic cards\u2014just remember that if you have more than 5, you'll need to keep the extras in your hand. Benched cards are important because you can grow them by giving them energy cards and can swap them out with your main card on any given turn. They also often have useful abilities that can be used from the bench."
        },
        {
          "headline":"Set 6 cards off to the side facedown to be your \u201cprize cards.\u201d Both you and your opponent will draw the top 6 cards from your shuffled deck and lay them facedown on your lefthand side.",
          "description":"Choose one of these cards every time you knock out a Pok\u00e9mon. You can pick up the prize cards in any order you like."
        },
        {
          "headline":"Flip a coin to see who goes first, and draw a card to start your turn.",
          "description":"You can choose if heads or tails will go first. After the winner is decided, they will draw a card from the deck. From there, they can lay down basic cards on their bench, evolve Pok\u00e9mon, play energy cards (only once per turn), trainer cards, use abilities, and remove and replace their active Pok\u00e9mon (only once per turn). If you go first, you can't attack on your first turn, but your opponent can. To evolve: a Pok\u00e9mon has to be in play for a full turn before you can evolve it to the next level, and each Pok\u00e9mon can only be evolved once per turn. You can, however, evolve multiple Pok\u00e9mon in a turn. Break cards: give additional abilities or attacking powers while also allowing you to retain other card attributes. Energy cards: grass, lightning, darkness, fairy, fire, psychic, metal, dragon, water, fighting, and colorless. Match your energy cards to your Pok\u00e9mon cards (they'll have the same color and symbol on them). Trainer cards: items, supporters, and stadiums. Read the rules at the bottom of each card to see how it works. Abilities: listed on each Pok\u00e9mon card."
        },
        {
          "headline":"Attack your opponent's Pok\u00e9mon at the end of your turn.",
          "description":"Check your active Pok\u00e9mon to see how much energy it costs to attack, and then check your opponent's active Pok\u00e9mon to see its weakness level. If you have enough power to attack, put a damage counter on the attacked Pok\u00e9mon. After you attack, your turn is over, and you and your opponent will alternate taking turns until the game is over. If you knock out the Pok\u00e9mon, that card goes into the discard pile and you draw a card from your prize pile. If you attack and knock out an EX or GX Pok\u00e9mon, you receive 2 prize cards instead of 1."
        },
        {
          "headline":"Care for and revive attacked Pok\u00e9mon by moving them to the bench.",
          "description":"After a Pok\u00e9mon is attacked, they will either be asleep, burned, confused, paralyzed, or poisoned (unless they were knocked out\u2014in which case that card goes into the discard pile). Move them to the bench to remove those characteristics. Each special condition is removed or dealt with in a different way, depending on which kind of Pok\u00e9mon was damaged, so make sure to read your cards carefully."
        },
        {
          "headline":"Win the game by getting all your prize cards.",
          "description":"This means you will have attacked and knocked out 6 of your opponent's Pok\u00e9mon. Also, if you knock out all of your opponent's Pok\u00e9mon that are on the table at one time (so the active card as well as any benched cards), then you win, even if they had less than 6 laid out. Additionally, the first person to run out of cards in their draw pile loses even if there are remaining prize cards\u2014 that's the least fun way to win because it ends the game by default!"
        }
      ]
    },
    {
      "name":"Exploring Pok\u00e9mon Video Games",
      "steps":[
        {
          "headline":"Enjoy getting outdoors by playing Pok\u00e9mon Go on your phone.",
          "description":"Download this game from the app store and use it while you walk around your neighborhood, or explore new areas. As you walk, your phone will alert you to when there is a Pok\u00e9mon in the area that you can catch through your phone screen. Evolve Pok\u00e9mon, challenge other players, and collect as many different Pok\u00e9mon as you can! Be careful when playing Pok\u00e9mon Go and pay attention to your surroundings. It can be distracting, so make sure you're safe while you're walking around."
        },
        {
          "headline":"Play on a game console if you like traditional video games.",
          "description":"Nintendo 64, GameCube, and Wii all offer a myriad of Pok\u00e9mon games. If you already have one of these consoles, visit your local video game store to find copies of Pok\u00e9mon games, or search for them online. For example, Pok\u00e9mon XD: Gale of Darkness, Pok\u00e9mon Trozei!, Pok\u00e9mon Battle Revolution, and Pok\u00e9mon X and Y are all fun games that you can play. Nintendo 3DS is a handheld video game option that also has lots of Pok\u00e9mon gaming options."
        },
        {
          "headline":"Download a Pok\u00e9mon app to play on your phone.",
          "description":"Open up your app store and type \u201cPok\u00e9mon\u201d into the search bar to find what games are available for your kind of phone. After you've selected and downloaded one, open it up, follow the onscreen instructions, and enjoy your gaming experience! Pok\u00e9dex 3D, Pok\u00e9mon Bank, Pok\u00e9mon Duel, and Pok\u00e9mon Quest are some of more popular apps."
        },
        {
          "headline":"Use an emulator to play video games on your computer.",
          "description":"An emulator is a type of software that lets your computer screen mimic that of a video game console, like a Nintendo DS. If you use an emulator, you'll most likely have to use a pirated version of the Pok\u00e9mon game you want to play, so keep that in mind. Pok\u00e9mon Emerald, Pok\u00e9mon Crystal, and Pok\u00e9mon Soul Silver are some of the more well-known DS games that are still played on a PC via an emulator."
        },
        {
          "headline":"Play the 3DS Virtual Console if you like handheld video games.",
          "description":"Simply buy a Nintendo 3DS, along with the available Pok\u00e9mon game of your choice. After you load the game, onscreen instructions will pop up to direct you during gameplay. Look online for tips and hints on how to beat difficult levels. Pok\u00e9mon Rumble Blast, Pok\u00e9mon Mystery Dungeon, Pok\u00e9mon X and Y, Pokemon Ultra Sun and Moon, Pok\u00e9mon Battle Trozei, and Pok\u00e9mon Omega Rube and Alpha Sapphire are all fun 3DS games you can play."
        },
        {
          "headline":"Get a hold of a Gameboy to play the 1996 original game.",
          "description":"Although Nintendo no longer produces new Gameboys, you can still buy used and refurbished ones online from places like Amazon and Ebay. You can also find copies of old games, like the original Pok\u00e9mon Red, online. Look for these other Pok\u00e9mon games for Gameboy, too:\nRed, Blue, and Green\nPok\u00e9mon Yellow: Special Pikachu Edition\nPok\u00e9mon Gold and Silver\nPok\u00e9mon Crystal\nPok\u00e9mon Ruby and Sapphire"
        }
      ]
    }
  ],
  "text":" Learning to Play the Pok\u00e9mon TCG Shuffle your deck and draw 7 cards to start the game. You and your opponent should each have your own deck made up of 60 cards. Don't show anyone your cards after you draw them. Keep them in your hand, and set the rest of the deck facedown in a pile on your righthand side. Although you start with 7 cards, there's no limit to how many cards you can keep in your hand at any time. You draw a new card at the beginning of each turn, and there are additional cards in the deck that let you pick more up. You can also play Pok\u00e9mon TCG online for free and import any physical cards you own. All physical cards come with codes that you can input online to play with the cards and learn more about them. Visit http://www.pokemon.com/us/pokemon-tcg/play-online. This is a great way to practice and learn the rules. Pok\u00e9mon TCG is traditionally a two-player game, but you can search online for three-player variations. Choose a basic, active Pok\u00e9mon to play with. The top lefthand corner of your Pok\u00e9mon cards will tell you if your card is \u201cbasic,\u201d \u201cstage 1,\u201d or \u201cstage 2.\u201d Look through the 7 cards you drew, and place your active Pok\u00e9mon in the middle of the playing area before doing anything else with the rest of your cards. If you don't get a basic Pok\u00e9mon in your first 7 cards, you have to discard your hand back into your deck, shuffle the cards, and draw 7 new ones. If that happens, your opponent gets to draw 1 new card from their deck and add it to their hand. There are also EX and GX cards, which have more powers and special abilities. The active Pok\u00e9mon in the middle of the table is the only one that can attack or be attacked. Read your cards thoroughly to understand each Pok\u00e9mon's ability, hit points (how much it takes to \u201cknock them out\u201d), and any weaknesses or resistances. Bench up to 5 basic Pok\u00e9mon by laying them facedown in front of you. Once the game play starts, turn your benched cards so they are face up. As the game continues, you can keep benching basic cards\u2014just remember that if you have more than 5, you'll need to keep the extras in your hand. Benched cards are important because you can grow them by giving them energy cards and can swap them out with your main card on any given turn. They also often have useful abilities that can be used from the bench. Set 6 cards off to the side facedown to be your \u201cprize cards.\u201d Both you and your opponent will draw the top 6 cards from your shuffled deck and lay them facedown on your lefthand side. Choose one of these cards every time you knock out a Pok\u00e9mon. You can pick up the prize cards in any order you like. Flip a coin to see who goes first, and draw a card to start your turn. You can choose if heads or tails will go first. After the winner is decided, they will draw a card from the deck. From there, they can lay down basic cards on their bench, evolve Pok\u00e9mon, play energy cards (only once per turn), trainer cards, use abilities, and remove and replace their active Pok\u00e9mon (only once per turn). If you go first, you can't attack on your first turn, but your opponent can. To evolve: a Pok\u00e9mon has to be in play for a full turn before you can evolve it to the next level, and each Pok\u00e9mon can only be evolved once per turn. You can, however, evolve multiple Pok\u00e9mon in a turn. Break cards: give additional abilities or attacking powers while also allowing you to retain other card attributes. Energy cards: grass, lightning, darkness, fairy, fire, psychic, metal, dragon, water, fighting, and colorless. Match your energy cards to your Pok\u00e9mon cards (they'll have the same color and symbol on them). Trainer cards: items, supporters, and stadiums. Read the rules at the bottom of each card to see how it works. Abilities: listed on each Pok\u00e9mon card. Attack your opponent's Pok\u00e9mon at the end of your turn. Check your active Pok\u00e9mon to see how much energy it costs to attack, and then check your opponent's active Pok\u00e9mon to see its weakness level. If you have enough power to attack, put a damage counter on the attacked Pok\u00e9mon. After you attack, your turn is over, and you and your opponent will alternate taking turns until the game is over. If you knock out the Pok\u00e9mon, that card goes into the discard pile and you draw a card from your prize pile. If you attack and knock out an EX or GX Pok\u00e9mon, you receive 2 prize cards instead of 1. Care for and revive attacked Pok\u00e9mon by moving them to the bench. After a Pok\u00e9mon is attacked, they will either be asleep, burned, confused, paralyzed, or poisoned (unless they were knocked out\u2014in which case that card goes into the discard pile). Move them to the bench to remove those characteristics. Each special condition is removed or dealt with in a different way, depending on which kind of Pok\u00e9mon was damaged, so make sure to read your cards carefully. Win the game by getting all your prize cards. This means you will have attacked and knocked out 6 of your opponent's Pok\u00e9mon. Also, if you knock out all of your opponent's Pok\u00e9mon that are on the table at one time (so the active card as well as any benched cards), then you win, even if they had less than 6 laid out. Additionally, the first person to run out of cards in their draw pile loses even if there are remaining prize cards\u2014 that's the least fun way to win because it ends the game by default! Exploring Pok\u00e9mon Video Games Enjoy getting outdoors by playing Pok\u00e9mon Go on your phone. Download this game from the app store and use it while you walk around your neighborhood, or explore new areas. As you walk, your phone will alert you to when there is a Pok\u00e9mon in the area that you can catch through your phone screen. Evolve Pok\u00e9mon, challenge other players, and collect as many different Pok\u00e9mon as you can! Be careful when playing Pok\u00e9mon Go and pay attention to your surroundings. It can be distracting, so make sure you're safe while you're walking around. Play on a game console if you like traditional video games. Nintendo 64, GameCube, and Wii all offer a myriad of Pok\u00e9mon games. If you already have one of these consoles, visit your local video game store to find copies of Pok\u00e9mon games, or search for them online. For example, Pok\u00e9mon XD: Gale of Darkness, Pok\u00e9mon Trozei!, Pok\u00e9mon Battle Revolution, and Pok\u00e9mon X and Y are all fun games that you can play. Nintendo 3DS is a handheld video game option that also has lots of Pok\u00e9mon gaming options. Download a Pok\u00e9mon app to play on your phone. Open up your app store and type \u201cPok\u00e9mon\u201d into the search bar to find what games are available for your kind of phone. After you've selected and downloaded one, open it up, follow the onscreen instructions, and enjoy your gaming experience! Pok\u00e9dex 3D, Pok\u00e9mon Bank, Pok\u00e9mon Duel, and Pok\u00e9mon Quest are some of more popular apps. Use an emulator to play video games on your computer. An emulator is a type of software that lets your computer screen mimic that of a video game console, like a Nintendo DS. If you use an emulator, you'll most likely have to use a pirated version of the Pok\u00e9mon game you want to play, so keep that in mind. Pok\u00e9mon Emerald, Pok\u00e9mon Crystal, and Pok\u00e9mon Soul Silver are some of the more well-known DS games that are still played on a PC via an emulator. Play the 3DS Virtual Console if you like handheld video games. Simply buy a Nintendo 3DS, along with the available Pok\u00e9mon game of your choice. After you load the game, onscreen instructions will pop up to direct you during gameplay. Look online for tips and hints on how to beat difficult levels. Pok\u00e9mon Rumble Blast, Pok\u00e9mon Mystery Dungeon, Pok\u00e9mon X and Y, Pokemon Ultra Sun and Moon, Pok\u00e9mon Battle Trozei, and Pok\u00e9mon Omega Rube and Alpha Sapphire are all fun 3DS games you can play. Get a hold of a Gameboy to play the 1996 original game. Although Nintendo no longer produces new Gameboys, you can still buy used and refurbished ones online from places like Amazon and Ebay. You can also find copies of old games, like the original Pok\u00e9mon Red, online. Look for these other Pok\u00e9mon games for Gameboy, too:\nRed, Blue, and Green\nPok\u00e9mon Yellow: Special Pikachu Edition\nPok\u00e9mon Gold and Silver\nPok\u00e9mon Crystal\nPok\u00e9mon Ruby and Sapphire",
  "tyn_model":[
    "pok\u00e9mon",
    "cards",
    "emulator",
    "pok\u00e9mon tcg",
    "pok\u00e9mon go",
    "gameboy",
    "pok\u00e9mon tcg is",
    "\u201cbasic",
    "\u201d \u201c",
    "\u201d or",
    "\u201cstage",
    "\u201d look",
    "\u201cknock",
    "\u201d)",
    "\u2014just",
    "\u201cprize",
    "\u201d both",
    "fire",
    "water",
    "bench",
    "\u2014in",
    "\u2014 that",
    "\u201cpok\u00e9mon",
    "\u201d into",
    "nintendo 3ds,",
    "gameboys"
  ],
  "tyn_section":[

  ]
}