{
  "title":"How to Make Cookie Dough Without Eggs",
  "url":"https://www.wikihow.com/Make-Cookie-Dough-Without-Eggs",
  "category_hierarchy":[
    "Food and Entertaining",
    "Recipes",
    "Baking",
    "Cookies and Biscuits"
  ],
  "methods":[
    {
      "name":"Making Raw Cookie Dough",
      "steps":[
        {
          "headline":"Cream together the butter and brown sugar.",
          "description":"Make sure the butter is already at room temperature. Mix the butter first until it's nice and creamy, and then press the sugar into the butter with a fork. Then, use a wooden spoon or mixer to thoroughly combine the ingredients."
        },
        {
          "headline":"Add the flour and the salt to the mixture.",
          "description":"Slowly mix these ingredients into the mixture until it's thoroughly combined. A stand mixer or hand beaters work well for mixing these ingredients."
        },
        {
          "headline":"Pour in the milk and vanilla.",
          "description":"Add the vanilla and the milk slowly to the mixture, until everything is blended together. If the dough still seems too chunky for your liking, you can keep adding milk a little at a time until it smoothes out."
        },
        {
          "headline":"Fold in the add-in ingredients.",
          "description":"Carefully fold in chocolate chips, nuts, or other add-ins that you want to add to your cookie dough. You should fold them in with a wooden spoon rather than beaters to avoid crushing the chocolate chips."
        },
        {
          "headline":"Serve the raw dough.",
          "description":"For a firmer texture, place the dough in the refrigerator for 30 minutes or longer. The dough can be eaten straight out of the bowl with a spoon or rolled into cookie dough balls. Leftovers can be stored in the refrigerator for about 4 days or frozen for up to three months"
        }
      ]
    },
    {
      "name":"Making Raw Cookie Dough Balls",
      "steps":[
        {
          "headline":"Cream the butter and brown sugar together.",
          "description":"To cream butter and sugar, first let the butter sit out of the fridge for about an hour until it has reached room temperature. You want it to be soft, but not completely melted. Cut the butter into cubes and place it in a large bowl, using a wooden spoon to beat it until you've made a soft, even mixture and there are no chunks left. You can also use a mixer if you have one. Pour the brown sugar into the bowl and use the tines of a fork to press the sugar into the butter. Use the wooden spoon to mix the ingredients together until the mixture rises and is a light yellow color."
        },
        {
          "headline":"Add the remaining ingredients to the mixture.",
          "description":"Now, add the vanilla extract, flour, chocolate chips, and peanut butter to the mixture. Use a wooden spoon or even a mixer for best results. The mixture doesn't have to be perfectly smooth -- since you won't be baking it, it's okay if some parts are a little chunky."
        },
        {
          "headline":"Roll the ingredients into 1 inch (2.5 cm) balls.",
          "description":"Each ball should be a bit smaller than a ping pong ball. You should be able to easily enjoy each ball in one or two bites."
        },
        {
          "headline":"Refrigerate the balls until they're firm.",
          "description":"Just place the cookie dough bites on a plate and stick them in the refrigerator for at least 30 minutes. You can also put them in the freezer for 10 minutes if you have a time constraint or you feel impatient."
        },
        {
          "headline":"Dip the balls in chocolate.",
          "description":"For an extra decadent flavor, you can dip the balls into chocolate to coat them completely. Alternatively, you can melt some chocolate in a pan or in the microwave and then use a spoon or fork to drizzle the chocolate in a zig-zag pattern over the chocolate balls. If the balls are for a party, you can place a small fork or toothpick in each ball before dipping it."
        },
        {
          "headline":"Allow chocolate to cool.",
          "description":"You can place the balls in the refrigerator or freezer to cool the chocolate coating."
        },
        {
          "headline":"Serve.",
          "description":"Gently sprinkle these raw cookie dough balls with powdered sugar (you could also substitute cinnamon or even a touch of chili powder) and enjoy your tasty treat."
        }
      ]
    },
    {
      "name":"Baking Sugar Cookies without Eggs",
      "steps":[
        {
          "headline":"Preheat your oven to 350\u00baF (176\u00baC).",
          "description":"Start your oven when you begin preparing the ingredients so that it is hot and ready to go once your dough is ready."
        },
        {
          "headline":"Cream the butter and sugar together.",
          "description":"To cream the butter and sugar, make sure the butter is already at room temperature and mix it with a wooden spoon until it's creamy. Then, press the sugar into the butter with a fork and stir the ingredients together until you've made a whipped-like, light yellow mixture. As you cream the ingredients, use a rubber spatula to scrape the extra mixture off of the sides of the bowl, so you make sure you fully mix all of the butter and sugar together. You can use a stand mixer or beaters if you have them."
        },
        {
          "headline":"Add the vanilla.",
          "description":"Once the butter and sugar mix is nice and creamy, add the vanilla to the mix before beginning to add the dry ingredients."
        },
        {
          "headline":"Sift the flour and baking soda and mix them into the creamed mixture.",
          "description":"Just hold a sieve or sifter over a different bowl and gently pour in the flour and baking soda, shaking it lightly to allow the ingredients to absorb some air while falling into the bowl. When you're done, mix the ingredients together until they are fully incorporated."
        },
        {
          "headline":"Roll the mixture into balls.",
          "description":"Once the ingredients are mixed together, roll little balls a bit smaller than a lime, either onto a board or into your hands, until you've used up all of the dough. Alternatively, you can roll the cookie dough out flat between two pieces of wax paper and cut into shapes with a cookie cutter. Placing the dough in the freezer for 5 minutes may make it easier to cut shapes because it will be less sticky."
        },
        {
          "headline":"Prepare the cookies for baking.",
          "description":"Place each cookie on an ungreased cookie sheet or on parchment paper. If you are making round sugar cookies, squish each ball with the bottom of a glass or another handy kitchen item. You may want to sprinkle the top of each cookie with granulated sugar."
        },
        {
          "headline":"Bake for 10-12 minutes or until the cookies are lightly browned.",
          "description":"Check up on them periodically to make sure they don't burn. When they're done, remove them from the oven and let them sit for 5 minutes. Larger cookies will take longer to bake than smaller cookies. If you wish to make mini-cookies, check the time before 10 minutes."
        },
        {
          "headline":"Cool and serve the cookies.",
          "description":"After a brief period of cooling, enjoy these tasty eggless sugar cookies on their own or with a glass of milk. Store cookies in an airtight container for up to a week, but be sure they have completely cooled before placing them in the container."
        }
      ]
    },
    {
      "name":"Using Egg Replacements",
      "steps":[
        {
          "headline":"Differentiate between an egg replacement and an egg substitute.",
          "description":"If you are making something egg-free due to allergies, you need to be sure you are using a product that replaces eggs (without having any egg ingredients. Most products that are egg substitutes contain some egg."
        },
        {
          "headline":"Replace eggs with other binding agents.",
          "description":"If the egg in the recipe you\u2019re using is functioning as a binder, or an agent that makes other ingredients \u201cstick\u201d together, you will need to replace it with other items that serve the same function. Mashed banana or applesauce are healthy fruit options that can work as binders. Use half of a banana or \u00bc of a cup of applesauce for each egg in the recipe. One tablespoon of cornstarch or soy flour mixed with two tablespoons of water can be used as a replacement for each egg. One tablespoon of ground flax seed mixed with 4 tablespoons of water may also be used as a replacement binding agent. Products in the baking aisle from the grocery store called \u201cegg replacements\u201d may be used. Follow product packaging instructions for quantity and procedures."
        },
        {
          "headline":"Substitute other moistening agents.",
          "description":"Eggs often provide moistness to your cookies. To retain the moistness in your recipe, try substituting \u00bc cup of vegetable or coconut oil for each egg in your recipe."
        }
      ]
    }
  ],
  "text":" Making Raw Cookie Dough Cream together the butter and brown sugar. Make sure the butter is already at room temperature. Mix the butter first until it's nice and creamy, and then press the sugar into the butter with a fork. Then, use a wooden spoon or mixer to thoroughly combine the ingredients. Add the flour and the salt to the mixture. Slowly mix these ingredients into the mixture until it's thoroughly combined. A stand mixer or hand beaters work well for mixing these ingredients. Pour in the milk and vanilla. Add the vanilla and the milk slowly to the mixture, until everything is blended together. If the dough still seems too chunky for your liking, you can keep adding milk a little at a time until it smoothes out. Fold in the add-in ingredients. Carefully fold in chocolate chips, nuts, or other add-ins that you want to add to your cookie dough. You should fold them in with a wooden spoon rather than beaters to avoid crushing the chocolate chips. Serve the raw dough. For a firmer texture, place the dough in the refrigerator for 30 minutes or longer. The dough can be eaten straight out of the bowl with a spoon or rolled into cookie dough balls. Leftovers can be stored in the refrigerator for about 4 days or frozen for up to three months Making Raw Cookie Dough Balls Cream the butter and brown sugar together. To cream butter and sugar, first let the butter sit out of the fridge for about an hour until it has reached room temperature. You want it to be soft, but not completely melted. Cut the butter into cubes and place it in a large bowl, using a wooden spoon to beat it until you've made a soft, even mixture and there are no chunks left. You can also use a mixer if you have one. Pour the brown sugar into the bowl and use the tines of a fork to press the sugar into the butter. Use the wooden spoon to mix the ingredients together until the mixture rises and is a light yellow color. Add the remaining ingredients to the mixture. Now, add the vanilla extract, flour, chocolate chips, and peanut butter to the mixture. Use a wooden spoon or even a mixer for best results. The mixture doesn't have to be perfectly smooth -- since you won't be baking it, it's okay if some parts are a little chunky. Roll the ingredients into 1 inch (2.5 cm) balls. Each ball should be a bit smaller than a ping pong ball. You should be able to easily enjoy each ball in one or two bites. Refrigerate the balls until they're firm. Just place the cookie dough bites on a plate and stick them in the refrigerator for at least 30 minutes. You can also put them in the freezer for 10 minutes if you have a time constraint or you feel impatient. Dip the balls in chocolate. For an extra decadent flavor, you can dip the balls into chocolate to coat them completely. Alternatively, you can melt some chocolate in a pan or in the microwave and then use a spoon or fork to drizzle the chocolate in a zig-zag pattern over the chocolate balls. If the balls are for a party, you can place a small fork or toothpick in each ball before dipping it. Allow chocolate to cool. You can place the balls in the refrigerator or freezer to cool the chocolate coating. Serve. Gently sprinkle these raw cookie dough balls with powdered sugar (you could also substitute cinnamon or even a touch of chili powder) and enjoy your tasty treat. Baking Sugar Cookies without Eggs Preheat your oven to 350\u00baF (176\u00baC). Start your oven when you begin preparing the ingredients so that it is hot and ready to go once your dough is ready. Cream the butter and sugar together. To cream the butter and sugar, make sure the butter is already at room temperature and mix it with a wooden spoon until it's creamy. Then, press the sugar into the butter with a fork and stir the ingredients together until you've made a whipped-like, light yellow mixture. As you cream the ingredients, use a rubber spatula to scrape the extra mixture off of the sides of the bowl, so you make sure you fully mix all of the butter and sugar together. You can use a stand mixer or beaters if you have them. Add the vanilla. Once the butter and sugar mix is nice and creamy, add the vanilla to the mix before beginning to add the dry ingredients. Sift the flour and baking soda and mix them into the creamed mixture. Just hold a sieve or sifter over a different bowl and gently pour in the flour and baking soda, shaking it lightly to allow the ingredients to absorb some air while falling into the bowl. When you're done, mix the ingredients together until they are fully incorporated. Roll the mixture into balls. Once the ingredients are mixed together, roll little balls a bit smaller than a lime, either onto a board or into your hands, until you've used up all of the dough. Alternatively, you can roll the cookie dough out flat between two pieces of wax paper and cut into shapes with a cookie cutter. Placing the dough in the freezer for 5 minutes may make it easier to cut shapes because it will be less sticky. Prepare the cookies for baking. Place each cookie on an ungreased cookie sheet or on parchment paper. If you are making round sugar cookies, squish each ball with the bottom of a glass or another handy kitchen item. You may want to sprinkle the top of each cookie with granulated sugar. Bake for 10-12 minutes or until the cookies are lightly browned. Check up on them periodically to make sure they don't burn. When they're done, remove them from the oven and let them sit for 5 minutes. Larger cookies will take longer to bake than smaller cookies. If you wish to make mini-cookies, check the time before 10 minutes. Cool and serve the cookies. After a brief period of cooling, enjoy these tasty eggless sugar cookies on their own or with a glass of milk. Store cookies in an airtight container for up to a week, but be sure they have completely cooled before placing them in the container. Using Egg Replacements Differentiate between an egg replacement and an egg substitute. If you are making something egg-free due to allergies, you need to be sure you are using a product that replaces eggs (without having any egg ingredients. Most products that are egg substitutes contain some egg. Replace eggs with other binding agents. If the egg in the recipe you\u2019re using is functioning as a binder, or an agent that makes other ingredients \u201cstick\u201d together, you will need to replace it with other items that serve the same function. Mashed banana or applesauce are healthy fruit options that can work as binders. Use half of a banana or \u00bc of a cup of applesauce for each egg in the recipe. One tablespoon of cornstarch or soy flour mixed with two tablespoons of water can be used as a replacement for each egg. One tablespoon of ground flax seed mixed with 4 tablespoons of water may also be used as a replacement binding agent. Products in the baking aisle from the grocery store called \u201cegg replacements\u201d may be used. Follow product packaging instructions for quantity and procedures. Substitute other moistening agents. Eggs often provide moistness to your cookies. To retain the moistness in your recipe, try substituting \u00bc cup of vegetable or coconut oil for each egg in your recipe.",
  "tyn_model":[
    "butter",
    "sugar",
    "wooden spoon",
    "chocolate",
    "fork",
    "flour",
    "milk",
    "vanilla",
    "brown sugar",
    "mixer",
    "chocolate chips",
    "cookie dough",
    "refrigerator",
    "cookie dough balls",
    "bowl",
    "oven",
    "eggs",
    "stand mixer",
    "beaters",
    "baking soda",
    "banana",
    "applesauce",
    "water",
    "salt",
    "nuts",
    "large bowl",
    "vanilla extract",
    "peanut butter",
    "ping pong ball",
    "microwave",
    "spoon",
    "powdered sugar",
    "chili powder",
    "rubber spatula",
    "sieve",
    "sifter",
    "wax paper",
    "cookie cutter",
    "freezer",
    "cookie sheet",
    "parchment paper",
    "glass",
    "granulated sugar",
    "eggless sugar cookies",
    "egg substitute",
    "\u201cstick",
    "\u201d together",
    "cornstarch or",
    "\u201cegg",
    "\u201d may",
    "vegetable or coconut oil"
  ],
  "tyn_section":[

  ]
}