{
  "title":"How to Add Medicinal Plants to Your Garden",
  "url":"https://www.wikihow.com/Add-Medicinal-Plants-to-Your-Garden",
  "category_hierarchy":[
    "Home and Garden",
    "Gardening",
    "Planting and Growing",
    "Growing Herbs and Spices"
  ],
  "methods":[
    {
      "name":"Choose Medicinal Plants to Add to Your Garden",
      "steps":[
        {
          "headline":"Consider which medicinal plants you want to add.",
          "description":"There are many varieties of medicinal plants to choose from. Research the plants. Talk to your local gardening experts at the nurseries or garden centers where you buy your plants. Find out what they recommend. Go online to find out how people use medicinal herbs and plants. Many holistic and alternative medicine websites will tell you what the plants can be used for, and how to use them."
        },
        {
          "headline":"Add plants you will use.",
          "description":"Consider some of the most popular medicinal plants used in gardens."
        },
        {
          "headline":"Plant some aloe vera, especially if you sunburn easily.",
          "description":"You can also use it to treat rashes, exczema and digestive problems. Keep the aloe plants in direct sunlight. They grow best under full sunlight."
        },
        {
          "headline":"Use peppermint in your garden, especially if you frequently have an upset stomach.",
          "description":"It can also be good for bad breath, and it will make your garden smell pretty."
        },
        {
          "headline":"Plant ginseng, which can be used to improve overall health.",
          "description":"It is especially useful for nervous disorders, and it can help boost your immune system and provide greater stamina."
        },
        {
          "headline":"Try planting Pot Marigold.",
          "description":"Not only does it thrive in any soil condition, it can be used to treat bee stings and other insect bites, varicose veins, fevers and infections."
        }
      ]
    },
    {
      "name":"Plant and Care for Your Medicinal Plants",
      "steps":[
        {
          "headline":"Find an area to plant.",
          "description":"Take a look at your garden and determine where you will put your medicinal plants. Plant your medicinal plants in different locations, depending on the amount of sunlight, shade and water they need. For example, aloe plants need a lot of sun, so you will want to plant them outdoors in direct sunlight. Prepare an area specific for your medicinal plants. If you want to add medicinal plants to your garden but do not want to integrate them with your existing plants, dedicate a medicinal section. Use containers for some of your medicinal plants. For example, sage does well when contained in a pot, and can be used as medicine for insect bites, mouth infections and indigestion."
        },
        {
          "headline":"Purchase plants or seeds.",
          "description":"You can get medicinal plants such as garlic, lavender, Echinacea, ginseng, licorice, elder tree, and hundreds of other varieties at your local garden shop or nursery. Shop online for seeds if you prefer to have them mailed to you. You might find a greater selection on gardening websites such as HorizonHerbs.com, which is based in Oregon, or a wholesale supplier such as BotanicalOnline.com. Most online retailers also have printed catalogues you can order from."
        },
        {
          "headline":"Place your medicinal plant into the ground or their containers.",
          "description":"Dig a hole large enough to accommodate the roots and cover with soil. Pat soil gently into place around the plant."
        },
        {
          "headline":"Water your medicinal plants often enough to keep soil moist but not saturated.",
          "description":""
        },
        {
          "headline":"Prune your medicinal plants and keep them neat.",
          "description":"Trim away any dead leaves and brush off pests such as insects. Replant those that outgrow their containers or pots."
        },
        {
          "headline":"Add any species of Echinacea to your garden for multiple medicinal purposes.",
          "description":"It can treat wounds, bites, stings and allergies."
        }
      ]
    }
  ],
  "text":" Choose Medicinal Plants to Add to Your Garden Consider which medicinal plants you want to add. There are many varieties of medicinal plants to choose from. Research the plants. Talk to your local gardening experts at the nurseries or garden centers where you buy your plants. Find out what they recommend. Go online to find out how people use medicinal herbs and plants. Many holistic and alternative medicine websites will tell you what the plants can be used for, and how to use them. Add plants you will use. Consider some of the most popular medicinal plants used in gardens. Plant some aloe vera, especially if you sunburn easily. You can also use it to treat rashes, exczema and digestive problems. Keep the aloe plants in direct sunlight. They grow best under full sunlight. Use peppermint in your garden, especially if you frequently have an upset stomach. It can also be good for bad breath, and it will make your garden smell pretty. Plant ginseng, which can be used to improve overall health. It is especially useful for nervous disorders, and it can help boost your immune system and provide greater stamina. Try planting Pot Marigold. Not only does it thrive in any soil condition, it can be used to treat bee stings and other insect bites, varicose veins, fevers and infections. Plant and Care for Your Medicinal Plants Find an area to plant. Take a look at your garden and determine where you will put your medicinal plants. Plant your medicinal plants in different locations, depending on the amount of sunlight, shade and water they need. For example, aloe plants need a lot of sun, so you will want to plant them outdoors in direct sunlight. Prepare an area specific for your medicinal plants. If you want to add medicinal plants to your garden but do not want to integrate them with your existing plants, dedicate a medicinal section. Use containers for some of your medicinal plants. For example, sage does well when contained in a pot, and can be used as medicine for insect bites, mouth infections and indigestion. Purchase plants or seeds. You can get medicinal plants such as garlic, lavender, Echinacea, ginseng, licorice, elder tree, and hundreds of other varieties at your local garden shop or nursery. Shop online for seeds if you prefer to have them mailed to you. You might find a greater selection on gardening websites such as HorizonHerbs.com, which is based in Oregon, or a wholesale supplier such as BotanicalOnline.com. Most online retailers also have printed catalogues you can order from. Place your medicinal plant into the ground or their containers. Dig a hole large enough to accommodate the roots and cover with soil. Pat soil gently into place around the plant. Water your medicinal plants often enough to keep soil moist but not saturated.  Prune your medicinal plants and keep them neat. Trim away any dead leaves and brush off pests such as insects. Replant those that outgrow their containers or pots. Add any species of Echinacea to your garden for multiple medicinal purposes. It can treat wounds, bites, stings and allergies.",
  "tyn_model":[
    "medicinal plants",
    "plants",
    "ginseng",
    "water",
    "soil",
    "medicinal herbs",
    "alternative medicine",
    "aloe vera",
    "aloe plants",
    "peppermint",
    "pot marigold",
    "containers",
    "sage",
    "pot",
    "garlic",
    "lavender",
    "licorice",
    "elder tree",
    "seeds",
    "echinacea"
  ],
  "tyn_section":[

  ]
}