{
  "title":"How to Make Brownies Without Eggs",
  "url":"https://www.wikihow.com/Make-Brownies-Without-Eggs",
  "category_hierarchy":[
    "Food and Entertaining",
    "Recipes",
    "Baking",
    "Cakes",
    "Brownies"
  ],
  "methods":[
    {
      "name":"Vegan Brownies",
      "steps":[
        {
          "headline":"Prepare the oven and muffin tins.",
          "description":"Preheat the oven to 350\u00baF (175\u00baC). Grease eight muffin tins with cooking spray or line them with parchment. Compared to a baking pan, the muffin tins will help the brownies cook more evenly, instead of leaving them gooey in the middle."
        },
        {
          "headline":"Grind flax seeds.",
          "description":"Grind the seeds in a coffee grinder or mortar and pestle until they form a fine powder. Measure 2 tbsp (10 mL) of the ground flax seeds for the next step. If you're grinding a larger batch in advance, store the rest in an airtight container in the freezer. Do not buy pre-ground flax seeds. Flax oil turns rancid quickly once the seeds are ground."
        },
        {
          "headline":"Mix flax meal and water.",
          "description":"Take the ground flax seeds and stir it into 5 tbsp (75 mL) water. Set aside to rest for at least five minutes while you move on to the next step. This will thicken into a binding gel roughly equivalent to two eggs."
        },
        {
          "headline":"Combine dry ingredients.",
          "description":"Stir together the following ingredients in a large bowl: \u00be tsp (3.5 mL) baking powder, \u00bd cup (120 mL) cocoa powder, \u00be cup (90g) all purpose flour, \u00be cup (150g) sugar, and \u00bc tsp (1 mL) salt. Dutch processed cocoa powder will create a denser brownie with a more intense chocolate flavor. Natural cocoa powder (anything not labeled \"Dutch processed\") is a safer bet, since vegan brownies already tend to be denser than recipes that contain eggs."
        },
        {
          "headline":"Replace half the all purpose flour with cake flour if you prefer somewhat lighter, cake-ey brownies.",
          "description":"Pastry flour should have an even more significant effect."
        },
        {
          "headline":"Melt remaining wet ingredients together.",
          "description":"Stir together 7 tbsp (100g) margarine, \u00bc cup (40g) semisweet chocolate chips, and 1 tsp (5 mL) vanilla extract. Microwave for 30 seconds at a time, stirring well after each interval. Stop once the ingredients are mostly melted, usually after about 2 minutes. A few lumps of chocolate are fine."
        },
        {
          "headline":"Stir all ingredients together.",
          "description":"Stir the flax mixture into the wet ingredients, then mix in the dry ingredients in stages until fully combined. The batter may be thicker than you're used to with normal brownie recipes."
        },
        {
          "headline":"Fill the muffin tins.",
          "description":"Scoop the batter into the muffin tins, pressing down with a spoon to smooth it out. Leave a little room at the top for the brownies to rise."
        },
        {
          "headline":"Bake for 22 to 27 minutes.",
          "description":"Bake on the middle rack of the oven. After the 22 minute mark, test with a toothpick or fork. When it comes out with just a few crumbs, the brownies are done. These brownies do not burn easily, but overcooking them can make them dry and crumbly."
        },
        {
          "headline":"Let cool.",
          "description":"Wait at least ten minutes for the brownies to cool, or they'll collapse when you try to remove them. Once cool, remove all the brownies before they harden onto the pan."
        }
      ]
    },
    {
      "name":"Silken Brownies (Non-Vegan)",
      "steps":[
        {
          "headline":"Preheat the oven to 350\u00baF (180\u00baC).",
          "description":""
        },
        {
          "headline":"Melt the butter.",
          "description":"Melt \u00bd cup (110g) butter, either on the stove or in the the microwave. If you are using the microwave, take the butter out and stir it every 15\u201330 seconds."
        },
        {
          "headline":"Blend silken tofu until completely smooth.",
          "description":"Blend extra-firm, silken tofu in a blender or food processor until there are no chunks or signs of graininess. You'll probably need to add a little of the melted butter or a little water to get it to blend smoothly. Blend in pulses to avoid overheating your blender. You'll need approximately 10 grams of solid tofu to make \u00bd cup (120 mL) liquid tofu."
        },
        {
          "headline":"Combine butter, cocoa powder, and sugar.",
          "description":"Stir \u00bd cup (120 mL) cocoa powder into the butter until it dissolves. Next, stir in 1 cup (200g) sugar until lit forms a thick mixture."
        },
        {
          "headline":"Add tofu, vanilla, salt, and flour.",
          "description":"Gradually stir in \u00bd cup (120 mL) pureed silken tofu, 2 tsp (10 mL) vanilla essence, and \u00bc tsp (1 mL) salt. Finally, mix in \u00bd cup (60g) flour until the batter is homogenous. Optionally, stir in \u00bd cup (120 mL) chopped nuts as well."
        },
        {
          "headline":"Add the batter to a greased pan.",
          "description":"Grease an 8\" x 8\" (20 x 20 cm) pan, or line with parchment paper. This is a thick batter, so you'll need to spoon it onto the pan instead of pouring it. Spread the batter with the back of a large spoon until it's pressed against the edges and has a smooth surface."
        },
        {
          "headline":"Bake for 25 minutes.",
          "description":"Even if the brownies don't seem completely cooked, you may want to remove them at this point to prevent the surface drying out. The brownies will continue to cook for a short time after they are removed."
        },
        {
          "headline":"Let it cool for some time.",
          "description":"It can take two or three hours before the pan cools down. The brownies may fall apart if you try to slice them while the pan is still hot. To speed up the cooling, place the pan on top of a sturdy wire rack."
        }
      ]
    },
    {
      "name":"Substituting Eggs in Brownie Mix Recipes",
      "steps":[
        {
          "headline":"Start with a box of brownie mix.",
          "description":"If you're avoiding eggs for dietary reasons \u2014 and not just because your fridge is understocked \u2014 check the brownie mix ingredients first. Some brownie mixes contain whey or other dairy products not suitable for vegans. Less commonly, some brands include egg whites."
        },
        {
          "headline":"Replace the eggs with simple substitutes.",
          "description":"The easiest option is to follow the recipe printed on the box. For each egg in the recipe, replace it with one of the following:\n1 tbsp (15 mL) finely ground flax seeds, mixed into 3 tbsp (45 mL) water and allowed to thicken for five minutes. \u00bc cup (60 mL) plain nonfat yogurt (or soy yogurt for a vegan recipe)\nAn egg replacement product, available at health food stores"
        },
        {
          "headline":"Consider adding a rising agent.",
          "description":"Eggs are complex ingredients. While most egg substitutes can replace the moisture and the ability to hold the batter together, they do not form the same foaming structure that eggs do. Try adding \u00bd tsp (2.5 mL) baking powder to the mix to create a slightly airier batter and avoid a dense, collapsed brownie. This is a ballpark figure, since brownie mixes come in many different recipes. You may need to experiment with adding more."
        },
        {
          "headline":"Try a quick brownie mix recipe instead.",
          "description":"If you don't want to worry about all these egg substitutes, you can skip the recipe on the box and go with a two-ingredient recipe instead. Here are a couple options which may sound strange, but which end up working pretty well:\nOpen a can of black beans (~15 oz). Drain and rinse well to reduce salt, fill can with water, and blend until you don't see any bean skins. Mix with a box of brownie mix (~20 oz) and bake on a greased pan until a toothpick comes out mostly clean. Combine a can of pumpkin puree (~15 oz) with a box of brownie mix (~20 oz). Bake for about 25\u201330 minutes or according to package instructions."
        }
      ]
    }
  ],
  "text":" Vegan Brownies Prepare the oven and muffin tins. Preheat the oven to 350\u00baF (175\u00baC). Grease eight muffin tins with cooking spray or line them with parchment. Compared to a baking pan, the muffin tins will help the brownies cook more evenly, instead of leaving them gooey in the middle. Grind flax seeds. Grind the seeds in a coffee grinder or mortar and pestle until they form a fine powder. Measure 2 tbsp (10 mL) of the ground flax seeds for the next step. If you're grinding a larger batch in advance, store the rest in an airtight container in the freezer. Do not buy pre-ground flax seeds. Flax oil turns rancid quickly once the seeds are ground. Mix flax meal and water. Take the ground flax seeds and stir it into 5 tbsp (75 mL) water. Set aside to rest for at least five minutes while you move on to the next step. This will thicken into a binding gel roughly equivalent to two eggs. Combine dry ingredients. Stir together the following ingredients in a large bowl: \u00be tsp (3.5 mL) baking powder, \u00bd cup (120 mL) cocoa powder, \u00be cup (90g) all purpose flour, \u00be cup (150g) sugar, and \u00bc tsp (1 mL) salt. Dutch processed cocoa powder will create a denser brownie with a more intense chocolate flavor. Natural cocoa powder (anything not labeled \"Dutch processed\") is a safer bet, since vegan brownies already tend to be denser than recipes that contain eggs. Replace half the all purpose flour with cake flour if you prefer somewhat lighter, cake-ey brownies. Pastry flour should have an even more significant effect. Melt remaining wet ingredients together. Stir together 7 tbsp (100g) margarine, \u00bc cup (40g) semisweet chocolate chips, and 1 tsp (5 mL) vanilla extract. Microwave for 30 seconds at a time, stirring well after each interval. Stop once the ingredients are mostly melted, usually after about 2 minutes. A few lumps of chocolate are fine. Stir all ingredients together. Stir the flax mixture into the wet ingredients, then mix in the dry ingredients in stages until fully combined. The batter may be thicker than you're used to with normal brownie recipes. Fill the muffin tins. Scoop the batter into the muffin tins, pressing down with a spoon to smooth it out. Leave a little room at the top for the brownies to rise. Bake for 22 to 27 minutes. Bake on the middle rack of the oven. After the 22 minute mark, test with a toothpick or fork. When it comes out with just a few crumbs, the brownies are done. These brownies do not burn easily, but overcooking them can make them dry and crumbly. Let cool. Wait at least ten minutes for the brownies to cool, or they'll collapse when you try to remove them. Once cool, remove all the brownies before they harden onto the pan. Silken Brownies (Non-Vegan) Preheat the oven to 350\u00baF (180\u00baC).  Melt the butter. Melt \u00bd cup (110g) butter, either on the stove or in the the microwave. If you are using the microwave, take the butter out and stir it every 15\u201330 seconds. Blend silken tofu until completely smooth. Blend extra-firm, silken tofu in a blender or food processor until there are no chunks or signs of graininess. You'll probably need to add a little of the melted butter or a little water to get it to blend smoothly. Blend in pulses to avoid overheating your blender. You'll need approximately 10 grams of solid tofu to make \u00bd cup (120 mL) liquid tofu. Combine butter, cocoa powder, and sugar. Stir \u00bd cup (120 mL) cocoa powder into the butter until it dissolves. Next, stir in 1 cup (200g) sugar until lit forms a thick mixture. Add tofu, vanilla, salt, and flour. Gradually stir in \u00bd cup (120 mL) pureed silken tofu, 2 tsp (10 mL) vanilla essence, and \u00bc tsp (1 mL) salt. Finally, mix in \u00bd cup (60g) flour until the batter is homogenous. Optionally, stir in \u00bd cup (120 mL) chopped nuts as well. Add the batter to a greased pan. Grease an 8\" x 8\" (20 x 20 cm) pan, or line with parchment paper. This is a thick batter, so you'll need to spoon it onto the pan instead of pouring it. Spread the batter with the back of a large spoon until it's pressed against the edges and has a smooth surface. Bake for 25 minutes. Even if the brownies don't seem completely cooked, you may want to remove them at this point to prevent the surface drying out. The brownies will continue to cook for a short time after they are removed. Let it cool for some time. It can take two or three hours before the pan cools down. The brownies may fall apart if you try to slice them while the pan is still hot. To speed up the cooling, place the pan on top of a sturdy wire rack. Substituting Eggs in Brownie Mix Recipes Start with a box of brownie mix. If you're avoiding eggs for dietary reasons \u2014 and not just because your fridge is understocked \u2014 check the brownie mix ingredients first. Some brownie mixes contain whey or other dairy products not suitable for vegans. Less commonly, some brands include egg whites. Replace the eggs with simple substitutes. The easiest option is to follow the recipe printed on the box. For each egg in the recipe, replace it with one of the following:\n1 tbsp (15 mL) finely ground flax seeds, mixed into 3 tbsp (45 mL) water and allowed to thicken for five minutes. \u00bc cup (60 mL) plain nonfat yogurt (or soy yogurt for a vegan recipe)\nAn egg replacement product, available at health food stores Consider adding a rising agent. Eggs are complex ingredients. While most egg substitutes can replace the moisture and the ability to hold the batter together, they do not form the same foaming structure that eggs do. Try adding \u00bd tsp (2.5 mL) baking powder to the mix to create a slightly airier batter and avoid a dense, collapsed brownie. This is a ballpark figure, since brownie mixes come in many different recipes. You may need to experiment with adding more. Try a quick brownie mix recipe instead. If you don't want to worry about all these egg substitutes, you can skip the recipe on the box and go with a two-ingredient recipe instead. Here are a couple options which may sound strange, but which end up working pretty well:\nOpen a can of black beans (~15 oz). Drain and rinse well to reduce salt, fill can with water, and blend until you don't see any bean skins. Mix with a box of brownie mix (~20 oz) and bake on a greased pan until a toothpick comes out mostly clean. Combine a can of pumpkin puree (~15 oz) with a box of brownie mix (~20 oz). Bake for about 25\u201330 minutes or according to package instructions.",
  "tyn_model":[
    "eggs",
    "butter",
    "brownie mix",
    "muffin tins",
    "water",
    "cocoa powder",
    "oven",
    "flax",
    "sugar",
    "salt",
    "tofu",
    "baking powder",
    "all purpose flour",
    "microwave",
    "blender",
    "flour",
    "cooking spray",
    "baking pan",
    "coffee grinder",
    "mortar",
    "airtight container",
    "flax meal",
    "large bowl",
    "cake flour",
    "pastry flour",
    "margarine",
    "semisweet chocolate chips",
    "vanilla extract",
    "chocolate",
    "spoon",
    "fork",
    "food processor",
    "vanilla",
    "vanilla essence",
    "nuts",
    "parchment paper",
    "large spoon",
    "\u2014 and",
    "\u2014 check",
    "brownie mixes",
    "nonfat yogurt",
    "yogurt",
    "rising agent",
    "egg substitutes",
    "black beans",
    "pumpkin"
  ],
  "tyn_section":[

  ]
}