{
  "title":"How to Make Recipes With Chia Seeds",
  "url":"https://www.wikihow.com/Make-Recipes-With-Chia-Seeds",
  "category_hierarchy":[
    "Food and Entertaining",
    "Recipes"
  ],
  "methods":[
    {
      "name":"Use Chia Seeds as a Topping",
      "steps":[
        {
          "headline":"Add chia seeds as a topping for granola or cereal.",
          "description":"Using chia seeds with recipes that are grain-based will make the seeds less noticeable. Oatmeal, muesli, and other breakfast grains make ideal bases for a sprinkle of chia seeds."
        },
        {
          "headline":"Top baked goods with chia seeds.",
          "description":"Breads, muffins, granola bars, and other grain-based baked goods are simple receptacles for a few chia seeds. If added before baking, the seeds develop a toasted flavor and may settle into the batter or dough. If added afterwards, do so while the baked good is still warm to enable the seed to attach itself firmly to the product. Cobblers and streusels can easily incorporate a small handful of chia seeds with little noticeable impact on flavor, even for sweet dishes."
        },
        {
          "headline":"Sprinkle chia seeds on dairy products.",
          "description":"Yogurt and ice cream can benefit from the nutty flavor and added texture of chia seeds as a topping. If you prefer fruit-based jams or syrups with yogurt or ice cream, try stirring chia seeds into the fruit topping to blend them instead of sprinkling the chia seeds as a separate topping."
        },
        {
          "headline":"Use chia seeds as a salad topping.",
          "description":"Chia seeds can be used like nuts or sunflower seeds in regular salads. They can also be mixed in with salad dressing just prior to serving."
        }
      ]
    },
    {
      "name":"Use Chia Seeds as a Substitute in Recipes",
      "steps":[
        {
          "headline":"Replace eggs or oil with chia seed gel.",
          "description":"Mixing a tablespoon of chia seeds with \u00bc cup of water will provide about the equivalent of a single egg or quarter cup of oil for a recipe. Most recipes can tolerate about a 25% substitution of chia seeds for eggs or oil without a noticeable alteration in flavor. This technique can also help stretch eggs for omelets and souffl\u00e9s. Just prepare about a quarter of your egg needs by mixing in chia seeds and milk into the beaten eggs about 10 minutes before cooking them."
        },
        {
          "headline":"Use chia seeds as a thickener.",
          "description":"Because chia seeds form a gel in liquid, they can be added to soups, stews, sauces, and marinades to help thicken the liquid in place of corn starch or flour. Chia seeds can also be blended into juice smoothies to add the thicker texture normally provided by whole fruits or yogurt. If you have accidentally added too much liquid to a recipe, including baked goods, adding chia seeds can thicken the dough by absorbing the excess liquid."
        },
        {
          "headline":"Bind ingredients with chia seeds.",
          "description":"Meatballs and meatloaf can be held together with chia seeds and a bit of water once mixed with the ground meat. Jellies, jams, and compotes can also benefit from the gel properties of chia seeds."
        },
        {
          "headline":"Replace oats or pudding mixes with chia seeds.",
          "description":"Because chia seeds firm when mixed with liquid, ground seeds and flavorful liquids help form a gel that can give the consistency of porridge when hot or pudding when cold. For dessert-like chia mixtures, mix the seeds with sweetened or flavored milks or juices. For breakfast-like chia mixtures, stir the seeds into hot milk or water and then flavor to your preferences with brown sugar, cinnamon, or other breakfast toppings."
        }
      ]
    },
    {
      "name":"Add Chia Seeds to Traditional Recipes",
      "steps":[
        {
          "headline":"Mix chia seeds into one-dish meals.",
          "description":"Lentil or bean soups, slow-cooker recipes, and casseroles are ideal for adding chia seeds. Stir the seeds into the broth or sauce and monitor the consistency for about 15 minutes to determine if additional liquid is necessary. If so, consider adding the primary liquid base of the recipe (milk, broth, water, or juice, for instance)."
        },
        {
          "headline":"Add chia seeds to peanut butter or other spreads.",
          "description":"Because of the nutty flavor and texture, chia seeds can easily be added to sandwich spreads to get extra fiber and nutrients."
        },
        {
          "headline":"Include chia seeds in breading and batter.",
          "description":"Chia seeds can be added to traditional breading for chicken, pork, and even tofu to add a nutty, crunchy aspect to traditional breadcrumb or cereal-based breading. Chia seeds can also be used in batters for fish or vegetable tempura to add flavor to pan-fried, battered dishes."
        },
        {
          "headline":"Mix chia seeds into rice dishes.",
          "description":"Traditional recipes with a base of rice, such as jambalaya or stuffed peppers, can easily tolerate chia seeds added after the rice has been cooked completely. The meals will benefit from the added nutrients of the chia seeds without altering flavor significantly."
        },
        {
          "headline":"Include chia seeds in nut mixes.",
          "description":"Homemade trail mix, nut clusters, and snack bags can easily incorporate chia seeds to improve nutrition and add to the nutty flavor of the original dish."
        }
      ]
    }
  ],
  "text":" Use Chia Seeds as a Topping Add chia seeds as a topping for granola or cereal. Using chia seeds with recipes that are grain-based will make the seeds less noticeable. Oatmeal, muesli, and other breakfast grains make ideal bases for a sprinkle of chia seeds. Top baked goods with chia seeds. Breads, muffins, granola bars, and other grain-based baked goods are simple receptacles for a few chia seeds. If added before baking, the seeds develop a toasted flavor and may settle into the batter or dough. If added afterwards, do so while the baked good is still warm to enable the seed to attach itself firmly to the product. Cobblers and streusels can easily incorporate a small handful of chia seeds with little noticeable impact on flavor, even for sweet dishes. Sprinkle chia seeds on dairy products. Yogurt and ice cream can benefit from the nutty flavor and added texture of chia seeds as a topping. If you prefer fruit-based jams or syrups with yogurt or ice cream, try stirring chia seeds into the fruit topping to blend them instead of sprinkling the chia seeds as a separate topping. Use chia seeds as a salad topping. Chia seeds can be used like nuts or sunflower seeds in regular salads. They can also be mixed in with salad dressing just prior to serving. Use Chia Seeds as a Substitute in Recipes Replace eggs or oil with chia seed gel. Mixing a tablespoon of chia seeds with \u00bc cup of water will provide about the equivalent of a single egg or quarter cup of oil for a recipe. Most recipes can tolerate about a 25% substitution of chia seeds for eggs or oil without a noticeable alteration in flavor. This technique can also help stretch eggs for omelets and souffl\u00e9s. Just prepare about a quarter of your egg needs by mixing in chia seeds and milk into the beaten eggs about 10 minutes before cooking them. Use chia seeds as a thickener. Because chia seeds form a gel in liquid, they can be added to soups, stews, sauces, and marinades to help thicken the liquid in place of corn starch or flour. Chia seeds can also be blended into juice smoothies to add the thicker texture normally provided by whole fruits or yogurt. If you have accidentally added too much liquid to a recipe, including baked goods, adding chia seeds can thicken the dough by absorbing the excess liquid. Bind ingredients with chia seeds. Meatballs and meatloaf can be held together with chia seeds and a bit of water once mixed with the ground meat. Jellies, jams, and compotes can also benefit from the gel properties of chia seeds. Replace oats or pudding mixes with chia seeds. Because chia seeds firm when mixed with liquid, ground seeds and flavorful liquids help form a gel that can give the consistency of porridge when hot or pudding when cold. For dessert-like chia mixtures, mix the seeds with sweetened or flavored milks or juices. For breakfast-like chia mixtures, stir the seeds into hot milk or water and then flavor to your preferences with brown sugar, cinnamon, or other breakfast toppings. Add Chia Seeds to Traditional Recipes Mix chia seeds into one-dish meals. Lentil or bean soups, slow-cooker recipes, and casseroles are ideal for adding chia seeds. Stir the seeds into the broth or sauce and monitor the consistency for about 15 minutes to determine if additional liquid is necessary. If so, consider adding the primary liquid base of the recipe (milk, broth, water, or juice, for instance). Add chia seeds to peanut butter or other spreads. Because of the nutty flavor and texture, chia seeds can easily be added to sandwich spreads to get extra fiber and nutrients. Include chia seeds in breading and batter. Chia seeds can be added to traditional breading for chicken, pork, and even tofu to add a nutty, crunchy aspect to traditional breadcrumb or cereal-based breading. Chia seeds can also be used in batters for fish or vegetable tempura to add flavor to pan-fried, battered dishes. Mix chia seeds into rice dishes. Traditional recipes with a base of rice, such as jambalaya or stuffed peppers, can easily tolerate chia seeds added after the rice has been cooked completely. The meals will benefit from the added nutrients of the chia seeds without altering flavor significantly. Include chia seeds in nut mixes. Homemade trail mix, nut clusters, and snack bags can easily incorporate chia seeds to improve nutrition and add to the nutty flavor of the original dish.",
  "tyn_model":[
    "chia seeds",
    "eggs",
    "water",
    "yogurt",
    "oil",
    "milk",
    "ice cream",
    "broth",
    "granola bars",
    "sunflower seeds",
    "salad dressing",
    "chia seed gel",
    "corn starch",
    "oats",
    "brown sugar",
    "cinnamon",
    "slow-cooker recipes",
    "peanut butter",
    "tofu",
    "rice",
    "nut mixes",
    "trail mix"
  ],
  "tyn_section":[

  ]
}