{
  "title":"How to Cook a Lobster",
  "url":"https://www.wikihow.com/Cook-a-Lobster",
  "category_hierarchy":[
    "Food and Entertaining",
    "Recipes",
    "Fish and Seafood",
    "Lobster"
  ],
  "methods":[
    {
      "name":"Boiled Whole Lobster",
      "steps":[
        {
          "headline":"Buy live lobsters.",
          "description":"Live lobsters may be available in your grocery store, at your local fishmonger or if you're exceptionally fortunate enough to live in a lobster fishing area, right off the boat that caught them. Look inside the lobster tank for lobsters that seem healthy and active. Avoid lobsters that are too still or have holes or black marks on their shells."
        },
        {
          "headline":"Fill a large pot \u00be full with water.",
          "description":"Add 2 tablespoons of coarse salt for each quart of water, and bring the water to a quick boil."
        },
        {
          "headline":"Plunge the lobsters into the water.",
          "description":"One at a time, pick up the lobsters by the body and plunge them headfirst into the boiling water. Cover the pot with a lid. Do not allow the water to overflow. If there isn\u2019t room in the pot for all the lobsters you bought, cook them in two or more batches."
        },
        {
          "headline":"Cook the lobsters.",
          "description":"Once the water has come to a boil again, begin timing the cooking of the lobsters. One-pound lobsters should cook for about 15 minutes, 1 \u00bd-pound lobsters for 20 minutes, and 2-pound lobsters for 25 minutes. The lobsters are finished cooking when their shells have turned bright red. Remove them from the pot and set them on a plate on their backs to dry and cool. This keeps the juices in the lobsters. It\u2019s important to time the cooking, since lobsters may turn red before they are fully done."
        },
        {
          "headline":"Serve the lobsters whole.",
          "description":"Place each lobster on a dinner plate for serving. Serve each lobster with a small cup of melted butter, a nutcracker for cracking the claws, a lobster pick and a bowl for the discarded shells. See How to Eat Lobster for a tutorial on which parts of the lobster are good to eat."
        }
      ]
    },
    {
      "name":"Grilled or Broiled Lobster Tails",
      "steps":[
        {
          "headline":"Heat your grill.",
          "description":"Prepare to cook the lobster tails by heating your grill to medium high. Make sure the entire surface of the grill is evenly hot. If you are broiling your lobster tails instead of grilling them, turn the broiler on to heat up your oven."
        },
        {
          "headline":"Butterfly the lobster tails.",
          "description":"Using a sharp pair of kitchen shears, cut lengthwise down the middle of the softer underside of the lobster shells. Insert metal skewers lengthwise through the meat of the lobster tails. Brush the tails with olive oil on both sides."
        },
        {
          "headline":"Grill the lobster tails.",
          "description":"Lay them across the grill cut side down and cook them for about five minutes, or until the shells turn bright red. Turn the tails over, cut side up. Sprinkle minced garlic, salt and pepper into the lobster meat, and top with a few spoonfuls of butter. Grill for an additional five minutes, or until the meat is no longer translucent. If you are broiling your lobster tails instead of grilling them, complete this process in your oven. Broil them cut side down for five minutes, remove them from the oven and top with garlic, salt and pepper, and butter, and replace in the oven for five more minutes."
        },
        {
          "headline":"Serve the lobster tails.",
          "description":"Place each one on a plate and serve with melted butter and lemon wedges."
        }
      ]
    }
  ],
  "text":" Boiled Whole Lobster Buy live lobsters. Live lobsters may be available in your grocery store, at your local fishmonger or if you're exceptionally fortunate enough to live in a lobster fishing area, right off the boat that caught them. Look inside the lobster tank for lobsters that seem healthy and active. Avoid lobsters that are too still or have holes or black marks on their shells. Fill a large pot \u00be full with water. Add 2 tablespoons of coarse salt for each quart of water, and bring the water to a quick boil. Plunge the lobsters into the water. One at a time, pick up the lobsters by the body and plunge them headfirst into the boiling water. Cover the pot with a lid. Do not allow the water to overflow. If there isn\u2019t room in the pot for all the lobsters you bought, cook them in two or more batches. Cook the lobsters. Once the water has come to a boil again, begin timing the cooking of the lobsters. One-pound lobsters should cook for about 15 minutes, 1 \u00bd-pound lobsters for 20 minutes, and 2-pound lobsters for 25 minutes. The lobsters are finished cooking when their shells have turned bright red. Remove them from the pot and set them on a plate on their backs to dry and cool. This keeps the juices in the lobsters. It\u2019s important to time the cooking, since lobsters may turn red before they are fully done. Serve the lobsters whole. Place each lobster on a dinner plate for serving. Serve each lobster with a small cup of melted butter, a nutcracker for cracking the claws, a lobster pick and a bowl for the discarded shells. See How to Eat Lobster for a tutorial on which parts of the lobster are good to eat. Grilled or Broiled Lobster Tails Heat your grill. Prepare to cook the lobster tails by heating your grill to medium high. Make sure the entire surface of the grill is evenly hot. If you are broiling your lobster tails instead of grilling them, turn the broiler on to heat up your oven. Butterfly the lobster tails. Using a sharp pair of kitchen shears, cut lengthwise down the middle of the softer underside of the lobster shells. Insert metal skewers lengthwise through the meat of the lobster tails. Brush the tails with olive oil on both sides. Grill the lobster tails. Lay them across the grill cut side down and cook them for about five minutes, or until the shells turn bright red. Turn the tails over, cut side up. Sprinkle minced garlic, salt and pepper into the lobster meat, and top with a few spoonfuls of butter. Grill for an additional five minutes, or until the meat is no longer translucent. If you are broiling your lobster tails instead of grilling them, complete this process in your oven. Broil them cut side down for five minutes, remove them from the oven and top with garlic, salt and pepper, and butter, and replace in the oven for five more minutes. Serve the lobster tails. Place each one on a plate and serve with melted butter and lemon wedges.",
  "tyn_model":[
    "lobsters",
    "water",
    "butter",
    "grill",
    "oven",
    "pot",
    "plate",
    "lobster",
    "garlic",
    "lobster fishing",
    "lobster tank",
    "large pot",
    "coarse salt",
    "dinner plate",
    "nutcracker",
    "lobster pick",
    "bowl",
    "broiler",
    "kitchen shears",
    "olive oil",
    "salt",
    "pepper",
    "salt and pepper",
    "lemon"
  ],
  "tyn_section":[

  ]
}