{
  "title":"How to Make a Healthy Fruit Smoothie",
  "url":"https://www.wikihow.com/Make-a-Healthy-Fruit-Smoothie",
  "category_hierarchy":[
    "Food and Entertaining",
    "Drinks",
    "Smoothies Shakes and Milk",
    "Smoothies"
  ],
  "methods":[
    {
      "name":"Apple Cinnamon Peanut Butter",
      "steps":[
        {
          "headline":"Put the oats and chia seeds into the blender.",
          "description":"Grate 'em up until you get the  consistency of flour -- in other words, till they're near powder."
        },
        {
          "headline":"Add milk and yogurt.",
          "description":"Then blend it up! Occasionally stop the blender to get all the oat-chia powder unstuck from the bottom of the blender."
        },
        {
          "headline":"Add the applesauce, peanut butter, and cinnamon.",
          "description":"Turn it on again until you get the consistency you're looking for in a smoothie. If it's too thick, add a bit more liquid. Mix it manually if necessary. Adjust the apple or peanut butter-ness of the smoothie by adding more or less of one ingredient. However, too much peanut butter and you lose the healthy descriptor for this smoothie. PB2 is a peanut butter substitute that's a bit healthier (tastes like it as well)."
        },
        {
          "headline":"Taste it.",
          "description":"If you'd like it a little sweeter, add honey or sweetener. However, if you have neither of these, don't sweat it. The smoothie will be good without it! Then, pour it in a glass and start relaxing. If you can't drink it all now, throw it in the freezer for later! It'll keep for a few days."
        }
      ]
    },
    {
      "name":"Cherry Vanilla Oat",
      "steps":[
        {
          "headline":"Blend up the flax seeds and oats.",
          "description":"Get it to a very thin consistency. Think about how textured you like your smoothies -- if you like it a bit chunkier, blend it a bit less."
        },
        {
          "headline":"Add the milk, juice, and yogurt.",
          "description":"Grab a spoon and mix it up to make it a little easier on the blender -- or else the flax-oat powder may not combine well."
        },
        {
          "headline":"Throw in the cherries and vanilla.",
          "description":"Blend until the smoothie looks ready. Take a small taste test and see if you'd like it any sweeter. If so, add honey or sugar substitute and blend a bit more. Fresh cherries are going to taste very different than dried or canned. And if you use fresh, don't throw them in with the pits!"
        },
        {
          "headline":"Pour in a glass and enjoy!",
          "description":"Complete the look with a straw and umbrella for summer in a glass. Keep it cold in the fridge or freezer if you'd like to have it later."
        }
      ]
    },
    {
      "name":"Raspberry Banana Coconut",
      "steps":[
        {
          "headline":"Add ice and raspberries to the blender.",
          "description":"Blend it up for 20 seconds or so to make the whole process go a little bit faster. It doesn't need to blend all the way; just break it up a bit so you're not left with ice cubes in your drink."
        },
        {
          "headline":"Add in the oats, banana, yogurt and coconut water.",
          "description":"Cut the banana into pieces beforehand, of course. Blend it up until it reaches the texture and thickness you desire. Greek yogurt is great, but low-fat regular is tasty, too. And really any flavor works!"
        },
        {
          "headline":"Try it out.",
          "description":"This smoothie is great without the honey or sugar substitute, but if you have a sweet tooth, a bit of honey will do the trick. If you like this smoothie, try substituting different yogurt flavors for a subtle yet noticeable flavor difference."
        },
        {
          "headline":"Pour into glasses.",
          "description":"This recipe will make two regular-sized smoothies. One for breakfast and one for lunch! Now that was easy math. Put it in the freezer to keep it cold and thick -- if there's extra, of course."
        }
      ]
    }
  ],
  "text":" Apple Cinnamon Peanut Butter Put the oats and chia seeds into the blender. Grate 'em up until you get the  consistency of flour -- in other words, till they're near powder. Add milk and yogurt. Then blend it up! Occasionally stop the blender to get all the oat-chia powder unstuck from the bottom of the blender. Add the applesauce, peanut butter, and cinnamon. Turn it on again until you get the consistency you're looking for in a smoothie. If it's too thick, add a bit more liquid. Mix it manually if necessary. Adjust the apple or peanut butter-ness of the smoothie by adding more or less of one ingredient. However, too much peanut butter and you lose the healthy descriptor for this smoothie. PB2 is a peanut butter substitute that's a bit healthier (tastes like it as well). Taste it. If you'd like it a little sweeter, add honey or sweetener. However, if you have neither of these, don't sweat it. The smoothie will be good without it! Then, pour it in a glass and start relaxing. If you can't drink it all now, throw it in the freezer for later! It'll keep for a few days. Cherry Vanilla Oat Blend up the flax seeds and oats. Get it to a very thin consistency. Think about how textured you like your smoothies -- if you like it a bit chunkier, blend it a bit less. Add the milk, juice, and yogurt. Grab a spoon and mix it up to make it a little easier on the blender -- or else the flax-oat powder may not combine well. Throw in the cherries and vanilla. Blend until the smoothie looks ready. Take a small taste test and see if you'd like it any sweeter. If so, add honey or sugar substitute and blend a bit more. Fresh cherries are going to taste very different than dried or canned. And if you use fresh, don't throw them in with the pits! Pour in a glass and enjoy! Complete the look with a straw and umbrella for summer in a glass. Keep it cold in the fridge or freezer if you'd like to have it later. Raspberry Banana Coconut Add ice and raspberries to the blender. Blend it up for 20 seconds or so to make the whole process go a little bit faster. It doesn't need to blend all the way; just break it up a bit so you're not left with ice cubes in your drink. Add in the oats, banana, yogurt and coconut water. Cut the banana into pieces beforehand, of course. Blend it up until it reaches the texture and thickness you desire. Greek yogurt is great, but low-fat regular is tasty, too. And really any flavor works! Try it out. This smoothie is great without the honey or sugar substitute, but if you have a sweet tooth, a bit of honey will do the trick. If you like this smoothie, try substituting different yogurt flavors for a subtle yet noticeable flavor difference. Pour into glasses. This recipe will make two regular-sized smoothies. One for breakfast and one for lunch! Now that was easy math. Put it in the freezer to keep it cold and thick -- if there's extra, of course.",
  "tyn_model":[
    "blender",
    "yogurt",
    "peanut butter",
    "oats",
    "honey",
    "glass",
    "milk",
    "cherries",
    "banana",
    "flour",
    "oat-chia powder",
    "applesauce",
    "cinnamon",
    "sweetener",
    "cherry vanilla oat",
    "flax seeds",
    "juice",
    "spoon",
    "flax-oat",
    "vanilla",
    "sugar substitute",
    "straw",
    "raspberry banana",
    "ice",
    "raspberries",
    "ice cubes",
    "coconut water",
    "greek yogurt",
    "low-fat regular is",
    "freezer"
  ],
  "tyn_section":[

  ]
}