{
  "title":"How to Ship Large Furniture",
  "url":"https://www.wikihow.com/Ship-Large-Furniture",
  "category_hierarchy":[
    "Home and Garden",
    "Furniture"
  ],
  "methods":[
    {
      "name":"Package the Large Furniture",
      "steps":[
        {
          "headline":"Remove any feet or other fragile pieces from the furniture.",
          "description":"If a piece of furniture with feet is packed right-side-up in a box, the feet will likely be broken in transit as the box can be handled quite roughly. If the furniture's feet, doors, or any other small or delicate parts can be removed and wrapped in bubble wrap, do so."
        },
        {
          "headline":"Surround the furniture in Styrofoam sheets.",
          "description":"Rigid Styrofoam sheets can be purchased at shipping or office supply stores, and are ideal for protecting large furniture. Cut the sheets to fit around all of the furniture's surfaces, taping the sheets together using packing tape."
        },
        {
          "headline":"Build the sides of the box.",
          "description":"The 4 sides of the shipping box can be built from large sheets of corrugated cardboard, often available in a 30-inch x 40-inch (75 x 100 cm) size. Cut the sheets to fit tightly around the Styrofoam sheets. Avoid seaming the cardboard together at the corners. Instead, bend the cardboard sheets to form the corners and tape them together where the ends meet."
        },
        {
          "headline":"Make lids for the top and bottom of the box.",
          "description":"Lids for the open top and bottom of your box can be made by cutting a sheet of cardboard a few inches wider than the opening on all sides. Fold each side down, cutting away the excess in the corners. Tape the corners together so that each lid looks like the lid of a shoebox."
        },
        {
          "headline":"Strap the entire box together.",
          "description":"When you're ready to ship, use polypropylene strapping in both directions to secure the lids to the box. This strapping can be purchased at shipping supply stores or online through a specialty retailer."
        }
      ]
    },
    {
      "name":"Ship the Large Furniture",
      "steps":[
        {
          "headline":"Measure the package in all directions.",
          "description":"Measuring the package is important because it will determine whether or not you can ship the box through a private carrier such as UPS, DHL, or FedEx."
        },
        {
          "headline":"Check the dimension restrictions for several carriers.",
          "description":"Companies like UPS and FedEx list their dimension restrictions online. They often have an oversized package fee that is charged for packages over a certain size, and there may be a certain size or weight beyond which they cannot ship. Scheduling a pickup with these carriers can be done online."
        },
        {
          "headline":"Open an account with a freight carrier if necessary.",
          "description":"For packages that are too large for regular package carriers, you can ship the furniture through a freight company like Old Dominion. These companies usually require you to have a standing account before shipping, which can often be opened through their website."
        },
        {
          "headline":"Look for other shipping options.",
          "description":"Some transit services also offer low-cost options for shipping large furniture. In the United States, Greyhound offers inexpensive shipping aboard its bus lines, but your recipient will have to pick up the furniture at a Greyhound station."
        }
      ]
    }
  ],
  "text":" Package the Large Furniture Remove any feet or other fragile pieces from the furniture. If a piece of furniture with feet is packed right-side-up in a box, the feet will likely be broken in transit as the box can be handled quite roughly. If the furniture's feet, doors, or any other small or delicate parts can be removed and wrapped in bubble wrap, do so. Surround the furniture in Styrofoam sheets. Rigid Styrofoam sheets can be purchased at shipping or office supply stores, and are ideal for protecting large furniture. Cut the sheets to fit around all of the furniture's surfaces, taping the sheets together using packing tape. Build the sides of the box. The 4 sides of the shipping box can be built from large sheets of corrugated cardboard, often available in a 30-inch x 40-inch (75 x 100 cm) size. Cut the sheets to fit tightly around the Styrofoam sheets. Avoid seaming the cardboard together at the corners. Instead, bend the cardboard sheets to form the corners and tape them together where the ends meet. Make lids for the top and bottom of the box. Lids for the open top and bottom of your box can be made by cutting a sheet of cardboard a few inches wider than the opening on all sides. Fold each side down, cutting away the excess in the corners. Tape the corners together so that each lid looks like the lid of a shoebox. Strap the entire box together. When you're ready to ship, use polypropylene strapping in both directions to secure the lids to the box. This strapping can be purchased at shipping supply stores or online through a specialty retailer. Ship the Large Furniture Measure the package in all directions. Measuring the package is important because it will determine whether or not you can ship the box through a private carrier such as UPS, DHL, or FedEx. Check the dimension restrictions for several carriers. Companies like UPS and FedEx list their dimension restrictions online. They often have an oversized package fee that is charged for packages over a certain size, and there may be a certain size or weight beyond which they cannot ship. Scheduling a pickup with these carriers can be done online. Open an account with a freight carrier if necessary. For packages that are too large for regular package carriers, you can ship the furniture through a freight company like Old Dominion. These companies usually require you to have a standing account before shipping, which can often be opened through their website. Look for other shipping options. Some transit services also offer low-cost options for shipping large furniture. In the United States, Greyhound offers inexpensive shipping aboard its bus lines, but your recipient will have to pick up the furniture at a Greyhound station.",
  "tyn_model":[
    "styrofoam sheets",
    "cardboard",
    "bubble wrap",
    "packing tape",
    "corrugated cardboard",
    "polypropylene strapping",
    "shipping supply stores",
    "ups"
  ],
  "tyn_section":[

  ]
}