{
  "title":"How to Win Photo Contests",
  "url":"https://www.wikihow.com/Win-Photo-Contests",
  "category_hierarchy":[
    "Hobbies and Crafts",
    "Photography"
  ],
  "methods":[
    {
      "name":"Preparation",
      "steps":[
        {
          "headline":"Pick a contest.",
          "description":"Lots of magazines hold photography contests, or ask your friends if they know of any. Try to choose a contest that suits you and your surroundings. For example, if the theme of the contest is \"Ocean Life\", and you live nowhere near an ocean or aquarium, don't decide to enter it."
        },
        {
          "headline":"Read all the rules.",
          "description":"Are you allowed to use a digital camera? Is there an age limit? How many times can you enter? Photocopy or write out a copy of the rules to carry with you when you are taking photos."
        },
        {
          "headline":"Prepare your equipment.",
          "description":"Make sure you have enough film or digital disks and extra camera and flash batteries. If you're planning on using a special lens or tripod, make sure you know where it is."
        }
      ]
    },
    {
      "name":"Taking the Photos: Consider the Following",
      "steps":[
        {
          "headline":"Angles.",
          "description":"Taking the photo from above will create a much different effect than if you take the photo head-on. Be prepared to bend down, or stand on top of something to get to the right height."
        },
        {
          "headline":"Background.",
          "description":"Do you want your background to be distracting or iconic? Depending on the contest's theme you may want a simple background or a complex one. Why not try taking photos in a few places?"
        },
        {
          "headline":"Lighting.",
          "description":"If you're taking photos outside, consider if you want your photo to be taken in the middle of the day, when it is brightest, or at night when the only light comes from streetlights. If taking photos inside, do you want the windows open or closed?"
        },
        {
          "headline":"Flashes.",
          "description":"Do you need to use a flash. If you do, be careful how far away your subject is. A flash will only work about 8\u201310 feet (2.4\u20133.0 m) ahead. Also be careful not to stand to close to your subject as this will result in a whiteout. If you're taking photos of people or animals, consider using a camera with a \"red eye double flash\" feature, to prevent red eyes."
        },
        {
          "headline":"Shadows.",
          "description":"Which direction should they be pointing? Do you even want them in your photo? Also be careful that your subject's face isn't blacked out (unless you want it that way). This can happen when you are pointing the camera into the sun."
        },
        {
          "headline":"Cropping and Centering.",
          "description":"Do you want your whole subject in the photo? Should they be off to the side or centered? Be creative with these as they can distinguish a forgettable photo into a memorable one."
        },
        {
          "headline":"Zoom.",
          "description":"Generally, zoomed in photos give more impact. Again it depends on what the judges will be looking for. You may consider using a telephoto or other special lens, depending on what your subject is."
        },
        {
          "headline":"Color.",
          "description":"Try looking at a color wheel for creative ideas. For example: If you are photographing some blue flowers, you may want to mix them with orange flowers for contrast, as the two are opposites on the color wheel. Consider the following: Complimentary, Split Complimentary, Triad, Analogous, Monochromatic, Sepia, Black and White."
        },
        {
          "headline":"Candid Shots.",
          "description":"Sometimes the best shots are the unplanned ones. Keep your camera with you at all times. If the contest rules allow it, look for old photos to submit."
        }
      ]
    },
    {
      "name":"Entering the Contest",
      "steps":[
        {
          "headline":"Make sure you enter on time!",
          "description":""
        },
        {
          "headline":"Fill out the forms neatly.",
          "description":"Make sure you fill in all the information. It's best to fill out forms with black or blue pen. Make sure you enclose your photo!"
        }
      ]
    }
  ],
  "text":" Preparation Pick a contest. Lots of magazines hold photography contests, or ask your friends if they know of any. Try to choose a contest that suits you and your surroundings. For example, if the theme of the contest is \"Ocean Life\", and you live nowhere near an ocean or aquarium, don't decide to enter it. Read all the rules. Are you allowed to use a digital camera? Is there an age limit? How many times can you enter? Photocopy or write out a copy of the rules to carry with you when you are taking photos. Prepare your equipment. Make sure you have enough film or digital disks and extra camera and flash batteries. If you're planning on using a special lens or tripod, make sure you know where it is. Taking the Photos: Consider the Following Angles. Taking the photo from above will create a much different effect than if you take the photo head-on. Be prepared to bend down, or stand on top of something to get to the right height. Background. Do you want your background to be distracting or iconic? Depending on the contest's theme you may want a simple background or a complex one. Why not try taking photos in a few places? Lighting. If you're taking photos outside, consider if you want your photo to be taken in the middle of the day, when it is brightest, or at night when the only light comes from streetlights. If taking photos inside, do you want the windows open or closed? Flashes. Do you need to use a flash. If you do, be careful how far away your subject is. A flash will only work about 8\u201310 feet (2.4\u20133.0 m) ahead. Also be careful not to stand to close to your subject as this will result in a whiteout. If you're taking photos of people or animals, consider using a camera with a \"red eye double flash\" feature, to prevent red eyes. Shadows. Which direction should they be pointing? Do you even want them in your photo? Also be careful that your subject's face isn't blacked out (unless you want it that way). This can happen when you are pointing the camera into the sun. Cropping and Centering. Do you want your whole subject in the photo? Should they be off to the side or centered? Be creative with these as they can distinguish a forgettable photo into a memorable one. Zoom. Generally, zoomed in photos give more impact. Again it depends on what the judges will be looking for. You may consider using a telephoto or other special lens, depending on what your subject is. Color. Try looking at a color wheel for creative ideas. For example: If you are photographing some blue flowers, you may want to mix them with orange flowers for contrast, as the two are opposites on the color wheel. Consider the following: Complimentary, Split Complimentary, Triad, Analogous, Monochromatic, Sepia, Black and White. Candid Shots. Sometimes the best shots are the unplanned ones. Keep your camera with you at all times. If the contest rules allow it, look for old photos to submit. Entering the Contest Make sure you enter on time!  Fill out the forms neatly. Make sure you fill in all the information. It's best to fill out forms with black or blue pen. Make sure you enclose your photo!",
  "tyn_model":[
    "camera",
    "pen"
  ],
  "tyn_section":[

  ]
}