{
  "title":"How to Make Converted Rice",
  "url":"https://www.wikihow.com/Make-Converted-Rice",
  "category_hierarchy":[
    "Food and Entertaining",
    "Recipes",
    "Rice and Beans"
  ],
  "methods":[
    {
      "name":"Stovetop Preparation of Converted Rice",
      "steps":[
        {
          "headline":"Using a formula of 1 part converted rice to 3 parts water, mix together the water and rice in a large pot with a lid.",
          "description":"For 2 servings, that would be a 1/2 cup rice and 1 1/2 cups water."
        },
        {
          "headline":"Add some fat.",
          "description":"Add 1 tablespoon of oil, margarine or butter to every 1/2 cup of rice in the pot."
        },
        {
          "headline":"Cover the pot and bring the water to a boil.",
          "description":""
        },
        {
          "headline":"Turn the heat down until the rice is just simmering.",
          "description":""
        },
        {
          "headline":"Cook the rice until tender, stirring occasionally, (about 20 minutes).",
          "description":"Pay close attention near the end of the cooking period as the rice absorbs most of the water so that it doesn't scorch. You can add a small amount of warm water if the rice doesn't seem tender enough but is sticking to the pan bottom."
        },
        {
          "headline":"If you are going to use the rice in a recipe that will be cooked further, you may want to cook the rice less, until it is just starting to soften.",
          "description":"Consult your recipe for directions. Reduce the cooking time by 5-10 minutes if the recipe calls for using regular rice."
        }
      ]
    },
    {
      "name":"Making Converted Rice in the Microwave",
      "steps":[
        {
          "headline":"Place 1 part converted rice to 3 parts water in a microwave-safe bowl with a vented cover.",
          "description":"That's 1 cup of rice to 3 cups of water for 4 servings."
        },
        {
          "headline":"Add 1 tablespoon of oil, margarine or butter to the rice and water.",
          "description":""
        },
        {
          "headline":"Cover the microwave bowl and microwave on high about 15 minutes, until the rice is tender and fluffy.",
          "description":"Stop the microwave every 5 minutes and stir the rice for best results. Pay close attention to the rice as it nears the end of cooking and add a small amount (1/4 cup) warm water if the rice appears too dry."
        }
      ]
    },
    {
      "name":"Recipes to Try with Converted Rice",
      "steps":[
        {
          "headline":"Make rice pudding.",
          "description":"This recipe makes about 4 servings. Use the stovetop method given above to cook 3/4 cup of converted rice. That's 3/4 cup of rice to 2 1/2 cups of water. Combine the cooked rice with 1 1/2 cups milk, 1/3 cup sugar, 1/4 teaspoon salt, 1/4 teaspoon cinnamon in a clean pan and cook over medium heat, stirring frequently until thick and creamy, about 15 minutes. Add 1/2 cup of additional milk, 1 beaten egg and a 1/2 cup of raisins. Stir well and cook for an additional 2 minutes. Remove from the heat and stir in 1 tablespoon butter or margarine and 1/2 teaspoon vanilla extract. Serve warm or chilled."
        },
        {
          "headline":"Make Texan Rice Salad.",
          "description":"This makes 4-6 servings. Cook 1 cup of converted rice on the stove or in the micro wave as directed above. Let the rice cool to room temperature. Combine 1/2 cup mayonnaise, 1/2 cup salsa, 1/3 cup sour cream, 1 finely minced jalapeno pepper and 1 finely minced small onion in a bowl. Set aside. In a large bowl combine the rice, 1 pound of medium cooked shrimp, 1 cup of diced pepper jack cheese, 1-15 oz. (425.24 g)  can of drained corn and 1 -15 oz. ( 425.24 g) can of cooked black beans and 2 medium diced tomatoes and stir well. Pour the mayonnaise mixture over the rice mixture and toss to coat the rice and shrimp mixture."
        }
      ]
    }
  ],
  "text":" Stovetop Preparation of Converted Rice Using a formula of 1 part converted rice to 3 parts water, mix together the water and rice in a large pot with a lid. For 2 servings, that would be a 1/2 cup rice and 1 1/2 cups water. Add some fat. Add 1 tablespoon of oil, margarine or butter to every 1/2 cup of rice in the pot. Cover the pot and bring the water to a boil.  Turn the heat down until the rice is just simmering.  Cook the rice until tender, stirring occasionally, (about 20 minutes). Pay close attention near the end of the cooking period as the rice absorbs most of the water so that it doesn't scorch. You can add a small amount of warm water if the rice doesn't seem tender enough but is sticking to the pan bottom. If you are going to use the rice in a recipe that will be cooked further, you may want to cook the rice less, until it is just starting to soften. Consult your recipe for directions. Reduce the cooking time by 5-10 minutes if the recipe calls for using regular rice. Making Converted Rice in the Microwave Place 1 part converted rice to 3 parts water in a microwave-safe bowl with a vented cover. That's 1 cup of rice to 3 cups of water for 4 servings. Add 1 tablespoon of oil, margarine or butter to the rice and water.  Cover the microwave bowl and microwave on high about 15 minutes, until the rice is tender and fluffy. Stop the microwave every 5 minutes and stir the rice for best results. Pay close attention to the rice as it nears the end of cooking and add a small amount (1/4 cup) warm water if the rice appears too dry. Recipes to Try with Converted Rice Make rice pudding. This recipe makes about 4 servings. Use the stovetop method given above to cook 3/4 cup of converted rice. That's 3/4 cup of rice to 2 1/2 cups of water. Combine the cooked rice with 1 1/2 cups milk, 1/3 cup sugar, 1/4 teaspoon salt, 1/4 teaspoon cinnamon in a clean pan and cook over medium heat, stirring frequently until thick and creamy, about 15 minutes. Add 1/2 cup of additional milk, 1 beaten egg and a 1/2 cup of raisins. Stir well and cook for an additional 2 minutes. Remove from the heat and stir in 1 tablespoon butter or margarine and 1/2 teaspoon vanilla extract. Serve warm or chilled. Make Texan Rice Salad. This makes 4-6 servings. Cook 1 cup of converted rice on the stove or in the micro wave as directed above. Let the rice cool to room temperature. Combine 1/2 cup mayonnaise, 1/2 cup salsa, 1/3 cup sour cream, 1 finely minced jalapeno pepper and 1 finely minced small onion in a bowl. Set aside. In a large bowl combine the rice, 1 pound of medium cooked shrimp, 1 cup of diced pepper jack cheese, 1-15 oz. (425.24 g)  can of drained corn and 1 -15 oz. ( 425.24 g) can of cooked black beans and 2 medium diced tomatoes and stir well. Pour the mayonnaise mixture over the rice mixture and toss to coat the rice and shrimp mixture.",
  "tyn_model":[
    "rice",
    "water",
    "margarine",
    "butter",
    "microwave",
    "pot",
    "milk",
    "mayonnaise",
    "shrimp",
    "large pot",
    "oil",
    "microwave-safe bowl",
    "microwave bowl",
    "rice pudding",
    "stovetop method",
    "sugar",
    "salt",
    "cinnamon",
    "egg",
    "raisins",
    "vanilla",
    "stove",
    "salsa",
    "sour cream",
    "jalapeno pepper",
    "small onion",
    "bowl",
    "pepper jack cheese",
    "drained corn",
    "cooked black beans",
    "tomatoes"
  ],
  "tyn_section":[

  ]
}