{
  "title":"How to Make a Squash Casserole",
  "url":"https://www.wikihow.com/Make-a-Squash-Casserole",
  "category_hierarchy":[
    "Food and Entertaining",
    "Recipes",
    "Fruits and Vegetables",
    "Squash"
  ],
  "methods":[
    {
      "name":"Cooking Classic Squash Casserole",
      "steps":[
        {
          "headline":"Preheat the oven to 350 \u00b0F (177 \u00b0C) and grease a baking dish.",
          "description":"Use a 2 US qt (1.9 L) baking dish or a pan that's around 7 by 11 inches (18 cm \u00d7 28 cm) in size. Spray the inside with a little cooking spray or brush vegetable oil to prevent the casserole from sticking."
        },
        {
          "headline":"Chop 1 onion and slice 3 pounds (1.4 kg) of yellow squash.",
          "description":"Peel a yellow onion and chop it into \u20442 inch (1.3 cm) pieces. Then cut the yellow squash into \u20444 inch (0.64 cm) thick slices. 3 pounds (1.4 kg) of yellow squash is about 5 medium-sized squash or 3 large squash."
        },
        {
          "headline":"Saut\u00e9 the onion and squash over medium-high for 10 minutes.",
          "description":"Put 3 tablespoons (42 g) of the butter into a large skillet and turn the burner to medium-high. Once the oil melts, add the chopped onion, sliced squash, and 1 teaspoon (5.5 g) of kosher salt. Stir and cook the vegetables until the squash is tender. The squash should release liquid that evaporates as it cooks."
        },
        {
          "headline":"Drain the vegetables in a colander for 5 minutes.",
          "description":"Set a colander in the sink and put the saut\u00e9ed vegetables into it. Leave the vegetables to sit for 5 minutes so any liquid left in the vegetables drains into the sink.Did You Know? It's important to drain any liquid from the squash so that the casserole doesn't become soggy."
        },
        {
          "headline":"Mix the eggs, sour cream, cheese, mayo, and spices in a bowl.",
          "description":"Get out a large mixing bowl and crack 2 eggs into it. Lightly beat them with a fork and then stir in 1 cup (230 g) of sour cream, 1 cup (113 g) of shredded Cheddar cheese, 1/2 cup (54 g) of shredded Swiss cheese, 1/2 cup (116 g) of mayonnaise, and:\n1 teaspoon (5.5 g) of kosher salt\n2 teaspoons (1.5 g) of chopped fresh thyme\n1/2 teaspoon (0.5 g) of black pepper"
        },
        {
          "headline":"Stir in the vegetables and spread the mixture in the pan.",
          "description":"Add the saut\u00e9ed onion and squash to the bowl with the creamy mixture. Use a large spoon to carefully fold in vegetables until they're combined. Then spread the casserole into the greased baking dish."
        },
        {
          "headline":"Melt the remaining butter and stir in the crackers and Parmesan.",
          "description":"Put the remaining 3 tablespoons (42 g) of butter into a microwave-safe bowl and microwave it for about 25 seconds. Once the butter is melted, remove the bowl and stir in 2 sleeves (224 g) of coarsely crushed buttery crackers along with 1/4 cup (25 g) of shredded Parmesan cheese. If you can't find round buttery crackers, you can use saltines instead."
        },
        {
          "headline":"Scatter the topping over the casserole and bake it for 20 minutes.",
          "description":"Sprinkle the buttery cracker topping evenly over the casserole and put the pan in the preheated oven. Bake the squash casserole until the topping is golden brown and crunchy. Serve the casserole while it's hot. Although you can refrigerate covered leftovers for up to 1 or 2 days, the casserole will become soggy as it's stored."
        }
      ]
    },
    {
      "name":"Trying Variations",
      "steps":[
        {
          "headline":"Replace the cracker topping.",
          "description":"If you want a topping that has a richer herb flavor and less crunch, don't use the cracker topping. Instead, stir 2 cups (400 g) of dry herb stuffing with 4 tablespoons (56 g) of melted butter and scatter it over the casserole before baking. If you want a crunchy topping but don't want to use the crackers, substitute the same amount of fried onions. Scatter the plain fried onions over the casserole and bake it."
        },
        {
          "headline":"Substitute zucchini for the yellow squash.",
          "description":"If you have an abundance of zucchini that you want to use up, use the zucchini in place of the yellow squash. Keep the amount the same and slice the zucchini to \u20444 inch (0.64 cm) slices. You can also use a mix of zucchini and yellow squash."
        },
        {
          "headline":"Add a bell pepper to the saut\u00e9ed vegetables.",
          "description":"If you'd like to include more vegetables in the casserole, chop  a red bell pepper into \u20442 inch (1.3 cm) pieces and add it to the skillet when you saut\u00e9 the squash and onion.Tip: For a slightly sweet flavor, stir a drained jar of pimientos into the creamy filling."
        },
        {
          "headline":"Use a can of condensed soup in place of the mayonnaise.",
          "description":"To get a creamy, rich flavor, open a can of condensed soup and add it to the creamy filling mixture. Leave out the mayonnaise since the soup will thicken the filling. Use any of these condensed soups:\nCream of celery soup\nCream of chicken soup\nCream of mushroom soup"
        }
      ]
    }
  ],
  "text":" Cooking Classic Squash Casserole Preheat the oven to 350 \u00b0F (177 \u00b0C) and grease a baking dish. Use a 2 US qt (1.9 L) baking dish or a pan that's around 7 by 11 inches (18 cm \u00d7 28 cm) in size. Spray the inside with a little cooking spray or brush vegetable oil to prevent the casserole from sticking. Chop 1 onion and slice 3 pounds (1.4 kg) of yellow squash. Peel a yellow onion and chop it into \u20442 inch (1.3 cm) pieces. Then cut the yellow squash into \u20444 inch (0.64 cm) thick slices. 3 pounds (1.4 kg) of yellow squash is about 5 medium-sized squash or 3 large squash. Saut\u00e9 the onion and squash over medium-high for 10 minutes. Put 3 tablespoons (42 g) of the butter into a large skillet and turn the burner to medium-high. Once the oil melts, add the chopped onion, sliced squash, and 1 teaspoon (5.5 g) of kosher salt. Stir and cook the vegetables until the squash is tender. The squash should release liquid that evaporates as it cooks. Drain the vegetables in a colander for 5 minutes. Set a colander in the sink and put the saut\u00e9ed vegetables into it. Leave the vegetables to sit for 5 minutes so any liquid left in the vegetables drains into the sink.Did You Know? It's important to drain any liquid from the squash so that the casserole doesn't become soggy. Mix the eggs, sour cream, cheese, mayo, and spices in a bowl. Get out a large mixing bowl and crack 2 eggs into it. Lightly beat them with a fork and then stir in 1 cup (230 g) of sour cream, 1 cup (113 g) of shredded Cheddar cheese, 1/2 cup (54 g) of shredded Swiss cheese, 1/2 cup (116 g) of mayonnaise, and:\n1 teaspoon (5.5 g) of kosher salt\n2 teaspoons (1.5 g) of chopped fresh thyme\n1/2 teaspoon (0.5 g) of black pepper Stir in the vegetables and spread the mixture in the pan. Add the saut\u00e9ed onion and squash to the bowl with the creamy mixture. Use a large spoon to carefully fold in vegetables until they're combined. Then spread the casserole into the greased baking dish. Melt the remaining butter and stir in the crackers and Parmesan. Put the remaining 3 tablespoons (42 g) of butter into a microwave-safe bowl and microwave it for about 25 seconds. Once the butter is melted, remove the bowl and stir in 2 sleeves (224 g) of coarsely crushed buttery crackers along with 1/4 cup (25 g) of shredded Parmesan cheese. If you can't find round buttery crackers, you can use saltines instead. Scatter the topping over the casserole and bake it for 20 minutes. Sprinkle the buttery cracker topping evenly over the casserole and put the pan in the preheated oven. Bake the squash casserole until the topping is golden brown and crunchy. Serve the casserole while it's hot. Although you can refrigerate covered leftovers for up to 1 or 2 days, the casserole will become soggy as it's stored. Trying Variations Replace the cracker topping. If you want a topping that has a richer herb flavor and less crunch, don't use the cracker topping. Instead, stir 2 cups (400 g) of dry herb stuffing with 4 tablespoons (56 g) of melted butter and scatter it over the casserole before baking. If you want a crunchy topping but don't want to use the crackers, substitute the same amount of fried onions. Scatter the plain fried onions over the casserole and bake it. Substitute zucchini for the yellow squash. If you have an abundance of zucchini that you want to use up, use the zucchini in place of the yellow squash. Keep the amount the same and slice the zucchini to \u20444 inch (0.64 cm) slices. You can also use a mix of zucchini and yellow squash. Add a bell pepper to the saut\u00e9ed vegetables. If you'd like to include more vegetables in the casserole, chop  a red bell pepper into \u20442 inch (1.3 cm) pieces and add it to the skillet when you saut\u00e9 the squash and onion.Tip: For a slightly sweet flavor, stir a drained jar of pimientos into the creamy filling. Use a can of condensed soup in place of the mayonnaise. To get a creamy, rich flavor, open a can of condensed soup and add it to the creamy filling mixture. Leave out the mayonnaise since the soup will thicken the filling. Use any of these condensed soups:\nCream of celery soup\nCream of chicken soup\nCream of mushroom soup",
  "tyn_model":[
    "onion",
    "yellow squash",
    "squash",
    "butter",
    "zucchini",
    "baking dish",
    "bowl",
    "mayonnaise",
    "oven",
    "kosher salt",
    "colander",
    "eggs",
    "sour cream",
    "vegetables",
    "pan",
    "crackers",
    "cracker topping",
    "fried onions",
    "condensed soup",
    "\u00d7 28",
    "cooking spray",
    "vegetable oil",
    "yellow onion",
    "large skillet",
    "burner",
    "oil",
    "cheese",
    "mayo",
    "spices",
    "large mixing bowl",
    "fork",
    "shredded cheddar cheese",
    "swiss cheese",
    "thyme",
    "black pepper",
    "large spoon",
    "parmesan",
    "microwave-safe bowl",
    "microwave",
    "parmesan cheese",
    "buttery crackers",
    "saltines",
    "buttery cracker",
    "dry herb stuffing",
    "bell pepper",
    "red bell pepper",
    "skillet",
    "pimientos",
    "condensed soups",
    "celery soup",
    "chicken soup",
    "of mushroom"
  ],
  "tyn_section":[

  ]
}