{
  "title":"How to Play Zombie Tag",
  "url":"https://www.wikihow.com/Play-Zombie-Tag",
  "category_hierarchy":[
    "Hobbies and Crafts",
    "Games"
  ],
  "methods":[
    {
      "name":"Playing Basic Zombie Tag",
      "steps":[
        {
          "headline":"Gather at least four players.",
          "description":"This is a game for four or more people. One person begins the game as the zombie, and the others are humans. In this game, zombies can\u2019t run, but humans can."
        },
        {
          "headline":"Find a large space to play.",
          "description":"You can play this game in any space big enough for your players to run around. It can be played indoors, outdoors, in an open area, or an area with lots of hiding spaces. There is no home base in this game."
        },
        {
          "headline":"Choose a zombie.",
          "description":"If this is your first round, choose a zombie by playing an elimination game, like asking everyone to choose a number. The winner of the game is the zombie! If you\u2019ve just finished playing a round, the last remaining human can't be the new zombie."
        },
        {
          "headline":"Give the humans a head start.",
          "description":"The zombie should stay where they are for 15-20 seconds while the humans start running."
        },
        {
          "headline":"Remember the rules if you're a zombie.",
          "description":"Zombies can't run! They also can't pretend to be human or leave the play area to ambush humans."
        },
        {
          "headline":"Tag the humans.",
          "description":"If you\u2019re the zombie, your goal is to tag as many humans as possible by reaching out and touching them. Once they are tagged, they become zombies and can tag other humans. Zombies can\u2019t pretend to be human. This is a good opportunity to get into character!"
        },
        {
          "headline":"Determine the winner.",
          "description":"The game continues until there is only one human left. This person is the winner, and they can't be the zombie in the next round."
        }
      ]
    },
    {
      "name":"Playing Doctor\u2019s Antidote",
      "steps":[
        {
          "headline":"Get at least five players.",
          "description":"This game requires at least five players to work well. One person is the Doctor, who has the imaginary antidote to the zombie outbreak. At least two people will be Humans, who help the Doctor get to home base. They can run. At least two players are zombies, who cannot run."
        },
        {
          "headline":"Choose a spot to play.",
          "description":"You\u2019ll need a space with plenty of room and at least one landmark to act as home base. Parks, rec centers, or gyms would be great places to play."
        },
        {
          "headline":"Pick a home base.",
          "description":"The object of the game is for the Doctor to make it to home base with the antidote. Choose a visible landmark to act as home base, like a tree, a sign, or a sidewalk."
        },
        {
          "headline":"Choose a Doctor.",
          "description":"You can choose a Doctor by any method you want--elimination games, picking a number, or simply volunteering."
        },
        {
          "headline":"Stand in a circle and close your eyes--unless you\u2019re the Doctor!",
          "description":"The Doctor chooses at least two zombies by tapping them on the head. The zombies can open their eyes and look at each other, but everyone else must keep their eyes shut."
        },
        {
          "headline":"Choose runner and angel zombies (optional).",
          "description":"If you have more than ten people, you can have the Doctor choose a runner zombie and an angel zombie as well. The runner zombie can run, unlike the other zombies. The angel can turn zombies back into humans, but only once for each person. The angel also is unaffected by zombies. This step is completely optional, but it might make the game more fun!"
        },
        {
          "headline":"Give the Doctor one minute to hide.",
          "description":"Everybody, including the zombies, should close their eyes and wait one minute for the Doctor to hide. The game begins when the minute is up! You can count to sixty, or set a timer on your phone."
        },
        {
          "headline":"Wait an extra minute to start acting like zombies.",
          "description":"If you are a zombie, wait an extra minute before you start playing your role. This will give the humans a chance to get further away from you, which will help the game last longer. Show the other players that you\u2019re a zombie by walking slowly with your arms out in front of you, groaning the word \u201cBrains!\u201d over and over again."
        },
        {
          "headline":"Touch the humans to tag them!",
          "description":"If you are a zombie, tagging the humans or the Doctor will turn them into zombies. Your goal is to turn all of the humans into zombies before they can bring the Doctor to home base."
        },
        {
          "headline":"Get the Doctor to home base.",
          "description":"If you\u2019re a human (or the Doctor! ), your goal is to bring the Doctor to home base. If you\u2019re turned into a zombie, you can start tagging others. The Doctor can only get to home base alone if all the humans have been turned into zombies."
        },
        {
          "headline":"Call the winners!",
          "description":"If the humans bring the Doctor to home base safely, then it's a human victory! If everyone has turned into a zombie, then it's a zombie victory!"
        }
      ]
    },
    {
      "name":"Playing Zombie Racing",
      "steps":[
        {
          "headline":"Choose at least four players.",
          "description":"You\u2019ll need at least four players for this game. There should be one zombie for every three or four runners. The zombies can\u2019t run, but the runners can. You can pick your zombies any way you\u2019d like."
        },
        {
          "headline":"Set up the racetrack.",
          "description":"Your track should be at long enough for the game to last about five minutes. There should be clear start and finish lines, and clear side boundaries--runners can\u2019t leave the track!"
        },
        {
          "headline":"Get everybody into position.",
          "description":"The runners should be lined up at the starting line, but the zombies can be anywhere they want along the track."
        },
        {
          "headline":"Start running.",
          "description":"The object is to reach the finish line without being tagged by a zombie. Zombies can be anywhere on the track and can even stand outside the track. If a zombie tags you, you become a zombie. If you bump into another runner, you become a zombie. The person you bumped into does not become a zombie, but you can tag them. If you leave the track area, you become a zombie."
        },
        {
          "headline":"Cheer the winner!",
          "description":"The winner is the first human to cross the finish line. If no humans make it across, there is no winner."
        }
      ]
    },
    {
      "name":"Playing Zombie Zombie",
      "steps":[
        {
          "headline":"Get some friends.",
          "description":"2 will work, but more is fun too!"
        },
        {
          "headline":"Find a trampoline/bounce house.",
          "description":"This will be more fun because you bounce around, but safer since you cant step on anything pointy."
        },
        {
          "headline":"Have one person be \"it\".",
          "description":"\"It\" will lay down in the middle."
        },
        {
          "headline":"Have the other people run around the zombie saying, \"Zombie, Zombie, come alive.",
          "description":"When I count to the number 5!\" They then proceed to count to 5. Say this once."
        },
        {
          "headline":"When they say that, \"It\" gets up and walks around blindly trying to tag someone else.",
          "description":""
        },
        {
          "headline":"Once \"It\" tags someone, start the game over with the tagged person being \"It\".",
          "description":""
        },
        {
          "headline":"Have Fun!",
          "description":""
        }
      ]
    }
  ],
  "text":" Playing Basic Zombie Tag Gather at least four players. This is a game for four or more people. One person begins the game as the zombie, and the others are humans. In this game, zombies can\u2019t run, but humans can. Find a large space to play. You can play this game in any space big enough for your players to run around. It can be played indoors, outdoors, in an open area, or an area with lots of hiding spaces. There is no home base in this game. Choose a zombie. If this is your first round, choose a zombie by playing an elimination game, like asking everyone to choose a number. The winner of the game is the zombie! If you\u2019ve just finished playing a round, the last remaining human can't be the new zombie. Give the humans a head start. The zombie should stay where they are for 15-20 seconds while the humans start running. Remember the rules if you're a zombie. Zombies can't run! They also can't pretend to be human or leave the play area to ambush humans. Tag the humans. If you\u2019re the zombie, your goal is to tag as many humans as possible by reaching out and touching them. Once they are tagged, they become zombies and can tag other humans. Zombies can\u2019t pretend to be human. This is a good opportunity to get into character! Determine the winner. The game continues until there is only one human left. This person is the winner, and they can't be the zombie in the next round. Playing Doctor\u2019s Antidote Get at least five players. This game requires at least five players to work well. One person is the Doctor, who has the imaginary antidote to the zombie outbreak. At least two people will be Humans, who help the Doctor get to home base. They can run. At least two players are zombies, who cannot run. Choose a spot to play. You\u2019ll need a space with plenty of room and at least one landmark to act as home base. Parks, rec centers, or gyms would be great places to play. Pick a home base. The object of the game is for the Doctor to make it to home base with the antidote. Choose a visible landmark to act as home base, like a tree, a sign, or a sidewalk. Choose a Doctor. You can choose a Doctor by any method you want--elimination games, picking a number, or simply volunteering. Stand in a circle and close your eyes--unless you\u2019re the Doctor! The Doctor chooses at least two zombies by tapping them on the head. The zombies can open their eyes and look at each other, but everyone else must keep their eyes shut. Choose runner and angel zombies (optional). If you have more than ten people, you can have the Doctor choose a runner zombie and an angel zombie as well. The runner zombie can run, unlike the other zombies. The angel can turn zombies back into humans, but only once for each person. The angel also is unaffected by zombies. This step is completely optional, but it might make the game more fun! Give the Doctor one minute to hide. Everybody, including the zombies, should close their eyes and wait one minute for the Doctor to hide. The game begins when the minute is up! You can count to sixty, or set a timer on your phone. Wait an extra minute to start acting like zombies. If you are a zombie, wait an extra minute before you start playing your role. This will give the humans a chance to get further away from you, which will help the game last longer. Show the other players that you\u2019re a zombie by walking slowly with your arms out in front of you, groaning the word \u201cBrains!\u201d over and over again. Touch the humans to tag them! If you are a zombie, tagging the humans or the Doctor will turn them into zombies. Your goal is to turn all of the humans into zombies before they can bring the Doctor to home base. Get the Doctor to home base. If you\u2019re a human (or the Doctor! ), your goal is to bring the Doctor to home base. If you\u2019re turned into a zombie, you can start tagging others. The Doctor can only get to home base alone if all the humans have been turned into zombies. Call the winners! If the humans bring the Doctor to home base safely, then it's a human victory! If everyone has turned into a zombie, then it's a zombie victory! Playing Zombie Racing Choose at least four players. You\u2019ll need at least four players for this game. There should be one zombie for every three or four runners. The zombies can\u2019t run, but the runners can. You can pick your zombies any way you\u2019d like. Set up the racetrack. Your track should be at long enough for the game to last about five minutes. There should be clear start and finish lines, and clear side boundaries--runners can\u2019t leave the track! Get everybody into position. The runners should be lined up at the starting line, but the zombies can be anywhere they want along the track. Start running. The object is to reach the finish line without being tagged by a zombie. Zombies can be anywhere on the track and can even stand outside the track. If a zombie tags you, you become a zombie. If you bump into another runner, you become a zombie. The person you bumped into does not become a zombie, but you can tag them. If you leave the track area, you become a zombie. Cheer the winner! The winner is the first human to cross the finish line. If no humans make it across, there is no winner. Playing Zombie Zombie Get some friends. 2 will work, but more is fun too! Find a trampoline/bounce house. This will be more fun because you bounce around, but safer since you cant step on anything pointy. Have one person be \"it\". \"It\" will lay down in the middle. Have the other people run around the zombie saying, \"Zombie, Zombie, come alive. When I count to the number 5!\" They then proceed to count to 5. Say this once. When they say that, \"It\" gets up and walks around blindly trying to tag someone else.  Once \"It\" tags someone, start the game over with the tagged person being \"It\".  Have Fun! ",
  "tyn_model":[
    "zombies",
    "zombie",
    "doctor",
    "zombie tag",
    "humans",
    "\u201cbrains",
    "\u201d over",
    "trampoline/"
  ],
  "tyn_section":[

  ]
}