{
  "title":"How to Minimize Lag While Gaming Online",
  "url":"https://www.wikihow.com/Minimize-Lag-While-Gaming-Online",
  "category_hierarchy":[
    "Hobbies and Crafts",
    "Games",
    "Video Games",
    "Electronic Game Strategies",
    "Online Game Strategies"
  ],
  "parts":[
    {
      "name":"Tweaking the settings",
      "steps":[
        {
          "headline":"Optimize your game settings.",
          "description":"All popular online games have network settings, its just a case of finding them. Search online for a guide to tweaking your game."
        },
        {
          "headline":"Configure your firewall properly.",
          "description":"Badly configured firewalls can stop some packets getting through, causing loss or lag."
        }
      ]
    },
    {
      "name":"Improving speed",
      "steps":[
        {
          "headline":"Speed up your PC.",
          "description":"Slow PCs may not be able to keep up with the amount of packets. Close antivirus programs and other background applications."
        },
        {
          "headline":"Change your internet connection.",
          "description":"It might just be that your ISP is not suited to gaming, or that your current package is just not fast enough."
        },
        {
          "headline":"Use a wired connection.",
          "description":"If you have a laptop, simply connect your computer directly to your home router/modem via a Ethernet cable. This can help speed your internet speeds up by having you directly connected into the network instead of being a wireless signal which can slow down upload/download rates."
        },
        {
          "headline":"Make the gaming window smaller.",
          "description":"The smaller the window, the higher the quality of the game."
        }
      ]
    }
  ],
  "text":" Tweaking the settings Optimize your game settings. All popular online games have network settings, its just a case of finding them. Search online for a guide to tweaking your game. Configure your firewall properly. Badly configured firewalls can stop some packets getting through, causing loss or lag. Improving speed Speed up your PC. Slow PCs may not be able to keep up with the amount of packets. Close antivirus programs and other background applications. Change your internet connection. It might just be that your ISP is not suited to gaming, or that your current package is just not fast enough. Use a wired connection. If you have a laptop, simply connect your computer directly to your home router/modem via a Ethernet cable. This can help speed your internet speeds up by having you directly connected into the network instead of being a wireless signal which can slow down upload/download rates. Make the gaming window smaller. The smaller the window, the higher the quality of the game.",
  "tyn_model":[
    "firewall",
    "isp",
    "laptop",
    "computer",
    "internet"
  ],
  "tyn_section":[

  ]
}