{
  "title":"How to Clean up Dog Urine",
  "url":"https://www.wikihow.com/Clean-up-Dog-Urine",
  "category_hierarchy":[
    "Home and Garden",
    "Housekeeping",
    "Cleaning"
  ],
  "methods":[
    {
      "name":"Cleaning Dog Urine From Bare Flooring",
      "steps":[
        {
          "headline":"Absorb the mess.",
          "description":"Tear several pieces of paper towel off the roll. Lightly place the paper towels over the spill. Let them soak up the urine; add more paper towels if necessary."
        },
        {
          "headline":"Wipe up the urine.",
          "description":"Put on rubber or plastic gloves. Pick up the wet paper towels. Place the paper towels in a thick, plastic bag and tie it shut to block out the odor of the urine. Throw the bag in the garbage."
        },
        {
          "headline":"Clean and disinfect the floor.",
          "description":"Spray an enzyme cleaner on the part of the floor where you wiped up the urine. Using a damp cloth, wipe down the area thoroughly. Allow to air dry. Do not use bleach to clean urine off of the floor; the combination of the ammonia in the urine and the bleach will give off harmful fumes."
        }
      ]
    },
    {
      "name":"Cleaning Dog Urine Out of the Carpet",
      "steps":[
        {
          "headline":"Blot the area.",
          "description":"To  remove dog urine from the carpet, start by adding water and a few drops of dish soap to a thick cluster of paper towels. Place over the area of the carpet that your dog urinated on. Using your foot or a gloved hand, press down the mess lightly to absorb as much as possible."
        },
        {
          "headline":"Make a cleaning solution.",
          "description":"Mix one cup of white vinegar and one cup of water. Add a tablespoon of baking soda, stir and pour the mixture into a spray bottle. Spray a thick layer of the mixture onto the soiled area of the carpet and let it sit for 5-6 minutes. You can also opt for a store-bought carpet cleaning spray, but avoid products containing chlorine, ammonia and sodium lauryl sulfate, which can be harmful to pets."
        },
        {
          "headline":"Pat down the area.",
          "description":"With a fresh cloth, gently blot the area to absorb the solution. Let the carpet air dry. Keep pets away from the damp carpet while it dries."
        },
        {
          "headline":"Rent a carpet cleaner.",
          "description":"If the area is still stained, or if it still smells like urine after your first attempt to clean it, consider renting a carpet cleaner. Cleaners are usually available at local hardware stores or grocery stores for rental periods of 24 hours or more. Opt for a hot water extraction cleaner, the rates for which start at $20 a day for less expensive models. Be sure to follow directions carefully when using a rented carpet cleaner."
        }
      ]
    },
    {
      "name":"Washing Dog Urine Out of Bedding or Clothes",
      "steps":[
        {
          "headline":"Rinse thoroughly.",
          "description":"Before washing, rinse the soiled items under cold water. Keep rinsing until you have flushed out as much of the urine as possible. Wring out excess water."
        },
        {
          "headline":"Presoak the items.",
          "description":"Pretreat urine stains with a liquid detergent that contains enzymes; look for enzymes commonly used in cleaning products (proteases, amylases, lipases, cellulases and mannanases) in the ingredients list on the product label. Fill a sink or bathtub with cold water and soak the soiled bedding or clothing for 30 minutes. Remove the items and wring them out again."
        },
        {
          "headline":"Load the washing machine.",
          "description":"Place the items in the washing machine. Set a hot water wash cycle. Add detergent; if you are washing your dog's bedding, use a mild detergent that will not cause irritation to its skin."
        },
        {
          "headline":"Add vinegar to the wash. Add 1/2 cup of white vinegar to the softener dispenser of the machine.",
          "description":"Start the wash cycle. If there is no softener dispenser in your machine, run it as usual and add the vinegar at the beginning of the final rinse cycle. If the urine smell is too strong for these quantities, add a full cup of vinegar to the final rinse cycle."
        },
        {
          "headline":"Dry the items.",
          "description":"Run items through the dryer. Alternatively (and if possible) hang the items on a clothesline to dry. The outdoor air will help neutralize the odor of urine and freshen the fabric. Avoid using dryer sheets, which may irritate your dog's skin."
        }
      ]
    }
  ],
  "text":" Cleaning Dog Urine From Bare Flooring Absorb the mess. Tear several pieces of paper towel off the roll. Lightly place the paper towels over the spill. Let them soak up the urine; add more paper towels if necessary. Wipe up the urine. Put on rubber or plastic gloves. Pick up the wet paper towels. Place the paper towels in a thick, plastic bag and tie it shut to block out the odor of the urine. Throw the bag in the garbage. Clean and disinfect the floor. Spray an enzyme cleaner on the part of the floor where you wiped up the urine. Using a damp cloth, wipe down the area thoroughly. Allow to air dry. Do not use bleach to clean urine off of the floor; the combination of the ammonia in the urine and the bleach will give off harmful fumes. Cleaning Dog Urine Out of the Carpet Blot the area. To  remove dog urine from the carpet, start by adding water and a few drops of dish soap to a thick cluster of paper towels. Place over the area of the carpet that your dog urinated on. Using your foot or a gloved hand, press down the mess lightly to absorb as much as possible. Make a cleaning solution. Mix one cup of white vinegar and one cup of water. Add a tablespoon of baking soda, stir and pour the mixture into a spray bottle. Spray a thick layer of the mixture onto the soiled area of the carpet and let it sit for 5-6 minutes. You can also opt for a store-bought carpet cleaning spray, but avoid products containing chlorine, ammonia and sodium lauryl sulfate, which can be harmful to pets. Pat down the area. With a fresh cloth, gently blot the area to absorb the solution. Let the carpet air dry. Keep pets away from the damp carpet while it dries. Rent a carpet cleaner. If the area is still stained, or if it still smells like urine after your first attempt to clean it, consider renting a carpet cleaner. Cleaners are usually available at local hardware stores or grocery stores for rental periods of 24 hours or more. Opt for a hot water extraction cleaner, the rates for which start at $20 a day for less expensive models. Be sure to follow directions carefully when using a rented carpet cleaner. Washing Dog Urine Out of Bedding or Clothes Rinse thoroughly. Before washing, rinse the soiled items under cold water. Keep rinsing until you have flushed out as much of the urine as possible. Wring out excess water. Presoak the items. Pretreat urine stains with a liquid detergent that contains enzymes; look for enzymes commonly used in cleaning products (proteases, amylases, lipases, cellulases and mannanases) in the ingredients list on the product label. Fill a sink or bathtub with cold water and soak the soiled bedding or clothing for 30 minutes. Remove the items and wring them out again. Load the washing machine. Place the items in the washing machine. Set a hot water wash cycle. Add detergent; if you are washing your dog's bedding, use a mild detergent that will not cause irritation to its skin. Add vinegar to the wash. Add 1/2 cup of white vinegar to the softener dispenser of the machine. Start the wash cycle. If there is no softener dispenser in your machine, run it as usual and add the vinegar at the beginning of the final rinse cycle. If the urine smell is too strong for these quantities, add a full cup of vinegar to the final rinse cycle. Dry the items. Run items through the dryer. Alternatively (and if possible) hang the items on a clothesline to dry. The outdoor air will help neutralize the odor of urine and freshen the fabric. Avoid using dryer sheets, which may irritate your dog's skin.",
  "tyn_model":[
    "paper towels",
    "water",
    "carpet cleaner",
    "vinegar",
    "bleach",
    "white vinegar",
    "washing machine",
    "paper towel",
    "enzyme cleaner",
    "ammonia",
    "dish soap",
    "baking soda",
    "spray bottle",
    "sodium lauryl sulfate",
    "water extraction cleaner",
    "liquid detergent",
    "detergent",
    "softener dispenser",
    "dryer sheets"
  ],
  "tyn_section":[

  ]
}