{
  "title":"How to Catch a Pok\u00e9mon in Any Game",
  "url":"https://www.wikihow.com/Catch-a-Pok%C3%A9mon-in-Any-Game",
  "category_hierarchy":[
    "Hobbies and Crafts",
    "Games",
    "Video Games",
    "Multi Platform Games",
    "Pokemon Video Games"
  ],
  "methods":[
    {
      "name":"Catching Pok\u00e9mon in Pok\u00e9mon GO",
      "steps":[
        {
          "headline":"Open Pok\u00e9mon GO.",
          "description":"Tap the Pok\u00e9mon GO app icon, which resembles a Pok\u00e9 Ball. This will open the Pok\u00e9mon GO interface. If you aren't logged into your Pok\u00e9mon GO account, you'll need to tap Returning and enter your login information on the main screen when prompted. If you haven't yet downloaded Pok\u00e9mon GO, you can do so for free from the iPhone's App Store or an Android's Play Store."
        },
        {
          "headline":"Stock up on the right kind of Pok\u00e9 Balls.",
          "description":"If you're planning on catching a Pok\u00e9mon that's a higher level than you'd prefer, you may be able to use a Great Ball or an Ultra Ball to do so. You can find Pok\u00e9mon GO supplies, including Ball variations, at Pok\u00e9Stops, which are blue icons on the map typically found at monuments and other public points of interest. When you arrive at a Pok\u00e9Stop, tap its icon on the map to open its interface."
        },
        {
          "headline":"Walk until a Pok\u00e9mon shows up.",
          "description":"When you see a Pok\u00e9mon appear on your map, you can stop walking and proceed."
        },
        {
          "headline":"Select the Pok\u00e9mon.",
          "description":"Tap the Pok\u00e9mon on the map to do so. This will open the AR viewer. You may have to confirm a prompt telling you not to use Pok\u00e9mon GO in dangerous areas at this point."
        },
        {
          "headline":"Search for the Pok\u00e9mon's grass.",
          "description":"Slowly move your iPhone or Android around you. When you see grass appear on-screen, you can proceed."
        },
        {
          "headline":"Tap the grass.",
          "description":"Doing so will prompt the Pok\u00e9mon to pop up. You may have to tap the grass a couple of times before this happens."
        },
        {
          "headline":"Select a different Pok\u00e9 Ball if necessary.",
          "description":"If you selected different Balls to use from a Pok\u00e9Stop, you can equip the one you want to use by tapping the Pok\u00e9 Ball icon on the right side of the screen and then tapping the ball you want to use."
        },
        {
          "headline":"Swipe up to throw Pok\u00e9 Balls.",
          "description":"Tap and hold the ball to prime the Pok\u00e9mon for catching, then swipe up. Swiping directly up on your smartphone's screen will toss a Pok\u00e9 Ball in an arc; the faster you swipe, the farther the ball will go. You're aiming for the colored circle that appears inside of white circle that's around the Pok\u00e9mon. Your chances of catching the Pok\u00e9mon are best when the circle is at its smallest."
        },
        {
          "headline":"Wait for confirmation.",
          "description":"Once the Pok\u00e9 Ball lands on the Pok\u00e9mon successfully, you should see the Pok\u00e9 Ball rock about for a few seconds; if you see stars appear above the Ball, you've caught the Pok\u00e9mon. If the Pok\u00e9mon breaks out of the Ball, you'll have to try to catch it again."
        }
      ]
    },
    {
      "name":"Catching Pok\u00e9mon in Other Games",
      "steps":[
        {
          "headline":"Consider saving your game before attempting to catch a Pok\u00e9mon.",
          "description":"This is optional, but recommended: in case the Pok\u00e9mon faints, causes your Pok\u00e9mon to faint, flees, or uses too many of your Pok\u00e9 Balls, you can reload the save to try to catch it again. This is especially important when attempting to catch rare or legendary Pok\u00e9mon."
        },
        {
          "headline":"Select the correct variation of Pok\u00e9 Ball.",
          "description":"While standard Pok\u00e9 Balls have a 1x catch rate, you can use more expensive variations to increase your chances of catching harder Pok\u00e9mon. The following Balls are available in every Pok\u00e9mon game:\n\nGreat Ball \u2014 Increases the catch rate to 1.5x. Ultra Ball \u2014 Increases the catch rate to 2x. Timer Ball \u2014 Increases the catch rate as the battle goes on."
        },
        {
          "headline":"Wander around in some tall grass.",
          "description":"Grass is found outside of virtually any city's limits. Walking around in it will eventually cause a Pok\u00e9mon to appear, which will be indicated by a flashing screen and the Pok\u00e9mon showing up opposite your character."
        },
        {
          "headline":"Fight with the proper Pok\u00e9mon.",
          "description":"Depending on the Pok\u00e9mon you're trying to catch, you may have to select a different Pok\u00e9mon for the fight. You want a Pok\u00e9mon that will do adequate damage without one-shotting the Pok\u00e9mon you're trying to catch. Avoid using attacks that inflict a status effect (e.g., poison), as such effects can unexpectedly lower the Pok\u00e9mon's health to the point where it faints before you can capture it."
        },
        {
          "headline":"Get the other Pok\u00e9mon's health down.",
          "description":"At the very least, you'll want your selected Pok\u00e9mon's health bar to turn orange; if you're attempting to capture a legendary Pok\u00e9mon or a Pok\u00e9mon that's a higher level than your Pok\u00e9mon, try to get the health bar into the red zone. For some legendary Pok\u00e9mon, you'll want to get the health bar down to the last 10 points or so before attempting to capture it."
        },
        {
          "headline":"Select your Pok\u00e9 Ball.",
          "description":"Go into the BACKPACK menu and select the ball you want to use. This will cause your character to throw the Pok\u00e9 Ball at the Pok\u00e9mon."
        },
        {
          "headline":"Wait for confirmation.",
          "description":"After the ball is selected, an animation will play of the Pok\u00e9 Ball being tossed. The ball will then shift side-to-side a few times; if it does so three times and then stars come out from the ball, you've captured your Pok\u00e9mon successfully. If the Pok\u00e9mon breaks out of the ball, you'll need to try catching it again."
        }
      ]
    }
  ],
  "text":" Catching Pok\u00e9mon in Pok\u00e9mon GO Open Pok\u00e9mon GO. Tap the Pok\u00e9mon GO app icon, which resembles a Pok\u00e9 Ball. This will open the Pok\u00e9mon GO interface. If you aren't logged into your Pok\u00e9mon GO account, you'll need to tap Returning and enter your login information on the main screen when prompted. If you haven't yet downloaded Pok\u00e9mon GO, you can do so for free from the iPhone's App Store or an Android's Play Store. Stock up on the right kind of Pok\u00e9 Balls. If you're planning on catching a Pok\u00e9mon that's a higher level than you'd prefer, you may be able to use a Great Ball or an Ultra Ball to do so. You can find Pok\u00e9mon GO supplies, including Ball variations, at Pok\u00e9Stops, which are blue icons on the map typically found at monuments and other public points of interest. When you arrive at a Pok\u00e9Stop, tap its icon on the map to open its interface. Walk until a Pok\u00e9mon shows up. When you see a Pok\u00e9mon appear on your map, you can stop walking and proceed. Select the Pok\u00e9mon. Tap the Pok\u00e9mon on the map to do so. This will open the AR viewer. You may have to confirm a prompt telling you not to use Pok\u00e9mon GO in dangerous areas at this point. Search for the Pok\u00e9mon's grass. Slowly move your iPhone or Android around you. When you see grass appear on-screen, you can proceed. Tap the grass. Doing so will prompt the Pok\u00e9mon to pop up. You may have to tap the grass a couple of times before this happens. Select a different Pok\u00e9 Ball if necessary. If you selected different Balls to use from a Pok\u00e9Stop, you can equip the one you want to use by tapping the Pok\u00e9 Ball icon on the right side of the screen and then tapping the ball you want to use. Swipe up to throw Pok\u00e9 Balls. Tap and hold the ball to prime the Pok\u00e9mon for catching, then swipe up. Swiping directly up on your smartphone's screen will toss a Pok\u00e9 Ball in an arc; the faster you swipe, the farther the ball will go. You're aiming for the colored circle that appears inside of white circle that's around the Pok\u00e9mon. Your chances of catching the Pok\u00e9mon are best when the circle is at its smallest. Wait for confirmation. Once the Pok\u00e9 Ball lands on the Pok\u00e9mon successfully, you should see the Pok\u00e9 Ball rock about for a few seconds; if you see stars appear above the Ball, you've caught the Pok\u00e9mon. If the Pok\u00e9mon breaks out of the Ball, you'll have to try to catch it again. Catching Pok\u00e9mon in Other Games Consider saving your game before attempting to catch a Pok\u00e9mon. This is optional, but recommended: in case the Pok\u00e9mon faints, causes your Pok\u00e9mon to faint, flees, or uses too many of your Pok\u00e9 Balls, you can reload the save to try to catch it again. This is especially important when attempting to catch rare or legendary Pok\u00e9mon. Select the correct variation of Pok\u00e9 Ball. While standard Pok\u00e9 Balls have a 1x catch rate, you can use more expensive variations to increase your chances of catching harder Pok\u00e9mon. The following Balls are available in every Pok\u00e9mon game:\n\nGreat Ball \u2014 Increases the catch rate to 1.5x. Ultra Ball \u2014 Increases the catch rate to 2x. Timer Ball \u2014 Increases the catch rate as the battle goes on. Wander around in some tall grass. Grass is found outside of virtually any city's limits. Walking around in it will eventually cause a Pok\u00e9mon to appear, which will be indicated by a flashing screen and the Pok\u00e9mon showing up opposite your character. Fight with the proper Pok\u00e9mon. Depending on the Pok\u00e9mon you're trying to catch, you may have to select a different Pok\u00e9mon for the fight. You want a Pok\u00e9mon that will do adequate damage without one-shotting the Pok\u00e9mon you're trying to catch. Avoid using attacks that inflict a status effect (e.g., poison), as such effects can unexpectedly lower the Pok\u00e9mon's health to the point where it faints before you can capture it. Get the other Pok\u00e9mon's health down. At the very least, you'll want your selected Pok\u00e9mon's health bar to turn orange; if you're attempting to capture a legendary Pok\u00e9mon or a Pok\u00e9mon that's a higher level than your Pok\u00e9mon, try to get the health bar into the red zone. For some legendary Pok\u00e9mon, you'll want to get the health bar down to the last 10 points or so before attempting to capture it. Select your Pok\u00e9 Ball. Go into the BACKPACK menu and select the ball you want to use. This will cause your character to throw the Pok\u00e9 Ball at the Pok\u00e9mon. Wait for confirmation. After the ball is selected, an animation will play of the Pok\u00e9 Ball being tossed. The ball will then shift side-to-side a few times; if it does so three times and then stars come out from the ball, you've captured your Pok\u00e9mon successfully. If the Pok\u00e9mon breaks out of the ball, you'll need to try catching it again.",
  "tyn_model":[
    "pok\u00e9 ball",
    "pok\u00e9mon go",
    "pok\u00e9mon",
    "pok\u00e9 balls",
    "\u2014 increases",
    "pok\u00e9mon go supplies",
    "iphone",
    "smartphone",
    "grass",
    "poison"
  ],
  "tyn_section":[

  ]
}