{
  "title":"How to Make a Chicken Quesadilla",
  "url":"https://www.wikihow.com/Make-a-Chicken-Quesadilla",
  "category_hierarchy":[
    "Food and Entertaining",
    "Recipes",
    "World Cuisines",
    "Central and South American Cuisine",
    "Quesadillas"
  ],
  "methods":[
    {
      "name":"Standard Chicken Quesadilla",
      "steps":[
        {
          "headline":"Grease a baking sheet with a neutral cooking spray.",
          "description":""
        },
        {
          "headline":"Mix the chicken with the fajita seasoning.",
          "description":"Spread it on the greased baking sheet. Place it under a broiler for about five minutes. When the chicken has some color on the outside, remove it from the broiler and dice into smaller pieces. The chicken may still be undercooked at this point."
        },
        {
          "headline":"Preheat the oven to 350 degrees F (177 degrees C).",
          "description":""
        },
        {
          "headline":"In a large saucepan, heat the oil over medium heat.",
          "description":"Mix it with the green peppers, red peppers, onions, and chicken. Cook the veggies for about ten minutes, making sure to remove chicken once no longer pink on the inside."
        },
        {
          "headline":"Place the chicken and veggie mix onto the tortilla.",
          "description":""
        },
        {
          "headline":"Sprinkle it with cheese.",
          "description":""
        },
        {
          "headline":"Bake it for about ten minutes, or until the cheese has melted.",
          "description":""
        },
        {
          "headline":"Take the tortilla from the oven.",
          "description":""
        },
        {
          "headline":"Fold the stuffed tortilla in half.",
          "description":""
        },
        {
          "headline":"Enjoy it with a nice cerveza or a bottle of Sauvignon Blanc!",
          "description":""
        },
        {
          "headline":"Finished.",
          "description":""
        }
      ]
    },
    {
      "name":"Santa Fe Chicken Quesadilla",
      "steps":[
        {
          "headline":"Cook your chicken if you haven't already.",
          "description":"Many people who make chicken quesadillas used leftover chicken in their quesadillas. If you don't have pre-cooked chicken at your disposal, here are some ways that you can cook your chicken:\nPan-sear chicken. Season chicken with salt and pepper and begin searing it over medium heat in a well-oiled pan. To develop a nice, brown exterior, turn the heat up to medium-high just before the chicken is finished cooking. Oven-roast chicken. This is a great way of cooking a whole chicken. Butterfly a chicken in the oven. Another great way of cooking a whole chicken, butterflying is a quick technique that sounds more difficult than it is. Definitely worth trying!"
        },
        {
          "headline":"While the chicken is cooking, sweat the onions in a well-oiled skillet over medium heat.",
          "description":"Cook until onions are aromatic and translucent, about 4 minutes."
        },
        {
          "headline":"Add the corn to the onions.",
          "description":"Cook until a little bit of color develops on both the corn and the onions. Remove from skillet and set aside."
        },
        {
          "headline":"Lay one tortilla flat into the bottom of the saucepan.",
          "description":""
        },
        {
          "headline":"Add onions, corn, beans, chicken, and avocado.",
          "description":"Make sure all the ingredients are evenly spread across the bottom of the tortilla."
        },
        {
          "headline":"Layer the top of the ingredients with the Mexican cheese mix",
          "description":""
        },
        {
          "headline":"Cover with the second tortilla.",
          "description":""
        },
        {
          "headline":"Cook the tortilla over medium-low heat, flipping once, until color develops on both tortillas.",
          "description":"To expedite the process, cover the skillet with a lid while cooking."
        },
        {
          "headline":"Cut quesadilla into wedges and serve.",
          "description":"Enjoy!"
        }
      ]
    }
  ],
  "text":" Standard Chicken Quesadilla Grease a baking sheet with a neutral cooking spray.  Mix the chicken with the fajita seasoning. Spread it on the greased baking sheet. Place it under a broiler for about five minutes. When the chicken has some color on the outside, remove it from the broiler and dice into smaller pieces. The chicken may still be undercooked at this point. Preheat the oven to 350 degrees F (177 degrees C).  In a large saucepan, heat the oil over medium heat. Mix it with the green peppers, red peppers, onions, and chicken. Cook the veggies for about ten minutes, making sure to remove chicken once no longer pink on the inside. Place the chicken and veggie mix onto the tortilla.  Sprinkle it with cheese.  Bake it for about ten minutes, or until the cheese has melted.  Take the tortilla from the oven.  Fold the stuffed tortilla in half.  Enjoy it with a nice cerveza or a bottle of Sauvignon Blanc!  Finished.  Santa Fe Chicken Quesadilla Cook your chicken if you haven't already. Many people who make chicken quesadillas used leftover chicken in their quesadillas. If you don't have pre-cooked chicken at your disposal, here are some ways that you can cook your chicken:\nPan-sear chicken. Season chicken with salt and pepper and begin searing it over medium heat in a well-oiled pan. To develop a nice, brown exterior, turn the heat up to medium-high just before the chicken is finished cooking. Oven-roast chicken. This is a great way of cooking a whole chicken. Butterfly a chicken in the oven. Another great way of cooking a whole chicken, butterflying is a quick technique that sounds more difficult than it is. Definitely worth trying! While the chicken is cooking, sweat the onions in a well-oiled skillet over medium heat. Cook until onions are aromatic and translucent, about 4 minutes. Add the corn to the onions. Cook until a little bit of color develops on both the corn and the onions. Remove from skillet and set aside. Lay one tortilla flat into the bottom of the saucepan.  Add onions, corn, beans, chicken, and avocado. Make sure all the ingredients are evenly spread across the bottom of the tortilla. Layer the top of the ingredients with the Mexican cheese mix  Cover with the second tortilla.  Cook the tortilla over medium-low heat, flipping once, until color develops on both tortillas. To expedite the process, cover the skillet with a lid while cooking. Cut quesadilla into wedges and serve. Enjoy!",
  "tyn_model":[
    "chicken",
    "onions",
    "oven",
    "corn",
    "baking sheet",
    "broiler",
    "skillet",
    "chicken quesadilla",
    "cooking spray",
    "fajita seasoning",
    "large saucepan",
    "oil",
    "green peppers",
    "red peppers",
    "tortilla",
    "cheese",
    "chicken quesadillas",
    "pan-sear",
    "salt and pepper",
    "well-oiled skillet",
    "saucepan",
    "beans",
    "avocado",
    "mexican cheese"
  ],
  "tyn_section":[

  ]
}