{
  "title":"How to Make a Cookie Cake",
  "url":"https://www.wikihow.com/Make-a-Cookie-Cake",
  "category_hierarchy":[
    "Food and Entertaining",
    "Recipes",
    "Baking",
    "Cakes"
  ],
  "methods":[
    {
      "name":"Making a Chocolate Chip Cookie Cake",
      "steps":[
        {
          "headline":"Preheat your oven to 350 \u00b0F (177 \u00b0C) and grease a 9 in (23 cm) cake pan.",
          "description":"For best results, use a non-stick cooking spray to grease the cake pan; you can use butter as well, however. Use a basic cake pan or a pie pan. Don't use a springform cake pan."
        },
        {
          "headline":"Beat the butter in a mixer on a medium speed setting for 1 minute.",
          "description":"Place \u00be cup (170 g) of unsalted, room-temperature butter into a mixer. Blend the butter on medium speed until it turns smooth and creamy. This take about 1 minute. You can do this by hand with an electric mixer or in a stand mixer. If you're using a stand mixer, use a paddle attachment instead of a whisk attachment."
        },
        {
          "headline":"Add 1 cup (200 g) of brown sugar and beat for another minute.",
          "description":"Use the same speed setting as before: medium. If you need to, pause the mixer, then use a rubber spatula to scrape any unblended mixture towards the bottom of the bowl."
        },
        {
          "headline":"Mix in the egg, yolk, and vanilla extract on a medium-high speed setting.",
          "description":"Crack open 1 egg and add it into the mixer. Next, crack open a second egg and separate the yolk from the white. Add the yolk to the mixer and discard the white. Add in 2 teaspoons of vanilla extract, and beat everything together on medium-high until combined. Be sure to scrape the sides of the bowl with a rubber spatula every so often so that nothing gets left out. Instead of discarding the egg white, save it for another recipe. For best results, use room-temperature eggs. Either leave them on the counter with the butter, or put them into a bowl filled with hot water for about 5 minutes."
        },
        {
          "headline":"Combine the flour, cornstarch, baking soda, and salt in a separate bowl.",
          "description":"Get out a new bowl and pour 2 cups (250 g) of all-purpose flour into it. Add 2 teaspoons of cornstarch, 1 teaspoon of baking soda, and \u00bd teaspoon of salt. Stir everything together with a whisk. Make sure that you are using baking soda and not baking powder."
        },
        {
          "headline":"Mix the dry mixture into the wet mixture on a low speed setting.",
          "description":"Do not dump all of the flour into the butter mixture at once. Instead, let your mixer run on a low speed setting while you slowly pour the flour into the creamed butter. The batter will thicken and clump together into dough."
        },
        {
          "headline":"Fold in 1\u00bc cups (220 g) of semi-sweet chocolate chips.",
          "description":"You can do this by hand with a rubber spatula, or you can use your mixer on a low speed setting for about 5 seconds. If you can\u2019t find semi-sweet chocolate chips, try dark chocolate chips instead. Avoid milk or white chocolate, as they will make the cake too sweet."
        },
        {
          "headline":"Press the dough into the pan.",
          "description":"Lift the dough up and set it into the prepared pan. Use your hands to flatten the dough until it touches the edges of the pan. Try to make the surface as even as possible; you don't want 1 side of the cookie to be thicker than the other. Don\u2019t worry about making it too perfect; it\u2019s okay if the cookie is a little lumpy with fingerprints."
        },
        {
          "headline":"Bake the cookie for 20 to 25 minutes.",
          "description":"The cookie cake is ready when the top is a light, golden-brown color. After about 25 minutes, take the cake out and poke a toothpick into the middle. If the toothpick comes out clean, the cake is ready. If it has crumbs on it, bake it for another 5 minutes. It can take up to 30 minutes for the cake to bake. If the cake is browning too fast, cover it loosely with aluminum foil, about halfway through baking."
        },
        {
          "headline":"Let the cake cool completely before removing it from the pan.",
          "description":"Once the cake has finished baking, take it out of the oven, and set it onto a wire cooling rack. Wait until the cake has cooled off completely, then run a knife around the edges of the pan and tip the cake out. You can leave the cake in the pan if you prefer to serve it that way."
        }
      ]
    },
    {
      "name":"Making a Sugar Cookie Cake",
      "steps":[
        {
          "headline":"Preheat your oven to 350 \u00b0F (177 \u00b0C) and grease a 9 in (23 cm) cake pan.",
          "description":"You can use a small amount of butter for this, but a non-stick cooking spray would be better. You can also use a 10 in (25 cm) cast iron skillet. Use 1 tablespoon of butter to grease it."
        },
        {
          "headline":"Beat the butter and sugar on medium-high speed for 4 minutes.",
          "description":"Place 1 cup (225 g) of butter into a stand mixer, then add 1\u00bd cups (340 g) of sugar. Beat the 2 ingredients together using a medium-high speed setting until the butter turns light and creamy. This will take about 4 minutes. Use a paddle attachment for the mixer, if possible. If you don't have a stand mixer, then you can use a handheld mixer instead. If you greased your cake or pie pan with non-stick cooking spray, subtract 1 tablespoon of butter."
        },
        {
          "headline":"Add in the egg and vanilla extract.",
          "description":"Crack open an egg into the butter mixture, then add 1 teaspoon of vanilla extract. Beat the mixture on a medium-high speed setting for a few more seconds until the egg is completely blended in and no yolk streaks remain. If you need to, scrape the sides of the bowl with a rubber spatula so that everything gets mixed in evenly."
        },
        {
          "headline":"Mix the flour, baking powder, and salt in a separate bowl.",
          "description":"Pour 2\u00bd cups (250 g) of all-purpose flour into a new bowl. Add \u00bd teaspoon of baking powder and \u00bd teaspoon of salt, then whisk everything together until combined. Make sure that you are using baking powder and not baking soda."
        },
        {
          "headline":"Mix the flour into the butter on a medium-low speed setting.",
          "description":"Add in half of the flour mixture into the butter mixture, then blend it in using a medium-low speed setting. Add the rest of the flour mixture in, and finish beating it until it is all blended in. Do not overwork the batter. Once you can't see anymore dry flour, stop. If you keep blending it, then it will soften too much. Use a rubber spatula to scrape any unblended mixture down the sides of the bowl as needed."
        },
        {
          "headline":"Fold in \u00bd cup (80 g) of sprinkles if you are using them.",
          "description":"This is not absolutely necessary, but it is a nice touch, and will make the cookie look more like a \u201cFunfetti\u201d birthday cake. Pour the sprinkles across the batter first, then gently fold them in with a rubber spatula. Be careful not to overdo it with the folding, or the sprinkles\u2019 colors will bleed into the batter. The batter may also soften too much."
        },
        {
          "headline":"Spread the batter across the bottom of the pan or skillet.",
          "description":"Scrape the batter into the pan or skillet with a rubber spatula first. Use the spatula to help spread the batter towards the edges."
        },
        {
          "headline":"Bake the cake for about 25 to 50 minutes.",
          "description":"How long you bake the cake for depends on what you are baking it in. If you used a cast-iron skillet, it will be ready in about 45 to 50 minutes. If you used a cake pan or a pie pan, it will be ready in about 25 to 30 minutes. The cake is ready when the edges are lightly browned and the top is a golden color."
        },
        {
          "headline":"Allow the cake to cool on a wire rack before frosting it.",
          "description":"Sugar cookie cakes are softer than chocolate chip cakes, so you won\u2019t be able to take it out of the pan. Instead, set the pan on a wire cooling rack for about 10 to 15 minutes, or until it reaches room temperature. Once the cake has cooled off, you can decorate it as you like. The middle of the cake will dip slightly as it cools, which is normal."
        }
      ]
    },
    {
      "name":"Decorating the Cake",
      "steps":[
        {
          "headline":"Prepare a batch of buttercream frosting.",
          "description":"Since cookie cakes aren't meant to be frosted all over like traditional cakes, you can prepare a half-size or quarter-size batch instead. Chocolate or vanilla buttercream are both great choices. If you make vanilla buttercream, consider tinting it with food coloring to make it look more interesting."
        },
        {
          "headline":"Fit a piping bag with a star-shaped decorator's tip.",
          "description":"Try to use a larger tip here so that you can cover more surface area. Snip the tip off of the bag first, then insert the tip. Alternatively, fit the piping bag with a coupler, then insert a star-shaped decorating tip into the coupler. This will make switching tips out easier."
        },
        {
          "headline":"Fill the piping bag with your frosting.",
          "description":"Set the piping bag into a cup or mug first, then fold the top edge down over the rim. Use a rubber spatula to transfer the frosting into the bag. After this, you can twist and tie the end of the bag, or you can secure it with a rubber band."
        },
        {
          "headline":"Pipe the frosting onto the edges of the cake.",
          "description":"Hold the tip close to the cake, then squeeze out a dollop of frosting while lifting the tip away. Release pressure on the bag, then twist it away from the piping. You should have a little, star-shaped rosette on the cake. Keep making these all around the cake. Alternatively, you can make short, overlapping dashes around the cake instead, like ripples."
        },
        {
          "headline":"Use leftover frosting to write or draw something on the cake.",
          "description":"Fit a new piping with a large, round decorator's tip, and fill it with more frosting. Use the bag to pipe out a message on the cake that suits the occasion, such as \"Happy Birthday.\" If you used a coupler, then pull off the star-shaped tip and pop on the round tip. If you have more frosting left over, use it to draw a picture that fits the message, such as a set of balloons."
        }
      ]
    }
  ],
  "text":" Making a Chocolate Chip Cookie Cake Preheat your oven to 350 \u00b0F (177 \u00b0C) and grease a 9 in (23 cm) cake pan. For best results, use a non-stick cooking spray to grease the cake pan; you can use butter as well, however. Use a basic cake pan or a pie pan. Don't use a springform cake pan. Beat the butter in a mixer on a medium speed setting for 1 minute. Place \u00be cup (170 g) of unsalted, room-temperature butter into a mixer. Blend the butter on medium speed until it turns smooth and creamy. This take about 1 minute. You can do this by hand with an electric mixer or in a stand mixer. If you're using a stand mixer, use a paddle attachment instead of a whisk attachment. Add 1 cup (200 g) of brown sugar and beat for another minute. Use the same speed setting as before: medium. If you need to, pause the mixer, then use a rubber spatula to scrape any unblended mixture towards the bottom of the bowl. Mix in the egg, yolk, and vanilla extract on a medium-high speed setting. Crack open 1 egg and add it into the mixer. Next, crack open a second egg and separate the yolk from the white. Add the yolk to the mixer and discard the white. Add in 2 teaspoons of vanilla extract, and beat everything together on medium-high until combined. Be sure to scrape the sides of the bowl with a rubber spatula every so often so that nothing gets left out. Instead of discarding the egg white, save it for another recipe. For best results, use room-temperature eggs. Either leave them on the counter with the butter, or put them into a bowl filled with hot water for about 5 minutes. Combine the flour, cornstarch, baking soda, and salt in a separate bowl. Get out a new bowl and pour 2 cups (250 g) of all-purpose flour into it. Add 2 teaspoons of cornstarch, 1 teaspoon of baking soda, and \u00bd teaspoon of salt. Stir everything together with a whisk. Make sure that you are using baking soda and not baking powder. Mix the dry mixture into the wet mixture on a low speed setting. Do not dump all of the flour into the butter mixture at once. Instead, let your mixer run on a low speed setting while you slowly pour the flour into the creamed butter. The batter will thicken and clump together into dough. Fold in 1\u00bc cups (220 g) of semi-sweet chocolate chips. You can do this by hand with a rubber spatula, or you can use your mixer on a low speed setting for about 5 seconds. If you can\u2019t find semi-sweet chocolate chips, try dark chocolate chips instead. Avoid milk or white chocolate, as they will make the cake too sweet. Press the dough into the pan. Lift the dough up and set it into the prepared pan. Use your hands to flatten the dough until it touches the edges of the pan. Try to make the surface as even as possible; you don't want 1 side of the cookie to be thicker than the other. Don\u2019t worry about making it too perfect; it\u2019s okay if the cookie is a little lumpy with fingerprints. Bake the cookie for 20 to 25 minutes. The cookie cake is ready when the top is a light, golden-brown color. After about 25 minutes, take the cake out and poke a toothpick into the middle. If the toothpick comes out clean, the cake is ready. If it has crumbs on it, bake it for another 5 minutes. It can take up to 30 minutes for the cake to bake. If the cake is browning too fast, cover it loosely with aluminum foil, about halfway through baking. Let the cake cool completely before removing it from the pan. Once the cake has finished baking, take it out of the oven, and set it onto a wire cooling rack. Wait until the cake has cooled off completely, then run a knife around the edges of the pan and tip the cake out. You can leave the cake in the pan if you prefer to serve it that way. Making a Sugar Cookie Cake Preheat your oven to 350 \u00b0F (177 \u00b0C) and grease a 9 in (23 cm) cake pan. You can use a small amount of butter for this, but a non-stick cooking spray would be better. You can also use a 10 in (25 cm) cast iron skillet. Use 1 tablespoon of butter to grease it. Beat the butter and sugar on medium-high speed for 4 minutes. Place 1 cup (225 g) of butter into a stand mixer, then add 1\u00bd cups (340 g) of sugar. Beat the 2 ingredients together using a medium-high speed setting until the butter turns light and creamy. This will take about 4 minutes. Use a paddle attachment for the mixer, if possible. If you don't have a stand mixer, then you can use a handheld mixer instead. If you greased your cake or pie pan with non-stick cooking spray, subtract 1 tablespoon of butter. Add in the egg and vanilla extract. Crack open an egg into the butter mixture, then add 1 teaspoon of vanilla extract. Beat the mixture on a medium-high speed setting for a few more seconds until the egg is completely blended in and no yolk streaks remain. If you need to, scrape the sides of the bowl with a rubber spatula so that everything gets mixed in evenly. Mix the flour, baking powder, and salt in a separate bowl. Pour 2\u00bd cups (250 g) of all-purpose flour into a new bowl. Add \u00bd teaspoon of baking powder and \u00bd teaspoon of salt, then whisk everything together until combined. Make sure that you are using baking powder and not baking soda. Mix the flour into the butter on a medium-low speed setting. Add in half of the flour mixture into the butter mixture, then blend it in using a medium-low speed setting. Add the rest of the flour mixture in, and finish beating it until it is all blended in. Do not overwork the batter. Once you can't see anymore dry flour, stop. If you keep blending it, then it will soften too much. Use a rubber spatula to scrape any unblended mixture down the sides of the bowl as needed. Fold in \u00bd cup (80 g) of sprinkles if you are using them. This is not absolutely necessary, but it is a nice touch, and will make the cookie look more like a \u201cFunfetti\u201d birthday cake. Pour the sprinkles across the batter first, then gently fold them in with a rubber spatula. Be careful not to overdo it with the folding, or the sprinkles\u2019 colors will bleed into the batter. The batter may also soften too much. Spread the batter across the bottom of the pan or skillet. Scrape the batter into the pan or skillet with a rubber spatula first. Use the spatula to help spread the batter towards the edges. Bake the cake for about 25 to 50 minutes. How long you bake the cake for depends on what you are baking it in. If you used a cast-iron skillet, it will be ready in about 45 to 50 minutes. If you used a cake pan or a pie pan, it will be ready in about 25 to 30 minutes. The cake is ready when the edges are lightly browned and the top is a golden color. Allow the cake to cool on a wire rack before frosting it. Sugar cookie cakes are softer than chocolate chip cakes, so you won\u2019t be able to take it out of the pan. Instead, set the pan on a wire cooling rack for about 10 to 15 minutes, or until it reaches room temperature. Once the cake has cooled off, you can decorate it as you like. The middle of the cake will dip slightly as it cools, which is normal. Decorating the Cake Prepare a batch of buttercream frosting. Since cookie cakes aren't meant to be frosted all over like traditional cakes, you can prepare a half-size or quarter-size batch instead. Chocolate or vanilla buttercream are both great choices. If you make vanilla buttercream, consider tinting it with food coloring to make it look more interesting. Fit a piping bag with a star-shaped decorator's tip. Try to use a larger tip here so that you can cover more surface area. Snip the tip off of the bag first, then insert the tip. Alternatively, fit the piping bag with a coupler, then insert a star-shaped decorating tip into the coupler. This will make switching tips out easier. Fill the piping bag with your frosting. Set the piping bag into a cup or mug first, then fold the top edge down over the rim. Use a rubber spatula to transfer the frosting into the bag. After this, you can twist and tie the end of the bag, or you can secure it with a rubber band. Pipe the frosting onto the edges of the cake. Hold the tip close to the cake, then squeeze out a dollop of frosting while lifting the tip away. Release pressure on the bag, then twist it away from the piping. You should have a little, star-shaped rosette on the cake. Keep making these all around the cake. Alternatively, you can make short, overlapping dashes around the cake instead, like ripples. Use leftover frosting to write or draw something on the cake. Fit a new piping with a large, round decorator's tip, and fill it with more frosting. Use the bag to pipe out a message on the cake that suits the occasion, such as \"Happy Birthday.\" If you used a coupler, then pull off the star-shaped tip and pop on the round tip. If you have more frosting left over, use it to draw a picture that fits the message, such as a set of balloons.",
  "tyn_model":[
    "butter",
    "mixer",
    "flour",
    "rubber spatula",
    "bowl",
    "cake pan",
    "stand mixer",
    "vanilla extract",
    "baking soda",
    "salt",
    "baking powder",
    "oven",
    "non-stick cooking spray",
    "pie pan",
    "chocolate chips",
    "piping bag",
    "coupler",
    "frosting",
    "whisk",
    "egg",
    "cornstarch",
    "all-purpose flour",
    "sugar",
    "pan",
    "skillet",
    "cake",
    "chocolate chip cookie cake",
    "electric mixer",
    "brown sugar",
    "eggs",
    "hot water",
    "creamed butter",
    "cookie cake",
    "toothpick",
    "aluminum foil",
    "knife",
    "sugar cookie",
    "cast iron skillet",
    "paddle attachment",
    "handheld mixer",
    "\u201cfunfetti",
    "\u201d birthday cake",
    "\u2019 colors",
    "spatula",
    "cast-iron skillet",
    "wire rack",
    "sugar cookie cakes",
    "chocolate chip cakes",
    "buttercream frosting",
    "cookie cakes",
    "vanilla buttercream",
    "buttercream",
    "food coloring",
    "star-shaped decorating tip",
    "rubber band",
    "piping",
    "decorator's",
    "balloons"
  ],
  "tyn_section":[

  ]
}