{
  "title":"How to Buy a Dry Cleaning Business",
  "url":"https://www.wikihow.com/Buy-a-Dry-Cleaning-Business",
  "category_hierarchy":[
    "Home and Garden",
    "Housekeeping",
    "Laundry",
    "Dry Cleaning"
  ],
  "methods":[
    {
      "name":"Finding a Dry Cleaning Business To Buy",
      "steps":[
        {
          "headline":"Conduct market research.",
          "description":"Getting to know the dry cleaning market in the region where you plan to buy will help you decide if you want to buy a local dry cleaning company or a franchise. Prove you have a net worth of at least $300,000 and financing if you want to open a franchise. They are often less flexible than an independent owner who will work with you to sell the business."
        },
        {
          "headline":"Find a location and a dry cleaning business that fits your vision of how you want to run your business.",
          "description":"You might ask current owners if they are willing to sell, or work with a broker who can find sellers for you."
        },
        {
          "headline":"Draft a Letter of Intent .",
          "description":"This letter will give a written intention of your desire to buy the dry cleaning business and the owner's willingness to sell it to you. Include a proposed purchase price in the LOI. This might be negotiated later. It should also disclose any assets or property that will transfer to you in the sale as well as provide a deadline or a window by which the sale must close."
        },
        {
          "headline":"Hire a lawyer.",
          "description":"Having a lawyer draw up the contract of sale will ensure you are protected during the buying process. A contract lawyer can offer you the best advice in the purchase of a dry cleaning business. Refrain from using one lawyer for both parties. No matter how friendly you are with the seller, ensure that each party has its own lawyer."
        }
      ]
    },
    {
      "name":"Making a Formal Offer on a Dry Cleaning Business",
      "steps":[
        {
          "headline":"Appraise the property that the dry cleaning business inhabits.",
          "description":"Gather information on property taxes and whether they are up to date. Look for liens against the property and determine where the property boundaries are. Negotiate the inclusion of any vehicles. Some dry cleaning businesses pick up and drop off clothing for their customers, so a sale might include vans or trucks that are used for this purpose."
        },
        {
          "headline":"Check the condition of the equipment that will transfer with the sale.",
          "description":"Look for warranties, and find out which vendors service and repair the equipment in the dry cleaning business."
        },
        {
          "headline":"Examine employee records.",
          "description":"When you buy a dry cleaning business, you will want to know how many workers are currently employed and what their terms of employment are."
        },
        {
          "headline":"Go through financial records.",
          "description":"Examine cash flow, debts and insurance payments."
        },
        {
          "headline":"Find out what you can about the dry cleaner's reputation.",
          "description":"Before you buy, you want to make sure it is a reputable shop that dry cleaning customers and other business owners speak highly of."
        },
        {
          "headline":"Negotiate the purchase price if any of your research has turned up unexpected information, such as property liens, outstanding debts or malfunctioning equipment.",
          "description":""
        }
      ]
    },
    {
      "name":"Closing the Deal on a Dry Cleaning Business Purchase",
      "steps":[
        {
          "headline":"Make sure your financing is in order.",
          "description":"Whether you are financing the purchase with your own funds, bringing in investors, getting a business loan or working with alternative financing methods, the money will need to be in place before you close the deal."
        },
        {
          "headline":"Set a closing date.",
          "description":"Your lawyer can schedule a date to finalize the sale with the seller's attorney."
        },
        {
          "headline":"Pay the seller for the dry cleaning business, either in person or through his or her attorney.",
          "description":"Obtain the keys and all the necessary permits, locks and other information once the money changes hands."
        },
        {
          "headline":"Announce the new ownership of your dry cleaning business and begin making whatever changes you envisioned when you decided to buy it.",
          "description":""
        }
      ]
    }
  ],
  "text":" Finding a Dry Cleaning Business To Buy Conduct market research. Getting to know the dry cleaning market in the region where you plan to buy will help you decide if you want to buy a local dry cleaning company or a franchise. Prove you have a net worth of at least $300,000 and financing if you want to open a franchise. They are often less flexible than an independent owner who will work with you to sell the business. Find a location and a dry cleaning business that fits your vision of how you want to run your business. You might ask current owners if they are willing to sell, or work with a broker who can find sellers for you. Draft a Letter of Intent . This letter will give a written intention of your desire to buy the dry cleaning business and the owner's willingness to sell it to you. Include a proposed purchase price in the LOI. This might be negotiated later. It should also disclose any assets or property that will transfer to you in the sale as well as provide a deadline or a window by which the sale must close. Hire a lawyer. Having a lawyer draw up the contract of sale will ensure you are protected during the buying process. A contract lawyer can offer you the best advice in the purchase of a dry cleaning business. Refrain from using one lawyer for both parties. No matter how friendly you are with the seller, ensure that each party has its own lawyer. Making a Formal Offer on a Dry Cleaning Business Appraise the property that the dry cleaning business inhabits. Gather information on property taxes and whether they are up to date. Look for liens against the property and determine where the property boundaries are. Negotiate the inclusion of any vehicles. Some dry cleaning businesses pick up and drop off clothing for their customers, so a sale might include vans or trucks that are used for this purpose. Check the condition of the equipment that will transfer with the sale. Look for warranties, and find out which vendors service and repair the equipment in the dry cleaning business. Examine employee records. When you buy a dry cleaning business, you will want to know how many workers are currently employed and what their terms of employment are. Go through financial records. Examine cash flow, debts and insurance payments. Find out what you can about the dry cleaner's reputation. Before you buy, you want to make sure it is a reputable shop that dry cleaning customers and other business owners speak highly of. Negotiate the purchase price if any of your research has turned up unexpected information, such as property liens, outstanding debts or malfunctioning equipment.  Closing the Deal on a Dry Cleaning Business Purchase Make sure your financing is in order. Whether you are financing the purchase with your own funds, bringing in investors, getting a business loan or working with alternative financing methods, the money will need to be in place before you close the deal. Set a closing date. Your lawyer can schedule a date to finalize the sale with the seller's attorney. Pay the seller for the dry cleaning business, either in person or through his or her attorney. Obtain the keys and all the necessary permits, locks and other information once the money changes hands. Announce the new ownership of your dry cleaning business and begin making whatever changes you envisioned when you decided to buy it. ",
  "tyn_model":[
    "dry cleaning",
    "dry cleaning business",
    "lawyer",
    "dry cleaning market",
    "dry cleaning businesses",
    "dry cleaner"
  ],
  "tyn_section":[

  ]
}