{
  "title":"How to Cook Country Style Ribs",
  "url":"https://www.wikihow.com/Cook-Country-Style-Ribs",
  "category_hierarchy":[
    "Food and Entertaining",
    "Recipes",
    "Meat",
    "Pork"
  ],
  "methods":[
    {
      "name":"Making Baked Country Style Ribs",
      "steps":[
        {
          "headline":"Preheat the oven to 300 \u00b0F (149 \u00b0C) and prep the ribs.",
          "description":"Let the oven heat up while you're getting the ribs ready. Line a rimmed baking sheet with foil or parchment paper and lay the ribs out in a single layer. Sprinkle salt and pepper on both sides. Use 2 trays if the ribs won't fit on one in a single layer. You can use bone-in or boneless ribs."
        },
        {
          "headline":"Cover the ribs with foil and bake them for 2 hours.",
          "description":"Use foil to make a tight lid over the ribs. Let them cook for at least 2 hours. Don't take them out of the oven  during this time. You don't even really need to check on them. Basically, you're braising the ribs in their own juice at this point, as they will render fat and liquid as they cook."
        },
        {
          "headline":"Take the ribs out to pour off the grease.",
          "description":"Carefully uncover the ribs, as the steam will be hot. Remove the ribs from the pan momentarily, and drain the grease into a can to throw away later. Set the ribs back on the baking tray. If the ribs don't seem tender when you uncover them, put them back in the oven under the cover for another 15-30 minutes. They should be starting to soften but not fully tender yet."
        },
        {
          "headline":"Brush the ribs with sauce.",
          "description":"You can use any kind of sauce you want or even make your own. Place the ribs back on the pan before brushing the tops with sauce. Just use enough to coat the ribs thoroughly. Barbecue sauce works greats for this purpose! You can also try teriyaki sauce, hoisin sauce, or really any thick sauce that has some oil in it."
        },
        {
          "headline":"Turn the oven up to 350 \u00b0F (177 \u00b0C) and put the ribs back in.",
          "description":"Leave the ribs uncovered, and let them cook for 15-30 minutes at this temperature. This process will start caramelizing the barbecue sauce."
        },
        {
          "headline":"Turn and baste the ribs every 15-30 minutes until they're tender.",
          "description":"Pull the ribs out of the oven and turn them over. Brush barbecue sauce on the other side. Put them back in the oven to heat some more. Repeat the process until the ribs are tender and falling off the bone, which should take about 90 minutes."
        },
        {
          "headline":"Broil the ribs for 1-2 minutes at the end to caramelize the sauce.",
          "description":"Once the ribs seem tender enough, add one more layer of barbecue sauce. Watch them closely while they're broiling, and take them out before they start burning."
        }
      ]
    },
    {
      "name":"Making Braised Country Style Ribs",
      "steps":[
        {
          "headline":"Wash and chop the vegetables.",
          "description":"Wash the vegetables under running water, scrubbing them lightly with a vegetable scrubber. Chop the carrot, onion, and celery stalk into small pieces. Mince the 4 garlic cloves finely. You can peel the carrot if you'd like, but it's not necessary if you scrub it well enough."
        },
        {
          "headline":"Heat 2 tablespoons (30 mL) of oil in a Dutch oven on the stove.",
          "description":"Place the pot over medium-high heat. Let the oil heat up for a minute or two. While it's heating, take time to prep the ribs for browning."
        },
        {
          "headline":"Season the ribs with salt and pepper to prepare them for browning.",
          "description":"Take the ribs out of the package. Pat the ribs dry with a paper towel so they'll brown properly. Salt and pepper both sides of the ribs."
        },
        {
          "headline":"Brown the ribs in the Dutch oven for 1-2 minutes on each side.",
          "description":"Set them in the oil one at a time. The ribs will begin to brown on the side that's in the pan. Turn the ribs after a minute or two, so you brown all the sides of the ribs. Don't crowd the pan with ribs, as they won't brown. If you need to, brown the ribs one or two at a time. Set the ribs to the side for a moment."
        },
        {
          "headline":"Add 1 tablespoon (15 mL) of oil to the pan and cook the veggies.",
          "description":"Turn the heat down on the pan to medium, and add the carrot, onion, and celery. Let them cook for 3-4 minutes, then scrape in the minced garlic. Let it cook for a minute or so."
        },
        {
          "headline":"Spoon in the tomato paste, apple cider vinegar, and bay leaves.",
          "description":"Add the tomato paste first, and let it cook for a couple of minutes. Pour in the apple cider vinegar, and use it to help scrape off what's on the bottom of the pan. Drop the bay leaves into the pan. You can add a pinch of red pepper flakes at this point if you'd like a little heat."
        },
        {
          "headline":"Pour in the 2.5 cups (590 mL) of chicken stock and put the ribs back in.",
          "description":"The chicken stock will not completely submerge the ribs. Let the stock come up to a simmer, and then cover the ribs to transfer them to the oven. Make sure the ribs are tightly covered."
        },
        {
          "headline":"Cook the ribs in a 350 \u00b0F (177 \u00b0C) oven for 1 1/2 hours.",
          "description":"The ribs will slowly braise during this time. After an hour or so, take the lid off the ribs. The heat will reduce the sauce, as well as give the ribs some color. Serve the ribs with mashed potatoes or polenta."
        }
      ]
    },
    {
      "name":"Making Grilled Country Style Ribs",
      "steps":[
        {
          "headline":"Mix the dry rub together.",
          "description":"Place the 2 tablespoons (25 g) of brown sugar, 2 teaspoons (5 g) of ancho chile, 2 teaspoons (5 g) of chipotle chile, 1/2 teaspoon (1 g) of ground cumin, 1/2 teaspoon (1.4 g) of garlic powder, 1/2 teaspoon (1.4 g) of onion powder, and 2 tablespoons (36 g) of kosher salt in a small bowl. Stir the spices to combine. You can also use a marinade instead."
        },
        {
          "headline":"Apply the dry rub to the ribs.",
          "description":"Use your hands to massage the dry rub into the ribs, making sure to get it all over the meat. If you want, you can use latex gloves for this process so you're not coating your hands with seasonings and meat juice."
        },
        {
          "headline":"Leave the ribs overnight in the fridge.",
          "description":"Place the ribs in a zip-top bag, and put them in the refrigerator for 8 hours. If you're in a hurry, you can cook them after 4 hours instead of 8. Pull the ribs out of the fridge an hour before you want to cook them so they can come to room temperature."
        },
        {
          "headline":"Heat the grill up to medium high.",
          "description":"Aim for 350 to 450 \u00b0F (177 to 232 \u00b0C) with your gas or charcoal grill. Let the grill heat up all the way before you cook the ribs."
        },
        {
          "headline":"Cook both flat sides of the ribs for about 6 minutes on each side.",
          "description":"Start by placing the largest side face down. They should be crusty on that side before you turn them over. Let the other side cook about 6 minutes, too."
        },
        {
          "headline":"Grill the thin sides of the ribs.",
          "description":"Turn the ribs up on one side, and cook them for another 5 minutes or so. Once that side is crusty, turn them over to the other thin side, and cook that side for 5 minutes. You may need to lean the ribs against each other to grill the thin sides."
        },
        {
          "headline":"Let the ribs rest for 5 minutes before serving.",
          "description":"Remove the ribs from the grill and cover them with a tent of foil. Letting them rest 5 minutes will help keep the juice in the meat when you cut into it."
        }
      ]
    }
  ],
  "text":" Making Baked Country Style Ribs Preheat the oven to 300 \u00b0F (149 \u00b0C) and prep the ribs. Let the oven heat up while you're getting the ribs ready. Line a rimmed baking sheet with foil or parchment paper and lay the ribs out in a single layer. Sprinkle salt and pepper on both sides. Use 2 trays if the ribs won't fit on one in a single layer. You can use bone-in or boneless ribs. Cover the ribs with foil and bake them for 2 hours. Use foil to make a tight lid over the ribs. Let them cook for at least 2 hours. Don't take them out of the oven  during this time. You don't even really need to check on them. Basically, you're braising the ribs in their own juice at this point, as they will render fat and liquid as they cook. Take the ribs out to pour off the grease. Carefully uncover the ribs, as the steam will be hot. Remove the ribs from the pan momentarily, and drain the grease into a can to throw away later. Set the ribs back on the baking tray. If the ribs don't seem tender when you uncover them, put them back in the oven under the cover for another 15-30 minutes. They should be starting to soften but not fully tender yet. Brush the ribs with sauce. You can use any kind of sauce you want or even make your own. Place the ribs back on the pan before brushing the tops with sauce. Just use enough to coat the ribs thoroughly. Barbecue sauce works greats for this purpose! You can also try teriyaki sauce, hoisin sauce, or really any thick sauce that has some oil in it. Turn the oven up to 350 \u00b0F (177 \u00b0C) and put the ribs back in. Leave the ribs uncovered, and let them cook for 15-30 minutes at this temperature. This process will start caramelizing the barbecue sauce. Turn and baste the ribs every 15-30 minutes until they're tender. Pull the ribs out of the oven and turn them over. Brush barbecue sauce on the other side. Put them back in the oven to heat some more. Repeat the process until the ribs are tender and falling off the bone, which should take about 90 minutes. Broil the ribs for 1-2 minutes at the end to caramelize the sauce. Once the ribs seem tender enough, add one more layer of barbecue sauce. Watch them closely while they're broiling, and take them out before they start burning. Making Braised Country Style Ribs Wash and chop the vegetables. Wash the vegetables under running water, scrubbing them lightly with a vegetable scrubber. Chop the carrot, onion, and celery stalk into small pieces. Mince the 4 garlic cloves finely. You can peel the carrot if you'd like, but it's not necessary if you scrub it well enough. Heat 2 tablespoons (30 mL) of oil in a Dutch oven on the stove. Place the pot over medium-high heat. Let the oil heat up for a minute or two. While it's heating, take time to prep the ribs for browning. Season the ribs with salt and pepper to prepare them for browning. Take the ribs out of the package. Pat the ribs dry with a paper towel so they'll brown properly. Salt and pepper both sides of the ribs. Brown the ribs in the Dutch oven for 1-2 minutes on each side. Set them in the oil one at a time. The ribs will begin to brown on the side that's in the pan. Turn the ribs after a minute or two, so you brown all the sides of the ribs. Don't crowd the pan with ribs, as they won't brown. If you need to, brown the ribs one or two at a time. Set the ribs to the side for a moment. Add 1 tablespoon (15 mL) of oil to the pan and cook the veggies. Turn the heat down on the pan to medium, and add the carrot, onion, and celery. Let them cook for 3-4 minutes, then scrape in the minced garlic. Let it cook for a minute or so. Spoon in the tomato paste, apple cider vinegar, and bay leaves. Add the tomato paste first, and let it cook for a couple of minutes. Pour in the apple cider vinegar, and use it to help scrape off what's on the bottom of the pan. Drop the bay leaves into the pan. You can add a pinch of red pepper flakes at this point if you'd like a little heat. Pour in the 2.5 cups (590 mL) of chicken stock and put the ribs back in. The chicken stock will not completely submerge the ribs. Let the stock come up to a simmer, and then cover the ribs to transfer them to the oven. Make sure the ribs are tightly covered. Cook the ribs in a 350 \u00b0F (177 \u00b0C) oven for 1 1/2 hours. The ribs will slowly braise during this time. After an hour or so, take the lid off the ribs. The heat will reduce the sauce, as well as give the ribs some color. Serve the ribs with mashed potatoes or polenta. Making Grilled Country Style Ribs Mix the dry rub together. Place the 2 tablespoons (25 g) of brown sugar, 2 teaspoons (5 g) of ancho chile, 2 teaspoons (5 g) of chipotle chile, 1/2 teaspoon (1 g) of ground cumin, 1/2 teaspoon (1.4 g) of garlic powder, 1/2 teaspoon (1.4 g) of onion powder, and 2 tablespoons (36 g) of kosher salt in a small bowl. Stir the spices to combine. You can also use a marinade instead. Apply the dry rub to the ribs. Use your hands to massage the dry rub into the ribs, making sure to get it all over the meat. If you want, you can use latex gloves for this process so you're not coating your hands with seasonings and meat juice. Leave the ribs overnight in the fridge. Place the ribs in a zip-top bag, and put them in the refrigerator for 8 hours. If you're in a hurry, you can cook them after 4 hours instead of 8. Pull the ribs out of the fridge an hour before you want to cook them so they can come to room temperature. Heat the grill up to medium high. Aim for 350 to 450 \u00b0F (177 to 232 \u00b0C) with your gas or charcoal grill. Let the grill heat up all the way before you cook the ribs. Cook both flat sides of the ribs for about 6 minutes on each side. Start by placing the largest side face down. They should be crusty on that side before you turn them over. Let the other side cook about 6 minutes, too. Grill the thin sides of the ribs. Turn the ribs up on one side, and cook them for another 5 minutes or so. Once that side is crusty, turn them over to the other thin side, and cook that side for 5 minutes. You may need to lean the ribs against each other to grill the thin sides. Let the ribs rest for 5 minutes before serving. Remove the ribs from the grill and cover them with a tent of foil. Letting them rest 5 minutes will help keep the juice in the meat when you cut into it.",
  "tyn_model":[
    "ribs",
    "oven",
    "foil",
    "barbecue sauce",
    "oil",
    "pan",
    "carrot",
    "grill",
    "salt and pepper",
    "vegetables",
    "onion",
    "celery",
    "garlic",
    "dutch oven",
    "tomato paste",
    "apple cider vinegar",
    "bay leaves",
    "chicken stock",
    "baking sheet",
    "parchment paper",
    "baking tray",
    "sauce",
    "water",
    "vegetable scrubber",
    "pot",
    "paper towel",
    "salt",
    "red pepper",
    "stock",
    "mashed potatoes",
    "grilled country style ribs",
    "brown sugar",
    "ancho chile",
    "chipotle chile",
    "ground cumin",
    "garlic powder",
    "onion powder",
    "kosher salt",
    "spices",
    "seasonings",
    "zip-top bag",
    "refrigerator",
    "fridge",
    "gas or charcoal grill"
  ],
  "tyn_section":[

  ]
}