{
  "title":"How to Care for Dark Clothing and Retain Color",
  "url":"https://www.wikihow.com/Care-for-Dark-Clothing-and-Retain-Color",
  "category_hierarchy":[
    "Home and Garden",
    "Housekeeping",
    "Laundry",
    "Cleaning Clothes"
  ],
  "methods":[
    {
      "name":"Washing Dark Clothing",
      "steps":[
        {
          "headline":"Separate dark and light clothing.",
          "description":"Dark clothing requires extra gentle washing and can also bleed onto lighter clothes if they're washed at the same time. Therefore, always separate dark and light clothing before doing laundry. Darker garments should be washed separately."
        },
        {
          "headline":"Turn dark clothing inside out.",
          "description":"The less exposure dark fabrics get to water and detergent, the better. Turning your clothing inside out before washing it minimizes contact with water and soap."
        },
        {
          "headline":"Pick a detergent for dark clothing.",
          "description":"For best results, look for a detergent specifically formulated to wash dark clothes. A basic detergent that's free of additives is your best option. Avoid things like \"color-safe bleach,\" as no bleach is actually 100% color safe. While you should avoid most additives, a built-in fabric softener is a good idea, especially one specifically formulated for dark clothes."
        },
        {
          "headline":"Opt for a shorter cycle.",
          "description":"Pick the shortest cycle offered by your washer or dryer. A briefer cycle minimizes dark clothing's exposure to water and soap, reducing the amount of damage it accrues."
        },
        {
          "headline":"Use cold water.",
          "description":"Choose the coldest water setting possible. Cold water does not cause as much fading and bleeding in the wash. Never wash dark clothes in warm or hot water."
        },
        {
          "headline":"Add a cup of vinegar during the rinse cycle.",
          "description":"White vinegar can help prevent the build up of residue from detergent. Detergent residue is a major culprit in dark clothing becoming faded. During the rinse cycle, open your washer and add a cup of white vinegar."
        },
        {
          "headline":"Hang dry your clothes.",
          "description":"The less time dark clothing spends in the dryer, the better. It's best to hang your dark clothes to dry. Do not hang your clothes in direct sunlight, however, as sun exposure can fade color."
        }
      ]
    },
    {
      "name":"Minimizing the Need to Wash Dark Clothes",
      "steps":[
        {
          "headline":"Make sure you're clean before wearing your clothes.",
          "description":"The less often you have to wash dark clothing, the better. Before throwing on dark clothes, make sure you're clean yourself. Putting on dark clothes when you're sweaty or messy will get your clothes dirty faster, meaning you'll need to wash them more often."
        },
        {
          "headline":"Carry sprays to treat stains promptly.",
          "description":"Invest in a small tube of stain remover, which you can buy at any drugstore or department store. If you get something on your clothing while wearing it out, promptly apply the stain remover according to package directions. Spot treating stains and spills in the moment will result in you needing to clean clothing less often."
        },
        {
          "headline":"Avoid doing chores in dark clothing.",
          "description":"Cleaning or doing yard work is bad for dark clothing. If you do work that requires kneeling, it'll fade out the knee area. Yard work, scrubbing the floors, and similar tasks should be avoided when wearing dark clothes."
        },
        {
          "headline":"Rotate your clothes.",
          "description":"You can wear dark clothing more than once before washing it. However, rotating your clothes will keep them fresher longer. Never wear the same dark garment more than one day in a row. Rotating clothing will prevent damage and cut down on the need for washing."
        }
      ]
    },
    {
      "name":"Avoiding Damage",
      "steps":[
        {
          "headline":"Store your clothing properly.",
          "description":"Dark clothing should be stored in a dark, cool place in your home. Avoid areas prone to humidity, like bathrooms or basements. If you use hangers, opt for hangers with plush arms. These are less likely to stretch out your clothes."
        },
        {
          "headline":"Wash dark clothing less.",
          "description":"Only wear dark clothing for short periods to prevent the need to wash it. For example, wear a black dress or suit out for an evening and take it off immediately when you get home. Wear black pants only indoors. You can get away with wearing an item of dark clothing three or four times before washing it."
        },
        {
          "headline":"Avoid doing your hair and makeup while wearing dark clothes.",
          "description":"Chemicals from things like makeup, hairspray, and hair gel can damage dark clothes. If you're wearing something dark for a night out, do your hair and makeup before getting dressed."
        }
      ]
    }
  ],
  "text":" Washing Dark Clothing Separate dark and light clothing. Dark clothing requires extra gentle washing and can also bleed onto lighter clothes if they're washed at the same time. Therefore, always separate dark and light clothing before doing laundry. Darker garments should be washed separately. Turn dark clothing inside out. The less exposure dark fabrics get to water and detergent, the better. Turning your clothing inside out before washing it minimizes contact with water and soap. Pick a detergent for dark clothing. For best results, look for a detergent specifically formulated to wash dark clothes. A basic detergent that's free of additives is your best option. Avoid things like \"color-safe bleach,\" as no bleach is actually 100% color safe. While you should avoid most additives, a built-in fabric softener is a good idea, especially one specifically formulated for dark clothes. Opt for a shorter cycle. Pick the shortest cycle offered by your washer or dryer. A briefer cycle minimizes dark clothing's exposure to water and soap, reducing the amount of damage it accrues. Use cold water. Choose the coldest water setting possible. Cold water does not cause as much fading and bleeding in the wash. Never wash dark clothes in warm or hot water. Add a cup of vinegar during the rinse cycle. White vinegar can help prevent the build up of residue from detergent. Detergent residue is a major culprit in dark clothing becoming faded. During the rinse cycle, open your washer and add a cup of white vinegar. Hang dry your clothes. The less time dark clothing spends in the dryer, the better. It's best to hang your dark clothes to dry. Do not hang your clothes in direct sunlight, however, as sun exposure can fade color. Minimizing the Need to Wash Dark Clothes Make sure you're clean before wearing your clothes. The less often you have to wash dark clothing, the better. Before throwing on dark clothes, make sure you're clean yourself. Putting on dark clothes when you're sweaty or messy will get your clothes dirty faster, meaning you'll need to wash them more often. Carry sprays to treat stains promptly. Invest in a small tube of stain remover, which you can buy at any drugstore or department store. If you get something on your clothing while wearing it out, promptly apply the stain remover according to package directions. Spot treating stains and spills in the moment will result in you needing to clean clothing less often. Avoid doing chores in dark clothing. Cleaning or doing yard work is bad for dark clothing. If you do work that requires kneeling, it'll fade out the knee area. Yard work, scrubbing the floors, and similar tasks should be avoided when wearing dark clothes. Rotate your clothes. You can wear dark clothing more than once before washing it. However, rotating your clothes will keep them fresher longer. Never wear the same dark garment more than one day in a row. Rotating clothing will prevent damage and cut down on the need for washing. Avoiding Damage Store your clothing properly. Dark clothing should be stored in a dark, cool place in your home. Avoid areas prone to humidity, like bathrooms or basements. If you use hangers, opt for hangers with plush arms. These are less likely to stretch out your clothes. Wash dark clothing less. Only wear dark clothing for short periods to prevent the need to wash it. For example, wear a black dress or suit out for an evening and take it off immediately when you get home. Wear black pants only indoors. You can get away with wearing an item of dark clothing three or four times before washing it. Avoid doing your hair and makeup while wearing dark clothes. Chemicals from things like makeup, hairspray, and hair gel can damage dark clothes. If you're wearing something dark for a night out, do your hair and makeup before getting dressed.",
  "tyn_model":[
    "water",
    "detergent",
    "soap",
    "white vinegar",
    "stain remover",
    "hangers",
    "bleach",
    "fabric softener",
    "washer or dryer",
    "vinegar",
    "washer",
    "clothes",
    "clothing",
    "makeup",
    "hairspray",
    "hair gel"
  ],
  "tyn_section":[

  ]
}