{
  "title":"How to Enjoy Spring Cleaning",
  "url":"https://www.wikihow.com/Enjoy-Spring-Cleaning",
  "category_hierarchy":[
    "Home and Garden",
    "Housekeeping",
    "Cleaning"
  ],
  "methods":[
    {
      "name":"Find Motivation",
      "steps":[
        {
          "headline":"Clean with friends.",
          "description":"It won't seem so long and boring if you do it with people who you care about. Call your friends and family and make it a fun get-together project. Afterwards, do something fun like a barbecue or a home movie night."
        },
        {
          "headline":"Share your experiences online.",
          "description":"Most everyone participates in social networking online, so make spring cleaning more fun by sharing before-after photo's to inspire and entertain your friends, family, and peers. By sharing your spring cleaning tasks online, the task of spring cleaning won't seem so tremendous anymore."
        },
        {
          "headline":"Get your kids to help you with spring cleaning.",
          "description":"Getting the kids to join is a breeze when you put some fun and foolishness into your work. Having them start spring cleaning at a young age, they will enjoy pitching in and will want to help more often, also giving them a sense of accomplishment, collaboration, independence, and responsibility."
        }
      ]
    },
    {
      "name":"Get the Right Supplies",
      "steps":[
        {
          "headline":"Build your tool kit.",
          "description":"Get a shower caddy or other container with a handle. This will prevent you from wasting steps and saving trips and also having your supplies at your finger tips. To really take advantage of cost savings and multitasking, settle with your shower one or swap it out with one for as low as 6$."
        },
        {
          "headline":"Get colorful.",
          "description":"Assign a color coded wash rag for each room to make your cleaning organized. After all, you wouldn't want to use the rag you used on the bathroom toilet in the kitchen sink. You will also be cutting back on paper waste and be more productive with your time by knowing which rag to grab for first."
        }
      ]
    },
    {
      "name":"Finishing Up",
      "steps":[
        {
          "headline":"End the cleaning with the floors.",
          "description":"Take small rugs outside to air them; sprinkle baking soda on large carpets and let it sit for a few hours, then vacuum. This will refresh them."
        },
        {
          "headline":"Reward yourself.",
          "description":"Even before you start your spring cleaning, start thinking about what you want to reward yourself with after you are done. It would be nice if you would associate your reward with what you accomplished, for example, try upgrading your furniture if you donated some of your old furniture, or try buying new curtains if you cleaned and washed your windows. Nevertheless, a great expensive dinner would be an amazing reward too, and this may inspire you to work harder the next time if you reward yourself this time."
        }
      ]
    }
  ],
  "text":" Find Motivation Clean with friends. It won't seem so long and boring if you do it with people who you care about. Call your friends and family and make it a fun get-together project. Afterwards, do something fun like a barbecue or a home movie night. Share your experiences online. Most everyone participates in social networking online, so make spring cleaning more fun by sharing before-after photo's to inspire and entertain your friends, family, and peers. By sharing your spring cleaning tasks online, the task of spring cleaning won't seem so tremendous anymore. Get your kids to help you with spring cleaning. Getting the kids to join is a breeze when you put some fun and foolishness into your work. Having them start spring cleaning at a young age, they will enjoy pitching in and will want to help more often, also giving them a sense of accomplishment, collaboration, independence, and responsibility. Get the Right Supplies Build your tool kit. Get a shower caddy or other container with a handle. This will prevent you from wasting steps and saving trips and also having your supplies at your finger tips. To really take advantage of cost savings and multitasking, settle with your shower one or swap it out with one for as low as 6$. Get colorful. Assign a color coded wash rag for each room to make your cleaning organized. After all, you wouldn't want to use the rag you used on the bathroom toilet in the kitchen sink. You will also be cutting back on paper waste and be more productive with your time by knowing which rag to grab for first. Finishing Up End the cleaning with the floors. Take small rugs outside to air them; sprinkle baking soda on large carpets and let it sit for a few hours, then vacuum. This will refresh them. Reward yourself. Even before you start your spring cleaning, start thinking about what you want to reward yourself with after you are done. It would be nice if you would associate your reward with what you accomplished, for example, try upgrading your furniture if you donated some of your old furniture, or try buying new curtains if you cleaned and washed your windows. Nevertheless, a great expensive dinner would be an amazing reward too, and this may inspire you to work harder the next time if you reward yourself this time.",
  "tyn_model":[
    "tool kit",
    "wash rag",
    "rugs",
    "baking soda",
    "vacuum",
    "curtains"
  ],
  "tyn_section":[

  ]
}