{
  "title":"How to Make Garlic Chicken Alfredo",
  "url":"https://www.wikihow.com/Make-Garlic-Chicken-Alfredo",
  "category_hierarchy":[
    "Food and Entertaining",
    "Recipes",
    "Meat",
    "Poultry Recipes",
    "Chicken"
  ],
  "parts":[
    {
      "name":"Chicken",
      "steps":[
        {
          "headline":"Heat olive oil in a large skillet.",
          "description":"Heat until the oil shimmers or barely begins to smoke. You can substitute butter for a richer flavor."
        },
        {
          "headline":"Season the chicken.",
          "description":"Sprinkle boneless or deboned chicken breasts with black pepper and salt."
        },
        {
          "headline":"Cook chicken breasts for one minute on each side.",
          "description":"Add the chicken breasts to the hot skillet. Cook briefly over medium heat, until just beginning to turn golden on each side."
        },
        {
          "headline":"Cover and cook for ten minutes.",
          "description":"Cover the skillet with a tight lid. Reduce heat to low. Set a timer for 10 minutes and leave the chicken to cook."
        },
        {
          "headline":"Remove from heat and leave covered.",
          "description":"Leave the chicken covered and in the pan for about another ten minutes. This will keep the chicken moist and warm while you make the rest of the dish. Get started on the pasta as soon as you remove the pan from heat."
        }
      ]
    },
    {
      "name":"Pasta",
      "steps":[
        {
          "headline":"Bring salted water to a boil.",
          "description":"In a separate, large pot, put two quarts (two liters) water over high heat, plus a generous pinch of salt. This is less water than usual for this amount of pasta. This will leave us with an extra starchy water base to start our alfredo sauce. Add more water if you plan on making a more traditional, extra-rich sauce."
        },
        {
          "headline":"Cook pasta until slightly underdone.",
          "description":"Check the package instructions for recommended cooking time. Boil the pasta for a minute or two less than the label suggests. Start on the sauce while you wait. Set a timer for the pasta so you don't forget to check it. If using fresh pasta instead of dried, cook for about 45 seconds instead, or until al dente. Fettuccine is the original pasta choice for this dish, but you can use any type. The dish is only a few decades old, so your Italian grandmother won't roll in her grave too vigorously."
        },
        {
          "headline":"Save some of the water before draining.",
          "description":"If you want to make the lighter version of this dish, save 2 cups (480 mL) of the pasta water. Drain the pasta and set aside in a large bowl."
        }
      ]
    },
    {
      "name":"Garlic Alfredo Sauce",
      "steps":[
        {
          "headline":"Check on the chicken.",
          "description":"After the chicken has been off the heat for ten minutes, remove the lid. Make sure the chicken is cooked all the way through, with no pink meat visible. Set the chicken aside."
        },
        {
          "headline":"Heat minced garlic in the skillet.",
          "description":"Peel and chop the garlic. Toss it in the hot skillet. Stir it while cooking for about one minute, or until it releases its aroma. Set it aside. Heat a little more olive oil or butter first if the pan is dry."
        },
        {
          "headline":"Heat and thicken a cream sauce.",
          "description":"While Alfredo sauce began as just butter and cheese, the most common version nowadays uses heavy cream. Using one of the two recipes below, bring the mixture to a boil, stirring constantly. Extra-rich: 2 cups (480 mL) heavy cream, added directly to the skillet. Light (ish): 1 cup (240 mL) heavy cream, 2 large egg yolks. Heat gradually in a cold pan or temper the egg to avoid scrambling the egg."
        },
        {
          "headline":"Add cheese and black pepper.",
          "description":"The cheese is the centerpiece of the dish. Grated or shredded Parmigiano Reggiano will make a much more flavorful sauce than powdered parmesan. Also add a generous amount of black pepper. Stir until the cheese is melted and well-mixed. Optionally, save \u2153 of the cheese to sprinkle on top of the dish just before serving."
        },
        {
          "headline":"Add reserved pasta water (light version only).",
          "description":"If you went with the light recipe containing eggs, gradually add the 2 cups (480 mL) leftover pasta water. Whisk constantly as you do so. This starchy water will thicken the sauce, making up for the lesser amount of cream. Bring to a boil again and cook for about 45 seconds. Stir constantly to break apart lumps."
        },
        {
          "headline":"Combine sauce and pasta.",
          "description":"Add the pasta to the sauce and toss until thoroughly coated. Taste the sauce, adding more black pepper or salt if necessary."
        },
        {
          "headline":"Serve with chicken.",
          "description":"Cut the chicken into strips and lay them on top of the pasta in the serving dishes. Optionally, sprinkle with more cheese, parsley, and/or black pepper."
        }
      ]
    }
  ],
  "text":" Chicken Heat olive oil in a large skillet. Heat until the oil shimmers or barely begins to smoke. You can substitute butter for a richer flavor. Season the chicken. Sprinkle boneless or deboned chicken breasts with black pepper and salt. Cook chicken breasts for one minute on each side. Add the chicken breasts to the hot skillet. Cook briefly over medium heat, until just beginning to turn golden on each side. Cover and cook for ten minutes. Cover the skillet with a tight lid. Reduce heat to low. Set a timer for 10 minutes and leave the chicken to cook. Remove from heat and leave covered. Leave the chicken covered and in the pan for about another ten minutes. This will keep the chicken moist and warm while you make the rest of the dish. Get started on the pasta as soon as you remove the pan from heat. Pasta Bring salted water to a boil. In a separate, large pot, put two quarts (two liters) water over high heat, plus a generous pinch of salt. This is less water than usual for this amount of pasta. This will leave us with an extra starchy water base to start our alfredo sauce. Add more water if you plan on making a more traditional, extra-rich sauce. Cook pasta until slightly underdone. Check the package instructions for recommended cooking time. Boil the pasta for a minute or two less than the label suggests. Start on the sauce while you wait. Set a timer for the pasta so you don't forget to check it. If using fresh pasta instead of dried, cook for about 45 seconds instead, or until al dente. Fettuccine is the original pasta choice for this dish, but you can use any type. The dish is only a few decades old, so your Italian grandmother won't roll in her grave too vigorously. Save some of the water before draining. If you want to make the lighter version of this dish, save 2 cups (480 mL) of the pasta water. Drain the pasta and set aside in a large bowl. Garlic Alfredo Sauce Check on the chicken. After the chicken has been off the heat for ten minutes, remove the lid. Make sure the chicken is cooked all the way through, with no pink meat visible. Set the chicken aside. Heat minced garlic in the skillet. Peel and chop the garlic. Toss it in the hot skillet. Stir it while cooking for about one minute, or until it releases its aroma. Set it aside. Heat a little more olive oil or butter first if the pan is dry. Heat and thicken a cream sauce. While Alfredo sauce began as just butter and cheese, the most common version nowadays uses heavy cream. Using one of the two recipes below, bring the mixture to a boil, stirring constantly. Extra-rich: 2 cups (480 mL) heavy cream, added directly to the skillet. Light (ish): 1 cup (240 mL) heavy cream, 2 large egg yolks. Heat gradually in a cold pan or temper the egg to avoid scrambling the egg. Add cheese and black pepper. The cheese is the centerpiece of the dish. Grated or shredded Parmigiano Reggiano will make a much more flavorful sauce than powdered parmesan. Also add a generous amount of black pepper. Stir until the cheese is melted and well-mixed. Optionally, save \u2153 of the cheese to sprinkle on top of the dish just before serving. Add reserved pasta water (light version only). If you went with the light recipe containing eggs, gradually add the 2 cups (480 mL) leftover pasta water. Whisk constantly as you do so. This starchy water will thicken the sauce, making up for the lesser amount of cream. Bring to a boil again and cook for about 45 seconds. Stir constantly to break apart lumps. Combine sauce and pasta. Add the pasta to the sauce and toss until thoroughly coated. Taste the sauce, adding more black pepper or salt if necessary. Serve with chicken. Cut the chicken into strips and lay them on top of the pasta in the serving dishes. Optionally, sprinkle with more cheese, parsley, and/or black pepper.",
  "tyn_model":[
    "water",
    "black pepper",
    "skillet",
    "pasta",
    "chicken",
    "butter",
    "salt",
    "pasta water",
    "cheese",
    "heavy cream",
    "olive oil",
    "pan",
    "garlic",
    "large skillet",
    "salted water",
    "fettuccine",
    "large bowl",
    "garlic alfredo sauce",
    "cream sauce",
    "parmesan",
    "\u2153 of",
    "eggs",
    "cream",
    "serving dishes",
    "parsley"
  ],
  "tyn_section":[

  ]
}