{
  "title":"How to Make a Candy Cake",
  "url":"https://www.wikihow.com/Make-a-Candy-Cake",
  "category_hierarchy":[
    "Food and Entertaining",
    "Recipes",
    "Baking",
    "Cakes"
  ],
  "methods":[
    {
      "name":"Making a Kit Kat Candy Cake",
      "steps":[
        {
          "headline":"Bake or buy a cake.",
          "description":"Bake a cake or purchase a cake. You can have any flavor of cake you want. Make two round cakes and stack them together with buttercream frosting in between the two cakes."
        },
        {
          "headline":"Frost the cake.",
          "description":"Cover the cake with plenty of buttercream frosting. Make sure to use a good amount and that you put it everywhere so the Kit Kats will be able to stick to the cake."
        },
        {
          "headline":"Pile frosting on the top of the cake.",
          "description":"Add more frosting on top of the cake and spread it out so there is a thick layer. You are going to be adding more candy to the top that needs to be able to stick to the frosting."
        },
        {
          "headline":"Put the Kit Kats around the cake.",
          "description":"Break the regular size Kit Kats into sections of two. Spread them around the sides of the cake so they are vertical and go slightly above the height of your cake. You will probably need anywhere from 6 to 10 Kit Kats, depending on the size of your cake."
        },
        {
          "headline":"Place in the refrigerator for 10-15 minutes, until the kitkat sticks are settled.",
          "description":""
        },
        {
          "headline":"Cover the top of the cake in candy.",
          "description":"Fill the top of the cake with whatever candy you want. You can use M&M's, Wonka candy, gummy candy, Skittles, or even something different like goldfish or cookies."
        },
        {
          "headline":"Serve and enjoy!",
          "description":"!"
        }
      ]
    },
    {
      "name":"Making a Popcorn Candy Cake",
      "steps":[
        {
          "headline":"Melt the marshmallows.",
          "description":"In a saucepan, melt one package of miniature marshmallows, \u00be cup of canola oil, and \u00bd cup of butter. Stir them together until it is smooth."
        },
        {
          "headline":"Combine the candy, peanuts, and popcorn.",
          "description":"In a large bowl, combine 20 cups (5 quarts) of popped popcorn, 1 package of gumdrops, and 1 cup of salted peanuts."
        },
        {
          "headline":"Stir in the marshmallow mixture.",
          "description":"Pour the melted marshmallow mixture into the popcorn and candy mixture. Toss the ingredients in the bowl to coat the popcorn and candy in the marshmallow sauce."
        },
        {
          "headline":"Refrigerate the mixture.",
          "description":"Press the mixture into a greased 10-inch tube pan. Don't use a two-piece tube pan for this cake. Cover the pan and refrigerate it for at least five hours."
        },
        {
          "headline":"Take the cake out of the pan.",
          "description":"Dip the pan in hot water for 5-10 seconds. This will help unmold it. Remove the cake from the pan. Slice it with an electric or serrated knife and serve it."
        }
      ]
    },
    {
      "name":"Displaying Candy to Look Like a Cake",
      "steps":[
        {
          "headline":"Get hat boxes or Styrofoam circles.",
          "description":"Purchase two or three round hat boxes or Styrofoam circles in three different sizes. You won't need the lids of the hat boxes. Glue the hat boxes together upside down or glue the Styrofoam circles together with a hot glue gun. Have the largest on the bottom and the smallest on the top. If you want, you can glue wrapping paper or colored paper on your boxes or Styrofoam before you glue them together."
        },
        {
          "headline":"Hot glue candy to the sides.",
          "description":"Hot glue candy in their wrappers to the sides of the boxes or Styrofoam. You can use a few large candy boxes or you can use a lot of small candy. Glue the candy on the top box or top Styrofoam circle so it goes slightly past the top. This will create a \u201cbowl\u201d on the top of your cake. You can pour candy onto the top and the sides of the candy glued around it will keep it from falling out. Choose candy that won't melt because of the hot glue. Good candy to use to avoid melting is Airheads, Swedish Fish, Jolly Ranchers, and Nerds. Chocolate is more likely to melt, but can still work if you are careful."
        },
        {
          "headline":"Add bows and ribbons.",
          "description":"You can tie ribbons around your \"cake\" and stick a bow on top of it. Add any decorations you want to make your \"cake\" perfect for your party."
        }
      ]
    }
  ],
  "text":" Making a Kit Kat Candy Cake Bake or buy a cake. Bake a cake or purchase a cake. You can have any flavor of cake you want. Make two round cakes and stack them together with buttercream frosting in between the two cakes. Frost the cake. Cover the cake with plenty of buttercream frosting. Make sure to use a good amount and that you put it everywhere so the Kit Kats will be able to stick to the cake. Pile frosting on the top of the cake. Add more frosting on top of the cake and spread it out so there is a thick layer. You are going to be adding more candy to the top that needs to be able to stick to the frosting. Put the Kit Kats around the cake. Break the regular size Kit Kats into sections of two. Spread them around the sides of the cake so they are vertical and go slightly above the height of your cake. You will probably need anywhere from 6 to 10 Kit Kats, depending on the size of your cake. Place in the refrigerator for 10-15 minutes, until the kitkat sticks are settled.  Cover the top of the cake in candy. Fill the top of the cake with whatever candy you want. You can use M&M's, Wonka candy, gummy candy, Skittles, or even something different like goldfish or cookies. Serve and enjoy! ! Making a Popcorn Candy Cake Melt the marshmallows. In a saucepan, melt one package of miniature marshmallows, \u00be cup of canola oil, and \u00bd cup of butter. Stir them together until it is smooth. Combine the candy, peanuts, and popcorn. In a large bowl, combine 20 cups (5 quarts) of popped popcorn, 1 package of gumdrops, and 1 cup of salted peanuts. Stir in the marshmallow mixture. Pour the melted marshmallow mixture into the popcorn and candy mixture. Toss the ingredients in the bowl to coat the popcorn and candy in the marshmallow sauce. Refrigerate the mixture. Press the mixture into a greased 10-inch tube pan. Don't use a two-piece tube pan for this cake. Cover the pan and refrigerate it for at least five hours. Take the cake out of the pan. Dip the pan in hot water for 5-10 seconds. This will help unmold it. Remove the cake from the pan. Slice it with an electric or serrated knife and serve it. Displaying Candy to Look Like a Cake Get hat boxes or Styrofoam circles. Purchase two or three round hat boxes or Styrofoam circles in three different sizes. You won't need the lids of the hat boxes. Glue the hat boxes together upside down or glue the Styrofoam circles together with a hot glue gun. Have the largest on the bottom and the smallest on the top. If you want, you can glue wrapping paper or colored paper on your boxes or Styrofoam before you glue them together. Hot glue candy to the sides. Hot glue candy in their wrappers to the sides of the boxes or Styrofoam. You can use a few large candy boxes or you can use a lot of small candy. Glue the candy on the top box or top Styrofoam circle so it goes slightly past the top. This will create a \u201cbowl\u201d on the top of your cake. You can pour candy onto the top and the sides of the candy glued around it will keep it from falling out. Choose candy that won't melt because of the hot glue. Good candy to use to avoid melting is Airheads, Swedish Fish, Jolly Ranchers, and Nerds. Chocolate is more likely to melt, but can still work if you are careful. Add bows and ribbons. You can tie ribbons around your \"cake\" and stick a bow on top of it. Add any decorations you want to make your \"cake\" perfect for your party.",
  "tyn_model":[
    "candy",
    "kit kats",
    "popcorn",
    "styrofoam circles",
    "styrofoam",
    "hot glue",
    "buttercream frosting",
    "marshmallows",
    "ribbons",
    "kit kat candy cake",
    "refrigerator",
    "gummy candy",
    "cookies",
    "popcorn candy cake",
    "saucepan",
    "canola oil",
    "butter",
    "peanuts",
    "large bowl",
    "gumdrops",
    "salted peanuts",
    "bowl",
    "10-inch tube pan",
    "cake",
    "water",
    "electric or serrated knife",
    "hot glue gun",
    "wrapping paper",
    "colored paper",
    "\u201cbowl",
    "\u201d on",
    "swedish fish",
    "jolly ranchers",
    "nerds",
    "chocolate"
  ],
  "tyn_section":[

  ]
}