{
  "title":"How to Wash Baby Bottles",
  "url":"https://www.wikihow.com/Wash-Baby-Bottles",
  "category_hierarchy":[
    "Home and Garden",
    "Housekeeping",
    "Cleaning",
    "House Cleaning"
  ],
  "parts":[
    {
      "name":"Cleaning Bottles",
      "steps":[
        {
          "headline":"Rinse the baby bottles directly after use.",
          "description":"As soon as you have finished feeding your baby, give the bottle a quick rinse out in the sink. You can wash the bottle more thoroughly later on when you have time, but this will prevent any old milk or dirt from accumulating in the bottle. Try to use hot water when rinsing out the bottle, as this will clean more effectively."
        },
        {
          "headline":"Gather the right cleaning materials.",
          "description":"When cleaning out baby bottles, it helps to use the right materials. Make sure you have:\nA bottle brush to help you clean the bottom and sides of the bottle and a nipple brush to clean out the rubber nipple, which is prone to accumulating bacteria. Dishwashing liquid designed specifically for baby bottles. This is very gentle and non-toxic and will not leave a soapy residue on the bottles. If you are using plastic baby bottles, make sure that they are free from BPA (bisphenol A), an estrogen-mimicking chemical that was banned by the FDA in 2012."
        },
        {
          "headline":"Rinse out the sink and fill with hot soapy water.",
          "description":"Before you wash your bottles, it's a good idea to clean the sink you intend to use first, to remove any potential bacteria or chemicals. Use a sponge or scouring pad to scrub down the bottom and sides of the sink and around the plug using hot water. You can use a little baking soda as a natural disinfectant if necessary. Once the sink is clean and rinsed, fill it with hot water (as hot as your hands can comfortably handle) and dish soap."
        },
        {
          "headline":"Dismantle the bottle and wash each part separately.",
          "description":"When cleaning baby bottles, it's necessary to take them apart and wash each part -- the bottle, the ring and the nipple -- separately. This is important as a lot of old milk can build up between the ring and the nipple, leading to the growth of bacteria. Place all of the bottle parts into the hot, soapy water and wash separately. Use the bottle brush for the bottles and the nipple brush for the plastic nipples and rings."
        },
        {
          "headline":"Alternatively, wash the bottles in the dishwasher.",
          "description":"If your bottles are labelled dishwasher safe, you can go ahead and wash them in the dishwasher. Stack the bottles upside-down on the top rack of the dishwasher, away from the heating element. You can buy special dishwasher-safe baskets for the nipples and rings in baby supply stores."
        },
        {
          "headline":"Allow the bottles to dry thoroughly.",
          "description":"After washing, rinse the bottle parts thoroughly in hot running water to remove any bubbles or soap residue. Place the parts on a bottle drying rack (available at baby supply stores in a range of cute designs). Make sure the bottles are left to drain in a well-ventilated location to ensure that they dry thoroughly. Bottles that remain damp for too long can grow mold or fungus."
        },
        {
          "headline":"Wash your hands before bottle feeding your baby.",
          "description":"Once the bottles are dry, remember to wash your hands thoroughly with soap and warm water before handling the bottles or feeding your baby."
        }
      ]
    },
    {
      "name":"Sterilizing Bottles",
      "steps":[
        {
          "headline":"Understand that it's not necessary to sterilize bottles after each use.",
          "description":"Although parents were once advised to sterilize bottles after every use, this is no longer deemed necessary. According to The American Academy of Pediatrics, washing your bottle with hot, soapy water is enough to effectively clean it -- as long as the water is safe to drink. However, it is still necessary to sterilize new bottles before their first use and to sterilize bottles that have been washed with well water after each use."
        },
        {
          "headline":"Use a bottle sterilizer.",
          "description":"When you need to sterilize your bottles, you can do so using an electric steam sterilizer or a microwave steam sterilizer. With both types of sterilizer, the bottles are immersed in steam at a temperature of 212 degrees F (or 100 degrees C), which kills off any bacteria. With the electric sterilizer, you add water, stack the bottles, rings and nipples (spaced well apart), cover with a lid, plug in and turn on. The sterilization process takes approximately 10 minutes. With the microwave sterilizer, the process is essentially the same. Once the bottles are in the sterilizer, place it in the microwave and heat on full power for 4 to 8 minutes, depending on the wattage of your microwave."
        },
        {
          "headline":"Sterilize bottles in boiling water.",
          "description":"The old fashioned way of sterilizing bottles simply involved boiling them in a pot of water. Bring a large pot of water to the boil, then add the bottle parts, cover with a lid and boil for at least 5 minutes. This method is best for sterilizing glass baby bottles, but will work on plastic ones too (provided they don't contain BPA)."
        }
      ]
    },
    {
      "name":"Cleaning Bottles While Traveling",
      "steps":[
        {
          "headline":"Be prepared.",
          "description":"The best way to deal with bottle cleaning when travelling is to be prepared. Carry a small bottle of dish soap and a bottle brush in a sealable plastic bag at all times. Use disposable bottle liners, so you only have to bring one bottle. The liners can be changed after each feed so the bottle only needs to be washed at night. If you're staying somewhere with a microwave, bring a portable microwave sterilizer with you when you travel."
        },
        {
          "headline":"Wash the bottles in a hotel sink or public restroom.",
          "description":"If you're prepared and have your dish soap and bottle brush with you, you can wash the bottles in any available sink. Just make sure to give the sink a rinse down first, to remove any obvious dirt. Once washed, place the bottle parts on a clean towel to dry."
        },
        {
          "headline":"Sterilize using a travel kettle.",
          "description":"If you've used a sink with water unsafe for drinking, you may need to sterilize bottles while traveling. As mentioned above, the easiest way to do this is with a portable microwave sterilizer, but if you don't have access to a microwave, you can make do with a travel kettle and a small pair of bottle tongs. Simply fill the kettle with water, plug it in and allow to boil. Pour the boiling water over the (washed) bottle parts in the sink. Use the tongs to remove the items from the sink and place them on a clean towel to dry."
        }
      ]
    }
  ],
  "text":" Cleaning Bottles Rinse the baby bottles directly after use. As soon as you have finished feeding your baby, give the bottle a quick rinse out in the sink. You can wash the bottle more thoroughly later on when you have time, but this will prevent any old milk or dirt from accumulating in the bottle. Try to use hot water when rinsing out the bottle, as this will clean more effectively. Gather the right cleaning materials. When cleaning out baby bottles, it helps to use the right materials. Make sure you have:\nA bottle brush to help you clean the bottom and sides of the bottle and a nipple brush to clean out the rubber nipple, which is prone to accumulating bacteria. Dishwashing liquid designed specifically for baby bottles. This is very gentle and non-toxic and will not leave a soapy residue on the bottles. If you are using plastic baby bottles, make sure that they are free from BPA (bisphenol A), an estrogen-mimicking chemical that was banned by the FDA in 2012. Rinse out the sink and fill with hot soapy water. Before you wash your bottles, it's a good idea to clean the sink you intend to use first, to remove any potential bacteria or chemicals. Use a sponge or scouring pad to scrub down the bottom and sides of the sink and around the plug using hot water. You can use a little baking soda as a natural disinfectant if necessary. Once the sink is clean and rinsed, fill it with hot water (as hot as your hands can comfortably handle) and dish soap. Dismantle the bottle and wash each part separately. When cleaning baby bottles, it's necessary to take them apart and wash each part -- the bottle, the ring and the nipple -- separately. This is important as a lot of old milk can build up between the ring and the nipple, leading to the growth of bacteria. Place all of the bottle parts into the hot, soapy water and wash separately. Use the bottle brush for the bottles and the nipple brush for the plastic nipples and rings. Alternatively, wash the bottles in the dishwasher. If your bottles are labelled dishwasher safe, you can go ahead and wash them in the dishwasher. Stack the bottles upside-down on the top rack of the dishwasher, away from the heating element. You can buy special dishwasher-safe baskets for the nipples and rings in baby supply stores. Allow the bottles to dry thoroughly. After washing, rinse the bottle parts thoroughly in hot running water to remove any bubbles or soap residue. Place the parts on a bottle drying rack (available at baby supply stores in a range of cute designs). Make sure the bottles are left to drain in a well-ventilated location to ensure that they dry thoroughly. Bottles that remain damp for too long can grow mold or fungus. Wash your hands before bottle feeding your baby. Once the bottles are dry, remember to wash your hands thoroughly with soap and warm water before handling the bottles or feeding your baby. Sterilizing Bottles Understand that it's not necessary to sterilize bottles after each use. Although parents were once advised to sterilize bottles after every use, this is no longer deemed necessary. According to The American Academy of Pediatrics, washing your bottle with hot, soapy water is enough to effectively clean it -- as long as the water is safe to drink. However, it is still necessary to sterilize new bottles before their first use and to sterilize bottles that have been washed with well water after each use. Use a bottle sterilizer. When you need to sterilize your bottles, you can do so using an electric steam sterilizer or a microwave steam sterilizer. With both types of sterilizer, the bottles are immersed in steam at a temperature of 212 degrees F (or 100 degrees C), which kills off any bacteria. With the electric sterilizer, you add water, stack the bottles, rings and nipples (spaced well apart), cover with a lid, plug in and turn on. The sterilization process takes approximately 10 minutes. With the microwave sterilizer, the process is essentially the same. Once the bottles are in the sterilizer, place it in the microwave and heat on full power for 4 to 8 minutes, depending on the wattage of your microwave. Sterilize bottles in boiling water. The old fashioned way of sterilizing bottles simply involved boiling them in a pot of water. Bring a large pot of water to the boil, then add the bottle parts, cover with a lid and boil for at least 5 minutes. This method is best for sterilizing glass baby bottles, but will work on plastic ones too (provided they don't contain BPA). Cleaning Bottles While Traveling Be prepared. The best way to deal with bottle cleaning when travelling is to be prepared. Carry a small bottle of dish soap and a bottle brush in a sealable plastic bag at all times. Use disposable bottle liners, so you only have to bring one bottle. The liners can be changed after each feed so the bottle only needs to be washed at night. If you're staying somewhere with a microwave, bring a portable microwave sterilizer with you when you travel. Wash the bottles in a hotel sink or public restroom. If you're prepared and have your dish soap and bottle brush with you, you can wash the bottles in any available sink. Just make sure to give the sink a rinse down first, to remove any obvious dirt. Once washed, place the bottle parts on a clean towel to dry. Sterilize using a travel kettle. If you've used a sink with water unsafe for drinking, you may need to sterilize bottles while traveling. As mentioned above, the easiest way to do this is with a portable microwave sterilizer, but if you don't have access to a microwave, you can make do with a travel kettle and a small pair of bottle tongs. Simply fill the kettle with water, plug it in and allow to boil. Pour the boiling water over the (washed) bottle parts in the sink. Use the tongs to remove the items from the sink and place them on a clean towel to dry.",
  "tyn_model":[
    "water",
    "bottles",
    "bottle",
    "bottle brush",
    "microwave",
    "dish soap",
    "microwave sterilizer",
    "nipple brush",
    "baby supply stores",
    "dishwashing liquid",
    "bisphenol a",
    "soapy water",
    "sponge",
    "baking soda",
    "milk",
    "bottle drying rack",
    "bottle feeding",
    "soap",
    "bottle sterilizer",
    "electric steam sterilizer",
    "microwave steam sterilizer",
    "electric sterilizer",
    "pot",
    "bottle liners",
    "travel kettle",
    "bottle tongs",
    "kettle"
  ],
  "tyn_section":[

  ]
}