{
  "title":"How to Make Fish Bowl Drinks",
  "url":"https://www.wikihow.com/Make-Fish-Bowl-Drinks",
  "category_hierarchy":[
    "Food and Entertaining",
    "Drinks",
    "Alcoholic Drinks"
  ],
  "methods":[
    {
      "name":"Making the Classic Fishbowl Drink",
      "steps":[
        {
          "headline":"Gather the ingredients and supplies.",
          "description":"This summertime drink requires several liquors, a few candies, fresh fruit, and a few fishbowls! You will need:\n10 ounces Vodka\n10 ounces Coconut Rum\n6 ounces Blue Curacao Liqueur\n12 ounces Sweet-and-Sour Mix\n20 ounces Pineapple Juice\n32 ounces Lemon-Lime Soda\nBlue food coloring\n1 6 ounce box of Nerds\u00ae candy\n12 to 18 Swedish Fish candies\n1 Fresh Lemon\n1 Fresh Lime\n1 Fresh Orange\nIce\n3 small Fishbowls\n9 Drinking Straws"
        },
        {
          "headline":"Mix the liquids.",
          "description":"Find a large pitcher or container. Pour the Vodka, Coconut Rum, Blue Curacao Liqueur, Sweet-and-Sour Mix, Pineapple Juice, and Lemon-Lime soda into the pitcher or container. Stir with a spoon. Cover the pitcher or container tightly and keep it in the fridge until you\u2019re ready to serve the drink."
        },
        {
          "headline":"Prep the fishbowls.",
          "description":"Thoroughly wash and dry the 3 fishbowls. Divide the Nerds\u00ae candy evenly between the 3 fishbowls. The Nerds\u00ae should cover the bottom of the fishbowl. Fill the fishbowl with ice. Wedge 4 to 6 Swedish fish candies between the ice and the glass\u2014the ice will hold the fish in place."
        },
        {
          "headline":"Pour the drinks.",
          "description":"Grab the pitcher or container out the of the fridge. Uncover and add the blue food coloring to the mix. Add a few drops at a time and stir until the liquid becomes the perfect shade of ocean blue. Pour or ladle the mixture into the 3 fish bowls. Try to divide the mixture between the 3 fishbowls as evenly as possible."
        },
        {
          "headline":"Add the finishing touches and serve.",
          "description":"Wash the lemon, lime, and orange before thinly slicing the fruit. Add 2 to 3 slices of each fruit to the top of each fishbowl. Top each drink off with Lemon-Lime soda. Put 3 straws into each fishbowl and serve the drinks to your guests."
        }
      ]
    },
    {
      "name":"Making an Upscale Fishbowl Drink",
      "steps":[
        {
          "headline":"Gather the ingredients and supplies.",
          "description":"While this classy fishbowl drink doesn\u2019t have candy rocks or fish, it has the same great taste! You will need:\n3 ounces Coconut Rum\n3 ounces Blue Curacao Liqueur\n3 ounces Vodka\n1 ounce Pineapple Juice\n\u00bd cup Sweet-and-Sour Mix\n1 can Lemon-Lime Soda\n1 Fresh Lemon\n1 Fresh Lime\nIce\n1 Pitcher\n4 Glasses."
        },
        {
          "headline":"Mix the liquids.",
          "description":"Combine the Coconut Rum, Blue Curacao Liqueur, and Vodka. Add the Pineapple Juice, Sweet-and-Sour Mix, and Lemon Lime Soda into the pitcher. Stir with a spoon.."
        },
        {
          "headline":"Make the drinks.",
          "description":"Fill each glass with ice. Pour the liquid over the ice. Carefully quarter the lemon and lime. Garnish each drink with 1 lime quarter and 1 lemon quarter. Serve the festive summer drink to your guests."
        }
      ]
    },
    {
      "name":"Making a Non-Alcoholic Fishbowl Drink",
      "steps":[
        {
          "headline":"Gather the ingredients and supplies.",
          "description":"Kids and adults will love this non-alcoholic fishbowl drink! You will need:\n3 tablespoons Water\n3 tablespoons Sugar\n1 teaspoon Coconut Extract\n3 drops Blue Food Coloring\n2 12 ounce cans Lemon-Lime Soda\nIce\n1 6 ounce box of Nerds\u00ae candy\n9 to 12 Swedish Fish candies\n3 Straws\n1 pitcher\n1 microwave safe bowl\n3 glasses"
        },
        {
          "headline":"Mix the drink.",
          "description":"Pour the water and sugar into a microwave safe bowl. Heat in the microwave for 1 minute. Take the bowl out and stir the mixture until the sugar is completely dissolved. Pour the mixture into a pitcher. Pour in the coconut extract and soda. Add 3 drops of blue food coloring to the pitcher and stir."
        },
        {
          "headline":"Prep the glasses and serve the drinks.",
          "description":"Divide the Nerds\u00ae candy between the 3glasses. The Nerds\u00ae candy should cover the bottom of each glass. Add ice to each cup. Position 3 to 4 Swedish Fish candies between the ice and the glass. Pour the mixture over the ice and add a straw. Serve the delicious non-alcoholic beverage to your guests!"
        },
        {
          "headline":"Finished.",
          "description":""
        }
      ]
    }
  ],
  "text":" Making the Classic Fishbowl Drink Gather the ingredients and supplies. This summertime drink requires several liquors, a few candies, fresh fruit, and a few fishbowls! You will need:\n10 ounces Vodka\n10 ounces Coconut Rum\n6 ounces Blue Curacao Liqueur\n12 ounces Sweet-and-Sour Mix\n20 ounces Pineapple Juice\n32 ounces Lemon-Lime Soda\nBlue food coloring\n1 6 ounce box of Nerds\u00ae candy\n12 to 18 Swedish Fish candies\n1 Fresh Lemon\n1 Fresh Lime\n1 Fresh Orange\nIce\n3 small Fishbowls\n9 Drinking Straws Mix the liquids. Find a large pitcher or container. Pour the Vodka, Coconut Rum, Blue Curacao Liqueur, Sweet-and-Sour Mix, Pineapple Juice, and Lemon-Lime soda into the pitcher or container. Stir with a spoon. Cover the pitcher or container tightly and keep it in the fridge until you\u2019re ready to serve the drink. Prep the fishbowls. Thoroughly wash and dry the 3 fishbowls. Divide the Nerds\u00ae candy evenly between the 3 fishbowls. The Nerds\u00ae should cover the bottom of the fishbowl. Fill the fishbowl with ice. Wedge 4 to 6 Swedish fish candies between the ice and the glass\u2014the ice will hold the fish in place. Pour the drinks. Grab the pitcher or container out the of the fridge. Uncover and add the blue food coloring to the mix. Add a few drops at a time and stir until the liquid becomes the perfect shade of ocean blue. Pour or ladle the mixture into the 3 fish bowls. Try to divide the mixture between the 3 fishbowls as evenly as possible. Add the finishing touches and serve. Wash the lemon, lime, and orange before thinly slicing the fruit. Add 2 to 3 slices of each fruit to the top of each fishbowl. Top each drink off with Lemon-Lime soda. Put 3 straws into each fishbowl and serve the drinks to your guests. Making an Upscale Fishbowl Drink Gather the ingredients and supplies. While this classy fishbowl drink doesn\u2019t have candy rocks or fish, it has the same great taste! You will need:\n3 ounces Coconut Rum\n3 ounces Blue Curacao Liqueur\n3 ounces Vodka\n1 ounce Pineapple Juice\n\u00bd cup Sweet-and-Sour Mix\n1 can Lemon-Lime Soda\n1 Fresh Lemon\n1 Fresh Lime\nIce\n1 Pitcher\n4 Glasses. Mix the liquids. Combine the Coconut Rum, Blue Curacao Liqueur, and Vodka. Add the Pineapple Juice, Sweet-and-Sour Mix, and Lemon Lime Soda into the pitcher. Stir with a spoon.. Make the drinks. Fill each glass with ice. Pour the liquid over the ice. Carefully quarter the lemon and lime. Garnish each drink with 1 lime quarter and 1 lemon quarter. Serve the festive summer drink to your guests. Making a Non-Alcoholic Fishbowl Drink Gather the ingredients and supplies. Kids and adults will love this non-alcoholic fishbowl drink! You will need:\n3 tablespoons Water\n3 tablespoons Sugar\n1 teaspoon Coconut Extract\n3 drops Blue Food Coloring\n2 12 ounce cans Lemon-Lime Soda\nIce\n1 6 ounce box of Nerds\u00ae candy\n9 to 12 Swedish Fish candies\n3 Straws\n1 pitcher\n1 microwave safe bowl\n3 glasses Mix the drink. Pour the water and sugar into a microwave safe bowl. Heat in the microwave for 1 minute. Take the bowl out and stir the mixture until the sugar is completely dissolved. Pour the mixture into a pitcher. Pour in the coconut extract and soda. Add 3 drops of blue food coloring to the pitcher and stir. Prep the glasses and serve the drinks. Divide the Nerds\u00ae candy between the 3glasses. The Nerds\u00ae candy should cover the bottom of each glass. Add ice to each cup. Position 3 to 4 Swedish Fish candies between the ice and the glass. Pour the mixture over the ice and add a straw. Serve the delicious non-alcoholic beverage to your guests! Finished. ",
  "tyn_model":[
    "ice",
    "pitcher",
    "lemon-lime soda",
    "lemon",
    "vodka",
    "coconut rum",
    "blue curacao liqueur",
    "pineapple juice",
    "nerds\u00ae candy",
    "swedish fish candies",
    "blue food coloring",
    "lime",
    "sugar",
    "sweet-and-sour mix",
    "spoon",
    "fridge",
    "sweet-and-sour",
    "water",
    "coconut extract",
    "microwave safe bowl",
    "food coloring",
    "fresh orange",
    "drinking straws",
    "nerds\u00ae",
    "nerds",
    "glass",
    "\u2014the",
    "container",
    "orange",
    "lemon lime soda",
    "microwave",
    "bowl",
    "soda",
    "glasses",
    "straw"
  ],
  "tyn_section":[

  ]
}