{
  "title":"How to Clean Microfiber",
  "url":"https://www.wikihow.com/Clean-Microfiber",
  "category_hierarchy":[
    "Home and Garden",
    "Housekeeping",
    "Laundry",
    "Cleaning Fabric",
    "Cleaning Synthetic Fabric"
  ],
  "methods":[
    {
      "name":"Cleaning Microfiber Furniture",
      "steps":[
        {
          "headline":"Remove fabric covers from cushions and pillows.",
          "description":"If you\u2019re cleaning a couch, pillow, or other piece of furniture that uses microfiber slip-covers, take them off the furniture and set them aside. Wash these separately, either by hand or in a washing machine."
        },
        {
          "headline":"Use rubbing alcohol to remove dirt and greasy stains.",
          "description":"Pour rubbing alcohol into a squirt bottle and spray it onto the grimy area. Let it sit for about 1 minute, then scrub the alcohol with a clean sponge. Keep scrubbing until you see results, spraying on more alcohol if necessary. If you\u2019re worried about discoloring your furniture, wipe a cotton swab dipped in rubbing alcohol to an inconspicuous area to test for colorfastness."
        },
        {
          "headline":"Use distilled water to get rid of water stains.",
          "description":"If your furniture has light stains caused by moisture, fill up a squirt bottle with distilled water and spray it on the affected area. Just like with the rubbing alcohol, scrub the couch with a sponge until you start seeing the stains go away."
        },
        {
          "headline":"Let your furniture air dry.",
          "description":"If you have the time, let your furniture dry on its own. This will prevent any needless damage caused by improper drying techniques. However, if you\u2019re in a hurry, try spot drying the microfiber with a blow dryer. Make sure the dryer is set to cool, since heat can damage microfiber."
        },
        {
          "headline":"Scrub the microfiber with a brush after cleaning.",
          "description":"Once it\u2019s dry, your furniture may feel crisp or hard. If it does, rub the rough areas with a soft bristle or suede brush. This will loosen the fibers and make them feel comfortable again."
        }
      ]
    },
    {
      "name":"Hand Washing Microfiber Fabric",
      "steps":[
        {
          "headline":"Soak the cloth in warm water.",
          "description":"Fill a bucket or sink with warm water. Add 3 to 5 tablespoons (44 to 74 mL) of a clear liquid laundry detergent or dish soap. Gently mix the cleaner into the water. Then, add your fabric to the water. Specialty microfiber cleaning solutions are also available. You can buy them online or in the cleaning aisle of your local store. You can start washing the cloth as soon as it is fully wet, or you can let the fabric soak for an hour or longer if it is especially soiled."
        },
        {
          "headline":"Use your hands to wash the fabric.",
          "description":"Agitate the cloth manually by rubbing it with your hands. This will remove built up dirt and grime. Repeat as needed."
        },
        {
          "headline":"Rinse the cloth thoroughly with warm water.",
          "description":"In a sink or bucket, completely rinse the fabric with warm water. Make sure that the soap or cleaning solution is completely removed. Wring the cloth to remove excess water."
        },
        {
          "headline":"Allow the fabric to air dry if possible.",
          "description":"Microfiber is a synthetic material and high heat can damage it. Air drying will help the cloth last longer. To do so, hang the fabric on a clothesline, or drape it over a sink or bucket. Microfiber dries quickly, so you will not have to wait long."
        },
        {
          "headline":"Use the lowest dryer setting if you need to dry the cloth quickly.",
          "description":"If your dryer has an air-fluff setting, use that to dry the cloth. If not, use the lowest setting possible, and check on the cloth after 30 minutes. The less heat exposure it has, the longer the fabric will last."
        }
      ]
    },
    {
      "name":"Machine Washing Microfiber Fabric",
      "steps":[
        {
          "headline":"Wash microfiber only with other microfiber fabrics.",
          "description":"Microfiber will attract lint from other fabrics, such as cotton. These fibers are extremely hard to remove from the microfiber and will decrease the effectiveness of the fabric. It is best to only wash microfiber cloth with other microfiber materials."
        },
        {
          "headline":"Use a gentle, clear, liquid laundry detergent.",
          "description":"Stronger laundry detergents can damage microfiber fabric and make cleaning cloths less efficient. Powdered detergents will adhere to the microfiber in the same way that cotton will, creating a difficult to remove film over the cloth. Use the smallest amount of detergent possible to avoid damaging the microfiber. Begin with \u00bd the amount you would use for normal laundry and add more to the next load if necessary. You can also use a specialty microfiber cleaning solution in place of detergent. Read the label to make sure that the cleaning solution is safe for the washing machine."
        },
        {
          "headline":"Skip the fabric softener.",
          "description":"Fabric softener will clog up microfiber and bind multiple pieces of cloth together. Only use a clear detergent or specialty microfiber cleaner when laundering your fabric."
        },
        {
          "headline":"Avoid using bleach to clean microfiber fabric.",
          "description":"The bleach will cause the fibers to deteriorate, making them wear out more quickly. If you\u2019re washing microfiber cleaning cloths, bleach will make them less effective at picking up dirt and grime."
        },
        {
          "headline":"Set your washer to a cool or warm water setting.",
          "description":"Though hot water is generally better at cleaning, high temperatures can damage the synthetic material found in microfiber. To help your fabric last longer, set your washing machine so it uses only cool or warm water."
        },
        {
          "headline":"Use the lowest temperature possible to dry your microfiber.",
          "description":"If possible, air-dry the fabric after you remove it from the washer. If you\u2019re pressed for time, set your dryer to the lowest temperature setting available and dry your fabric for the shortest amount of time possible."
        }
      ]
    }
  ],
  "text":" Cleaning Microfiber Furniture Remove fabric covers from cushions and pillows. If you\u2019re cleaning a couch, pillow, or other piece of furniture that uses microfiber slip-covers, take them off the furniture and set them aside. Wash these separately, either by hand or in a washing machine. Use rubbing alcohol to remove dirt and greasy stains. Pour rubbing alcohol into a squirt bottle and spray it onto the grimy area. Let it sit for about 1 minute, then scrub the alcohol with a clean sponge. Keep scrubbing until you see results, spraying on more alcohol if necessary. If you\u2019re worried about discoloring your furniture, wipe a cotton swab dipped in rubbing alcohol to an inconspicuous area to test for colorfastness. Use distilled water to get rid of water stains. If your furniture has light stains caused by moisture, fill up a squirt bottle with distilled water and spray it on the affected area. Just like with the rubbing alcohol, scrub the couch with a sponge until you start seeing the stains go away. Let your furniture air dry. If you have the time, let your furniture dry on its own. This will prevent any needless damage caused by improper drying techniques. However, if you\u2019re in a hurry, try spot drying the microfiber with a blow dryer. Make sure the dryer is set to cool, since heat can damage microfiber. Scrub the microfiber with a brush after cleaning. Once it\u2019s dry, your furniture may feel crisp or hard. If it does, rub the rough areas with a soft bristle or suede brush. This will loosen the fibers and make them feel comfortable again. Hand Washing Microfiber Fabric Soak the cloth in warm water. Fill a bucket or sink with warm water. Add 3 to 5 tablespoons (44 to 74 mL) of a clear liquid laundry detergent or dish soap. Gently mix the cleaner into the water. Then, add your fabric to the water. Specialty microfiber cleaning solutions are also available. You can buy them online or in the cleaning aisle of your local store. You can start washing the cloth as soon as it is fully wet, or you can let the fabric soak for an hour or longer if it is especially soiled. Use your hands to wash the fabric. Agitate the cloth manually by rubbing it with your hands. This will remove built up dirt and grime. Repeat as needed. Rinse the cloth thoroughly with warm water. In a sink or bucket, completely rinse the fabric with warm water. Make sure that the soap or cleaning solution is completely removed. Wring the cloth to remove excess water. Allow the fabric to air dry if possible. Microfiber is a synthetic material and high heat can damage it. Air drying will help the cloth last longer. To do so, hang the fabric on a clothesline, or drape it over a sink or bucket. Microfiber dries quickly, so you will not have to wait long. Use the lowest dryer setting if you need to dry the cloth quickly. If your dryer has an air-fluff setting, use that to dry the cloth. If not, use the lowest setting possible, and check on the cloth after 30 minutes. The less heat exposure it has, the longer the fabric will last. Machine Washing Microfiber Fabric Wash microfiber only with other microfiber fabrics. Microfiber will attract lint from other fabrics, such as cotton. These fibers are extremely hard to remove from the microfiber and will decrease the effectiveness of the fabric. It is best to only wash microfiber cloth with other microfiber materials. Use a gentle, clear, liquid laundry detergent. Stronger laundry detergents can damage microfiber fabric and make cleaning cloths less efficient. Powdered detergents will adhere to the microfiber in the same way that cotton will, creating a difficult to remove film over the cloth. Use the smallest amount of detergent possible to avoid damaging the microfiber. Begin with \u00bd the amount you would use for normal laundry and add more to the next load if necessary. You can also use a specialty microfiber cleaning solution in place of detergent. Read the label to make sure that the cleaning solution is safe for the washing machine. Skip the fabric softener. Fabric softener will clog up microfiber and bind multiple pieces of cloth together. Only use a clear detergent or specialty microfiber cleaner when laundering your fabric. Avoid using bleach to clean microfiber fabric. The bleach will cause the fibers to deteriorate, making them wear out more quickly. If you\u2019re washing microfiber cleaning cloths, bleach will make them less effective at picking up dirt and grime. Set your washer to a cool or warm water setting. Though hot water is generally better at cleaning, high temperatures can damage the synthetic material found in microfiber. To help your fabric last longer, set your washing machine so it uses only cool or warm water. Use the lowest temperature possible to dry your microfiber. If possible, air-dry the fabric after you remove it from the washer. If you\u2019re pressed for time, set your dryer to the lowest temperature setting available and dry your fabric for the shortest amount of time possible.",
  "tyn_model":[
    "water",
    "rubbing alcohol",
    "dryer",
    "bleach",
    "washing machine",
    "squirt bottle",
    "sponge",
    "distilled water",
    "detergent",
    "fabric softener",
    "washer",
    "fabric",
    "microfiber slip-covers",
    "alcohol",
    "blow dryer",
    "brush",
    "clear liquid laundry detergent",
    "dish soap",
    "soap",
    "microfiber",
    "laundry detergent",
    "laundry detergents",
    "detergents",
    "clear detergent",
    "microfiber cleaner"
  ],
  "tyn_section":[

  ]
}