{
  "title":"How to Clean Strawberries",
  "url":"https://www.wikihow.com/Clean-Strawberries",
  "category_hierarchy":[
    "Food and Entertaining",
    "Recipes",
    "Fruits and Vegetables",
    "Berries"
  ],
  "methods":[
    {
      "name":"Washing Strawberries in Water",
      "steps":[
        {
          "headline":"Remove bad or spoiled strawberries.",
          "description":"Don\u2019t wash them before you\u2019re ready to use them, though, as strawberries act like sponges. They absorb water fast, which speeds up spoiling. Discard strawberries that are bruised, mushy, moldy or not ripe. Keep strawberries that have a deep red color and are plump. Don\u2019t remove the stem before washing as that way the strawberries will just absorb water."
        },
        {
          "headline":"Place strawberries in a large clean colander.",
          "description":"It\u2019s important not to ever soak them in water. Wash the strawberries under clean running water. Keep moving them gently with hands making sure each one gets washed."
        },
        {
          "headline":"Clean them in a basin of cool water alternatively.",
          "description":"Hold a few strawberries in hand and slosh them through the water. Rather than being submerged, strawberries need to be given a quick rinse."
        },
        {
          "headline":"Dry the strawberries.",
          "description":"When left wet, berries start going bad fast. Even if they are left wet to air dry, they will absorb the water and taste less sweet. Let them drain in the colander for a minute. Pat them dry with a paper towel. Be careful not to damage the fruit. Alternatively, spread them on a clean kitchen towel and gently rub them dry."
        }
      ]
    },
    {
      "name":"Cleaning Strawberries with Vinegar Solution",
      "steps":[
        {
          "headline":"Clean the strawberries more thoroughly with a vinegar solution.",
          "description":"This also helps keep them from getting spoiled too fast in the refrigerator. It\u2019s frustrating to buy a carton of strawberries and to find them covered in white fuzz two days later. You should discard strawberries that are moldy or squished. Again, keep the stem on until you are ready to use the berries in your recipe or to eat."
        },
        {
          "headline":"Prepare the vinegar solution.",
          "description":"You will need white vinegar and a basin or sink. Fill up half a clean basin or sink with cold water. Make sure the water is not warm. Add 1 cup vinegar for every 3 cups of water. Mix the solution well with your hand."
        },
        {
          "headline":"Grab two or three strawberries.",
          "description":"You will clean a few strawberries at the time. This ensures you are cleaning each one properly. Run strawberries vigorously for about 30 seconds through the vinegar solution. Rinse those strawberries well under cold water. You don\u2019t want any of the vinegar flavor to remain on the fruit. Pat the fruit dry with paper towels, or dry it gently with a kitchen towel."
        }
      ]
    },
    {
      "name":"Using Veggie Wash",
      "steps":[
        {
          "headline":"Prepare the Veggie Wash solution.",
          "description":"You can purchase Veggie Wash at most major food supermarkets. Fill up half a clean basin or a sink with cold water. Add 2 oz of Veggie Wash and stir. Give the solution a good swirl."
        },
        {
          "headline":"Grab up to two or three strawberries in your hand.",
          "description":"This ensures each piece gets cleaned properly. Run strawberries vigorously for about 30 seconds through the Veggie Wash solution. Rinse those strawberries well under cold running water. You don\u2019t want any of the Veggie Wash residue to remain on the fruit. Pat the fruit dry with paper towels, or gently dry it with a kitchen towel."
        }
      ]
    }
  ],
  "text":" Washing Strawberries in Water Remove bad or spoiled strawberries. Don\u2019t wash them before you\u2019re ready to use them, though, as strawberries act like sponges. They absorb water fast, which speeds up spoiling. Discard strawberries that are bruised, mushy, moldy or not ripe. Keep strawberries that have a deep red color and are plump. Don\u2019t remove the stem before washing as that way the strawberries will just absorb water. Place strawberries in a large clean colander. It\u2019s important not to ever soak them in water. Wash the strawberries under clean running water. Keep moving them gently with hands making sure each one gets washed. Clean them in a basin of cool water alternatively. Hold a few strawberries in hand and slosh them through the water. Rather than being submerged, strawberries need to be given a quick rinse. Dry the strawberries. When left wet, berries start going bad fast. Even if they are left wet to air dry, they will absorb the water and taste less sweet. Let them drain in the colander for a minute. Pat them dry with a paper towel. Be careful not to damage the fruit. Alternatively, spread them on a clean kitchen towel and gently rub them dry. Cleaning Strawberries with Vinegar Solution Clean the strawberries more thoroughly with a vinegar solution. This also helps keep them from getting spoiled too fast in the refrigerator. It\u2019s frustrating to buy a carton of strawberries and to find them covered in white fuzz two days later. You should discard strawberries that are moldy or squished. Again, keep the stem on until you are ready to use the berries in your recipe or to eat. Prepare the vinegar solution. You will need white vinegar and a basin or sink. Fill up half a clean basin or sink with cold water. Make sure the water is not warm. Add 1 cup vinegar for every 3 cups of water. Mix the solution well with your hand. Grab two or three strawberries. You will clean a few strawberries at the time. This ensures you are cleaning each one properly. Run strawberries vigorously for about 30 seconds through the vinegar solution. Rinse those strawberries well under cold water. You don\u2019t want any of the vinegar flavor to remain on the fruit. Pat the fruit dry with paper towels, or dry it gently with a kitchen towel. Using Veggie Wash Prepare the Veggie Wash solution. You can purchase Veggie Wash at most major food supermarkets. Fill up half a clean basin or a sink with cold water. Add 2 oz of Veggie Wash and stir. Give the solution a good swirl. Grab up to two or three strawberries in your hand. This ensures each piece gets cleaned properly. Run strawberries vigorously for about 30 seconds through the Veggie Wash solution. Rinse those strawberries well under cold running water. You don\u2019t want any of the Veggie Wash residue to remain on the fruit. Pat the fruit dry with paper towels, or gently dry it with a kitchen towel.",
  "tyn_model":[
    "strawberries",
    "water",
    "vinegar",
    "veggie wash",
    "kitchen towel",
    "colander",
    "cold water",
    "paper towels",
    "berries",
    "paper towel",
    "refrigerator",
    "white vinegar"
  ],
  "tyn_section":[

  ]
}