{
  "title":"How to Order Off the Starbucks \"Secret\" Menu",
  "url":"https://www.wikihow.com/Order-Off-the-Starbucks-%22Secret%22-Menu",
  "category_hierarchy":[
    "Food and Entertaining",
    "Drinks",
    "Coffee",
    "Commercial Coffee",
    "Starbucks Coffee"
  ],
  "parts":[
    {
      "name":"Placing Your Order",
      "steps":[
        {
          "headline":"Know the recipe, not just the name.",
          "description":"When it\u2019s your turn to order, you need to be able to tell the barista exactly what is in your secret menu item drink. Visit websites like https://starbuckssecretmenu.net/ or http://hackthemenu.com/starbucks/secret-menu/ to pick a drink and get the information on how to create it. It\u2019s a good idea to pull the recipe up on your phone so that you can refer to it if needed when ordering. The Starbucks employees probably won't know about the drink. The Starbucks secret menu is maintained by fans, not by Starbucks, so the employees are not trained to make these drinks."
        },
        {
          "headline":"Start with the base drink.",
          "description":"Most secret menu drinks will be an alteration of a drink that already exists, so be sure to tell your barista what the base drink is to make their job much easier. For example, the base drink for a Twix Frappuccino is a Caramel Frappuccino."
        },
        {
          "headline":"Request any substitutions.",
          "description":"Once you\u2019ve stated your base drink, specify whether you\u2019d like any substitutions in the liquid. For example, maybe your secret menu item asks for milk instead of water."
        },
        {
          "headline":"Ask for the type and number of pumps of additions.",
          "description":"Most secret menu drinks will have an additional type of syrup or specific number of pumps that should be used. When you go to order, don\u2019t just say you\u2019d like caramel syrup, but know the number of pumps that your drink requires. Know the specific toppings on your drink as well, such as mocha drizzle, whipped cream, or chocolate chips. Be prepared to pay for the extra additions."
        },
        {
          "headline":"Order the drink as a custom order in 1 sentence.",
          "description":"Instead of requesting the secret menu item\u2019s name, ask for the base drink, substitutions, and additions all in 1 swift sentence. For example, if you\u2019re ordering a Red Velvet Frappuccino, you\u2019d say \u201ca half White Chocolate Mocha and half Regular Chocolate Mocha Frappuccino with 2 pumps of raspberry syrup topped with whipped cream, please.\u201d"
        }
      ]
    },
    {
      "name":"Choosing a Drink",
      "steps":[
        {
          "headline":"Order a Pink Drink for a colorful refresher.",
          "description":"The base drink for a Pink Drink is a Strawberry Acai Refresher with coconut milk, strawberries, and blackberries. This drink is well-known, so the barista may already know how to make it."
        },
        {
          "headline":"Pick a Nutella Frappuccino for a chocolate treat.",
          "description":"Order a Coffee Frappuccino with 2 pumps of mocha syrup and 1 pump of hazelnut syrup, all blended with whipped cream. Ask for a whipped cream topping and a caramel drizzle on top."
        },
        {
          "headline":"Try out a Peach Ring Tea for a sweet, fruity drink.",
          "description":"Ask for half Valencia Orange Refresher and half Passion Tea without water. Add 1-3 pumps of peach syrup."
        },
        {
          "headline":"Opt for the Three C\u2019s for a classic.",
          "description":"The Three C\u2019s consists of a Cinnamon Dolce Latte with a pump of caramel and a pump of chocolate mocha syrup."
        },
        {
          "headline":"Choose the Captain Crunch for a drink that tastes like the cereal.",
          "description":"Order a Strawberries and Creme Frappuccino with a pump of caramel, 2 pumps of toffee, 1 pump of hazelnut, and 2 scoops of chocolate chips."
        },
        {
          "headline":"Drink a Citrus Berry Passion Refresher to cool you down.",
          "description":"This drink is equal parts of Very Berry Hibiscus Refresher, Cool Lime Refresher, and Lemonade. Finish it off with a splash of Passion Tango Tea."
        },
        {
          "headline":"Ask for a Cotton Candy Frappuccino for a pink concoction.",
          "description":"Order a Vanilla Bean Frappuccino with 1-2 extra pumps of raspberry syrup."
        },
        {
          "headline":"Request Raspberry Milk Tea for a soothing thirst-quencher.",
          "description":"This drink consists of Iced Black Tea using half and half instead of water. Ask for an extra pump of classic syrup, 1-2 pumps of toffee nut syrup, and 1-2 pumps of raspberry syrup."
        },
        {
          "headline":"Enjoy a Thin Mint Frappuccino for a minty drink.",
          "description":"Ask for a Tazo Green Tea Frappuccino with 2 pumps of chocolate syrup, 1 pump of mint syrup, java chips, and honey."
        }
      ]
    }
  ],
  "text":" Placing Your Order Know the recipe, not just the name. When it\u2019s your turn to order, you need to be able to tell the barista exactly what is in your secret menu item drink. Visit websites like https://starbuckssecretmenu.net/ or http://hackthemenu.com/starbucks/secret-menu/ to pick a drink and get the information on how to create it. It\u2019s a good idea to pull the recipe up on your phone so that you can refer to it if needed when ordering. The Starbucks employees probably won't know about the drink. The Starbucks secret menu is maintained by fans, not by Starbucks, so the employees are not trained to make these drinks. Start with the base drink. Most secret menu drinks will be an alteration of a drink that already exists, so be sure to tell your barista what the base drink is to make their job much easier. For example, the base drink for a Twix Frappuccino is a Caramel Frappuccino. Request any substitutions. Once you\u2019ve stated your base drink, specify whether you\u2019d like any substitutions in the liquid. For example, maybe your secret menu item asks for milk instead of water. Ask for the type and number of pumps of additions. Most secret menu drinks will have an additional type of syrup or specific number of pumps that should be used. When you go to order, don\u2019t just say you\u2019d like caramel syrup, but know the number of pumps that your drink requires. Know the specific toppings on your drink as well, such as mocha drizzle, whipped cream, or chocolate chips. Be prepared to pay for the extra additions. Order the drink as a custom order in 1 sentence. Instead of requesting the secret menu item\u2019s name, ask for the base drink, substitutions, and additions all in 1 swift sentence. For example, if you\u2019re ordering a Red Velvet Frappuccino, you\u2019d say \u201ca half White Chocolate Mocha and half Regular Chocolate Mocha Frappuccino with 2 pumps of raspberry syrup topped with whipped cream, please.\u201d Choosing a Drink Order a Pink Drink for a colorful refresher. The base drink for a Pink Drink is a Strawberry Acai Refresher with coconut milk, strawberries, and blackberries. This drink is well-known, so the barista may already know how to make it. Pick a Nutella Frappuccino for a chocolate treat. Order a Coffee Frappuccino with 2 pumps of mocha syrup and 1 pump of hazelnut syrup, all blended with whipped cream. Ask for a whipped cream topping and a caramel drizzle on top. Try out a Peach Ring Tea for a sweet, fruity drink. Ask for half Valencia Orange Refresher and half Passion Tea without water. Add 1-3 pumps of peach syrup. Opt for the Three C\u2019s for a classic. The Three C\u2019s consists of a Cinnamon Dolce Latte with a pump of caramel and a pump of chocolate mocha syrup. Choose the Captain Crunch for a drink that tastes like the cereal. Order a Strawberries and Creme Frappuccino with a pump of caramel, 2 pumps of toffee, 1 pump of hazelnut, and 2 scoops of chocolate chips. Drink a Citrus Berry Passion Refresher to cool you down. This drink is equal parts of Very Berry Hibiscus Refresher, Cool Lime Refresher, and Lemonade. Finish it off with a splash of Passion Tango Tea. Ask for a Cotton Candy Frappuccino for a pink concoction. Order a Vanilla Bean Frappuccino with 1-2 extra pumps of raspberry syrup. Request Raspberry Milk Tea for a soothing thirst-quencher. This drink consists of Iced Black Tea using half and half instead of water. Ask for an extra pump of classic syrup, 1-2 pumps of toffee nut syrup, and 1-2 pumps of raspberry syrup. Enjoy a Thin Mint Frappuccino for a minty drink. Ask for a Tazo Green Tea Frappuccino with 2 pumps of chocolate syrup, 1 pump of mint syrup, java chips, and honey.",
  "tyn_model":[
    "whipped cream",
    "raspberry syrup",
    "chocolate chips",
    "starbucks",
    "twix frappuccino is",
    "milk",
    "water",
    "caramel syrup",
    "red velvet",
    "\u201ca",
    "white chocolate mocha",
    "\u201d choosing",
    "strawberry acai refresher",
    "coconut milk",
    "strawberries",
    "blackberries",
    "nutella frappuccino",
    "mocha syrup",
    "hazelnut syrup",
    "peach ring tea",
    "valencia orange refresher",
    "peach syrup",
    "cinnamon dolce latte",
    "caramel",
    "chocolate mocha syrup",
    "captain crunch",
    "toffee",
    "citrus berry passion refresher",
    "very berry hibiscus refresher",
    "cool lime",
    "lemonade",
    "passion tango tea",
    "cotton candy frappuccino",
    "vanilla bean frappuccino",
    "raspberry milk tea",
    "iced black tea",
    "half and half instead of water",
    "toffee nut syrup",
    "thin mint frappuccino",
    "green tea frappuccino",
    "chocolate syrup",
    "mint syrup",
    "java chips",
    "honey"
  ],
  "tyn_section":[

  ]
}