{
  "title":"How to Recycle Old Computer Hard Drives",
  "url":"https://www.wikihow.com/Recycle-Old-Computer-Hard-Drives",
  "category_hierarchy":[
    "Home and Garden",
    "Housekeeping",
    "Household Waste Disposal",
    "Recycling"
  ],
  "methods":[
    {
      "name":"Wiping Your Hard Drive",
      "steps":[
        {
          "headline":"Use software to wipe your hard drive.",
          "description":"Before you discard your hard drive, it is important for you to remove any personal information. One method of achieving this is to use a computer-wiping software. Just choose (and in some cases purchase) the software you'd like to use, install it, and follow the prompts. Some software options include:\nKilldisk\nDerik's Boot and Nuke\nErAce"
        },
        {
          "headline":"Destroy your hard drive.",
          "description":"If there is no chance that you will be using this hard drive again, you can also break the hard drive manually. This will make it impossible for anyone to access your personal information. You have numerous options for destroying the hard drive. These include:\nDrilling holes into it\nHammering it\nMagnetizing it"
        },
        {
          "headline":"Contact a Windows-certified refurbisher if you have a PC.",
          "description":"If you have a Windows PC, there are some Windows-certified refurbishers that can wipe your hard drive for a small fee. Visit https://www.microsoft.com/en-us/refurbishedpcs to locate the refurbisher of your choice. Some refurbishers will provide a free shipping label. Some will offer to recycle the hard drive for you, and others will send it back to you wiped clean."
        },
        {
          "headline":"Send your hard drive to the Apple recycling center if you have a Mac.",
          "description":"If you have a Mac computer, you can send your hard drive to the Apple recycling center. The Apple recycling center will wipe your Mac hard drive (and recycle it) for free. Contact Apple to receive a free shipping label for your hardware. Visit http://www.apple.com/recycling/gift-card/ to contact Apple and request a shipping label."
        }
      ]
    },
    {
      "name":"Sending Your Hard Drive to the Manufacturer",
      "steps":[
        {
          "headline":"Research the policies for your brand.",
          "description":"If you don't want to go through the trouble of disassembling the hard drive yourself, you may be able to send it directly to the manufacturer for recycling. You can choose to send in your whole computer or just your hard drive. First, look into the policies for your brand of computer. Apple provides free shipping labels and free hard drive wiping. IBM will not wipe your hard drive for you or provide shipping labels, but they will accept your old hardware for recycling. Dell will provide a shipping label. In some locations they also allow you to drop off your old hardware at Goodwill."
        },
        {
          "headline":"Request a shipping label.",
          "description":"If you will be working with a company that offers free shipping, contact that company (by phone or online) and request a pre-paid shipping label. Print out your label."
        },
        {
          "headline":"Send in your hard drive.",
          "description":"Once your hard drive has been removed, you can package it up and bring the package to the appropriate mail carrier. Package the hard drive in bubble wrap (or other materials) so that it does not get damaged in transit. If you have received a shipping label, remember to affix this to your box. Also, be sure to visit the mail carrier that matched your shipping label. If you have not received a shipping label, you will need to pay for shipping at the mail carrier of your choice. Be sure to bring the address (available on the website of your brand)."
        }
      ]
    },
    {
      "name":"Recycling the Aluminum",
      "steps":[
        {
          "headline":"Remove the first set of screws.",
          "description":"With the label facing up, remove the six visible screws with an 8x60 Torx screwdriver. There is usually at least one screw covered by the label. Use your fingers to find the depression, then use a utility knife to expose the screw."
        },
        {
          "headline":"Remove the second set of screws and cut the seal.",
          "description":"Turn the drive over and remove the screws that fasten the drive controller card to the drive. Using a utility knife, cut the seal that runs along the side of the drive on all four sides."
        },
        {
          "headline":"Open the cover and remove more screws.",
          "description":"Carefully pry open the drive cover, and set it aside. Remove all visible screws and set these aside as well."
        },
        {
          "headline":"Remove the magnets and the read/write arm.",
          "description":"Use a flat head screwdriver to remove the first rare earth magnet. Next, use the flat head screwdriver to unscrew the drive read/write arm and remove it. With the read/write arm out, you can remove the second magnet. You can retain and reuse these magnets."
        },
        {
          "headline":"Remove the data disk.",
          "description":"Use a 7x60 Torx screwdriver to remove the round plate that retains the data disk. Pull out the retaining ring and data disk. Save or destroy this data disk."
        },
        {
          "headline":"Remove the motor and remaining magnets.",
          "description":"Use an 8x60 Torx screwdriver to remove the drive motor. Now that the drive is completely disassembled, you can remove the two remaining magnets."
        },
        {
          "headline":"Recycle the aluminum.",
          "description":"With the exception of the motor, the remaining parts are all aluminum. The average hard drive produces one-half pound of recyclable aluminum. Bring this material to an aluminum recycling center."
        }
      ]
    }
  ],
  "text":" Wiping Your Hard Drive Use software to wipe your hard drive. Before you discard your hard drive, it is important for you to remove any personal information. One method of achieving this is to use a computer-wiping software. Just choose (and in some cases purchase) the software you'd like to use, install it, and follow the prompts. Some software options include:\nKilldisk\nDerik's Boot and Nuke\nErAce Destroy your hard drive. If there is no chance that you will be using this hard drive again, you can also break the hard drive manually. This will make it impossible for anyone to access your personal information. You have numerous options for destroying the hard drive. These include:\nDrilling holes into it\nHammering it\nMagnetizing it Contact a Windows-certified refurbisher if you have a PC. If you have a Windows PC, there are some Windows-certified refurbishers that can wipe your hard drive for a small fee. Visit https://www.microsoft.com/en-us/refurbishedpcs to locate the refurbisher of your choice. Some refurbishers will provide a free shipping label. Some will offer to recycle the hard drive for you, and others will send it back to you wiped clean. Send your hard drive to the Apple recycling center if you have a Mac. If you have a Mac computer, you can send your hard drive to the Apple recycling center. The Apple recycling center will wipe your Mac hard drive (and recycle it) for free. Contact Apple to receive a free shipping label for your hardware. Visit http://www.apple.com/recycling/gift-card/ to contact Apple and request a shipping label. Sending Your Hard Drive to the Manufacturer Research the policies for your brand. If you don't want to go through the trouble of disassembling the hard drive yourself, you may be able to send it directly to the manufacturer for recycling. You can choose to send in your whole computer or just your hard drive. First, look into the policies for your brand of computer. Apple provides free shipping labels and free hard drive wiping. IBM will not wipe your hard drive for you or provide shipping labels, but they will accept your old hardware for recycling. Dell will provide a shipping label. In some locations they also allow you to drop off your old hardware at Goodwill. Request a shipping label. If you will be working with a company that offers free shipping, contact that company (by phone or online) and request a pre-paid shipping label. Print out your label. Send in your hard drive. Once your hard drive has been removed, you can package it up and bring the package to the appropriate mail carrier. Package the hard drive in bubble wrap (or other materials) so that it does not get damaged in transit. If you have received a shipping label, remember to affix this to your box. Also, be sure to visit the mail carrier that matched your shipping label. If you have not received a shipping label, you will need to pay for shipping at the mail carrier of your choice. Be sure to bring the address (available on the website of your brand). Recycling the Aluminum Remove the first set of screws. With the label facing up, remove the six visible screws with an 8x60 Torx screwdriver. There is usually at least one screw covered by the label. Use your fingers to find the depression, then use a utility knife to expose the screw. Remove the second set of screws and cut the seal. Turn the drive over and remove the screws that fasten the drive controller card to the drive. Using a utility knife, cut the seal that runs along the side of the drive on all four sides. Open the cover and remove more screws. Carefully pry open the drive cover, and set it aside. Remove all visible screws and set these aside as well. Remove the magnets and the read/write arm. Use a flat head screwdriver to remove the first rare earth magnet. Next, use the flat head screwdriver to unscrew the drive read/write arm and remove it. With the read/write arm out, you can remove the second magnet. You can retain and reuse these magnets. Remove the data disk. Use a 7x60 Torx screwdriver to remove the round plate that retains the data disk. Pull out the retaining ring and data disk. Save or destroy this data disk. Remove the motor and remaining magnets. Use an 8x60 Torx screwdriver to remove the drive motor. Now that the drive is completely disassembled, you can remove the two remaining magnets. Recycle the aluminum. With the exception of the motor, the remaining parts are all aluminum. The average hard drive produces one-half pound of recyclable aluminum. Bring this material to an aluminum recycling center.",
  "tyn_model":[
    "hard drive",
    "software",
    "screwdriver",
    "apple recycling center",
    "aluminum",
    "utility knife",
    "screws",
    "flat head screwdriver",
    "computer-wiping software",
    "nuke",
    "pc",
    "apple recycling",
    "computer",
    "bubble wrap",
    "drive controller",
    "rare earth magnet",
    "magnets",
    "aluminum recycling center"
  ],
  "tyn_section":[

  ]
}