{
  "title":"How to Make a Baby Shower Invitation Template Using Microsoft Word",
  "url":"https://www.wikihow.com/Make-a-Baby-Shower-Invitation-Template-Using-Microsoft-Word",
  "category_hierarchy":[
    "Food and Entertaining",
    "Parties",
    "Party Planning",
    "Invitations"
  ],
  "methods":[
    {
      "name":"Making a Template from Scratch",
      "steps":[
        {
          "headline":"Open a new blank document in Microsoft Word.",
          "description":"Open Word and open a new document with a blank 8.5 x 11 letter-size sheet (which is standard). This will be the canvas you work on to create your own design."
        },
        {
          "headline":"Determine your invitation size and shape.",
          "description":"For the easiest design, you can fit two half-sheet sized invitations per sheet. To do this, orient your page landscape, or sideways. At the top of the screen click Page Layout, then Orientation, and then select Landscape."
        },
        {
          "headline":"Create a border.",
          "description":"Click the Insert tab at the top of the screen. Then select the Shapes drop-down menu. Pick a shape to create a border, such as a rectangle, a rounded rectangle, or an oval. Click and drag to create an area about half the size of the page. You\u2019ll want to only use half the page so that later you can copy and paste your design to the other side, so you can print two copies per sheet."
        },
        {
          "headline":"Keep the background readable.",
          "description":"It is probably best to keep your background white, for readability. If your box is filled with color, select Shape Fill from the Format tab, or click the picture of a box with no filling inside. To change the color of the border line, click Shape Outline. If you don't want a white background, choose another light color like yellow so the invitations are easy to read."
        },
        {
          "headline":"Get creative with the effects.",
          "description":"Have a little fun and make unique effects for our invitations. You can click Shape Effects to give the border shadow or a glow. You can also make a box that is filled with something then create a white box within it. To explore the options for filling the box, select Shape Fill and play around with adding a gradient or texture. Remember, you can always click the \"Undo\" button if you dislike something you create. Feel free to experiment a little until you get the effect you want."
        },
        {
          "headline":"Add a title.",
          "description":"To make a stylized title, click Insert then WordArt then type your title: \u201cIt\u2019s a Boy!\u201d You can also insert a Text Box which will offer a cleaner text that you can still edit. Customize your WordArt or regular text by changing the font, font size, and font color under the Home tab. To create a text box, click the Insert tab on the top tool bar. Select \"Text Box.\" Click \"Draw Text Box\" and use your cursor to create a text box in your desired shape and size in your document. Use a variety of stylized texts to include all the important information. If you want to include the baby\u2019s name, you might want to do it in a different color or font than the main title. If you find some of your objects are being moved around by the placement of other objects, such as text, select the object then open the Format tab. Then click Wrap Text then \u201cIn Front of Text.\u201d"
        },
        {
          "headline":"Add an image.",
          "description":"Open the Insert tab, then click Clip Art, which will have a lot of stock image and cartoon options. If you want to insert a photograph, select Picture, then find the photo\u2019s location on your computer. Arrange your image and title as you see fit by dragging and dropping them into position. Experiment until you find a design you like."
        },
        {
          "headline":"Add your baby shower details.",
          "description":"Include all the essentials such as guests of honor, date, time, location, RSVP info, and gift registry information. This time, use a text box rather than WordArt so that it doesn\u2019t steal attention from the title. Make sure to double check the information you include for accuracy."
        },
        {
          "headline":"Group all of your images and text together.",
          "description":"When you have all the necessary information and images that you want, make sure everything is centered according to the border. Then, go to Home and Select in the far right side of the screen. You can click \u201cSelect Objects\u201d and draw a box around your invitation design, or you can choose \u201cSelect All\u201d if the images and texts are the only thing on the page. Once everything is selected, right-click on one part of it and choose Group. This will make everything one object that can be moved without changing the position of the different parts."
        },
        {
          "headline":"Copy and paste your design.",
          "description":"With your group design selected, hit Ctrl + C on a PC or Command + C on a Mac to copy it. Then hit Ctrl + V or Command + V to paste it. Move the copied design to the other, empty side of the page."
        },
        {
          "headline":"Save your template.",
          "description":"You can save your document as a document, or you can also save it as a template for later use. To do this, click on File then Save As. On the Format or \u201cSave as type\u201d pop-up menu, select Word Template. In the Save As or \u201cFile name\u201d box, type the name of your template: \u201cBaby Shower Invitation.\u201d Click Save."
        },
        {
          "headline":"Print and cut your invitations.",
          "description":"Print your invitations on cardstock, or thicker paper. Go for card stock paper between 80 and 110lb for the sturdiest invitations. Since you have two copies per sheet, you will need to cut your invitations in half. Use a paper cutter or bring them to a copy shop to do it for you."
        }
      ]
    },
    {
      "name":"Editing an Existing Template",
      "steps":[
        {
          "headline":"Open a template in Microsoft Word.",
          "description":"To open an existing template, click File then New. Here you will find folders with existing Microsoft Office templates. Select Announcements and find one that is for baby showers or could easily be made into a baby shower invitation. If you don\u2019t find a satisfactory template already on your computer, you can download new ones online. Go to the Microsoft website to browse the templates they have to download and find one that you like and matches your vision for a baby shower invitation."
        },
        {
          "headline":"Type your baby shower invitation wording.",
          "description":"Simply click the existing text boxes to enter them, delete the existing text, and type your own. Be sure to include the guest of honor, date, time, location, RSVP info, and gift registry information."
        },
        {
          "headline":"Change the font and color.",
          "description":"Highlight the text you\u2019d like to change. Then select the font, font size, and color you\u2019d like. These options are under the Home tab at the top of the screen. If you like the font or color, you can keep it as is. However, if you had a specific color or font in mind, feel free to alter the font to your liking."
        },
        {
          "headline":"Insert new pictures.",
          "description":"If there are images you don\u2019t want, select them and press \u201cDelete\u201d or right-click and choose delete. To insert new images open the Insert tab, then click Clip Art which will have a lot of stock image and cartoon options. If you want to insert a photograph, select Picture then find the photo\u2019s location on your computer. Once your picture is added, you can choose to center it at the top of the invitation, or place it anywhere you wish."
        },
        {
          "headline":"Change background colors or borders.",
          "description":"To change the color of the background, or a border, select the object, then open the Format tab. Change the \u201cShape Fill\u201d or \u201cShape Outline\u201d as you see fit."
        },
        {
          "headline":"Proofread and save your invitation.",
          "description":"Make sure everything is correct. Then save the invitation by using the \"Save as\" option, so you will have it for future use, if needed. It's a good idea to set your invitation aside for an hour and then proofread. This will help you catch errors better. You can also have someone else proofread for you."
        },
        {
          "headline":"Print the invitation on heavy cardstock.",
          "description":"Cardstock paper between 80lb and 110lb works best as it will make sturdy invitations. If your template only takes up half the page, you will need to cut your invitations in half."
        }
      ]
    }
  ],
  "text":" Making a Template from Scratch Open a new blank document in Microsoft Word. Open Word and open a new document with a blank 8.5 x 11 letter-size sheet (which is standard). This will be the canvas you work on to create your own design. Determine your invitation size and shape. For the easiest design, you can fit two half-sheet sized invitations per sheet. To do this, orient your page landscape, or sideways. At the top of the screen click Page Layout, then Orientation, and then select Landscape. Create a border. Click the Insert tab at the top of the screen. Then select the Shapes drop-down menu. Pick a shape to create a border, such as a rectangle, a rounded rectangle, or an oval. Click and drag to create an area about half the size of the page. You\u2019ll want to only use half the page so that later you can copy and paste your design to the other side, so you can print two copies per sheet. Keep the background readable. It is probably best to keep your background white, for readability. If your box is filled with color, select Shape Fill from the Format tab, or click the picture of a box with no filling inside. To change the color of the border line, click Shape Outline. If you don't want a white background, choose another light color like yellow so the invitations are easy to read. Get creative with the effects. Have a little fun and make unique effects for our invitations. You can click Shape Effects to give the border shadow or a glow. You can also make a box that is filled with something then create a white box within it. To explore the options for filling the box, select Shape Fill and play around with adding a gradient or texture. Remember, you can always click the \"Undo\" button if you dislike something you create. Feel free to experiment a little until you get the effect you want. Add a title. To make a stylized title, click Insert then WordArt then type your title: \u201cIt\u2019s a Boy!\u201d You can also insert a Text Box which will offer a cleaner text that you can still edit. Customize your WordArt or regular text by changing the font, font size, and font color under the Home tab. To create a text box, click the Insert tab on the top tool bar. Select \"Text Box.\" Click \"Draw Text Box\" and use your cursor to create a text box in your desired shape and size in your document. Use a variety of stylized texts to include all the important information. If you want to include the baby\u2019s name, you might want to do it in a different color or font than the main title. If you find some of your objects are being moved around by the placement of other objects, such as text, select the object then open the Format tab. Then click Wrap Text then \u201cIn Front of Text.\u201d Add an image. Open the Insert tab, then click Clip Art, which will have a lot of stock image and cartoon options. If you want to insert a photograph, select Picture, then find the photo\u2019s location on your computer. Arrange your image and title as you see fit by dragging and dropping them into position. Experiment until you find a design you like. Add your baby shower details. Include all the essentials such as guests of honor, date, time, location, RSVP info, and gift registry information. This time, use a text box rather than WordArt so that it doesn\u2019t steal attention from the title. Make sure to double check the information you include for accuracy. Group all of your images and text together. When you have all the necessary information and images that you want, make sure everything is centered according to the border. Then, go to Home and Select in the far right side of the screen. You can click \u201cSelect Objects\u201d and draw a box around your invitation design, or you can choose \u201cSelect All\u201d if the images and texts are the only thing on the page. Once everything is selected, right-click on one part of it and choose Group. This will make everything one object that can be moved without changing the position of the different parts. Copy and paste your design. With your group design selected, hit Ctrl + C on a PC or Command + C on a Mac to copy it. Then hit Ctrl + V or Command + V to paste it. Move the copied design to the other, empty side of the page. Save your template. You can save your document as a document, or you can also save it as a template for later use. To do this, click on File then Save As. On the Format or \u201cSave as type\u201d pop-up menu, select Word Template. In the Save As or \u201cFile name\u201d box, type the name of your template: \u201cBaby Shower Invitation.\u201d Click Save. Print and cut your invitations. Print your invitations on cardstock, or thicker paper. Go for card stock paper between 80 and 110lb for the sturdiest invitations. Since you have two copies per sheet, you will need to cut your invitations in half. Use a paper cutter or bring them to a copy shop to do it for you. Editing an Existing Template Open a template in Microsoft Word. To open an existing template, click File then New. Here you will find folders with existing Microsoft Office templates. Select Announcements and find one that is for baby showers or could easily be made into a baby shower invitation. If you don\u2019t find a satisfactory template already on your computer, you can download new ones online. Go to the Microsoft website to browse the templates they have to download and find one that you like and matches your vision for a baby shower invitation. Type your baby shower invitation wording. Simply click the existing text boxes to enter them, delete the existing text, and type your own. Be sure to include the guest of honor, date, time, location, RSVP info, and gift registry information. Change the font and color. Highlight the text you\u2019d like to change. Then select the font, font size, and color you\u2019d like. These options are under the Home tab at the top of the screen. If you like the font or color, you can keep it as is. However, if you had a specific color or font in mind, feel free to alter the font to your liking. Insert new pictures. If there are images you don\u2019t want, select them and press \u201cDelete\u201d or right-click and choose delete. To insert new images open the Insert tab, then click Clip Art which will have a lot of stock image and cartoon options. If you want to insert a photograph, select Picture then find the photo\u2019s location on your computer. Once your picture is added, you can choose to center it at the top of the invitation, or place it anywhere you wish. Change background colors or borders. To change the color of the background, or a border, select the object, then open the Format tab. Change the \u201cShape Fill\u201d or \u201cShape Outline\u201d as you see fit. Proofread and save your invitation. Make sure everything is correct. Then save the invitation by using the \"Save as\" option, so you will have it for future use, if needed. It's a good idea to set your invitation aside for an hour and then proofread. This will help you catch errors better. You can also have someone else proofread for you. Print the invitation on heavy cardstock. Cardstock paper between 80lb and 110lb works best as it will make sturdy invitations. If your template only takes up half the page, you will need to cut your invitations in half.",
  "tyn_model":[
    "microsoft word",
    "text box",
    "clip art",
    "\u201cselect",
    "\u201d or",
    "\u201cshape",
    "word",
    "\u201cit",
    "\u201d you",
    "wordart or",
    "\u201cin",
    "\u201d add",
    "\u201d and",
    "\u201d if",
    "\u201csave",
    "\u201d pop",
    "\u201cfile",
    "\u201d box",
    "\u201cbaby",
    "\u201d click",
    "card stock paper",
    "paper cutter",
    "microsoft office",
    "\u201cdelete",
    "photograph",
    "\u201d as",
    "cardstock paper"
  ],
  "tyn_section":[

  ]
}