{
  "title":"How to Make Royal Icing",
  "url":"https://www.wikihow.com/Make-Royal-Icing",
  "category_hierarchy":[
    "Food and Entertaining",
    "Recipes",
    "Baking"
  ],
  "methods":[
    {
      "name":"Mixing Royal Icing with Egg Whites",
      "steps":[
        {
          "headline":"Gather your ingredients.",
          "description":"Here's what you'll need to make about four cups of royal icing with egg whites:\n3 cups (375 g) of confectioners' sugar, plus extra\n2 egg whites\n1 teaspoon (5 mL) of lemon juice"
        },
        {
          "headline":"Sift the powdered sugar into a bowl.",
          "description":"Sifting is not necessary but will help keep your icing from getting lumpy."
        },
        {
          "headline":"Separate the egg whites into a separate bowl.",
          "description":"Crack an egg and then turn it crack-side up. As you gently open it, use half of the shell to catch the yolk. Allow white to drain by transferring yolk from one half of the shell to the other several times. Consider saving the yolk for homemade mayonnaise or Hollandaise sauce."
        },
        {
          "headline":"Combine lemon juice and egg whites and mix briefly with a wire whisk.",
          "description":"You don't have to whisk much or for long. Whisking for 20 seconds will help break up the egg whites and combine it with the lemon juice."
        },
        {
          "headline":"In a stand mixer, combine the lemon juice and egg white mixture with the sugar, adding the sugar a little at a time.",
          "description":"Start with 1 1/2 cups or 2 cups of sugar, and gradually add the rest while the mixer is on its medium setting. Mix until shiny and opaque, about 5 minutes. Hand mixers also do the trick just fine if you do not have a stand mixer. In a pinch, a little bit of old-fashioned hard work will work as well, although you'll be getting a considerable workout. For edible construction projects like gingerbread houses, a thicker, more peanut-buttery consistency will provide extra stability."
        },
        {
          "headline":"For icing to be used as piping, mix the royal icing until soft peaks begin forming.",
          "description":"Soft peaks are contoured without being firm; when you dip your whisk into the icing and turn it upside down, the peaks move back in on themselves. To make your own icing tube, simply put the icing in a Ziploc bag and snip off one of the bottom corners. Start by cutting off very little of the corner to keep your icing lines thinner and more manageable. You can always snip more away as you go."
        },
        {
          "headline":"Continue mixing and adding sugar, 2 teaspoons at a time, for firmer peaks.",
          "description":"If you want firm peaks for your icing, continue adding sugar a little bit at a time while the mixer is still beating. The additional sugar will create a stiffer icing."
        },
        {
          "headline":"Adjust as necessary with sugar, water, or egg whites.",
          "description":"You probably have a good idea of how you want your icing to turn out. However, sometimes, things don't happen according to plan. If you need to change the consistency of your icing \u2014 it's too stiff, for example \u2014 don't fret. Here's how you adjust the consistency of your icing:\nIf your icing is too runny, add more sugar. A little bit at a time works best. If your icing is too stiff, add more egg white. Again, a little goes a long way. If you want to runny icing, add water, a couple drops at a time, to the icing. Whisk the icing and wait for the peaks to break up. Since this process causes air-bubbles to form, rest runny icing for up to 30 minutes before using to allow time for the air bubbles to dissipate."
        },
        {
          "headline":"Use royal icing immediately or transfer to an airtight container.",
          "description":"Royal icing hardens very quickly if not properly stored. For storage instructions, see How to Store Royal icing."
        }
      ]
    },
    {
      "name":"Trying Royal Icing with Meringue Powder",
      "steps":[
        {
          "headline":"Gather your ingredients.",
          "description":"Here's what you'll need to make about 5 cups of royal icing with meringue powder:\n4 cups (500 g) of confectioners' sugar\n3 tablespoons (30 g) of meringue powder\n1/2 teaspoon (2.5 mL) of extract (vanilla, lemon, almond)\n\n\u20442 to \u20444 cup (120 to 180 mL) of warm water"
        },
        {
          "headline":"Check the label on your meringue powder.",
          "description":"Many meringue powder labels contain specific instructions on how to make royal icing using their product \u2014 with powders varying from one product to the next. Adjust the recipe keeping the manufacturer's suggestions on the label in mind."
        },
        {
          "headline":"In a stand- or electric mixer, beat the sugar and meringue powder on low until fully combined.",
          "description":""
        },
        {
          "headline":"Add warm water and beat on medium or high until icing becomes glossy and peaks begin to form.",
          "description":"This whole process takes anywhere from 5 to 7 minutes."
        },
        {
          "headline":"Adjust with more powdered sugar or water as needed.",
          "description":"When using royal icing as the glue with which to bind a gingerbread house, for example, you probably want stiffer peaks. In this case, add more sugar. When flooding a cookie, for example, you probably want a runnier icing. In this case, add more water. Icing is ready to be used in flooding a cookie when the icing runs off the surface of the beater tong when it's lifted from the mixer."
        },
        {
          "headline":"Use royal icing immediately or transfer to an airtight container.",
          "description":"Royal icing hardens quickly if not properly stored."
        },
        {
          "headline":"Finished.",
          "description":""
        }
      ]
    },
    {
      "name":"Making Royal Icing without Egg Whites",
      "steps":[
        {
          "headline":"Gather the ingredients.",
          "description":"You'll need:\n1 cup (125 g) of confectioners sugar\n2 teaspoons (10 mL) of water or non-dairy milk\n2 teaspoons (10 mL) of light corn syrup\n1/4 teaspoon (1.2 mL) of vanilla extract\nFood coloring (optional)"
        },
        {
          "headline":"Add the confectioners sugar to a medium mixing bowl.",
          "description":"Add the non-dairy milk or the water."
        },
        {
          "headline":"Stir the ingredients together until a smooth paste forms.",
          "description":""
        },
        {
          "headline":"Pour in the corn syrup and vanilla extract.",
          "description":"The icing will start to look glossy; it is now ready for use. If it seems too thick, add a little more corn syrup."
        },
        {
          "headline":"If adding food coloring, remove even amounts from the bowl.",
          "description":"Place the divided pieces in different bowls and add the food coloring according to the packaging instructions."
        },
        {
          "headline":"Use the royal icing straight away.",
          "description":"If not using it immediately, place under a clean, damp cloth to keep the moisture intact."
        }
      ]
    }
  ],
  "text":" Mixing Royal Icing with Egg Whites Gather your ingredients. Here's what you'll need to make about four cups of royal icing with egg whites:\n3 cups (375 g) of confectioners' sugar, plus extra\n2 egg whites\n1 teaspoon (5 mL) of lemon juice Sift the powdered sugar into a bowl. Sifting is not necessary but will help keep your icing from getting lumpy. Separate the egg whites into a separate bowl. Crack an egg and then turn it crack-side up. As you gently open it, use half of the shell to catch the yolk. Allow white to drain by transferring yolk from one half of the shell to the other several times. Consider saving the yolk for homemade mayonnaise or Hollandaise sauce. Combine lemon juice and egg whites and mix briefly with a wire whisk. You don't have to whisk much or for long. Whisking for 20 seconds will help break up the egg whites and combine it with the lemon juice. In a stand mixer, combine the lemon juice and egg white mixture with the sugar, adding the sugar a little at a time. Start with 1 1/2 cups or 2 cups of sugar, and gradually add the rest while the mixer is on its medium setting. Mix until shiny and opaque, about 5 minutes. Hand mixers also do the trick just fine if you do not have a stand mixer. In a pinch, a little bit of old-fashioned hard work will work as well, although you'll be getting a considerable workout. For edible construction projects like gingerbread houses, a thicker, more peanut-buttery consistency will provide extra stability. For icing to be used as piping, mix the royal icing until soft peaks begin forming. Soft peaks are contoured without being firm; when you dip your whisk into the icing and turn it upside down, the peaks move back in on themselves. To make your own icing tube, simply put the icing in a Ziploc bag and snip off one of the bottom corners. Start by cutting off very little of the corner to keep your icing lines thinner and more manageable. You can always snip more away as you go. Continue mixing and adding sugar, 2 teaspoons at a time, for firmer peaks. If you want firm peaks for your icing, continue adding sugar a little bit at a time while the mixer is still beating. The additional sugar will create a stiffer icing. Adjust as necessary with sugar, water, or egg whites. You probably have a good idea of how you want your icing to turn out. However, sometimes, things don't happen according to plan. If you need to change the consistency of your icing \u2014 it's too stiff, for example \u2014 don't fret. Here's how you adjust the consistency of your icing:\nIf your icing is too runny, add more sugar. A little bit at a time works best. If your icing is too stiff, add more egg white. Again, a little goes a long way. If you want to runny icing, add water, a couple drops at a time, to the icing. Whisk the icing and wait for the peaks to break up. Since this process causes air-bubbles to form, rest runny icing for up to 30 minutes before using to allow time for the air bubbles to dissipate. Use royal icing immediately or transfer to an airtight container. Royal icing hardens very quickly if not properly stored. For storage instructions, see How to Store Royal icing. Trying Royal Icing with Meringue Powder Gather your ingredients. Here's what you'll need to make about 5 cups of royal icing with meringue powder:\n4 cups (500 g) of confectioners' sugar\n3 tablespoons (30 g) of meringue powder\n1/2 teaspoon (2.5 mL) of extract (vanilla, lemon, almond)\n\n\u20442 to \u20444 cup (120 to 180 mL) of warm water Check the label on your meringue powder. Many meringue powder labels contain specific instructions on how to make royal icing using their product \u2014 with powders varying from one product to the next. Adjust the recipe keeping the manufacturer's suggestions on the label in mind. In a stand- or electric mixer, beat the sugar and meringue powder on low until fully combined.  Add warm water and beat on medium or high until icing becomes glossy and peaks begin to form. This whole process takes anywhere from 5 to 7 minutes. Adjust with more powdered sugar or water as needed. When using royal icing as the glue with which to bind a gingerbread house, for example, you probably want stiffer peaks. In this case, add more sugar. When flooding a cookie, for example, you probably want a runnier icing. In this case, add more water. Icing is ready to be used in flooding a cookie when the icing runs off the surface of the beater tong when it's lifted from the mixer. Use royal icing immediately or transfer to an airtight container. Royal icing hardens quickly if not properly stored. Finished.  Making Royal Icing without Egg Whites Gather the ingredients. You'll need:\n1 cup (125 g) of confectioners sugar\n2 teaspoons (10 mL) of water or non-dairy milk\n2 teaspoons (10 mL) of light corn syrup\n1/4 teaspoon (1.2 mL) of vanilla extract\nFood coloring (optional) Add the confectioners sugar to a medium mixing bowl. Add the non-dairy milk or the water. Stir the ingredients together until a smooth paste forms.  Pour in the corn syrup and vanilla extract. The icing will start to look glossy; it is now ready for use. If it seems too thick, add a little more corn syrup. If adding food coloring, remove even amounts from the bowl. Place the divided pieces in different bowls and add the food coloring according to the packaging instructions. Use the royal icing straight away. If not using it immediately, place under a clean, damp cloth to keep the moisture intact.",
  "tyn_model":[
    "royal icing",
    "sugar",
    "water",
    "meringue powder",
    "lemon juice",
    "bowl",
    "mixer",
    "icing",
    "food coloring",
    "egg whites",
    "confectioners' sugar",
    "powdered sugar",
    "stand mixer",
    "egg white",
    "airtight container",
    "confectioners sugar",
    "vanilla extract",
    "corn syrup",
    "mayonnaise or",
    "hollandaise sauce",
    "wire whisk",
    "mixers",
    "whisk",
    "ziploc bag",
    "\u2014 it",
    "\u2014 do",
    "meringue",
    "warm water",
    "\u2014 with",
    "stand- or electric mixer",
    "beater",
    "water or non-dairy milk",
    "light corn syrup",
    "medium mixing bowl",
    "milk"
  ],
  "tyn_section":[

  ]
}