{
  "title":"How to Have Fun While Cleaning Your Room",
  "url":"https://www.wikihow.com/Have-Fun-While-Cleaning-Your-Room",
  "category_hierarchy":[
    "Home and Garden",
    "Housekeeping",
    "Cleaning",
    "Cleaning Motivation"
  ],
  "methods":[
    {
      "name":"Playing a Game",
      "steps":[
        {
          "headline":"Make it a race.",
          "description":"Set a timer and see if you can get your room sparkly clean before it goes off. Try to beat your time from last week, or clean your room at the same time as your sibling. The two of you can race against each other to see who finishes first. Ready, set, clean! Make sure you\u2019re still cleaning your room well. Being speedy doesn\u2019t mean doing a half-hearted job."
        },
        {
          "headline":"Shoot hoops with laundry and trash.",
          "description":"Pick up all those candy wrappers and papers, and see if you can throw them into your trash can from across the room. You can shoot hoops with laundry into your laundry basket, too! Keep score of how many baskets you make. Try to beat your best score every time you clean. You\u2019ll be a pro laundry baller in no time."
        },
        {
          "headline":"Make up a story to turn cleaning into an adventure.",
          "description":"Get creative! Pretend you\u2019re a maid cleaning a dirty mansion or a pirate searching for buried treasure in \u201cislands\u201d of dirty clothes. You can be poor Cinderella cleaning her wicked stepmother\u2019s cobweb-filled chambers, or a spy on a mission to find a top secret document."
        },
        {
          "headline":"Roll the dice to pick a task.",
          "description":"Make a checklist of the different tasks you need to do, like making your bed, throwing out trash, and putting away your clothes. Number the items and roll a die. Then, do the task that matches the number on the die. Who knows what task you\u2019ll get next? For a checklist that has more than six items, roll a pair of die. If you get a number that you\u2019ve already done or one that\u2019s not on your list, roll again until you do."
        },
        {
          "headline":"Clean items one color at a time.",
          "description":"For some color coded fun, focus on picking up items of one color at a time. For example, start by picking up blue things, then white things, and then black things."
        },
        {
          "headline":"Skate over wooden floors to clean them.",
          "description":"Imagine that your hardwood floor is an ice rink and your cleaning rag is a pair of skates. Take off your shoes, and skate around the room on your rag to wipe your floor clean. Make sure you pick up all your toys and clothes off the floor before you start skating!"
        }
      ]
    },
    {
      "name":"Motivating Yourself",
      "steps":[
        {
          "headline":"Give yourself a reward when you finish cleaning your room.",
          "description":"Pick something good. It could be eating your favorite snack, reading a good book, or watching an episode of your favorite show in the glory of your freshly cleaned room."
        },
        {
          "headline":"Break up cleaning into smaller tasks and reward yourself for each one.",
          "description":"Different tasks might include making your bed, folding your clothes, picking up toys, and vacuuming your floor. Focus on conquering one task at a time, and give yourself a mini reward after each one. These mini rewards should be much smaller than your final reward. You might reward yourself with a short break, a few minutes on Instagram, or a cold glass of juice."
        },
        {
          "headline":"Check off tasks as you finish them.",
          "description":"Using colorful markers, crayons, and stickers, make a list of the different things you need to do to get your room squeaky clean. When you finish an item, check it off! It\u2019ll feel really good."
        },
        {
          "headline":"Take before and after photos.",
          "description":"Snap a photo before you clean your room, and then take another one after it\u2019s nice and tidy. Compare them. The difference might be crazy! You can even pretend you\u2019re on a home makeover show."
        }
      ]
    },
    {
      "name":"Distracting Yourself",
      "steps":[
        {
          "headline":"Call a friend while you clean.",
          "description":"Put them on speaker and chat away while you fold clothes or sweep. The time will go by much faster."
        },
        {
          "headline":"Put on your favorite show or movie.",
          "description":"Use your TV or computer, and let it play in the background while you clean. Make sure you don\u2019t get too distracted, though. If cleaning will only take about 30 minutes, pick a show episode. If it\u2019s going be a longer clean, you might opt for a movie."
        },
        {
          "headline":"Turn on some music.",
          "description":"A little music can turning a boring room cleaning session into a fun dance party. Pick songs that you can sing along to as you clean. Listening to an audiobook can be fun, too. EXPERT TIP\t\t\t\t\t\t\t\t\t\t\t\t\t\t\t\t\t\t\t\t\t\t\t\t\t\t\t\t\t\t\tAshley Moon, MA\t\t\t\t\t\t\t\t\t\t\t\t\t\t\t\tOrganizational Coach & Consultant, Creatively Neat\t\t\t\t\t\t\t\tAshley Moon is the Founder and CEO of Creatively Neat, a virtual organizing and life coaching business based in Los Angeles, California. In addition to helping people organize their best life, she has a fabulous team of organizers ready to de-clutter your home or business. Ashley hosts workshops and speaking engagements at various venues and festivals. She has trained with Coach Approach and Heart Core for organizing and business coaching respectively. She has an MA in Human Development and Social Change from Pacific Oaks College. Ashley Moon, MA\t\t\tOrganizational Coach & Consultant, Creatively Neat\t\t\t\tOur Expert Agrees: I like putting on my favorite playlist that has songs about letting go, living your best life, and not letting anything get in your way. It makes cleaning fun because the more senses you activate, the more engaging the activity is. Try turning on music, lighting a candle, and paying attention to the feel of each item you touch."
        },
        {
          "headline":"Make cleaning a workout.",
          "description":"Sprint around your room, picking up items as fast as you can. Do jumping jacks, sit-ups, or push-ups between tasks. You\u2019ll be so involved in your workout that you may not even notice you\u2019re cleaning!"
        }
      ]
    }
  ],
  "text":" Playing a Game Make it a race. Set a timer and see if you can get your room sparkly clean before it goes off. Try to beat your time from last week, or clean your room at the same time as your sibling. The two of you can race against each other to see who finishes first. Ready, set, clean! Make sure you\u2019re still cleaning your room well. Being speedy doesn\u2019t mean doing a half-hearted job. Shoot hoops with laundry and trash. Pick up all those candy wrappers and papers, and see if you can throw them into your trash can from across the room. You can shoot hoops with laundry into your laundry basket, too! Keep score of how many baskets you make. Try to beat your best score every time you clean. You\u2019ll be a pro laundry baller in no time. Make up a story to turn cleaning into an adventure. Get creative! Pretend you\u2019re a maid cleaning a dirty mansion or a pirate searching for buried treasure in \u201cislands\u201d of dirty clothes. You can be poor Cinderella cleaning her wicked stepmother\u2019s cobweb-filled chambers, or a spy on a mission to find a top secret document. Roll the dice to pick a task. Make a checklist of the different tasks you need to do, like making your bed, throwing out trash, and putting away your clothes. Number the items and roll a die. Then, do the task that matches the number on the die. Who knows what task you\u2019ll get next? For a checklist that has more than six items, roll a pair of die. If you get a number that you\u2019ve already done or one that\u2019s not on your list, roll again until you do. Clean items one color at a time. For some color coded fun, focus on picking up items of one color at a time. For example, start by picking up blue things, then white things, and then black things. Skate over wooden floors to clean them. Imagine that your hardwood floor is an ice rink and your cleaning rag is a pair of skates. Take off your shoes, and skate around the room on your rag to wipe your floor clean. Make sure you pick up all your toys and clothes off the floor before you start skating! Motivating Yourself Give yourself a reward when you finish cleaning your room. Pick something good. It could be eating your favorite snack, reading a good book, or watching an episode of your favorite show in the glory of your freshly cleaned room. Break up cleaning into smaller tasks and reward yourself for each one. Different tasks might include making your bed, folding your clothes, picking up toys, and vacuuming your floor. Focus on conquering one task at a time, and give yourself a mini reward after each one. These mini rewards should be much smaller than your final reward. You might reward yourself with a short break, a few minutes on Instagram, or a cold glass of juice. Check off tasks as you finish them. Using colorful markers, crayons, and stickers, make a list of the different things you need to do to get your room squeaky clean. When you finish an item, check it off! It\u2019ll feel really good. Take before and after photos. Snap a photo before you clean your room, and then take another one after it\u2019s nice and tidy. Compare them. The difference might be crazy! You can even pretend you\u2019re on a home makeover show. Distracting Yourself Call a friend while you clean. Put them on speaker and chat away while you fold clothes or sweep. The time will go by much faster. Put on your favorite show or movie. Use your TV or computer, and let it play in the background while you clean. Make sure you don\u2019t get too distracted, though. If cleaning will only take about 30 minutes, pick a show episode. If it\u2019s going be a longer clean, you might opt for a movie. Turn on some music. A little music can turning a boring room cleaning session into a fun dance party. Pick songs that you can sing along to as you clean. Listening to an audiobook can be fun, too. EXPERT TIP\t\t\t\t\t\t\t\t\t\t\t\t\t\t\t\t\t\t\t\t\t\t\t\t\t\t\t\t\t\t\tAshley Moon, MA\t\t\t\t\t\t\t\t\t\t\t\t\t\t\t\tOrganizational Coach & Consultant, Creatively Neat\t\t\t\t\t\t\t\tAshley Moon is the Founder and CEO of Creatively Neat, a virtual organizing and life coaching business based in Los Angeles, California. In addition to helping people organize their best life, she has a fabulous team of organizers ready to de-clutter your home or business. Ashley hosts workshops and speaking engagements at various venues and festivals. She has trained with Coach Approach and Heart Core for organizing and business coaching respectively. She has an MA in Human Development and Social Change from Pacific Oaks College. Ashley Moon, MA\t\t\tOrganizational Coach & Consultant, Creatively Neat\t\t\t\tOur Expert Agrees: I like putting on my favorite playlist that has songs about letting go, living your best life, and not letting anything get in your way. It makes cleaning fun because the more senses you activate, the more engaging the activity is. Try turning on music, lighting a candle, and paying attention to the feel of each item you touch. Make cleaning a workout. Sprint around your room, picking up items as fast as you can. Do jumping jacks, sit-ups, or push-ups between tasks. You\u2019ll be so involved in your workout that you may not even notice you\u2019re cleaning!",
  "tyn_model":[
    "die",
    "laundry",
    "\u201cislands",
    "\u201d of",
    "dice",
    "ice rink",
    "markers",
    "crayons",
    "stickers",
    "tv",
    "organizational coach",
    "creatively neat,",
    "organizers",
    "heart core"
  ],
  "tyn_section":[

  ]
}