{
  "title":"How to Kill a Venomous Spider",
  "url":"https://www.wikihow.com/Kill-a-Venomous-Spider",
  "category_hierarchy":[
    "Home and Garden",
    "Housekeeping",
    "Pest Control",
    "Spider Control"
  ],
  "methods":[
    {
      "name":"Identifying Dangerous Spiders",
      "steps":[
        {
          "headline":"Spot Black Widows by their red hourglass mark.",
          "description":"If you see a black spider in or near your home that has a bright red hourglass marking on its abdomen, you\u2019ve spotted a Black Widow spider. These are extremely dangerous and are potentially fatally venomous. Be extra careful around the outside of your home if you live in a temperate climate and have woodpiles; Black Widows are most frequently found there."
        },
        {
          "headline":"Look out for Brown Recluses\u2019 violin-like mark.",
          "description":"If you see a long-legged brown spider that has a violin shape on its head, then you\u2019ve most likely come across a Brown Recluse spider. These are very dangerous spiders who have an extremely venomous bite. Brown Recluses like to lurk in dimly lit areas such as clothing, so be wary when you\u2019re putting on old socks or shoes."
        },
        {
          "headline":"Identify Mouse spiders by their large size.",
          "description":"Mouse spiders can get up to 1-1 \u00bd inches in length. You might be dealing with a female if you notice big fangs and a big, stocky build and you might be dealing with a male if you notice a slimmer version with a bright red head. They are venomous and have an especially painful bite."
        },
        {
          "headline":"Look for a union jack impression on a Wolf spider\u2019s back.",
          "description":"Wolf spiders have what looks similar to a map of the United Kingdom on their back, except brown or grey in color. Although they aren\u2019t as aggressive as other dangerous spiders, their bites are still venomous. Don\u2019t squish this type of spider because the females carry their young on their backs. Keep an eye out for Wolf spiders in your garden."
        },
        {
          "headline":"Identify Black House spiders by their velvet-like texture.",
          "description":"Black House spiders are usually either a dark brown or black color, appear velvety, and like dry, secluded areas. Be cautious around windowsills and in sheds, because they\u2019re often found there. Their venomous bites can make you nauseous and give you a headache."
        },
        {
          "headline":"Spot Hobo spiders by their chevron pattern.",
          "description":"If you see a chevron-patterned spider in your basement, it might be a Hobo spider. The females are a little rounder and the males have two palpi that look like boxing gloves. These spiders have initially painless bites, but make sure to take action quickly if you think you\u2019ve been bitten by one. A day after the bite, your skin may blister and you may get a bad headache."
        }
      ]
    },
    {
      "name":"Killing Spiders",
      "steps":[
        {
          "headline":"Spray the spider or dust the area with an insecticide.",
          "description":"Buy an insecticide dust or spray that\u2019s specifically for killing spiders. You can spray an aerosol insecticide directly on a spider to successfully kill it. If the spider you\u2019re trying to kill is especially agile, you may want to apply an insecticide dust to the entire room. EXPERT TIP\t\"I recommend using a residual pesticide to ensure spiders don't return to an area, since sprays are limited to killing spiders on contact.\" Hussam Bin Break\t\t\t\t\tPest Control Specialist, Diagno Pest Control\t\t\t\t\t\t\t\tHussam Bin Break is a Certified Commercial Pesticide Applicator and Operations Manager at Diagno Pest Control. Hussam and his brother own and operate Diagno Pest Control in the Greater Philadelphia Area. Hussam Bin BreakPest Control Specialist, Diagno Pest Control"
        },
        {
          "headline":"Vacuum the spider up.",
          "description":"Get out your vacuum cleaner and suck the spider up with it. This is a better method to go with if your vacuum has a bag that you can easily remove and throw away. Don\u2019t reach your hand in the debris if you use a bagless vacuum in case the spider is still alive."
        },
        {
          "headline":"Squish the spider with a heavy object.",
          "description":"Use your shoe or a rolled-up magazine or newspaper to squish the spider. To ensure that the impact kills the spider, have confidence and use force."
        },
        {
          "headline":"Dispose of the spider immediately.",
          "description":"Once you\u2019ve killed the spider, double check to make sure that it\u2019s dead, and then use a paper towel to carefully pick it up and throw it in your trash can or drop it into your toilet and flush it. Pets and young children often attempt to eat anything and everything. Even if the venomous spider is dead, it still may have poisonous venom that could be extremely harmful if ingested."
        }
      ]
    },
    {
      "name":"Keeping Spiders Away",
      "steps":[
        {
          "headline":"Keep your home clean.",
          "description":"Vacuum on a regular basis to suck up and kill any spiders or egg sacs in your home. Pay special attention to the cracks and corners in your home and remove any spiderwebs that you notice. Make sure to keep your storage in the basement, garage or attic well organized and clutter-free."
        },
        {
          "headline":"Take care of your home\u2019s exterior.",
          "description":"Regularly wipe down your shutters, caulk all cracks, and put weather strips on your doors. Make sure to de-clutter piles of rocks, wood, or compost around your home so that your yard is a less appealing environment to spiders."
        },
        {
          "headline":"Make spider repellents.",
          "description":"Dissolve regular table salt in warm water, put the solution in a spray bottle, and spray the plants surrounding the outside of your home to keep spiders away. You can also mix water with lavender, cinnamon, citrus, tea tree, or peppermint oil and spray it in problem areas to repel and even kill spiders."
        },
        {
          "headline":"Keep your outdoor lights off.",
          "description":"Bugs will be less drawn to your home if you keep the exterior lights off. Because of this, you can cut spiders\u2019 food supply with just the flick of a switch. Replace your lights with sodium vapor lights or yellow lights as an alternative. These types of lights are much less attractive to bugs."
        }
      ]
    }
  ],
  "text":" Identifying Dangerous Spiders Spot Black Widows by their red hourglass mark. If you see a black spider in or near your home that has a bright red hourglass marking on its abdomen, you\u2019ve spotted a Black Widow spider. These are extremely dangerous and are potentially fatally venomous. Be extra careful around the outside of your home if you live in a temperate climate and have woodpiles; Black Widows are most frequently found there. Look out for Brown Recluses\u2019 violin-like mark. If you see a long-legged brown spider that has a violin shape on its head, then you\u2019ve most likely come across a Brown Recluse spider. These are very dangerous spiders who have an extremely venomous bite. Brown Recluses like to lurk in dimly lit areas such as clothing, so be wary when you\u2019re putting on old socks or shoes. Identify Mouse spiders by their large size. Mouse spiders can get up to 1-1 \u00bd inches in length. You might be dealing with a female if you notice big fangs and a big, stocky build and you might be dealing with a male if you notice a slimmer version with a bright red head. They are venomous and have an especially painful bite. Look for a union jack impression on a Wolf spider\u2019s back. Wolf spiders have what looks similar to a map of the United Kingdom on their back, except brown or grey in color. Although they aren\u2019t as aggressive as other dangerous spiders, their bites are still venomous. Don\u2019t squish this type of spider because the females carry their young on their backs. Keep an eye out for Wolf spiders in your garden. Identify Black House spiders by their velvet-like texture. Black House spiders are usually either a dark brown or black color, appear velvety, and like dry, secluded areas. Be cautious around windowsills and in sheds, because they\u2019re often found there. Their venomous bites can make you nauseous and give you a headache. Spot Hobo spiders by their chevron pattern. If you see a chevron-patterned spider in your basement, it might be a Hobo spider. The females are a little rounder and the males have two palpi that look like boxing gloves. These spiders have initially painless bites, but make sure to take action quickly if you think you\u2019ve been bitten by one. A day after the bite, your skin may blister and you may get a bad headache. Killing Spiders Spray the spider or dust the area with an insecticide. Buy an insecticide dust or spray that\u2019s specifically for killing spiders. You can spray an aerosol insecticide directly on a spider to successfully kill it. If the spider you\u2019re trying to kill is especially agile, you may want to apply an insecticide dust to the entire room. EXPERT TIP\t\"I recommend using a residual pesticide to ensure spiders don't return to an area, since sprays are limited to killing spiders on contact.\" Hussam Bin Break\t\t\t\t\tPest Control Specialist, Diagno Pest Control\t\t\t\t\t\t\t\tHussam Bin Break is a Certified Commercial Pesticide Applicator and Operations Manager at Diagno Pest Control. Hussam and his brother own and operate Diagno Pest Control in the Greater Philadelphia Area. Hussam Bin BreakPest Control Specialist, Diagno Pest Control Vacuum the spider up. Get out your vacuum cleaner and suck the spider up with it. This is a better method to go with if your vacuum has a bag that you can easily remove and throw away. Don\u2019t reach your hand in the debris if you use a bagless vacuum in case the spider is still alive. Squish the spider with a heavy object. Use your shoe or a rolled-up magazine or newspaper to squish the spider. To ensure that the impact kills the spider, have confidence and use force. Dispose of the spider immediately. Once you\u2019ve killed the spider, double check to make sure that it\u2019s dead, and then use a paper towel to carefully pick it up and throw it in your trash can or drop it into your toilet and flush it. Pets and young children often attempt to eat anything and everything. Even if the venomous spider is dead, it still may have poisonous venom that could be extremely harmful if ingested. Keeping Spiders Away Keep your home clean. Vacuum on a regular basis to suck up and kill any spiders or egg sacs in your home. Pay special attention to the cracks and corners in your home and remove any spiderwebs that you notice. Make sure to keep your storage in the basement, garage or attic well organized and clutter-free. Take care of your home\u2019s exterior. Regularly wipe down your shutters, caulk all cracks, and put weather strips on your doors. Make sure to de-clutter piles of rocks, wood, or compost around your home so that your yard is a less appealing environment to spiders. Make spider repellents. Dissolve regular table salt in warm water, put the solution in a spray bottle, and spray the plants surrounding the outside of your home to keep spiders away. You can also mix water with lavender, cinnamon, citrus, tea tree, or peppermint oil and spray it in problem areas to repel and even kill spiders. Keep your outdoor lights off. Bugs will be less drawn to your home if you keep the exterior lights off. Because of this, you can cut spiders\u2019 food supply with just the flick of a switch. Replace your lights with sodium vapor lights or yellow lights as an alternative. These types of lights are much less attractive to bugs.",
  "tyn_model":[
    "spiders",
    "spider",
    "vacuum",
    "insecticide",
    "insecticide dust",
    "water",
    "black widow",
    "\u2019 violin",
    "brown recluse spider",
    "brown recluses",
    "wolf spider",
    "wolf spiders",
    "black house spiders",
    "pesticide",
    "diagno pest control",
    "vacuum cleaner",
    "newspaper",
    "paper towel",
    "table salt",
    "spray bottle",
    "tea tree,",
    "\u2019 food",
    "sodium vapor lights"
  ],
  "tyn_section":[

  ]
}