{
  "title":"How to Pickle Onions",
  "url":"https://www.wikihow.com/Pickle-Onions",
  "category_hierarchy":[
    "Food and Entertaining",
    "Recipes",
    "Jams Preserves and Condiments",
    "Pickles"
  ],
  "methods":[
    {
      "name":"Preparing the Onions",
      "steps":[
        {
          "headline":"Halve, peel, and slice the onion.",
          "description":"Red onions go great for this recipe; with their distinctive taste and deep red color, they actually turn pink after a couple days in the refrigerator. You can slice the onions to the thickness you prefer \u2014 however thick, they'll still take the pickling solution. Some people prefer to cut the onions in a full moon, which makes them easy to grab with a fork; others prefer them smaller, cut them into half moons."
        },
        {
          "headline":"Heat some water over the stove or in a kettle.",
          "description":"Heat enough water to completely submerge the sliced onion."
        },
        {
          "headline":"While the water begins to boil, toast the spices in a small pot.",
          "description":"Throw the cloves, cinnamon, chili, and thyme into a pot and toast them over medium-low heat until they become aromatic, about 3 - 5 minutes."
        },
        {
          "headline":"When the water is just about to boil, remove it from the heat and add the onions to the water.",
          "description":"Count to 10, and then strain the water and onions through a sieve. Why parboil the onions? Parboiling removes a little bit of the acid zing from raw onions. You don't have to parboil if you like the zing of raw onions, but a slightly mellower onion makes the pickling juice really stand out."
        },
        {
          "headline":"Transfer the onions from the sieve to the ice bath to stop them from cooking.",
          "description":"You can let the onions rest there or remove them after 10 seconds. Onions which are left in the ice bath will continue to mellow while the sulfur compounds (the onion's natural defense) diffuse into the water. Once onions are done, drain them completely and place them into a container."
        },
        {
          "headline":"Add the vinegar, lime juice, and 1/4 cup of sugar to the toasted spices.",
          "description":"Turn on the burner to medium high and bring the pickling juice to a simmer, dissolving the sugar completely. Simmer for an additional minute."
        },
        {
          "headline":"Remove the pickling juice from heat and pour into container with onions.",
          "description":"Seal the container and place into refrigerator. The pickled onions will be ready to try in as little as one hour, but are best after at least one day. Store pickled onions in the refrigerator for up to 2 weeks. Red onions which are pickled will turn slightly pink as they age."
        },
        {
          "headline":"Enjoy.",
          "description":"Try your pickles on homemade tacos, sandwiches with richer cuts of meat (like pork), or a hearty stew."
        }
      ]
    },
    {
      "name":"Additional Considerations",
      "steps":[
        {
          "headline":"Choose different spices for your pickling juice.",
          "description":"The above spices are just one combination that works well together. There are lots of spices that work well in a pickling liquid for onions. Here are just a few:\nFresh whole garlic. A little goes a long way, but who doesn't like the combination of garlic and onion? Simply divine. Fresh ginger. Cuts through the acidity with its distinctive taste. Bay leaf. Dried bay leaf has a smoky, fresh complexity. Fresh herbs. Experiment with rosemary, oregano, marjoram, or tarragon, among many others. Juniper berries. Fruity, spicy, complex. These berries give gin their distinctive taste. Star anise. Great substitute for or addition to cloves. Mustard seed. This seed adds a bit of smoky tang to the onions."
        },
        {
          "headline":"Pickle beets along with your onions to give them a distinctive pink color.",
          "description":"If you've only got yellow or white onions, but still want that distinctive pink color in your onions, beets are your friend. They've got a natural red dye that's close to flavorless. And did we mention they taste excellent, too?"
        },
        {
          "headline":"Pickle your onions whole for a traditional English variety of the recipe.",
          "description":"The traditional English approach to pickled onions is to use smaller yellow onions, or shallots, and then keep them whole. Malt vinegar is generally used instead of apple cider or sherry vinegar. Give it a go for a different culinary experience."
        }
      ]
    }
  ],
  "text":" Preparing the Onions Halve, peel, and slice the onion. Red onions go great for this recipe; with their distinctive taste and deep red color, they actually turn pink after a couple days in the refrigerator. You can slice the onions to the thickness you prefer \u2014 however thick, they'll still take the pickling solution. Some people prefer to cut the onions in a full moon, which makes them easy to grab with a fork; others prefer them smaller, cut them into half moons. Heat some water over the stove or in a kettle. Heat enough water to completely submerge the sliced onion. While the water begins to boil, toast the spices in a small pot. Throw the cloves, cinnamon, chili, and thyme into a pot and toast them over medium-low heat until they become aromatic, about 3 - 5 minutes. When the water is just about to boil, remove it from the heat and add the onions to the water. Count to 10, and then strain the water and onions through a sieve. Why parboil the onions? Parboiling removes a little bit of the acid zing from raw onions. You don't have to parboil if you like the zing of raw onions, but a slightly mellower onion makes the pickling juice really stand out. Transfer the onions from the sieve to the ice bath to stop them from cooking. You can let the onions rest there or remove them after 10 seconds. Onions which are left in the ice bath will continue to mellow while the sulfur compounds (the onion's natural defense) diffuse into the water. Once onions are done, drain them completely and place them into a container. Add the vinegar, lime juice, and 1/4 cup of sugar to the toasted spices. Turn on the burner to medium high and bring the pickling juice to a simmer, dissolving the sugar completely. Simmer for an additional minute. Remove the pickling juice from heat and pour into container with onions. Seal the container and place into refrigerator. The pickled onions will be ready to try in as little as one hour, but are best after at least one day. Store pickled onions in the refrigerator for up to 2 weeks. Red onions which are pickled will turn slightly pink as they age. Enjoy. Try your pickles on homemade tacos, sandwiches with richer cuts of meat (like pork), or a hearty stew. Additional Considerations Choose different spices for your pickling juice. The above spices are just one combination that works well together. There are lots of spices that work well in a pickling liquid for onions. Here are just a few:\nFresh whole garlic. A little goes a long way, but who doesn't like the combination of garlic and onion? Simply divine. Fresh ginger. Cuts through the acidity with its distinctive taste. Bay leaf. Dried bay leaf has a smoky, fresh complexity. Fresh herbs. Experiment with rosemary, oregano, marjoram, or tarragon, among many others. Juniper berries. Fruity, spicy, complex. These berries give gin their distinctive taste. Star anise. Great substitute for or addition to cloves. Mustard seed. This seed adds a bit of smoky tang to the onions. Pickle beets along with your onions to give them a distinctive pink color. If you've only got yellow or white onions, but still want that distinctive pink color in your onions, beets are your friend. They've got a natural red dye that's close to flavorless. And did we mention they taste excellent, too? Pickle your onions whole for a traditional English variety of the recipe. The traditional English approach to pickled onions is to use smaller yellow onions, or shallots, and then keep them whole. Malt vinegar is generally used instead of apple cider or sherry vinegar. Give it a go for a different culinary experience.",
  "tyn_model":[
    "onions",
    "water",
    "onion",
    "pickled onions",
    "sieve",
    "ice bath",
    "container",
    "sugar",
    "pickling juice",
    "spices",
    "garlic",
    "beets",
    "\u2014 however",
    "fork",
    "small pot",
    "cinnamon",
    "chili",
    "thyme",
    "pot",
    "sulfur",
    "vinegar",
    "lime juice",
    "toasted spices",
    "burner",
    "refrigerator",
    "pickles",
    "pickling liquid",
    "ginger",
    "bay leaf",
    "herbs",
    "rosemary",
    "oregano",
    "marjoram",
    "tarragon",
    "juniper berries",
    "star anise",
    "cloves",
    "mustard",
    "malt vinegar",
    "apple cider or",
    "sherry vinegar"
  ],
  "tyn_section":[

  ]
}