{
  "title":"How to Make Thin Mints",
  "url":"https://www.wikihow.com/Make-Thin-Mints",
  "category_hierarchy":[
    "Food and Entertaining",
    "Recipes",
    "Baking",
    "Cookies and Biscuits",
    "Chocolate Cookies and Biscuits"
  ],
  "methods":[
    {
      "name":"Making Thin Mints",
      "steps":[
        {
          "headline":"Bring a double boiler to a simmer.",
          "description":"Fill a saucepan about \u00bc or \u2153 full with water. Bring to a simmer. Place a second pan or a glass bowl on top of the saucepan, making sure it is stable and does not touch the water."
        },
        {
          "headline":"Melt the chocolate and peppermint oil.",
          "description":"Pour the chocolate chips into the bowl. Heat until melted, stirring occasionally. Stir in peppermint oil to taste, typically about \u00bc tsp (1.25mL). Remove from heat. You can use any type of chocolate, but larger chunks may require special tempering. Alternatively, replace both ingredients with mint-flavored chocolate chips, \"bits,\" or \"melts.\" You can replace the oil with 1 tsp (5mL) peppermint extract, but this tends to have a weaker flavor."
        },
        {
          "headline":"Choose your cookies or crackers.",
          "description":"You can bake your own thin, crisp chocolate cookies, using the recipe below. For a quicker thin mint, just use one of these storebought options:\nGraham crackers (chocolate graham crackers match the color of thin mints)\nUnsalted snack crackers (Ritz crackers)\nChocolate sandwich cookies (Oreos) with the filling removed"
        },
        {
          "headline":"Dip the cookies into the melted chocolate.",
          "description":"Ideally, use a pair of kitchen tongs to avoid breaking the cookies. Gently dip the cookie or cracker into the melted chocolate, submerge it, and pull it out again. If you don't have any tongs, you can spoon the chocolate directly onto the cookies."
        },
        {
          "headline":"Let cool until hard.",
          "description":"Transfer the cookies onto a wire rack, with wax paper or foil underneath to catch the drips. Let cool for about four hours in the refrigerator, until the chocolate coating hardens."
        }
      ]
    },
    {
      "name":"Making Thin Mints from Scratch",
      "steps":[
        {
          "headline":"Preheat your oven.",
          "description":"Set it to 350\u00baF (175\u00baC)."
        },
        {
          "headline":"Mix the butter and sugar.",
          "description":"Cream the butter, adding sugar slowly. Combine until uniform and lighter in color."
        },
        {
          "headline":"Mix in remaining cookie ingredients.",
          "description":"Add the flour in two or three increments, mixing in each one until well combined. Thoroughly mix in baking soda, salt, cocoa powder, and vanilla extract."
        },
        {
          "headline":"Knead and chill.",
          "description":"Knead the dough until it sticks together. Chill for 15 minutes."
        },
        {
          "headline":"Form the cookies.",
          "description":"Roll out the dough to about \u00bc in (0.6cm) thickness. Cut out cookies using cookie cutters in any shape."
        },
        {
          "headline":"Bake the cookies.",
          "description":"Transfer to a parchment-paper lined baking sheet. Bake until fragrant and just beginning to crack on the surface. This can take anywhere from 8 to 15 minutes, depending on how large the cookies are. Check on them regularly."
        },
        {
          "headline":"Let cool.",
          "description":"Let them cool completely on a wire rack or parchment paper. This takes about 5\u201310 minutes."
        },
        {
          "headline":"Melt the chocolate chips and peppermint oil.",
          "description":"You can melt the chocolate chips in a microwave, but they may burn or separate. For best results, melt over a double boiler. Stir in the peppermint oil."
        },
        {
          "headline":"Pour or spread the chocolate onto the cooled cookies.",
          "description":"You can use a pastry brush or the bottom of a spoon to help spread it evenly. Alternatively, dip the cookies into the chocolate. Let cool completely on a wire rack, with something to catch the dripping chocolate."
        }
      ]
    }
  ],
  "text":" Making Thin Mints Bring a double boiler to a simmer. Fill a saucepan about \u00bc or \u2153 full with water. Bring to a simmer. Place a second pan or a glass bowl on top of the saucepan, making sure it is stable and does not touch the water. Melt the chocolate and peppermint oil. Pour the chocolate chips into the bowl. Heat until melted, stirring occasionally. Stir in peppermint oil to taste, typically about \u00bc tsp (1.25mL). Remove from heat. You can use any type of chocolate, but larger chunks may require special tempering. Alternatively, replace both ingredients with mint-flavored chocolate chips, \"bits,\" or \"melts.\" You can replace the oil with 1 tsp (5mL) peppermint extract, but this tends to have a weaker flavor. Choose your cookies or crackers. You can bake your own thin, crisp chocolate cookies, using the recipe below. For a quicker thin mint, just use one of these storebought options:\nGraham crackers (chocolate graham crackers match the color of thin mints)\nUnsalted snack crackers (Ritz crackers)\nChocolate sandwich cookies (Oreos) with the filling removed Dip the cookies into the melted chocolate. Ideally, use a pair of kitchen tongs to avoid breaking the cookies. Gently dip the cookie or cracker into the melted chocolate, submerge it, and pull it out again. If you don't have any tongs, you can spoon the chocolate directly onto the cookies. Let cool until hard. Transfer the cookies onto a wire rack, with wax paper or foil underneath to catch the drips. Let cool for about four hours in the refrigerator, until the chocolate coating hardens. Making Thin Mints from Scratch Preheat your oven. Set it to 350\u00baF (175\u00baC). Mix the butter and sugar. Cream the butter, adding sugar slowly. Combine until uniform and lighter in color. Mix in remaining cookie ingredients. Add the flour in two or three increments, mixing in each one until well combined. Thoroughly mix in baking soda, salt, cocoa powder, and vanilla extract. Knead and chill. Knead the dough until it sticks together. Chill for 15 minutes. Form the cookies. Roll out the dough to about \u00bc in (0.6cm) thickness. Cut out cookies using cookie cutters in any shape. Bake the cookies. Transfer to a parchment-paper lined baking sheet. Bake until fragrant and just beginning to crack on the surface. This can take anywhere from 8 to 15 minutes, depending on how large the cookies are. Check on them regularly. Let cool. Let them cool completely on a wire rack or parchment paper. This takes about 5\u201310 minutes. Melt the chocolate chips and peppermint oil. You can melt the chocolate chips in a microwave, but they may burn or separate. For best results, melt over a double boiler. Stir in the peppermint oil. Pour or spread the chocolate onto the cooled cookies. You can use a pastry brush or the bottom of a spoon to help spread it evenly. Alternatively, dip the cookies into the chocolate. Let cool completely on a wire rack, with something to catch the dripping chocolate.",
  "tyn_model":[
    "chocolate",
    "peppermint oil",
    "chocolate chips",
    "wire rack",
    "thin mints",
    "double boiler",
    "saucepan",
    "water",
    "graham crackers",
    "butter",
    "sugar",
    "\u2153 full",
    "glass bowl",
    "bowl",
    "oil",
    "peppermint extract",
    "cookies",
    "crackers",
    "chocolate cookies",
    "snack crackers",
    "ritz crackers",
    "chocolate sandwich cookies",
    "kitchen tongs",
    "cracker",
    "wax paper",
    "refrigerator",
    "oven",
    "flour",
    "baking soda",
    "salt",
    "cocoa powder",
    "vanilla extract",
    "cookie cutters",
    "parchment-paper lined baking sheet",
    "parchment paper",
    "microwave",
    "pastry brush",
    "spoon"
  ],
  "tyn_section":[

  ]
}