{
  "title":"How to Draw Monster High",
  "url":"https://www.wikihow.com/Draw-Monster-High",
  "category_hierarchy":[
    "Hobbies and Crafts",
    "Drawing",
    "Drawing Objects"
  ],
  "methods":[
    {
      "name":"Draculaura",
      "steps":[
        {
          "headline":"Draw a big circle to outline her upper skull.",
          "description":""
        },
        {
          "headline":"Add guidelines for the face.",
          "description":"Draw a vertical line in the middle of the head to align the center of her face. You can draw on a different angle for her pose. Add two L-shaped lines for her jaw guide."
        },
        {
          "headline":"Complete the jaw.",
          "description":"Draw 2 short parallel lines for her cheeks."
        },
        {
          "headline":"Add body, hair and ears.",
          "description":"Because Draculaura\u2019s ears aren\u2019t round, draw a pointed rectangle instead of a round line for her ears. For her hair, draw 2 big S-shaped curvy lines. This would be your guide for her pony tails. For her body draw a rounded trapezoid with a rectangular trapezoid connected to the top."
        },
        {
          "headline":"Add limbs and legs.",
          "description":"For the limbs and legs, just draw some lines. It all comes to the artist\u2019s preference."
        },
        {
          "headline":"Add hands.",
          "description":"For the hands, just draw rounded ovals. If you want to show some fingers, draw simple lines for your guide."
        },
        {
          "headline":"Draw the face and some clothing details.",
          "description":"On the center of the face,  draw her small nose and exaggeratingly large lips. Make sure to make the lower lip big and the upper lip thin. Add two semi-circles for her eyes. Make the eyes skew a little from the center. Add a long dangling oval from her ear. To giver her more figure, add an oval around her chest. Draculaura usually wears a skirt with the frills on the bottom end, so add a long hexagon to guide you for her skirt."
        },
        {
          "headline":"Draw the face and some clothing details.",
          "description":"Add cuffs using trapezoids that open towards her hands. You can use a simple rectangle for her boots. Add two circles inside her eyes for her iris. Add a big semi-circle for her bangs. For her neck just draw a rectangle to connect the body to her head. She usually wears a V-neck blouse so add a big V on her chest, just above the oval. By now, you should have her basic skeleton."
        },
        {
          "headline":"Using a pen, draw on top of your sketch.",
          "description":"Put in mind the overlapping lines and parts that should be hidden. For her limbs and legs, just add some width from the bone. It doesn\u2019t matter if your legs look weird. The drawing style for Monster High defies logic and proportional rules. Don\u2019t forget to add her mouth, eyelashes and some clothing and jewelry details. She also has her signature heart on her left cheek. The lineart might not look perfect and crisp but it should look neat when the pencil is erased."
        },
        {
          "headline":"Erase the pencil sketch and add details.",
          "description":"You can add details like the buttons, her eye lens, stitch lines. In this stage, add her hair extensions as well. Try to add more if needed. Don\u2019t be afraid to add more lines than what is necessary. You can add lots of trinkets on her clothes. Try adding some flowers or lace."
        },
        {
          "headline":"Color Draculaura.",
          "description":""
        }
      ]
    },
    {
      "name":"Lagoona Blue",
      "steps":[
        {
          "headline":"Draw a big circle to outline her upper skull.",
          "description":""
        },
        {
          "headline":"Add guidelines for the face and her body.",
          "description":"Draw a vertical line in the middle of the head so you know the center of the face. You can draw on a different angle for her pose. Add two L-shaped lines for her jaw guide. For her body draw a rounded trapezoid with a rectangular trapezoid connected to the top."
        },
        {
          "headline":"Add neck, limbs and legs.",
          "description":"For the limbs and legs, just draw some lines. It all comes to the artist\u2019s preference. For her neck just draw a rectangle to connect the body to her head."
        },
        {
          "headline":"Complete the jaw and add hands.",
          "description":"Draw 2 short parallel lines for her cheeks. For the hands, just draw rounded ovals."
        },
        {
          "headline":"Draw the face.",
          "description":"On the center of the face,  draw her small nose and exaggeratingly large lips. Make sure to make the lower lip big and the upper lip thin. Add two almond-shaped figures for her eyes. Make the eyes skew a little from the center. On the top part of her head, draw a horizontal line for her bandana. Also, add a 4-petaled flower on the end of the bandana band."
        },
        {
          "headline":"Add bangs and ears.",
          "description":"If you want to show some fingers, draw simple lines for your guide. For her bangs, draw some curvy and wavy lines."
        },
        {
          "headline":"Add hair.",
          "description":"Basically, Lagoona\u2019s hair looks like waves so you might want to keep that in mind when drawing her hair. Aside from that, it\u2019s just simple lines and curves."
        },
        {
          "headline":"Draw the face and some clothing details.",
          "description":"For her fins, add triangles on her legs, her wrist and beside her bandana. Add two circles inside her eyes for her iris. For She usually wears a vest blouse so add a vest to her body as well. By now, you should have her basic skeleton."
        },
        {
          "headline":"Using a pen, draw on top of your sketch.",
          "description":"Put in mind the overlapping lines and parts that should be hidden. For her limbs and legs, just add some width from the bone. It doesn\u2019t matter if your legs look weird. The drawing style for Monster High defies logic and proportional rules. Don\u2019t forget to add her board shorts and webbed fingers. The lineart might not look perfect and crisp but it should look neat when the pencil is erased."
        },
        {
          "headline":"Erase the pencil sketch and add details.",
          "description":"You can add details like scales, jewelry and different accessories. Don\u2019t forget to add some eyelashes and the inside lens (which is just 2 small circles overlapping a big one). Try to add more if needed. Don\u2019t be afraid to add more lines than what is necessary. You can add lots of trinkets on her clothes. Try adding some flowers or pearls."
        },
        {
          "headline":"Color Lagoona.",
          "description":"and remember Lagoona has some freckles."
        }
      ]
    },
    {
      "name":"Frankie Stein",
      "steps":[
        {
          "headline":"Draw a big circle.",
          "description":"This is for her upper skull. Make sure that you are using a pencil for the draft sketch so you can erase it afterwards to make it neat."
        },
        {
          "headline":"Add guidelines for the face.",
          "description":"Draw a vertical line in the middle of the head so you know the center of the face. You can draw on a different angle for her pose. Add an L-shaped line for her jaw guide."
        },
        {
          "headline":"Add her torso and cheeks.",
          "description":"For her torso, draw an inverted triangle. For her cheeks, just connect the head with the L-shaped line."
        },
        {
          "headline":"Add neck and hips.",
          "description":"Draw a circle at the pointed end of the triangle for her hips. For her neck just draw a rectangle to connect the body to her head."
        },
        {
          "headline":"Draw her limbs and thigh.",
          "description":"For the limbs and legs, just draw some lines. It all comes to the artist\u2019s preference."
        },
        {
          "headline":"Complete neck and add hands.",
          "description":"To complete her neck, draw 2 huge bolts at each side. For the hands, just draw rounded ovals. Also, don\u2019t forget to add her legs. By now, you should have her basic skeleton."
        },
        {
          "headline":"Add hair.",
          "description":"Basically, Frankie\u2019s hair is straight but tends to meet up at the ends, you might want to keep that in mind when drawing her hair. Aside from that, it\u2019s just simple lines and curves."
        },
        {
          "headline":"Draw some clothing details.",
          "description":"For her bangs, draw some curvy and wavy lines. Add some sleeve puffs and her necktie. Frankie likes wearing gothic dresses so let\u2019s add some ruffles for her skirt."
        },
        {
          "headline":"Draw the face.",
          "description":"On the center of the face,  draw her small nose and large lips. Make sure to make the lower lip big and the upper lip thin. Add two almond-shaped figures for her eyes. Make the eyes skew a little from the center."
        },
        {
          "headline":"Using a pen, draw on top of your sketch.",
          "description":"Put in mind the overlapping lines and parts that should be hidden. For her limbs and legs, just add some width from the bone. It doesn\u2019t matter if your legs look weird. The drawing style for Monster High defies logic and proportional rules. The lineart might not look perfect and crisp but it should look neat when the pencil is erased."
        },
        {
          "headline":"Erase the pencil sketch and add details.",
          "description":"You can add details like jewelry and different accessories. Don\u2019t forget to add some eyelashes and the inside lens (which is just 2 small circles overlapping a big one). Also, never forget her body stitches. She\u2019s got one on her face, neck, two on her right arm, and one on the other. For her legs, she\u2019s got one set of stitches each leg. Try to add more if needed. Don\u2019t be afraid to add more lines than what is necessary. You can add lots of trinkets on her clothes."
        },
        {
          "headline":"Color Frankie.",
          "description":"When coloring her, notice that she has different-colored eyes."
        }
      ]
    },
    {
      "name":"Cleo de Nile",
      "steps":[
        {
          "headline":"Draw a big circle.",
          "description":"This is for her upper skull. Make sure that you are using a pencil for the draft sketch so you can erase it afterwards to make it neat."
        },
        {
          "headline":"Add guidelines for the face.",
          "description":"Draw a vertical line in the middle of the head so you know the center of the face. You can draw on a different angle for her pose. Add an L-shaped line for her jaw guide."
        },
        {
          "headline":"Add her torso and cheeks.",
          "description":"For her torso, draw an inverted triangle. For her cheeks, just connect the head with the L-shaped line."
        },
        {
          "headline":"Add neck and hips.",
          "description":"Draw a circle at the pointed end of the triangle for her hips. For her neck just draw a rectangle to connect the body to her head."
        },
        {
          "headline":"Draw her limbs and thigh.",
          "description":"For the limbs and legs, just draw some lines. It all comes to the artist\u2019s preference."
        },
        {
          "headline":"Add some hair and hands.",
          "description":"For the hands, just draw rounded ovals. Also, don\u2019t forget to add her legs. For her bangs, just draw a semi-circle and add some wavy lines to add some more hair to her side. By now, you should have her basic skeleton."
        },
        {
          "headline":"Add hair.",
          "description":"Basically, Cleo\u2019s hair is straight and big."
        },
        {
          "headline":"Draw the face.",
          "description":"On the center of the face,  draw her small nose and large lips. Make sure to make the lower lip big and the upper lip thin. Add two almond-shaped figures for her eyes. Make the eyes skew a little from the center."
        },
        {
          "headline":"Using a pen, draw on top of your sketch.",
          "description":"Put in mind the overlapping lines and parts that should be hidden. For her limbs and legs, just add some width from the bone. It doesn\u2019t matter if your legs look weird. The drawing style for Monster High defies logic and proportional rules. The lineart might not look perfect and crisp but it should look neat when the pencil is erased."
        },
        {
          "headline":"Erase the pencil sketch and add details.",
          "description":"You can add details like jewelry and different accessories. Don\u2019t forget to add some eyelashes and the inside lens(which is just 2 small circles overlapping a big one)\nTry to add more if needed. Don\u2019t be afraid to add more lines than what is necessary. You can add lots of trinkets on her clothes. Because Cleo is a mummy, don\u2019t forget to add some bandages to her limbs and arms. Cleo also has a jewelry stud/birthmark on her face."
        },
        {
          "headline":"Color Cleo.",
          "description":"When coloring her, notice her eyes are light blue. but in the picture above she has yellow eyes."
        }
      ]
    },
    {
      "name":"Clawdeen Wolf",
      "steps":[
        {
          "headline":"Draw a big circle.",
          "description":"This is for her upper skull. Make sure that you are using a pencil for the draft sketch so you can erase it afterwards to make it neat."
        },
        {
          "headline":"Add guidelines for the face.",
          "description":"Draw a vertical line in the middle of the head so you know the center of the face. You can draw on a different angle for her pose. Add an L-shaped line for her jaw guide."
        },
        {
          "headline":"Add her torso and cheeks.",
          "description":"For her torso, draw an inverted triangle. For her cheeks, just connect the head with the L-shaped line."
        },
        {
          "headline":"Add neck and hips.",
          "description":"Draw a circle at the pointed end of the triangle for her hips. For her neck just draw a rectangle to connect the body to her head."
        },
        {
          "headline":"Draw her limbs and thigh.",
          "description":"For the limbs and legs, just draw some lines. It all comes to the artist\u2019s preference."
        },
        {
          "headline":"Add some hair and hands.",
          "description":"For the hands, just draw rounded ovals. Also, don\u2019t forget to add her legs. For her bangs, just draw 2 big S-shaped waves. By now, you should have her basic skeleton."
        },
        {
          "headline":"Add hair.",
          "description":"Clawdeen\u2019s hair is wavy and big. Her hair is similar to Lagoona\u2019s but hers is chunkier."
        },
        {
          "headline":"Draw the face.",
          "description":"On the center of the face,  draw her small nose and large lips. Make sure to make the lower lip big and the upper lip thin. Add two almond-shaped figures for her eyes. Make the eyes skew a little from the center. Add two lemon-shaped figure above her bangs for her ears."
        },
        {
          "headline":"Draw some clothing details.",
          "description":"Draw some wavy lines for her fur coat and skirt frills."
        },
        {
          "headline":"Using a pen, draw on top of your sketch.",
          "description":"Put in mind the overlapping lines and parts that should be hidden. For her limbs and legs, just add some width from the bone. It doesn\u2019t matter if your legs look weird. The drawing style for Monster High defies logic and proportional rules. The lineart might not look perfect and crisp but it should look neat when the pencil is erased."
        },
        {
          "headline":"Erase the pencil sketch and add details.",
          "description":"You can add details like jewelry and different accessories. Don\u2019t forget to add some eyelashes and the inside lens (which is just 2 small circles overlapping a big one). Try to add more if needed. Don\u2019t be afraid to add more lines than what is necessary. You can add lots of trinkets on her clothes. Don\u2019t forget to add her fangs."
        },
        {
          "headline":"Color Clawdeen.",
          "description":""
        }
      ]
    }
  ],
  "text":" Draculaura Draw a big circle to outline her upper skull.  Add guidelines for the face. Draw a vertical line in the middle of the head to align the center of her face. You can draw on a different angle for her pose. Add two L-shaped lines for her jaw guide. Complete the jaw. Draw 2 short parallel lines for her cheeks. Add body, hair and ears. Because Draculaura\u2019s ears aren\u2019t round, draw a pointed rectangle instead of a round line for her ears. For her hair, draw 2 big S-shaped curvy lines. This would be your guide for her pony tails. For her body draw a rounded trapezoid with a rectangular trapezoid connected to the top. Add limbs and legs. For the limbs and legs, just draw some lines. It all comes to the artist\u2019s preference. Add hands. For the hands, just draw rounded ovals. If you want to show some fingers, draw simple lines for your guide. Draw the face and some clothing details. On the center of the face,  draw her small nose and exaggeratingly large lips. Make sure to make the lower lip big and the upper lip thin. Add two semi-circles for her eyes. Make the eyes skew a little from the center. Add a long dangling oval from her ear. To giver her more figure, add an oval around her chest. Draculaura usually wears a skirt with the frills on the bottom end, so add a long hexagon to guide you for her skirt. Draw the face and some clothing details. Add cuffs using trapezoids that open towards her hands. You can use a simple rectangle for her boots. Add two circles inside her eyes for her iris. Add a big semi-circle for her bangs. For her neck just draw a rectangle to connect the body to her head. She usually wears a V-neck blouse so add a big V on her chest, just above the oval. By now, you should have her basic skeleton. Using a pen, draw on top of your sketch. Put in mind the overlapping lines and parts that should be hidden. For her limbs and legs, just add some width from the bone. It doesn\u2019t matter if your legs look weird. The drawing style for Monster High defies logic and proportional rules. Don\u2019t forget to add her mouth, eyelashes and some clothing and jewelry details. She also has her signature heart on her left cheek. The lineart might not look perfect and crisp but it should look neat when the pencil is erased. Erase the pencil sketch and add details. You can add details like the buttons, her eye lens, stitch lines. In this stage, add her hair extensions as well. Try to add more if needed. Don\u2019t be afraid to add more lines than what is necessary. You can add lots of trinkets on her clothes. Try adding some flowers or lace. Color Draculaura.  Lagoona Blue Draw a big circle to outline her upper skull.  Add guidelines for the face and her body. Draw a vertical line in the middle of the head so you know the center of the face. You can draw on a different angle for her pose. Add two L-shaped lines for her jaw guide. For her body draw a rounded trapezoid with a rectangular trapezoid connected to the top. Add neck, limbs and legs. For the limbs and legs, just draw some lines. It all comes to the artist\u2019s preference. For her neck just draw a rectangle to connect the body to her head. Complete the jaw and add hands. Draw 2 short parallel lines for her cheeks. For the hands, just draw rounded ovals. Draw the face. On the center of the face,  draw her small nose and exaggeratingly large lips. Make sure to make the lower lip big and the upper lip thin. Add two almond-shaped figures for her eyes. Make the eyes skew a little from the center. On the top part of her head, draw a horizontal line for her bandana. Also, add a 4-petaled flower on the end of the bandana band. Add bangs and ears. If you want to show some fingers, draw simple lines for your guide. For her bangs, draw some curvy and wavy lines. Add hair. Basically, Lagoona\u2019s hair looks like waves so you might want to keep that in mind when drawing her hair. Aside from that, it\u2019s just simple lines and curves. Draw the face and some clothing details. For her fins, add triangles on her legs, her wrist and beside her bandana. Add two circles inside her eyes for her iris. For She usually wears a vest blouse so add a vest to her body as well. By now, you should have her basic skeleton. Using a pen, draw on top of your sketch. Put in mind the overlapping lines and parts that should be hidden. For her limbs and legs, just add some width from the bone. It doesn\u2019t matter if your legs look weird. The drawing style for Monster High defies logic and proportional rules. Don\u2019t forget to add her board shorts and webbed fingers. The lineart might not look perfect and crisp but it should look neat when the pencil is erased. Erase the pencil sketch and add details. You can add details like scales, jewelry and different accessories. Don\u2019t forget to add some eyelashes and the inside lens (which is just 2 small circles overlapping a big one). Try to add more if needed. Don\u2019t be afraid to add more lines than what is necessary. You can add lots of trinkets on her clothes. Try adding some flowers or pearls. Color Lagoona. and remember Lagoona has some freckles. Frankie Stein Draw a big circle. This is for her upper skull. Make sure that you are using a pencil for the draft sketch so you can erase it afterwards to make it neat. Add guidelines for the face. Draw a vertical line in the middle of the head so you know the center of the face. You can draw on a different angle for her pose. Add an L-shaped line for her jaw guide. Add her torso and cheeks. For her torso, draw an inverted triangle. For her cheeks, just connect the head with the L-shaped line. Add neck and hips. Draw a circle at the pointed end of the triangle for her hips. For her neck just draw a rectangle to connect the body to her head. Draw her limbs and thigh. For the limbs and legs, just draw some lines. It all comes to the artist\u2019s preference. Complete neck and add hands. To complete her neck, draw 2 huge bolts at each side. For the hands, just draw rounded ovals. Also, don\u2019t forget to add her legs. By now, you should have her basic skeleton. Add hair. Basically, Frankie\u2019s hair is straight but tends to meet up at the ends, you might want to keep that in mind when drawing her hair. Aside from that, it\u2019s just simple lines and curves. Draw some clothing details. For her bangs, draw some curvy and wavy lines. Add some sleeve puffs and her necktie. Frankie likes wearing gothic dresses so let\u2019s add some ruffles for her skirt. Draw the face. On the center of the face,  draw her small nose and large lips. Make sure to make the lower lip big and the upper lip thin. Add two almond-shaped figures for her eyes. Make the eyes skew a little from the center. Using a pen, draw on top of your sketch. Put in mind the overlapping lines and parts that should be hidden. For her limbs and legs, just add some width from the bone. It doesn\u2019t matter if your legs look weird. The drawing style for Monster High defies logic and proportional rules. The lineart might not look perfect and crisp but it should look neat when the pencil is erased. Erase the pencil sketch and add details. You can add details like jewelry and different accessories. Don\u2019t forget to add some eyelashes and the inside lens (which is just 2 small circles overlapping a big one). Also, never forget her body stitches. She\u2019s got one on her face, neck, two on her right arm, and one on the other. For her legs, she\u2019s got one set of stitches each leg. Try to add more if needed. Don\u2019t be afraid to add more lines than what is necessary. You can add lots of trinkets on her clothes. Color Frankie. When coloring her, notice that she has different-colored eyes. Cleo de Nile Draw a big circle. This is for her upper skull. Make sure that you are using a pencil for the draft sketch so you can erase it afterwards to make it neat. Add guidelines for the face. Draw a vertical line in the middle of the head so you know the center of the face. You can draw on a different angle for her pose. Add an L-shaped line for her jaw guide. Add her torso and cheeks. For her torso, draw an inverted triangle. For her cheeks, just connect the head with the L-shaped line. Add neck and hips. Draw a circle at the pointed end of the triangle for her hips. For her neck just draw a rectangle to connect the body to her head. Draw her limbs and thigh. For the limbs and legs, just draw some lines. It all comes to the artist\u2019s preference. Add some hair and hands. For the hands, just draw rounded ovals. Also, don\u2019t forget to add her legs. For her bangs, just draw a semi-circle and add some wavy lines to add some more hair to her side. By now, you should have her basic skeleton. Add hair. Basically, Cleo\u2019s hair is straight and big. Draw the face. On the center of the face,  draw her small nose and large lips. Make sure to make the lower lip big and the upper lip thin. Add two almond-shaped figures for her eyes. Make the eyes skew a little from the center. Using a pen, draw on top of your sketch. Put in mind the overlapping lines and parts that should be hidden. For her limbs and legs, just add some width from the bone. It doesn\u2019t matter if your legs look weird. The drawing style for Monster High defies logic and proportional rules. The lineart might not look perfect and crisp but it should look neat when the pencil is erased. Erase the pencil sketch and add details. You can add details like jewelry and different accessories. Don\u2019t forget to add some eyelashes and the inside lens(which is just 2 small circles overlapping a big one)\nTry to add more if needed. Don\u2019t be afraid to add more lines than what is necessary. You can add lots of trinkets on her clothes. Because Cleo is a mummy, don\u2019t forget to add some bandages to her limbs and arms. Cleo also has a jewelry stud/birthmark on her face. Color Cleo. When coloring her, notice her eyes are light blue. but in the picture above she has yellow eyes. Clawdeen Wolf Draw a big circle. This is for her upper skull. Make sure that you are using a pencil for the draft sketch so you can erase it afterwards to make it neat. Add guidelines for the face. Draw a vertical line in the middle of the head so you know the center of the face. You can draw on a different angle for her pose. Add an L-shaped line for her jaw guide. Add her torso and cheeks. For her torso, draw an inverted triangle. For her cheeks, just connect the head with the L-shaped line. Add neck and hips. Draw a circle at the pointed end of the triangle for her hips. For her neck just draw a rectangle to connect the body to her head. Draw her limbs and thigh. For the limbs and legs, just draw some lines. It all comes to the artist\u2019s preference. Add some hair and hands. For the hands, just draw rounded ovals. Also, don\u2019t forget to add her legs. For her bangs, just draw 2 big S-shaped waves. By now, you should have her basic skeleton. Add hair. Clawdeen\u2019s hair is wavy and big. Her hair is similar to Lagoona\u2019s but hers is chunkier. Draw the face. On the center of the face,  draw her small nose and large lips. Make sure to make the lower lip big and the upper lip thin. Add two almond-shaped figures for her eyes. Make the eyes skew a little from the center. Add two lemon-shaped figure above her bangs for her ears. Draw some clothing details. Draw some wavy lines for her fur coat and skirt frills. Using a pen, draw on top of your sketch. Put in mind the overlapping lines and parts that should be hidden. For her limbs and legs, just add some width from the bone. It doesn\u2019t matter if your legs look weird. The drawing style for Monster High defies logic and proportional rules. The lineart might not look perfect and crisp but it should look neat when the pencil is erased. Erase the pencil sketch and add details. You can add details like jewelry and different accessories. Don\u2019t forget to add some eyelashes and the inside lens (which is just 2 small circles overlapping a big one). Try to add more if needed. Don\u2019t be afraid to add more lines than what is necessary. You can add lots of trinkets on her clothes. Don\u2019t forget to add her fangs. Color Clawdeen. ",
  "tyn_model":[
    "pencil",
    "pen",
    "monster high",
    "draculaura",
    "bandana",
    "hexagon",
    "4-petaled",
    "board shorts",
    "jewelry",
    "hair",
    "clawdeen"
  ],
  "tyn_section":[

  ]
}