{
  "title":"How to Have Energy to Do Chores when You Are Sick",
  "url":"https://www.wikihow.com/Have-Energy-to-Do-Chores-when-You-Are-Sick",
  "category_hierarchy":[
    "Home and Garden",
    "Housekeeping",
    "Cleaning",
    "Cleaning Motivation"
  ],
  "parts":[
    {
      "name":"Completing Your Chores",
      "steps":[
        {
          "headline":"List the chores you need to complete.",
          "description":"Take a moment to think about what needs attention around the house. Write those things down. Take a second look at your list and whittle it down to the things that must be done first. Remember that it's important for you to rest in order for your body to make a quick recovery, so don't plan to overexert yourself."
        },
        {
          "headline":"Do what makes you feel energized before starting your chore list.",
          "description":"You may feel as though washing your face or taking a shower reminds you of morning time, and your body responds to that feeling with increased energy. Maybe it\u2019s a game of chess. Do what makes you feel rejuvenated."
        },
        {
          "headline":"Complete chores in five minute bursts when you\u2019re feeling your best.",
          "description":"Consider which chores require the least amount of effort. It feels great to complete many of these tasks in a short time. You might be surprised when you realize how many tasks you can complete in only a few minutes. Keep a trash bag on hand so that you don't have to walk back and forth to a trash can. Tackle tasks such as these, which can be done in around five minutes: cleaning the kitchen counter, loading the dishwasher, sweeping the floor, wiping the mirrors, and folding your clothes."
        },
        {
          "headline":"Take a break if you're feeling exhausted.",
          "description":"Taking breaks for as long as you need before continuing your chores will sustain your energy throughout the day. Remember that you won't be able to perform the way you would at your healthiest, so don't try to give it your all. It's better to complete your chosen tasks well enough than to spend all of your energy on a single task."
        }
      ]
    },
    {
      "name":"Getting Support",
      "steps":[
        {
          "headline":"Call a friend.",
          "description":"Energy can come from the bonds you share with others. Even a brief chat with a friend or relative who understands your illness can fill you with positive energy. After exchanging a few good vibes, unleash that energy onto your chore list. Find a nearby area outdoors with a comfortable seat while talking to your friend. You may find the fresh air to be invigorating."
        },
        {
          "headline":"Invite a friend over for motivation.",
          "description":"Maybe there's a friend or someone else you know has a positive effect on your energy. Let them know that they make you feel energized, and how important they are to you because of it. Invite them over and ask them to provide you with a few positive words of motivation."
        },
        {
          "headline":"Delegate tasks to others.",
          "description":"Don\u2019t hesitate to let someone know that you need help around the house. There are probably more people in your orbit than you\u2019re aware of who would enjoy visiting you while knocking out a few tasks. Ask for help directly. Many people prefer to be asked for help, as opposed to feeling as though they must go out on a limb to ask you if they can be of assistance."
        }
      ]
    },
    {
      "name":"Being Kind to Yourself",
      "steps":[
        {
          "headline":"Shorten your chore list if necessary.",
          "description":"Remember that it isn\u2019t crucial to finish every single task you set out to do in the beginning. When you feel as though you\u2019ve done what you\u2019re able to, cross out everything you\u2019ve done on your chore list and be proud of yourself."
        },
        {
          "headline":"Be positive, and don't beat yourself up.",
          "description":"There\u2019s a lot of work to be done around the house. Don\u2019t take it to heart if your energy level doesn\u2019t match up with the tasks at hand. Save those tasks for another day."
        },
        {
          "headline":"Rest often.",
          "description":"Take it easy. Reading your favorite books or listening to music you love can provide you with energy to get back up later. If it doesn\u2019t, then that\u2019s okay too. This includes getting plenty of sleep\u2014more than eight hours if necessary."
        }
      ]
    }
  ],
  "text":" Completing Your Chores List the chores you need to complete. Take a moment to think about what needs attention around the house. Write those things down. Take a second look at your list and whittle it down to the things that must be done first. Remember that it's important for you to rest in order for your body to make a quick recovery, so don't plan to overexert yourself. Do what makes you feel energized before starting your chore list. You may feel as though washing your face or taking a shower reminds you of morning time, and your body responds to that feeling with increased energy. Maybe it\u2019s a game of chess. Do what makes you feel rejuvenated. Complete chores in five minute bursts when you\u2019re feeling your best. Consider which chores require the least amount of effort. It feels great to complete many of these tasks in a short time. You might be surprised when you realize how many tasks you can complete in only a few minutes. Keep a trash bag on hand so that you don't have to walk back and forth to a trash can. Tackle tasks such as these, which can be done in around five minutes: cleaning the kitchen counter, loading the dishwasher, sweeping the floor, wiping the mirrors, and folding your clothes. Take a break if you're feeling exhausted. Taking breaks for as long as you need before continuing your chores will sustain your energy throughout the day. Remember that you won't be able to perform the way you would at your healthiest, so don't try to give it your all. It's better to complete your chosen tasks well enough than to spend all of your energy on a single task. Getting Support Call a friend. Energy can come from the bonds you share with others. Even a brief chat with a friend or relative who understands your illness can fill you with positive energy. After exchanging a few good vibes, unleash that energy onto your chore list. Find a nearby area outdoors with a comfortable seat while talking to your friend. You may find the fresh air to be invigorating. Invite a friend over for motivation. Maybe there's a friend or someone else you know has a positive effect on your energy. Let them know that they make you feel energized, and how important they are to you because of it. Invite them over and ask them to provide you with a few positive words of motivation. Delegate tasks to others. Don\u2019t hesitate to let someone know that you need help around the house. There are probably more people in your orbit than you\u2019re aware of who would enjoy visiting you while knocking out a few tasks. Ask for help directly. Many people prefer to be asked for help, as opposed to feeling as though they must go out on a limb to ask you if they can be of assistance. Being Kind to Yourself Shorten your chore list if necessary. Remember that it isn\u2019t crucial to finish every single task you set out to do in the beginning. When you feel as though you\u2019ve done what you\u2019re able to, cross out everything you\u2019ve done on your chore list and be proud of yourself. Be positive, and don't beat yourself up. There\u2019s a lot of work to be done around the house. Don\u2019t take it to heart if your energy level doesn\u2019t match up with the tasks at hand. Save those tasks for another day. Rest often. Take it easy. Reading your favorite books or listening to music you love can provide you with energy to get back up later. If it doesn\u2019t, then that\u2019s okay too. This includes getting plenty of sleep\u2014more than eight hours if necessary.",
  "tyn_model":[
    "\u2014more"
  ],
  "tyn_section":[

  ]
}