{
  "title":"How to Make Fry Sauce",
  "url":"https://www.wikihow.com/Make-Fry-Sauce",
  "category_hierarchy":[
    "Food and Entertaining",
    "Recipes",
    "Jams Preserves and Condiments",
    "Sauces"
  ],
  "methods":[
    {
      "name":"Making Classic Fry Sauce",
      "steps":[
        {
          "headline":"Mix 2 parts mayonnaise and 1 part ketchup.",
          "description":"The most common fry sauce is simply a mixture of two classic condiments. To make it, simply mix together some ketchup and twice as much mayo. So, if you used 1/2 cup ketchup, you'd mix in 1 full cup of mayonnaise. For healthier sauce, try using Miracle Whip, or low-fat version mayo."
        },
        {
          "headline":"Add vinegar for tangier, smoother sauce recipes.",
          "description":"Looking for a little extra flavor in your fry sauce? Mix things up with some salt, pepper, and a little vinegar for an added punch. Because there is vinegar, a common ingredient in ketchup, you actually need less of the red stuff. In a bowl, mix the following ingredients well:\n1/4 cup mayonnaise\n2 tablespoons ketchup\n1 teaspoon vinegar\n1/2 teaspoon ground black pepper\n1/2 teaspoon sea salt"
        },
        {
          "headline":"Mix in 1 tablespoon hot sauce for an added kick.",
          "description":"In order to get a little heat in your life, throw in a dash (1-2 tablespoons) of your favorite hot sauce."
        },
        {
          "headline":"Substitute BBQ sauce for ketchup to get a smokier flavor.",
          "description":"The base of most barbecue sauces, tomato paste and vinegar, are the same basic ingredients as ketchup. BBQ sauce simply has spices already added, and usually has a richer flavor than ketchup. Mix in 1 part BBQ and 2 parts mayo for your final fry sauce."
        },
        {
          "headline":"Mix up spices and sauces for a decadent spiced fry sauce.",
          "description":"It is easy to customize and change fry sauce to meet your needs, and the following spices all go well with the mixture. Try them individually, or try them all together for a rich, delectable sauce. Note that the following mixtures are measured out for a base of 1 cup mayo, 1/2 cup ketchup. 2 tablespoons mayonnaise\n1/4 cup white sugar\n1/2 teaspoon salt\n1/8 teaspoon paprika\n1/4 teaspoon ground mustard\n1/2 teaspoon onion powder\n1 teaspoon garlic powder\n2 tablespoons red wine vinegar\n1 teaspoon Worcestershire sauce"
        },
        {
          "headline":"Try a few teaspoons of pickle juice for some tangy kick.",
          "description":"It might sound odd, but pickle juice is mostly vinegar, and it's already been established that it goes well with fry sauce. Start with roughly 1 teaspoon at a time, testing each time. The sauce can quickly become \"pickley\" if you're not careful."
        },
        {
          "headline":"Serve fry sauce with anything you'd eat with ketchup.",
          "description":"Of course fry sauce is good on french fries. But it is also incredible on burgers, sandwiches, chicken nuggets. There is, of course, no wrong way to use fry sauce, but it is generally best with comfort food or anything you would put ketchup or mayonnaise on separately. Many other countries have made and adapted Fry Sauces, often calling them \"American Sauce.\" In French-speaking countries like Belgium, \"sauce American\" is a popular condiment with fries."
        }
      ]
    },
    {
      "name":"International Fry Sauces",
      "steps":[
        {
          "headline":"Try Argentinian fry sauce, or \"golf sauce.\"",
          "description":"Simply mix up your normal fry sauce with a pinch (to taste) of the following ingredients. Great on fries, burgers, eggs, and chicken. Pimento\nCumin\nOregano"
        },
        {
          "headline":"Try British Marie Rose sauce.",
          "description":"This common dressing in England is sometimes made with simply ketchup and mayo, much like American fry sauce, or dressed up as a cocktail sauce for shrimp. 1/2 cup tomato puree, or Ketchup\n1 cup Mayonnaise\n1-2 teaspoons Worcestershire sauce,\n1-2 teaspoons Lemon juice\nSalt and pepper to taste."
        },
        {
          "headline":"Substitute half your mayo for sour cream for an Icelandic fry sauce.",
          "description":"This makes the sauce thicker, and it is often used for shrimp, fries, burgers, and even tacos."
        },
        {
          "headline":"Add honey and chopped pickles for a French Polynesian twist.",
          "description":"Made famous at \"The Blue Lagoon\" restaurant, the actual proportions of this sauce are reportedly held secret. Still, a little playing around with your ratios should deliver something delicious."
        }
      ]
    }
  ],
  "text":" Making Classic Fry Sauce Mix 2 parts mayonnaise and 1 part ketchup. The most common fry sauce is simply a mixture of two classic condiments. To make it, simply mix together some ketchup and twice as much mayo. So, if you used 1/2 cup ketchup, you'd mix in 1 full cup of mayonnaise. For healthier sauce, try using Miracle Whip, or low-fat version mayo. Add vinegar for tangier, smoother sauce recipes. Looking for a little extra flavor in your fry sauce? Mix things up with some salt, pepper, and a little vinegar for an added punch. Because there is vinegar, a common ingredient in ketchup, you actually need less of the red stuff. In a bowl, mix the following ingredients well:\n1/4 cup mayonnaise\n2 tablespoons ketchup\n1 teaspoon vinegar\n1/2 teaspoon ground black pepper\n1/2 teaspoon sea salt Mix in 1 tablespoon hot sauce for an added kick. In order to get a little heat in your life, throw in a dash (1-2 tablespoons) of your favorite hot sauce. Substitute BBQ sauce for ketchup to get a smokier flavor. The base of most barbecue sauces, tomato paste and vinegar, are the same basic ingredients as ketchup. BBQ sauce simply has spices already added, and usually has a richer flavor than ketchup. Mix in 1 part BBQ and 2 parts mayo for your final fry sauce. Mix up spices and sauces for a decadent spiced fry sauce. It is easy to customize and change fry sauce to meet your needs, and the following spices all go well with the mixture. Try them individually, or try them all together for a rich, delectable sauce. Note that the following mixtures are measured out for a base of 1 cup mayo, 1/2 cup ketchup. 2 tablespoons mayonnaise\n1/4 cup white sugar\n1/2 teaspoon salt\n1/8 teaspoon paprika\n1/4 teaspoon ground mustard\n1/2 teaspoon onion powder\n1 teaspoon garlic powder\n2 tablespoons red wine vinegar\n1 teaspoon Worcestershire sauce Try a few teaspoons of pickle juice for some tangy kick. It might sound odd, but pickle juice is mostly vinegar, and it's already been established that it goes well with fry sauce. Start with roughly 1 teaspoon at a time, testing each time. The sauce can quickly become \"pickley\" if you're not careful. Serve fry sauce with anything you'd eat with ketchup. Of course fry sauce is good on french fries. But it is also incredible on burgers, sandwiches, chicken nuggets. There is, of course, no wrong way to use fry sauce, but it is generally best with comfort food or anything you would put ketchup or mayonnaise on separately. Many other countries have made and adapted Fry Sauces, often calling them \"American Sauce.\" In French-speaking countries like Belgium, \"sauce American\" is a popular condiment with fries. International Fry Sauces Try Argentinian fry sauce, or \"golf sauce.\" Simply mix up your normal fry sauce with a pinch (to taste) of the following ingredients. Great on fries, burgers, eggs, and chicken. Pimento\nCumin\nOregano Try British Marie Rose sauce. This common dressing in England is sometimes made with simply ketchup and mayo, much like American fry sauce, or dressed up as a cocktail sauce for shrimp. 1/2 cup tomato puree, or Ketchup\n1 cup Mayonnaise\n1-2 teaspoons Worcestershire sauce,\n1-2 teaspoons Lemon juice\nSalt and pepper to taste. Substitute half your mayo for sour cream for an Icelandic fry sauce. This makes the sauce thicker, and it is often used for shrimp, fries, burgers, and even tacos. Add honey and chopped pickles for a French Polynesian twist. Made famous at \"The Blue Lagoon\" restaurant, the actual proportions of this sauce are reportedly held secret. Still, a little playing around with your ratios should deliver something delicious.",
  "tyn_model":[
    "ketchup",
    "fry sauce",
    "vinegar",
    "mayonnaise",
    "mayo",
    "spices",
    "hot sauce",
    "bbq sauce",
    "worcestershire sauce",
    "pickle",
    "miracle whip",
    "low-fat version mayo",
    "salt, pepper",
    "bowl",
    "ground black pepper",
    "sea salt",
    "barbecue sauces",
    "tomato paste",
    "bbq",
    "white sugar",
    "salt",
    "paprika",
    "ground mustard",
    "onion powder",
    "garlic powder",
    "red wine vinegar",
    "fry sauces",
    "sauce",
    "oregano",
    "tomato puree",
    "lemon juice",
    "sour cream",
    "icelandic fry sauce",
    "honey",
    "pickles"
  ],
  "tyn_section":[

  ]
}