{
  "title":"How to Collect Rocks",
  "url":"https://www.wikihow.com/Collect-Rocks",
  "category_hierarchy":[
    "Hobbies and Crafts",
    "Collecting"
  ],
  "parts":[
    {
      "name":"Choosing Places to Search",
      "steps":[
        {
          "headline":"Start your collection with rocks from your neighborhood.",
          "description":"When you\u2019re first starting out, try searching for rocks in your backyard, around your neighborhood, and in other places you frequent. Look for specimens that have interesting features and, most importantly, appeal to your personal tastes. During this time, train yourself to spot unique rocks that you would normally overlook. Keep your eyes peeled for old stream beds, ditches, road cuts, and other areas with lots of exposed rocks."
        },
        {
          "headline":"Visit nature sites to expand your collection.",
          "description":"Though searching for rocks in your immediate area can lead to some wonderful discoveries, you\u2019ll run out of new specimens pretty fast. Given this, you\u2019ll have to visit a variety of nature sites to expand your collection further. Some popular places to look for rocks include mountain ranges, beaches, lowland plains, natural cliffs, outcrops, and quarries. You can find a map of popular collection sites at http://wheretofindrocks.com/why-collect-rocks/."
        },
        {
          "headline":"Ask before excavating rocks from private property or nature preserves.",
          "description":"Before digging up rocks on someone\u2019s private property or in a government-owned park or reserve, get permission from the owner or an authorized government agent. Without explicit permission, digging up rocks from these sites is illegal and can lead to theft or vandalism charges. For some parks and monuments, such as the Grand Canyon, you need a full geological permit to excavate rock samples."
        },
        {
          "headline":"Purchase or trade specimens at a rockhound club.",
          "description":"Unlike minerals and precious gems, rocks don\u2019t have a particularly large secondhand market. As such, the best way to purchase new specimens or make rock swaps is by visiting a rockhound club and mingling with its members. You can find a complete list of rockhound clubs at http://www.the-vug.com/educate-and-inform/rock-and-gem-clubs/. Even if they don\u2019t have any rocks for sale, rockhound clubs can point you in the direction of interesting excavation sites."
        }
      ]
    },
    {
      "name":"Finding and Excavating Rocks",
      "steps":[
        {
          "headline":"Search for specific types of rocks.",
          "description":"Rocks come in 3 primary forms: igneous, metamorphic, and sedimentary. Each of these forms has unique characteristics that will appeal to different types of people. There\u2019s no \u201cright\u201d way to collect rocks, so feel free to go after whichever style you like most. Igneous rocks are firm, crystalline specimens formed out of magma. Popular variants include basalt, obsidian, and gabbro. Sedimentary rocks are layered specimens formed by water, ice, or wind. Popular variants include sandstone, limestone, and shale. Metamorphic rocks are igneous and sedimentary rocks that were transformed and flattened by extreme heat. Popular variants include slate, marble, and gneiss."
        },
        {
          "headline":"Look for rocks that are unique to the area you find them in.",
          "description":"This may mean rocks only available in specific places, such as novaculite and jadeite, or standard rocks that look unique thanks to the natural processes that formed them. If you\u2019re going to a popular collecting destination like the Appalachians, search online for region-specific rock guides to see what specimens exist in the area."
        },
        {
          "headline":"Excavate rocks with a geologist\u2019s hammer if necessary.",
          "description":"Though you may find some rocks simply lying on the ground, others will require a geologist\u2019s hammer to excavate properly. These tools come with a blunt end, which you can use to break off new specimens, and a pick end, which you can use to chisel specimens out of a rock face. Before using your hammer, put on safety goggles to protect your eyes from debris. You can purchase geologist\u2019s hammers from most home improvement stores."
        },
        {
          "headline":"Label each rock as soon as you excavate it.",
          "description":"Whenever you pick up a new specimen, write down the area you found it in on an adhesive label and attach it to the rock. Then, store the rock in an area where it won\u2019t get mixed up with other specimens. Doing this will help you catalog your rocks once you get home. If you can, take a picture of the exact spot you get each rock from. That way, if you have trouble identifying a rock later on, you can look at its photo for further clues."
        }
      ]
    },
    {
      "name":"Storing Your Collection",
      "steps":[
        {
          "headline":"Catalog your rocks.",
          "description":"So you can keep track of all the different rocks you have, create a simple catalog listing out each of your specimens. For every specimen, include what type of rock it is, where you found it, when you picked it up, and any additional notes you feel are relevant. If you don\u2019t know what type of rock you have, consult the Mineralogical Society of America\u2019s Rock Identification Key at http://www.minsocam.org/msa/collectors_corner/id/rock_key.htm."
        },
        {
          "headline":"Cut your rocks down to a common specimen size.",
          "description":"To save space, most rock collectors cut their specimens down to a size that\u2019s just large enough to show off the rock\u2019s features. Though measurements will vary by rock, the most common specimen sizes are 3 by 4 by 2 in (7.6 by 10.2 by 5.1 cm) and 2 by 3 by 1 in (5.1 by 7.6 by 2.5 cm). You can cut your rocks using the pick end of a geologist\u2019s hammer, a slab saw, or a trim saw."
        },
        {
          "headline":"Keep your rocks in a loose box.",
          "description":"Unlike many other types of collectibles, rocks are incredibly durable and have no special storage requirements. As such, you can keep them in any loose container such as a shoe box or egg carton. If you want to display your collection, consider purchasing a wall case from a craft or picture frame supply store. To keep your rocks from getting mixed up, try sorting them by type or location."
        },
        {
          "headline":"Clean you rocks with a toothbrush when necessary.",
          "description":"If your rocks get dirt or grime on them, rinse them in cold water with a small amount of dish soap or laundry detergent. Then, gently scrub your specimens clean with a toothbrush."
        }
      ]
    }
  ],
  "text":" Choosing Places to Search Start your collection with rocks from your neighborhood. When you\u2019re first starting out, try searching for rocks in your backyard, around your neighborhood, and in other places you frequent. Look for specimens that have interesting features and, most importantly, appeal to your personal tastes. During this time, train yourself to spot unique rocks that you would normally overlook. Keep your eyes peeled for old stream beds, ditches, road cuts, and other areas with lots of exposed rocks. Visit nature sites to expand your collection. Though searching for rocks in your immediate area can lead to some wonderful discoveries, you\u2019ll run out of new specimens pretty fast. Given this, you\u2019ll have to visit a variety of nature sites to expand your collection further. Some popular places to look for rocks include mountain ranges, beaches, lowland plains, natural cliffs, outcrops, and quarries. You can find a map of popular collection sites at http://wheretofindrocks.com/why-collect-rocks/. Ask before excavating rocks from private property or nature preserves. Before digging up rocks on someone\u2019s private property or in a government-owned park or reserve, get permission from the owner or an authorized government agent. Without explicit permission, digging up rocks from these sites is illegal and can lead to theft or vandalism charges. For some parks and monuments, such as the Grand Canyon, you need a full geological permit to excavate rock samples. Purchase or trade specimens at a rockhound club. Unlike minerals and precious gems, rocks don\u2019t have a particularly large secondhand market. As such, the best way to purchase new specimens or make rock swaps is by visiting a rockhound club and mingling with its members. You can find a complete list of rockhound clubs at http://www.the-vug.com/educate-and-inform/rock-and-gem-clubs/. Even if they don\u2019t have any rocks for sale, rockhound clubs can point you in the direction of interesting excavation sites. Finding and Excavating Rocks Search for specific types of rocks. Rocks come in 3 primary forms: igneous, metamorphic, and sedimentary. Each of these forms has unique characteristics that will appeal to different types of people. There\u2019s no \u201cright\u201d way to collect rocks, so feel free to go after whichever style you like most. Igneous rocks are firm, crystalline specimens formed out of magma. Popular variants include basalt, obsidian, and gabbro. Sedimentary rocks are layered specimens formed by water, ice, or wind. Popular variants include sandstone, limestone, and shale. Metamorphic rocks are igneous and sedimentary rocks that were transformed and flattened by extreme heat. Popular variants include slate, marble, and gneiss. Look for rocks that are unique to the area you find them in. This may mean rocks only available in specific places, such as novaculite and jadeite, or standard rocks that look unique thanks to the natural processes that formed them. If you\u2019re going to a popular collecting destination like the Appalachians, search online for region-specific rock guides to see what specimens exist in the area. Excavate rocks with a geologist\u2019s hammer if necessary. Though you may find some rocks simply lying on the ground, others will require a geologist\u2019s hammer to excavate properly. These tools come with a blunt end, which you can use to break off new specimens, and a pick end, which you can use to chisel specimens out of a rock face. Before using your hammer, put on safety goggles to protect your eyes from debris. You can purchase geologist\u2019s hammers from most home improvement stores. Label each rock as soon as you excavate it. Whenever you pick up a new specimen, write down the area you found it in on an adhesive label and attach it to the rock. Then, store the rock in an area where it won\u2019t get mixed up with other specimens. Doing this will help you catalog your rocks once you get home. If you can, take a picture of the exact spot you get each rock from. That way, if you have trouble identifying a rock later on, you can look at its photo for further clues. Storing Your Collection Catalog your rocks. So you can keep track of all the different rocks you have, create a simple catalog listing out each of your specimens. For every specimen, include what type of rock it is, where you found it, when you picked it up, and any additional notes you feel are relevant. If you don\u2019t know what type of rock you have, consult the Mineralogical Society of America\u2019s Rock Identification Key at http://www.minsocam.org/msa/collectors_corner/id/rock_key.htm. Cut your rocks down to a common specimen size. To save space, most rock collectors cut their specimens down to a size that\u2019s just large enough to show off the rock\u2019s features. Though measurements will vary by rock, the most common specimen sizes are 3 by 4 by 2 in (7.6 by 10.2 by 5.1 cm) and 2 by 3 by 1 in (5.1 by 7.6 by 2.5 cm). You can cut your rocks using the pick end of a geologist\u2019s hammer, a slab saw, or a trim saw. Keep your rocks in a loose box. Unlike many other types of collectibles, rocks are incredibly durable and have no special storage requirements. As such, you can keep them in any loose container such as a shoe box or egg carton. If you want to display your collection, consider purchasing a wall case from a craft or picture frame supply store. To keep your rocks from getting mixed up, try sorting them by type or location. Clean you rocks with a toothbrush when necessary. If your rocks get dirt or grime on them, rinse them in cold water with a small amount of dish soap or laundry detergent. Then, gently scrub your specimens clean with a toothbrush.",
  "tyn_model":[
    "rocks",
    "rock",
    "geologist\u2019s hammer",
    "rockhound clubs",
    "water",
    "minerals",
    "rockhound club",
    "\u201cright",
    "\u201d way",
    "basalt",
    "obsidian",
    "gabbro",
    "ice",
    "sandstone",
    "limestone",
    "shale",
    "slate",
    "marble",
    "gneiss",
    "hammer",
    "geologist\u2019s hammers",
    "mineralogical society",
    "rock collectors",
    "slab saw",
    "trim saw",
    "toothbrush",
    "dish soap",
    "laundry detergent"
  ],
  "tyn_section":[

  ]
}