{
  "title":"How to Make a Regular Teaser",
  "url":"https://www.wikihow.com/Make-a-Regular-Teaser",
  "category_hierarchy":[
    "Hobbies and Crafts",
    "Games",
    "Games of Chance"
  ],
  "parts":[
    {
      "name":"Calling your sportsbook",
      "steps":[
        {
          "headline":"Call your favorite sportsbook.",
          "description":"After the clerk\u2019s initial greeting ask:\nHow many points do their teasers offer in football? What about basketball? Up to how many picks can you take in a teaser? The more picks you take, the more it will pay. What happens with cancellations and ties? Will your teaser cancel, lose, win, or just turn into a smaller teaser with an adjusted payout? Once you have those questions answered, you're ready to move to the next steps, to call in a regular teaser bet. {\"smallUrl\":\"https:\\/\\/www.wikihow.com\\/images\\/thumb\\/d\\/d2\\/Make-a-Regular-Teaser-Step-2.jpg\\/v4-460px-Make-a-Regular-Teaser-Step-2.jpg\",\"bigUrl\":\"https:\\/\\/www.wikihow.com\\/images\\/thumb\\/d\\/d2\\/Make-a-Regular-Teaser-Step-2.jpg\\/v4-760px-Make-a-Regular-Teaser-Step-2.jpg\",\"smallWidth\":460,\"smallHeight\":345,\"bigWidth\":760,\"bigHeight\":570,\"licensing\":\"<div class=\\\"mw-parser-output\\\"><p>License: <a rel=\\\"nofollow\\\" class=\\\"external text\\\" href=\\\"https:\\/\\/creativecommons.org\\/licenses\\/by-nc-sa\\/3.0\\/\\\">Creative Commons<\\/a><br>\\n<\\/p><p><br \\/>\\n<\\/p><\\/div>\"}"
        },
        {
          "headline":"Give him or her your account number and password when you're ready to go ahead.",
          "description":"Ask for the games you\u2019re interested in. You can make a two-team teaser with only one game, using the total and one of the teams. Or, you can even take both sides and play for the middle. You can also combine football and basketball together or professional and collegian leagues. So if you want to hear the complete board, ask for a rundown. Have a pen and the sports\u2019 schedule with you!"
        },
        {
          "headline":"Write the lines down.",
          "description":"A complete rundown can vary anywhere between two lines to up to more than fifty in college football or basketball. You\u2019ll want to write the lines down to study them. Remember, you can only tease football and basketball."
        }
      ]
    },
    {
      "name":"Deciding on picks, points, teams and totals",
      "steps":[
        {
          "headline":"Decide how many picks you want in your teaser.",
          "description":"Most regular teasers go from two teams up to eight teams. It\u2019s important to point out that although they\u2019re called 2-team teasers (or however number of teams in the play), you can take totals in there, not only the teams themselves. And remember, the more picks you add the more it will pay, but it will also be harder to hit."
        },
        {
          "headline":"Decide how many points you want in your teaser.",
          "description":"Again, rules will vary, but most sportsbooks offer regular teasers with points going from 6, 6.5 or 7 points in football (with the corresponding 4, 4.5, and 5 points in basketball). This works like this:You would make a three-team regular teaser, 7 points in football, 5 points in basketball. This is done automatically, if you take a 7 pointer in football, it will be a 5 pointer in basketball. A 6.5 pointer in football will be a 4.5 pointer in basketball and a 6 pointer in football would be a 4 pointer in basketball. You can\u2019t mix and match."
        },
        {
          "headline":"Pick your teams and totals.",
          "description":"You can take a teaser with only teams-to-win, or combined with totals. It\u2019s not unusual for gamblers to take four-team teasers with both sides of the same game, accompanied with the over and under the teased total. Although it is more common in the larger special teasers.Take a look at this comparison between a 3-team parlay and a 3-team teaser, notice how the lines and the payout differ:3-team Parlay $100/600Titans +11 -110Ravens Over 41 -110Nets -4.5 -1103-team Regular Teaser $100/150 - 6.5 pts in football/4.5 pts in basketballTitans +17.5Ravens Over 34.5Nets +2"
        }
      ]
    },
    {
      "name":"Deciding on the amount",
      "steps":[
        {
          "headline":"Decide on an amount.",
          "description":"In a teaser your payout will be affected by two factors:a. How many picks you\u2019re taking. The bigger the teaser, the better the payout.b. How many points you\u2019re taking. The more points subtracted from your picks, the less the teaser pays."
        },
        {
          "headline":"Look at the options below and notice the difference in payouts:3-team regular teaser $100/170 - 6 pts in football/4 pts in basketballTitans +17Ravens Over 35Nets +1.53-team regular teaser $100/150 - 6.5 pts in football/4.5 pts in basketballTitans +17.5Ravens Over 34.5Nets +23-team regular teaser $100/130 - 7 pts in football/5 pts in basketballTitans +18Ravens Over 34Nets +2.5",
          "description":""
        }
      ]
    },
    {
      "name":"Placing the bet",
      "steps":[
        {
          "headline":"Make the bet.",
          "description":"Begin by telling the clerk what kind of play you want and the number of picks in it. To ask for the teaser in the middle column above, you\u2019d say: \u201cI want a three-team, six-and-a-half point teaser in football, four-and-a-half pointer in basketball.\u201d If you were asking for a teaser with only football teams, all you\u2019d have to say is \u201cI want a three-team, six-and-a-half point teaser.\u201d"
        },
        {
          "headline":"Give the clerk your picks.",
          "description":"It is not necessary to give the clerk the lines, for the example above you would say:\"With the Titans, Ravens over, and Nets.\u201d"
        },
        {
          "headline":"Give the clerk the amount you are willing to risk.",
          "description":"A simple \u201cfor twenty\u201d is enough to let the clerk know that you want to risk twenty dollars on this teaser. If you say nothing after listing your picks, the clerk will prompt you by asking \u201cfor how much?\u201d If you prefer, you can wait for this moment to give him or her your amount."
        },
        {
          "headline":"Listen to the read back.",
          "description":"The clerk will now ask you if you need anything else. If that\u2019s the only play you want to make, say \u201cno thank you\u201d. The clerk will proceed to give you the read back. Listen carefully and make sure you\u2019re taking the teams, the lines and the amount you wanted. If everything is in order, confirm your parlay by giving the clerk your account number and password one last time. The clerk will then thank you and end the call."
        },
        {
          "headline":"Enjoy the games!",
          "description":""
        }
      ]
    }
  ],
  "text":" Calling your sportsbook Call your favorite sportsbook. After the clerk\u2019s initial greeting ask:\nHow many points do their teasers offer in football? What about basketball? Up to how many picks can you take in a teaser? The more picks you take, the more it will pay. What happens with cancellations and ties? Will your teaser cancel, lose, win, or just turn into a smaller teaser with an adjusted payout? Once you have those questions answered, you're ready to move to the next steps, to call in a regular teaser bet. {\"smallUrl\":\"https:\\/\\/www.wikihow.com\\/images\\/thumb\\/d\\/d2\\/Make-a-Regular-Teaser-Step-2.jpg\\/v4-460px-Make-a-Regular-Teaser-Step-2.jpg\",\"bigUrl\":\"https:\\/\\/www.wikihow.com\\/images\\/thumb\\/d\\/d2\\/Make-a-Regular-Teaser-Step-2.jpg\\/v4-760px-Make-a-Regular-Teaser-Step-2.jpg\",\"smallWidth\":460,\"smallHeight\":345,\"bigWidth\":760,\"bigHeight\":570,\"licensing\":\"<div class=\\\"mw-parser-output\\\"><p>License: <a rel=\\\"nofollow\\\" class=\\\"external text\\\" href=\\\"https:\\/\\/creativecommons.org\\/licenses\\/by-nc-sa\\/3.0\\/\\\">Creative Commons<\\/a><br>\\n<\\/p><p><br \\/>\\n<\\/p><\\/div>\"} Give him or her your account number and password when you're ready to go ahead. Ask for the games you\u2019re interested in. You can make a two-team teaser with only one game, using the total and one of the teams. Or, you can even take both sides and play for the middle. You can also combine football and basketball together or professional and collegian leagues. So if you want to hear the complete board, ask for a rundown. Have a pen and the sports\u2019 schedule with you! Write the lines down. A complete rundown can vary anywhere between two lines to up to more than fifty in college football or basketball. You\u2019ll want to write the lines down to study them. Remember, you can only tease football and basketball. Deciding on picks, points, teams and totals Decide how many picks you want in your teaser. Most regular teasers go from two teams up to eight teams. It\u2019s important to point out that although they\u2019re called 2-team teasers (or however number of teams in the play), you can take totals in there, not only the teams themselves. And remember, the more picks you add the more it will pay, but it will also be harder to hit. Decide how many points you want in your teaser. Again, rules will vary, but most sportsbooks offer regular teasers with points going from 6, 6.5 or 7 points in football (with the corresponding 4, 4.5, and 5 points in basketball). This works like this:You would make a three-team regular teaser, 7 points in football, 5 points in basketball. This is done automatically, if you take a 7 pointer in football, it will be a 5 pointer in basketball. A 6.5 pointer in football will be a 4.5 pointer in basketball and a 6 pointer in football would be a 4 pointer in basketball. You can\u2019t mix and match. Pick your teams and totals. You can take a teaser with only teams-to-win, or combined with totals. It\u2019s not unusual for gamblers to take four-team teasers with both sides of the same game, accompanied with the over and under the teased total. Although it is more common in the larger special teasers.Take a look at this comparison between a 3-team parlay and a 3-team teaser, notice how the lines and the payout differ:3-team Parlay $100/600Titans +11 -110Ravens Over 41 -110Nets -4.5 -1103-team Regular Teaser $100/150 - 6.5 pts in football/4.5 pts in basketballTitans +17.5Ravens Over 34.5Nets +2 Deciding on the amount Decide on an amount. In a teaser your payout will be affected by two factors:a. How many picks you\u2019re taking. The bigger the teaser, the better the payout.b. How many points you\u2019re taking. The more points subtracted from your picks, the less the teaser pays. Look at the options below and notice the difference in payouts:3-team regular teaser $100/170 - 6 pts in football/4 pts in basketballTitans +17Ravens Over 35Nets +1.53-team regular teaser $100/150 - 6.5 pts in football/4.5 pts in basketballTitans +17.5Ravens Over 34.5Nets +23-team regular teaser $100/130 - 7 pts in football/5 pts in basketballTitans +18Ravens Over 34Nets +2.5  Placing the bet Make the bet. Begin by telling the clerk what kind of play you want and the number of picks in it. To ask for the teaser in the middle column above, you\u2019d say: \u201cI want a three-team, six-and-a-half point teaser in football, four-and-a-half pointer in basketball.\u201d If you were asking for a teaser with only football teams, all you\u2019d have to say is \u201cI want a three-team, six-and-a-half point teaser.\u201d Give the clerk your picks. It is not necessary to give the clerk the lines, for the example above you would say:\"With the Titans, Ravens over, and Nets.\u201d Give the clerk the amount you are willing to risk. A simple \u201cfor twenty\u201d is enough to let the clerk know that you want to risk twenty dollars on this teaser. If you say nothing after listing your picks, the clerk will prompt you by asking \u201cfor how much?\u201d If you prefer, you can wait for this moment to give him or her your amount. Listen to the read back. The clerk will now ask you if you need anything else. If that\u2019s the only play you want to make, say \u201cno thank you\u201d. The clerk will proceed to give you the read back. Listen carefully and make sure you\u2019re taking the teams, the lines and the amount you wanted. If everything is in order, confirm your parlay by giving the clerk your account number and password one last time. The clerk will then thank you and end the call. Enjoy the games! ",
  "tyn_model":[
    "clerk",
    "\u201ci",
    "\u201d if",
    "\u201d give",
    "\u201cfor",
    "pen",
    "\u2019 schedule",
    "titans",
    "ravens",
    "\u201d is",
    "\u201cno",
    "\u201d."
  ],
  "tyn_section":[

  ]
}