{
  "title":"How to Make Shenandoah Apple Cake",
  "url":"https://www.wikihow.com/Make-Shenandoah-Apple-Cake",
  "category_hierarchy":[
    "Food and Entertaining",
    "Recipes",
    "Baking",
    "Cakes",
    "Fruit Cakes"
  ],
  "parts":[
    {
      "name":"Making the Cake",
      "steps":[
        {
          "headline":"Preheat the oven to 350\u00baF/180\u00baC.",
          "description":""
        },
        {
          "headline":"Rinse and dice the apples.",
          "description":"Size needn't be exact, but don't have the pieces terribly large."
        },
        {
          "headline":"Grease and lightly flour the baking pan.",
          "description":"To do this, spray-grease the pan and then take a small handful of flour and coat the pan. Shake out excess flour. Alternatively, some bakers find that it works best to line the pan with wax paper and grease the wax paper."
        },
        {
          "headline":"Beat together the oil, sugar, eggs, and vanilla extract in the mixing bowl.",
          "description":""
        },
        {
          "headline":"Sift together the flour, salt, and baking soda into a separate bowl.",
          "description":""
        },
        {
          "headline":"Mix the dry ingredients into the wet mixture until thoroughly combined.",
          "description":""
        },
        {
          "headline":"Stir in the diced apples while using the large spoon.",
          "description":""
        },
        {
          "headline":"Pour the batter into prepared pan.",
          "description":"Bake 350\u00ba for 60 minutes."
        }
      ]
    },
    {
      "name":"Making the Frosting",
      "steps":[
        {
          "headline":"Wait until the cake is done baking.",
          "description":"Meanwhile you can gather the ingredients!"
        },
        {
          "headline":"Add the frosting ingredients to a pan and boil for three minutes, stirring occasionally.",
          "description":"Hurry and move on to the next step while the frosting is heating!"
        }
      ]
    },
    {
      "name":"Applying the Frosting",
      "steps":[
        {
          "headline":"While the frosting is boiling, poke holes in the baked cake using a skewer.",
          "description":"The more holes, the more the cake will be saturated with delicious frosting!"
        },
        {
          "headline":"Pour the frosting over the cake as soon as the frosting has boiled for three minutes.",
          "description":"Carefully tilt the cake pan or use a spatula to ensure full-coverage of the cake."
        },
        {
          "headline":"Finished!",
          "description":"Shenandoah Apple Cake tastes great either warm or chilled, and especially when served with vanilla ice cream. To store, simply cover and refrigerate. These cakes have a long fridge-life, and taste even better the second day!"
        }
      ]
    }
  ],
  "text":" Making the Cake Preheat the oven to 350\u00baF/180\u00baC.  Rinse and dice the apples. Size needn't be exact, but don't have the pieces terribly large. Grease and lightly flour the baking pan. To do this, spray-grease the pan and then take a small handful of flour and coat the pan. Shake out excess flour. Alternatively, some bakers find that it works best to line the pan with wax paper and grease the wax paper. Beat together the oil, sugar, eggs, and vanilla extract in the mixing bowl.  Sift together the flour, salt, and baking soda into a separate bowl.  Mix the dry ingredients into the wet mixture until thoroughly combined.  Stir in the diced apples while using the large spoon.  Pour the batter into prepared pan. Bake 350\u00ba for 60 minutes. Making the Frosting Wait until the cake is done baking. Meanwhile you can gather the ingredients! Add the frosting ingredients to a pan and boil for three minutes, stirring occasionally. Hurry and move on to the next step while the frosting is heating! Applying the Frosting While the frosting is boiling, poke holes in the baked cake using a skewer. The more holes, the more the cake will be saturated with delicious frosting! Pour the frosting over the cake as soon as the frosting has boiled for three minutes. Carefully tilt the cake pan or use a spatula to ensure full-coverage of the cake. Finished! Shenandoah Apple Cake tastes great either warm or chilled, and especially when served with vanilla ice cream. To store, simply cover and refrigerate. These cakes have a long fridge-life, and taste even better the second day!",
  "tyn_model":[
    "flour",
    "apples",
    "wax paper",
    "oven",
    "baking pan",
    "oil",
    "sugar",
    "eggs",
    "vanilla extract",
    "mixing bowl",
    "salt",
    "baking soda",
    "large spoon",
    "skewer",
    "cake pan",
    "spatula",
    "vanilla ice cream"
  ],
  "tyn_section":[

  ]
}