{
  "title":"How to Avoid Video Game Addiction",
  "url":"https://www.wikihow.com/Avoid-Video-Game-Addiction",
  "category_hierarchy":[
    "Hobbies and Crafts",
    "Games",
    "Video Games",
    "Electronic Game Strategies",
    "Gaming Addictions"
  ],
  "methods":[
    {
      "name":"Steps",
      "steps":[
        {
          "headline":"Accept responsibility.",
          "description":"The problem lies within the individual, not within the game. No attempt at beating 'addiction' can succeed until the individual accepts its existence. It is not the existence of video games, nor the content of games, but the person who chooses to play them."
        },
        {
          "headline":"Identify the impact.",
          "description":"How many hours a day do you spend playing games? Do you normally go out on the weekend? When was the last time you read a book? Identifying the negative impacts of the addiction will help you focus on positive improvements and getting back the things that you really are missing."
        },
        {
          "headline":"Avoid blame.",
          "description":"Blaming others for problems that you alone must face does not solve the problems. The 'gaming industry' or manufacturers are not the cause of this problem, and blaming them does not make the problem better. The vast, extreme majority of 'gamers' are healthy individuals, accepting responsibility is the first step.Also , do not make excuses : take responsibility."
        },
        {
          "headline":"Stay positive.",
          "description":"While it is important to identify the negative aspects of the problem, it is also important to focus on the goal and progress that you have made."
        },
        {
          "headline":"Set limits.",
          "description":"If you decide that you have one hour per day to spend playing games, stick to that. Choose your games correctly! If you are playing a game that requires many hours of gameplay between saves or which is an open-ended game like many MMOs, you likely should consider a different game or different genre of games."
        },
        {
          "headline":"Monitor your child's video game time.",
          "description":"You are the parent, and thus you are in control. If your children do not listen to you, removal of the game console or setting of administrative control on the computer may allow you to better handle the problem."
        },
        {
          "headline":"Look in your drawer of CDs.",
          "description":"Are there more than 5 games that you have played in the last two months? Are these games open-ended (like Civilization, World of Warcraft, or Evil Genius)? This could be a warning sign."
        },
        {
          "headline":"Add up the total hours played per week.",
          "description":"This includes time spent reading walkthroughs and watching videos and discussing games in real life. Always round up! If this number is over 25, then there may be a problem."
        },
        {
          "headline":"Request that your parents put you on a strict time limit for computer playing.",
          "description":"There are freeware programs available for download that can help with this. Playing hide-and-go-seek with your parents (hiding your games) is an effective way to minimize gaming overall."
        },
        {
          "headline":"Find something else to do.",
          "description":"You know the statement \"my anti-drug...\" This statement is better phrased \"my anti-addiction...\" or \"my anti-bad habit...\" The best way to do this is to develop a variety of other things to do, with others."
        }
      ]
    },
    {
      "name":"Friends",
      "steps":[
        {
          "headline":"Count how many games you play and how long you are playing them.",
          "description":""
        },
        {
          "headline":"Fix the problem by finding friends or spending more time with the ones you have.",
          "description":""
        },
        {
          "headline":"Step two could be hard for certain people.",
          "description":"If you can't, ask a teacher or a parent. If there isn't one available, do it on your own."
        },
        {
          "headline":"Find games to do outside.",
          "description":"Play with your friends."
        },
        {
          "headline":"Go get a book at the library.",
          "description":"Read together."
        },
        {
          "headline":"Do puzzles that could help your mind.",
          "description":"Have contests with your friends."
        },
        {
          "headline":"Come up with new fun games together and stay healthy.",
          "description":""
        }
      ]
    }
  ],
  "text":" Steps Accept responsibility. The problem lies within the individual, not within the game. No attempt at beating 'addiction' can succeed until the individual accepts its existence. It is not the existence of video games, nor the content of games, but the person who chooses to play them. Identify the impact. How many hours a day do you spend playing games? Do you normally go out on the weekend? When was the last time you read a book? Identifying the negative impacts of the addiction will help you focus on positive improvements and getting back the things that you really are missing. Avoid blame. Blaming others for problems that you alone must face does not solve the problems. The 'gaming industry' or manufacturers are not the cause of this problem, and blaming them does not make the problem better. The vast, extreme majority of 'gamers' are healthy individuals, accepting responsibility is the first step.Also , do not make excuses : take responsibility. Stay positive. While it is important to identify the negative aspects of the problem, it is also important to focus on the goal and progress that you have made. Set limits. If you decide that you have one hour per day to spend playing games, stick to that. Choose your games correctly! If you are playing a game that requires many hours of gameplay between saves or which is an open-ended game like many MMOs, you likely should consider a different game or different genre of games. Monitor your child's video game time. You are the parent, and thus you are in control. If your children do not listen to you, removal of the game console or setting of administrative control on the computer may allow you to better handle the problem. Look in your drawer of CDs. Are there more than 5 games that you have played in the last two months? Are these games open-ended (like Civilization, World of Warcraft, or Evil Genius)? This could be a warning sign. Add up the total hours played per week. This includes time spent reading walkthroughs and watching videos and discussing games in real life. Always round up! If this number is over 25, then there may be a problem. Request that your parents put you on a strict time limit for computer playing. There are freeware programs available for download that can help with this. Playing hide-and-go-seek with your parents (hiding your games) is an effective way to minimize gaming overall. Find something else to do. You know the statement \"my anti-drug...\" This statement is better phrased \"my anti-addiction...\" or \"my anti-bad habit...\" The best way to do this is to develop a variety of other things to do, with others. Friends Count how many games you play and how long you are playing them.  Fix the problem by finding friends or spending more time with the ones you have.  Step two could be hard for certain people. If you can't, ask a teacher or a parent. If there isn't one available, do it on your own. Find games to do outside. Play with your friends. Go get a book at the library. Read together. Do puzzles that could help your mind. Have contests with your friends. Come up with new fun games together and stay healthy. ",
  "tyn_model":[
    "games",
    "video games",
    "video game",
    "cds",
    "civilization"
  ],
  "tyn_section":[

  ]
}