{
  "title":"How to Connect Your Xbox One to the Internet",
  "url":"https://www.wikihow.com/Connect-Your-Xbox-One-to-the-Internet",
  "category_hierarchy":[
    "Hobbies and Crafts",
    "Games",
    "Video Games",
    "Xbox",
    "Xbox One"
  ],
  "methods":[
    {
      "name":"Wired Connection",
      "steps":[
        {
          "headline":"Get an Ethernet cable.",
          "description":"You will need to have an Ethernet cable to connect your Xbox One to your Internet source. Consider the length of your cable and the distance of your console from your Internet source: you don't want to get one that is too short! Your Xbox may come with a cable included, but otherwise you will need to purchase one. Currently, Xbox Ones do not ship with a cable."
        },
        {
          "headline":"Connect the Ethernet cable to your LAN port.",
          "description":"At the back of the Xbox One, at the lower right corner beside the infrared output, you will find your console\u2019s LAN port. This is where you\u2019re going to connect your Ethernet cable."
        },
        {
          "headline":"Connect the Ethernet cable to your Internet source.",
          "description":"The other end of the Ethernet cable goes directly to your internet source. Remember, your Internet source could be your router or your modem itself. It may also be an Ethernet wall jack."
        },
        {
          "headline":"Turn your console on.",
          "description":"After setting up your wired connection, you can now turn on your Xbox One. The initial boot should already give you access to the Internet. You can turn on your console by pressing the Home button on your Xbox One controller. Xbox One added a voice recognition feature that wakes your console by just saying \u201cXbox On\u201d. The Xbox One Kinect can also identify you through biometric scanning by which it automatically logs in a user via face recognition."
        }
      ]
    },
    {
      "name":"Wireless Connection",
      "steps":[
        {
          "headline":"Access Wi-Fi.",
          "description":"Just like the Xbox 360 Slim, Xbox One can easily access the Internet wirelessly in an instant! It has a built in Wi-Fi 802.11n Wi-Fi Direct that allows it to connect to your router automatically."
        },
        {
          "headline":"Turn your console on.",
          "description":"The first time you turn on your console, it will not yet automatically connect to the Internet since it hasn\u2019t memorized your router\u2019s access name and codes yet."
        },
        {
          "headline":"Choose your signal.",
          "description":"In the Network menu, Xbox One will display all the Wi-Fi hotspots within its signal\u2019s reach. Once the Xbox One detects your router in the Network, select it and you will be able to access the Internet. You may have to enter your router\u2019s password first, depending on your router\u2019s security settings. Xbox One will now remember this wireless setup and use it automatically on your following sessions. If you have an Ethernet cable connected to your console, it will automatically go into \u201cwired\u201d Internet connection mode. If you want to stay connected wirelessly just disconnect the Ethernet cable from your unit. You may need to adjust your console\u2019s wireless configuration setting if your console fails to connect to the Internet. When in doubt, set everything to automatic or simply reset to default."
        }
      ]
    }
  ],
  "text":" Wired Connection Get an Ethernet cable. You will need to have an Ethernet cable to connect your Xbox One to your Internet source. Consider the length of your cable and the distance of your console from your Internet source: you don't want to get one that is too short! Your Xbox may come with a cable included, but otherwise you will need to purchase one. Currently, Xbox Ones do not ship with a cable. Connect the Ethernet cable to your LAN port. At the back of the Xbox One, at the lower right corner beside the infrared output, you will find your console\u2019s LAN port. This is where you\u2019re going to connect your Ethernet cable. Connect the Ethernet cable to your Internet source. The other end of the Ethernet cable goes directly to your internet source. Remember, your Internet source could be your router or your modem itself. It may also be an Ethernet wall jack. Turn your console on. After setting up your wired connection, you can now turn on your Xbox One. The initial boot should already give you access to the Internet. You can turn on your console by pressing the Home button on your Xbox One controller. Xbox One added a voice recognition feature that wakes your console by just saying \u201cXbox On\u201d. The Xbox One Kinect can also identify you through biometric scanning by which it automatically logs in a user via face recognition. Wireless Connection Access Wi-Fi. Just like the Xbox 360 Slim, Xbox One can easily access the Internet wirelessly in an instant! It has a built in Wi-Fi 802.11n Wi-Fi Direct that allows it to connect to your router automatically. Turn your console on. The first time you turn on your console, it will not yet automatically connect to the Internet since it hasn\u2019t memorized your router\u2019s access name and codes yet. Choose your signal. In the Network menu, Xbox One will display all the Wi-Fi hotspots within its signal\u2019s reach. Once the Xbox One detects your router in the Network, select it and you will be able to access the Internet. You may have to enter your router\u2019s password first, depending on your router\u2019s security settings. Xbox One will now remember this wireless setup and use it automatically on your following sessions. If you have an Ethernet cable connected to your console, it will automatically go into \u201cwired\u201d Internet connection mode. If you want to stay connected wirelessly just disconnect the Ethernet cable from your unit. You may need to adjust your console\u2019s wireless configuration setting if your console fails to connect to the Internet. When in doubt, set everything to automatic or simply reset to default.",
  "tyn_model":[
    "xbox one",
    "ethernet cable",
    "console",
    "cable",
    "xbox",
    "xbox ones",
    "router",
    "ethernet wall jack",
    "xbox one controller",
    "\u201cxbox",
    "\u201d.",
    "xbox one kinect",
    "\u201cwired",
    "\u201d internet"
  ],
  "tyn_section":[

  ]
}