{
  "title":"How to Make Mint Tea",
  "url":"https://www.wikihow.com/Make-Mint-Tea",
  "category_hierarchy":[
    "Food and Entertaining",
    "Drinks",
    "Tea",
    "Herbal Tea",
    "Mint Tea"
  ],
  "methods":[
    {
      "name":"Making Hot Mint Tea",
      "steps":[
        {
          "headline":"Boil the water.",
          "description":"This can be done in a kettle, over a fire, in a pot on the stove, in the microwave, or any other way you typically boil water. To conserve water, energy, time, and money, only boil as much water as you\u2019re going to use in your tea."
        },
        {
          "headline":"Wash and tear the mint leaves.",
          "description":"Rinse them to remove any residual dirt, bugs, or soil that may be on the leaves. Then, tear the leaves to help them release their aromas and give your tea a stronger flavor. There are a variety of mint leaves you can use, including chocolate mint, spearmint, and peppermint."
        },
        {
          "headline":"Prepare the leaves.",
          "description":"The mint leaves can go into a tea ball, a teapot designed for loose leaf tea, into a coffee filter, in a French press, or straight into a mug."
        },
        {
          "headline":"Pour the boiling water over the leaves.",
          "description":"Some teas should be done at different temperatures, so you don\u2019t burn the leaves, but mint is hardy, and you can pour fully boiling water right over the leaves."
        },
        {
          "headline":"Steep the tea.",
          "description":"Mint tea should steep for five to 10 minutes, but longer is fine if you want a stronger tea. Once your tea reaches the strength you like (either take a taste or go by the smell), remove the leaves. You can also leave the leaves in, and the tea will continue to get stronger. Use a strainer if desired to remove the loose leaves if you didn\u2019t use a tea ball or special pot. If you\u2019re using a French press, push the plunger down when the tea has reached the desired strength."
        },
        {
          "headline":"Add additional ingredients.",
          "description":"Once your tea has steeped, you can add honey or sweetener if you desire, or a splash of lemon before you drink it."
        }
      ]
    },
    {
      "name":"Making Iced Mint Tea",
      "steps":[
        {
          "headline":"Make your mint tea.",
          "description":"Using the ratio for a larger batch, make your hot mint tea. Just place the mint leaves in a large heat-safe bowl and pour the boiling water directly over the top. Allow to steep. To make a single serving, use the same mint\u2013water ratio and method as you would for a mug of hot mint tea."
        },
        {
          "headline":"Stir in sweetener and lemon.",
          "description":"Once the tea is ready, squeeze the lemon juice into the tea, making sure you don\u2019t get any seeds in the tea. Add your sweetener of choice, to taste, if you want sweet tea. Stir vigorously to break down the sugar particles. Agave nectar also works well as a liquid sweetener and honey substitute."
        },
        {
          "headline":"Let the tea cool to room temperature.",
          "description":"Once it\u2019s cool, strain the tea into a pitcher and discard the used mint leaves. Refrigerate until it\u2019s cold."
        },
        {
          "headline":"Serve over ice with cucumber.",
          "description":"When the tea has chilled, and you are ready to serve it, fill your glasses with ice. Thinly slice a cucumber and add a few slices to each glass. Pour the tea and enjoy."
        }
      ]
    },
    {
      "name":"Making Moroccan Mint Tea",
      "steps":[
        {
          "headline":"Rinse the tea leaves.",
          "description":"Place the green tea in a teapot and add one cup of boiling water. Swirl the water to rinse the leaves and warm the pot. Pour out the water, leaving the green tea leaves in the teapot."
        },
        {
          "headline":"Steep the tea.",
          "description":"Add four cups of boiling water to the teapot and steep the tea for two minutes."
        },
        {
          "headline":"Add sugar and mint.",
          "description":"Steep for an additional four minutes, or to taste, and serve."
        }
      ]
    },
    {
      "name":"Preserving Fresh Mint",
      "steps":[
        {
          "headline":"Freeze your mint leaves in an ice cube tray.",
          "description":"Leftover mint from the store or garden can be preserved for later use. To freeze your mint, place two washed mint leaves in each basin of an ice cube tray. Fill each with water. Freeze them until you\u2019re ready to use the mint. Once the mint cubes have frozen, remove them from the tray and place them in a plastic bag in the freezer. (Now you have your ice cube tray back!) When it\u2019s time to use your mint, pull the ice cubes out of the freezer (as many as you need for how much mint you require) and place them in a bowl to thaw. When the ice has thawed, drain the water and pat the mint dry."
        },
        {
          "headline":"Dry your mint.",
          "description":"Dried mint can be used to make teas, and can even be put into the reusable cups for single-serve coffee machines. Take the fresh sprigs of mint and loosely bundle a couple together with elastic bands. Hang them upside down somewhere warm and dry until the leaves are dry and brittle. Mint contains more moisture than some other herbs, which means it can take anywhere from a few days to a couple of weeks to dry, depending on the climate. The warmer and dryer the room you use for drying, the less time the process will take. When the leaves are dry, place them in a bag or between sheets of wax paper and break them up. Store in a spice jar."
        }
      ]
    }
  ],
  "text":" Making Hot Mint Tea Boil the water. This can be done in a kettle, over a fire, in a pot on the stove, in the microwave, or any other way you typically boil water. To conserve water, energy, time, and money, only boil as much water as you\u2019re going to use in your tea. Wash and tear the mint leaves. Rinse them to remove any residual dirt, bugs, or soil that may be on the leaves. Then, tear the leaves to help them release their aromas and give your tea a stronger flavor. There are a variety of mint leaves you can use, including chocolate mint, spearmint, and peppermint. Prepare the leaves. The mint leaves can go into a tea ball, a teapot designed for loose leaf tea, into a coffee filter, in a French press, or straight into a mug. Pour the boiling water over the leaves. Some teas should be done at different temperatures, so you don\u2019t burn the leaves, but mint is hardy, and you can pour fully boiling water right over the leaves. Steep the tea. Mint tea should steep for five to 10 minutes, but longer is fine if you want a stronger tea. Once your tea reaches the strength you like (either take a taste or go by the smell), remove the leaves. You can also leave the leaves in, and the tea will continue to get stronger. Use a strainer if desired to remove the loose leaves if you didn\u2019t use a tea ball or special pot. If you\u2019re using a French press, push the plunger down when the tea has reached the desired strength. Add additional ingredients. Once your tea has steeped, you can add honey or sweetener if you desire, or a splash of lemon before you drink it. Making Iced Mint Tea Make your mint tea. Using the ratio for a larger batch, make your hot mint tea. Just place the mint leaves in a large heat-safe bowl and pour the boiling water directly over the top. Allow to steep. To make a single serving, use the same mint\u2013water ratio and method as you would for a mug of hot mint tea. Stir in sweetener and lemon. Once the tea is ready, squeeze the lemon juice into the tea, making sure you don\u2019t get any seeds in the tea. Add your sweetener of choice, to taste, if you want sweet tea. Stir vigorously to break down the sugar particles. Agave nectar also works well as a liquid sweetener and honey substitute. Let the tea cool to room temperature. Once it\u2019s cool, strain the tea into a pitcher and discard the used mint leaves. Refrigerate until it\u2019s cold. Serve over ice with cucumber. When the tea has chilled, and you are ready to serve it, fill your glasses with ice. Thinly slice a cucumber and add a few slices to each glass. Pour the tea and enjoy. Making Moroccan Mint Tea Rinse the tea leaves. Place the green tea in a teapot and add one cup of boiling water. Swirl the water to rinse the leaves and warm the pot. Pour out the water, leaving the green tea leaves in the teapot. Steep the tea. Add four cups of boiling water to the teapot and steep the tea for two minutes. Add sugar and mint. Steep for an additional four minutes, or to taste, and serve. Preserving Fresh Mint Freeze your mint leaves in an ice cube tray. Leftover mint from the store or garden can be preserved for later use. To freeze your mint, place two washed mint leaves in each basin of an ice cube tray. Fill each with water. Freeze them until you\u2019re ready to use the mint. Once the mint cubes have frozen, remove them from the tray and place them in a plastic bag in the freezer. (Now you have your ice cube tray back!) When it\u2019s time to use your mint, pull the ice cubes out of the freezer (as many as you need for how much mint you require) and place them in a bowl to thaw. When the ice has thawed, drain the water and pat the mint dry. Dry your mint. Dried mint can be used to make teas, and can even be put into the reusable cups for single-serve coffee machines. Take the fresh sprigs of mint and loosely bundle a couple together with elastic bands. Hang them upside down somewhere warm and dry until the leaves are dry and brittle. Mint contains more moisture than some other herbs, which means it can take anywhere from a few days to a couple of weeks to dry, depending on the climate. The warmer and dryer the room you use for drying, the less time the process will take. When the leaves are dry, place them in a bag or between sheets of wax paper and break them up. Store in a spice jar.",
  "tyn_model":[
    "water",
    "mint",
    "teapot",
    "lemon",
    "ice",
    "ice cube tray",
    "tea ball",
    "french press",
    "sweetener",
    "cucumber",
    "tea",
    "freezer",
    "microwave",
    "coffee filter",
    "mug",
    "mint tea",
    "strainer",
    "iced mint tea",
    "\u2013water",
    "sweet tea",
    "agave nectar",
    "pitcher",
    "moroccan mint tea",
    "green tea",
    "pot",
    "boiling water",
    "sugar",
    "tray",
    "plastic bag",
    "ice cubes",
    "bowl",
    "herbs",
    "wax paper",
    "spice jar"
  ],
  "tyn_section":[

  ]
}