{
  "title":"How to Share Games on the PlayStation 4",
  "url":"https://www.wikihow.com/Share-Games-on-the-PlayStation-4",
  "category_hierarchy":[
    "Hobbies and Crafts",
    "Games",
    "Video Games",
    "PlayStation Video Game Consoles",
    "PlayStation 4"
  ],
  "parts":[
    {
      "name":"Deactivating the PS4 Systems",
      "steps":[
        {
          "headline":"Open the Settings menu on your PS4.",
          "description":"Press Up on PS4 main menu and then scroll to the right to find the Settings option. You'll be deactivating your own PS4 as your primary console and instead signing in on the second PS4. This will allow the second PS4 to access all of your purchases, and you'll still be able to access them on the primary PS4. When the owner of the second PS4 does the same on yours, you'll have access to all of their purchases as well."
        },
        {
          "headline":"Select \"PlayStation Network/Account Management.\"",
          "description":"This will open your account settings."
        },
        {
          "headline":"Select \"Activate as Your Primary PS4.\"",
          "description":"A new menu will appear."
        },
        {
          "headline":"Select \"Deactivate.\"",
          "description":"This will make the PS4 console no longer your \"home\" console, which will allow you to make your friend's console your primary."
        },
        {
          "headline":"Have your friend deactivate their PS4.",
          "description":"Follow the steps above on the second PS4 to ensure that there is no active primary account. Only one primary account is allowed per system."
        }
      ]
    },
    {
      "name":"Activating Your PS4s with Each Other's Accounts",
      "steps":[
        {
          "headline":"Log out on the second PS4.",
          "description":"Log out of the current account by holding the PS button on the controller and then selecting \"Power Options\" \u2192 \"Log Out.\" Before you can make your account primary on your friend's PS4, you'll need to sign in with your own account."
        },
        {
          "headline":"Select \"New User\" on the login screen.",
          "description":"This will let you create a new user on that system"
        },
        {
          "headline":"Select \"Create a User.\"",
          "description":"This will let you log in with your PSN account. You'll need to accept the terms first."
        },
        {
          "headline":"Log in with your PSN account.",
          "description":"You'll be logging on with your account on the second PS4."
        },
        {
          "headline":"Open the Settings menu while logged in with your account.",
          "description":"Once you're logged in, open the PS4's Settings menu."
        },
        {
          "headline":"Select \"PlayStation Network/Account Management.\"",
          "description":"This menu will allow you to set this PS4 as your primary console, giving your friend access to your games."
        },
        {
          "headline":"Select \"Activate as Your Primary PS4\" and then \"Activate.\"",
          "description":"This will make your account the primary account."
        },
        {
          "headline":"Repeat the process with your friend's account on your PS4.",
          "description":"This will make your PS4 their primary system, and their PS4 will be your primary system."
        }
      ]
    },
    {
      "name":"Accessing Games",
      "steps":[
        {
          "headline":"Sign into your own account on your own PS4.",
          "description":"Even though it's not your primary console anymore, you can still sign in with your PSN account. This will give you access to all of your own games from the Library on your account."
        },
        {
          "headline":"Make sure you have an internet connection.",
          "description":"The one caveat to game sharing is that you'll need an active internet connection in order to play your own games. This is because your PS4 is no longer your primary PS4, so you need to connect to Sony to authorize your games."
        },
        {
          "headline":"Set your purchased games to download from the webstore.",
          "description":"This will allow you to send games to each other's PS4s. When your friend purchases a digital game, they can set it to download from the PSN webstore. This will send it to your PS4, since your PS4 is set as their primary console. Once the game has downloaded, you'll be able to play it with your own account. This will work in the opposite direction as well. Games that you purchase and set to download from the webstore will download to your friend's PS4."
        },
        {
          "headline":"Download your own purchases through the Library.",
          "description":"Any purchases that you've made with your own account will be accessible in the Library. Select the game you want to play and click \"Download\" to begin downloading it to your own console."
        },
        {
          "headline":"Share your PS+ membership.",
          "description":"If you have PS+ subscription, your friend will be able to play online because their PS4 is set as your primary. You'll be able to play online as well when you're signed in on your own console. In fact, you can both be playing the same game together that only one of you bought with just one person's PS+ subscription. The other person will only get the online play benefits of your PS+ subscription. They will not be able to use cloud storage for their own saves unless they have their own PS+ account."
        }
      ]
    }
  ],
  "text":" Deactivating the PS4 Systems Open the Settings menu on your PS4. Press Up on PS4 main menu and then scroll to the right to find the Settings option. You'll be deactivating your own PS4 as your primary console and instead signing in on the second PS4. This will allow the second PS4 to access all of your purchases, and you'll still be able to access them on the primary PS4. When the owner of the second PS4 does the same on yours, you'll have access to all of their purchases as well. Select \"PlayStation Network/Account Management.\" This will open your account settings. Select \"Activate as Your Primary PS4.\" A new menu will appear. Select \"Deactivate.\" This will make the PS4 console no longer your \"home\" console, which will allow you to make your friend's console your primary. Have your friend deactivate their PS4. Follow the steps above on the second PS4 to ensure that there is no active primary account. Only one primary account is allowed per system. Activating Your PS4s with Each Other's Accounts Log out on the second PS4. Log out of the current account by holding the PS button on the controller and then selecting \"Power Options\" \u2192 \"Log Out.\" Before you can make your account primary on your friend's PS4, you'll need to sign in with your own account. Select \"New User\" on the login screen. This will let you create a new user on that system Select \"Create a User.\" This will let you log in with your PSN account. You'll need to accept the terms first. Log in with your PSN account. You'll be logging on with your account on the second PS4. Open the Settings menu while logged in with your account. Once you're logged in, open the PS4's Settings menu. Select \"PlayStation Network/Account Management.\" This menu will allow you to set this PS4 as your primary console, giving your friend access to your games. Select \"Activate as Your Primary PS4\" and then \"Activate.\" This will make your account the primary account. Repeat the process with your friend's account on your PS4. This will make your PS4 their primary system, and their PS4 will be your primary system. Accessing Games Sign into your own account on your own PS4. Even though it's not your primary console anymore, you can still sign in with your PSN account. This will give you access to all of your own games from the Library on your account. Make sure you have an internet connection. The one caveat to game sharing is that you'll need an active internet connection in order to play your own games. This is because your PS4 is no longer your primary PS4, so you need to connect to Sony to authorize your games. Set your purchased games to download from the webstore. This will allow you to send games to each other's PS4s. When your friend purchases a digital game, they can set it to download from the PSN webstore. This will send it to your PS4, since your PS4 is set as their primary console. Once the game has downloaded, you'll be able to play it with your own account. This will work in the opposite direction as well. Games that you purchase and set to download from the webstore will download to your friend's PS4. Download your own purchases through the Library. Any purchases that you've made with your own account will be accessible in the Library. Select the game you want to play and click \"Download\" to begin downloading it to your own console. Share your PS+ membership. If you have PS+ subscription, your friend will be able to play online because their PS4 is set as your primary. You'll be able to play online as well when you're signed in on your own console. In fact, you can both be playing the same game together that only one of you bought with just one person's PS+ subscription. The other person will only get the online play benefits of your PS+ subscription. They will not be able to use cloud storage for their own saves unless they have their own PS+ account.",
  "tyn_model":[
    "ps4",
    "console",
    "games",
    "playstation network",
    "ps4 console",
    "\u2192 \"",
    "playstation network/account management",
    "psn"
  ],
  "tyn_section":[

  ]
}