{
  "title":"How to Play Monopoly Empire",
  "url":"https://www.wikihow.com/Play-Monopoly-Empire",
  "category_hierarchy":[
    "Hobbies and Crafts",
    "Games",
    "Board Games",
    "Resource Management Board Games",
    "Monopoly"
  ],
  "parts":[
    {
      "name":"Setting Up the Game",
      "steps":[
        {
          "headline":"Check the game components.",
          "description":"Before you start setting up your game of Monopoly Empire, you may want to check the game components to ensure that you have everything. Checking the game components will also help you to become more familiar with the game pieces and board. You should have:\na Monopoly Empire board\n4 Towers\n6 game tokens\n30 Billboard tiles\n6 Office tiles\n14 Chance cards\n14 Empire cards\nMonopoly money\n2 dice"
        },
        {
          "headline":"Unfold the board and place it on your playing surface.",
          "description":"After you have checked your game components to make sure that you have everything you need to play, you can set up your game board. Unfold the board and place it on a table, the floor, or wherever you plan to play the game. Make sure that you place the board somewhere that all of the players have easy access to the board."
        },
        {
          "headline":"Shuffle the cards and place them on the board.",
          "description":"Shuffle the deck of Chance cards and the deck of Empire cards and place them in their designated spots on the board. The Chance cards are similar to the Chance cards used in regular Monopoly. The Empire cards are similar to the Community Chest cards in Monopoly, which often give you advantages that may help you win the game. You will get two Empire cards at the beginning of the game."
        },
        {
          "headline":"Sort the brand billboard tiles on their places on the board.",
          "description":"The brand billboard tiles have specific places all around the game board. Look for these spaces and match the billboard tile to the billboard space. For example, the Coca-Cola billboard tile should go on the Coca-Cola billboard space. You will be competing against your fellow players to obtain these tiles and fill up your tower first."
        },
        {
          "headline":"Place the Water Works and Electric Company tiles on the board as well.",
          "description":"The Water Works and Electric Company tiles have a specific spaces on the board where you should place those tiles until someone purchases them. There is one space for all four of the Water Works tiles and one space for all four of the Electric Company tiles."
        },
        {
          "headline":"Leave the six office tiles and the dice off of the board.",
          "description":"The only tiles that you do not place on the board are the six office tiles. Leave these tiles off of the board along with the dice. You can put them off to the side or have someone be in charge of them."
        },
        {
          "headline":"Choose a player to be the banker.",
          "description":"The banker is in charge of handling transactions, managing auctions, giving players money when they pass \u201cGO,\u201d and collecting fees and fines. Make sure that the person you choose to be the banker is willing and able to perform all of these tasks. Have the banker give everyone $1000 to start the game (one $500, four $100s, and two $50s)."
        },
        {
          "headline":"Give everyone two empire cards and one tower.",
          "description":"Everyone starts the game with two Empire cards. Look at them, but don\u2019t share them you\u2019re your fellow players. Wait until your turn to use them. Each player will also need a tower. The object of the game is to be the first one to fill up your tower with billboards."
        },
        {
          "headline":"Have players select their tokens and place them on \u201cGO.\u201d Once everything else is set up, you can have players choose their game tokens and place them on the board.",
          "description":"The game tokens in Monopoly Empire include a game controller, racecar, coke bottle, film slate, motorcycle, and French fries."
        }
      ]
    },
    {
      "name":"Playing the Game",
      "steps":[
        {
          "headline":"Understand the object of the game.",
          "description":"In Monopoly Empire, the first player to fill up his or her billboard with brand billboards wins the game. Therefore, you want to buy as many brand billboards as quickly as you can to fill up the spaces in your board. When other players land on billboard spaces that you own, they will have to pay you the amount of money you\u2019re your billboard height reaches on your tower. If a player runs out of money, they do not go bankrupt as in regular Monopoly. That player simply takes the top billboard piece from his or her tower and gives it to the player who requires it."
        },
        {
          "headline":"Decide who will go first.",
          "description":"Before you start the game, decide who will go first. The official rules for Monopoly Empire state that the youngest player gets to go first. If you prefer, you can also determine who goes first by rolling the dice and seeing who gets the largest number. Follow a clockwise pattern for turns."
        },
        {
          "headline":"Take your turn.",
          "description":"When it is your turn to play, you will need to complete a specific set of actions. Perform these actions on every turn in the same order. Your turn will be a little different every time based on the space you land on. During your turn, perform each of the following actions:\nRoll the dice. Take two turns if you roll a double. For example, if you roll two sixes, then move 12 spaces and perform an action for that space. But then, roll again and move again and perform another action. Move your token the number of spaces you rolled. For example, if you roll a 10, then move 10 spaces\nPerform an action for the space you land on. For example, if you land on a billboard tile that is available for purchase, then you can purchase it."
        },
        {
          "headline":"Follow the instructions when you draw a Chance or Empire card.",
          "description":"Whenever you land on a Chance or Empire card space, you will get to draw one of these cards. In general, you will need to use Chance cards right away, but you can save Empire cards until you want or need to use them. For example, if you get a \u201cGet Out of Jail Free\u201d card, then you can hang onto it until you need it. Please note, there is no limit to the amount of Empire cards that can be played during a turn. For example, if someone plays a \"Just Say No\" card, the other opponent could also play a \"Just Say No\" card should they have one in their hand."
        },
        {
          "headline":"Bid on spaces that other players do not want.",
          "description":"If you happen to land on a billboard that you do not want to buy, then that tile will be up for auction. The banker is in charge of managing the auction and the bidding starts at $50. All follow-up bids must be in increments of $50, such as $100, $150, $200, $250, etc. The highest bidder gets the billboard and must pay the amount that he or she bid to the bank."
        },
        {
          "headline":"Use the sneaky swapper option on the dice.",
          "description":"If you roll the handshake icon on one of your dice rolls, then you can perform a sneaky swap as one of your turn actions. This means that you can exchange two topmost billboard tower tiles. For example, you can exchange your topmost billboard tile with another player\u2019s topmost billboard tile, or you can swap the tiles of two other players. Using the sneaky swap is optional. If you do not want to use it, just move your piece the number of spaces that that you rolled on the other die. If you do use the sneaky swap, then do not move this turn."
        },
        {
          "headline":"Keep playing until someone wins.",
          "description":"The player who fills his or her tower first wins the game. Keep playing until someone does so. Monopoly Empire takes about 90 minutes to play, but it may take longer for someone to win the game."
        }
      ]
    }
  ],
  "text":" Setting Up the Game Check the game components. Before you start setting up your game of Monopoly Empire, you may want to check the game components to ensure that you have everything. Checking the game components will also help you to become more familiar with the game pieces and board. You should have:\na Monopoly Empire board\n4 Towers\n6 game tokens\n30 Billboard tiles\n6 Office tiles\n14 Chance cards\n14 Empire cards\nMonopoly money\n2 dice Unfold the board and place it on your playing surface. After you have checked your game components to make sure that you have everything you need to play, you can set up your game board. Unfold the board and place it on a table, the floor, or wherever you plan to play the game. Make sure that you place the board somewhere that all of the players have easy access to the board. Shuffle the cards and place them on the board. Shuffle the deck of Chance cards and the deck of Empire cards and place them in their designated spots on the board. The Chance cards are similar to the Chance cards used in regular Monopoly. The Empire cards are similar to the Community Chest cards in Monopoly, which often give you advantages that may help you win the game. You will get two Empire cards at the beginning of the game. Sort the brand billboard tiles on their places on the board. The brand billboard tiles have specific places all around the game board. Look for these spaces and match the billboard tile to the billboard space. For example, the Coca-Cola billboard tile should go on the Coca-Cola billboard space. You will be competing against your fellow players to obtain these tiles and fill up your tower first. Place the Water Works and Electric Company tiles on the board as well. The Water Works and Electric Company tiles have a specific spaces on the board where you should place those tiles until someone purchases them. There is one space for all four of the Water Works tiles and one space for all four of the Electric Company tiles. Leave the six office tiles and the dice off of the board. The only tiles that you do not place on the board are the six office tiles. Leave these tiles off of the board along with the dice. You can put them off to the side or have someone be in charge of them. Choose a player to be the banker. The banker is in charge of handling transactions, managing auctions, giving players money when they pass \u201cGO,\u201d and collecting fees and fines. Make sure that the person you choose to be the banker is willing and able to perform all of these tasks. Have the banker give everyone $1000 to start the game (one $500, four $100s, and two $50s). Give everyone two empire cards and one tower. Everyone starts the game with two Empire cards. Look at them, but don\u2019t share them you\u2019re your fellow players. Wait until your turn to use them. Each player will also need a tower. The object of the game is to be the first one to fill up your tower with billboards. Have players select their tokens and place them on \u201cGO.\u201d Once everything else is set up, you can have players choose their game tokens and place them on the board. The game tokens in Monopoly Empire include a game controller, racecar, coke bottle, film slate, motorcycle, and French fries. Playing the Game Understand the object of the game. In Monopoly Empire, the first player to fill up his or her billboard with brand billboards wins the game. Therefore, you want to buy as many brand billboards as quickly as you can to fill up the spaces in your board. When other players land on billboard spaces that you own, they will have to pay you the amount of money you\u2019re your billboard height reaches on your tower. If a player runs out of money, they do not go bankrupt as in regular Monopoly. That player simply takes the top billboard piece from his or her tower and gives it to the player who requires it. Decide who will go first. Before you start the game, decide who will go first. The official rules for Monopoly Empire state that the youngest player gets to go first. If you prefer, you can also determine who goes first by rolling the dice and seeing who gets the largest number. Follow a clockwise pattern for turns. Take your turn. When it is your turn to play, you will need to complete a specific set of actions. Perform these actions on every turn in the same order. Your turn will be a little different every time based on the space you land on. During your turn, perform each of the following actions:\nRoll the dice. Take two turns if you roll a double. For example, if you roll two sixes, then move 12 spaces and perform an action for that space. But then, roll again and move again and perform another action. Move your token the number of spaces you rolled. For example, if you roll a 10, then move 10 spaces\nPerform an action for the space you land on. For example, if you land on a billboard tile that is available for purchase, then you can purchase it. Follow the instructions when you draw a Chance or Empire card. Whenever you land on a Chance or Empire card space, you will get to draw one of these cards. In general, you will need to use Chance cards right away, but you can save Empire cards until you want or need to use them. For example, if you get a \u201cGet Out of Jail Free\u201d card, then you can hang onto it until you need it. Please note, there is no limit to the amount of Empire cards that can be played during a turn. For example, if someone plays a \"Just Say No\" card, the other opponent could also play a \"Just Say No\" card should they have one in their hand. Bid on spaces that other players do not want. If you happen to land on a billboard that you do not want to buy, then that tile will be up for auction. The banker is in charge of managing the auction and the bidding starts at $50. All follow-up bids must be in increments of $50, such as $100, $150, $200, $250, etc. The highest bidder gets the billboard and must pay the amount that he or she bid to the bank. Use the sneaky swapper option on the dice. If you roll the handshake icon on one of your dice rolls, then you can perform a sneaky swap as one of your turn actions. This means that you can exchange two topmost billboard tower tiles. For example, you can exchange your topmost billboard tile with another player\u2019s topmost billboard tile, or you can swap the tiles of two other players. Using the sneaky swap is optional. If you do not want to use it, just move your piece the number of spaces that that you rolled on the other die. If you do use the sneaky swap, then do not move this turn. Keep playing until someone wins. The player who fills his or her tower first wins the game. Keep playing until someone does so. Monopoly Empire takes about 90 minutes to play, but it may take longer for someone to win the game.",
  "tyn_model":[
    "banker",
    "monopoly empire",
    "monopoly",
    "dice",
    "board",
    "empire cards",
    "water works",
    "\u201cgo",
    "monopoly empire board",
    "cards",
    "electric company",
    "\u201d and",
    "\u201d once",
    "game controller",
    "coke bottle",
    "film slate",
    "french fries",
    "\u201cget",
    "\u201d card",
    "billboard"
  ],
  "tyn_section":[

  ]
}