{
  "title":"How to Make a Stuffed Animal Kingdom",
  "url":"https://www.wikihow.com/Make-a-Stuffed-Animal-Kingdom",
  "category_hierarchy":[
    "Hobbies and Crafts",
    "Toys",
    "Traditional Toys",
    "Stuffed Animals"
  ],
  "parts":[
    {
      "name":"Steps",
      "steps":[
        {
          "headline":"Choose a king.",
          "description":"You can't have a kingdom without a king, so pick a stuffed toy to rule the kingdom. Or, you could rule it yourself! Consider using a lion if your kingdom is located in the jungle, as lions are known as the \"King of the Jungle\". However, it is entirely up to you. You can locate your kingdom in the forest, or at the beach!"
        },
        {
          "headline":"Make a character sheet for each of the animals living in the kingdom.",
          "description":"You can give them a name, personal history, and family members if you like.The King can have a queen and there can be princes and princesses. The King can have knights and the Queen, Ladies in Waiting."
        },
        {
          "headline":"Have a whole feudal (class system), if you like with Lords, Ladies, Squires and all the rest.",
          "description":"All the stuffed toys can be upper class and \"posh\" if you like or some can be maids, and knaves and serfs."
        },
        {
          "headline":"Get really detailed and complex if you like.",
          "description":"Have jobs for the animals based on their history. Remember, a baker can't bake without a farmer for the ingredients and a smith can't forge without someone mining the ores for them. There are no houses without a builder to build them and a supplier of the materials, for example a lumberjack for a wood house so if you want to, you can have a really detailed, working, Stuffed Animal Kingdom."
        },
        {
          "headline":"Make a house for each subject of the Kingdom and his or her family.",
          "description":"A house can be a cardboard box with a doorway, a blanket draped over a chair, under a chair, even a small area that you claim is the house. The Royal Palace or Castle can be more fancy than where the peasants live."
        }
      ]
    },
    {
      "name":"Playing it out",
      "steps":[
        {
          "headline":"Play with the stuffed animals.",
          "description":"Make them carry out jobs, get married, start a family and have the children grow up. Make an enemy Kingdom and have knights that go into battle on behalf of their King if you like. Make bandits to pillage the kingdom. Remember that bandits and knights and what-not don't just appear really, but when you are playing make believe you can do what you like. You can pretend the bandits and knights grow up from your original kingdom members and have their history impact their futures. You can have the kingdom expand or grow smaller."
        },
        {
          "headline":"Draw a Map of the Kingdom!",
          "description":"Include neighboring Empires and unknown territory for your animals to explore."
        },
        {
          "headline":"Start your own kingdom today, and if you do draw a map, or make a great bear king costume, take a picture and add it to wikiHow.",
          "description":"Tell your friends too and let them run kingdoms alongside your own!"
        },
        {
          "headline":"Do it with your friends!",
          "description":"If you have lots of friends, you could ask each friend to create a 'family' of animals and create a house for them. If you have one or two friends, then tell them to also create cousins, aunts, ect. You could even make a kingdom each, create allies with some, and rivals with others."
        }
      ]
    }
  ],
  "text":" Steps Choose a king. You can't have a kingdom without a king, so pick a stuffed toy to rule the kingdom. Or, you could rule it yourself! Consider using a lion if your kingdom is located in the jungle, as lions are known as the \"King of the Jungle\". However, it is entirely up to you. You can locate your kingdom in the forest, or at the beach! Make a character sheet for each of the animals living in the kingdom. You can give them a name, personal history, and family members if you like.The King can have a queen and there can be princes and princesses. The King can have knights and the Queen, Ladies in Waiting. Have a whole feudal (class system), if you like with Lords, Ladies, Squires and all the rest. All the stuffed toys can be upper class and \"posh\" if you like or some can be maids, and knaves and serfs. Get really detailed and complex if you like. Have jobs for the animals based on their history. Remember, a baker can't bake without a farmer for the ingredients and a smith can't forge without someone mining the ores for them. There are no houses without a builder to build them and a supplier of the materials, for example a lumberjack for a wood house so if you want to, you can have a really detailed, working, Stuffed Animal Kingdom. Make a house for each subject of the Kingdom and his or her family. A house can be a cardboard box with a doorway, a blanket draped over a chair, under a chair, even a small area that you claim is the house. The Royal Palace or Castle can be more fancy than where the peasants live. Playing it out Play with the stuffed animals. Make them carry out jobs, get married, start a family and have the children grow up. Make an enemy Kingdom and have knights that go into battle on behalf of their King if you like. Make bandits to pillage the kingdom. Remember that bandits and knights and what-not don't just appear really, but when you are playing make believe you can do what you like. You can pretend the bandits and knights grow up from your original kingdom members and have their history impact their futures. You can have the kingdom expand or grow smaller. Draw a Map of the Kingdom! Include neighboring Empires and unknown territory for your animals to explore. Start your own kingdom today, and if you do draw a map, or make a great bear king costume, take a picture and add it to wikiHow. Tell your friends too and let them run kingdoms alongside your own! Do it with your friends! If you have lots of friends, you could ask each friend to create a 'family' of animals and create a house for them. If you have one or two friends, then tell them to also create cousins, aunts, ect. You could even make a kingdom each, create allies with some, and rivals with others.",
  "tyn_model":[
    "lion",
    "lions",
    "blanket",
    "bandits"
  ],
  "tyn_section":[

  ]
}