{
  "title":"How to Make Mexican Enchiladas",
  "url":"https://www.wikihow.com/Make-Mexican-Enchiladas",
  "category_hierarchy":[
    "Food and Entertaining",
    "Recipes",
    "World Cuisines",
    "Central and South American Cuisine",
    "Enchiladas"
  ],
  "methods":[
    {
      "name":"Making the Enchilada Sauce",
      "steps":[
        {
          "headline":"Reconstitute the peppers.",
          "description":"Ancho chile peppers are large red peppers that are most often sold dry. Place the peppers in a large, deep baking dish. Boil 3 cups of water on the stove. When it comes to a boil, pour the water over the peppers, then cover them with a lid. Wait 15 minutes, then test a peppers with a pair of tongs. If it has become soft and limp, it's finished reconstituting. If not, replace the lid and let the peppers sit for another 15 minutes."
        },
        {
          "headline":"Remove the stems and seeds.",
          "description":"Once the peppers are soft, remove them from the water bath. Use a sharp knife to cut away the stems, the slice the peppers lengthwise and open them up. Remove the seeds inside the peppers and discard them."
        },
        {
          "headline":"Puree the peppers and spices.",
          "description":"Place the deseeded peppers in a blender. Add the celery salt, cumin, chicken broth, tomatoes, and oregano. Blend the mixture until it is completely pureed and smooth."
        },
        {
          "headline":"Saut\u00e9 the onions.",
          "description":"Heat 1 tablespoon (14.8 ml) of oil in a large frying pan. When the oil is hot, add the diced onions. Stir them frequently and allow them to cook until they turn translucent, about 5 minutes. A 10-inch cast iron skillet is a good pan to use for this purpose. Test to make sure the oil is hot by placing one small piece of onion in the pan; if it sizzles, add the remaining onion."
        },
        {
          "headline":"Add the pepper sauce.",
          "description":"Pour the pureed pepper sauce into the hot skillet with the onions. Use a wooden spoon to stir the mixture, incorporating the onions throughout the sauce. Reduce the heat so that the sauce comes to a low simmer. Let it simmer for 20 minutes, stirring occasionally. If the sauce seems to cook down quickly, add 1/2 cup of water or chicken broth. Taste the sauce to determine whether it needs more salt."
        }
      ]
    },
    {
      "name":"Filling the Tortillas",
      "steps":[
        {
          "headline":"Soften the tortillas.",
          "description":"Heat a large frying pan over medium heat. Pour in enough oil to coat the bottom of the pan. When the oil is hot, place a tortilla in the pan. Let it cook for 30 seconds, then turn it over and let it cook for another 30 seconds. Place it on a paper towel to drain. Repeat with the remaining tortillas. If your pan is large enough, cook more than one tortilla at a time. Add a small amount of oil every few minutes, since the tortillas will absorb it as they cook."
        },
        {
          "headline":"Stuff the tortillas with cheese.",
          "description":"One at a time, sprinkle each tortilla with a liberal amount of cheese. Roll up the tortillas and place them in an oiled casserole dish. Line them up close to one another so that they stay rolled. Continue until you run out of tortillas."
        }
      ]
    },
    {
      "name":"Finishing the Enchiladas",
      "steps":[
        {
          "headline":"Cover the enchiladas with sauce.",
          "description":"Pour the enchilada sauce over the rolled tortillas. Make sure each one gets covered in sauce. If you pour the entire contents of the pot into the casserole dish, it should rise up the sides a bit. Sprinkle some extra cheese on top if you'd like. You could also reserve some sauce to serve with the enchiladas."
        },
        {
          "headline":"Bake the enchiladas.",
          "description":"Place the dish of enchiladas in an oven preheated to 350 degrees. Bake them until the sauce is bubbling and the cheese has melted."
        },
        {
          "headline":"Serve the enchiladas.",
          "description":"Serve with sour cream and chopped cilantro. These enchiladas are excellent with  Mexican rice."
        },
        {
          "headline":"Finished.",
          "description":""
        }
      ]
    }
  ],
  "text":" Making the Enchilada Sauce Reconstitute the peppers. Ancho chile peppers are large red peppers that are most often sold dry. Place the peppers in a large, deep baking dish. Boil 3 cups of water on the stove. When it comes to a boil, pour the water over the peppers, then cover them with a lid. Wait 15 minutes, then test a peppers with a pair of tongs. If it has become soft and limp, it's finished reconstituting. If not, replace the lid and let the peppers sit for another 15 minutes. Remove the stems and seeds. Once the peppers are soft, remove them from the water bath. Use a sharp knife to cut away the stems, the slice the peppers lengthwise and open them up. Remove the seeds inside the peppers and discard them. Puree the peppers and spices. Place the deseeded peppers in a blender. Add the celery salt, cumin, chicken broth, tomatoes, and oregano. Blend the mixture until it is completely pureed and smooth. Saut\u00e9 the onions. Heat 1 tablespoon (14.8 ml) of oil in a large frying pan. When the oil is hot, add the diced onions. Stir them frequently and allow them to cook until they turn translucent, about 5 minutes. A 10-inch cast iron skillet is a good pan to use for this purpose. Test to make sure the oil is hot by placing one small piece of onion in the pan; if it sizzles, add the remaining onion. Add the pepper sauce. Pour the pureed pepper sauce into the hot skillet with the onions. Use a wooden spoon to stir the mixture, incorporating the onions throughout the sauce. Reduce the heat so that the sauce comes to a low simmer. Let it simmer for 20 minutes, stirring occasionally. If the sauce seems to cook down quickly, add 1/2 cup of water or chicken broth. Taste the sauce to determine whether it needs more salt. Filling the Tortillas Soften the tortillas. Heat a large frying pan over medium heat. Pour in enough oil to coat the bottom of the pan. When the oil is hot, place a tortilla in the pan. Let it cook for 30 seconds, then turn it over and let it cook for another 30 seconds. Place it on a paper towel to drain. Repeat with the remaining tortillas. If your pan is large enough, cook more than one tortilla at a time. Add a small amount of oil every few minutes, since the tortillas will absorb it as they cook. Stuff the tortillas with cheese. One at a time, sprinkle each tortilla with a liberal amount of cheese. Roll up the tortillas and place them in an oiled casserole dish. Line them up close to one another so that they stay rolled. Continue until you run out of tortillas. Finishing the Enchiladas Cover the enchiladas with sauce. Pour the enchilada sauce over the rolled tortillas. Make sure each one gets covered in sauce. If you pour the entire contents of the pot into the casserole dish, it should rise up the sides a bit. Sprinkle some extra cheese on top if you'd like. You could also reserve some sauce to serve with the enchiladas. Bake the enchiladas. Place the dish of enchiladas in an oven preheated to 350 degrees. Bake them until the sauce is bubbling and the cheese has melted. Serve the enchiladas. Serve with sour cream and chopped cilantro. These enchiladas are excellent with  Mexican rice. Finished. ",
  "tyn_model":[
    "oil",
    "peppers",
    "water",
    "enchilada sauce",
    "chicken broth",
    "onions",
    "large frying pan",
    "onion",
    "cheese",
    "ancho chile peppers",
    "baking dish",
    "stove",
    "spices",
    "blender",
    "celery salt",
    "cumin",
    "tomatoes",
    "oregano",
    "10-inch cast iron skillet",
    "pepper sauce",
    "pureed pepper",
    "skillet",
    "wooden spoon",
    "paper towel",
    "oiled casserole dish",
    "tortillas",
    "casserole dish",
    "oven",
    "sour cream",
    "cilantro"
  ],
  "tyn_section":[

  ]
}