{
  "title":"How to Fix Xbox 360 Disc Drive Problems",
  "url":"https://www.wikihow.com/Fix-Xbox-360-Disc-Drive-Problems",
  "category_hierarchy":[
    "Hobbies and Crafts",
    "Games",
    "Video Games",
    "Xbox",
    "Xbox 360"
  ],
  "parts":[
    {
      "name":"Solve a reading... open tray problem",
      "steps":[
        {
          "headline":"Clean the disk with a slightly damp cloth.",
          "description":"Do not use solvents."
        },
        {
          "headline":"Remove stickers.",
          "description":""
        },
        {
          "headline":"If this doesn't work, follow the instructions below.",
          "description":""
        }
      ]
    },
    {
      "name":"Solve a game related problem",
      "steps":[
        {
          "headline":"Turn off the console, and remove any USB drives attached.",
          "description":""
        },
        {
          "headline":"Check that the game is the correct region code.",
          "description":"NTSC: North America and South America (United States, Canada, Mexico, Chile, and Brazil)\nNTSC-J: Asia (Hong Kong SAR, Japan, Korea, Singapore, and Taiwan)\nPAL: Europe, South Africa, India, Australia, and New Zealand"
        },
        {
          "headline":"Try another game.",
          "description":""
        },
        {
          "headline":"If all of the above fails, your console will need service.",
          "description":""
        }
      ]
    },
    {
      "name":"Solve a DVD related problem",
      "steps":[
        {
          "headline":"Check the DVD region.",
          "description":"1: United States, Canada, Bermuda, U.S. territories\n2: Europe (except Russia, Ukraine and Belarus), Middle East, Egypt, Japan, South Africa, Swaziland, Lesotho, Greenland\n3: Southeast Asia, South Korea, Taiwan, Hong Kong SAR, Macau\n4: Mexico, Central and South America, Australia, New Zealand, Oceania\n5: India, Afghanistan, Ukraine, Belarus, Russia, Africa, Central and South Asia, North Korea\n6: People's Republic of China, Hong Kong\n7: Reserved\n8: Special international venues, such as airplanes and cruise ships"
        },
        {
          "headline":"Try another DVD.",
          "description":""
        },
        {
          "headline":"If all of the above fails, your console will need service.",
          "description":""
        }
      ]
    },
    {
      "name":"Solve a CD related  problem",
      "steps":[
        {
          "headline":"Check the CD format.",
          "description":"The following CD formats are supported by Xbox: CD-DA, CD-ROM, CD-ROM XA, CD-R, CD-RW, CD-Extra. The following music files are supported: WMA, MP3, JPEG."
        },
        {
          "headline":"Try another CD.",
          "description":""
        },
        {
          "headline":"If all of the above fails, your console will need service.",
          "description":""
        }
      ]
    },
    {
      "name":"Correct disc tray stuck open error",
      "steps":[
        {
          "headline":"Check the power button.",
          "description":"If the Xbox is on, move on to the next step. If it is not on, check the power source and cables."
        },
        {
          "headline":"Remove the disc from the tray, then press eject.",
          "description":"If the tray closes, open the tray and insert the disc. Try to use the tray with a disc in it."
        },
        {
          "headline":"Gently move the disc tray up and down, left and right.",
          "description":"Then press eject. If it closes, try to use the tray with a disc in it."
        },
        {
          "headline":"If all of the above fails, your console will need service.",
          "description":""
        }
      ]
    },
    {
      "name":"Correct  disc tray stuck shut error",
      "steps":[
        {
          "headline":"Check the power button.",
          "description":"If the Xbox is on, move on to the next step. If it is not on, check the power source and cables."
        },
        {
          "headline":"Check for a plastic strip.",
          "description":"This is used to keep the disc tray shut while the Xbox is shipped. If you find one, peel it off."
        },
        {
          "headline":"Try to manually open the disk drive.",
          "description":"You can find how to do this for your console online."
        },
        {
          "headline":"If all of the above fails, your console will need service.",
          "description":""
        }
      ]
    }
  ],
  "text":" Solve a reading... open tray problem Clean the disk with a slightly damp cloth. Do not use solvents. Remove stickers.  If this doesn't work, follow the instructions below.  Solve a game related problem Turn off the console, and remove any USB drives attached.  Check that the game is the correct region code. NTSC: North America and South America (United States, Canada, Mexico, Chile, and Brazil)\nNTSC-J: Asia (Hong Kong SAR, Japan, Korea, Singapore, and Taiwan)\nPAL: Europe, South Africa, India, Australia, and New Zealand Try another game.  If all of the above fails, your console will need service.  Solve a DVD related problem Check the DVD region. 1: United States, Canada, Bermuda, U.S. territories\n2: Europe (except Russia, Ukraine and Belarus), Middle East, Egypt, Japan, South Africa, Swaziland, Lesotho, Greenland\n3: Southeast Asia, South Korea, Taiwan, Hong Kong SAR, Macau\n4: Mexico, Central and South America, Australia, New Zealand, Oceania\n5: India, Afghanistan, Ukraine, Belarus, Russia, Africa, Central and South Asia, North Korea\n6: People's Republic of China, Hong Kong\n7: Reserved\n8: Special international venues, such as airplanes and cruise ships Try another DVD.  If all of the above fails, your console will need service.  Solve a CD related  problem Check the CD format. The following CD formats are supported by Xbox: CD-DA, CD-ROM, CD-ROM XA, CD-R, CD-RW, CD-Extra. The following music files are supported: WMA, MP3, JPEG. Try another CD.  If all of the above fails, your console will need service.  Correct disc tray stuck open error Check the power button. If the Xbox is on, move on to the next step. If it is not on, check the power source and cables. Remove the disc from the tray, then press eject. If the tray closes, open the tray and insert the disc. Try to use the tray with a disc in it. Gently move the disc tray up and down, left and right. Then press eject. If it closes, try to use the tray with a disc in it. If all of the above fails, your console will need service.  Correct  disc tray stuck shut error Check the power button. If the Xbox is on, move on to the next step. If it is not on, check the power source and cables. Check for a plastic strip. This is used to keep the disc tray shut while the Xbox is shipped. If you find one, peel it off. Try to manually open the disk drive. You can find how to do this for your console online. If all of the above fails, your console will need service. ",
  "tyn_model":[
    "console",
    "xbox",
    "tray",
    "dvd",
    "rom",
    "cd",
    "cables",
    "disc tray"
  ],
  "tyn_section":[

  ]
}