{
  "title":"How to Make Mascarpone",
  "url":"https://www.wikihow.com/Make-Mascarpone",
  "category_hierarchy":[
    "Food and Entertaining",
    "Recipes",
    "Eggs and Dairy",
    "Cheese"
  ],
  "parts":[
    {
      "name":"Making the Mascarpone",
      "steps":[
        {
          "headline":"Fill the bain marie with water, and place on a stove top over high heat.",
          "description":"Gas stoves work best. As the pans and water heat up, you may reduce and readjust the heat."
        },
        {
          "headline":"Add 1 quarter of heavy cream to the top of the bain-marie.",
          "description":"Heat, stirring constantly, to a steady temperature of about 180 degrees F (about 82 C). The cream should barely simmer."
        },
        {
          "headline":"Add 1 quarter of tartaric acid, and continue to whisk or stir constantly, until the cream reaches 185\u00b0F (85\u00b0C).",
          "description":"You will notice the mixture beginning to thicken almost immediately after incorporating the tartaric acid. You might want to switch quickly between a  high heat rubber spatula to skim the sides, and your whisk or spoon, in order to maintain an even temperature and consistency throughout the thickening mascarpone. Be very aware of the temperature."
        },
        {
          "headline":"Remove the top portion of the bain-marie, containing the cream mixture, from the heat the instant that it reaches 185\u00b0F.",
          "description":"Any higher temperature will burn the cream. Continue to stir for at least two minutes. Have at the ready your chinoise mousseline, (lined with damp cheesecloth if desired). This should be in place over a stainless steel vessel suitable for storing overnight in the fridge."
        },
        {
          "headline":"Pour all of the mascarpone into the sieve, using a rubber spatula to scrape the sides.",
          "description":""
        },
        {
          "headline":"Pass the mascarpone through the cheesecloth and sieve, into a stainless steel vessel.",
          "description":"(Bain-marie pots are perfect for this function.) To facilitate the passing process, you may use a small ladle to press the cream through the bottom of the sieve. Cover well, and refrigerate at least 8 hours or overnight. Glass or porcelain may be used to store the mascarpone if stainless steel is unavailable, but avoid using any 'reactionary' metals like aluminum, as the acid in the mascarpone will undergo a chemical reaction with the metal."
        }
      ]
    },
    {
      "name":"Using Mascarpone",
      "steps":[
        {
          "headline":"Use mascarpone as an alternative to a custard-cream base (French base) in ice cream makers.",
          "description":"Try balancing the tart flavor with a slightly sweet ingredient and making ice cream."
        },
        {
          "headline":"Use mascarpone for desserts.",
          "description":"A classic, simple dessert may be prepared by slicing fresh strawberries and placing in a martini glass or ice cream bowl. Drizzle in a bit of balsamic syrup or Chambord liquor, or even Champagne or framboise Lambic. Top with creamy mascarpone. You might notice many recipe ideas for desserts like strawberry mascarpone 'parfaits', or mascarpone cream online. These will call for whipping together the dense version of mascarpone with heavy cream. Because this creamy version has not been strained, this recipe is already perfect for use as a berry or fruit accompaniment\u2013\u2013no additional cream is necessary. Creamy mascarpone may be whipped, like cream. This is fantastic served with rich desserts like a fallen chocolate souffle cake. If you'd like to experiment with flavoring the mascarpone for particular desserts, add the desired ingredients (like vanilla beans and molasses) to the cream before the tartaric acid is introduced. This way, the flavors will really meld and develop, and any detritus, like vanilla bean pods, will be strained out before chilling. If you want to add flavoring to the final product, incorporate very well, and consider straining once more before using in your recipe."
        },
        {
          "headline":"Sweeten the mascarpone.",
          "description":"If you'd like the creamy mascarpone to be a bit sweeter, experiment with flavoring it with vanilla sugar syrup, molasses, or honey before serving. When serving with unsweetened fresh fruits like berries, green mission figs, peaches, or poached pears, the tart but slightly sweet smoothness provides a perfect juxtaposition."
        },
        {
          "headline":"Finished.",
          "description":""
        }
      ]
    }
  ],
  "text":" Making the Mascarpone Fill the bain marie with water, and place on a stove top over high heat. Gas stoves work best. As the pans and water heat up, you may reduce and readjust the heat. Add 1 quarter of heavy cream to the top of the bain-marie. Heat, stirring constantly, to a steady temperature of about 180 degrees F (about 82 C). The cream should barely simmer. Add 1 quarter of tartaric acid, and continue to whisk or stir constantly, until the cream reaches 185\u00b0F (85\u00b0C). You will notice the mixture beginning to thicken almost immediately after incorporating the tartaric acid. You might want to switch quickly between a  high heat rubber spatula to skim the sides, and your whisk or spoon, in order to maintain an even temperature and consistency throughout the thickening mascarpone. Be very aware of the temperature. Remove the top portion of the bain-marie, containing the cream mixture, from the heat the instant that it reaches 185\u00b0F. Any higher temperature will burn the cream. Continue to stir for at least two minutes. Have at the ready your chinoise mousseline, (lined with damp cheesecloth if desired). This should be in place over a stainless steel vessel suitable for storing overnight in the fridge. Pour all of the mascarpone into the sieve, using a rubber spatula to scrape the sides.  Pass the mascarpone through the cheesecloth and sieve, into a stainless steel vessel. (Bain-marie pots are perfect for this function.) To facilitate the passing process, you may use a small ladle to press the cream through the bottom of the sieve. Cover well, and refrigerate at least 8 hours or overnight. Glass or porcelain may be used to store the mascarpone if stainless steel is unavailable, but avoid using any 'reactionary' metals like aluminum, as the acid in the mascarpone will undergo a chemical reaction with the metal. Using Mascarpone Use mascarpone as an alternative to a custard-cream base (French base) in ice cream makers. Try balancing the tart flavor with a slightly sweet ingredient and making ice cream. Use mascarpone for desserts. A classic, simple dessert may be prepared by slicing fresh strawberries and placing in a martini glass or ice cream bowl. Drizzle in a bit of balsamic syrup or Chambord liquor, or even Champagne or framboise Lambic. Top with creamy mascarpone. You might notice many recipe ideas for desserts like strawberry mascarpone 'parfaits', or mascarpone cream online. These will call for whipping together the dense version of mascarpone with heavy cream. Because this creamy version has not been strained, this recipe is already perfect for use as a berry or fruit accompaniment\u2013\u2013no additional cream is necessary. Creamy mascarpone may be whipped, like cream. This is fantastic served with rich desserts like a fallen chocolate souffle cake. If you'd like to experiment with flavoring the mascarpone for particular desserts, add the desired ingredients (like vanilla beans and molasses) to the cream before the tartaric acid is introduced. This way, the flavors will really meld and develop, and any detritus, like vanilla bean pods, will be strained out before chilling. If you want to add flavoring to the final product, incorporate very well, and consider straining once more before using in your recipe. Sweeten the mascarpone. If you'd like the creamy mascarpone to be a bit sweeter, experiment with flavoring it with vanilla sugar syrup, molasses, or honey before serving. When serving with unsweetened fresh fruits like berries, green mission figs, peaches, or poached pears, the tart but slightly sweet smoothness provides a perfect juxtaposition. Finished. ",
  "tyn_model":[
    "mascarpone",
    "cream",
    "tartaric acid",
    "sieve",
    "water",
    "heavy cream",
    "stainless steel vessel",
    "molasses",
    "stove top",
    "gas stoves",
    "pans",
    "spatula",
    "whisk",
    "spoon",
    "chinoise mousseline",
    "rubber spatula",
    "cheesecloth",
    "ladle",
    "porcelain",
    "ice cream makers",
    "ice cream",
    "strawberries",
    "martini glass",
    "ice cream bowl",
    "balsamic syrup",
    "chambord liquor",
    "champagne",
    "framboise lambic",
    "mascarpone cream",
    "vanilla beans",
    "vanilla bean",
    "vanilla sugar syrup",
    "honey",
    "berries",
    "green mission figs",
    "peaches",
    "pears"
  ],
  "tyn_section":[

  ]
}