{
  "title":"How to Make Microwave Fudge",
  "url":"https://www.wikihow.com/Make-Microwave-Fudge",
  "category_hierarchy":[
    "Food and Entertaining",
    "Recipes",
    "Chocolate and Candy",
    "Fudge"
  ],
  "methods":[
    {
      "name":"Making Traditional Fudge in the Microwave",
      "steps":[
        {
          "headline":"Grease a baking pan.",
          "description":"Coat an 8-inch (20-cm) baking pan with a layer of butter, oil, or cooking spray. This will prevent the fudge from sticking to the pan, and make it easier to remove once the fudge has set. Alternatively, you can also line the dish with parchment paper instead."
        },
        {
          "headline":"Heat the sugar, milk, and butter.",
          "description":"Combine the three ingredients in a large microwave-safe bowl. Add a pinch of salt. Transfer the mixture to the microwave and heat it on high for 10 minutes. Stop the microwave every two minutes to stir the mixture. Watch the mixture as it cooks, as the fudge may bubble over the sides of the bowl. Stop the microwave and stir the mixture if this happens. Traditional fudge made in the microwave takes longer to cook than other types of fudge, because the sugar must get hot enough to start caramelizing."
        },
        {
          "headline":"Add the vanilla.",
          "description":"Remove the bowl from the microwave and add the vanilla. You can use either vanilla bean paste or vanilla extract. Whisk all the ingredients together vigorously until the fudge is creamy and smooth. Return the bowl to the microwave and cook for another two minutes. When the fudge is ready, it will be thick and the color of caramel."
        },
        {
          "headline":"Pour the fudge.",
          "description":"Stir the fudge one last time and transfer it to the greased baking pan. Use a rubber spatula to scrape the sides and get all the fudge from the bowl. Use the spatula to spread the fudge evenly around the bowl."
        },
        {
          "headline":"Let the fudge set before serving.",
          "description":"Set the fudge aside and let it cool and set for at least an hour. This will give the ingredients time to cool and firm up. Don\u2019t chill the fudge in the refrigerator to set, as this can cause the sugar to crystallize."
        },
        {
          "headline":"Cut and serve the fudge.",
          "description":"After an hour, cut the fudge into 1- to 2-inch (2.5- to 5-cm) squares and serve. Transfer any leftover squares to an airtight container. Store at room temperature for up to three weeks."
        }
      ]
    },
    {
      "name":"Making Chocolate Fudge",
      "steps":[
        {
          "headline":"Grease a baking pan.",
          "description":"Fudge is quite sticky, so it\u2019s important to grease the baking pan that the fudge will be poured into. Coat an 8-inch (20-cm) baking pan with a layer of cooking spray, oil, or butter. For even easier cleanup, line the baking pan with foil or parchment paper, and coat the foil or paper with butter."
        },
        {
          "headline":"Melt the butter, milk, and chocolate.",
          "description":"Combine the milk, butter, and chocolate chips in a large microwave-safe bowl. Heat the mixture on high for three minutes, or until the butter and chips are melted. Once melted, stir the mixture to combine all the ingredients. For an even richer and stickier fudge, use condensed milk instead of regular milk."
        },
        {
          "headline":"Beat in the remaining ingredients.",
          "description":"Add the confectioner\u2019s sugar and vanilla to the bowl with the melted butter, milk, and chocolate. With a hand mixer, beat the ingredients together on medium speed. Keep beating for about two minutes, until the mixture is smooth and all the ingredients are incorporated. As you beat the fudge, scrape down the sides of the bowl with a rubber spatula or spoon as necessary."
        },
        {
          "headline":"Transfer to the baking pan and chill.",
          "description":"Pour the fudge into the prepared baking pan. Use a rubber spatula to spread the fudge out evenly in the pan. Transfer the pan to the refrigerator and let the fudge chill and set for one to two hours. The fudge is ready when it\u2019s fully cooled and firm."
        },
        {
          "headline":"Cut into squares before serving.",
          "description":"Cut the fudge into 1-inch (2.5-cm) squares for small snack-sized treats, or 2-inch (5-cm) squares for a larger dessert-sized portion. If there's any fudge leftover, transfer it to an airtight container and store it at room temperature for two to three weeks."
        }
      ]
    },
    {
      "name":"Making Peanut Butter Fudge",
      "steps":[
        {
          "headline":"Melt the butter and peanut butter.",
          "description":"Combine the peanut butter and butter in a medium microwave-safe bowl. Microwave for two minutes, removing the dish halfway through the cooking time to stir. When the fudge has cooked for two minutes, remove it from the microwave and stir it again. You can use either crunchy or smooth peanut butter to make this fudge. Crunchy peanut butter will leave some small chunks of nuts in the fudge, whereas smooth peanut butter will result in a completely smooth and creamy fudge."
        },
        {
          "headline":"Mix in the sugar.",
          "description":"Add the sugar and mix the fudge with a wooden spoon or hand mixer on medium speed. Scrape down the sides as necessary, and keep mixing until all the sugar has been fully incorporated into the fudge. You can also add 1 teaspoon (5 ml) of vanilla to the mixture at this time if you like. It\u2019s important to use confectioner\u2019s sugar, because granulated sugar will give the fudge a grainy texture."
        },
        {
          "headline":"Pour the fudge into a greased baking pan.",
          "description":"Grease an 8-inch (20-cm) baking pan with butter, cooking spray, or oil. Pour the fudge into the greased pan. Spread the fudge evenly around the pan with a wooden spatula."
        },
        {
          "headline":"Chill before serving.",
          "description":"Transfer the fudge to the refrigerator and chill for at least two hours. This will give the ingredients time to cool and allow the fudge to set. Once firm, cut the fudge into squares or slices and serve. Transfer leftovers to an airtight container. Leftovers will keep in the fridge for about two weeks."
        }
      ]
    },
    {
      "name":"Modifying the Recipes",
      "steps":[
        {
          "headline":"Change the type of chocolate fudge.",
          "description":"You can quickly and easily change the type of fudge you make just by using a different type of chocolate chip. Instead of using semi-sweet chocolate chips, you can use:\nWhite chocolate\nMilk chocolate\nButterscotch\nDark chocolate"
        },
        {
          "headline":"Add nuts.",
          "description":"Fudge and nuts are a classic combination, and you can add any kind of nut you like to any flavor of fudge. Add 1 cup (125 g) of chopped raw or toasted nuts to any fudge after all the ingredients have been melted. Stir everything together before letting the fudge set. Classic nut and fudge combinations include:\nDark or milk chocolate and almonds\nWhite chocolate and macadamia nuts\nMilk chocolate and hazelnuts\nDark chocolate and pistachios\nPeanut butter and cashews\nTraditional fudge with any nut"
        },
        {
          "headline":"Add marshmallows.",
          "description":"Marshmallow and chocolate is the traditional flavor of rocky road, and you can make rocky road fudge by adding 1 cup (50 g) of mini marshmallows to milk or dark chocolate fudge. For a colorful rocky road fudge, add multicolored mini marshmallows instead of plain white ones."
        },
        {
          "headline":"Turn your fudge into peppermint bark.",
          "description":"Peppermint bark is a tasty treat that\u2019s usually found around the holidays, and you can easily make a basic chocolate fudge into peppermint bark fudge:\nMake a basic chocolate fudge recipe, but replace the semi-sweet chocolate chips with white chocolate chips\nReplace the vanilla extract with peppermint extract\nAdd 1 cup (8 ounces) of crush candy cane pieces to the fudge after all the ingredients have been melted\nStir to combine and let the fudge set"
        },
        {
          "headline":"Change the flavor of traditional fudge.",
          "description":"The great thing about traditional fudge is that you can add any type of flavorings you want to customize the taste. Whereas most traditional fudge recipes call for vanilla extract, you can replace that with:\nEqual parts almond extract to make a marzipan fudge\nEqual parts citrus extract to make a zesty fruit fudge\n2 tablespoons (30 ml) coffee syrup, such as hazelnut, berry, or pumpkin spice\n2 tablespoons (30 ml) liqueur"
        },
        {
          "headline":"Try different nut butters.",
          "description":"While peanut butter fudge is a very popular variety, there's no reason you can't experiment with different nut butters, especially if allergies are an issue. Instead of using peanut butter to make fudge, try:\nCashew butter\nAlmond butter\nSunflower butter\nWalnut butter\nPecan butter"
        }
      ]
    }
  ],
  "text":" Making Traditional Fudge in the Microwave Grease a baking pan. Coat an 8-inch (20-cm) baking pan with a layer of butter, oil, or cooking spray. This will prevent the fudge from sticking to the pan, and make it easier to remove once the fudge has set. Alternatively, you can also line the dish with parchment paper instead. Heat the sugar, milk, and butter. Combine the three ingredients in a large microwave-safe bowl. Add a pinch of salt. Transfer the mixture to the microwave and heat it on high for 10 minutes. Stop the microwave every two minutes to stir the mixture. Watch the mixture as it cooks, as the fudge may bubble over the sides of the bowl. Stop the microwave and stir the mixture if this happens. Traditional fudge made in the microwave takes longer to cook than other types of fudge, because the sugar must get hot enough to start caramelizing. Add the vanilla. Remove the bowl from the microwave and add the vanilla. You can use either vanilla bean paste or vanilla extract. Whisk all the ingredients together vigorously until the fudge is creamy and smooth. Return the bowl to the microwave and cook for another two minutes. When the fudge is ready, it will be thick and the color of caramel. Pour the fudge. Stir the fudge one last time and transfer it to the greased baking pan. Use a rubber spatula to scrape the sides and get all the fudge from the bowl. Use the spatula to spread the fudge evenly around the bowl. Let the fudge set before serving. Set the fudge aside and let it cool and set for at least an hour. This will give the ingredients time to cool and firm up. Don\u2019t chill the fudge in the refrigerator to set, as this can cause the sugar to crystallize. Cut and serve the fudge. After an hour, cut the fudge into 1- to 2-inch (2.5- to 5-cm) squares and serve. Transfer any leftover squares to an airtight container. Store at room temperature for up to three weeks. Making Chocolate Fudge Grease a baking pan. Fudge is quite sticky, so it\u2019s important to grease the baking pan that the fudge will be poured into. Coat an 8-inch (20-cm) baking pan with a layer of cooking spray, oil, or butter. For even easier cleanup, line the baking pan with foil or parchment paper, and coat the foil or paper with butter. Melt the butter, milk, and chocolate. Combine the milk, butter, and chocolate chips in a large microwave-safe bowl. Heat the mixture on high for three minutes, or until the butter and chips are melted. Once melted, stir the mixture to combine all the ingredients. For an even richer and stickier fudge, use condensed milk instead of regular milk. Beat in the remaining ingredients. Add the confectioner\u2019s sugar and vanilla to the bowl with the melted butter, milk, and chocolate. With a hand mixer, beat the ingredients together on medium speed. Keep beating for about two minutes, until the mixture is smooth and all the ingredients are incorporated. As you beat the fudge, scrape down the sides of the bowl with a rubber spatula or spoon as necessary. Transfer to the baking pan and chill. Pour the fudge into the prepared baking pan. Use a rubber spatula to spread the fudge out evenly in the pan. Transfer the pan to the refrigerator and let the fudge chill and set for one to two hours. The fudge is ready when it\u2019s fully cooled and firm. Cut into squares before serving. Cut the fudge into 1-inch (2.5-cm) squares for small snack-sized treats, or 2-inch (5-cm) squares for a larger dessert-sized portion. If there's any fudge leftover, transfer it to an airtight container and store it at room temperature for two to three weeks. Making Peanut Butter Fudge Melt the butter and peanut butter. Combine the peanut butter and butter in a medium microwave-safe bowl. Microwave for two minutes, removing the dish halfway through the cooking time to stir. When the fudge has cooked for two minutes, remove it from the microwave and stir it again. You can use either crunchy or smooth peanut butter to make this fudge. Crunchy peanut butter will leave some small chunks of nuts in the fudge, whereas smooth peanut butter will result in a completely smooth and creamy fudge. Mix in the sugar. Add the sugar and mix the fudge with a wooden spoon or hand mixer on medium speed. Scrape down the sides as necessary, and keep mixing until all the sugar has been fully incorporated into the fudge. You can also add 1 teaspoon (5 ml) of vanilla to the mixture at this time if you like. It\u2019s important to use confectioner\u2019s sugar, because granulated sugar will give the fudge a grainy texture. Pour the fudge into a greased baking pan. Grease an 8-inch (20-cm) baking pan with butter, cooking spray, or oil. Pour the fudge into the greased pan. Spread the fudge evenly around the pan with a wooden spatula. Chill before serving. Transfer the fudge to the refrigerator and chill for at least two hours. This will give the ingredients time to cool and allow the fudge to set. Once firm, cut the fudge into squares or slices and serve. Transfer leftovers to an airtight container. Leftovers will keep in the fridge for about two weeks. Modifying the Recipes Change the type of chocolate fudge. You can quickly and easily change the type of fudge you make just by using a different type of chocolate chip. Instead of using semi-sweet chocolate chips, you can use:\nWhite chocolate\nMilk chocolate\nButterscotch\nDark chocolate Add nuts. Fudge and nuts are a classic combination, and you can add any kind of nut you like to any flavor of fudge. Add 1 cup (125 g) of chopped raw or toasted nuts to any fudge after all the ingredients have been melted. Stir everything together before letting the fudge set. Classic nut and fudge combinations include:\nDark or milk chocolate and almonds\nWhite chocolate and macadamia nuts\nMilk chocolate and hazelnuts\nDark chocolate and pistachios\nPeanut butter and cashews\nTraditional fudge with any nut Add marshmallows. Marshmallow and chocolate is the traditional flavor of rocky road, and you can make rocky road fudge by adding 1 cup (50 g) of mini marshmallows to milk or dark chocolate fudge. For a colorful rocky road fudge, add multicolored mini marshmallows instead of plain white ones. Turn your fudge into peppermint bark. Peppermint bark is a tasty treat that\u2019s usually found around the holidays, and you can easily make a basic chocolate fudge into peppermint bark fudge:\nMake a basic chocolate fudge recipe, but replace the semi-sweet chocolate chips with white chocolate chips\nReplace the vanilla extract with peppermint extract\nAdd 1 cup (8 ounces) of crush candy cane pieces to the fudge after all the ingredients have been melted\nStir to combine and let the fudge set Change the flavor of traditional fudge. The great thing about traditional fudge is that you can add any type of flavorings you want to customize the taste. Whereas most traditional fudge recipes call for vanilla extract, you can replace that with:\nEqual parts almond extract to make a marzipan fudge\nEqual parts citrus extract to make a zesty fruit fudge\n2 tablespoons (30 ml) coffee syrup, such as hazelnut, berry, or pumpkin spice\n2 tablespoons (30 ml) liqueur Try different nut butters. While peanut butter fudge is a very popular variety, there's no reason you can't experiment with different nut butters, especially if allergies are an issue. Instead of using peanut butter to make fudge, try:\nCashew butter\nAlmond butter\nSunflower butter\nWalnut butter\nPecan butter",
  "tyn_model":[
    "baking pan",
    "butter",
    "sugar",
    "microwave",
    "bowl",
    "peanut butter",
    "milk",
    "vanilla",
    "cooking spray",
    "rubber spatula",
    "refrigerator",
    "airtight container",
    "chocolate fudge",
    "chocolate",
    "milk chocolate",
    "nuts",
    "marshmallows",
    "parchment paper",
    "microwave-safe bowl",
    "vanilla extract",
    "oil",
    "chocolate chips",
    "confectioner\u2019s sugar",
    "hand mixer",
    "peanut butter fudge",
    "nut butters",
    "butter, oil",
    "salt",
    "vanilla bean paste",
    "spatula",
    "foil",
    "condensed milk",
    "wooden spoon",
    "wooden spatula",
    "chocolate chip",
    "butterscotch",
    "fudge",
    "almonds",
    "macadamia nuts",
    "hazelnuts",
    "pistachios",
    "cashews",
    "rocky road fudge",
    "milk or dark chocolate fudge",
    "peppermint bark fudge",
    "peppermint extract",
    "candy cane",
    "almond extract",
    "citrus extract",
    "coffee syrup",
    "pumpkin spice",
    "cashew butter",
    "almond butter",
    "sunflower butter",
    "walnut butter",
    "pecan butter"
  ],
  "tyn_section":[

  ]
}