{
  "title":"How to Beat the Impossible Quiz",
  "url":"https://www.wikihow.com/Beat-the-Impossible-Quiz",
  "category_hierarchy":[
    "Hobbies and Crafts",
    "Games",
    "Puzzles and Memory Games"
  ],
  "methods":[
    {
      "name":"Solving the Quiz Yourself",
      "steps":[
        {
          "headline":"Stop and think when you can.",
          "description":"If you see a bomb, the question has a time limit. If you don't, you can take as long as you like to answer the question. Stop and make sure you're confident in your answer before continuing, especially if you're a long ways into the game. You don't want to have to start again from the beginning because you tried to save a few seconds."
        },
        {
          "headline":"Think about possible jokes and puns.",
          "description":"The answers are often illogical, making puns, jokes, or pop culture references instead of answering the question seriously. Some of them are even intentionally misspelled words to make bad jokes (\"armies\" instead of \"arms\")."
        },
        {
          "headline":"Think very literally.",
          "description":"Read the question word by word. Is there an obvious meaning \u2013 so obvious you hadn't thought of it? For example, if you're told to \"Click the answer,\" literally click the words \"the answer.\" A supposed typo or misspelling might actually be a hint."
        },
        {
          "headline":"Ask a friend for help.",
          "description":"The more people working together, the more likely you'll get the answer. Friends who know internet memes and pop culture references are especially helpful, since some of the questions are references to movies, songs, or memes that the game developer thought were funny back in 2006 and 2007."
        },
        {
          "headline":"Write down wrong answers and guesses.",
          "description":"If you have to guess, write down the answer you're going to guess before you click it. Cross it out if it was wrong, and circle it if you were right. If you lose all your lives and have to restart the game (and it's a miracle if this doesn't happen), you'll be glad you wrote down your last guess so you have fewer options to choose from next time."
        }
      ]
    },
    {
      "name":"Hints and Advice",
      "steps":[
        {
          "headline":"Use a mouse or touch screen.",
          "description":"Some of the questions require extreme precision and timing with your cursor or touch screen. If you're on a laptop, plug in a mouse instead of relying on your mouse pad."
        },
        {
          "headline":"Never skip a question.",
          "description":"The game lets you earn \"Skips\" which can be used to skip some questions if you get stuck, but don't be tempted! It is impossible to beat the game unless you have all seven \"Skips\" unused on question 110 (the last question)."
        },
        {
          "headline":"Write down the code in question 50.",
          "description":"A list of numbers is written on the screen on question 50. Write these numbers down, and be prepared to type them in on question 108."
        }
      ]
    },
    {
      "name":"Cheating",
      "steps":[
        {
          "headline":"Look up answers for the original Impossible Quiz.",
          "description":"All 110 answers are listed at The Impossible Quiz wiki. Scroll down to the bottom of the page for changes if you are using the iOS version. If you have trouble following the instructions, use this guide that includes screenshots."
        },
        {
          "headline":"Cheat on The Impossible Quiz 2.",
          "description":"The Impossible Quiz wiki has lists of answers for this game as well."
        },
        {
          "headline":"Get help on The Impossible Quiz Book.",
          "description":"Once again, the impossible quiz wiki is you friend. There are not as many guides for this game as the prequels, but you might find some others if you search online for the specific chapter (1, 2, or 3) you are currently playing."
        },
        {
          "headline":"Watch a video walkthrough.",
          "description":"YouTube has many video walkthroughs of these games being played. Some of these are straightforward guides to help players, while some, like the famous PewDiePie's, are also entertaining to watch and listen to."
        },
        {
          "headline":"Look for invisible or off-screen answers.",
          "description":"Sometimes, you'll need to ignore the answers. Click words in the question, the numbers next to the answers, or answers hidden in the pictures. If you're playing on the computer, you might even need to move your mouse outside of the game window for some puzzles."
        }
      ]
    }
  ],
  "text":" Solving the Quiz Yourself Stop and think when you can. If you see a bomb, the question has a time limit. If you don't, you can take as long as you like to answer the question. Stop and make sure you're confident in your answer before continuing, especially if you're a long ways into the game. You don't want to have to start again from the beginning because you tried to save a few seconds. Think about possible jokes and puns. The answers are often illogical, making puns, jokes, or pop culture references instead of answering the question seriously. Some of them are even intentionally misspelled words to make bad jokes (\"armies\" instead of \"arms\"). Think very literally. Read the question word by word. Is there an obvious meaning \u2013 so obvious you hadn't thought of it? For example, if you're told to \"Click the answer,\" literally click the words \"the answer.\" A supposed typo or misspelling might actually be a hint. Ask a friend for help. The more people working together, the more likely you'll get the answer. Friends who know internet memes and pop culture references are especially helpful, since some of the questions are references to movies, songs, or memes that the game developer thought were funny back in 2006 and 2007. Write down wrong answers and guesses. If you have to guess, write down the answer you're going to guess before you click it. Cross it out if it was wrong, and circle it if you were right. If you lose all your lives and have to restart the game (and it's a miracle if this doesn't happen), you'll be glad you wrote down your last guess so you have fewer options to choose from next time. Hints and Advice Use a mouse or touch screen. Some of the questions require extreme precision and timing with your cursor or touch screen. If you're on a laptop, plug in a mouse instead of relying on your mouse pad. Never skip a question. The game lets you earn \"Skips\" which can be used to skip some questions if you get stuck, but don't be tempted! It is impossible to beat the game unless you have all seven \"Skips\" unused on question 110 (the last question). Write down the code in question 50. A list of numbers is written on the screen on question 50. Write these numbers down, and be prepared to type them in on question 108. Cheating Look up answers for the original Impossible Quiz. All 110 answers are listed at The Impossible Quiz wiki. Scroll down to the bottom of the page for changes if you are using the iOS version. If you have trouble following the instructions, use this guide that includes screenshots. Cheat on The Impossible Quiz 2. The Impossible Quiz wiki has lists of answers for this game as well. Get help on The Impossible Quiz Book. Once again, the impossible quiz wiki is you friend. There are not as many guides for this game as the prequels, but you might find some others if you search online for the specific chapter (1, 2, or 3) you are currently playing. Watch a video walkthrough. YouTube has many video walkthroughs of these games being played. Some of these are straightforward guides to help players, while some, like the famous PewDiePie's, are also entertaining to watch and listen to. Look for invisible or off-screen answers. Sometimes, you'll need to ignore the answers. Click words in the question, the numbers next to the answers, or answers hidden in the pictures. If you're playing on the computer, you might even need to move your mouse outside of the game window for some puzzles.",
  "tyn_model":[
    "mouse",
    "\u2013 so",
    "impossible quiz wiki",
    "computer"
  ],
  "tyn_section":[

  ]
}