{
  "title":"How to Reuse Junk Mail",
  "url":"https://www.wikihow.com/Reuse-Junk-Mail",
  "category_hierarchy":[
    "Hobbies and Crafts",
    "Crafts"
  ],
  "methods":[
    {
      "name":"Around the house",
      "steps":[
        {
          "headline":"Use junk mail catalogs under pet dishes.",
          "description":"This is an easy way to keep kibble, biscuits and meat from messing up the floor. Whenever there is a spill, simply pick up the junk mail and toss it, replacing with a fresh piece."
        },
        {
          "headline":"Use junk mail catalogs under your kitchen trash can.",
          "description":"Let it collect the bits that get dropped. Each trash collection, also pick up the junk mail, toss it away and replace with a new piece."
        },
        {
          "headline":"Line boxes with junk mail catalogs.",
          "description":"Use the boxes for storage of items, carriage of things or for temporary housing for an injured animal while transferring it to the vet or welfare center."
        },
        {
          "headline":"Turn the backs of junk mail envelopes into writing paper.",
          "description":"Ideal for shopping lists, working out calculations and drawing doodles."
        },
        {
          "headline":"Cut out your address labels from personalized junk mail.",
          "description":"Keep these \"pre-addressed labels\" to reuse for sticking on envelopes you need to send. This can be helpful for parcels sent after selling items online. Anything padded is worth keeping for your online sales too!"
        }
      ]
    },
    {
      "name":"Crafts",
      "steps":[
        {
          "headline":"Cover a book with junk mail.",
          "description":"For a great example, see How to cover a paperback book with junk mail."
        },
        {
          "headline":"Use junk mail catalogs to turn into decoupage.",
          "description":"Cut out the fun pictures and use to decoupage boxes, old suitcases (for funky storage), old bottles (for vases), etc. Make decoupage pictures or collages using shreds of junk mail catalogs. Open the flap of junk mail envelopes to make a house shape. Glue to paper, design windows and doors, a chimney and you have instant house designs to create fun art with."
        },
        {
          "headline":"Make paper snowflakes from junk mail catalogs.",
          "description":"See How to make paper snowflakes for more details."
        },
        {
          "headline":"Turn junk mail into necklaces.",
          "description":"Punch out lots of junk mail catalogs. Use any shapes but circles work as well as any other shapes. Thread them onto a string tightly until you have the length required. Knot to close. Wear and enjoy the feel of junk mail as art."
        },
        {
          "headline":"Make paper flowers from junk mail catalogs.",
          "description":"For ideas, see How to make a paper flower bouquet and How to make a paper flower."
        },
        {
          "headline":"Transform junk mail into a paper wallet.",
          "description":"See How to make a paper wallet for one idea."
        },
        {
          "headline":"Make woven paper art.",
          "description":"You can weave junk mail into baskets, boxes, wallets, bags and more. It will look a lot better than it did as junk mail."
        }
      ]
    },
    {
      "name":"Party Ideas",
      "steps":[
        {
          "headline":"Hole punch lots of junk mail into small pieces.",
          "description":"Both catalogs and envelopes can be used. Use as confetti. Tuck the confetti pieces inside balloons before blowing them up for a fun effect."
        },
        {
          "headline":"Rip junk mail catalogs into long pieces.",
          "description":"Use as streamers for your next party event."
        }
      ]
    },
    {
      "name":"Toys and Games",
      "steps":[
        {
          "headline":"Make bingo cards from lots of catalogs that carry the same images.",
          "description":"Play bingo."
        },
        {
          "headline":"Make memory cards from catalogs with the same images.",
          "description":"Turn them all over and test your memory."
        },
        {
          "headline":"Make toy groceries and stock from catalogs.",
          "description":"Cut out the images, glue to cardboard (old cereal boxes, shoe boxes) or containers (old yogurt containers, bottles, etc.) to create toy groceries and items. Set up shop and let your kids play at displaying the goods for sale and selling them."
        },
        {
          "headline":"Give children catalogs for their artwork.",
          "description":"They can cut and rip to their heart's content and turn it into any sort of art and craft that pleases them."
        }
      ]
    }
  ],
  "text":" Around the house Use junk mail catalogs under pet dishes. This is an easy way to keep kibble, biscuits and meat from messing up the floor. Whenever there is a spill, simply pick up the junk mail and toss it, replacing with a fresh piece. Use junk mail catalogs under your kitchen trash can. Let it collect the bits that get dropped. Each trash collection, also pick up the junk mail, toss it away and replace with a new piece. Line boxes with junk mail catalogs. Use the boxes for storage of items, carriage of things or for temporary housing for an injured animal while transferring it to the vet or welfare center. Turn the backs of junk mail envelopes into writing paper. Ideal for shopping lists, working out calculations and drawing doodles. Cut out your address labels from personalized junk mail. Keep these \"pre-addressed labels\" to reuse for sticking on envelopes you need to send. This can be helpful for parcels sent after selling items online. Anything padded is worth keeping for your online sales too! Crafts Cover a book with junk mail. For a great example, see How to cover a paperback book with junk mail. Use junk mail catalogs to turn into decoupage. Cut out the fun pictures and use to decoupage boxes, old suitcases (for funky storage), old bottles (for vases), etc. Make decoupage pictures or collages using shreds of junk mail catalogs. Open the flap of junk mail envelopes to make a house shape. Glue to paper, design windows and doors, a chimney and you have instant house designs to create fun art with. Make paper snowflakes from junk mail catalogs. See How to make paper snowflakes for more details. Turn junk mail into necklaces. Punch out lots of junk mail catalogs. Use any shapes but circles work as well as any other shapes. Thread them onto a string tightly until you have the length required. Knot to close. Wear and enjoy the feel of junk mail as art. Make paper flowers from junk mail catalogs. For ideas, see How to make a paper flower bouquet and How to make a paper flower. Transform junk mail into a paper wallet. See How to make a paper wallet for one idea. Make woven paper art. You can weave junk mail into baskets, boxes, wallets, bags and more. It will look a lot better than it did as junk mail. Party Ideas Hole punch lots of junk mail into small pieces. Both catalogs and envelopes can be used. Use as confetti. Tuck the confetti pieces inside balloons before blowing them up for a fun effect. Rip junk mail catalogs into long pieces. Use as streamers for your next party event. Toys and Games Make bingo cards from lots of catalogs that carry the same images. Play bingo. Make memory cards from catalogs with the same images. Turn them all over and test your memory. Make toy groceries and stock from catalogs. Cut out the images, glue to cardboard (old cereal boxes, shoe boxes) or containers (old yogurt containers, bottles, etc.) to create toy groceries and items. Set up shop and let your kids play at displaying the goods for sale and selling them. Give children catalogs for their artwork. They can cut and rip to their heart's content and turn it into any sort of art and craft that pleases them.",
  "tyn_model":[
    "junk mail",
    "glue",
    "writing paper",
    "paper",
    "string",
    "woven paper art",
    "balloons",
    "cardboard",
    "containers"
  ],
  "tyn_section":[

  ]
}