{
  "title":"How to Make a Guild in Aura Kingdom",
  "url":"https://www.wikihow.com/Make-a-Guild-in-Aura-Kingdom",
  "category_hierarchy":[
    "Hobbies and Crafts",
    "Games",
    "Video Games",
    "Electronic Game Strategies",
    "Online Game Strategies"
  ],
  "parts":[
    {
      "name":"Create a Guild",
      "steps":[
        {
          "headline":"Press G to open the Guild window.",
          "description":"Choose Create a Guild."
        },
        {
          "headline":"Choose a name.",
          "description":"Type in the name you want your Guild to have."
        },
        {
          "headline":"Have 10 gold ready for the guild fee.",
          "description":"Also, the character used in creating the guild must be level 20 or above"
        }
      ]
    },
    {
      "name":"Invite People",
      "steps":[
        {
          "headline":"Invite guild members.",
          "description":"The more members in the guild, the better. Simply press G to bring up your guild window and then choose Recruit. Afterward, type in the name of the player you wish to invite."
        },
        {
          "headline":"Invite through your friends list.",
          "description":"Another way to recruit people is through your friends list. The Friends List button can be seen at the upper right-hand side of your screen, right next to your mini map. After opening the friend list, right click on the name of the person and then choose Recruit."
        },
        {
          "headline":"Recruit directly.",
          "description":"To recruit the person within your screen, simply right-click on their character to see the options and then choose Recruit."
        }
      ]
    },
    {
      "name":"Increase your guild EXP",
      "steps":[
        {
          "headline":"Do a daily quest.",
          "description":"In order for you to obtain guild EXP, members, including you, must do daily guild quests, which can be found in the towns and cities of Aura Kingdom."
        },
        {
          "headline":"Remind your members to do their daily quest.",
          "description":"Each quest you finish will reward you with guild EXP, character EXP, fragments, and even boxes that contain items. You have probably noticed the EXP bar found in your guild window. This indicates the amount of EXP you need in order for your guild to advance to the next level. The higher the level of the guild, the more benefits you get. As the guild Levels, the member capacity will also increase. This also increase the number of officers you can assign. The number of announcements or notes that can be added under the Affairs tab will also increase."
        }
      ]
    },
    {
      "name":"Make a Guild Emblem",
      "steps":[
        {
          "headline":"Reach guild level 3.",
          "description":"This is the required level that your guild must be to create an emblem."
        },
        {
          "headline":"Create a small emblem.",
          "description":"The size of a small emblem is 32x32 pixels, with 24-bit depth, and saved in .bmp (bitmap) file format. Most players used pre-made ones that can be found over their Internet, especially to already-existing games such as Ragnarok Online, as they have the very same emblem size and format. For your emblem to have a transparent background, color the part you want to have transparent with pink (use RGB 255 for red and blue while green is 0)."
        }
      ]
    },
    {
      "name":"Know the Guild Features",
      "steps":[
        {
          "headline":"Use the Guild Hall.",
          "description":"The Guild Hall will be available as soon as the guild reached level 5. Guild members are able to enter the Guild Hall; they can find the following in the Guild Hall:\nNPCs selling special items from crafting materials to alchemy. An auction NPC. The guild storage; this is where everyone can put the items they want to donate for lower-level guild members. Members can enter the Guild Hall with any level, but new recruits need to wait 24 hours before they can use the Guild Hall. To enter the hall, press G to open the guild window and then choose Guild Hall at the bottom part. You will be automatically teleported inside the Guild Hall."
        },
        {
          "headline":"Use the Summoning Device.",
          "description":"Inside the Guild Hall, you can find a summoning NPC in the middle of the map. Use the NPC to summon Eidolons. After summoning, guild members can enter the Guild Hall to kill the Eidolon together to obtain keys. A summon costs 100 pieces of Eidolon Energy."
        },
        {
          "headline":"Kill Eidolons.",
          "description":"Nearly every day, the Guild Hall summons certain Eidolons without the need of Eidolon Energy. Anyone can kill the Eidolon for drops, whether in party or solo. You get to pick up Eidolon keys, which is used to create a Summoning Key for you to own your very own Eidolons."
        },
        {
          "headline":"Assign officers.",
          "description":"In the guild, you can assign ranks to any members, which gives them the authority to either recruit, expel, and add new announcements in Guild Affairs. Basically, officers are the guild leader's trusted members who will take care of the group while the leader is away."
        }
      ]
    }
  ],
  "text":" Create a Guild Press G to open the Guild window. Choose Create a Guild. Choose a name. Type in the name you want your Guild to have. Have 10 gold ready for the guild fee. Also, the character used in creating the guild must be level 20 or above Invite People Invite guild members. The more members in the guild, the better. Simply press G to bring up your guild window and then choose Recruit. Afterward, type in the name of the player you wish to invite. Invite through your friends list. Another way to recruit people is through your friends list. The Friends List button can be seen at the upper right-hand side of your screen, right next to your mini map. After opening the friend list, right click on the name of the person and then choose Recruit. Recruit directly. To recruit the person within your screen, simply right-click on their character to see the options and then choose Recruit. Increase your guild EXP Do a daily quest. In order for you to obtain guild EXP, members, including you, must do daily guild quests, which can be found in the towns and cities of Aura Kingdom. Remind your members to do their daily quest. Each quest you finish will reward you with guild EXP, character EXP, fragments, and even boxes that contain items. You have probably noticed the EXP bar found in your guild window. This indicates the amount of EXP you need in order for your guild to advance to the next level. The higher the level of the guild, the more benefits you get. As the guild Levels, the member capacity will also increase. This also increase the number of officers you can assign. The number of announcements or notes that can be added under the Affairs tab will also increase. Make a Guild Emblem Reach guild level 3. This is the required level that your guild must be to create an emblem. Create a small emblem. The size of a small emblem is 32x32 pixels, with 24-bit depth, and saved in .bmp (bitmap) file format. Most players used pre-made ones that can be found over their Internet, especially to already-existing games such as Ragnarok Online, as they have the very same emblem size and format. For your emblem to have a transparent background, color the part you want to have transparent with pink (use RGB 255 for red and blue while green is 0). Know the Guild Features Use the Guild Hall. The Guild Hall will be available as soon as the guild reached level 5. Guild members are able to enter the Guild Hall; they can find the following in the Guild Hall:\nNPCs selling special items from crafting materials to alchemy. An auction NPC. The guild storage; this is where everyone can put the items they want to donate for lower-level guild members. Members can enter the Guild Hall with any level, but new recruits need to wait 24 hours before they can use the Guild Hall. To enter the hall, press G to open the guild window and then choose Guild Hall at the bottom part. You will be automatically teleported inside the Guild Hall. Use the Summoning Device. Inside the Guild Hall, you can find a summoning NPC in the middle of the map. Use the NPC to summon Eidolons. After summoning, guild members can enter the Guild Hall to kill the Eidolon together to obtain keys. A summon costs 100 pieces of Eidolon Energy. Kill Eidolons. Nearly every day, the Guild Hall summons certain Eidolons without the need of Eidolon Energy. Anyone can kill the Eidolon for drops, whether in party or solo. You get to pick up Eidolon keys, which is used to create a Summoning Key for you to own your very own Eidolons. Assign officers. In the guild, you can assign ranks to any members, which gives them the authority to either recruit, expel, and add new announcements in Guild Affairs. Basically, officers are the guild leader's trusted members who will take care of the group while the leader is away.",
  "tyn_model":[
    "guild hall",
    "eidolons",
    "eidolon",
    "officers",
    "aura kingdom",
    "exp",
    "guild emblem",
    "emblem"
  ],
  "tyn_section":[

  ]
}