{
  "title":"How to Connect an Xbox 360 Account to a PC",
  "url":"https://www.wikihow.com/Connect-an-Xbox-360-Account-to-a-PC",
  "category_hierarchy":[
    "Hobbies and Crafts",
    "Games",
    "Video Games",
    "Xbox",
    "Xbox 360"
  ],
  "methods":[
    {
      "name":"Windows 8 and 10",
      "steps":[
        {
          "headline":"Open the Start menu.",
          "description":"To do so, press the \u229e Win key, or click the Start icon in the bottom-left corner of the screen."
        },
        {
          "headline":"Type \"groove\" into the search bar.",
          "description":"This will bring up a list of search results, one of which is Groove Music. On Windows 10, with the Start menu open, simply begin typing \"groove\" on the keyboard and a search will start automatically."
        },
        {
          "headline":"Click Groove Music.",
          "description":"Doing so will open Groove Music, which is a music player to which your computer and Xbox 360 both synchronize. If you sign into Groove with your Xbox 360 account, you'll be able to view your Xbox 360 purchases. You will need a Groove subscription on your Xbox 360 to play music on it."
        },
        {
          "headline":"Click Sign In.",
          "description":"You'll see this option in the lower-left side of the \"Groove\" window. If you're already signed into a different account, click your name here instead and then click Sign Out."
        },
        {
          "headline":"Click Microsoft Account.",
          "description":"This will open a page on which you can enter your Xbox 360 account's email address and password."
        },
        {
          "headline":"Type in your email address and password.",
          "description":"These must be the same credentials you use to sign into the Xbox 360 account you're trying to link."
        },
        {
          "headline":"Click Sign in.",
          "description":"It's a blue button at the bottom of the page. As long as your password and email address are correct, you should now be able to play your Xbox 360's music on your computer (and vice versa)."
        },
        {
          "headline":"Re-open the Start menu.",
          "description":"Press \u229e Win or click the icon in the bottom-left corner of the screen."
        },
        {
          "headline":"Type \"movies & tv\" into the search bar.",
          "description":"Doing so will bring up the \"Movies & TV\" app as a result."
        },
        {
          "headline":"Click Movies & TV.",
          "description":"This app is where all of your Microsoft account's purchased movies and TV shows appear."
        },
        {
          "headline":"Click the person-shaped icon.",
          "description":"It's in the top-right corner of the screen. You'll see a drop-down menu appear. If you're already logged in on a different account, click your account email and then click Sign out before proceeding."
        },
        {
          "headline":"Click Microsoft Account.",
          "description":"Like Groove, this will open a page for you to enter your Xbox 360 account's email address and password."
        },
        {
          "headline":"Type in your email address and password.",
          "description":"These must be the same credentials you use to sign into the Xbox 360 account you're trying to link."
        },
        {
          "headline":"Click Sign in.",
          "description":"Doing so will open your Xbox 360's video library; you'll be able to watch any purchased movies or TV show seasons here. This process goes both ways: signing into your Xbox 360 with your default Windows account information will allow you to access your Windows' media on your Xbox 360."
        }
      ]
    },
    {
      "name":"Windows 7 and Vista",
      "steps":[
        {
          "headline":"Make sure your Xbox 360 is on the same network as your computer.",
          "description":"To do so, you'll turn on your Xbox 360 and sign in, then do the following:\nPress the guide button (the X) in the middle of the controller. Scroll over to the \"Settings\" page and select System Settings. Scroll down and select Network Settings. Look at the name of the Wi-Fi network on the card that's in the foreground. If it matches your computer, proceed; if not, select your Wi-Fi network from this menu and wait for it to connect."
        },
        {
          "headline":"Press the Xbox controller's guide button again.",
          "description":"It's the X in the middle of the controller."
        },
        {
          "headline":"Scroll right to the \"Media\" tab and select Windows Media Center.",
          "description":"You'll see the \"Media\" tab to the right of the main guide menu after opening it."
        },
        {
          "headline":"Press A, then select Continue.",
          "description":"It's at the bottom of the page."
        },
        {
          "headline":"Press A and review your eight-digit code.",
          "description":"You'll need to type this code into Windows Media Center on your computer to pair your Xbox 360 with your PC."
        },
        {
          "headline":"Open your computer's Start menu.",
          "description":"To do so, press the \u229e Win key on the computer's keyboard, or click the Windows icon in the bottom-left corner of the screen."
        },
        {
          "headline":"Click Windows Media Center.",
          "description":"It's a green app with the Windows icon on it. If you don't see Windows Media Center in the Start menu, just type \"windows media center\" into the search bar at the bottom of the Start menu and click on the app when it appears."
        },
        {
          "headline":"Scroll down to \"Tasks\" and click Add Extender.",
          "description":"\"Tasks\" is a tab on the left side of the Windows Media Center window; you'll see the Add Extender button directly below it."
        },
        {
          "headline":"Click Next.",
          "description":"It's at the bottom of the Windows Media Center window."
        },
        {
          "headline":"Type in the eight-digit code.",
          "description":"This is the code you got from your Xbox 360."
        },
        {
          "headline":"Click Next.",
          "description":"Doing so will implement the code. If you correctly entered it and your console/computer are on the same network, the two are now connected."
        },
        {
          "headline":"Re-open Windows Media Center on your Xbox 360.",
          "description":"To do so, simply press the guide button, scroll right to the \"Media\" tab, and press A while Windows Media Center is selected."
        },
        {
          "headline":"Wait for your Windows media to show up on your console.",
          "description":"Depending on how vast your Windows Media Center library is, this process may take awhile. Once your media is available in your Xbox's Windows Media Center app, you'll be able to listen to music and watch movies on both of your devices."
        }
      ]
    }
  ],
  "text":" Windows 8 and 10 Open the Start menu. To do so, press the \u229e Win key, or click the Start icon in the bottom-left corner of the screen. Type \"groove\" into the search bar. This will bring up a list of search results, one of which is Groove Music. On Windows 10, with the Start menu open, simply begin typing \"groove\" on the keyboard and a search will start automatically. Click Groove Music. Doing so will open Groove Music, which is a music player to which your computer and Xbox 360 both synchronize. If you sign into Groove with your Xbox 360 account, you'll be able to view your Xbox 360 purchases. You will need a Groove subscription on your Xbox 360 to play music on it. Click Sign In. You'll see this option in the lower-left side of the \"Groove\" window. If you're already signed into a different account, click your name here instead and then click Sign Out. Click Microsoft Account. This will open a page on which you can enter your Xbox 360 account's email address and password. Type in your email address and password. These must be the same credentials you use to sign into the Xbox 360 account you're trying to link. Click Sign in. It's a blue button at the bottom of the page. As long as your password and email address are correct, you should now be able to play your Xbox 360's music on your computer (and vice versa). Re-open the Start menu. Press \u229e Win or click the icon in the bottom-left corner of the screen. Type \"movies & tv\" into the search bar. Doing so will bring up the \"Movies & TV\" app as a result. Click Movies & TV. This app is where all of your Microsoft account's purchased movies and TV shows appear. Click the person-shaped icon. It's in the top-right corner of the screen. You'll see a drop-down menu appear. If you're already logged in on a different account, click your account email and then click Sign out before proceeding. Click Microsoft Account. Like Groove, this will open a page for you to enter your Xbox 360 account's email address and password. Type in your email address and password. These must be the same credentials you use to sign into the Xbox 360 account you're trying to link. Click Sign in. Doing so will open your Xbox 360's video library; you'll be able to watch any purchased movies or TV show seasons here. This process goes both ways: signing into your Xbox 360 with your default Windows account information will allow you to access your Windows' media on your Xbox 360. Windows 7 and Vista Make sure your Xbox 360 is on the same network as your computer. To do so, you'll turn on your Xbox 360 and sign in, then do the following:\nPress the guide button (the X) in the middle of the controller. Scroll over to the \"Settings\" page and select System Settings. Scroll down and select Network Settings. Look at the name of the Wi-Fi network on the card that's in the foreground. If it matches your computer, proceed; if not, select your Wi-Fi network from this menu and wait for it to connect. Press the Xbox controller's guide button again. It's the X in the middle of the controller. Scroll right to the \"Media\" tab and select Windows Media Center. You'll see the \"Media\" tab to the right of the main guide menu after opening it. Press A, then select Continue. It's at the bottom of the page. Press A and review your eight-digit code. You'll need to type this code into Windows Media Center on your computer to pair your Xbox 360 with your PC. Open your computer's Start menu. To do so, press the \u229e Win key on the computer's keyboard, or click the Windows icon in the bottom-left corner of the screen. Click Windows Media Center. It's a green app with the Windows icon on it. If you don't see Windows Media Center in the Start menu, just type \"windows media center\" into the search bar at the bottom of the Start menu and click on the app when it appears. Scroll down to \"Tasks\" and click Add Extender. \"Tasks\" is a tab on the left side of the Windows Media Center window; you'll see the Add Extender button directly below it. Click Next. It's at the bottom of the Windows Media Center window. Type in the eight-digit code. This is the code you got from your Xbox 360. Click Next. Doing so will implement the code. If you correctly entered it and your console/computer are on the same network, the two are now connected. Re-open Windows Media Center on your Xbox 360. To do so, simply press the guide button, scroll right to the \"Media\" tab, and press A while Windows Media Center is selected. Wait for your Windows media to show up on your console. Depending on how vast your Windows Media Center library is, this process may take awhile. Once your media is available in your Xbox's Windows Media Center app, you'll be able to listen to music and watch movies on both of your devices.",
  "tyn_model":[
    "xbox 360",
    "windows media center",
    "\u229e win",
    "wi-fi network",
    "groove music",
    "groove subscription",
    "xbox controller",
    "media center",
    "computer"
  ],
  "tyn_section":[

  ]
}