{
  "title":"How to Connect Xbox 360 Wired Controller to PC Windows 8",
  "url":"https://www.wikihow.com/Connect-Xbox-360-Wired-Controller-to-PC-Windows-8",
  "category_hierarchy":[
    "Hobbies and Crafts",
    "Games",
    "Video Games",
    "Xbox",
    "Xbox 360"
  ],
  "parts":[
    {
      "name":"Downloading the Drivers",
      "steps":[
        {
          "headline":"Open the Xbox 360 controller drivers page.",
          "description":"From here, download the drivers from the \"Download\" section. These drivers will make your Xbox 360 controller work with Windows 8's operating system."
        },
        {
          "headline":"Click the box beneath the \"Software & Drivers\" heading.",
          "description":"Doing so will prompt a drop-down menu with all of the available drivers for the Xbox 360 controller. You'll see two Windows 7 options here: \"32-bit only\" and \"64-bit only\". If the page doesn't scroll down automatically, first scroll down to below the \"Free Shipping. Free Returns\" banner and click Download on the right side of the page."
        },
        {
          "headline":"Click a Windows 7 option.",
          "description":"Since the Xbox 360 controller doesn't have Windows 8 drivers available, you'll use the Windows 7 drivers that correspond to your version of Windows (32-bit or 64-bit). If you aren't sure of your operating system's bit count, you can check your version of Windows."
        },
        {
          "headline":"Click the download link.",
          "description":"It's below the box with your drivers' information; the link will say something like \"Xbox 360 Accessories Software 1.2\". Once you click the link, the drivers file will begin to download. Depending on your browser, you may first need to select a download location."
        },
        {
          "headline":"Right-click the setup file.",
          "description":"You'll find the file in your computer's default downloads location (e.g., the desktop). The file should be named \"Xbox360_[bit number]Eng\" where \"[bit number]\" is \"32\" or \"64\" depending on your operating system version."
        },
        {
          "headline":"Click Properties.",
          "description":"It's at the bottom of the drop-down menu."
        },
        {
          "headline":"Click the Compatibility tab.",
          "description":"You'll see this option at the top of the \"Properties\" window."
        },
        {
          "headline":"Check the box next to \"Run this program in compatibility mode for:\".",
          "description":"This text is beneath the \"Compatibility mode\" heading."
        },
        {
          "headline":"Click the operating system box.",
          "description":"It's below the \"Run this program in compatibility mode for:\" text. If you've never used compatibility mode before, this box will likely say \"Window XP\" or something similar."
        },
        {
          "headline":"Click Windows 7.",
          "description":"It's toward the bottom of the drop-down window here."
        },
        {
          "headline":"Click OK. Now you should be able to install the drivers without a problem.",
          "description":""
        },
        {
          "headline":"Double-click the setup file.",
          "description":"Doing so will launch the setup window."
        },
        {
          "headline":"Follow the on-screen instructions.",
          "description":"You'll likely need to click Yes when prompted to allow the setup file access to your computer, after which you'll simply check the \"I agree\" box on the \"Terms and Conditions\" page and then click Next to begin installing the drivers."
        },
        {
          "headline":"Wait for the drivers to finish installing.",
          "description":"This process will likely take several minutes."
        },
        {
          "headline":"Click Finish.",
          "description":"It's in the bottom-right corner of the setup window. Doing so will complete the drivers' installation, though you'll need to restart your computer in order for them to work properly."
        },
        {
          "headline":"Click Yes to restart the computer.",
          "description":"You'll see this pop up in a window; clicking it will restart your computer and ensure that your Xbox 360 controller's drivers are properly integrated. Make sure you save any open work before restarting your computer."
        }
      ]
    },
    {
      "name":"Connecting the Controller",
      "steps":[
        {
          "headline":"Plug your controller into your computer.",
          "description":"Do so by plugging the narrow end of the controller's USB charging cable into the controller and the large end of the USB cable into one of your computer's USB ports. USB port locations vary depending on the type of computer you're using. If you can't locate the USB ports, check the sides or the back of your computer's CPU (desktop) or the back of the casing (laptop)."
        },
        {
          "headline":"Press the Xbox button.",
          "description":"It's the large, circular X button in the middle of the controller. Doing so will turn on your controller. If prompted, first click Yes when asked if you trust the device."
        },
        {
          "headline":"Place your mouse cursor in the top-right corner of the screen.",
          "description":"After a second, you'll see a column pop out."
        },
        {
          "headline":"Click Settings.",
          "description":"It's at the bottom of the column on the right side of the screen."
        },
        {
          "headline":"Click PC Info.",
          "description":"It's near the bottom of the \"Settings\" column."
        },
        {
          "headline":"Click Device Manager.",
          "description":"This option is in the top-left corner of the \"PC Info\" page."
        },
        {
          "headline":"Scroll down and double-click Xbox 360 Peripherals.",
          "description":"It's at the bottom of the page; double-clicking this option will expand it to show all Xbox 360 accessories. You should see \"Xbox 360 Controller for Windows\" listed below the \"Xbox 360 Peripherals\" heading."
        },
        {
          "headline":"Right-click Xbox 360 Controller for Windows.",
          "description":"If you don't see this option, try unplugging your controller from its current USB port and plugging it into a different one."
        },
        {
          "headline":"Click Update Driver Software.",
          "description":"It's the top option in the drop-down menu."
        },
        {
          "headline":"Click Search automatically for updated driver software.",
          "description":"Doing so will scan for any missing or outdated drivers for your controller. Since you already installed the drivers, you'll likely see a message that says \"This device is using the best drivers,\" in which case your controller is ready to use. If you're prompted to update the drivers, follow the on-screen instructions to do so. After this process is complete, your Xbox 360 controller will be usable with Windows 8!"
        }
      ]
    }
  ],
  "text":" Downloading the Drivers Open the Xbox 360 controller drivers page. From here, download the drivers from the \"Download\" section. These drivers will make your Xbox 360 controller work with Windows 8's operating system. Click the box beneath the \"Software & Drivers\" heading. Doing so will prompt a drop-down menu with all of the available drivers for the Xbox 360 controller. You'll see two Windows 7 options here: \"32-bit only\" and \"64-bit only\". If the page doesn't scroll down automatically, first scroll down to below the \"Free Shipping. Free Returns\" banner and click Download on the right side of the page. Click a Windows 7 option. Since the Xbox 360 controller doesn't have Windows 8 drivers available, you'll use the Windows 7 drivers that correspond to your version of Windows (32-bit or 64-bit). If you aren't sure of your operating system's bit count, you can check your version of Windows. Click the download link. It's below the box with your drivers' information; the link will say something like \"Xbox 360 Accessories Software 1.2\". Once you click the link, the drivers file will begin to download. Depending on your browser, you may first need to select a download location. Right-click the setup file. You'll find the file in your computer's default downloads location (e.g., the desktop). The file should be named \"Xbox360_[bit number]Eng\" where \"[bit number]\" is \"32\" or \"64\" depending on your operating system version. Click Properties. It's at the bottom of the drop-down menu. Click the Compatibility tab. You'll see this option at the top of the \"Properties\" window. Check the box next to \"Run this program in compatibility mode for:\". This text is beneath the \"Compatibility mode\" heading. Click the operating system box. It's below the \"Run this program in compatibility mode for:\" text. If you've never used compatibility mode before, this box will likely say \"Window XP\" or something similar. Click Windows 7. It's toward the bottom of the drop-down window here. Click OK. Now you should be able to install the drivers without a problem.  Double-click the setup file. Doing so will launch the setup window. Follow the on-screen instructions. You'll likely need to click Yes when prompted to allow the setup file access to your computer, after which you'll simply check the \"I agree\" box on the \"Terms and Conditions\" page and then click Next to begin installing the drivers. Wait for the drivers to finish installing. This process will likely take several minutes. Click Finish. It's in the bottom-right corner of the setup window. Doing so will complete the drivers' installation, though you'll need to restart your computer in order for them to work properly. Click Yes to restart the computer. You'll see this pop up in a window; clicking it will restart your computer and ensure that your Xbox 360 controller's drivers are properly integrated. Make sure you save any open work before restarting your computer. Connecting the Controller Plug your controller into your computer. Do so by plugging the narrow end of the controller's USB charging cable into the controller and the large end of the USB cable into one of your computer's USB ports. USB port locations vary depending on the type of computer you're using. If you can't locate the USB ports, check the sides or the back of your computer's CPU (desktop) or the back of the casing (laptop). Press the Xbox button. It's the large, circular X button in the middle of the controller. Doing so will turn on your controller. If prompted, first click Yes when asked if you trust the device. Place your mouse cursor in the top-right corner of the screen. After a second, you'll see a column pop out. Click Settings. It's at the bottom of the column on the right side of the screen. Click PC Info. It's near the bottom of the \"Settings\" column. Click Device Manager. This option is in the top-left corner of the \"PC Info\" page. Scroll down and double-click Xbox 360 Peripherals. It's at the bottom of the page; double-clicking this option will expand it to show all Xbox 360 accessories. You should see \"Xbox 360 Controller for Windows\" listed below the \"Xbox 360 Peripherals\" heading. Right-click Xbox 360 Controller for Windows. If you don't see this option, try unplugging your controller from its current USB port and plugging it into a different one. Click Update Driver Software. It's the top option in the drop-down menu. Click Search automatically for updated driver software. Doing so will scan for any missing or outdated drivers for your controller. Since you already installed the drivers, you'll likely see a message that says \"This device is using the best drivers,\" in which case your controller is ready to use. If you're prompted to update the drivers, follow the on-screen instructions to do so. After this process is complete, your Xbox 360 controller will be usable with Windows 8!",
  "tyn_model":[
    "xbox 360 controller",
    "drivers",
    "xbox 360 accessories",
    "xbox 360 peripherals",
    "xbox 360 controller drivers",
    "windows 7 options",
    "windows 7 drivers",
    "windows 7",
    "xbox 360",
    "usb charging cable",
    "usb cable",
    "xbox button",
    "controller",
    "windows 8"
  ],
  "tyn_section":[

  ]
}