{
  "title":"How to Cheat on Shrek 2",
  "url":"https://www.wikihow.com/Cheat-on-Shrek-2",
  "category_hierarchy":[
    "Hobbies and Crafts",
    "Games",
    "Video Games",
    "Multi Platform Games"
  ],
  "methods":[
    {
      "name":"Shrek 2 on PC",
      "steps":[
        {
          "headline":"Press enter.",
          "description":"You'll see a text box where you will enter the cheat code."
        },
        {
          "headline":"Enter the code.",
          "description":"There are only two codes (Write without quotes). Cheat mode - \"i am the best\". Obtain All Potions - \"Yahoo\""
        },
        {
          "headline":"Press enter to send the code to game.",
          "description":""
        }
      ]
    },
    {
      "name":"Shrek 2 on PS2",
      "steps":[
        {
          "headline":"Access the level \"Spooky Forest\".",
          "description":""
        },
        {
          "headline":"Enter the scrapbook.",
          "description":""
        },
        {
          "headline":"Enter them:",
          "description":"Enable cheat mode: L1, L2, R1, R2, \u25b2\u25bc\u25c4\u25ba\u25b2\u25bc\u25bc\u25bc Bonus games: \u25c4\u25b2XO\u25c4\u25b2XO\u25c4\u25b2XO\u25a0O\u25a0O\u25a0O and enter \"Bonus\" to surprise Full Health:  \u25c4\u25b2XO\u25c4\u25b2XO\u25c4\u25b2XO\u25b2\u25ba\u25bc\u25c4\u25b2 1000 Coins: \u25c4\u25b2XO\u25c4\u25b2XO\u25c4\u25b2XOOOOOO All levels: (enter in first level only) \u25c4\u25b2XO\u25c4\u25b2XO\u25c4\u25b2XO\u25b2\u25b2\u25b2\u25b2\u25b2 (You'll hear \"That's what I call spreading joy.\" if entered correctly)"
        }
      ]
    },
    {
      "name":"Shrek 2 on GameCube",
      "steps":[
        {
          "headline":"Open the scrapbook in the pause menu.",
          "description":""
        },
        {
          "headline":"Enter these:",
          "description":"1000 Coins: LEFT, UP, A, X, LEFT, UP, A, X, LEFT, UP, A, X, X, X, X, X, X Refill health: LEFT, UP, A, X, LEFT, UP, A, X, LEFT, UP, A, X, UP, Right, DOWN, LEFT, UP All Bonuses: LEFT, UP, A, X, LEFT, UP, A, X, LEFT, UP, A, X, Y, X, Y, X, Y, X All levels: LEFT, UP, A, X, LEFT, UP, A, X, LEFT, UP, A, X, UP, UP, UP, UP, UP"
        }
      ]
    }
  ],
  "text":" Shrek 2 on PC Press enter. You'll see a text box where you will enter the cheat code. Enter the code. There are only two codes (Write without quotes). Cheat mode - \"i am the best\". Obtain All Potions - \"Yahoo\" Press enter to send the code to game.  Shrek 2 on PS2 Access the level \"Spooky Forest\".  Enter the scrapbook.  Enter them: Enable cheat mode: L1, L2, R1, R2, \u25b2\u25bc\u25c4\u25ba\u25b2\u25bc\u25bc\u25bc Bonus games: \u25c4\u25b2XO\u25c4\u25b2XO\u25c4\u25b2XO\u25a0O\u25a0O\u25a0O and enter \"Bonus\" to surprise Full Health:  \u25c4\u25b2XO\u25c4\u25b2XO\u25c4\u25b2XO\u25b2\u25ba\u25bc\u25c4\u25b2 1000 Coins: \u25c4\u25b2XO\u25c4\u25b2XO\u25c4\u25b2XOOOOOO All levels: (enter in first level only) \u25c4\u25b2XO\u25c4\u25b2XO\u25c4\u25b2XO\u25b2\u25b2\u25b2\u25b2\u25b2 (You'll hear \"That's what I call spreading joy.\" if entered correctly) Shrek 2 on GameCube Open the scrapbook in the pause menu.  Enter these: 1000 Coins: LEFT, UP, A, X, LEFT, UP, A, X, LEFT, UP, A, X, X, X, X, X, X Refill health: LEFT, UP, A, X, LEFT, UP, A, X, LEFT, UP, A, X, UP, Right, DOWN, LEFT, UP All Bonuses: LEFT, UP, A, X, LEFT, UP, A, X, LEFT, UP, A, X, Y, X, Y, X, Y, X All levels: LEFT, UP, A, X, LEFT, UP, A, X, LEFT, UP, A, X, UP, UP, UP, UP, UP",
  "tyn_model":[
    "\u25c4\u25b2",
    "\u25a0o",
    "\u25b2\u25bc",
    "\u25b2\u25b2",
    "scrapbook",
    "\u25c4\u25ba",
    "\u25bc\u25bc",
    "\u25b2\u25ba",
    "\u25bc\u25c4",
    "\u25b2 1000",
    "\u25b2 (",
    "gamecube open"
  ],
  "tyn_section":[

  ]
}