{
  "title":"How to Make a Breakfast Pizza with a Crust",
  "url":"https://www.wikihow.com/Make-a-Breakfast-Pizza-with-a-Crust",
  "category_hierarchy":[
    "Food and Entertaining",
    "Breakfast",
    "Savory Breakfast Dishes"
  ],
  "methods":[
    {
      "name":"Making a Hearty Breakfast Pizza",
      "steps":[
        {
          "headline":"Choose your crust.",
          "description":"Pick the crust that you think is fitting for this breakfast pizza. Hand tossed, thin and crispy, Chicago style, New York style, wheat, gluten free\u2013\u2013all are suitable, it's just a question of taste."
        },
        {
          "headline":"Prepare French fries.",
          "description":"Yes, that's right\u2013\u2013French fries! Use enough for one or two servings and bake them in the oven for five to six minutes at 350\u00baF/180\u00baF."
        },
        {
          "headline":"Prepare the meats.",
          "description":"Get out the bacon, ham and ground sausage. Cut the ham into small bits. Cook the bacon in a skillet/frying pan halfway. Do not allow it to get too crispy. After the bacon is cool, break the pieces into bits. Brown and crumble the ground sausage. It should be cooked rather thoroughly."
        },
        {
          "headline":"Take the fries out.",
          "description":"Let them cool a little, along with the meats."
        },
        {
          "headline":"Put it all together.",
          "description":"Sprinkle garlic on the crust that you have chosen. This, of course, is optional. Put the fries down as the base, followed by cheddar cheese. You can cut the fries to bits or leave them whole. Add all of the meats, then top it off with your choice of mozzarella or provolone cheese. You can also use both!"
        },
        {
          "headline":"Cook the pizza.",
          "description":"After all the ingredients have been placed on the pizza, it's time to put it in the oven. Bake at 450\u00baF for 7-10 minutes (depending on how crispy you would like it)."
        },
        {
          "headline":"Serve immediately.",
          "description":""
        }
      ]
    },
    {
      "name":"Making a Healthier Breakfast Pizza",
      "steps":[
        {
          "headline":"Choose a crust.",
          "description":"For this pizza, a good (healthy) choice would be a crispy thin crust or a New York style. However, any healthy crust will do."
        },
        {
          "headline":"Beat the eggs.",
          "description":"Put three eggs in a bowl and stir them thoroughly. Pour the eggs on the crust and spread them as the base. If three is not enough, you may add more."
        },
        {
          "headline":"Add the healthy toppings.",
          "description":"Baby spinach leaves go first, gently soaking in the eggs. Add mozzarella cheese and onions."
        },
        {
          "headline":"Place the healthy pizza in the oven at 450\u00baF for 7-10 minutes (depending on how crispy you would like it).",
          "description":""
        }
      ]
    }
  ],
  "text":" Making a Hearty Breakfast Pizza Choose your crust. Pick the crust that you think is fitting for this breakfast pizza. Hand tossed, thin and crispy, Chicago style, New York style, wheat, gluten free\u2013\u2013all are suitable, it's just a question of taste. Prepare French fries. Yes, that's right\u2013\u2013French fries! Use enough for one or two servings and bake them in the oven for five to six minutes at 350\u00baF/180\u00baF. Prepare the meats. Get out the bacon, ham and ground sausage. Cut the ham into small bits. Cook the bacon in a skillet/frying pan halfway. Do not allow it to get too crispy. After the bacon is cool, break the pieces into bits. Brown and crumble the ground sausage. It should be cooked rather thoroughly. Take the fries out. Let them cool a little, along with the meats. Put it all together. Sprinkle garlic on the crust that you have chosen. This, of course, is optional. Put the fries down as the base, followed by cheddar cheese. You can cut the fries to bits or leave them whole. Add all of the meats, then top it off with your choice of mozzarella or provolone cheese. You can also use both! Cook the pizza. After all the ingredients have been placed on the pizza, it's time to put it in the oven. Bake at 450\u00baF for 7-10 minutes (depending on how crispy you would like it). Serve immediately.  Making a Healthier Breakfast Pizza Choose a crust. For this pizza, a good (healthy) choice would be a crispy thin crust or a New York style. However, any healthy crust will do. Beat the eggs. Put three eggs in a bowl and stir them thoroughly. Pour the eggs on the crust and spread them as the base. If three is not enough, you may add more. Add the healthy toppings. Baby spinach leaves go first, gently soaking in the eggs. Add mozzarella cheese and onions. Place the healthy pizza in the oven at 450\u00baF for 7-10 minutes (depending on how crispy you would like it). ",
  "tyn_model":[
    "eggs",
    "oven",
    "bacon",
    "ham",
    "sausage",
    "french fries",
    "skillet/frying pan",
    "garlic",
    "cheddar cheese",
    "mozzarella or",
    "provolone cheese",
    "bowl",
    "baby spinach",
    "mozzarella cheese",
    "onions"
  ],
  "tyn_section":[

  ]
}