{
  "title":"How to Make Chocolate Muffins",
  "url":"https://www.wikihow.com/Make-Chocolate-Muffins",
  "category_hierarchy":[
    "Food and Entertaining",
    "Recipes",
    "Baking",
    "Muffins"
  ],
  "parts":[
    {
      "name":"Preparing the Batter",
      "steps":[
        {
          "headline":"Preheat the oven to 400 \u00b0F (204 \u00b0C).",
          "description":"Turn the oven up to 400 degrees Farenheit and wait for it to preheat completely. Use the time that you\u2019re waiting to make the muffin batter."
        },
        {
          "headline":"Mix the dry ingredients together.",
          "description":"Pour the flour, cocoa powder, chocolate chips, sugar, baking powder, baking soda and salt into a large bowl. Stir all the ingredients together with a large spoon until they are all mixed together."
        },
        {
          "headline":"Beat the egg.",
          "description":"Break the egg into a small bowl, the use a fork to mix the egg. Make sure that the yolk and the egg white are completely blended."
        },
        {
          "headline":"Mix the wet ingredients together.",
          "description":"Pour the beaten egg into a large bowl, then pour in the milk and oil. Whisk the ingredients together until they are all mixed."
        },
        {
          "headline":"Add the dry ingredients into the wet ingredients and mix.",
          "description":"Pour the dry ingredients that you just mixed little by little into the wet ingredients, stirring continuously. Stir until all the ingredients are just combined. Make sure not to over-stir, as this can change the consistency of the muffins."
        }
      ]
    },
    {
      "name":"Baking the Muffins",
      "steps":[
        {
          "headline":"Grease the muffin pan or insert muffin wrappers.",
          "description":"Use a stick of butter or vegetable oil spray to spray the inside of each compartment of a 12-muffin pan. If you prefer to use paper or aluminum muffin wrappers, place one wrapper into each insert of the pan. Greasing the pan ensures that the muffins won\u2019t stick to the pan after they\u2019ve baked. Using muffin wrappers lets you skip the process of greasing the pan and ensures that the muffins will come out of the pan easily after they\u2019ve baked."
        },
        {
          "headline":"Pour the batter into the muffin pans.",
          "description":"Carefully pour or spoon the muffin batter into each insert of the muffin tin until about two-thirds full. Try to distribute the batter equally so that each muffin is about the same size. Smooth the tops of the batter with a spoon if they\u2019re uneven on top. You can also hold the muffin tin in each hand and shake it gently side to side to make sure that the batter lays flat in each insert."
        },
        {
          "headline":"Put extra chocolate chips and sparkling sugar on top.",
          "description":"If you wish, sprinkle some chocolate chips and sparkling sugar on top of each compartment of batter. This will give the top of each muffin more texture and sweetness. You can skip this step if you want a more consistent texture for your muffins."
        },
        {
          "headline":"Bake the muffins 18-22 minutes.",
          "description":"Put the muffin tin in the oven and bake for 18-22 minutes. After 18 minutes, poke one muffin with a toothpick. If it comes out clean, take out the muffins. If not, keep checking every minute until the toothpick comes out completely clean."
        }
      ]
    },
    {
      "name":"Serving the Muffins",
      "steps":[
        {
          "headline":"Wait for the muffins to cool.",
          "description":"Even if you want to enjoy the muffins warm, wait for a few minutes before taking them out of the muffin pan. Waiting for a bit helps the muffins to solidify and come out of the pan more easily."
        },
        {
          "headline":"Place the muffin on a cooling rack.",
          "description":"Use a knife to go around each muffin and the pan, then place the muffins on a cooling rack. If you used muffin wrappers, just lift each muffin out of the pan by the wrapper and place them on the cooling rack."
        },
        {
          "headline":"Serve the muffins.",
          "description":"If you want to eat your muffins while they\u2019re warm, take the muffins off the cooling rack and enjoy. If you prefer room temperature muffins that are slightly firmer, wait until they have completely cooled and enjoy."
        },
        {
          "headline":"Store uneaten muffins in a closed container.",
          "description":"To prevent the muffins from getting stale, store them in Tupperware or another airtight container."
        }
      ]
    }
  ],
  "text":" Preparing the Batter Preheat the oven to 400 \u00b0F (204 \u00b0C). Turn the oven up to 400 degrees Farenheit and wait for it to preheat completely. Use the time that you\u2019re waiting to make the muffin batter. Mix the dry ingredients together. Pour the flour, cocoa powder, chocolate chips, sugar, baking powder, baking soda and salt into a large bowl. Stir all the ingredients together with a large spoon until they are all mixed together. Beat the egg. Break the egg into a small bowl, the use a fork to mix the egg. Make sure that the yolk and the egg white are completely blended. Mix the wet ingredients together. Pour the beaten egg into a large bowl, then pour in the milk and oil. Whisk the ingredients together until they are all mixed. Add the dry ingredients into the wet ingredients and mix. Pour the dry ingredients that you just mixed little by little into the wet ingredients, stirring continuously. Stir until all the ingredients are just combined. Make sure not to over-stir, as this can change the consistency of the muffins. Baking the Muffins Grease the muffin pan or insert muffin wrappers. Use a stick of butter or vegetable oil spray to spray the inside of each compartment of a 12-muffin pan. If you prefer to use paper or aluminum muffin wrappers, place one wrapper into each insert of the pan. Greasing the pan ensures that the muffins won\u2019t stick to the pan after they\u2019ve baked. Using muffin wrappers lets you skip the process of greasing the pan and ensures that the muffins will come out of the pan easily after they\u2019ve baked. Pour the batter into the muffin pans. Carefully pour or spoon the muffin batter into each insert of the muffin tin until about two-thirds full. Try to distribute the batter equally so that each muffin is about the same size. Smooth the tops of the batter with a spoon if they\u2019re uneven on top. You can also hold the muffin tin in each hand and shake it gently side to side to make sure that the batter lays flat in each insert. Put extra chocolate chips and sparkling sugar on top. If you wish, sprinkle some chocolate chips and sparkling sugar on top of each compartment of batter. This will give the top of each muffin more texture and sweetness. You can skip this step if you want a more consistent texture for your muffins. Bake the muffins 18-22 minutes. Put the muffin tin in the oven and bake for 18-22 minutes. After 18 minutes, poke one muffin with a toothpick. If it comes out clean, take out the muffins. If not, keep checking every minute until the toothpick comes out completely clean. Serving the Muffins Wait for the muffins to cool. Even if you want to enjoy the muffins warm, wait for a few minutes before taking them out of the muffin pan. Waiting for a bit helps the muffins to solidify and come out of the pan more easily. Place the muffin on a cooling rack. Use a knife to go around each muffin and the pan, then place the muffins on a cooling rack. If you used muffin wrappers, just lift each muffin out of the pan by the wrapper and place them on the cooling rack. Serve the muffins. If you want to eat your muffins while they\u2019re warm, take the muffins off the cooling rack and enjoy. If you prefer room temperature muffins that are slightly firmer, wait until they have completely cooled and enjoy. Store uneaten muffins in a closed container. To prevent the muffins from getting stale, store them in Tupperware or another airtight container.",
  "tyn_model":[
    "egg",
    "oven",
    "chocolate chips",
    "muffin tin",
    "large bowl",
    "muffin pan",
    "sparkling sugar",
    "muffin batter",
    "flour",
    "cocoa powder",
    "sugar",
    "baking powder",
    "baking soda",
    "salt",
    "large spoon",
    "fork",
    "milk",
    "oil",
    "butter or vegetable oil",
    "12-muffin pan",
    "muffin wrappers",
    "muffin pans",
    "spoon",
    "knife",
    "pan",
    "cooling rack",
    "tupperware or",
    "airtight container"
  ],
  "tyn_section":[

  ]
}