{
  "title":"How to Clean Kitchen Appliances",
  "url":"https://www.wikihow.com/Clean-Kitchen-Appliances",
  "category_hierarchy":[
    "Home and Garden",
    "Housekeeping",
    "Cleaning"
  ],
  "methods":[
    {
      "name":"Using salt",
      "steps":[
        {
          "headline":"Use salt to clean burnt food.",
          "description":"For spills onto the stove top, sprinkle with salt before it has a chance to cool; it'll peel off with ease. If you've burnt food onto the base of your pans, sprinkle with salt and a little water and let sit for a while before scrubbing off. The salt will help to lift off the burnt material."
        },
        {
          "headline":"Use salt and lemon to clean cutting boards.",
          "description":"Cut a lemon in half. Rub the cutting board with the lemon half. Sprinkle the rubbed board with salt. Allow to sit for a quarter of an hour. Then, use the lemon half to rub the salt in. Rinse off with water. Let dry. The board will now be deodorized and clean."
        },
        {
          "headline":"Use salt to clean cast iron.",
          "description":"Make a mixture from one tablespoon of olive oil and a teaspoon or so of coarse sea salt. Scrub the cast iron pan or pot with a cloth, using the abrasive quality of the salt to thoroughly clean. Finish off by wiping off the salt and leaving a thin layer of olive oil for a coating."
        }
      ]
    },
    {
      "name":"Using citrus",
      "steps":[
        {
          "headline":"Clean the microwave with a lemon.",
          "description":"Cut a lemon in half. Place both halves cut-side down on a microwaveable plate with a tablespoon of water. Microwave for about 1 minute or until the lemon is hot and the inside of the microwave is steamy. Wipe the inside of the microwave with kitchen paper and wash the plate. Now that the lemon is hot and squishy, it makes a great natural cleanser for a smelly garbage disposal. Cut the halves into smaller pieces and flush through with plenty of water."
        },
        {
          "headline":"Remove grease from appliances with a lemon.",
          "description":"Slice a lemon in half and place it in the microwave on high for 30 seconds. Firmly rub the inside of the lemon over your kitchen appliances in a circular motion - microwaves, ovens, fridges whatever you have that harbors grease and grime. Heat the other half of the lemon and continue if necessary. Wipe down with a clean kitchen towel and be amazed as all the grease pulls away effortlessly."
        },
        {
          "headline":"Use lemons and oranges to clean water stains.",
          "description":"Use fresh citrus juice on chrome items in the kitchen, to remove scale build-up. Squeeze the juice out, then either wipe or spray it onto the chrome item."
        },
        {
          "headline":"Use lemon to clean odors.",
          "description":"Lemons can be used to remove odors from plastic containers and garbage disposal units. For a garbage disposal unit: Throw finished peel and lemon halves/quarters into the unit. Turn the unit on to grind the lemon pieces. This is a great way to get rid of the peel or old lemons, as it will leave a fantastic odor behind. For plastic containers, squeeze lemon juice into soap water and fill the container. Allow to soak for half an hour or so, then scrub lightly. Pour out and allow to dry. The odor should be gone. Let sit for 10 minutes, then rinse off. Any scale build-up should come off with it."
        }
      ]
    },
    {
      "name":"Using vinegar",
      "steps":[
        {
          "headline":"Clean your microwave using vinegar.",
          "description":"Heat up a mixture of vinegar and water for few minutes and wipe it with a towel for cleaning."
        },
        {
          "headline":"Use vinegar as an all-purpose surface cleaner in the kitchen.",
          "description":"Vinegar can effectively clean kitchen counter tops, stove tops, and the tops of refrigerators and other appliances. Spray undiluted vinegar over the surface of appliances and counters in your kitchen, then wipe away using paper towels or a soft, clean rag."
        },
        {
          "headline":"Use vinegar to clean odors out of food processors and blenders.",
          "description":"Pour half a cup of white vinegar into the food processor bowl or blender jug. Add a quarter teaspoon of your usual dish washing detergent. Pour in warm water to near the top of the food processor bowl or blender jug. Place the processor or blender lid on and set aside. Leave for an hour or two. During this time, the vinegar will absorb the food odor from the plastic or glass. Tip the water and vinegar solution out. Wash the processor or blender as usual. Give it the sniff test; if it's odorless, you're good to go. If not, repeat but allow the soaking to occur for 8 to 12 hours, then rinse. That will usually be sufficient to remove the odor."
        },
        {
          "headline":"Remove soap scum from kitchen faucets.",
          "description":"Mix together 1 part salt with 4 parts vinegar, then moisten a rag with the solution. Use the rag to rub away built-up soap scum from bathroom and kitchen faucets."
        },
        {
          "headline":"Periodically run the dishwasher with vinegar.",
          "description":"Place 2 cups of vinegar in the bottom of your dishwasher and run it on low, or the energy-saving setting. Halfway through, stop the dishwasher and let the vinegar soak on the bottom for 15 or 20 minutes. After the time is up, turn it back on to finish. If it's really bad, you can let it soak overnight. If smell is an issue, sprinkle 1/2 - 1 cup of baking soda around the bottom and run the washer as normal."
        },
        {
          "headline":"Use vinegar to descale a kettle.",
          "description":"Dilute it with water in a 1:1 ratio. Pour into the kettle and leave it in the kettle for 1 hour, without boiling. Tip it out after the soaking time. Rinse. Fully rinse the kettle with fresh water at least 5 times before using again."
        }
      ]
    },
    {
      "name":"Using baking soda",
      "steps":[
        {
          "headline":"Clean the oven with baking soda.",
          "description":"See How to clean stubborn stains off an oven using baking soda and How to clean oven glass with a baking soda paste for more details."
        },
        {
          "headline":"Use baking soda to keep sink drains smelling sweet.",
          "description":"Add 2 tablespoons of baking soda to the drain and run warm water for a couple minutes. This will help keep your drains from becoming stinky."
        },
        {
          "headline":"Use baking soda to scrub baked-on food in casserole dishes.",
          "description":"Add a bit of baking soda powder to a dampened dishcloth. Scrub the casserole to remove the baked on food. You can also apply the baking soda powder directly to the surface and scrub."
        },
        {
          "headline":"Use a box of baking soda to help keep the refrigerator smelling sweet.",
          "description":"Be sure to change the box about every month or so to maintain the deodorizing effect."
        }
      ]
    }
  ],
  "text":" Using salt Use salt to clean burnt food. For spills onto the stove top, sprinkle with salt before it has a chance to cool; it'll peel off with ease. If you've burnt food onto the base of your pans, sprinkle with salt and a little water and let sit for a while before scrubbing off. The salt will help to lift off the burnt material. Use salt and lemon to clean cutting boards. Cut a lemon in half. Rub the cutting board with the lemon half. Sprinkle the rubbed board with salt. Allow to sit for a quarter of an hour. Then, use the lemon half to rub the salt in. Rinse off with water. Let dry. The board will now be deodorized and clean. Use salt to clean cast iron. Make a mixture from one tablespoon of olive oil and a teaspoon or so of coarse sea salt. Scrub the cast iron pan or pot with a cloth, using the abrasive quality of the salt to thoroughly clean. Finish off by wiping off the salt and leaving a thin layer of olive oil for a coating. Using citrus Clean the microwave with a lemon. Cut a lemon in half. Place both halves cut-side down on a microwaveable plate with a tablespoon of water. Microwave for about 1 minute or until the lemon is hot and the inside of the microwave is steamy. Wipe the inside of the microwave with kitchen paper and wash the plate. Now that the lemon is hot and squishy, it makes a great natural cleanser for a smelly garbage disposal. Cut the halves into smaller pieces and flush through with plenty of water. Remove grease from appliances with a lemon. Slice a lemon in half and place it in the microwave on high for 30 seconds. Firmly rub the inside of the lemon over your kitchen appliances in a circular motion - microwaves, ovens, fridges whatever you have that harbors grease and grime. Heat the other half of the lemon and continue if necessary. Wipe down with a clean kitchen towel and be amazed as all the grease pulls away effortlessly. Use lemons and oranges to clean water stains. Use fresh citrus juice on chrome items in the kitchen, to remove scale build-up. Squeeze the juice out, then either wipe or spray it onto the chrome item. Use lemon to clean odors. Lemons can be used to remove odors from plastic containers and garbage disposal units. For a garbage disposal unit: Throw finished peel and lemon halves/quarters into the unit. Turn the unit on to grind the lemon pieces. This is a great way to get rid of the peel or old lemons, as it will leave a fantastic odor behind. For plastic containers, squeeze lemon juice into soap water and fill the container. Allow to soak for half an hour or so, then scrub lightly. Pour out and allow to dry. The odor should be gone. Let sit for 10 minutes, then rinse off. Any scale build-up should come off with it. Using vinegar Clean your microwave using vinegar. Heat up a mixture of vinegar and water for few minutes and wipe it with a towel for cleaning. Use vinegar as an all-purpose surface cleaner in the kitchen. Vinegar can effectively clean kitchen counter tops, stove tops, and the tops of refrigerators and other appliances. Spray undiluted vinegar over the surface of appliances and counters in your kitchen, then wipe away using paper towels or a soft, clean rag. Use vinegar to clean odors out of food processors and blenders. Pour half a cup of white vinegar into the food processor bowl or blender jug. Add a quarter teaspoon of your usual dish washing detergent. Pour in warm water to near the top of the food processor bowl or blender jug. Place the processor or blender lid on and set aside. Leave for an hour or two. During this time, the vinegar will absorb the food odor from the plastic or glass. Tip the water and vinegar solution out. Wash the processor or blender as usual. Give it the sniff test; if it's odorless, you're good to go. If not, repeat but allow the soaking to occur for 8 to 12 hours, then rinse. That will usually be sufficient to remove the odor. Remove soap scum from kitchen faucets. Mix together 1 part salt with 4 parts vinegar, then moisten a rag with the solution. Use the rag to rub away built-up soap scum from bathroom and kitchen faucets. Periodically run the dishwasher with vinegar. Place 2 cups of vinegar in the bottom of your dishwasher and run it on low, or the energy-saving setting. Halfway through, stop the dishwasher and let the vinegar soak on the bottom for 15 or 20 minutes. After the time is up, turn it back on to finish. If it's really bad, you can let it soak overnight. If smell is an issue, sprinkle 1/2 - 1 cup of baking soda around the bottom and run the washer as normal. Use vinegar to descale a kettle. Dilute it with water in a 1:1 ratio. Pour into the kettle and leave it in the kettle for 1 hour, without boiling. Tip it out after the soaking time. Rinse. Fully rinse the kettle with fresh water at least 5 times before using again. Using baking soda Clean the oven with baking soda. See How to clean stubborn stains off an oven using baking soda and How to clean oven glass with a baking soda paste for more details. Use baking soda to keep sink drains smelling sweet. Add 2 tablespoons of baking soda to the drain and run warm water for a couple minutes. This will help keep your drains from becoming stinky. Use baking soda to scrub baked-on food in casserole dishes. Add a bit of baking soda powder to a dampened dishcloth. Scrub the casserole to remove the baked on food. You can also apply the baking soda powder directly to the surface and scrub. Use a box of baking soda to help keep the refrigerator smelling sweet. Be sure to change the box about every month or so to maintain the deodorizing effect.",
  "tyn_model":[
    "vinegar",
    "salt",
    "lemon",
    "baking soda",
    "water",
    "microwave",
    "olive oil",
    "lemons",
    "food processor",
    "blender",
    "kettle",
    "cutting board",
    "cast iron",
    "coarse sea salt",
    "cast iron pan",
    "microwaveable plate",
    "kitchen paper",
    "plate",
    "oranges",
    "garbage disposal units",
    "garbage disposal",
    "lemon juice",
    "soap water",
    "paper towels",
    "food processors",
    "white vinegar",
    "dish washing detergent",
    "processor",
    "dishwasher",
    "washer",
    "refrigerator"
  ],
  "tyn_section":[

  ]
}