{
  "title":"How to Become a Good Sniper in Halo for Computer",
  "url":"https://www.wikihow.com/Become-a-Good-Sniper-in-Halo-for-Computer",
  "category_hierarchy":[
    "Hobbies and Crafts",
    "Games",
    "Video Games",
    "Multi Platform Games",
    "Halo"
  ],
  "methods":[
    {
      "name":"Offense Basics",
      "steps":[
        {
          "headline":"Learn to lead based on the server ping if you're playing as a client (shoot ahead in the direction they're moving).",
          "description":"Practice on your own with friends to become accustomed to different lead distances."
        },
        {
          "headline":"don't give them a chance to regenerate their shield once you snipe someone, or it'll take two more body shots to kill him.",
          "description":""
        },
        {
          "headline":"Find advantageous terrain.",
          "description":"For instance, the sniper hill in Bloodgulch allows the sniper to attack the enemy base at full range while only revealing the head of the sniper himself."
        },
        {
          "headline":"Stay out of range.",
          "description":"The advantage of a sniper is its range, so use it. Attack from a long distance so your opponents can't retaliate."
        },
        {
          "headline":"Go for two body shots on a moving target is generally safer then going for one head shot unless you're a professional,.",
          "description":""
        },
        {
          "headline":"Learn to shoot while strafing.",
          "description":"On large open maps such as Bloodgulch, it is not uncommon for two experienced snipers to have a shootout on opposite sides of the map, both strafing around while sniping at the same time."
        }
      ]
    },
    {
      "name":"Defense Basics",
      "steps":[
        {
          "headline":"Don't stand in one spot!",
          "description":"While it may be tempting to find a good camping spot, the sniper rifle in Halo leaves a visible trail that will make even the stealthiest snipers vulnerable. Strafe around unpredictably to avoid getting shot and learn to predict the opponent's movements."
        },
        {
          "headline":"Crouch down whenever your in defense of your moves.",
          "description":"When crouched, you halve the area for someone else to shoot at. And being a sniper, you don't really need to move that fast."
        },
        {
          "headline":"Avoid unnecessary jumping as the parabolic motion is easily predictable to experienced snipers and you cannot change direction in mid-air.",
          "description":"Do NOT walk straight or head on into the enemy as that can get you easily sniped."
        },
        {
          "headline":"Find a location where it is hard for people to sneak up on you (against a wall for instance).",
          "description":"A good location gives the sniper a wide open range to snipe targets from while eliminating the threat of surprise attacks from the behind or side. Use peripheral vision to watch your radar and be weary of sniper trails from the enemy. CONSTANT VIGILANCE! Every time you enter a new open area, scan the perimeters quickly for potential targets or enemies. {\"smallUrl\":\"https:\\/\\/www.wikihow.com\\/images\\/thumb\\/a\\/a8\\/Snipe-in-Halo-PC-on-Blood-Gulch-Step-14.jpg\\/v4-460px-Snipe-in-Halo-PC-on-Blood-Gulch-Step-14.jpg\",\"bigUrl\":\"\\/images\\/thumb\\/a\\/a8\\/Snipe-in-Halo-PC-on-Blood-Gulch-Step-14.jpg\\/aid47186-v4-728px-Snipe-in-Halo-PC-on-Blood-Gulch-Step-14.jpg\",\"smallWidth\":460,\"smallHeight\":288,\"bigWidth\":\"728\",\"bigHeight\":\"455\",\"licensing\":\"<div class=\\\"mw-parser-output\\\"><p>License: <a rel=\\\"nofollow\\\" class=\\\"external text\\\" href=\\\"https:\\/\\/creativecommons.org\\/licenses\\/by-nc-sa\\/3.0\\/\\\">Creative Commons<\\/a><br>\\n<\\/p><p><br \\/>\\n<\\/p><\\/div>\"}"
        },
        {
          "headline":"Know thy enemy.",
          "description":"Remember which ones walk straight or predictably, remember which ones carry a sniper or is wearing an over-shield."
        }
      ]
    },
    {
      "name":"Advanced Skills",
      "steps":[
        {
          "headline":"Learn how to snipe moving vehicles.",
          "description":"Snipe the exposed body of the enemy rather than the vehicle itself. When done correctly the vehicle's protection is moot. (This is an extremely difficult skill to master and should be practiced thoroughly first in order not to waste ammo)"
        },
        {
          "headline":"Learn to point blank-no scope.",
          "description":"In Halo, the sniper has a cross hair whether you zoom in or not, which makes it much easier to point blank someone with the sniper rifle. However, this is still a tough skill to master and possibly remains outside the realm of 'sniping'. However good snipers in Halo can utilize the sniper rifle's potential whether in close range or at a distance."
        }
      ]
    }
  ],
  "text":" Offense Basics Learn to lead based on the server ping if you're playing as a client (shoot ahead in the direction they're moving). Practice on your own with friends to become accustomed to different lead distances. don't give them a chance to regenerate their shield once you snipe someone, or it'll take two more body shots to kill him.  Find advantageous terrain. For instance, the sniper hill in Bloodgulch allows the sniper to attack the enemy base at full range while only revealing the head of the sniper himself. Stay out of range. The advantage of a sniper is its range, so use it. Attack from a long distance so your opponents can't retaliate. Go for two body shots on a moving target is generally safer then going for one head shot unless you're a professional,.  Learn to shoot while strafing. On large open maps such as Bloodgulch, it is not uncommon for two experienced snipers to have a shootout on opposite sides of the map, both strafing around while sniping at the same time. Defense Basics Don't stand in one spot! While it may be tempting to find a good camping spot, the sniper rifle in Halo leaves a visible trail that will make even the stealthiest snipers vulnerable. Strafe around unpredictably to avoid getting shot and learn to predict the opponent's movements. Crouch down whenever your in defense of your moves. When crouched, you halve the area for someone else to shoot at. And being a sniper, you don't really need to move that fast. Avoid unnecessary jumping as the parabolic motion is easily predictable to experienced snipers and you cannot change direction in mid-air. Do NOT walk straight or head on into the enemy as that can get you easily sniped. Find a location where it is hard for people to sneak up on you (against a wall for instance). A good location gives the sniper a wide open range to snipe targets from while eliminating the threat of surprise attacks from the behind or side. Use peripheral vision to watch your radar and be weary of sniper trails from the enemy. CONSTANT VIGILANCE! Every time you enter a new open area, scan the perimeters quickly for potential targets or enemies. {\"smallUrl\":\"https:\\/\\/www.wikihow.com\\/images\\/thumb\\/a\\/a8\\/Snipe-in-Halo-PC-on-Blood-Gulch-Step-14.jpg\\/v4-460px-Snipe-in-Halo-PC-on-Blood-Gulch-Step-14.jpg\",\"bigUrl\":\"\\/images\\/thumb\\/a\\/a8\\/Snipe-in-Halo-PC-on-Blood-Gulch-Step-14.jpg\\/aid47186-v4-728px-Snipe-in-Halo-PC-on-Blood-Gulch-Step-14.jpg\",\"smallWidth\":460,\"smallHeight\":288,\"bigWidth\":\"728\",\"bigHeight\":\"455\",\"licensing\":\"<div class=\\\"mw-parser-output\\\"><p>License: <a rel=\\\"nofollow\\\" class=\\\"external text\\\" href=\\\"https:\\/\\/creativecommons.org\\/licenses\\/by-nc-sa\\/3.0\\/\\\">Creative Commons<\\/a><br>\\n<\\/p><p><br \\/>\\n<\\/p><\\/div>\"} Know thy enemy. Remember which ones walk straight or predictably, remember which ones carry a sniper or is wearing an over-shield. Advanced Skills Learn how to snipe moving vehicles. Snipe the exposed body of the enemy rather than the vehicle itself. When done correctly the vehicle's protection is moot. (This is an extremely difficult skill to master and should be practiced thoroughly first in order not to waste ammo) Learn to point blank-no scope. In Halo, the sniper has a cross hair whether you zoom in or not, which makes it much easier to point blank someone with the sniper rifle. However, this is still a tough skill to master and possibly remains outside the realm of 'sniping'. However good snipers in Halo can utilize the sniper rifle's potential whether in close range or at a distance.",
  "tyn_model":[
    "sniper",
    "sniper rifle",
    "sniper hill",
    "snipers",
    "scope"
  ],
  "tyn_section":[

  ]
}