{
  "title":"How to Download GTA for PC",
  "url":"https://www.wikihow.com/Download-GTA-for-PC",
  "category_hierarchy":[
    "Hobbies and Crafts",
    "Games",
    "Video Games",
    "PC Games"
  ],
  "methods":[
    {
      "name":"Getting the First GTA on the PC",
      "steps":[
        {
          "headline":"Open your Internet browser.",
          "description":""
        },
        {
          "headline":"Head to Best Old Games website.",
          "description":"When you have opened your Internet browser, type this in the address bar up top: www.bestoldgames.net."
        },
        {
          "headline":"Go to the list of games with names starting with the letter G. On the home page of the website, click on the letter G near the top, underneath the website\u2019s logo.",
          "description":""
        },
        {
          "headline":"Choose \u201cGrand Theft Auto.\u201d Scroll down until you have reached the bottom of the menu, and click on \u201cGrand Theft Auto.\u201d This will bring you to the download page of that game.",
          "description":""
        },
        {
          "headline":"Download the installer.",
          "description":"Click on the \u201cDownload\u201d button to download the installer. This button is located on the right side of the page."
        },
        {
          "headline":"Install the game.",
          "description":"After downloading, find the installer in your Downloads folder of your PC. Click on the file to start the installation process. The filename should be GTA.exe or something similar to that."
        },
        {
          "headline":"Start playing GTA on your PC.",
          "description":"After the game installs, there should be a shortcut to the game on your desktop. Just double-click on the icon to launch the game so you can start playing GTA on your PC."
        }
      ]
    },
    {
      "name":"Getting Vice City, San Andreas, GTA 3, GTA IV, and GTA V for the PC",
      "steps":[
        {
          "headline":"Install Steam.",
          "description":"Steam is a good way for PC users to get GTA 5 and over 1,500 other games. Go to steampowered.com/ to download the Steam installer. Once at the Steam-powered website, click on the green \u201cInstall\u201d button on the top-right side of the window. Wait for the installation of Steam to finish."
        },
        {
          "headline":"Launch Steam.",
          "description":"Once Steam has finished installing, open the application. It should be located on your desktop."
        },
        {
          "headline":"Create a Steam account.",
          "description":"You need a Steam account so you can start purchasing games from Steam. Click the \u201cCreate Account\u201d button on the Steam log-in window."
        },
        {
          "headline":"Locate and open \u201cAccount Details.\u201d After you have successfully created your Steam account, you will need to add funds into your account so you can pay for the games you purchase through Steam.",
          "description":"Sign into your account and look for your account name on the top right of the Steam window. Click on your account name, and a drop box will appear showing three options. Click on \u201cAccount Details.\u201d"
        },
        {
          "headline":"Look for the option \u201cAdd funds to your Steam Wallet\u201d and click on it.",
          "description":"This will bring you to the menu where you can add funds to your Steam Wallet using your credit card."
        },
        {
          "headline":"Choose which amount to add to your Steam Wallet you want to purchase.",
          "description":"Make sure you choose the amount that is enough to purchase the GTA game you want. After choosing the amount, you will be directed to another menu where you will checkout that amount to complete your Steam Wallet purchase."
        },
        {
          "headline":"Head for the Steam store.",
          "description":"After purchasing funds for your Steam Wallet, click on the Store tab on the upper-left side of the Steam window. This will bring you to the place where all games and in-game items are sold through Steam."
        },
        {
          "headline":"Search for the GTA game you want.",
          "description":"Do this by using the search bar on the top-right side of the window."
        },
        {
          "headline":"Add the GTA game to your cart.",
          "description":"Once you are at the menu to buy the GTA game you\u2019ve chosen, on the bottom of the window will be the button \u201cAdd to Cart.\u201d Click on it to add the game to your cart."
        },
        {
          "headline":"Purchase the game.",
          "description":"After adding it, it will bring you to a menu that will show you what is inside your Shopping Cart. Click on the green \u201cPurchase for Myself\u201d button to add the game to your Steam Library. After clicking the \u201cPurchase for Myself\u201d button, click on the \u201cCheckout\u201d button to complete the purchase of the game."
        },
        {
          "headline":"Download the GTA game.",
          "description":"After purchasing the game, go to the Steam Library and start downloading the GTA game you purchased. Wait for the download to finish, and you can start playing the game. If you want, and if you have enough funds in your Steam wallet, you can repeat steps 7 to 11 until you have all the GTA game series. If you need to add more funds so you can buy more GTA games, just repeat the steps from step 4."
        }
      ]
    }
  ],
  "text":" Getting the First GTA on the PC Open your Internet browser.  Head to Best Old Games website. When you have opened your Internet browser, type this in the address bar up top: www.bestoldgames.net. Go to the list of games with names starting with the letter G. On the home page of the website, click on the letter G near the top, underneath the website\u2019s logo.  Choose \u201cGrand Theft Auto.\u201d Scroll down until you have reached the bottom of the menu, and click on \u201cGrand Theft Auto.\u201d This will bring you to the download page of that game.  Download the installer. Click on the \u201cDownload\u201d button to download the installer. This button is located on the right side of the page. Install the game. After downloading, find the installer in your Downloads folder of your PC. Click on the file to start the installation process. The filename should be GTA.exe or something similar to that. Start playing GTA on your PC. After the game installs, there should be a shortcut to the game on your desktop. Just double-click on the icon to launch the game so you can start playing GTA on your PC. Getting Vice City, San Andreas, GTA 3, GTA IV, and GTA V for the PC Install Steam. Steam is a good way for PC users to get GTA 5 and over 1,500 other games. Go to steampowered.com/ to download the Steam installer. Once at the Steam-powered website, click on the green \u201cInstall\u201d button on the top-right side of the window. Wait for the installation of Steam to finish. Launch Steam. Once Steam has finished installing, open the application. It should be located on your desktop. Create a Steam account. You need a Steam account so you can start purchasing games from Steam. Click the \u201cCreate Account\u201d button on the Steam log-in window. Locate and open \u201cAccount Details.\u201d After you have successfully created your Steam account, you will need to add funds into your account so you can pay for the games you purchase through Steam. Sign into your account and look for your account name on the top right of the Steam window. Click on your account name, and a drop box will appear showing three options. Click on \u201cAccount Details.\u201d Look for the option \u201cAdd funds to your Steam Wallet\u201d and click on it. This will bring you to the menu where you can add funds to your Steam Wallet using your credit card. Choose which amount to add to your Steam Wallet you want to purchase. Make sure you choose the amount that is enough to purchase the GTA game you want. After choosing the amount, you will be directed to another menu where you will checkout that amount to complete your Steam Wallet purchase. Head for the Steam store. After purchasing funds for your Steam Wallet, click on the Store tab on the upper-left side of the Steam window. This will bring you to the place where all games and in-game items are sold through Steam. Search for the GTA game you want. Do this by using the search bar on the top-right side of the window. Add the GTA game to your cart. Once you are at the menu to buy the GTA game you\u2019ve chosen, on the bottom of the window will be the button \u201cAdd to Cart.\u201d Click on it to add the game to your cart. Purchase the game. After adding it, it will bring you to a menu that will show you what is inside your Shopping Cart. Click on the green \u201cPurchase for Myself\u201d button to add the game to your Steam Library. After clicking the \u201cPurchase for Myself\u201d button, click on the \u201cCheckout\u201d button to complete the purchase of the game. Download the GTA game. After purchasing the game, go to the Steam Library and start downloading the GTA game you purchased. Wait for the download to finish, and you can start playing the game. If you want, and if you have enough funds in your Steam wallet, you can repeat steps 7 to 11 until you have all the GTA game series. If you need to add more funds so you can buy more GTA games, just repeat the steps from step 4.",
  "tyn_model":[
    "steam",
    "\u201d button",
    "steam wallet",
    "\u201cgrand",
    "theft auto",
    "gta",
    "\u201caccount",
    "\u201cadd",
    "funds",
    "\u201cpurchase",
    "\u201d scroll",
    "\u201d this",
    "\u201cdownload",
    "steam-powered website",
    "\u201cinstall",
    "\u201ccreate",
    "\u201d after",
    "\u201d look",
    "\u201d and",
    "steam store",
    "\u201d click",
    "\u201ccheckout"
  ],
  "tyn_section":[

  ]
}