{
  "title":"How to Clean White Leather",
  "url":"https://www.wikihow.com/Clean-White-Leather",
  "category_hierarchy":[
    "Home and Garden",
    "Housekeeping",
    "Cleaning",
    "Cleaning Animal Materials",
    "Cleaning Leather"
  ],
  "methods":[
    {
      "name":"Using Liquid Cleaners",
      "steps":[
        {
          "headline":"Make your own liquid cleaner.",
          "description":"Not only is it easy and cost-effective to make your own liquid cleaner, but it can be safer for your leather. Many synthetic cleaning products, especially ones that are petroleum-based, can actually discolor, stain, or change the surface quality of your leather. Here are some easy recipes for making your own liquid cleaner out of common household products:\nMix 1 part mild soap (the kind you would use on your face or clothes) with 8 parts warm water. Mix 2 parts vinegar with 1 part linseed oil."
        },
        {
          "headline":"Apply your cleaner.",
          "description":"It's important not to use too much liquid directly on the leather, as this can over-saturate the leather and cause \u201cwatermark\u201d staining. Instead, try using a spray bottle  or applying your cleaner to a micro-fiber cloth rather than onto the leather."
        },
        {
          "headline":"Use gentle wiping motions or very gentle circular motions to remove grime and dirt.",
          "description":"Be careful not to rub to aggressively, as this can embed the dirt into the leather rather than remove it."
        },
        {
          "headline":"Don't rinse, but do repeat.",
          "description":"It's not really necessary to rinse off your homemade cleaner, instead you can gently buff it into an even shine. If your item is still dirty, wait a little while and try applying some more cleaner."
        }
      ]
    },
    {
      "name":"Using Non-Liquid Cleaners",
      "steps":[
        {
          "headline":"Use an \"eraser\" cleaning sponge.",
          "description":"These are safe to use on leather items and can help you avoid some of the drawbacks associated with liquid cleaners leaving watermarks. Eraser sponges are also particularly effective if you need to remove scuffs or pen ink."
        },
        {
          "headline":"Try saddle soap.",
          "description":"Saddle soap is a special type of soap that both cleans, conditions, and protects leather. Trifecta! Saddle soap comes in a solid wax (or liquid) form and can work well to remove stains if you follow the manufacturers instructions. But be cautious and test it in an inconspicuous place first, since it can remove leather dye along with your stain."
        },
        {
          "headline":"Try talc powder or cornstarch.",
          "description":"If you're dealing with an oil or grease stain, these absorbent powders can work wonders to draw out the stain. Follow these steps for the best results:\nAfter blotting the stain, sprinkle the powder onto the surface. Allow it to sit for awhile. Gently brush the excess powder away\nRepeat until all the oil is absorbed"
        },
        {
          "headline":"Make your own cleaning paste.",
          "description":"You can also make a homemade cleaning paste out of 1 part lemon juice and 1 part cream of tartar."
        }
      ]
    }
  ],
  "text":" Using Liquid Cleaners Make your own liquid cleaner. Not only is it easy and cost-effective to make your own liquid cleaner, but it can be safer for your leather. Many synthetic cleaning products, especially ones that are petroleum-based, can actually discolor, stain, or change the surface quality of your leather. Here are some easy recipes for making your own liquid cleaner out of common household products:\nMix 1 part mild soap (the kind you would use on your face or clothes) with 8 parts warm water. Mix 2 parts vinegar with 1 part linseed oil. Apply your cleaner. It's important not to use too much liquid directly on the leather, as this can over-saturate the leather and cause \u201cwatermark\u201d staining. Instead, try using a spray bottle  or applying your cleaner to a micro-fiber cloth rather than onto the leather. Use gentle wiping motions or very gentle circular motions to remove grime and dirt. Be careful not to rub to aggressively, as this can embed the dirt into the leather rather than remove it. Don't rinse, but do repeat. It's not really necessary to rinse off your homemade cleaner, instead you can gently buff it into an even shine. If your item is still dirty, wait a little while and try applying some more cleaner. Using Non-Liquid Cleaners Use an \"eraser\" cleaning sponge. These are safe to use on leather items and can help you avoid some of the drawbacks associated with liquid cleaners leaving watermarks. Eraser sponges are also particularly effective if you need to remove scuffs or pen ink. Try saddle soap. Saddle soap is a special type of soap that both cleans, conditions, and protects leather. Trifecta! Saddle soap comes in a solid wax (or liquid) form and can work well to remove stains if you follow the manufacturers instructions. But be cautious and test it in an inconspicuous place first, since it can remove leather dye along with your stain. Try talc powder or cornstarch. If you're dealing with an oil or grease stain, these absorbent powders can work wonders to draw out the stain. Follow these steps for the best results:\nAfter blotting the stain, sprinkle the powder onto the surface. Allow it to sit for awhile. Gently brush the excess powder away\nRepeat until all the oil is absorbed Make your own cleaning paste. You can also make a homemade cleaning paste out of 1 part lemon juice and 1 part cream of tartar.",
  "tyn_model":[
    "liquid cleaner",
    "cleaner",
    "saddle soap",
    "liquid cleaners",
    "mild soap",
    "water",
    "vinegar",
    "linseed oil",
    "\u201cwatermark",
    "\u201d staining",
    "spray bottle",
    "micro-fiber cloth",
    "eraser\" cleaning",
    "sponge",
    "eraser sponges",
    "soap",
    "talc powder",
    "cornstarch",
    "cleaning paste",
    "lemon",
    "cream of tartar"
  ],
  "tyn_section":[

  ]
}