{
  "title":"How to Care for Tiger Bark Ficus Bonsai Tree",
  "url":"https://www.wikihow.com/Care-for-Tiger-Bark-Ficus-Bonsai-Tree",
  "category_hierarchy":[
    "Home and Garden",
    "Gardening",
    "Indoor and Patio Plants",
    "Bonsai"
  ],
  "parts":[
    {
      "name":"Propagation",
      "steps":[
        {
          "headline":"Plant a cutting.",
          "description":"Cuttings can be planted at any time of the year, but the highest success is likely to be experienced with mid-summer growth. Airlayering will work best in spring (April \u2013 May)."
        },
        {
          "headline":"Grow from seed.",
          "description":"Growing ficus plants from seed in spring also works easily in most cases."
        },
        {
          "headline":"Purchase ficus ginseng bonsai as an already growing plant.",
          "description":"Ficus plants are available as cheap bonsai or pot plants in nearly every home-store, building supplies store or nursery. Be aware that mass-produced cheap bonsai in most cases bring a lot of problems with them, like ugly scars from rusty wire that bit into the bark, unattractive shapes, often poorly grafted branches in odd positions, bad soil and sometimes inappropriate pots without drainage holes. On the other hand, specialised bonsai traders offer everything from young plants, pre-bonsai and pre-styled ficus trees up to high-value bonsai, in most cases well-tended and of good quality."
        }
      ]
    },
    {
      "name":"Providing an appropriate position",
      "steps":[
        {
          "headline":"Grow the plant indoors.",
          "description":"The ficus bonsai tree is an indoor bonsai which cannot endure frost. It can be kept outside in summer, if temperatures are above 15 degrees C (59\u00baF)."
        },
        {
          "headline":"Ensure plenty of light.",
          "description":"This plant needs lots of light. Full sun is ideal, in the house as well as outside. A very shady position is unfavourable. If the tree is outside, expose it to the ultraviolet radiation gradually or make sure it is defoliated before placing the tree outside."
        },
        {
          "headline":"Keep the temperature relatively constant.",
          "description":"Figs can endure low humidity due to their thick, waxy leaves, but they prefer a higher humidity and need extremely high humidity to develop aerial roots."
        }
      ]
    },
    {
      "name":"Pruning",
      "steps":[
        {
          "headline":"Prune often.",
          "description":"Regular pruning is necessary to retain the tree\u2019s shape."
        },
        {
          "headline":"Prune back to two leaves after six to eight leaves have grown.",
          "description":"Leaf pruning can be used to reduce leaf size, as some ficus bonsai species normally grow large leaves. If a considerable thickening of the trunk is desired, the ficus can be left to grow freely for one or two years. The strong cuts that are necessary afterwards don't affect the ficus' health and new shoots will grow from old wood. Larger wounds should be covered with cut paste."
        }
      ]
    },
    {
      "name":"Wiring",
      "steps":[
        {
          "headline":"Wire the branches.",
          "description":"Wiring of thin to medium-strong ficus branches is easy as they are very flexible. The wires should be checked regularly though, as they cut into the bark very quickly. Strong branches should be shaped with guy-wires because those can be left on the tree for a much longer period."
        },
        {
          "headline":"Try some special training techniques:",
          "description":"Ficus has the ability to fuse plant parts which touch each other with some pressure. So branches, roots or trunks can fuse together and form appealing structures. You can use this feature for example to tie a lot of young plants together and let them fuse to build one strong single trunk. Fig trees also react very well to approach-grafting of branches and roots and to other grafting techniques. If the growing conditions are ideal, even aerial roots taken from one part of the tree can be grafted in a different position."
        },
        {
          "headline":"For faster closing of large wounds young plants, shoots or aerial roots can be grafted across the wound.",
          "description":"The grower can work on fig trees with nearly unlimited creativity, which increases the appeal of ficus as a bonsai plant considerably."
        },
        {
          "headline":"Use the roots as part of the designing.",
          "description":"Most ficus bonsai trees can produce aerial roots in their natural habitat, which are often presented in appealing bonsai creations with many aerial root pillars or root over rock styles. To enable aerial root growth in your home, a humidity of nearly 100% must be achieved artificially. You can use a glass cover, fish tank or a construction with transparent sheets for this purpose. Aerial roots grow down vertically from the branches and when they reach the soil they develop into strong pillar-like trunks."
        }
      ]
    }
  ],
  "text":" Propagation Plant a cutting. Cuttings can be planted at any time of the year, but the highest success is likely to be experienced with mid-summer growth. Airlayering will work best in spring (April \u2013 May). Grow from seed. Growing ficus plants from seed in spring also works easily in most cases. Purchase ficus ginseng bonsai as an already growing plant. Ficus plants are available as cheap bonsai or pot plants in nearly every home-store, building supplies store or nursery. Be aware that mass-produced cheap bonsai in most cases bring a lot of problems with them, like ugly scars from rusty wire that bit into the bark, unattractive shapes, often poorly grafted branches in odd positions, bad soil and sometimes inappropriate pots without drainage holes. On the other hand, specialised bonsai traders offer everything from young plants, pre-bonsai and pre-styled ficus trees up to high-value bonsai, in most cases well-tended and of good quality. Providing an appropriate position Grow the plant indoors. The ficus bonsai tree is an indoor bonsai which cannot endure frost. It can be kept outside in summer, if temperatures are above 15 degrees C (59\u00baF). Ensure plenty of light. This plant needs lots of light. Full sun is ideal, in the house as well as outside. A very shady position is unfavourable. If the tree is outside, expose it to the ultraviolet radiation gradually or make sure it is defoliated before placing the tree outside. Keep the temperature relatively constant. Figs can endure low humidity due to their thick, waxy leaves, but they prefer a higher humidity and need extremely high humidity to develop aerial roots. Pruning Prune often. Regular pruning is necessary to retain the tree\u2019s shape. Prune back to two leaves after six to eight leaves have grown. Leaf pruning can be used to reduce leaf size, as some ficus bonsai species normally grow large leaves. If a considerable thickening of the trunk is desired, the ficus can be left to grow freely for one or two years. The strong cuts that are necessary afterwards don't affect the ficus' health and new shoots will grow from old wood. Larger wounds should be covered with cut paste. Wiring Wire the branches. Wiring of thin to medium-strong ficus branches is easy as they are very flexible. The wires should be checked regularly though, as they cut into the bark very quickly. Strong branches should be shaped with guy-wires because those can be left on the tree for a much longer period. Try some special training techniques: Ficus has the ability to fuse plant parts which touch each other with some pressure. So branches, roots or trunks can fuse together and form appealing structures. You can use this feature for example to tie a lot of young plants together and let them fuse to build one strong single trunk. Fig trees also react very well to approach-grafting of branches and roots and to other grafting techniques. If the growing conditions are ideal, even aerial roots taken from one part of the tree can be grafted in a different position. For faster closing of large wounds young plants, shoots or aerial roots can be grafted across the wound. The grower can work on fig trees with nearly unlimited creativity, which increases the appeal of ficus as a bonsai plant considerably. Use the roots as part of the designing. Most ficus bonsai trees can produce aerial roots in their natural habitat, which are often presented in appealing bonsai creations with many aerial root pillars or root over rock styles. To enable aerial root growth in your home, a humidity of nearly 100% must be achieved artificially. You can use a glass cover, fish tank or a construction with transparent sheets for this purpose. Aerial roots grow down vertically from the branches and when they reach the soil they develop into strong pillar-like trunks.",
  "tyn_model":[
    "bonsai",
    "\u2013 may",
    "ficus plants",
    "ficus ginseng bonsai",
    "bonsai traders",
    "ficus bonsai tree",
    "ultraviolet radiation",
    "ficus bonsai species",
    "wires",
    "plants",
    "branches",
    "ficus",
    "ficus bonsai trees"
  ],
  "tyn_section":[

  ]
}