{
  "title":"How to Recycle Baby and Kid Items",
  "url":"https://www.wikihow.com/Recycle-Baby-and-Kid-Items",
  "category_hierarchy":[
    "Home and Garden",
    "Housekeeping",
    "Household Waste Disposal",
    "Recycling"
  ],
  "methods":[
    {
      "name":"Saving Baby and Kid Items",
      "steps":[
        {
          "headline":"Consider keeping items in good condition.",
          "description":"If you plan to have more children, you may decide to keep your clothing and equipment for the future. Even if you do not have more children, you can save certain items for your future grandchildren \u2013 particularly special articles of clothing, like christening gowns, and favorite toys and blankets."
        },
        {
          "headline":"Keep bigger, pricier items in storage.",
          "description":"If you plan to have more children, it might be worthwhile to store larger items like cribs, highchairs, strollers, and infant furniture. If you have room in your house or garage, that\u2019s great; if not, consider renting a small storage unit."
        },
        {
          "headline":"Store clothing carefully.",
          "description":"Wash each article of clothing before storing, and then fold it neatly and sort it into a plastic tub or cardboard box, organizing by size and (if applicable) season."
        },
        {
          "headline":"Wash bottles, nipples, and pacifiers thoroughly.",
          "description":"These items can carry bacteria, so it\u2019s important to clean them thoroughly before storing. Keep in mind that before you use these items again, you will have to inspect them carefully. Rubber can rot over time, and these items don\u2019t always hold up in storage."
        }
      ]
    },
    {
      "name":"Selling Baby and Kid Items",
      "steps":[
        {
          "headline":"Choose items that are in good condition.",
          "description":"Reselling children\u2019s clothing and equipment is a simple way to make a little extra money while passing useful items to parents who need them. Keep in mind, though, that you should only sell items that are in good condition \u2013 clean and functional, with no missing parts. A good rule of thumb is to ask yourself whether you would buy the item, if you were in the market for it. If not, it\u2019s probably best to donate or otherwise repurpose it."
        },
        {
          "headline":"Check local ordinances regarding garage sales.",
          "description":"If you have a lot of clothing and equipment to sell, you might consider holding a garage sale on your own property. Before you do so, you should check the laws and guidelines in your area. Some neighborhoods require you to purchase a permit; others might restrict the days and times that such sales can take place."
        },
        {
          "headline":"Advertise your garage sale.",
          "description":"For the best possible turnout, you should advertise your sale at least a week or two in advance. Post clear, eye-catching signs in your neighborhood, or place ads in your local newspaper. Keep in mind that buyers often plan their routes in advance, and they may show up very early to ensure they have the best opportunity to purchase your items. If you need to cancel or change the date of your sale, it\u2019s polite to take down your notices and place an apology notice on your property."
        },
        {
          "headline":"Arrange your items in an organized fashion.",
          "description":"To make your items as accessible and appealing as possible, organize them neatly and attractively. A few suggestions:\nOrganize clothing according to size and gender. Place a sticker on each item, marked clearly with the price. Alternatively, use color-coded stickers, and have a printed price sheet handy that shows each color\u2019s designated price."
        },
        {
          "headline":"Consider secondhand stores.",
          "description":"If you have only a few items to sell, or you have some items left after a garage sale, take your items to a secondhand store or consignment shop. You may have to try several different stores before you find one that will take your items. Store policies vary, but in general:\nConsignment shops will take items likely to sell and have to fill out paperwork so that they can reach you if and when someone purchases them. You will only make money if an items sells. Secondhand stores will often pay you a fair price up front, then sell the items at a higher price to make a profit."
        },
        {
          "headline":"Try selling online.",
          "description":"In addition to garage sales and secondhand stores, you can put your items up for sale online. Various sites, including eBay, function to connect buyers and sellers. A quick search for \u201csell baby clothes online\u201d will generate a list of these sites. Some people will meet in person to make the sale \u2013 this is often the case on sites like Craigslist. However, it can be safer, easier, and more convenient to let a site serve as the middleman, handling everything by mail and making sure no one is cheated."
        }
      ]
    },
    {
      "name":"Donating Baby and Kid Items",
      "steps":[
        {
          "headline":"Give your items to needy friends and relatives.",
          "description":"If you have friends or family members who are pregnant or have small children, consider passing your baby and kid items along to them. This way, the items can be used more than once."
        },
        {
          "headline":"Donate to a local charity.",
          "description":"Another way to give a second life to your gently used baby and kid items is to give them away to a local charity. Consider local churches, food banks, and shelters, as well as the well-known national charity organizations. One of the benefits of giving your items to a charity is that you can be sure they will go to a family in need. This is especially true after a national disaster or other emergency, when many people lose their homes or can no longer afford to purchase necessary clothing and equipment. Contact organizations to find out what their policies are. Some will even pick up your items for you. Don\u2019t forget to get a receipt. When you donate valuable items to a charity, you may be able to claim a deduction on your tax return."
        },
        {
          "headline":"Find a child care center that can use your items.",
          "description":"Another alternative is to give your baby and kid items to a local preschool, child care center, or home day care. Depending on individual regulations, these places may want your clothing and equipment. Many child care centers have a need for baby and toddler clothing, as young children often have accidents and need to be changed."
        }
      ]
    },
    {
      "name":"Repurposing Outgrown Clothing and Equipment",
      "steps":[
        {
          "headline":"Make a patchwork quilt.",
          "description":"Cut rectangular pieces of fabric from outgrown clothing and blankets, and sew them together to make a quilt. Some children really enjoy touching the various textures and seeing all of the different colors and patterns, even if they don\u2019t remember wearing or using the items themselves. If parts of the clothes are too small \u2013 like socks \u2013 sew them onto one of the other patches. These quilts make excellent heirlooms. Consider keeping a record of which patches came from where."
        },
        {
          "headline":"Give outgrown clothing to your children to use for their toys.",
          "description":"Baby clothes make excellent clothing for larger dolls and stuffed toys."
        },
        {
          "headline":"Sew new doll clothes.",
          "description":"To make new doll clothes from outgrown baby clothes, simply measure the doll, cut a piece of fabric from the old clothing, and cut slits for the neck, sleeves, and pant legs. Then sew the parts together."
        },
        {
          "headline":"Clean the house.",
          "description":"Old cloth diapers, cotton blankets, and t-shirts can be used as cleaning rags."
        },
        {
          "headline":"Use old baby bottles as measuring cups.",
          "description":"Bottles are marked with measurements, so you can easily use them for liquids during cooking and baking."
        },
        {
          "headline":"Oil a squeaky door.",
          "description":"Baby bottles can also be used to lubricate squeaky doors. Pour oil into an old baby bottle, and attach a nipple. Because it dispenses a small amount of liquid and easily fits into hard-to-reach areas, you can easily use this to lubricate door hinges. After doing so, move the door to the left and right to distribute the oil."
        },
        {
          "headline":"Convert your crib to a cot.",
          "description":"If your child has outgrown the crib, you can repurpose it for a toddler. Remove the part of the crib with the bars, so that your child can climb in without any obstacles. Be sure to remove excess parts and redundant screws, and don\u2019t let your child use the bed until you have sanded it smooth and repainted it."
        },
        {
          "headline":"Turn your crib into a bench.",
          "description":"You can also convert a crib into a bench. Remove only one side, and take out the mattress. Replace the footer with a stronger board, and repaint it all in one color."
        },
        {
          "headline":"Build a work table.",
          "description":"Another use for an outgrown crib is a work table. Check to make sure the crib is the appropriate height. Remove the mattress and footer, and replace it with glass or a stronger board. If the table is too low, you can extend the legs of the crib and place the work surface above. Use the space beneath for storage."
        },
        {
          "headline":"Repurpose wheels from your child\u2019s stroller.",
          "description":"You can use the wheels of a stroller to build a trailer for your children to play with. Use planks to build the trailer in the form of a box. Attach the wheels with screws. Keep in mind that the length of the trailer must be sufficient for the wheels to rotate freely. The width can be any measure."
        }
      ]
    },
    {
      "name":"Recycling Packaging Materials",
      "steps":[
        {
          "headline":"Store crayons in old formula cans.",
          "description":"Clean, empty formula cans make excellent storage containers for crayons (or markers or colored pencils). If desired, you can cut strips of paper or fabric and use them to decorate the can."
        },
        {
          "headline":"Make a piggy bank.",
          "description":"You can also use a formula can as a piggy bank. Cut a slot into the center of the lid for money, then secure the lid. Decorate as desired."
        },
        {
          "headline":"Use baby food jars for storage.",
          "description":"Baby food jars are transparent, so they make great storage containers for small items. Use them for buttons, beads, thumbtacks, paper clips, and anything else you can think of. Baby food jars work especially well for spices. Be sure to label them clearly. Alternatively, use them to store paints."
        },
        {
          "headline":"Use wet wipes boxes to store various supplies.",
          "description":"The boxes from wet wipes can be used to store makeup, hair accessories, first aid supplies, arts and crafts materials, and anything else that fits. Since these boxes are made from plastic, which is waterproof, you can also use them to store family photos or important documents."
        }
      ]
    }
  ],
  "text":" Saving Baby and Kid Items Consider keeping items in good condition. If you plan to have more children, you may decide to keep your clothing and equipment for the future. Even if you do not have more children, you can save certain items for your future grandchildren \u2013 particularly special articles of clothing, like christening gowns, and favorite toys and blankets. Keep bigger, pricier items in storage. If you plan to have more children, it might be worthwhile to store larger items like cribs, highchairs, strollers, and infant furniture. If you have room in your house or garage, that\u2019s great; if not, consider renting a small storage unit. Store clothing carefully. Wash each article of clothing before storing, and then fold it neatly and sort it into a plastic tub or cardboard box, organizing by size and (if applicable) season. Wash bottles, nipples, and pacifiers thoroughly. These items can carry bacteria, so it\u2019s important to clean them thoroughly before storing. Keep in mind that before you use these items again, you will have to inspect them carefully. Rubber can rot over time, and these items don\u2019t always hold up in storage. Selling Baby and Kid Items Choose items that are in good condition. Reselling children\u2019s clothing and equipment is a simple way to make a little extra money while passing useful items to parents who need them. Keep in mind, though, that you should only sell items that are in good condition \u2013 clean and functional, with no missing parts. A good rule of thumb is to ask yourself whether you would buy the item, if you were in the market for it. If not, it\u2019s probably best to donate or otherwise repurpose it. Check local ordinances regarding garage sales. If you have a lot of clothing and equipment to sell, you might consider holding a garage sale on your own property. Before you do so, you should check the laws and guidelines in your area. Some neighborhoods require you to purchase a permit; others might restrict the days and times that such sales can take place. Advertise your garage sale. For the best possible turnout, you should advertise your sale at least a week or two in advance. Post clear, eye-catching signs in your neighborhood, or place ads in your local newspaper. Keep in mind that buyers often plan their routes in advance, and they may show up very early to ensure they have the best opportunity to purchase your items. If you need to cancel or change the date of your sale, it\u2019s polite to take down your notices and place an apology notice on your property. Arrange your items in an organized fashion. To make your items as accessible and appealing as possible, organize them neatly and attractively. A few suggestions:\nOrganize clothing according to size and gender. Place a sticker on each item, marked clearly with the price. Alternatively, use color-coded stickers, and have a printed price sheet handy that shows each color\u2019s designated price. Consider secondhand stores. If you have only a few items to sell, or you have some items left after a garage sale, take your items to a secondhand store or consignment shop. You may have to try several different stores before you find one that will take your items. Store policies vary, but in general:\nConsignment shops will take items likely to sell and have to fill out paperwork so that they can reach you if and when someone purchases them. You will only make money if an items sells. Secondhand stores will often pay you a fair price up front, then sell the items at a higher price to make a profit. Try selling online. In addition to garage sales and secondhand stores, you can put your items up for sale online. Various sites, including eBay, function to connect buyers and sellers. A quick search for \u201csell baby clothes online\u201d will generate a list of these sites. Some people will meet in person to make the sale \u2013 this is often the case on sites like Craigslist. However, it can be safer, easier, and more convenient to let a site serve as the middleman, handling everything by mail and making sure no one is cheated. Donating Baby and Kid Items Give your items to needy friends and relatives. If you have friends or family members who are pregnant or have small children, consider passing your baby and kid items along to them. This way, the items can be used more than once. Donate to a local charity. Another way to give a second life to your gently used baby and kid items is to give them away to a local charity. Consider local churches, food banks, and shelters, as well as the well-known national charity organizations. One of the benefits of giving your items to a charity is that you can be sure they will go to a family in need. This is especially true after a national disaster or other emergency, when many people lose their homes or can no longer afford to purchase necessary clothing and equipment. Contact organizations to find out what their policies are. Some will even pick up your items for you. Don\u2019t forget to get a receipt. When you donate valuable items to a charity, you may be able to claim a deduction on your tax return. Find a child care center that can use your items. Another alternative is to give your baby and kid items to a local preschool, child care center, or home day care. Depending on individual regulations, these places may want your clothing and equipment. Many child care centers have a need for baby and toddler clothing, as young children often have accidents and need to be changed. Repurposing Outgrown Clothing and Equipment Make a patchwork quilt. Cut rectangular pieces of fabric from outgrown clothing and blankets, and sew them together to make a quilt. Some children really enjoy touching the various textures and seeing all of the different colors and patterns, even if they don\u2019t remember wearing or using the items themselves. If parts of the clothes are too small \u2013 like socks \u2013 sew them onto one of the other patches. These quilts make excellent heirlooms. Consider keeping a record of which patches came from where. Give outgrown clothing to your children to use for their toys. Baby clothes make excellent clothing for larger dolls and stuffed toys. Sew new doll clothes. To make new doll clothes from outgrown baby clothes, simply measure the doll, cut a piece of fabric from the old clothing, and cut slits for the neck, sleeves, and pant legs. Then sew the parts together. Clean the house. Old cloth diapers, cotton blankets, and t-shirts can be used as cleaning rags. Use old baby bottles as measuring cups. Bottles are marked with measurements, so you can easily use them for liquids during cooking and baking. Oil a squeaky door. Baby bottles can also be used to lubricate squeaky doors. Pour oil into an old baby bottle, and attach a nipple. Because it dispenses a small amount of liquid and easily fits into hard-to-reach areas, you can easily use this to lubricate door hinges. After doing so, move the door to the left and right to distribute the oil. Convert your crib to a cot. If your child has outgrown the crib, you can repurpose it for a toddler. Remove the part of the crib with the bars, so that your child can climb in without any obstacles. Be sure to remove excess parts and redundant screws, and don\u2019t let your child use the bed until you have sanded it smooth and repainted it. Turn your crib into a bench. You can also convert a crib into a bench. Remove only one side, and take out the mattress. Replace the footer with a stronger board, and repaint it all in one color. Build a work table. Another use for an outgrown crib is a work table. Check to make sure the crib is the appropriate height. Remove the mattress and footer, and replace it with glass or a stronger board. If the table is too low, you can extend the legs of the crib and place the work surface above. Use the space beneath for storage. Repurpose wheels from your child\u2019s stroller. You can use the wheels of a stroller to build a trailer for your children to play with. Use planks to build the trailer in the form of a box. Attach the wheels with screws. Keep in mind that the length of the trailer must be sufficient for the wheels to rotate freely. The width can be any measure. Recycling Packaging Materials Store crayons in old formula cans. Clean, empty formula cans make excellent storage containers for crayons (or markers or colored pencils). If desired, you can cut strips of paper or fabric and use them to decorate the can. Make a piggy bank. You can also use a formula can as a piggy bank. Cut a slot into the center of the lid for money, then secure the lid. Decorate as desired. Use baby food jars for storage. Baby food jars are transparent, so they make great storage containers for small items. Use them for buttons, beads, thumbtacks, paper clips, and anything else you can think of. Baby food jars work especially well for spices. Be sure to label them clearly. Alternatively, use them to store paints. Use wet wipes boxes to store various supplies. The boxes from wet wipes can be used to store makeup, hair accessories, first aid supplies, arts and crafts materials, and anything else that fits. Since these boxes are made from plastic, which is waterproof, you can also use them to store family photos or important documents.",
  "tyn_model":[
    "crib",
    "baby food jars",
    "blankets",
    "clothing",
    "fabric",
    "baby bottles",
    "oil",
    "crayons",
    "\u2013 particularly",
    "small storage unit",
    "plastic tub",
    "bottles",
    "nipples",
    "pacifiers",
    "rubber",
    "\u2013 clean",
    "garage sale",
    "ebay",
    "\u201csell",
    "\u201d will",
    "\u2013 this",
    "craigslist",
    "child care center",
    "child care centers",
    "patchwork quilt",
    "quilt",
    "\u2013 like",
    "\u2013 sew",
    "quilts",
    "baby bottle",
    "nipple",
    "cot",
    "glass",
    "table",
    "planks",
    "screws",
    "formula cans",
    "markers",
    "colored pencils",
    "formula can",
    "paints",
    "wet wipes boxes",
    "wet wipes",
    "first aid supplies"
  ],
  "tyn_section":[

  ]
}