{
  "title":"How to Take Angry Bird Toys on Vacation",
  "url":"https://www.wikihow.com/Take-Angry-Bird-Toys-on-Vacation",
  "category_hierarchy":[
    "Hobbies and Crafts",
    "Toys",
    "Traditional Toys",
    "Stuffed Animals"
  ],
  "parts":[
    {
      "name":"Car Ride to Destination (not Airport or Train Station)",
      "steps":[
        {
          "headline":"Make sure your bird or pig has rest, so it doesn't get too sleepy.",
          "description":"You want a perky bird/pig, not a lazy one! Bring their favorite toys if they have any toys."
        },
        {
          "headline":"If your bird(s) and/or pig(s) are scared, pet them gently and say \"don't worry\".",
          "description":""
        },
        {
          "headline":"If you drive through tunnels or any other dark place, and they get scared, show them fun videos, play Angry Birds for them if they are a bird, or bad piggies if they are a pig.",
          "description":""
        },
        {
          "headline":"Let them sleep.",
          "description":"If you stop at a gas station and they are hungry or thirsty, choose something you and they like, and share it. Or if they have to go potty (if you live in England not like they have to go crazy, not that type of potty) then take turns going to the bathroom."
        },
        {
          "headline":"Or, if you are taking a plane there, follow this method.",
          "description":""
        }
      ]
    },
    {
      "name":"Plane Ride",
      "steps":[
        {
          "headline":"Do steps 1-4 of previous method if you're in a car.",
          "description":"If in a train to airport, follow steps 1-4 of next method."
        },
        {
          "headline":"When you're at the airport talk with your bird(s) and or pig(s).",
          "description":""
        },
        {
          "headline":"If your bird(s) and or pig(s) don't want to go through security, then tell them that it'll be okay.",
          "description":"Maybe show them a quick video."
        },
        {
          "headline":"Wait with your bird(s) and/or pig(s).",
          "description":"Maybe shop with them too."
        },
        {
          "headline":"When the plane is ready, be sure to bring all of your bird(s) and or pig(s).",
          "description":""
        },
        {
          "headline":"If the plane is overnight, and your bird(s) and or pig(s) can't sleep, and you brought some stories, read them a story!",
          "description":"Or, if the plane has televisions and you can stay up for a little longer, use the entertainment system. Maybe Tiny Square Critters, or Shaun the Sheep. As long as your bird(s) and or pig(s) would like to watch TV, listen to music, (pretend they can hear it) Let them have fun. Cuddle them if it's bedtime, or put them back in their bag if you brought one. A bag would be a smart idea!"
        }
      ]
    },
    {
      "name":"Train to Airport or Destination",
      "steps":[
        {
          "headline":"At the train station, while waiting, play with your toys, have fun and tell them stories.",
          "description":""
        },
        {
          "headline":"Make sure you have them all when the train comes.",
          "description":""
        },
        {
          "headline":"Get on the train with them.",
          "description":""
        },
        {
          "headline":"Do things on the train.",
          "description":""
        },
        {
          "headline":"When you get there, follow the next method.",
          "description":""
        }
      ]
    },
    {
      "name":"After Arrival",
      "steps":[
        {
          "headline":"When you get there, find your place.",
          "description":"Let your bird(s) and or pig(s) sleep in the same room as you!"
        },
        {
          "headline":"Pretend to play the game if you brought blocks and the whole flock (or 1 bird and 1 pig)",
          "description":""
        },
        {
          "headline":"Take them places!",
          "description":""
        },
        {
          "headline":"Make sure you've brought them all when it's time to go back home.",
          "description":""
        },
        {
          "headline":"When it's home time, follow whichever method of how you're getting home.",
          "description":""
        }
      ]
    }
  ],
  "text":" Car Ride to Destination (not Airport or Train Station) Make sure your bird or pig has rest, so it doesn't get too sleepy. You want a perky bird/pig, not a lazy one! Bring their favorite toys if they have any toys. If your bird(s) and/or pig(s) are scared, pet them gently and say \"don't worry\".  If you drive through tunnels or any other dark place, and they get scared, show them fun videos, play Angry Birds for them if they are a bird, or bad piggies if they are a pig.  Let them sleep. If you stop at a gas station and they are hungry or thirsty, choose something you and they like, and share it. Or if they have to go potty (if you live in England not like they have to go crazy, not that type of potty) then take turns going to the bathroom. Or, if you are taking a plane there, follow this method.  Plane Ride Do steps 1-4 of previous method if you're in a car. If in a train to airport, follow steps 1-4 of next method. When you're at the airport talk with your bird(s) and or pig(s).  If your bird(s) and or pig(s) don't want to go through security, then tell them that it'll be okay. Maybe show them a quick video. Wait with your bird(s) and/or pig(s). Maybe shop with them too. When the plane is ready, be sure to bring all of your bird(s) and or pig(s).  If the plane is overnight, and your bird(s) and or pig(s) can't sleep, and you brought some stories, read them a story! Or, if the plane has televisions and you can stay up for a little longer, use the entertainment system. Maybe Tiny Square Critters, or Shaun the Sheep. As long as your bird(s) and or pig(s) would like to watch TV, listen to music, (pretend they can hear it) Let them have fun. Cuddle them if it's bedtime, or put them back in their bag if you brought one. A bag would be a smart idea! Train to Airport or Destination At the train station, while waiting, play with your toys, have fun and tell them stories.  Make sure you have them all when the train comes.  Get on the train with them.  Do things on the train.  When you get there, follow the next method.  After Arrival When you get there, find your place. Let your bird(s) and or pig(s) sleep in the same room as you! Pretend to play the game if you brought blocks and the whole flock (or 1 bird and 1 pig)  Take them places!  Make sure you've brought them all when it's time to go back home.  When it's home time, follow whichever method of how you're getting home. ",
  "tyn_model":[
    "televisions",
    "toys",
    "train",
    "blocks"
  ],
  "tyn_section":[

  ]
}