{
  "title":"How to Make 'Rosca De Pascua",
  "url":"https://www.wikihow.com/Make-%27Rosca-De-Pascua",
  "category_hierarchy":[
    "Food and Entertaining",
    "Recipes",
    "Baking"
  ],
  "methods":[
    {
      "name":"Simple Easter Bread Ring",
      "steps":[
        {
          "headline":"Prepare the yeast mixture.",
          "description":"In a bowl, mix the milk, yeast and sugar, and allow it to leaven. It will be ready when its size has doubled."
        },
        {
          "headline":"Prepare the dough.",
          "description":"In a large bowl, mix the flour and salt. Make an empty space in the middle of the flour and start incorporating the rest of the dough's ingredients one by one, mixing them in with your fingers as you add them. Mix in the eggs, vanilla extract, and lemon zest. Pour in the milk while, constantly mixing. Last, add the yeast mixture and the sugar."
        },
        {
          "headline":"Make the dough.",
          "description":"Make sure that all of the ingredients are well mixed. Now, add the butter, cut into small cubes so that it will be easier to integrate into the dough. Place the dough on a clean surface and knead it until it becomes smooth. Its consistency should be somewhat \"sticky.\""
        },
        {
          "headline":"Let the dough rise.",
          "description":"Put the dough in a container and cover it with plastic wrap. Allow it to rise for two hours and make sure that it is far away from any heat sources."
        },
        {
          "headline":"Assemble the Easter bread ring.",
          "description":"The last thing that you should do to get the dough ready for cooking is to remove excess gasses. Take the previously risen dough and apply slight pressure with the palm of your hand until it becomes smaller. Knead and stretch the dough a bit. Use your elbow to make a pit in the middle of the dough; then, use your hands to finish making the ring shape. Place the ring on a baking sheet and flatten it out. Allow it to rise for at least 20 minutes. Decorate it with pastry cream."
        },
        {
          "headline":"Cook the ring.",
          "description":"Pre-heat your oven to 350 \u00b0F (177 \u00b0C). Place the ring in the oven and cook it for approximately 30 minutes."
        },
        {
          "headline":"Serve.",
          "description":"When it turns golden brown, remove the ring from the oven and dust it with powdered sugar. Wait for it to cool before serving."
        }
      ]
    },
    {
      "name":"Elaborate Easter Bread Ring",
      "steps":[
        {
          "headline":"Prepare the dough for the simple Easter bread ring.",
          "description":"Follow all of the steps previously mentioned, from preparing the yeast mixture to removing excess gasses from the dough."
        },
        {
          "headline":"Assemble and fill the ring.",
          "description":"When you have removed the excess gasses from the dough, place it on a clean surface and stretch it out with a rolling pin. It shouldn't be too thin. In the middle of the dough (lengthways), place half of the pastry cream and all of the figs in syrup. Roll up the dough and join the ends to give it a ring shape."
        },
        {
          "headline":"Decorate the ring.",
          "description":"Use the rest of the ingredients to decorate the top of the ring, starting with the remaining pastry cream and following with the candied orange peel, almonds, and Maraschino cherries."
        },
        {
          "headline":"Cook the ring.",
          "description":"Pre-heat your oven to 350 \u00b0F (177 \u00b0C). Place the ring in the oven and cook it for approximately 30 minutes."
        },
        {
          "headline":"Serve.",
          "description":"Remove the ring from the oven and dust it with powdered sugar. Wait for it to cool before serving."
        }
      ]
    },
    {
      "name":"Pastry Cream",
      "steps":[
        {
          "headline":"Prepare the mixture.",
          "description":"In a small pot, mix the flour, egg yolks, sugar, cornstarch, vanilla extract, and eggs. Whisk until all ingredients are well mixed."
        },
        {
          "headline":"Whisk in the milk.",
          "description":"Pour in the milk while whisking the rest of the mixture. Continue doing this until you have a uniform mixture."
        },
        {
          "headline":"Cook the pastry cream.",
          "description":"Place the pot over low heat, constantly whisking the mixture. The pastry cream will be ready when it becomes thick and smooth."
        }
      ]
    }
  ],
  "text":" Simple Easter Bread Ring Prepare the yeast mixture. In a bowl, mix the milk, yeast and sugar, and allow it to leaven. It will be ready when its size has doubled. Prepare the dough. In a large bowl, mix the flour and salt. Make an empty space in the middle of the flour and start incorporating the rest of the dough's ingredients one by one, mixing them in with your fingers as you add them. Mix in the eggs, vanilla extract, and lemon zest. Pour in the milk while, constantly mixing. Last, add the yeast mixture and the sugar. Make the dough. Make sure that all of the ingredients are well mixed. Now, add the butter, cut into small cubes so that it will be easier to integrate into the dough. Place the dough on a clean surface and knead it until it becomes smooth. Its consistency should be somewhat \"sticky.\" Let the dough rise. Put the dough in a container and cover it with plastic wrap. Allow it to rise for two hours and make sure that it is far away from any heat sources. Assemble the Easter bread ring. The last thing that you should do to get the dough ready for cooking is to remove excess gasses. Take the previously risen dough and apply slight pressure with the palm of your hand until it becomes smaller. Knead and stretch the dough a bit. Use your elbow to make a pit in the middle of the dough; then, use your hands to finish making the ring shape. Place the ring on a baking sheet and flatten it out. Allow it to rise for at least 20 minutes. Decorate it with pastry cream. Cook the ring. Pre-heat your oven to 350 \u00b0F (177 \u00b0C). Place the ring in the oven and cook it for approximately 30 minutes. Serve. When it turns golden brown, remove the ring from the oven and dust it with powdered sugar. Wait for it to cool before serving. Elaborate Easter Bread Ring Prepare the dough for the simple Easter bread ring. Follow all of the steps previously mentioned, from preparing the yeast mixture to removing excess gasses from the dough. Assemble and fill the ring. When you have removed the excess gasses from the dough, place it on a clean surface and stretch it out with a rolling pin. It shouldn't be too thin. In the middle of the dough (lengthways), place half of the pastry cream and all of the figs in syrup. Roll up the dough and join the ends to give it a ring shape. Decorate the ring. Use the rest of the ingredients to decorate the top of the ring, starting with the remaining pastry cream and following with the candied orange peel, almonds, and Maraschino cherries. Cook the ring. Pre-heat your oven to 350 \u00b0F (177 \u00b0C). Place the ring in the oven and cook it for approximately 30 minutes. Serve. Remove the ring from the oven and dust it with powdered sugar. Wait for it to cool before serving. Pastry Cream Prepare the mixture. In a small pot, mix the flour, egg yolks, sugar, cornstarch, vanilla extract, and eggs. Whisk until all ingredients are well mixed. Whisk in the milk. Pour in the milk while whisking the rest of the mixture. Continue doing this until you have a uniform mixture. Cook the pastry cream. Place the pot over low heat, constantly whisking the mixture. The pastry cream will be ready when it becomes thick and smooth.",
  "tyn_model":[
    "pastry cream",
    "oven",
    "yeast",
    "milk",
    "easter bread",
    "sugar",
    "flour",
    "eggs",
    "powdered sugar",
    "bowl",
    "salt",
    "vanilla",
    "lemon",
    "butter",
    "container",
    "plastic wrap",
    "baking sheet",
    "easter bread ring",
    "rolling pin",
    "syrup",
    "candied orange peel",
    "almonds",
    "maraschino cherries",
    "small pot",
    "cornstarch",
    "vanilla extract",
    "pot"
  ],
  "tyn_section":[

  ]
}