{
  "title":"How to Add Friends on Wii U",
  "url":"https://www.wikihow.com/Add-Friends-on-Wii-U",
  "category_hierarchy":[
    "Hobbies and Crafts",
    "Games",
    "Video Games",
    "Nintendo Video Game Consoles",
    "Wii U"
  ],
  "methods":[
    {
      "name":"Adding Friends Using Their Nintendo Network ID",
      "steps":[
        {
          "headline":"Ask your friend for their Nintendo Network ID.",
          "description":"This will be needed to add your friend to your Friends List, so jot it down."
        },
        {
          "headline":"Turn on your Wii U.",
          "description":"Press the Power button found on the front right side of the device."
        },
        {
          "headline":"Head for the Home screen.",
          "description":"Press the Home button on your gamepad. It is just below the touchscreen."
        },
        {
          "headline":"View your Friends List.",
          "description":"Tap the Friends List icon on the very left side of the interface."
        },
        {
          "headline":"Add friends to your network.",
          "description":"Press the \u201cRegister Friend\u201d button at the bottom of the gamepad screen then enter the Nintendo Network ID of your friend. When you're done, hit the \u201cOK\u201d button at the middle of the screen. This will add your friend to your Friends List."
        }
      ]
    },
    {
      "name":"Adding Friends Using \u201cFriend Request\u201d",
      "steps":[
        {
          "headline":"Turn on your Wii U.",
          "description":"Press the Power button found on the front right side of the device."
        },
        {
          "headline":"Head for the Home screen.",
          "description":"Press the Home button on your gamepad. It is just below the touchscreen."
        },
        {
          "headline":"Go to Miiverse.",
          "description":"Tap the second (green) icon from the left, right next to the Friends List icon."
        },
        {
          "headline":"Find someone you want to add.",
          "description":"Miiverse will list several members of the Nintendo Network. Just search for a person you'd like to add to your Friends List."
        },
        {
          "headline":"View the person's profile.",
          "description":"Once you find someone you'd like to befriend, tap on their picture to view their profile."
        },
        {
          "headline":"Send a friend request.",
          "description":"At the top-right corner of the profile is a \u201cFriend Request\u201d button; tap on this. That particular person will get a notification. If he or she accepts, you will be able to view him or her in your Friends List."
        }
      ]
    }
  ],
  "text":" Adding Friends Using Their Nintendo Network ID Ask your friend for their Nintendo Network ID. This will be needed to add your friend to your Friends List, so jot it down. Turn on your Wii U. Press the Power button found on the front right side of the device. Head for the Home screen. Press the Home button on your gamepad. It is just below the touchscreen. View your Friends List. Tap the Friends List icon on the very left side of the interface. Add friends to your network. Press the \u201cRegister Friend\u201d button at the bottom of the gamepad screen then enter the Nintendo Network ID of your friend. When you're done, hit the \u201cOK\u201d button at the middle of the screen. This will add your friend to your Friends List. Adding Friends Using \u201cFriend Request\u201d Turn on your Wii U. Press the Power button found on the front right side of the device. Head for the Home screen. Press the Home button on your gamepad. It is just below the touchscreen. Go to Miiverse. Tap the second (green) icon from the left, right next to the Friends List icon. Find someone you want to add. Miiverse will list several members of the Nintendo Network. Just search for a person you'd like to add to your Friends List. View the person's profile. Once you find someone you'd like to befriend, tap on their picture to view their profile. Send a friend request. At the top-right corner of the profile is a \u201cFriend Request\u201d button; tap on this. That particular person will get a notification. If he or she accepts, you will be able to view him or her in your Friends List.",
  "tyn_model":[
    "\u201d button",
    "wii u.",
    "\u201cfriend",
    "nintendo network id",
    "\u201cregister",
    "nintendo network",
    "\u201cok",
    "\u201d turn"
  ],
  "tyn_section":[

  ]
}