{
  "title":"How to Time Travel in Animal Crossing: New Leaf",
  "url":"https://www.wikihow.com/Time-Travel-in-Animal-Crossing:-New-Leaf",
  "category_hierarchy":[
    "Hobbies and Crafts",
    "Games",
    "Video Games",
    "Nintendo Video Game Consoles",
    "Nintendo 3DS",
    "Animal Crossing: New Leaf"
  ],
  "methods":[
    {
      "name":"Changing the Time In-Game",
      "steps":[
        {
          "headline":"Load your Animal Crossing game.",
          "description":"When you first boot up Animal Crossing:  New Leaf on your DS, Isabelle will be there asking you if you\u2019re ready to begin the game."
        },
        {
          "headline":"Get help.",
          "description":"Instead of choosing \u201cYes, let\u2019s\u201d to get started as you do normally, choose \u201cI need help first\u2026\u201d to reach another branch of dialogue. From this dialogue branch, Isabelle can either assist you with setting the time, demolishing your home, or re-creating the town."
        },
        {
          "headline":"Set the time for TT.",
          "description":"In order to TT, choose \u201cSet the time\u201d from the options. Isabelle will then allow you to choose the date and the time."
        },
        {
          "headline":"Start your Animal Crossing game.",
          "description":"Once you have the time that you desire, start the game, and you will see that the date has changed to reflect your adjustments. This can be done however many times you wish. You could play a whole Animal Crossing month in one real-life day should you want to do so!"
        }
      ]
    },
    {
      "name":"Changing the Time Outside the Game",
      "steps":[
        {
          "headline":"Turn on your DS.",
          "description":"In order to change the time outside of the game, you will need to start your DS."
        },
        {
          "headline":"Go to the Settings menu.",
          "description":"Instead of loading an Animal Crossing game, click on the settings icon from the DS menu. The system settings will not open if you have a game running; if you do, the DS will inform you that the software needs to be closed to proceed."
        },
        {
          "headline":"Select \u201cOther settings.\u201d Once you\u2019ve clicked on the system settings, you will see four different panels.",
          "description":"\u201cOther settings\u201d is found in the lower-right corner."
        },
        {
          "headline":"Change the date and time.",
          "description":"Tap on \u201cDate & time,\u201d which is the second on the list; here, you can either change today\u2019s date, the current time, or both (just one at a time)."
        },
        {
          "headline":"Start your Animal Crossing game.",
          "description":"Once you\u2019ve selected the date and time that you desire, load Animal Crossing: A New Leaf. You will see that the date in the game will also change in order to reflect the system settings."
        }
      ]
    }
  ],
  "text":" Changing the Time In-Game Load your Animal Crossing game. When you first boot up Animal Crossing:  New Leaf on your DS, Isabelle will be there asking you if you\u2019re ready to begin the game. Get help. Instead of choosing \u201cYes, let\u2019s\u201d to get started as you do normally, choose \u201cI need help first\u2026\u201d to reach another branch of dialogue. From this dialogue branch, Isabelle can either assist you with setting the time, demolishing your home, or re-creating the town. Set the time for TT. In order to TT, choose \u201cSet the time\u201d from the options. Isabelle will then allow you to choose the date and the time. Start your Animal Crossing game. Once you have the time that you desire, start the game, and you will see that the date has changed to reflect your adjustments. This can be done however many times you wish. You could play a whole Animal Crossing month in one real-life day should you want to do so! Changing the Time Outside the Game Turn on your DS. In order to change the time outside of the game, you will need to start your DS. Go to the Settings menu. Instead of loading an Animal Crossing game, click on the settings icon from the DS menu. The system settings will not open if you have a game running; if you do, the DS will inform you that the software needs to be closed to proceed. Select \u201cOther settings.\u201d Once you\u2019ve clicked on the system settings, you will see four different panels. \u201cOther settings\u201d is found in the lower-right corner. Change the date and time. Tap on \u201cDate & time,\u201d which is the second on the list; here, you can either change today\u2019s date, the current time, or both (just one at a time). Start your Animal Crossing game. Once you\u2019ve selected the date and time that you desire, load Animal Crossing: A New Leaf. You will see that the date in the game will also change in order to reflect the system settings.",
  "tyn_model":[
    "animal crossing",
    "ds",
    "animal crossing:",
    "\u201cother",
    "\u201cyes",
    "\u201d to",
    "\u201ci",
    "\u2026\u201d",
    "\u201cset",
    "\u201d from",
    "animal crossing month",
    "animal crossing game",
    "\u201d once",
    "\u201d is",
    "\u201cdate",
    "\u201d which"
  ],
  "tyn_section":[

  ]
}