{
  "title":"How to Cook Jamaican Jerk Chicken",
  "url":"https://www.wikihow.com/Cook-Jamaican-Jerk-Chicken",
  "category_hierarchy":[
    "Food and Entertaining",
    "Recipes",
    "Meat",
    "Poultry Recipes",
    "Chicken"
  ],
  "methods":[
    {
      "name":"Making a \"Wet\" Marinade (Grilled Chicken)",
      "steps":[
        {
          "headline":"Quarter a whole chicken and squeeze fresh lime juice over it all.",
          "description":"You can buy the chicken pre-quartered, or you can do it yourself easily with a sharp knife and some kitchen shears. You'll end up with four pieces -- two thighs and two breasts.To do so:\nPull the thighs away from the breast and cut them away at the joint. Use the scissors to cut the breastbone off the chicken. Flip the chicken back over, breast up. Cut lengthwise through the chicken, splitting the breast in two. Squeeze fresh lime juice on the chicken quarters."
        },
        {
          "headline":"Chop 2 Scotch Bonnet peppers, a bushel of green onions, and one small yellow onion into large chunks.",
          "description":"These vegetables will go into a food processor later, so don't worry about getting them too fine right now. You just want them to fit and chop easily in the processor. If you're a fan of garlic, chop up 2-3 cloves as well and throw them in. Habaneros and Jalapenos will both do as substitutes in a pinch."
        },
        {
          "headline":"Combine the following wet ingredients in a bowl, then transfer to your food processor.",
          "description":"The wet ingredients are easiest to measure out first, stirred together, and then tossed in with food processor with the peppers and onions. 1/3 cup olive oil\n1/3 cup distilled white vinegar\n1/2 cup orange juice\n1/2 cup lime juice\n1/2 cup molasses\n1/4 cup soy sauce"
        },
        {
          "headline":"Add the following spices, sugars, and dry ingredients to the food processor and blend until almost liquid.",
          "description":"There should still be some chunks here and there, but you want this marinade to be more or less liquid. This is your jerk sauce! 1 tablespoon ground thyme (or 2-3 springs fresh thyme)\n1 teaspoon freshly ground black pepper\n1/2 teaspoon nutmeg + 1/2 teaspoon cinnamon\n1 tablespoon allspice (or 7-8 whole allspice)\n1-2 Bay leaves\n1/4 cup cilantro (optional)"
        },
        {
          "headline":"Cover the entire chicken in the jerk sauce and marinate overnight, covered, in the fridge.",
          "description":"Yo should marinate the bird for at least 4 hours, though most chefs swear that it needs to be overnight. The acids and salt in the marinade liquids will tenderize the meat and lend more flavor to the meat."
        },
        {
          "headline":"Heat up an outdoor grill to approximately 350F.",
          "description":"If this is a charcoal grill, it will take about 30-40 minutes to heat up, though a propane grill will be at heat within 10 minutes. If you don't have thermometer on your grill, the right heat is roughly when you can't hold your hand over the grill (6\" away) for more than 3-4 seconds."
        },
        {
          "headline":"Cook for approximately 1 hour in the oven or on the barbecue until done, Flipping every 7-8 minutes.",
          "description":"The chicken should be cooked to 160F degrees all the way through, with a crispy skin crossed with grill marks. Every 2-3 times you flip the bird, baste it with a little bit more jerk marinade."
        },
        {
          "headline":"Remove chicken from oven or grill and serve, after it has rested for 5 minutes.",
          "description":"As meat cooks, the juices that keep it tender are released into the meat. If you cut the meat while it is still piping hot, these juices leak out and lead to dry, rough meat. But if you simply wait 5 minutes or so, the juices will reabsorb into the chicken, leading to a much more delicious bird."
        }
      ]
    },
    {
      "name":"Making a Dry Marinade (Oven-Roasted)",
      "steps":[
        {
          "headline":"Rinse off and quarter a 3-4 lb chicken, leaving the skin on.",
          "description":"Remove the chicken from the fridge, rinse it off and pat it dry, then get your sharpest knife out. You can buy chicken quarters pre-cut at many stores, but it is cheaper and fresher to quarter the chicken yourself. To do so, start with the chicken breast-side up, then:\nPull the thighs away from the breasts and cut them off at the joint. Flip the chicken over and, using a pair of kitchen sheers, cut the backbone out of the chicken. Flip the chicken back over and cut the breast in half lengthwise, slicing through the ribcage."
        },
        {
          "headline":"Using a mortar and pestal, crush up 7-8 kernels of whole allspice as finely as possible.",
          "description":"This recipe is rather simple, but the difference between freshly ground allspice and a jar of it from the store is remarkable. If you can't get your hands on whole allspice, substitute a full tablespoon of the spice."
        },
        {
          "headline":"Roughly chop up 1-2 Scotch Bonnet peppers and 1 bunch of green onions.",
          "description":"You can substitute in jalapenos if you need. Don't worry about getting them too fine, as everything will get blended up finely in a food processor later. You're just cutting it up now to make sure everything fits."
        },
        {
          "headline":"Toss 3 tablespoons seasoning salt, 2-3 sprigs fresh thyme, and a pinch of black pepper in the food processor with the peppers, onions, and allspice.",
          "description":"If you'd like to take this rub a little further, you can also toss in the following spices, choosing your favorites:\n2-3 cloves chopped garlic\n1 teaspoon ground ginger\n1 teaspoon cayenne pepper\n2 teaspoons dark brown sugar\n1/2 teaspoon cinnamon and nutmeg"
        },
        {
          "headline":"Add 1/2 cup of water to the food processor and blend until there are only light chunks.",
          "description":"You want a spreadable, but still not entirely wet, marinade -- a bit like wet, chunky sand. Use the \"pulse\" setting to chop it up to your desired consistency. This is your jerk marinade!"
        },
        {
          "headline":"Alternatively, hand mash all the ingredients into a paste using a mortar and pestal.",
          "description":"If you don't have a food processor, you should do things the old fashioned way -- crushing by hand. You'll want to chop the peppers and green onions as finely as possible first, then start crushing it bit by bit, adding more once you have the first handful or so crushed into a nice, chunky paste."
        },
        {
          "headline":"Spread half off the jerk marinade under the skin of the chicken.",
          "description":"Lift the skin up slightly and slide your marinade underneath, spreading it across the whole chicken. Make sure you don't pull the skin off of the chicken -- you just want to lift the skin enough to get the marinade underneath."
        },
        {
          "headline":"Spread half of the remaining marinade on top of the chicken, saving the rest for basting.",
          "description":"If you're running out of marinade, you can just use some salt and pepper, saving the rest for basting or a dipping sauce. Make sure you keep a few tablespoons of marinade to drop on the chicken as it cooks."
        },
        {
          "headline":"Refrigerate the chicken overnight in an oven-safe pan to marinade.",
          "description":"At the very bare minimum, you want to let the chicken marinade for 4 hours, but overnight is the best way to spice the chicken by far. Cover it with plastic wrap and let it sit to absorb the flavors."
        },
        {
          "headline":"Heat the oven to 350 and cook the chicken for 1 hour, flipping halfway through.",
          "description":"Start the chicken meat sides up, basting the quarters with the leftover jerk marinade and flipping after 30 minutes. You want the internal temperature of the chicken to reach 160F. If you stick a thick through with a skewer, the juice that runs out should be clear. If you want extra crispy skin, finish the chicken breast-side up on broil for 5-7 minutes. You can cook this chicken on the grill ass well"
        },
        {
          "headline":"Serve hot, with rice and beans and a splash of fresh lime juice.",
          "description":"If you have any leftover jerk marinade you can pour it over the cooked chicken or set it aside as a dipping sauce. Once the chicken is done, let it sit for 5 minutes before cutting into it, then serve hot."
        }
      ]
    }
  ],
  "text":" Making a \"Wet\" Marinade (Grilled Chicken) Quarter a whole chicken and squeeze fresh lime juice over it all. You can buy the chicken pre-quartered, or you can do it yourself easily with a sharp knife and some kitchen shears. You'll end up with four pieces -- two thighs and two breasts.To do so:\nPull the thighs away from the breast and cut them away at the joint. Use the scissors to cut the breastbone off the chicken. Flip the chicken back over, breast up. Cut lengthwise through the chicken, splitting the breast in two. Squeeze fresh lime juice on the chicken quarters. Chop 2 Scotch Bonnet peppers, a bushel of green onions, and one small yellow onion into large chunks. These vegetables will go into a food processor later, so don't worry about getting them too fine right now. You just want them to fit and chop easily in the processor. If you're a fan of garlic, chop up 2-3 cloves as well and throw them in. Habaneros and Jalapenos will both do as substitutes in a pinch. Combine the following wet ingredients in a bowl, then transfer to your food processor. The wet ingredients are easiest to measure out first, stirred together, and then tossed in with food processor with the peppers and onions. 1/3 cup olive oil\n1/3 cup distilled white vinegar\n1/2 cup orange juice\n1/2 cup lime juice\n1/2 cup molasses\n1/4 cup soy sauce Add the following spices, sugars, and dry ingredients to the food processor and blend until almost liquid. There should still be some chunks here and there, but you want this marinade to be more or less liquid. This is your jerk sauce! 1 tablespoon ground thyme (or 2-3 springs fresh thyme)\n1 teaspoon freshly ground black pepper\n1/2 teaspoon nutmeg + 1/2 teaspoon cinnamon\n1 tablespoon allspice (or 7-8 whole allspice)\n1-2 Bay leaves\n1/4 cup cilantro (optional) Cover the entire chicken in the jerk sauce and marinate overnight, covered, in the fridge. Yo should marinate the bird for at least 4 hours, though most chefs swear that it needs to be overnight. The acids and salt in the marinade liquids will tenderize the meat and lend more flavor to the meat. Heat up an outdoor grill to approximately 350F. If this is a charcoal grill, it will take about 30-40 minutes to heat up, though a propane grill will be at heat within 10 minutes. If you don't have thermometer on your grill, the right heat is roughly when you can't hold your hand over the grill (6\" away) for more than 3-4 seconds. Cook for approximately 1 hour in the oven or on the barbecue until done, Flipping every 7-8 minutes. The chicken should be cooked to 160F degrees all the way through, with a crispy skin crossed with grill marks. Every 2-3 times you flip the bird, baste it with a little bit more jerk marinade. Remove chicken from oven or grill and serve, after it has rested for 5 minutes. As meat cooks, the juices that keep it tender are released into the meat. If you cut the meat while it is still piping hot, these juices leak out and lead to dry, rough meat. But if you simply wait 5 minutes or so, the juices will reabsorb into the chicken, leading to a much more delicious bird. Making a Dry Marinade (Oven-Roasted) Rinse off and quarter a 3-4 lb chicken, leaving the skin on. Remove the chicken from the fridge, rinse it off and pat it dry, then get your sharpest knife out. You can buy chicken quarters pre-cut at many stores, but it is cheaper and fresher to quarter the chicken yourself. To do so, start with the chicken breast-side up, then:\nPull the thighs away from the breasts and cut them off at the joint. Flip the chicken over and, using a pair of kitchen sheers, cut the backbone out of the chicken. Flip the chicken back over and cut the breast in half lengthwise, slicing through the ribcage. Using a mortar and pestal, crush up 7-8 kernels of whole allspice as finely as possible. This recipe is rather simple, but the difference between freshly ground allspice and a jar of it from the store is remarkable. If you can't get your hands on whole allspice, substitute a full tablespoon of the spice. Roughly chop up 1-2 Scotch Bonnet peppers and 1 bunch of green onions. You can substitute in jalapenos if you need. Don't worry about getting them too fine, as everything will get blended up finely in a food processor later. You're just cutting it up now to make sure everything fits. Toss 3 tablespoons seasoning salt, 2-3 sprigs fresh thyme, and a pinch of black pepper in the food processor with the peppers, onions, and allspice. If you'd like to take this rub a little further, you can also toss in the following spices, choosing your favorites:\n2-3 cloves chopped garlic\n1 teaspoon ground ginger\n1 teaspoon cayenne pepper\n2 teaspoons dark brown sugar\n1/2 teaspoon cinnamon and nutmeg Add 1/2 cup of water to the food processor and blend until there are only light chunks. You want a spreadable, but still not entirely wet, marinade -- a bit like wet, chunky sand. Use the \"pulse\" setting to chop it up to your desired consistency. This is your jerk marinade! Alternatively, hand mash all the ingredients into a paste using a mortar and pestal. If you don't have a food processor, you should do things the old fashioned way -- crushing by hand. You'll want to chop the peppers and green onions as finely as possible first, then start crushing it bit by bit, adding more once you have the first handful or so crushed into a nice, chunky paste. Spread half off the jerk marinade under the skin of the chicken. Lift the skin up slightly and slide your marinade underneath, spreading it across the whole chicken. Make sure you don't pull the skin off of the chicken -- you just want to lift the skin enough to get the marinade underneath. Spread half of the remaining marinade on top of the chicken, saving the rest for basting. If you're running out of marinade, you can just use some salt and pepper, saving the rest for basting or a dipping sauce. Make sure you keep a few tablespoons of marinade to drop on the chicken as it cooks. Refrigerate the chicken overnight in an oven-safe pan to marinade. At the very bare minimum, you want to let the chicken marinade for 4 hours, but overnight is the best way to spice the chicken by far. Cover it with plastic wrap and let it sit to absorb the flavors. Heat the oven to 350 and cook the chicken for 1 hour, flipping halfway through. Start the chicken meat sides up, basting the quarters with the leftover jerk marinade and flipping after 30 minutes. You want the internal temperature of the chicken to reach 160F. If you stick a thick through with a skewer, the juice that runs out should be clear. If you want extra crispy skin, finish the chicken breast-side up on broil for 5-7 minutes. You can cook this chicken on the grill ass well Serve hot, with rice and beans and a splash of fresh lime juice. If you have any leftover jerk marinade you can pour it over the cooked chicken or set it aside as a dipping sauce. Once the chicken is done, let it sit for 5 minutes before cutting into it, then serve hot.",
  "tyn_model":[
    "chicken",
    "food processor",
    "allspice",
    "grill",
    "marinade",
    "lime juice",
    "green onions",
    "peppers",
    "oven",
    "jerk marinade",
    "garlic",
    "jalapenos",
    "jerk sauce",
    "fresh thyme",
    "cinnamon",
    "grilled chicken",
    "scissors",
    "scotch bonnet",
    "yellow onion",
    "processor",
    "bowl",
    "olive oil",
    "distilled white vinegar",
    "orange juice",
    "molasses",
    "soy sauce",
    "sugars",
    "thyme",
    "freshly ground black pepper",
    "nutmeg",
    "cilantro",
    "salt",
    "charcoal grill",
    "propane grill",
    "barbecue",
    "knife",
    "chicken quarters",
    "kitchen sheers",
    "mortar",
    "scotch bonnet peppers",
    "seasoning salt",
    "black pepper",
    "onions",
    "spices",
    "ginger",
    "cayenne pepper",
    "dark brown sugar",
    "water",
    "mortar and pestal",
    "salt and pepper",
    "oven-safe pan",
    "plastic wrap",
    "rice and beans",
    "fresh lime juice",
    "dipping sauce"
  ],
  "tyn_section":[

  ]
}