{
  "title":"How to Swim and Dive in Animal Crossing: New Leaf",
  "url":"https://www.wikihow.com/Swim-and-Dive-in-Animal-Crossing:-New-Leaf",
  "category_hierarchy":[
    "Hobbies and Crafts",
    "Games",
    "Video Games",
    "Nintendo Video Game Consoles",
    "Nintendo 3DS",
    "Animal Crossing: New Leaf"
  ],
  "parts":[
    {
      "name":"Getting the Wetsuit",
      "steps":[
        {
          "headline":"Head for Tortimer Island.",
          "description":"To get to the island, visit the south-most region of your town map where there will be docks. You will need 1,000 bells in order to visit the island. Kapp\u2019n, the frog who mans the docks, will not allow you to take any of your belongings with you."
        },
        {
          "headline":"Go to the gyroid.",
          "description":"When you arrive on the island, you\u2019ll be inside a small hut. Walk outside the hut, and directly to your left will be the gyroid. It rents out equipment that you can use for the duration of your visit, but you cannot take the equipment back with you."
        },
        {
          "headline":"Rent the wetsuit.",
          "description":"In order to swim and dive, you first need a wetsuit. One of the items that the gyroid offers is the wetsuit. It will also offer you a tutorial if you need to learn how to use it."
        },
        {
          "headline":"Wear the wetsuit.",
          "description":"In order to use the wetsuit, you first need to equip it. Do this by pressing \u201cX\u201d to open your inventory screen. Then drag and drop the wetsuit on top of your character\u2019s avatar."
        },
        {
          "headline":"Start swimming.",
          "description":"Getting into the water is easy. Simply walk up to the edge of the ocean. Instead of hitting an invisible barrier like your character would have before, he or she will now continue walking into the water and continue to swim."
        }
      ]
    },
    {
      "name":"Swimming, Diving, and Catching",
      "steps":[
        {
          "headline":"Swim around.",
          "description":"Swim around by continually pressing \u201cA.\u201d Every time you press \u201cA,\u201d your character will inch forward just a little bit, effectively swimming."
        },
        {
          "headline":"Look around for sea creatures.",
          "description":"You want to be looking for little black dots in the water. These will also be noted by small bubbles that rise up to the surface. These spots indicate critters that you can catch. You can also encounter jellyfish in the ocean. If you run into them, they will sting you, and you will be unable to move for a short time."
        },
        {
          "headline":"Dive for the critters.",
          "description":"Once you\u2019ve spotted a critter, swim towards. Once you\u2019re reasonably close, go ahead and press \u201cY,\u201d which will cause you to dive. When diving, your character can only stay underwater for a short period of time, which is why you want to be as close as possible to your prey on the surface."
        },
        {
          "headline":"Catch them.",
          "description":"Often times, these critters will continue to move, and in order to catch them, you\u2019ll need to continue swimming in their direction by pressing \u201cA\u201d and holding the directional stick towards them. To succeed in catching, your character needs to take up the same spot as the critter. If successful, your character will grab the critter and rise to the surface with her catch, and it will appear in your inventory."
        }
      ]
    },
    {
      "name":"Getting a Wetsuit of Your Own",
      "steps":[
        {
          "headline":"Talk to the frog at the island.",
          "description":"The frog is behind the desk on the lefthand side of the hut. This is the same frog that will take you back home to the village."
        },
        {
          "headline":"Participate in mini-games.",
          "description":"When you talk to him, instead of choosing \u201cGo home,\u201d you need to choose \u201cGo on a tour.\u201d\nEvery tour is different, and at the beginning of it, Tortimer will explain the goal and rules. The number of medals you receive at the end is dependent on how well you perform in the mini-game."
        },
        {
          "headline":"Continue participating in mini-games until you earn 40 medals.",
          "description":"You will then use these medals to purchase a wetsuit. You need 40 of them."
        },
        {
          "headline":"Buy a wetsuit at the island shop.",
          "description":"The diving suit will not always be available in the island shop, so you may have to check back multiple days to wait for it. Once it arrives, press \u201cA\u201d when standing next to the wetsuit and choose the correct dialogue options to purchase it."
        },
        {
          "headline":"Take the wetsuit home with you.",
          "description":"Make sure that you put the wetsuit into the island basket so that it travels with you when you return home. The frog at the counter will remind you of this if you attempt to leave with anything in your inventory. Things do not travel in your inventory, they only travel in the basket beside the counter."
        },
        {
          "headline":"Enjoy swimming and diving.",
          "description":"Return home and enjoy swimming and diving in your own village in addition to on the island!"
        }
      ]
    }
  ],
  "text":" Getting the Wetsuit Head for Tortimer Island. To get to the island, visit the south-most region of your town map where there will be docks. You will need 1,000 bells in order to visit the island. Kapp\u2019n, the frog who mans the docks, will not allow you to take any of your belongings with you. Go to the gyroid. When you arrive on the island, you\u2019ll be inside a small hut. Walk outside the hut, and directly to your left will be the gyroid. It rents out equipment that you can use for the duration of your visit, but you cannot take the equipment back with you. Rent the wetsuit. In order to swim and dive, you first need a wetsuit. One of the items that the gyroid offers is the wetsuit. It will also offer you a tutorial if you need to learn how to use it. Wear the wetsuit. In order to use the wetsuit, you first need to equip it. Do this by pressing \u201cX\u201d to open your inventory screen. Then drag and drop the wetsuit on top of your character\u2019s avatar. Start swimming. Getting into the water is easy. Simply walk up to the edge of the ocean. Instead of hitting an invisible barrier like your character would have before, he or she will now continue walking into the water and continue to swim. Swimming, Diving, and Catching Swim around. Swim around by continually pressing \u201cA.\u201d Every time you press \u201cA,\u201d your character will inch forward just a little bit, effectively swimming. Look around for sea creatures. You want to be looking for little black dots in the water. These will also be noted by small bubbles that rise up to the surface. These spots indicate critters that you can catch. You can also encounter jellyfish in the ocean. If you run into them, they will sting you, and you will be unable to move for a short time. Dive for the critters. Once you\u2019ve spotted a critter, swim towards. Once you\u2019re reasonably close, go ahead and press \u201cY,\u201d which will cause you to dive. When diving, your character can only stay underwater for a short period of time, which is why you want to be as close as possible to your prey on the surface. Catch them. Often times, these critters will continue to move, and in order to catch them, you\u2019ll need to continue swimming in their direction by pressing \u201cA\u201d and holding the directional stick towards them. To succeed in catching, your character needs to take up the same spot as the critter. If successful, your character will grab the critter and rise to the surface with her catch, and it will appear in your inventory. Getting a Wetsuit of Your Own Talk to the frog at the island. The frog is behind the desk on the lefthand side of the hut. This is the same frog that will take you back home to the village. Participate in mini-games. When you talk to him, instead of choosing \u201cGo home,\u201d you need to choose \u201cGo on a tour.\u201d\nEvery tour is different, and at the beginning of it, Tortimer will explain the goal and rules. The number of medals you receive at the end is dependent on how well you perform in the mini-game. Continue participating in mini-games until you earn 40 medals. You will then use these medals to purchase a wetsuit. You need 40 of them. Buy a wetsuit at the island shop. The diving suit will not always be available in the island shop, so you may have to check back multiple days to wait for it. Once it arrives, press \u201cA\u201d when standing next to the wetsuit and choose the correct dialogue options to purchase it. Take the wetsuit home with you. Make sure that you put the wetsuit into the island basket so that it travels with you when you return home. The frog at the counter will remind you of this if you attempt to leave with anything in your inventory. Things do not travel in your inventory, they only travel in the basket beside the counter. Enjoy swimming and diving. Return home and enjoy swimming and diving in your own village in addition to on the island!",
  "tyn_model":[
    "wetsuit",
    "gyroid",
    "water",
    "\u201ca",
    "ocean",
    "\u201cgo",
    "bells",
    "\u201cx",
    "\u201d to",
    "\u201ca.",
    "\u201d every",
    "\u201d your",
    "jellyfish",
    "\u201cy",
    "\u201d which",
    "\u201d and",
    "directional stick",
    "frog",
    "\u201d you",
    "\u201d\n",
    "diving suit",
    "\u201d when"
  ],
  "tyn_section":[

  ]
}