{
  "title":"How to Harvest Wild Rose Petals",
  "url":"https://www.wikihow.com/Harvest-Wild-Rose-Petals",
  "category_hierarchy":[
    "Home and Garden",
    "Gardening",
    "Planting and Growing",
    "Growing Flowers",
    "Roses"
  ],
  "methods":[
    {
      "name":"Harvesting Your Petals",
      "steps":[
        {
          "headline":"Know when you should harvest the petals.",
          "description":"Wild rose petals are commonly harvested to make tea, jellies and jams but they can also be used in sandwich spreads, omelets, syrup and salads. The best time to harvest wild rose petals is early in the summer when roses are in full bloom. However, as mentioned above, some areas will have roses that bloom at different times throughout the year. Run an internet search to find out when roses generally bloom in your area."
        },
        {
          "headline":"Look your blooms over before harvesting the petals.",
          "description":"Be cautious about where the wild rose petals are harvested. Pesticides and herbicides are often sprayed on wild roses growing along roadsides or other public areas. Automobile exhaust will also contaminate wild roses growing along highways. Be sure to find wild roses in an area that is free of these chemicals. Avoid blooms from plants that are infested with bugs or diseases. Be selective when choosing petals; a few bad petals can ruin an entire afternoon worth of work."
        },
        {
          "headline":"Select rose flowers that are at their peak and have not yet begun to fade.",
          "description":"Pick your rose petals early in the morning. To pick the petals, simply hold the rose stem with one hand, gather the petals together in the other hand and pull them off."
        },
        {
          "headline":"Be careful not to bruise the petals by holding them too tightly.",
          "description":"Pinch the white tips of the petals between your finger and thumb and tear them off the stem. These white tips where the petal was attached to the flower stem have a bitter flavor. Place the petals into a bag to carry them home."
        },
        {
          "headline":"Make sure to leave some blooms behind.",
          "description":"Wild roses generally have five petals per bloom. When picking blooms, don\u2019t pick all the blooms from each plant. Leave some to be propagated for next year."
        }
      ]
    },
    {
      "name":"Cleaning Your Petals",
      "steps":[
        {
          "headline":"Put your harvested petals in a container.",
          "description":"Place the petals you pick into a container or colder, as you will have to wash them once you get them home. Make sure you use a container that is sturdy enough that it will protect your petals from getting squished."
        },
        {
          "headline":"Rinse the petals.",
          "description":"If you have not already done so, place your rose petals in a colander or strainer. Rinse your rose petals under a gentle stream of water. Doing this will help to remove the petals of dirt, pollen, and bugs."
        },
        {
          "headline":"Place your petals on a paper towel.",
          "description":"Place your petals on a paper towel so that they are not overlapping. Spacing the petals out will promote airflow so that the petals can dry more quickly and will not get stuck together. Press the petals lightly with another paper towel. However, be careful not to crush or bruise the petals."
        },
        {
          "headline":"Decide what you will do with your petals.",
          "description":"If you\u2019re planning to use the petals immediately in your cooking or to create rose water, you can use your petals now. If you would like to preserve them, dry them in a safe place, or use a dehydrator to dry them in three hours. You can tell that petals are dry when they are no longer soft to the touch."
        }
      ]
    }
  ],
  "text":" Harvesting Your Petals Know when you should harvest the petals. Wild rose petals are commonly harvested to make tea, jellies and jams but they can also be used in sandwich spreads, omelets, syrup and salads. The best time to harvest wild rose petals is early in the summer when roses are in full bloom. However, as mentioned above, some areas will have roses that bloom at different times throughout the year. Run an internet search to find out when roses generally bloom in your area. Look your blooms over before harvesting the petals. Be cautious about where the wild rose petals are harvested. Pesticides and herbicides are often sprayed on wild roses growing along roadsides or other public areas. Automobile exhaust will also contaminate wild roses growing along highways. Be sure to find wild roses in an area that is free of these chemicals. Avoid blooms from plants that are infested with bugs or diseases. Be selective when choosing petals; a few bad petals can ruin an entire afternoon worth of work. Select rose flowers that are at their peak and have not yet begun to fade. Pick your rose petals early in the morning. To pick the petals, simply hold the rose stem with one hand, gather the petals together in the other hand and pull them off. Be careful not to bruise the petals by holding them too tightly. Pinch the white tips of the petals between your finger and thumb and tear them off the stem. These white tips where the petal was attached to the flower stem have a bitter flavor. Place the petals into a bag to carry them home. Make sure to leave some blooms behind. Wild roses generally have five petals per bloom. When picking blooms, don\u2019t pick all the blooms from each plant. Leave some to be propagated for next year. Cleaning Your Petals Put your harvested petals in a container. Place the petals you pick into a container or colder, as you will have to wash them once you get them home. Make sure you use a container that is sturdy enough that it will protect your petals from getting squished. Rinse the petals. If you have not already done so, place your rose petals in a colander or strainer. Rinse your rose petals under a gentle stream of water. Doing this will help to remove the petals of dirt, pollen, and bugs. Place your petals on a paper towel. Place your petals on a paper towel so that they are not overlapping. Spacing the petals out will promote airflow so that the petals can dry more quickly and will not get stuck together. Press the petals lightly with another paper towel. However, be careful not to crush or bruise the petals. Decide what you will do with your petals. If you\u2019re planning to use the petals immediately in your cooking or to create rose water, you can use your petals now. If you would like to preserve them, dry them in a safe place, or use a dehydrator to dry them in three hours. You can tell that petals are dry when they are no longer soft to the touch.",
  "tyn_model":[
    "roses",
    "container",
    "paper towel",
    "wild rose petals",
    "herbicides",
    "rose petals",
    "colander",
    "strainer",
    "water",
    "rose water",
    "dehydrator"
  ],
  "tyn_section":[

  ]
}