{
  "title":"How to Clean a Flat Screen TV",
  "url":"https://www.wikihow.com/Clean-a-Flat-Screen-TV",
  "category_hierarchy":[
    "Home and Garden",
    "Housekeeping",
    "Cleaning"
  ],
  "methods":[
    {
      "name":"Cleaning With a Microfiber Cloth",
      "steps":[
        {
          "headline":"Turn the TV off.",
          "description":"You don't want to interfere with any pixels while they're still firing, and turning off the TV will enable you to see dirt, dust, and grime better since you're working with a dark surface."
        },
        {
          "headline":"Find a  microfiber cloth.",
          "description":"These soft, dry cloths are the same type of cloth you would use to clean eyeglasses. They're perfect for LCD screens because they don't leave lint."
        },
        {
          "headline":"Wipe the screen.",
          "description":"Use the microfiber cloth to gently wipe off any dirt or grime that's visible. Don't press hard on the screen if the dirt or grime does not immediately come off. Simply move on to the next method below. Do not use paper towels, toilet paper, or old shirts as your cleaning cloth. These materials are more abrasive than microfiber cloth and may scratch the screen and leave lint residue."
        },
        {
          "headline":"Examine the screen.",
          "description":"If it now looks clean, there may not be a need to wash it. If you see splatters of dried liquid, built up dust or other gunk, move on to the method below to give your flat screen some extra shine."
        },
        {
          "headline":"Clean the frame of the screen.",
          "description":"The hard plastic frame is less sensitive than the screen itself. Use the microfiber cloth or a duster to wipe it off."
        }
      ]
    },
    {
      "name":"Washing With a Vinegar and Water Solution",
      "steps":[
        {
          "headline":"Turn off the TV.",
          "description":"Again, you don't want to interfere with any pixels, and you want to be able to see any imperfections."
        },
        {
          "headline":"Make a solution of equal parts vinegar and water.",
          "description":"Vinegar is a natural detergent, making it a safer, and much less pricey option, than other cleaners."
        },
        {
          "headline":"Dab a microfiber cloth in the vinegar solution and gently wipe the screen.",
          "description":"If necessary, apply gentle pressure and rub spots that need extra cleaning in a circular motion. Do not dump or spray vinegar solution directly onto the TV screen. It could end up damaging the screen permanently. If you would prefer to buy an LCD screen cleaning solution, they are available for purchase at computer stores. Do not use cleaning solutions that contain ammonia, ethyl alcohol, acetone or ethyl chloride. These chemicals can damage the screen by cleaning a little too much."
        },
        {
          "headline":"Use a second microfiber cloth to wipe the screen dry.",
          "description":"Allowing liquid to dry on the screen could leave marks."
        },
        {
          "headline":"Wash the frame of the screen.",
          "description":"If the hard plastic frame needs more than a dusting, dip a paper towel in the vinegar solution and scrub it clean. Use a second towel to wipe it dry."
        }
      ]
    },
    {
      "name":"Removing Scratches from Flat Screen TVs",
      "steps":[
        {
          "headline":"Check your  warranty.",
          "description":"If you have a large scratch that is covered by  your warranty, your best option may be to exchange the TV for a new one. Proceeding to try to repair the scratch yourself may cause further damage that is not covered under your warranty."
        },
        {
          "headline":"Use a scratch repair kit.",
          "description":"This is the safest method for removing a scratch from your screen. Repair kits are available for purchase where TVs are sold."
        },
        {
          "headline":"Use petroleum jelly.",
          "description":"Coat a cotton ball in petroleum jelly and dab it over the scratch."
        },
        {
          "headline":"Use lacquer.",
          "description":"Buy clear lacquer and spray a small amount directly over the scratch. Allow it to dry."
        }
      ]
    }
  ],
  "text":" Cleaning With a Microfiber Cloth Turn the TV off. You don't want to interfere with any pixels while they're still firing, and turning off the TV will enable you to see dirt, dust, and grime better since you're working with a dark surface. Find a  microfiber cloth. These soft, dry cloths are the same type of cloth you would use to clean eyeglasses. They're perfect for LCD screens because they don't leave lint. Wipe the screen. Use the microfiber cloth to gently wipe off any dirt or grime that's visible. Don't press hard on the screen if the dirt or grime does not immediately come off. Simply move on to the next method below. Do not use paper towels, toilet paper, or old shirts as your cleaning cloth. These materials are more abrasive than microfiber cloth and may scratch the screen and leave lint residue. Examine the screen. If it now looks clean, there may not be a need to wash it. If you see splatters of dried liquid, built up dust or other gunk, move on to the method below to give your flat screen some extra shine. Clean the frame of the screen. The hard plastic frame is less sensitive than the screen itself. Use the microfiber cloth or a duster to wipe it off. Washing With a Vinegar and Water Solution Turn off the TV. Again, you don't want to interfere with any pixels, and you want to be able to see any imperfections. Make a solution of equal parts vinegar and water. Vinegar is a natural detergent, making it a safer, and much less pricey option, than other cleaners. Dab a microfiber cloth in the vinegar solution and gently wipe the screen. If necessary, apply gentle pressure and rub spots that need extra cleaning in a circular motion. Do not dump or spray vinegar solution directly onto the TV screen. It could end up damaging the screen permanently. If you would prefer to buy an LCD screen cleaning solution, they are available for purchase at computer stores. Do not use cleaning solutions that contain ammonia, ethyl alcohol, acetone or ethyl chloride. These chemicals can damage the screen by cleaning a little too much. Use a second microfiber cloth to wipe the screen dry. Allowing liquid to dry on the screen could leave marks. Wash the frame of the screen. If the hard plastic frame needs more than a dusting, dip a paper towel in the vinegar solution and scrub it clean. Use a second towel to wipe it dry. Removing Scratches from Flat Screen TVs Check your  warranty. If you have a large scratch that is covered by  your warranty, your best option may be to exchange the TV for a new one. Proceeding to try to repair the scratch yourself may cause further damage that is not covered under your warranty. Use a scratch repair kit. This is the safest method for removing a scratch from your screen. Repair kits are available for purchase where TVs are sold. Use petroleum jelly. Coat a cotton ball in petroleum jelly and dab it over the scratch. Use lacquer. Buy clear lacquer and spray a small amount directly over the scratch. Allow it to dry.",
  "tyn_model":[
    "microfiber cloth",
    "vinegar",
    "tv",
    "water",
    "petroleum jelly",
    "paper towels",
    "toilet paper",
    "flat screen",
    "cleaners",
    "ethyl alcohol",
    "ethyl chloride",
    "paper towel",
    "tvs",
    "lacquer",
    "clear lacquer"
  ],
  "tyn_section":[

  ]
}