{
  "title":"How to Make Bread Flour",
  "url":"https://www.wikihow.com/Make-Bread-Flour",
  "category_hierarchy":[
    "Food and Entertaining",
    "Recipes",
    "Baking",
    "Breads",
    "Bread Making Tips"
  ],
  "methods":[
    {
      "name":"From All-Purpose Flour",
      "steps":[
        {
          "headline":"Buy or order vital wheat gluten.",
          "description":"For this recipe, you'll need only two ingredients: all-purpose flour and vital wheat gluten. All-purpose flour can be purchased at nearly any grocery store. However, you may need to make a trip to a health food store or a baking supply store to find vital wheat gluten. Alternatively, if you can stand to wait, vital wheat gluten is easily available for order online. Either way, it is not especially expensive \u2014 a small bag should cost less than $10. You won't need more than a few teaspoons of vital wheat gluten for most bread recipes."
        },
        {
          "headline":"Measure out the all-purpose flour for your recipe.",
          "description":"Look at the recipe to see how much bread flour is required. Measure out this much all-purpose flour instead. Pour this flour into a mixing bowl separate from the other ingredients."
        },
        {
          "headline":"Add one teaspoon vital wheat gluten per cup of flour.",
          "description":"This converts all-purpose flour to a form that can be used just like bread flour. This ratio scales proportionally. For instance, if your recipe calls for 2 1/2 cups of bread flour, you would add 2 1/2 teaspoons vital wheat gluten to 2 1/2 cups of all-purpose flour."
        },
        {
          "headline":"Add a small amount of whole wheat flour.",
          "description":"This step isn't essential, but a little wheat flour works well as a binding agent and gives the bread a subtle \"nutty\" flavor. Add no more than 1/2 teaspoon per cup of all-purpose flour so as not to affect the total volume of your dry ingredients."
        },
        {
          "headline":"Mix well.",
          "description":"Sift the ingredients above together in the bowl. Once they are well incorporated, you will be left with a substance you can use in place of bread flour. The gluten in the new flour substitute will give the final product a denser, \"stronger\" bread than you would have otherwise. Don't be alarmed if your bread turns out with a slightly different texture than it had before."
        }
      ]
    },
    {
      "name":"From Wholewheat Flour",
      "steps":[
        {
          "headline":"Measure out wholewheat flour for your recipe.",
          "description":"The basic process for converting wholewheat flour to bread flour is basically the same as above. However, a few qualities of wholewheat flour make some minor differences necessary. To start, add the wheat flour to a mixing bowl. Again, this is a one-to-one substitution for the bread flour in your recipe. If your recipe calls for three cups of bread flour, start with three cups of wholewheat flour (and so on)."
        },
        {
          "headline":"Add two teaspoons of vital wheat gluten per cup flour.",
          "description":"Wholewheat flour contains a substance called bran which weakens the effects of gluten. This means that it's necessary to add more gluten artificially than you would with all-purpose flour. This scales proportionally in the same way as in the section above. For instance, if you have three cups of wholewheat flour, you would add six teaspoons of vital wheat gluten."
        },
        {
          "headline":"Mix well.",
          "description":"Sift the ingredients together in the mixing bowl. When they are well combined, the substance you have in the bowl will substitute well for bread flour. However, for the best possible results, a few more precautions are necessary. See the next steps."
        },
        {
          "headline":"Add extra water to the wet ingredients.",
          "description":"The bran and protein content of wholewheat flour tend to make it slightly more absorbent than normal flour. To compensate, add a little extra to the wet ingredients you're using for your bread. About two and a half tablespoons of water per cup of wholewheat flour should be plenty. To be clear, you'll want to add this water to the bowl where you're mixing the eggs, oil, milk, and so on. Don't add it directly to the flour or it will incorporate unevenly."
        },
        {
          "headline":"Let the bread rise less than normal.",
          "description":"When making bread, normally, you allow the dough to rise to about double its normal size. However, with wholewheat flour, you'll only want to allow it to rise to about 1 1/2 times its normal size. This is because wholewheat flour tends to make dough a little less flexible. If you let the dough rise all the way, it won't be able to support its full size and will \"deflate\" somewhat during baking."
        }
      ]
    }
  ],
  "text":" From All-Purpose Flour Buy or order vital wheat gluten. For this recipe, you'll need only two ingredients: all-purpose flour and vital wheat gluten. All-purpose flour can be purchased at nearly any grocery store. However, you may need to make a trip to a health food store or a baking supply store to find vital wheat gluten. Alternatively, if you can stand to wait, vital wheat gluten is easily available for order online. Either way, it is not especially expensive \u2014 a small bag should cost less than $10. You won't need more than a few teaspoons of vital wheat gluten for most bread recipes. Measure out the all-purpose flour for your recipe. Look at the recipe to see how much bread flour is required. Measure out this much all-purpose flour instead. Pour this flour into a mixing bowl separate from the other ingredients. Add one teaspoon vital wheat gluten per cup of flour. This converts all-purpose flour to a form that can be used just like bread flour. This ratio scales proportionally. For instance, if your recipe calls for 2 1/2 cups of bread flour, you would add 2 1/2 teaspoons vital wheat gluten to 2 1/2 cups of all-purpose flour. Add a small amount of whole wheat flour. This step isn't essential, but a little wheat flour works well as a binding agent and gives the bread a subtle \"nutty\" flavor. Add no more than 1/2 teaspoon per cup of all-purpose flour so as not to affect the total volume of your dry ingredients. Mix well. Sift the ingredients above together in the bowl. Once they are well incorporated, you will be left with a substance you can use in place of bread flour. The gluten in the new flour substitute will give the final product a denser, \"stronger\" bread than you would have otherwise. Don't be alarmed if your bread turns out with a slightly different texture than it had before. From Wholewheat Flour Measure out wholewheat flour for your recipe. The basic process for converting wholewheat flour to bread flour is basically the same as above. However, a few qualities of wholewheat flour make some minor differences necessary. To start, add the wheat flour to a mixing bowl. Again, this is a one-to-one substitution for the bread flour in your recipe. If your recipe calls for three cups of bread flour, start with three cups of wholewheat flour (and so on). Add two teaspoons of vital wheat gluten per cup flour. Wholewheat flour contains a substance called bran which weakens the effects of gluten. This means that it's necessary to add more gluten artificially than you would with all-purpose flour. This scales proportionally in the same way as in the section above. For instance, if you have three cups of wholewheat flour, you would add six teaspoons of vital wheat gluten. Mix well. Sift the ingredients together in the mixing bowl. When they are well combined, the substance you have in the bowl will substitute well for bread flour. However, for the best possible results, a few more precautions are necessary. See the next steps. Add extra water to the wet ingredients. The bran and protein content of wholewheat flour tend to make it slightly more absorbent than normal flour. To compensate, add a little extra to the wet ingredients you're using for your bread. About two and a half tablespoons of water per cup of wholewheat flour should be plenty. To be clear, you'll want to add this water to the bowl where you're mixing the eggs, oil, milk, and so on. Don't add it directly to the flour or it will incorporate unevenly. Let the bread rise less than normal. When making bread, normally, you allow the dough to rise to about double its normal size. However, with wholewheat flour, you'll only want to allow it to rise to about 1 1/2 times its normal size. This is because wholewheat flour tends to make dough a little less flexible. If you let the dough rise all the way, it won't be able to support its full size and will \"deflate\" somewhat during baking.",
  "tyn_model":[
    "wholewheat flour",
    "all-purpose flour",
    "vital wheat gluten",
    "bread flour",
    "flour",
    "mixing bowl",
    "bowl",
    "water",
    "wheat flour",
    "bread",
    "baking supply store",
    "\u2014 a",
    "wheat gluten",
    "whole wheat flour",
    "flour substitute",
    "gluten",
    "eggs",
    "oil",
    "milk"
  ],
  "tyn_section":[

  ]
}