{
  "title":"How to Install a New Part in Need for Speed",
  "url":"https://www.wikihow.com/Install-a-New-Part-in-Need-for-Speed",
  "category_hierarchy":[
    "Hobbies and Crafts",
    "Games",
    "Video Games",
    "Multi Platform Games",
    "Need for Speed"
  ],
  "methods":[
    {
      "name":"Installing a New Part in NFS: Carbon (PC)",
      "steps":[
        {
          "headline":"Launch the game.",
          "description":"You can do this from the Start menu (Start Button >> All Programs >> Electronic Arts >> Need for Speed Carbon) or from the desktop by double-clicking its icon."
        },
        {
          "headline":"Access the main menu.",
          "description":"When the game loads, press Enter to display the main menu."
        },
        {
          "headline":"Open career mode.",
          "description":"Choose the first option on the main menu, Career, by pressing Enter."
        },
        {
          "headline":"Continue your career.",
          "description":"On the Career menu, choose \u201cResume Career.\u201d This will take you to the Safe House you accessed most recently or the one nearest to the point you last were in the game world. A Safe House is a hideout in the game world that offers respite from the cops and where you can customize your car(s) and manage your racing crew. Depending on your career progress, there may one or several Safe Houses scattered all over the game world (a fictional city called Palmont)."
        },
        {
          "headline":"Open the Safe House menu.",
          "description":"The Safe House menu allows you to install different types of parts on your car."
        },
        {
          "headline":"Begin customizing a new performance part.",
          "description":"On the Safe House menu scroll rightwards and choose \u201cCustomization\u201d by pressing Enter."
        },
        {
          "headline":"Go to Performance.",
          "description":"On the Customization menu scroll rightwards and choose \u201cPerformance\u201d by pressing Enter."
        },
        {
          "headline":"Select a category for performance upgrade.",
          "description":"On the Performance menu, the following categories of upgrades are available: Engine, Transmission, Suspension, Nitrous, Tires, Brakes, and Turbo. Select which category you'll be upgrading by scrolling downward or upward (Down or Up Arrow key, respectively) to highlight the category you want then pressing Enter."
        },
        {
          "headline":"Select an upgrade.",
          "description":"There are different upgrades in each category, and each is priced according to how much it improves your car. Scroll downward or upward (Down or Up Arrow key respectively) to highlight the upgrade you want and press Enter to choose it. This will put the upgrade in your shopping cart."
        },
        {
          "headline":"Exit the Performance Customization menu.",
          "description":"Once you have selected all the performance parts you want, press Escape to return to the Customization menu."
        },
        {
          "headline":"Begin installing a new visual part.",
          "description":"Everything else on the NFS Carbon Customization menu (apart from the Performance section) is pretty much dedicated to improving the visual appearance of the car. These sections are: Autosculpt, Aftermarket and Visuals. The Aftermarket section allows you to install visual parts that are not by default installed on the car by the manufacturer while the Visuals section mostly tackles paint. In Autosculpt, you can modify Aftermarket parts like Bumpers and Roof Scoops to better suite you car. The procedure for installing a visual part is like that of a performance part, but the order is important, as shown in the next steps."
        },
        {
          "headline":"Start off with the Aftermarket section.",
          "description":"Scrolling rightwards on the Customization menu and pressing Enter when the category you want is highlighted."
        },
        {
          "headline":"Select an Aftermarket category.",
          "description":"The categories under Aftermarket include: Body Kit, Hood, and Wheels. Use the Left and Right Arrow keys to scroll from a category to the next."
        },
        {
          "headline":"Select an Aftermarket upgrade.",
          "description":"Use the Down and Up Arrow keys to highlight the upgrades/parts under the categories. Pressing Enter will put the part into your shopping cart."
        },
        {
          "headline":"Go to Visuals.",
          "description":"After Aftermarket, return to the Customization menu (Escape) and choose \u201cVisuals.\u201d Here you can select the paint color for different parts of the car, i.e., Body and Wheels. Scroll rightwards on the Visuals section and press Enter when the category you want is highlighted."
        },
        {
          "headline":"Select a Visual category.",
          "description":"Use the Left and Right Arrow keys to scroll from a category to the next."
        },
        {
          "headline":"Select a Visual upgrade.",
          "description":"Use the Down and Up Arrow keys to highlight the upgrades/parts under the categories. Pressing Enter will put the part into your shopping cart."
        },
        {
          "headline":"Go to Autosculpt.",
          "description":"After Visuals, return to the Customization menu (Escape) and choose \u201cAutosculpt.\u201d This is where you can modify the parts added from Aftermarket to your tastes."
        },
        {
          "headline":"Select an Autosculpt upgrade.",
          "description":"Categories under Autosculpt are identical those under Aftermarket and can be selected by scrolling leftwards or rightwards and pressing Enter. The Left and Right Arrow keys can be used to alter the parts, e.g., the positioning of a Roof Scoop or the height of a Bumper."
        },
        {
          "headline":"Purchase your upgrade.",
          "description":"The last part is to pay for the upgrades in the shopping cart and thus apply them to the car. Press Spacebar to view the shopping cart and Enter to complete the process. At this point, your car is much better than when you entered the Safe House!"
        }
      ]
    },
    {
      "name":"Installing a New Part in NFS Most Wanted 2012 (PC)",
      "steps":[
        {
          "headline":"Launch the game.",
          "description":"You can launch it from the Start Menu (Start Button >> All Program >> Electronic Arts >> Need for Speed Most Wanted) or from the desktop by double-clicking its icon. When it finishes loading, the game will launch directly into the game world."
        },
        {
          "headline":"Open the EasyDrive menu.",
          "description":"Use the EasyDrive system to find races. EasyDrive is an in-game menu in the game that provides functions such as Customization, Race Selection, Car Changing, and Multiplayer. Press number 6 to bring up the EasyDrive Menu."
        },
        {
          "headline":"Go to Races.",
          "description":"Use number 2 to scroll down to the Races option and press number 6 to view available races."
        },
        {
          "headline":"View available racs.",
          "description":"Use number 8 and number 2 to scroll up and down respectively among the available races."
        },
        {
          "headline":"Select a race.",
          "description":"To accept a race, scroll down (number 2) to Start Race and press number 6 again. This will get you into the race."
        },
        {
          "headline":"Go back to the EasyDrive menu.",
          "description":"After winning the race, any unlocked parts will be available on the EasyDrive menu. Press number 6 to bring it up."
        },
        {
          "headline":"Go to Customize Car.",
          "description":"To do this, scroll to Customize Car using number 2."
        },
        {
          "headline":"Select a customization option.",
          "description":"Under Customize Car, you will find the following categories: Tires, Nitrous, Chassis, Body, and Transmission. Scroll to the part you unlocked (number 2 and number 8) by winning your race and press number 6 to select it."
        },
        {
          "headline":"Install the upgrade.",
          "description":"Press number 6 again to install the part."
        }
      ]
    }
  ],
  "text":" Installing a New Part in NFS: Carbon (PC) Launch the game. You can do this from the Start menu (Start Button >> All Programs >> Electronic Arts >> Need for Speed Carbon) or from the desktop by double-clicking its icon. Access the main menu. When the game loads, press Enter to display the main menu. Open career mode. Choose the first option on the main menu, Career, by pressing Enter. Continue your career. On the Career menu, choose \u201cResume Career.\u201d This will take you to the Safe House you accessed most recently or the one nearest to the point you last were in the game world. A Safe House is a hideout in the game world that offers respite from the cops and where you can customize your car(s) and manage your racing crew. Depending on your career progress, there may one or several Safe Houses scattered all over the game world (a fictional city called Palmont). Open the Safe House menu. The Safe House menu allows you to install different types of parts on your car. Begin customizing a new performance part. On the Safe House menu scroll rightwards and choose \u201cCustomization\u201d by pressing Enter. Go to Performance. On the Customization menu scroll rightwards and choose \u201cPerformance\u201d by pressing Enter. Select a category for performance upgrade. On the Performance menu, the following categories of upgrades are available: Engine, Transmission, Suspension, Nitrous, Tires, Brakes, and Turbo. Select which category you'll be upgrading by scrolling downward or upward (Down or Up Arrow key, respectively) to highlight the category you want then pressing Enter. Select an upgrade. There are different upgrades in each category, and each is priced according to how much it improves your car. Scroll downward or upward (Down or Up Arrow key respectively) to highlight the upgrade you want and press Enter to choose it. This will put the upgrade in your shopping cart. Exit the Performance Customization menu. Once you have selected all the performance parts you want, press Escape to return to the Customization menu. Begin installing a new visual part. Everything else on the NFS Carbon Customization menu (apart from the Performance section) is pretty much dedicated to improving the visual appearance of the car. These sections are: Autosculpt, Aftermarket and Visuals. The Aftermarket section allows you to install visual parts that are not by default installed on the car by the manufacturer while the Visuals section mostly tackles paint. In Autosculpt, you can modify Aftermarket parts like Bumpers and Roof Scoops to better suite you car. The procedure for installing a visual part is like that of a performance part, but the order is important, as shown in the next steps. Start off with the Aftermarket section. Scrolling rightwards on the Customization menu and pressing Enter when the category you want is highlighted. Select an Aftermarket category. The categories under Aftermarket include: Body Kit, Hood, and Wheels. Use the Left and Right Arrow keys to scroll from a category to the next. Select an Aftermarket upgrade. Use the Down and Up Arrow keys to highlight the upgrades/parts under the categories. Pressing Enter will put the part into your shopping cart. Go to Visuals. After Aftermarket, return to the Customization menu (Escape) and choose \u201cVisuals.\u201d Here you can select the paint color for different parts of the car, i.e., Body and Wheels. Scroll rightwards on the Visuals section and press Enter when the category you want is highlighted. Select a Visual category. Use the Left and Right Arrow keys to scroll from a category to the next. Select a Visual upgrade. Use the Down and Up Arrow keys to highlight the upgrades/parts under the categories. Pressing Enter will put the part into your shopping cart. Go to Autosculpt. After Visuals, return to the Customization menu (Escape) and choose \u201cAutosculpt.\u201d This is where you can modify the parts added from Aftermarket to your tastes. Select an Autosculpt upgrade. Categories under Autosculpt are identical those under Aftermarket and can be selected by scrolling leftwards or rightwards and pressing Enter. The Left and Right Arrow keys can be used to alter the parts, e.g., the positioning of a Roof Scoop or the height of a Bumper. Purchase your upgrade. The last part is to pay for the upgrades in the shopping cart and thus apply them to the car. Press Spacebar to view the shopping cart and Enter to complete the process. At this point, your car is much better than when you entered the Safe House! Installing a New Part in NFS Most Wanted 2012 (PC) Launch the game. You can launch it from the Start Menu (Start Button >> All Program >> Electronic Arts >> Need for Speed Most Wanted) or from the desktop by double-clicking its icon. When it finishes loading, the game will launch directly into the game world. Open the EasyDrive menu. Use the EasyDrive system to find races. EasyDrive is an in-game menu in the game that provides functions such as Customization, Race Selection, Car Changing, and Multiplayer. Press number 6 to bring up the EasyDrive Menu. Go to Races. Use number 2 to scroll down to the Races option and press number 6 to view available races. View available racs. Use number 8 and number 2 to scroll up and down respectively among the available races. Select a race. To accept a race, scroll down (number 2) to Start Race and press number 6 again. This will get you into the race. Go back to the EasyDrive menu. After winning the race, any unlocked parts will be available on the EasyDrive menu. Press number 6 to bring it up. Go to Customize Car. To do this, scroll to Customize Car using number 2. Select a customization option. Under Customize Car, you will find the following categories: Tires, Nitrous, Chassis, Body, and Transmission. Scroll to the part you unlocked (number 2 and number 8) by winning your race and press number 6 to select it. Install the upgrade. Press number 6 again to install the part.",
  "tyn_model":[
    "\u201d this",
    "\u201d by",
    "nfs: carbon",
    "electronic arts",
    "\u201cresume",
    "\u201ccustomization",
    "\u201cperformance",
    "nfs carbon customization",
    "paint",
    "roof scoops",
    "\u201cvisuals",
    "\u201d here",
    "\u201cautosculpt",
    "roof scoop",
    "shopping cart",
    "electronic arts >",
    "tires",
    "nitrous"
  ],
  "tyn_section":[

  ]
}