{
  "title":"How to Make Party Favors from Candy",
  "url":"https://www.wikihow.com/Make-Party-Favors-from-Candy",
  "category_hierarchy":[
    "Food and Entertaining",
    "Parties",
    "Party Decorations",
    "Party Favors"
  ],
  "methods":[
    {
      "name":"Basic candy party favor bag",
      "steps":[
        {
          "headline":"Choose the candy bag.",
          "description":"It is probably best to choose a bag that matches the party theme. If making your own, either paper or cellophane bags can be used. Paper bags can be jazzed up with drawings, patterns, stamps, etc. ; while cellophane bags can be improved with stickers or glued-on images. Choose colors matching the party theme."
        },
        {
          "headline":"Select the candies.",
          "description":"The candies can be matched to the party theme or simply chosen because you know the kids like certain kinds. Be mindful of any allergies when choosing the candies. If you're not sure, steer clear especially of candies containing nuts. Other allergens include milk, egg, soy and gluten."
        },
        {
          "headline":"Make up portions of the same size for each bag.",
          "description":"Tip the candies into the bags."
        },
        {
          "headline":"Tie the bag or knot it.",
          "description":"Finish with a ribbon or yarn bow."
        }
      ]
    },
    {
      "name":"Candy skewer",
      "steps":[
        {
          "headline":"Purchase a bag of skewers.",
          "description":"Also buy lots of soft candies that can be pierced easily by the skewer. Get as many skewers as party guests needing a party favor. A few spares won't hurt either, in case some snap while working with them."
        },
        {
          "headline":"Plan the skewer design.",
          "description":"Arrange all of the candies on a clean tray or large plate. Play around with placement of each type of candy to form a line that will sit on the skewer. When you're happy with the design, start making the skewers."
        },
        {
          "headline":"Set up a manufacturing line.",
          "description":"Place the designed skewer in front of you for guidance, and each candy type in order of the template design."
        },
        {
          "headline":"Pierce each candy into place on the first skewer.",
          "description":"Set that skewer aside on a plate and move onto the next one. Repeat until all of the skewers are done."
        },
        {
          "headline":"Cover with long cellophane bags.",
          "description":"If you can't find cellophane bags, make cellophane covers from plain cellophane and tape in place. Finish off with a ribbon bow at the base to keep the bag in place."
        },
        {
          "headline":"Done.",
          "description":"The candy party favors are now ready for sharing out."
        }
      ]
    },
    {
      "name":"Candy jars",
      "steps":[
        {
          "headline":"Visit the dollar store.",
          "description":"Look for small spice jars or jars of a similar small and cylinder shape. They must have decent lids on them, to keep the contents safely inside."
        },
        {
          "headline":"Get small candies that will fit inside the little jars.",
          "description":"Small candy-coated chocolates, jelly beans, tiny boiled sweets, etc. are ideal for adding."
        },
        {
          "headline":"Fill each jar.",
          "description":"Decide whether you'll only use one type of candy or layer different candies before filling. If layering, do at least three layers to make it look effective. Then place the lid on top. It may be a good idea to tape down the lid if it's not tight enough on its own."
        },
        {
          "headline":"Decorate the jar.",
          "description":"This can be done in many ways, some suggestions include tying a ribbon bow around the neck of the jar, piercing a miniature windmill through the top if the lid is made from cork, adding a label with the birthday party date and the guest's name, adding stickers or scrapbook cutouts, and so forth."
        }
      ]
    },
    {
      "name":"Easy lollipop",
      "steps":[
        {
          "headline":"Purchase large lollipops.",
          "description":"You'll need one per guest."
        },
        {
          "headline":"Design a birthday party logo on your computer.",
          "description":"It must be able to fit onto the lollipop. Include a message such as \"Thank you for coming to Melissa's birthday party\" and any pictures, patterns or designs you'd like."
        },
        {
          "headline":"Print off as many as needed for each lollipop.",
          "description":"Cut around them to fit the lollipop."
        },
        {
          "headline":"Glue onto each lollipop.",
          "description":"Finish off with a small ribbon tied around the lollipop stick."
        },
        {
          "headline":"Done.",
          "description":"This is a nice, easy way to make a candy party favor that also serves as a memento."
        }
      ]
    },
    {
      "name":"Halloween pumpkins",
      "steps":[
        {
          "headline":"Purchase orange tulle (net), orange jellybeans or candies, orange or brown rubber bands and brown pipe cleaners (chenille sticks).",
          "description":""
        },
        {
          "headline":"Draw a large circle on a piece of thin card.",
          "description":"This is the template for cutting out the tulle circles. It must be large enough so that when the tulle is gathered, it holds about a handful of the candies inside the tulle."
        },
        {
          "headline":"Place the template onto the tulle.",
          "description":"Cut out as many circles as you need to make candy party favors."
        },
        {
          "headline":"Fill the first tulle circle with candy.",
          "description":"Then draw up all of the circle edges of the tulle to the center top, holding it with your fingers. There needs to be enough tulle meeting in the center to allow for you to wrap the chenille stick around it. If not, remove some of the candies; you'll get a sense for how many candies to add as you keep making more pumpkins."
        },
        {
          "headline":"Use the rubber band to hold the tulle top in place.",
          "description":"Wrap it around to fit tightly, so that no candies can escape."
        },
        {
          "headline":"Wind the brown pipe cleaner around the tulle top.",
          "description":"This forms the pumpkin stem. As it leaves the tulle, continue to wind the top part of the pipe cleaner into a standalone spiral. This finishes off the look."
        },
        {
          "headline":"Repeat until all of the pumpkins needed have been made.",
          "description":"These make great Halloween party favors or they can be given out at the door for trick and treaters."
        },
        {
          "headline":"Finished.",
          "description":""
        }
      ]
    }
  ],
  "text":" Basic candy party favor bag Choose the candy bag. It is probably best to choose a bag that matches the party theme. If making your own, either paper or cellophane bags can be used. Paper bags can be jazzed up with drawings, patterns, stamps, etc. ; while cellophane bags can be improved with stickers or glued-on images. Choose colors matching the party theme. Select the candies. The candies can be matched to the party theme or simply chosen because you know the kids like certain kinds. Be mindful of any allergies when choosing the candies. If you're not sure, steer clear especially of candies containing nuts. Other allergens include milk, egg, soy and gluten. Make up portions of the same size for each bag. Tip the candies into the bags. Tie the bag or knot it. Finish with a ribbon or yarn bow. Candy skewer Purchase a bag of skewers. Also buy lots of soft candies that can be pierced easily by the skewer. Get as many skewers as party guests needing a party favor. A few spares won't hurt either, in case some snap while working with them. Plan the skewer design. Arrange all of the candies on a clean tray or large plate. Play around with placement of each type of candy to form a line that will sit on the skewer. When you're happy with the design, start making the skewers. Set up a manufacturing line. Place the designed skewer in front of you for guidance, and each candy type in order of the template design. Pierce each candy into place on the first skewer. Set that skewer aside on a plate and move onto the next one. Repeat until all of the skewers are done. Cover with long cellophane bags. If you can't find cellophane bags, make cellophane covers from plain cellophane and tape in place. Finish off with a ribbon bow at the base to keep the bag in place. Done. The candy party favors are now ready for sharing out. Candy jars Visit the dollar store. Look for small spice jars or jars of a similar small and cylinder shape. They must have decent lids on them, to keep the contents safely inside. Get small candies that will fit inside the little jars. Small candy-coated chocolates, jelly beans, tiny boiled sweets, etc. are ideal for adding. Fill each jar. Decide whether you'll only use one type of candy or layer different candies before filling. If layering, do at least three layers to make it look effective. Then place the lid on top. It may be a good idea to tape down the lid if it's not tight enough on its own. Decorate the jar. This can be done in many ways, some suggestions include tying a ribbon bow around the neck of the jar, piercing a miniature windmill through the top if the lid is made from cork, adding a label with the birthday party date and the guest's name, adding stickers or scrapbook cutouts, and so forth. Easy lollipop Purchase large lollipops. You'll need one per guest. Design a birthday party logo on your computer. It must be able to fit onto the lollipop. Include a message such as \"Thank you for coming to Melissa's birthday party\" and any pictures, patterns or designs you'd like. Print off as many as needed for each lollipop. Cut around them to fit the lollipop. Glue onto each lollipop. Finish off with a small ribbon tied around the lollipop stick. Done. This is a nice, easy way to make a candy party favor that also serves as a memento. Halloween pumpkins Purchase orange tulle (net), orange jellybeans or candies, orange or brown rubber bands and brown pipe cleaners (chenille sticks).  Draw a large circle on a piece of thin card. This is the template for cutting out the tulle circles. It must be large enough so that when the tulle is gathered, it holds about a handful of the candies inside the tulle. Place the template onto the tulle. Cut out as many circles as you need to make candy party favors. Fill the first tulle circle with candy. Then draw up all of the circle edges of the tulle to the center top, holding it with your fingers. There needs to be enough tulle meeting in the center to allow for you to wrap the chenille stick around it. If not, remove some of the candies; you'll get a sense for how many candies to add as you keep making more pumpkins. Use the rubber band to hold the tulle top in place. Wrap it around to fit tightly, so that no candies can escape. Wind the brown pipe cleaner around the tulle top. This forms the pumpkin stem. As it leaves the tulle, continue to wind the top part of the pipe cleaner into a standalone spiral. This finishes off the look. Repeat until all of the pumpkins needed have been made. These make great Halloween party favors or they can be given out at the door for trick and treaters. Finished. ",
  "tyn_model":[
    "tulle",
    "cellophane bags",
    "candy",
    "cellophane",
    "pipe cleaner",
    "candy bag",
    "paper",
    "candy skewer",
    "skewers",
    "skewer",
    "tray",
    "large plate",
    "plate",
    "tape",
    "candy jars",
    "jars",
    "chocolates",
    "jelly beans",
    "sweets",
    "jar",
    "glue",
    "ribbon",
    "rubber bands",
    "pipe cleaners",
    "card",
    "template",
    "rubber band"
  ],
  "tyn_section":[

  ]
}