{
  "title":"How to Cook Smoked Turkey Legs",
  "url":"https://www.wikihow.com/Cook-Smoked-Turkey-Legs",
  "category_hierarchy":[
    "Food and Entertaining",
    "Recipes",
    "Meat",
    "Poultry Recipes"
  ],
  "methods":[
    {
      "name":"Preparing the Turkey Legs",
      "steps":[
        {
          "headline":"Make the brine.",
          "description":"Combine all the brining ingredients in a large pot over medium-high heat. Stir to mix it all together and cook it until it starts to boil. Remove the pot from heat. Let it cool to room temperature."
        },
        {
          "headline":"Pour the brine into containers.",
          "description":"Place it in one large food-safe container or a couple of small containers. If using a large one, make sure it easily fits in your refrigerator. The brining liquid must be at 40 \u00b0F (4.4 \u00b0C). before using."
        },
        {
          "headline":"Add the turkey legs.",
          "description":"Place the turkey legs in the brining liquid and cover with plastic wrap. Put them in the refrigerator and let the legs rest for 8 to 9 hours, or overnight."
        },
        {
          "headline":"Remove the turkey legs from the brine.",
          "description":"Take the legs out of the brining liquid and discard the brine. Rinse the turkey legs with cold water."
        },
        {
          "headline":"Cover the turkey legs with the oil and season.",
          "description":"Drizzle and rub some peanut or vegetable oil to coat the turkey legs. You can use a pastry brush or your fingers. Season the legs with salt and pepper or extra Cajun seasoning, if you want it a little spicier."
        }
      ]
    },
    {
      "name":"Cooking the Turkey Legs in a Smoker",
      "steps":[
        {
          "headline":"Prepare your smoker.",
          "description":"Follow your manufacturer's directions to get the heat between 250 and 275 degrees F. When you see smoke coming from the vents, you can add your turkey. You can use an electric, gas, wood, or charcoal smoker."
        },
        {
          "headline":"Place the turkey legs on the smoker grate and cook.",
          "description":"Smoke the turkey legs for 2 to 2.5 hours. If you want smokier turkey legs, consider smoking them longer at a lower heat. Try 3.5 to 4 hours at 225 to 240 degrees."
        },
        {
          "headline":"Check the turkey legs.",
          "description":"Use a meat thermometer and check to see if the legs have reached 165 \u00b0F (73.9 \u00b0C). If so, they're finished. If not, continue checking the temperature at regular intervals until they're at 165 degrees."
        },
        {
          "headline":"Remove the legs from the smoker.",
          "description":"Serve the turkey legs immediately or wrap them in foil and refrigerate if using much later. To reheat the turkey legs, set the foil-wrapped cooked turkey legs in a 275 degree F. oven for 30 minutes."
        }
      ]
    },
    {
      "name":"Cooking the Turkey Legs on a Gas or Wood Grill",
      "steps":[
        {
          "headline":"Prepare your grill.",
          "description":"Prepare your charcoal or wood stove as directed, but add several large hunks of hardwood among the charcoal. This will release smoke during grilling and impart a smoky flavor to the turkey legs."
        },
        {
          "headline":"Prepare a smoky seasoning packet, optional.",
          "description":"You could also create a small seasoning packet to place directly in the center of the grill, surrounded by the coals or wood. Take an aluminum pie plate and fill it with the following ingredients. Then, cover the plate with foil and poke holes around the top. When this starts to smoke, add your turkey legs. 1/2 cup white rice\n1/3 cup black loose leaf tea\n1/4 cup brown sugar\n6 whole cloves\n3 star anise pods"
        },
        {
          "headline":"Place the turkey legs directly on the grate and cook.",
          "description":"Smoke the turkey legs for 2 to 2.5 hours. If you want smokier turkey legs, consider grilling them longer at a lower heat. Try 3.5 to 4 hours at 225 to 240 degrees."
        },
        {
          "headline":"Check the turkey legs.",
          "description":"Use a meat thermometer and check to see if the legs have reached 165 \u00b0F (73.9 \u00b0C). If so, they're finished. If not, continue checking the temperature at regular intervals until they're at 165 degrees F."
        },
        {
          "headline":"Remove the legs from the grill.",
          "description":"Serve the turkey legs immediately or wrap them in foil and refrigerate them if you're going to eat them much later. To reheat the turkey legs, set the foil-wrapped cooked turkey legs in a 275 degree F. oven for 30 minutes."
        },
        {
          "headline":"Finished.",
          "description":""
        }
      ]
    }
  ],
  "text":" Preparing the Turkey Legs Make the brine. Combine all the brining ingredients in a large pot over medium-high heat. Stir to mix it all together and cook it until it starts to boil. Remove the pot from heat. Let it cool to room temperature. Pour the brine into containers. Place it in one large food-safe container or a couple of small containers. If using a large one, make sure it easily fits in your refrigerator. The brining liquid must be at 40 \u00b0F (4.4 \u00b0C). before using. Add the turkey legs. Place the turkey legs in the brining liquid and cover with plastic wrap. Put them in the refrigerator and let the legs rest for 8 to 9 hours, or overnight. Remove the turkey legs from the brine. Take the legs out of the brining liquid and discard the brine. Rinse the turkey legs with cold water. Cover the turkey legs with the oil and season. Drizzle and rub some peanut or vegetable oil to coat the turkey legs. You can use a pastry brush or your fingers. Season the legs with salt and pepper or extra Cajun seasoning, if you want it a little spicier. Cooking the Turkey Legs in a Smoker Prepare your smoker. Follow your manufacturer's directions to get the heat between 250 and 275 degrees F. When you see smoke coming from the vents, you can add your turkey. You can use an electric, gas, wood, or charcoal smoker. Place the turkey legs on the smoker grate and cook. Smoke the turkey legs for 2 to 2.5 hours. If you want smokier turkey legs, consider smoking them longer at a lower heat. Try 3.5 to 4 hours at 225 to 240 degrees. Check the turkey legs. Use a meat thermometer and check to see if the legs have reached 165 \u00b0F (73.9 \u00b0C). If so, they're finished. If not, continue checking the temperature at regular intervals until they're at 165 degrees. Remove the legs from the smoker. Serve the turkey legs immediately or wrap them in foil and refrigerate if using much later. To reheat the turkey legs, set the foil-wrapped cooked turkey legs in a 275 degree F. oven for 30 minutes. Cooking the Turkey Legs on a Gas or Wood Grill Prepare your grill. Prepare your charcoal or wood stove as directed, but add several large hunks of hardwood among the charcoal. This will release smoke during grilling and impart a smoky flavor to the turkey legs. Prepare a smoky seasoning packet, optional. You could also create a small seasoning packet to place directly in the center of the grill, surrounded by the coals or wood. Take an aluminum pie plate and fill it with the following ingredients. Then, cover the plate with foil and poke holes around the top. When this starts to smoke, add your turkey legs. 1/2 cup white rice\n1/3 cup black loose leaf tea\n1/4 cup brown sugar\n6 whole cloves\n3 star anise pods Place the turkey legs directly on the grate and cook. Smoke the turkey legs for 2 to 2.5 hours. If you want smokier turkey legs, consider grilling them longer at a lower heat. Try 3.5 to 4 hours at 225 to 240 degrees. Check the turkey legs. Use a meat thermometer and check to see if the legs have reached 165 \u00b0F (73.9 \u00b0C). If so, they're finished. If not, continue checking the temperature at regular intervals until they're at 165 degrees F. Remove the legs from the grill. Serve the turkey legs immediately or wrap them in foil and refrigerate them if you're going to eat them much later. To reheat the turkey legs, set the foil-wrapped cooked turkey legs in a 275 degree F. oven for 30 minutes. Finished. ",
  "tyn_model":[
    "turkey legs",
    "smoker",
    "foil",
    "grill",
    "refrigerator",
    "turkey",
    "meat thermometer",
    "oven",
    "charcoal",
    "large pot",
    "pot",
    "containers",
    "food-safe container",
    "plastic wrap",
    "cold water",
    "oil",
    "peanut or vegetable oil",
    "pastry brush",
    "salt and pepper",
    "gas or wood grill",
    "smoky seasoning",
    "aluminum pie plate",
    "plate",
    "white rice",
    "loose leaf tea",
    "brown sugar",
    "star anise pods"
  ],
  "tyn_section":[

  ]
}