{
  "title":"How to Make Chicken Gravy",
  "url":"https://www.wikihow.com/Make-Chicken-Gravy",
  "category_hierarchy":[
    "Food and Entertaining",
    "Recipes",
    "Meat",
    "Poultry Recipes",
    "Chicken"
  ],
  "methods":[
    {
      "name":"Using Chicken Drippings",
      "steps":[
        {
          "headline":"Melt the butter in a saucepan on the stove top over a medium heat.",
          "description":"Measure \u00bc cup (56 grams) of butter into the saucepan and wait for it to melt. If the butter starts to boil, turn down the heat. If you don\u2019t have any butter, use margarine instead. Cut the butter into small pieces to make it melt quicker."
        },
        {
          "headline":"Stir the flour into the melted butter.",
          "description":"Measure \u2153 cup (40 grams) of all-purpose flour into the melted butter. Mix the ingredients with a hand-held whisk until they are fully combined and the mixture has a paste consistency. If you don\u2019t have a hand-held whisk, use a fork instead."
        },
        {
          "headline":"Whisk the chicken broth into the flour and butter until the mixture thickens.",
          "description":"Add 2 cups (0.47 L) of chicken broth into the saucepan. Use a hand-held whisk to stir the ingredients into a smooth sauce. Keep stirring the gravy until it reaches your desired consistency. Purchase chicken broth from a supermarket. Use the back of a spoon to squish any lumps in the mixture. It typically takes about 10 minutes for the gravy to thicken."
        },
        {
          "headline":"Stir in the chicken drippings.",
          "description":"Scrape 2 tablespoons (30 mL) of chicken drippings from the bottom of the roasting dish that you cooked the chicken in. This gives the gravy a delicious chicken flavour. Stir the mixture with a spoon until the drippings are evenly dispersed amongst the gravy."
        },
        {
          "headline":"Spoon the hot gravy over your roast chicken and vegetables.",
          "description":"Gravy is a delicious way to add flavour to your roast meal. Use the gravy as a dipping sauce or spoon it over your meat and vegetables, and enjoy! Gravy tastes best hot; however, if you have some leftover, store it in the fridge for up to 2 days."
        }
      ]
    },
    {
      "name":"Making Gravy with Chicken Stock",
      "steps":[
        {
          "headline":"Melt the butter in a large saucepan on the stovetop.",
          "description":"Measure \u00bc cup (56 grams) of butter into the saucepan. Turn the heat up to medium and wait for the butter to melt. If the butter starts to boil or has a burning smell, turn down the heat. If you prefer not to use butter, use margarine instead."
        },
        {
          "headline":"Stir the flour into the butter for 10 minutes.",
          "description":"This gives time for the mixture to turn a golden brown colour. Measure \u00bd cup (64 grams) of all-purpose flour into the butter, and then use a hand-held whisk to combine the ingredients. Continue to stir the mixture to stop it from sticking to the saucepan. Use a fork to mix the flour and butter, if you don\u2019t have a hand-held whisk"
        },
        {
          "headline":"Whisk the chicken stock into the flour and melted butter gradually.",
          "description":"Slowly tip 4 cups (1 L) of chicken stock into the saucepan whilst you whisk the mixture. This helps to avoid lumps forming in the gravy. Purchase liquid stock from a cooking store or a supermarket. Choose a chicken stock that is made from real chicken to achieve the best taste."
        },
        {
          "headline":"Stir the mixture with a wooden spoon over a low heat for 10 minutes.",
          "description":"This helps to thicken the gravy. Stir the mixture continuously to avoid the mixture burning on the bottom of the pan. Keep the mixture on the heat until it is thick enough to coat the rounded side of a spoon."
        },
        {
          "headline":"Mix in the cream, cayenne pepper, salt, and pepper into the gravy.",
          "description":"Measure \u2153 cup (118 mL) of heavy cream, \u00bc teaspoon (1.25 grams) of salt, \u00bc teaspoon (0.5 grams) of pepper, and \u00bc teaspoon (0.5 grams) of cayenne pepper into the gravy. Stir the mixture until the ingredients are combined. If the gravy is lacking flavour, stir another \u00bc teaspoon (1.25 grams) of salt and \u00bc teaspoon (0.5 grams) of pepper into the mixture."
        },
        {
          "headline":"Enjoy the delicious hot gravy with a roast meal.",
          "description":"Pour the gravy over your meat and vegetable to add flavour to your meal. Chicken gravy tastes best hot served hot; however, if you have some leftover, store it in the fridge for up to 2 days."
        }
      ]
    }
  ],
  "text":" Using Chicken Drippings Melt the butter in a saucepan on the stove top over a medium heat. Measure \u00bc cup (56 grams) of butter into the saucepan and wait for it to melt. If the butter starts to boil, turn down the heat. If you don\u2019t have any butter, use margarine instead. Cut the butter into small pieces to make it melt quicker. Stir the flour into the melted butter. Measure \u2153 cup (40 grams) of all-purpose flour into the melted butter. Mix the ingredients with a hand-held whisk until they are fully combined and the mixture has a paste consistency. If you don\u2019t have a hand-held whisk, use a fork instead. Whisk the chicken broth into the flour and butter until the mixture thickens. Add 2 cups (0.47 L) of chicken broth into the saucepan. Use a hand-held whisk to stir the ingredients into a smooth sauce. Keep stirring the gravy until it reaches your desired consistency. Purchase chicken broth from a supermarket. Use the back of a spoon to squish any lumps in the mixture. It typically takes about 10 minutes for the gravy to thicken. Stir in the chicken drippings. Scrape 2 tablespoons (30 mL) of chicken drippings from the bottom of the roasting dish that you cooked the chicken in. This gives the gravy a delicious chicken flavour. Stir the mixture with a spoon until the drippings are evenly dispersed amongst the gravy. Spoon the hot gravy over your roast chicken and vegetables. Gravy is a delicious way to add flavour to your roast meal. Use the gravy as a dipping sauce or spoon it over your meat and vegetables, and enjoy! Gravy tastes best hot; however, if you have some leftover, store it in the fridge for up to 2 days. Making Gravy with Chicken Stock Melt the butter in a large saucepan on the stovetop. Measure \u00bc cup (56 grams) of butter into the saucepan. Turn the heat up to medium and wait for the butter to melt. If the butter starts to boil or has a burning smell, turn down the heat. If you prefer not to use butter, use margarine instead. Stir the flour into the butter for 10 minutes. This gives time for the mixture to turn a golden brown colour. Measure \u00bd cup (64 grams) of all-purpose flour into the butter, and then use a hand-held whisk to combine the ingredients. Continue to stir the mixture to stop it from sticking to the saucepan. Use a fork to mix the flour and butter, if you don\u2019t have a hand-held whisk Whisk the chicken stock into the flour and melted butter gradually. Slowly tip 4 cups (1 L) of chicken stock into the saucepan whilst you whisk the mixture. This helps to avoid lumps forming in the gravy. Purchase liquid stock from a cooking store or a supermarket. Choose a chicken stock that is made from real chicken to achieve the best taste. Stir the mixture with a wooden spoon over a low heat for 10 minutes. This helps to thicken the gravy. Stir the mixture continuously to avoid the mixture burning on the bottom of the pan. Keep the mixture on the heat until it is thick enough to coat the rounded side of a spoon. Mix in the cream, cayenne pepper, salt, and pepper into the gravy. Measure \u2153 cup (118 mL) of heavy cream, \u00bc teaspoon (1.25 grams) of salt, \u00bc teaspoon (0.5 grams) of pepper, and \u00bc teaspoon (0.5 grams) of cayenne pepper into the gravy. Stir the mixture until the ingredients are combined. If the gravy is lacking flavour, stir another \u00bc teaspoon (1.25 grams) of salt and \u00bc teaspoon (0.5 grams) of pepper into the mixture. Enjoy the delicious hot gravy with a roast meal. Pour the gravy over your meat and vegetable to add flavour to your meal. Chicken gravy tastes best hot served hot; however, if you have some leftover, store it in the fridge for up to 2 days.",
  "tyn_model":[
    "butter",
    "saucepan",
    "flour",
    "chicken stock",
    "hand-held whisk",
    "chicken broth",
    "spoon",
    "gravy",
    "salt",
    "pepper",
    "margarine",
    "\u2153 cup",
    "all-purpose flour",
    "fork",
    "cayenne pepper",
    "stove top",
    "roasting dish",
    "large saucepan",
    "liquid stock",
    "cooking store",
    "wooden spoon",
    "cream",
    "heavy cream"
  ],
  "tyn_section":[

  ]
}