{
  "title":"How to Clean Children's Bath Toys",
  "url":"https://www.wikihow.com/Clean-Children%27s-Bath-Toys",
  "category_hierarchy":[
    "Hobbies and Crafts",
    "Toys",
    "Care and Repair of Toys"
  ],
  "methods":[
    {
      "name":"Method 1: Cleaning the Toys with Vinegar",
      "steps":[
        {
          "headline":"Consider the benefits of vinegar.",
          "description":"Vinegar is a very effective cleaner and is a harmless natural cleaner. It should be your first choice for cleaning and preventing any \u201cunwanted additives\u201d and other dirt or bacteria on your child's toys."
        },
        {
          "headline":"Mix the vinegar solution.",
          "description":"Combine two parts warm water and one part white vinegar. The acid in the vinegar will naturally dissolve most of the dirt, so you do not need to use soap. Apple cider vinegar is also very effective at cleaning bath toys. However, white alcoholic vinegar is the best choice because it is colorless and is less likely to leave any unwanted residue."
        },
        {
          "headline":"Remove any excess water inside the toy.",
          "description":"Bath toys usually have a hole on the bottom of the toy that makes a sound when they are squeezed, but this hole can also allow water to get into the inside of the toys. If water sits inside the toy, it can develop bacteria and promote the growth of mold. So always squeeze out any excess water and let the toys dry thoroughly."
        },
        {
          "headline":"Soak the toys in the vinegar solution.",
          "description":"Let the toys soak for at least 10-15 minutes. Make sure the solution also gets into the inside of the toy, where dirt can accumulate."
        },
        {
          "headline":"Scrub the toy with the vinegar using a small brush.",
          "description":"Scrub in all directions and on the entire surface of the toy using a small brush or toothbrush. If there are narrow areas or small openings on the toy, scrub these surfaces using the tip of the brush. For example, to clean the inside of a rubber duck\u2019s beak, put the brush inside the beak and scrub the surface in a circular motion."
        },
        {
          "headline":"Rinse the toys in water and let them dry.",
          "description":"Use clean water to rinse the toys and allow them to dry completely in the sun or on a dry towel before allowing your child to use them."
        }
      ]
    },
    {
      "name":"Method 2: Using the Dishwasher",
      "steps":[
        {
          "headline":"Check that the toy(s) can be safely washed in the dishwasher.",
          "description":"The dishwasher runs at high temperatures in order to destroy any bacteria, so always check the label on the toy(s) to make sure it is dishwasher safe before using this method."
        },
        {
          "headline":"Squeeze out the excess water inside the toys and let them dry out.",
          "description":"It\u2019s important to dry the toys as much as possible before you put them in the dishwasher to help reduce the moisture on and in the toys."
        },
        {
          "headline":"Place the toys on the dishwasher rack.",
          "description":"Put them in a lingerie bag or in a plastic basket if they are smaller, on the top shelf of the machine."
        },
        {
          "headline":"Add the dishwasher soap or cleaning agent of choice.",
          "description":"You can use regular detergent, a natural solution, or dishwasher capsules. For a natural cleaning agent, use a solution of one part white vinegar and three parts warm water."
        },
        {
          "headline":"Choose the setting and turn on the machine.",
          "description":"Use the warming cycle setting to ensure the toys come out dry. Some machines have an extra cycle with a higher temperature for sterilization. Be careful with this option as bath toys made of plastic or rubber can melt or be damaged by high temperatures."
        },
        {
          "headline":"Remove the toys once the cycle has finished and dry them.",
          "description":"Put the toys on a dry towel to air dry completely before putting them back in the tub or allowing your child to use them."
        }
      ]
    },
    {
      "name":"Method 3: Cleaning the Toys with Chlorine Bleach",
      "steps":[
        {
          "headline":"Check your child\u2019s toys for mold.",
          "description":"If there are visible traces of mold, chlorine bleach is one way you can remove the mold and sanitize the toys. Always pay strict attention to the amount of bleach in the cleaning solution you use as bleach can be harmful to the health of your children if it is ingested. Due to health risks, this method should only be used sparingly, and only if your child\u2019s toys are very moldy. Use Environmental Protection Agency registered bleach products, as the concentration of chemicals in bleach has recently risen."
        },
        {
          "headline":"Make the cleaning solution.",
          "description":"Combine 1 tablespoon of chlorine bleach with 1 gallon (3.8 L) of water. Diluting the bleach lessens its harmful effects."
        },
        {
          "headline":"Soak the toys in the solution.",
          "description":"You can spray the toys with the solution or place the toys in a tub of the solution. Press the toys while they are soaking so the solution is sucked through any holes and gets inside the toys. Allow the solution to remain on the toys for two minutes. For a more thorough clean, you can soak the bath toys in a solution of 1/2 cup bleach and 1 gallon (3.8 L) of water for fifteen minutes."
        },
        {
          "headline":"Thoroughly rinse the toys with clean water.",
          "description":"Squeeze and rinse the toys several times. Be sure to also rinse the inside of the toys by pouring clean water into the holes and squeezing the toys. While you cannot see bleach, you can smell it. So rinse the toys until you can no longer smell bleach on them. If you do not rinse the toys well, your child can swallow any bleach left on or inside the toy. Bleach poses numerous health risks and issues, especially for young children, and is highly corrosive to the skin, eyes, and lungs. So always make sure you rinse away all bleach from the toys."
        },
        {
          "headline":"Allow the toys to dry completely.",
          "description":"You can air dry them on a dry towel or in the sun. Always check that the toys are completely dried before allowing your child to play with them."
        }
      ]
    },
    {
      "name":"Method 4: Properly Storing the Toys",
      "steps":[
        {
          "headline":"Squeeze and rinse the bath toys after every use.",
          "description":"Removing any excess water from the toys on a consistent basis will cut down on the amount of bacteria and dirt that remains on the toys."
        },
        {
          "headline":"Thoroughly dry the toys after every use.",
          "description":"Place the toys on a dry towel or in the sun to ensure they get good ventilation and dry out completely as the moist environment creates an ideal breeding ground for mold and bacteria."
        },
        {
          "headline":"Store the dry toys in a breathable box.",
          "description":"Boxes for bath toys should be placed outside the bathroom, where there is natural light and good ventilation. A box made with perforated material or mesh is ideal as it allows for good air circulation."
        },
        {
          "headline":"Consider sealing up the holes on the bath toys.",
          "description":"As the interior of the toys is the hardest area to clean and to dry, it may be a good idea to seal or close up these holes. You can do this using super glue or a glue gun. If you use a glue gun to seal the holes, be sure not to leave it in the vicinity of children to prevent the risk of burns. If the toy is wet before you seal it and you do not dry it out, this can lead to the development of bacteria and mold inside the sealed toy. If the toy then breaks or the glue does not stick, your child may be exposed to the infected water. So before you seal the holes, be sure to disinfect and thoroughly dry the toys. Check the sealed holes on the toys periodically to make sure they are glued well, as any loose glue can become a choking hazard."
        }
      ]
    }
  ],
  "text":" Method 1: Cleaning the Toys with Vinegar Consider the benefits of vinegar. Vinegar is a very effective cleaner and is a harmless natural cleaner. It should be your first choice for cleaning and preventing any \u201cunwanted additives\u201d and other dirt or bacteria on your child's toys. Mix the vinegar solution. Combine two parts warm water and one part white vinegar. The acid in the vinegar will naturally dissolve most of the dirt, so you do not need to use soap. Apple cider vinegar is also very effective at cleaning bath toys. However, white alcoholic vinegar is the best choice because it is colorless and is less likely to leave any unwanted residue. Remove any excess water inside the toy. Bath toys usually have a hole on the bottom of the toy that makes a sound when they are squeezed, but this hole can also allow water to get into the inside of the toys. If water sits inside the toy, it can develop bacteria and promote the growth of mold. So always squeeze out any excess water and let the toys dry thoroughly. Soak the toys in the vinegar solution. Let the toys soak for at least 10-15 minutes. Make sure the solution also gets into the inside of the toy, where dirt can accumulate. Scrub the toy with the vinegar using a small brush. Scrub in all directions and on the entire surface of the toy using a small brush or toothbrush. If there are narrow areas or small openings on the toy, scrub these surfaces using the tip of the brush. For example, to clean the inside of a rubber duck\u2019s beak, put the brush inside the beak and scrub the surface in a circular motion. Rinse the toys in water and let them dry. Use clean water to rinse the toys and allow them to dry completely in the sun or on a dry towel before allowing your child to use them. Method 2: Using the Dishwasher Check that the toy(s) can be safely washed in the dishwasher. The dishwasher runs at high temperatures in order to destroy any bacteria, so always check the label on the toy(s) to make sure it is dishwasher safe before using this method. Squeeze out the excess water inside the toys and let them dry out. It\u2019s important to dry the toys as much as possible before you put them in the dishwasher to help reduce the moisture on and in the toys. Place the toys on the dishwasher rack. Put them in a lingerie bag or in a plastic basket if they are smaller, on the top shelf of the machine. Add the dishwasher soap or cleaning agent of choice. You can use regular detergent, a natural solution, or dishwasher capsules. For a natural cleaning agent, use a solution of one part white vinegar and three parts warm water. Choose the setting and turn on the machine. Use the warming cycle setting to ensure the toys come out dry. Some machines have an extra cycle with a higher temperature for sterilization. Be careful with this option as bath toys made of plastic or rubber can melt or be damaged by high temperatures. Remove the toys once the cycle has finished and dry them. Put the toys on a dry towel to air dry completely before putting them back in the tub or allowing your child to use them. Method 3: Cleaning the Toys with Chlorine Bleach Check your child\u2019s toys for mold. If there are visible traces of mold, chlorine bleach is one way you can remove the mold and sanitize the toys. Always pay strict attention to the amount of bleach in the cleaning solution you use as bleach can be harmful to the health of your children if it is ingested. Due to health risks, this method should only be used sparingly, and only if your child\u2019s toys are very moldy. Use Environmental Protection Agency registered bleach products, as the concentration of chemicals in bleach has recently risen. Make the cleaning solution. Combine 1 tablespoon of chlorine bleach with 1 gallon (3.8 L) of water. Diluting the bleach lessens its harmful effects. Soak the toys in the solution. You can spray the toys with the solution or place the toys in a tub of the solution. Press the toys while they are soaking so the solution is sucked through any holes and gets inside the toys. Allow the solution to remain on the toys for two minutes. For a more thorough clean, you can soak the bath toys in a solution of 1/2 cup bleach and 1 gallon (3.8 L) of water for fifteen minutes. Thoroughly rinse the toys with clean water. Squeeze and rinse the toys several times. Be sure to also rinse the inside of the toys by pouring clean water into the holes and squeezing the toys. While you cannot see bleach, you can smell it. So rinse the toys until you can no longer smell bleach on them. If you do not rinse the toys well, your child can swallow any bleach left on or inside the toy. Bleach poses numerous health risks and issues, especially for young children, and is highly corrosive to the skin, eyes, and lungs. So always make sure you rinse away all bleach from the toys. Allow the toys to dry completely. You can air dry them on a dry towel or in the sun. Always check that the toys are completely dried before allowing your child to play with them. Method 4: Properly Storing the Toys Squeeze and rinse the bath toys after every use. Removing any excess water from the toys on a consistent basis will cut down on the amount of bacteria and dirt that remains on the toys. Thoroughly dry the toys after every use. Place the toys on a dry towel or in the sun to ensure they get good ventilation and dry out completely as the moist environment creates an ideal breeding ground for mold and bacteria. Store the dry toys in a breathable box. Boxes for bath toys should be placed outside the bathroom, where there is natural light and good ventilation. A box made with perforated material or mesh is ideal as it allows for good air circulation. Consider sealing up the holes on the bath toys. As the interior of the toys is the hardest area to clean and to dry, it may be a good idea to seal or close up these holes. You can do this using super glue or a glue gun. If you use a glue gun to seal the holes, be sure not to leave it in the vicinity of children to prevent the risk of burns. If the toy is wet before you seal it and you do not dry it out, this can lead to the development of bacteria and mold inside the sealed toy. If the toy then breaks or the glue does not stick, your child may be exposed to the infected water. So before you seal the holes, be sure to disinfect and thoroughly dry the toys. Check the sealed holes on the toys periodically to make sure they are glued well, as any loose glue can become a choking hazard.",
  "tyn_model":[
    "water",
    "bleach",
    "vinegar",
    "bath toys",
    "chlorine bleach",
    "white vinegar",
    "glue gun",
    "\u201cunwanted",
    "\u201d and",
    "apple cider vinegar",
    "white alcoholic vinegar",
    "small brush",
    "rubber duck",
    "brush",
    "dishwasher",
    "dishwasher rack",
    "dishwasher soap",
    "dishwasher capsules",
    "warm water",
    "tub",
    "environmental protection agency registered bleach products",
    "cleaning solution",
    "breathable box",
    "super glue",
    "glue"
  ],
  "tyn_section":[

  ]
}