{
  "title":"How to Unlock Car Slots in Need for Speed",
  "url":"https://www.wikihow.com/Unlock-Car-Slots-in-Need-for-Speed",
  "category_hierarchy":[
    "Hobbies and Crafts",
    "Games",
    "Video Games",
    "Multi Platform Games",
    "Need for Speed"
  ],
  "methods":[
    {
      "name":"Unlocking Car Slots in Need for Speed: Underground 2 (PC)",
      "steps":[
        {
          "headline":"Launch the game from the Windows Start menu.",
          "description":"Click the Start button  >> All Programs >> EA Games >> Need for Speed Underground 2. You can also start it by double-clicking the Need for Speed: Underground 2 shortcut from the desktop, if you have it there."
        },
        {
          "headline":"Choose \u201cCareer\u201d on the game\u2019s Main Menu.",
          "description":"This will open the Career Mode screen."
        },
        {
          "headline":"Choose \u201cResume Career\u201d by pressing Enter.",
          "description":"This will launch the Career Mode menu."
        },
        {
          "headline":"Scroll rightwards and select \u201cWorld Map.\u201d This will bring up a map of the game world (the fictional Olympic City) with different races and their locations.",
          "description":""
        },
        {
          "headline":"Select a race.",
          "description":"You can scroll downwards to view the different races, and when a drift race is highlighted, press Enter to select it."
        },
        {
          "headline":"Choose \u201cYes\u201d on the confirmation dialogue that comes.",
          "description":"The race will start. You can navigate  the track and control your car using the following keys:\nUp and Down Arrow keys for accelerating and braking respectively, and Left and Right Arrow keys for steering left and right respectively."
        },
        {
          "headline":"Start and complete a second race.",
          "description":"After you have completed the first drift race, do the following to start your second race:\nPress \u201cEscape\u201d to bring up the Pause Menu. Scroll rightwards (Right arrow key) till \u201cJump to Garage\u201d is highlighted and press Enter. You will be asked to confirm if you wish to Jump to Garage. Scroll to \u201cOK\u201d (Up/Down Arrow keys) and press Enter. This will take you to your Garage. On the Garage menu, choose \u201cWorld Map.\u201d This will bring up the game\u2019s map again where you can select your second drift race."
        },
        {
          "headline":"Start and complete the third race.",
          "description":"Just follow the previous steps to start and complete the third race required to get a sponsor."
        },
        {
          "headline":"Sign up with a sponsor.",
          "description":"Once you complete the third drift race, you will be presented with a contract from a sponsor. Select \u201cAgree\u201d to sign up with the sponsor."
        },
        {
          "headline":"Win 3 URL races and 9 races of your choice.",
          "description":"Before you get your extra car slot, you will need to fulfill all the requirements on the contract, which are: win three URL races, three races of the sponsor\u2019s choice, and nine other races of your choice. All the other types of races except sponsor races can be accessed by following the steps outlined above and choosing the respective type of race you on the World Map. To start a sponsor race, proceed to the next step."
        },
        {
          "headline":"Win 3 Sponsor races.",
          "description":"On the Career Mode menu, choose \u201cReturn to Explore Mode.\u201d This will take you to the game world (the streets of the fictional Olympic City). In Explore Mode, look for X-shaped icons on the mini map (displayed on the left bottom corner of the screen). These icons represent the locations of Sponsor races in the city. Using the mini map as a guide, drive to the Sponsor race. When you arrive at the location, stop in the race\u2019s marker and press Enter to start the race. Repeat this process till you win all the current Sponsor\u2019s races."
        },
        {
          "headline":"View your new car slot.",
          "description":"After completing all the races that the contract requires you to complete, a new car slot will be unlocked in your garage. To access your garage, press \u201cEscape\u201d to bring up the Pause Menu. Scroll rightwards (Right arrow key) till \u201cJump to Garage\u201d is highlighted and press Enter. You will be asked to confirm if you wish to Jump to Garage. Scroll to \u201cOK\u201d (Up/Down Arrow keys) and press Enter. This will take you to your Garage. On the Garage menu, scroll rightwards and choose \u201cCar Select.\u201d\nScroll rightwards to view all your available Cars and Car Slots. You will find that a new Car Slot has been added."
        }
      ]
    },
    {
      "name":"Unlocking Car Slots in Need for Speed: World (PC)",
      "steps":[
        {
          "headline":"Launch NFS World.",
          "description":"You can do this using the Windows Start menu (Start button >> All Programs >> EA Games >> Need for Speed World) or by double-clicking the Need for Speed: World shortcut on your desktop, if you have it there. The cheat only works when the game is running."
        },
        {
          "headline":"Minimize the game to the task bar once it loads.",
          "description":"You can do this by pressing Ctrl + Esc together."
        },
        {
          "headline":"Visit the download page of the cheat.",
          "description":"On a new web browser, go to http://rghost.net/50739915."
        },
        {
          "headline":"Click the \u201cDownload\u201d button.",
          "description":"This will download a zip (compressed) file named nfsw,slots.rar that contains two files: NFSW_PursuitBot.exe and SlotBot.exe."
        },
        {
          "headline":"Right-click the nfsw,slots.zip file and select the \u201cExtract Here\u201d option from the menu.",
          "description":"This will extract the two files from the zip file and place them in the folder you are working from."
        },
        {
          "headline":"Right-click NFSW_PursuitBot.exe and select Run as Administrator.",
          "description":""
        },
        {
          "headline":"Right-click SlotBot.exe and select Run as Administrator.",
          "description":"This will bring up a dialog box that will allow you to choose how many slots you wish to add to your NFS World garage."
        },
        {
          "headline":"Type in the number of slots in figures, e.g., 10, and press \u201cGo.\"",
          "description":"This will add the number of slots you specified in your garage. The number of car slots you have represents the maximum number of cars you can buy in NFS World, hence the more the better!"
        }
      ]
    }
  ],
  "text":" Unlocking Car Slots in Need for Speed: Underground 2 (PC) Launch the game from the Windows Start menu. Click the Start button  >> All Programs >> EA Games >> Need for Speed Underground 2. You can also start it by double-clicking the Need for Speed: Underground 2 shortcut from the desktop, if you have it there. Choose \u201cCareer\u201d on the game\u2019s Main Menu. This will open the Career Mode screen. Choose \u201cResume Career\u201d by pressing Enter. This will launch the Career Mode menu. Scroll rightwards and select \u201cWorld Map.\u201d This will bring up a map of the game world (the fictional Olympic City) with different races and their locations.  Select a race. You can scroll downwards to view the different races, and when a drift race is highlighted, press Enter to select it. Choose \u201cYes\u201d on the confirmation dialogue that comes. The race will start. You can navigate  the track and control your car using the following keys:\nUp and Down Arrow keys for accelerating and braking respectively, and Left and Right Arrow keys for steering left and right respectively. Start and complete a second race. After you have completed the first drift race, do the following to start your second race:\nPress \u201cEscape\u201d to bring up the Pause Menu. Scroll rightwards (Right arrow key) till \u201cJump to Garage\u201d is highlighted and press Enter. You will be asked to confirm if you wish to Jump to Garage. Scroll to \u201cOK\u201d (Up/Down Arrow keys) and press Enter. This will take you to your Garage. On the Garage menu, choose \u201cWorld Map.\u201d This will bring up the game\u2019s map again where you can select your second drift race. Start and complete the third race. Just follow the previous steps to start and complete the third race required to get a sponsor. Sign up with a sponsor. Once you complete the third drift race, you will be presented with a contract from a sponsor. Select \u201cAgree\u201d to sign up with the sponsor. Win 3 URL races and 9 races of your choice. Before you get your extra car slot, you will need to fulfill all the requirements on the contract, which are: win three URL races, three races of the sponsor\u2019s choice, and nine other races of your choice. All the other types of races except sponsor races can be accessed by following the steps outlined above and choosing the respective type of race you on the World Map. To start a sponsor race, proceed to the next step. Win 3 Sponsor races. On the Career Mode menu, choose \u201cReturn to Explore Mode.\u201d This will take you to the game world (the streets of the fictional Olympic City). In Explore Mode, look for X-shaped icons on the mini map (displayed on the left bottom corner of the screen). These icons represent the locations of Sponsor races in the city. Using the mini map as a guide, drive to the Sponsor race. When you arrive at the location, stop in the race\u2019s marker and press Enter to start the race. Repeat this process till you win all the current Sponsor\u2019s races. View your new car slot. After completing all the races that the contract requires you to complete, a new car slot will be unlocked in your garage. To access your garage, press \u201cEscape\u201d to bring up the Pause Menu. Scroll rightwards (Right arrow key) till \u201cJump to Garage\u201d is highlighted and press Enter. You will be asked to confirm if you wish to Jump to Garage. Scroll to \u201cOK\u201d (Up/Down Arrow keys) and press Enter. This will take you to your Garage. On the Garage menu, scroll rightwards and choose \u201cCar Select.\u201d\nScroll rightwards to view all your available Cars and Car Slots. You will find that a new Car Slot has been added. Unlocking Car Slots in Need for Speed: World (PC) Launch NFS World. You can do this using the Windows Start menu (Start button >> All Programs >> EA Games >> Need for Speed World) or by double-clicking the Need for Speed: World shortcut on your desktop, if you have it there. The cheat only works when the game is running. Minimize the game to the task bar once it loads. You can do this by pressing Ctrl + Esc together. Visit the download page of the cheat. On a new web browser, go to http://rghost.net/50739915. Click the \u201cDownload\u201d button. This will download a zip (compressed) file named nfsw,slots.rar that contains two files: NFSW_PursuitBot.exe and SlotBot.exe. Right-click the nfsw,slots.zip file and select the \u201cExtract Here\u201d option from the menu. This will extract the two files from the zip file and place them in the folder you are working from. Right-click NFSW_PursuitBot.exe and select Run as Administrator.  Right-click SlotBot.exe and select Run as Administrator. This will bring up a dialog box that will allow you to choose how many slots you wish to add to your NFS World garage. Type in the number of slots in figures, e.g., 10, and press \u201cGo.\" This will add the number of slots you specified in your garage. The number of car slots you have represents the maximum number of cars you can buy in NFS World, hence the more the better!",
  "tyn_model":[
    "\u201d this",
    "\u201d to",
    "\u201d on",
    "\u201cworld",
    "\u201cescape",
    "\u201cjump",
    "\u201d is",
    "\u201cok",
    "\u201d (",
    "nfs world",
    "\u201ccareer",
    "\u201cresume",
    "\u201d by",
    "\u201cyes",
    "\u201cagree",
    "\u201creturn",
    "\u201ccar",
    "\u201d\n",
    "cars",
    "\u201cdownload",
    "\u201d button",
    "\u201cextract",
    "\u201d option",
    "\u201cgo"
  ],
  "tyn_section":[

  ]
}