{
  "title":"How to Create a Shirt in ROBLOX",
  "url":"https://www.wikihow.com/Create-a-Shirt-in-ROBLOX",
  "category_hierarchy":[
    "Hobbies and Crafts",
    "Games",
    "Video Games",
    "PC Games",
    "Online Games",
    "Roblox"
  ],
  "parts":[
    {
      "name":"Creating the Shirt",
      "steps":[
        {
          "headline":"Make sure that you have a subscription.",
          "description":"If you aren't a paying member of the Builders Club subscription, you can't upload your shirt template. To become a member of Builders Club:\nGo to https://www.roblox.com/premium/membership?ctx=preroll\n\nSelect the \u201csubscription\u201d button on the right side. Select the amount of time. Select a payment method. Click Continue\n\nEnter your payment details. Click Submit Order"
        },
        {
          "headline":"Open the Roblox shirt template page.",
          "description":"Go to https://static.rbxcdn.com/images/Template-Shirts-R15_04202017.png in your browser. If you want a shirt template that doesn't have any borders on it, go to http://wiki.roblox.com/images/d/d5/Template-Transparent-R15_04112017_V2.png instead."
        },
        {
          "headline":"Save the shirt template onto your computer.",
          "description":"Right-click the template, click Save image as... (or Save as...) in the resulting drop-down menu, select a save location (e.g., your desktop), and click Save. If, your computer's mouse, doesn't have a right mouse button, click the right side of the mouse or use two fingers to click (or tap the trackpad) instead of right-clicking."
        },
        {
          "headline":"Open a photo-editing program.",
          "description":"Depending on your preferences and your operating system, you may have several different photo-editing software options:\nIf you use Windows, you have Microsoft Paint installed by default. You can also download other programs like Paint.NET, which is a free program also available for Mac users. If you use a Mac, you can download Pinta for free, or you can pay for something like Photoshop or Lightroom. GIMP 2 is a good free option for both Windows and Mac users."
        },
        {
          "headline":"Open the template in your program.",
          "description":"Click and drag the template into your photo-editing program\u2014or click File, click Open, and double-click the template\u2014to open it in your program."
        },
        {
          "headline":"Edit the template.",
          "description":"Depending on your preferences for your shirt, this step will vary; for example, if you want to place a logo on your shirt's torso, you might use the photo-editing software's pen tool to draw on the chest section of the template."
        },
        {
          "headline":"Save your shirt.",
          "description":"Press Ctrl+S (Windows) or \u2318 Command+S (Mac) to save the changes to your template, or click File and then click Save."
        }
      ]
    },
    {
      "name":"Uploading the Shirt",
      "steps":[
        {
          "headline":"Open the Roblox main page.",
          "description":"Go to https://www.roblox.com/games in your browser."
        },
        {
          "headline":"Click the Create tab.",
          "description":"It's on the upper-left side of the page."
        },
        {
          "headline":"Click Continue to Create page if prompted.",
          "description":"If this is your first time opening the Create tab, click the blue Continue to Create page link in the pop-up window. Skip this step if you go straight to the Create page. If you aren't logged into Roblox, you'll need to enter your username and password and then click Sign In before you can continue."
        },
        {
          "headline":"Click Shirts.",
          "description":"This option is near the bottom of the \"My Creations\" list of items. You may first need to click My Creations at the top of the page to open this list."
        },
        {
          "headline":"Click Browse.",
          "description":"It's a grey button near the top of the \"Create a Shirt\" page. A window will open."
        },
        {
          "headline":"Select your shirt image.",
          "description":"Find the PNG template image in the folder where you saved it (e.g., Desktop) and click it."
        },
        {
          "headline":"Click Open.",
          "description":"It's in the bottom-right corner of the window."
        },
        {
          "headline":"Enter a name for your shirt.",
          "description":"In the \"Shirt Name\" text field, type in the name of your shirt. This is how it will appear in the web store and on your profile."
        },
        {
          "headline":"Click Upload.",
          "description":"It's a green button below the \"Shirt Name\" text field. Doing so will upload your shirt to your Roblox profile, from which point you can equip or sell it as you please."
        }
      ]
    }
  ],
  "text":" Creating the Shirt Make sure that you have a subscription. If you aren't a paying member of the Builders Club subscription, you can't upload your shirt template. To become a member of Builders Club:\nGo to https://www.roblox.com/premium/membership?ctx=preroll\n\nSelect the \u201csubscription\u201d button on the right side. Select the amount of time. Select a payment method. Click Continue\n\nEnter your payment details. Click Submit Order Open the Roblox shirt template page. Go to https://static.rbxcdn.com/images/Template-Shirts-R15_04202017.png in your browser. If you want a shirt template that doesn't have any borders on it, go to http://wiki.roblox.com/images/d/d5/Template-Transparent-R15_04112017_V2.png instead. Save the shirt template onto your computer. Right-click the template, click Save image as... (or Save as...) in the resulting drop-down menu, select a save location (e.g., your desktop), and click Save. If, your computer's mouse, doesn't have a right mouse button, click the right side of the mouse or use two fingers to click (or tap the trackpad) instead of right-clicking. Open a photo-editing program. Depending on your preferences and your operating system, you may have several different photo-editing software options:\nIf you use Windows, you have Microsoft Paint installed by default. You can also download other programs like Paint.NET, which is a free program also available for Mac users. If you use a Mac, you can download Pinta for free, or you can pay for something like Photoshop or Lightroom. GIMP 2 is a good free option for both Windows and Mac users. Open the template in your program. Click and drag the template into your photo-editing program\u2014or click File, click Open, and double-click the template\u2014to open it in your program. Edit the template. Depending on your preferences for your shirt, this step will vary; for example, if you want to place a logo on your shirt's torso, you might use the photo-editing software's pen tool to draw on the chest section of the template. Save your shirt. Press Ctrl+S (Windows) or \u2318 Command+S (Mac) to save the changes to your template, or click File and then click Save. Uploading the Shirt Open the Roblox main page. Go to https://www.roblox.com/games in your browser. Click the Create tab. It's on the upper-left side of the page. Click Continue to Create page if prompted. If this is your first time opening the Create tab, click the blue Continue to Create page link in the pop-up window. Skip this step if you go straight to the Create page. If you aren't logged into Roblox, you'll need to enter your username and password and then click Sign In before you can continue. Click Shirts. This option is near the bottom of the \"My Creations\" list of items. You may first need to click My Creations at the top of the page to open this list. Click Browse. It's a grey button near the top of the \"Create a Shirt\" page. A window will open. Select your shirt image. Find the PNG template image in the folder where you saved it (e.g., Desktop) and click it. Click Open. It's in the bottom-right corner of the window. Enter a name for your shirt. In the \"Shirt Name\" text field, type in the name of your shirt. This is how it will appear in the web store and on your profile. Click Upload. It's a green button below the \"Shirt Name\" text field. Doing so will upload your shirt to your Roblox profile, from which point you can equip or sell it as you please.",
  "tyn_model":[
    "builders club",
    "photo-editing program",
    "\u201csubscription",
    "\u201d button",
    "roblox shirt",
    "gimp 2",
    "\u2014or",
    "\u2014to",
    "photo-editing software",
    "\u2318 command+s",
    "roblox main",
    "roblox,"
  ],
  "tyn_section":[

  ]
}