{
  "title":"How to Buy Games from the PlayStation Store",
  "url":"https://www.wikihow.com/Buy-Games-from-the-PlayStation-Store",
  "category_hierarchy":[
    "Hobbies and Crafts",
    "Games",
    "Video Games",
    "PlayStation Video Game Consoles"
  ],
  "methods":[
    {
      "name":"Playstation System",
      "steps":[
        {
          "headline":"Open the Playstation Store.",
          "description":"On PS4, this is on the far left side of the app marquee. On PS3 or PSP, this is listed in the Game section of the app marquee."
        },
        {
          "headline":"Sign in to your account (if prompted).",
          "description":"You will need the email associated with your account and your password. If you do not have an account you can make one. You most likely set one up when setting up your system."
        },
        {
          "headline":"Use the left sidebar to browse for media.",
          "description":"The Playstation store carries games, movies, and TV shows for purchase. You can also use the Search option at the top to find specific titles."
        },
        {
          "headline":"Hit the X button when selecting to view the details of an item.",
          "description":""
        },
        {
          "headline":"Press Add to Cart.",
          "description":""
        },
        {
          "headline":"Press Proceed to Checkout.",
          "description":"If you want to add more items, press Continue Shopping and repeat the previous steps. To remove an item from the cart, select the \u201cX\u201d icon next to the title using the directional keys and hit X."
        },
        {
          "headline":"Press Confirm Purchase.",
          "description":"The item will be added to your downloads. Once the download is complete it can be accessed from the Library. If you want to setup or add a new payment method, you can do so from  Settings \u2192 Account Management \u2192 Account Information \u2192 Wallet on PS4 or these steps for PS3/PSP. You may be prompted to enter your account password to complete the purchase if you have that feature enabled."
        }
      ]
    },
    {
      "name":"Web",
      "steps":[
        {
          "headline":"Navigate to https://store.playstation.com in your web browser.",
          "description":""
        },
        {
          "headline":"Click Sign in.",
          "description":"If you do not have an account you will need to click Create Account and make one."
        },
        {
          "headline":"Enter your login information.",
          "description":"You will need the email associated with your account and your password."
        },
        {
          "headline":"Click the Add to Cart button.",
          "description":"If not viewing an item, this will look like a shopping cart with a down arrow. You can click an item to see more information about it. You can browse by platform (PS4, PS3, or PSP), media (Game, Movie, TV), or use the search bar to find specific titles."
        },
        {
          "headline":"Click Show Cart.",
          "description":""
        },
        {
          "headline":"Click Proceed to Checkout.",
          "description":"If you want to add more items, click Continue Shopping and repeat the previous steps."
        },
        {
          "headline":"Click Confirm Purchase.",
          "description":"If you want to setup or add a new payment method, you can do so from Account Settings \u2192 Wallet. You may be prompted to enter your account password to complete the purchase if you have that feature enabled."
        }
      ]
    }
  ],
  "text":" Playstation System Open the Playstation Store. On PS4, this is on the far left side of the app marquee. On PS3 or PSP, this is listed in the Game section of the app marquee. Sign in to your account (if prompted). You will need the email associated with your account and your password. If you do not have an account you can make one. You most likely set one up when setting up your system. Use the left sidebar to browse for media. The Playstation store carries games, movies, and TV shows for purchase. You can also use the Search option at the top to find specific titles. Hit the X button when selecting to view the details of an item.  Press Add to Cart.  Press Proceed to Checkout. If you want to add more items, press Continue Shopping and repeat the previous steps. To remove an item from the cart, select the \u201cX\u201d icon next to the title using the directional keys and hit X. Press Confirm Purchase. The item will be added to your downloads. Once the download is complete it can be accessed from the Library. If you want to setup or add a new payment method, you can do so from  Settings \u2192 Account Management \u2192 Account Information \u2192 Wallet on PS4 or these steps for PS3/PSP. You may be prompted to enter your account password to complete the purchase if you have that feature enabled. Web Navigate to https://store.playstation.com in your web browser.  Click Sign in. If you do not have an account you will need to click Create Account and make one. Enter your login information. You will need the email associated with your account and your password. Click the Add to Cart button. If not viewing an item, this will look like a shopping cart with a down arrow. You can click an item to see more information about it. You can browse by platform (PS4, PS3, or PSP), media (Game, Movie, TV), or use the search bar to find specific titles. Click Show Cart.  Click Proceed to Checkout. If you want to add more items, click Continue Shopping and repeat the previous steps. Click Confirm Purchase. If you want to setup or add a new payment method, you can do so from Account Settings \u2192 Wallet. You may be prompted to enter your account password to complete the purchase if you have that feature enabled.",
  "tyn_model":[
    "\u2192 account",
    "\u2192 wallet",
    "\u201cx",
    "\u201d icon",
    "shopping cart"
  ],
  "tyn_section":[

  ]
}