{
  "title":"How to Play My Horse",
  "url":"https://www.wikihow.com/Play-My-Horse",
  "category_hierarchy":[
    "Hobbies and Crafts",
    "Games"
  ],
  "parts":[
    {
      "name":"Starting Off Your Account",
      "steps":[
        {
          "headline":"Expect to be introduced to the game by an electronic man that welcomes you to My Horse.",
          "description":"Touch your horse to get its attention (as the man tells you to do)."
        },
        {
          "headline":"Do everything the man tells you to do.",
          "description":"He will introduce you to different things you can do on My Horse."
        },
        {
          "headline":"Change your nickname.",
          "description":"Go to your profile by clicking the empty circle person image at the top left corner of the screen. Tap where the nickname box is and type in a new nickname. Do the same with your horse name, if you want a different name (the default name when you have just made an account is \"Beauty\")."
        },
        {
          "headline":"Add a picture if you'd like.",
          "description":""
        },
        {
          "headline":"Add/request friends if you'd like as well.",
          "description":""
        }
      ]
    },
    {
      "name":"Doing Care\\/Work Tasks",
      "steps":[
        {
          "headline":"Earn enough coins, XP, and energy.",
          "description":"You will need these to complete care tasks and work tasks. You can earn these things by playing mini-games (found in the journal the man shows you) when you start off."
        },
        {
          "headline":"In the journal, tap the tab with the health and happiness picture or the one with coins in the other picture.",
          "description":"The coins are the work tasks, allowing you to earn coins and XP. They cost energy. Care tasks are found via the other picture, and these give you health and happiness; they cost energy and coins."
        },
        {
          "headline":"Choose which type of task you want to do.",
          "description":"When you start your account off, the only ones available is stable maintenance and riding lessons."
        },
        {
          "headline":"Choose which task you want to have your horse have.",
          "description":"When you start your account off, the only tasks available will be the first options."
        },
        {
          "headline":"Level up or earn gems in order to get new work tasks and care tasks.",
          "description":"If you level up, you will automatically earn new tasks. If you have gems, you can buy the new tasks with them."
        }
      ]
    },
    {
      "name":"Competitions",
      "steps":[
        {
          "headline":"Buy treats with gems to earn energy in order to do competitions.",
          "description":"You can also wait to let your horse rest to get more energy. It's best if you let your horse recharge to 100 energy to save your gems."
        },
        {
          "headline":"Go to the journal.",
          "description":"Tap the tab that shows a picture of a medal on it."
        },
        {
          "headline":"At first, the only series you can compete in is the UK series.",
          "description":"Tap that one."
        },
        {
          "headline":"Choose the first competition.",
          "description":"One you finish more competitions, you will be able to move on to other competitions."
        },
        {
          "headline":"Before competing with your horse, it requires training, which also takes up energy.",
          "description":"Depending on how many stars you see over each trick, that shows how many times you need to train for that trick. You will need to complete the training half and half or in thirds to fill in one star. The first competition takes only one star."
        },
        {
          "headline":"Press the black button when the horse gets exactly into the blue area, for best results.",
          "description":"The excellent and good results are okay, but try not to get results in any of the other colors."
        },
        {
          "headline":"Press the ready button when all the training is complete and compete to win some medals!",
          "description":"You will also win coins and XP this way."
        }
      ]
    },
    {
      "name":"Playing Minigames",
      "steps":[
        {
          "headline":"Go to the journal and tap the first tab.",
          "description":"You will see some \"minigames\" (competitions and buying a new horse are not part of this); grooming, feeding, mucking out, and cleaning up the paddock. When you just started your account, the only one available is feeding."
        },
        {
          "headline":"Tap a minigame.",
          "description":"Use this guide to show you how to play each of the minigames:\n\nFeeding - Choose a recipe that you can afford to buy with your coins. If you look at the top, there will be more tabs with more recipes you can use. Pour in the correct ingredients until it reaches the red point. Drag the bucket to the side to fill in other ingredients. When the mixing picture appears, press it and mix the ingredients together. Mucking out - Drag dirty straw into the bucket nearly at the top left corner. Don't drag clean straw, or it will lower your score. Depending on how long you take, slowness will also lower your score. Swipe the block of new straw and spread it out for a nice bed for your horse. Grooming - Touch your dirty horse to remove dirty marks. A checkmark button will appear when you cleaned most of the horse. You can press it to finish, but if you want more coins and XP, clean the horse some more until the checkmark is filled green. Paddock cleanup - On the side of the screen, when there is a shovel, tap the horse's business. When you see a rake, tap the weeds. Depending on how long you take, the highest score is 6 health, 6 happiness, and 12 XP."
        }
      ]
    },
    {
      "name":"Earning Gems",
      "steps":[
        {
          "headline":"Compete in competitions.",
          "description":"Later in the game, another generated helper who appears just like the man but is a girl this time, rewards you with gems sometimes when you win first place in a competition."
        },
        {
          "headline":"Complete goals that are set for you.",
          "description":"Goals are unlocked later in the game where you do a certain event a certain amount of time. For example, \"Care task: Muck out 20x\". You will earn a gem when you finish everything it tells you to do, like a to-do list."
        },
        {
          "headline":"Level up.",
          "description":"Earn lots of XP in order to level up. Play minigames, care/work tasks, and compete. Press the XP box to show how much more XP you need to level up to the next level. When you do, you will earn a gem."
        },
        {
          "headline":"Watch videos to earn free gems.",
          "description":"Go to the minigames tab. You will later unlock the Free Gems. Tap it and it will ask if you want to watch a video to earn a gem. Press okay. All you have to do is watch a commercial and you will earn a gem as the reward."
        },
        {
          "headline":"Buy gems with your credit card if you can afford them.",
          "description":"This may be the fastest way to get lots of gems."
        }
      ]
    },
    {
      "name":"Buying New Horses",
      "steps":[
        {
          "headline":"Earn lots of coins and gems in order to afford the horse.",
          "description":"It will take some time, but eventually you will get it."
        },
        {
          "headline":"Go to the minigame section.",
          "description":"Tap the option to buy a new horse."
        },
        {
          "headline":"Swipe to the side to see all the horses, and tap one horse that satisfies you.",
          "description":""
        },
        {
          "headline":"Tap on the side of the screen the box that says \"Buy for [number] gems/coins\".",
          "description":"Make sure you can afford it."
        },
        {
          "headline":"In the notice that asks you to confirm to buy that horse, press Okay.",
          "description":"You will get more tasks you can do in care/work tasks. Some tasks will explain that you need a certain amount of horses. Use your certain amount of horses to do these tasks."
        },
        {
          "headline":"To switch a horse from stable to paddock, on the side of the screen, tap the button with two horses and a curved arrow.",
          "description":"Press the horse you want to check on, and press Done. You will see your horse. Repeat this process to do this with other horses."
        }
      ]
    }
  ],
  "text":" Starting Off Your Account Expect to be introduced to the game by an electronic man that welcomes you to My Horse. Touch your horse to get its attention (as the man tells you to do). Do everything the man tells you to do. He will introduce you to different things you can do on My Horse. Change your nickname. Go to your profile by clicking the empty circle person image at the top left corner of the screen. Tap where the nickname box is and type in a new nickname. Do the same with your horse name, if you want a different name (the default name when you have just made an account is \"Beauty\"). Add a picture if you'd like.  Add/request friends if you'd like as well.  Doing Care\\/Work Tasks Earn enough coins, XP, and energy. You will need these to complete care tasks and work tasks. You can earn these things by playing mini-games (found in the journal the man shows you) when you start off. In the journal, tap the tab with the health and happiness picture or the one with coins in the other picture. The coins are the work tasks, allowing you to earn coins and XP. They cost energy. Care tasks are found via the other picture, and these give you health and happiness; they cost energy and coins. Choose which type of task you want to do. When you start your account off, the only ones available is stable maintenance and riding lessons. Choose which task you want to have your horse have. When you start your account off, the only tasks available will be the first options. Level up or earn gems in order to get new work tasks and care tasks. If you level up, you will automatically earn new tasks. If you have gems, you can buy the new tasks with them. Competitions Buy treats with gems to earn energy in order to do competitions. You can also wait to let your horse rest to get more energy. It's best if you let your horse recharge to 100 energy to save your gems. Go to the journal. Tap the tab that shows a picture of a medal on it. At first, the only series you can compete in is the UK series. Tap that one. Choose the first competition. One you finish more competitions, you will be able to move on to other competitions. Before competing with your horse, it requires training, which also takes up energy. Depending on how many stars you see over each trick, that shows how many times you need to train for that trick. You will need to complete the training half and half or in thirds to fill in one star. The first competition takes only one star. Press the black button when the horse gets exactly into the blue area, for best results. The excellent and good results are okay, but try not to get results in any of the other colors. Press the ready button when all the training is complete and compete to win some medals! You will also win coins and XP this way. Playing Minigames Go to the journal and tap the first tab. You will see some \"minigames\" (competitions and buying a new horse are not part of this); grooming, feeding, mucking out, and cleaning up the paddock. When you just started your account, the only one available is feeding. Tap a minigame. Use this guide to show you how to play each of the minigames:\n\nFeeding - Choose a recipe that you can afford to buy with your coins. If you look at the top, there will be more tabs with more recipes you can use. Pour in the correct ingredients until it reaches the red point. Drag the bucket to the side to fill in other ingredients. When the mixing picture appears, press it and mix the ingredients together. Mucking out - Drag dirty straw into the bucket nearly at the top left corner. Don't drag clean straw, or it will lower your score. Depending on how long you take, slowness will also lower your score. Swipe the block of new straw and spread it out for a nice bed for your horse. Grooming - Touch your dirty horse to remove dirty marks. A checkmark button will appear when you cleaned most of the horse. You can press it to finish, but if you want more coins and XP, clean the horse some more until the checkmark is filled green. Paddock cleanup - On the side of the screen, when there is a shovel, tap the horse's business. When you see a rake, tap the weeds. Depending on how long you take, the highest score is 6 health, 6 happiness, and 12 XP. Earning Gems Compete in competitions. Later in the game, another generated helper who appears just like the man but is a girl this time, rewards you with gems sometimes when you win first place in a competition. Complete goals that are set for you. Goals are unlocked later in the game where you do a certain event a certain amount of time. For example, \"Care task: Muck out 20x\". You will earn a gem when you finish everything it tells you to do, like a to-do list. Level up. Earn lots of XP in order to level up. Play minigames, care/work tasks, and compete. Press the XP box to show how much more XP you need to level up to the next level. When you do, you will earn a gem. Watch videos to earn free gems. Go to the minigames tab. You will later unlock the Free Gems. Tap it and it will ask if you want to watch a video to earn a gem. Press okay. All you have to do is watch a commercial and you will earn a gem as the reward. Buy gems with your credit card if you can afford them. This may be the fastest way to get lots of gems. Buying New Horses Earn lots of coins and gems in order to afford the horse. It will take some time, but eventually you will get it. Go to the minigame section. Tap the option to buy a new horse. Swipe to the side to see all the horses, and tap one horse that satisfies you.  Tap on the side of the screen the box that says \"Buy for [number] gems/coins\". Make sure you can afford it. In the notice that asks you to confirm to buy that horse, press Okay. You will get more tasks you can do in care/work tasks. Some tasks will explain that you need a certain amount of horses. Use your certain amount of horses to do these tasks. To switch a horse from stable to paddock, on the side of the screen, tap the button with two horses and a curved arrow. Press the horse you want to check on, and press Done. You will see your horse. Repeat this process to do this with other horses.",
  "tyn_model":[
    "gems",
    "horse",
    "horses",
    "coins",
    "journal",
    "straw",
    "feeding",
    "bucket",
    "energy",
    "treats",
    "shovel",
    "rake",
    "gem"
  ],
  "tyn_section":[

  ]
}