{
  "title":"How to Get Sprouts in Plants vs Zombies 2",
  "url":"https://www.wikihow.com/Get-Sprouts-in-Plants-vs-Zombies-2",
  "category_hierarchy":[
    "Hobbies and Crafts",
    "Games",
    "Video Games",
    "Multi Platform Games",
    "Plants vs. Zombies"
  ],
  "methods":[
    {
      "name":"Playing the Game",
      "steps":[
        {
          "headline":"Launch Plants vs Zombies 2.",
          "description":"Look for the game app on your device. Its name is PvZ 2 with the app icon of a zombie\u2019s face. Tap on it."
        },
        {
          "headline":"Select a World.",
          "description":"There are many Worlds within the game. Each World has its own theme, set of plants, and set of zombies. You can choose among Ancient Egypt, Pirate Seas, Wild West, Far Future, Dark Ages, Big Wave Beach, and Frostbite Caves, with many more to come. Swipe left and right on the screen to select the World you want to play, and tap on it."
        },
        {
          "headline":"Select a level.",
          "description":"Within each World are many levels. Each level can have a different set of zombies and goals. You can only play a level you\u2019ve already completed or the level right after the last one you\u2019ve completed. Tap on the button with the level number to start the game."
        },
        {
          "headline":"Select plants.",
          "description":"On the level where you can select your own plants, you will be presented with your inventory of plants. Tap on the ones you want to use for the game. Be sure you have a plant that will give you sun and plants that can attack and defend your base."
        },
        {
          "headline":"Tap on the \u201cLet\u2019s Rock!\u201d button to begin your game.",
          "description":"Start by planting the plant that will give you sun, and then strategize from there."
        },
        {
          "headline":"Collect sprouts.",
          "description":"Some zombies you defeat will drop sprouts. Sprouts are basically pots with a small plant inside. When you see one, tap on it to collect it."
        }
      ]
    },
    {
      "name":"Playing the Daily Event",
      "steps":[
        {
          "headline":"Launch Plants vs Zombies 2.",
          "description":"Look for the game app on your device. Its name is PvZ 2 with the app icon of a zombie\u2019s face. Tap on it."
        },
        {
          "headline":"Tap on the \u201cPlay Event\u201d button at the bottom of the screen to play it.",
          "description":"Daily Events are special and unique games not found on any of the Worlds or levels. These get refreshed every day. Once you completed a Daily Event, you can no longer play it again."
        },
        {
          "headline":"Complete the Event.",
          "description":"Meet the goals of the Daily Event and defeat the zombies. You won\u2019t get any reward if you aren\u2019t successful."
        },
        {
          "headline":"Whack open 3 party pi\u00f1atas.",
          "description":"When you complete the Daily Event, you will be given a screen containing 16 party pi\u00f1atas. Tap on three of these to uncover rewards. Rewards can range from a small amount of coins to 3,500 coins. They can also contain special plant costumes, gems, or sprouts."
        }
      ]
    },
    {
      "name":"Buying Sprouts",
      "steps":[
        {
          "headline":"Launch Plants vs Zombies 2.",
          "description":"Look for the game app on your device. Its name is PvZ 2 with the app icon of a zombie\u2019s face. Tap on it."
        },
        {
          "headline":"Tap on the shopping cart button on the top right corner of the screen.",
          "description":"You will see the PvZ 2 Store with all the items for sale under the different tabs."
        },
        {
          "headline":"Tap on the Sprouts tab to see all the sprout packages in the store.",
          "description":"There are five different sprout packages available, ranging from 3 sprouts at 20 gems to 50 sprouts at 150 gems. You cannot buy sprouts with coins or real money."
        },
        {
          "headline":"Buy a sprout package.",
          "description":"Tap on the price button for the sprout package you want to buy. You have to have enough gems to cover the purchase. The number of sprouts bought will be added to your total available sprouts. If you don\u2019t have enough gems, you can purchase more with real money."
        }
      ]
    }
  ],
  "text":" Playing the Game Launch Plants vs Zombies 2. Look for the game app on your device. Its name is PvZ 2 with the app icon of a zombie\u2019s face. Tap on it. Select a World. There are many Worlds within the game. Each World has its own theme, set of plants, and set of zombies. You can choose among Ancient Egypt, Pirate Seas, Wild West, Far Future, Dark Ages, Big Wave Beach, and Frostbite Caves, with many more to come. Swipe left and right on the screen to select the World you want to play, and tap on it. Select a level. Within each World are many levels. Each level can have a different set of zombies and goals. You can only play a level you\u2019ve already completed or the level right after the last one you\u2019ve completed. Tap on the button with the level number to start the game. Select plants. On the level where you can select your own plants, you will be presented with your inventory of plants. Tap on the ones you want to use for the game. Be sure you have a plant that will give you sun and plants that can attack and defend your base. Tap on the \u201cLet\u2019s Rock!\u201d button to begin your game. Start by planting the plant that will give you sun, and then strategize from there. Collect sprouts. Some zombies you defeat will drop sprouts. Sprouts are basically pots with a small plant inside. When you see one, tap on it to collect it. Playing the Daily Event Launch Plants vs Zombies 2. Look for the game app on your device. Its name is PvZ 2 with the app icon of a zombie\u2019s face. Tap on it. Tap on the \u201cPlay Event\u201d button at the bottom of the screen to play it. Daily Events are special and unique games not found on any of the Worlds or levels. These get refreshed every day. Once you completed a Daily Event, you can no longer play it again. Complete the Event. Meet the goals of the Daily Event and defeat the zombies. You won\u2019t get any reward if you aren\u2019t successful. Whack open 3 party pi\u00f1atas. When you complete the Daily Event, you will be given a screen containing 16 party pi\u00f1atas. Tap on three of these to uncover rewards. Rewards can range from a small amount of coins to 3,500 coins. They can also contain special plant costumes, gems, or sprouts. Buying Sprouts Launch Plants vs Zombies 2. Look for the game app on your device. Its name is PvZ 2 with the app icon of a zombie\u2019s face. Tap on it. Tap on the shopping cart button on the top right corner of the screen. You will see the PvZ 2 Store with all the items for sale under the different tabs. Tap on the Sprouts tab to see all the sprout packages in the store. There are five different sprout packages available, ranging from 3 sprouts at 20 gems to 50 sprouts at 150 gems. You cannot buy sprouts with coins or real money. Buy a sprout package. Tap on the price button for the sprout package you want to buy. You have to have enough gems to cover the purchase. The number of sprouts bought will be added to your total available sprouts. If you don\u2019t have enough gems, you can purchase more with real money.",
  "tyn_model":[
    "plants",
    "sprouts",
    "plants vs zombies 2",
    "gems",
    "sprout",
    "plant",
    "\u201d button",
    "pi\u00f1atas",
    "\u201clet",
    "\u201cplay",
    "zombies"
  ],
  "tyn_section":[

  ]
}