{
  "title":"How to Get Coins in Plants vs Zombies 2",
  "url":"https://www.wikihow.com/Get-Coins-in-Plants-vs-Zombies-2",
  "category_hierarchy":[
    "Hobbies and Crafts",
    "Games",
    "Video Games",
    "Multi Platform Games",
    "Plants vs. Zombies"
  ],
  "methods":[
    {
      "name":"Playing the Game",
      "steps":[
        {
          "headline":"Launch Plants vs Zombies 2.",
          "description":"Look for the game app on your device. Its name is PvZ 2 with the app icon of a zombie\u2019s face. Tap on it."
        },
        {
          "headline":"Select a World.",
          "description":"There are many Worlds within the game. Each World has its own theme, set of plants, and set of zombies. You can choose among Ancient Egypt, Pirate Seas, Wild West, Far Future, Dark Ages, Big Wave Beach, and Frostbite Caves, with many more to come. Swipe left and right on the screen to select the World you want to play, and tap on it."
        },
        {
          "headline":"Select a level.",
          "description":"Within each World are many levels. Each level can have a different set of zombies and goals. You can only play a level you\u2019ve already completed or the level right after the last one you\u2019ve completed. Tap on the button with the level number to start the game."
        },
        {
          "headline":"Select plants.",
          "description":"On the level where you can select your own plants, you will be presented with your inventory of plants. Tap on the ones you want to use for the game. Be sure you have a plant that will give you sun and plants that can attack and defend your base."
        },
        {
          "headline":"Tap on the \u201cLet\u2019s Rock!\u201d button to begin your game.",
          "description":"Start by planting the plant that will give you sun, and then strategize from there."
        },
        {
          "headline":"Collect coins.",
          "description":"Some zombies you defeat will give out coins in return. Watch for these coins during game play. When you see one, tap on it to collect it. The corresponding amount will be added to your coin bank. The coins can be in silver or gold. Silver coins are worth 10 coins and gold coins are worth 100 coins. On rarer occasions, you will see a zombie drop a blue diamond. Tap on it to collect it. Blue diamonds are worth 500 coins."
        },
        {
          "headline":"Preserve the lawnmowers.",
          "description":"Lawnmowers are you final defense against the zombie attacks. When you finish the game without using them, each lawnmower left will be changed to a silver coin, adding to your coin bank."
        },
        {
          "headline":"Defeat the zombies.",
          "description":"On levels you\u2019ve previously completed, and on Yeti levels, a bag of coins will be rewarded to you when you complete it. A bag of coins can be worth as much as 3,500 coins."
        }
      ]
    },
    {
      "name":"Growing Plants in the Zen Garden",
      "steps":[
        {
          "headline":"Launch Plants vs Zombies 2.",
          "description":"Look for the game app on your device. Its name is PvZ 2 with the app icon of a zombie\u2019s face. Tap on it."
        },
        {
          "headline":"Tap on the watering can on the menu.",
          "description":"This will bring you to the Zen Garden where you can grow plants equipped with plant food."
        },
        {
          "headline":"Plant.",
          "description":"If you have an empty pot, tap on it to plant a plant. A random plant will be placed there. The plant will start as a baby or mini version of the plant."
        },
        {
          "headline":"Water the plants.",
          "description":"Whenever you see a water droplet beside the plants, it means it\u2019s time to water them. Tap on them to bring out the watering can."
        },
        {
          "headline":"Let the plants grow.",
          "description":"The plants in the Zen Garden grow. Each time they grow, they give out coins as a reward for taking care of them. The plants\u2019 growth is time-based, meaning you have to wait for the countdown to finish before they grow and before you can use them."
        },
        {
          "headline":"Collect the coins when the plants grow.",
          "description":"Once a plant reaches its next growth point, it will release some coins for you to collect. Tap on the coins to add them to your coin bank. When a plant reaches its maturity and it\u2019s now ready for use, it will release some gold coins."
        }
      ]
    },
    {
      "name":"Playing the Daily Event",
      "steps":[
        {
          "headline":"Launch Plants vs Zombies 2.",
          "description":"Look for the game app on your device. Its name is PvZ 2 with the app icon of a zombie\u2019s face. Tap on it."
        },
        {
          "headline":"Tap on the \u201cPlay Event\u201d button at the bottom of the screen to play it.",
          "description":"Daily Events are special and unique games not found on any of the Worlds or Levels. These get refreshed every day. Once you completed a Daily Event, you can no longer play it again."
        },
        {
          "headline":"Complete the Event.",
          "description":"Meet the goals of the Daily Event and defeat the zombies. You won\u2019t get any reward if you aren\u2019t successful."
        },
        {
          "headline":"Whack open 3 party pi\u00f1atas.",
          "description":"When you complete the Daily Event, you will be given a screen containing 16 party pi\u00f1atas. Tap on three of these to uncover rewards. Rewards can range from a small amount of coins to 3,500 coins. They can also contain special plant costumes and gems."
        }
      ]
    },
    {
      "name":"Buying Coins",
      "steps":[
        {
          "headline":"Launch Plants vs Zombies 2.",
          "description":"Look for the game app on your device. Its name is PvZ 2 with the app icon of a zombie\u2019s face. Tap on it."
        },
        {
          "headline":"Tap on the shopping cart button on the top right corner of the screen.",
          "description":"You will see the PvZ 2 Store with all the items for sale under the different tabs."
        },
        {
          "headline":"Tap on the Coins tab to see all the coin packages in the store.",
          "description":"There are six different coin packages available, ranging from 5,000 coins at $2.99 to 450,000 coins at $99.99."
        },
        {
          "headline":"Buy a coin package.",
          "description":"Do this by tapping on the price button for the coin package you want to buy."
        },
        {
          "headline":"Pay for your purchase.",
          "description":"Follow the on-screen instructions to complete your purchase. If you\u2019re using an iOS device, the iTunes Store will process your payment. If you\u2019re using an Android device, the Google Checkout will do that. Once the purchase is completed, you will receive your coin package."
        }
      ]
    }
  ],
  "text":" Playing the Game Launch Plants vs Zombies 2. Look for the game app on your device. Its name is PvZ 2 with the app icon of a zombie\u2019s face. Tap on it. Select a World. There are many Worlds within the game. Each World has its own theme, set of plants, and set of zombies. You can choose among Ancient Egypt, Pirate Seas, Wild West, Far Future, Dark Ages, Big Wave Beach, and Frostbite Caves, with many more to come. Swipe left and right on the screen to select the World you want to play, and tap on it. Select a level. Within each World are many levels. Each level can have a different set of zombies and goals. You can only play a level you\u2019ve already completed or the level right after the last one you\u2019ve completed. Tap on the button with the level number to start the game. Select plants. On the level where you can select your own plants, you will be presented with your inventory of plants. Tap on the ones you want to use for the game. Be sure you have a plant that will give you sun and plants that can attack and defend your base. Tap on the \u201cLet\u2019s Rock!\u201d button to begin your game. Start by planting the plant that will give you sun, and then strategize from there. Collect coins. Some zombies you defeat will give out coins in return. Watch for these coins during game play. When you see one, tap on it to collect it. The corresponding amount will be added to your coin bank. The coins can be in silver or gold. Silver coins are worth 10 coins and gold coins are worth 100 coins. On rarer occasions, you will see a zombie drop a blue diamond. Tap on it to collect it. Blue diamonds are worth 500 coins. Preserve the lawnmowers. Lawnmowers are you final defense against the zombie attacks. When you finish the game without using them, each lawnmower left will be changed to a silver coin, adding to your coin bank. Defeat the zombies. On levels you\u2019ve previously completed, and on Yeti levels, a bag of coins will be rewarded to you when you complete it. A bag of coins can be worth as much as 3,500 coins. Growing Plants in the Zen Garden Launch Plants vs Zombies 2. Look for the game app on your device. Its name is PvZ 2 with the app icon of a zombie\u2019s face. Tap on it. Tap on the watering can on the menu. This will bring you to the Zen Garden where you can grow plants equipped with plant food. Plant. If you have an empty pot, tap on it to plant a plant. A random plant will be placed there. The plant will start as a baby or mini version of the plant. Water the plants. Whenever you see a water droplet beside the plants, it means it\u2019s time to water them. Tap on them to bring out the watering can. Let the plants grow. The plants in the Zen Garden grow. Each time they grow, they give out coins as a reward for taking care of them. The plants\u2019 growth is time-based, meaning you have to wait for the countdown to finish before they grow and before you can use them. Collect the coins when the plants grow. Once a plant reaches its next growth point, it will release some coins for you to collect. Tap on the coins to add them to your coin bank. When a plant reaches its maturity and it\u2019s now ready for use, it will release some gold coins. Playing the Daily Event Launch Plants vs Zombies 2. Look for the game app on your device. Its name is PvZ 2 with the app icon of a zombie\u2019s face. Tap on it. Tap on the \u201cPlay Event\u201d button at the bottom of the screen to play it. Daily Events are special and unique games not found on any of the Worlds or Levels. These get refreshed every day. Once you completed a Daily Event, you can no longer play it again. Complete the Event. Meet the goals of the Daily Event and defeat the zombies. You won\u2019t get any reward if you aren\u2019t successful. Whack open 3 party pi\u00f1atas. When you complete the Daily Event, you will be given a screen containing 16 party pi\u00f1atas. Tap on three of these to uncover rewards. Rewards can range from a small amount of coins to 3,500 coins. They can also contain special plant costumes and gems. Buying Coins Launch Plants vs Zombies 2. Look for the game app on your device. Its name is PvZ 2 with the app icon of a zombie\u2019s face. Tap on it. Tap on the shopping cart button on the top right corner of the screen. You will see the PvZ 2 Store with all the items for sale under the different tabs. Tap on the Coins tab to see all the coin packages in the store. There are six different coin packages available, ranging from 5,000 coins at $2.99 to 450,000 coins at $99.99. Buy a coin package. Do this by tapping on the price button for the coin package you want to buy. Pay for your purchase. Follow the on-screen instructions to complete your purchase. If you\u2019re using an iOS device, the iTunes Store will process your payment. If you\u2019re using an Android device, the Google Checkout will do that. Once the purchase is completed, you will receive your coin package.",
  "tyn_model":[
    "plants",
    "plants vs zombies 2",
    "water",
    "\u201d button",
    "lawnmowers",
    "watering can",
    "pi\u00f1atas",
    "plant",
    "\u201clet",
    "plant food",
    "pot",
    "\u2019 growth",
    "coins",
    "\u201cplay",
    "zombies",
    "itunes store"
  ],
  "tyn_section":[

  ]
}