{
  "title":"How to Get a Hacked ROBLOX Account Back",
  "url":"https://www.wikihow.com/Get-a-Hacked-ROBLOX-Account-Back",
  "category_hierarchy":[
    "Hobbies and Crafts",
    "Games",
    "Video Games",
    "PC Games",
    "Online Games",
    "Roblox"
  ],
  "parts":[
    {
      "name":"Restoring the Password",
      "steps":[
        {
          "headline":"Try logging in with your password.",
          "description":"If your password isn't being accepted, make sure you're using proper capitalization when necessary (and that the \u21ec Caps Lock key is not on). Make sure to do a complete malware scan and remove all potential threats from your computer. Accounts are often hacked due after downloading bad software or browser extensions. If you're not sure how to fully scan for and remove malware, check out How to Remove Malware."
        },
        {
          "headline":"Go to https://www.roblox.com/login/forgot-password-or-username in a web browser.",
          "description":"If you can't sign into your account, you can try resetting your password on the ROBLOX website."
        },
        {
          "headline":"Enter your email address and click Submit.",
          "description":"If you provided your email address to ROBLOX (and the hacker hasn't changed it), you should be able to reset it on the website. If you provided your mobile number to ROBLOX, you can use it to recover your password too. Click Use phone number to reset password below the \"Submit\" button, enter the number, and then click Submit. You'll receive a 6-digit code via text message."
        },
        {
          "headline":"Open the email from ROBLOX and click Reset Password.",
          "description":"This opens the password reset page in your browser. If you're using a phone number to reset your account, enter the 6-digit code from the text message into the \"Verify Phone\" window and click Verify. It may take several minutes for the email to arrive. Check your Spam or Junk folder if you still haven't received the email after about 10 minutes."
        },
        {
          "headline":"Create a new password.",
          "description":"If you were able to reach the password reset page, enter a new password into both blanks and click Submit. You can then sign into ROBLOX with your new account information."
        },
        {
          "headline":"Contact ROBLOX support if you can't reset the password.",
          "description":"You can do so by filling out the form at https://www.roblox.com/support. Once ROBLOX support contacts you via email, you'll need to be able to prove the account belongs to you. Here are some tips for that process:\nWhen filling out the form, use the email address you used to sign up for ROBLOX. Even if the hacker changed the email address on the account, ROBLOX can still see your original signup info. If you ever bought anything in ROBLOX, be prepared to answer questions about the amounts of purchase, credit card info, and PayPal account."
        }
      ]
    },
    {
      "name":"Setting Up 2 Step Verification",
      "steps":[
        {
          "headline":"Go to https://www.roblox.com/my/account#!/security in a web browser.",
          "description":"Once you regain access to your hacked account, you should turn on 2-Step Verification to help keep your account secure in the future. When 2 Step Verification is enabled, ROBLOX will automatically send an email containing a verification code to the email address on file. You won't be able to completely log in until you enter that code. This keeps your account secure because anyone who signs in with your ROBLOX account must also have access to your email account."
        },
        {
          "headline":"Verify your email address.",
          "description":"You can only use a verified email address for 2 Step Verification. Here's how to verify yours:\nEnter your email address into the blank (if you haven't already) and click Verify button. Open the email from ROBLOX (it should come from email_validate@roblox.com) and follow the on-screen instructions. If the email doesn't arrive in a few minutes, check the Spam or Junk folder. Follow the instructions in the email to verify."
        },
        {
          "headline":"Slide the \"2 Step Verification\" switch to the On (green) position.",
          "description":"A confirmation message will appear."
        },
        {
          "headline":"Click OK to confirm.",
          "description":"2 Step Verification is now enabled for your account. When you sign into ROBLOX in the future, you'll receive an email that contains a code. You'll have to enter that code to sign in."
        }
      ]
    }
  ],
  "text":" Restoring the Password Try logging in with your password. If your password isn't being accepted, make sure you're using proper capitalization when necessary (and that the \u21ec Caps Lock key is not on). Make sure to do a complete malware scan and remove all potential threats from your computer. Accounts are often hacked due after downloading bad software or browser extensions. If you're not sure how to fully scan for and remove malware, check out How to Remove Malware. Go to https://www.roblox.com/login/forgot-password-or-username in a web browser. If you can't sign into your account, you can try resetting your password on the ROBLOX website. Enter your email address and click Submit. If you provided your email address to ROBLOX (and the hacker hasn't changed it), you should be able to reset it on the website. If you provided your mobile number to ROBLOX, you can use it to recover your password too. Click Use phone number to reset password below the \"Submit\" button, enter the number, and then click Submit. You'll receive a 6-digit code via text message. Open the email from ROBLOX and click Reset Password. This opens the password reset page in your browser. If you're using a phone number to reset your account, enter the 6-digit code from the text message into the \"Verify Phone\" window and click Verify. It may take several minutes for the email to arrive. Check your Spam or Junk folder if you still haven't received the email after about 10 minutes. Create a new password. If you were able to reach the password reset page, enter a new password into both blanks and click Submit. You can then sign into ROBLOX with your new account information. Contact ROBLOX support if you can't reset the password. You can do so by filling out the form at https://www.roblox.com/support. Once ROBLOX support contacts you via email, you'll need to be able to prove the account belongs to you. Here are some tips for that process:\nWhen filling out the form, use the email address you used to sign up for ROBLOX. Even if the hacker changed the email address on the account, ROBLOX can still see your original signup info. If you ever bought anything in ROBLOX, be prepared to answer questions about the amounts of purchase, credit card info, and PayPal account. Setting Up 2 Step Verification Go to https://www.roblox.com/my/account#!/security in a web browser. Once you regain access to your hacked account, you should turn on 2-Step Verification to help keep your account secure in the future. When 2 Step Verification is enabled, ROBLOX will automatically send an email containing a verification code to the email address on file. You won't be able to completely log in until you enter that code. This keeps your account secure because anyone who signs in with your ROBLOX account must also have access to your email account. Verify your email address. You can only use a verified email address for 2 Step Verification. Here's how to verify yours:\nEnter your email address into the blank (if you haven't already) and click Verify button. Open the email from ROBLOX (it should come from email_validate@roblox.com) and follow the on-screen instructions. If the email doesn't arrive in a few minutes, check the Spam or Junk folder. Follow the instructions in the email to verify. Slide the \"2 Step Verification\" switch to the On (green) position. A confirmation message will appear. Click OK to confirm. 2 Step Verification is now enabled for your account. When you sign into ROBLOX in the future, you'll receive an email that contains a code. You'll have to enter that code to sign in.",
  "tyn_model":[
    "\u21ec caps",
    "2-step verification",
    "roblox account",
    "2 step verification"
  ],
  "tyn_section":[

  ]
}