{
  "title":"How to Sell a Part in Need for Speed",
  "url":"https://www.wikihow.com/Sell-a-Part-in-Need-for-Speed",
  "category_hierarchy":[
    "Hobbies and Crafts",
    "Games",
    "Video Games",
    "Multi Platform Games",
    "Need for Speed"
  ],
  "methods":[
    {
      "name":"Selling Parts in Need for Speed: World (PC)",
      "steps":[
        {
          "headline":"Launch the game and log in.",
          "description":"You can launch the game from the desktop or Start menu. Once launched, log into your account. A progress bar will then be displayed as the game tries to download any required updates from the Internet."
        },
        {
          "headline":"Open the NFS World.",
          "description":"As soon as all the updates are downloaded, the \u201cPlay\u201d button on the dialogue box will activate. Click it to open NFS World. When the game has finished loading, press \u201cEnter\u201d or any other key to start. Your NFSW profile details will be displayed."
        },
        {
          "headline":"Click \u201cEnter World\u201d to enter the NFS World in Free Roam mode.",
          "description":"Free Roam is a mode in the game (and most other modern NFS titles) that allows you to tour the city for familiarization or to find races you can engage in."
        },
        {
          "headline":"Hit \u201cH\u201d on your keyboard once you are in Free Roam mode.",
          "description":"This will take you to your Safe House. A Safe House on NFSW is a facility where you can buy new cars and manage them."
        },
        {
          "headline":"Open the AfterMarket Shop.",
          "description":"On the Safe House Menu, click \u201cCustomization\u201d and then select \u201cAfterMarket Shop.\u201d This will open a page where you can purchase or sell parts for or from your car. There are two small windows on the AfterMarket Shop page that allow you to view purchasable items and items that are already installed on the car. The window labelled \u201cInventory\u201d allows you to view and sell parts already on your car while the one marked \u201cStore\u201d allows you to purchase new parts. Click the round button that links the two windows to toggle between them."
        },
        {
          "headline":"View the categories of body parts you can sell.",
          "description":"Activate the Inventory window by clicking the round button and then clicking the downward-facing arrow on it to view the categories of body parts that are already installed on the vehicle."
        },
        {
          "headline":"Select a part to sell from the category.",
          "description":"For instance, to sell a Level 2 Lowering Kit, select \u201cLowering Kit\u201d from the categories. This will display all lowering kits available on the car."
        },
        {
          "headline":"Sell the part.",
          "description":"Drag the part to sell onto the Sell Parts tab. The Sell Parts tab is found at the bottom right of the Aftermarket page. A confirmation dialog box will appear, asking you to confirm that you want to sell the part. Click \u201cYes.\u201d The part will be removed and your cash balance incremented with the value of the part. Press \u201cEscape\u201d to exit to the Customization menu and \u201cEscape\u201d again to return to Free Roam."
        }
      ]
    },
    {
      "name":"Selling Parts in Need for Speed: Shift (PC)",
      "steps":[
        {
          "headline":"Launch the game from the Start Menu.",
          "description":"Start Button >> Games >> Need for Speed Shift. You can also launch it from the desktop by double-clicking its icon, if you have it there. When the game finishes loading, the player profile selection page will be displayed."
        },
        {
          "headline":"Press \u201cEnter\u201d to select the currently highlighted player profile.",
          "description":"You can also use the Up and Down Arrow keys to scroll through the available player profiles and select a different one. As soon as the profile loads, the game will display the Main Menu."
        },
        {
          "headline":"Open the Upgrades menu.",
          "description":"Select \u201cCareer\u201d by pressing Enter then use the Up and Down Arrow keys to scroll to \u201cUpgrades.\u201d\nIn the Upgrades section, you can buy or sell both visual and performance upgrades from or for your car(s)."
        },
        {
          "headline":"Select the level of the part to sell.",
          "description":"Use the Left and Right Arrow keys to  select  the level of parts you want to install or sell. The options are Stage 1, Stage 2, Stage 3, and so on. For instance, to sell a Brake Stage 1 upgrade: Scroll to Stage 1 and press Enter to open the Stage 1 upgrades menu."
        },
        {
          "headline":"Select the part to sell.",
          "description":"From the Stage menu, scroll downwards to select the part you want to sell. A confirmation dialog box will appear asking if you wish to sell the part will appear. For example, to sell a Brake Stage 1 upgrade, scroll to the part and press Enter to select it."
        },
        {
          "headline":"Select \u201cYes\u201d to confirm.",
          "description":"The part will be removed from your car and your cash balance incremented with the value of the part. Press \u201cEscape\u201d repeatedly to exit from the Upgrades return to the game\u2019s Main Menu."
        }
      ]
    }
  ],
  "text":" Selling Parts in Need for Speed: World (PC) Launch the game and log in. You can launch the game from the desktop or Start menu. Once launched, log into your account. A progress bar will then be displayed as the game tries to download any required updates from the Internet. Open the NFS World. As soon as all the updates are downloaded, the \u201cPlay\u201d button on the dialogue box will activate. Click it to open NFS World. When the game has finished loading, press \u201cEnter\u201d or any other key to start. Your NFSW profile details will be displayed. Click \u201cEnter World\u201d to enter the NFS World in Free Roam mode. Free Roam is a mode in the game (and most other modern NFS titles) that allows you to tour the city for familiarization or to find races you can engage in. Hit \u201cH\u201d on your keyboard once you are in Free Roam mode. This will take you to your Safe House. A Safe House on NFSW is a facility where you can buy new cars and manage them. Open the AfterMarket Shop. On the Safe House Menu, click \u201cCustomization\u201d and then select \u201cAfterMarket Shop.\u201d This will open a page where you can purchase or sell parts for or from your car. There are two small windows on the AfterMarket Shop page that allow you to view purchasable items and items that are already installed on the car. The window labelled \u201cInventory\u201d allows you to view and sell parts already on your car while the one marked \u201cStore\u201d allows you to purchase new parts. Click the round button that links the two windows to toggle between them. View the categories of body parts you can sell. Activate the Inventory window by clicking the round button and then clicking the downward-facing arrow on it to view the categories of body parts that are already installed on the vehicle. Select a part to sell from the category. For instance, to sell a Level 2 Lowering Kit, select \u201cLowering Kit\u201d from the categories. This will display all lowering kits available on the car. Sell the part. Drag the part to sell onto the Sell Parts tab. The Sell Parts tab is found at the bottom right of the Aftermarket page. A confirmation dialog box will appear, asking you to confirm that you want to sell the part. Click \u201cYes.\u201d The part will be removed and your cash balance incremented with the value of the part. Press \u201cEscape\u201d to exit to the Customization menu and \u201cEscape\u201d again to return to Free Roam. Selling Parts in Need for Speed: Shift (PC) Launch the game from the Start Menu. Start Button >> Games >> Need for Speed Shift. You can also launch it from the desktop by double-clicking its icon, if you have it there. When the game finishes loading, the player profile selection page will be displayed. Press \u201cEnter\u201d to select the currently highlighted player profile. You can also use the Up and Down Arrow keys to scroll through the available player profiles and select a different one. As soon as the profile loads, the game will display the Main Menu. Open the Upgrades menu. Select \u201cCareer\u201d by pressing Enter then use the Up and Down Arrow keys to scroll to \u201cUpgrades.\u201d\nIn the Upgrades section, you can buy or sell both visual and performance upgrades from or for your car(s). Select the level of the part to sell. Use the Left and Right Arrow keys to  select  the level of parts you want to install or sell. The options are Stage 1, Stage 2, Stage 3, and so on. For instance, to sell a Brake Stage 1 upgrade: Scroll to Stage 1 and press Enter to open the Stage 1 upgrades menu. Select the part to sell. From the Stage menu, scroll downwards to select the part you want to sell. A confirmation dialog box will appear asking if you wish to sell the part will appear. For example, to sell a Brake Stage 1 upgrade, scroll to the part and press Enter to select it. Select \u201cYes\u201d to confirm. The part will be removed from your car and your cash balance incremented with the value of the part. Press \u201cEscape\u201d repeatedly to exit from the Upgrades return to the game\u2019s Main Menu.",
  "tyn_model":[
    "\u201d to",
    "\u201center",
    "\u201cescape",
    "nfs world",
    "\u201d allows",
    "\u201cyes",
    "\u201cplay",
    "\u201d button",
    "\u201d or",
    "nfs titles",
    "\u201ch",
    "\u201d on",
    "\u201ccustomization",
    "\u201d and",
    "\u201caftermarket",
    "\u201d this",
    "\u201cinventory",
    "\u201cstore",
    "\u201clowering",
    "\u201d from",
    "\u201d the",
    "\u201d again",
    "\u201ccareer",
    "\u201d by",
    "\u201cupgrades",
    "\u201d\n",
    "\u201d repeatedly"
  ],
  "tyn_section":[

  ]
}