{
  "title":"How to Pretend to Drink Alcohol",
  "url":"https://www.wikihow.com/Pretend-to-Drink-Alcohol",
  "category_hierarchy":[
    "Food and Entertaining",
    "Drinks",
    "Mocktails"
  ],
  "methods":[
    {
      "name":"Getting Your Drink to Look Like Alcohol",
      "steps":[
        {
          "headline":"Order a mocktail.",
          "description":"If you\u2019re at a bar, order a mocktail by simply asking for any special alcoholic drink to be made \u201cvirgin.\u201d For example, ask for a \u201cvirgin pina colada\u201d or a \u201cvirgin margarita.\u201d Or, simply ask for a drink like the Shirley Temple, which is a non-alcoholic cocktail made with citrus soda and grenadine."
        },
        {
          "headline":"Get a soda instead of a mixed drink.",
          "description":"Order any kind of soda at the bar, which will look the same as a mixed alcohol drink. Order Coke to look like a rum and Coke, or get Sprite or soda water to look like a gin and tonic or vodka tonic, for example. Ask for a straw, too, and a lemon or lime wedge if it\u2019s a clear soda. You may also want to ask for it in a short glass."
        },
        {
          "headline":"Order a ginger ale to look like beer.",
          "description":"Ask for a ginger ale, without ice, in a pint glass to make it appear like a draft beer."
        },
        {
          "headline":"Order a non-alcoholic beer.",
          "description":"Ask for a non-alcoholic beer at the bar, and have them pour it into a glass so people don\u2019t see the label."
        },
        {
          "headline":"Drink grape juice to look like wine.",
          "description":"Order or pour your own apple or white grape juice into a wine glass to look like white wine, regular grape juice to look like red wine, or sparkling white grape or pear juice to look like champagne."
        },
        {
          "headline":"Drink soda or juice in a bottle.",
          "description":"If you\u2019re at friend\u2019s house or house party, bring along a regular soda, juice, or tea bottle and drink from that, explaining to anyone who asks that it\u2019s mixed with alcohol."
        }
      ]
    },
    {
      "name":"Getting Rid of Alcoholic Drinks",
      "steps":[
        {
          "headline":"Pour out a beer and fill it with water.",
          "description":"Take a beer bottle or can with you to a restroom and dump the contents down the sink or toilet. Then refill it with water from the tap and drink that instead. No one will be able to see the difference through the brown bottle or metal can. Be sure to rinse the bottle or can out at least once before you fill it with the water you intend to drink, to get rid of any residual alcohol in the bottle or can."
        },
        {
          "headline":"Slowly empty a drink.",
          "description":"If you have an alcoholic drink, hold onto it and, very occasionally, find opportunities to get rid of a small amount at a time. Pour some into the sink in the bathroom, a trash can nearby, or someone else\u2019s finished drink cup. Don\u2019t get rid of too much at a time, or leave too often to empty it. Put your mouth to the drink occasionally without actually drinking any so it doesn\u2019t look suspicious that your drink is disappearing on its own. Tell a friend (or several), \u201cMmm, this is good, try this!\u201d and have them take a sip so your drink disappears faster."
        },
        {
          "headline":"Spit alcohol into another bottle.",
          "description":"If you have a drink with alcohol, keep a water, soda, or tea bottle nearby. Take a sip of the alcoholic drink, but hold it in your mouth without swallowing. Keep it there for at least 30 seconds, then pretend to drink from the other bottle, instead backwashing the alcohol into it at the end. Explain that you\u2019re just trying to hydrate and avoid a hangover, if anyone asks."
        },
        {
          "headline":"Fake taking a shot.",
          "description":"If you\u2019re offered a shot of alcohol, pour it out in a trash can, plant, or empty cup when no one is looking or while others are doing their shots. Hold your hand around the shot glass to disguise that there\u2019s nothing in it, then pretend to take the shot. If you can\u2019t get away with pouring the shot out, take it but don\u2019t swallow it. Reach for a soda bottle (preferably your own personal one) and pretend to drink from it as a chaser, backwashing the alcohol from your mouth instead."
        }
      ]
    }
  ],
  "text":" Getting Your Drink to Look Like Alcohol Order a mocktail. If you\u2019re at a bar, order a mocktail by simply asking for any special alcoholic drink to be made \u201cvirgin.\u201d For example, ask for a \u201cvirgin pina colada\u201d or a \u201cvirgin margarita.\u201d Or, simply ask for a drink like the Shirley Temple, which is a non-alcoholic cocktail made with citrus soda and grenadine. Get a soda instead of a mixed drink. Order any kind of soda at the bar, which will look the same as a mixed alcohol drink. Order Coke to look like a rum and Coke, or get Sprite or soda water to look like a gin and tonic or vodka tonic, for example. Ask for a straw, too, and a lemon or lime wedge if it\u2019s a clear soda. You may also want to ask for it in a short glass. Order a ginger ale to look like beer. Ask for a ginger ale, without ice, in a pint glass to make it appear like a draft beer. Order a non-alcoholic beer. Ask for a non-alcoholic beer at the bar, and have them pour it into a glass so people don\u2019t see the label. Drink grape juice to look like wine. Order or pour your own apple or white grape juice into a wine glass to look like white wine, regular grape juice to look like red wine, or sparkling white grape or pear juice to look like champagne. Drink soda or juice in a bottle. If you\u2019re at friend\u2019s house or house party, bring along a regular soda, juice, or tea bottle and drink from that, explaining to anyone who asks that it\u2019s mixed with alcohol. Getting Rid of Alcoholic Drinks Pour out a beer and fill it with water. Take a beer bottle or can with you to a restroom and dump the contents down the sink or toilet. Then refill it with water from the tap and drink that instead. No one will be able to see the difference through the brown bottle or metal can. Be sure to rinse the bottle or can out at least once before you fill it with the water you intend to drink, to get rid of any residual alcohol in the bottle or can. Slowly empty a drink. If you have an alcoholic drink, hold onto it and, very occasionally, find opportunities to get rid of a small amount at a time. Pour some into the sink in the bathroom, a trash can nearby, or someone else\u2019s finished drink cup. Don\u2019t get rid of too much at a time, or leave too often to empty it. Put your mouth to the drink occasionally without actually drinking any so it doesn\u2019t look suspicious that your drink is disappearing on its own. Tell a friend (or several), \u201cMmm, this is good, try this!\u201d and have them take a sip so your drink disappears faster. Spit alcohol into another bottle. If you have a drink with alcohol, keep a water, soda, or tea bottle nearby. Take a sip of the alcoholic drink, but hold it in your mouth without swallowing. Keep it there for at least 30 seconds, then pretend to drink from the other bottle, instead backwashing the alcohol into it at the end. Explain that you\u2019re just trying to hydrate and avoid a hangover, if anyone asks. Fake taking a shot. If you\u2019re offered a shot of alcohol, pour it out in a trash can, plant, or empty cup when no one is looking or while others are doing their shots. Hold your hand around the shot glass to disguise that there\u2019s nothing in it, then pretend to take the shot. If you can\u2019t get away with pouring the shot out, take it but don\u2019t swallow it. Reach for a soda bottle (preferably your own personal one) and pretend to drink from it as a chaser, backwashing the alcohol from your mouth instead.",
  "tyn_model":[
    "alcohol",
    "\u201cvirgin",
    "water",
    "\u201d or",
    "soda",
    "ginger ale",
    "beer",
    "grape juice",
    "\u201d for",
    "pina colada",
    "margarita",
    "shirley temple",
    "citrus soda",
    "grenadine",
    "coke",
    "sprite",
    "soda water",
    "straw",
    "lemon",
    "pint glass",
    "glass",
    "wine glass",
    "sparkling white grape",
    "beer bottle",
    "\u201cmmm",
    "\u201d and",
    "shot glass",
    "soda bottle"
  ],
  "tyn_section":[

  ]
}