{
  "title":"How to Sign Documents with Hightail",
  "url":"https://www.wikihow.com/Sign-Documents-with-Hightail",
  "category_hierarchy":[
    "Hobbies and Crafts",
    "Drawing",
    "Drawing Text and Lettering"
  ],
  "parts":[
    {
      "name":"Loading the File to Sign",
      "steps":[
        {
          "headline":"Log into Hightail.",
          "description":"Using your computer\u2019s web browser, go to Hightail. Click the Log In link on the header of the page to access the login page. Enter your username and password in the fields that will appear, then click the \u201cLog In\u201d button to continue. Upon logging in, you will be brought to your dashboard, an overview of all your recent file activities."
        },
        {
          "headline":"Click the Signature menu from the header.",
          "description":"It has a signature icon with it. You will brought to the Sign a File page."
        },
        {
          "headline":"Choose the file you want to sign.",
          "description":"You can upload a file from your computer or choose one from your Hightail folders. Hightail supports signing of PDF, Word, Excel, PowerPoint, and Rich Text files. Selecting a file from My Desktop\u2014Click on the \u201cMy Desktop\u201d button and select the file from your computer. The file will be uploaded to Hightail and then loaded on your screen. Selecting a file from My Hightail Folders\u2014Click on the \u201cMy Hightail Folders\u201d button and select the file from one of your Hightail folders. The file will be loaded on your screen."
        }
      ]
    },
    {
      "name":"Signing the File",
      "steps":[
        {
          "headline":"View the file.",
          "description":"The file will be loaded in a sub-window on Hightail\u2019s web page. Check to see if this is the correct file."
        },
        {
          "headline":"Set the location for the signature.",
          "description":"Click on the document where you want to place your signature."
        },
        {
          "headline":"Add your signature.",
          "description":"A small window will appear where you can draw or type your signature. You have two options on putting your signature on the document. Drawing with your mouse\u2014Click on the \u201cDraw with mouse\u201d button to draw your signature using your mouse. Your digital signature will look almost like your own writing. Go to the box for the signature and draw your signature. The box will be enlarged so you can draw easily. Typing your signature\u2014Click on the \u201cType signature\u201d button to type your signature instead. A small text box will appear where you can type your name. Hightail will transform your typed text into a cursive, signature format."
        },
        {
          "headline":"Finalize the signature\u2019s location.",
          "description":"Click on the \u201cAdd\u201d button and your signature will be pasted on the document. Hover over it and drag it to the exact location where you want it. You can also drag the signature box to enlarge or minimize it."
        },
        {
          "headline":"Click the \u201cDone\u201d button.",
          "description":"This will affix your signature onto the document and save the changes."
        },
        {
          "headline":"Send the document or save it locally.",
          "description":"Once the document has been saved, you will be asked what you want to do with it. Click on the \u201cSend it\u201d button to directly email the signed document. You can also save the file instead and send it later. Click on the \u201cSave it to My Folders\u201d button and identify where to put the signed file inside your Hightail folders. You can go back to that folder later when you need the signed document."
        }
      ]
    }
  ],
  "text":" Loading the File to Sign Log into Hightail. Using your computer\u2019s web browser, go to Hightail. Click the Log In link on the header of the page to access the login page. Enter your username and password in the fields that will appear, then click the \u201cLog In\u201d button to continue. Upon logging in, you will be brought to your dashboard, an overview of all your recent file activities. Click the Signature menu from the header. It has a signature icon with it. You will brought to the Sign a File page. Choose the file you want to sign. You can upload a file from your computer or choose one from your Hightail folders. Hightail supports signing of PDF, Word, Excel, PowerPoint, and Rich Text files. Selecting a file from My Desktop\u2014Click on the \u201cMy Desktop\u201d button and select the file from your computer. The file will be uploaded to Hightail and then loaded on your screen. Selecting a file from My Hightail Folders\u2014Click on the \u201cMy Hightail Folders\u201d button and select the file from one of your Hightail folders. The file will be loaded on your screen. Signing the File View the file. The file will be loaded in a sub-window on Hightail\u2019s web page. Check to see if this is the correct file. Set the location for the signature. Click on the document where you want to place your signature. Add your signature. A small window will appear where you can draw or type your signature. You have two options on putting your signature on the document. Drawing with your mouse\u2014Click on the \u201cDraw with mouse\u201d button to draw your signature using your mouse. Your digital signature will look almost like your own writing. Go to the box for the signature and draw your signature. The box will be enlarged so you can draw easily. Typing your signature\u2014Click on the \u201cType signature\u201d button to type your signature instead. A small text box will appear where you can type your name. Hightail will transform your typed text into a cursive, signature format. Finalize the signature\u2019s location. Click on the \u201cAdd\u201d button and your signature will be pasted on the document. Hover over it and drag it to the exact location where you want it. You can also drag the signature box to enlarge or minimize it. Click the \u201cDone\u201d button. This will affix your signature onto the document and save the changes. Send the document or save it locally. Once the document has been saved, you will be asked what you want to do with it. Click on the \u201cSend it\u201d button to directly email the signed document. You can also save the file instead and send it later. Click on the \u201cSave it to My Folders\u201d button and identify where to put the signed file inside your Hightail folders. You can go back to that folder later when you need the signed document.",
  "tyn_model":[
    "\u201d button",
    "\u2014click",
    "\u201cmy",
    "\u201clog",
    "\u201cdraw",
    "\u201ctype",
    "\u201cadd",
    "\u201cdone",
    "\u201csend",
    "\u201csave"
  ],
  "tyn_section":[

  ]
}