{
  "title":"How to Block Friends in Need for Speed",
  "url":"https://www.wikihow.com/Block-Friends-in-Need-for-Speed",
  "category_hierarchy":[
    "Hobbies and Crafts",
    "Games",
    "Video Games",
    "Multi Platform Games",
    "Need for Speed"
  ],
  "methods":[
    {
      "name":"Blocking Users while Roaming the World",
      "steps":[
        {
          "headline":"Launch Need for Speed World.",
          "description":"You can launch the game from the Start menu or desktop, if you created a shortcut there during setup."
        },
        {
          "headline":"Log into your account.",
          "description":"Enter your username and password into the fields provided, and click \u201cSign in.\u201d\nAfter logging in, NFSW will initiate an update. As soon as NFSW has finished downloading and installing all the required updates from the Internet, a dialog box with a \u201cPlay\u201d button will appear."
        },
        {
          "headline":"Enter the NFSW world in Free Roam mode.",
          "description":"Click on the \u201cPlay\u201d button, and press \u201cEnter\u201d or any other key to start. This will load and display your NFSW profile details. Click \u201cEnter World\u201d to enter the NFS World in Free Roam mode. Free Roam is a mode in the game (and most other modern NFS titles) that allows you to tour the racing world to find races or other drivers."
        },
        {
          "headline":"Block users.",
          "description":"In Free Roam mode, if you do not like the behavior of any fellow driver, you can block them by right-clicking their user name and selecting \u201cBlock Driver.\u201d The usernames of the drivers are shown on top of their vehicles throughout NFS World. A dialog box will appear asking you to confirm whether you wish to block the driver. Click \u201cBlock Driver\u201d to confirm. The user will be blocked, meaning they can not race with you or see you in NFS World. They will not be notified that you blocked them."
        }
      ]
    },
    {
      "name":"Blocking Friends via the Social Screen",
      "steps":[
        {
          "headline":"Launch Need for Speed World.",
          "description":"You can launch the game from the Start menu or desktop, if you created a shortcut there during setup."
        },
        {
          "headline":"Log into your account.",
          "description":"Enter your username and password into the fields provided, and click \u201cSign in.\u201d\nAfter logging in, NFSW will initiate an update. As soon as NFSW has finished downloading and installing all the required updates from the Internet, a dialog box with a \u201cPlay\u201d button will appear."
        },
        {
          "headline":"Enter the NFSW world in Free Roam mode.",
          "description":"Click on the \u201cPlay\u201d button, and press \u201cEnter\u201d or any other key to start. This will load and display your NFSW profile details. Click \u201cEnter World\u201d to enter the NFS World in Free Roam mode."
        },
        {
          "headline":"Hit \u201cO\u201d on your keyboard to display the NFSW Social screen.",
          "description":"Alternatively, to display the screen, you can click the \u201cFriends\u201d button at the top of the NFS World screen. The Social screen will display all the drivers currently on your Friends List."
        },
        {
          "headline":"Block a friend.",
          "description":"To block a friend, right-click their name and select \u201cBlock Friend.\u201d A dialogue will pop up asking you to confirm. Click \u201cBlock Friend\u201d to confirm the action."
        }
      ]
    }
  ],
  "text":" Blocking Users while Roaming the World Launch Need for Speed World. You can launch the game from the Start menu or desktop, if you created a shortcut there during setup. Log into your account. Enter your username and password into the fields provided, and click \u201cSign in.\u201d\nAfter logging in, NFSW will initiate an update. As soon as NFSW has finished downloading and installing all the required updates from the Internet, a dialog box with a \u201cPlay\u201d button will appear. Enter the NFSW world in Free Roam mode. Click on the \u201cPlay\u201d button, and press \u201cEnter\u201d or any other key to start. This will load and display your NFSW profile details. Click \u201cEnter World\u201d to enter the NFS World in Free Roam mode. Free Roam is a mode in the game (and most other modern NFS titles) that allows you to tour the racing world to find races or other drivers. Block users. In Free Roam mode, if you do not like the behavior of any fellow driver, you can block them by right-clicking their user name and selecting \u201cBlock Driver.\u201d The usernames of the drivers are shown on top of their vehicles throughout NFS World. A dialog box will appear asking you to confirm whether you wish to block the driver. Click \u201cBlock Driver\u201d to confirm. The user will be blocked, meaning they can not race with you or see you in NFS World. They will not be notified that you blocked them. Blocking Friends via the Social Screen Launch Need for Speed World. You can launch the game from the Start menu or desktop, if you created a shortcut there during setup. Log into your account. Enter your username and password into the fields provided, and click \u201cSign in.\u201d\nAfter logging in, NFSW will initiate an update. As soon as NFSW has finished downloading and installing all the required updates from the Internet, a dialog box with a \u201cPlay\u201d button will appear. Enter the NFSW world in Free Roam mode. Click on the \u201cPlay\u201d button, and press \u201cEnter\u201d or any other key to start. This will load and display your NFSW profile details. Click \u201cEnter World\u201d to enter the NFS World in Free Roam mode. Hit \u201cO\u201d on your keyboard to display the NFSW Social screen. Alternatively, to display the screen, you can click the \u201cFriends\u201d button at the top of the NFS World screen. The Social screen will display all the drivers currently on your Friends List. Block a friend. To block a friend, right-click their name and select \u201cBlock Friend.\u201d A dialogue will pop up asking you to confirm. Click \u201cBlock Friend\u201d to confirm the action.",
  "tyn_model":[
    "\u201d button",
    "\u201cplay",
    "\u201center",
    "\u201d to",
    "\u201cblock",
    "nfs world",
    "need for speed world",
    "\u201csign",
    "\u201d\n",
    "\u201d or",
    "free roam mode",
    "free roam",
    "nfs titles",
    "\u201d the",
    "\u201co",
    "\u201d on",
    "\u201cfriends",
    "\u201d a"
  ],
  "tyn_section":[

  ]
}