{
  "title":"How to Create a Driver in Need for Speed",
  "url":"https://www.wikihow.com/Create-a-Driver-in-Need-for-Speed",
  "category_hierarchy":[
    "Hobbies and Crafts",
    "Games",
    "Video Games",
    "Multi Platform Games",
    "Need for Speed"
  ],
  "methods":[
    {
      "name":"Creating a Driver in Need for Speed World",
      "steps":[
        {
          "headline":"Launch Need for Speed World.",
          "description":"You can launch the game from the Start menu or desktop, if you created a shortcut there during setup."
        },
        {
          "headline":"Log into your account.",
          "description":"Enter your username and password into the fields provided, and click \u201cSign in.\u201d\nAfter logging in, NFSW will initiate an update. As soon as NFSW has finished downloading and installing all the required updates from the Internet, a dialog box with a \u201cPlay\u201d button will appear."
        },
        {
          "headline":"Go to the Select a Driver page.",
          "description":"Click on the \u201cPlay\u201d button, and press \u201cEnter\u201d or any other key when prompted. You will be taken to the Select a Driver page."
        },
        {
          "headline":"Click the \u201cCreate a Driver\u201d button.",
          "description":"Now you can start the process of creating a new driver profile."
        },
        {
          "headline":"Name your driver.",
          "description":"Enter the name you would like to use for your driver in the \u201cEnter a Driver Name\u201d field. On the Select a Driver Picture pane of the same screen, choose a picture for your driver from the ones provided. Click the \u201cNext\u201d button at the bottom of the page when you're done."
        },
        {
          "headline":"Select a car for your driver.",
          "description":"On the next page, you will be allowed to choose a car you can purchase with your SpeedBoost. SpeedBoost is the currency used in NFS World, and you are given 200,000 of this when you create a new driver. Click on a model from the Car Models list, and click \u201cPurchase Car\u201d at the bottom of the page to buy the car. A dialog box will pop up asking you to confirm purchasing the car. Click \u201cYes\u201d to confirm and return to the Select a Driver page."
        },
        {
          "headline":"Start using the new driver.",
          "description":"On the Select a Driver page, click \u201cEnter World\u201d to enter NFS World and start racing as the Driver you just created!"
        }
      ]
    },
    {
      "name":"Creating a Driver in Need for Speed Hot Pursuit (PC)",
      "steps":[
        {
          "headline":"Launch the game.",
          "description":"You can launch the game by clicking its program icon from the Windows Start menu (Start button  >> All Programs >> EA Games >> Need for Speed Hot Pursuit)."
        },
        {
          "headline":"Press Enter once the game loads.",
          "description":"This will display the Main Menu."
        },
        {
          "headline":"Access the Driver Profile page.",
          "description":"On the Main Menu, click \u201cOptions\u201d then scroll right (using the right arrow button) till you arrive at the Driver Profile page."
        },
        {
          "headline":"Create a new driver.",
          "description":"On the Driver Profile page, click \u201cNew driver profile.\u201d A dialog box will appear where you can name your driver."
        },
        {
          "headline":"Name your driver.",
          "description":"Click on the text field in the dialog box, and enter the name you would like to use for your driver. Click \u201cOK\u201d when you're done. Confirm the new name by clicking \u201cOK\u201d again."
        },
        {
          "headline":"Exit the Driver Profile page.",
          "description":"Click \u201cBack\u201d at the bottom of the Driver Profile page to exit back to the Main Menu. You can now race using the driver name that you created!"
        }
      ]
    },
    {
      "name":"Creating a Driver in Need for Speed Shift (PC)",
      "steps":[
        {
          "headline":"Launch the game.",
          "description":"You can launch the game from the Start menu (Start Button >> Games >> Need for Speed Shift), or you can also launch it from the desktop by double-clicking its icon, if you have it installed there."
        },
        {
          "headline":"Select your language.",
          "description":"A language selection page will be displayed. Scroll down the options and highlight the language you want to use. Press Enter to select the language to load the game\nWhen the game finishes loading, a Driver profile selection page with a list of all available Drivers will be displayed."
        },
        {
          "headline":"Create a new driver.",
          "description":"Click the option labelled \u201cNew Game\u201d to create a new Driver profile. You will be prompted to type the name of your new Driver. Do so in the provided box, and press Enter. NFS Shift will create a new Driver profile with the name you entered, and launch a new racing career under it. To race as a different Driver, quit (by pressing Alt+F4) and relaunch the game, and then select the Driver name you want from the Driver profile selection page."
        }
      ]
    }
  ],
  "text":" Creating a Driver in Need for Speed World Launch Need for Speed World. You can launch the game from the Start menu or desktop, if you created a shortcut there during setup. Log into your account. Enter your username and password into the fields provided, and click \u201cSign in.\u201d\nAfter logging in, NFSW will initiate an update. As soon as NFSW has finished downloading and installing all the required updates from the Internet, a dialog box with a \u201cPlay\u201d button will appear. Go to the Select a Driver page. Click on the \u201cPlay\u201d button, and press \u201cEnter\u201d or any other key when prompted. You will be taken to the Select a Driver page. Click the \u201cCreate a Driver\u201d button. Now you can start the process of creating a new driver profile. Name your driver. Enter the name you would like to use for your driver in the \u201cEnter a Driver Name\u201d field. On the Select a Driver Picture pane of the same screen, choose a picture for your driver from the ones provided. Click the \u201cNext\u201d button at the bottom of the page when you're done. Select a car for your driver. On the next page, you will be allowed to choose a car you can purchase with your SpeedBoost. SpeedBoost is the currency used in NFS World, and you are given 200,000 of this when you create a new driver. Click on a model from the Car Models list, and click \u201cPurchase Car\u201d at the bottom of the page to buy the car. A dialog box will pop up asking you to confirm purchasing the car. Click \u201cYes\u201d to confirm and return to the Select a Driver page. Start using the new driver. On the Select a Driver page, click \u201cEnter World\u201d to enter NFS World and start racing as the Driver you just created! Creating a Driver in Need for Speed Hot Pursuit (PC) Launch the game. You can launch the game by clicking its program icon from the Windows Start menu (Start button  >> All Programs >> EA Games >> Need for Speed Hot Pursuit). Press Enter once the game loads. This will display the Main Menu. Access the Driver Profile page. On the Main Menu, click \u201cOptions\u201d then scroll right (using the right arrow button) till you arrive at the Driver Profile page. Create a new driver. On the Driver Profile page, click \u201cNew driver profile.\u201d A dialog box will appear where you can name your driver. Name your driver. Click on the text field in the dialog box, and enter the name you would like to use for your driver. Click \u201cOK\u201d when you're done. Confirm the new name by clicking \u201cOK\u201d again. Exit the Driver Profile page. Click \u201cBack\u201d at the bottom of the Driver Profile page to exit back to the Main Menu. You can now race using the driver name that you created! Creating a Driver in Need for Speed Shift (PC) Launch the game. You can launch the game from the Start menu (Start Button >> Games >> Need for Speed Shift), or you can also launch it from the desktop by double-clicking its icon, if you have it installed there. Select your language. A language selection page will be displayed. Scroll down the options and highlight the language you want to use. Press Enter to select the language to load the game\nWhen the game finishes loading, a Driver profile selection page with a list of all available Drivers will be displayed. Create a new driver. Click the option labelled \u201cNew Game\u201d to create a new Driver profile. You will be prompted to type the name of your new Driver. Do so in the provided box, and press Enter. NFS Shift will create a new Driver profile with the name you entered, and launch a new racing career under it. To race as a different Driver, quit (by pressing Alt+F4) and relaunch the game, and then select the Driver name you want from the Driver profile selection page.",
  "tyn_model":[
    "\u201d button",
    "\u201center",
    "\u201d to",
    "\u201cplay",
    "\u201d at",
    "\u201cnew",
    "\u201cok",
    "\u201csign",
    "\u201d\n",
    "\u201d or",
    "\u201ccreate",
    "\u201d field",
    "\u201cnext",
    "speedboost.",
    "nfs world",
    "\u201cpurchase",
    "\u201cyes",
    "\u201coptions",
    "\u201d then",
    "\u201d a",
    "\u201d when",
    "\u201d again",
    "\u201cback"
  ],
  "tyn_section":[

  ]
}