{
  "title":"How to Show Off Achievements in Need for Speed",
  "url":"https://www.wikihow.com/Show-Off-Achievements-in-Need-for-Speed",
  "category_hierarchy":[
    "Hobbies and Crafts",
    "Games",
    "Video Games",
    "Multi Platform Games",
    "Need for Speed"
  ],
  "methods":[
    {
      "name":"Showing Off Achievements in Need for Speed World (PC)",
      "steps":[
        {
          "headline":"Launch Need for Speed World.",
          "description":"You can launch the game from the Start menu or desktop, if you created a shortcut there during setup."
        },
        {
          "headline":"Log into your account.",
          "description":"Enter your username and password into the fields provided, and click \u201cSign in.\u201d\nAfter logging in, NFSW will initiate an update. As soon as NFSW has finished downloading and installing all the required updates from the Internet, a dialog box with a \u201cPlay\u201d button will appear."
        },
        {
          "headline":"Enter the NFSW world in Free Roam mode.",
          "description":"Click on the \u201cPlay\u201d button, and press \u201cEnter\u201d or any other key to start. This will load and display your NFSW profile details. Click \u201cEnter World\u201d to enter the NFS World in Free Roam mode. Free Roam is a mode in the game (and most other modern NFS titles) that allows you to tour the racing world to find races or other drivers."
        },
        {
          "headline":"Hit \u201cI\u201d on your keyboard to open the NFSW Achievements screen.",
          "description":"Alternatively, you can click the \u201cAchievements\u201d button (the one that resembles a \u201cD\u201d) at the top of the NFSW window."
        },
        {
          "headline":"View your achievements.",
          "description":"On the Achievements screen, click the drop-down list at the top right, and select \u201cCOMPLETED.\u201dThis will display a log of all achievements you have completed in the game to that point."
        },
        {
          "headline":"Show off your achievements.",
          "description":"To show off an Achievement, drag its badge from the log to an open slot at the top right-hand corner of the screen. The Achievement will now be visible on your driver profile throughout NFS World."
        }
      ]
    },
    {
      "name":"Showing Off Achievements in Need for Speed Underground 2 (PC)",
      "steps":[
        {
          "headline":"Launch the game.",
          "description":"Click Start  >> All Programs >> EA Games >> Need for Speed Underground 2. You can also start it by double-clicking the Need for Speed: Underground 2 shortcut from the desktop, if you created it there during game setup."
        },
        {
          "headline":"Resume your Career Mode game.",
          "description":"Press Enter once the game loads. This will display the Main Menu. Choose \u201cCareer\u201d on the game\u2019s Main Menu and select \u201cResume Career\u201d by pressing Enter. This will launch the Career Mode menu."
        },
        {
          "headline":"View your achievements.",
          "description":"Scroll rightwards (Right Arrow key) and select \u201cView Rewards.\u201d This will open the Reward Options screen. On this screen, you can open three categories of achievements: Magazines, DVD Covers, and Signed Sponsors. Select the category you want using the Left and Right Arrow keys."
        },
        {
          "headline":"Grab screenshots of your achievements.",
          "description":"When the category you want to show off is selected, press \u201cPrint Screen\u201d on your keyboard to capture a screenshot of it."
        },
        {
          "headline":"Save the screenshot.",
          "description":"Return to Windows by pressing the \u201cWindows key\u201d or \u201cControl+Escape\u201d on your keyboard. Open Microsoft Paint by clicking Start button >> All Programs >> Accessories >> Paint. Press CTRL + V to paste your screenshot. Press CTRL + S. This will open the Save dialog box. After selecting your storage location on the dialog box then click \u201cSave.\u201d"
        },
        {
          "headline":"Show off your achievements.",
          "description":"You can now show off your NFSU2 achievement by emailing your friends the screenshot, or by posting it on your social media, e.g., Facebook, Twitter, and Instagram."
        }
      ]
    },
    {
      "name":"Showing Off Achievements in Need for Speed Carbon (PC)",
      "steps":[
        {
          "headline":"Launch the game.",
          "description":"You can do this by clicking its icon from the Start menu (Start Button >> All Programs >> Electronic Arts >> Need for Speed Carbon), or double-clicking its shortcut icon from the desktop if its icon is present there."
        },
        {
          "headline":"View the main menu.",
          "description":"When the game finishes loading, press Enter to display the main menu."
        },
        {
          "headline":"Access the Rewards screen.",
          "description":"On the main menu, scroll rightwards (Right Arrow key) and select \u201cRewards.\u201d This will open the Rewards screen, which displays the different things you have achieved in NFS Carbon in small icons."
        },
        {
          "headline":"Take a screenshot of the Rewards page.",
          "description":"To do this, press \u201cPrint Screen\u201d on your keyboard."
        },
        {
          "headline":"Save the screenshot.",
          "description":"Return to Windows by pressing the \u201cWindows key\u201d or \u201cControl+Escape\u201d on your keyboard. Open Microsoft Paint by clicking Start button >> All Programs >> Accessories >> Paint. Press CTRL + V to paste your screenshot. Press CTRL + S. This will open the Save dialog box. After selecting your storage location on the dialog box then click \u201cSave.\u201d"
        },
        {
          "headline":"Show off your achievements.",
          "description":"You can now show off your NFSU2 achievement by emailing your friends the screenshot, or by posting it on your social media, e.g., Facebook, Twitter, and Instagram."
        }
      ]
    }
  ],
  "text":" Showing Off Achievements in Need for Speed World (PC) Launch Need for Speed World. You can launch the game from the Start menu or desktop, if you created a shortcut there during setup. Log into your account. Enter your username and password into the fields provided, and click \u201cSign in.\u201d\nAfter logging in, NFSW will initiate an update. As soon as NFSW has finished downloading and installing all the required updates from the Internet, a dialog box with a \u201cPlay\u201d button will appear. Enter the NFSW world in Free Roam mode. Click on the \u201cPlay\u201d button, and press \u201cEnter\u201d or any other key to start. This will load and display your NFSW profile details. Click \u201cEnter World\u201d to enter the NFS World in Free Roam mode. Free Roam is a mode in the game (and most other modern NFS titles) that allows you to tour the racing world to find races or other drivers. Hit \u201cI\u201d on your keyboard to open the NFSW Achievements screen. Alternatively, you can click the \u201cAchievements\u201d button (the one that resembles a \u201cD\u201d) at the top of the NFSW window. View your achievements. On the Achievements screen, click the drop-down list at the top right, and select \u201cCOMPLETED.\u201dThis will display a log of all achievements you have completed in the game to that point. Show off your achievements. To show off an Achievement, drag its badge from the log to an open slot at the top right-hand corner of the screen. The Achievement will now be visible on your driver profile throughout NFS World. Showing Off Achievements in Need for Speed Underground 2 (PC) Launch the game. Click Start  >> All Programs >> EA Games >> Need for Speed Underground 2. You can also start it by double-clicking the Need for Speed: Underground 2 shortcut from the desktop, if you created it there during game setup. Resume your Career Mode game. Press Enter once the game loads. This will display the Main Menu. Choose \u201cCareer\u201d on the game\u2019s Main Menu and select \u201cResume Career\u201d by pressing Enter. This will launch the Career Mode menu. View your achievements. Scroll rightwards (Right Arrow key) and select \u201cView Rewards.\u201d This will open the Reward Options screen. On this screen, you can open three categories of achievements: Magazines, DVD Covers, and Signed Sponsors. Select the category you want using the Left and Right Arrow keys. Grab screenshots of your achievements. When the category you want to show off is selected, press \u201cPrint Screen\u201d on your keyboard to capture a screenshot of it. Save the screenshot. Return to Windows by pressing the \u201cWindows key\u201d or \u201cControl+Escape\u201d on your keyboard. Open Microsoft Paint by clicking Start button >> All Programs >> Accessories >> Paint. Press CTRL + V to paste your screenshot. Press CTRL + S. This will open the Save dialog box. After selecting your storage location on the dialog box then click \u201cSave.\u201d Show off your achievements. You can now show off your NFSU2 achievement by emailing your friends the screenshot, or by posting it on your social media, e.g., Facebook, Twitter, and Instagram. Showing Off Achievements in Need for Speed Carbon (PC) Launch the game. You can do this by clicking its icon from the Start menu (Start Button >> All Programs >> Electronic Arts >> Need for Speed Carbon), or double-clicking its shortcut icon from the desktop if its icon is present there. View the main menu. When the game finishes loading, press Enter to display the main menu. Access the Rewards screen. On the main menu, scroll rightwards (Right Arrow key) and select \u201cRewards.\u201d This will open the Rewards screen, which displays the different things you have achieved in NFS Carbon in small icons. Take a screenshot of the Rewards page. To do this, press \u201cPrint Screen\u201d on your keyboard. Save the screenshot. Return to Windows by pressing the \u201cWindows key\u201d or \u201cControl+Escape\u201d on your keyboard. Open Microsoft Paint by clicking Start button >> All Programs >> Accessories >> Paint. Press CTRL + V to paste your screenshot. Press CTRL + S. This will open the Save dialog box. After selecting your storage location on the dialog box then click \u201cSave.\u201d Show off your achievements. You can now show off your NFSU2 achievement by emailing your friends the screenshot, or by posting it on your social media, e.g., Facebook, Twitter, and Instagram.",
  "tyn_model":[
    "\u201d on",
    "\u201d button",
    "\u201d or",
    "\u201cplay",
    "\u201center",
    "\u201d this",
    "\u201cprint",
    "\u201cwindows",
    "\u201ccontrol+escape",
    "microsoft paint",
    "paint",
    "\u201csave",
    "\u201d show",
    "\u201csign",
    "\u201d\n",
    "\u201d to",
    "free roam",
    "\u201ci",
    "\u201cachievements",
    "\u201cd",
    "\u201d)",
    "\u201ccompleted.\u201dthis",
    "\u201ccareer",
    "\u201cresume",
    "\u201d by",
    "\u201cview",
    "magazines",
    "dvd",
    "electronic arts",
    "\u201crewards",
    "nfs carbon"
  ],
  "tyn_section":[

  ]
}