{
  "title":"How to Replace Cars in Need for Speed: Most Wanted",
  "url":"https://www.wikihow.com/Replace-Cars-in-Need-for-Speed:-Most-Wanted",
  "category_hierarchy":[
    "Hobbies and Crafts",
    "Games",
    "Video Games",
    "Multi Platform Games",
    "Need for Speed"
  ],
  "parts":[
    {
      "name":"Downloading a New Car from the Internet",
      "steps":[
        {
          "headline":"Start the process of downloading new cars for NFSMW from the Internet.",
          "description":"There are a variety of websites you can do this from, but one of the most popular ones is nfscars.net."
        },
        {
          "headline":"Select NFS Most Wanted from the list of available NFS games.",
          "description":"To do this, click the \u201cNeed for Speed\u201d link on the top part of the site, and click \u201cNeed for Speed Most Wanted\u201d from the list that appears."
        },
        {
          "headline":"Select the car you want to add to your NFSMW.",
          "description":"You can click one of the cars under \u201cLatest Most Wanted Cars\u201d or click \u201cMore\u201d to see other available cars. Once you sight the car you want, click on it."
        },
        {
          "headline":"Review which car your downloaded vehicle replaces in NFSMW.",
          "description":"You can see this info in the description box for your download, which is found below the vehicle\u2019s photo. Each downloaded vehicle must replace one of the cars originally available on NFSMW. If you do not want to replace the particular original car indicated, click the Back button on your browser and select a different car to download."
        },
        {
          "headline":"Download your new car.",
          "description":"If you are okay with replacing the car stated in the description box of the new car, click the green \u201cDownload\u201d button. This will download a zipped (compressed) folder containing the files for the new car onto your computer."
        }
      ]
    },
    {
      "name":"Backing Up the Old Car\u2019s Files",
      "steps":[
        {
          "headline":"Open your NFS MW installation folder.",
          "description":"This is the folder to which the game\u2019s installation files were copied to during its setup and is, by default, on this path: C:\\Program Files\\ EA Games\\Need for Speed Most Wanted\\"
        },
        {
          "headline":"Open the \u201cCars\u201d folder.",
          "description":"Do this by double-click on the folder."
        },
        {
          "headline":"Move the old car\u2019s folder to a new location on the computer.",
          "description":"You can do this by right-clicking the folder and selecting \u201cCopy\u201d or \u201cCut.\u201d If the old car is SL 500, for instance, its folder will be named SL500. Head to a location where you want to keep the car file. In the new location, right-click and and select \u201cPaste.\u201d This will allow you to later restore the old car in case you are dissatisfied with the new one."
        }
      ]
    },
    {
      "name":"Installing the Downloaded Car into NFSMW",
      "steps":[
        {
          "headline":"Open the zipped folder you downloaded.",
          "description":"Go to your Downloads folder, locate the downloaded zip file, and right-click it. Select \u201cUnzip here\u201d from the context menu to unzip the new car file."
        },
        {
          "headline":"Copy the new car\u2019s files from the unzipped folder.",
          "description":"Open the folder, and locate the new car\u2019s file. Its folder will bear the name of the car that is to be replaced, e.g., SL500. Do this by right-clicking the folder and choosing \u201cCopy\u201d from the context menu"
        },
        {
          "headline":"Install the new car into your NFSMW game.",
          "description":"Head inside the NFSMW installation folder and open the Cars folder. Right-click and select \u201cPaste.\u201d You will then have replaced the old car with a new car!"
        }
      ]
    }
  ],
  "text":" Downloading a New Car from the Internet Start the process of downloading new cars for NFSMW from the Internet. There are a variety of websites you can do this from, but one of the most popular ones is nfscars.net. Select NFS Most Wanted from the list of available NFS games. To do this, click the \u201cNeed for Speed\u201d link on the top part of the site, and click \u201cNeed for Speed Most Wanted\u201d from the list that appears. Select the car you want to add to your NFSMW. You can click one of the cars under \u201cLatest Most Wanted Cars\u201d or click \u201cMore\u201d to see other available cars. Once you sight the car you want, click on it. Review which car your downloaded vehicle replaces in NFSMW. You can see this info in the description box for your download, which is found below the vehicle\u2019s photo. Each downloaded vehicle must replace one of the cars originally available on NFSMW. If you do not want to replace the particular original car indicated, click the Back button on your browser and select a different car to download. Download your new car. If you are okay with replacing the car stated in the description box of the new car, click the green \u201cDownload\u201d button. This will download a zipped (compressed) folder containing the files for the new car onto your computer. Backing Up the Old Car\u2019s Files Open your NFS MW installation folder. This is the folder to which the game\u2019s installation files were copied to during its setup and is, by default, on this path: C:\\Program Files\\ EA Games\\Need for Speed Most Wanted\\ Open the \u201cCars\u201d folder. Do this by double-click on the folder. Move the old car\u2019s folder to a new location on the computer. You can do this by right-clicking the folder and selecting \u201cCopy\u201d or \u201cCut.\u201d If the old car is SL 500, for instance, its folder will be named SL500. Head to a location where you want to keep the car file. In the new location, right-click and and select \u201cPaste.\u201d This will allow you to later restore the old car in case you are dissatisfied with the new one. Installing the Downloaded Car into NFSMW Open the zipped folder you downloaded. Go to your Downloads folder, locate the downloaded zip file, and right-click it. Select \u201cUnzip here\u201d from the context menu to unzip the new car file. Copy the new car\u2019s files from the unzipped folder. Open the folder, and locate the new car\u2019s file. Its folder will bear the name of the car that is to be replaced, e.g., SL500. Do this by right-clicking the folder and choosing \u201cCopy\u201d from the context menu Install the new car into your NFSMW game. Head inside the NFSMW installation folder and open the Cars folder. Right-click and select \u201cPaste.\u201d You will then have replaced the old car with a new car!",
  "tyn_model":[
    "\u201d from",
    "\u201cneed",
    "\u201d or",
    "\u201ccopy",
    "\u201cpaste",
    "nfs games",
    "\u201d link",
    "\u201clatest",
    "\u201cmore",
    "\u201d to",
    "\u201cdownload",
    "\u201d button",
    "nfs mw installation folder",
    "\u201ccars",
    "\u201d folder",
    "computer",
    "\u201ccut",
    "\u201d if",
    "\u201d this",
    "\u201cunzip",
    "\u201d you"
  ],
  "tyn_section":[

  ]
}