{
  "title":"How to Join a Team Escape Event in Need for Speed World",
  "url":"https://www.wikihow.com/Join-a-Team-Escape-Event-in-Need-for-Speed-World",
  "category_hierarchy":[
    "Hobbies and Crafts",
    "Games",
    "Video Games",
    "Multi Platform Games",
    "Need for Speed"
  ],
  "methods":[
    {
      "name":"Joining a Team Escape Event while Roaming the World",
      "steps":[
        {
          "headline":"Launch Need for Speed World.",
          "description":"You can launch the game from the Start menu or desktop, if you created a shortcut there during setup."
        },
        {
          "headline":"Log into your account.",
          "description":"Enter your username and password into the fields provided, and click \u201cSign in.\u201d\nAfter logging in, NFSW will initiate an update. As soon as NFSW has finished downloading and installing all the required updates from the Internet, a dialog box with a \u201cPlay\u201d button will appear."
        },
        {
          "headline":"Enter the NFSW world Free Roam mode.",
          "description":"Click on the \u201cPlay\u201d button, and press \u201cEnter\u201d or any other key to start. This will load and display your NFSW profile details. Click \u201cEnter World\u201d to enter the NFS World in Free Roam mode. Free Roam is a mode in the game (and most other modern NFS titles) that allows you to\troam the racing world to find races or other drivers."
        },
        {
          "headline":"Look for a Team Escape race marker.",
          "description":"While roaming the NFS World, look out for the Team Escape race marker on the road. The marker is red and consists of an arrow-shaped race track with a ring around it. The marker for a normal sprint race looks similar but is blue instead."
        },
        {
          "headline":"Join the Team Escape race.",
          "description":"Drive anywhere close to the marker, and press \u201c[\u201c (left bracket) on your keyboard. This will put you in the waiting list of players waiting to start the Team Escape race. As soon as the countdown time has elapsed, the race will start, and you will have joined a NFSW Team Escape event!"
        }
      ]
    },
    {
      "name":"Joining a Team Escape Event through the Game Map",
      "steps":[
        {
          "headline":"Launch Need for Speed World.",
          "description":"You can launch the game from the Start menu or desktop, if you created a shortcut there during setup."
        },
        {
          "headline":"Log into your account.",
          "description":"Enter your username and password into the fields provided, and click \u201cSign in.\u201d\nAfter logging in, NFSW will initiate an update. As soon as NFSW has finished downloading and installing all the required updates from the Internet, a dialog box with a \u201cPlay\u201d button will appear."
        },
        {
          "headline":"Enter the NFSW world Free Roam mode.",
          "description":"Click on the \u201cPlay\u201d button, and press \u201cEnter\u201d or any other key to start. This will load and display your NFSW profile details. Click \u201cEnter World\u201d to enter the NFS World in Free Roam mode."
        },
        {
          "headline":"Launch your NFSW map.",
          "description":"You can do this by pressing M on your keyboard or by clicking the second icon from right on the row of icons at the top of your NFSW screen. The icon should say \u201cWorld Map\u201d if you hover your mouse on it."
        },
        {
          "headline":"Find the Team Escape icon on the map.",
          "description":"The map displays the city\u2019s race locations using blue and red icons, and Team Escape races are represented by red icons that are shaped like an arrow."
        },
        {
          "headline":"Join the Team Escape race.",
          "description":"You can do this by hovering your mouse over the icon and then, on the dialog box that appears click \u201cJoin.\u201d This will immediately enter you into the Team Escape event."
        }
      ]
    }
  ],
  "text":" Joining a Team Escape Event while Roaming the World Launch Need for Speed World. You can launch the game from the Start menu or desktop, if you created a shortcut there during setup. Log into your account. Enter your username and password into the fields provided, and click \u201cSign in.\u201d\nAfter logging in, NFSW will initiate an update. As soon as NFSW has finished downloading and installing all the required updates from the Internet, a dialog box with a \u201cPlay\u201d button will appear. Enter the NFSW world Free Roam mode. Click on the \u201cPlay\u201d button, and press \u201cEnter\u201d or any other key to start. This will load and display your NFSW profile details. Click \u201cEnter World\u201d to enter the NFS World in Free Roam mode. Free Roam is a mode in the game (and most other modern NFS titles) that allows you to\troam the racing world to find races or other drivers. Look for a Team Escape race marker. While roaming the NFS World, look out for the Team Escape race marker on the road. The marker is red and consists of an arrow-shaped race track with a ring around it. The marker for a normal sprint race looks similar but is blue instead. Join the Team Escape race. Drive anywhere close to the marker, and press \u201c[\u201c (left bracket) on your keyboard. This will put you in the waiting list of players waiting to start the Team Escape race. As soon as the countdown time has elapsed, the race will start, and you will have joined a NFSW Team Escape event! Joining a Team Escape Event through the Game Map Launch Need for Speed World. You can launch the game from the Start menu or desktop, if you created a shortcut there during setup. Log into your account. Enter your username and password into the fields provided, and click \u201cSign in.\u201d\nAfter logging in, NFSW will initiate an update. As soon as NFSW has finished downloading and installing all the required updates from the Internet, a dialog box with a \u201cPlay\u201d button will appear. Enter the NFSW world Free Roam mode. Click on the \u201cPlay\u201d button, and press \u201cEnter\u201d or any other key to start. This will load and display your NFSW profile details. Click \u201cEnter World\u201d to enter the NFS World in Free Roam mode. Launch your NFSW map. You can do this by pressing M on your keyboard or by clicking the second icon from right on the row of icons at the top of your NFSW screen. The icon should say \u201cWorld Map\u201d if you hover your mouse on it. Find the Team Escape icon on the map. The map displays the city\u2019s race locations using blue and red icons, and Team Escape races are represented by red icons that are shaped like an arrow. Join the Team Escape race. You can do this by hovering your mouse over the icon and then, on the dialog box that appears click \u201cJoin.\u201d This will immediately enter you into the Team Escape event.",
  "tyn_model":[
    "\u201cplay",
    "\u201d button",
    "\u201center",
    "\u201csign",
    "\u201d\n",
    "\u201d or",
    "\u201d to",
    "free roam",
    "need for speed world",
    "nfs titles",
    "\u201c[",
    "\u201c (",
    "nfs world",
    "\u201cworld",
    "\u201d if",
    "mouse",
    "\u201cjoin",
    "\u201d this"
  ],
  "tyn_section":[

  ]
}