{
  "title":"How to Leave a Group in Need for Speed World",
  "url":"https://www.wikihow.com/Leave-a-Group-in-Need-for-Speed-World",
  "category_hierarchy":[
    "Hobbies and Crafts",
    "Games",
    "Video Games",
    "Multi Platform Games",
    "Need for Speed"
  ],
  "methods":[
    {
      "name":"Leaving a Group via the Social Screen",
      "steps":[
        {
          "headline":"Launch Need for Speed World.",
          "description":"You can launch the game from the Start menu or desktop, if you created a shortcut there during setup."
        },
        {
          "headline":"Log into your account.",
          "description":"Enter your username and password into the fields provided, and click \u201cSign in.\u201d\nAfter logging in, NFSW will initiate an update. As soon as NFSW has finished downloading and installing all the required updates from the Internet, a dialog box with a \u201cPlay\u201d button will appear."
        },
        {
          "headline":"Enter the NFSW world in Free Roam mode.",
          "description":"Click on the \u201cPlay\u201d button, and press \u201cEnter\u201d or any other key to start. This will load and display your NFSW profile details. Click \u201cEnter World\u201d to enter the NFS World in Free Roam mode. Free Roam is a mode in the game (and most other modern NFS titles) that allows you to tour the racing world to find races or other drivers."
        },
        {
          "headline":"Hit \u201cO\u201d on your keyboard.",
          "description":"This will launch NFS World\u2019s Social screen."
        },
        {
          "headline":"Click on the Group List icon on the Social screen.",
          "description":"It is the third icon from the left at the top of the screen; if you hover your mouse over the icon, it will say \u201cGroup List.\u201d This will open the Group tab, which lists all the members in the group."
        },
        {
          "headline":"Leave the group.",
          "description":"Click the \u201cLeave Group\u201d button at the bottom of the screen. This is the button next to the \u201c+\u201d icon. Click \u201cYes\u201d on the dialog box that appears to confirm the action. This will immediately remove you from the group."
        },
        {
          "headline":"Confirm that you\u2019re no longer in the group.",
          "description":"This is optional, but if you really want to check that you\u2019ve been removed from the group, open the Social screen again and access the Group List tab. If you are not in a group, a notification will appear on Group List tab indicating so; otherwise, the other Drivers that are in the group will be listed."
        }
      ]
    },
    {
      "name":"Leaving a Group by Exiting the Game",
      "steps":[
        {
          "headline":"Exit NFSW using the Exit command.",
          "description":"During Free Roam, press Escape on your keyboard. This will bring up the Options menu. On the Options menu, click the very last item: \u201cExit Game.\u201d This will close the game, removing you from the group."
        },
        {
          "headline":"Exit NFSW using the Alt+F4 shortcut.",
          "description":"Press the Alt key together with F4 whilst in any part of NFSW. This will instantly close the game, and thus remove you from the group."
        },
        {
          "headline":"Exit NFSW by first returning to Windows.",
          "description":"Press the Windows key on your keyboard whilst in any part of the game. This will minimize NFSW and return you to the Windows desktop. Right-click the icon of the minimized NFSW on the taskbar, and select \u201cClose.\u201d This will close NFSW and remove you from the group. Whichever way you exit NFSW, when you log in again and return to the game, you will no longer be in a group."
        }
      ]
    }
  ],
  "text":" Leaving a Group via the Social Screen Launch Need for Speed World. You can launch the game from the Start menu or desktop, if you created a shortcut there during setup. Log into your account. Enter your username and password into the fields provided, and click \u201cSign in.\u201d\nAfter logging in, NFSW will initiate an update. As soon as NFSW has finished downloading and installing all the required updates from the Internet, a dialog box with a \u201cPlay\u201d button will appear. Enter the NFSW world in Free Roam mode. Click on the \u201cPlay\u201d button, and press \u201cEnter\u201d or any other key to start. This will load and display your NFSW profile details. Click \u201cEnter World\u201d to enter the NFS World in Free Roam mode. Free Roam is a mode in the game (and most other modern NFS titles) that allows you to tour the racing world to find races or other drivers. Hit \u201cO\u201d on your keyboard. This will launch NFS World\u2019s Social screen. Click on the Group List icon on the Social screen. It is the third icon from the left at the top of the screen; if you hover your mouse over the icon, it will say \u201cGroup List.\u201d This will open the Group tab, which lists all the members in the group. Leave the group. Click the \u201cLeave Group\u201d button at the bottom of the screen. This is the button next to the \u201c+\u201d icon. Click \u201cYes\u201d on the dialog box that appears to confirm the action. This will immediately remove you from the group. Confirm that you\u2019re no longer in the group. This is optional, but if you really want to check that you\u2019ve been removed from the group, open the Social screen again and access the Group List tab. If you are not in a group, a notification will appear on Group List tab indicating so; otherwise, the other Drivers that are in the group will be listed. Leaving a Group by Exiting the Game Exit NFSW using the Exit command. During Free Roam, press Escape on your keyboard. This will bring up the Options menu. On the Options menu, click the very last item: \u201cExit Game.\u201d This will close the game, removing you from the group. Exit NFSW using the Alt+F4 shortcut. Press the Alt key together with F4 whilst in any part of NFSW. This will instantly close the game, and thus remove you from the group. Exit NFSW by first returning to Windows. Press the Windows key on your keyboard whilst in any part of the game. This will minimize NFSW and return you to the Windows desktop. Right-click the icon of the minimized NFSW on the taskbar, and select \u201cClose.\u201d This will close NFSW and remove you from the group. Whichever way you exit NFSW, when you log in again and return to the game, you will no longer be in a group.",
  "tyn_model":[
    "\u201d button",
    "\u201d this",
    "\u201cplay",
    "\u201center",
    "nfs world",
    "\u201d on",
    "need for speed world",
    "\u201csign",
    "\u201d\n",
    "\u201d or",
    "\u201d to",
    "free roam",
    "nfs titles",
    "\u201co",
    "\u201cgroup",
    "\u201cleave",
    "\u201c+",
    "\u201d icon",
    "\u201cyes",
    "\u201cexit",
    "\u201cclose"
  ],
  "tyn_section":[

  ]
}