{
  "title":"How to Swap Between Drivers in Need for Speed",
  "url":"https://www.wikihow.com/Swap-Between-Drivers-in-Need-for-Speed",
  "category_hierarchy":[
    "Hobbies and Crafts",
    "Games",
    "Video Games",
    "Multi Platform Games",
    "Need for Speed"
  ],
  "methods":[
    {
      "name":"via the Safe House Menu",
      "steps":[
        {
          "headline":"Open the Safe House menu.",
          "description":"If you need to swap drivers, press the Safehouse button on the top right corner of the screen to go to your Safehouse. You can also go to Safehouse by pressing \u201cH\u201d on your keyboard."
        },
        {
          "headline":"Click \u201cChange Driver\u201d from the Safe House menu.",
          "description":"This will take you to the Select a Driver page."
        },
        {
          "headline":"Choose a different Driver from the list.",
          "description":"Do this by clicking the name and then clicking \u201cEnter NFS World.\u201d This will let you play the game as the new Driver you\u2019ve chosen."
        }
      ]
    },
    {
      "name":"Restarting the Game",
      "steps":[
        {
          "headline":"Exit the game.",
          "description":"There are two ways to swap drivers in NFS World. The first is totally restarting the game. To do this, exit the game, and you can do this three ways too:\nThe first way is to press Esc to bring up the Options menu and then select \u201cExit Game.\u201d\nThe second way to exit the game is to press the Alt key together with F4. You will exit the game automatically. The third way to exit the game is by pressing the Windows key on your keyboard to return to the Windows Desktop and then closing NFSW by right-clicking its icon on the taskbar and selecting \u201cClose.\u201d"
        },
        {
          "headline":"Launch Need for Speed World.",
          "description":"You can launch the game from the Start menu or desktop, if you created a shortcut there during setup."
        },
        {
          "headline":"Log into your account.",
          "description":"Enter your username and password into the fields provided, and click \u201cSign in.\u201d\nAfter logging in, NFSW will initiate an update. As soon as NFSW has finished downloading and installing all the required updates from the Internet, a dialog box with a \u201cPlay\u201d button will appear."
        },
        {
          "headline":"Select a new driver.",
          "description":"Click on the \u201cPlay\u201d button, and press \u201cEnter\u201d or any other key to display your NFSW profile details. Here you can choose a different Driver from the list by clicking the name, and then clicking \u201cEnter NFS World.\u201d This will let you play the game as the new Driver you\u2019ve chosen."
        }
      ]
    },
    {
      "name":"Need for Speed Hot Pursuit (PC)",
      "steps":[
        {
          "headline":"Press Esc during a race.",
          "description":"This will open the game menu."
        },
        {
          "headline":"Access the Driver Profile.",
          "description":"Choose \u201cQuit Race\u201d from the menu. You will be taken to the Main Menu. Select \u201cOptions\u201d from the menu. Once in the Options menu, click the right arrow at the top till you arrive at the Driver Profile page. Here, the current Driver\u2019s username will be displayed."
        },
        {
          "headline":"Select a new Driver.",
          "description":"Click \u201cLoad Driver profile,\u201d and on the dialog box that appears, use the Left and Right Arrow keys to scroll the list of Available Driver names till the one you want is highlighted. Click \u201cOK\u201d to swap to that Driver. You will receive a confirmation that the new Driver\u2019s profile has been loaded."
        },
        {
          "headline":"Exit the menu.",
          "description":"Click the \u201cBack\u201d button at the bottom of the Driver Profile page to exit back to the Main Menu. You can now race using the new Driver name you selected!"
        }
      ]
    }
  ],
  "text":" via the Safe House Menu Open the Safe House menu. If you need to swap drivers, press the Safehouse button on the top right corner of the screen to go to your Safehouse. You can also go to Safehouse by pressing \u201cH\u201d on your keyboard. Click \u201cChange Driver\u201d from the Safe House menu. This will take you to the Select a Driver page. Choose a different Driver from the list. Do this by clicking the name and then clicking \u201cEnter NFS World.\u201d This will let you play the game as the new Driver you\u2019ve chosen. Restarting the Game Exit the game. There are two ways to swap drivers in NFS World. The first is totally restarting the game. To do this, exit the game, and you can do this three ways too:\nThe first way is to press Esc to bring up the Options menu and then select \u201cExit Game.\u201d\nThe second way to exit the game is to press the Alt key together with F4. You will exit the game automatically. The third way to exit the game is by pressing the Windows key on your keyboard to return to the Windows Desktop and then closing NFSW by right-clicking its icon on the taskbar and selecting \u201cClose.\u201d Launch Need for Speed World. You can launch the game from the Start menu or desktop, if you created a shortcut there during setup. Log into your account. Enter your username and password into the fields provided, and click \u201cSign in.\u201d\nAfter logging in, NFSW will initiate an update. As soon as NFSW has finished downloading and installing all the required updates from the Internet, a dialog box with a \u201cPlay\u201d button will appear. Select a new driver. Click on the \u201cPlay\u201d button, and press \u201cEnter\u201d or any other key to display your NFSW profile details. Here you can choose a different Driver from the list by clicking the name, and then clicking \u201cEnter NFS World.\u201d This will let you play the game as the new Driver you\u2019ve chosen. Need for Speed Hot Pursuit (PC) Press Esc during a race. This will open the game menu. Access the Driver Profile. Choose \u201cQuit Race\u201d from the menu. You will be taken to the Main Menu. Select \u201cOptions\u201d from the menu. Once in the Options menu, click the right arrow at the top till you arrive at the Driver Profile page. Here, the current Driver\u2019s username will be displayed. Select a new Driver. Click \u201cLoad Driver profile,\u201d and on the dialog box that appears, use the Left and Right Arrow keys to scroll the list of Available Driver names till the one you want is highlighted. Click \u201cOK\u201d to swap to that Driver. You will receive a confirmation that the new Driver\u2019s profile has been loaded. Exit the menu. Click the \u201cBack\u201d button at the bottom of the Driver Profile page to exit back to the Main Menu. You can now race using the new Driver name you selected!",
  "tyn_model":[
    "driver",
    "\u201d from",
    "\u201center",
    "\u201d button",
    "nfs world",
    "\u201d this",
    "\u201d\n",
    "\u201cplay",
    "\u201ch",
    "\u201d on",
    "\u201cchange",
    "\u201cexit",
    "\u201cclose",
    "\u201d launch",
    "need for speed world",
    "\u201csign",
    "\u201d or",
    "\u201cquit",
    "\u201coptions",
    "\u201cload",
    "\u201d and",
    "\u201cok",
    "\u201d to",
    "\u201cback"
  ],
  "tyn_section":[

  ]
}