{
  "title":"How to Make Red Velvet Cupcakes with Pancake Mix",
  "url":"https://www.wikihow.com/Make-Red-Velvet-Cupcakes-with-Pancake-Mix",
  "category_hierarchy":[
    "Food and Entertaining",
    "Recipes",
    "Baking",
    "Cakes",
    "Cupcakes"
  ],
  "parts":[
    {
      "name":"Making the Batter",
      "steps":[
        {
          "headline":"Preheat your oven to 375 F or 190 degrees C.",
          "description":""
        },
        {
          "headline":"Cream together the butter and sugar.",
          "description":"Use a fork or spoon to cream and stir the butter and sugar together in a bowl. Cream until sugar is blended in with the butter,"
        },
        {
          "headline":"Add the eggs.",
          "description":"Crack each egg into creamed mixture, one at a time. Stir and cream fast to beat the eggs apart. To make it easier, beat the eggs before adding them in the creamed mixture. This helps make the mixture easier to cream."
        },
        {
          "headline":"In a separate bowl whisk the food coloring and cocoa powder.",
          "description":"In a separate small, whisk the food coloring and cocoa powder together. Pour in the creamed mixture."
        },
        {
          "headline":"Add the rest of the ingredients.",
          "description":"Add the baking powder, baking soda, vanilla extract, and pancake mix in the batter. Stir well, getting all the pancake mix lumps away. Keep stirring until well mixed, the batter will be a bright red and should be batter-like. If it helps, use an electric or hand blender for easy mixing."
        }
      ]
    },
    {
      "name":"Baking the Cupcakes",
      "steps":[
        {
          "headline":"Scoop the cupcake batter in a cupcake tin.",
          "description":"Lay out a cupcake tin and place twelve or more muffin wrappers (depending on the size of the cupcake) in each hole. Scoop cupcake batter into each muffin wrapper. For easy scooping, use an ice cream scoop to scoop the batter easily into each hole."
        },
        {
          "headline":"Bake the cupcakes.",
          "description":"Have the cupcakes bake for about 12-20 minutes, depending on your oven. The cupcakes should rise and get puffy once they are ready. To test if cupcakes are ready, poke a toothpick in one of the cupcakes, If the toothpick comes out dry, the cupcakes are ready. If the toothpick comes out wet, have the cupcakes bake for an additional 5 minutes. Once the cupcakes are done baking have them cool."
        }
      ]
    },
    {
      "name":"Serving",
      "steps":[
        {
          "headline":"Frost the cupcakes.",
          "description":"These cupcakes are best with cream cheese frosting. Make a batch of frosting and spread them on top of the cupcakes."
        },
        {
          "headline":"Add additional toppings.",
          "description":"Cinnamon, heat shaped candies, fondant, and chopped strawberries on top help make the cupcakes look beautiful and look tastier."
        },
        {
          "headline":"Enjoy!",
          "description":""
        }
      ]
    }
  ],
  "text":" Making the Batter Preheat your oven to 375 F or 190 degrees C.  Cream together the butter and sugar. Use a fork or spoon to cream and stir the butter and sugar together in a bowl. Cream until sugar is blended in with the butter, Add the eggs. Crack each egg into creamed mixture, one at a time. Stir and cream fast to beat the eggs apart. To make it easier, beat the eggs before adding them in the creamed mixture. This helps make the mixture easier to cream. In a separate bowl whisk the food coloring and cocoa powder. In a separate small, whisk the food coloring and cocoa powder together. Pour in the creamed mixture. Add the rest of the ingredients. Add the baking powder, baking soda, vanilla extract, and pancake mix in the batter. Stir well, getting all the pancake mix lumps away. Keep stirring until well mixed, the batter will be a bright red and should be batter-like. If it helps, use an electric or hand blender for easy mixing. Baking the Cupcakes Scoop the cupcake batter in a cupcake tin. Lay out a cupcake tin and place twelve or more muffin wrappers (depending on the size of the cupcake) in each hole. Scoop cupcake batter into each muffin wrapper. For easy scooping, use an ice cream scoop to scoop the batter easily into each hole. Bake the cupcakes. Have the cupcakes bake for about 12-20 minutes, depending on your oven. The cupcakes should rise and get puffy once they are ready. To test if cupcakes are ready, poke a toothpick in one of the cupcakes, If the toothpick comes out dry, the cupcakes are ready. If the toothpick comes out wet, have the cupcakes bake for an additional 5 minutes. Once the cupcakes are done baking have them cool. Serving Frost the cupcakes. These cupcakes are best with cream cheese frosting. Make a batch of frosting and spread them on top of the cupcakes. Add additional toppings. Cinnamon, heat shaped candies, fondant, and chopped strawberries on top help make the cupcakes look beautiful and look tastier. Enjoy! ",
  "tyn_model":[
    "butter",
    "sugar",
    "eggs",
    "oven",
    "food coloring",
    "cocoa powder",
    "pancake mix",
    "cupcake batter",
    "cupcake tin",
    "fork or spoon",
    "bowl",
    "cream",
    "baking powder",
    "baking soda",
    "vanilla extract",
    "electric or hand blender",
    "ice cream scoop",
    "cream cheese",
    "frosting",
    "cinnamon",
    "fondant",
    "strawberries"
  ],
  "tyn_section":[

  ]
}