{
  "title":"How to Change Shop Hours in Animal Crossing: New Leaf",
  "url":"https://www.wikihow.com/Change-Shop-Hours-in-Animal-Crossing:-New-Leaf",
  "category_hierarchy":[
    "Hobbies and Crafts",
    "Games",
    "Video Games",
    "Nintendo Video Game Consoles",
    "Nintendo 3DS",
    "Animal Crossing: New Leaf"
  ],
  "parts":[
    {
      "name":"Raising the Approval Rating",
      "steps":[
        {
          "headline":"Check your approval rating.",
          "description":"Being able to alter store hours requires that you make an ordinance, but in order to make an ordinance, your approval rating must be 100%. To know what approval rating you currently have, journey to the Town Hall (the purple marker on the map at the bottom screen). Enter the Town Hall and sit in the mayor\u2019s chair located behind Isabelle\u2019s desk. Isabelle will approach you once you sit down, and speak to you, giving you a variety of dialogue options. Select \u201cCheck approval rating\u201d to see how the villagers view you. If it is not yet 100%, there are several things you can do to quickly reach the perfect goal. If it has, proceed to Part 2."
        },
        {
          "headline":"Perform actions worth 3 points.",
          "description":"There are several actions that can raise your approval rating by 3; however, you will only receive points the first time you do each action:\nChanging the town music\u2014Speak to Isabelle in the Town Hall. She will give you the option to change the town music, but only if your town is two in-game days old or more. Changing the town flag\u2014Speak to Isabelle in the Town Hall. Putting something up for sale at Re-tail\u2014Visiting Re-tail (the pink arrow icon on the map at the bottom of the screen), and talk to Reese, the pink alpaca. Posting something on the bulletin board\u2014Go to the bulletin board next to the train station (northernmost part of town) and hit \u201cA\u201d on your console, and then enter your message. Donating a fish, bug, or fossil to the museum\u2014This can be done after capturing a fish with the fishing rod, catching a bug with the net, or digging up a fossil with the shovel. Enter the museum, which is on the far left side of Main Street, and talk to Blathers."
        },
        {
          "headline":"Perform actions worth 1 point.",
          "description":"These actions can be repeated:\nRemoving trash from the water by fishing\u2014At times when you fish, rather than pulling up an animal, you will come up with a piece of junk, which can later be disposed of. Note that this is a random occurrence. Introducing yourself to villagers\u2014This can be done by approaching villagers and hitting the \u201cA\u201d button to converse with them. Sending letters\u2014Buy letter paper at the Nookling Junction. Open it in your inventory, enter a message, and send it by giving it to the duck working at the Post Office (found on the left hand side of Main Street). Pulling weeds\u2014This can be done by standing over weeds, which appear as brownish green sprouts of grass, and hitting the \u201cY\u201d button. Watering flowers\u2014This can only be done if you own a watering can, which can be purchased at the Nookling Junction. With the watering can equipped, stand in front of the flowers and hit the \u201cA\u201d button to water them."
        },
        {
          "headline":"Play Animal Crossing: New Leaf daily.",
          "description":"You will earn 3 extra points per day simply by playing."
        }
      ]
    },
    {
      "name":"Enacting the Ordinance",
      "steps":[
        {
          "headline":"Sit in the mayor\u2019s seat.",
          "description":"Once your approval rating has peaked, you will be able to enact four different ordinances, two of which alter the opening and closing times of shops, so go to the Town Hall and sit in the mayor\u2019s seat."
        },
        {
          "headline":"Talk to Isabelle.",
          "description":"Once you sit in the chair, Isabelle will approach and and ask you you if you want to enact an ordinance. Tell her yes."
        },
        {
          "headline":"Select an ordinance to enact.",
          "description":"You can choose either the \u201cEarly Bird Town\u201d or \u201cNightlife Town\u201d ordinance. The Early Bird Town ordinance will cause shops to open and close 3 hours earlier, and villagers to wake up and go to bed 3 hours earlier. The Nightlife Town ordinance will cause shops to open and close 3 hours later, and villagers to wake up and go to bed 3 hours later."
        },
        {
          "headline":"Pay for the ordinance.",
          "description":"After selecting your preferred ordinance, Isabelle will ask you to pay 20,000 bells; pay for it, and the new ordinance will go into effect the following day."
        }
      ]
    }
  ],
  "text":" Raising the Approval Rating Check your approval rating. Being able to alter store hours requires that you make an ordinance, but in order to make an ordinance, your approval rating must be 100%. To know what approval rating you currently have, journey to the Town Hall (the purple marker on the map at the bottom screen). Enter the Town Hall and sit in the mayor\u2019s chair located behind Isabelle\u2019s desk. Isabelle will approach you once you sit down, and speak to you, giving you a variety of dialogue options. Select \u201cCheck approval rating\u201d to see how the villagers view you. If it is not yet 100%, there are several things you can do to quickly reach the perfect goal. If it has, proceed to Part 2. Perform actions worth 3 points. There are several actions that can raise your approval rating by 3; however, you will only receive points the first time you do each action:\nChanging the town music\u2014Speak to Isabelle in the Town Hall. She will give you the option to change the town music, but only if your town is two in-game days old or more. Changing the town flag\u2014Speak to Isabelle in the Town Hall. Putting something up for sale at Re-tail\u2014Visiting Re-tail (the pink arrow icon on the map at the bottom of the screen), and talk to Reese, the pink alpaca. Posting something on the bulletin board\u2014Go to the bulletin board next to the train station (northernmost part of town) and hit \u201cA\u201d on your console, and then enter your message. Donating a fish, bug, or fossil to the museum\u2014This can be done after capturing a fish with the fishing rod, catching a bug with the net, or digging up a fossil with the shovel. Enter the museum, which is on the far left side of Main Street, and talk to Blathers. Perform actions worth 1 point. These actions can be repeated:\nRemoving trash from the water by fishing\u2014At times when you fish, rather than pulling up an animal, you will come up with a piece of junk, which can later be disposed of. Note that this is a random occurrence. Introducing yourself to villagers\u2014This can be done by approaching villagers and hitting the \u201cA\u201d button to converse with them. Sending letters\u2014Buy letter paper at the Nookling Junction. Open it in your inventory, enter a message, and send it by giving it to the duck working at the Post Office (found on the left hand side of Main Street). Pulling weeds\u2014This can be done by standing over weeds, which appear as brownish green sprouts of grass, and hitting the \u201cY\u201d button. Watering flowers\u2014This can only be done if you own a watering can, which can be purchased at the Nookling Junction. With the watering can equipped, stand in front of the flowers and hit the \u201cA\u201d button to water them. Play Animal Crossing: New Leaf daily. You will earn 3 extra points per day simply by playing. Enacting the Ordinance Sit in the mayor\u2019s seat. Once your approval rating has peaked, you will be able to enact four different ordinances, two of which alter the opening and closing times of shops, so go to the Town Hall and sit in the mayor\u2019s seat. Talk to Isabelle. Once you sit in the chair, Isabelle will approach and and ask you you if you want to enact an ordinance. Tell her yes. Select an ordinance to enact. You can choose either the \u201cEarly Bird Town\u201d or \u201cNightlife Town\u201d ordinance. The Early Bird Town ordinance will cause shops to open and close 3 hours earlier, and villagers to wake up and go to bed 3 hours earlier. The Nightlife Town ordinance will cause shops to open and close 3 hours later, and villagers to wake up and go to bed 3 hours later. Pay for the ordinance. After selecting your preferred ordinance, Isabelle will ask you to pay 20,000 bells; pay for it, and the new ordinance will go into effect the following day.",
  "tyn_model":[
    "\u2014this",
    "\u201ca",
    "fish",
    "\u201d button",
    "\u2014speak",
    "water",
    "\u201ccheck",
    "\u201d to",
    "\u2014visiting",
    "\u2014go",
    "\u201d on",
    "fishing rod",
    "net",
    "shovel",
    "fishing",
    "\u2014at",
    "\u2014buy",
    "letter paper",
    "\u201cy",
    "watering can",
    "animal crossing:",
    "\u201cearly",
    "\u201d or",
    "\u201cnightlife",
    "\u201d ordinance",
    "bells"
  ],
  "tyn_section":[

  ]
}