{
  "title":"How to Learn Emotions from Dr. Shrunk in Animal Crossing: New Leaf",
  "url":"https://www.wikihow.com/Learn-Emotions-from-Dr.-Shrunk-in-Animal-Crossing:-New-Leaf",
  "category_hierarchy":[
    "Hobbies and Crafts",
    "Games",
    "Video Games",
    "Nintendo Video Game Consoles",
    "Nintendo 3DS",
    "Animal Crossing: New Leaf"
  ],
  "parts":[
    {
      "name":"Upgrading the Nookling Junction",
      "steps":[
        {
          "headline":"Wait 10 days.",
          "description":"To get Dr. Shrunk\u2019s club, Club LOL, you must first upgrade Nookling Junction to T&T Mart, which can only be upgraded if you\u2019ve upgraded your tent to a house. Before you can do this, though, your town must be at least 10 days old. If you\u2019ve been playing the game for more than 10 days, proceed to Step 2."
        },
        {
          "headline":"Upgrade your tent.",
          "description":"Do this by giving Tom Nook a down payment of 10,000 bells. Your tent will upgrade to a house the next day."
        },
        {
          "headline":"Spend 12,000 bells at the Nookling Junction.",
          "description":"You can find Nookling Junction in Main Street. Once you\u2019ve spent 12,000 bells there, after completing all of the above requirements, Nookling Junction will close for a day of renovations. After this, it will reopen as the T&T Mart."
        }
      ]
    },
    {
      "name":"Raising Approval Rating",
      "steps":[
        {
          "headline":"Check your approval rating.",
          "description":"Before you can approve the construction of new stores, your approval rating must be 100%. To know how much approval rating you currently have, journey to the Town Hall (the purple marker on the map at the bottom screen). Enter the Town Hall and sit in the mayor\u2019s chair located behind Isabelle\u2019s desk. Isabelle will approach you once you sit down, and speak to you, giving you a variety of dialogue options. Select \u201cCheck approval rating\u201d to see how the villagers view you. If it is not yet 100%, there are several things you can do to quickly reach the perfect goal. If it has, proceed to Part 3."
        },
        {
          "headline":"Perform actions worth 3 points.",
          "description":"There are several actions that can raise your approval rating by 3; however, you will only receive points the first time you do the action:\nChanging the town music\u2014Speak to Isabelle in the Town Hall. She will give you the option to change the town music, but only if your town is two in-game days old or more. Changing the town flag\u2014Speak to Isabelle in the Town Hall. Putting something up for sale at Re-tail\u2014Visiting Re-tail (the pink arrow icon on the map at the bottom of the screen), and talk to Reese, the pink alpaca. Posting something on the bulletin board\u2014Go to the bulletin board next to the train station (northernmost part of town) and hit \u201cA\u201d on your console, and then enter your message. Donating a fish, bug, or fossil to the museum\u2014This can be done after capturing a fish with the fishing rod, catching a bug with the net, or digging up a fossil with the shovel. Enter the museum, which is on the far left side of Main Street, and talk to Blathers."
        },
        {
          "headline":"Perform actions worth 1 point.",
          "description":"These actions can be repeated:\nRemoving trash from the water by fishing\u2014At times when you fish, rather than pulling up an animal, you will come up with a piece of junk, which can later be disposed of. Note that this is a random occurrence. Introducing yourself to villagers\u2014This can be done by approaching villagers and hitting the \u201cA\u201d button to converse with them. Sending letters\u2014Buy letter paper at the Nookling Junction. Open it in your inventory, enter a message, and send it by giving it to the pelican working at the Post Office (found on the left hand side of Main Street). Pulling weeds\u2014This can be done by standing over weeds, which appear as brownish green sprouts of grass, and hitting the \u201cY\u201d button. Watering flowers\u2014This can only be done if you own a watering can, which can be purchased at the Nookling Junction. With the watering can equipped, stand in front of the flowers and hit the \u201cA\u201d button to water them."
        },
        {
          "headline":"Play Animal Crossing: New Leaf daily.",
          "description":"You will earn 3 extra points per day simply by playing."
        }
      ]
    },
    {
      "name":"Constructing Club LOL",
      "steps":[
        {
          "headline":"Talk to Dr. Shrunk.",
          "description":"The day after you completed the requirements mentioned in Parts 1 and 2, Dr. Shrunk will be waiting for you outside your house. He will inform you of what he wants to build and ask your permission for the construction. After giving him the OK, he will hand you a petition and request that you collect 6 signatures from your villagers. The petition is an item that cannot be dropped, put into storage, sold, or thrown away; you are stuck with it until you collect the correct amount of signatures."
        },
        {
          "headline":"Approach a villager.",
          "description":"Any villager will sign the petition, and they can be asked while wandering around town or while in their homes. When you find a villager, hit \u201cA\u201d to talk to them."
        },
        {
          "headline":"Get the villager to sign the petition.",
          "description":"One of the options that will pop up after the initial greetings is asking them to sign the petition; select that option, and the villager may sign the petition. Don't worry if they don't, sometimes this happens. Repeat steps 2 and 3 for the next 5 villagers."
        },
        {
          "headline":"Talk to Dr. Shrunk again.",
          "description":"Once you have collected all 6 signatures, go talk to Dr. Shrunk, who can be found walking around the Main Street in the shopping District, and give him the petition. Within the next 4 to 8 in-game days, Club LOL will begin its construction and open."
        }
      ]
    },
    {
      "name":"Learning Emotions from Dr. Shrunk",
      "steps":[
        {
          "headline":"Visit Dr. Shrunk, and bring with you a piece of fruit or a mushroom.",
          "description":"After Club LOL opens, pay Dr. Shrunk a visit during its daytime hours, 12 p.m. to 8 p.m. The club can be found on the left side of Main Street."
        },
        {
          "headline":"Talk to Dr. Shrunk.",
          "description":"Dr. Shrunk will thank you for helping with the construction of the club, and mention his ability to teach emotions. The first time you talk to Dr. Shrunk after his club opens, he will hand you a joke book, which contains all the emotions you learn."
        },
        {
          "headline":"Have him teach you an emotion.",
          "description":"If you brought a piece of fruit, when you talk to him, a \u201cI brought you a snack\u201d option will appear. Select this to give him the fruit, and in return, he will teach you an emotion. Right after the exchange, the new emotion will be accessible to the player. Only one emotion can be learned per day, and Dr. Shrunk can only teach them before 8 p.m. After 8, the club will become a dance floor. Shrunk will also accept mushrooms."
        },
        {
          "headline":"Perform the emotion.",
          "description":"Access the joke book by selecting the purple book button on the bottom of the screen. Click an emotion to have your character perform it. Some villagers may respond to emotions such as showmanship, disbelief, heartbreak, mischief, and more, while other emotions won't lead a reaction by villagers, like cold chill, daydreaming, and surprise."
        }
      ]
    }
  ],
  "text":" Upgrading the Nookling Junction Wait 10 days. To get Dr. Shrunk\u2019s club, Club LOL, you must first upgrade Nookling Junction to T&T Mart, which can only be upgraded if you\u2019ve upgraded your tent to a house. Before you can do this, though, your town must be at least 10 days old. If you\u2019ve been playing the game for more than 10 days, proceed to Step 2. Upgrade your tent. Do this by giving Tom Nook a down payment of 10,000 bells. Your tent will upgrade to a house the next day. Spend 12,000 bells at the Nookling Junction. You can find Nookling Junction in Main Street. Once you\u2019ve spent 12,000 bells there, after completing all of the above requirements, Nookling Junction will close for a day of renovations. After this, it will reopen as the T&T Mart. Raising Approval Rating Check your approval rating. Before you can approve the construction of new stores, your approval rating must be 100%. To know how much approval rating you currently have, journey to the Town Hall (the purple marker on the map at the bottom screen). Enter the Town Hall and sit in the mayor\u2019s chair located behind Isabelle\u2019s desk. Isabelle will approach you once you sit down, and speak to you, giving you a variety of dialogue options. Select \u201cCheck approval rating\u201d to see how the villagers view you. If it is not yet 100%, there are several things you can do to quickly reach the perfect goal. If it has, proceed to Part 3. Perform actions worth 3 points. There are several actions that can raise your approval rating by 3; however, you will only receive points the first time you do the action:\nChanging the town music\u2014Speak to Isabelle in the Town Hall. She will give you the option to change the town music, but only if your town is two in-game days old or more. Changing the town flag\u2014Speak to Isabelle in the Town Hall. Putting something up for sale at Re-tail\u2014Visiting Re-tail (the pink arrow icon on the map at the bottom of the screen), and talk to Reese, the pink alpaca. Posting something on the bulletin board\u2014Go to the bulletin board next to the train station (northernmost part of town) and hit \u201cA\u201d on your console, and then enter your message. Donating a fish, bug, or fossil to the museum\u2014This can be done after capturing a fish with the fishing rod, catching a bug with the net, or digging up a fossil with the shovel. Enter the museum, which is on the far left side of Main Street, and talk to Blathers. Perform actions worth 1 point. These actions can be repeated:\nRemoving trash from the water by fishing\u2014At times when you fish, rather than pulling up an animal, you will come up with a piece of junk, which can later be disposed of. Note that this is a random occurrence. Introducing yourself to villagers\u2014This can be done by approaching villagers and hitting the \u201cA\u201d button to converse with them. Sending letters\u2014Buy letter paper at the Nookling Junction. Open it in your inventory, enter a message, and send it by giving it to the pelican working at the Post Office (found on the left hand side of Main Street). Pulling weeds\u2014This can be done by standing over weeds, which appear as brownish green sprouts of grass, and hitting the \u201cY\u201d button. Watering flowers\u2014This can only be done if you own a watering can, which can be purchased at the Nookling Junction. With the watering can equipped, stand in front of the flowers and hit the \u201cA\u201d button to water them. Play Animal Crossing: New Leaf daily. You will earn 3 extra points per day simply by playing. Constructing Club LOL Talk to Dr. Shrunk. The day after you completed the requirements mentioned in Parts 1 and 2, Dr. Shrunk will be waiting for you outside your house. He will inform you of what he wants to build and ask your permission for the construction. After giving him the OK, he will hand you a petition and request that you collect 6 signatures from your villagers. The petition is an item that cannot be dropped, put into storage, sold, or thrown away; you are stuck with it until you collect the correct amount of signatures. Approach a villager. Any villager will sign the petition, and they can be asked while wandering around town or while in their homes. When you find a villager, hit \u201cA\u201d to talk to them. Get the villager to sign the petition. One of the options that will pop up after the initial greetings is asking them to sign the petition; select that option, and the villager may sign the petition. Don't worry if they don't, sometimes this happens. Repeat steps 2 and 3 for the next 5 villagers. Talk to Dr. Shrunk again. Once you have collected all 6 signatures, go talk to Dr. Shrunk, who can be found walking around the Main Street in the shopping District, and give him the petition. Within the next 4 to 8 in-game days, Club LOL will begin its construction and open. Learning Emotions from Dr. Shrunk Visit Dr. Shrunk, and bring with you a piece of fruit or a mushroom. After Club LOL opens, pay Dr. Shrunk a visit during its daytime hours, 12 p.m. to 8 p.m. The club can be found on the left side of Main Street. Talk to Dr. Shrunk. Dr. Shrunk will thank you for helping with the construction of the club, and mention his ability to teach emotions. The first time you talk to Dr. Shrunk after his club opens, he will hand you a joke book, which contains all the emotions you learn. Have him teach you an emotion. If you brought a piece of fruit, when you talk to him, a \u201cI brought you a snack\u201d option will appear. Select this to give him the fruit, and in return, he will teach you an emotion. Right after the exchange, the new emotion will be accessible to the player. Only one emotion can be learned per day, and Dr. Shrunk can only teach them before 8 p.m. After 8, the club will become a dance floor. Shrunk will also accept mushrooms. Perform the emotion. Access the joke book by selecting the purple book button on the bottom of the screen. Click an emotion to have your character perform it. Some villagers may respond to emotions such as showmanship, disbelief, heartbreak, mischief, and more, while other emotions won't lead a reaction by villagers, like cold chill, daydreaming, and surprise.",
  "tyn_model":[
    "\u201ca",
    "\u2014this",
    "\u201d button",
    "fruit",
    "tent",
    "\u201d to",
    "\u2014speak",
    "water",
    "bells",
    "\u201ccheck",
    "\u2014visiting",
    "\u2014go",
    "\u201d on",
    "fishing rod",
    "shovel",
    "fishing",
    "\u2014at",
    "fish",
    "\u2014buy",
    "letter paper",
    "\u201cy",
    "watering can",
    "animal crossing: new leaf",
    "petition",
    "mushroom",
    "\u201ci",
    "\u201d option",
    "mushrooms",
    "purple book",
    "cold chill"
  ],
  "tyn_section":[

  ]
}