{
  "title":"How to Clean a House to Help Prevent Illness",
  "url":"https://www.wikihow.com/Clean-a-House-to-Help-Prevent-Illness",
  "category_hierarchy":[
    "Home and Garden",
    "Housekeeping",
    "Cleaning",
    "House Cleaning"
  ],
  "methods":[
    {
      "name":"Kitchen",
      "steps":[
        {
          "headline":"The kitchen is probably the dirtiest room in the house.",
          "description":"Kitchen dirt is usually caused by meats and other raw foods brought into the kitchen."
        },
        {
          "headline":"Always use a cleaning solution, preferably one that is green, to help keep the kitchen clean.",
          "description":"Use a sponge to clean the kitchen or any other room of the house. Make sure to keep the sponge clean by either boiling it in water for 5 minutes, or running the sponge in the dishwasher cycle. Be sure to use the dishwasher's heat cycle to thoroughly sanitize the sponge."
        },
        {
          "headline":"Keep your cutting boards clean.",
          "description":""
        },
        {
          "headline":"Keep your kitchen sink clean.",
          "description":""
        },
        {
          "headline":"Wash your hands.",
          "description":"People do not wash their hands well enough to keep the germs at bay."
        },
        {
          "headline":"Use microfiber cloths, because you can clean with them; and then wash them in the washing machine.",
          "description":"They can also be bleached to help keep them really clean."
        },
        {
          "headline":"Use green cleaners that are lower in toxicity to reduce exposure to harsh chemicals.",
          "description":"One multi-purpose green cleaner is ionized acidic water from a water ionizer. When made at 2.7 pH, ionized acidic water has been lab tested and proven to kill E.choli and staph bacteria on contact. It is safe and effective on countertops, cutting boards, floors, glass, toilets, door handles and even on skin so no gloves or masks are needed. You can make it for pennies on the gallon by hooking a water ionizer up to your tap and filling a plastic spray bottle with it."
        }
      ]
    },
    {
      "name":"General Cleaning Tips",
      "steps":[
        {
          "headline":"Use microfiber cloths to clean glass and mirrors.",
          "description":"Dampen the cloth with water and start cleaning. This will help reduce the use of window cleaning products."
        },
        {
          "headline":"Remove shoes before entering the home to help reduce lead exposure.",
          "description":"Doing this may also help reduce exposure to pesticides, lawn and garden chemicals, allergens and dust mites."
        },
        {
          "headline":"Use mattress covers to help reduce exposure to dust mites.",
          "description":"This is helpful for kids with asthma or eczema. Dust mites lurk in mattresses and pillows"
        },
        {
          "headline":"Brush your pets to keep the fur from flying.",
          "description":"Pet dander is a great allergen."
        },
        {
          "headline":"Remove pet fur from couches and bedding.",
          "description":""
        },
        {
          "headline":"Use an air purifier if someone has allergies or asthma.",
          "description":""
        }
      ]
    }
  ],
  "text":" Kitchen The kitchen is probably the dirtiest room in the house. Kitchen dirt is usually caused by meats and other raw foods brought into the kitchen. Always use a cleaning solution, preferably one that is green, to help keep the kitchen clean. Use a sponge to clean the kitchen or any other room of the house. Make sure to keep the sponge clean by either boiling it in water for 5 minutes, or running the sponge in the dishwasher cycle. Be sure to use the dishwasher's heat cycle to thoroughly sanitize the sponge. Keep your cutting boards clean.  Keep your kitchen sink clean.  Wash your hands. People do not wash their hands well enough to keep the germs at bay. Use microfiber cloths, because you can clean with them; and then wash them in the washing machine. They can also be bleached to help keep them really clean. Use green cleaners that are lower in toxicity to reduce exposure to harsh chemicals. One multi-purpose green cleaner is ionized acidic water from a water ionizer. When made at 2.7 pH, ionized acidic water has been lab tested and proven to kill E.choli and staph bacteria on contact. It is safe and effective on countertops, cutting boards, floors, glass, toilets, door handles and even on skin so no gloves or masks are needed. You can make it for pennies on the gallon by hooking a water ionizer up to your tap and filling a plastic spray bottle with it. General Cleaning Tips Use microfiber cloths to clean glass and mirrors. Dampen the cloth with water and start cleaning. This will help reduce the use of window cleaning products. Remove shoes before entering the home to help reduce lead exposure. Doing this may also help reduce exposure to pesticides, lawn and garden chemicals, allergens and dust mites. Use mattress covers to help reduce exposure to dust mites. This is helpful for kids with asthma or eczema. Dust mites lurk in mattresses and pillows Brush your pets to keep the fur from flying. Pet dander is a great allergen. Remove pet fur from couches and bedding.  Use an air purifier if someone has allergies or asthma. ",
  "tyn_model":[
    "sponge",
    "water",
    "microfiber cloths",
    "water ionizer",
    "dishwasher's",
    "acidic water",
    "air purifier"
  ],
  "tyn_section":[

  ]
}