{
  "title":"How to Tidy in an Organized Way",
  "url":"https://www.wikihow.com/Tidy-in-an-Organized-Way",
  "category_hierarchy":[
    "Home and Garden",
    "Housekeeping",
    "Cleaning"
  ],
  "parts":[
    {
      "name":"Prepare",
      "steps":[
        {
          "headline":"First of all, assess your task.",
          "description":"What do you need to clean? Is it just a desk space, or is it multiple rooms? This can help you figure out how to plan your tidy-ing, like how much time you need."
        },
        {
          "headline":"If you have a large space, it's good to map it out and tackle each part in sections.",
          "description":"For example, if you're cleaning your room, then you could separate it into desk, closet, bookshelf, bed and dresser. Also, if you have a messy floor, you should add that as a part to clean, too."
        },
        {
          "headline":"Get together any supplies you need while you clean.",
          "description":"If you're doing a bathroom deep-clean, you'll need cleaning tools like spray cleaner and a sponge. If your room is dusty, then you'll need a broom or a vacuum cleaner. If there's something you enjoy doing while you work that calms you down or lets you have fun while working, like music, then set it up. Whatever you do should not distract you from the task ahead."
        },
        {
          "headline":"Plan out your time.",
          "description":"Decide how much time you need to spend cleaning, out of the time you have free. I'd suggest to try to get the job done in a day, because if you stretch it out for a long time chances are you'll forget about it eventually. Breaks should be placed in between work periods, and should be about 15 minutes long. Work periods should be 30 minutes to an hour long."
        },
        {
          "headline":"Take a deep breath.",
          "description":"You're ready to start."
        }
      ]
    },
    {
      "name":"Clean",
      "steps":[
        {
          "headline":"Turn some music and get yourself pumped.",
          "description":"After a minute or so, start on a task that is pretty easy to get yourself started. For example, if your bed isn't made, do that first."
        },
        {
          "headline":"Now, get moving with a more difficult task.",
          "description":"As you do tasks, try to clean up each area well instead of pushing the mess into another area. If you do that, the mess will be infinite."
        },
        {
          "headline":"Continue with each task.",
          "description":"Take breaks every once in a while, but don't make them too long. Keep yourself well fed so that you don't lose energy while cleaning. try to alternate from a hard cleaning task to an easy one. When you finish each task, cross it of a checklist or off of your map. If you want to move furniture around, feel free, because that can make room for other furniture, like a cozy reading corner or a window seat."
        }
      ]
    },
    {
      "name":"Afterwards",
      "steps":[
        {
          "headline":"Congratulations!",
          "description":"Hopefully, you've finished, and most likely, it was worth it!"
        },
        {
          "headline":"Open your curtains/blinds and let sunlight shine on your new tidy room.",
          "description":"It will feel good."
        },
        {
          "headline":"Do something fun in the room to enjoy the fact that it's clean!",
          "description":"But don't forget to clean up after yourself."
        }
      ]
    }
  ],
  "text":" Prepare First of all, assess your task. What do you need to clean? Is it just a desk space, or is it multiple rooms? This can help you figure out how to plan your tidy-ing, like how much time you need. If you have a large space, it's good to map it out and tackle each part in sections. For example, if you're cleaning your room, then you could separate it into desk, closet, bookshelf, bed and dresser. Also, if you have a messy floor, you should add that as a part to clean, too. Get together any supplies you need while you clean. If you're doing a bathroom deep-clean, you'll need cleaning tools like spray cleaner and a sponge. If your room is dusty, then you'll need a broom or a vacuum cleaner. If there's something you enjoy doing while you work that calms you down or lets you have fun while working, like music, then set it up. Whatever you do should not distract you from the task ahead. Plan out your time. Decide how much time you need to spend cleaning, out of the time you have free. I'd suggest to try to get the job done in a day, because if you stretch it out for a long time chances are you'll forget about it eventually. Breaks should be placed in between work periods, and should be about 15 minutes long. Work periods should be 30 minutes to an hour long. Take a deep breath. You're ready to start. Clean Turn some music and get yourself pumped. After a minute or so, start on a task that is pretty easy to get yourself started. For example, if your bed isn't made, do that first. Now, get moving with a more difficult task. As you do tasks, try to clean up each area well instead of pushing the mess into another area. If you do that, the mess will be infinite. Continue with each task. Take breaks every once in a while, but don't make them too long. Keep yourself well fed so that you don't lose energy while cleaning. try to alternate from a hard cleaning task to an easy one. When you finish each task, cross it of a checklist or off of your map. If you want to move furniture around, feel free, because that can make room for other furniture, like a cozy reading corner or a window seat. Afterwards Congratulations! Hopefully, you've finished, and most likely, it was worth it! Open your curtains/blinds and let sunlight shine on your new tidy room. It will feel good. Do something fun in the room to enjoy the fact that it's clean! But don't forget to clean up after yourself.",
  "tyn_model":[
    "spray cleaner",
    "sponge",
    "broom",
    "vacuum cleaner",
    "music",
    "window seat"
  ],
  "tyn_section":[

  ]
}