{
  "title":"How to Delete Buildings in Age of Empires",
  "url":"https://www.wikihow.com/Delete-Buildings-in-Age-of-Empires",
  "category_hierarchy":[
    "Hobbies and Crafts",
    "Games",
    "Video Games",
    "PC Games"
  ],
  "methods":[
    {
      "name":"Deleting Buildings in Age of Empires 3 and Age of Empires 3: The WarChiefs",
      "steps":[
        {
          "headline":"Start the game.",
          "description":"This can be done either by double-clicking the AoE3: The Warchiefs shortcut icon on the desktop, if it\u2019s there, or by following this Start Menu sequence: Start button >> All Programs >> Microsoft Games >> Age of Empires III - The Warchiefs. For AoE3, the sequence is: Start button >> All Programs >> Microsoft Games >> Age of Empires III."
        },
        {
          "headline":"Open the Main Menu.",
          "description":"Press the Spacebar repeatedly to skip through the pre-game cinematics and display the Main Menu."
        },
        {
          "headline":"Enter into the game world.",
          "description":"You can do this by loading a previously saved game by clicking \u201cSingle Player,\u201d then \u201cSaved Game,\u201d and then double-clicking the game from the saved games list. If you want to start a totally new game, click \u201cSkirmish,\u201d select your preferred Home City from the list, and then click \u201cPlay.\u201d"
        },
        {
          "headline":"Select a building you want to delete.",
          "description":"You can achieve this by left-clicking building you want to delete. You can select more than one building by holding the Ctrl key, and left-clicking each building you want to delete. You can also select a building by pressing its hotkey. Different buildings have different hotkeys that can be used to select them, e.g., \u201cT\u201d for Town Center and \u201cControl+B\u201d for Barracks."
        },
        {
          "headline":"Delete the building.",
          "description":"Once you\u2019ve selected the building, hit Delete on your keyboard. A Yes-No confirmation dialog box will pop up. Click \u201cYes\u201d to confirm. You can also delete a building by clicking the delete icon in the building's info panel on the bottom right corner of the screen (the delete icon is a small square icon with a skull on it) after you\u2019ve selected the building. Click \u201cYes\u201d in the confirmation pop-up to remove the building."
        }
      ]
    },
    {
      "name":"Delete Buildings in Age of Empires II: The Age of Kings",
      "steps":[
        {
          "headline":"Start the game.",
          "description":"This can be done either by double-clicking the AoE2: Age of Kings shortcut icon on the desktop, if it\u2019s there, or by following this Start Menu sequence: Start button >> All Programs >> Microsoft Games >> Age of Empires II - Age of Kings. #Open the Main Menu. Press Enter repeatedly to skip through the pre-game cinematics and display the Main Menu."
        },
        {
          "headline":"Enter into the game world.",
          "description":"Load a previously saved game by clicking \u201cSingle Player,\u201d \u201cSaved Game,\u201d and then double-clicking on the game from the saved games list. You can also start an entirely new game by clicking \u201cRandom Map.\u201d Select your preferred Civilization from the list, and then click \u201cPlay.\u201d"
        },
        {
          "headline":"Select the building to delete.",
          "description":"Do this by left-clicking the building you want to remove. Alternatively, you can press the building\u2019s hotkey. Different buildings have different hotkeys that can be used to select them, e.g., T for Town Center and Control+B for Barracks."
        },
        {
          "headline":"Delete the building.",
          "description":"Just hit Delete on your keyboard. Note that in AoE2, no confirmation dialog box will appear, so make sure you really want to delete that particular building, because once you press Delete, it\u2019s gone. In AoE2, you cannot delete multiple buildings at the same time, and neither can you use the mouse as there is no delete icon you can click in the game."
        }
      ]
    }
  ],
  "text":" Deleting Buildings in Age of Empires 3 and Age of Empires 3: The WarChiefs Start the game. This can be done either by double-clicking the AoE3: The Warchiefs shortcut icon on the desktop, if it\u2019s there, or by following this Start Menu sequence: Start button >> All Programs >> Microsoft Games >> Age of Empires III - The Warchiefs. For AoE3, the sequence is: Start button >> All Programs >> Microsoft Games >> Age of Empires III. Open the Main Menu. Press the Spacebar repeatedly to skip through the pre-game cinematics and display the Main Menu. Enter into the game world. You can do this by loading a previously saved game by clicking \u201cSingle Player,\u201d then \u201cSaved Game,\u201d and then double-clicking the game from the saved games list. If you want to start a totally new game, click \u201cSkirmish,\u201d select your preferred Home City from the list, and then click \u201cPlay.\u201d Select a building you want to delete. You can achieve this by left-clicking building you want to delete. You can select more than one building by holding the Ctrl key, and left-clicking each building you want to delete. You can also select a building by pressing its hotkey. Different buildings have different hotkeys that can be used to select them, e.g., \u201cT\u201d for Town Center and \u201cControl+B\u201d for Barracks. Delete the building. Once you\u2019ve selected the building, hit Delete on your keyboard. A Yes-No confirmation dialog box will pop up. Click \u201cYes\u201d to confirm. You can also delete a building by clicking the delete icon in the building's info panel on the bottom right corner of the screen (the delete icon is a small square icon with a skull on it) after you\u2019ve selected the building. Click \u201cYes\u201d in the confirmation pop-up to remove the building. Delete Buildings in Age of Empires II: The Age of Kings Start the game. This can be done either by double-clicking the AoE2: Age of Kings shortcut icon on the desktop, if it\u2019s there, or by following this Start Menu sequence: Start button >> All Programs >> Microsoft Games >> Age of Empires II - Age of Kings. #Open the Main Menu. Press Enter repeatedly to skip through the pre-game cinematics and display the Main Menu. Enter into the game world. Load a previously saved game by clicking \u201cSingle Player,\u201d \u201cSaved Game,\u201d and then double-clicking on the game from the saved games list. You can also start an entirely new game by clicking \u201cRandom Map.\u201d Select your preferred Civilization from the list, and then click \u201cPlay.\u201d Select the building to delete. Do this by left-clicking the building you want to remove. Alternatively, you can press the building\u2019s hotkey. Different buildings have different hotkeys that can be used to select them, e.g., T for Town Center and Control+B for Barracks. Delete the building. Just hit Delete on your keyboard. Note that in AoE2, no confirmation dialog box will appear, so make sure you really want to delete that particular building, because once you press Delete, it\u2019s gone. In AoE2, you cannot delete multiple buildings at the same time, and neither can you use the mouse as there is no delete icon you can click in the game.",
  "tyn_model":[
    "\u201d select",
    "\u201csingle",
    "\u201d and",
    "\u201cplay",
    "\u201d for",
    "\u201cyes",
    "\u201d then",
    "\u201csaved",
    "\u201cskirmish",
    "\u201ct",
    "\u201ccontrol+b",
    "\u201d to",
    "\u201d in",
    "age of empires ii",
    "\u201d \u201c",
    "\u201crandom",
    "mouse"
  ],
  "tyn_section":[

  ]
}