{
  "title":"How to Connect the Nintendo Wii to Wi\u2013Fi",
  "url":"https://www.wikihow.com/Connect-the-Nintendo-Wii-to-Wi%E2%80%93Fi",
  "category_hierarchy":[
    "Hobbies and Crafts",
    "Games",
    "Video Games",
    "Nintendo Video Game Consoles",
    "Nintendo Wii"
  ],
  "parts":[
    {
      "name":"Connecting the Wii to Wi-Fi",
      "steps":[
        {
          "headline":"Power on your Nintendo Wii console and press the \u201cA\u201d button on your Wii remote.",
          "description":"This will bring up the Wii main menu."
        },
        {
          "headline":"Select the \u201cWii\u201d button located in the lower left corner of the screen, then select \u201cWii Settings.\u201d",
          "description":""
        },
        {
          "headline":"Select the arrow displayed on the right side of your screen.",
          "description":"This will access page two of Wii System Settings."
        },
        {
          "headline":"Select \u201cInternet,\u201d then select \u201cConnection Settings.\u201d",
          "description":""
        },
        {
          "headline":"Select \u201cConnection 1: None,\u201d or another empty connection slot.",
          "description":"If all connection slots are being used, select the connection slot you want cleared, then select \u201cClear settings.\u201d Your Wii cannot connect to Wi-Fi unless you use an empty connection slot."
        },
        {
          "headline":"Select \u201cWireless Connection,\u201d then select \u201cSearch for an Access Point.\u201d",
          "description":""
        },
        {
          "headline":"Select \u201cOK.\u201d Your Wii will scan for all nearby Wi-Fi networks, and display the list of networks on-screen.",
          "description":""
        },
        {
          "headline":"Select the wireless network to which you want to connect, then enter the network password or security key, if applicable.",
          "description":"If you do not know the network password, try contacting the network administrator, enter the value displayed next to \u201csecurity key\u201d on your router, or contact the router\u2019s manufacturer to obtain the default password."
        },
        {
          "headline":"Select \u201cOK\u201d three times at each subsequent prompt.",
          "description":"This will save your wireless network settings and test the Internet connection."
        },
        {
          "headline":"Select \u201cYes\u201d when your Wii displays a message saying the connection test was successful.",
          "description":"Your Wii will now be connected to the Wi-Fi network selected."
        }
      ]
    },
    {
      "name":"Troubleshooting Wii Wi-Fi Connectivity",
      "steps":[
        {
          "headline":"Try re-entering the router\u2019s security code if you receive error codes 51330 or 52130 after testing the Internet connection.",
          "description":"These errors mean the router security code you\u2019ve entered is incorrect."
        },
        {
          "headline":"Try powercycling or resetting your Wi-Fi router if your Wii is still unable to connect to the Internet after entering the correct security code.",
          "description":"Powercycling the router can help refresh the network connection, whereas resetting your router will restore the router\u2019s default factory settings and reset its username and password. Most brands of routers can be reset by pressing the \u201cReset\u201d button on the front, back, or side of your router."
        },
        {
          "headline":"Close out applications or shut down devices that may be using an excessive amount of bandwidth on your network if your Wii is unable to connect to the Internet or experiences slowness.",
          "description":"Certain applications and behaviors, such as downloading large files, may interfere with your being able to connect the Wii to Wi-Fi."
        },
        {
          "headline":"Try relocating furniture and metal objects away from your router and Nintendo Wii if you are unable to establish or maintain an Internet connection.",
          "description":"In many cases, metal objects such as filing cabinets and electronic devices such as cordless phones can interfere with your Wi-Fi signal."
        },
        {
          "headline":"Contact Nintendo\u2019s customer support team at 1-800-255-3700 if you are still unable to connect to Wi-Fi using your Wii console.",
          "description":"Nintendo will guide you through additional troubleshooting, and may walk you through changing additional settings on the console. Nintendo\u2019s customer support team is available between the hours of 6 a.m. and 7 p.m. Pacific Time, seven days per week. Alternately, navigate to Nintendo\u2019s chat service at http://www.nintendo.com/consumer/assets/chat/chatPop.jsp?type=wifi&system=Wii&data1=, and fill out the required fields to chat with an agent from Nintendo."
        }
      ]
    }
  ],
  "text":" Connecting the Wii to Wi-Fi Power on your Nintendo Wii console and press the \u201cA\u201d button on your Wii remote. This will bring up the Wii main menu. Select the \u201cWii\u201d button located in the lower left corner of the screen, then select \u201cWii Settings.\u201d  Select the arrow displayed on the right side of your screen. This will access page two of Wii System Settings. Select \u201cInternet,\u201d then select \u201cConnection Settings.\u201d  Select \u201cConnection 1: None,\u201d or another empty connection slot. If all connection slots are being used, select the connection slot you want cleared, then select \u201cClear settings.\u201d Your Wii cannot connect to Wi-Fi unless you use an empty connection slot. Select \u201cWireless Connection,\u201d then select \u201cSearch for an Access Point.\u201d  Select \u201cOK.\u201d Your Wii will scan for all nearby Wi-Fi networks, and display the list of networks on-screen.  Select the wireless network to which you want to connect, then enter the network password or security key, if applicable. If you do not know the network password, try contacting the network administrator, enter the value displayed next to \u201csecurity key\u201d on your router, or contact the router\u2019s manufacturer to obtain the default password. Select \u201cOK\u201d three times at each subsequent prompt. This will save your wireless network settings and test the Internet connection. Select \u201cYes\u201d when your Wii displays a message saying the connection test was successful. Your Wii will now be connected to the Wi-Fi network selected. Troubleshooting Wii Wi-Fi Connectivity Try re-entering the router\u2019s security code if you receive error codes 51330 or 52130 after testing the Internet connection. These errors mean the router security code you\u2019ve entered is incorrect. Try powercycling or resetting your Wi-Fi router if your Wii is still unable to connect to the Internet after entering the correct security code. Powercycling the router can help refresh the network connection, whereas resetting your router will restore the router\u2019s default factory settings and reset its username and password. Most brands of routers can be reset by pressing the \u201cReset\u201d button on the front, back, or side of your router. Close out applications or shut down devices that may be using an excessive amount of bandwidth on your network if your Wii is unable to connect to the Internet or experiences slowness. Certain applications and behaviors, such as downloading large files, may interfere with your being able to connect the Wii to Wi-Fi. Try relocating furniture and metal objects away from your router and Nintendo Wii if you are unable to establish or maintain an Internet connection. In many cases, metal objects such as filing cabinets and electronic devices such as cordless phones can interfere with your Wi-Fi signal. Contact Nintendo\u2019s customer support team at 1-800-255-3700 if you are still unable to connect to Wi-Fi using your Wii console. Nintendo will guide you through additional troubleshooting, and may walk you through changing additional settings on the console. Nintendo\u2019s customer support team is available between the hours of 6 a.m. and 7 p.m. Pacific Time, seven days per week. Alternately, navigate to Nintendo\u2019s chat service at http://www.nintendo.com/consumer/assets/chat/chatPop.jsp?type=wifi&system=Wii&data1=, and fill out the required fields to chat with an agent from Nintendo.",
  "tyn_model":[
    "router",
    "wii",
    "\u201d button",
    "\u201d  ",
    "\u201cwii",
    "\u201d then",
    "\u201cconnection",
    "\u201d your",
    "\u201cok",
    "nintendo",
    "nintendo wii console",
    "\u201ca",
    "wii remote",
    "wii system settings",
    "\u201cinternet",
    "\u201d or",
    "\u201cclear",
    "\u201cwireless",
    "\u201csearch",
    "wi-fi networks",
    "\u201csecurity",
    "\u201d on",
    "\u201d three",
    "wireless network settings",
    "\u201cyes",
    "\u201d when",
    "wi-fi network",
    "wi-fi router",
    "routers",
    "\u201creset",
    "nintendo wii"
  ],
  "tyn_section":[

  ]
}