{
  "title":"How to Manage Your Preferences on Your Xbox One",
  "url":"https://www.wikihow.com/Manage-Your-Preferences-on-Your-Xbox-One",
  "category_hierarchy":[
    "Hobbies and Crafts",
    "Games",
    "Video Games",
    "Xbox",
    "Xbox One"
  ],
  "methods":[
    {
      "name":"Managing Your Preferences from the Xbox One Console",
      "steps":[
        {
          "headline":"Go to My Games and Apps.",
          "description":"Look at your Xbox One dashboard for the button that says \u201cMy Games and Apps\u201d; select it with the A button. Your screen will change to your apps and settings."
        },
        {
          "headline":"Go under the \u201cApps\u201d tab on the left side of the screen.",
          "description":"This will list your apps on the right side of the page."
        },
        {
          "headline":"Open the Settings menu.",
          "description":"Scroll over until you see a gear icon with the word \u201cSettings\u201d inside it. Tap the A button on it to open your Xbox One settings."
        },
        {
          "headline":"Click the \u201cPreferences\u201d button on the top right side of the page.",
          "description":"This is where you will find your preferences for your Xbox One."
        },
        {
          "headline":"Set Notifications.",
          "description":"Select the drop box that says \u201c Show Notifications,\u201d  and set it to ON if you want to get your notifications to pop up on your Xbox One. Your notifications will include things like messages, friend requests, and so on. Allow Skype to stay on while you\u2019re playing by clicking the Skype box. This is great for communicating with friends across consoles. Press the A button on Messages box if you want to get notified when new messages come to your account. This is especially useful if you are looking to hear from a friend about a game that you are playing. Selecting the Party option and picking \u201cYes\u201d or \u201cNo\u201d will allow you to get party notifications. It will tell you when someone leaves or joins the party. \u201cSign In and Broadcasts\u201d is the final notification box. You can set your system to let you know when favorites, all friends, or no friends sign on. All you need to do is hit the A button on the box and pick your preference."
        },
        {
          "headline":"Pick your Systems and App settings in the middle column.",
          "description":"You can Allow the following for your systems and apps:\n\u201cPlay for streaming,\u201d which allows you to stream directly from apps such as Netflix and Hulu. \u201cAllow broadcasts,\u201d which lets you broadcast from Twitch. This is basically a parental feature. \u201cAllow streaming from other devices,\u201d which lets you stream what you are doing in your games from apps such as SmartGlass. All three options have check boxes. Select the ones you want to use by hitting the A button over the box by each option until you see a checkmark inside. You are able to pick all three if you want them to all be active at once. Essentially, they are for either parental control or data conservation."
        },
        {
          "headline":"Enable Smartglass.",
          "description":"Select your final option, which is how your Xbox One handles Smartglass. Smartglass is a mobile app that interacts with your Xbox. You can choose between \u201cDo not allow,\u201d \u201cAllow select devices,\u201d and \u201cAllow all devices.\u201d Press the A button by the option that you choose to allow for your Smartglass."
        }
      ]
    },
    {
      "name":"Managing Your Xbox Preferences from a Windows 10 Computer",
      "steps":[
        {
          "headline":"Open the All Apps menu.",
          "description":"Click the Start menu on the bottom left side of the screen, and from the list of programs and options, select \u201cAll Apps.\u201d All the apps on your computer will be listed in alphabetical order."
        },
        {
          "headline":"Select Xbox.",
          "description":"Scroll down to the letter \u201cX\u201d and you will see the green Xbox app. Select it by clicking on it."
        },
        {
          "headline":"Log into your Microsoft account.",
          "description":"Do this by entering your email address and password on the login screen. Right-click the login button to load your account."
        },
        {
          "headline":"Open the menu.",
          "description":"Click the box with 3 lines in it on the top left side of your Xbox app. You will see a list of options that you can click on."
        },
        {
          "headline":"Select the Settings box at the bottom of the menu under the box with three lines.",
          "description":"Your Xbox settings will load on the screen where you can adjust Xbox preferences. On Windows 10, the options for preferences are limited; you can only adjust notification preferences for your Xbox."
        },
        {
          "headline":"Adjust Favorites notifications.",
          "description":"Look under the top section that reads \u201cNotifications.\u201d The first box says \u201cFavorites Online\u201d with a checkbox by it. If you click this check box, your favorite friends will show up on your screen when they sign in."
        },
        {
          "headline":"Set Twitch broadcast notifications.",
          "description":"Select the checkbox right below that which says \u201cTwitch Broadcast Started\u201d if you want to see when your friends are broadcasting on Twitch. This is great if you do not have the time to monitor your Twitch or friends list."
        },
        {
          "headline":"Turn on Messages notifications.",
          "description":"Click the third check box that reads \u201cMessages\u201d if you want to get an Xbox One notification when someone sends you a message."
        }
      ]
    }
  ],
  "text":" Managing Your Preferences from the Xbox One Console Go to My Games and Apps. Look at your Xbox One dashboard for the button that says \u201cMy Games and Apps\u201d; select it with the A button. Your screen will change to your apps and settings. Go under the \u201cApps\u201d tab on the left side of the screen. This will list your apps on the right side of the page. Open the Settings menu. Scroll over until you see a gear icon with the word \u201cSettings\u201d inside it. Tap the A button on it to open your Xbox One settings. Click the \u201cPreferences\u201d button on the top right side of the page. This is where you will find your preferences for your Xbox One. Set Notifications. Select the drop box that says \u201c Show Notifications,\u201d  and set it to ON if you want to get your notifications to pop up on your Xbox One. Your notifications will include things like messages, friend requests, and so on. Allow Skype to stay on while you\u2019re playing by clicking the Skype box. This is great for communicating with friends across consoles. Press the A button on Messages box if you want to get notified when new messages come to your account. This is especially useful if you are looking to hear from a friend about a game that you are playing. Selecting the Party option and picking \u201cYes\u201d or \u201cNo\u201d will allow you to get party notifications. It will tell you when someone leaves or joins the party. \u201cSign In and Broadcasts\u201d is the final notification box. You can set your system to let you know when favorites, all friends, or no friends sign on. All you need to do is hit the A button on the box and pick your preference. Pick your Systems and App settings in the middle column. You can Allow the following for your systems and apps:\n\u201cPlay for streaming,\u201d which allows you to stream directly from apps such as Netflix and Hulu. \u201cAllow broadcasts,\u201d which lets you broadcast from Twitch. This is basically a parental feature. \u201cAllow streaming from other devices,\u201d which lets you stream what you are doing in your games from apps such as SmartGlass. All three options have check boxes. Select the ones you want to use by hitting the A button over the box by each option until you see a checkmark inside. You are able to pick all three if you want them to all be active at once. Essentially, they are for either parental control or data conservation. Enable Smartglass. Select your final option, which is how your Xbox One handles Smartglass. Smartglass is a mobile app that interacts with your Xbox. You can choose between \u201cDo not allow,\u201d \u201cAllow select devices,\u201d and \u201cAllow all devices.\u201d Press the A button by the option that you choose to allow for your Smartglass. Managing Your Xbox Preferences from a Windows 10 Computer Open the All Apps menu. Click the Start menu on the bottom left side of the screen, and from the list of programs and options, select \u201cAll Apps.\u201d All the apps on your computer will be listed in alphabetical order. Select Xbox. Scroll down to the letter \u201cX\u201d and you will see the green Xbox app. Select it by clicking on it. Log into your Microsoft account. Do this by entering your email address and password on the login screen. Right-click the login button to load your account. Open the menu. Click the box with 3 lines in it on the top left side of your Xbox app. You will see a list of options that you can click on. Select the Settings box at the bottom of the menu under the box with three lines. Your Xbox settings will load on the screen where you can adjust Xbox preferences. On Windows 10, the options for preferences are limited; you can only adjust notification preferences for your Xbox. Adjust Favorites notifications. Look under the top section that reads \u201cNotifications.\u201d The first box says \u201cFavorites Online\u201d with a checkbox by it. If you click this check box, your favorite friends will show up on your screen when they sign in. Set Twitch broadcast notifications. Select the checkbox right below that which says \u201cTwitch Broadcast Started\u201d if you want to see when your friends are broadcasting on Twitch. This is great if you do not have the time to monitor your Twitch or friends list. Turn on Messages notifications. Click the third check box that reads \u201cMessages\u201d if you want to get an Xbox One notification when someone sends you a message.",
  "tyn_model":[
    "xbox one",
    "\u201d which",
    "\u201callow",
    "xbox",
    "skype",
    "\u201d and",
    "\u201d if",
    "xbox one console",
    "xbox one dashboard",
    "\u201cmy",
    "\u201d;",
    "\u201capps",
    "\u201d tab",
    "\u201csettings",
    "\u201d inside",
    "\u201cpreferences",
    "\u201d button",
    "\u201c show",
    "\u201d  ",
    "\u201cyes",
    "\u201d or",
    "\u201cno",
    "\u201d will",
    "\u201csign",
    "\u201d is",
    "\u201cplay",
    "hulu",
    "\u201cdo",
    "\u201d \u201c",
    "\u201d press",
    "\u201call",
    "\u201d all",
    "\u201cx",
    "xbox app",
    "xbox settings",
    "\u201cnotifications",
    "\u201d the",
    "\u201cfavorites",
    "\u201d with",
    "\u201ctwitch",
    "\u201cmessages"
  ],
  "tyn_section":[

  ]
}