{
  "title":"How to Play Bike Dash",
  "url":"https://www.wikihow.com/Play-Bike-Dash",
  "category_hierarchy":[
    "Hobbies and Crafts",
    "Games",
    "Video Games"
  ],
  "methods":[
    {
      "name":"Customizing or Upgrading Elements",
      "steps":[
        {
          "headline":"Launch the game.",
          "description":"Bike Dash if available on iOS and Android. Download it from your device's app store. After it's installed, locate its icon (a biker) and tap to launch the game."
        },
        {
          "headline":"Select a bike.",
          "description":"Tap the bike icon on the main screen's menu bar. Your currently equipped bike and all the other available bikes in the game will be listed. Each of the bikes has different abilities that can change your bike run and jumps. The bikes aren't free, and you have to pay in coins to acquire and equip them. The prices are displayed right beside the bikes. Tap the one you'd like to equip."
        },
        {
          "headline":"Select clothing.",
          "description":"You can customize the way your biker looks in the game, from his headgear, top, and pants. To do this, tap the clothes icon at the top. The different clothes have different abilities or bonuses when used. These aren't free and you have to pay in coins to wear them. The prices are displayed right beside the clothes. Tap the ones you'd like to wear."
        },
        {
          "headline":"Select power-ups.",
          "description":"During the runs, you can find different boosters or power-ups. These can provide different effects on your run and scores. There's a power-up that can collect coins; another that can protect the biker; another that can double the coins you collect, and many more. Open the Power-ups menu by tapping the star icon from the main screen's menu bar. The power-ups will be listed on the screen. These power-ups can be upgraded so that their effects can be multiplied and these cost coins. The prices are displayed right beside the power-up. Tap on the ones you'd like to upgrade."
        },
        {
          "headline":"Select tricks.",
          "description":"Tap the biker icon from the main screen's menu bar. The tricks your biker can do are listed here. Some of the tricks will be unlocked when you reach specific levels. You need to pay in coins to upgrade and use these tricks. The prices are displayed right beside the trick. Tap on the one's you'd like to upgrade."
        },
        {
          "headline":"Select a trail.",
          "description":"Tap the trail icon from the main screen's menu bar. The available trails in the game will be displayed. Only the Forest Trail is available by default. You need to pay coins for the others to unlock and use them. The prices are displayed right beside the trail. Tap on the one you'd like to use."
        }
      ]
    },
    {
      "name":"Playing the Game",
      "steps":[
        {
          "headline":"Start the run.",
          "description":"From the main screen, tap the \u201cPlay\u201d button on the bottom right corner. All the customizations you've made earlier will be loaded."
        },
        {
          "headline":"Control the biker.",
          "description":"You don't need to do anything to move your biker forward. Like all endless runner games, it will run by itself. You need to watch where it's going though. You need to move your biker to collect the coins and avoid the obstacles. Go right\u2014Swipe right to move your biker to the right. Go left\u2014Swipe left to mover your biker to the left. Skid\u2014Swipe down to have your biker skid and go under an obstacle. Jump\u2014Swipe up to have your biker jump over obstacles."
        },
        {
          "headline":"Collect coins.",
          "description":"The trail will have coins on it. Move your biker to collect as much coins as you can. These coins add up, and you can then use them to unlock and buy the customizations and upgrades for your biker."
        },
        {
          "headline":"Collect power-ups.",
          "description":"Occasionally, you will see some special power-ups on the trail. Collect them to give you temporary special abilities, like coin magnet, shield, coin multiplier, and others."
        },
        {
          "headline":"Do tricks.",
          "description":"You can do tricks while jumping. Find ramps that will allow you to jump and make the tricks. Your biker can do different tricks depending on how you swipe during the jump and what tricks are currently unlocked."
        },
        {
          "headline":"Avoid obstacles.",
          "description":"Your game will end once your biker hits obstacles three times. Watch your trail carefully and avoid these obstacles, including trees, huge rocks, deer, and disconnected bridges."
        },
        {
          "headline":"Score high.",
          "description":"Each run is scored in terms of the coins collected, distance travelled, tricks scored, and multipliers. Focus on these aspects in every run to beat your best score. Your score is displayed on the top left, the distance travelled on the top middle, and the coins collected on the top right."
        }
      ]
    }
  ],
  "text":" Customizing or Upgrading Elements Launch the game. Bike Dash if available on iOS and Android. Download it from your device's app store. After it's installed, locate its icon (a biker) and tap to launch the game. Select a bike. Tap the bike icon on the main screen's menu bar. Your currently equipped bike and all the other available bikes in the game will be listed. Each of the bikes has different abilities that can change your bike run and jumps. The bikes aren't free, and you have to pay in coins to acquire and equip them. The prices are displayed right beside the bikes. Tap the one you'd like to equip. Select clothing. You can customize the way your biker looks in the game, from his headgear, top, and pants. To do this, tap the clothes icon at the top. The different clothes have different abilities or bonuses when used. These aren't free and you have to pay in coins to wear them. The prices are displayed right beside the clothes. Tap the ones you'd like to wear. Select power-ups. During the runs, you can find different boosters or power-ups. These can provide different effects on your run and scores. There's a power-up that can collect coins; another that can protect the biker; another that can double the coins you collect, and many more. Open the Power-ups menu by tapping the star icon from the main screen's menu bar. The power-ups will be listed on the screen. These power-ups can be upgraded so that their effects can be multiplied and these cost coins. The prices are displayed right beside the power-up. Tap on the ones you'd like to upgrade. Select tricks. Tap the biker icon from the main screen's menu bar. The tricks your biker can do are listed here. Some of the tricks will be unlocked when you reach specific levels. You need to pay in coins to upgrade and use these tricks. The prices are displayed right beside the trick. Tap on the one's you'd like to upgrade. Select a trail. Tap the trail icon from the main screen's menu bar. The available trails in the game will be displayed. Only the Forest Trail is available by default. You need to pay coins for the others to unlock and use them. The prices are displayed right beside the trail. Tap on the one you'd like to use. Playing the Game Start the run. From the main screen, tap the \u201cPlay\u201d button on the bottom right corner. All the customizations you've made earlier will be loaded. Control the biker. You don't need to do anything to move your biker forward. Like all endless runner games, it will run by itself. You need to watch where it's going though. You need to move your biker to collect the coins and avoid the obstacles. Go right\u2014Swipe right to move your biker to the right. Go left\u2014Swipe left to mover your biker to the left. Skid\u2014Swipe down to have your biker skid and go under an obstacle. Jump\u2014Swipe up to have your biker jump over obstacles. Collect coins. The trail will have coins on it. Move your biker to collect as much coins as you can. These coins add up, and you can then use them to unlock and buy the customizations and upgrades for your biker. Collect power-ups. Occasionally, you will see some special power-ups on the trail. Collect them to give you temporary special abilities, like coin magnet, shield, coin multiplier, and others. Do tricks. You can do tricks while jumping. Find ramps that will allow you to jump and make the tricks. Your biker can do different tricks depending on how you swipe during the jump and what tricks are currently unlocked. Avoid obstacles. Your game will end once your biker hits obstacles three times. Watch your trail carefully and avoid these obstacles, including trees, huge rocks, deer, and disconnected bridges. Score high. Each run is scored in terms of the coins collected, distance travelled, tricks scored, and multipliers. Focus on these aspects in every run to beat your best score. Your score is displayed on the top left, the distance travelled on the top middle, and the coins collected on the top right.",
  "tyn_model":[
    "bikes",
    "\u2014swipe",
    "bike",
    "coins",
    "bike dash",
    "clothing",
    "clothes",
    "\u201cplay",
    "\u201d button",
    "endless runner games",
    "shield",
    "rocks",
    "deer"
  ],
  "tyn_section":[

  ]
}