{
  "title":"How to Use a Moka Pot",
  "url":"https://www.wikihow.com/Use-a-Moka-Pot",
  "category_hierarchy":[
    "Food and Entertaining",
    "Drinks",
    "Coffee",
    "Stove Coffee"
  ],
  "parts":[
    {
      "name":"Getting the Moka Pot Ready",
      "steps":[
        {
          "headline":"Fill the boiler up with hot water to the fill line.",
          "description":"Remove the basket from the Moka pot and pour hot water into the boiler. If there is no fill line, fill up the boiler to just below the steam release valve."
        },
        {
          "headline":"Be very careful when handling the Moka pot after you have filled it with hot water.",
          "description":"This is because the metal will heat up very fast. Hot water is usually used in Moka pots because not only does this reduce the amount of time that it takes for the coffee to brew, but it also prevents the grounds from overheating and burning."
        },
        {
          "headline":"Grind coffee beans to the consistency of table salt.",
          "description":"Place 18\u201320 grams (0.63\u20130.71 oz) of coffee beans into the grinder and turn it on. The grind that you choose depends on your personal preference. Most grinds for Moka pot coffee fall somewhere between espresso and hand drip coffee."
        },
        {
          "headline":"Always grind coffee beans just before you are going to use it.",
          "description":"Freshly ground coffee beans make the best coffee. This creates enough coffee grounds for 1 shot of Moka pot coffee."
        },
        {
          "headline":"Place the ground coffee into the filter basket.",
          "description":"Fill the filter basket loosely and make sure that the coffee grounds are not tightly packed. Make sure the ground coffee sits level in the filter basket."
        },
        {
          "headline":"Don't tamp the coffee as you level it in the filter basket.",
          "description":"This is because if the coffee is too tightly packed, it will be too difficult for the water to travel through."
        },
        {
          "headline":"Assemble the Moka pot.",
          "description":"Place the filter basket into the boiler. Then, screw the top of the Moka pot onto the boiler base."
        },
        {
          "headline":"Hold the boiler base with a towel if it is too warm to hold while you assemble the Moka pot.",
          "description":""
        }
      ]
    },
    {
      "name":"Brewing and Serving the Coffee",
      "steps":[
        {
          "headline":"Heat the Moka pot on the stovetop for 5\u201310 minutes.",
          "description":"Set the stovetop temperature to medium-low and watch the coffee closely as it brews. As soon as the brew flows into the upper chamber, remove the Moka pot from the stovetop immediately. The warmer the water that you started with, the faster this process will go."
        },
        {
          "headline":"It's best to remove the Moka pot from the heat as soon as the coffee rises into the upper chamber.",
          "description":"This is because the residual heat will continue to brew the coffee once it has been removed from the stovetop. Adjust the temperature of the stovetop during the brewing process if necessary. If the coffee rises very fast and almost explodes out of the Moka pot, reduce the heat. However, if the coffee only rises in tiny droplets with no consistency, increase the heat. It can take a few attempts to find the correct heat setting that works for your stovetop and Moka pot."
        },
        {
          "headline":"Use a spoon to stir the coffee in the upper chamber.",
          "description":"Once the Moka pot has been removed from the heat, carefully stir it. This will help to mix the different layers of the coffee to create a smooth flavor."
        },
        {
          "headline":"Serve the Moka pot coffee immediately.",
          "description":"Moka pot coffee is best served fresh. Be careful when you take a sip, as it will be very hot!"
        },
        {
          "headline":"You can drink Moka pot coffee with sugar if you prefer.",
          "description":"Moka pot coffee can be quite strong, which isn't to everyone's liking. To work around this, Moka pot coffee can be diluted with hot water to create an Americano-style coffee. Don't drink coffee that has been left in the Moka pot. This is because it will taste burnt or scorched as it will continue to heat up in the chamber."
        },
        {
          "headline":"Clean the Moka pot using hot water and no detergent.",
          "description":"Empty the Moka pot and let it cool down completely before you begin to clean it. Then disassemble the Moka pot and rinse out each part thoroughly using cool water. Dry each part with a tea towel."
        },
        {
          "headline":"If you notice an excess of coffee build up, use a dry paper towel to remove this.",
          "description":""
        }
      ]
    }
  ],
  "text":" Getting the Moka Pot Ready Fill the boiler up with hot water to the fill line. Remove the basket from the Moka pot and pour hot water into the boiler. If there is no fill line, fill up the boiler to just below the steam release valve. Be very careful when handling the Moka pot after you have filled it with hot water. This is because the metal will heat up very fast. Hot water is usually used in Moka pots because not only does this reduce the amount of time that it takes for the coffee to brew, but it also prevents the grounds from overheating and burning. Grind coffee beans to the consistency of table salt. Place 18\u201320 grams (0.63\u20130.71 oz) of coffee beans into the grinder and turn it on. The grind that you choose depends on your personal preference. Most grinds for Moka pot coffee fall somewhere between espresso and hand drip coffee. Always grind coffee beans just before you are going to use it. Freshly ground coffee beans make the best coffee. This creates enough coffee grounds for 1 shot of Moka pot coffee. Place the ground coffee into the filter basket. Fill the filter basket loosely and make sure that the coffee grounds are not tightly packed. Make sure the ground coffee sits level in the filter basket. Don't tamp the coffee as you level it in the filter basket. This is because if the coffee is too tightly packed, it will be too difficult for the water to travel through. Assemble the Moka pot. Place the filter basket into the boiler. Then, screw the top of the Moka pot onto the boiler base. Hold the boiler base with a towel if it is too warm to hold while you assemble the Moka pot.  Brewing and Serving the Coffee Heat the Moka pot on the stovetop for 5\u201310 minutes. Set the stovetop temperature to medium-low and watch the coffee closely as it brews. As soon as the brew flows into the upper chamber, remove the Moka pot from the stovetop immediately. The warmer the water that you started with, the faster this process will go. It's best to remove the Moka pot from the heat as soon as the coffee rises into the upper chamber. This is because the residual heat will continue to brew the coffee once it has been removed from the stovetop. Adjust the temperature of the stovetop during the brewing process if necessary. If the coffee rises very fast and almost explodes out of the Moka pot, reduce the heat. However, if the coffee only rises in tiny droplets with no consistency, increase the heat. It can take a few attempts to find the correct heat setting that works for your stovetop and Moka pot. Use a spoon to stir the coffee in the upper chamber. Once the Moka pot has been removed from the heat, carefully stir it. This will help to mix the different layers of the coffee to create a smooth flavor. Serve the Moka pot coffee immediately. Moka pot coffee is best served fresh. Be careful when you take a sip, as it will be very hot! You can drink Moka pot coffee with sugar if you prefer. Moka pot coffee can be quite strong, which isn't to everyone's liking. To work around this, Moka pot coffee can be diluted with hot water to create an Americano-style coffee. Don't drink coffee that has been left in the Moka pot. This is because it will taste burnt or scorched as it will continue to heat up in the chamber. Clean the Moka pot using hot water and no detergent. Empty the Moka pot and let it cool down completely before you begin to clean it. Then disassemble the Moka pot and rinse out each part thoroughly using cool water. Dry each part with a tea towel. If you notice an excess of coffee build up, use a dry paper towel to remove this. ",
  "tyn_model":[
    "moka pot",
    "moka pot coffee",
    "boiler",
    "water",
    "hot water",
    "coffee beans",
    "filter basket",
    "coffee",
    "moka pots",
    "table salt",
    "grinder",
    "spoon",
    "sugar",
    "tea towel",
    "dry paper towel"
  ],
  "tyn_section":[

  ]
}