{
  "title":"How to Get Infinite Rare Candy in Pok\u00e9mon Light Platinum",
  "url":"https://www.wikihow.com/Get-Infinite-Rare-Candy-in-Pok%C3%A9mon-Light-Platinum",
  "category_hierarchy":[
    "Hobbies and Crafts",
    "Games",
    "Video Games",
    "Multi Platform Games",
    "Pokemon Video Games"
  ],
  "parts":[
    {
      "name":"Using the Infinite Item Code",
      "steps":[
        {
          "headline":"Load up Pok\u00e9mon Light Platinum.",
          "description":"Using your emulator of choice, load up the Pok\u00e9mon Light Platinum ROM to start the game. Since Pok\u00e9mon Light Platinum is a ROM hack of Pok\u00e9mon Ruby, you should have no problems using your old Pok\u00e9mon Ruby cheat codes for it."
        },
        {
          "headline":"Access your emulator\u2019s menu.",
          "description":"Once the game is loaded, open up your emulator\u2019s menu and look for \u201cCheats,\u201d if you\u2019re using emulators for the iOS or Android platforms. In case you\u2019re using the latest version of VBA (Visual Boy Advance) on PC, then you\u2019ll find the Cheats option under \u201cTools.\u201d\nThis is where you\u2019ll add the codes that will allow you to play around with the game\u2019s RNG, or Random Number Generator."
        },
        {
          "headline":"Input the Infinite Item code.",
          "description":"The first code that you\u2019ll need to enable so that you can get Infinite Rare Candies is this Gameshark code for Infinite Items: D261DC6D 197B4DC2. When this code is enabled, you will get 99 pieces/units of whatever item is in the first slot of your PC\u2019s Item Storage. Additionally, the item will always stay on the first slot even if you\u2019ve withdrew all of it to you bag. Essentially, you\u2019ll have an infinite number of whatever item is on the first slot."
        },
        {
          "headline":"Input the Rare Candy Item Modifier code.",
          "description":"You\u2019re then going to have to add this Codebreaker Item Modifier code for the Rare Candy: 82025BD0 0044. Since this is a Codebreaker code, it\u2019s best that you add this to your cheat list separately from the Infinite Item code. It is not advisable to use this code by itself since it might cause your game to crash."
        },
        {
          "headline":"Finish character creation and the short story intro.",
          "description":"Starting up the game will lead you directly to the character creation screen. Just input your name after choosing your gender, and watch the short cutscene that introduces the premise of the game\u2019s story."
        },
        {
          "headline":"Set the time.",
          "description":"After the cutscene ends, your character will now be in his/her room, and you can now control his/her movements. Move toward the clock or door to trigger a conversation with the character\u2019s mother wherein she will ask you to set the time. Just set it to any time you want using your virtual D-pad or keyboard (or actual D-pad, if you\u2019re playing using a controller)."
        },
        {
          "headline":"Go outside to trigger another cutscene.",
          "description":"Setting the time will now allow you to regain control of your character again. Now, you\u2019ll need to go down the stairs and out of the house to trigger another cutscene that will introduce you to Professor Jasmine and two other Pok\u00e9mon trainers who\u2019ll play an important role in the story later."
        }
      ]
    },
    {
      "name":"Getting to Central City",
      "steps":[
        {
          "headline":"Choose Charmander as your starter Pokemon.",
          "description":"After the cutscene/dialogue, a member of Team Steam will attack you and Professor Jasmine. Since this will be your first battle, the Professor will ask you to choose between three starter Pokemon: Squirtle, Bulbasaur, and Charmander. Just go for Charmander since you\u2019ll mainly be up against bug-type Pok\u00e9mon at the start of the game."
        },
        {
          "headline":"Beat the Team Steam grunt.",
          "description":"You\u2019ll only be up against one Pok\u00e9mon during this battle, and all you have to do is spam Charmander\u2019s Scratch attack. The enemy\u2019s Pok\u00e9mon (Poochyena) should be down after about two or three attacks from you."
        },
        {
          "headline":"Get the Pokeball from Professor Jasmine.",
          "description":"As soon as you beat the Team Steam grunt, the Professor will then bring you to her laboratory and give you a Pokeball. Finish up your dialogue with her and then head out of her laboratory."
        },
        {
          "headline":"Look for tall grass north of the town.",
          "description":"Once you\u2019re out of the laboratory, go up north of the town and look for an area that has tall grass. Moving inside this area will result in you encountering wild Pokemon."
        },
        {
          "headline":"Level up Charmander.",
          "description":"The majority of the Pok\u00e9mon in this area are low-level bug-types, thus making it ideal for leveling up Charmander. Just have Charmander fight 3 or 4 wild Pok\u00e9mon to increase his level to 7, which will then allow him to learn the Ember move. Due to its high damage output, Charmander\u2019s Scratch should make short work of any Wild Pok\u00e9mon you come across at this point. If you do come across a Pok\u00e9mon with a high level, you can always Run Away."
        },
        {
          "headline":"Move up north to Central City.",
          "description":"The moment Charmander\u2019s level goes up to 7, you can now proceed further up north to Central City. Before you get to the city though, you will have to face three trainers who mostly have around 4\u20135 bug-type Pokemon."
        },
        {
          "headline":"Beat the trainers.",
          "description":"Don\u2019t worry if the trainers have more Pok\u00e9mon than you. Charmander should be able to take each Pok\u00e9mon that he\u2019s matched up against with one Ember attack. There\u2019s no need to plan for a strategy for these guys since you will always get to attack first during every turn."
        }
      ]
    },
    {
      "name":"Withdrawing the Rare Candies",
      "steps":[
        {
          "headline":"Head for the Pok\u00e9mon Center.",
          "description":"After beating the trainers, immediately go to Central City and look for the Pok\u00e9mon Center."
        },
        {
          "headline":"Go to the Nurse.",
          "description":"Once inside, make sure to head first to the Nurse to have Charmander healed before heading to a PC."
        },
        {
          "headline":"Open a PC.",
          "description":"The PC is usually found on the Nurse\u2019s station or on the eastern area inside the Pok\u00e9mon Center. If you\u2019re playing on an emulator for mobile devices, press on the A button on your screen (or its equivalent for those playing on keyboards or controllers), and it should now give you the option to open someone\u2019s PC or your character\u2019s PC."
        },
        {
          "headline":"Withdraw the 99 Potions.",
          "description":"Open up your character\u2019s PC and go to \u201cWithdraw Item\u201d under \u201cItem Storage.\u201d You should now see that the PC has Potions and Rare Candy stored inside of it. Withdraw all the Potions (there are 99 in total) to your bag by pressing on A (or equivalent button/key for those playing with controllers/keyboards) again. Doing this will result in the Rare Candy now occupying the first slot of your PC\u2019s Item Storage."
        },
        {
          "headline":"Withdraw as many Rare Candies as you want.",
          "description":"Now that it is on the first slot, you can get a maximum of 99 Rare Candies for every withdrawal. For those playing on emulators of touch screen devices, just press on A (or equivalent button/key for those playing with controllers/keyboards) when the Rare Candy is highlighted, and select the number you\u2019d like to withdraw to your bag."
        },
        {
          "headline":"Log off of the PC.",
          "description":"You can log off of the PC as soon as you\u2019re satisfied with the amount of Rare Candies that you\u2019ve withdrawn."
        },
        {
          "headline":"Level up your Pokemon.",
          "description":"Use the Rare Candy by pressing on Start and going to the Items section of your Bag. Highlight the Rare Candy and press on A. On the options that pop-up, choose \u201cUse\u201d (press on A again) and highlight Charmander (or the Pok\u00e9mon you want to level up)."
        }
      ]
    }
  ],
  "text":" Using the Infinite Item Code Load up Pok\u00e9mon Light Platinum. Using your emulator of choice, load up the Pok\u00e9mon Light Platinum ROM to start the game. Since Pok\u00e9mon Light Platinum is a ROM hack of Pok\u00e9mon Ruby, you should have no problems using your old Pok\u00e9mon Ruby cheat codes for it. Access your emulator\u2019s menu. Once the game is loaded, open up your emulator\u2019s menu and look for \u201cCheats,\u201d if you\u2019re using emulators for the iOS or Android platforms. In case you\u2019re using the latest version of VBA (Visual Boy Advance) on PC, then you\u2019ll find the Cheats option under \u201cTools.\u201d\nThis is where you\u2019ll add the codes that will allow you to play around with the game\u2019s RNG, or Random Number Generator. Input the Infinite Item code. The first code that you\u2019ll need to enable so that you can get Infinite Rare Candies is this Gameshark code for Infinite Items: D261DC6D 197B4DC2. When this code is enabled, you will get 99 pieces/units of whatever item is in the first slot of your PC\u2019s Item Storage. Additionally, the item will always stay on the first slot even if you\u2019ve withdrew all of it to you bag. Essentially, you\u2019ll have an infinite number of whatever item is on the first slot. Input the Rare Candy Item Modifier code. You\u2019re then going to have to add this Codebreaker Item Modifier code for the Rare Candy: 82025BD0 0044. Since this is a Codebreaker code, it\u2019s best that you add this to your cheat list separately from the Infinite Item code. It is not advisable to use this code by itself since it might cause your game to crash. Finish character creation and the short story intro. Starting up the game will lead you directly to the character creation screen. Just input your name after choosing your gender, and watch the short cutscene that introduces the premise of the game\u2019s story. Set the time. After the cutscene ends, your character will now be in his/her room, and you can now control his/her movements. Move toward the clock or door to trigger a conversation with the character\u2019s mother wherein she will ask you to set the time. Just set it to any time you want using your virtual D-pad or keyboard (or actual D-pad, if you\u2019re playing using a controller). Go outside to trigger another cutscene. Setting the time will now allow you to regain control of your character again. Now, you\u2019ll need to go down the stairs and out of the house to trigger another cutscene that will introduce you to Professor Jasmine and two other Pok\u00e9mon trainers who\u2019ll play an important role in the story later. Getting to Central City Choose Charmander as your starter Pokemon. After the cutscene/dialogue, a member of Team Steam will attack you and Professor Jasmine. Since this will be your first battle, the Professor will ask you to choose between three starter Pokemon: Squirtle, Bulbasaur, and Charmander. Just go for Charmander since you\u2019ll mainly be up against bug-type Pok\u00e9mon at the start of the game. Beat the Team Steam grunt. You\u2019ll only be up against one Pok\u00e9mon during this battle, and all you have to do is spam Charmander\u2019s Scratch attack. The enemy\u2019s Pok\u00e9mon (Poochyena) should be down after about two or three attacks from you. Get the Pokeball from Professor Jasmine. As soon as you beat the Team Steam grunt, the Professor will then bring you to her laboratory and give you a Pokeball. Finish up your dialogue with her and then head out of her laboratory. Look for tall grass north of the town. Once you\u2019re out of the laboratory, go up north of the town and look for an area that has tall grass. Moving inside this area will result in you encountering wild Pokemon. Level up Charmander. The majority of the Pok\u00e9mon in this area are low-level bug-types, thus making it ideal for leveling up Charmander. Just have Charmander fight 3 or 4 wild Pok\u00e9mon to increase his level to 7, which will then allow him to learn the Ember move. Due to its high damage output, Charmander\u2019s Scratch should make short work of any Wild Pok\u00e9mon you come across at this point. If you do come across a Pok\u00e9mon with a high level, you can always Run Away. Move up north to Central City. The moment Charmander\u2019s level goes up to 7, you can now proceed further up north to Central City. Before you get to the city though, you will have to face three trainers who mostly have around 4\u20135 bug-type Pokemon. Beat the trainers. Don\u2019t worry if the trainers have more Pok\u00e9mon than you. Charmander should be able to take each Pok\u00e9mon that he\u2019s matched up against with one Ember attack. There\u2019s no need to plan for a strategy for these guys since you will always get to attack first during every turn. Withdrawing the Rare Candies Head for the Pok\u00e9mon Center. After beating the trainers, immediately go to Central City and look for the Pok\u00e9mon Center. Go to the Nurse. Once inside, make sure to head first to the Nurse to have Charmander healed before heading to a PC. Open a PC. The PC is usually found on the Nurse\u2019s station or on the eastern area inside the Pok\u00e9mon Center. If you\u2019re playing on an emulator for mobile devices, press on the A button on your screen (or its equivalent for those playing on keyboards or controllers), and it should now give you the option to open someone\u2019s PC or your character\u2019s PC. Withdraw the 99 Potions. Open up your character\u2019s PC and go to \u201cWithdraw Item\u201d under \u201cItem Storage.\u201d You should now see that the PC has Potions and Rare Candy stored inside of it. Withdraw all the Potions (there are 99 in total) to your bag by pressing on A (or equivalent button/key for those playing with controllers/keyboards) again. Doing this will result in the Rare Candy now occupying the first slot of your PC\u2019s Item Storage. Withdraw as many Rare Candies as you want. Now that it is on the first slot, you can get a maximum of 99 Rare Candies for every withdrawal. For those playing on emulators of touch screen devices, just press on A (or equivalent button/key for those playing with controllers/keyboards) when the Rare Candy is highlighted, and select the number you\u2019d like to withdraw to your bag. Log off of the PC. You can log off of the PC as soon as you\u2019re satisfied with the amount of Rare Candies that you\u2019ve withdrawn. Level up your Pokemon. Use the Rare Candy by pressing on Start and going to the Items section of your Bag. Highlight the Rare Candy and press on A. On the options that pop-up, choose \u201cUse\u201d (press on A again) and highlight Charmander (or the Pok\u00e9mon you want to level up).",
  "tyn_model":[
    "charmander",
    "emulator",
    "rare candy",
    "pokeball",
    "pok\u00e9mon",
    "pok\u00e9mon center",
    "pc",
    "potions",
    "pok\u00e9mon light platinum",
    "pok\u00e9mon ruby",
    "\u201ccheats",
    "\u201d if",
    "emulators",
    "visual boy advance",
    "\u201ctools",
    "\u201d\n",
    "random number generator",
    "steam",
    "squirtle",
    "bulbasaur",
    "scratch",
    "ember",
    "\u201cwithdraw",
    "\u201d under",
    "\u201citem",
    "\u201d you",
    "rare candies",
    "pokemon",
    "\u201cuse",
    "\u201d ("
  ],
  "tyn_section":[

  ]
}