{
  "title":"How to Find Your XBox 360 Serial Number",
  "url":"https://www.wikihow.com/Find-Your-XBox-360-Serial-Number",
  "category_hierarchy":[
    "Hobbies and Crafts",
    "Games",
    "Video Games",
    "Xbox",
    "Xbox 360"
  ],
  "methods":[
    {
      "name":"Checking the back",
      "steps":[
        {
          "headline":"Look on the back of your Xbox.",
          "description":"Look near the A/V,HDMI,I/O(USB) and Ethernet ports."
        },
        {
          "headline":"Find a sticker near these parts.",
          "description":"The sticker will have a barcode on it."
        },
        {
          "headline":"Look above that barcode.",
          "description":""
        },
        {
          "headline":"There should be bold numbers followed by words.",
          "description":"For example: MFR Date (Manufacture Date, the date when your XBox was made) ."
        },
        {
          "headline":"Look under the MFR Date.",
          "description":"You will find your Xbox 360's Serial Number."
        }
      ]
    },
    {
      "name":"Checking the USB portal",
      "steps":[
        {
          "headline":"Open up the USB port in the front of your console.",
          "description":""
        },
        {
          "headline":"Look for a sticker with a number.",
          "description":"This should be the serial number."
        }
      ]
    },
    {
      "name":"Checking System Information",
      "steps":[
        {
          "headline":"Go to System Information.",
          "description":""
        },
        {
          "headline":"It will display your Serial Number.",
          "description":""
        }
      ]
    },
    {
      "name":"Cracking the code - LNNNNNN YWWFF",
      "steps":[
        {
          "headline":"On the bottom of the Xbox 360, you will be able to see the Xbox 360 manufacturing date and the Xbox 360 serial number.",
          "description":"The manufacturing date is in the following format: \n2008-11-03\nYYYY-MM-DD (Year-Month-Day,) which is the date according to ISO 8601."
        },
        {
          "headline":"Unravel the code.",
          "description":"The serial number looks like this: 6144526 84302. The serial number is formatted (LNNNNNN YWWFF). L the number of the production line within the factory,\nNNNNNN the number of the Xbox within this week. Y the last digit of the production year,\nWW the number of the week of the production year\nFF is the code of the factory (02: Mexico, 03: Hungary, 05: China, 06: Taiwan)."
        },
        {
          "headline":"Put it altogether.",
          "description":"Taking the serial number 6144526 14302 this would give you: \nLine 6 of the factory\nThis would be 144526 off the production line\n2008 production year\nWeek 43 of the year\nFactory location Mexico."
        }
      ]
    }
  ],
  "text":" Checking the back Look on the back of your Xbox. Look near the A/V,HDMI,I/O(USB) and Ethernet ports. Find a sticker near these parts. The sticker will have a barcode on it. Look above that barcode.  There should be bold numbers followed by words. For example: MFR Date (Manufacture Date, the date when your XBox was made) . Look under the MFR Date. You will find your Xbox 360's Serial Number. Checking the USB portal Open up the USB port in the front of your console.  Look for a sticker with a number. This should be the serial number. Checking System Information Go to System Information.  It will display your Serial Number.  Cracking the code - LNNNNNN YWWFF On the bottom of the Xbox 360, you will be able to see the Xbox 360 manufacturing date and the Xbox 360 serial number. The manufacturing date is in the following format: \n2008-11-03\nYYYY-MM-DD (Year-Month-Day,) which is the date according to ISO 8601. Unravel the code. The serial number looks like this: 6144526 84302. The serial number is formatted (LNNNNNN YWWFF). L the number of the production line within the factory,\nNNNNNN the number of the Xbox within this week. Y the last digit of the production year,\nWW the number of the week of the production year\nFF is the code of the factory (02: Mexico, 03: Hungary, 05: China, 06: Taiwan). Put it altogether. Taking the serial number 6144526 14302 this would give you: \nLine 6 of the factory\nThis would be 144526 off the production line\n2008 production year\nWeek 43 of the year\nFactory location Mexico.",
  "tyn_model":[
    "xbox 360",
    "xbox",
    "xbox was",
    "usb"
  ],
  "tyn_section":[

  ]
}