{
  "title":"How to Make Chicken Fried Steak",
  "url":"https://www.wikihow.com/Make-Chicken-Fried-Steak",
  "category_hierarchy":[
    "Food and Entertaining",
    "Recipes",
    "Meat",
    "Beef and Lamb",
    "Steak Dishes"
  ],
  "methods":[
    {
      "name":"Steak and Batter",
      "steps":[
        {
          "headline":"Begin by pre-heating a skillet on medium-high with enough oil to cover the bottom of the skillet.",
          "description":""
        },
        {
          "headline":"Tenderize your cube steaks a little (optional).",
          "description":"Using a cooking mallet, lightly hammer each steak until it begins to tenderize and grows by roughly half."
        },
        {
          "headline":"Create four (4) stations.",
          "description":"Make space for one cutting board to season the meat, one bowl with flour, one bowl with the beaten egg mixture, and a resting surface, like a bowl or plate. To make the egg mixture, mix together all the dry ingredients first in a medium bowl \u2014 the baking powder, baking soda, pepper, and salt. To the dry ingredients, add the buttermilk, egg, and hot sauce to create a kind of slurry."
        },
        {
          "headline":"Season the steaks on each side and dredge.",
          "description":"To dredge, put a steak through flour, then soak in the egg mixture, then the flour again and put on resting surface. Do this for all the steaks. Let them rest for 10-15 minutes. When covering the steaks with flour for the second time, make sure they are evenly patted down and completely coated. For a fully-developed crust, make sure to pat down the steaks several times in the flour."
        }
      ]
    },
    {
      "name":"Frying the Steaks and Making the Country Gravy",
      "steps":[
        {
          "headline":"When the oil is shimmering, put the steaks in and fry them for 3-5 minutes on each side.",
          "description":"Steaks are done when they are golden brown on both sides. Note that thinner steaks will require less time than thicker steaks. Put them in a warm oven for the following steps."
        },
        {
          "headline":"Create a roux by mixing equal parts butter and flour.",
          "description":"Make sure you start the roux off at a low-enough temperature so that the flour doesn't burn."
        },
        {
          "headline":"Gradually add milk, salt and pepper to the roux, whisking frequently.",
          "description":"Whisk until the mixture can coat the back of a spoon, about 4 to 7 minutes. Now you have gravy!"
        },
        {
          "headline":"Finished!",
          "description":"Serve with mashed potatoes and veggies, or any other combination you desire."
        }
      ]
    }
  ],
  "text":" Steak and Batter Begin by pre-heating a skillet on medium-high with enough oil to cover the bottom of the skillet.  Tenderize your cube steaks a little (optional). Using a cooking mallet, lightly hammer each steak until it begins to tenderize and grows by roughly half. Create four (4) stations. Make space for one cutting board to season the meat, one bowl with flour, one bowl with the beaten egg mixture, and a resting surface, like a bowl or plate. To make the egg mixture, mix together all the dry ingredients first in a medium bowl \u2014 the baking powder, baking soda, pepper, and salt. To the dry ingredients, add the buttermilk, egg, and hot sauce to create a kind of slurry. Season the steaks on each side and dredge. To dredge, put a steak through flour, then soak in the egg mixture, then the flour again and put on resting surface. Do this for all the steaks. Let them rest for 10-15 minutes. When covering the steaks with flour for the second time, make sure they are evenly patted down and completely coated. For a fully-developed crust, make sure to pat down the steaks several times in the flour. Frying the Steaks and Making the Country Gravy When the oil is shimmering, put the steaks in and fry them for 3-5 minutes on each side. Steaks are done when they are golden brown on both sides. Note that thinner steaks will require less time than thicker steaks. Put them in a warm oven for the following steps. Create a roux by mixing equal parts butter and flour. Make sure you start the roux off at a low-enough temperature so that the flour doesn't burn. Gradually add milk, salt and pepper to the roux, whisking frequently. Whisk until the mixture can coat the back of a spoon, about 4 to 7 minutes. Now you have gravy! Finished! Serve with mashed potatoes and veggies, or any other combination you desire.",
  "tyn_model":[
    "flour",
    "egg",
    "skillet",
    "oil",
    "pepper",
    "salt",
    "cooking mallet",
    "cutting board",
    "bowl",
    "plate",
    "medium bowl",
    "\u2014 the",
    "baking powder",
    "baking soda",
    "buttermilk",
    "hot sauce",
    "country gravy",
    "oven",
    "butter",
    "milk",
    "spoon",
    "mashed potatoes"
  ],
  "tyn_section":[

  ]
}