{
  "title":"How to Change the Resolution in Age of Empires 2 HD",
  "url":"https://www.wikihow.com/Change-the-Resolution-in-Age-of-Empires-2-HD",
  "category_hierarchy":[
    "Hobbies and Crafts",
    "Games",
    "Video Games",
    "PC Games"
  ],
  "methods":[
    {
      "name":"Adjusting the Resolution of Your Windows Desktop",
      "steps":[
        {
          "headline":"Open Control Panel.",
          "description":"The game\u2019s resolution is directly mapped to the resolution you\u2019re using for your Windows desktop, meaning that changing your Windows resolution also changes the game\u2019s resolution. To begin, access your computer\u2019s Control Panel."
        },
        {
          "headline":"Open the Screen Resolution settings page.",
          "description":"Under \u201cAppearance and Personalization,\u201d click \u201cAdjust Screen Resolution.\u201d On the Resolution drop-down menu, click the resolution you want. This is the resolution both your AoE2HD game and Windows desktop will run in. The best resolution depends on the size of your screen. Here are a few popular screen sizes with their recommended resolutions:\n14 CRT (aspect ratio 4:3): 1024x768\n\n14 Notebook / 15.6 Laptop / 18.5 monitor (aspect ratio 16:9): 1366x768\n\n19 monitor (aspect ratio 5:4): 1280x1024\n\n21.5 monitor / 23 monitor / 1080p TV (aspect ratio 16:9): 1920x1080"
        },
        {
          "headline":"Apply the changes.",
          "description":"When you\u2019ve selected the screen resolution you prefer, just click the \u201cApply\u201d button at the bottom of the screen to accept the new resolution."
        },
        {
          "headline":"Start the game.",
          "description":"The usual way to do this is to double-click the game\u2019s icon on the desktop. The game will display in the resolution you set. You can also change the resolution settings in the Control Panel while playing the game. Just hit the Windows key on your keyboard to minimize the game and open the Start menu. Open the Control Panel, and change the resolution through the Screen Resolution settings page, and then return to the game by clicking the game\u2019s icon on the Taskbar."
        }
      ]
    },
    {
      "name":"Adjusting the Resolution on a Mac[1]\n\tX\n\t\tResearch source",
      "steps":[
        {
          "headline":"Launch AoE2HD.",
          "description":"Do this by clicking the game\u2019s icon on the Dock (an application launching toolbar running on one of the sides of your Mac desktop) or on the Launchpad."
        },
        {
          "headline":"Open the Apple Menu.",
          "description":"Do this by pressing the three-key combo CTRL+FN+F2 on your keyboard. This will minimize the game and open the Apple Menu."
        },
        {
          "headline":"Access the System Preferences.",
          "description":"Find \u201cSystem Preferences\u201d in the Apple Menu and select it to open its settings."
        },
        {
          "headline":"View the Display settings.",
          "description":"On the System Preferences page, click \u201cDisplays.\u201d In this Displays menu will be another option titled \u201cDisplay\u201d; click it as well. This will open a list of available resolution options."
        },
        {
          "headline":"Select your preferred resolution.",
          "description":"You screen will automatically change to the resolution you click. If you are unsure of the best resolution to use, keep clicking the available resolutions till you find a suitable one. To switch to the game to see how a resolution you selected affects it, press the combination Command+Tab till the game\u2019s icon is highlighted and then release. To go back to the Display settings page, press the same combination again until the icon for Display settings is highlighted. Keep at it till you find the resolution that works best."
        }
      ]
    },
    {
      "name":"Playing the Game in Windowed Mode",
      "steps":[
        {
          "headline":"Start the game.",
          "description":"You can alter the resolution of your AoE2HD by playing it in windowed mode and then adjusting the size of the window using the mouse. So begin by starting the game (by following this Start menu sequence: Start button >> All Programs >> Microsoft Games >> Age of Empires II HD or by double-clicking the game\u2019s icon on the desktop)."
        },
        {
          "headline":"Go to the game Settings.",
          "description":"Press the hotkey F10 to produce the in-game menu, and click \u201cOptions.\u201d"
        },
        {
          "headline":"Disable Full Screen mode.",
          "description":"On the Options page, untick the Full Screen box near the middle of the page. This will display the game in a window."
        },
        {
          "headline":"Adjust the resolution manually using the mouse.",
          "description":"Once the game is in window mode, use the mouse to simply drag the top and side edges of the game window till it is the satisfactory size."
        }
      ]
    }
  ],
  "text":" Adjusting the Resolution of Your Windows Desktop Open Control Panel. The game\u2019s resolution is directly mapped to the resolution you\u2019re using for your Windows desktop, meaning that changing your Windows resolution also changes the game\u2019s resolution. To begin, access your computer\u2019s Control Panel. Open the Screen Resolution settings page. Under \u201cAppearance and Personalization,\u201d click \u201cAdjust Screen Resolution.\u201d On the Resolution drop-down menu, click the resolution you want. This is the resolution both your AoE2HD game and Windows desktop will run in. The best resolution depends on the size of your screen. Here are a few popular screen sizes with their recommended resolutions:\n14 CRT (aspect ratio 4:3): 1024x768\n\n14 Notebook / 15.6 Laptop / 18.5 monitor (aspect ratio 16:9): 1366x768\n\n19 monitor (aspect ratio 5:4): 1280x1024\n\n21.5 monitor / 23 monitor / 1080p TV (aspect ratio 16:9): 1920x1080 Apply the changes. When you\u2019ve selected the screen resolution you prefer, just click the \u201cApply\u201d button at the bottom of the screen to accept the new resolution. Start the game. The usual way to do this is to double-click the game\u2019s icon on the desktop. The game will display in the resolution you set. You can also change the resolution settings in the Control Panel while playing the game. Just hit the Windows key on your keyboard to minimize the game and open the Start menu. Open the Control Panel, and change the resolution through the Screen Resolution settings page, and then return to the game by clicking the game\u2019s icon on the Taskbar. Adjusting the Resolution on a Mac[1]\n\tX\n\t\tResearch source Launch AoE2HD. Do this by clicking the game\u2019s icon on the Dock (an application launching toolbar running on one of the sides of your Mac desktop) or on the Launchpad. Open the Apple Menu. Do this by pressing the three-key combo CTRL+FN+F2 on your keyboard. This will minimize the game and open the Apple Menu. Access the System Preferences. Find \u201cSystem Preferences\u201d in the Apple Menu and select it to open its settings. View the Display settings. On the System Preferences page, click \u201cDisplays.\u201d In this Displays menu will be another option titled \u201cDisplay\u201d; click it as well. This will open a list of available resolution options. Select your preferred resolution. You screen will automatically change to the resolution you click. If you are unsure of the best resolution to use, keep clicking the available resolutions till you find a suitable one. To switch to the game to see how a resolution you selected affects it, press the combination Command+Tab till the game\u2019s icon is highlighted and then release. To go back to the Display settings page, press the same combination again until the icon for Display settings is highlighted. Keep at it till you find the resolution that works best. Playing the Game in Windowed Mode Start the game. You can alter the resolution of your AoE2HD by playing it in windowed mode and then adjusting the size of the window using the mouse. So begin by starting the game (by following this Start menu sequence: Start button >> All Programs >> Microsoft Games >> Age of Empires II HD or by double-clicking the game\u2019s icon on the desktop). Go to the game Settings. Press the hotkey F10 to produce the in-game menu, and click \u201cOptions.\u201d Disable Full Screen mode. On the Options page, untick the Full Screen box near the middle of the page. This will display the game in a window. Adjust the resolution manually using the mouse. Once the game is in window mode, use the mouse to simply drag the top and side edges of the game window till it is the satisfactory size.",
  "tyn_model":[
    "apple menu",
    "mouse",
    "\u201d in",
    "control panel",
    "\u201cappearance",
    "\u201d click",
    "\u201cadjust",
    "\u201d on",
    "tv",
    "\u201capply",
    "\u201d button",
    "mac",
    "\u201csystem",
    "system preferences",
    "\u201cdisplays",
    "\u201cdisplay",
    "\u201d;",
    "\u201coptions",
    "\u201d disable"
  ],
  "tyn_section":[

  ]
}