{
  "title":"How to Play Custom Maps in Age of Empires 2 HD",
  "url":"https://www.wikihow.com/Play-Custom-Maps-in-Age-of-Empires-2-HD",
  "category_hierarchy":[
    "Hobbies and Crafts",
    "Games",
    "Video Games"
  ],
  "methods":[
    {
      "name":"Playing Inbuilt Custom ES Maps",
      "steps":[
        {
          "headline":"Start a standard game.",
          "description":"Inbuilt custom maps are maps created by Ensemble Studios (ES) and come with the game. Just start a AoE2HD Standard game. Once you select \u201cStandard Game\u201d from the menu, the Game Settings will open where you can set up the options for the game you want to play. You can play ES custom maps in both single-player games or multiplayer."
        },
        {
          "headline":"Choose \u201cCustom\u201d as the Map Style.",
          "description":"On the Game Settings panel on the right-hand side of the page, select \u201cCustom\u201d from the Map Style drop-down menu. This will place all available custom maps in the Location menu."
        },
        {
          "headline":"Choose the custom map you want to play.",
          "description":"On the Location drop-down menu, select the custom map you want to play. By default, only the following ES (Ensemble Studios) custom maps are included:\nES@Canals_V2.rms\nES@Metropolis_V2.rms\nES@Capricious_V2.rms\nES@Dingos_V2.rms\nES@Shipwreck_V2.rms\nES@Graveyards_V2.rms\nES@Moats_V2.rms\nES@Paradise_Island_V2.rms\nES@Pilgrims_v2.rms\nES@Prairie_V2.rms\nES@Seasons_V2.rms\nES@The_Unknown_V2.rms\nES@Sherwood_Forest_V2.rms\nES@Sherwood_Heroes_V2.rms\nES@Team_Glaciers_V2.rms"
        },
        {
          "headline":"Click \u201cStart Game.\u201d This will launch the game with the custom map you selected, and you can play the game as you would on an original map.",
          "description":""
        }
      ]
    },
    {
      "name":"Playing Imported Custom Maps",
      "steps":[
        {
          "headline":"Get the custom maps.",
          "description":"AoE2HD custom maps are files of the extension *.rms. These files can be downloaded from the Internet. A couple of sites from where you can get them is IGN\u2019s File Planet or Mod Database\nAlso, if your friends have custom maps that you would like to use, ask for a copy of the .rms files from them."
        },
        {
          "headline":"Incorporate the custom map into your AoE2HD game.",
          "description":"Once you have the custom map files, move the it into the \u201cRandom\u201d folder of your AoE2HD installation. The \u201cRandom\u201d folder will typically be found here: C:\\Program Files\\Microsoft Games\\Age of Empires II HD. To access the \u201cRandom\u201d folder on a Mac, open the Applications folder from your Dock and then open the AoE2HD folder. All resource files for the game, including the \u201cRandom\u201d folder, are stored therein."
        },
        {
          "headline":"Launch Aoe2HD and play the custom maps.",
          "description":"Run your AoE2HD game, and on the Game Settings page on any game mode you chose (whether multiplayer or single player), choose \u201cCustom\u201d from under Map Style. Your custom map, which bears the name of the *.rms file you put in the Random folder, will appear in the Location drop-down menu. Select it, and click \u201cStart Game\u201d to play!"
        }
      ]
    }
  ],
  "text":" Playing Inbuilt Custom ES Maps Start a standard game. Inbuilt custom maps are maps created by Ensemble Studios (ES) and come with the game. Just start a AoE2HD Standard game. Once you select \u201cStandard Game\u201d from the menu, the Game Settings will open where you can set up the options for the game you want to play. You can play ES custom maps in both single-player games or multiplayer. Choose \u201cCustom\u201d as the Map Style. On the Game Settings panel on the right-hand side of the page, select \u201cCustom\u201d from the Map Style drop-down menu. This will place all available custom maps in the Location menu. Choose the custom map you want to play. On the Location drop-down menu, select the custom map you want to play. By default, only the following ES (Ensemble Studios) custom maps are included:\nES@Canals_V2.rms\nES@Metropolis_V2.rms\nES@Capricious_V2.rms\nES@Dingos_V2.rms\nES@Shipwreck_V2.rms\nES@Graveyards_V2.rms\nES@Moats_V2.rms\nES@Paradise_Island_V2.rms\nES@Pilgrims_v2.rms\nES@Prairie_V2.rms\nES@Seasons_V2.rms\nES@The_Unknown_V2.rms\nES@Sherwood_Forest_V2.rms\nES@Sherwood_Heroes_V2.rms\nES@Team_Glaciers_V2.rms Click \u201cStart Game.\u201d This will launch the game with the custom map you selected, and you can play the game as you would on an original map.  Playing Imported Custom Maps Get the custom maps. AoE2HD custom maps are files of the extension *.rms. These files can be downloaded from the Internet. A couple of sites from where you can get them is IGN\u2019s File Planet or Mod Database\nAlso, if your friends have custom maps that you would like to use, ask for a copy of the .rms files from them. Incorporate the custom map into your AoE2HD game. Once you have the custom map files, move the it into the \u201cRandom\u201d folder of your AoE2HD installation. The \u201cRandom\u201d folder will typically be found here: C:\\Program Files\\Microsoft Games\\Age of Empires II HD. To access the \u201cRandom\u201d folder on a Mac, open the Applications folder from your Dock and then open the AoE2HD folder. All resource files for the game, including the \u201cRandom\u201d folder, are stored therein. Launch Aoe2HD and play the custom maps. Run your AoE2HD game, and on the Game Settings page on any game mode you chose (whether multiplayer or single player), choose \u201cCustom\u201d from under Map Style. Your custom map, which bears the name of the *.rms file you put in the Random folder, will appear in the Location drop-down menu. Select it, and click \u201cStart Game\u201d to play!",
  "tyn_model":[
    "\u201crandom",
    "\u201d folder",
    "\u201d from",
    "\u201ccustom",
    "\u201cstart",
    "\u201cstandard",
    "maps",
    "\u201d as",
    "\u201d this",
    "\u201d to"
  ],
  "tyn_section":[

  ]
}