{
  "title":"How to Make a Bot Lobby in Black Ops 2 for Xbox 360",
  "url":"https://www.wikihow.com/Make-a-Bot-Lobby-in-Black-Ops-2-for-Xbox-360",
  "category_hierarchy":[
    "Hobbies and Crafts",
    "Games",
    "Video Games",
    "Xbox",
    "Xbox 360"
  ],
  "parts":[
    {
      "name":"Setup",
      "steps":[
        {
          "headline":"Get a second controller.",
          "description":"Sign it into guest, but don't join in the lobby."
        },
        {
          "headline":"Save a modded CTF mode.",
          "description":"Go to COD TV, then Trending, then go to Custom Games, and select a game-mode on the lines of \"Modded CTF\" or \"Capture the Flag Modded\". Now go to \"Edit Game Rules\" and save the game-mode under whatever name you'd like."
        },
        {
          "headline":"Grab a friend.",
          "description":"Make sure this \"friend\" is trustworthy, and isn't going to report you on Xbox Live or Black Ops 2. making sure you and your friend have some way of instant communication is essential, as you have a limited time frame."
        }
      ]
    },
    {
      "name":"Making the Lobby",
      "steps":[
        {
          "headline":"Glitch your friend's lobby.",
          "description":"You will need go into online mode and hover over \"Public Match\". Have your friend search for a public match, then leave immediately. The friend should now go to the main menu, and select \"System Link\". Now the friend must hover over create game, open their friends list, hover to your name, press \"Y\", and then press \"A\" as fast as possible. Repeat this step until your friend tells you his rank indicator doesn't show. Now have them back out and select \"Xbox 360\", then hover over public match."
        },
        {
          "headline":"Join your friends game with a second controller.",
          "description":"Open a custom game, set the game mode to Free for All, and add the guest controller. Now, open your friends list and join your friend."
        },
        {
          "headline":"Set up the game.",
          "description":"You will have 10-15 seconds to do this. Open a saved Capture the Flag Glitch mode, and set the bot settings. The game will start automatically."
        },
        {
          "headline":"Boost to your hearts content.",
          "description":"If done correctly, when you end the game, you will have gained XP and unlocked challenges completed in game."
        }
      ]
    }
  ],
  "text":" Setup Get a second controller. Sign it into guest, but don't join in the lobby. Save a modded CTF mode. Go to COD TV, then Trending, then go to Custom Games, and select a game-mode on the lines of \"Modded CTF\" or \"Capture the Flag Modded\". Now go to \"Edit Game Rules\" and save the game-mode under whatever name you'd like. Grab a friend. Make sure this \"friend\" is trustworthy, and isn't going to report you on Xbox Live or Black Ops 2. making sure you and your friend have some way of instant communication is essential, as you have a limited time frame. Making the Lobby Glitch your friend's lobby. You will need go into online mode and hover over \"Public Match\". Have your friend search for a public match, then leave immediately. The friend should now go to the main menu, and select \"System Link\". Now the friend must hover over create game, open their friends list, hover to your name, press \"Y\", and then press \"A\" as fast as possible. Repeat this step until your friend tells you his rank indicator doesn't show. Now have them back out and select \"Xbox 360\", then hover over public match. Join your friends game with a second controller. Open a custom game, set the game mode to Free for All, and add the guest controller. Now, open your friends list and join your friend. Set up the game. You will have 10-15 seconds to do this. Open a saved Capture the Flag Glitch mode, and set the bot settings. The game will start automatically. Boost to your hearts content. If done correctly, when you end the game, you will have gained XP and unlocked challenges completed in game.",
  "tyn_model":[
    "controller",
    "xbox 360"
  ],
  "tyn_section":[

  ]
}