{
  "title":"How to Connect a Wireless Xbox 360 Controller",
  "url":"https://www.wikihow.com/Connect-a-Wireless-Xbox-360-Controller",
  "category_hierarchy":[
    "Hobbies and Crafts",
    "Games",
    "Video Games",
    "Xbox",
    "Xbox 360"
  ],
  "methods":[
    {
      "name":"Connecting to an Xbox 360",
      "steps":[
        {
          "headline":"Turn on your Xbox 360.",
          "description":"Press the Power button on the right side of the console's face. Make sure your console is plugged into a power source."
        },
        {
          "headline":"Turn on the controller.",
          "description":"Press and hold the Guide button, which is the Xbox logo in the middle of the controller. It will start flashing."
        },
        {
          "headline":"Press the Xbox 360's connection button.",
          "description":"It has a >>> icon next to it; pressing it will cause the Xbox 360's light to begin circling the Power button. The connection button is in one of three places, depending on your Xbox 360 model:\n\nOriginal Xbox 360 - Right of the memory card slots. Xbox 360 S - Left of the USB slots that are in the lower-right side of the Xbox 360's face. Xbox 360 E - Bottom-right corner of the Xbox 360's face."
        },
        {
          "headline":"Press the controller's connection button.",
          "description":"It's a button with the >>> icon on the front of the controller, between the shoulder buttons (LB and RB). You will have 20 seconds after pressing the button on the console to press the button on the controller."
        },
        {
          "headline":"Wait for your controller to connect.",
          "description":"Once the controller's Guide light turns constant and the Xbox 360's Power light stops circling, your controller is synchronized to your console."
        }
      ]
    },
    {
      "name":"Connecting to a Windows Computer",
      "steps":[
        {
          "headline":"Buy an Xbox 360 USB Wireless Receiver.",
          "description":"You can find these on Amazon or in tech department stores like Best Buy. Be sure to buy an officially licensed Microsoft receiver and not a third-party one, since third-party receivers do not work."
        },
        {
          "headline":"Attach the receiver to your PC.",
          "description":"It should plug into one of your computer's USB ports. Plugging the receiver into your computer will prompt its drivers to install. If the drivers don't automatically install, you can insert the disc that comes with your receiver to prompt them to install."
        },
        {
          "headline":"Unplug your Xbox 360 from its power source.",
          "description":"If you have an Xbox 360, disconnect it from its power source before continuing; otherwise, your controller will attempt to connect to the Xbox 360 instead."
        },
        {
          "headline":"Turn on the controller.",
          "description":"Press and hold the Guide button, which is the Xbox logo in the middle of the controller. It will start flashing."
        },
        {
          "headline":"Press the receiver's connection button.",
          "description":"It's a circular button in the middle of the receiver. The receiver's light will turn on."
        },
        {
          "headline":"Press the controller's connection button.",
          "description":"It's a button with the >>> icon on the front of the controller, between the shoulder buttons (LB and RB). Once the Xbox 360 controller's Guide light stops flashing, it is connected to your PC's wireless receiver."
        },
        {
          "headline":"Test the controller in a game.",
          "description":"Your controller's settings will differ from game to game, and you may need to customize your controller's settings in a game before you can use the controller."
        }
      ]
    },
    {
      "name":"Connecting to a Mac Computer",
      "steps":[
        {
          "headline":"Buy an Xbox 360 USB Wireless Receiver.",
          "description":"You can find these on Amazon or in tech department stores like Best Buy. Be sure to buy an officially licensed Microsoft receiver and not a third-party one, since third-party receivers do not work."
        },
        {
          "headline":"Go to the Mac Xbox 360 driver webpage.",
          "description":"Go to https://github.com/360Controller/360Controller/releases/tag/v0.16.5 in your web browser."
        },
        {
          "headline":"Click the \"360ControllerInstall\" link.",
          "description":"This is the .dmg file listed just below the \"Downloads\" heading. The file will download to your Mac."
        },
        {
          "headline":"Install the Xbox 360 driver.",
          "description":"Double-click the .dmg file, then click and drag the driver's icon into the Applications folder. If you encounter an error during this process, do the following:\nOpen the Apple menu. Click System Preferences. Click Security & Privacy. Click the lock icon and enter your password if prompted. Click Open Anyway next to the file name. Click Open when prompted."
        },
        {
          "headline":"Restart your Mac.",
          "description":"Click the Apple menu {\"smallUrl\":\"https:\\/\\/www.wikihow.com\\/images\\/f\\/ff\\/Macapple1.png\",\"bigUrl\":\"\\/images\\/thumb\\/f\\/ff\\/Macapple1.png\\/29px-Macapple1.png\",\"smallWidth\":460,\"smallHeight\":476,\"bigWidth\":\"29\",\"bigHeight\":\"30\",\"licensing\":\"<div class=\\\"mw-parser-output\\\"><p>I edited this screenshot of a Mac icon.\\n<\\/p><p>License: <a rel=\\\"nofollow\\\" class=\\\"external text\\\" href=\\\"http:\\/\\/en.wikipedia.org\\/wiki\\/Fair_use\\\">Fair Use<\\/a><br>\\n<\\/p><\\/div>\"}, click Restart, and click Restart when prompted. This will ensure that the .dmg file's drivers are incorporated."
        },
        {
          "headline":"Attach the receiver to your Mac.",
          "description":"It should plug into one of the USB ports on your computer's housing. If your Mac doesn't have USB ports, you'll need to purchase a USB-C to USB adapter."
        },
        {
          "headline":"Unplug your Xbox 360 from its power source.",
          "description":"If you have an Xbox 360, disconnect it from its power source before continuing; otherwise, your controller will attempt to connect to the Xbox 360 instead."
        },
        {
          "headline":"Turn on the controller.",
          "description":"Press and hold the Guide button, which is the Xbox logo in the middle of the controller. It will start flashing."
        },
        {
          "headline":"Press the receiver's connection button.",
          "description":"It's a circular button in the middle of the receiver. The receiver's light will turn on."
        },
        {
          "headline":"Press the controller's connection button.",
          "description":"It's a button with the >>> icon on the front of the controller, between the shoulder buttons (LB and RB). Once the Xbox 360 controller's Guide light stops flashing, it is connected to your computer's wireless receiver."
        },
        {
          "headline":"Open the Apple menu .",
          "description":"It's in the upper-left corner of the screen."
        },
        {
          "headline":"Click System Preferences.",
          "description":"This option is near the top of the drop-down menu. Doing so opens the System Preferences window."
        },
        {
          "headline":"Click the Xbox 360 Controllers icon.",
          "description":"It resembles an Xbox 360 controller. Doing so opens the controller window, where you should see your controller listed in the box at the top of the window. This means that your Xbox 360 controller is connected to your Mac."
        },
        {
          "headline":"Test the controller in a game.",
          "description":"Your controller's settings will differ from game to game, and you may need to customize your controller's settings in a game before you can use the controller."
        }
      ]
    }
  ],
  "text":" Connecting to an Xbox 360 Turn on your Xbox 360. Press the Power button on the right side of the console's face. Make sure your console is plugged into a power source. Turn on the controller. Press and hold the Guide button, which is the Xbox logo in the middle of the controller. It will start flashing. Press the Xbox 360's connection button. It has a >>> icon next to it; pressing it will cause the Xbox 360's light to begin circling the Power button. The connection button is in one of three places, depending on your Xbox 360 model:\n\nOriginal Xbox 360 - Right of the memory card slots. Xbox 360 S - Left of the USB slots that are in the lower-right side of the Xbox 360's face. Xbox 360 E - Bottom-right corner of the Xbox 360's face. Press the controller's connection button. It's a button with the >>> icon on the front of the controller, between the shoulder buttons (LB and RB). You will have 20 seconds after pressing the button on the console to press the button on the controller. Wait for your controller to connect. Once the controller's Guide light turns constant and the Xbox 360's Power light stops circling, your controller is synchronized to your console. Connecting to a Windows Computer Buy an Xbox 360 USB Wireless Receiver. You can find these on Amazon or in tech department stores like Best Buy. Be sure to buy an officially licensed Microsoft receiver and not a third-party one, since third-party receivers do not work. Attach the receiver to your PC. It should plug into one of your computer's USB ports. Plugging the receiver into your computer will prompt its drivers to install. If the drivers don't automatically install, you can insert the disc that comes with your receiver to prompt them to install. Unplug your Xbox 360 from its power source. If you have an Xbox 360, disconnect it from its power source before continuing; otherwise, your controller will attempt to connect to the Xbox 360 instead. Turn on the controller. Press and hold the Guide button, which is the Xbox logo in the middle of the controller. It will start flashing. Press the receiver's connection button. It's a circular button in the middle of the receiver. The receiver's light will turn on. Press the controller's connection button. It's a button with the >>> icon on the front of the controller, between the shoulder buttons (LB and RB). Once the Xbox 360 controller's Guide light stops flashing, it is connected to your PC's wireless receiver. Test the controller in a game. Your controller's settings will differ from game to game, and you may need to customize your controller's settings in a game before you can use the controller. Connecting to a Mac Computer Buy an Xbox 360 USB Wireless Receiver. You can find these on Amazon or in tech department stores like Best Buy. Be sure to buy an officially licensed Microsoft receiver and not a third-party one, since third-party receivers do not work. Go to the Mac Xbox 360 driver webpage. Go to https://github.com/360Controller/360Controller/releases/tag/v0.16.5 in your web browser. Click the \"360ControllerInstall\" link. This is the .dmg file listed just below the \"Downloads\" heading. The file will download to your Mac. Install the Xbox 360 driver. Double-click the .dmg file, then click and drag the driver's icon into the Applications folder. If you encounter an error during this process, do the following:\nOpen the Apple menu. Click System Preferences. Click Security & Privacy. Click the lock icon and enter your password if prompted. Click Open Anyway next to the file name. Click Open when prompted. Restart your Mac. Click the Apple menu {\"smallUrl\":\"https:\\/\\/www.wikihow.com\\/images\\/f\\/ff\\/Macapple1.png\",\"bigUrl\":\"\\/images\\/thumb\\/f\\/ff\\/Macapple1.png\\/29px-Macapple1.png\",\"smallWidth\":460,\"smallHeight\":476,\"bigWidth\":\"29\",\"bigHeight\":\"30\",\"licensing\":\"<div class=\\\"mw-parser-output\\\"><p>I edited this screenshot of a Mac icon.\\n<\\/p><p>License: <a rel=\\\"nofollow\\\" class=\\\"external text\\\" href=\\\"http:\\/\\/en.wikipedia.org\\/wiki\\/Fair_use\\\">Fair Use<\\/a><br>\\n<\\/p><\\/div>\"}, click Restart, and click Restart when prompted. This will ensure that the .dmg file's drivers are incorporated. Attach the receiver to your Mac. It should plug into one of the USB ports on your computer's housing. If your Mac doesn't have USB ports, you'll need to purchase a USB-C to USB adapter. Unplug your Xbox 360 from its power source. If you have an Xbox 360, disconnect it from its power source before continuing; otherwise, your controller will attempt to connect to the Xbox 360 instead. Turn on the controller. Press and hold the Guide button, which is the Xbox logo in the middle of the controller. It will start flashing. Press the receiver's connection button. It's a circular button in the middle of the receiver. The receiver's light will turn on. Press the controller's connection button. It's a button with the >>> icon on the front of the controller, between the shoulder buttons (LB and RB). Once the Xbox 360 controller's Guide light stops flashing, it is connected to your computer's wireless receiver. Open the Apple menu . It's in the upper-left corner of the screen. Click System Preferences. This option is near the top of the drop-down menu. Doing so opens the System Preferences window. Click the Xbox 360 Controllers icon. It resembles an Xbox 360 controller. Doing so opens the controller window, where you should see your controller listed in the box at the top of the window. This means that your Xbox 360 controller is connected to your Mac. Test the controller in a game. Your controller's settings will differ from game to game, and you may need to customize your controller's settings in a game before you can use the controller.",
  "tyn_model":[
    "xbox 360",
    "controller",
    "receiver",
    "xbox 360 controller",
    "mac",
    "xbox 360 usb wireless receiver",
    "receivers",
    "wireless receiver",
    "xbox 360 driver",
    "apple menu",
    "parser",
    "usb-c to usb adapter",
    "system preferences",
    "xbox 360 controllers"
  ],
  "tyn_section":[

  ]
}