{
  "title":"How to Play PS3 Games on the PS4",
  "url":"https://www.wikihow.com/Play-PS3-Games-on-the-PS4",
  "category_hierarchy":[
    "Hobbies and Crafts",
    "Games",
    "Video Games",
    "PlayStation Video Game Consoles"
  ],
  "parts":[
    {
      "name":"Getting a Playstation Now Subscription",
      "steps":[
        {
          "headline":"Connect your PS4 to the Internet.",
          "description":"If you haven't already done so, connect your PS4 to the internet. In order to use Playstation Now, you need a broadband internet to connect"
        },
        {
          "headline":"Sign up for a Playstation Network account.",
          "description":"If you haven't already done so, you need to sign up for a Playstation Network account. You can do so on your PS4 or through the Playstation Store website."
        },
        {
          "headline":"Select the Playstation Store icon.",
          "description":"It's the first icon on the Playstation 4 dynamic menu. It has an icon that resembles a shopping back. Press X on the controller to select the Playstation Store. This is where you can purchase and sign up for PlayStation Now."
        },
        {
          "headline":"Scroll down and select PS Now.",
          "description":"It's near the bottom of the sidebar menu on the left."
        },
        {
          "headline":"Select Start 7-day free trial.",
          "description":"It's the orange button in the center of the screen. You get a free 7-day trial to Playstation Now. After that, it is $19.99 plus tax per month. You can explore the Playstation Now library online at https://www.playstation.com/en-us/explore/playstation-now/games/. Just click the blue button that says See All Games."
        },
        {
          "headline":"Select Subscribe.",
          "description":"It's the blue button below \"7 Days free trial\" to the left. Press the X button to select it. If it says Not available for purchase you may have already used your PS Now free trial."
        },
        {
          "headline":"Select Confirm Purchase.",
          "description":"It the third button on the right. Use the directional buttons or left stick to navigate to the button and press X to select it. You can also select Connection Test to test if your internet connection is fast enough for Playstation Now."
        },
        {
          "headline":"Enter your Playstation Network password.",
          "description":"In order to confirm your purchase, you need to enter the password associated with your PSN account. Use the controller to navigate the on-screen keyboard and enter your PSN password and press X. This starts your free PS Now trial. If you decide not to continue your subscription after the 7-day free trial, you will need to turn off auto-renew before the trial is over. To turn off auto renew on your Playstation 4, navigate to Settings. Then select Account Management. Select Account Information, and select PlayStation Subscriptions. Select Playstation Now Subscription and select Turn Off Auto-Renew."
        }
      ]
    },
    {
      "name":"Playing PS3 Games on PS Now",
      "steps":[
        {
          "headline":"Press the PS button on your controller.",
          "description":"It's the button with the Playstation logo in the center of your Dualshock controller. This opens the dynamic menu on the PS4."
        },
        {
          "headline":"Open the PS Now app.",
          "description":"It has an icon that resembles the Playstation logo in a curvy triangle. Use the controller to navigate to the PS Now app on the dynamic menu and press X to open the app. If you don't see the PS Now app on your main dynamic menu, navigate all the way to the right and select Library. Then select Applications in the sidebar to the left, and select PS Now in the Applications menu."
        },
        {
          "headline":"Select Start.",
          "description":"It's below the Playstation Now icon to the right. This launches the app."
        },
        {
          "headline":"Select Browse.",
          "description":"It's the third tab at the top of the screen. Use the left stick or directional buttons on the controller to navigate to it and press X.\nAlternatively, if you know of a specific game you want to play, select Search instead. Select Type to search and use the on-screen keyboard to type the name of the game you want to search for."
        },
        {
          "headline":"Select the PS3 games box.",
          "description":"It's the fourth box in the browse menu. This displays a list of all available PS3 games."
        },
        {
          "headline":"Select a game.",
          "description":"Use the left stick or directional buttons on the controller to navigate to a game you want to play. Then press X to open the game."
        },
        {
          "headline":"Select Stream Now.",
          "description":"It's the blue button below the game title. This starts the game. Allow a few moments for the game to finish loading. Press the PS button on the controller to access the PS Now menu. Press the right side of the touchpad to press Start. Press the left side of the touchpad to press Select."
        }
      ]
    },
    {
      "name":"Troubleshooting",
      "steps":[
        {
          "headline":"Switch to using a wired connection.",
          "description":"A wired connection is usually more reliable than a wireless connection. If PlayStation Now fails to stream or connect properly through a wireless connection, try switching to a wired connection. Sony recommends using a wired connection with an Ethernet cable for the best results when using PlayStation Now."
        },
        {
          "headline":"Suspend or cancel any large downloads and other streaming services.",
          "description":"If your connection is poor when using PlayStation Now, you may be using too much bandwidth. Make sure that there aren't any large downloads or streaming services (such as Netflix, or YouTube) running on any other devices connected to your wireless network. Large downloads and streaming services running on smartphones and other computers can interfere with the streaming speed for Playstation Now on your PS4."
        }
      ]
    }
  ],
  "text":" Getting a Playstation Now Subscription Connect your PS4 to the Internet. If you haven't already done so, connect your PS4 to the internet. In order to use Playstation Now, you need a broadband internet to connect Sign up for a Playstation Network account. If you haven't already done so, you need to sign up for a Playstation Network account. You can do so on your PS4 or through the Playstation Store website. Select the Playstation Store icon. It's the first icon on the Playstation 4 dynamic menu. It has an icon that resembles a shopping back. Press X on the controller to select the Playstation Store. This is where you can purchase and sign up for PlayStation Now. Scroll down and select PS Now. It's near the bottom of the sidebar menu on the left. Select Start 7-day free trial. It's the orange button in the center of the screen. You get a free 7-day trial to Playstation Now. After that, it is $19.99 plus tax per month. You can explore the Playstation Now library online at https://www.playstation.com/en-us/explore/playstation-now/games/. Just click the blue button that says See All Games. Select Subscribe. It's the blue button below \"7 Days free trial\" to the left. Press the X button to select it. If it says Not available for purchase you may have already used your PS Now free trial. Select Confirm Purchase. It the third button on the right. Use the directional buttons or left stick to navigate to the button and press X to select it. You can also select Connection Test to test if your internet connection is fast enough for Playstation Now. Enter your Playstation Network password. In order to confirm your purchase, you need to enter the password associated with your PSN account. Use the controller to navigate the on-screen keyboard and enter your PSN password and press X. This starts your free PS Now trial. If you decide not to continue your subscription after the 7-day free trial, you will need to turn off auto-renew before the trial is over. To turn off auto renew on your Playstation 4, navigate to Settings. Then select Account Management. Select Account Information, and select PlayStation Subscriptions. Select Playstation Now Subscription and select Turn Off Auto-Renew. Playing PS3 Games on PS Now Press the PS button on your controller. It's the button with the Playstation logo in the center of your Dualshock controller. This opens the dynamic menu on the PS4. Open the PS Now app. It has an icon that resembles the Playstation logo in a curvy triangle. Use the controller to navigate to the PS Now app on the dynamic menu and press X to open the app. If you don't see the PS Now app on your main dynamic menu, navigate all the way to the right and select Library. Then select Applications in the sidebar to the left, and select PS Now in the Applications menu. Select Start. It's below the Playstation Now icon to the right. This launches the app. Select Browse. It's the third tab at the top of the screen. Use the left stick or directional buttons on the controller to navigate to it and press X.\nAlternatively, if you know of a specific game you want to play, select Search instead. Select Type to search and use the on-screen keyboard to type the name of the game you want to search for. Select the PS3 games box. It's the fourth box in the browse menu. This displays a list of all available PS3 games. Select a game. Use the left stick or directional buttons on the controller to navigate to a game you want to play. Then press X to open the game. Select Stream Now. It's the blue button below the game title. This starts the game. Allow a few moments for the game to finish loading. Press the PS button on the controller to access the PS Now menu. Press the right side of the touchpad to press Start. Press the left side of the touchpad to press Select. Troubleshooting Switch to using a wired connection. A wired connection is usually more reliable than a wireless connection. If PlayStation Now fails to stream or connect properly through a wireless connection, try switching to a wired connection. Sony recommends using a wired connection with an Ethernet cable for the best results when using PlayStation Now. Suspend or cancel any large downloads and other streaming services. If your connection is poor when using PlayStation Now, you may be using too much bandwidth. Make sure that there aren't any large downloads or streaming services (such as Netflix, or YouTube) running on any other devices connected to your wireless network. Large downloads and streaming services running on smartphones and other computers can interfere with the streaming speed for Playstation Now on your PS4.",
  "tyn_model":[
    "playstation now",
    "ps now",
    "controller",
    "ps4",
    "playstation network",
    "playstation store",
    "ps3 games",
    "playstation now subscription",
    "playstation 4 dynamic menu",
    "ps now trial",
    "playstation 4",
    "dualshock controller",
    "ps now app",
    "playstation"
  ],
  "tyn_section":[

  ]
}