{
  "title":"How to Descale a Magimix Coffee Machine",
  "url":"https://www.wikihow.com/Descale-a-Magimix-Coffee-Machine",
  "category_hierarchy":[
    "Food and Entertaining",
    "Drinks",
    "Coffee",
    "Coffee Accessories"
  ],
  "methods":[
    {
      "name":"Magimix U, Inissia, Pixie, or Citiz",
      "steps":[
        {
          "headline":"Throw away used capsules and water.",
          "description":"Remove the coffee capsule if present. Pour out water from the drip tray. Lower the lever to move the capsule container back into place."
        },
        {
          "headline":"Pour water and descaling liquid into the water tank.",
          "description":"You'll need 0.5 liters (17 oz) of water, and one Nespresso descaling liquid packet. Take care not to get the descaling liquid on your skin or clothing. The Citiz & Co. model with two nozzles requires 1 liter (34 oz) of water and two descaling packets. You can make your own descaling liquid by mixing 5g citric acid into 95mL water. This approach is not approved by the manufacturer, but citric acid is the active ingredient in its descaler."
        },
        {
          "headline":"Place a container under the nozzle.",
          "description":"Choose one large enough to hold all the liquid in the water tank. On a Citiz & Co. model, repeat each step of this process for the second nozzle."
        },
        {
          "headline":"Turn on the machine.",
          "description":"Wait until the lights stop blinking before you continue."
        },
        {
          "headline":"Hold both cup buttons down for three seconds.",
          "description":"Once the lights start blinking, your machine is in descaling mode. On the Magimix U model, the slider must be closed for this step. After the machine beeps, open the slider and hold both buttons down again until a second beep."
        },
        {
          "headline":"Press the large cup button to start descaling.",
          "description":"Leave the machine alone until the water tank is empty. This can take anywhere from 90 seconds to several minutes. On the Magimix U model, just close the slider to start descaling. Do not press any buttons."
        },
        {
          "headline":"Descale again with the same liquid.",
          "description":"Pour the liquid that went through the machine back into the water tank. Press the large cup button again. Let the machine run again until the liquid is gone from the tank."
        },
        {
          "headline":"Repeat with drinking water.",
          "description":"Pour out the descaling solution. Rinse the water tank thoroughly, then fill it with ordinary water. Press the large cup button to run the machine through descaling mode one more time."
        },
        {
          "headline":"Return to normal mode.",
          "description":"Once the water tank is empty, the descaling process is complete. Hold both cup buttons down for three seconds. The machine is now ready for brewing, although it may take thirty seconds to heat it up."
        }
      ]
    },
    {
      "name":"Magimix Essenza or Le Cube",
      "steps":[
        {
          "headline":"Empty the capsule container and drip tray.",
          "description":"Remove the coffee capsule and pour water out of the drip tray."
        },
        {
          "headline":"Rinse the machine.",
          "description":"Fill the water tank and place a container under the nozzle. Turn on the machine. Press the coffee button, let water run through for about a minute, then press the coffee button again to stop. If you have the Essenza Automatic model, instead let the water run until it stops, and repeat until you've pressed the coffee button six times. If no water comes through at all, stop the machine and lift the lever. Start the machine again, then lower the lever once you see water reach the nozzle. If this still doesn't work, Essenza models (but not Essenza Automatic) have another option you can try. While the machine is off, press and hold the power button while you press the coffee button three times. Flip the lever open, hold it there for three seconds, and close it again. The machine should shut down and attempt to repair itself. It will not be usable for thirty minutes."
        },
        {
          "headline":"Pour water and descaling liquid into the water tank.",
          "description":"Measure out 0.5 liters (17 oz) of water and pour it into the tank. Add one packet of Nespresso descaling liquid. The descaling liquid is a strong irritant, so keep it away from skin and the casing of your machine. Alternatively, buy citric acid from the supermarket and dilute 5g of it in 95mL water to make your own descaling liquid."
        },
        {
          "headline":"Insert the filter if there is a slot for it.",
          "description":"The official Nespresso descaling kit comes with a filter. Lift the lever and look for a slot to fit the filter in. Close the lever afterward. If there is no slot, just skip this step."
        },
        {
          "headline":"Put a large container under the nozzle.",
          "description":"Make sure it can hold all the liquid you added."
        },
        {
          "headline":"Hold down both buttons for three seconds.",
          "description":"Hold down the power and coffee buttons until they start to flash. The machine is now in descale mode."
        },
        {
          "headline":"Press the coffee button.",
          "description":"Leave the machine alone until all the descaling liquid has gone through the machine."
        },
        {
          "headline":"Descale again with the same liquid.",
          "description":"Pour the collected liquid back into the water tank. Press the coffee button and let it run through a second time."
        },
        {
          "headline":"Remove the filter and rinse.",
          "description":"Take out the filter if you used it. Rinse the water tank and collection container thoroughly to remove traces of descaling liquid. Fill the water tank with drinking water. Press the coffee button one more time and let it run through."
        },
        {
          "headline":"Exit descaling mode.",
          "description":"On an Essenza Automatic or a Le Cube machine, hold the power and coffee buttons down for three seconds. On an ordinary Essenza model, just turn the machine off and on again."
        }
      ]
    },
    {
      "name":"Magimix 200 or 200A",
      "steps":[
        {
          "headline":"Prepare the machine.",
          "description":"Before you begin descaling, take care of the following:\nRemove any coffee capsules. Empty the drip tray. Remove the steam nozzle and place a cloth under the hole. You may need to unclog the steam nozzle separately with a needle or a special nozzle cleaning tool."
        },
        {
          "headline":"Fill the tank with water and descaling solution.",
          "description":"Pour in 500 mL (17 oz) of water and one 100mL (3.4oz) packet of Nespresso descaling solution. You can make a cheaper descaling solution with a 20:1 mix of citric acid and water. Never use vinegar."
        },
        {
          "headline":"Let the liquid pass through the machine.",
          "description":"Place a large container under the nozzle. Start the descaling process as follows:\nMagimix 200: Turn on the machine and set the switch to hot water. Magimix 200A: Turn on the machine. Once it's warmed up, press and hold the two coffee buttons simultaneously for three seconds. Press the coffee button whenever the water runs out, until the tank is empty (about five presses)."
        },
        {
          "headline":"Descale the coffee system.",
          "description":"If using the 200 model (not 200A), pour the collected liquid back into the water tank. Move the switch to \"Coffee\" and let the tank empty again."
        },
        {
          "headline":"Rinse the machine.",
          "description":"Rinse the tank thoroughly and fill with fresh water. Run the water through the machine until the tank is empty. Magimix 200A: Turn the machine off and on again to return to brew mode."
        }
      ]
    }
  ],
  "text":" Magimix U, Inissia, Pixie, or Citiz Throw away used capsules and water. Remove the coffee capsule if present. Pour out water from the drip tray. Lower the lever to move the capsule container back into place. Pour water and descaling liquid into the water tank. You'll need 0.5 liters (17 oz) of water, and one Nespresso descaling liquid packet. Take care not to get the descaling liquid on your skin or clothing. The Citiz & Co. model with two nozzles requires 1 liter (34 oz) of water and two descaling packets. You can make your own descaling liquid by mixing 5g citric acid into 95mL water. This approach is not approved by the manufacturer, but citric acid is the active ingredient in its descaler. Place a container under the nozzle. Choose one large enough to hold all the liquid in the water tank. On a Citiz & Co. model, repeat each step of this process for the second nozzle. Turn on the machine. Wait until the lights stop blinking before you continue. Hold both cup buttons down for three seconds. Once the lights start blinking, your machine is in descaling mode. On the Magimix U model, the slider must be closed for this step. After the machine beeps, open the slider and hold both buttons down again until a second beep. Press the large cup button to start descaling. Leave the machine alone until the water tank is empty. This can take anywhere from 90 seconds to several minutes. On the Magimix U model, just close the slider to start descaling. Do not press any buttons. Descale again with the same liquid. Pour the liquid that went through the machine back into the water tank. Press the large cup button again. Let the machine run again until the liquid is gone from the tank. Repeat with drinking water. Pour out the descaling solution. Rinse the water tank thoroughly, then fill it with ordinary water. Press the large cup button to run the machine through descaling mode one more time. Return to normal mode. Once the water tank is empty, the descaling process is complete. Hold both cup buttons down for three seconds. The machine is now ready for brewing, although it may take thirty seconds to heat it up. Magimix Essenza or Le Cube Empty the capsule container and drip tray. Remove the coffee capsule and pour water out of the drip tray. Rinse the machine. Fill the water tank and place a container under the nozzle. Turn on the machine. Press the coffee button, let water run through for about a minute, then press the coffee button again to stop. If you have the Essenza Automatic model, instead let the water run until it stops, and repeat until you've pressed the coffee button six times. If no water comes through at all, stop the machine and lift the lever. Start the machine again, then lower the lever once you see water reach the nozzle. If this still doesn't work, Essenza models (but not Essenza Automatic) have another option you can try. While the machine is off, press and hold the power button while you press the coffee button three times. Flip the lever open, hold it there for three seconds, and close it again. The machine should shut down and attempt to repair itself. It will not be usable for thirty minutes. Pour water and descaling liquid into the water tank. Measure out 0.5 liters (17 oz) of water and pour it into the tank. Add one packet of Nespresso descaling liquid. The descaling liquid is a strong irritant, so keep it away from skin and the casing of your machine. Alternatively, buy citric acid from the supermarket and dilute 5g of it in 95mL water to make your own descaling liquid. Insert the filter if there is a slot for it. The official Nespresso descaling kit comes with a filter. Lift the lever and look for a slot to fit the filter in. Close the lever afterward. If there is no slot, just skip this step. Put a large container under the nozzle. Make sure it can hold all the liquid you added. Hold down both buttons for three seconds. Hold down the power and coffee buttons until they start to flash. The machine is now in descale mode. Press the coffee button. Leave the machine alone until all the descaling liquid has gone through the machine. Descale again with the same liquid. Pour the collected liquid back into the water tank. Press the coffee button and let it run through a second time. Remove the filter and rinse. Take out the filter if you used it. Rinse the water tank and collection container thoroughly to remove traces of descaling liquid. Fill the water tank with drinking water. Press the coffee button one more time and let it run through. Exit descaling mode. On an Essenza Automatic or a Le Cube machine, hold the power and coffee buttons down for three seconds. On an ordinary Essenza model, just turn the machine off and on again. Magimix 200 or 200A Prepare the machine. Before you begin descaling, take care of the following:\nRemove any coffee capsules. Empty the drip tray. Remove the steam nozzle and place a cloth under the hole. You may need to unclog the steam nozzle separately with a needle or a special nozzle cleaning tool. Fill the tank with water and descaling solution. Pour in 500 mL (17 oz) of water and one 100mL (3.4oz) packet of Nespresso descaling solution. You can make a cheaper descaling solution with a 20:1 mix of citric acid and water. Never use vinegar. Let the liquid pass through the machine. Place a large container under the nozzle. Start the descaling process as follows:\nMagimix 200: Turn on the machine and set the switch to hot water. Magimix 200A: Turn on the machine. Once it's warmed up, press and hold the two coffee buttons simultaneously for three seconds. Press the coffee button whenever the water runs out, until the tank is empty (about five presses). Descale the coffee system. If using the 200 model (not 200A), pour the collected liquid back into the water tank. Move the switch to \"Coffee\" and let the tank empty again. Rinse the machine. Rinse the tank thoroughly and fill with fresh water. Run the water through the machine until the tank is empty. Magimix 200A: Turn the machine off and on again to return to brew mode.",
  "tyn_model":[
    "water",
    "citric acid",
    "container",
    "slider",
    "drinking water",
    "drip tray",
    "essenza automatic",
    "nespresso descaling",
    "nespresso descaling liquid",
    "g citric acid",
    "large cup",
    "ordinary water",
    "descaling liquid",
    "filter",
    "coffee",
    "nespresso descaling solution",
    "vinegar"
  ],
  "tyn_section":[

  ]
}