{
  "title":"How to Clean a Shower Curtain",
  "url":"https://www.wikihow.com/Clean-a-Shower-Curtain",
  "category_hierarchy":[
    "Home and Garden",
    "Home Maintenance",
    "Doors and Windows",
    "Window Treatments",
    "Curtains"
  ],
  "methods":[
    {
      "name":"Machine Washing Your Shower Curtain",
      "steps":[
        {
          "headline":"Place the shower curtain or liner into your washing machine.",
          "description":"To start, remove the shower curtain from the wall in your bathroom. Then, place it in  your washing machine. Make sure you remove any metal hooks that may be on the shower curtain before placing it in your washing machine."
        },
        {
          "headline":"Place one or two towels into the washing machine.",
          "description":"This helps prevent the shower curtain or liner from wrinkling, sticking to itself, and being torn apart in the machine. The towels also scrub the shower curtain while the washing machine is going. Take one to two white towels and throw them into the washing machine. The towels you use should be clean."
        },
        {
          "headline":"Add baking soda and detergent.",
          "description":"Add the normal amount of laundry detergent you would use for a load of laundry. From there, add half a cup to a cup of baking soda. Bigger shower curtains will require more baking soda."
        },
        {
          "headline":"Start the machine.",
          "description":"Turn on your washing machine. Select the highest cleaning level. Wash your shower curtain in warm water."
        },
        {
          "headline":"Use bleach for built-up stains.",
          "description":"For mildly dirty shower curtains, you do not need anything other than baking soda and detergent. However, if there is a lot of mildew and other stains on your curtain, add bleach. After adding your baking soda and detergent, turn the machine on. Pour in half a cup of bleach as the washer fills with water. Only add bleach if your shower curtain is white or transparent."
        },
        {
          "headline":"Add vinegar during the rinse cycle.",
          "description":"When the washing machine switches to the rinse cycle, open the machine. Pour in a half cup to a cup of the distilled vinegar. Restart the machine and allow it finish the cycle."
        },
        {
          "headline":"Hang the shower curtain or liner to drip-dry.",
          "description":"Never dry a shower curtain. Instead, hang it back up in the shower after it's done in the washing machine. It should drip dry on its own from there."
        }
      ]
    },
    {
      "name":"Hand Washing Your Shower Curtain",
      "steps":[
        {
          "headline":"Add baking soda to a dampened cloth.",
          "description":"Get a clean microfiber cloth slightly damp. Then, sprinkle baking soda over the cloth so the cloth is coated in a light layer of baking soda."
        },
        {
          "headline":"Scrub down the entire shower curtain.",
          "description":"Use your cloth to scrub down the curtain. Give the curtain a light scrub at first, leaving set-in stains alone for now. Focus on removing basic grime and dirt only."
        },
        {
          "headline":"Rinse with warm water.",
          "description":"Take a new cloth and get it damp with warm water. Swipe it over the shower curtain to remove all of the baking soda and water. Make sure to scrub the curtain until all traces of baking soda are gone. Add more water to the cloth as necessary."
        },
        {
          "headline":"Clean any remaining stains.",
          "description":"After giving the shower curtain a general cleaning, get your cloth damp again and sprinkle it with baking soda. Scrub out any set in soap stains or mildew this time around. Focus on areas you glossed over during the first round of cleaning."
        },
        {
          "headline":"Rinse the curtain again.",
          "description":"Get another clean cloth damp with warm, clean water. Rub down the shower curtain again to remove any baking soda residue. Do not leave any lingering baking soda on the shower curtain. Make sure you keep rinsing the shower curtain until your cloth runs clean."
        }
      ]
    },
    {
      "name":"Taking Precautions",
      "steps":[
        {
          "headline":"Spot test any cleaner first.",
          "description":"Before applying detergents, cleaners, or bleach to a shower curtain, test out the cleaners on a small portion of the curtain. Make sure they do not cause discoloration or damage. If you notice any damage, opt for a different cleaner."
        },
        {
          "headline":"Read the care label.",
          "description":"Before washing a shower curtain, give the care label a close read. Most shower curtains can be washed in the washing machine with detergent or bleach, but some are hand wash only. Others may require specific types of cleaning. Always read the care label over carefully before washing your curtain."
        },
        {
          "headline":"Maintain a clean shower curtain.",
          "description":"After cleaning your shower curtain, take steps to make sure mold and mildew do not build up in the future. Spray down the shower curtain with a mixture of half water and half vinegar each day. Wash the bottom of the shower curtain with vinegar and water each week to remove any soap scum and mildew building up on the bottom of the curtain. Go for body wash over bar soaps, as bar soaps can cause scum."
        }
      ]
    }
  ],
  "text":" Machine Washing Your Shower Curtain Place the shower curtain or liner into your washing machine. To start, remove the shower curtain from the wall in your bathroom. Then, place it in  your washing machine. Make sure you remove any metal hooks that may be on the shower curtain before placing it in your washing machine. Place one or two towels into the washing machine. This helps prevent the shower curtain or liner from wrinkling, sticking to itself, and being torn apart in the machine. The towels also scrub the shower curtain while the washing machine is going. Take one to two white towels and throw them into the washing machine. The towels you use should be clean. Add baking soda and detergent. Add the normal amount of laundry detergent you would use for a load of laundry. From there, add half a cup to a cup of baking soda. Bigger shower curtains will require more baking soda. Start the machine. Turn on your washing machine. Select the highest cleaning level. Wash your shower curtain in warm water. Use bleach for built-up stains. For mildly dirty shower curtains, you do not need anything other than baking soda and detergent. However, if there is a lot of mildew and other stains on your curtain, add bleach. After adding your baking soda and detergent, turn the machine on. Pour in half a cup of bleach as the washer fills with water. Only add bleach if your shower curtain is white or transparent. Add vinegar during the rinse cycle. When the washing machine switches to the rinse cycle, open the machine. Pour in a half cup to a cup of the distilled vinegar. Restart the machine and allow it finish the cycle. Hang the shower curtain or liner to drip-dry. Never dry a shower curtain. Instead, hang it back up in the shower after it's done in the washing machine. It should drip dry on its own from there. Hand Washing Your Shower Curtain Add baking soda to a dampened cloth. Get a clean microfiber cloth slightly damp. Then, sprinkle baking soda over the cloth so the cloth is coated in a light layer of baking soda. Scrub down the entire shower curtain. Use your cloth to scrub down the curtain. Give the curtain a light scrub at first, leaving set-in stains alone for now. Focus on removing basic grime and dirt only. Rinse with warm water. Take a new cloth and get it damp with warm water. Swipe it over the shower curtain to remove all of the baking soda and water. Make sure to scrub the curtain until all traces of baking soda are gone. Add more water to the cloth as necessary. Clean any remaining stains. After giving the shower curtain a general cleaning, get your cloth damp again and sprinkle it with baking soda. Scrub out any set in soap stains or mildew this time around. Focus on areas you glossed over during the first round of cleaning. Rinse the curtain again. Get another clean cloth damp with warm, clean water. Rub down the shower curtain again to remove any baking soda residue. Do not leave any lingering baking soda on the shower curtain. Make sure you keep rinsing the shower curtain until your cloth runs clean. Taking Precautions Spot test any cleaner first. Before applying detergents, cleaners, or bleach to a shower curtain, test out the cleaners on a small portion of the curtain. Make sure they do not cause discoloration or damage. If you notice any damage, opt for a different cleaner. Read the care label. Before washing a shower curtain, give the care label a close read. Most shower curtains can be washed in the washing machine with detergent or bleach, but some are hand wash only. Others may require specific types of cleaning. Always read the care label over carefully before washing your curtain. Maintain a clean shower curtain. After cleaning your shower curtain, take steps to make sure mold and mildew do not build up in the future. Spray down the shower curtain with a mixture of half water and half vinegar each day. Wash the bottom of the shower curtain with vinegar and water each week to remove any soap scum and mildew building up on the bottom of the curtain. Go for body wash over bar soaps, as bar soaps can cause scum.",
  "tyn_model":[
    "shower curtain",
    "baking soda",
    "water",
    "washing machine",
    "bleach",
    "vinegar",
    "towels",
    "laundry detergent",
    "washer",
    "distilled vinegar",
    "microfiber cloth",
    "shower curtains",
    "half vinegar",
    "body wash"
  ],
  "tyn_section":[

  ]
}