{
  "title":"How to Make Cotton Candy Cupcakes",
  "url":"https://www.wikihow.com/Make-Cotton-Candy-Cupcakes",
  "category_hierarchy":[
    "Food and Entertaining",
    "Recipes",
    "Baking",
    "Cakes",
    "Cupcakes"
  ],
  "parts":[
    {
      "name":"Making the Cupcakes",
      "steps":[
        {
          "headline":"Prepare to make the cupcakes.",
          "description":"Lay 20 paper cases into a cupcake tray or spray with non-stick greasing spray if no cases are available. Preheat the oven to 375 degrees Fahrenheit or 190 degrees Celsius."
        },
        {
          "headline":"Cream the butter, sugar, and vanilla.",
          "description":"In a large bowl, use an electric or hand blender to cream the sugar, butter, and vanilla extract until light and fluffy. Set aside."
        },
        {
          "headline":"Mix the dry ingredients.",
          "description":"In a separate medium-sized bowl, combine the cake flour, baking powder, and salt. Use a wooden spoon to mix."
        },
        {
          "headline":"Pour the dry ingredients with the wet ingredients.",
          "description":"Pour the bowl of dry ingredients into with the butter mixture. On slow speed, blend in circular motions to properly combine the batter. Add the milk. Blend again until there are no more flour streaks and the batter is glossy."
        },
        {
          "headline":"Scoop the batter into the cupcake tray.",
          "description":"Using an ice cream scoop, scoop the cupcake batter into each case of the cupcake tray. Provide each case with the exact same amount. Avoid adding too much batter in one case or your cupcakes will overflow. At the same, don't add too little batter or your cupcakes have a high chance of burning."
        },
        {
          "headline":"Bake in the oven.",
          "description":"Place the cupcake tray in the oven for baking. Have it bake until the cupcakes rise and the sides turn slightly brown. It will usually take about 15-20 minutes."
        },
        {
          "headline":"Have the cupcakes cool.",
          "description":"Remove the cupcakes carefully from the oven using oven mitts. Have the cupcakes cool on top of the oven or on a wire rack. Have them cool for about 5-7 minutes."
        }
      ]
    },
    {
      "name":"Frosting and Serving",
      "steps":[
        {
          "headline":"Separate the frosting.",
          "description":"Split the frosting into two equal amounts. Place the two amounts into two medium-sized bowls."
        },
        {
          "headline":"Add pink food coloring to the first bowl.",
          "description":"Add 7 drops of pink food coloring to the first bowl. Mix the color in using a fork, until the frosting turns a light pink."
        },
        {
          "headline":"Add light blue food coloring in the second bowl.",
          "description":"Add 5 drops of light blue food coloring to the second bowl. Use a different fork to mix the color, to avoid combining the pink frosting with the blue.."
        },
        {
          "headline":"Place both frostings in the frosting pipe.",
          "description":"Place the pink frosting on one side of the frosting pipe and the light blue on the other side, making it equal by half and half. That way, when you frost the cupcakes, the colors won't combine together and spoil the cotton candy look."
        },
        {
          "headline":"Top the cupcakes off with cotton candy.",
          "description":"An absolute must to finish off your cupcakes is adding the cotton candy. Grab enough cotton candy to decorate the cupcakes, but not too much to cover the frosting. Continue to frost and add cotton candy on all of the cupcakes. Serve."
        },
        {
          "headline":"Enjoy!",
          "description":""
        }
      ]
    }
  ],
  "text":" Making the Cupcakes Prepare to make the cupcakes. Lay 20 paper cases into a cupcake tray or spray with non-stick greasing spray if no cases are available. Preheat the oven to 375 degrees Fahrenheit or 190 degrees Celsius. Cream the butter, sugar, and vanilla. In a large bowl, use an electric or hand blender to cream the sugar, butter, and vanilla extract until light and fluffy. Set aside. Mix the dry ingredients. In a separate medium-sized bowl, combine the cake flour, baking powder, and salt. Use a wooden spoon to mix. Pour the dry ingredients with the wet ingredients. Pour the bowl of dry ingredients into with the butter mixture. On slow speed, blend in circular motions to properly combine the batter. Add the milk. Blend again until there are no more flour streaks and the batter is glossy. Scoop the batter into the cupcake tray. Using an ice cream scoop, scoop the cupcake batter into each case of the cupcake tray. Provide each case with the exact same amount. Avoid adding too much batter in one case or your cupcakes will overflow. At the same, don't add too little batter or your cupcakes have a high chance of burning. Bake in the oven. Place the cupcake tray in the oven for baking. Have it bake until the cupcakes rise and the sides turn slightly brown. It will usually take about 15-20 minutes. Have the cupcakes cool. Remove the cupcakes carefully from the oven using oven mitts. Have the cupcakes cool on top of the oven or on a wire rack. Have them cool for about 5-7 minutes. Frosting and Serving Separate the frosting. Split the frosting into two equal amounts. Place the two amounts into two medium-sized bowls. Add pink food coloring to the first bowl. Add 7 drops of pink food coloring to the first bowl. Mix the color in using a fork, until the frosting turns a light pink. Add light blue food coloring in the second bowl. Add 5 drops of light blue food coloring to the second bowl. Use a different fork to mix the color, to avoid combining the pink frosting with the blue.. Place both frostings in the frosting pipe. Place the pink frosting on one side of the frosting pipe and the light blue on the other side, making it equal by half and half. That way, when you frost the cupcakes, the colors won't combine together and spoil the cotton candy look. Top the cupcakes off with cotton candy. An absolute must to finish off your cupcakes is adding the cotton candy. Grab enough cotton candy to decorate the cupcakes, but not too much to cover the frosting. Continue to frost and add cotton candy on all of the cupcakes. Serve. Enjoy! ",
  "tyn_model":[
    "oven",
    "cotton candy",
    "cupcake tray",
    "butter",
    "sugar",
    "pink food coloring",
    "fork",
    "food coloring",
    "non-stick greasing spray",
    "vanilla",
    "electric or hand blender",
    "vanilla extract",
    "cake flour",
    "baking powder",
    "salt",
    "wooden spoon",
    "bowl",
    "milk",
    "ice cream scoop",
    "cupcake batter",
    "oven mitts",
    "frosting",
    "medium-sized bowls",
    "frosting pipe"
  ],
  "tyn_section":[

  ]
}