{
  "title":"How to Make Cake Batter Cinnamon Rolls",
  "url":"https://www.wikihow.com/Make-Cake-Batter-Cinnamon-Rolls",
  "category_hierarchy":[
    "Food and Entertaining",
    "Recipes",
    "Baking",
    "Breads",
    "Bread Rolls"
  ],
  "parts":[
    {
      "name":"Making the Dough for the Cinnamon Rolls",
      "steps":[
        {
          "headline":"Warm the milk.",
          "description":"Using a small saucepan, heat the milk under low heat. Have the milk heat up until warm, about 95 degrees Fahrenheit or 35 degrees Celsius. It will usually take about 5-7 minutes."
        },
        {
          "headline":"Blend the milk, sugar, and yeast.",
          "description":"In an electric blender mixing bowl, pour in the warm milk and attach the dough hook to prepare for blending. Pour in only \u00bd cup of sugar and add the yeast. Use a whisk to mix until well-combined. Cover the bowl with a towel and let it sit for about 5-10 minutes, until the yeast gets foamy and bubbly."
        },
        {
          "headline":"Add the eggs, butter, and salt.",
          "description":"Crack in the eggs and pour in the butter (only the \u00bd stick) and salt. Use a rubber spatula to combine the ingredients together. While you are combining the dough mixture, scrape the edges occasionally. Do note that there will be butter clumps and pieces in the mixture."
        },
        {
          "headline":"Make the dough.",
          "description":"Add the flour into the mixture and blend on medium speed until the dough forms and is soft. Depending on the type of blender, it could take between 6-12 minutes. If you do not have an electric blender on hand, you can knead the dough yourself."
        },
        {
          "headline":"Have the dough sit.",
          "description":"On a floured surface, lightly knead the dough with your hands for 2 minutes. This helps make the dough easier to handle. Roll the dough into a ball and place it in a large greased mixing bowl. Cover the dough with a towel and have it sit for about 1-2 hours."
        },
        {
          "headline":"Roll the dough out.",
          "description":"Place the dough on a floured surface and roll it out using a rolling pin. Roll it out into a rectangle that's exactly 10 x 24 inches. Ensure the dough is smooth and broad. Even the edges."
        }
      ]
    },
    {
      "name":"Preparing the Filling",
      "steps":[
        {
          "headline":"Make the filling.",
          "description":"Using a food processor mix the sugar, milk powder, salt, and flour. Have it process for about 10 seconds. Add the butter and process again for 10 seconds. Finish the filling by adding the vanilla extract and sprinkles. Process for one more time at 10 seconds and pour filling in a small bowl."
        },
        {
          "headline":"Make the rolls.",
          "description":"Spread the 6 tablespoons of melted butter over the dough. Sprinkle the cinnamon all around and then sprinkle the filling. Roll the dough tightly and use a slicing knife it slice 15 cinnamon rolls. Each roll should be 1.5 inches in width. Place rolls on a dish and cover them with plastic wrap. Have them rise for about 2 hours until they are puffy."
        }
      ]
    },
    {
      "name":"Baking and Serving",
      "steps":[
        {
          "headline":"Prepare to bake the cinnamon rolls.",
          "description":"Preheat your oven to 400 degrees Fahrenheit or 204 degrees Celsius. Cover a 9 x 13 inch baking tray with parchment paper. {\"smallUrl\":\"https:\\/\\/www.wikihow.com\\/images\\/d\\/db\\/Make-Cake-Batter-Cinnamon-Rolls-Step-9.jpg\",\"bigUrl\":\"\\/images\\/thumb\\/d\\/db\\/Make-Cake-Batter-Cinnamon-Rolls-Step-9.jpg\\/v4-190px-Make-Cake-Batter-Cinnamon-Rolls-Step-9.jpg\",\"smallWidth\":460,\"smallHeight\":307,\"bigWidth\":\"190\",\"bigHeight\":\"127\",\"licensing\":\"<div class=\\\"mw-parser-output\\\"><p>License: <a rel=\\\"nofollow\\\" class=\\\"external text\\\" href=\\\"https:\\/\\/creativecommons.org\\/licenses\\/by-nc-sa\\/3.0\\/\\\">Creative Commons<\\/a><br>\\n<\\/p><p><br \\/>\\n<\\/p><\\/div>\"}"
        },
        {
          "headline":"Bake the cinnamon rolls.",
          "description":"Before baking, cover the rolls with aluminum foil to prevent them from browning too quickly while baking. Have them bake for about 25 minutes, until they are golden brown."
        },
        {
          "headline":"Have the cinnamon rolls cool.",
          "description":"Use a spatula to remove the cinnamon rolls from the baking tray and set them on a dish to cool."
        }
      ]
    },
    {
      "name":"Making the Glaze",
      "steps":[
        {
          "headline":"Make the glaze.",
          "description":"In a medium-sized mixing bowl, whisk all the ingredients until glaze forms and is slightly sticky. If you want to make your glaze thicker add more sugar or heavy cream."
        },
        {
          "headline":"Enjoy!",
          "description":"Drizzle the glaze using a fork over the cinnamon rolls. Serve with a glass of cold milk. Enjoy your cake batter cinnamon rolls!"
        }
      ]
    }
  ],
  "text":" Making the Dough for the Cinnamon Rolls Warm the milk. Using a small saucepan, heat the milk under low heat. Have the milk heat up until warm, about 95 degrees Fahrenheit or 35 degrees Celsius. It will usually take about 5-7 minutes. Blend the milk, sugar, and yeast. In an electric blender mixing bowl, pour in the warm milk and attach the dough hook to prepare for blending. Pour in only \u00bd cup of sugar and add the yeast. Use a whisk to mix until well-combined. Cover the bowl with a towel and let it sit for about 5-10 minutes, until the yeast gets foamy and bubbly. Add the eggs, butter, and salt. Crack in the eggs and pour in the butter (only the \u00bd stick) and salt. Use a rubber spatula to combine the ingredients together. While you are combining the dough mixture, scrape the edges occasionally. Do note that there will be butter clumps and pieces in the mixture. Make the dough. Add the flour into the mixture and blend on medium speed until the dough forms and is soft. Depending on the type of blender, it could take between 6-12 minutes. If you do not have an electric blender on hand, you can knead the dough yourself. Have the dough sit. On a floured surface, lightly knead the dough with your hands for 2 minutes. This helps make the dough easier to handle. Roll the dough into a ball and place it in a large greased mixing bowl. Cover the dough with a towel and have it sit for about 1-2 hours. Roll the dough out. Place the dough on a floured surface and roll it out using a rolling pin. Roll it out into a rectangle that's exactly 10 x 24 inches. Ensure the dough is smooth and broad. Even the edges. Preparing the Filling Make the filling. Using a food processor mix the sugar, milk powder, salt, and flour. Have it process for about 10 seconds. Add the butter and process again for 10 seconds. Finish the filling by adding the vanilla extract and sprinkles. Process for one more time at 10 seconds and pour filling in a small bowl. Make the rolls. Spread the 6 tablespoons of melted butter over the dough. Sprinkle the cinnamon all around and then sprinkle the filling. Roll the dough tightly and use a slicing knife it slice 15 cinnamon rolls. Each roll should be 1.5 inches in width. Place rolls on a dish and cover them with plastic wrap. Have them rise for about 2 hours until they are puffy. Baking and Serving Prepare to bake the cinnamon rolls. Preheat your oven to 400 degrees Fahrenheit or 204 degrees Celsius. Cover a 9 x 13 inch baking tray with parchment paper. {\"smallUrl\":\"https:\\/\\/www.wikihow.com\\/images\\/d\\/db\\/Make-Cake-Batter-Cinnamon-Rolls-Step-9.jpg\",\"bigUrl\":\"\\/images\\/thumb\\/d\\/db\\/Make-Cake-Batter-Cinnamon-Rolls-Step-9.jpg\\/v4-190px-Make-Cake-Batter-Cinnamon-Rolls-Step-9.jpg\",\"smallWidth\":460,\"smallHeight\":307,\"bigWidth\":\"190\",\"bigHeight\":\"127\",\"licensing\":\"<div class=\\\"mw-parser-output\\\"><p>License: <a rel=\\\"nofollow\\\" class=\\\"external text\\\" href=\\\"https:\\/\\/creativecommons.org\\/licenses\\/by-nc-sa\\/3.0\\/\\\">Creative Commons<\\/a><br>\\n<\\/p><p><br \\/>\\n<\\/p><\\/div>\"} Bake the cinnamon rolls. Before baking, cover the rolls with aluminum foil to prevent them from browning too quickly while baking. Have them bake for about 25 minutes, until they are golden brown. Have the cinnamon rolls cool. Use a spatula to remove the cinnamon rolls from the baking tray and set them on a dish to cool. Making the Glaze Make the glaze. In a medium-sized mixing bowl, whisk all the ingredients until glaze forms and is slightly sticky. If you want to make your glaze thicker add more sugar or heavy cream. Enjoy! Drizzle the glaze using a fork over the cinnamon rolls. Serve with a glass of cold milk. Enjoy your cake batter cinnamon rolls!",
  "tyn_model":[
    "milk",
    "butter",
    "cinnamon rolls",
    "sugar",
    "yeast",
    "salt",
    "electric blender",
    "mixing bowl",
    "eggs",
    "flour",
    "dish",
    "baking tray",
    "small saucepan",
    "whisk",
    "bowl",
    "rubber spatula",
    "blender",
    "large greased mixing bowl",
    "rolling pin",
    "food processor",
    "milk powder",
    "vanilla extract",
    "small bowl",
    "cinnamon",
    "slicing knife",
    "plastic wrap",
    "oven",
    "parchment paper",
    "aluminum foil",
    "spatula",
    "heavy cream",
    "fork",
    "cold milk",
    "cake batter"
  ],
  "tyn_section":[

  ]
}