{
  "title":"How to Make Dairy\u2010Free Mac and Cheese",
  "url":"https://www.wikihow.com/Make-Dairy%E2%80%90Free-Mac-and-Cheese",
  "category_hierarchy":[
    "Food and Entertaining",
    "Recipes",
    "Pasta and Noodles",
    "Macaroni and Cheese"
  ],
  "methods":[
    {
      "name":"Cooking Dairy-Free Mac and Cheese with Butternut Squash",
      "steps":[
        {
          "headline":"Buy one nice butternut squash.",
          "description":"The butternut squash is the heart of this recipe, so you want to find a quality squash at the grocery store or the farmer's market. Choose a medium-sized butternut squash that feels pretty heavy for its' size and has no deep cuts or bruises. It is fine if there are a lot of scratches as long as they don't penetrate beneath the skin."
        },
        {
          "headline":"Gather your ingredients for the sauce.",
          "description":"If you have a little more time on your hands, you might consider this super delicious butternut squash mac and cheese. You will need the following ingredients: one butternut squash; four cloves of garlic; a tablespoon of coconut oil; a cup and a half of cooked butter beans (1 can); three-quarters of a cup of nutritional yeast flakes; a teaspoon of Dijon mustard; one and a half teaspoons of sea salt; two teaspoons of paprika; two tablespoons of olive oil; a teaspoon of apple cider vinegar; four cups of your favorite gluten-free macaroni; and two or three cups of almond or soy milk."
        },
        {
          "headline":"Put together your ingredients for the topping.",
          "description":"For the crumble topping, you will need one cup of sunflower seeds; a tablespoon of coconut oil; two tablespoons of nutritional yeast; half a teaspoon of sea salt; a quarter teaspoon of garlic powder; and a quarter teaspoon of paprika. Using these ingredients, make your mac and cheese topping."
        },
        {
          "headline":"Prepare your ingredients.",
          "description":"Prior to making the sauce and baking the mac and cheese, you will need to prepare each of the individual ingredients. In particular, you will need to prepare the butternut squash, pasta, and the crumble topping:\nSkin, seed, and cube the butternut squash. Bake the butternut squash with the garlic and olive oil for fifteen to twenty minutes at 400 Fahrenheit (200 Celsius). Toast the sunflower seeds for three to five minutes. Then, put them in a food processor with all of the other crumble topping ingredients. Prepare the pasta following the instructions on the package."
        },
        {
          "headline":"Cook the mac and cheese.",
          "description":"Use the following instructions to prepare your sauce and then bake your mac and cheese:\nPut the roasted squash in a blender with all of the ingredients except the soy or almond milk. Blend the squash and slowly add some milk at the end until you get a nice creamy consistency. Pour the mixture over the macaroni pasta. Turn the oven down to 325 Fahrenheit (160 C). Put the pasta and sauce in a casserole dish, add the crumble topping and bake it for twenty minutes."
        }
      ]
    },
    {
      "name":"Making Dairy-Free Mac and Cheese with Potatoes and Carrots",
      "steps":[
        {
          "headline":"Find fresh Yukon gold potatoes.",
          "description":"Yukon gold potatoes are the heart of this delicious dairy-free mac and cheese, so it is best to find fresh potatoes at your local farmer's market or grocery store. Yukon gold potatoes are early-bearing so you should be able to pick them up early in the season. They are available year round but taste best when they have been recently harvested, so check your local farmer's market for fresh potatoes. Choose fresh potatoes that are golden and have no deep bruises or cuts. You will need one cup of potatoes for this recipe."
        },
        {
          "headline":"Gather your ingredients.",
          "description":"If you want to make a vegan or dairy-free mac and cheese but don't have any nutritional yeast, this recipe may do the trick. You will need the following ingredients: two cups of elbow pasta; one cup of chopped Yukon gold potatoes; a quarter cup of chopped carrots; a third of a cup of chopped onion; three tablespoons of olive oil; three tablespoons of all-purpose flour; half a cup of non-dairy milk; two teaspoons of sea salt; a quarter teaspoon of minced garlic; a quarter teaspoon of Dijon mustard; a tablespoon of lemon juice; a quarter teaspoon of black pepper."
        },
        {
          "headline":"Put together your topping ingredients.",
          "description":"For the topping, you will need two shredded slices of whole wheat bread; a quarter teaspoon of paprika; and two teaspoons of olive oil. Using these ingredients, make your mac and cheese topping."
        },
        {
          "headline":"Prepare your individual ingredients.",
          "description":"Get ready for cooking by preheating your oven and preparing the pasta as well as the ingredients for the sauce. Use the following instructions for the first stage of this recipe:\nTurn on the oven at 350 degrees Fahrenheit (176 C). Cook the potatoes, carrots, onion and a cup of water in a medium saucepan. Bring the water to a boil and simmer for fifteen minutes or until vegetables are done. Follow the instructions on the pasta to cook until al dente."
        },
        {
          "headline":"Make your saucy mac and cheese.",
          "description":"In the final stage of this recipe, you will prepare you sauce and bake the mac and cheese. Use the following ingredients to finish the mac and cheese:\nCook the olive oil in a saucepan and gradually add the non-dairy milk and the flour until thickened. This should take five minutes. Add the vegetables and milk sauce to the food processor. Add the salt, garlic, mustard, lemon juice, and pepper. Blend it all together, and then pour it over the cooked pasta. Pour the pasta and sauce into a baking dish, thrown on the breadcrumb mixture, and bake for thirty minutes."
        }
      ]
    },
    {
      "name":"Replacing the Dairy with Vegan Cheese and Non-Dairy Milk",
      "steps":[
        {
          "headline":"Cook macaroni and cheese with vegan Parmesan cheese.",
          "description":"This creamy mac and cheese makes a great weeknight meal and can be served with kale. You will need the following ingredients: one head of roasted garlic; twelve ounces of gluten free penne; four tablespoons of olive oil; four cloves of minced garlic; four and a half tablespoons of arrowroot starch; two cups of almond milk; five tablespoons of nutritional yeast; half a cup of vegan Parmesan cheese; and sea salt to taste. Using these ingredients, make your mac and cheese:\nRoast your head of garlic in the oven at 400 degrees Fahrenheit (200 C) for one hour. Cook the pasta for eight to ten minutes, following the instructions on the package. To prepare the sauce, saute the minced garlic for a couple minutes and then add the arrowroot starch. Slowly add the almond milk until it starts to look clumpy. Add the salt, pepper, nutritional yeast, and vegan Parmesan cheese. Cook the sauce in the skillet for a few minutes. Add the cooked pasta to the sauce and top with more vegan Parmesan cheese."
        },
        {
          "headline":"Replace the cheese packet with vegan cheese.",
          "description":"When you buy your conventional macaroni and cheese product, it will come with a packet of conventional cheese. Discard this cheese and replace it with vegan cheese. Alongside non-dairy milk, this will transform your conventional package of macaroni and cheese into a dairy-free recipe. If you are working with a traditional mac and cheese recipe, you can simply substitute with vegan cheese and an alternative milk. Try using a vegan Parmesan cheese. Cheesy vegan white cheddar style cheese is known to melt well. You can buy it online or at your local health food store. Try Sheese melty smoked cheddar. This vegan cheese is a great vegan cheese that also melts well for pizza or, indeed, macaroni and cheese. If you have a friend, family member or roommate who enjoys conventional macaroni and cheese, you can give them the cheese packet."
        },
        {
          "headline":"Substitute non-dairy for cow milk.",
          "description":"When you follow the directions on your box of conventional macaroni and cheese, it will call for cow milk. At this point in the recipe, replace the cow milk with a non-diary option such as almond milk, soy milk, or rice milk. A cup of soy milk has six grams of protein, twelve grams of carbohydrates, and four grams of fat. It contains one hundred and five calories. A cup of almond milk has a gram of fiber and protein, two to three grams of fat, and around 40 calories. A cup of rice milk has twenty five carbohydrates, two grams of fat, and a hundred and twenty calories in total."
        },
        {
          "headline":"Replace the milk with pasta water.",
          "description":"If you want to make a dairy-free macaroni and cheese but only have a little bit of vegan cheese and a box of conventional mac and cheese but no non-dairy milk, you can still make mac and cheese. If you are in this situation, simply replace the milk with the starchy water from cooking your pasta. It will help the pasta to stick to the vegan cheese. Instead of throwing out the water when you drain your pasta, catch the water in a pot. When the recipe calls for milk, simply use the starchy water instead."
        }
      ]
    },
    {
      "name":"Buying Boxes of Dairy-Free Mac and Cheese",
      "steps":[
        {
          "headline":"Buy a box of dairy-free macaroni and cheese.",
          "description":"A lot of vegan or dairy-free macaroni and cheese recipes are labor intensive, often involving multiple pots and a lot of time in the kitchen. If you want to avoid a few hours in the kitchen, you might consider looking at the increasing variety of options for boxed or frozen, dairy-free macaroni and cheese products. These products can be found at health food stores and some specialty grocery stores."
        },
        {
          "headline":"Pick up a box of Earth Balance Mac and Cheese.",
          "description":"Earth Balance makes a variety of boxed mac and cheese products catered to vegans and people who have difficulty with dairy. If you would like to make some dairy-free mac and cheese but are stretched for time, try one of their three products:\nVegan cheddar mac and cheese. Vegan white cheddar mac and cheese. Gluten-free vegan mac and cheese. Follow the instructions on the box to make your dairy-free mac and cheese."
        },
        {
          "headline":"Choose a box of Daiya.",
          "description":"Daiya Foods makes a variety of boxed macaroni and cheese options. Daiya is a company that specializes in dairy-free products and recreating the taste of cheese for those who wish to live a plant-based lifestyle. They carry a few varieties of dairy-free mac and cheese that can be quickly prepared at home:\nDeluxe white cheddar style veggie. Deluxe cheddar style. Deluxe alfredo style. Follow the instructions on the box to make your dairy-free mac and cheese."
        },
        {
          "headline":"Pick up some frozen microwavable macaroni and cheese.",
          "description":"A variety of companies offer dairy-free macaroni and cheese products that can be microwaved for a quick meal. In particular, you might want to look into options from Amy's Kitchen and Candle Cafe. You can find microwavable macaroni and cheese at your local health food store or a bigger grocery store such as Whole Foods Market. Follow the instructions on the box to microwave or cook your mac and cheese."
        },
        {
          "headline":"Finished.",
          "description":""
        }
      ]
    }
  ],
  "text":" Cooking Dairy-Free Mac and Cheese with Butternut Squash Buy one nice butternut squash. The butternut squash is the heart of this recipe, so you want to find a quality squash at the grocery store or the farmer's market. Choose a medium-sized butternut squash that feels pretty heavy for its' size and has no deep cuts or bruises. It is fine if there are a lot of scratches as long as they don't penetrate beneath the skin. Gather your ingredients for the sauce. If you have a little more time on your hands, you might consider this super delicious butternut squash mac and cheese. You will need the following ingredients: one butternut squash; four cloves of garlic; a tablespoon of coconut oil; a cup and a half of cooked butter beans (1 can); three-quarters of a cup of nutritional yeast flakes; a teaspoon of Dijon mustard; one and a half teaspoons of sea salt; two teaspoons of paprika; two tablespoons of olive oil; a teaspoon of apple cider vinegar; four cups of your favorite gluten-free macaroni; and two or three cups of almond or soy milk. Put together your ingredients for the topping. For the crumble topping, you will need one cup of sunflower seeds; a tablespoon of coconut oil; two tablespoons of nutritional yeast; half a teaspoon of sea salt; a quarter teaspoon of garlic powder; and a quarter teaspoon of paprika. Using these ingredients, make your mac and cheese topping. Prepare your ingredients. Prior to making the sauce and baking the mac and cheese, you will need to prepare each of the individual ingredients. In particular, you will need to prepare the butternut squash, pasta, and the crumble topping:\nSkin, seed, and cube the butternut squash. Bake the butternut squash with the garlic and olive oil for fifteen to twenty minutes at 400 Fahrenheit (200 Celsius). Toast the sunflower seeds for three to five minutes. Then, put them in a food processor with all of the other crumble topping ingredients. Prepare the pasta following the instructions on the package. Cook the mac and cheese. Use the following instructions to prepare your sauce and then bake your mac and cheese:\nPut the roasted squash in a blender with all of the ingredients except the soy or almond milk. Blend the squash and slowly add some milk at the end until you get a nice creamy consistency. Pour the mixture over the macaroni pasta. Turn the oven down to 325 Fahrenheit (160 C). Put the pasta and sauce in a casserole dish, add the crumble topping and bake it for twenty minutes. Making Dairy-Free Mac and Cheese with Potatoes and Carrots Find fresh Yukon gold potatoes. Yukon gold potatoes are the heart of this delicious dairy-free mac and cheese, so it is best to find fresh potatoes at your local farmer's market or grocery store. Yukon gold potatoes are early-bearing so you should be able to pick them up early in the season. They are available year round but taste best when they have been recently harvested, so check your local farmer's market for fresh potatoes. Choose fresh potatoes that are golden and have no deep bruises or cuts. You will need one cup of potatoes for this recipe. Gather your ingredients. If you want to make a vegan or dairy-free mac and cheese but don't have any nutritional yeast, this recipe may do the trick. You will need the following ingredients: two cups of elbow pasta; one cup of chopped Yukon gold potatoes; a quarter cup of chopped carrots; a third of a cup of chopped onion; three tablespoons of olive oil; three tablespoons of all-purpose flour; half a cup of non-dairy milk; two teaspoons of sea salt; a quarter teaspoon of minced garlic; a quarter teaspoon of Dijon mustard; a tablespoon of lemon juice; a quarter teaspoon of black pepper. Put together your topping ingredients. For the topping, you will need two shredded slices of whole wheat bread; a quarter teaspoon of paprika; and two teaspoons of olive oil. Using these ingredients, make your mac and cheese topping. Prepare your individual ingredients. Get ready for cooking by preheating your oven and preparing the pasta as well as the ingredients for the sauce. Use the following instructions for the first stage of this recipe:\nTurn on the oven at 350 degrees Fahrenheit (176 C). Cook the potatoes, carrots, onion and a cup of water in a medium saucepan. Bring the water to a boil and simmer for fifteen minutes or until vegetables are done. Follow the instructions on the pasta to cook until al dente. Make your saucy mac and cheese. In the final stage of this recipe, you will prepare you sauce and bake the mac and cheese. Use the following ingredients to finish the mac and cheese:\nCook the olive oil in a saucepan and gradually add the non-dairy milk and the flour until thickened. This should take five minutes. Add the vegetables and milk sauce to the food processor. Add the salt, garlic, mustard, lemon juice, and pepper. Blend it all together, and then pour it over the cooked pasta. Pour the pasta and sauce into a baking dish, thrown on the breadcrumb mixture, and bake for thirty minutes. Replacing the Dairy with Vegan Cheese and Non-Dairy Milk Cook macaroni and cheese with vegan Parmesan cheese. This creamy mac and cheese makes a great weeknight meal and can be served with kale. You will need the following ingredients: one head of roasted garlic; twelve ounces of gluten free penne; four tablespoons of olive oil; four cloves of minced garlic; four and a half tablespoons of arrowroot starch; two cups of almond milk; five tablespoons of nutritional yeast; half a cup of vegan Parmesan cheese; and sea salt to taste. Using these ingredients, make your mac and cheese:\nRoast your head of garlic in the oven at 400 degrees Fahrenheit (200 C) for one hour. Cook the pasta for eight to ten minutes, following the instructions on the package. To prepare the sauce, saute the minced garlic for a couple minutes and then add the arrowroot starch. Slowly add the almond milk until it starts to look clumpy. Add the salt, pepper, nutritional yeast, and vegan Parmesan cheese. Cook the sauce in the skillet for a few minutes. Add the cooked pasta to the sauce and top with more vegan Parmesan cheese. Replace the cheese packet with vegan cheese. When you buy your conventional macaroni and cheese product, it will come with a packet of conventional cheese. Discard this cheese and replace it with vegan cheese. Alongside non-dairy milk, this will transform your conventional package of macaroni and cheese into a dairy-free recipe. If you are working with a traditional mac and cheese recipe, you can simply substitute with vegan cheese and an alternative milk. Try using a vegan Parmesan cheese. Cheesy vegan white cheddar style cheese is known to melt well. You can buy it online or at your local health food store. Try Sheese melty smoked cheddar. This vegan cheese is a great vegan cheese that also melts well for pizza or, indeed, macaroni and cheese. If you have a friend, family member or roommate who enjoys conventional macaroni and cheese, you can give them the cheese packet. Substitute non-dairy for cow milk. When you follow the directions on your box of conventional macaroni and cheese, it will call for cow milk. At this point in the recipe, replace the cow milk with a non-diary option such as almond milk, soy milk, or rice milk. A cup of soy milk has six grams of protein, twelve grams of carbohydrates, and four grams of fat. It contains one hundred and five calories. A cup of almond milk has a gram of fiber and protein, two to three grams of fat, and around 40 calories. A cup of rice milk has twenty five carbohydrates, two grams of fat, and a hundred and twenty calories in total. Replace the milk with pasta water. If you want to make a dairy-free macaroni and cheese but only have a little bit of vegan cheese and a box of conventional mac and cheese but no non-dairy milk, you can still make mac and cheese. If you are in this situation, simply replace the milk with the starchy water from cooking your pasta. It will help the pasta to stick to the vegan cheese. Instead of throwing out the water when you drain your pasta, catch the water in a pot. When the recipe calls for milk, simply use the starchy water instead. Buying Boxes of Dairy-Free Mac and Cheese Buy a box of dairy-free macaroni and cheese. A lot of vegan or dairy-free macaroni and cheese recipes are labor intensive, often involving multiple pots and a lot of time in the kitchen. If you want to avoid a few hours in the kitchen, you might consider looking at the increasing variety of options for boxed or frozen, dairy-free macaroni and cheese products. These products can be found at health food stores and some specialty grocery stores. Pick up a box of Earth Balance Mac and Cheese. Earth Balance makes a variety of boxed mac and cheese products catered to vegans and people who have difficulty with dairy. If you would like to make some dairy-free mac and cheese but are stretched for time, try one of their three products:\nVegan cheddar mac and cheese. Vegan white cheddar mac and cheese. Gluten-free vegan mac and cheese. Follow the instructions on the box to make your dairy-free mac and cheese. Choose a box of Daiya. Daiya Foods makes a variety of boxed macaroni and cheese options. Daiya is a company that specializes in dairy-free products and recreating the taste of cheese for those who wish to live a plant-based lifestyle. They carry a few varieties of dairy-free mac and cheese that can be quickly prepared at home:\nDeluxe white cheddar style veggie. Deluxe cheddar style. Deluxe alfredo style. Follow the instructions on the box to make your dairy-free mac and cheese. Pick up some frozen microwavable macaroni and cheese. A variety of companies offer dairy-free macaroni and cheese products that can be microwaved for a quick meal. In particular, you might want to look into options from Amy's Kitchen and Candle Cafe. You can find microwavable macaroni and cheese at your local health food store or a bigger grocery store such as Whole Foods Market. Follow the instructions on the box to microwave or cook your mac and cheese. Finished. ",
  "tyn_model":[
    "cheese",
    "potatoes",
    "milk",
    "butternut squash",
    "olive oil",
    "water",
    "garlic",
    "nutritional yeast",
    "squash",
    "sea salt",
    "oven",
    "almond milk",
    "paprika",
    "carrots",
    "parmesan cheese",
    "vegan cheese",
    "cow milk",
    "butternut",
    "coconut oil",
    "dijon mustard",
    "sunflower seeds",
    "mac and cheese",
    "pasta",
    "food processor",
    "minced garlic",
    "lemon juice",
    "salt",
    "pepper",
    "arrowroot starch",
    "vegan parmesan cheese",
    "soy milk",
    "rice milk",
    "dairy-free macaroni and cheese",
    "cooked butter beans",
    "apple cider vinegar",
    "almond or soy milk",
    "garlic powder",
    "crumble topping",
    "blender",
    "soy or almond milk",
    "macaroni pasta",
    "casserole dish",
    "dairy-free mac and cheese",
    "elbow pasta",
    "chopped onion",
    "all-purpose flour",
    "non-dairy milk",
    "black pepper",
    "whole wheat bread",
    "mac and cheese topping",
    "onion",
    "medium saucepan",
    "saucepan",
    "flour",
    "vegetables",
    "milk sauce",
    "mustard",
    "baking dish",
    "breadcrumb mixture",
    "kale",
    "roasted garlic",
    "gluten free penne",
    "skillet",
    "sheese melty smoked cheddar",
    "cheese packet",
    "pasta water",
    "pot",
    "earth balance mac and cheese",
    "earth balance",
    "daiya.",
    "daiya foods",
    "dairy-free mac",
    "microwave"
  ],
  "tyn_section":[

  ]
}