{
  "title":"How to Make Applesauce Donuts",
  "url":"https://www.wikihow.com/Make-Applesauce-Donuts",
  "category_hierarchy":[
    "Food and Entertaining",
    "Recipes",
    "Baking",
    "Donuts and Doughnuts"
  ],
  "parts":[
    {
      "name":"Mixing the Dough",
      "steps":[
        {
          "headline":"Set aside 2 cups of flour.",
          "description":"Before you mix together the ingredients, you will need to divide your flour. Measure the 2 cups of flour and set aside in a separate bowl. These two cups of flour will be the last ingredient you add to the dough."
        },
        {
          "headline":"Combine the dry ingredients.",
          "description":"Add the dry ingredients listed below to a large mixing bowl. Use a wooden spoon to combine the dry ingredients. Stir until all the ingredients are combined. The dry ingredients you will mix together are:\n1 1/3 cups all purpose flour\n3/4 cup sugar\n2 tablespoons shortening\n3 teaspoons baking powder\n1 teaspoon ground cinnamon\n1/2 teaspoon salt"
        },
        {
          "headline":"Add the eggs and applesauce.",
          "description":"Once you have combined all the dry ingredients, add two eggs and 1 cup applesauce to the mixture. You do not need to beat the eggs before adding them to the dry ingredients. Simply crack the eggs on the side of a bowl and then add the eggs to the dry ingredients."
        },
        {
          "headline":"Blend the ingredients with an electric mixer.",
          "description":"Once you have added the eggs to the dry ingredients, you will mix the dough until well blended. You can use an electric hand mixer or an electric stand mixer. Beat the ingredients together on medium speed until just blended."
        },
        {
          "headline":"Add the remaining 2 cups of flour.",
          "description":"Take the 2 cups of flour you put aside earlier and add the flour to the dough mixture. Mix the flour into the dough mixture on medium speed. The dough will be completely combined after mixing on medium speed for about two minutes."
        },
        {
          "headline":"Refrigerate the dough.",
          "description":"Once you\u2019ve finished making the dough, cover the bowl with plastic wrap. Place the bowl of dough in the refrigerator and refrigerate for about 1 hour. This will allow the dough enough time to stiffen so that you can shape it into donuts."
        }
      ]
    },
    {
      "name":"Forming and Cooking the Donuts",
      "steps":[
        {
          "headline":"Prepare a pastry board.",
          "description":"You will need a pastry board or another flat, clean surface upon which to roll out and cut your donuts. Take a pastry board, or large cutting board, and sprinkle with flour. Make sure the entire surface is covered in a light dusting of flour."
        },
        {
          "headline":"Heat the vegetable oil.",
          "description":"In a deep fryer or in a 3-quart saucepan, heat about 2 to 3 inches of oil to a temperature of 375 degrees Fahrenheit or about 190 degrees Celsius. If you do not have a temperature gauge on your deep fryer, you can check the temperature by dipping a wooden spoon handle in the oil. If the oil starts to steadily bubble, then it has reached the proper temperature."
        },
        {
          "headline":"Divide the dough.",
          "description":"Remove the donut dough from the refrigerator. Next, take the plastic wrap off the top of the bowl. Finally, divide the donut dough into two halves. You will roll each half separately to make and shape your donuts."
        },
        {
          "headline":"Roll out the dough.",
          "description":"Take one half of the donut dough and place it on the well-floured pastry board. Grab a rolling pin. Take the rolling pin and roll out the donut dough. The dough should be about 3/8 inch or about 1 centimeter thick."
        },
        {
          "headline":"Cut the donuts.",
          "description":"Ideally, you will use a 3 inch or 7.5 centimeter donut cutter. If you do not have a donut cutter, you can use a cup or glass that is about 3 inches or 7.5 centimeters in diameter. You can then use a clean soda bottle lid to cut the hole in the center of each donut. You can also substitute a circular cookie cutter and the base of a large pastry tip."
        },
        {
          "headline":"Fry the donuts.",
          "description":"Use a wide spatula to slide the donuts into the oil. Fry about 1 to 1.5 minutes on the first side. At this point, they should begin to rise to the surface, which is a signal it is time for you to flip them. Fry on the second side for an additional 1 to 1.5 minutes. The donuts should be golden brown when they are finished."
        },
        {
          "headline":"Remove the donuts from the oil.",
          "description":"Once you have fried the donuts for 1 to 1.5 minutes on each side, it will be time to remove the donuts from the oil. Place the freshly friend donuts on a plate or platter lined with paper towels or a clean kitchen towel. This will help absorb any excess oil."
        },
        {
          "headline":"Sprinkle the donuts with sugar.",
          "description":"If you wish, you can sprinkle sugar, or a mixture or cinnamon and sugar, on your freshly made donuts. You can eat them once they have cooled or serve them up to a day later. Enjoy!"
        }
      ]
    }
  ],
  "text":" Mixing the Dough Set aside 2 cups of flour. Before you mix together the ingredients, you will need to divide your flour. Measure the 2 cups of flour and set aside in a separate bowl. These two cups of flour will be the last ingredient you add to the dough. Combine the dry ingredients. Add the dry ingredients listed below to a large mixing bowl. Use a wooden spoon to combine the dry ingredients. Stir until all the ingredients are combined. The dry ingredients you will mix together are:\n1 1/3 cups all purpose flour\n3/4 cup sugar\n2 tablespoons shortening\n3 teaspoons baking powder\n1 teaspoon ground cinnamon\n1/2 teaspoon salt Add the eggs and applesauce. Once you have combined all the dry ingredients, add two eggs and 1 cup applesauce to the mixture. You do not need to beat the eggs before adding them to the dry ingredients. Simply crack the eggs on the side of a bowl and then add the eggs to the dry ingredients. Blend the ingredients with an electric mixer. Once you have added the eggs to the dry ingredients, you will mix the dough until well blended. You can use an electric hand mixer or an electric stand mixer. Beat the ingredients together on medium speed until just blended. Add the remaining 2 cups of flour. Take the 2 cups of flour you put aside earlier and add the flour to the dough mixture. Mix the flour into the dough mixture on medium speed. The dough will be completely combined after mixing on medium speed for about two minutes. Refrigerate the dough. Once you\u2019ve finished making the dough, cover the bowl with plastic wrap. Place the bowl of dough in the refrigerator and refrigerate for about 1 hour. This will allow the dough enough time to stiffen so that you can shape it into donuts. Forming and Cooking the Donuts Prepare a pastry board. You will need a pastry board or another flat, clean surface upon which to roll out and cut your donuts. Take a pastry board, or large cutting board, and sprinkle with flour. Make sure the entire surface is covered in a light dusting of flour. Heat the vegetable oil. In a deep fryer or in a 3-quart saucepan, heat about 2 to 3 inches of oil to a temperature of 375 degrees Fahrenheit or about 190 degrees Celsius. If you do not have a temperature gauge on your deep fryer, you can check the temperature by dipping a wooden spoon handle in the oil. If the oil starts to steadily bubble, then it has reached the proper temperature. Divide the dough. Remove the donut dough from the refrigerator. Next, take the plastic wrap off the top of the bowl. Finally, divide the donut dough into two halves. You will roll each half separately to make and shape your donuts. Roll out the dough. Take one half of the donut dough and place it on the well-floured pastry board. Grab a rolling pin. Take the rolling pin and roll out the donut dough. The dough should be about 3/8 inch or about 1 centimeter thick. Cut the donuts. Ideally, you will use a 3 inch or 7.5 centimeter donut cutter. If you do not have a donut cutter, you can use a cup or glass that is about 3 inches or 7.5 centimeters in diameter. You can then use a clean soda bottle lid to cut the hole in the center of each donut. You can also substitute a circular cookie cutter and the base of a large pastry tip. Fry the donuts. Use a wide spatula to slide the donuts into the oil. Fry about 1 to 1.5 minutes on the first side. At this point, they should begin to rise to the surface, which is a signal it is time for you to flip them. Fry on the second side for an additional 1 to 1.5 minutes. The donuts should be golden brown when they are finished. Remove the donuts from the oil. Once you have fried the donuts for 1 to 1.5 minutes on each side, it will be time to remove the donuts from the oil. Place the freshly friend donuts on a plate or platter lined with paper towels or a clean kitchen towel. This will help absorb any excess oil. Sprinkle the donuts with sugar. If you wish, you can sprinkle sugar, or a mixture or cinnamon and sugar, on your freshly made donuts. You can eat them once they have cooled or serve them up to a day later. Enjoy!",
  "tyn_model":[
    "flour",
    "eggs",
    "oil",
    "bowl",
    "sugar",
    "pastry board",
    "wooden spoon",
    "applesauce",
    "plastic wrap",
    "refrigerator",
    "deep fryer",
    "rolling pin",
    "large mixing bowl",
    "all purpose flour",
    "shortening",
    "baking powder",
    "ground cinnamon",
    "salt",
    "electric mixer",
    "electric hand mixer",
    "electric stand mixer",
    "vegetable oil",
    "3-quart saucepan",
    "donut cutter",
    "soda bottle",
    "circular cookie cutter",
    "pastry tip",
    "spatula",
    "plate",
    "cinnamon",
    "donuts"
  ],
  "tyn_section":[

  ]
}