{
  "title":"How to Make an Apple Pie Smoothie",
  "url":"https://www.wikihow.com/Make-an-Apple-Pie-Smoothie",
  "category_hierarchy":[
    "Food and Entertaining",
    "Drinks",
    "Smoothies Shakes and Milk",
    "Smoothies"
  ],
  "methods":[
    {
      "name":"Making An Apple Pie Smoothie With Oats",
      "steps":[
        {
          "headline":"Prepare the apple.",
          "description":"Wash one large apple and remove the core. You don't need to peel the apple, although you may want to if your blender isn't very powerful. Chop the apple into rough pieces and put them in the blender. Consider using a Red Delicious of Gala apple for the best flavor in this smoothie."
        },
        {
          "headline":"Blend the smoothie ingredients.",
          "description":"Add the remaining smoothie ingredients into the blender. Just be sure to pour the almond milk in first so it's nearest to the blender blade. Blitz the ingredients until they're smooth. Add all ingredients except for ice."
        },
        {
          "headline":"Add ice and finish blending the smoothie.",
          "description":"Dump in 1 cup (140 g) of ice cubes and cover the blender with the lid. Turn the blender on and blitz the smoothie again until it's completely smooth. Pour the smoothie into two glasses and serve them immediately. You can garnish the apple pie smoothies with a dusting of cinnamon or a sliver of apple."
        }
      ]
    },
    {
      "name":"Making a Vegan Apple Pie Smoothie",
      "steps":[
        {
          "headline":"Prepare the apples.",
          "description":"Wash two large red apple and remove the cores. You don't need to peel the apples, although you may want to if your blender isn't very powerful. Chop the apple into rough pieces and put them in the blender. Consider using Fuji apples for the best flavor in this smoothie."
        },
        {
          "headline":"Blend the smoothie ingredients.",
          "description":"Add the remaining smoothie ingredients into the blender. Pour the almond milk and Greek yogurt in first so they're nearest to the blender blade. Blend the ingredients until they're smooth. Add in all ingredients except for ice and sweetener (if using)."
        },
        {
          "headline":"Add ice and sweetener, as needed.",
          "description":"Add 1 cup (140 g) of ice to the blender and blitz the smoothie until the ice is completely blended. Remove the lid and taste the smoothie. If you'd like to make it sweeter, consider adding 1 or 2 pitted dates or 1 to 2 teaspoons of honey. Pulse the blender to incorporate the sweetener. This smoothie makes enough for two drinks, so divide it between two glasses when you're ready to serve them."
        }
      ]
    },
    {
      "name":"Making a Warm Apple Pie Smoothie",
      "steps":[
        {
          "headline":"Prepare the apple.",
          "description":"Wash one large apple and remove the core. You don't need to peel the apple, although you may want to if your blender isn't very powerful. Chop the apple into chunks and put the chunks in the blender. You can use any type of apple that you enjoy eating. For example, you could use Pink Lady apples, Gala apples, or Jonagolds."
        },
        {
          "headline":"Blend the remaining ingredients.",
          "description":"Add the remaining smoothie ingredients into the blender. Pour the water in first so it's nearest to the blender blade. Blend the ingredients until they're smooth. Use all remaining ingredients."
        },
        {
          "headline":"Microwave the apple pie smoothie.",
          "description":"Pour the smoothie into a large microwave-safe mug. Microwave the smoothie on the high setting for about two minutes. Carefully remove the warm smoothie from the microwave and garnish the smoothie. Consider topping the warm apple pie smoothie with:\nWhipped cream\nCinnamon sticks\nIce cream\nSprinkled cinnamon"
        }
      ]
    }
  ],
  "text":" Making An Apple Pie Smoothie With Oats Prepare the apple. Wash one large apple and remove the core. You don't need to peel the apple, although you may want to if your blender isn't very powerful. Chop the apple into rough pieces and put them in the blender. Consider using a Red Delicious of Gala apple for the best flavor in this smoothie. Blend the smoothie ingredients. Add the remaining smoothie ingredients into the blender. Just be sure to pour the almond milk in first so it's nearest to the blender blade. Blitz the ingredients until they're smooth. Add all ingredients except for ice. Add ice and finish blending the smoothie. Dump in 1 cup (140 g) of ice cubes and cover the blender with the lid. Turn the blender on and blitz the smoothie again until it's completely smooth. Pour the smoothie into two glasses and serve them immediately. You can garnish the apple pie smoothies with a dusting of cinnamon or a sliver of apple. Making a Vegan Apple Pie Smoothie Prepare the apples. Wash two large red apple and remove the cores. You don't need to peel the apples, although you may want to if your blender isn't very powerful. Chop the apple into rough pieces and put them in the blender. Consider using Fuji apples for the best flavor in this smoothie. Blend the smoothie ingredients. Add the remaining smoothie ingredients into the blender. Pour the almond milk and Greek yogurt in first so they're nearest to the blender blade. Blend the ingredients until they're smooth. Add in all ingredients except for ice and sweetener (if using). Add ice and sweetener, as needed. Add 1 cup (140 g) of ice to the blender and blitz the smoothie until the ice is completely blended. Remove the lid and taste the smoothie. If you'd like to make it sweeter, consider adding 1 or 2 pitted dates or 1 to 2 teaspoons of honey. Pulse the blender to incorporate the sweetener. This smoothie makes enough for two drinks, so divide it between two glasses when you're ready to serve them. Making a Warm Apple Pie Smoothie Prepare the apple. Wash one large apple and remove the core. You don't need to peel the apple, although you may want to if your blender isn't very powerful. Chop the apple into chunks and put the chunks in the blender. You can use any type of apple that you enjoy eating. For example, you could use Pink Lady apples, Gala apples, or Jonagolds. Blend the remaining ingredients. Add the remaining smoothie ingredients into the blender. Pour the water in first so it's nearest to the blender blade. Blend the ingredients until they're smooth. Use all remaining ingredients. Microwave the apple pie smoothie. Pour the smoothie into a large microwave-safe mug. Microwave the smoothie on the high setting for about two minutes. Carefully remove the warm smoothie from the microwave and garnish the smoothie. Consider topping the warm apple pie smoothie with:\nWhipped cream\nCinnamon sticks\nIce cream\nSprinkled cinnamon",
  "tyn_model":[
    "blender",
    "ice",
    "apple pie smoothie",
    "almond milk",
    "cinnamon",
    "sweetener",
    "oats",
    "red delicious of gala apple",
    "ice cubes",
    "apple pie smoothies",
    "apple",
    "greek yogurt",
    "dates",
    "honey",
    "water",
    "large microwave-safe mug",
    "microwave",
    "whipped cream",
    "ice cream"
  ],
  "tyn_section":[

  ]
}