{
  "title":"How to Make Coffee Creamer",
  "url":"https://www.wikihow.com/Make-Coffee-Creamer",
  "category_hierarchy":[
    "Food and Entertaining",
    "Drinks",
    "Coffee"
  ],
  "methods":[
    {
      "name":"Making Hazelnut Creamer",
      "steps":[
        {
          "headline":"Toast your hazelnuts.",
          "description":"Place the nuts in a skillet over medium heat. Cook them until they begin to brown and give off an aroma. Stir them constantly while cooking to prevent them from burning."
        },
        {
          "headline":"Cool your hazelnuts.",
          "description":"Remove the hazelnuts and place them on a kitchen towel. Set them aside until they're completely cool. They should be around room temperature and cool to the touch. Fold your towel over the nuts once they cool. Give the towel a good shake. This will remove most of the husks from the nuts."
        },
        {
          "headline":"Blend all your ingredients.",
          "description":"Place the condensed milk, sugar, hazel nuts, and vanilla extract into a blend. Blend for about 15 seconds. You want the nuts broken into small chunks but not completely dissolved in the liquids."
        },
        {
          "headline":"Heat your mixture.",
          "description":"Heat the blend in a saucepan over low heat. Keep heating until the creamer is warm. It should not be boiling hot, but warm tot he touch."
        },
        {
          "headline":"Steep the hazelnuts and strain.",
          "description":"Steeping means soaking dry ingredients in liquid so the liquid can absorb the flavor. You should steep your hazelnuts for about 30 minutes. Strain the liquid into the container. You now have hazelnut creamer."
        }
      ]
    },
    {
      "name":"Making Pecan Creamer",
      "steps":[
        {
          "headline":"Toast your pecans.",
          "description":"Place your pecans in a skillet. Toast them over medium heat, making sure to stir them constantly. When the pecans start giving off a pleasant aroma, you can remove them from the heat."
        },
        {
          "headline":"Blend your ingredients.",
          "description":"Place the pecans, condensed milk, maple syrup, cinnamon, and vanilla extract in a blender. Blend until your pecans are finely chopped. You do not want the pecans to completely dissolve into the liquids."
        },
        {
          "headline":"Heat your mixture.",
          "description":"Place your mixture in a sauce pan. Cook the mixture over low heat until it's just warm."
        },
        {
          "headline":"Steep the pecans and strain.",
          "description":"Steeping is the method in which you let solid ingredients stay in liquid ingredients to absorb the flavor. The pecans should steep for about 30 minutes. When the steeping process is over, strain your pecans into a small container. You now have pecan pie flavored creamer."
        }
      ]
    },
    {
      "name":"Making Cinnamon Vanilla Creamer",
      "steps":[
        {
          "headline":"Mix equal parts condensed milk and half-and-half in a mason jar.",
          "description":"How much you should use depends on how much creamer you want. Use the jar you choose as your guide, adding as much as can reasonably fit in the jar. Make sure you have the same amount of condensed milk and half-and-half. Make sure you leave about an inch of headspace. The measuring does not have to be completely precise, but it can be a good idea to use measuring cups here."
        },
        {
          "headline":"Sprinkle in your flavorings.",
          "description":"Measure out the cinnamon and vanilla extract. Pour the spices in with the milk and cream mixture."
        },
        {
          "headline":"Shake your jar to mix.",
          "description":"Seal your jar tightly to prevent leaking. Give the jar a good shake. Shake for a few seconds to mix everything evenly."
        },
        {
          "headline":"Chill before serving.",
          "description":"The creamer will taste best after it's been chilled. Place it in a refrigerator for at least an hour before adding it to coffee. The creamer will last about as long as the expiration date indicated on your milk and half-and-half."
        }
      ]
    },
    {
      "name":"Making Mocha Creamer",
      "steps":[
        {
          "headline":"Add equal parts half-and-half and creamer to a jar.",
          "description":"Select a jar and fill it with one part half-and-half and one part creamer. How much you add depends on the size of the jar. Make sure to leave an inch of headspace at the top. For precise measurements, use a measuring cup."
        },
        {
          "headline":"Add your flavors.",
          "description":"Measure out the cocoa and espresso powder. Add that to your half-and-half and creamer mixture."
        },
        {
          "headline":"Shake to mix.",
          "description":"Close the lid tightly. Then, shake the jar for a few seconds. Keep shaking until everything is mixed evenly and the creamer is all the same color."
        },
        {
          "headline":"Chill before using.",
          "description":"You should let the creamer sit in the fridge for at least an hour before using it. It will last about as long as the expiration date of the milk and half-and-half. It's a good idea to write the approximate expiration date on the top of the mason jar with sharpie."
        }
      ]
    }
  ],
  "text":" Making Hazelnut Creamer Toast your hazelnuts. Place the nuts in a skillet over medium heat. Cook them until they begin to brown and give off an aroma. Stir them constantly while cooking to prevent them from burning. Cool your hazelnuts. Remove the hazelnuts and place them on a kitchen towel. Set them aside until they're completely cool. They should be around room temperature and cool to the touch. Fold your towel over the nuts once they cool. Give the towel a good shake. This will remove most of the husks from the nuts. Blend all your ingredients. Place the condensed milk, sugar, hazel nuts, and vanilla extract into a blend. Blend for about 15 seconds. You want the nuts broken into small chunks but not completely dissolved in the liquids. Heat your mixture. Heat the blend in a saucepan over low heat. Keep heating until the creamer is warm. It should not be boiling hot, but warm tot he touch. Steep the hazelnuts and strain. Steeping means soaking dry ingredients in liquid so the liquid can absorb the flavor. You should steep your hazelnuts for about 30 minutes. Strain the liquid into the container. You now have hazelnut creamer. Making Pecan Creamer Toast your pecans. Place your pecans in a skillet. Toast them over medium heat, making sure to stir them constantly. When the pecans start giving off a pleasant aroma, you can remove them from the heat. Blend your ingredients. Place the pecans, condensed milk, maple syrup, cinnamon, and vanilla extract in a blender. Blend until your pecans are finely chopped. You do not want the pecans to completely dissolve into the liquids. Heat your mixture. Place your mixture in a sauce pan. Cook the mixture over low heat until it's just warm. Steep the pecans and strain. Steeping is the method in which you let solid ingredients stay in liquid ingredients to absorb the flavor. The pecans should steep for about 30 minutes. When the steeping process is over, strain your pecans into a small container. You now have pecan pie flavored creamer. Making Cinnamon Vanilla Creamer Mix equal parts condensed milk and half-and-half in a mason jar. How much you should use depends on how much creamer you want. Use the jar you choose as your guide, adding as much as can reasonably fit in the jar. Make sure you have the same amount of condensed milk and half-and-half. Make sure you leave about an inch of headspace. The measuring does not have to be completely precise, but it can be a good idea to use measuring cups here. Sprinkle in your flavorings. Measure out the cinnamon and vanilla extract. Pour the spices in with the milk and cream mixture. Shake your jar to mix. Seal your jar tightly to prevent leaking. Give the jar a good shake. Shake for a few seconds to mix everything evenly. Chill before serving. The creamer will taste best after it's been chilled. Place it in a refrigerator for at least an hour before adding it to coffee. The creamer will last about as long as the expiration date indicated on your milk and half-and-half. Making Mocha Creamer Add equal parts half-and-half and creamer to a jar. Select a jar and fill it with one part half-and-half and one part creamer. How much you add depends on the size of the jar. Make sure to leave an inch of headspace at the top. For precise measurements, use a measuring cup. Add your flavors. Measure out the cocoa and espresso powder. Add that to your half-and-half and creamer mixture. Shake to mix. Close the lid tightly. Then, shake the jar for a few seconds. Keep shaking until everything is mixed evenly and the creamer is all the same color. Chill before using. You should let the creamer sit in the fridge for at least an hour before using it. It will last about as long as the expiration date of the milk and half-and-half. It's a good idea to write the approximate expiration date on the top of the mason jar with sharpie.",
  "tyn_model":[
    "half-and-half",
    "hazelnuts",
    "condensed milk",
    "pecans",
    "vanilla extract",
    "milk",
    "creamer",
    "skillet",
    "cinnamon",
    "mason jar",
    "making hazelnut creamer",
    "kitchen towel",
    "towel",
    "nuts",
    "sugar",
    "hazel nuts",
    "saucepan",
    "container",
    "hazelnut creamer",
    "pecan creamer",
    "maple syrup",
    "blender",
    "sauce pan",
    "pecan pie flavored",
    "cinnamon vanilla creamer",
    "cream",
    "coffee",
    "cocoa",
    "espresso powder",
    "sharpie"
  ],
  "tyn_section":[

  ]
}