{
  "title":"How to Make Benne Cakes",
  "url":"https://www.wikihow.com/Make-Benne-Cakes",
  "category_hierarchy":[
    "Food and Entertaining",
    "Recipes",
    "Baking",
    "Cookies and Biscuits"
  ],
  "parts":[
    {
      "name":"Beginning the Baking Process",
      "steps":[
        {
          "headline":"Toast your sesame seeds.",
          "description":"To start, you will need to toast your sesame seeds. You should use a dry pan over medium heat to toast your seeds. Toast the seeds until they brown slightly. Do not cook them until they burn."
        },
        {
          "headline":"Soften your butter.",
          "description":"Your butter needs to be softened to make benne cakes. There are many ways to soften your butter for baking. You can slice your butter into small chunks. This encourages it to soften faster. You can place the butter in a Ziploc bag and pound it with a rolling pin. It can take awhile for butter to soften, so set it out for about an hour before you make your benne cakes."
        },
        {
          "headline":"Mix your dry ingredients.",
          "description":"In a mixing bowl, add your flour, baking powder, and salt. Use a fork or spoon to mix all the dry ingredients together. Set them aside for now."
        }
      ]
    },
    {
      "name":"Mixing Your Ingredients",
      "steps":[
        {
          "headline":"Beat the butter and brown sugar.",
          "description":"Add the butter and brown sugar to a large mixing bowl. Use a wooden spoon to cream them together until you have a smooth, even consistency. To cream butter and sugar, you gently mash the butter and run the spoon downward, slowly incorporating the sugar."
        },
        {
          "headline":"Add the egg, lemon juice and vanilla extract.",
          "description":"After the butter and sugar are creamed, measure out your vanilla. Add this and the egg and lemon juice to the batter. Use your mixing spoon to stir the ingredients together until everything is evenly mixed."
        },
        {
          "headline":"Add the dry ingredients and sesame.",
          "description":"Add the dry ingredients you set aside earlier. It can sometimes help to add the dry ingredients in small intervals, as this can prevent the dough from getting to dry. Once the dry ingredients are evenly mixed, you can stir in the sesame seeds."
        }
      ]
    },
    {
      "name":"Completing Your Benne Cookies",
      "steps":[
        {
          "headline":"Prepare a cooking sheet.",
          "description":"Use parchment paper to line the cookie sheet or use cooking oil to lightly spray a cookie sheet. This will prevent your cookies from sticking. Don't add too much cooking spray. A light layer is enough."
        },
        {
          "headline":"Drop your cookies onto the sheet.",
          "description":"Benne cookies are drop cookies. This means you use a rounded teaspoon to scoop up the dough. From there, gently drop the cookies onto the plate. Keep the cookies about two inches apart."
        },
        {
          "headline":"Bake your cookies.",
          "description":"Your benne cookie should be baked at 325 degrees Fahrenheit (approximately 163 degrees Celsius) for 15 minutes. The edges should be browned when they're done. You may need to cook your benne cookies for a bit longer if the do not look done after 15 minutes. Cool your cookies on an iron cooling rack before serving."
        }
      ]
    }
  ],
  "text":" Beginning the Baking Process Toast your sesame seeds. To start, you will need to toast your sesame seeds. You should use a dry pan over medium heat to toast your seeds. Toast the seeds until they brown slightly. Do not cook them until they burn. Soften your butter. Your butter needs to be softened to make benne cakes. There are many ways to soften your butter for baking. You can slice your butter into small chunks. This encourages it to soften faster. You can place the butter in a Ziploc bag and pound it with a rolling pin. It can take awhile for butter to soften, so set it out for about an hour before you make your benne cakes. Mix your dry ingredients. In a mixing bowl, add your flour, baking powder, and salt. Use a fork or spoon to mix all the dry ingredients together. Set them aside for now. Mixing Your Ingredients Beat the butter and brown sugar. Add the butter and brown sugar to a large mixing bowl. Use a wooden spoon to cream them together until you have a smooth, even consistency. To cream butter and sugar, you gently mash the butter and run the spoon downward, slowly incorporating the sugar. Add the egg, lemon juice and vanilla extract. After the butter and sugar are creamed, measure out your vanilla. Add this and the egg and lemon juice to the batter. Use your mixing spoon to stir the ingredients together until everything is evenly mixed. Add the dry ingredients and sesame. Add the dry ingredients you set aside earlier. It can sometimes help to add the dry ingredients in small intervals, as this can prevent the dough from getting to dry. Once the dry ingredients are evenly mixed, you can stir in the sesame seeds. Completing Your Benne Cookies Prepare a cooking sheet. Use parchment paper to line the cookie sheet or use cooking oil to lightly spray a cookie sheet. This will prevent your cookies from sticking. Don't add too much cooking spray. A light layer is enough. Drop your cookies onto the sheet. Benne cookies are drop cookies. This means you use a rounded teaspoon to scoop up the dough. From there, gently drop the cookies onto the plate. Keep the cookies about two inches apart. Bake your cookies. Your benne cookie should be baked at 325 degrees Fahrenheit (approximately 163 degrees Celsius) for 15 minutes. The edges should be browned when they're done. You may need to cook your benne cookies for a bit longer if the do not look done after 15 minutes. Cool your cookies on an iron cooling rack before serving.",
  "tyn_model":[
    "butter",
    "sugar",
    "brown sugar",
    "benne cookies",
    "cookie sheet",
    "ziploc bag",
    "rolling pin",
    "mixing bowl",
    "flour",
    "baking powder",
    "salt",
    "fork",
    "large mixing bowl",
    "wooden spoon",
    "egg",
    "lemon juice",
    "vanilla extract",
    "vanilla",
    "lemon",
    "mixing spoon",
    "sesame",
    "sesame seeds",
    "cooking sheet",
    "parchment paper",
    "cooking oil",
    "cooking spray",
    "plate",
    "benne cookie"
  ],
  "tyn_section":[

  ]
}