{
  "title":"How to Make Double Chocolate Brownies",
  "url":"https://www.wikihow.com/Make-Double-Chocolate-Brownies",
  "category_hierarchy":[
    "Food and Entertaining",
    "Recipes",
    "Baking",
    "Cakes",
    "Brownies"
  ],
  "parts":[
    {
      "name":"Readying the Oven and Pan",
      "steps":[
        {
          "headline":"Preheat the oven.",
          "description":"To ensure that the oven is hot enough for the brownies, it\u2019s important to preheat it. Set the temperature to 350 degrees Fahrenheit (177 degrees Celsius), and allow it to fully heat. Keep an eye on the oven so you know when it\u2019s finished preheated. Your oven will likely beep or flash an indicator light to alert you."
        },
        {
          "headline":"Grease the pan.",
          "description":"You\u2019ll need a 9 x 13-inch (23 x 33-cm) baking pan for the brownies. Grease it lightly with butter, shortening or a nonstick cooking spray. While you\u2019re going to place parchment paper in the pan as a liner, greasing it first ensures that the paper will stick to it."
        },
        {
          "headline":"Line the pan with parchment paper.",
          "description":"After you\u2019ve greased the pan, cut a piece parchment paper to line the pan. It should be long enough to cover the bottom and two of the sides. Press it down in the pan so it sticks to the greased surface. If you don\u2019t have parchment paper, you can substitute foil. However, you will need to grease the top of the foil so the brownies don\u2019t stick to it."
        }
      ]
    },
    {
      "name":"Mixing the Batter",
      "steps":[
        {
          "headline":"Combine the cocoa and baking powders.",
          "description":"Add \u00be cup (75 g) of cocoa powder and \u00bd teaspoon (1 g) of baking powder to a large bowl. Stir the two together until they\u2019re completely blended. If you\u2019re out of baking powder, combine \u00bc teaspoon (.5 g) baking soda with \u00bc teaspoon (.5 g) of cream of tartar to add to the batter."
        },
        {
          "headline":"Add half of the melted butter.",
          "description":"When the cocoa powder and baking powder are fully mixed, stir in \u2153 cup (75 g) of melted butter. Blend the mixture until the butter is fully incorporated. For best results, use unsalted butter. However, if you only have salted butter on hand, just omit the added salt later in the recipe."
        },
        {
          "headline":"Mix in the boiling water.",
          "description":"Once the butter is incorporated into the batter, add \u00bd cup (118 ml) of boiling water to the bowl. Stir the mixture until it\u2019s completely blended and smooth."
        },
        {
          "headline":"Blend in sugar, eggs, and remaining butter.",
          "description":"When the boiling water has been mixed in, add in 2 cups (450 g) of sugar, 2 large eggs, and the remaining \u2153 cup (75 g) of melted butter. Stir well until the ingredients are fully incorporated. It\u2019s a good idea to break the eggs in a separate bowl before mixing them into the bowl. That way, if one is bad, you won\u2019t ruin all of the batter."
        },
        {
          "headline":"Stir in the flour, vanilla, and salt.",
          "description":"Once the sugar, eggs, and butter are blended into the batter, add 1 \u2153 cup (167 g) of all-purpose flour, 1 teaspoon (5 ml) of vanilla extract, and \u00bc (1.5 g) teaspoon of salt. Mix well until the ingredients are fully incorporated and the batter is as smooth as possible. If you usually make boxed brownies, this batter may be thicker than you\u2019re used to. Don\u2019t worry -- that\u2019s the proper consistency."
        },
        {
          "headline":"Add the nuts and chocolate chunks.",
          "description":"When you\u2019re finished mixing the batter, fold in \u00bd cup (65 g) of coarsely chopped nuts and 2 cups (350 g) of semisweet chocolate chunks. Make sure that they\u2019re fully blended throughout the batter. Walnuts and pecans are typically used in brownies, but you can use whatever type of nut that you prefer. You can substitute other types of chocolate chunks, such as milk chocolate or bittersweet, for the semisweet chunks if you prefer. If you don\u2019t have chocolate chunks, you can use chocolate chips instead."
        }
      ]
    },
    {
      "name":"Baking the Brownies",
      "steps":[
        {
          "headline":"Pour the batter into the pan.",
          "description":"Once the nuts and chocolate chunks are mixed into the batter, transfer it to the prepared pan. Use a spatula to smooth it into place so it\u2019s in an even layer."
        },
        {
          "headline":"Bake the brownies until they\u2019re set.",
          "description":"Place the pan of brownies in the preheated oven, and allow them to bake for 35 to 40 minutes. You\u2019ll know that they\u2019re done when they are set and start to pull away from the sides of the pan. For the best results, bake the brownies on the center rack of the oven."
        },
        {
          "headline":"Cool the brownies before cutting.",
          "description":"Remove the brownies from the oven, and place the pan on a wire rack to cool. It should take approximately 30 minutes for the brownies to cool to room temperature. Cut them into squares, and serve. If you like, you can garnish the brownies with powdered sugar."
        },
        {
          "headline":"Finished.",
          "description":""
        }
      ]
    }
  ],
  "text":" Readying the Oven and Pan Preheat the oven. To ensure that the oven is hot enough for the brownies, it\u2019s important to preheat it. Set the temperature to 350 degrees Fahrenheit (177 degrees Celsius), and allow it to fully heat. Keep an eye on the oven so you know when it\u2019s finished preheated. Your oven will likely beep or flash an indicator light to alert you. Grease the pan. You\u2019ll need a 9 x 13-inch (23 x 33-cm) baking pan for the brownies. Grease it lightly with butter, shortening or a nonstick cooking spray. While you\u2019re going to place parchment paper in the pan as a liner, greasing it first ensures that the paper will stick to it. Line the pan with parchment paper. After you\u2019ve greased the pan, cut a piece parchment paper to line the pan. It should be long enough to cover the bottom and two of the sides. Press it down in the pan so it sticks to the greased surface. If you don\u2019t have parchment paper, you can substitute foil. However, you will need to grease the top of the foil so the brownies don\u2019t stick to it. Mixing the Batter Combine the cocoa and baking powders. Add \u00be cup (75 g) of cocoa powder and \u00bd teaspoon (1 g) of baking powder to a large bowl. Stir the two together until they\u2019re completely blended. If you\u2019re out of baking powder, combine \u00bc teaspoon (.5 g) baking soda with \u00bc teaspoon (.5 g) of cream of tartar to add to the batter. Add half of the melted butter. When the cocoa powder and baking powder are fully mixed, stir in \u2153 cup (75 g) of melted butter. Blend the mixture until the butter is fully incorporated. For best results, use unsalted butter. However, if you only have salted butter on hand, just omit the added salt later in the recipe. Mix in the boiling water. Once the butter is incorporated into the batter, add \u00bd cup (118 ml) of boiling water to the bowl. Stir the mixture until it\u2019s completely blended and smooth. Blend in sugar, eggs, and remaining butter. When the boiling water has been mixed in, add in 2 cups (450 g) of sugar, 2 large eggs, and the remaining \u2153 cup (75 g) of melted butter. Stir well until the ingredients are fully incorporated. It\u2019s a good idea to break the eggs in a separate bowl before mixing them into the bowl. That way, if one is bad, you won\u2019t ruin all of the batter. Stir in the flour, vanilla, and salt. Once the sugar, eggs, and butter are blended into the batter, add 1 \u2153 cup (167 g) of all-purpose flour, 1 teaspoon (5 ml) of vanilla extract, and \u00bc (1.5 g) teaspoon of salt. Mix well until the ingredients are fully incorporated and the batter is as smooth as possible. If you usually make boxed brownies, this batter may be thicker than you\u2019re used to. Don\u2019t worry -- that\u2019s the proper consistency. Add the nuts and chocolate chunks. When you\u2019re finished mixing the batter, fold in \u00bd cup (65 g) of coarsely chopped nuts and 2 cups (350 g) of semisweet chocolate chunks. Make sure that they\u2019re fully blended throughout the batter. Walnuts and pecans are typically used in brownies, but you can use whatever type of nut that you prefer. You can substitute other types of chocolate chunks, such as milk chocolate or bittersweet, for the semisweet chunks if you prefer. If you don\u2019t have chocolate chunks, you can use chocolate chips instead. Baking the Brownies Pour the batter into the pan. Once the nuts and chocolate chunks are mixed into the batter, transfer it to the prepared pan. Use a spatula to smooth it into place so it\u2019s in an even layer. Bake the brownies until they\u2019re set. Place the pan of brownies in the preheated oven, and allow them to bake for 35 to 40 minutes. You\u2019ll know that they\u2019re done when they are set and start to pull away from the sides of the pan. For the best results, bake the brownies on the center rack of the oven. Cool the brownies before cutting. Remove the brownies from the oven, and place the pan on a wire rack to cool. It should take approximately 30 minutes for the brownies to cool to room temperature. Cut them into squares, and serve. If you like, you can garnish the brownies with powdered sugar. Finished. ",
  "tyn_model":[
    "oven",
    "butter",
    "parchment paper",
    "eggs",
    "baking powder",
    "salt",
    "bowl",
    "sugar",
    "nuts",
    "foil",
    "cocoa",
    "\u2153 cup",
    "water",
    "pan",
    "baking pan",
    "nonstick cooking spray",
    "baking powders",
    "cocoa powder",
    "large bowl",
    "baking soda",
    "cream of tartar",
    "unsalted butter",
    "salted butter",
    "boiling water",
    "flour",
    "vanilla",
    "1 \u2153",
    "all-purpose flour",
    "vanilla extract",
    "chocolate",
    "walnuts",
    "pecans",
    "milk chocolate",
    "chocolate chips",
    "spatula",
    "powdered sugar"
  ],
  "tyn_section":[

  ]
}