{
  "title":"How to Make Chocolate Peanut Butter Fudge",
  "url":"https://www.wikihow.com/Make-Chocolate-Peanut-Butter-Fudge",
  "category_hierarchy":[
    "Food and Entertaining",
    "Recipes",
    "Chocolate and Candy",
    "Fudge"
  ],
  "methods":[
    {
      "name":"Making Chocolate Peanut Butter Fudge",
      "steps":[
        {
          "headline":"Line an 8-inch-square baking pan with foil.",
          "description":"Tear off a large piece of foil and place it over the baking pan. Push down in the center, and then press the foil into the corners and up the sides of the pan. Be sure to leave a few inches of overhang on two sides of the pan."
        },
        {
          "headline":"Brush the foil with butter.",
          "description":"Allow your unsalted butter to soften at room temperature or, if you don't want to wait, pop it in the microwave for a few seconds to soften it up. Use a pastry brush to cover the bottom and all four sides of the foil-lined pan with butter."
        },
        {
          "headline":"Place condensed milk, chocolate chips and salt in one saucepan.",
          "description":"Measure out \u00be cup of the condensed milk, reserving the rest. Place the milk in a medium-sized saucepan, then add the chocolate chips and a pinch of salt."
        },
        {
          "headline":"Put the reserved milk, peanut butter chips and salt in another saucepan.",
          "description":"Pour the remaining condensed milk into a separate medium-sized saucepan. Add the peanut butter chips and a pinch of salt to the pan."
        },
        {
          "headline":"Place both saucepans side-by-side over low heat.",
          "description":"Arrange both saucepans on your stove, side-by-side, in a way that you can easily access both. Turn on low heat beneath both of them. Stir both mixtures occasionally as they melt. Once they have both melted completely, remove them from heat. Their consistencies should be smooth."
        },
        {
          "headline":"Place alternating spoonfuls of both mixtures into the baking pan.",
          "description":"Use a teaspoon to scoop up some of the chocolate mixture, then carefully drop it on the foil in the prepared baking pan. Continue to do this until you fill up the pan, taking care to leave gaps between each spoonful. Then spoon the peanut butter mixture into the gaps. If you prefer, you can alternate spoonfuls of the chocolate and peanut butter rather than doing all of one, then all of the other."
        },
        {
          "headline":"Place a prepared 8-inch square of parchment paper on top of the pan.",
          "description":"Cut the parchment paper to size and then brush it with unsalted butter, just as you did with the foil. Then place the parchment paper right on top of the fudge in the pan. Press down on the paper so that the surface is even and flat."
        },
        {
          "headline":"Put the fudge in the refrigerator until it becomes firm.",
          "description":"This should take approximately 45 minutes. Once firm, take the pan out. Pull up on the two foil flaps that you left overhanging to remove the fudge from the pan. Cut the fudge into 1-inch squares and serve. The fudge will keep for one week in an airtight container."
        }
      ]
    },
    {
      "name":"Making Sugar-Free Chocolate Peanut Butter Fudge",
      "steps":[
        {
          "headline":"Place the chocolate in a medium-sized saucepan over low heat.",
          "description":"Break the unsweetened chocolate into squares and put them in the saucepan. Stir occasionally over low heat until the chocolate has completely melted. Keep a close eye on the saucepan so the chocolate doesn't burn."
        },
        {
          "headline":"Mix in the remaining ingredients.",
          "description":"Measure out the sugar-free peanut butter and sugar substitutes and add them to the saucepan. Then add a pinch of salt. Stir the mixture until everything has fully combined. Taste the mixture and adjust the sweetener if necessary."
        },
        {
          "headline":"Spread the mixture into a 9x5-inch loaf pan.",
          "description":"Remove the saucepan from heat. The fudge mixture will be very thick. Stir it one final time, then use a spatula to scoop the mixture out and pack it all into the loaf pan."
        },
        {
          "headline":"Cool the mixture to room temperature.",
          "description":"You can leave the fudge out on the counter until it naturally cools to room temperature, or you can place it in the refrigerator to speed up the process. Once the fudge has cooled and is firm to the touch, cut it into about 18 pieces. It's ready to be served. Store the fudge pieces in an airtight container for up to one week."
        }
      ]
    },
    {
      "name":"Making Vegan Gluten-Free Chocolate Peanut Butter Fudge Swirl",
      "steps":[
        {
          "headline":"Line a 9x5-inch baking pan with a one long piece of parchment paper.",
          "description":"Place a large piece of parchment paper directly over the pan. Cut the paper so that it fits perfectly along the base of the pan. Leave one inch of the paper hanging over the two short sides of the pan."
        },
        {
          "headline":"Combine the peanut butter, oil, syrup/honey and salt in a mixing bowl.",
          "description":"Measure out the ingredients and place them all in a medium-sized mixing bowl. Use a whisk to stir the ingredients until they are completely blended together. Reserve approximately \u00bd cup of the peanut butter mixture in a medium-sized bowl."
        },
        {
          "headline":"Pour the rest of the peanut butter mixture into the baking pan.",
          "description":"After setting aside \u00bd cup of the mixture, add the rest to the baking pan lined with parchment paper. The consistency will be thick, so use a spatula to smooth the mixture and distribute it evenly in the pan."
        },
        {
          "headline":"Add the cocoa powder, oil, syrup/honey and salt to the reserved mixture.",
          "description":"Measure out the ingredients and place them in the medium-sized bowl with the reserved peanut butter mixture. Thoroughly blend the ingredients together using a whisk."
        },
        {
          "headline":"Spoon the chocolate mixture over the peanut butter mixture.",
          "description":"Once the chocolate mixture is combined thoroughly, use a spoon to transfer it right on top of the peanut butter mixture already inside the baking pan. The mixture will be very thick, so you will probably have to transfer it one spoon-dollop at a time."
        },
        {
          "headline":"Use a knife to create the swirl pattern.",
          "description":"Place the end of a butter knife down into the baking pan. Drag the knife through the mixture, making swirls and zig zags as you see fit. The chocolate and peanut butter will create a swirled pattern, blending into one another."
        },
        {
          "headline":"Cover the pan with plastic wrap and put it in the freezer until firm.",
          "description":"This will take approximately one hour, maybe a little longer. Once it finally feels firm, remove the pan from the freezer. Use a very sharp knife to cut the fudge into 1-inch pieces."
        },
        {
          "headline":"Serve the fudge chilled.",
          "description":"This fudge will melt quite quickly at room temperature, so serve it chilled or right out of the freezer. Store the pieces in an airtight container, in either the refrigerator or the freezer. The fudge will stay good in the refrigerator for two weeks. You can store it in the freezer for up to two months."
        },
        {
          "headline":"Finished.",
          "description":""
        }
      ]
    }
  ],
  "text":" Making Chocolate Peanut Butter Fudge Line an 8-inch-square baking pan with foil. Tear off a large piece of foil and place it over the baking pan. Push down in the center, and then press the foil into the corners and up the sides of the pan. Be sure to leave a few inches of overhang on two sides of the pan. Brush the foil with butter. Allow your unsalted butter to soften at room temperature or, if you don't want to wait, pop it in the microwave for a few seconds to soften it up. Use a pastry brush to cover the bottom and all four sides of the foil-lined pan with butter. Place condensed milk, chocolate chips and salt in one saucepan. Measure out \u00be cup of the condensed milk, reserving the rest. Place the milk in a medium-sized saucepan, then add the chocolate chips and a pinch of salt. Put the reserved milk, peanut butter chips and salt in another saucepan. Pour the remaining condensed milk into a separate medium-sized saucepan. Add the peanut butter chips and a pinch of salt to the pan. Place both saucepans side-by-side over low heat. Arrange both saucepans on your stove, side-by-side, in a way that you can easily access both. Turn on low heat beneath both of them. Stir both mixtures occasionally as they melt. Once they have both melted completely, remove them from heat. Their consistencies should be smooth. Place alternating spoonfuls of both mixtures into the baking pan. Use a teaspoon to scoop up some of the chocolate mixture, then carefully drop it on the foil in the prepared baking pan. Continue to do this until you fill up the pan, taking care to leave gaps between each spoonful. Then spoon the peanut butter mixture into the gaps. If you prefer, you can alternate spoonfuls of the chocolate and peanut butter rather than doing all of one, then all of the other. Place a prepared 8-inch square of parchment paper on top of the pan. Cut the parchment paper to size and then brush it with unsalted butter, just as you did with the foil. Then place the parchment paper right on top of the fudge in the pan. Press down on the paper so that the surface is even and flat. Put the fudge in the refrigerator until it becomes firm. This should take approximately 45 minutes. Once firm, take the pan out. Pull up on the two foil flaps that you left overhanging to remove the fudge from the pan. Cut the fudge into 1-inch squares and serve. The fudge will keep for one week in an airtight container. Making Sugar-Free Chocolate Peanut Butter Fudge Place the chocolate in a medium-sized saucepan over low heat. Break the unsweetened chocolate into squares and put them in the saucepan. Stir occasionally over low heat until the chocolate has completely melted. Keep a close eye on the saucepan so the chocolate doesn't burn. Mix in the remaining ingredients. Measure out the sugar-free peanut butter and sugar substitutes and add them to the saucepan. Then add a pinch of salt. Stir the mixture until everything has fully combined. Taste the mixture and adjust the sweetener if necessary. Spread the mixture into a 9x5-inch loaf pan. Remove the saucepan from heat. The fudge mixture will be very thick. Stir it one final time, then use a spatula to scoop the mixture out and pack it all into the loaf pan. Cool the mixture to room temperature. You can leave the fudge out on the counter until it naturally cools to room temperature, or you can place it in the refrigerator to speed up the process. Once the fudge has cooled and is firm to the touch, cut it into about 18 pieces. It's ready to be served. Store the fudge pieces in an airtight container for up to one week. Making Vegan Gluten-Free Chocolate Peanut Butter Fudge Swirl Line a 9x5-inch baking pan with a one long piece of parchment paper. Place a large piece of parchment paper directly over the pan. Cut the paper so that it fits perfectly along the base of the pan. Leave one inch of the paper hanging over the two short sides of the pan. Combine the peanut butter, oil, syrup/honey and salt in a mixing bowl. Measure out the ingredients and place them all in a medium-sized mixing bowl. Use a whisk to stir the ingredients until they are completely blended together. Reserve approximately \u00bd cup of the peanut butter mixture in a medium-sized bowl. Pour the rest of the peanut butter mixture into the baking pan. After setting aside \u00bd cup of the mixture, add the rest to the baking pan lined with parchment paper. The consistency will be thick, so use a spatula to smooth the mixture and distribute it evenly in the pan. Add the cocoa powder, oil, syrup/honey and salt to the reserved mixture. Measure out the ingredients and place them in the medium-sized bowl with the reserved peanut butter mixture. Thoroughly blend the ingredients together using a whisk. Spoon the chocolate mixture over the peanut butter mixture. Once the chocolate mixture is combined thoroughly, use a spoon to transfer it right on top of the peanut butter mixture already inside the baking pan. The mixture will be very thick, so you will probably have to transfer it one spoon-dollop at a time. Use a knife to create the swirl pattern. Place the end of a butter knife down into the baking pan. Drag the knife through the mixture, making swirls and zig zags as you see fit. The chocolate and peanut butter will create a swirled pattern, blending into one another. Cover the pan with plastic wrap and put it in the freezer until firm. This will take approximately one hour, maybe a little longer. Once it finally feels firm, remove the pan from the freezer. Use a very sharp knife to cut the fudge into 1-inch pieces. Serve the fudge chilled. This fudge will melt quite quickly at room temperature, so serve it chilled or right out of the freezer. Store the pieces in an airtight container, in either the refrigerator or the freezer. The fudge will stay good in the refrigerator for two weeks. You can store it in the freezer for up to two months. Finished. ",
  "tyn_model":[
    "peanut butter",
    "baking pan",
    "foil",
    "salt",
    "chocolate",
    "saucepan",
    "parchment paper",
    "refrigerator",
    "freezer",
    "condensed milk",
    "medium-sized saucepan",
    "airtight container",
    "knife",
    "butter",
    "unsalted butter",
    "chocolate chips",
    "milk",
    "loaf pan",
    "spatula",
    "oil",
    "syrup",
    "honey",
    "whisk",
    "medium-sized bowl",
    "microwave",
    "pastry brush",
    "stove",
    "pan",
    "sugar-free chocolate peanut butter fudge",
    "unsweetened chocolate",
    "sugar-free peanut butter",
    "sugar",
    "sweetener",
    "mixing bowl",
    "medium-sized mixing bowl",
    "cocoa powder",
    "spoon",
    "butter knife",
    "plastic wrap"
  ],
  "tyn_section":[

  ]
}