{
  "title":"How to Prepare Rooibos Tea",
  "url":"https://www.wikihow.com/Prepare-Rooibos-Tea",
  "category_hierarchy":[
    "Food and Entertaining",
    "Drinks",
    "Tea"
  ],
  "methods":[
    {
      "name":"Brewing with Teabags",
      "steps":[
        {
          "headline":"Stuff tea bags with loose tea leaves.",
          "description":"If you have loose leaves, you need to create your teabags. Do this by stuffing your loose tea leaves into a store-bought teabag. You can purchase paper teabags online, the grocery store, or at a cafe. Use one heaping teaspoon (1.5 g) of tea leaves per eight ounces (236.58 mL) of water. If you've purchased your Rooibos tea already in teabags, you can skip this step."
        },
        {
          "headline":"Boil filtered or spring water.",
          "description":"Fill your teapot with water and then place it on top of your stovetop. Set the heat to high and boil the water. Rooibos tea tastes best when boiled at 212\u00b0F (100\u00b0C). You can use a food thermometer to determine the heat of your water. If you don't have a teapot you can use a regular pot. You can purchase spring water in bottles from the store. Purifying your water in a home filter, like a Brita, will also enhance the taste of your tea. Rooibos tea tastes the best with filtered or spring water, but can also be made with the distilled water from your faucet."
        },
        {
          "headline":"Place your tea bag and hot water in a mug or cup.",
          "description":"Put your tea bag in the cup before pouring the boiling water into it. Consider adding two bags of tea in your cup if you enjoy stronger tasting tea. You can also put any additional ingredients in your tea at this time, like sweeteners or creamers. If you do put additives, make sure to mix them in afterward."
        },
        {
          "headline":"Let your tea steep.",
          "description":"Let your tea steep for at least four to five minutes. To get the most out of your rooibos tea, allowing it to steep for up to ten minutes releases nutrients and antioxidants from the leaves. Rooibos tea must steep for a longer time than other teas."
        }
      ]
    },
    {
      "name":"Brewing Loose Tea Leaves",
      "steps":[
        {
          "headline":"Add more tea leaves if you enjoy a stronger cup of tea.",
          "description":"If you want to stay traditional, add one tsp (2.3 g) of tea leaves for every cup (236 mL) of water. Experiment with different tea leaf amounts to brew a tea that matches your preferences."
        },
        {
          "headline":"Bring a pot of water to a rolling boil.",
          "description":"The water temperature for rooibos tea should be 212\u00b0F (100\u00b0C). A rolling boil occurs when the bubbles pop on the surface of the water. You can achieve this by setting the heat on your stovetop to high."
        },
        {
          "headline":"Submerge tea leaves in boiling water.",
          "description":"Pour your boiling water over your tea leaves and allow them to steep for five to seven minutes. After the tea steeps, you can pour it into individual teacups and serve it. You can run your tea through a filter or sieve to filter the leaves out of your tea."
        },
        {
          "headline":"Prepare your tea in a drip coffee maker.",
          "description":"If you have an automatic coffee maker, you can also prepare your rooibos tea in it. Put the loose tea leaves into a regular coffee filter and fill it up with the appropriate amount of water. Again, you can use the same ratio of one tsp (2.3 g) of tea leaves for every cup (236 mL) of water. You can also brew your rooibos tea in a French press style coffee maker."
        }
      ]
    },
    {
      "name":"Preparing Iced Rooibos Tea",
      "steps":[
        {
          "headline":"Add rooibos tea leaves to a jar of filtered water.",
          "description":"Add four tablespoons (8 grams) of rooibos tea leaves to 1 liters (4.2 cups) of cold water. Cover it with the lid and place it in a shady, cool area in your kitchen."
        },
        {
          "headline":"Leave your jar of tea out for 8 hours.",
          "description":"Leaving your jar of water and tea leaves will impart the taste of the leaves into the water. You can submerge your leaves in water before going to sleep or while you're out of the house at work."
        },
        {
          "headline":"Use a French press or sieve to filter your tea.",
          "description":"Use a tea strainer, sieve, or a French press to separate your tea from the tea leaves. Straining your tea will eliminate any sediment or pulp from the tea leaves, making your tea smoother and cleaner."
        },
        {
          "headline":"Refrigerate and serve over ice with a sweetener of your choice.",
          "description":"Storing your tea in the refrigerator will make it chilled for when you want to drink it. When you're ready, fill a glass with ice and add whatever sweetener you want. A slice of a citrus fruit like lemon or orange goes perfectly with rooibos tea. Rooibos tea can be stored in the refrigerator for up to two weeks."
        }
      ]
    },
    {
      "name":"Adding Things to Your Tea",
      "steps":[
        {
          "headline":"Add sweeteners to your tea.",
          "description":"Although rooibos tea is naturally sweet and aromatic, you may want to make it sweeter. Adding sugar or artificial sweeteners can achieve a sweeter tasting tea. Incorporating honey into your tea is also another way to make it sweeter if you're trying to avoid refined sugars. Turbinado, or less refined brown sugar is also a popular sweetener for teas. You may want to add more sweeteners to iced tea since the taste of the tea is naturally stronger."
        },
        {
          "headline":"Adds fruit and citrus to your tea.",
          "description":"Adding lemon, lime, orange, or grapefruit in your rooibos tea helps bring out the natural flavors of the tea. You can place a slice of fruit into your pitcher if you're drinking iced rooibos tea. When hot, simply add the fruit to your tea and smash it with a spoon to release the flavors of the citrus."
        },
        {
          "headline":"Add cinnamon or mint to iced tea.",
          "description":"Adding cinnamon or mint to your iced tea will impart different flavors to your tea. If you like cool and refreshing drinks, try the mint. If you like warmer and richer tasting tea, you should opt for the cinnamon. Try both and see what additives you like the best."
        },
        {
          "headline":"Finished.",
          "description":""
        }
      ]
    }
  ],
  "text":" Brewing with Teabags Stuff tea bags with loose tea leaves. If you have loose leaves, you need to create your teabags. Do this by stuffing your loose tea leaves into a store-bought teabag. You can purchase paper teabags online, the grocery store, or at a cafe. Use one heaping teaspoon (1.5 g) of tea leaves per eight ounces (236.58 mL) of water. If you've purchased your Rooibos tea already in teabags, you can skip this step. Boil filtered or spring water. Fill your teapot with water and then place it on top of your stovetop. Set the heat to high and boil the water. Rooibos tea tastes best when boiled at 212\u00b0F (100\u00b0C). You can use a food thermometer to determine the heat of your water. If you don't have a teapot you can use a regular pot. You can purchase spring water in bottles from the store. Purifying your water in a home filter, like a Brita, will also enhance the taste of your tea. Rooibos tea tastes the best with filtered or spring water, but can also be made with the distilled water from your faucet. Place your tea bag and hot water in a mug or cup. Put your tea bag in the cup before pouring the boiling water into it. Consider adding two bags of tea in your cup if you enjoy stronger tasting tea. You can also put any additional ingredients in your tea at this time, like sweeteners or creamers. If you do put additives, make sure to mix them in afterward. Let your tea steep. Let your tea steep for at least four to five minutes. To get the most out of your rooibos tea, allowing it to steep for up to ten minutes releases nutrients and antioxidants from the leaves. Rooibos tea must steep for a longer time than other teas. Brewing Loose Tea Leaves Add more tea leaves if you enjoy a stronger cup of tea. If you want to stay traditional, add one tsp (2.3 g) of tea leaves for every cup (236 mL) of water. Experiment with different tea leaf amounts to brew a tea that matches your preferences. Bring a pot of water to a rolling boil. The water temperature for rooibos tea should be 212\u00b0F (100\u00b0C). A rolling boil occurs when the bubbles pop on the surface of the water. You can achieve this by setting the heat on your stovetop to high. Submerge tea leaves in boiling water. Pour your boiling water over your tea leaves and allow them to steep for five to seven minutes. After the tea steeps, you can pour it into individual teacups and serve it. You can run your tea through a filter or sieve to filter the leaves out of your tea. Prepare your tea in a drip coffee maker. If you have an automatic coffee maker, you can also prepare your rooibos tea in it. Put the loose tea leaves into a regular coffee filter and fill it up with the appropriate amount of water. Again, you can use the same ratio of one tsp (2.3 g) of tea leaves for every cup (236 mL) of water. You can also brew your rooibos tea in a French press style coffee maker. Preparing Iced Rooibos Tea Add rooibos tea leaves to a jar of filtered water. Add four tablespoons (8 grams) of rooibos tea leaves to 1 liters (4.2 cups) of cold water. Cover it with the lid and place it in a shady, cool area in your kitchen. Leave your jar of tea out for 8 hours. Leaving your jar of water and tea leaves will impart the taste of the leaves into the water. You can submerge your leaves in water before going to sleep or while you're out of the house at work. Use a French press or sieve to filter your tea. Use a tea strainer, sieve, or a French press to separate your tea from the tea leaves. Straining your tea will eliminate any sediment or pulp from the tea leaves, making your tea smoother and cleaner. Refrigerate and serve over ice with a sweetener of your choice. Storing your tea in the refrigerator will make it chilled for when you want to drink it. When you're ready, fill a glass with ice and add whatever sweetener you want. A slice of a citrus fruit like lemon or orange goes perfectly with rooibos tea. Rooibos tea can be stored in the refrigerator for up to two weeks. Adding Things to Your Tea Add sweeteners to your tea. Although rooibos tea is naturally sweet and aromatic, you may want to make it sweeter. Adding sugar or artificial sweeteners can achieve a sweeter tasting tea. Incorporating honey into your tea is also another way to make it sweeter if you're trying to avoid refined sugars. Turbinado, or less refined brown sugar is also a popular sweetener for teas. You may want to add more sweeteners to iced tea since the taste of the tea is naturally stronger. Adds fruit and citrus to your tea. Adding lemon, lime, orange, or grapefruit in your rooibos tea helps bring out the natural flavors of the tea. You can place a slice of fruit into your pitcher if you're drinking iced rooibos tea. When hot, simply add the fruit to your tea and smash it with a spoon to release the flavors of the citrus. Add cinnamon or mint to iced tea. Adding cinnamon or mint to your iced tea will impart different flavors to your tea. If you like cool and refreshing drinks, try the mint. If you like warmer and richer tasting tea, you should opt for the cinnamon. Try both and see what additives you like the best. Finished. ",
  "tyn_model":[
    "water",
    "tea leaves",
    "tea",
    "sieve",
    "iced tea",
    "cinnamon",
    "mint",
    "teapot",
    "tea bag",
    "french press",
    "sweetener",
    "tea bags",
    "tea leaf",
    "coffee maker",
    "coffee filter",
    "french press style coffee maker",
    "filtered water",
    "cold water",
    "tea strainer",
    "refrigerator",
    "glass",
    "ice",
    "sweeteners",
    "honey",
    "turbinado",
    "sugar",
    "lemon",
    "pitcher",
    "spoon",
    "citrus"
  ],
  "tyn_section":[

  ]
}