{
  "title":"How to Make Gluten\u2010Free Christmas Pudding",
  "url":"https://www.wikihow.com/Make-Gluten%E2%80%90Free-Christmas-Pudding",
  "category_hierarchy":[
    "Food and Entertaining",
    "Recipes",
    "Baking"
  ],
  "methods":[
    {
      "name":"Making Vegan No-Bake Gluten-Free Pudding",
      "steps":[
        {
          "headline":"Mix your dry ingredients together.",
          "description":"Take your prunes and figs and cut them into smaller pieces using scissors before adding them to the bowl. Combine your currants, raisins, sultanas, prunes, figs, peel, nuts, pear, vegetable suet, and spices and mix them together in a large mixing bowl. Make sure to incorporate the spices over the rest of the dry ingredients so that your pudding has a full, consistent flavor."
        },
        {
          "headline":"Combine the pureed pear and pear juice to the mixture.",
          "description":"Add 50g (5oz) of the pureed pear and 50ml (5fl oz) of the pear juice to your bowl and stir your mixture vigorously, making sure that the dry ingredients are fairly distributed throughout it. To kick your gluten-free pudding up a notch, you can use 100 milliliters (3.4  fl oz) (3\u00bd oz) of apple or pear juice and 50ml (2fl oz) of brandy instead of just using pear or apple juice. A large wooden spoon or sturdy whisk is great for mixing gluten-free pudding."
        },
        {
          "headline":"Sieve the flour with the baking powder and salt.",
          "description":"Combine your 100g (3\u00bd oz) of gluten and wheat-free flour with a fine sieve until they are completely mixed. Sifting the flour with the baking powder allows the flour to aerate which will add to the fluffiness of your pudding. It will also help incorporate all of the ingredients together."
        },
        {
          "headline":"Fold your flour into your bowl.",
          "description":"The gluten-free and wheat-free flour will help bind your mixture together. Carefully pour each flour, one at a time, into your mixture. Use your spoon or bowl and continue stirring until your mixture has a thicker viscosity. Work out any lumps by continuing to stir and fold the mixture together."
        },
        {
          "headline":"Pour your mixture into a pudding basin.",
          "description":"Use a 1.5-liter pudding basin when making your gluten-free pudding. Cover the top of the basin with the lid or a piece of greaseproof paper. You can purchase a pudding basin online or at most department stores or cook shops."
        },
        {
          "headline":"Put your basin in a tin or deep pan and fill it with water.",
          "description":"The water in your deep pan should come halfway up the side of your pudding basin. This will ensure an even cook throughout your pudding."
        },
        {
          "headline":"Simmer the pan for 4-5 hours.",
          "description":"Put a lid on the pan and keep your pudding on the stovetop for 4-5 hours on low-medium heat. During this time, the pudding should solidify. Check back on the water level in the pan every hour and add more water if it's evaporated. When adding new water, make sure to add hot water."
        },
        {
          "headline":"Allow your pudding to cool in the refrigerator overnight.",
          "description":"Remove the lid and attach cling wrap to the top of your pudding basin. You can store your Christmas pudding for almost three months before it goes bad."
        },
        {
          "headline":"Reheat your gluten-free pudding and eat it.",
          "description":"When you're ready to serve your gluten-free pudding, you have two ways of reheating it. You can either put it back into your tin or deep pan and re-steam it for one to two hours. Alternatively, you can put it in your microwave for 3-5 minutes, or until it becomes soft. You can garnish your Christmas pudding with holly and serve it with cream or brandy butter."
        }
      ]
    },
    {
      "name":"Baking Gluten-Free Pudding",
      "steps":[
        {
          "headline":"Simmer the apricots and raisins in a saucepan.",
          "description":"Use the 300 milliliters (10.1  fl oz) (1.26 cups) of red wine and 75g (1.26 cups) of brandy to make the dried fruit taste richer. Simmer them over low-medium heat for 15 minutes. Once you're done, set them aside and allow them to cool for at least 20 minutes."
        },
        {
          "headline":"Heat your oven to 180\u00b0C (356\u00b0F).",
          "description":"Preheat the oven so that when you start to bake your pudding, it will cook all the way through. Not preheating your oven often leads to an uneven cook, especially when baking Christmas pudding."
        },
        {
          "headline":"Combine your dates and orange in the food processor.",
          "description":"Pulse at medium to high for 30 seconds or until the dates and orange form a paste. To get the consistency that's desirable, a food processor may be required. If your mixture is lumpy, continue to pulse on high until it doesn't have lumps."
        },
        {
          "headline":"Add your eggs, olive oil,  vanilla, cinnamon, nutmeg, salt, and ginger.",
          "description":"Add your two eggs and 60 milliliters (2  fl oz) (1/4 cup) olive oil with your other spices to your food processor or large bowl. Continue to combine the ingredients, mixing them together until they are completely incorporated with one another. Your batter should have a smooth and creamy consistency."
        },
        {
          "headline":"Drain the remaining orange juice from the bowl.",
          "description":"Drain any orange juice that settles at the top of your mixture. The goal is to get your batter as creamy and smooth as possible. Excess water will make your cake more likely to fall apart when cooked."
        },
        {
          "headline":"Transfer to a large bowl and add your dried fruit and almond meal.",
          "description":"Put your paste into a large mixing bowl and your raisins and dried apricots to the mixture. Instead of raisins, you can also use sultanas or white raisins. Mix the batter together and prepare it for baking."
        },
        {
          "headline":"Put your batter in pudding molds and bake your pudding.",
          "description":"Transfer your batter to 750 milliliters (25.4  fl oz) pudding molds using a spatula. Place the molds on the middle rack in your oven and continue to bake your pudding for 45 minutes. Check back on your Christmas pudding and make sure that it's cooking properly. The outside should have a brown and crispy crust that forms on the top."
        },
        {
          "headline":"Cool your pudding for at least 10 minutes, then serve.",
          "description":"Allow your puddings to cool for at least 10 minutes before removing them from their molds. At this point, they should be solid enough so that you can remove them without them falling apart."
        },
        {
          "headline":"Finished.",
          "description":""
        }
      ]
    }
  ],
  "text":" Making Vegan No-Bake Gluten-Free Pudding Mix your dry ingredients together. Take your prunes and figs and cut them into smaller pieces using scissors before adding them to the bowl. Combine your currants, raisins, sultanas, prunes, figs, peel, nuts, pear, vegetable suet, and spices and mix them together in a large mixing bowl. Make sure to incorporate the spices over the rest of the dry ingredients so that your pudding has a full, consistent flavor. Combine the pureed pear and pear juice to the mixture. Add 50g (5oz) of the pureed pear and 50ml (5fl oz) of the pear juice to your bowl and stir your mixture vigorously, making sure that the dry ingredients are fairly distributed throughout it. To kick your gluten-free pudding up a notch, you can use 100 milliliters (3.4  fl oz) (3\u00bd oz) of apple or pear juice and 50ml (2fl oz) of brandy instead of just using pear or apple juice. A large wooden spoon or sturdy whisk is great for mixing gluten-free pudding. Sieve the flour with the baking powder and salt. Combine your 100g (3\u00bd oz) of gluten and wheat-free flour with a fine sieve until they are completely mixed. Sifting the flour with the baking powder allows the flour to aerate which will add to the fluffiness of your pudding. It will also help incorporate all of the ingredients together. Fold your flour into your bowl. The gluten-free and wheat-free flour will help bind your mixture together. Carefully pour each flour, one at a time, into your mixture. Use your spoon or bowl and continue stirring until your mixture has a thicker viscosity. Work out any lumps by continuing to stir and fold the mixture together. Pour your mixture into a pudding basin. Use a 1.5-liter pudding basin when making your gluten-free pudding. Cover the top of the basin with the lid or a piece of greaseproof paper. You can purchase a pudding basin online or at most department stores or cook shops. Put your basin in a tin or deep pan and fill it with water. The water in your deep pan should come halfway up the side of your pudding basin. This will ensure an even cook throughout your pudding. Simmer the pan for 4-5 hours. Put a lid on the pan and keep your pudding on the stovetop for 4-5 hours on low-medium heat. During this time, the pudding should solidify. Check back on the water level in the pan every hour and add more water if it's evaporated. When adding new water, make sure to add hot water. Allow your pudding to cool in the refrigerator overnight. Remove the lid and attach cling wrap to the top of your pudding basin. You can store your Christmas pudding for almost three months before it goes bad. Reheat your gluten-free pudding and eat it. When you're ready to serve your gluten-free pudding, you have two ways of reheating it. You can either put it back into your tin or deep pan and re-steam it for one to two hours. Alternatively, you can put it in your microwave for 3-5 minutes, or until it becomes soft. You can garnish your Christmas pudding with holly and serve it with cream or brandy butter. Baking Gluten-Free Pudding Simmer the apricots and raisins in a saucepan. Use the 300 milliliters (10.1  fl oz) (1.26 cups) of red wine and 75g (1.26 cups) of brandy to make the dried fruit taste richer. Simmer them over low-medium heat for 15 minutes. Once you're done, set them aside and allow them to cool for at least 20 minutes. Heat your oven to 180\u00b0C (356\u00b0F). Preheat the oven so that when you start to bake your pudding, it will cook all the way through. Not preheating your oven often leads to an uneven cook, especially when baking Christmas pudding. Combine your dates and orange in the food processor. Pulse at medium to high for 30 seconds or until the dates and orange form a paste. To get the consistency that's desirable, a food processor may be required. If your mixture is lumpy, continue to pulse on high until it doesn't have lumps. Add your eggs, olive oil,  vanilla, cinnamon, nutmeg, salt, and ginger. Add your two eggs and 60 milliliters (2  fl oz) (1/4 cup) olive oil with your other spices to your food processor or large bowl. Continue to combine the ingredients, mixing them together until they are completely incorporated with one another. Your batter should have a smooth and creamy consistency. Drain the remaining orange juice from the bowl. Drain any orange juice that settles at the top of your mixture. The goal is to get your batter as creamy and smooth as possible. Excess water will make your cake more likely to fall apart when cooked. Transfer to a large bowl and add your dried fruit and almond meal. Put your paste into a large mixing bowl and your raisins and dried apricots to the mixture. Instead of raisins, you can also use sultanas or white raisins. Mix the batter together and prepare it for baking. Put your batter in pudding molds and bake your pudding. Transfer your batter to 750 milliliters (25.4  fl oz) pudding molds using a spatula. Place the molds on the middle rack in your oven and continue to bake your pudding for 45 minutes. Check back on your Christmas pudding and make sure that it's cooking properly. The outside should have a brown and crispy crust that forms on the top. Cool your pudding for at least 10 minutes, then serve. Allow your puddings to cool for at least 10 minutes before removing them from their molds. At this point, they should be solid enough so that you can remove them without them falling apart. Finished. ",
  "tyn_model":[
    "pudding",
    "water",
    "bowl",
    "flour",
    "oven",
    "raisins",
    "pear",
    "spices",
    "food processor",
    "prunes",
    "large mixing bowl",
    "pear juice",
    "brandy",
    "baking powder",
    "salt",
    "pudding basin",
    "gluten-free pudding",
    "apricots",
    "dates",
    "eggs",
    "olive oil",
    "large bowl",
    "orange juice",
    "currants",
    "sultanas",
    "figs",
    "peel",
    "nuts",
    "vegetable suet",
    "apple or pear juice",
    "apple juice",
    "whisk",
    "gluten and wheat-free flour",
    "fine sieve",
    "gluten-free and",
    "wheat-free flour",
    "spoon",
    "greaseproof paper",
    "refrigerator",
    "microwave",
    "holly",
    "cream or brandy butter",
    "baking gluten-free pudding",
    "saucepan",
    "red wine",
    "vanilla",
    "cinnamon",
    "nutmeg",
    "ginger",
    "dried fruit",
    "almond meal",
    "spatula",
    "christmas pudding"
  ],
  "tyn_section":[

  ]
}