{
  "title":"How to Sweeten Foods with Maple Syrup",
  "url":"https://www.wikihow.com/Sweeten-Foods-with-Maple-Syrup",
  "category_hierarchy":[
    "Food and Entertaining",
    "Recipes",
    "Jams Preserves and Condiments",
    "Syrups"
  ],
  "methods":[
    {
      "name":"Using Maple Syrup in Desserts",
      "steps":[
        {
          "headline":"Know the benefits and disadvantages of maple syrup.",
          "description":"Sweetening a dessert with maple syrup rather than refined sugar can be a delicious way to liven up your favorite, treacly treat, but you should know that it's not an identical sugar substitute. Perhaps most importantly, you should know that maple syrup cannot leaven or moisten baked goods\u2014that is, add air and water to them\u2014as sugar does, so your finished product will come out denser and drier than the original, refined sugar recipe. It will also yield a slightly less sweet product, and it will darken your dessert due to its natural brown coloring."
        },
        {
          "headline":"Select a genuine maple syrup.",
          "description":"Oddly enough, your fondest memories of maple syrup-drenched pancakes might not involve maple syrup at all! That's because many of the syrups people think are maple\u2014such as popular brands like Aunt Jemima\u2014are actually just high fructose corn syrup with an aromatic additive to mimic the flavor and smell of maple. In order to avoid these insidious imposters, check the label and make sure it says 'maple,' rather than 'pancake syrup' or 'breakfast syrup.' You should also consider what kind of maple syrup you're purchasing. Grade A has a subtler flavor and a lighter coloring, while Grade B is darker, thicker, and stronger. Also, expect to pay more for a bottle of Grade A than you will for a bottle of B."
        },
        {
          "headline":"Find the right recipe.",
          "description":"It's best to use maple syrup in items that don't require creaming\u2014that is, beating sugar and butter together so that the granulated sugar cuts air bubbles in the butter and leavens the pastry. Add it instead to no-bake goods, such as candies, caramels, no-bake cookies and brownies, and ice creams. If you really want to add maple flavor to your baked goods, use granulated maple sugar\u2014essentially evaporated maple syrup\u2014instead of syrup. The ratio for this substitution is 1:1."
        },
        {
          "headline":"Substitute one cup (150 g) white sugar with \u00be cup (105 g) maple syrup.",
          "description":"When using maple syrup instead of refined sugar in your desserts, you should use three quarters of the amount of sugar which the recipe demands. Otherwise, follow the original recipe in all other respects, including cooking and refrigeration times. If you're using maple syrup in a baked good despite the caveats, reduce all the other liquids in the recipe by three tablespoons."
        },
        {
          "headline":"Experiment with other substitutions and sweeteners.",
          "description":"If your maple-sweetened dessert turned out just right, great! If not, you can try the substitution trick on other recipes, or try the same recipe again while combining the maple syrup with other sweeteners, such as molasses. Practice and tinkering will (eventually) make perfect!"
        },
        {
          "headline":"Try a maple-specific recipe, such as maple ice cream.",
          "description":"You don't have to limit your experimentation to old recipes where you replace the ingredient of refined sugar with maple syrup. Instead, try using a dessert recipe that originally called for it. For example, you can make your very own walnut-maple ice cream by mixing water, coconut butter, maple syrup, and sea salt, then freezing, and blending the mixture in a food processor with walnuts. Alternatively, no-bake maple brownies contain just five ingredients\u2014coconut flour, cocoa powder, a nut butter of your choice, maple syrup, and pumpkin puree\u2014and take only minutes to make!"
        }
      ]
    },
    {
      "name":"Sweetening Coffee with Maple Syrup",
      "steps":[
        {
          "headline":"Make your morning coffee as usual.",
          "description":"Using maple syrup instead of refined sugar or sugar substitutes can add a smooth, flavorful pop to your morning beverage. To do so, just make your coffee the way you always do, whether you customarily use a fancy French press, instant crystals, or a trusty Keurig. Consider making iced coffee if it's hot outside and you want something refreshing. If you're more of a tea person than a coffee person, try maple syrup in your tea instead! Maple goes particularly well with green tea and lemon flavors."
        },
        {
          "headline":"Add a small amount of pure maple syrup.",
          "description":"Since it's the first time you're experimenting with maple syrup in your coffee, start with a teaspoon when first testing the new combo. Sip the result and decide if it's sweet enough for your taste or not."
        },
        {
          "headline":"Stir in more maple syrup according to taste.",
          "description":"Now simply add as much\u2014or as little\u2014maple syrup as you like! Just keep in mind that one tablespoon of maple syrup contains 52 calories and 12.4 grams of sugar."
        }
      ]
    },
    {
      "name":"Glazing Root Vegetables with Maple Syrup",
      "steps":[
        {
          "headline":"Select a root vegetable, such as squash, carrots, or sweet potatoes.",
          "description":"When selecting the ingredients for your recipe, think about hearty root vegetables that stand up well to roasting. Butternut squash, carrots, beets, parsnips, and sweet potatoes all roast beautifully in the oven, and their flavor profiles mesh beautifully with maple. You can choose to roast just one kind of vegetable for your dish, or chop and mix together several different kinds."
        },
        {
          "headline":"Blend olive oil or butter with maple syrup.",
          "description":"Depending on how many root vegetables you're working with, you should mix about \u00bd cup (170 g) maple syrup with two tablespoons (28.6 g) butter or olive oil for every 2.5 pounds (1 kg) of vegetable. Add salt or pepper according to your usual cooking preferences. You can also experiment with more elaborate glazes, such as ones including chicken broth, garlic powder, honey, or rosemary."
        },
        {
          "headline":"Slather the mixture on your vegetables.",
          "description":"Drizzle the maple glaze on top of the vegetables and gently toss them in a bowl to make sure the glaze distributes evenly. Then lay the coated vegetables evenly on a baking sheet."
        },
        {
          "headline":"Roast until soft.",
          "description":"Roasting times can vary significantly among different root vegetables, so the basic rule-of-thumb is that you should roast until your veggies become tender and start to brown. Check your oven often to make sure that you don't burn them."
        },
        {
          "headline":"Serve vegetables with a grain or protein.",
          "description":"Roasted vegetables go well with just about anything, but they pair particularly well with grains, such as quinoa or rice. If you want something a bit heartier, serve them alongside a portion of meat, such as lean red meat, pork chops, grilled chicken, or fish. You can also use your roasted vegetables in a soup, or you can mix them up with eggs for a hearty, healthy omelet!"
        }
      ]
    }
  ],
  "text":" Using Maple Syrup in Desserts Know the benefits and disadvantages of maple syrup. Sweetening a dessert with maple syrup rather than refined sugar can be a delicious way to liven up your favorite, treacly treat, but you should know that it's not an identical sugar substitute. Perhaps most importantly, you should know that maple syrup cannot leaven or moisten baked goods\u2014that is, add air and water to them\u2014as sugar does, so your finished product will come out denser and drier than the original, refined sugar recipe. It will also yield a slightly less sweet product, and it will darken your dessert due to its natural brown coloring. Select a genuine maple syrup. Oddly enough, your fondest memories of maple syrup-drenched pancakes might not involve maple syrup at all! That's because many of the syrups people think are maple\u2014such as popular brands like Aunt Jemima\u2014are actually just high fructose corn syrup with an aromatic additive to mimic the flavor and smell of maple. In order to avoid these insidious imposters, check the label and make sure it says 'maple,' rather than 'pancake syrup' or 'breakfast syrup.' You should also consider what kind of maple syrup you're purchasing. Grade A has a subtler flavor and a lighter coloring, while Grade B is darker, thicker, and stronger. Also, expect to pay more for a bottle of Grade A than you will for a bottle of B. Find the right recipe. It's best to use maple syrup in items that don't require creaming\u2014that is, beating sugar and butter together so that the granulated sugar cuts air bubbles in the butter and leavens the pastry. Add it instead to no-bake goods, such as candies, caramels, no-bake cookies and brownies, and ice creams. If you really want to add maple flavor to your baked goods, use granulated maple sugar\u2014essentially evaporated maple syrup\u2014instead of syrup. The ratio for this substitution is 1:1. Substitute one cup (150 g) white sugar with \u00be cup (105 g) maple syrup. When using maple syrup instead of refined sugar in your desserts, you should use three quarters of the amount of sugar which the recipe demands. Otherwise, follow the original recipe in all other respects, including cooking and refrigeration times. If you're using maple syrup in a baked good despite the caveats, reduce all the other liquids in the recipe by three tablespoons. Experiment with other substitutions and sweeteners. If your maple-sweetened dessert turned out just right, great! If not, you can try the substitution trick on other recipes, or try the same recipe again while combining the maple syrup with other sweeteners, such as molasses. Practice and tinkering will (eventually) make perfect! Try a maple-specific recipe, such as maple ice cream. You don't have to limit your experimentation to old recipes where you replace the ingredient of refined sugar with maple syrup. Instead, try using a dessert recipe that originally called for it. For example, you can make your very own walnut-maple ice cream by mixing water, coconut butter, maple syrup, and sea salt, then freezing, and blending the mixture in a food processor with walnuts. Alternatively, no-bake maple brownies contain just five ingredients\u2014coconut flour, cocoa powder, a nut butter of your choice, maple syrup, and pumpkin puree\u2014and take only minutes to make! Sweetening Coffee with Maple Syrup Make your morning coffee as usual. Using maple syrup instead of refined sugar or sugar substitutes can add a smooth, flavorful pop to your morning beverage. To do so, just make your coffee the way you always do, whether you customarily use a fancy French press, instant crystals, or a trusty Keurig. Consider making iced coffee if it's hot outside and you want something refreshing. If you're more of a tea person than a coffee person, try maple syrup in your tea instead! Maple goes particularly well with green tea and lemon flavors. Add a small amount of pure maple syrup. Since it's the first time you're experimenting with maple syrup in your coffee, start with a teaspoon when first testing the new combo. Sip the result and decide if it's sweet enough for your taste or not. Stir in more maple syrup according to taste. Now simply add as much\u2014or as little\u2014maple syrup as you like! Just keep in mind that one tablespoon of maple syrup contains 52 calories and 12.4 grams of sugar. Glazing Root Vegetables with Maple Syrup Select a root vegetable, such as squash, carrots, or sweet potatoes. When selecting the ingredients for your recipe, think about hearty root vegetables that stand up well to roasting. Butternut squash, carrots, beets, parsnips, and sweet potatoes all roast beautifully in the oven, and their flavor profiles mesh beautifully with maple. You can choose to roast just one kind of vegetable for your dish, or chop and mix together several different kinds. Blend olive oil or butter with maple syrup. Depending on how many root vegetables you're working with, you should mix about \u00bd cup (170 g) maple syrup with two tablespoons (28.6 g) butter or olive oil for every 2.5 pounds (1 kg) of vegetable. Add salt or pepper according to your usual cooking preferences. You can also experiment with more elaborate glazes, such as ones including chicken broth, garlic powder, honey, or rosemary. Slather the mixture on your vegetables. Drizzle the maple glaze on top of the vegetables and gently toss them in a bowl to make sure the glaze distributes evenly. Then lay the coated vegetables evenly on a baking sheet. Roast until soft. Roasting times can vary significantly among different root vegetables, so the basic rule-of-thumb is that you should roast until your veggies become tender and start to brown. Check your oven often to make sure that you don't burn them. Serve vegetables with a grain or protein. Roasted vegetables go well with just about anything, but they pair particularly well with grains, such as quinoa or rice. If you want something a bit heartier, serve them alongside a portion of meat, such as lean red meat, pork chops, grilled chicken, or fish. You can also use your roasted vegetables in a soup, or you can mix them up with eggs for a hearty, healthy omelet!",
  "tyn_model":[
    "maple syrup",
    "refined sugar",
    "sugar",
    "butter",
    "vegetables",
    "maple",
    "\u2014that",
    "water",
    "syrup",
    "ice cream",
    "coffee",
    "carrots",
    "sweet potatoes",
    "oven",
    "olive oil",
    "\u2014as",
    "syrups",
    "\u2014such",
    "aunt jemima",
    "\u2014are",
    "high fructose corn syrup",
    "pancake syrup",
    "breakfast syrup",
    "ice creams",
    "maple sugar",
    "\u2014essentially",
    "\u2014instead",
    "white sugar",
    "baked good",
    "molasses",
    "coconut butter",
    "sea salt",
    "food processor",
    "maple brownies",
    "\u2014coconut",
    "cocoa powder",
    "nut butter",
    "pumpkin puree",
    "\u2014and",
    "french press",
    "instant crystals",
    "keurig",
    "tea",
    "green tea",
    "\u2014or",
    "\u2014maple",
    "root vegetable",
    "squash",
    "root vegetables",
    "butternut squash",
    "beets",
    "parsnips",
    "salt or pepper",
    "chicken broth",
    "garlic powder",
    "honey",
    "maple glaze",
    "bowl",
    "baking sheet",
    "rice",
    "grilled chicken",
    "fish",
    "eggs"
  ],
  "tyn_section":[

  ]
}