{
  "title":"How to Serve Halloumi Cheese",
  "url":"https://www.wikihow.com/Serve-Halloumi-Cheese",
  "category_hierarchy":[
    "Food and Entertaining",
    "Recipes",
    "Eggs and Dairy",
    "Cheese"
  ],
  "methods":[
    {
      "name":"Grilling Halloumi and Serving with Blueberry Jam",
      "steps":[
        {
          "headline":"Put lemon juice, thyme, and pepper into a shallow dish.",
          "description":"Any type of shallow dish will work. Use a spoon or any other utensil to mix lightly. Do not remove the mixture from the dish until the halloumi has been coated in it."
        },
        {
          "headline":"Add the halloumi to the dish.",
          "description":"You can keep the halloumi in its original block form, cut it in half, or cut it into strips. Turn it around in the mixture to coat it thoroughly. Next, allow the halloumi to marinate for one hour. Turn the cheese once during the hour."
        },
        {
          "headline":"Combine blueberries, vinegar, salt, and honey in a medium saucepan.",
          "description":"Simmer these ingredients on a high heat setting for a few minutes. Then, bring the heat down to medium and cook the mixture. Stir it occasionally until it has a thick consistency and then remove it. This should take 12 to 15 minutes for fresh berries. It will take 20 to 30 minutes altogether if you\u2019re using frozen berries."
        },
        {
          "headline":"Oil the grill rack.",
          "description":"This will prevent the food from sticking to the grill. First, allow the grill to heat up. After that, put oil on a folded paper towel. Use tongs to to rub the towel over the rack. Do not put cooking spray on a very hot grill."
        },
        {
          "headline":"Grill the halloumi.",
          "description":"Make sure the grill is preheated to medium-high. Put the halloumi in a pan and grill it until is warm. This should take about two minutes for each side. You can use a metal spatula to loosen the halloumi before flipping it to the other side."
        },
        {
          "headline":"Serve with the jam.",
          "description":"Take the jam you made and serve it with the halloumi. It should be served at room temperature. You can put it on the side, or you can drizzle it on top of the halloumi. It is your choice."
        }
      ]
    },
    {
      "name":"Baking Halloumi Fries",
      "steps":[
        {
          "headline":"Cut Halloumi slices.",
          "description":"Consider the amount of people you want to feed before purchasing the halloumi. You should purchase at least one pack of cheese to make these fries. Cut the halloumi into long, relatively thin slices. They should resemble fries."
        },
        {
          "headline":"Preheat the oven to 400\u00b0F (200\u00b0C).",
          "description":"Once you have preheated the oven, prepare the baking tray. Line the tray with parchment paper. Place tray in the oven for five minutes."
        },
        {
          "headline":"Mix coconut flour and Creole seasoning.",
          "description":"Pour coconut flour onto a plate. Sprinkle the Creole seasoning in and stir it together. You can also use a bag to mix the flour and seasoning."
        },
        {
          "headline":"Press the halloumi slices into the mixture.",
          "description":"Make sure they are thoroughly and evenly coated. The mixture should stick to the halloumi. You can lightly spray the halloumi with olive oil if you think it will be necessary."
        },
        {
          "headline":"Bake the Halloumi fries.",
          "description":"After the five minutes, remove the tray from the oven. Quickly before it gets cool, put the slices onto the tray. Then, lightly spray them with oil spray."
        },
        {
          "headline":"Put the tray into the oven.",
          "description":"Allow them to cook for ten minutes on one side. Then, flip the slices and allow them to cook for another eight minutes. They should be golden and slightly crisped around the edges when they are finished."
        },
        {
          "headline":"Serve with marinara sauce.",
          "description":"Remove the slices from the tray and place them on plates or a tray. Serve them with marinara sauce. If you want, you can make  your own marinara sauce, but if not, store-bought marinara sauce will do."
        }
      ]
    },
    {
      "name":"Making Halloumi Skewers",
      "steps":[
        {
          "headline":"Soak the halloumi for at least two hours.",
          "description":"You should do this to remove the excess saltiness. Put the halloumi into cold water. The least amount of time you should let it soak is two hours, but it is also okay to allow it to soak overnight."
        },
        {
          "headline":"Cut the halloumi into long slices.",
          "description":"Use a knife to cut the halloumi into long slices that would be the ideal size and length for skewers. Once the slices have been made, thread them onto the skewers. The amount of cheese that you cut depends on the amount of people that you want to serve, though the amount of ingredients used in this recipe is made to serve four to six people. Use metal skewers or wooden skewers that have soaked in water for ten minutes. You can find skewers at most supermarkets."
        },
        {
          "headline":"Drizzle with oil.",
          "description":"Drizzle the skewered halloumi with two tablespoons of extra virgin olive oil. Make sure that the olive oil is evenly distributed over the cheese."
        },
        {
          "headline":"Sprinkle oregano and black pepper.",
          "description":"Use a pinch of both the oregano and black pepper. Evenly sprinkle the ingredients over the halloumi cheese."
        },
        {
          "headline":"Use an outdoor barbecue.",
          "description":"You will need an outdoor barbecue to grill the halloumi skewers. If you don\u2019t have an outdoor barbecue, you can use a hot griddle pan. The hot griddle pan will work just as well to grill the halloumi."
        },
        {
          "headline":"Put the halloumi onto the pan or barbecue.",
          "description":"Do this after they have been skewered and sprinkled. Grill for two to three minutes on each side."
        },
        {
          "headline":"Serve with the sauce of your choice.",
          "description":"Remove the skewers off of the barbecue and put them onto plates or a tray. Serve them with the sauce of your choice, or no sauce at all if you don\u2019t want it. A few sauces that pair well with this recipe are smoky pepper tomato salsa, creamy Aji green sauce, and chimichurri sauce. If you don\u2019t want to make your own sauce, look for a premade sauce, like the salsa, at your local grocery store."
        }
      ]
    }
  ],
  "text":" Grilling Halloumi and Serving with Blueberry Jam Put lemon juice, thyme, and pepper into a shallow dish. Any type of shallow dish will work. Use a spoon or any other utensil to mix lightly. Do not remove the mixture from the dish until the halloumi has been coated in it. Add the halloumi to the dish. You can keep the halloumi in its original block form, cut it in half, or cut it into strips. Turn it around in the mixture to coat it thoroughly. Next, allow the halloumi to marinate for one hour. Turn the cheese once during the hour. Combine blueberries, vinegar, salt, and honey in a medium saucepan. Simmer these ingredients on a high heat setting for a few minutes. Then, bring the heat down to medium and cook the mixture. Stir it occasionally until it has a thick consistency and then remove it. This should take 12 to 15 minutes for fresh berries. It will take 20 to 30 minutes altogether if you\u2019re using frozen berries. Oil the grill rack. This will prevent the food from sticking to the grill. First, allow the grill to heat up. After that, put oil on a folded paper towel. Use tongs to to rub the towel over the rack. Do not put cooking spray on a very hot grill. Grill the halloumi. Make sure the grill is preheated to medium-high. Put the halloumi in a pan and grill it until is warm. This should take about two minutes for each side. You can use a metal spatula to loosen the halloumi before flipping it to the other side. Serve with the jam. Take the jam you made and serve it with the halloumi. It should be served at room temperature. You can put it on the side, or you can drizzle it on top of the halloumi. It is your choice. Baking Halloumi Fries Cut Halloumi slices. Consider the amount of people you want to feed before purchasing the halloumi. You should purchase at least one pack of cheese to make these fries. Cut the halloumi into long, relatively thin slices. They should resemble fries. Preheat the oven to 400\u00b0F (200\u00b0C). Once you have preheated the oven, prepare the baking tray. Line the tray with parchment paper. Place tray in the oven for five minutes. Mix coconut flour and Creole seasoning. Pour coconut flour onto a plate. Sprinkle the Creole seasoning in and stir it together. You can also use a bag to mix the flour and seasoning. Press the halloumi slices into the mixture. Make sure they are thoroughly and evenly coated. The mixture should stick to the halloumi. You can lightly spray the halloumi with olive oil if you think it will be necessary. Bake the Halloumi fries. After the five minutes, remove the tray from the oven. Quickly before it gets cool, put the slices onto the tray. Then, lightly spray them with oil spray. Put the tray into the oven. Allow them to cook for ten minutes on one side. Then, flip the slices and allow them to cook for another eight minutes. They should be golden and slightly crisped around the edges when they are finished. Serve with marinara sauce. Remove the slices from the tray and place them on plates or a tray. Serve them with marinara sauce. If you want, you can make  your own marinara sauce, but if not, store-bought marinara sauce will do. Making Halloumi Skewers Soak the halloumi for at least two hours. You should do this to remove the excess saltiness. Put the halloumi into cold water. The least amount of time you should let it soak is two hours, but it is also okay to allow it to soak overnight. Cut the halloumi into long slices. Use a knife to cut the halloumi into long slices that would be the ideal size and length for skewers. Once the slices have been made, thread them onto the skewers. The amount of cheese that you cut depends on the amount of people that you want to serve, though the amount of ingredients used in this recipe is made to serve four to six people. Use metal skewers or wooden skewers that have soaked in water for ten minutes. You can find skewers at most supermarkets. Drizzle with oil. Drizzle the skewered halloumi with two tablespoons of extra virgin olive oil. Make sure that the olive oil is evenly distributed over the cheese. Sprinkle oregano and black pepper. Use a pinch of both the oregano and black pepper. Evenly sprinkle the ingredients over the halloumi cheese. Use an outdoor barbecue. You will need an outdoor barbecue to grill the halloumi skewers. If you don\u2019t have an outdoor barbecue, you can use a hot griddle pan. The hot griddle pan will work just as well to grill the halloumi. Put the halloumi onto the pan or barbecue. Do this after they have been skewered and sprinkled. Grill for two to three minutes on each side. Serve with the sauce of your choice. Remove the skewers off of the barbecue and put them onto plates or a tray. Serve them with the sauce of your choice, or no sauce at all if you don\u2019t want it. A few sauces that pair well with this recipe are smoky pepper tomato salsa, creamy Aji green sauce, and chimichurri sauce. If you don\u2019t want to make your own sauce, look for a premade sauce, like the salsa, at your local grocery store.",
  "tyn_model":[
    "halloumi",
    "tray",
    "grill",
    "oven",
    "barbecue",
    "marinara sauce",
    "berries",
    "oil",
    "pan",
    "coconut flour",
    "creole seasoning",
    "olive oil",
    "plates",
    "oregano",
    "black pepper",
    "hot griddle pan",
    "blueberry jam",
    "lemon juice",
    "thyme",
    "pepper",
    "shallow dish",
    "spoon",
    "blueberries",
    "vinegar",
    "salt",
    "honey",
    "medium saucepan",
    "grill rack",
    "cooking spray",
    "spatula",
    "cheese",
    "baking tray",
    "parchment paper",
    "plate",
    "flour",
    "oil spray",
    "water",
    "knife",
    "extra virgin olive oil",
    "halloumi cheese",
    "smoky pepper tomato salsa",
    "chimichurri sauce",
    "salsa"
  ],
  "tyn_section":[

  ]
}