{
  "title":"How to Make Spiced Green Tea",
  "url":"https://www.wikihow.com/Make-Spiced-Green-Tea",
  "category_hierarchy":[
    "Food and Entertaining",
    "Drinks",
    "Tea",
    "Spiced Tea"
  ],
  "methods":[
    {
      "name":"Brewing Spiced Green Tea",
      "steps":[
        {
          "headline":"Boil the water.",
          "description":"Fill a kettle or cooking pot with four cups of water. Place the kettle or pot on a stovetop burner set to high heat. The water should reach a rolling boil in roughly 10 to 15 minutes."
        },
        {
          "headline":"Prepare the ginger, lemon, and cardamom.",
          "description":"While your water boils, zest a lemon to get the grated lemon peel. Then mince the fresh ginger root. Finally, bruise or crush the cardamom pods to release their aroma and strong flavor."
        },
        {
          "headline":"Add the ingredients.",
          "description":"Place the tea bags, cinnamon sticks, minced ginger root, lemon zest, and the cardamom in a large bowl. Then pour in the boiling water. Cover the tea and let it steep for about five to six minutes."
        },
        {
          "headline":"Strain the tea.",
          "description":"Once the time is up, remove the tea bags and strain out the spices. You can use a large grated spoon to remove the tea bags and the cinnamon sticks. For smaller pieces of ginger and lemon zest, you might consider pouring the tea through cheesecloth. Serve the tea immediately after straining."
        }
      ]
    },
    {
      "name":"Preparing Slow Cooker Spiced Green Tea",
      "steps":[
        {
          "headline":"Make a spice bag.",
          "description":"Cut a six to eight-inch (15.24 to 20.32 cm) piece of double-thick cotton cheesecloth. Then place the cinnamon and the ginger in the middle of the cloth. Bring up the corners of the cloth and tie them together with a piece of string."
        },
        {
          "headline":"Cook the ingredients.",
          "description":"Pour the tea and the orange juice into a slow cooker. Then add the spice bag and the dried fruit. Cover and cook the tea on the low-setting for four to six hours or the high-setting for two to three hours."
        },
        {
          "headline":"Serve the tea.",
          "description":"Once the time is up, use a spoon to remove the tea bag and the dried fruit. Serve the tea immediately for a hot drink. You can add orange slices or sugar for some added flavor."
        }
      ]
    },
    {
      "name":"Making a Spiced Green Tea Smoothie",
      "steps":[
        {
          "headline":"Prepare the pear.",
          "description":"Take a whole pear and peel it. Then core it with a spoon to remove the seeds. Finally, use a knife and cutting board to chop it into half-inch (1.27 cm) sized pieces. You can buy seedless pears if you do not want to waste time removing the seeds."
        },
        {
          "headline":"Blend the ingredients.",
          "description":"Place all of the ingredients in a blender. Then blend until smooth. Continue pulsing the blender until the smoothie is the desired consistency. If you have brewed your own green tea, make sure that you have let it cool down before adding it to the smoothie. Hot tea will make your smoothie runny."
        },
        {
          "headline":"Serve chilled.",
          "description":"Serve the smoothie cold. If the smoothie is not as cold as you would like, place it in your freezer for a few minutes. Consider garnishing it with some orange slices."
        }
      ]
    }
  ],
  "text":" Brewing Spiced Green Tea Boil the water. Fill a kettle or cooking pot with four cups of water. Place the kettle or pot on a stovetop burner set to high heat. The water should reach a rolling boil in roughly 10 to 15 minutes. Prepare the ginger, lemon, and cardamom. While your water boils, zest a lemon to get the grated lemon peel. Then mince the fresh ginger root. Finally, bruise or crush the cardamom pods to release their aroma and strong flavor. Add the ingredients. Place the tea bags, cinnamon sticks, minced ginger root, lemon zest, and the cardamom in a large bowl. Then pour in the boiling water. Cover the tea and let it steep for about five to six minutes. Strain the tea. Once the time is up, remove the tea bags and strain out the spices. You can use a large grated spoon to remove the tea bags and the cinnamon sticks. For smaller pieces of ginger and lemon zest, you might consider pouring the tea through cheesecloth. Serve the tea immediately after straining. Preparing Slow Cooker Spiced Green Tea Make a spice bag. Cut a six to eight-inch (15.24 to 20.32 cm) piece of double-thick cotton cheesecloth. Then place the cinnamon and the ginger in the middle of the cloth. Bring up the corners of the cloth and tie them together with a piece of string. Cook the ingredients. Pour the tea and the orange juice into a slow cooker. Then add the spice bag and the dried fruit. Cover and cook the tea on the low-setting for four to six hours or the high-setting for two to three hours. Serve the tea. Once the time is up, use a spoon to remove the tea bag and the dried fruit. Serve the tea immediately for a hot drink. You can add orange slices or sugar for some added flavor. Making a Spiced Green Tea Smoothie Prepare the pear. Take a whole pear and peel it. Then core it with a spoon to remove the seeds. Finally, use a knife and cutting board to chop it into half-inch (1.27 cm) sized pieces. You can buy seedless pears if you do not want to waste time removing the seeds. Blend the ingredients. Place all of the ingredients in a blender. Then blend until smooth. Continue pulsing the blender until the smoothie is the desired consistency. If you have brewed your own green tea, make sure that you have let it cool down before adding it to the smoothie. Hot tea will make your smoothie runny. Serve chilled. Serve the smoothie cold. If the smoothie is not as cold as you would like, place it in your freezer for a few minutes. Consider garnishing it with some orange slices.",
  "tyn_model":[
    "water",
    "lemon",
    "ginger",
    "cardamom",
    "tea bags",
    "tea",
    "spiced green tea",
    "cinnamon sticks",
    "spice bag",
    "spoon",
    "orange slices",
    "pear",
    "blender",
    "kettle or cooking pot",
    "kettle",
    "stovetop burner",
    "fresh ginger",
    "large bowl",
    "large grated spoon",
    "cheesecloth",
    "slow cooker spiced green tea",
    "cinnamon",
    "string",
    "orange juice",
    "slow cooker",
    "tea bag",
    "sugar",
    "knife",
    "pears",
    "green tea"
  ],
  "tyn_section":[

  ]
}