{
  "title":"How to Use Aquafaba",
  "url":"https://www.wikihow.com/Use-Aquafaba",
  "category_hierarchy":[
    "Food and Entertaining",
    "Recipes",
    "Vegetarian",
    "Vegan"
  ],
  "methods":[
    {
      "name":"Replacing Eggs in Recipes",
      "steps":[
        {
          "headline":"Save the liquid from canned chickpeas.",
          "description":"Even if you\u2019re an omnivore, drain the aquafaba into an airtight container whenever you open a can of chickpeas. Sure, you may not have the incentive that vegans and people with lactose issues might have to use it for dairy-free cheddar or mayo, but you can easily use it as an egg substitute for an recipe that calls for them. Waste not, want not. Keep the aquafaba refrigerated and use within one week."
        },
        {
          "headline":"Reduce the aquafaba when needed.",
          "description":"In general, the consistency of aquafaba is very similar to eggs. However, be aware that its consistency can vary slightly from can to can. Favor thicker aquafaba over thinner liquid when substituting it for eggs. If the liquid from your can appears watery, simply heat it in a small pot on the stovetop until it reduces by roughly a quarter before cooking."
        },
        {
          "headline":"Use tablespoons to convert recipes.",
          "description":"First, review the original recipe. See if it calls for one whole egg, the white of one egg, or the yolk of one egg. Then use the following conversions:\n1 whole egg = 3 tablespoons aquafaba\n1 egg white = 2 tablespoons aquafaba\n1 yolk = 1 tablespoon aquafaba"
        }
      ]
    },
    {
      "name":"Foaming a Whiskey Sour",
      "steps":[
        {
          "headline":"Shake your ingredients without ice.",
          "description":"Add the simple syrup, lemon juice, bourbon, and aquafaba to a cocktail shaker. Leave the ice out for right now, since this inhibits foaming. Cap and shake it vigorously for about 10 to 12 seconds. Be sure to keep the shaker vertical to prevent leaks, since ice is what usually keeps a slanted shaker from leaking, thanks to the vacuum that the cold creates. Simple syrup is simply equal parts sugar and water."
        },
        {
          "headline":"Shake again with ice.",
          "description":"Uncap your shaker. Add a cube or two of ice. Cover the shaker again and shake for another 10 to 15 seconds."
        },
        {
          "headline":"Add air with long pours.",
          "description":"Uncap your shaker and slowly pour the liquid from as high as you can into the shaker\u2019s top half or a tall glass (depending on what type of shaker you have). Allow the liquid to travel through as much air as possible so more air combines with it, which will make your foam that much foamier. Remove the ice from the shaker after the first pour, then repeat back and forth two or three more times."
        },
        {
          "headline":"Strain, top, and serve.",
          "description":"Depending on what type of shaker you have, either attach its strainer if it has an attachable one or, if it doesn\u2019t, hold a strainer over your serving glass. Slowly pour the liquid through the strainer into the glass. Add a dash or two of Angostura bitters to taste, then serve."
        }
      ]
    },
    {
      "name":"Making Dairy-Free Cheddar",
      "steps":[
        {
          "headline":"Soak or boil your cashews.",
          "description":"If you know you\u2019ll be making your cheese tomorrow, simply place your raw cashews in a bowl, cover them with warm water, and let them soak overnight. If you\u2019re making it today, just place them in a small pot, cover them with water, and then turn the burner on and let them boil for 15 minutes. Either way, dump the cashews and water into a strainer in the sink to drain them once you\u2019re ready. Soaking or boiling the cashews softens them, which results in a creamier texture when blended."
        },
        {
          "headline":"Blend and strain your nuts.",
          "description":"Transfer your drained cashews into a blender. Add the aquafaba. Blend at high speed. You want it as smooth as can be, so give it an extra minute or two just to be sure. Then pour the mixture through a sieve over a mixing bowl. Remove any chunks of cashew that may still be in the blender. Then transfer the mixture from the bowl back into the blender. Low-end blenders and food processors are more likely to leave chunks."
        },
        {
          "headline":"Blend in all but the vinegar.",
          "description":"To start, add all ingredients to the mix except for the apple cider vinegar and, for the moment, the coconut oil. This means your tapioca starch, kappa carrageenan, lactic acid, nutritional yeast, tomato paste, onion powder, paprika, turmeric, and salt. Pulse until they combine evenly. Next, pour in the coconut oil and pulse again until the mixture thickens a bit. The turmeric is mostly for coloring, so if you don\u2019t have any on hand, don\u2019t sweat it."
        },
        {
          "headline":"Heat on stovetop to 170 degrees Fahrenheit.",
          "description":"Transfer your mixture to a medium saucepan on the stovetop. Turn the burner to medium-low. The starch will cause the mixture to turn lumpy, so stir constantly to keep it smooth. Measure the temperature with a food thermometer. Once it reaches 170 degrees F (77 degrees Celsius), stir in the apple cider vinegar and remove the mixture from heat. The oil may separate from other ingredients during the heating process. If this happens at any point, remove from heat and stir it up to recombine it. If that doesn\u2019t work, use an immersion blender."
        },
        {
          "headline":"Mold, chill, and serve.",
          "description":"Transfer the mixture into a cheese mold. Place the mold in the refrigerator. Let it sit for a few hours, testing occasionally for firmness. Once it feels as firm as real cheddar cheese, slice, grate, or shred it as desired."
        }
      ]
    },
    {
      "name":"Whipping Up Some Vegan Mayo",
      "steps":[
        {
          "headline":"Blend together all but the oil.",
          "description":"Add your apple cider vinegar, ground mustard, salt, and aquafaba to a small bowl. Blend them together with an immersion blender until they\u2019re evenly mixed. This should only take a second or two."
        },
        {
          "headline":"Add the oil.",
          "description":"Once the other ingredients are mixed, keep the immersion blender running. Very slowly pour in \u00bc cup (59 ml) of your oil while mixing it in with blender as you pour. The oil will cause the mixture to thicken, which means you\u2019ll have to move the blender around more and more to cover it all, so pause between each \u00bc cup to blend and judge the mixture\u2019s consistency before repeating. You only need enough oil to thicken the mixture so it isn\u2019t runny. If it doesn\u2019t drip or pour off the blender when you remove it after the third 1/4 cup, stop there. If it still appears running, add another 1/4 cup."
        },
        {
          "headline":"Refrigerate.",
          "description":"Pour the mixture into a jar with an airtight seal. Place the jar in the refrigerator. Give it a few hours to thicken, until it reaches the consistency of real mayo. Once it does, use it as a spread for sandwiches, a dip for french fries, or as needed in any recipe that calls for mayo. Once a can of chickpeas is opened, the aquafaba will last for one week when refrigerated, so adjust the recipe's proportions if needed to make an amount you're likely to use up in that time."
        }
      ]
    }
  ],
  "text":" Replacing Eggs in Recipes Save the liquid from canned chickpeas. Even if you\u2019re an omnivore, drain the aquafaba into an airtight container whenever you open a can of chickpeas. Sure, you may not have the incentive that vegans and people with lactose issues might have to use it for dairy-free cheddar or mayo, but you can easily use it as an egg substitute for an recipe that calls for them. Waste not, want not. Keep the aquafaba refrigerated and use within one week. Reduce the aquafaba when needed. In general, the consistency of aquafaba is very similar to eggs. However, be aware that its consistency can vary slightly from can to can. Favor thicker aquafaba over thinner liquid when substituting it for eggs. If the liquid from your can appears watery, simply heat it in a small pot on the stovetop until it reduces by roughly a quarter before cooking. Use tablespoons to convert recipes. First, review the original recipe. See if it calls for one whole egg, the white of one egg, or the yolk of one egg. Then use the following conversions:\n1 whole egg = 3 tablespoons aquafaba\n1 egg white = 2 tablespoons aquafaba\n1 yolk = 1 tablespoon aquafaba Foaming a Whiskey Sour Shake your ingredients without ice. Add the simple syrup, lemon juice, bourbon, and aquafaba to a cocktail shaker. Leave the ice out for right now, since this inhibits foaming. Cap and shake it vigorously for about 10 to 12 seconds. Be sure to keep the shaker vertical to prevent leaks, since ice is what usually keeps a slanted shaker from leaking, thanks to the vacuum that the cold creates. Simple syrup is simply equal parts sugar and water. Shake again with ice. Uncap your shaker. Add a cube or two of ice. Cover the shaker again and shake for another 10 to 15 seconds. Add air with long pours. Uncap your shaker and slowly pour the liquid from as high as you can into the shaker\u2019s top half or a tall glass (depending on what type of shaker you have). Allow the liquid to travel through as much air as possible so more air combines with it, which will make your foam that much foamier. Remove the ice from the shaker after the first pour, then repeat back and forth two or three more times. Strain, top, and serve. Depending on what type of shaker you have, either attach its strainer if it has an attachable one or, if it doesn\u2019t, hold a strainer over your serving glass. Slowly pour the liquid through the strainer into the glass. Add a dash or two of Angostura bitters to taste, then serve. Making Dairy-Free Cheddar Soak or boil your cashews. If you know you\u2019ll be making your cheese tomorrow, simply place your raw cashews in a bowl, cover them with warm water, and let them soak overnight. If you\u2019re making it today, just place them in a small pot, cover them with water, and then turn the burner on and let them boil for 15 minutes. Either way, dump the cashews and water into a strainer in the sink to drain them once you\u2019re ready. Soaking or boiling the cashews softens them, which results in a creamier texture when blended. Blend and strain your nuts. Transfer your drained cashews into a blender. Add the aquafaba. Blend at high speed. You want it as smooth as can be, so give it an extra minute or two just to be sure. Then pour the mixture through a sieve over a mixing bowl. Remove any chunks of cashew that may still be in the blender. Then transfer the mixture from the bowl back into the blender. Low-end blenders and food processors are more likely to leave chunks. Blend in all but the vinegar. To start, add all ingredients to the mix except for the apple cider vinegar and, for the moment, the coconut oil. This means your tapioca starch, kappa carrageenan, lactic acid, nutritional yeast, tomato paste, onion powder, paprika, turmeric, and salt. Pulse until they combine evenly. Next, pour in the coconut oil and pulse again until the mixture thickens a bit. The turmeric is mostly for coloring, so if you don\u2019t have any on hand, don\u2019t sweat it. Heat on stovetop to 170 degrees Fahrenheit. Transfer your mixture to a medium saucepan on the stovetop. Turn the burner to medium-low. The starch will cause the mixture to turn lumpy, so stir constantly to keep it smooth. Measure the temperature with a food thermometer. Once it reaches 170 degrees F (77 degrees Celsius), stir in the apple cider vinegar and remove the mixture from heat. The oil may separate from other ingredients during the heating process. If this happens at any point, remove from heat and stir it up to recombine it. If that doesn\u2019t work, use an immersion blender. Mold, chill, and serve. Transfer the mixture into a cheese mold. Place the mold in the refrigerator. Let it sit for a few hours, testing occasionally for firmness. Once it feels as firm as real cheddar cheese, slice, grate, or shred it as desired. Whipping Up Some Vegan Mayo Blend together all but the oil. Add your apple cider vinegar, ground mustard, salt, and aquafaba to a small bowl. Blend them together with an immersion blender until they\u2019re evenly mixed. This should only take a second or two. Add the oil. Once the other ingredients are mixed, keep the immersion blender running. Very slowly pour in \u00bc cup (59 ml) of your oil while mixing it in with blender as you pour. The oil will cause the mixture to thicken, which means you\u2019ll have to move the blender around more and more to cover it all, so pause between each \u00bc cup to blend and judge the mixture\u2019s consistency before repeating. You only need enough oil to thicken the mixture so it isn\u2019t runny. If it doesn\u2019t drip or pour off the blender when you remove it after the third 1/4 cup, stop there. If it still appears running, add another 1/4 cup. Refrigerate. Pour the mixture into a jar with an airtight seal. Place the jar in the refrigerator. Give it a few hours to thicken, until it reaches the consistency of real mayo. Once it does, use it as a spread for sandwiches, a dip for french fries, or as needed in any recipe that calls for mayo. Once a can of chickpeas is opened, the aquafaba will last for one week when refrigerated, so adjust the recipe's proportions if needed to make an amount you're likely to use up in that time.",
  "tyn_model":[
    "shaker",
    "aquafaba",
    "ice",
    "blender",
    "oil",
    "water",
    "strainer",
    "eggs",
    "chickpeas",
    "apple cider vinegar",
    "immersion blender",
    "bowl",
    "cashews",
    "coconut oil",
    "turmeric",
    "salt",
    "refrigerator",
    "mayo",
    "airtight container",
    "egg",
    "tablespoons",
    "simple syrup",
    "lemon juice",
    "bourbon",
    "cocktail shaker",
    "sugar",
    "air",
    "tall glass",
    "serving glass",
    "angostura bitters",
    "nuts",
    "sieve",
    "mixing bowl",
    "food processors",
    "vinegar",
    "tapioca starch",
    "lactic acid",
    "nutritional yeast",
    "tomato paste",
    "onion powder",
    "paprika",
    "medium saucepan",
    "burner",
    "food thermometer",
    "cheese mold",
    "cheddar cheese",
    "vegan mayo",
    "mustard",
    "small bowl",
    "jar"
  ],
  "tyn_section":[

  ]
}