{
  "title":"How to Draw a Dog Using a Figurine As a Model",
  "url":"https://www.wikihow.com/Draw-a-Dog-Using-a-Figurine-As-a-Model",
  "category_hierarchy":[
    "Hobbies and Crafts",
    "Drawing"
  ],
  "methods":[
    {
      "name":"Studying Your Figurine",
      "steps":[
        {
          "headline":"Find a figurine of a dog.",
          "description":"They can be found many places, including thrift and dollar stores. Look around the house. The breeds and poses available in small statuary are unlimited. Select a two inch or taller dog statue for comfortable viewing from a slight distance."
        },
        {
          "headline":"Check out the dog\u2019s pose.",
          "description":"It might suggest what kind of painting you want to do. If the dog is pointing, you might place him, in your art, in a grassy field. It he is sitting patiently what setting might you choose?"
        },
        {
          "headline":"Perhaps you like close-ups.",
          "description":"Will you zoom in on just the dog and have your painting be his portrait? Will the dog be seen indoors as part of a larger setting or be outside, enjoying nature. Select one whose pose inspires you. Place your dog/model in your line of vision, at your work station."
        },
        {
          "headline":"Decide which point of view you want.",
          "description":"Are you seeing the dog at eye level, as if you were stooping down to his level. Might he be seen as if you were standing, looking down at him? At your work station, elevate the statue on a small box, if necessary, to hold the view you require."
        },
        {
          "headline":"Locate reference photos.",
          "description":"Even if you are doing a portrait of a dog, you will be probably want to put the dog in a setting, however simple. Take new photos or gather other photos. Whatever inspires you. Places where you might see a dog are limitless, so, be open to ideas and find a setting you\u2019d like to spend time painting."
        }
      ]
    },
    {
      "name":"Drawing the Dog",
      "steps":[
        {
          "headline":"Use a piece of #140, cold pressed, watercolor paper from a pad.",
          "description":"Any size is fine, but if your are thinking of putting the dog in an outdoor setting, allow a large, 11\u201d x 14\u201d piece of paper. The same goes for an indoor setting. How large do you want to make the dog, if it is going to be a portrait and how much of the environment do you want to include in your painting? It is up to you, but it\u2018s best to allow a lot of space on your paper because having the room to expand is better than wishing you\u2018d allowed more paper at the start."
        },
        {
          "headline":"Get your art supplies ready;  watercolors, brushes, a pencil, eraser, and a water bucket.",
          "description":"Put everything on a solid work table and prepare your colors, either by activating each dry pad of color with a brushfull of water or squeezing pigments onto a palette. Drop a small amount of water on freshly squeezed paint, too."
        },
        {
          "headline":"Draw the dog first.",
          "description":"Tackling the most difficult thing immediately is a good strategy, if only to know that a major hurdle has been crossed. Since the dog is your subject and most likely the focus of the painting, take your time and get it right. Keep in mind you will be coloring the scene shortly and drawn guide lines are helpful."
        },
        {
          "headline":"Use the figurine as a guide.",
          "description":"Working from a statue gives you the information you need in three dimensions. Study the shapes, planes and detailed areas of the dog as carefully as you study the outline which defines his breed."
        },
        {
          "headline":"Pay special attention to the texture of the fur.",
          "description":"Look with an eye to planning how you will depict the fur, describing it to yourself;  rough, smooth, shaggy, feathered, etc. Do the same with color and distribution of spots and the like."
        },
        {
          "headline":"Sketch the scene surrounding the dog.",
          "description":"Even if it is just cushions or drapes in the case of a portrait, indicate what will go where."
        }
      ]
    },
    {
      "name":"Painting",
      "steps":[
        {
          "headline":"Decide where you want to start painting.",
          "description":"One idea is to do the difficult or most important part first. There is no hard and fast rule about where to begin. Just jump in. Let the completed area dry before painting too close to it to keep the colors from running together. If you must place a wet area next to another damp area, reserve a tiny dam or line of white paper to keep the shapes from merging. Use a hairdryer if necessary."
        },
        {
          "headline":"Think about contrast.",
          "description":"If one area is detailed, you might want to show it off against a more loosely painted area. If the colors are intense in one area, you might want to soften them in another. Look for contrasts;  cold/warm soft/hard, textured/plain, etc. Listen to and trust your instincts."
        },
        {
          "headline":"Paint until you feel the piece is as done as you can make it.",
          "description":"Stop and distance yourself from it. Allow time for it to dry. Stand it up and step back. Before long, the painting will \u201ctalk\u201d to you and things that need changing, adding to or taking away will become obvious."
        },
        {
          "headline":"Make edits and corrections after the piece is thoroughly dry.",
          "description":"Use a scrubbing brush with short bristles in tiny areas and a piece of white eraser pad for the kitchen to remove or lighten larger spans of color. Once again, allow the piece to dry before attempting to paint over an area."
        },
        {
          "headline":"Try out a different breed of dog in your next painting.",
          "description":"Or simply turn the statue and do the dog from a new angle. Using a realistic statue or figurine of a dog provides loads of useful information. You can see right before you the structure of the dog and how parts are related to one another."
        }
      ]
    }
  ],
  "text":" Studying Your Figurine Find a figurine of a dog. They can be found many places, including thrift and dollar stores. Look around the house. The breeds and poses available in small statuary are unlimited. Select a two inch or taller dog statue for comfortable viewing from a slight distance. Check out the dog\u2019s pose. It might suggest what kind of painting you want to do. If the dog is pointing, you might place him, in your art, in a grassy field. It he is sitting patiently what setting might you choose? Perhaps you like close-ups. Will you zoom in on just the dog and have your painting be his portrait? Will the dog be seen indoors as part of a larger setting or be outside, enjoying nature. Select one whose pose inspires you. Place your dog/model in your line of vision, at your work station. Decide which point of view you want. Are you seeing the dog at eye level, as if you were stooping down to his level. Might he be seen as if you were standing, looking down at him? At your work station, elevate the statue on a small box, if necessary, to hold the view you require. Locate reference photos. Even if you are doing a portrait of a dog, you will be probably want to put the dog in a setting, however simple. Take new photos or gather other photos. Whatever inspires you. Places where you might see a dog are limitless, so, be open to ideas and find a setting you\u2019d like to spend time painting. Drawing the Dog Use a piece of #140, cold pressed, watercolor paper from a pad. Any size is fine, but if your are thinking of putting the dog in an outdoor setting, allow a large, 11\u201d x 14\u201d piece of paper. The same goes for an indoor setting. How large do you want to make the dog, if it is going to be a portrait and how much of the environment do you want to include in your painting? It is up to you, but it\u2018s best to allow a lot of space on your paper because having the room to expand is better than wishing you\u2018d allowed more paper at the start. Get your art supplies ready;  watercolors, brushes, a pencil, eraser, and a water bucket. Put everything on a solid work table and prepare your colors, either by activating each dry pad of color with a brushfull of water or squeezing pigments onto a palette. Drop a small amount of water on freshly squeezed paint, too. Draw the dog first. Tackling the most difficult thing immediately is a good strategy, if only to know that a major hurdle has been crossed. Since the dog is your subject and most likely the focus of the painting, take your time and get it right. Keep in mind you will be coloring the scene shortly and drawn guide lines are helpful. Use the figurine as a guide. Working from a statue gives you the information you need in three dimensions. Study the shapes, planes and detailed areas of the dog as carefully as you study the outline which defines his breed. Pay special attention to the texture of the fur. Look with an eye to planning how you will depict the fur, describing it to yourself;  rough, smooth, shaggy, feathered, etc. Do the same with color and distribution of spots and the like. Sketch the scene surrounding the dog. Even if it is just cushions or drapes in the case of a portrait, indicate what will go where. Painting Decide where you want to start painting. One idea is to do the difficult or most important part first. There is no hard and fast rule about where to begin. Just jump in. Let the completed area dry before painting too close to it to keep the colors from running together. If you must place a wet area next to another damp area, reserve a tiny dam or line of white paper to keep the shapes from merging. Use a hairdryer if necessary. Think about contrast. If one area is detailed, you might want to show it off against a more loosely painted area. If the colors are intense in one area, you might want to soften them in another. Look for contrasts;  cold/warm soft/hard, textured/plain, etc. Listen to and trust your instincts. Paint until you feel the piece is as done as you can make it. Stop and distance yourself from it. Allow time for it to dry. Stand it up and step back. Before long, the painting will \u201ctalk\u201d to you and things that need changing, adding to or taking away will become obvious. Make edits and corrections after the piece is thoroughly dry. Use a scrubbing brush with short bristles in tiny areas and a piece of white eraser pad for the kitchen to remove or lighten larger spans of color. Once again, allow the piece to dry before attempting to paint over an area. Try out a different breed of dog in your next painting. Or simply turn the statue and do the dog from a new angle. Using a realistic statue or figurine of a dog provides loads of useful information. You can see right before you the structure of the dog and how parts are related to one another.",
  "tyn_model":[
    "dog",
    "paper",
    "water",
    "paint",
    "figurine",
    "watercolor paper",
    "\u201d x",
    "\u201d piece",
    "art supplies",
    "watercolors",
    "brushes",
    "pencil",
    "eraser",
    "water bucket",
    "palette",
    "fur",
    "white paper",
    "hairdryer",
    "\u201ctalk",
    "\u201d to",
    "scrubbing brush",
    "white eraser pad"
  ],
  "tyn_section":[

  ]
}