{
  "title":"How to Choose the Healthiest Sushi Dishes",
  "url":"https://www.wikihow.com/Choose-the-Healthiest-Sushi-Dishes",
  "category_hierarchy":[
    "Food and Entertaining",
    "Recipes",
    "World Cuisines",
    "Asian Cuisine",
    "Japanese Dishes",
    "Sushi"
  ],
  "methods":[
    {
      "name":"Choosing Your Proteins",
      "steps":[
        {
          "headline":"Go for salmon and tuna.",
          "description":"When choosing healthy proteins, salmon and tuna are your best options. They are rich in omega 3 fatty acids, which are great for heart health, as well as high in protein and vitamin D. When choosing rolls, look for rolls that contain salmon and tuna. However, just because a roll has salmon or tuna does not necessarily mean it's healthy. Watch out for high calorie ingredients, like cream cheese, for optimal health."
        },
        {
          "headline":"Limit your intake of eel.",
          "description":"Eel is a healthy source of omega 3 acids as well, but is often prepared in brown, sugary sauces. It's best to limit yourself to one eel roll when eating at a sushi restaurant. This will help you avoid extra sugar and calories."
        },
        {
          "headline":"Opt for fish without added ingredients.",
          "description":"The fewer additives, the better. The fish found in sushi is very healthy, but additives can add unnecessary calories. Look for rolls that mostly fish, rice, and seaweed. Stay away from rolls with additives like cream cheese, tempura, and mayonnaise. Stick to mixtures that mostly use fish and vegetables."
        },
        {
          "headline":"Look for meats that are steamed, grilled, or raw.",
          "description":"How meat is prepared can affect its health. When choosing meats, look for steamed, grilled, and raw options. These meats have not been tampered with as much, which means they will have less added calories from things like sauces, sugars, and oils."
        }
      ]
    },
    {
      "name":"Selecting Other Ingredients",
      "steps":[
        {
          "headline":"Choose veggie rolls.",
          "description":"Try ordering one veggie roll in addition to a fish roll. Veggie rolls are lower in calories and help you get needed vitamins and minerals from vegetables. Go for veggie rolls without a lot of extra seasonings, sauces, or other ingredients. Opt for healthy veggies like cucumbers, carrots, and sea vegetables."
        },
        {
          "headline":"Order avocado in moderation.",
          "description":"Avocados are very healthy. Adding an avocado roll at a sushi restaurant can be a healthy choice. However, they are high in calories. Stick to only one roll containing avocado when eating at a sushi restaurant."
        },
        {
          "headline":"Ask for brown rice or rice-free wraps.",
          "description":"Rice can be a healthy carb, but brown rice is generally better than white rice. See if you can substitute white rice for brown rice in a wrap. If this is not permitted, see if there are any rice-free wraps available. See if the restaurant offers cucumber wraps or wraps made with seaweed."
        },
        {
          "headline":"Add wasabi.",
          "description":"Wasabi is often served on the side with sushi. You can dip your sushi in wasabi to add flavor and a little spiciness. If you enjoy the taste of wasabi, add it freely to your sushi as it is packed with antioxidants. You only need to dab a small amount of wasabi on your sushi for added flavor and health benefits."
        },
        {
          "headline":"Garnish your food with ginger.",
          "description":"Pickled ginger can be placed on your sushi before you eat it. Ginger is a good source of potassium and magnesium and may help boost the immune system. Try garnishing your sushi with ginger or eating the ginger raw."
        }
      ]
    },
    {
      "name":"Avoiding Unhealthy Options",
      "steps":[
        {
          "headline":"Request low sodium soy sauce.",
          "description":"Soy sauce is high in salt. Low sodium soy sauce has about 25% less sodium than regular soy sauce, so request that whenever possible. Soy sauce is never low in sodium, however. Even low sodium soy sauce is very salty, so avoid adding high amounts of soy sauce to your sushi."
        },
        {
          "headline":"Skip tempura rolls and crunchy sushi.",
          "description":"Tempura rolls are often served as an appetizer. These are vegetables coated in breading and deep fried. Some sushi rolls may also be crunchy and contain tempura. In general, skip tempura when eating at a sushi restaurant if you want to eat healthy."
        },
        {
          "headline":"Avoid fancier rolls.",
          "description":"Specialty rolls include things like rainbow rolls, dynamite rolls, Philadelphia rolls, and spider rolls. These rolls are packed with extra ingredients, such as cream cheese, and tend to be larger. This makes them much higher in calories than regular rolls. If you really want to try a specialty roll, offer to split one friends. They can be good for a group setting, as everyone can try a small amount without going overboard."
        },
        {
          "headline":"Stick to two rolls.",
          "description":"In general, two rolls should provide enough calories for a healthy dinner. Limit yourself to only two rolls when eating at a sushi restaurant."
        }
      ]
    }
  ],
  "text":" Choosing Your Proteins Go for salmon and tuna. When choosing healthy proteins, salmon and tuna are your best options. They are rich in omega 3 fatty acids, which are great for heart health, as well as high in protein and vitamin D. When choosing rolls, look for rolls that contain salmon and tuna. However, just because a roll has salmon or tuna does not necessarily mean it's healthy. Watch out for high calorie ingredients, like cream cheese, for optimal health. Limit your intake of eel. Eel is a healthy source of omega 3 acids as well, but is often prepared in brown, sugary sauces. It's best to limit yourself to one eel roll when eating at a sushi restaurant. This will help you avoid extra sugar and calories. Opt for fish without added ingredients. The fewer additives, the better. The fish found in sushi is very healthy, but additives can add unnecessary calories. Look for rolls that mostly fish, rice, and seaweed. Stay away from rolls with additives like cream cheese, tempura, and mayonnaise. Stick to mixtures that mostly use fish and vegetables. Look for meats that are steamed, grilled, or raw. How meat is prepared can affect its health. When choosing meats, look for steamed, grilled, and raw options. These meats have not been tampered with as much, which means they will have less added calories from things like sauces, sugars, and oils. Selecting Other Ingredients Choose veggie rolls. Try ordering one veggie roll in addition to a fish roll. Veggie rolls are lower in calories and help you get needed vitamins and minerals from vegetables. Go for veggie rolls without a lot of extra seasonings, sauces, or other ingredients. Opt for healthy veggies like cucumbers, carrots, and sea vegetables. Order avocado in moderation. Avocados are very healthy. Adding an avocado roll at a sushi restaurant can be a healthy choice. However, they are high in calories. Stick to only one roll containing avocado when eating at a sushi restaurant. Ask for brown rice or rice-free wraps. Rice can be a healthy carb, but brown rice is generally better than white rice. See if you can substitute white rice for brown rice in a wrap. If this is not permitted, see if there are any rice-free wraps available. See if the restaurant offers cucumber wraps or wraps made with seaweed. Add wasabi. Wasabi is often served on the side with sushi. You can dip your sushi in wasabi to add flavor and a little spiciness. If you enjoy the taste of wasabi, add it freely to your sushi as it is packed with antioxidants. You only need to dab a small amount of wasabi on your sushi for added flavor and health benefits. Garnish your food with ginger. Pickled ginger can be placed on your sushi before you eat it. Ginger is a good source of potassium and magnesium and may help boost the immune system. Try garnishing your sushi with ginger or eating the ginger raw. Avoiding Unhealthy Options Request low sodium soy sauce. Soy sauce is high in salt. Low sodium soy sauce has about 25% less sodium than regular soy sauce, so request that whenever possible. Soy sauce is never low in sodium, however. Even low sodium soy sauce is very salty, so avoid adding high amounts of soy sauce to your sushi. Skip tempura rolls and crunchy sushi. Tempura rolls are often served as an appetizer. These are vegetables coated in breading and deep fried. Some sushi rolls may also be crunchy and contain tempura. In general, skip tempura when eating at a sushi restaurant if you want to eat healthy. Avoid fancier rolls. Specialty rolls include things like rainbow rolls, dynamite rolls, Philadelphia rolls, and spider rolls. These rolls are packed with extra ingredients, such as cream cheese, and tend to be larger. This makes them much higher in calories than regular rolls. If you really want to try a specialty roll, offer to split one friends. They can be good for a group setting, as everyone can try a small amount without going overboard. Stick to two rolls. In general, two rolls should provide enough calories for a healthy dinner. Limit yourself to only two rolls when eating at a sushi restaurant.",
  "tyn_model":[
    "sushi",
    "soy sauce",
    "wasabi",
    "salmon",
    "tuna",
    "ginger",
    "cream cheese",
    "eel",
    "fish",
    "tempura",
    "avocado",
    "brown rice",
    "rice",
    "vegetables",
    "omega 3 fatty acids",
    "mayonnaise",
    "meats",
    "sauces",
    "cucumbers",
    "carrots",
    "avocados",
    "white rice",
    "tempura rolls",
    "sushi rolls",
    "dynamite rolls",
    "sushi restaurant"
  ],
  "tyn_section":[

  ]
}