{
  "title":"How to Choose and Prepare the Healthiest Fish",
  "url":"https://www.wikihow.com/Choose-and-Prepare-the-Healthiest-Fish",
  "category_hierarchy":[
    "Food and Entertaining",
    "Recipes",
    "Fish and Seafood"
  ],
  "methods":[
    {
      "name":"Choosing Healthy, Safe, and Sustainable Fish",
      "steps":[
        {
          "headline":"Choose fish that are high in omega-3 fatty acids.",
          "description":"Fish that contain high levels of omega-3 fatty acids are some of the healthiest seafood choices. Salmon, halibut, and sardines are all rich in omegas and delicious additions to your regular diet. Try grilling salmon or halibut and serving it with a side of vegetables."
        },
        {
          "headline":"Eat sardines and clams to boost your B-12 levels.",
          "description":"Certain types of fish are high in vitamin B-12, which is a critical nutrient for all humans. To get the most out of your fish choices, opt for varieties that are high in vitamin B-12 like clams, sardines, anchovies, and salmon. Try broiling fresh clams topped with a little bit of butter for a wonderful dinner option. Eat some sardines as an easy, healthy snack at home or on the go."
        },
        {
          "headline":"Avoid fish with high mercury levels.",
          "description":"Mercury is harmful to your central nervous system. Certain types of fish contain high mercury levels and should be avoided. The U.S. Environmental Protection Agency recommends completely avoiding king mackerel, marlin, orange roughy, shark, swordfish, tilefish, and bigeye tuna. It is especially important for women of childbearing age, pregnant and breastfeeding women, and young children to avoid fish that are high in mercury content."
        },
        {
          "headline":"Eat 2-3 servings of wild-caught or sustainably farmed fish weekly.",
          "description":"These choices should also be low in mercury. Some of the healthiest choices include Atlantic mackerel, wild-caught salmon, catfish, and sardines. Good shellfish choices include shrimp, oysters, American and spiny lobsters, and clams. A serving of fish or shellfish is 4 ounces for adults. For children between 4 and 7 years old, a serving is 2 ounces."
        },
        {
          "headline":"Consider sustainability.",
          "description":"When you are deciding what types of fish and seafood to consume, you should think about sustainability and how your food choices affect the environment. Increasing demand for fish as well as unregulated fishing practices can harm fisheries and species that are at risk. Check out the Monterey Bay Aquarium Seafood Watch at www.seafoodwatch.org to choose seafood that has a minimal impact on the environment. Some sustainable seafood choices include farmed catfish, farmed mussels, wild-caught cod, and wild-caught clams. Unsustainable seafood choices include Chilean seabass, orange roughy, shark, and Bluefin tuna."
        },
        {
          "headline":"Check for advisories if you catch your own fish.",
          "description":"If you eat fish caught by family and friends, or if you catch the fish yourself, you should check local advisories. Contact your county or state fish and wildlife service and ask about fish advisories. If there is not an advisory, you should eat only one serving of the fish. You should eat no other fish in the same week that you eat the serving of local fish."
        }
      ]
    },
    {
      "name":"Buying Healthy Fish and Shellfish",
      "steps":[
        {
          "headline":"Buy fresh fish displayed on ice that is not melting.",
          "description":"When you purchase fresh seafood, it is important that it has been kept at a proper temperature. This reduces the risk of foodborne illness, which is often referred to as food poisoning. Fresh seafood should be refrigerated in a case and displayed on thick ice that is not melting."
        },
        {
          "headline":"Choose fresh whole fish with clear eyes, firm flesh, and bright red gills.",
          "description":"Fresh whole fish should have clear eyes that slightly bulge. The flesh should be firm and shiny, and should spring back when you press it lightly with your finger. Look for fish with bright red gills. The gills should not have milky slime in them."
        },
        {
          "headline":"Select fresh fish fillets that are not discolored and do not smell fishy.",
          "description":"If you are purchasing fresh fish fillets, the flesh should be firm and it should not be discolored. You should avoid fish fillets that appear dried out or dark around the edges. Like whole fish, the flesh of fish fillets should spring back when pressed. The fish also should not smelly overly fishy."
        },
        {
          "headline":"Buy fresh shrimp that is translucent.",
          "description":"Fresh shrimp should have flesh that is translucent, or slightly clear. The flesh of fresh shrimp should also be shiny. You should avoid shrimp that have a strong odor. Instead, opt for fresh shrimp that have little or no odor."
        },
        {
          "headline":"Do a tap test on live shellfish.",
          "description":"If you are buying live clams, oysters, or mussels, you should tap their shells first. They should close up when you tap them. If they do not close up after the tap test, you should avoid buying them."
        },
        {
          "headline":"Avoid cracked shellfish.",
          "description":"When purchasing fresh or live shellfish, you should not select ones that have a cracked or broken shell. If you purchase a package of fresh shellfish that contains individuals with cracked or broken shells, you should throw those clams, oysters, or mussels away immediately."
        },
        {
          "headline":"Make sure live crabs and lobsters move their legs.",
          "description":"If a crab or lobster is alive, it should show at least some leg movement. Crabs and lobsters spoil very quickly after they die. This means you should only purchase and prepare live crabs and lobsters."
        },
        {
          "headline":"Pay attention to package indicators on refrigerated fish and seafood.",
          "description":"Sometimes refrigerated seafood is packaged. These packages might have time and temperature indicators on them to display whether the seafood has been stored properly. If the package has indicators on it, make sure you check them and only buy the seafood if it has been stored properly."
        },
        {
          "headline":"Exercise caution with frozen fish and seafood.",
          "description":"Frozen fish and seafood can spoil easily if it thaws or is left at warm temperatures for too long while being transported. Avoid packages that are open or crushed on the edges, or torn. You should also avoid packages in the top of a freezer case or that have signs of frost or ice crystals."
        },
        {
          "headline":"Read the ingredient labels.",
          "description":"There are many fish products that have unhealthy additives. For example, fish sticks can contain transfats and preservatives. Make sure you read all ingredient labels carefully, and opt for fish that have minimal additional ingredients."
        }
      ]
    },
    {
      "name":"Properly Preparing Healthy Seafood",
      "steps":[
        {
          "headline":"Thaw frozen fish and seafood safely.",
          "description":"The safest way to thaw frozen fish and seafood is in the refrigerator. Place it your refrigerator and allow it to thaw overnight. If you are in a hurry, you can place frozen fish and seafood in cold water as long as it is sealed in a plastic bag."
        },
        {
          "headline":"Remove skin and visible fat.",
          "description":"You can help reduce your potential exposure to contaminants commonly found in fish by removing the skin and any visible fat before you cook the fish. You should also avoid using fat from fish for gravy or sauces as it may contain contaminants like mercury, dioxin, or PCBs."
        },
        {
          "headline":"Grill or broil your fish instead of frying.",
          "description":"If you cook your fish on a grill or broiler grate, fat inside the fish filet will drip away. Fat is where chemicals like mercury, dioxin, and PCBs are stored in a fish. Grilling or broiling fish can help remove these harmful chemicals from the fish. It will also reduce the amount of fat and calories in your serving of fish. Try marinating salmon in teriyaki sauce and grilling it for 8 minutes on each side. Try broiling catfish and serving it with fresh tomato and corn salsa."
        },
        {
          "headline":"Cook fish for 8-10 minutes for each inch of thickness.",
          "description":"You should bake, poach, broil, or grill fish for 10 minutes per each inch of thickness. This means if the fish fillet is 2 inches thick, you should bake or broil it for about 20 minutes total."
        },
        {
          "headline":"Cook to an internal temperature of 145 degrees Fahrenheit or 63 degrees Celsius.",
          "description":"Whether you bake, broil, fry, or grill your fish and seafood, you should always make sure the internal temperature reaches 145 degrees Fahrenheit or 63 degrees Celsius."
        }
      ]
    }
  ],
  "text":" Choosing Healthy, Safe, and Sustainable Fish Choose fish that are high in omega-3 fatty acids. Fish that contain high levels of omega-3 fatty acids are some of the healthiest seafood choices. Salmon, halibut, and sardines are all rich in omegas and delicious additions to your regular diet. Try grilling salmon or halibut and serving it with a side of vegetables. Eat sardines and clams to boost your B-12 levels. Certain types of fish are high in vitamin B-12, which is a critical nutrient for all humans. To get the most out of your fish choices, opt for varieties that are high in vitamin B-12 like clams, sardines, anchovies, and salmon. Try broiling fresh clams topped with a little bit of butter for a wonderful dinner option. Eat some sardines as an easy, healthy snack at home or on the go. Avoid fish with high mercury levels. Mercury is harmful to your central nervous system. Certain types of fish contain high mercury levels and should be avoided. The U.S. Environmental Protection Agency recommends completely avoiding king mackerel, marlin, orange roughy, shark, swordfish, tilefish, and bigeye tuna. It is especially important for women of childbearing age, pregnant and breastfeeding women, and young children to avoid fish that are high in mercury content. Eat 2-3 servings of wild-caught or sustainably farmed fish weekly. These choices should also be low in mercury. Some of the healthiest choices include Atlantic mackerel, wild-caught salmon, catfish, and sardines. Good shellfish choices include shrimp, oysters, American and spiny lobsters, and clams. A serving of fish or shellfish is 4 ounces for adults. For children between 4 and 7 years old, a serving is 2 ounces. Consider sustainability. When you are deciding what types of fish and seafood to consume, you should think about sustainability and how your food choices affect the environment. Increasing demand for fish as well as unregulated fishing practices can harm fisheries and species that are at risk. Check out the Monterey Bay Aquarium Seafood Watch at www.seafoodwatch.org to choose seafood that has a minimal impact on the environment. Some sustainable seafood choices include farmed catfish, farmed mussels, wild-caught cod, and wild-caught clams. Unsustainable seafood choices include Chilean seabass, orange roughy, shark, and Bluefin tuna. Check for advisories if you catch your own fish. If you eat fish caught by family and friends, or if you catch the fish yourself, you should check local advisories. Contact your county or state fish and wildlife service and ask about fish advisories. If there is not an advisory, you should eat only one serving of the fish. You should eat no other fish in the same week that you eat the serving of local fish. Buying Healthy Fish and Shellfish Buy fresh fish displayed on ice that is not melting. When you purchase fresh seafood, it is important that it has been kept at a proper temperature. This reduces the risk of foodborne illness, which is often referred to as food poisoning. Fresh seafood should be refrigerated in a case and displayed on thick ice that is not melting. Choose fresh whole fish with clear eyes, firm flesh, and bright red gills. Fresh whole fish should have clear eyes that slightly bulge. The flesh should be firm and shiny, and should spring back when you press it lightly with your finger. Look for fish with bright red gills. The gills should not have milky slime in them. Select fresh fish fillets that are not discolored and do not smell fishy. If you are purchasing fresh fish fillets, the flesh should be firm and it should not be discolored. You should avoid fish fillets that appear dried out or dark around the edges. Like whole fish, the flesh of fish fillets should spring back when pressed. The fish also should not smelly overly fishy. Buy fresh shrimp that is translucent. Fresh shrimp should have flesh that is translucent, or slightly clear. The flesh of fresh shrimp should also be shiny. You should avoid shrimp that have a strong odor. Instead, opt for fresh shrimp that have little or no odor. Do a tap test on live shellfish. If you are buying live clams, oysters, or mussels, you should tap their shells first. They should close up when you tap them. If they do not close up after the tap test, you should avoid buying them. Avoid cracked shellfish. When purchasing fresh or live shellfish, you should not select ones that have a cracked or broken shell. If you purchase a package of fresh shellfish that contains individuals with cracked or broken shells, you should throw those clams, oysters, or mussels away immediately. Make sure live crabs and lobsters move their legs. If a crab or lobster is alive, it should show at least some leg movement. Crabs and lobsters spoil very quickly after they die. This means you should only purchase and prepare live crabs and lobsters. Pay attention to package indicators on refrigerated fish and seafood. Sometimes refrigerated seafood is packaged. These packages might have time and temperature indicators on them to display whether the seafood has been stored properly. If the package has indicators on it, make sure you check them and only buy the seafood if it has been stored properly. Exercise caution with frozen fish and seafood. Frozen fish and seafood can spoil easily if it thaws or is left at warm temperatures for too long while being transported. Avoid packages that are open or crushed on the edges, or torn. You should also avoid packages in the top of a freezer case or that have signs of frost or ice crystals. Read the ingredient labels. There are many fish products that have unhealthy additives. For example, fish sticks can contain transfats and preservatives. Make sure you read all ingredient labels carefully, and opt for fish that have minimal additional ingredients. Properly Preparing Healthy Seafood Thaw frozen fish and seafood safely. The safest way to thaw frozen fish and seafood is in the refrigerator. Place it your refrigerator and allow it to thaw overnight. If you are in a hurry, you can place frozen fish and seafood in cold water as long as it is sealed in a plastic bag. Remove skin and visible fat. You can help reduce your potential exposure to contaminants commonly found in fish by removing the skin and any visible fat before you cook the fish. You should also avoid using fat from fish for gravy or sauces as it may contain contaminants like mercury, dioxin, or PCBs. Grill or broil your fish instead of frying. If you cook your fish on a grill or broiler grate, fat inside the fish filet will drip away. Fat is where chemicals like mercury, dioxin, and PCBs are stored in a fish. Grilling or broiling fish can help remove these harmful chemicals from the fish. It will also reduce the amount of fat and calories in your serving of fish. Try marinating salmon in teriyaki sauce and grilling it for 8 minutes on each side. Try broiling catfish and serving it with fresh tomato and corn salsa. Cook fish for 8-10 minutes for each inch of thickness. You should bake, poach, broil, or grill fish for 10 minutes per each inch of thickness. This means if the fish fillet is 2 inches thick, you should bake or broil it for about 20 minutes total. Cook to an internal temperature of 145 degrees Fahrenheit or 63 degrees Celsius. Whether you bake, broil, fry, or grill your fish and seafood, you should always make sure the internal temperature reaches 145 degrees Fahrenheit or 63 degrees Celsius.",
  "tyn_model":[
    "fish",
    "seafood",
    "shellfish",
    "clams",
    "shrimp",
    "salmon",
    "sardines",
    "lobsters",
    "catfish",
    "oysters",
    "mussels",
    "crabs",
    "halibut",
    "ice",
    "fish fillets",
    "refrigerator",
    "grill",
    "vegetables",
    "anchovies",
    "butter",
    "mercury",
    "king mackerel",
    "marlin",
    "shark",
    "swordfish",
    "tuna",
    "atlantic mackerel",
    "cod",
    "wild-caught clams",
    "seabass",
    "orange roughy, shark",
    "bluefin tuna",
    "crab",
    "lobster",
    "freezer case",
    "fish sticks",
    "water",
    "broiler",
    "fish filet",
    "teriyaki sauce",
    "fresh tomato",
    "corn salsa"
  ],
  "tyn_section":[

  ]
}