{
  "title":"How to Make Red Velvet Pancakes",
  "url":"https://www.wikihow.com/Make-Red-Velvet-Pancakes",
  "category_hierarchy":[
    "Food and Entertaining",
    "Breakfast",
    "Pancakes"
  ],
  "parts":[
    {
      "name":"Mixing the Pancake Batter",
      "steps":[
        {
          "headline":"Combine the flour, powdered sugar, cocoa, baking soda, baking powder, and salt.",
          "description":"Add 2 cups (250 g) of all-purpose flour, 1 cup (125 g) of powdered sugar, \u00bd cup (50 g) of unsweetened cocoa, 1 \u00bd teaspoons (7 \u00bd g) of baking powder, \u00bd teaspoon (2 \u00bd g) of baking soda, and \u00bd teaspoon (3 g) salt to a large bowl. Whisk the ingredients together to ensure that they\u2019re well mixed. It\u2019s a good idea to sift the dry ingredients before you mix them."
        },
        {
          "headline":"Mix the buttermilk, eggs, sugar, and food coloring together.",
          "description":"Add 1 \u00bd cups (355 ml) of buttermilk, 2 large eggs, \u00bd cup (100 g) of granulated sugar, and 2 tablespoons (30 ml) of red liquid food coloring to a separate large bowl. Whisk the ingredients together until they are fully combined. If you don\u2019t have buttermilk on hand, mix 1 \u00bd cups (355 ml) of whole or 2% milk or heavy cream with 1 \u00bd tablespoons (22 \u00bd ml) of lemon juice or white vinegar. Allow the mixture to sit for 5 to 10 minutes until it thickens slightly before mixing it with the other ingredients."
        },
        {
          "headline":"Add the buttermilk mixture to the flour mixture until fully incorporated.",
          "description":"After the buttermilk mixture is fully combined, gradually pour it into the flour mixture. Stir until the dry and wet ingredients are just combined. Be careful not to overmix the pancake batter, or you may wind up with tough, chewy pancakes. It\u2019s normal for the batter to have some lumps."
        }
      ]
    },
    {
      "name":"Cooking the Pancakes",
      "steps":[
        {
          "headline":"Heat a nonstick skillet.",
          "description":"To cook the pancakes, you\u2019ll need a large, nonstick skillet. Preheat the pan on the stovetop over medium heat for approximately 5 to 7 minutes. If you prefer, you can use a griddle to cook the pancakes."
        },
        {
          "headline":"Grease the skillet lightly with butter.",
          "description":"While the skillet is heating, it\u2019s important to grease it so the pancakes won\u2019t stick. Lightly brush the interior of the pan with melted butter to grease it. Be careful not to use too much butter on the skillet, or you may end up with greasy pancakes."
        },
        {
          "headline":"Add the batter into the pan in small amounts.",
          "description":"Once the skillet is lightly greased and heated, pour the pancake batter into the pan. For each pancake, use approximately \u00bc cup (60 ml) of the batter, spacing them evenly apart in the pan. Using \u00bc cup (60 ml) of the batter will give you average side pancakes. If you want to make silver dollar pancakes, use \u215b cup (30 ml) or less."
        },
        {
          "headline":"Cook the pancakes for several minutes.",
          "description":"After you\u2019ve poured the batter into the pan, allow each pancake to cook for 3 to 4 minutes on the first side. You\u2019ll know that they\u2019re ready to turn when there are bubbles on the tops and the edges are dry and firm. Keep an eye on the pancakes as they\u2019re cooking because they can burn easily."
        },
        {
          "headline":"Flip the pancakes and cook for another few minutes.",
          "description":"When the pancakes are finished cooking on the first side, use a large, wide spatula to carefully turn them over. Let them cook on the other side for another 1 to 2 minutes, or until the bottoms are set and the pancakes are completely cooked through. Repeat the process of adding the batter and cooking the pancakes until you\u2019ve used up all of the batter. If you want keep the pancakes warm as you finish preparing breakfast, place the cooked pancakes in a single layer on a baking sheet. Set the oven to 200 degrees Fahrenheit (95 degrees Celsius), and leave the pancakes inside for up to 30 minutes."
        }
      ]
    },
    {
      "name":"Cream Cheese Topping and Serving",
      "steps":[
        {
          "headline":"Mix the cream cheese and powdered sugar.",
          "description":"To make the cream cheese topping for the pancakes, add 4 ounces (115 g) of softened cream cheese and \u00bd cup (75 g) of powdered sugar to a small bowl. Blend the two together until they are well mixed."
        },
        {
          "headline":"Add the milk.",
          "description":"After you\u2019ve mixed the cream cheese and powdered sugar, gradually mix in 1 tablespoon (15 ml) of milk. Stir well so the mixture is completely smooth. For the creamiest topping, use whole milk."
        },
        {
          "headline":"Stir in the vanilla.",
          "description":"Once the cream cheese mixture is well blended and smooth, add 1 teaspoon (5 ml) of vanilla extract. Mix the topping well to ensure that the vanilla is fully incorporated. If you prefer, you can omit the vanilla."
        },
        {
          "headline":"Place the cream cheese topping in a piping bag and drizzle over the pancakes.",
          "description":"Once you\u2019ve finished mixing the cream cheese topping, transfer it to a piping bag with a round tip. Set a serving of pancakes on a plate and drizzle the topping over the pancakes before serving.If you don\u2019t have a piping bag, put the cream cheese topping in a sealable plastic bag. Squeeze out all of the air, seal it, and cut off one of the corners, so you can use the bag to drizzle the topping over the pancakes. If you\u2019d like extra garnish for your pancakes, consider sprinkling them with chopped nuts, such as pecans or walnuts, and powdered sugar."
        }
      ]
    }
  ],
  "text":" Mixing the Pancake Batter Combine the flour, powdered sugar, cocoa, baking soda, baking powder, and salt. Add 2 cups (250 g) of all-purpose flour, 1 cup (125 g) of powdered sugar, \u00bd cup (50 g) of unsweetened cocoa, 1 \u00bd teaspoons (7 \u00bd g) of baking powder, \u00bd teaspoon (2 \u00bd g) of baking soda, and \u00bd teaspoon (3 g) salt to a large bowl. Whisk the ingredients together to ensure that they\u2019re well mixed. It\u2019s a good idea to sift the dry ingredients before you mix them. Mix the buttermilk, eggs, sugar, and food coloring together. Add 1 \u00bd cups (355 ml) of buttermilk, 2 large eggs, \u00bd cup (100 g) of granulated sugar, and 2 tablespoons (30 ml) of red liquid food coloring to a separate large bowl. Whisk the ingredients together until they are fully combined. If you don\u2019t have buttermilk on hand, mix 1 \u00bd cups (355 ml) of whole or 2% milk or heavy cream with 1 \u00bd tablespoons (22 \u00bd ml) of lemon juice or white vinegar. Allow the mixture to sit for 5 to 10 minutes until it thickens slightly before mixing it with the other ingredients. Add the buttermilk mixture to the flour mixture until fully incorporated. After the buttermilk mixture is fully combined, gradually pour it into the flour mixture. Stir until the dry and wet ingredients are just combined. Be careful not to overmix the pancake batter, or you may wind up with tough, chewy pancakes. It\u2019s normal for the batter to have some lumps. Cooking the Pancakes Heat a nonstick skillet. To cook the pancakes, you\u2019ll need a large, nonstick skillet. Preheat the pan on the stovetop over medium heat for approximately 5 to 7 minutes. If you prefer, you can use a griddle to cook the pancakes. Grease the skillet lightly with butter. While the skillet is heating, it\u2019s important to grease it so the pancakes won\u2019t stick. Lightly brush the interior of the pan with melted butter to grease it. Be careful not to use too much butter on the skillet, or you may end up with greasy pancakes. Add the batter into the pan in small amounts. Once the skillet is lightly greased and heated, pour the pancake batter into the pan. For each pancake, use approximately \u00bc cup (60 ml) of the batter, spacing them evenly apart in the pan. Using \u00bc cup (60 ml) of the batter will give you average side pancakes. If you want to make silver dollar pancakes, use \u215b cup (30 ml) or less. Cook the pancakes for several minutes. After you\u2019ve poured the batter into the pan, allow each pancake to cook for 3 to 4 minutes on the first side. You\u2019ll know that they\u2019re ready to turn when there are bubbles on the tops and the edges are dry and firm. Keep an eye on the pancakes as they\u2019re cooking because they can burn easily. Flip the pancakes and cook for another few minutes. When the pancakes are finished cooking on the first side, use a large, wide spatula to carefully turn them over. Let them cook on the other side for another 1 to 2 minutes, or until the bottoms are set and the pancakes are completely cooked through. Repeat the process of adding the batter and cooking the pancakes until you\u2019ve used up all of the batter. If you want keep the pancakes warm as you finish preparing breakfast, place the cooked pancakes in a single layer on a baking sheet. Set the oven to 200 degrees Fahrenheit (95 degrees Celsius), and leave the pancakes inside for up to 30 minutes. Cream Cheese Topping and Serving Mix the cream cheese and powdered sugar. To make the cream cheese topping for the pancakes, add 4 ounces (115 g) of softened cream cheese and \u00bd cup (75 g) of powdered sugar to a small bowl. Blend the two together until they are well mixed. Add the milk. After you\u2019ve mixed the cream cheese and powdered sugar, gradually mix in 1 tablespoon (15 ml) of milk. Stir well so the mixture is completely smooth. For the creamiest topping, use whole milk. Stir in the vanilla. Once the cream cheese mixture is well blended and smooth, add 1 teaspoon (5 ml) of vanilla extract. Mix the topping well to ensure that the vanilla is fully incorporated. If you prefer, you can omit the vanilla. Place the cream cheese topping in a piping bag and drizzle over the pancakes. Once you\u2019ve finished mixing the cream cheese topping, transfer it to a piping bag with a round tip. Set a serving of pancakes on a plate and drizzle the topping over the pancakes before serving.If you don\u2019t have a piping bag, put the cream cheese topping in a sealable plastic bag. Squeeze out all of the air, seal it, and cut off one of the corners, so you can use the bag to drizzle the topping over the pancakes. If you\u2019d like extra garnish for your pancakes, consider sprinkling them with chopped nuts, such as pecans or walnuts, and powdered sugar.",
  "tyn_model":[
    "cream cheese",
    "powdered sugar",
    "buttermilk",
    "skillet",
    "flour",
    "butter",
    "milk",
    "vanilla",
    "piping bag",
    "baking soda",
    "baking powder",
    "salt",
    "large bowl",
    "eggs",
    "nonstick skillet",
    "pancakes",
    "pancake batter",
    "cocoa",
    "all-purpose flour",
    "unsweetened cocoa",
    "sugar",
    "food coloring",
    "granulated sugar",
    "red liquid food coloring",
    "2% milk",
    "heavy cream",
    "lemon juice",
    "white vinegar",
    "stovetop",
    "griddle",
    "\u215b cup",
    "pan",
    "spatula",
    "baking sheet",
    "oven",
    "small bowl",
    "vanilla extract",
    "plate",
    "sealable plastic bag",
    "nuts",
    "walnuts"
  ],
  "tyn_section":[

  ]
}