{
  "title":"How to Draw and Paint a Romantic Cottage in One\u2010Point Perspective",
  "url":"https://www.wikihow.com/Draw-and-Paint-a-Romantic-Cottage-in-One%E2%80%90Point-Perspective",
  "category_hierarchy":[
    "Hobbies and Crafts",
    "Drawing",
    "Learning to Draw",
    "Drawing Perspective"
  ],
  "parts":[
    {
      "name":"Sketching the Cottage",
      "steps":[
        {
          "headline":"Draw the house.",
          "description":"Assemble your drawing supplies. A sheet of standard, 8 \u00bd\u201d X 11\u201d computer paper, a sharp pencil, a ruler, a pencil sharpener and an eraser."
        },
        {
          "headline":"Place your paper on a board or work surface in the landscape orientation.",
          "description":"Draw a line from side to side at approximately the center. This is the \u201cHorizon Line\u201d or the place where the sky and earth meet. It is also referred to as \u201cEye Level.\u201d  At eye level, you will only see the front and one side of the rectangle."
        },
        {
          "headline":"To the far left of the center, place a dot to represent the \u201cVanishing Point.\u201d  As we view scenery outdoors, this is the spot where all things are so far away, they converge into a single dot.",
          "description":""
        },
        {
          "headline":"Construct the front of the house.",
          "description":"It will be viewed at eye level. Draw a rectangle in the space to the right of the vanishing point on the horizon line, half above and half below."
        },
        {
          "headline":"Use your ruler to run lines from the left side (or the side closest to the vanishing point) to and touching the vanishing point.",
          "description":"Bear in mind that the only lines you will draw in this exercise will be horizontal, vertical (to the paper\u2019s edges) or to the vanishing point."
        },
        {
          "headline":"Draw a vertical line to indicate where the box or house ends.",
          "description":"Erase the guide lines;  the two lines to the vanishing point and the horizon line where it shows through the rectangle. Erasing the horizon line will make your rectangle appear to be a solid shape and will now be referred to as a cube."
        },
        {
          "headline":"Create a peaked roof.",
          "description":"Make an X with your ruler from corner to corner on the first rectangle representing the front of the building. Through the center of the X, draw a vertical line. Make it as high as you want your roof peak to be."
        },
        {
          "headline":"Connect the sides of the roof peak to form a triangle.",
          "description":""
        },
        {
          "headline":"Finish the roof.",
          "description":"Mimic the slope of the roof at the back. Do this by placing your ruler against the angle and lightly dragging it to the back. Draw this line to close the roof shape."
        },
        {
          "headline":"Draw the rooftop.",
          "description":"Run a line from the roof peak to the vanishing point."
        },
        {
          "headline":"Make the roof over hanging.",
          "description":""
        },
        {
          "headline":"Plan and block in windows and a door.",
          "description":"Remember to use only two kinds of lines for this: vertical or to the vanishing point. Make doors rectangular shaped, tall enough for a person to pass through. Windows can be rectangles, squares, even round. To do round, make a square and round off the four corners."
        },
        {
          "headline":"Do a chimney.",
          "description":"This is a rectangle rising well above the highest peak of the roof. Add another line to give it depth."
        },
        {
          "headline":"Erase all guide lines except the horizon line.",
          "description":""
        }
      ]
    },
    {
      "name":"Embellishing the Drawing",
      "steps":[
        {
          "headline":"Transfer and embellish the drawing.",
          "description":"Copy your house to a piece of 140 pound 11\u201d x 14\u201d watercolor paper from a pad. One method is to trace your sketch at the window. You might have to darken the lines of your house with pencil or fine line Sharpie for the sketch to show through onto the good paper. Hold your sketch behind the good paper and up to the light. Shift it around to determine where you want your house to go. Tack the sketch with masking tape it to the back of your good paper. Use a ruler for all lines. Another method is to use graphite paper from the art or craft store, an artist\u2019s erasable version of carbon paper. {\"smallUrl\":\"https:\\/\\/www.wikihow.com\\/images\\/thumb\\/0\\/0e\\/Graphitepaper.jpg\\/460px-Graphitepaper.jpg\",\"bigUrl\":\"https:\\/\\/www.wikihow.com\\/images\\/thumb\\/0\\/0e\\/Graphitepaper.jpg\\/760px-Graphitepaper.jpg\",\"smallWidth\":460,\"smallHeight\":348,\"bigWidth\":760,\"bigHeight\":575.2197802197802,\"licensing\":\"<div class=\\\"mw-parser-output\\\"><p>License: <a rel=\\\"nofollow\\\" class=\\\"external text\\\" href=\\\"https:\\/\\/creativecommons.org\\/licenses\\/by-nc-sa\\/3.0\\/\\\">Creative Commons<\\/a><br>\\n<\\/p><p><br \\/>\\n<\\/p><\\/div>\"}"
        },
        {
          "headline":"Stand up your paper, step back and plan the composition for your painting.",
          "description":"Ask yourself, what makes an house a country cottage? Do research on the internet. For ideas, Google \u201cromantic cottages in watercolor\u201d or \u201ccoloring pages of storybook cottages.\u201c  Or, simply use your imagination and add whatever makes you happy."
        },
        {
          "headline":"Consider the material of your house.",
          "description":"Siding will provide depth and texture; stucco, brick, stone, wood shingles, etc."
        },
        {
          "headline":"Study roofs.",
          "description":"They come in a great variety. A thatched roof is often seen in country cottages in storybooks."
        },
        {
          "headline":"Pay special attention to the door or entryway.",
          "description":"Do extra lines around it for depth and solidity. Add a window (s), texture, doorknob, raised panels, etc."
        },
        {
          "headline":"Treat your windows with special care.",
          "description":"They will represent and showcase the life that happens inside the house. Add additional lines for moldings and still more to break up the space into panes. Add window boxes and/or shutters. Show character by having them arched, narrow, or in an attic space, shaped like an eyelid."
        },
        {
          "headline":"Use accessories to add personal touches.",
          "description":"Low walls, picket or stone fences, a trellis or an arbor, shrubbery or landscaping elements, trees, paths, a rock garden or path, flowers, flagstones, etc."
        },
        {
          "headline":"Create a setting for the house.",
          "description":"Draw landscape elements to place the house in a special setting. Vary types of tree shapes for interest."
        },
        {
          "headline":"Use extra care showing a path.",
          "description":"Angle it to the side, curve it and have it narrower close to the doorway and flare and fade it out as it goes into the scene. Drawing it straight down from the house and making it too rigid will have it appear to be standing upright, a situation to avoid."
        }
      ]
    },
    {
      "name":"Painting the Cottage",
      "steps":[
        {
          "headline":"Paint your house.",
          "description":"Gather whatever watercolors you prefer, brushes, a water bucket and paper towel or tissues to help control the flow of paint."
        },
        {
          "headline":"Mix big puddles of color and use a big brush.",
          "description":"Flow the paint over the shapes."
        },
        {
          "headline":"Start painting at any spot.",
          "description":"There is no right place to begin. Work with light, diluted washes initially. This will help you see your scene in color and is easy to make corrections if you wipe away a wet area with tissue. Allow the piece to dry before doing additional layers or washes. Use a hairdryer if you wish."
        },
        {
          "headline":"Work on the painting until it satisfies you.",
          "description":"Better to stop earlier rather than overworking it. Remember there are lots of ways to edit your work, sponging off to lighten areas, over painting with another color, etc. You can add finishing touches indefinitely as they occur to you. When finished, sign your work. Start a new painting at this point."
        },
        {
          "headline":"Take pride in knowing that this special little dwelling is uniquely yours.",
          "description":"Hang it when finished and enjoy retreating to it whenever you want. No packing required."
        }
      ]
    }
  ],
  "text":" Sketching the Cottage Draw the house. Assemble your drawing supplies. A sheet of standard, 8 \u00bd\u201d X 11\u201d computer paper, a sharp pencil, a ruler, a pencil sharpener and an eraser. Place your paper on a board or work surface in the landscape orientation. Draw a line from side to side at approximately the center. This is the \u201cHorizon Line\u201d or the place where the sky and earth meet. It is also referred to as \u201cEye Level.\u201d  At eye level, you will only see the front and one side of the rectangle. To the far left of the center, place a dot to represent the \u201cVanishing Point.\u201d  As we view scenery outdoors, this is the spot where all things are so far away, they converge into a single dot.  Construct the front of the house. It will be viewed at eye level. Draw a rectangle in the space to the right of the vanishing point on the horizon line, half above and half below. Use your ruler to run lines from the left side (or the side closest to the vanishing point) to and touching the vanishing point. Bear in mind that the only lines you will draw in this exercise will be horizontal, vertical (to the paper\u2019s edges) or to the vanishing point. Draw a vertical line to indicate where the box or house ends. Erase the guide lines;  the two lines to the vanishing point and the horizon line where it shows through the rectangle. Erasing the horizon line will make your rectangle appear to be a solid shape and will now be referred to as a cube. Create a peaked roof. Make an X with your ruler from corner to corner on the first rectangle representing the front of the building. Through the center of the X, draw a vertical line. Make it as high as you want your roof peak to be. Connect the sides of the roof peak to form a triangle.  Finish the roof. Mimic the slope of the roof at the back. Do this by placing your ruler against the angle and lightly dragging it to the back. Draw this line to close the roof shape. Draw the rooftop. Run a line from the roof peak to the vanishing point. Make the roof over hanging.  Plan and block in windows and a door. Remember to use only two kinds of lines for this: vertical or to the vanishing point. Make doors rectangular shaped, tall enough for a person to pass through. Windows can be rectangles, squares, even round. To do round, make a square and round off the four corners. Do a chimney. This is a rectangle rising well above the highest peak of the roof. Add another line to give it depth. Erase all guide lines except the horizon line.  Embellishing the Drawing Transfer and embellish the drawing. Copy your house to a piece of 140 pound 11\u201d x 14\u201d watercolor paper from a pad. One method is to trace your sketch at the window. You might have to darken the lines of your house with pencil or fine line Sharpie for the sketch to show through onto the good paper. Hold your sketch behind the good paper and up to the light. Shift it around to determine where you want your house to go. Tack the sketch with masking tape it to the back of your good paper. Use a ruler for all lines. Another method is to use graphite paper from the art or craft store, an artist\u2019s erasable version of carbon paper. {\"smallUrl\":\"https:\\/\\/www.wikihow.com\\/images\\/thumb\\/0\\/0e\\/Graphitepaper.jpg\\/460px-Graphitepaper.jpg\",\"bigUrl\":\"https:\\/\\/www.wikihow.com\\/images\\/thumb\\/0\\/0e\\/Graphitepaper.jpg\\/760px-Graphitepaper.jpg\",\"smallWidth\":460,\"smallHeight\":348,\"bigWidth\":760,\"bigHeight\":575.2197802197802,\"licensing\":\"<div class=\\\"mw-parser-output\\\"><p>License: <a rel=\\\"nofollow\\\" class=\\\"external text\\\" href=\\\"https:\\/\\/creativecommons.org\\/licenses\\/by-nc-sa\\/3.0\\/\\\">Creative Commons<\\/a><br>\\n<\\/p><p><br \\/>\\n<\\/p><\\/div>\"} Stand up your paper, step back and plan the composition for your painting. Ask yourself, what makes an house a country cottage? Do research on the internet. For ideas, Google \u201cromantic cottages in watercolor\u201d or \u201ccoloring pages of storybook cottages.\u201c  Or, simply use your imagination and add whatever makes you happy. Consider the material of your house. Siding will provide depth and texture; stucco, brick, stone, wood shingles, etc. Study roofs. They come in a great variety. A thatched roof is often seen in country cottages in storybooks. Pay special attention to the door or entryway. Do extra lines around it for depth and solidity. Add a window (s), texture, doorknob, raised panels, etc. Treat your windows with special care. They will represent and showcase the life that happens inside the house. Add additional lines for moldings and still more to break up the space into panes. Add window boxes and/or shutters. Show character by having them arched, narrow, or in an attic space, shaped like an eyelid. Use accessories to add personal touches. Low walls, picket or stone fences, a trellis or an arbor, shrubbery or landscaping elements, trees, paths, a rock garden or path, flowers, flagstones, etc. Create a setting for the house. Draw landscape elements to place the house in a special setting. Vary types of tree shapes for interest. Use extra care showing a path. Angle it to the side, curve it and have it narrower close to the doorway and flare and fade it out as it goes into the scene. Drawing it straight down from the house and making it too rigid will have it appear to be standing upright, a situation to avoid. Painting the Cottage Paint your house. Gather whatever watercolors you prefer, brushes, a water bucket and paper towel or tissues to help control the flow of paint. Mix big puddles of color and use a big brush. Flow the paint over the shapes. Start painting at any spot. There is no right place to begin. Work with light, diluted washes initially. This will help you see your scene in color and is easy to make corrections if you wipe away a wet area with tissue. Allow the piece to dry before doing additional layers or washes. Use a hairdryer if you wish. Work on the painting until it satisfies you. Better to stop earlier rather than overworking it. Remember there are lots of ways to edit your work, sponging off to lighten areas, over painting with another color, etc. You can add finishing touches indefinitely as they occur to you. When finished, sign your work. Start a new painting at this point. Take pride in knowing that this special little dwelling is uniquely yours. Hang it when finished and enjoy retreating to it whenever you want. No packing required.",
  "tyn_model":[
    "ruler",
    "paper",
    "\u201d x",
    "\u201d or",
    "\u201d  ",
    "paint",
    "\u201d computer paper",
    "sharp pencil",
    "pencil sharpener",
    "eraser",
    "\u201chorizon",
    "\u201ceye",
    "\u201cvanishing",
    "windows",
    "chimney",
    "\u201d watercolor paper",
    "pencil",
    "fine line sharpie",
    "masking tape",
    "graphite paper",
    "carbon paper",
    "\u201cromantic",
    "\u201ccoloring",
    "\u201c  ",
    "roofs",
    "window",
    "window boxes",
    "trellis",
    "arbor",
    "trees",
    "watercolors",
    "brushes",
    "water bucket",
    "paper towel",
    "tissue",
    "hairdryer"
  ],
  "tyn_section":[

  ]
}