{
  "title":"How to Use Salt As a Cleaning Agent",
  "url":"https://www.wikihow.com/Use-Salt-As-a-Cleaning-Agent",
  "category_hierarchy":[
    "Home and Garden",
    "Housekeeping",
    "Cleaning"
  ],
  "methods":[
    {
      "name":"Scouring Hard Surfaces",
      "steps":[
        {
          "headline":"Mix salt and vinegar.",
          "description":"Vinegar is commonly used in household cleaning and can be combined with salt for extra stain removal power. Add some normal, distilled vinegar to a bowl. Sprinkle it with an equal amount of salt and stir it into the vinegar. Soda water is a possible substitute for vinegar and can be used to clean and deodorize refrigerators."
        },
        {
          "headline":"Apply to stained surfaces.",
          "description":"Use a rag to apply the mixture to surfaces such as your refrigerator or a mop for tile floors. The mixture can also be applied to glass, including removing coffee and tea stains on glassware. Don\u2019t use the mixture on surfaces sensitive to vinegar, such as linoleum, marble, and floor wax."
        },
        {
          "headline":"Freshen your cutting board.",
          "description":"Take a half of a lemon and squeeze out the juice. Pour some salt onto the lemon half. Rub the lemon half over stains on the cutting board then wipe up when finished. This will attack the stains as well as any odor."
        },
        {
          "headline":"Scrub coffee stains.",
          "description":"Coffee and tea stains on mugs can be taken care of with salt and dish soap. Add your soap and then mix in salt until it forms a paste. Using a cloth or gentle scrubber, buff away the stain using the paste."
        },
        {
          "headline":"Ice down glass.",
          "description":"Glass with stains at the bottom, including vases and coffee pots, can be aided by placing ice cubes in the glass with up to \u2153 a cup of salt. Let the mixture sit for five minutes. Swirl it around before rinsing with warm water."
        },
        {
          "headline":"Remove water marks.",
          "description":"Leaving glasses and plates on wooden surfaces leaves white water stains. These can be removed by combining an equal amount of vegetable oil and salt into a paste. Rub it over stains using a cloth and let it sit for ten minutes before wiping clean. This can also be done by combining lemon juice or vinegar with salt. EXPERT TIP\t\t\t\t\t\t\t\t\t\t\t\t\t\t\t\t\t\t\t\t\t\t\t\t\t\t\t\t\t\t\tRaymond Chiu\t\t\t\t\t\t\t\t\t\t\t\t\t\t\t\tCleaning Guru & Director of Operations, Maid Sailors\t\t\t\t\t\t\t\tRaymond Chiu is the Director of Operations for MaidSailors.com, a residential and commercial cleaning service based in New York City that provides home and office cleaning services at affordable prices. He has a Bachelors in Business Administration and Management from Baruch College. Raymond Chiu\t\t\tCleaning Guru & Director of Operations, Maid Sailors\t\t\t\tThere are a number of ways you can use salt around your home! Salt is a cheap, natural cleaner. You can use it as a scouring agent, or you can mix it with other ingredients, like vinegar or water, to boost the cleaning process. You can use salt mixed with hot water to clean your drains, for instance, or you can clean stained cups with salt and a drop of dish soap mixed with water. You can also scrub pots and pans with salt and paper towels or a soft-bristled brush."
        }
      ]
    },
    {
      "name":"Cleaning Carpet",
      "steps":[
        {
          "headline":"Cover fresh stains with salt.",
          "description":"Add enough salt on top of the carpeting so that is hides the stain. The salt will begin to absorb the liquid, pulling it out from the fibers. Let the salt rest for fifteen minutes. Salt is useful for removing such stains as those from wine or pets and can be used on tablecloths and clothing for the same purpose."
        },
        {
          "headline":"Vacuum up the salt.",
          "description":"It is better to use a vacuum attachment to ensure that you don\u2019t press the salt down into the carpet. Most of the stain should be gone. If liquid is still present, repeat the process with more salt until nothing more is absorbed."
        },
        {
          "headline":"Mix borax, vinegar, and salt.",
          "description":"For deeper cleaning, try this mixture. Place equal amounts of the three substances in a bowl and mix them together. Borax is a non-chemical cleaner that can be found in general retail stores."
        },
        {
          "headline":"Place the mixture on carpet spots.",
          "description":"Pour the mixture out of the container and onto the carpet. Spread it so that it covers all of the areas you\u2019re trying to clean. Allow it to stay there until it dries."
        },
        {
          "headline":"Vacuum up the mixture.",
          "description":"Once the mixture is dry, the salt should have helped bring the liquid to the surface. Grab your vacuum cleaner, power it on, and run it over the area. The cleaner will be removed with no problem."
        },
        {
          "headline":"Brighten the colors.",
          "description":"Combine an equal amount or more of salt and water in a bowl. Dip a rag into the water, wring it out, then rub it quickly over the area you need to freshen. This has the effect of preserving and revitalizing fading colors."
        }
      ]
    },
    {
      "name":"Washing Laundry",
      "steps":[
        {
          "headline":"Boil yellowed cotton and linen.",
          "description":"Combine \u00bc cup of salt and \u00bd cup of baking soda into a large pot filled with water. Add the yellowed items, then boil for 30 minutes. It is not uncommon for larger, thicker items such as tablecloths to require repeated boilings or be left for longer periods of time to whiten."
        },
        {
          "headline":"Rinse in cold water.",
          "description":"Once you have removed your cotton or linen from the pot, move it to the sink. Run it under cold water, making sure to turn the item until it it soaked and you are sure all the cleaner is removed. This prevents it from turning brown and degrading later. You may also want to lay the cloth flat out under the sun to dry. Avoid bunching the fabric so that it doesn\u2019t stretch. Avoid the dryer, as it can also stretch and dull the fabric."
        },
        {
          "headline":"Brighten colors.",
          "description":"Add a half a cup of salt into the wash cycle to give washable fabric renewed color. This works great on preserving new clothing as well as restoring fabrics that have begun to fade."
        },
        {
          "headline":"Remove perspiration stains.",
          "description":"Combine four tablespoons of salt to one quart of water. Use a cloth or sponge to apply the saltwater to the stains. Gently work the water into the stains, letting it soak and adding more as needed, until the stains disappear and you can wash the clothing normally."
        },
        {
          "headline":"Neutralize blood stains.",
          "description":"Combine two tablespoons of salt to one quart of cold water. Soak the stained clothing in the saltwater for an hour. Afterwards, wash the clothing as normally, either using a washing machine or hand washing in warm, soapy water. Fabric that can take high heat, such as cotton and linen, can be boiled in a pot of water after washing for extra effect."
        }
      ]
    },
    {
      "name":"Polishing Metal",
      "steps":[
        {
          "headline":"Sprinkle salt over grease.",
          "description":"Grease comes off easily in stainless steel pans with salt. Cover the grease areas with a small amount of salt. Add hot water if you need extra cleaning power, then wipe up with a paper towel. Dump any salt in the pan into the trash. This can also be done on enamel and ceramic pans, ovens, and grease fires. Do not use salt on non-stick surfaces. It will damage the finish."
        },
        {
          "headline":"Pour saltwater down the drain.",
          "description":"Hot water mixed with salt can prevent grease blockages in the drain. This must be done while the water is hot. For clogs that have already formed, mix a cup of salt, a half cup of white vinegar, and a cup of baking soda. Pour the mixture down the drain."
        },
        {
          "headline":"Flush the drain with boiling water.",
          "description":"Have a pot of boiling water on hand when dealing with the clog. Ten minutes after the salt, vinegar, and baking soda mixture has gone down the drain, chase it with the water. Rinse with warm water when you\u2019re done to ensure the clog is gone and the mixture no longer affects the plumbing."
        },
        {
          "headline":"Make a general polish paste.",
          "description":"Equal parts of salt, flour, and vinegar can be combined to make a paste that polishes most metals, including silver, gold, steel, and pewter. Place the ingredients into a bowl. Mix them until they form the paste."
        },
        {
          "headline":"Apply the paste.",
          "description":"Use a cloth to pick up the cleaner and place it on the metal. Spread it around to cover the entire surface. Allow the cleaner to sit for an hour."
        },
        {
          "headline":"Clean with citrus.",
          "description":"For shining copper and brass, try citrus juice instead of polish paste. A simple way to do this it to squeeze the juice out of a lemon half and then add salt to the rind. Rub the lemon half over the surface of the metal. A lime is a possible substitute for the lemon."
        },
        {
          "headline":"Remove rust with cream of tartar.",
          "description":"Combine equal parts cream of tartar, salt, and water in a bowl. All of these items can be found at a grocery store. Mix them into a paste and combine them as you would a polish by spreading them out over the rust spots with a rag. Lemon juice and salt also works. Use a squeezed out, salted lemon half on the rust."
        },
        {
          "headline":"Let the rusted metal sit in the sun.",
          "description":"This should only be done for metals being treated for rust. The sunlight warms the mixture and activates it so it eats away at the rust. Leave it alone until it dries."
        },
        {
          "headline":"Rinse off your cleaner.",
          "description":"No matter how you treated the metal, get it under warm water if possible in order to remove the paste. Another option is to use a clean cloth. Add warm water to it, then rub it over the metal surface. Make sure you get all the paste so it doesn\u2019t damage the finish."
        },
        {
          "headline":"Dry the metal.",
          "description":"Rather than leave the water to damage the metal, get a clean cloth. Wipe it all over the surface of the metal so that it removes all the water. The metal should look shiny. You can buff it with a clean, soft cloth to make it look better."
        }
      ]
    }
  ],
  "text":" Scouring Hard Surfaces Mix salt and vinegar. Vinegar is commonly used in household cleaning and can be combined with salt for extra stain removal power. Add some normal, distilled vinegar to a bowl. Sprinkle it with an equal amount of salt and stir it into the vinegar. Soda water is a possible substitute for vinegar and can be used to clean and deodorize refrigerators. Apply to stained surfaces. Use a rag to apply the mixture to surfaces such as your refrigerator or a mop for tile floors. The mixture can also be applied to glass, including removing coffee and tea stains on glassware. Don\u2019t use the mixture on surfaces sensitive to vinegar, such as linoleum, marble, and floor wax. Freshen your cutting board. Take a half of a lemon and squeeze out the juice. Pour some salt onto the lemon half. Rub the lemon half over stains on the cutting board then wipe up when finished. This will attack the stains as well as any odor. Scrub coffee stains. Coffee and tea stains on mugs can be taken care of with salt and dish soap. Add your soap and then mix in salt until it forms a paste. Using a cloth or gentle scrubber, buff away the stain using the paste. Ice down glass. Glass with stains at the bottom, including vases and coffee pots, can be aided by placing ice cubes in the glass with up to \u2153 a cup of salt. Let the mixture sit for five minutes. Swirl it around before rinsing with warm water. Remove water marks. Leaving glasses and plates on wooden surfaces leaves white water stains. These can be removed by combining an equal amount of vegetable oil and salt into a paste. Rub it over stains using a cloth and let it sit for ten minutes before wiping clean. This can also be done by combining lemon juice or vinegar with salt. EXPERT TIP\t\t\t\t\t\t\t\t\t\t\t\t\t\t\t\t\t\t\t\t\t\t\t\t\t\t\t\t\t\t\tRaymond Chiu\t\t\t\t\t\t\t\t\t\t\t\t\t\t\t\tCleaning Guru & Director of Operations, Maid Sailors\t\t\t\t\t\t\t\tRaymond Chiu is the Director of Operations for MaidSailors.com, a residential and commercial cleaning service based in New York City that provides home and office cleaning services at affordable prices. He has a Bachelors in Business Administration and Management from Baruch College. Raymond Chiu\t\t\tCleaning Guru & Director of Operations, Maid Sailors\t\t\t\tThere are a number of ways you can use salt around your home! Salt is a cheap, natural cleaner. You can use it as a scouring agent, or you can mix it with other ingredients, like vinegar or water, to boost the cleaning process. You can use salt mixed with hot water to clean your drains, for instance, or you can clean stained cups with salt and a drop of dish soap mixed with water. You can also scrub pots and pans with salt and paper towels or a soft-bristled brush. Cleaning Carpet Cover fresh stains with salt. Add enough salt on top of the carpeting so that is hides the stain. The salt will begin to absorb the liquid, pulling it out from the fibers. Let the salt rest for fifteen minutes. Salt is useful for removing such stains as those from wine or pets and can be used on tablecloths and clothing for the same purpose. Vacuum up the salt. It is better to use a vacuum attachment to ensure that you don\u2019t press the salt down into the carpet. Most of the stain should be gone. If liquid is still present, repeat the process with more salt until nothing more is absorbed. Mix borax, vinegar, and salt. For deeper cleaning, try this mixture. Place equal amounts of the three substances in a bowl and mix them together. Borax is a non-chemical cleaner that can be found in general retail stores. Place the mixture on carpet spots. Pour the mixture out of the container and onto the carpet. Spread it so that it covers all of the areas you\u2019re trying to clean. Allow it to stay there until it dries. Vacuum up the mixture. Once the mixture is dry, the salt should have helped bring the liquid to the surface. Grab your vacuum cleaner, power it on, and run it over the area. The cleaner will be removed with no problem. Brighten the colors. Combine an equal amount or more of salt and water in a bowl. Dip a rag into the water, wring it out, then rub it quickly over the area you need to freshen. This has the effect of preserving and revitalizing fading colors. Washing Laundry Boil yellowed cotton and linen. Combine \u00bc cup of salt and \u00bd cup of baking soda into a large pot filled with water. Add the yellowed items, then boil for 30 minutes. It is not uncommon for larger, thicker items such as tablecloths to require repeated boilings or be left for longer periods of time to whiten. Rinse in cold water. Once you have removed your cotton or linen from the pot, move it to the sink. Run it under cold water, making sure to turn the item until it it soaked and you are sure all the cleaner is removed. This prevents it from turning brown and degrading later. You may also want to lay the cloth flat out under the sun to dry. Avoid bunching the fabric so that it doesn\u2019t stretch. Avoid the dryer, as it can also stretch and dull the fabric. Brighten colors. Add a half a cup of salt into the wash cycle to give washable fabric renewed color. This works great on preserving new clothing as well as restoring fabrics that have begun to fade. Remove perspiration stains. Combine four tablespoons of salt to one quart of water. Use a cloth or sponge to apply the saltwater to the stains. Gently work the water into the stains, letting it soak and adding more as needed, until the stains disappear and you can wash the clothing normally. Neutralize blood stains. Combine two tablespoons of salt to one quart of cold water. Soak the stained clothing in the saltwater for an hour. Afterwards, wash the clothing as normally, either using a washing machine or hand washing in warm, soapy water. Fabric that can take high heat, such as cotton and linen, can be boiled in a pot of water after washing for extra effect. Polishing Metal Sprinkle salt over grease. Grease comes off easily in stainless steel pans with salt. Cover the grease areas with a small amount of salt. Add hot water if you need extra cleaning power, then wipe up with a paper towel. Dump any salt in the pan into the trash. This can also be done on enamel and ceramic pans, ovens, and grease fires. Do not use salt on non-stick surfaces. It will damage the finish. Pour saltwater down the drain. Hot water mixed with salt can prevent grease blockages in the drain. This must be done while the water is hot. For clogs that have already formed, mix a cup of salt, a half cup of white vinegar, and a cup of baking soda. Pour the mixture down the drain. Flush the drain with boiling water. Have a pot of boiling water on hand when dealing with the clog. Ten minutes after the salt, vinegar, and baking soda mixture has gone down the drain, chase it with the water. Rinse with warm water when you\u2019re done to ensure the clog is gone and the mixture no longer affects the plumbing. Make a general polish paste. Equal parts of salt, flour, and vinegar can be combined to make a paste that polishes most metals, including silver, gold, steel, and pewter. Place the ingredients into a bowl. Mix them until they form the paste. Apply the paste. Use a cloth to pick up the cleaner and place it on the metal. Spread it around to cover the entire surface. Allow the cleaner to sit for an hour. Clean with citrus. For shining copper and brass, try citrus juice instead of polish paste. A simple way to do this it to squeeze the juice out of a lemon half and then add salt to the rind. Rub the lemon half over the surface of the metal. A lime is a possible substitute for the lemon. Remove rust with cream of tartar. Combine equal parts cream of tartar, salt, and water in a bowl. All of these items can be found at a grocery store. Mix them into a paste and combine them as you would a polish by spreading them out over the rust spots with a rag. Lemon juice and salt also works. Use a squeezed out, salted lemon half on the rust. Let the rusted metal sit in the sun. This should only be done for metals being treated for rust. The sunlight warms the mixture and activates it so it eats away at the rust. Leave it alone until it dries. Rinse off your cleaner. No matter how you treated the metal, get it under warm water if possible in order to remove the paste. Another option is to use a clean cloth. Add warm water to it, then rub it over the metal surface. Make sure you get all the paste so it doesn\u2019t damage the finish. Dry the metal. Rather than leave the water to damage the metal, get a clean cloth. Wipe it all over the surface of the metal so that it removes all the water. The metal should look shiny. You can buff it with a clean, soft cloth to make it look better.",
  "tyn_model":[
    "salt",
    "water",
    "vinegar",
    "bowl",
    "lemon",
    "baking soda",
    "saltwater",
    "cutting board",
    "dish soap",
    "lemon juice",
    "borax",
    "cream of tartar",
    "cloth",
    "distilled vinegar",
    "soda water",
    "soap",
    "gentle scrubber",
    "ice cubes",
    "\u2153 a",
    "glasses",
    "plates",
    "vegetable oil",
    "vacuum attachment",
    "container",
    "vacuum cleaner",
    "large pot",
    "linen",
    "dryer",
    "sponge",
    "cold water",
    "stainless steel pans",
    "paper towel",
    "white vinegar",
    "boiling water",
    "flour",
    "pewter",
    "citrus",
    "citrus juice",
    "lime",
    "cleaner"
  ],
  "tyn_section":[

  ]
}