{
  "title":"How to Season Tuna",
  "url":"https://www.wikihow.com/Season-Tuna",
  "category_hierarchy":[
    "Food and Entertaining",
    "Recipes",
    "Fish and Seafood",
    "Tuna"
  ],
  "methods":[
    {
      "name":"Creating a Tuna Marinade",
      "steps":[
        {
          "headline":"Make a soy-based marinade.",
          "description":"This will help to flavour the tuna steak and keep it moist while cooking. For example, combine 1 cup (236 ml) of soy sauce, \u00bd cup (118 ml) of lemon juice, and 2 cloves of minced garlic in a medium bowl. Then add salt and pepper to taste. Alternatively, you could place the ingredients in a resealable plastic bag."
        },
        {
          "headline":"Add tuna to the marinade.",
          "description":"Once you have completed the marinade, add the tuna to the bowl or plastic bag. Dip the tuna entirely into the liquid marinade, so that all sides of the steak are coated."
        },
        {
          "headline":"Refrigerate the tuna in the marinade.",
          "description":"Place the tuna and marinade in the refrigerator for anywhere from 15 minutes to 4 hours. You can flip the tuna once in order to make sure that all sides are coated and flavoured. The tuna is now ready to be cooked."
        },
        {
          "headline":"Experiment with different marinade flavors.",
          "description":"Tuna can be marinated in a variety of different flavours. For example, you could replace the lemon juice with orange juice, or use teriyaki sauce as well as soy sauce. Search online for a variety of tuna marinade recipes and experiment until you find one that you like."
        }
      ]
    },
    {
      "name":"Making a Tuna Rub",
      "steps":[
        {
          "headline":"Pat the tuna steak dry with paper towel.",
          "description":"This will help the spices stick to the tuna. Alternatively, if you are grilling the tuna steaks, then you may want to lightly brush them with oil before rubbing with spices. This will prevent the tuna from sticking to the grill."
        },
        {
          "headline":"Make a simple dry rub with salt and pepper.",
          "description":"In a small bowl combine together 1 teaspoon of salt and 1/4 teaspoon of black pepper. For a spicier flavor substitute the back pepper with cayenne pepper or red pepper flakes. You could also try garlic salt or sea salt to expand the flavor."
        },
        {
          "headline":"Create a blackened tuna rub.",
          "description":"In order to make a blackened tuna rub, combine paprika, oregano, thyme, black pepper, onion powder, garlic powder, and salt in a bowl. Taste the seasoning and adjust the quantities when you reach a flavor you enjoy. You can search online to find a recipe for a delicious tuna rub or experiment with the spices and herbs that you have on hand."
        },
        {
          "headline":"Rub the seasoning onto the tuna.",
          "description":"You can do this by sprinkling the spice mix onto a cutting board and then pressing all sides of the tuna into the spices. Alternatively, you can sprinkle the spice mix directly onto each side of the tuna and then massage it into the meat using your hands. The tuna is now seasoned and ready to be cooked."
        }
      ]
    },
    {
      "name":"Seasoning Canned Tuna",
      "steps":[
        {
          "headline":"Make a tuna salad.",
          "description":"The most common way to eat canned tuna is by making a tuna salad. Typically, this consists of mixing canned tuna with mayonnaise and a variety of chopped vegetables, such as carrots, celery, cucumber, or tomato. Then add salt and pepper to taste. Tuna salad can be served on a sandwich or over a bed of greens. This creates a simple and tasty meal."
        },
        {
          "headline":"Try a tuna casserole.",
          "description":"Tuna casserole is a tasty and simple way to incorporate tuna into your diet. To make tuna casserole, you will need to combine canned tuna with noodles, cream of mushroom soup, peas, onions, and any other vegetables. Then bake the dish in the oven and finally sprinkle with cheese before serving."
        },
        {
          "headline":"Create tuna patties.",
          "description":"Canned tuna can also be used to make tuna patties that can then be served as burgers or eaten on their own with a bit of tartar sauce and lemon juice."
        }
      ]
    }
  ],
  "text":" Creating a Tuna Marinade Make a soy-based marinade. This will help to flavour the tuna steak and keep it moist while cooking. For example, combine 1 cup (236 ml) of soy sauce, \u00bd cup (118 ml) of lemon juice, and 2 cloves of minced garlic in a medium bowl. Then add salt and pepper to taste. Alternatively, you could place the ingredients in a resealable plastic bag. Add tuna to the marinade. Once you have completed the marinade, add the tuna to the bowl or plastic bag. Dip the tuna entirely into the liquid marinade, so that all sides of the steak are coated. Refrigerate the tuna in the marinade. Place the tuna and marinade in the refrigerator for anywhere from 15 minutes to 4 hours. You can flip the tuna once in order to make sure that all sides are coated and flavoured. The tuna is now ready to be cooked. Experiment with different marinade flavors. Tuna can be marinated in a variety of different flavours. For example, you could replace the lemon juice with orange juice, or use teriyaki sauce as well as soy sauce. Search online for a variety of tuna marinade recipes and experiment until you find one that you like. Making a Tuna Rub Pat the tuna steak dry with paper towel. This will help the spices stick to the tuna. Alternatively, if you are grilling the tuna steaks, then you may want to lightly brush them with oil before rubbing with spices. This will prevent the tuna from sticking to the grill. Make a simple dry rub with salt and pepper. In a small bowl combine together 1 teaspoon of salt and 1/4 teaspoon of black pepper. For a spicier flavor substitute the back pepper with cayenne pepper or red pepper flakes. You could also try garlic salt or sea salt to expand the flavor. Create a blackened tuna rub. In order to make a blackened tuna rub, combine paprika, oregano, thyme, black pepper, onion powder, garlic powder, and salt in a bowl. Taste the seasoning and adjust the quantities when you reach a flavor you enjoy. You can search online to find a recipe for a delicious tuna rub or experiment with the spices and herbs that you have on hand. Rub the seasoning onto the tuna. You can do this by sprinkling the spice mix onto a cutting board and then pressing all sides of the tuna into the spices. Alternatively, you can sprinkle the spice mix directly onto each side of the tuna and then massage it into the meat using your hands. The tuna is now seasoned and ready to be cooked. Seasoning Canned Tuna Make a tuna salad. The most common way to eat canned tuna is by making a tuna salad. Typically, this consists of mixing canned tuna with mayonnaise and a variety of chopped vegetables, such as carrots, celery, cucumber, or tomato. Then add salt and pepper to taste. Tuna salad can be served on a sandwich or over a bed of greens. This creates a simple and tasty meal. Try a tuna casserole. Tuna casserole is a tasty and simple way to incorporate tuna into your diet. To make tuna casserole, you will need to combine canned tuna with noodles, cream of mushroom soup, peas, onions, and any other vegetables. Then bake the dish in the oven and finally sprinkle with cheese before serving. Create tuna patties. Canned tuna can also be used to make tuna patties that can then be served as burgers or eaten on their own with a bit of tartar sauce and lemon juice.",
  "tyn_model":[
    "tuna",
    "salt and pepper",
    "canned tuna",
    "tuna casserole",
    "soy sauce",
    "bowl",
    "lemon",
    "salt",
    "pepper",
    "spice mix",
    "tuna salad",
    "tuna patties",
    "soy-based marinade",
    "lemon juice",
    "minced garlic",
    "medium bowl",
    "resealable plastic bag",
    "plastic bag",
    "refrigerator",
    "orange juice",
    "teriyaki sauce",
    "paper towel",
    "oil",
    "spices",
    "grill",
    "cayenne pepper",
    "red pepper",
    "garlic salt",
    "sea salt",
    "paprika",
    "oregano",
    "thyme",
    "black pepper",
    "onion powder",
    "garlic powder",
    "cutting board",
    "mayonnaise",
    "carrots",
    "celery",
    "cucumber",
    "tomato",
    "noodles",
    "cream of mushroom soup",
    "peas",
    "onions",
    "oven",
    "cheese",
    "tartar sauce"
  ],
  "tyn_section":[

  ]
}