{
  "title":"How to Clean Drapes",
  "url":"https://www.wikihow.com/Clean-Drapes",
  "category_hierarchy":[
    "Home and Garden",
    "Housekeeping",
    "Cleaning"
  ],
  "methods":[
    {
      "name":"Deep Cleaning Your Drapes",
      "steps":[
        {
          "headline":"Remove your drapes from the window.",
          "description":"To deep clean your drapes, remove them from the window and lay them on a flat surface. Remove any hardware from the drapes, such as wood polls, so you can focus on just cleaning the fabric. If your drapes are very dusty, open a window before removing them. This will prevent you from inhaling too much dust and debris."
        },
        {
          "headline":"Check the manufacturer's label.",
          "description":"There should be a manufacturer's label somewhere on the inside of your drapes. This should give you instructions on cleaning. Before washing your drapes, know what cleaning methods will not damage the drapes. Some drapes, for example, are hand wash only and others require dry cleaning. If you can't find a manufacturer's label, it's best to opt for professional cleaning. Professional dry cleaners will have a better sense than you of what kind of cleaning methods are safe for drapes. Drapes are expensive, so it's important not to damage them in the cleaning process. Follow the instructions on the manufacturer's label carefully and never machine wash drapes that are hand wash only. Wool, cotton, and very sheer fabrics are usually not machine washable."
        },
        {
          "headline":"Vacuum the drapes.",
          "description":"Before washing your drapes with detergent and water, vacuum them to remove excess dust and debris. Lay your drapes flat on the floor. Run a vacuum over the drapes until your remove layers of dirt and dust. Use the crevice tool of your vacuum to get into any folds or hard to reach places. If your vacuum has a detachable upholstery brush, use this utensil to vacuum the drapes. Sheer fabrics may not hold up under vacuuming. Remember to follow the instructions on the manufacturer's label and do not vacuum drapes if it advices against this. You can shake drapes outside if you cannot vacuum them."
        },
        {
          "headline":"Machine wash drapes if possible.",
          "description":"Some drapes are machine washable. Using a washing machine to wash your drapes can save you time and labor. Only wash one panel of drapes at a time. Use a gentle cycle and use cold water to wash drapes. Remove your drapes from the machine immediately after washing them to prevent wrinkling."
        },
        {
          "headline":"Hand wash drapes when necessary.",
          "description":"Wool, cotton, and sheer fabrics like lace usually require hand washing. Never put hand wash only drapes in a washing machine, as this can cause damage. To hand wash drapes, fill a sink with cold water and add one teaspoon of liquid dish detergent. Place one panel at a time in the water. Allow the panels to soak for 10 minutes before removing them. Then, swirl the drapes to remove the debris. Drain the sink and refill it with clean water. Repeat the process to dry your drapes. Make sure to swirl your drapes until all soap residue is removed. If necessary, repeat the rinsing process twice."
        },
        {
          "headline":"Air dry your drapes.",
          "description":"Most drapes should be air dried to prevent shrinking and other damage. You simply hang your drapes back up after washing them. Lay old towels down under the drapes to catch any dripping water. Within a few days, your drapes should be dry. EXPERT TIP\t\t\t\t\t\t\t\t\t\t\t\t\t\t\t\t\t\t\t\t\t\t\t\t\t\t\t\t\t\t\tChris Willatt\t\t\t\t\t\t\t\t\t\t\t\t\t\t\t\tCleaning Guru\t\t\t\t\t\t\t\tChris Willatt is the owner and founder of Alpine Maids, a cleaning agency in Denver, Colorado started in 2015. Alpine Maids has received Angie's List Super Service Award for three years in a row since 2016 and has been awarded Colorado's \"Top Rated Local House Cleaning\" Award in 2018. Chris Willatt\t\t\tCleaning Guru\t\t\t\tExpert Trick: You can also dry drapes on low heat in the dryer, for a quicker alternative."
        }
      ]
    },
    {
      "name":"Providing Daily Cleaning",
      "steps":[
        {
          "headline":"Give your drapes a gentle shake each night.",
          "description":"When you draw the drapes at nightfall, give them a gentle shake. This will remove any dirt and dust from the drapes. Shaking the drapes a little each night makes cleaning easier, as it removes unwanted dirt on a daily basis."
        },
        {
          "headline":"Use some water if necessary.",
          "description":"Drapes, especially sheer drapes, built up mild amounts of dust even with regular shaking. If your drapes are looking a little dusty, dip a chamois cloth in warm water and run it over the drapes. Wring out the cloth thoroughly before running it against the drapes. Make sure to read the manufacturer's label before using cloth on the drapes. Some drapes may not respond well to certain types of materials."
        },
        {
          "headline":"Provide a light vacuuming regularly.",
          "description":"When vacuuming, use the upholstery brush or another detachable nozzle to give the drapes a light vacuuming. Set the vacuum for reduced suction when washing the drapes. If your vacuum cleaner does not have a reduced suction option, place a nylon sock over the nozzle before running it over the drapes."
        }
      ]
    },
    {
      "name":"Maintaining Drapes",
      "steps":[
        {
          "headline":"Dry clean drapes when necessary.",
          "description":"If drapes are labeled dry clean only, never attempt to clean them on your own. This can damage your drapes. While dry cleaning is expensive, it's worth the extra cost to maintain drapes over time."
        },
        {
          "headline":"Remove dirt each month by running your drapes through a dryer.",
          "description":"Unless the manufacturer's label specifies otherwise, you can run your drapes through a dryer once a month to remove dirt and dust. Use the \"no heat\" or fluff setting and dry your drapes for 10 minutes."
        },
        {
          "headline":"Change your cleaning habits based on sun damage.",
          "description":"Drapes will inevitably wear down with time as they are damaged by the sun. If your drapes start to feel thin and look faded, wash them more delicately. For example, even machine washable drapes should be hand washed after they've developed sun damage. If very sheer drapes are becoming sun damaged, have them washed at a dry cleaners."
        }
      ]
    }
  ],
  "text":" Deep Cleaning Your Drapes Remove your drapes from the window. To deep clean your drapes, remove them from the window and lay them on a flat surface. Remove any hardware from the drapes, such as wood polls, so you can focus on just cleaning the fabric. If your drapes are very dusty, open a window before removing them. This will prevent you from inhaling too much dust and debris. Check the manufacturer's label. There should be a manufacturer's label somewhere on the inside of your drapes. This should give you instructions on cleaning. Before washing your drapes, know what cleaning methods will not damage the drapes. Some drapes, for example, are hand wash only and others require dry cleaning. If you can't find a manufacturer's label, it's best to opt for professional cleaning. Professional dry cleaners will have a better sense than you of what kind of cleaning methods are safe for drapes. Drapes are expensive, so it's important not to damage them in the cleaning process. Follow the instructions on the manufacturer's label carefully and never machine wash drapes that are hand wash only. Wool, cotton, and very sheer fabrics are usually not machine washable. Vacuum the drapes. Before washing your drapes with detergent and water, vacuum them to remove excess dust and debris. Lay your drapes flat on the floor. Run a vacuum over the drapes until your remove layers of dirt and dust. Use the crevice tool of your vacuum to get into any folds or hard to reach places. If your vacuum has a detachable upholstery brush, use this utensil to vacuum the drapes. Sheer fabrics may not hold up under vacuuming. Remember to follow the instructions on the manufacturer's label and do not vacuum drapes if it advices against this. You can shake drapes outside if you cannot vacuum them. Machine wash drapes if possible. Some drapes are machine washable. Using a washing machine to wash your drapes can save you time and labor. Only wash one panel of drapes at a time. Use a gentle cycle and use cold water to wash drapes. Remove your drapes from the machine immediately after washing them to prevent wrinkling. Hand wash drapes when necessary. Wool, cotton, and sheer fabrics like lace usually require hand washing. Never put hand wash only drapes in a washing machine, as this can cause damage. To hand wash drapes, fill a sink with cold water and add one teaspoon of liquid dish detergent. Place one panel at a time in the water. Allow the panels to soak for 10 minutes before removing them. Then, swirl the drapes to remove the debris. Drain the sink and refill it with clean water. Repeat the process to dry your drapes. Make sure to swirl your drapes until all soap residue is removed. If necessary, repeat the rinsing process twice. Air dry your drapes. Most drapes should be air dried to prevent shrinking and other damage. You simply hang your drapes back up after washing them. Lay old towels down under the drapes to catch any dripping water. Within a few days, your drapes should be dry. EXPERT TIP\t\t\t\t\t\t\t\t\t\t\t\t\t\t\t\t\t\t\t\t\t\t\t\t\t\t\t\t\t\t\tChris Willatt\t\t\t\t\t\t\t\t\t\t\t\t\t\t\t\tCleaning Guru\t\t\t\t\t\t\t\tChris Willatt is the owner and founder of Alpine Maids, a cleaning agency in Denver, Colorado started in 2015. Alpine Maids has received Angie's List Super Service Award for three years in a row since 2016 and has been awarded Colorado's \"Top Rated Local House Cleaning\" Award in 2018. Chris Willatt\t\t\tCleaning Guru\t\t\t\tExpert Trick: You can also dry drapes on low heat in the dryer, for a quicker alternative. Providing Daily Cleaning Give your drapes a gentle shake each night. When you draw the drapes at nightfall, give them a gentle shake. This will remove any dirt and dust from the drapes. Shaking the drapes a little each night makes cleaning easier, as it removes unwanted dirt on a daily basis. Use some water if necessary. Drapes, especially sheer drapes, built up mild amounts of dust even with regular shaking. If your drapes are looking a little dusty, dip a chamois cloth in warm water and run it over the drapes. Wring out the cloth thoroughly before running it against the drapes. Make sure to read the manufacturer's label before using cloth on the drapes. Some drapes may not respond well to certain types of materials. Provide a light vacuuming regularly. When vacuuming, use the upholstery brush or another detachable nozzle to give the drapes a light vacuuming. Set the vacuum for reduced suction when washing the drapes. If your vacuum cleaner does not have a reduced suction option, place a nylon sock over the nozzle before running it over the drapes. Maintaining Drapes Dry clean drapes when necessary. If drapes are labeled dry clean only, never attempt to clean them on your own. This can damage your drapes. While dry cleaning is expensive, it's worth the extra cost to maintain drapes over time. Remove dirt each month by running your drapes through a dryer. Unless the manufacturer's label specifies otherwise, you can run your drapes through a dryer once a month to remove dirt and dust. Use the \"no heat\" or fluff setting and dry your drapes for 10 minutes. Change your cleaning habits based on sun damage. Drapes will inevitably wear down with time as they are damaged by the sun. If your drapes start to feel thin and look faded, wash them more delicately. For example, even machine washable drapes should be hand washed after they've developed sun damage. If very sheer drapes are becoming sun damaged, have them washed at a dry cleaners.",
  "tyn_model":[
    "water",
    "vacuum",
    "dryer",
    "dry cleaners",
    "upholstery brush",
    "vacuuming",
    "fabric",
    "window",
    "cold water",
    "liquid dish detergent",
    "sink",
    "towels",
    "alpine maids,",
    "cleaning agency",
    "alpine maids has",
    "chamois cloth",
    "cloth",
    "vacuum cleaner",
    "nylon sock",
    "dry cleaning"
  ],
  "tyn_section":[

  ]
}