{
  "title":"How to Fireproof a Kitchen",
  "url":"https://www.wikihow.com/Fireproof-a-Kitchen",
  "category_hierarchy":[
    "Home and Garden",
    "Home Maintenance",
    "Kitchens",
    "Kitchen Safety"
  ],
  "methods":[
    {
      "name":"Setting up Your Kitchen Safely",
      "steps":[
        {
          "headline":"Install a smoke alarm near your kitchen.",
          "description":"You should install a smoke alarm very near your kitchen, such as in a hallway adjoining your kitchen. Since the alarm may go off too easily if it is in the middle of the kitchen, it is best to put it just outside."
        },
        {
          "headline":"Install your fire extinguisher by your kitchen door.",
          "description":"It should be easily accessible from anywhere in the kitchen but not too close to the stove or other appliances where a kitchen fire could start, such as a microwave. You don\u2019t want to have to reach through the fire to get the extinguisher. If you don\u2019t know how to use a fire extinguisher, you should sign up for a workshop with your local fire department."
        },
        {
          "headline":"Avoid installing cabinets above your stove.",
          "description":"Cabinets above your stove are common in many small apartments, but can pose a fire hazard. First, if there is no range hood or exhaust above the stove, you could get grease build up underneath the cabinets. This will increase the fire risk. Second, you may reach for something in the cabinet while you are cooking and inadvertently allow your clothing to catch fire."
        },
        {
          "headline":"Avoid storing solvents and cleaning products near the stove.",
          "description":"Since many solvents and cleaning products are flammable, it is not advisable to store them anywhere near your stove."
        },
        {
          "headline":"Store your pot holders and oven mitts away from your stove.",
          "description":"To avoid your oven mitts and pot holders catching fire on the stove, you should store them away from the stove. Instead, you could put them in a drawer or on a hook near your fridge."
        },
        {
          "headline":"Store your wood utensils away from your stove.",
          "description":"If you have a container with a bunch of wood utensils in your kitchen, you should keep it at least three feet away from your stove."
        },
        {
          "headline":"Keep flammables away from the stove.",
          "description":"Flammables such as paper and plastics should be kept a good distance away from your stove. You could put them in a kitchen drawer, cabinet or other secure location. All flammables should be kept a minimum of three feet away from the stove."
        },
        {
          "headline":"Check your kitchen wiring.",
          "description":"If you live in an old house, you may want to get your kitchen wiring checked. Faulty kitchen wiring is a serious fire risk. Phone your electrician and make an appointment to address any kitchen wiring issues. If you are constantly blowing a fuse in the kitchen, you may have a wiring problem. If you get shocked plugging in appliances, you may have a wiring problem."
        },
        {
          "headline":"Renovate your kitchen for fire safety.",
          "description":"If you are renovating your kitchen, you should ask your contractor to follow fire safety guidelines and use fire resistant materials. For instance, you can purchase fire resistant drywall and fire retardant poly sheeting. You can also design the kitchen so that it is easily accessible to the front and back door of your house. And you can minimize any obstacles such as interior walls or kitchen islands, so that your family can easily exit the house in the event of a fire."
        }
      ]
    },
    {
      "name":"Dealing with Appliances",
      "steps":[
        {
          "headline":"Register new kitchen appliances.",
          "description":"In many cases, kitchen fires are caused by poorly built appliances. Although you obviously want to avoid purchasing a poorly built kitchen appliance, you should also be sure to register any new appliances. If the appliance company finds a safety problem, you will find out about it sooner if you are registered."
        },
        {
          "headline":"Sign up for recall alerts.",
          "description":"You can sign up for appliance recall alerts, which will give you a heads up when there has been a recall on any kitchen appliance that you own. For instance, the following websites will allow you to sign up for kitchen appliance recall alerts:\nThe recalls government website: http://www.recalls.gov\n\nThe safer products government website: http://www.saferproducts.gov"
        },
        {
          "headline":"Make sure your appliances are in good working order.",
          "description":"You should keep your kitchen appliances such as stove, microwave, fridge and dishwasher regularly serviced. You should also replace your kitchen appliances in a timely manner. Finally, you should make sure your appliance power cords are not frayed or splintered, which is a serious fire risk. You should also consider whether any of your major kitchen appliances need to be replaced:\nRefrigerators last about fifteen years before you need to replace them. If you want to save energy, you might want to replace them sooner. Ovens and stoves last ten to fifteen years before you need to replace them. Dishwashers need to be replaced every eight to ten years."
        },
        {
          "headline":"Unplug small appliances when you are not using them.",
          "description":"Small appliances like toasters and coffee makers will draw energy whenever they are plugged in, even if you are not using them. If the temperature rises unexpectedly or these appliances are not in good working order, you could have a major fire risk. When you are not using your small appliances, remember to unplug them."
        }
      ]
    },
    {
      "name":"Cleaning for Fire Safety",
      "steps":[
        {
          "headline":"Clean your cooking surfaces to get rid of grease.",
          "description":"One of the simplest steps you can take to improve fire safety is cleaning your work surfaces. Your kitchen counter, stovetop and sink area should be cleaned regularly to reduce fire risk."
        },
        {
          "headline":"Clean your range hoods.",
          "description":"Grease tends to build up under range hoods and becomes a fire risk. To mitigate the risk of a fire starting under your range hood, you should clean it regularly."
        },
        {
          "headline":"Clean your toaster and microwave oven.",
          "description":"Small appliances like toasters and microwaves are often the start of kitchen fires. Crumbs gather at the bottom of your toaster. If the toaster is left on for too long or is defective, the crumbs could catch fire. To mitigate this risk, you should regularly clean these appliances."
        },
        {
          "headline":"Avoid cooking on a dirty stove.",
          "description":"If you let grease and grime build up on your kitchen stove and then start cooking, you are increasing the risk of a fire. As such, it is important to regularly clean your stovetop."
        },
        {
          "headline":"Practice everyday kitchen safety.",
          "description":"You should always stay in the kitchen when the stove is turned on, since many fires start when a stove is left on without anyone watching it. You should also follow stove guidelines when lighting the pilot light on your stove. When you are using grease, avoid very hot temperatures and avoid filling pots and pans too full with hot grease. Finally, you want to wear a cooking apron or other sensible clothing and keep your sleeves and hair away from heat sources while you are cooking."
        }
      ]
    }
  ],
  "text":" Setting up Your Kitchen Safely Install a smoke alarm near your kitchen. You should install a smoke alarm very near your kitchen, such as in a hallway adjoining your kitchen. Since the alarm may go off too easily if it is in the middle of the kitchen, it is best to put it just outside. Install your fire extinguisher by your kitchen door. It should be easily accessible from anywhere in the kitchen but not too close to the stove or other appliances where a kitchen fire could start, such as a microwave. You don\u2019t want to have to reach through the fire to get the extinguisher. If you don\u2019t know how to use a fire extinguisher, you should sign up for a workshop with your local fire department. Avoid installing cabinets above your stove. Cabinets above your stove are common in many small apartments, but can pose a fire hazard. First, if there is no range hood or exhaust above the stove, you could get grease build up underneath the cabinets. This will increase the fire risk. Second, you may reach for something in the cabinet while you are cooking and inadvertently allow your clothing to catch fire. Avoid storing solvents and cleaning products near the stove. Since many solvents and cleaning products are flammable, it is not advisable to store them anywhere near your stove. Store your pot holders and oven mitts away from your stove. To avoid your oven mitts and pot holders catching fire on the stove, you should store them away from the stove. Instead, you could put them in a drawer or on a hook near your fridge. Store your wood utensils away from your stove. If you have a container with a bunch of wood utensils in your kitchen, you should keep it at least three feet away from your stove. Keep flammables away from the stove. Flammables such as paper and plastics should be kept a good distance away from your stove. You could put them in a kitchen drawer, cabinet or other secure location. All flammables should be kept a minimum of three feet away from the stove. Check your kitchen wiring. If you live in an old house, you may want to get your kitchen wiring checked. Faulty kitchen wiring is a serious fire risk. Phone your electrician and make an appointment to address any kitchen wiring issues. If you are constantly blowing a fuse in the kitchen, you may have a wiring problem. If you get shocked plugging in appliances, you may have a wiring problem. Renovate your kitchen for fire safety. If you are renovating your kitchen, you should ask your contractor to follow fire safety guidelines and use fire resistant materials. For instance, you can purchase fire resistant drywall and fire retardant poly sheeting. You can also design the kitchen so that it is easily accessible to the front and back door of your house. And you can minimize any obstacles such as interior walls or kitchen islands, so that your family can easily exit the house in the event of a fire. Dealing with Appliances Register new kitchen appliances. In many cases, kitchen fires are caused by poorly built appliances. Although you obviously want to avoid purchasing a poorly built kitchen appliance, you should also be sure to register any new appliances. If the appliance company finds a safety problem, you will find out about it sooner if you are registered. Sign up for recall alerts. You can sign up for appliance recall alerts, which will give you a heads up when there has been a recall on any kitchen appliance that you own. For instance, the following websites will allow you to sign up for kitchen appliance recall alerts:\nThe recalls government website: http://www.recalls.gov\n\nThe safer products government website: http://www.saferproducts.gov Make sure your appliances are in good working order. You should keep your kitchen appliances such as stove, microwave, fridge and dishwasher regularly serviced. You should also replace your kitchen appliances in a timely manner. Finally, you should make sure your appliance power cords are not frayed or splintered, which is a serious fire risk. You should also consider whether any of your major kitchen appliances need to be replaced:\nRefrigerators last about fifteen years before you need to replace them. If you want to save energy, you might want to replace them sooner. Ovens and stoves last ten to fifteen years before you need to replace them. Dishwashers need to be replaced every eight to ten years. Unplug small appliances when you are not using them. Small appliances like toasters and coffee makers will draw energy whenever they are plugged in, even if you are not using them. If the temperature rises unexpectedly or these appliances are not in good working order, you could have a major fire risk. When you are not using your small appliances, remember to unplug them. Cleaning for Fire Safety Clean your cooking surfaces to get rid of grease. One of the simplest steps you can take to improve fire safety is cleaning your work surfaces. Your kitchen counter, stovetop and sink area should be cleaned regularly to reduce fire risk. Clean your range hoods. Grease tends to build up under range hoods and becomes a fire risk. To mitigate the risk of a fire starting under your range hood, you should clean it regularly. Clean your toaster and microwave oven. Small appliances like toasters and microwaves are often the start of kitchen fires. Crumbs gather at the bottom of your toaster. If the toaster is left on for too long or is defective, the crumbs could catch fire. To mitigate this risk, you should regularly clean these appliances. Avoid cooking on a dirty stove. If you let grease and grime build up on your kitchen stove and then start cooking, you are increasing the risk of a fire. As such, it is important to regularly clean your stovetop. Practice everyday kitchen safety. You should always stay in the kitchen when the stove is turned on, since many fires start when a stove is left on without anyone watching it. You should also follow stove guidelines when lighting the pilot light on your stove. When you are using grease, avoid very hot temperatures and avoid filling pots and pans too full with hot grease. Finally, you want to wear a cooking apron or other sensible clothing and keep your sleeves and hair away from heat sources while you are cooking.",
  "tyn_model":[
    "stove",
    "cabinets",
    "toaster",
    "smoke alarm",
    "microwave",
    "cleaning products",
    "pot holders",
    "oven mitts",
    "toasters",
    "fire extinguisher",
    "extinguisher",
    "container",
    "appliances",
    "fire retardant poly sheeting",
    "appliance company",
    "appliance recall alerts",
    "kitchen appliance recall",
    "safer products",
    "fridge",
    "refrigerators",
    "ovens",
    "stoves",
    "dishwashers",
    "microwave oven",
    "microwaves",
    "stovetop",
    "pots"
  ],
  "tyn_section":[

  ]
}