{
  "title":"How to Clean a Toilet Tank",
  "url":"https://www.wikihow.com/Clean-a-Toilet-Tank",
  "category_hierarchy":[
    "Home and Garden",
    "Home Maintenance",
    "Bathrooms"
  ],
  "parts":[
    {
      "name":"Applying Your Cleaner",
      "steps":[
        {
          "headline":"Drain the tank.",
          "description":"To drain the tank, switch off the water. You can find the valve near the wall behind your toilet. Once the water is switched off, flush your toilet. This should drain all the water from the tank."
        },
        {
          "headline":"Determine the proper type of cleaner.",
          "description":"Look at how dirty your tank is. If it seems relatively clean, all you need is a basic disinfectant. You can use the same spray you normally use in your bathroom. However, with built up debris, you need something stronger. If you notice hardened mineral deposits in the tank, opt for white vinegar. If there is a lot of gunk and mildew built up in the tank, clean it with bleach over a commercial cleaner."
        },
        {
          "headline":"Apply your cleaner accordingly.",
          "description":"With bleach and commercial cleaners, you can spray or pour the cleaners into the tank. Target the bottom and sides of the tank, paying particular attention to areas with built up dirt. Make sure to wear gloves when handling bleach."
        },
        {
          "headline":"Let vinegar sit to treat mineral deposits.",
          "description":"When dealing with mineral deposits, the process is slightly different. Pour white vinegar into the tank, up to the top of the overflow tube. Let the vinegar sit for 12 hours before flushing the toilet. After 12 hours have passed, flush the toilet and proceed with regular cleaning."
        }
      ]
    },
    {
      "name":"Cleaning Your Tank",
      "steps":[
        {
          "headline":"Put on gloves.",
          "description":"Toilets and bathrooms in general contain a lot of bacteria. Before cleaning your toilet tank, put on a pair of gloves. Rubber gloves will help protect you from bacteria and germs. If you're cleaning with bleach, gloves are vital to protect your skin."
        },
        {
          "headline":"Let your cleaner sit in the tank.",
          "description":"Leave your cleaner in the tank for a set amount of time. Most cleaners should be left on for 10 to 15 minutes. However, it's always a good idea to check the specific directions on your cleaner. Remember, vinegar should stay on for 12 hours before you proceed to clean the tank."
        },
        {
          "headline":"Scrub your cleaner into the tank.",
          "description":"Use a scrub brush, old toothbrush, or scrubby sponge to scrub the cleaner into your tank. Scrub down the sides and bottom of the tank until the toilet bowl smells fresh and you remove any obvious signs of dirt and built up grime. Clean the working parts of the tank as well, like the ball float and flapper."
        },
        {
          "headline":"Flush out the tank.",
          "description":"Once you've scrubbed the tank down, you can turn the water back on and flush the tank to rinse. If you've used bleach, add 1 gallon (3.8 L) of plain, cold water to the tank and then flush it. You may want to wear goggles to protect your eyes when adding water to a tank that had bleach in it."
        }
      ]
    },
    {
      "name":"Keeping Your Tank Clean",
      "steps":[
        {
          "headline":"Remove mineral deposits periodically.",
          "description":"Mineral deposits will eventually build up in any toilet tank. Check your tank once a week and if you notice any deposits, treat the tank with white vinegar. Fill the tank with vinegar, let it sit for 12 hours, then flush and clean the tank."
        },
        {
          "headline":"Be careful with tank tablets.",
          "description":"Stores often sell tank tablets, meant to be placed in your tank to help it smelling fresh. However, if you do use tablets, stay away from tablets that contain bleach. These can erode and damage the inside of your tank. If you clean your toilet tank regularly, tablets are probably not necessary."
        },
        {
          "headline":"Establish a cleaning routine.",
          "description":"Many people remember to clean their toilet regularly, but neglect the toilet tank. Make sure not to fall into this trap. At least once a month, give your toilet tank a good cleaning. This will keep your bathroom smelling clean and fresh."
        }
      ]
    }
  ],
  "text":" Applying Your Cleaner Drain the tank. To drain the tank, switch off the water. You can find the valve near the wall behind your toilet. Once the water is switched off, flush your toilet. This should drain all the water from the tank. Determine the proper type of cleaner. Look at how dirty your tank is. If it seems relatively clean, all you need is a basic disinfectant. You can use the same spray you normally use in your bathroom. However, with built up debris, you need something stronger. If you notice hardened mineral deposits in the tank, opt for white vinegar. If there is a lot of gunk and mildew built up in the tank, clean it with bleach over a commercial cleaner. Apply your cleaner accordingly. With bleach and commercial cleaners, you can spray or pour the cleaners into the tank. Target the bottom and sides of the tank, paying particular attention to areas with built up dirt. Make sure to wear gloves when handling bleach. Let vinegar sit to treat mineral deposits. When dealing with mineral deposits, the process is slightly different. Pour white vinegar into the tank, up to the top of the overflow tube. Let the vinegar sit for 12 hours before flushing the toilet. After 12 hours have passed, flush the toilet and proceed with regular cleaning. Cleaning Your Tank Put on gloves. Toilets and bathrooms in general contain a lot of bacteria. Before cleaning your toilet tank, put on a pair of gloves. Rubber gloves will help protect you from bacteria and germs. If you're cleaning with bleach, gloves are vital to protect your skin. Let your cleaner sit in the tank. Leave your cleaner in the tank for a set amount of time. Most cleaners should be left on for 10 to 15 minutes. However, it's always a good idea to check the specific directions on your cleaner. Remember, vinegar should stay on for 12 hours before you proceed to clean the tank. Scrub your cleaner into the tank. Use a scrub brush, old toothbrush, or scrubby sponge to scrub the cleaner into your tank. Scrub down the sides and bottom of the tank until the toilet bowl smells fresh and you remove any obvious signs of dirt and built up grime. Clean the working parts of the tank as well, like the ball float and flapper. Flush out the tank. Once you've scrubbed the tank down, you can turn the water back on and flush the tank to rinse. If you've used bleach, add 1 gallon (3.8 L) of plain, cold water to the tank and then flush it. You may want to wear goggles to protect your eyes when adding water to a tank that had bleach in it. Keeping Your Tank Clean Remove mineral deposits periodically. Mineral deposits will eventually build up in any toilet tank. Check your tank once a week and if you notice any deposits, treat the tank with white vinegar. Fill the tank with vinegar, let it sit for 12 hours, then flush and clean the tank. Be careful with tank tablets. Stores often sell tank tablets, meant to be placed in your tank to help it smelling fresh. However, if you do use tablets, stay away from tablets that contain bleach. These can erode and damage the inside of your tank. If you clean your toilet tank regularly, tablets are probably not necessary. Establish a cleaning routine. Many people remember to clean their toilet regularly, but neglect the toilet tank. Make sure not to fall into this trap. At least once a month, give your toilet tank a good cleaning. This will keep your bathroom smelling clean and fresh.",
  "tyn_model":[
    "water",
    "bleach",
    "cleaner",
    "vinegar",
    "white vinegar",
    "cleaners",
    "gloves",
    "rubber gloves",
    "scrub brush",
    "scrubby sponge",
    "toilet bowl",
    "toilet tank"
  ],
  "tyn_section":[

  ]
}