{
  "title":"How to Clean a Stainless Steel Stove",
  "url":"https://www.wikihow.com/Clean-a-Stainless-Steel-Stove",
  "category_hierarchy":[
    "Home and Garden",
    "Housekeeping",
    "Cleaning"
  ],
  "methods":[
    {
      "name":"Doing Preliminary Work",
      "steps":[
        {
          "headline":"Read the owner's manual.",
          "description":"Before cleaning your stove, it's always a good idea to read the owner's manual if you still have it. Some stainless steel stoves may come with specific cleaning instructions. Certain cleaners may damage some types of stainless steel. If you have your stove's instruction manual, give it a thorough read through before cleaning your stove."
        },
        {
          "headline":"Determine the direction of the grain.",
          "description":"Look at your stove closely. You should see small lines running across the stove. The lines will either run horizontally or vertically. When cleaning, it's important you move in the direction the grain runs. This helps prevent scratching and other damage."
        },
        {
          "headline":"Remove initial debris of vinegar.",
          "description":"Place some vinegar in a spray bottle. Liberally spritz the surface of the stove with vinegar. Use a paper towel or a very soft cloth to wipe down the stove, catching any obvious dirt and debris in your hands. Remember the directions in your owner's manual. If you are not supposed to use vinegar on your stove, choose another mild cleanser."
        },
        {
          "headline":"Mix a cleaning solution.",
          "description":"Most stainless steel stoves can be cleaned with mild dishwashing detergent. Mix a teaspoon of dish detergent into a quart of hot water. It is not necessary to use bottled or distilled water. Tap water can easily be used on stainless steel. Make sure to wear gloves to protect your hands from hot water."
        }
      ]
    },
    {
      "name":"Cleaning Your Stove",
      "steps":[
        {
          "headline":"Wipe down your appliances in the direction of the grain.",
          "description":"Get a washcloth slightly damp and then wipe down your stove. Start at the top of your stove and work your way downwards as you clean. Remember to clean in the direction of the grain. Vertical grains should be wiped down vertically and horizontal grains should be wiped down horizontally."
        },
        {
          "headline":"Apply a special cleaner for harsh stains.",
          "description":"After giving your stone an initial cleaning with your detergent solution, look for any harsh stains. If there is any splattered food or grease on your stove, use a special cleaner to remove it. Cleaners containing oxalic acid are usually the best course of action for a stainless steel stove. However, you should double check your owner's manual to make sure such cleaners are safe for your stove. When applying a cleaner on dirt and grease stains, remember to move your rag in the direction of the grain."
        },
        {
          "headline":"Rinse and dry your stove.",
          "description":"After applying cleaners, rinse your stove off completely. Dampen a clean wash cloth with hot water. Run it over the stove, moving in the direction of the grain, until the water runs clear. Immediately dry your stove with a paper towel or cloth. It's very important to use hot water only to rinse off a stainless steel stove."
        },
        {
          "headline":"Shine with oil.",
          "description":"To give your stove a nice shine after cleaning, dip a soft cloth in a small amount of oil, such as mineral or olive oil. Moving in the direction of the grain, give your stove a quick polishing. This will remove any streaks from the cleaning process and leave your stove shiny."
        }
      ]
    },
    {
      "name":"Avoiding Common Mistakes",
      "steps":[
        {
          "headline":"Avoid abrasive brushes or cleaners.",
          "description":"Only use paper towel and soft cloths on a stainless steel stove. Harsh, abrasive brushes, like steel wool, will very easily scratch stainless steel."
        },
        {
          "headline":"Do not use any kind of bleach.",
          "description":"Bleach of any kind should never be used on stainless steel. Chloride products and oven cleaners often contain bleach, which can seriously damage stainless steel."
        },
        {
          "headline":"Do not clean your stove when it's hot.",
          "description":"If you just cooked on your stove, avoid cleaning it until it cools down. Wait until your stove is cool to the touch before applying a cleaner."
        },
        {
          "headline":"Don't leave a mess on the stove.",
          "description":"To keep your stove clean, wipe it down after every use and avoid letting food spills sit on the stove. The longer the food stays on the stainless steel, the more likely it is to stain it. Wiping down your stove after every use will also help you to avoid needing harsh cleansers to clean your stove."
        }
      ]
    }
  ],
  "text":" Doing Preliminary Work Read the owner's manual. Before cleaning your stove, it's always a good idea to read the owner's manual if you still have it. Some stainless steel stoves may come with specific cleaning instructions. Certain cleaners may damage some types of stainless steel. If you have your stove's instruction manual, give it a thorough read through before cleaning your stove. Determine the direction of the grain. Look at your stove closely. You should see small lines running across the stove. The lines will either run horizontally or vertically. When cleaning, it's important you move in the direction the grain runs. This helps prevent scratching and other damage. Remove initial debris of vinegar. Place some vinegar in a spray bottle. Liberally spritz the surface of the stove with vinegar. Use a paper towel or a very soft cloth to wipe down the stove, catching any obvious dirt and debris in your hands. Remember the directions in your owner's manual. If you are not supposed to use vinegar on your stove, choose another mild cleanser. Mix a cleaning solution. Most stainless steel stoves can be cleaned with mild dishwashing detergent. Mix a teaspoon of dish detergent into a quart of hot water. It is not necessary to use bottled or distilled water. Tap water can easily be used on stainless steel. Make sure to wear gloves to protect your hands from hot water. Cleaning Your Stove Wipe down your appliances in the direction of the grain. Get a washcloth slightly damp and then wipe down your stove. Start at the top of your stove and work your way downwards as you clean. Remember to clean in the direction of the grain. Vertical grains should be wiped down vertically and horizontal grains should be wiped down horizontally. Apply a special cleaner for harsh stains. After giving your stone an initial cleaning with your detergent solution, look for any harsh stains. If there is any splattered food or grease on your stove, use a special cleaner to remove it. Cleaners containing oxalic acid are usually the best course of action for a stainless steel stove. However, you should double check your owner's manual to make sure such cleaners are safe for your stove. When applying a cleaner on dirt and grease stains, remember to move your rag in the direction of the grain. Rinse and dry your stove. After applying cleaners, rinse your stove off completely. Dampen a clean wash cloth with hot water. Run it over the stove, moving in the direction of the grain, until the water runs clear. Immediately dry your stove with a paper towel or cloth. It's very important to use hot water only to rinse off a stainless steel stove. Shine with oil. To give your stove a nice shine after cleaning, dip a soft cloth in a small amount of oil, such as mineral or olive oil. Moving in the direction of the grain, give your stove a quick polishing. This will remove any streaks from the cleaning process and leave your stove shiny. Avoiding Common Mistakes Avoid abrasive brushes or cleaners. Only use paper towel and soft cloths on a stainless steel stove. Harsh, abrasive brushes, like steel wool, will very easily scratch stainless steel. Do not use any kind of bleach. Bleach of any kind should never be used on stainless steel. Chloride products and oven cleaners often contain bleach, which can seriously damage stainless steel. Do not clean your stove when it's hot. If you just cooked on your stove, avoid cleaning it until it cools down. Wait until your stove is cool to the touch before applying a cleaner. Don't leave a mess on the stove. To keep your stove clean, wipe it down after every use and avoid letting food spills sit on the stove. The longer the food stays on the stainless steel, the more likely it is to stain it. Wiping down your stove after every use will also help you to avoid needing harsh cleansers to clean your stove.",
  "tyn_model":[
    "stove",
    "vinegar",
    "water",
    "cleaner",
    "bleach",
    "stainless steel stoves",
    "hot water",
    "stainless steel stove",
    "oil",
    "spray bottle",
    "cleaning solution",
    "dishwashing detergent",
    "dish detergent",
    "tap water",
    "washcloth",
    "detergent solution",
    "oxalic acid",
    "mineral or olive oil",
    "paper towel",
    "oven cleaners",
    "stainless steel",
    "cleansers"
  ],
  "tyn_section":[

  ]
}