{
  "title":"How to Cook Chicken and Rice",
  "url":"https://www.wikihow.com/Cook-Chicken-and-Rice",
  "category_hierarchy":[
    "Food and Entertaining",
    "Recipes",
    "Meat",
    "Poultry Recipes",
    "Chicken"
  ],
  "parts":[
    {
      "name":"Making Basic Chicken and Rice",
      "steps":[
        {
          "headline":"Prepare the chicken.",
          "description":"Remove the neck and organs from the cavity if they are present. You can either add the neck and gizzards in with the water to cook the chicken, or you can use them in another stock later."
        },
        {
          "headline":"Boil the chicken with the vegetables.",
          "description":"Place the whole chicken in a large stockpot along with the celery, onion, oregano, celery salt, and water. Add half the pepper, half the salt, and 1 teaspoon (5 g) of the parsley. Reserve the remaining herbs and spices for later. Depending on the size of the chicken and the pot, you may not need the full amount of water. Add enough water to cover the chicken plus an additional inch (2.5 cm) of water."
        },
        {
          "headline":"Cook the chicken.",
          "description":"Bring the chicken to a boil over medium\u2013high heat. When it starts to boil, reduce the heat to low or medium\u2013low. Put a lid on the pot and simmer the chicken for about two hours. You can get away with cooking the chicken for an hour, but the longer you cook it, the more tender it will become. Cook the chicken for up to three hours if possible."
        },
        {
          "headline":"Remove the chicken from the pot.",
          "description":"Use a heavy-duty slotted spoon to remove the chicken from the stock. Hold the chicken over the pot for a moment to allow the excess liquid to drain off. Transfer the chicken to a plate. Allow the chicken to rest until it\u2019s cool enough to handle. Leave the remaining stock on medium\u2013low heat."
        },
        {
          "headline":"Debone the chicken.",
          "description":"When the chicken has cooled enough that it\u2019s safe to touch, use your fingers to remove the meat from the bone. As long as the meat has been cooked long enough, it will fall off the bone easily. Place the meat into a second large saucepan or stockpot."
        },
        {
          "headline":"Cook the rice and chicken in the stock.",
          "description":"Place the rice and the remaining herbs and spices into the stockpot with the chicken meat. Add 6 cups (1.44 L) of the hot broth that you used to boil the chicken. Put a lid on the pot and heat the mixture over medium\u2013high heat. Bring it to a simmer and let it simmer for 15 minutes. Continue keeping the original pot of broth warm on the stove."
        },
        {
          "headline":"Add more broth until the rice is cooked.",
          "description":"Stir in a cup of broth and return the mixture to a simmer for five minutes. Continue adding broth in one-cup increments and cooking the rice for an additional five minutes until the rice is soft and creamy. When the rice is finished cooking, you can stir in 6 tablespoons (84.6 g) of butter to make it even creamier."
        },
        {
          "headline":"Serve hot.",
          "description":"When the rice is fully cooked, add salt and pepper to taste before serving. Basic chicken and rice can be served as a main meal or a side dish. If there's any broth left over, you can freeze it and save it to make soup or rice later on. Store the broth in an air-tight container in the freezer, and it will last for up to six months."
        }
      ]
    },
    {
      "name":"Baking a Chicken and Rice Casserole",
      "steps":[
        {
          "headline":"Preheat your oven.",
          "description":"Set your oven to 375 F (191 C). This is a simple and convenient one-dish meal, and it requires very little preparation and equipment. Aside from a stirring spoon, you only need an 8-by-11-inch baking dish."
        },
        {
          "headline":"Fill a baking dish with the ingredients.",
          "description":"Place the water, rice, soup, and spices in the baking dish and stir to incorporate. Lay the chicken breasts on top of the rice. Be sure to spread them out so they don\u2019t overlap, otherwise they won\u2019t cook evenly. Instead of mushroom soup, you can use an alternative cream soup or a combination of mushroom, celery, and chicken. For a more traditional style chicken and rice, you can also cut the chicken into bite-sized pieces and mix it in with the other ingredients."
        },
        {
          "headline":"Season and cover the dish.",
          "description":"Season the top of the chicken with additional pepper and paprika, to taste. Cover the dish with either a lid or a sheet of tin foil. You can also sprinkle other spices on top of the chicken, such as:\nRosemary\nMarjoram\nOregano\nTarragon\nChili powder\nSage"
        },
        {
          "headline":"Bake the casserole.",
          "description":"Bake the covered casserole for about 45 minutes, until the chicken and rice are cooked. Chicken is cooked when it reaches an internal temperature of 167 F (75 C). If you don\u2019t have a thermometer, cut open one of the chicken breasts and make sure there's no pink left in the meat."
        },
        {
          "headline":"Allow to cool before serving.",
          "description":"Let the casserole rest for 10 to 15 minutes before serving. Then, remove the chicken from the dish and portion it out. Add a few spoonfuls of rice to each dish as well. A proper portion of chicken is about four ounces (113 g), which is roughly the size of a deck of cards or an iPhone."
        }
      ]
    },
    {
      "name":"Making Spanish-Style Chicken and Rice",
      "steps":[
        {
          "headline":"Heat the oil.",
          "description":"Pour the oil into a large saucepan and heat it over medium heat. This dish, called Arroz con Pollo in Spanish, is another convenient one-dish meal that you make in a large saucepan. Make sure the saucepan you're using has a lid so that you can cover the dish as it cooks."
        },
        {
          "headline":"Cut and season the chicken.",
          "description":"With a sharp knife, carefully cut the chicken into 2.5-inch (6.4-cm) cubes. Place the chicken into a bowl and season it with salt and pepper, to taste. If you're unsure about the salt and pepper ratios, use \u00bd teaspoon (2.5 g) salt and \u00bc teaspoon (1.25 g) pepper."
        },
        {
          "headline":"Brown the chicken.",
          "description":"When the oil is hot, add the chicken pieces and cook for about two minutes per side, or until the meat is golden brown. When the oil is hot and ready, the surface will shimmer and glisten like wind blowing across the surface of a pond."
        },
        {
          "headline":"Add vegetables.",
          "description":"Stir in the onion and bell pepper. Cook these for about five minutes, stirring frequently, until they're soft. Then add the garlic and cook for an additional minute. Don\u2019t cook the garlic for longer than a minute, or it could burn and become bitter."
        },
        {
          "headline":"Add the wine, tomatoes, and rice.",
          "description":"Pour in all the juice from the tomatoes as well. Season with more salt and pepper, to taste, or use the same ratios as before. Bring the mixture to a boil, then lower the heat and simmer for 20 minutes. After the mixture comes to a boil, place a lid on it while it simmers. A good dry wine for cooking chicken and vegetables is a chardonnay or sauvignon blanc."
        },
        {
          "headline":"Add the peas.",
          "description":"After 20 minutes of simmering, add the peas. Put the lid back on, and continue simmering for a few minutes to heat the peas through. This will take about two minutes. Once the peas are heated, remove the saucepan from the heat."
        },
        {
          "headline":"Finish with olives and parsley before serving.",
          "description":"Stir in the olives while the dish is still piping hot so they warm up. Then, spoon individual portions into bowls or plates, and garnish each with a sprinkle of parsley."
        }
      ]
    }
  ],
  "text":" Making Basic Chicken and Rice Prepare the chicken. Remove the neck and organs from the cavity if they are present. You can either add the neck and gizzards in with the water to cook the chicken, or you can use them in another stock later. Boil the chicken with the vegetables. Place the whole chicken in a large stockpot along with the celery, onion, oregano, celery salt, and water. Add half the pepper, half the salt, and 1 teaspoon (5 g) of the parsley. Reserve the remaining herbs and spices for later. Depending on the size of the chicken and the pot, you may not need the full amount of water. Add enough water to cover the chicken plus an additional inch (2.5 cm) of water. Cook the chicken. Bring the chicken to a boil over medium\u2013high heat. When it starts to boil, reduce the heat to low or medium\u2013low. Put a lid on the pot and simmer the chicken for about two hours. You can get away with cooking the chicken for an hour, but the longer you cook it, the more tender it will become. Cook the chicken for up to three hours if possible. Remove the chicken from the pot. Use a heavy-duty slotted spoon to remove the chicken from the stock. Hold the chicken over the pot for a moment to allow the excess liquid to drain off. Transfer the chicken to a plate. Allow the chicken to rest until it\u2019s cool enough to handle. Leave the remaining stock on medium\u2013low heat. Debone the chicken. When the chicken has cooled enough that it\u2019s safe to touch, use your fingers to remove the meat from the bone. As long as the meat has been cooked long enough, it will fall off the bone easily. Place the meat into a second large saucepan or stockpot. Cook the rice and chicken in the stock. Place the rice and the remaining herbs and spices into the stockpot with the chicken meat. Add 6 cups (1.44 L) of the hot broth that you used to boil the chicken. Put a lid on the pot and heat the mixture over medium\u2013high heat. Bring it to a simmer and let it simmer for 15 minutes. Continue keeping the original pot of broth warm on the stove. Add more broth until the rice is cooked. Stir in a cup of broth and return the mixture to a simmer for five minutes. Continue adding broth in one-cup increments and cooking the rice for an additional five minutes until the rice is soft and creamy. When the rice is finished cooking, you can stir in 6 tablespoons (84.6 g) of butter to make it even creamier. Serve hot. When the rice is fully cooked, add salt and pepper to taste before serving. Basic chicken and rice can be served as a main meal or a side dish. If there's any broth left over, you can freeze it and save it to make soup or rice later on. Store the broth in an air-tight container in the freezer, and it will last for up to six months. Baking a Chicken and Rice Casserole Preheat your oven. Set your oven to 375 F (191 C). This is a simple and convenient one-dish meal, and it requires very little preparation and equipment. Aside from a stirring spoon, you only need an 8-by-11-inch baking dish. Fill a baking dish with the ingredients. Place the water, rice, soup, and spices in the baking dish and stir to incorporate. Lay the chicken breasts on top of the rice. Be sure to spread them out so they don\u2019t overlap, otherwise they won\u2019t cook evenly. Instead of mushroom soup, you can use an alternative cream soup or a combination of mushroom, celery, and chicken. For a more traditional style chicken and rice, you can also cut the chicken into bite-sized pieces and mix it in with the other ingredients. Season and cover the dish. Season the top of the chicken with additional pepper and paprika, to taste. Cover the dish with either a lid or a sheet of tin foil. You can also sprinkle other spices on top of the chicken, such as:\nRosemary\nMarjoram\nOregano\nTarragon\nChili powder\nSage Bake the casserole. Bake the covered casserole for about 45 minutes, until the chicken and rice are cooked. Chicken is cooked when it reaches an internal temperature of 167 F (75 C). If you don\u2019t have a thermometer, cut open one of the chicken breasts and make sure there's no pink left in the meat. Allow to cool before serving. Let the casserole rest for 10 to 15 minutes before serving. Then, remove the chicken from the dish and portion it out. Add a few spoonfuls of rice to each dish as well. A proper portion of chicken is about four ounces (113 g), which is roughly the size of a deck of cards or an iPhone. Making Spanish-Style Chicken and Rice Heat the oil. Pour the oil into a large saucepan and heat it over medium heat. This dish, called Arroz con Pollo in Spanish, is another convenient one-dish meal that you make in a large saucepan. Make sure the saucepan you're using has a lid so that you can cover the dish as it cooks. Cut and season the chicken. With a sharp knife, carefully cut the chicken into 2.5-inch (6.4-cm) cubes. Place the chicken into a bowl and season it with salt and pepper, to taste. If you're unsure about the salt and pepper ratios, use \u00bd teaspoon (2.5 g) salt and \u00bc teaspoon (1.25 g) pepper. Brown the chicken. When the oil is hot, add the chicken pieces and cook for about two minutes per side, or until the meat is golden brown. When the oil is hot and ready, the surface will shimmer and glisten like wind blowing across the surface of a pond. Add vegetables. Stir in the onion and bell pepper. Cook these for about five minutes, stirring frequently, until they're soft. Then add the garlic and cook for an additional minute. Don\u2019t cook the garlic for longer than a minute, or it could burn and become bitter. Add the wine, tomatoes, and rice. Pour in all the juice from the tomatoes as well. Season with more salt and pepper, to taste, or use the same ratios as before. Bring the mixture to a boil, then lower the heat and simmer for 20 minutes. After the mixture comes to a boil, place a lid on it while it simmers. A good dry wine for cooking chicken and vegetables is a chardonnay or sauvignon blanc. Add the peas. After 20 minutes of simmering, add the peas. Put the lid back on, and continue simmering for a few minutes to heat the peas through. This will take about two minutes. Once the peas are heated, remove the saucepan from the heat. Finish with olives and parsley before serving. Stir in the olives while the dish is still piping hot so they warm up. Then, spoon individual portions into bowls or plates, and garnish each with a sprinkle of parsley.",
  "tyn_model":[
    "chicken",
    "rice",
    "water",
    "pot",
    "spices",
    "broth",
    "salt and pepper",
    "oil",
    "peas",
    "pepper",
    "parsley",
    "stock",
    "large saucepan",
    "baking dish",
    "vegetables",
    "celery",
    "onion",
    "oregano",
    "salt",
    "herbs",
    "\u2013high",
    "\u2013low",
    "stockpot",
    "oven",
    "saucepan",
    "garlic",
    "tomatoes",
    "olives",
    "large stockpot",
    "celery salt",
    "heavy-duty slotted spoon",
    "plate",
    "hot broth",
    "stove",
    "butter",
    "air-tight container",
    "freezer",
    "stirring spoon",
    "soup",
    "mushroom soup",
    "cream soup",
    "mushroom",
    "paprika",
    "tin foil",
    "rosemary",
    "marjoram",
    "tarragon",
    "sage",
    "knife",
    "bowl",
    "bell pepper",
    "wine",
    "bowls",
    "plates"
  ],
  "tyn_section":[

  ]
}