{
  "title":"How to Use Chinese Pearl Barley",
  "url":"https://www.wikihow.com/Use-Chinese-Pearl-Barley",
  "category_hierarchy":[
    "Food and Entertaining",
    "Recipes",
    "World Cuisines",
    "Asian Cuisine",
    "Chinese Dishes"
  ],
  "methods":[
    {
      "name":"Cooking the Barley",
      "steps":[
        {
          "headline":"Soak 1 cup (240 ml) of barley in water.",
          "description":"Place the barley in a bowl or pot and add water. Make sure the water covers the barley completely. Let the barley soak in the water for 30 minutes to an hour. Then drain the water. A cup (240 ml) of barley yields three cups (709.8 ml) of cooked barley."
        },
        {
          "headline":"Bring 2 cups (475 ml) of water to a boil in a pot.",
          "description":"Place the pot on the burner and turn the heat setting to medium-high. Once the water reaches a rolling boil, add the barley and 1 teaspoon (5 ml) of salt. Use a spoon to mix the barley, salt, and water together. Then set the spoon aside and wait for the mixture to come to a rolling boil again."
        },
        {
          "headline":"Reduce the heat to a simmer.",
          "description":"Then let the barley simmer for 30 minutes or until it is cooked through. Chinese pearl barley is plump and has a chewy, al dente texture once it is cooked."
        },
        {
          "headline":"Remove it from the heat.",
          "description":"Then drain the water. You can either throw out the water, or save it to make a broth or a refreshing drink later. Do not rinse the barley again once it is cooked."
        },
        {
          "headline":"Store the barley.",
          "description":"You can make Chinese pearl barley ahead of time and store it in the fridge for future meals. Place the barley in an airtight container and store it in the fridge for up to a week. If you made a large batch, you can store a portion in the freezer for up to a month."
        }
      ]
    },
    {
      "name":"Incorporating It into Recipes",
      "steps":[
        {
          "headline":"Add it to soups.",
          "description":"Chinese pearl barley is a great addition to chicken, pork, beef, and coconut soups. But it is not limited to these types of soups. You can add it to any soup of your liking. For example, you can replace the rice in chicken tortilla soup with Chinese pearl barley. Additionally, you can add Chinese pearl barley to bean and vegetable soups."
        },
        {
          "headline":"Incorporate it into salads.",
          "description":"Adding Chinese pearl barley to salads is a great way to turn your salad into a hearty salad. Just add the barley to your favorite salad and enjoy. For example, add Chinese pearl barley to an avocado salad. Additionally, add it to a chicken, corn, and lettuce salad."
        },
        {
          "headline":"Use it in place of other grains.",
          "description":"Replace grains like hominy, rice, and regular barley with Chinese pearl barley. Simply replace the grain in your favorite recipe with Chinese pearl barley. For example, make pozole with Chinese pearl barley instead of hominy. You can also make mushroom barley soup with Chinese pearl barley instead of regular barley."
        }
      ]
    },
    {
      "name":"Making Barley Water",
      "steps":[
        {
          "headline":"Rinse 1 cup (240 ml) of barley.",
          "description":"Then soak it in 1 liter (4 cups) of water for one to two hours in a pot. Once it is done soaking, transfer the pot to the stove and turn on the heat to medium-high. Make sure to use a cooking pot, or transfer the contents to a cooking pot after the barley has finished soaking. Do not drain the water that is used to soak the barley. Use this water to cook the barley as well."
        },
        {
          "headline":"Bring the water and barley to a boil.",
          "description":"Once the contents reach a rolling boil, reduce the heat. Let the contents simmer for 30 minutes to 1 hour, or until it is cooked through. You do not need to cover the pot with a lid while it is simmering."
        },
        {
          "headline":"Strain the liquid into a pitcher.",
          "description":"Then add sugar or honey to taste. You can also add the juice of 1 lemon and/or 1 tablespoon (15 ml) of chopped mint leaves to add flavor. Serve hot or chilled. Store any unused liquid in the fridge for up to three days. Additionally, store the cooked barley in the fridge to use in recipes or to eat as is."
        }
      ]
    }
  ],
  "text":" Cooking the Barley Soak 1 cup (240 ml) of barley in water. Place the barley in a bowl or pot and add water. Make sure the water covers the barley completely. Let the barley soak in the water for 30 minutes to an hour. Then drain the water. A cup (240 ml) of barley yields three cups (709.8 ml) of cooked barley. Bring 2 cups (475 ml) of water to a boil in a pot. Place the pot on the burner and turn the heat setting to medium-high. Once the water reaches a rolling boil, add the barley and 1 teaspoon (5 ml) of salt. Use a spoon to mix the barley, salt, and water together. Then set the spoon aside and wait for the mixture to come to a rolling boil again. Reduce the heat to a simmer. Then let the barley simmer for 30 minutes or until it is cooked through. Chinese pearl barley is plump and has a chewy, al dente texture once it is cooked. Remove it from the heat. Then drain the water. You can either throw out the water, or save it to make a broth or a refreshing drink later. Do not rinse the barley again once it is cooked. Store the barley. You can make Chinese pearl barley ahead of time and store it in the fridge for future meals. Place the barley in an airtight container and store it in the fridge for up to a week. If you made a large batch, you can store a portion in the freezer for up to a month. Incorporating It into Recipes Add it to soups. Chinese pearl barley is a great addition to chicken, pork, beef, and coconut soups. But it is not limited to these types of soups. You can add it to any soup of your liking. For example, you can replace the rice in chicken tortilla soup with Chinese pearl barley. Additionally, you can add Chinese pearl barley to bean and vegetable soups. Incorporate it into salads. Adding Chinese pearl barley to salads is a great way to turn your salad into a hearty salad. Just add the barley to your favorite salad and enjoy. For example, add Chinese pearl barley to an avocado salad. Additionally, add it to a chicken, corn, and lettuce salad. Use it in place of other grains. Replace grains like hominy, rice, and regular barley with Chinese pearl barley. Simply replace the grain in your favorite recipe with Chinese pearl barley. For example, make pozole with Chinese pearl barley instead of hominy. You can also make mushroom barley soup with Chinese pearl barley instead of regular barley. Making Barley Water Rinse 1 cup (240 ml) of barley. Then soak it in 1 liter (4 cups) of water for one to two hours in a pot. Once it is done soaking, transfer the pot to the stove and turn on the heat to medium-high. Make sure to use a cooking pot, or transfer the contents to a cooking pot after the barley has finished soaking. Do not drain the water that is used to soak the barley. Use this water to cook the barley as well. Bring the water and barley to a boil. Once the contents reach a rolling boil, reduce the heat. Let the contents simmer for 30 minutes to 1 hour, or until it is cooked through. You do not need to cover the pot with a lid while it is simmering. Strain the liquid into a pitcher. Then add sugar or honey to taste. You can also add the juice of 1 lemon and/or 1 tablespoon (15 ml) of chopped mint leaves to add flavor. Serve hot or chilled. Store any unused liquid in the fridge for up to three days. Additionally, store the cooked barley in the fridge to use in recipes or to eat as is.",
  "tyn_model":[
    "barley",
    "water",
    "chinese pearl barley",
    "pot",
    "salt",
    "spoon",
    "rice",
    "cooking pot",
    "bowl",
    "airtight container",
    "mushroom barley soup",
    "pearl barley",
    "stove",
    "pitcher",
    "sugar",
    "honey",
    "lemon"
  ],
  "tyn_section":[

  ]
}