{
  "title":"How to Clean Dungeness Crab",
  "url":"https://www.wikihow.com/Clean-Dungeness-Crab",
  "category_hierarchy":[
    "Food and Entertaining",
    "Recipes",
    "Fish and Seafood",
    "Crab"
  ],
  "parts":[
    {
      "name":"Cooking the Crab",
      "steps":[
        {
          "headline":"Bring water to a boil.",
          "description":"Before you can clean and serve a Dungeness crab, it must be cooked. If you have purchased your crabs live, you\u2019ll need to be begin by bringing a large pot of water (enough that the crabs are completely submerged) to a rolling boil."
        },
        {
          "headline":"Boil the crab.",
          "description":"Carefully drop your crabs into the water and allow it to return to a boil. Once it is boiling again, start your timer. You want to boil the crabs for 7-8 minutes per pound."
        },
        {
          "headline":"Drain crabs.",
          "description":"You will be able to tell that your crabs are cooked because their shells should have turned from a blue/grey color to a bright orange hue. Once cooks, pour the pot of water over a colander to drain the crabs."
        },
        {
          "headline":"Rinse under cool water.",
          "description":"After your crabs have been drained, run cool water over them. Do this until they are cool enough to handle with bare hands. If you will be serving them right away, be careful not to make them too cool."
        }
      ]
    },
    {
      "name":"Cleaning the Crab",
      "steps":[
        {
          "headline":"Remove the \u201capron.\u201d Place the crab on a clean work surface, belly side up.",
          "description":"Then carefully remove the triangular shaped flap, known as the \u201capron.\u201d Discard this. If there is liquid inside the crab, drain this now."
        },
        {
          "headline":"Remove the \u201ccarapace.\u201d Holding the crab vertically, gently pull the top shell (or carapace) away from the body, using your thumb and fingers, until it comes off.",
          "description":"You can wash the top shell and set it aside, in case you want to use in your presentation."
        },
        {
          "headline":"Discard the gills and mouth.",
          "description":"With the crab on your work surface belly side down, carefully pull off the spongy gills and mouth on the front of the crab. Discard these."
        },
        {
          "headline":"Rinse the body.",
          "description":"After you have discarded all the unnecessary parts, hold the body under running water to remove any dark matter or debris. Be careful not to remove any of the meat while doing so."
        },
        {
          "headline":"Break the crab in half.",
          "description":"With the crab belly side down, grab it on either side using both of your hands. Using a firm motion, push down on both sides and crack the crab in half."
        },
        {
          "headline":"Remove the legs.",
          "description":"Insert your thumb and forefinger at each leg joint, and twist off each claw and leg. You should remove a bit of the body with each leg. Then, using a mallet, small hammer, or the flat side of a meat tenderizer, crack the legs at each joint."
        }
      ]
    },
    {
      "name":"Presenting the Meal",
      "steps":[
        {
          "headline":"Select your sauce.",
          "description":"If you will be serving the crab cold, your best choices of sauce include cocktail sauce, fresh lemon wedges, garlic aioli, or Russian dressing. If you\u2019ll be serving your crab hot, instead opt for melted butter, lemon, or garlic butter. If serving cold, chill in refrigerator until ready. If serving hot, serve immediately or re-steam just before serving."
        },
        {
          "headline":"Place legs on a plate.",
          "description":"If you will be serving just the crab legs, arrange these on individual plates. Include your choice of sauce in a ramekin, a wedge of lemon, and a sprig of parsley on each plate."
        },
        {
          "headline":"Serve the whole crab.",
          "description":"If you plan to present the whole crab, arrange the legs just as they would appear on a live crab (with the body pieces toward the center). Then place the cleaned top shell (carapace) on top. You can still include sauce, lemon, and parsley."
        }
      ]
    }
  ],
  "text":" Cooking the Crab Bring water to a boil. Before you can clean and serve a Dungeness crab, it must be cooked. If you have purchased your crabs live, you\u2019ll need to be begin by bringing a large pot of water (enough that the crabs are completely submerged) to a rolling boil. Boil the crab. Carefully drop your crabs into the water and allow it to return to a boil. Once it is boiling again, start your timer. You want to boil the crabs for 7-8 minutes per pound. Drain crabs. You will be able to tell that your crabs are cooked because their shells should have turned from a blue/grey color to a bright orange hue. Once cooks, pour the pot of water over a colander to drain the crabs. Rinse under cool water. After your crabs have been drained, run cool water over them. Do this until they are cool enough to handle with bare hands. If you will be serving them right away, be careful not to make them too cool. Cleaning the Crab Remove the \u201capron.\u201d Place the crab on a clean work surface, belly side up. Then carefully remove the triangular shaped flap, known as the \u201capron.\u201d Discard this. If there is liquid inside the crab, drain this now. Remove the \u201ccarapace.\u201d Holding the crab vertically, gently pull the top shell (or carapace) away from the body, using your thumb and fingers, until it comes off. You can wash the top shell and set it aside, in case you want to use in your presentation. Discard the gills and mouth. With the crab on your work surface belly side down, carefully pull off the spongy gills and mouth on the front of the crab. Discard these. Rinse the body. After you have discarded all the unnecessary parts, hold the body under running water to remove any dark matter or debris. Be careful not to remove any of the meat while doing so. Break the crab in half. With the crab belly side down, grab it on either side using both of your hands. Using a firm motion, push down on both sides and crack the crab in half. Remove the legs. Insert your thumb and forefinger at each leg joint, and twist off each claw and leg. You should remove a bit of the body with each leg. Then, using a mallet, small hammer, or the flat side of a meat tenderizer, crack the legs at each joint. Presenting the Meal Select your sauce. If you will be serving the crab cold, your best choices of sauce include cocktail sauce, fresh lemon wedges, garlic aioli, or Russian dressing. If you\u2019ll be serving your crab hot, instead opt for melted butter, lemon, or garlic butter. If serving cold, chill in refrigerator until ready. If serving hot, serve immediately or re-steam just before serving. Place legs on a plate. If you will be serving just the crab legs, arrange these on individual plates. Include your choice of sauce in a ramekin, a wedge of lemon, and a sprig of parsley on each plate. Serve the whole crab. If you plan to present the whole crab, arrange the legs just as they would appear on a live crab (with the body pieces toward the center). Then place the cleaned top shell (carapace) on top. You can still include sauce, lemon, and parsley.",
  "tyn_model":[
    "crab",
    "water",
    "crabs",
    "lemon",
    "\u201capron",
    "parsley",
    "dungeness crab",
    "pot",
    "colander",
    "\u201d place",
    "\u201d discard",
    "\u201ccarapace",
    "\u201d holding",
    "mallet",
    "small hammer",
    "meat tenderizer",
    "cocktail sauce",
    "fresh lemon",
    "garlic aioli",
    "russian dressing",
    "melted butter",
    "garlic butter",
    "refrigerator",
    "plate",
    "crab legs",
    "plates",
    "ramekin",
    "sauce"
  ],
  "tyn_section":[

  ]
}