{
  "title":"How to Clean an Air Filter",
  "url":"https://www.wikihow.com/Clean-an-Air-Filter",
  "category_hierarchy":[
    "Home and Garden",
    "Housekeeping",
    "Cleaning"
  ],
  "methods":[
    {
      "name":"Cleaning a Car Air Filter",
      "steps":[
        {
          "headline":"Remove the filter.",
          "description":"Open the hood of your car. If you can\u2019t locate the filter, check the physical or online vehicle manual. Alternately, you can ask a mechanic the next time your vehicle is serviced. Open the canister (usually secured with wing nuts or clamps). Pull the filter out. The air filter\u2019s housing should be on top of the engine, in a round or rectangular box."
        },
        {
          "headline":"Vacuum a dry filter.",
          "description":"Connect a hose attachment to your vacuum cleaner. Vacuum the filter for about a minute on each side. Look at the filter under a bright light, and vacuum any spots you may have missed. Vacuuming is faster and safer than washing the filter."
        },
        {
          "headline":"Wash a dry filter, if desired.",
          "description":"Fill a bucket with a soap and water solution. Place the filter in the bucket and swirl it around. Take the filter back out and shake off excess liquid. Rinse the filter gently under running water. Put the filter on a towel and allow it to dry completely.Don\u2019t put the filter back when it\u2019s still wet! This can damage the vehicle\u2019s engine. Washing can get your filter cleaner than vacuuming alone, but is riskier and more time-consuming."
        },
        {
          "headline":"Cleanse an oiled filter.",
          "description":"Tap the filter to shake off dust and dirt. Apply a cleaning solution (specifically for oiled filters) liberally to the outside, then inside of the filter. Make sure the filter is completely saturated. Leave it in a sink or basin for ten minutes. Rinse it with cool water at a low pressure. Shake it off and allow the filter to completely dry. Don\u2019t allow the cleanser to dry on the filter; let it sit only for ten minutes. Rinse the filter by moving it up and down under the stream of water. After the rinse, the filter should be dry in about fifteen minutes; but if it isn\u2019t thoroughly dry, allow it to sit longer. If you\u2019re short on time, you can use a hair dryer or small fan on moderate heat to speed up the drying process, after the rinse stage only."
        },
        {
          "headline":"Re-oil a filter, if applicable.",
          "description":"Apply air filter oil evenly to the filter. Coat the filter thoroughly with a thin layer. Wipe off any excess oil from the cap and bottom lip of the filter. Allow the filter to sit for twenty minutes to absorb the oil."
        },
        {
          "headline":"Clean out the canister.",
          "description":"Vacuum dust and dirt from the filter housing, using a hose attachment. Alternately, you can use a soft cloth or paper towel. Just make sure the canister is completely dry and free of debris before replacing the filter. Moisture and debris can cause damage to the engine."
        },
        {
          "headline":"Replace the filter.",
          "description":"Return the filter to its housing. Secure any locks or clamps that hold it in place. These will be the same ones you undid when you removed the filter."
        }
      ]
    },
    {
      "name":"Cleaning a Home Air Filter",
      "steps":[
        {
          "headline":"FOR ANIMATED PASSAGE GO HERE https://www.youtube.com/watch?v=vsK-BHWw-b4.",
          "description":"Turn the system off before touching the filter. Clean the area around the vent with a broom or vacuum before opening the vent. Open the screw(s) or latch and swing open the vent. Vacuum the encasement area, then take out the air filter. If the system isn\u2019t turned off first, it will suck in debris during the cleaning process. Use a step ladder if the vent is up on the ceiling or a high wall."
        },
        {
          "headline":"Remove excess dirt.",
          "description":"Brush dirt off the filter into a trash container outside. Connect a hose attachment to your vacuum cleaner. Vacuum dust and debris from the filter with an upholstery attachment on the filter\u2019s front, back and sides. Vacuum the filter outside, if possible, to avoid stirring up dust in the home."
        },
        {
          "headline":"Rinse the filter under running water.",
          "description":"Attach a hose to your water tap. Hold the filter so that the water flows the opposite way from the airflow. Spray the filter completely to wash off dust and dirt. Use a gentle spray, not the full force of your hose, to avoid damaging the filter."
        },
        {
          "headline":"Wash off heavy grime with a soap solution, if needed.",
          "description":"If a simple rinse isn\u2019t doing the job, you can soak your filter in a soap solution. Add a drop of mild liquid dish soap to two cups of warm water in a bowl. Stir the solution. Wet a cloth in the solution and wash both sides of your filter. Rinse the filter with water, and let it dry completely. After the final rinse, shake off any excess water before setting the filter out to dry. You may want to wash your filter with a soap solution if it\u2019s been exposed to grease, smoke or pet hair."
        },
        {
          "headline":"Dry the filter thoroughly.",
          "description":"Pat the filter dry with paper towels. Leave the filter outside so it can air-dry. Make sure that the filter is completely dry before re-installing it. Neglecting to let the filter dry completely can cause mold growth, which can spread spores throughout your home through the HVAC."
        },
        {
          "headline":"Replace the filter.",
          "description":"Place the filter back in its housing. Ensure that the airflow is facing in the proper direction. Close the vent, and secure any screws or latches. The filter should sit snugly, without appearing too small or warped. Make sure there are no gaps."
        }
      ]
    },
    {
      "name":"Evaluating Whether to Clean or Replace Filters",
      "steps":[
        {
          "headline":"Replace disposable air filters.",
          "description":"A cleanable air filter is advertised as \u201cwashable,\u201d \u201cpermanent,\u201d and/or \u201creusable.\u201d Don\u2019t wash paper or otherwise disposable air filters. Avoid vacuuming them as well. Washing disposable air filters can actually clog them, as well as cause mold. Disposable filters can tear under the pressure of vacuuming or compressed air. At a low pressure, this may work temporarily, but it\u2019s not a long-term solution."
        },
        {
          "headline":"Clean or replace your car air filter regularly.",
          "description":"Clean or change your filter every 12,000 to 15,000 miles, or more often if you travel on dusty roads or in polluted areas. Examine your air filter under a bright light. Clean or change the filter if it\u2019s darkened or clogged with debris. Disposable filters should be replaced, whereas permanent filters can be vacuumed or washed. If you don\u2019t change your air filter as needed, you may notice a decrease in your gas mileage, ignition problems, or fouled spark plugs."
        },
        {
          "headline":"Clean or replace your home air filter routinely.",
          "description":"Clean or change your filter every three months, and more frequently in-season. Clean or change the furnace filter monthly during the heating season. Clean or replace your central air filter every month or two in the cooling season. If your filter is disposable, replace it. If it\u2019s reusable, you can vacuum or wash it. More frequent changing is needed if your filter is exposed to a lot of dust or pet hair. Failing to clean your air filters in the home can cause HVAC failure or even fire."
        }
      ]
    }
  ],
  "text":" Cleaning a Car Air Filter Remove the filter. Open the hood of your car. If you can\u2019t locate the filter, check the physical or online vehicle manual. Alternately, you can ask a mechanic the next time your vehicle is serviced. Open the canister (usually secured with wing nuts or clamps). Pull the filter out. The air filter\u2019s housing should be on top of the engine, in a round or rectangular box. Vacuum a dry filter. Connect a hose attachment to your vacuum cleaner. Vacuum the filter for about a minute on each side. Look at the filter under a bright light, and vacuum any spots you may have missed. Vacuuming is faster and safer than washing the filter. Wash a dry filter, if desired. Fill a bucket with a soap and water solution. Place the filter in the bucket and swirl it around. Take the filter back out and shake off excess liquid. Rinse the filter gently under running water. Put the filter on a towel and allow it to dry completely.Don\u2019t put the filter back when it\u2019s still wet! This can damage the vehicle\u2019s engine. Washing can get your filter cleaner than vacuuming alone, but is riskier and more time-consuming. Cleanse an oiled filter. Tap the filter to shake off dust and dirt. Apply a cleaning solution (specifically for oiled filters) liberally to the outside, then inside of the filter. Make sure the filter is completely saturated. Leave it in a sink or basin for ten minutes. Rinse it with cool water at a low pressure. Shake it off and allow the filter to completely dry. Don\u2019t allow the cleanser to dry on the filter; let it sit only for ten minutes. Rinse the filter by moving it up and down under the stream of water. After the rinse, the filter should be dry in about fifteen minutes; but if it isn\u2019t thoroughly dry, allow it to sit longer. If you\u2019re short on time, you can use a hair dryer or small fan on moderate heat to speed up the drying process, after the rinse stage only. Re-oil a filter, if applicable. Apply air filter oil evenly to the filter. Coat the filter thoroughly with a thin layer. Wipe off any excess oil from the cap and bottom lip of the filter. Allow the filter to sit for twenty minutes to absorb the oil. Clean out the canister. Vacuum dust and dirt from the filter housing, using a hose attachment. Alternately, you can use a soft cloth or paper towel. Just make sure the canister is completely dry and free of debris before replacing the filter. Moisture and debris can cause damage to the engine. Replace the filter. Return the filter to its housing. Secure any locks or clamps that hold it in place. These will be the same ones you undid when you removed the filter. Cleaning a Home Air Filter FOR ANIMATED PASSAGE GO HERE https://www.youtube.com/watch?v=vsK-BHWw-b4. Turn the system off before touching the filter. Clean the area around the vent with a broom or vacuum before opening the vent. Open the screw(s) or latch and swing open the vent. Vacuum the encasement area, then take out the air filter. If the system isn\u2019t turned off first, it will suck in debris during the cleaning process. Use a step ladder if the vent is up on the ceiling or a high wall. Remove excess dirt. Brush dirt off the filter into a trash container outside. Connect a hose attachment to your vacuum cleaner. Vacuum dust and debris from the filter with an upholstery attachment on the filter\u2019s front, back and sides. Vacuum the filter outside, if possible, to avoid stirring up dust in the home. Rinse the filter under running water. Attach a hose to your water tap. Hold the filter so that the water flows the opposite way from the airflow. Spray the filter completely to wash off dust and dirt. Use a gentle spray, not the full force of your hose, to avoid damaging the filter. Wash off heavy grime with a soap solution, if needed. If a simple rinse isn\u2019t doing the job, you can soak your filter in a soap solution. Add a drop of mild liquid dish soap to two cups of warm water in a bowl. Stir the solution. Wet a cloth in the solution and wash both sides of your filter. Rinse the filter with water, and let it dry completely. After the final rinse, shake off any excess water before setting the filter out to dry. You may want to wash your filter with a soap solution if it\u2019s been exposed to grease, smoke or pet hair. Dry the filter thoroughly. Pat the filter dry with paper towels. Leave the filter outside so it can air-dry. Make sure that the filter is completely dry before re-installing it. Neglecting to let the filter dry completely can cause mold growth, which can spread spores throughout your home through the HVAC. Replace the filter. Place the filter back in its housing. Ensure that the airflow is facing in the proper direction. Close the vent, and secure any screws or latches. The filter should sit snugly, without appearing too small or warped. Make sure there are no gaps. Evaluating Whether to Clean or Replace Filters Replace disposable air filters. A cleanable air filter is advertised as \u201cwashable,\u201d \u201cpermanent,\u201d and/or \u201creusable.\u201d Don\u2019t wash paper or otherwise disposable air filters. Avoid vacuuming them as well. Washing disposable air filters can actually clog them, as well as cause mold. Disposable filters can tear under the pressure of vacuuming or compressed air. At a low pressure, this may work temporarily, but it\u2019s not a long-term solution. Clean or replace your car air filter regularly. Clean or change your filter every 12,000 to 15,000 miles, or more often if you travel on dusty roads or in polluted areas. Examine your air filter under a bright light. Clean or change the filter if it\u2019s darkened or clogged with debris. Disposable filters should be replaced, whereas permanent filters can be vacuumed or washed. If you don\u2019t change your air filter as needed, you may notice a decrease in your gas mileage, ignition problems, or fouled spark plugs. Clean or replace your home air filter routinely. Clean or change your filter every three months, and more frequently in-season. Clean or change the furnace filter monthly during the heating season. Clean or replace your central air filter every month or two in the cooling season. If your filter is disposable, replace it. If it\u2019s reusable, you can vacuum or wash it. More frequent changing is needed if your filter is exposed to a lot of dust or pet hair. Failing to clean your air filters in the home can cause HVAC failure or even fire.",
  "tyn_model":[
    "water",
    "air filter",
    "hose",
    "air filters",
    "canister",
    "vacuum",
    "soap",
    "vacuum cleaner",
    "bucket",
    "vacuuming",
    "towel",
    "basin",
    "hair dryer",
    "air filter oil",
    "filter",
    "home air filter",
    "broom",
    "trash container",
    "water tap",
    "mild liquid dish soap",
    "bowl",
    "paper towels",
    "\u201cwashable",
    "\u201d \u201c",
    "\u201d and/or",
    "\u201creusable",
    "\u201d do",
    "air",
    "furnace",
    "central air filter"
  ],
  "tyn_section":[

  ]
}