{
  "title":"How to Play Five Nights at Freddy's 2",
  "url":"https://www.wikihow.com/Play-Five-Nights-at-Freddy%27s-2",
  "category_hierarchy":[
    "Hobbies and Crafts",
    "Games",
    "Video Games",
    "Multi Platform Games",
    "Five Nights at Freddy's"
  ],
  "parts":[
    {
      "name":"Installing and Starting a Game",
      "steps":[
        {
          "headline":"Go to store.steampowered.com.",
          "description":""
        },
        {
          "headline":"Create a Steam account so you can buy it.",
          "description":""
        },
        {
          "headline":"Install Steam so you can launch the game.",
          "description":"Once done, it should be in the \"Games\" section in the Steam client."
        },
        {
          "headline":"Start a new game.",
          "description":"When the game starts up, you will be met with a creepy-looking title screen. You want to click New Game. You start on Night 1. Only the toy animatronics move in this night."
        }
      ]
    },
    {
      "name":"Getting to Know the Controls on Night 1",
      "steps":[
        {
          "headline":"Press Ctrl to use your flashlight.",
          "description":"Be careful, because it can run out of batteries. When you use it, you can see down the hallway in front of you and see if any animatronics are coming down it. Flash it a few times at any animatronics in the hallway."
        },
        {
          "headline":"Look out for the vents to the left and right of you.",
          "description":"You also want to check these often because animatronics can come from them, the button above them toggles a light."
        },
        {
          "headline":"Put on your mask when you see an animatronic.",
          "description":"This is especially important if they're in the vents or your office. There will be two buttons at the bottom of the screen. The red one brings up your mask if you hover the mouse over it. When/if you hear banging from the vents, then that means it's safe to take the mask off."
        },
        {
          "headline":"Use your camera for monitoring.",
          "description":"The white button at the bottom of the screen activates the camera. Using this, you'll be able to monitor other parts of the map. In the camera, you have to watch out for Cam 11. Also watch out for the vents, too, which are Cam 5 and 6."
        },
        {
          "headline":"Look for the circle in Cam 11.",
          "description":"On the camera in Cam 11, there is a thing you have to do to keep an animatronic away from you. There will be a button saying \"Wind Up Music Box\" and a circle next to that. Do not let that circle run out. If it does, the marionette, which is the thing that's in the room, will probably get you soon. You generally only want the circle to drop halfway before re-winding it."
        },
        {
          "headline":"Be quick.",
          "description":"Whenever an animatronic appears in front of you in your office area, put the mask on instantly. With Toy Freddy, you only have 1.2 seconds to put it on. If you don't, then you're toast. The mask will trick the animatronics into thinking that you're one, so it's an essential. The mask does not work on Withered Foxy or Marionette, another two animatronics. To keep away Withered Foxy, flash your light at him a few times."
        }
      ]
    },
    {
      "name":"Beating the Following Nights",
      "steps":[
        {
          "headline":"Be prepared for an increasing challenge.",
          "description":"If you pass the first night, then congrats! It will progressively get harder the further into the game you get. Don't worry if you die multiple times- just keep trying."
        },
        {
          "headline":"Tackle Night 2.",
          "description":"Night 2 is almost the same as Night 1, but Foxy will appear in your hallway, and the animatronics will come out earlier, this includes the old ones. Keep in mind that you must check Cam 11 after each time you check your office."
        },
        {
          "headline":"Beat Night 3.",
          "description":"Now it gets harder, as forgetting to wear the mask after checking the vents will trigger a jumpscare next time you put down your cameras. Withered Foxy will also become more active during the night, so don't forget to flash him away."
        },
        {
          "headline":"Tackle Night 4.",
          "description":"This is very similar to Night 3. Keep an eye on Withered Foxy and the Marionette."
        },
        {
          "headline":"Beat the final night.",
          "description":"This night is the hardest of the first five. To complete this night, you must check Cam 11 all the time. If an animatronic is in your office for a long time, go straight to the Prize Corner, and wind the box to at least half way. Toy Bonnie and Withered Foxy will be problems in this situation, as Withered Foxy will stay in the hall for ages, and even the slightest mistake will trigger a jumpscare. Toy Bonnie will stay in the vent for ages too, and if you don't put on the mask and keep him away long enough, it will result in a jumpscare. You may get lucky though, as another animatronic may get in your office before Toy Bonnie gets a chance to jumpscare you."
        },
        {
          "headline":"Beat the game.",
          "description":"When you beat the game, you can customize the danger of all the animatronics, and you get the option to do a 6th Night."
        }
      ]
    }
  ],
  "text":" Installing and Starting a Game Go to store.steampowered.com.  Create a Steam account so you can buy it.  Install Steam so you can launch the game. Once done, it should be in the \"Games\" section in the Steam client. Start a new game. When the game starts up, you will be met with a creepy-looking title screen. You want to click New Game. You start on Night 1. Only the toy animatronics move in this night. Getting to Know the Controls on Night 1 Press Ctrl to use your flashlight. Be careful, because it can run out of batteries. When you use it, you can see down the hallway in front of you and see if any animatronics are coming down it. Flash it a few times at any animatronics in the hallway. Look out for the vents to the left and right of you. You also want to check these often because animatronics can come from them, the button above them toggles a light. Put on your mask when you see an animatronic. This is especially important if they're in the vents or your office. There will be two buttons at the bottom of the screen. The red one brings up your mask if you hover the mouse over it. When/if you hear banging from the vents, then that means it's safe to take the mask off. Use your camera for monitoring. The white button at the bottom of the screen activates the camera. Using this, you'll be able to monitor other parts of the map. In the camera, you have to watch out for Cam 11. Also watch out for the vents, too, which are Cam 5 and 6. Look for the circle in Cam 11. On the camera in Cam 11, there is a thing you have to do to keep an animatronic away from you. There will be a button saying \"Wind Up Music Box\" and a circle next to that. Do not let that circle run out. If it does, the marionette, which is the thing that's in the room, will probably get you soon. You generally only want the circle to drop halfway before re-winding it. Be quick. Whenever an animatronic appears in front of you in your office area, put the mask on instantly. With Toy Freddy, you only have 1.2 seconds to put it on. If you don't, then you're toast. The mask will trick the animatronics into thinking that you're one, so it's an essential. The mask does not work on Withered Foxy or Marionette, another two animatronics. To keep away Withered Foxy, flash your light at him a few times. Beating the Following Nights Be prepared for an increasing challenge. If you pass the first night, then congrats! It will progressively get harder the further into the game you get. Don't worry if you die multiple times- just keep trying. Tackle Night 2. Night 2 is almost the same as Night 1, but Foxy will appear in your hallway, and the animatronics will come out earlier, this includes the old ones. Keep in mind that you must check Cam 11 after each time you check your office. Beat Night 3. Now it gets harder, as forgetting to wear the mask after checking the vents will trigger a jumpscare next time you put down your cameras. Withered Foxy will also become more active during the night, so don't forget to flash him away. Tackle Night 4. This is very similar to Night 3. Keep an eye on Withered Foxy and the Marionette. Beat the final night. This night is the hardest of the first five. To complete this night, you must check Cam 11 all the time. If an animatronic is in your office for a long time, go straight to the Prize Corner, and wind the box to at least half way. Toy Bonnie and Withered Foxy will be problems in this situation, as Withered Foxy will stay in the hall for ages, and even the slightest mistake will trigger a jumpscare. Toy Bonnie will stay in the vent for ages too, and if you don't put on the mask and keep him away long enough, it will result in a jumpscare. You may get lucky though, as another animatronic may get in your office before Toy Bonnie gets a chance to jumpscare you. Beat the game. When you beat the game, you can customize the danger of all the animatronics, and you get the option to do a 6th Night.",
  "tyn_model":[
    "animatronic",
    "mask",
    "marionette",
    "steam",
    "flashlight",
    "camera",
    "cameras",
    "animatronics"
  ],
  "tyn_section":[

  ]
}