{
  "title":"How to Clean Silk Plants",
  "url":"https://www.wikihow.com/Clean-Silk-Plants",
  "category_hierarchy":[
    "Home and Garden",
    "Housekeeping",
    "Cleaning",
    "Cleaning Animal Materials"
  ],
  "methods":[
    {
      "name":"Using Dry Techniques for Routine Cleaning",
      "steps":[
        {
          "headline":"Vacuum your silk plants.",
          "description":"Put a small brush nozzle on the end of your vacuum cleaner. Carefully vacuum the plants, working from the top to the bottom of the plant."
        },
        {
          "headline":"Use a can of forced air.",
          "description":"You can use the same can of forced air that you use to clean your keyboard and computer. Use the can of forced air to spray off the dust that has accumulated on your silk plants. An alternative to compressed air for cleaning electronics is an old can of hair spray. You could also use an air compressor if you have one available, but be careful not to hold the nozzle too close to the plant since the force of the compressed air could damage the plant."
        },
        {
          "headline":"Use cornmeal.",
          "description":"Put half a cup of cornmeal in the bottom of a grocery bag. Remove the silk flowers or petals that you want to clean and put them in the bag. Roll up the top of the bag and give it a shake for one or two-minutes. The cornmeal should rub off the dust. If you don\u2019t have cornmeal, you can also use salt."
        },
        {
          "headline":"Use your dryer.",
          "description":"Remove the petals and flowers from your silk plant. Put them in your dryer with a dryer sheet. Turn your dryer to a low heat setting. Run the dryer for one or two-minutes to remove any dust."
        },
        {
          "headline":"Use a hair dryer.",
          "description":"If you are looking for a quick dusting solution, you can use your hair dyer on a cool air, high fan setting. Use the hair dryer to blow away the dust. You may want to do this cleaning outside, so you don\u2019t get too much dust blown around your apartment."
        }
      ]
    },
    {
      "name":"Using Wet Techniques for a Deeper Clean",
      "steps":[
        {
          "headline":"Do a colorfast test.",
          "description":"To make sure you don\u2019t wash away the colors with a wet method, you should test a small part of your silk plant. Spray a mix of alcohol and water on one leaf. Blot the leaf dry and see if any of the dye or paint comes off the plant. If the plant loses color, you should go with a dry cleaning method, such as vacuuming, instead of a wet cleaning method."
        },
        {
          "headline":"Mix equal parts isopropyl alcohol and water to make a cleaner.",
          "description":"Use a mix of isopropyl alcohol and water, in a one to one ratio. Fill the mixture in a spray bottle. Spray your plants with the solution to remove any dust or grime. The alcohol will help the plants air dry quickly."
        },
        {
          "headline":"Clean your silk flowers and stems in the sink.",
          "description":"Fill the sink with cold water. Then, add a squirt of dishwashing liquid. Wash each petal and flower individually. Swish each one in the cold water and then place on a rack to dry. If there is a lot of grime, you should avoid rubbing too vigorously, since it could damage the plant."
        },
        {
          "headline":"Blot your plant dry.",
          "description":"After using any wet cleaning method, you should use a clean, soft cloth to blot the petals and flowers dry. Avoid a rubbing motion, which could damage the plant. When you have finished drying the petals and flowers, you can put them back on the plant."
        }
      ]
    }
  ],
  "text":" Using Dry Techniques for Routine Cleaning Vacuum your silk plants. Put a small brush nozzle on the end of your vacuum cleaner. Carefully vacuum the plants, working from the top to the bottom of the plant. Use a can of forced air. You can use the same can of forced air that you use to clean your keyboard and computer. Use the can of forced air to spray off the dust that has accumulated on your silk plants. An alternative to compressed air for cleaning electronics is an old can of hair spray. You could also use an air compressor if you have one available, but be careful not to hold the nozzle too close to the plant since the force of the compressed air could damage the plant. Use cornmeal. Put half a cup of cornmeal in the bottom of a grocery bag. Remove the silk flowers or petals that you want to clean and put them in the bag. Roll up the top of the bag and give it a shake for one or two-minutes. The cornmeal should rub off the dust. If you don\u2019t have cornmeal, you can also use salt. Use your dryer. Remove the petals and flowers from your silk plant. Put them in your dryer with a dryer sheet. Turn your dryer to a low heat setting. Run the dryer for one or two-minutes to remove any dust. Use a hair dryer. If you are looking for a quick dusting solution, you can use your hair dyer on a cool air, high fan setting. Use the hair dryer to blow away the dust. You may want to do this cleaning outside, so you don\u2019t get too much dust blown around your apartment. Using Wet Techniques for a Deeper Clean Do a colorfast test. To make sure you don\u2019t wash away the colors with a wet method, you should test a small part of your silk plant. Spray a mix of alcohol and water on one leaf. Blot the leaf dry and see if any of the dye or paint comes off the plant. If the plant loses color, you should go with a dry cleaning method, such as vacuuming, instead of a wet cleaning method. Mix equal parts isopropyl alcohol and water to make a cleaner. Use a mix of isopropyl alcohol and water, in a one to one ratio. Fill the mixture in a spray bottle. Spray your plants with the solution to remove any dust or grime. The alcohol will help the plants air dry quickly. Clean your silk flowers and stems in the sink. Fill the sink with cold water. Then, add a squirt of dishwashing liquid. Wash each petal and flower individually. Swish each one in the cold water and then place on a rack to dry. If there is a lot of grime, you should avoid rubbing too vigorously, since it could damage the plant. Blot your plant dry. After using any wet cleaning method, you should use a clean, soft cloth to blot the petals and flowers dry. Avoid a rubbing motion, which could damage the plant. When you have finished drying the petals and flowers, you can put them back on the plant.",
  "tyn_model":[
    "cornmeal",
    "dryer",
    "water",
    "forced air",
    "hair dryer",
    "isopropyl alcohol",
    "vacuum cleaner",
    "compressed air",
    "air compressor",
    "grocery bag",
    "salt",
    "dryer sheet",
    "hair dyer",
    "alcohol",
    "paint",
    "spray bottle",
    "dishwashing liquid",
    "cold water"
  ],
  "tyn_section":[

  ]
}