{
  "title":"How to Clean a Leather Belt",
  "url":"https://www.wikihow.com/Clean-a-Leather-Belt",
  "category_hierarchy":[
    "Home and Garden",
    "Housekeeping",
    "Cleaning",
    "Cleaning Animal Materials",
    "Cleaning Leather"
  ],
  "methods":[
    {
      "name":"Doing Routine Cleaning",
      "steps":[
        {
          "headline":"Wipe the belt down with a damp cloth.",
          "description":"For most cleaning, start with a soft cloth dampened with warm water. Wipe down the belt, focusing on any dirty areas. You can also just try a dry cloth if the belt isn't too dirty."
        },
        {
          "headline":"Purchase saddle soap or another leather cleaner.",
          "description":"Using a cleaner designed for leather is always the best choice. Saddle soap is a traditional leather cleaner, and it will suffice. However, you can also use another cleaner specifically designed for leather, as well. Sometimes, just a little mild soap will do the trick. However, you may not want to use it on a more expensive belt."
        },
        {
          "headline":"Add a little cleaner to a clean cloth.",
          "description":"It can help to start with a very slightly damp cloth. Add a little cleaner. If the cleaner is in a tub, like saddle soap usually is, you may need to rub the cloth in the cleaner to work up a light lather."
        },
        {
          "headline":"Rub the cleaner into the leather.",
          "description":"Try to follow the grain, and don't rub too hard. Once you've rubbed it in, use a clean part of the cloth or another lightly damp cloth to wipe up the excess."
        },
        {
          "headline":"Let it dry overnight.",
          "description":"It's best to leave the belt overnight so it has time to absorb all of the polish or cleaner. That way, it will stay on the belt instead of transferring to your hands or clothes, damaging them."
        }
      ]
    },
    {
      "name":"Working on Stains",
      "steps":[
        {
          "headline":"Try cornstarch on oil-based stains.",
          "description":"It's best to use cornstarch when the oil is fresh. Sprinkle the powder on the stain, and let it absorb the oil. If the oil stain is older, try rubbing in the powder with your fingers to help remove the oil stain. The heat from your fingers will help remove the stain. Use your fingers to brush the powder off. You can also try a dry rag to remove most of the oil first."
        },
        {
          "headline":"Remove water stains with a damp cloth.",
          "description":"If your belt has gotten wet in certain places, you've likely ended up with water stains. To deal with problem, you need to use a damp cloth to wet the whole belt, so that it can dry altogether without leaving small stains."
        },
        {
          "headline":"Use rubbing alcohol on small stains.",
          "description":"For a small stain, such as a pen mark, rubbing alcohol may do the trick. Use something small to apply it, such as a cotton swab. Once the stain is gone, blow it dry with a blow dryer."
        },
        {
          "headline":"Apply a lemon and cream of tartar paste.",
          "description":"For other stains, try mixing cream of tarter and lemon juice together in equal parts. Apply it to the stain, and leave it on the leather for 10 minutes. Wipe away the mixture."
        },
        {
          "headline":"Use more aggressive measures as a last resort.",
          "description":"Washing the belt more thoroughly with soap and water could completely ruin your belt, so it's best to use it as a last resort. However, if you're throwing it out anyway, washing the belt by hand may save it. Rub in more water and soap to try to clean the belt."
        }
      ]
    },
    {
      "name":"Deodorizing a Belt",
      "steps":[
        {
          "headline":"Try activated charcoal.",
          "description":"Add some to a bag or other air-tight container, and throw the belt inside. Seal it up, and leave it for at least a day. If it still smells, try it for longer. You can find activated charcoal at pet stores (in the fish supplies) or online."
        },
        {
          "headline":"Use kitty litter.",
          "description":"Another option for deodorizing is kitty litter. Kitty litter is designed to absorb odors for obvious reasons. To use, seal the belt in with the kitty litter in an airtight container. Let it sit for at least a day; let it go longer if it still needs deodorizing."
        },
        {
          "headline":"Use baking soda.",
          "description":"Another option for deodorizing is using baking soda. Simply seal it in with the belt and leave it for a day or so. If you're worried about it leaving a white residue, try one of the baking soda \"packs\" made to deodorize things like refrigerators, as the baking soda isn't loose."
        }
      ]
    }
  ],
  "text":" Doing Routine Cleaning Wipe the belt down with a damp cloth. For most cleaning, start with a soft cloth dampened with warm water. Wipe down the belt, focusing on any dirty areas. You can also just try a dry cloth if the belt isn't too dirty. Purchase saddle soap or another leather cleaner. Using a cleaner designed for leather is always the best choice. Saddle soap is a traditional leather cleaner, and it will suffice. However, you can also use another cleaner specifically designed for leather, as well. Sometimes, just a little mild soap will do the trick. However, you may not want to use it on a more expensive belt. Add a little cleaner to a clean cloth. It can help to start with a very slightly damp cloth. Add a little cleaner. If the cleaner is in a tub, like saddle soap usually is, you may need to rub the cloth in the cleaner to work up a light lather. Rub the cleaner into the leather. Try to follow the grain, and don't rub too hard. Once you've rubbed it in, use a clean part of the cloth or another lightly damp cloth to wipe up the excess. Let it dry overnight. It's best to leave the belt overnight so it has time to absorb all of the polish or cleaner. That way, it will stay on the belt instead of transferring to your hands or clothes, damaging them. Working on Stains Try cornstarch on oil-based stains. It's best to use cornstarch when the oil is fresh. Sprinkle the powder on the stain, and let it absorb the oil. If the oil stain is older, try rubbing in the powder with your fingers to help remove the oil stain. The heat from your fingers will help remove the stain. Use your fingers to brush the powder off. You can also try a dry rag to remove most of the oil first. Remove water stains with a damp cloth. If your belt has gotten wet in certain places, you've likely ended up with water stains. To deal with problem, you need to use a damp cloth to wet the whole belt, so that it can dry altogether without leaving small stains. Use rubbing alcohol on small stains. For a small stain, such as a pen mark, rubbing alcohol may do the trick. Use something small to apply it, such as a cotton swab. Once the stain is gone, blow it dry with a blow dryer. Apply a lemon and cream of tartar paste. For other stains, try mixing cream of tarter and lemon juice together in equal parts. Apply it to the stain, and leave it on the leather for 10 minutes. Wipe away the mixture. Use more aggressive measures as a last resort. Washing the belt more thoroughly with soap and water could completely ruin your belt, so it's best to use it as a last resort. However, if you're throwing it out anyway, washing the belt by hand may save it. Rub in more water and soap to try to clean the belt. Deodorizing a Belt Try activated charcoal. Add some to a bag or other air-tight container, and throw the belt inside. Seal it up, and leave it for at least a day. If it still smells, try it for longer. You can find activated charcoal at pet stores (in the fish supplies) or online. Use kitty litter. Another option for deodorizing is kitty litter. Kitty litter is designed to absorb odors for obvious reasons. To use, seal the belt in with the kitty litter in an airtight container. Let it sit for at least a day; let it go longer if it still needs deodorizing. Use baking soda. Another option for deodorizing is using baking soda. Simply seal it in with the belt and leave it for a day or so. If you're worried about it leaving a white residue, try one of the baking soda \"packs\" made to deodorize things like refrigerators, as the baking soda isn't loose.",
  "tyn_model":[
    "cleaner",
    "water",
    "kitty litter",
    "baking soda",
    "saddle soap",
    "soap",
    "belt",
    "cornstarch",
    "rubbing alcohol",
    "lemon",
    "activated charcoal",
    "leather cleaner",
    "leather",
    "dry rag",
    "cotton swab",
    "blow dryer",
    "cream of tartar",
    "cream of tarter",
    "air-tight container",
    "airtight container"
  ],
  "tyn_section":[

  ]
}