{
  "title":"How to Clean Beer Bottles",
  "url":"https://www.wikihow.com/Clean-Beer-Bottles",
  "category_hierarchy":[
    "Home and Garden",
    "Housekeeping",
    "Cleaning",
    "House Cleaning"
  ],
  "methods":[
    {
      "name":"Pre-Cleaning and Removing the Labels",
      "steps":[
        {
          "headline":"Place your bottles in a gallon tub.",
          "description":"If your bottles will not fit in a gallon tub, then use a bigger tub like a two or three gallon tub. Alternatively, you can use your sink. Place a stopper in your drain and then place your bottles in the sink."
        },
        {
          "headline":"Fill the tub with cold water.",
          "description":"Fill the tub until all of the bottles are fully submerged. Then mix in one to four tablespoons (15 to 60 ml) of bleach per gallon of water. Use a mixing spoon or stick to stir and disperse the cleaning solution into the bottles. Alternatively, you can use commercial cleaners like OxyClean or PBW (powder brewery wash). If you use these, fill your tub with hot water as opposed to cold water, and follow the dosing guidelines per the instructions on the product."
        },
        {
          "headline":"Let the bottles soak for 10 to 15 minutes.",
          "description":"If you are using a commercial cleaner, then you may need to let the bottles soak for a longer amount of time like 30 minutes."
        },
        {
          "headline":"Remove the labels.",
          "description":"After the bottles have soaked, you will see the labels beginning to peel off. Put on a pair of protective gloves like nylon gloves. Then begin to slowly peel the labels off. Traces of glue may remain on the bottles after the labels have been peeled off. Use a sponge with an abrasive surface (or a scrub pad) to remove any remaining glue."
        },
        {
          "headline":"Scrub the inside of the bottles.",
          "description":"Use a nylon bottle brush to do this. Fill the bottle with a small amount of the solution. Scrub the inside of the bottle to remove any dirt and grime. Scrub each bottle until all dirt and grime are removed. Hold the bottles up to the light to make sure all of the dirt and grime have been removed. Place the bottles upside down on a drying rack to be sanitized."
        }
      ]
    },
    {
      "name":"Using the Dishwasher to Sanitize",
      "steps":[
        {
          "headline":"Place the bottles in your washer.",
          "description":"Place your bottles upside down in your dishwasher. Also place the bottle caps in the dishwasher. Then close the dishwasher door."
        },
        {
          "headline":"Set your washer on the \"sanitize\" setting.",
          "description":"Make sure the heat cycle is on in order to sanitize the bottles and caps. Let the washer complete the full cycle, including the heat cycle, to ensure that they are sanitized. Do not use any detergent or drying agent like Jet Dry when sanitizing your bottles in the dishwasher. If you do, these will taint the taste of any liquid you fill your beer bottles with. Do not place dirty dishes in the washer while you are sanitizing the beer bottles."
        },
        {
          "headline":"Let the bottles cool.",
          "description":"The bottles will be very hot after the cycle is finished. Let them cool down for 10 minutes before storing or using them."
        }
      ]
    },
    {
      "name":"Using Bleach to Sanitize",
      "steps":[
        {
          "headline":"Fill a gallon tub with cold water.",
          "description":"Then mix in one tablespoon (15 ml) of bleach for each gallon of water. Make sure the bleach you use contains 5.25 percent of sodium hypochlorite. Then mix the ingredients together until they are well-combined. For example, if you are using two gallons of water, then mix in two tablespoons of bleach. Alternatively, you can use a commercial sanitizer to sanitize the beer bottles. Just make sure to follow the dosing guidelines per the instructions on the product."
        },
        {
          "headline":"Add your bottles to the tub.",
          "description":"Use a mixing spoon to stir the bottles and disperse the solution. Make sure the bottles are fully submerged in the solution. Then let them soak for 20 to 30 minutes."
        },
        {
          "headline":"Place them on a rack to drip dry.",
          "description":"Do this after they have finished soaking. Place the bottles upside down on a drying rack. You can use the rack in your dishwasher to do this. Do not use a cloth or rag to dry the bottles. Cloths and rags may contain bacteria that can contaminate your sanitized bottles. You do not need to rinse out the bottles after sanitizing them with bleach if you use the correct dosage of bleach. However, it is recommended that you rinse the bottles just to be safe."
        },
        {
          "headline":"Rinse them with boiled water.",
          "description":"Fill a pot with water and place it on the stove. Set the heat to high. Bring the water to a rolling boil, about 8 to 10 minutes. Remove the pot from the heat and let the water cool for five minutes. Rinse each bottle with the water. Then place them upside down a rack to drip dry. Do not use regular, un-boiled tap water to rinse your bottles. The tap water can contaminate your bottles."
        }
      ]
    }
  ],
  "text":" Pre-Cleaning and Removing the Labels Place your bottles in a gallon tub. If your bottles will not fit in a gallon tub, then use a bigger tub like a two or three gallon tub. Alternatively, you can use your sink. Place a stopper in your drain and then place your bottles in the sink. Fill the tub with cold water. Fill the tub until all of the bottles are fully submerged. Then mix in one to four tablespoons (15 to 60 ml) of bleach per gallon of water. Use a mixing spoon or stick to stir and disperse the cleaning solution into the bottles. Alternatively, you can use commercial cleaners like OxyClean or PBW (powder brewery wash). If you use these, fill your tub with hot water as opposed to cold water, and follow the dosing guidelines per the instructions on the product. Let the bottles soak for 10 to 15 minutes. If you are using a commercial cleaner, then you may need to let the bottles soak for a longer amount of time like 30 minutes. Remove the labels. After the bottles have soaked, you will see the labels beginning to peel off. Put on a pair of protective gloves like nylon gloves. Then begin to slowly peel the labels off. Traces of glue may remain on the bottles after the labels have been peeled off. Use a sponge with an abrasive surface (or a scrub pad) to remove any remaining glue. Scrub the inside of the bottles. Use a nylon bottle brush to do this. Fill the bottle with a small amount of the solution. Scrub the inside of the bottle to remove any dirt and grime. Scrub each bottle until all dirt and grime are removed. Hold the bottles up to the light to make sure all of the dirt and grime have been removed. Place the bottles upside down on a drying rack to be sanitized. Using the Dishwasher to Sanitize Place the bottles in your washer. Place your bottles upside down in your dishwasher. Also place the bottle caps in the dishwasher. Then close the dishwasher door. Set your washer on the \"sanitize\" setting. Make sure the heat cycle is on in order to sanitize the bottles and caps. Let the washer complete the full cycle, including the heat cycle, to ensure that they are sanitized. Do not use any detergent or drying agent like Jet Dry when sanitizing your bottles in the dishwasher. If you do, these will taint the taste of any liquid you fill your beer bottles with. Do not place dirty dishes in the washer while you are sanitizing the beer bottles. Let the bottles cool. The bottles will be very hot after the cycle is finished. Let them cool down for 10 minutes before storing or using them. Using Bleach to Sanitize Fill a gallon tub with cold water. Then mix in one tablespoon (15 ml) of bleach for each gallon of water. Make sure the bleach you use contains 5.25 percent of sodium hypochlorite. Then mix the ingredients together until they are well-combined. For example, if you are using two gallons of water, then mix in two tablespoons of bleach. Alternatively, you can use a commercial sanitizer to sanitize the beer bottles. Just make sure to follow the dosing guidelines per the instructions on the product. Add your bottles to the tub. Use a mixing spoon to stir the bottles and disperse the solution. Make sure the bottles are fully submerged in the solution. Then let them soak for 20 to 30 minutes. Place them on a rack to drip dry. Do this after they have finished soaking. Place the bottles upside down on a drying rack. You can use the rack in your dishwasher to do this. Do not use a cloth or rag to dry the bottles. Cloths and rags may contain bacteria that can contaminate your sanitized bottles. You do not need to rinse out the bottles after sanitizing them with bleach if you use the correct dosage of bleach. However, it is recommended that you rinse the bottles just to be safe. Rinse them with boiled water. Fill a pot with water and place it on the stove. Set the heat to high. Bring the water to a rolling boil, about 8 to 10 minutes. Remove the pot from the heat and let the water cool for five minutes. Rinse each bottle with the water. Then place them upside down a rack to drip dry. Do not use regular, un-boiled tap water to rinse your bottles. The tap water can contaminate your bottles.",
  "tyn_model":[
    "water",
    "bleach",
    "washer",
    "mixing spoon",
    "glue",
    "dishwasher",
    "pot",
    "tap water",
    "stopper",
    "protective gloves",
    "nylon gloves",
    "sponge",
    "scrub pad",
    "nylon bottle brush",
    "bottles",
    "jet dry",
    "tub",
    "stove"
  ],
  "tyn_section":[

  ]
}