{
  "title":"How to Clean a Faux Leather Jacket",
  "url":"https://www.wikihow.com/Clean-a-Faux-Leather-Jacket",
  "category_hierarchy":[
    "Home and Garden",
    "Housekeeping",
    "Laundry",
    "Cleaning Clothes"
  ],
  "methods":[
    {
      "name":"Handwashing Faux Leather",
      "steps":[
        {
          "headline":"Remove any crusty spots.",
          "description":"Before you spot clean your faux leather jacket, carefully go over the fabric to check for dried on spills, such as old food. Gently flake off the residue and wipe the spot with a soft cloth."
        },
        {
          "headline":"Mix mild laundry detergent into warm water.",
          "description":"Measure out about a tablespoon (15 milliliters) and pour it into a small bowl of water. Gently stir the water to distribute the soap. If you\u2019re going to purchase a new detergent, try one formulated for delicates. You can also try a commercial faux leather cleaner."
        },
        {
          "headline":"Dampen a soft cloth.",
          "description":"Dip a clean cloth into the soapy water to wet it. Wring out the excess water so that your cloth is barely damp. It\u2019s easier to apply more water than it is to remove excess, so wring out as much water as possible."
        },
        {
          "headline":"Wipe down your jacket.",
          "description":"Run the damp cloth over your jacket, paying careful attention to scuffs and dirty spots. Rewet your cloth in the soapy water as needed. For best results, spend additional time cleaning spots that suffered spills, dirt, or grime."
        },
        {
          "headline":"Use a clean, damp cloth to remove the excess soap.",
          "description":"Wet a fresh cloth and wring out the excess water. Run the damp cloth over your jacket, repeating until no soap remains. Rinse out your cloth between passes over the jacket. If the soap is left on the faux leather jacket, it can cause the jacket to crack and stiffen."
        },
        {
          "headline":"Dry any remaining wetness with a soft cloth.",
          "description":"Follow the wet cloth with a clean, dry cloth. Because you\u2019re using little water, you should be able to get it dry with your cloth. If it remains damp, allow the jacket to air dry. Do not try to speed the drying process by putting the jacket in a dryer or trying to use a hair dryer to dry your jacket. Heat will ruin your faux leather jacket."
        },
        {
          "headline":"Apply a conditioner to your jacket.",
          "description":"A conditioner will help you keep your jacket from getting too dry, which can cause cracking. Cleaning your jacket can dry it out, so it\u2019s important that you end the process with a conditioner. You can use a commercial product to condition your jacket, or you can polish it with olive oil by dripping a few drops of oil onto a cloth and then applying the oil to your jacket. While faux leather is different from regular leather, you still need to condition it."
        }
      ]
    },
    {
      "name":"Using a Washing Machine",
      "steps":[
        {
          "headline":"Check the tag on your faux leather jacket.",
          "description":"Faux leather can come with different care concerns depending on how it\u2019s made and how much of the garment is comprised of faux leather. Before you put your jacket in the washing machine, make sure that the care instructions list it as an option. Recently produced faux leather clothing is commonly marked as machine washable. Do not dry clean your faux leather jacket unless the tag explicitly says to do so. Dry cleaning chemicals dry out faux leather and lead to cracking, stiffness, and discoloration."
        },
        {
          "headline":"Turn your jacket inside out and place it in a mesh garment bag.",
          "description":"Protect the look of your jacket by washing it inside out in a laundry bag meant for delicates. If you can\u2019t find a mesh garment bag, try washing your jacket in a pillowcase. Be sure to tie off your pillowcase with a hair elastic or by tying the ends of the pillowcase opening into a knot."
        },
        {
          "headline":"Choose the delicate cycle with low spin.",
          "description":"Unless the tag recommends another setting, set your washing machine to wash your jacket on its gentlest cycle using cold water."
        },
        {
          "headline":"Allow your jacket to air dry.",
          "description":"Faux leather is easily damaged by heat, so lay out your jacket to let it air dry. You can also try line drying your jacket as long as you evenly distribute it on the hanger so that it doesn\u2019t stretch. If you try to use heat to dry your jacket, it will ruin both the jacket and your dryer. If you are hanging your jacket, make sure that the hanger does not press into the jacket where it isn\u2019t supposed to. The hanger placement should line up with the natural seams of the jacket."
        },
        {
          "headline":"Use a cool iron if needed to remove wrinkles.",
          "description":"Place a towel over your faux leather jacket and carefully press the wrinkles with a cool iron. Do not allow the iron to sit on the towel, and make sure that the metal never comes in contact with the jacket. You can also steam your leather jacket to remove wrinkles. Never apply heat to a faux leather jacket."
        }
      ]
    },
    {
      "name":"Removing Odors",
      "steps":[
        {
          "headline":"Sprinkle baking soda inside your jacket.",
          "description":"Baking soda absorbs and neutralizes smells without damaging the fabric. Use a liberal amount of baking soda so that most of the inner lining makes contact with it. Don\u2019t forget to put baking soda inside the sleeves."
        },
        {
          "headline":"Place your jacket in an area it will remain undisturbed.",
          "description":"Choose an area away from pets and children, such as the center of a table. Lay out your jacket flat so that the baking soda stays in place. Pets and children can become ill if they find and ingest the baking soda."
        },
        {
          "headline":"Allow your jacket to sit overnight.",
          "description":"The baking soda needs time to absorb the smell, so leave it undisturbed for at least 8 hours."
        },
        {
          "headline":"Vacuum away the baking soda.",
          "description":"Use a small nozzle attachment or a hand held vacuum to remove the baking soda from the jacket, including inside the sleeves. Shake it out and repeat if you see any baking soda fall from the jacket."
        },
        {
          "headline":"Smell your jacket.",
          "description":"The bad smell should be gone from your jacket lining. Repeat the process if the smell remains."
        }
      ]
    }
  ],
  "text":" Handwashing Faux Leather Remove any crusty spots. Before you spot clean your faux leather jacket, carefully go over the fabric to check for dried on spills, such as old food. Gently flake off the residue and wipe the spot with a soft cloth. Mix mild laundry detergent into warm water. Measure out about a tablespoon (15 milliliters) and pour it into a small bowl of water. Gently stir the water to distribute the soap. If you\u2019re going to purchase a new detergent, try one formulated for delicates. You can also try a commercial faux leather cleaner. Dampen a soft cloth. Dip a clean cloth into the soapy water to wet it. Wring out the excess water so that your cloth is barely damp. It\u2019s easier to apply more water than it is to remove excess, so wring out as much water as possible. Wipe down your jacket. Run the damp cloth over your jacket, paying careful attention to scuffs and dirty spots. Rewet your cloth in the soapy water as needed. For best results, spend additional time cleaning spots that suffered spills, dirt, or grime. Use a clean, damp cloth to remove the excess soap. Wet a fresh cloth and wring out the excess water. Run the damp cloth over your jacket, repeating until no soap remains. Rinse out your cloth between passes over the jacket. If the soap is left on the faux leather jacket, it can cause the jacket to crack and stiffen. Dry any remaining wetness with a soft cloth. Follow the wet cloth with a clean, dry cloth. Because you\u2019re using little water, you should be able to get it dry with your cloth. If it remains damp, allow the jacket to air dry. Do not try to speed the drying process by putting the jacket in a dryer or trying to use a hair dryer to dry your jacket. Heat will ruin your faux leather jacket. Apply a conditioner to your jacket. A conditioner will help you keep your jacket from getting too dry, which can cause cracking. Cleaning your jacket can dry it out, so it\u2019s important that you end the process with a conditioner. You can use a commercial product to condition your jacket, or you can polish it with olive oil by dripping a few drops of oil onto a cloth and then applying the oil to your jacket. While faux leather is different from regular leather, you still need to condition it. Using a Washing Machine Check the tag on your faux leather jacket. Faux leather can come with different care concerns depending on how it\u2019s made and how much of the garment is comprised of faux leather. Before you put your jacket in the washing machine, make sure that the care instructions list it as an option. Recently produced faux leather clothing is commonly marked as machine washable. Do not dry clean your faux leather jacket unless the tag explicitly says to do so. Dry cleaning chemicals dry out faux leather and lead to cracking, stiffness, and discoloration. Turn your jacket inside out and place it in a mesh garment bag. Protect the look of your jacket by washing it inside out in a laundry bag meant for delicates. If you can\u2019t find a mesh garment bag, try washing your jacket in a pillowcase. Be sure to tie off your pillowcase with a hair elastic or by tying the ends of the pillowcase opening into a knot. Choose the delicate cycle with low spin. Unless the tag recommends another setting, set your washing machine to wash your jacket on its gentlest cycle using cold water. Allow your jacket to air dry. Faux leather is easily damaged by heat, so lay out your jacket to let it air dry. You can also try line drying your jacket as long as you evenly distribute it on the hanger so that it doesn\u2019t stretch. If you try to use heat to dry your jacket, it will ruin both the jacket and your dryer. If you are hanging your jacket, make sure that the hanger does not press into the jacket where it isn\u2019t supposed to. The hanger placement should line up with the natural seams of the jacket. Use a cool iron if needed to remove wrinkles. Place a towel over your faux leather jacket and carefully press the wrinkles with a cool iron. Do not allow the iron to sit on the towel, and make sure that the metal never comes in contact with the jacket. You can also steam your leather jacket to remove wrinkles. Never apply heat to a faux leather jacket. Removing Odors Sprinkle baking soda inside your jacket. Baking soda absorbs and neutralizes smells without damaging the fabric. Use a liberal amount of baking soda so that most of the inner lining makes contact with it. Don\u2019t forget to put baking soda inside the sleeves. Place your jacket in an area it will remain undisturbed. Choose an area away from pets and children, such as the center of a table. Lay out your jacket flat so that the baking soda stays in place. Pets and children can become ill if they find and ingest the baking soda. Allow your jacket to sit overnight. The baking soda needs time to absorb the smell, so leave it undisturbed for at least 8 hours. Vacuum away the baking soda. Use a small nozzle attachment or a hand held vacuum to remove the baking soda from the jacket, including inside the sleeves. Shake it out and repeat if you see any baking soda fall from the jacket. Smell your jacket. The bad smell should be gone from your jacket lining. Repeat the process if the smell remains.",
  "tyn_model":[
    "water",
    "baking soda",
    "conditioner",
    "cloth",
    "dryer",
    "oil",
    "mesh garment bag",
    "hanger",
    "cool iron",
    "towel",
    "laundry detergent",
    "soap",
    "hair dryer",
    "olive oil",
    "faux leather clothing",
    "faux leather jacket",
    "dry cleaning chemicals",
    "laundry bag",
    "hair elastic",
    "washing machine",
    "iron"
  ],
  "tyn_section":[

  ]
}