{
  "title":"How to Clean Enamel Paint",
  "url":"https://www.wikihow.com/Clean-Enamel-Paint",
  "category_hierarchy":[
    "Home and Garden",
    "Housekeeping",
    "Cleaning"
  ],
  "methods":[
    {
      "name":"Doing Routine Cleaning",
      "steps":[
        {
          "headline":"Dust painted walls at least once every year.",
          "description":"Dust removal is important for maintaining enamel-painted surfaces, but an annual dusting is all that most walls need. Run the brush attachment on your vacuum over the walls and ceilings to quickly remove dust from the surface. For smaller areas, a hand duster should suffice. Always dust before you do a deeper clean. For instance, before trying to remove a stain, give the walls a quick dusting."
        },
        {
          "headline":"Make a cleaning solution with mild dish soap and warm water.",
          "description":"Dirt and smudges will require more than a simple dusting to remove them. Fill a medium-sized bucket with warm water, then add a few drops of mild dish detergent. Use your hand or stirring device to mix them together. Fill a separate bucket up with  just warm water. You could also mix three tablespoons of distilled white vinegar in a gallon of water to create a safe cleaning solution for enamel-painted walls."
        },
        {
          "headline":"Dampen a non-abrasive sponge with the solution.",
          "description":"Dunk a non-abrasive sponge, like a cellulose sponge, into the bucket of cleaning solution. Squeeze it to remove excess solution. You want the sponge to be dampened but not dripping."
        },
        {
          "headline":"Work in sections.",
          "description":"Divide the surface up into a series of vertical sections and clean them one at a time. Starting from the top and working your way down to the bottom, gently use the sponge to scrub the surface in circular motion. Once the sponge starts looking dirty, dip it back into the  solution, wring it out thoroughly, and continue. If the water in the bucket starts to look dirty during the process, dump it out and create a fresh batch of cleaning solution."
        },
        {
          "headline":"Rinse each section with clean water after scrubbing.",
          "description":"Wet a second sponge with the clean water in your second bucket. Starting at the top and working your way down, use the wet sponge to wipe down the section and rinse away the cleaning solution. Be sure to remove all soap thoroughly, since dirt and grime can stick to soap residue if left on the wall."
        },
        {
          "headline":"Dry the surface with a towel.",
          "description":"Thoroughly go over each section with a fresh towel to remove excess moisture from the surface. Work systematically, such as from top to bottom, so that you won't miss any spots."
        }
      ]
    },
    {
      "name":"Removing Tough Stains",
      "steps":[
        {
          "headline":"Perform a spot test with your intended cleaner.",
          "description":"Before you get started, apply a small amount of the cleaner on an inconspicuous spot on the wall. Rub it in, and then wipe it off. Carefully inspect the area to ensure the color of the paint isn't negatively affected. Even if it seems to be fine, only use abrasive cleaners when absolutely necessary."
        },
        {
          "headline":"Make a paste with baking soda and water.",
          "description":"Mix equal parts of baking soda and water to create a thick paste. Use your fingers or a utensil to apply the paste directly onto the stained area. Gently scrub the area with a non-abrasive sponge. Rinse with clean water and dry thoroughly."
        },
        {
          "headline":"Use a Magic Eraser on crayon and fingerprint stains.",
          "description":"Magic Erasers can be useful for removing tough stains left behind by small children. Wet the sponge, then wring it out. Scrub at the stain until it disappears. Use the less abrasive side of the sponge so that you don\u2019t scratch up the wall."
        },
        {
          "headline":"Get rid of tough stains with ammonia, vinegar and baking soda.",
          "description":"If dish soap, baking soda, vinegar and Magic Erasers all failed to remove the stain, create a stronger cleaning solution. Mix a gallon of water with 1 cup (120 mL) of ammonia, \u00bd cup (60 mL) of vinegar, and \u00bc cup (30 g) of baking soda. Use a gentle sponge to rub the solution into the stain with a circular motion. Rinse the solution away with a sponge dipped in clean water. Dry the area thoroughly."
        }
      ]
    }
  ],
  "text":" Doing Routine Cleaning Dust painted walls at least once every year. Dust removal is important for maintaining enamel-painted surfaces, but an annual dusting is all that most walls need. Run the brush attachment on your vacuum over the walls and ceilings to quickly remove dust from the surface. For smaller areas, a hand duster should suffice. Always dust before you do a deeper clean. For instance, before trying to remove a stain, give the walls a quick dusting. Make a cleaning solution with mild dish soap and warm water. Dirt and smudges will require more than a simple dusting to remove them. Fill a medium-sized bucket with warm water, then add a few drops of mild dish detergent. Use your hand or stirring device to mix them together. Fill a separate bucket up with  just warm water. You could also mix three tablespoons of distilled white vinegar in a gallon of water to create a safe cleaning solution for enamel-painted walls. Dampen a non-abrasive sponge with the solution. Dunk a non-abrasive sponge, like a cellulose sponge, into the bucket of cleaning solution. Squeeze it to remove excess solution. You want the sponge to be dampened but not dripping. Work in sections. Divide the surface up into a series of vertical sections and clean them one at a time. Starting from the top and working your way down to the bottom, gently use the sponge to scrub the surface in circular motion. Once the sponge starts looking dirty, dip it back into the  solution, wring it out thoroughly, and continue. If the water in the bucket starts to look dirty during the process, dump it out and create a fresh batch of cleaning solution. Rinse each section with clean water after scrubbing. Wet a second sponge with the clean water in your second bucket. Starting at the top and working your way down, use the wet sponge to wipe down the section and rinse away the cleaning solution. Be sure to remove all soap thoroughly, since dirt and grime can stick to soap residue if left on the wall. Dry the surface with a towel. Thoroughly go over each section with a fresh towel to remove excess moisture from the surface. Work systematically, such as from top to bottom, so that you won't miss any spots. Removing Tough Stains Perform a spot test with your intended cleaner. Before you get started, apply a small amount of the cleaner on an inconspicuous spot on the wall. Rub it in, and then wipe it off. Carefully inspect the area to ensure the color of the paint isn't negatively affected. Even if it seems to be fine, only use abrasive cleaners when absolutely necessary. Make a paste with baking soda and water. Mix equal parts of baking soda and water to create a thick paste. Use your fingers or a utensil to apply the paste directly onto the stained area. Gently scrub the area with a non-abrasive sponge. Rinse with clean water and dry thoroughly. Use a Magic Eraser on crayon and fingerprint stains. Magic Erasers can be useful for removing tough stains left behind by small children. Wet the sponge, then wring it out. Scrub at the stain until it disappears. Use the less abrasive side of the sponge so that you don\u2019t scratch up the wall. Get rid of tough stains with ammonia, vinegar and baking soda. If dish soap, baking soda, vinegar and Magic Erasers all failed to remove the stain, create a stronger cleaning solution. Mix a gallon of water with 1 cup (120 mL) of ammonia, \u00bd cup (60 mL) of vinegar, and \u00bc cup (30 g) of baking soda. Use a gentle sponge to rub the solution into the stain with a circular motion. Rinse the solution away with a sponge dipped in clean water. Dry the area thoroughly.",
  "tyn_model":[
    "water",
    "sponge",
    "baking soda",
    "bucket",
    "vinegar",
    "dish soap",
    "towel",
    "cleaner",
    "magic erasers",
    "ammonia",
    "vacuum",
    "mild dish detergent",
    "distilled white vinegar",
    "cleaning solution",
    "magic eraser"
  ],
  "tyn_section":[

  ]
}