{
  "title":"How to Clean a Dishwasher with Bleach",
  "url":"https://www.wikihow.com/Clean-a-Dishwasher-with-Bleach",
  "category_hierarchy":[
    "Home and Garden",
    "Housekeeping",
    "Cleaning",
    "House Cleaning"
  ],
  "methods":[
    {
      "name":"Creating a Cleaning Solution",
      "steps":[
        {
          "headline":"Wear the proper safety gear.",
          "description":"When handling liquid bleach, it's important that you wear thick rubber gloves and a facemask. Bleach can damage your skin, nose, eyes, and mouth so keep it away from your face while you're cleaning. EXPERT TIP\t\t\t\t\t\t\t\t\t\t\t\t\t\t\t\t\t\t\t\t\t\t\t\t\t\t\t\t\t\t\tChris Willatt\t\t\t\t\t\t\t\t\t\t\t\t\t\t\t\tCleaning Guru\t\t\t\t\t\t\t\tChris Willatt is the owner and founder of Alpine Maids, a cleaning agency in Denver, Colorado started in 2015. Alpine Maids has received Angie's List Super Service Award for three years in a row since 2016 and has been awarded Colorado's \"Top Rated Local House Cleaning\" Award in 2018. Chris Willatt\t\t\tCleaning Guru\t\t\t\tBe sure to work in a ventilated area. Chris Willatt, the owner of Alpine Maids, says: \"When you're working with bleach, it can oxidize your lungs, which is really harmful. Don't use it in a small confined space, and make sure to have the window or door open. If you can, give the chemicals a few minutes to evaporate before you go back and start cleaning. Also, you need to protect your eyes so you don't accidentally splash bleach in them, and wear gloves so you don't dry out your hands.\""
        },
        {
          "headline":"Take the proper safety precautions.",
          "description":"You'll want to make sure that you never mix liquid bleach with other household cleaning products like ammonia, vinegar, or rubbing alcohol. Only use cold or warm water when cleaning with bleach. If you mix bleach with the wrong cleaning product, it can create dangerous noxious fumes."
        },
        {
          "headline":"Fill a spray bottle with warm water.",
          "description":"Fill up a spray bottle with a quart of warm water. Do not mix bleach with boiling water because it can release a dangerous gas. Get water from the tap and test it with your finger to make sure that it's lukewarm."
        },
        {
          "headline":"Add chlorine bleach to the bottle.",
          "description":"Carefully measure out \u00be of a teaspoon (1.64 ml) of chlorine bleach and pour it into the top of the spray bottle. Once you add the bleach, shake the bottle to mix the solution together. The cleaning solution is now ready to be used for the interior and exterior of your dishwasher."
        }
      ]
    },
    {
      "name":"Cleaning the Dishwasher by Hand",
      "steps":[
        {
          "headline":"Remove all dishes and racks from the dishwasher.",
          "description":"Remove your dishes after you run a cycle and put them to the side. If you want to thoroughly clean your dishwasher, you'll also have to remove the plate racks. Typically these will slide out if you pull them towards you."
        },
        {
          "headline":"Clear out the holes in the spinning arms of the dishwasher.",
          "description":"The arms on the bottom of your washer have holes on them where the water comes out. When these get clogged, your dishwasher doesn't work as efficiently. Use a thin wire hanger or pin to make sure that these holes are clear of debris. Poke the holes with the thin object to remove any obstructions. The spinning arms at the bottom of the dishwasher and spray water onto the dishes when you run the cycle."
        },
        {
          "headline":"Clean around the side and lip of the door.",
          "description":"The side and lip of your dishwasher are prone to getting dirty. Open the dishwasher door and spray the bleach and water solution onto the plastic lip and side of the door. Wipe the solution dry with a dry cotton towel once you're done. Use a cotton swab or toothbrush to get to smaller areas that you can't reach."
        },
        {
          "headline":"Remove any obstructions from the drain.",
          "description":"The drain flushes out pieces of food during a wash cycle. Usually, the drain is in the bottom basin of your washer. Remove any built up debris that's been caught up in the drain with your hand. Food built up in your dishwasher's filter will make it run less efficiently."
        },
        {
          "headline":"Wash down the basin of the dishwasher.",
          "description":"Spray down the inside of your dishwasher with your bleach solution. Go in circular motions to wipe down the interior of the washer. Use a clean rag to wipe it dry."
        },
        {
          "headline":"Spray and wash down the door and buttons.",
          "description":"Remember to spray down the handles on the front of your dishwasher to get them saturated in the bleach and water solution. Use a damp sponge or rag to wipe down the door and buttons thoroughly. Once you finish, use a cloth or rag to dry down the exterior of your dishwasher."
        }
      ]
    },
    {
      "name":"Running a Wash with Bleach",
      "steps":[
        {
          "headline":"Ensure that your dishwasher isn't made with stainless steel.",
          "description":"Bleach can corrode and discolor stainless steel. You should not use liquid bleach if you are cleaning a stainless steel dishwasher."
        },
        {
          "headline":"Place a cup of liquid bleach on the top rack.",
          "description":"Use a measuring cup to measure out exactly a cup of liquid bleach. Transfer the bleach into a bowl or a glass and place it in the top of your dishwasher. Once you're done, close the dishwasher door."
        },
        {
          "headline":"Run your dishwasher on the highest heat.",
          "description":"Run a full cycle on the highest heat setting. The bleach will be tossed throughout the interior of your washing machine during the cycle. This will remove any mold or mildew on the inside of your dishwasher."
        }
      ]
    }
  ],
  "text":" Creating a Cleaning Solution Wear the proper safety gear. When handling liquid bleach, it's important that you wear thick rubber gloves and a facemask. Bleach can damage your skin, nose, eyes, and mouth so keep it away from your face while you're cleaning. EXPERT TIP\t\t\t\t\t\t\t\t\t\t\t\t\t\t\t\t\t\t\t\t\t\t\t\t\t\t\t\t\t\t\tChris Willatt\t\t\t\t\t\t\t\t\t\t\t\t\t\t\t\tCleaning Guru\t\t\t\t\t\t\t\tChris Willatt is the owner and founder of Alpine Maids, a cleaning agency in Denver, Colorado started in 2015. Alpine Maids has received Angie's List Super Service Award for three years in a row since 2016 and has been awarded Colorado's \"Top Rated Local House Cleaning\" Award in 2018. Chris Willatt\t\t\tCleaning Guru\t\t\t\tBe sure to work in a ventilated area. Chris Willatt, the owner of Alpine Maids, says: \"When you're working with bleach, it can oxidize your lungs, which is really harmful. Don't use it in a small confined space, and make sure to have the window or door open. If you can, give the chemicals a few minutes to evaporate before you go back and start cleaning. Also, you need to protect your eyes so you don't accidentally splash bleach in them, and wear gloves so you don't dry out your hands.\" Take the proper safety precautions. You'll want to make sure that you never mix liquid bleach with other household cleaning products like ammonia, vinegar, or rubbing alcohol. Only use cold or warm water when cleaning with bleach. If you mix bleach with the wrong cleaning product, it can create dangerous noxious fumes. Fill a spray bottle with warm water. Fill up a spray bottle with a quart of warm water. Do not mix bleach with boiling water because it can release a dangerous gas. Get water from the tap and test it with your finger to make sure that it's lukewarm. Add chlorine bleach to the bottle. Carefully measure out \u00be of a teaspoon (1.64 ml) of chlorine bleach and pour it into the top of the spray bottle. Once you add the bleach, shake the bottle to mix the solution together. The cleaning solution is now ready to be used for the interior and exterior of your dishwasher. Cleaning the Dishwasher by Hand Remove all dishes and racks from the dishwasher. Remove your dishes after you run a cycle and put them to the side. If you want to thoroughly clean your dishwasher, you'll also have to remove the plate racks. Typically these will slide out if you pull them towards you. Clear out the holes in the spinning arms of the dishwasher. The arms on the bottom of your washer have holes on them where the water comes out. When these get clogged, your dishwasher doesn't work as efficiently. Use a thin wire hanger or pin to make sure that these holes are clear of debris. Poke the holes with the thin object to remove any obstructions. The spinning arms at the bottom of the dishwasher and spray water onto the dishes when you run the cycle. Clean around the side and lip of the door. The side and lip of your dishwasher are prone to getting dirty. Open the dishwasher door and spray the bleach and water solution onto the plastic lip and side of the door. Wipe the solution dry with a dry cotton towel once you're done. Use a cotton swab or toothbrush to get to smaller areas that you can't reach. Remove any obstructions from the drain. The drain flushes out pieces of food during a wash cycle. Usually, the drain is in the bottom basin of your washer. Remove any built up debris that's been caught up in the drain with your hand. Food built up in your dishwasher's filter will make it run less efficiently. Wash down the basin of the dishwasher. Spray down the inside of your dishwasher with your bleach solution. Go in circular motions to wipe down the interior of the washer. Use a clean rag to wipe it dry. Spray and wash down the door and buttons. Remember to spray down the handles on the front of your dishwasher to get them saturated in the bleach and water solution. Use a damp sponge or rag to wipe down the door and buttons thoroughly. Once you finish, use a cloth or rag to dry down the exterior of your dishwasher. Running a Wash with Bleach Ensure that your dishwasher isn't made with stainless steel. Bleach can corrode and discolor stainless steel. You should not use liquid bleach if you are cleaning a stainless steel dishwasher. Place a cup of liquid bleach on the top rack. Use a measuring cup to measure out exactly a cup of liquid bleach. Transfer the bleach into a bowl or a glass and place it in the top of your dishwasher. Once you're done, close the dishwasher door. Run your dishwasher on the highest heat. Run a full cycle on the highest heat setting. The bleach will be tossed throughout the interior of your washing machine during the cycle. This will remove any mold or mildew on the inside of your dishwasher.",
  "tyn_model":[
    "bleach",
    "dishwasher",
    "water",
    "spray bottle",
    "washer",
    "liquid bleach",
    "chlorine bleach",
    "alpine maids,",
    "cleaning agency",
    "alpine maids has",
    "angie's list",
    "vinegar",
    "rubbing alcohol",
    "dishes",
    "plate",
    "thin wire hanger",
    "dishwasher door",
    "sponge",
    "measuring cup",
    "bowl"
  ],
  "tyn_section":[

  ]
}