{
  "title":"How to Clean Light Colored Leather",
  "url":"https://www.wikihow.com/Clean-Light-Colored-Leather",
  "category_hierarchy":[
    "Home and Garden",
    "Housekeeping",
    "Cleaning",
    "Cleaning Animal Materials",
    "Cleaning Leather"
  ],
  "methods":[
    {
      "name":"Doing General Cleaning",
      "steps":[
        {
          "headline":"Vacuum or dust the leather.",
          "description":"Prior to washing leather, you should vacuum or dust the surface to remove any loose crumbs or dirt. This should be done with a soft brush vacuum attachment or dusting cloth."
        },
        {
          "headline":"Mix together warm water and soap.",
          "description":"In a small bowl, dilute regular hand soap or dishwashing detergent in warm water. Mix together 1 teaspoon of soap for every four cups (946 ml) of water."
        },
        {
          "headline":"Dampen the cloth and wipe surface.",
          "description":"Dip a clean cloth into the soap and water mixture. Squeeze the cloth to remove any excess water. The cloth should be damp and not dripping wet. Wipe the leather surface with the damp cloth. Make sure to clean the entire surface. If you are cleaning a leather couch, it is best to start at the top and work your way down to the bottom."
        },
        {
          "headline":"Wipe with a clean damp cloth.",
          "description":"Then, take a clean cloth and dip it into plain water. Wring out the cloth so that it is wet, but not dripping. Wipe the entire surface with plain water. This will help remove any soap that remains on the surface."
        },
        {
          "headline":"Dry the leather.",
          "description":"Once you have rinsed the surface, take a dry towel and wipe the leather to remove all of the water. This will help dry the surface. You don\u2019t want to leave the surface wet because it could reduce the lifespan of your leather."
        },
        {
          "headline":"Apply leather conditioner after cleaning.",
          "description":"After washing the leather you should treat it with a conditioner. This will prevent the leather from drying out and cracking. Once cracks form it is much easier for dirt and oil to get trapped in the fabric, causing stains. You can use a commercial leather conditioner that can be purchased from a home store. Follow the directions to apply the conditioner. Alternatively, you could make your own conditioner by mixing together one part vinegar with one part linseed oil or flax oil. Apply the solution with a clean cloth and let sit overnight. Then, buff the surface using a dry cloth."
        }
      ]
    },
    {
      "name":"Removing Stains",
      "steps":[
        {
          "headline":"Remove stains with nail polish remover or rubbing alcohol.",
          "description":"If there are a few stains that won\u2019t come off with regular cleaning, then you can try treating them with nail polish remover or rubbing alcohol. Rub the stain with a cloth that has been dipped in rubbing alcohol or nail polish remover. Always test the fabric before applying to stains to ensure that it does not leave a mark."
        },
        {
          "headline":"Remove grease stains with baking soda.",
          "description":"In order to do this, you will need to apply baking soda to the stain and let it sit over night. The baking soda will absorb any grease from the leather. The next day, simply wipe the surface with a clean cloth."
        },
        {
          "headline":"Use toothpaste to clean leather shoes.",
          "description":"To do this, wipe off any loose dirt or dust, then wet your shoes using a damp cloth. Next, dab a small amount of toothpaste onto your shoes and rub in using your fingers. Pay close attention to any stains or scuff marks. Scrub any tough stains with an old toothbrush. Then, wipe away the toothpaste using a damp cloth. Let the shoes dry in a warm spot."
        },
        {
          "headline":"Make a lemon juice and cream of tartar cleaner.",
          "description":"Combine lemon juice with cream of tartar. Mix together, adjusting the amounts, until a paste is formed. Rub the mixture onto the stain and let sit for approximately half an hour. Then, remove the mixture with a sponge and wipe with a clean cloth."
        }
      ]
    },
    {
      "name":"Caring for Light Colored Leather",
      "steps":[
        {
          "headline":"Avoid spilling on and staining light colored leather.",
          "description":"Because light colored leather shows all marks and stains, you want to make sure that you avoid staining the material. For example, if you own a white leather couch, you should avoid eating and drinking regularly on the couch. This will reduce the likelihood of stains. Alternatively, if you own a cream colored leather handbag, you should not touch the bag immediately after putting on hand cream. The oils in the cream can transfer to the bag causing stains."
        },
        {
          "headline":"Wipe spills immediately.",
          "description":"As soon as a spill, smudge, or stain occurs on light colored leather, you should wipe it immediately with a microfiber cloth. If stains are left untreated they will become extremely difficult to remove. For example, you should wipe down light colored leather shoes after every use. This will keep them looking brand new."
        },
        {
          "headline":"Read any cleaning instructions that came with the product.",
          "description":"If you have purchased a leather designer handbag or couch, it may come with a list of cleaning instructions. Always read the instructions carefully before cleaning. They may give you helpful cleaning tips and product recommendations."
        },
        {
          "headline":"Get your leather professionally cleaned.",
          "description":"If you are unable to remove stains from your light colored leather products, then you should have them professionally cleaned. For example, a light colored leather couch will experience regular wear and tear from sweat or dirty hands. Have this leather professionally cleaned a few times each year."
        }
      ]
    }
  ],
  "text":" Doing General Cleaning Vacuum or dust the leather. Prior to washing leather, you should vacuum or dust the surface to remove any loose crumbs or dirt. This should be done with a soft brush vacuum attachment or dusting cloth. Mix together warm water and soap. In a small bowl, dilute regular hand soap or dishwashing detergent in warm water. Mix together 1 teaspoon of soap for every four cups (946 ml) of water. Dampen the cloth and wipe surface. Dip a clean cloth into the soap and water mixture. Squeeze the cloth to remove any excess water. The cloth should be damp and not dripping wet. Wipe the leather surface with the damp cloth. Make sure to clean the entire surface. If you are cleaning a leather couch, it is best to start at the top and work your way down to the bottom. Wipe with a clean damp cloth. Then, take a clean cloth and dip it into plain water. Wring out the cloth so that it is wet, but not dripping. Wipe the entire surface with plain water. This will help remove any soap that remains on the surface. Dry the leather. Once you have rinsed the surface, take a dry towel and wipe the leather to remove all of the water. This will help dry the surface. You don\u2019t want to leave the surface wet because it could reduce the lifespan of your leather. Apply leather conditioner after cleaning. After washing the leather you should treat it with a conditioner. This will prevent the leather from drying out and cracking. Once cracks form it is much easier for dirt and oil to get trapped in the fabric, causing stains. You can use a commercial leather conditioner that can be purchased from a home store. Follow the directions to apply the conditioner. Alternatively, you could make your own conditioner by mixing together one part vinegar with one part linseed oil or flax oil. Apply the solution with a clean cloth and let sit overnight. Then, buff the surface using a dry cloth. Removing Stains Remove stains with nail polish remover or rubbing alcohol. If there are a few stains that won\u2019t come off with regular cleaning, then you can try treating them with nail polish remover or rubbing alcohol. Rub the stain with a cloth that has been dipped in rubbing alcohol or nail polish remover. Always test the fabric before applying to stains to ensure that it does not leave a mark. Remove grease stains with baking soda. In order to do this, you will need to apply baking soda to the stain and let it sit over night. The baking soda will absorb any grease from the leather. The next day, simply wipe the surface with a clean cloth. Use toothpaste to clean leather shoes. To do this, wipe off any loose dirt or dust, then wet your shoes using a damp cloth. Next, dab a small amount of toothpaste onto your shoes and rub in using your fingers. Pay close attention to any stains or scuff marks. Scrub any tough stains with an old toothbrush. Then, wipe away the toothpaste using a damp cloth. Let the shoes dry in a warm spot. Make a lemon juice and cream of tartar cleaner. Combine lemon juice with cream of tartar. Mix together, adjusting the amounts, until a paste is formed. Rub the mixture onto the stain and let sit for approximately half an hour. Then, remove the mixture with a sponge and wipe with a clean cloth. Caring for Light Colored Leather Avoid spilling on and staining light colored leather. Because light colored leather shows all marks and stains, you want to make sure that you avoid staining the material. For example, if you own a white leather couch, you should avoid eating and drinking regularly on the couch. This will reduce the likelihood of stains. Alternatively, if you own a cream colored leather handbag, you should not touch the bag immediately after putting on hand cream. The oils in the cream can transfer to the bag causing stains. Wipe spills immediately. As soon as a spill, smudge, or stain occurs on light colored leather, you should wipe it immediately with a microfiber cloth. If stains are left untreated they will become extremely difficult to remove. For example, you should wipe down light colored leather shoes after every use. This will keep them looking brand new. Read any cleaning instructions that came with the product. If you have purchased a leather designer handbag or couch, it may come with a list of cleaning instructions. Always read the instructions carefully before cleaning. They may give you helpful cleaning tips and product recommendations. Get your leather professionally cleaned. If you are unable to remove stains from your light colored leather products, then you should have them professionally cleaned. For example, a light colored leather couch will experience regular wear and tear from sweat or dirty hands. Have this leather professionally cleaned a few times each year.",
  "tyn_model":[
    "water",
    "conditioner",
    "soap",
    "nail polish remover",
    "rubbing alcohol",
    "baking soda",
    "toothpaste",
    "cream of tartar",
    "vacuum",
    "soft brush vacuum attachment or dusting cloth",
    "regular hand soap",
    "dishwashing detergent",
    "plain water",
    "leather conditioner",
    "vinegar",
    "linseed oil",
    "flax oil",
    "toothbrush",
    "lemon juice",
    "lemon",
    "sponge",
    "hand cream",
    "microfiber cloth"
  ],
  "tyn_section":[

  ]
}