{
  "title":"How to Clean a Microwave with Baking Soda",
  "url":"https://www.wikihow.com/Clean-a-Microwave-with-Baking-Soda",
  "category_hierarchy":[
    "Home and Garden",
    "Housekeeping",
    "Cleaning"
  ],
  "methods":[
    {
      "name":"Applying Baking Soda Directly",
      "steps":[
        {
          "headline":"Remove the turntable and support ring, and sprinkle baking soda.",
          "description":"Set these pieces aside, on the kitchen counter or in the sink. Sprinkle the baking soda across the bottom of the microwave. Alternatively, you can use a baking soda paste to clean your microwave. Mix two parts baking soda to one part water and use a butter knife to apply the paste to the inside of the microwave. EXPERT TIP\t\t\t\t\t\t\t\t\t\t\t\t\t\t\t\t\t\t\t\t\t\t\t\t\t\t\t\t\t\t\tBridgett Price\t\t\t\t\t\t\t\t\t\t\t\t\t\t\t\tHouse Cleaning Professional\t\t\t\t\t\t\t\tBridgett Price is a Cleaning Guru and Co-Owner of Maideasy, a maid service company that services the Phoeniz, Arizona metropolitan area. She holds a Master of Management from the University of Phoenix, specializing in digital and traditional marketing. Bridgett Price\t\t\tHouse Cleaning Professional\t\t\t\tWash the plate with warm soapy water. Bridgett Price of Maid Easy says: \"For me, it's easiest to clean the microwave if I remove the spinning plate first, along with the axle it sits on. I hand-wash that, and then I have more room to work around the full base of the microwave.\""
        },
        {
          "headline":"Moisten a cloth with hot water and scrub.",
          "description":"Make sure to scrub the inside walls thoroughly as well as the inside of the microwave\u2019s door. This should dislodge even the most tenacious spills and stains. Make sure to wipe the turntable and support ring as well."
        },
        {
          "headline":"Rinse your cloth and wipe the microwave.",
          "description":"Wring out the baking soda mixture from the cloth then moisten it with hot water. Rinse the cloth again if needed, until you\u2019ve wiped all traces of the baking soda from the microwave."
        },
        {
          "headline":"Dry the turntable and support ring.",
          "description":"Wipe them down with a clean towel, then return them to the microwave."
        }
      ]
    },
    {
      "name":"Microwaving a Baking Soda Solution",
      "steps":[
        {
          "headline":"Mix a solution of water and baking soda.",
          "description":"Mix two tablespoons (30ml) of baking soda with one cup (237ml) of water. Pour the mixture into a microwaveable container and leave it unsealed."
        },
        {
          "headline":"Microwave the solution for three minutes.",
          "description":"As the solution warms and steams, the baking soda will absorb odors from the microwave. The steam will clean the walls of the microwave, loosening any lodged foods and oils. Let the container stand in the microwave for 15 minutes."
        },
        {
          "headline":"Remove the container.",
          "description":"The container will likely be very hot to the touch, use oven mitts to avoid burning yourself. Pour the contents of the container down the sink."
        },
        {
          "headline":"Use a damp cloth to wipe down the microwave.",
          "description":"Dampen a lint-free cloth with water. Wipe along the microwave\u2019s walls and its top. This will remove any traces of baking soda that may have collected on its walls. If you\u2019re really concerned about the cleanliness of the turntable and support ring, you can remove them from the microwave and wipe them down separately."
        },
        {
          "headline":"Leave the microwave door open and let it air dry.",
          "description":"If you don\u2019t have enough time to let the microwave air dry, you can wipe the inside down with a towel."
        }
      ]
    }
  ],
  "text":" Applying Baking Soda Directly Remove the turntable and support ring, and sprinkle baking soda. Set these pieces aside, on the kitchen counter or in the sink. Sprinkle the baking soda across the bottom of the microwave. Alternatively, you can use a baking soda paste to clean your microwave. Mix two parts baking soda to one part water and use a butter knife to apply the paste to the inside of the microwave. EXPERT TIP\t\t\t\t\t\t\t\t\t\t\t\t\t\t\t\t\t\t\t\t\t\t\t\t\t\t\t\t\t\t\tBridgett Price\t\t\t\t\t\t\t\t\t\t\t\t\t\t\t\tHouse Cleaning Professional\t\t\t\t\t\t\t\tBridgett Price is a Cleaning Guru and Co-Owner of Maideasy, a maid service company that services the Phoeniz, Arizona metropolitan area. She holds a Master of Management from the University of Phoenix, specializing in digital and traditional marketing. Bridgett Price\t\t\tHouse Cleaning Professional\t\t\t\tWash the plate with warm soapy water. Bridgett Price of Maid Easy says: \"For me, it's easiest to clean the microwave if I remove the spinning plate first, along with the axle it sits on. I hand-wash that, and then I have more room to work around the full base of the microwave.\" Moisten a cloth with hot water and scrub. Make sure to scrub the inside walls thoroughly as well as the inside of the microwave\u2019s door. This should dislodge even the most tenacious spills and stains. Make sure to wipe the turntable and support ring as well. Rinse your cloth and wipe the microwave. Wring out the baking soda mixture from the cloth then moisten it with hot water. Rinse the cloth again if needed, until you\u2019ve wiped all traces of the baking soda from the microwave. Dry the turntable and support ring. Wipe them down with a clean towel, then return them to the microwave. Microwaving a Baking Soda Solution Mix a solution of water and baking soda. Mix two tablespoons (30ml) of baking soda with one cup (237ml) of water. Pour the mixture into a microwaveable container and leave it unsealed. Microwave the solution for three minutes. As the solution warms and steams, the baking soda will absorb odors from the microwave. The steam will clean the walls of the microwave, loosening any lodged foods and oils. Let the container stand in the microwave for 15 minutes. Remove the container. The container will likely be very hot to the touch, use oven mitts to avoid burning yourself. Pour the contents of the container down the sink. Use a damp cloth to wipe down the microwave. Dampen a lint-free cloth with water. Wipe along the microwave\u2019s walls and its top. This will remove any traces of baking soda that may have collected on its walls. If you\u2019re really concerned about the cleanliness of the turntable and support ring, you can remove them from the microwave and wipe them down separately. Leave the microwave door open and let it air dry. If you don\u2019t have enough time to let the microwave air dry, you can wipe the inside down with a towel.",
  "tyn_model":[
    "microwave",
    "baking soda",
    "turntable",
    "water",
    "cloth",
    "hot water",
    "butter knife",
    "cleaning guru",
    "plate",
    "soapy water",
    "microwaveable container",
    "oven mitts",
    "towel"
  ],
  "tyn_section":[

  ]
}