{
  "title":"How to Clean a Moldy Dishwasher",
  "url":"https://www.wikihow.com/Clean-a-Moldy-Dishwasher",
  "category_hierarchy":[
    "Home and Garden",
    "Housekeeping",
    "Cleaning",
    "House Cleaning"
  ],
  "parts":[
    {
      "name":"Cleaning the Filter",
      "steps":[
        {
          "headline":"Slide out the bottom dish rack.",
          "description":"Simply slide it along the rails until it comes free. Make sure there aren\u2019t any dishes in the rack when you remove it."
        },
        {
          "headline":"Remove the filter.",
          "description":"You can find the filter at the bottom of the dishwasher. It\u2019s usually circular and can be found by the spinning water spout. Grab the top of the filter, rotate it counter-clockwise for a quarter turn. It should then come free from the assembly with a light pull. Some older dishwashers have a hard food grinder (or macerator) instead of a filter. Since they grind up fallen food, they won\u2019t usually need cleaning."
        },
        {
          "headline":"Wash the filter in the kitchen sink.",
          "description":"Turn on the sink and place the filter under the warm running water. Apply dishwashing soap to a kitchen sponge and rub the filter. Be gentle when you rub the filter as it can be quite delicate. If there\u2019s some more difficult food residue in your filter, you can use a toothbrush to coax them out. EXPERT TIP\t\"You should clean your dishwasher filter about every 3 months or so. Just take it out and rinse it under running water.\" Ashley Matuska\t\t\t\t\tCleaning Guru\t\t\t\t\t\t\t\tAshley Matuska is the owner and founder of Dashing Maids, a sustainably focused cleaning agency in Denver, Colorado. She has worked in the cleaning industry for over 5 years. Ashley MatuskaCleaning Guru"
        },
        {
          "headline":"Rinse the filter and place it back.",
          "description":"Rinse the filter under hot tap water. Return it to its place at the bottom of the dishwasher, making a clockwise quarter turn to set it in place. Place the dish rack back onto its rails. You don\u2019t need to let the filter dry before placing it back in the dishwasher."
        }
      ]
    },
    {
      "name":"Cleaning with Vinegar and Baking Soda",
      "steps":[
        {
          "headline":"Fill a dishwasher safe container with a cup (237ml) of vinegar.",
          "description":"Place the container on the top rack, leaving it open. Close the dishwasher and start a hot-water cycle. The vinegar will work to remove grime and mold that may have accumulated around the dishwasher. Make sure the dishwasher is empty save for your vinegar filled container."
        },
        {
          "headline":"Sprinkle a cup (237ml) of baking soda in the dishwasher.",
          "description":"Make sure the dishwasher is empty. Sprinkle it over the bottom. Let the baking soda sit in your dishwasher overnight. After doing so, turn the dishwasher on for a short hot water cycle. The baking soda will remove any remaining odors from the mold."
        },
        {
          "headline":"Use a toothbrush to scrub any remaining mold.",
          "description":"While the vinegar and baking soda will remove any mold on the walls, some of the dishwasher\u2019s nooks and crannies (such as the door seal and the folding arms) might need a bit more attention. Dip the toothbrush in soapy water and scrub at any mold you find. Pay close attention to the drain and spray arm at the bottom of the dishwasher. Humidity and food can collect there, making them a prime spot for mold. Scrub each thoroughly."
        }
      ]
    },
    {
      "name":"Preventing Mold from Forming",
      "steps":[
        {
          "headline":"Clean your dishwasher once a month.",
          "description":"Don\u2019t just clean your dishwasher when mold starts to appear; the appearance of mold in your dishwasher isn\u2019t just gross, it can be unhealthy. Regular cleaning will keep mold from building up and causing health problems"
        },
        {
          "headline":"Leave the door slightly ajar between cycles.",
          "description":"Moisture can stay stuck in the dishwasher between washes, creating a humid environment. Between that and the food within, your appliance becomes the ideal breeding ground for mold. Leaving the door open a crack will allow air pass through the dishwasher, preventing the growth of mold."
        },
        {
          "headline":"Empty the dishwasher and run a cleaning cycle.",
          "description":"Even if there are no dishes, make sure to add detergent to the dishwasher. If your dishwasher has a \u201csanitize\u201d option, make sure to activate it. This will increase the temperature of the water, giving your appliance a better clean. You can use a chlorine-based detergent to clean the dishwasher more thoroughly. Make sure you leave the door open slightly after the cleaning cycle is complete."
        }
      ]
    }
  ],
  "text":" Cleaning the Filter Slide out the bottom dish rack. Simply slide it along the rails until it comes free. Make sure there aren\u2019t any dishes in the rack when you remove it. Remove the filter. You can find the filter at the bottom of the dishwasher. It\u2019s usually circular and can be found by the spinning water spout. Grab the top of the filter, rotate it counter-clockwise for a quarter turn. It should then come free from the assembly with a light pull. Some older dishwashers have a hard food grinder (or macerator) instead of a filter. Since they grind up fallen food, they won\u2019t usually need cleaning. Wash the filter in the kitchen sink. Turn on the sink and place the filter under the warm running water. Apply dishwashing soap to a kitchen sponge and rub the filter. Be gentle when you rub the filter as it can be quite delicate. If there\u2019s some more difficult food residue in your filter, you can use a toothbrush to coax them out. EXPERT TIP\t\"You should clean your dishwasher filter about every 3 months or so. Just take it out and rinse it under running water.\" Ashley Matuska\t\t\t\t\tCleaning Guru\t\t\t\t\t\t\t\tAshley Matuska is the owner and founder of Dashing Maids, a sustainably focused cleaning agency in Denver, Colorado. She has worked in the cleaning industry for over 5 years. Ashley MatuskaCleaning Guru Rinse the filter and place it back. Rinse the filter under hot tap water. Return it to its place at the bottom of the dishwasher, making a clockwise quarter turn to set it in place. Place the dish rack back onto its rails. You don\u2019t need to let the filter dry before placing it back in the dishwasher. Cleaning with Vinegar and Baking Soda Fill a dishwasher safe container with a cup (237ml) of vinegar. Place the container on the top rack, leaving it open. Close the dishwasher and start a hot-water cycle. The vinegar will work to remove grime and mold that may have accumulated around the dishwasher. Make sure the dishwasher is empty save for your vinegar filled container. Sprinkle a cup (237ml) of baking soda in the dishwasher. Make sure the dishwasher is empty. Sprinkle it over the bottom. Let the baking soda sit in your dishwasher overnight. After doing so, turn the dishwasher on for a short hot water cycle. The baking soda will remove any remaining odors from the mold. Use a toothbrush to scrub any remaining mold. While the vinegar and baking soda will remove any mold on the walls, some of the dishwasher\u2019s nooks and crannies (such as the door seal and the folding arms) might need a bit more attention. Dip the toothbrush in soapy water and scrub at any mold you find. Pay close attention to the drain and spray arm at the bottom of the dishwasher. Humidity and food can collect there, making them a prime spot for mold. Scrub each thoroughly. Preventing Mold from Forming Clean your dishwasher once a month. Don\u2019t just clean your dishwasher when mold starts to appear; the appearance of mold in your dishwasher isn\u2019t just gross, it can be unhealthy. Regular cleaning will keep mold from building up and causing health problems Leave the door slightly ajar between cycles. Moisture can stay stuck in the dishwasher between washes, creating a humid environment. Between that and the food within, your appliance becomes the ideal breeding ground for mold. Leaving the door open a crack will allow air pass through the dishwasher, preventing the growth of mold. Empty the dishwasher and run a cleaning cycle. Even if there are no dishes, make sure to add detergent to the dishwasher. If your dishwasher has a \u201csanitize\u201d option, make sure to activate it. This will increase the temperature of the water, giving your appliance a better clean. You can use a chlorine-based detergent to clean the dishwasher more thoroughly. Make sure you leave the door open slightly after the cleaning cycle is complete.",
  "tyn_model":[
    "dishwasher",
    "water",
    "vinegar",
    "baking soda",
    "dishwashers",
    "macerator",
    "dishwashing soap",
    "kitchen sponge",
    "dishwasher filter",
    "dashing maids",
    "dish rack",
    "dishwasher safe container",
    "hot-water",
    "toothbrush",
    "soapy water",
    "food",
    "detergent",
    "\u201csanitize",
    "\u201d option",
    "chlorine-based detergent"
  ],
  "tyn_section":[

  ]
}