{
  "title":"How to Clean a Stainless Steel Dishwasher",
  "url":"https://www.wikihow.com/Clean-a-Stainless-Steel-Dishwasher",
  "category_hierarchy":[
    "Home and Garden",
    "Housekeeping",
    "Cleaning",
    "House Cleaning"
  ],
  "methods":[
    {
      "name":"Cleaning the Interior",
      "steps":[
        {
          "headline":"Run the garbage disposal.",
          "description":"Your stainless steel dishwasher drains into the same pipe your sink does. To keep the drain clear and effectively drain the water from the stainless steel dishwasher, run your garbage disposal before you start cleaning it."
        },
        {
          "headline":"Check the drain.",
          "description":"Remove the bottom rack on your stainless steel dishwasher. Examine it for clumps of debris that might cause it to drain improperly. Remove anything that might be clogging the drain. EXPERT TIP\t\t\t\t\t\t\t\t\t\t\t\t\t\t\t\t\t\t\t\t\t\t\t\t\t\t\t\t\t\t\tChris Willatt\t\t\t\t\t\t\t\t\t\t\t\t\t\t\t\tCleaning Guru\t\t\t\t\t\t\t\tChris Willatt is the owner and founder of Alpine Maids, a cleaning agency in Denver, Colorado started in 2015. Alpine Maids has received Angie's List Super Service Award for three years in a row since 2016 and has been awarded Colorado's \"Top Rated Local House Cleaning\" Award in 2018. Chris Willatt\t\t\tCleaning Guru\t\t\t\tIf the drain is easily accessible, scrub it with dish soap. Also, if your dishwasher has a filter you can access, wash it out every three months."
        },
        {
          "headline":"Run the wash with vinegar.",
          "description":"Fill a dishwasher-safe cup on the top rack of the stainless steel dishwasher with vinegar. Slide the rack back in the stainless steel dishwasher and close the door. With only the cupful of vinegar inside, turn the stainless steel dishwasher on and run it on the highest water temperature setting. The vinegar will help loosen grease and grime, and remove any odor that the dishwasher might have acquired. Use distilled white vinegar or specialized cleaning vinegar."
        },
        {
          "headline":"Wash again with baking soda.",
          "description":"When the first wash cycle is done, sprinkle the bottom of the stainless steel dishwasher with baking soda. Run the dishwasher on a short cycle with water at the highest temperature. Baking soda will help you remove stains from your dishwasher."
        },
        {
          "headline":"Wipe the edges along the door.",
          "description":"Check the area around the dishwasher door for debris and grime. Some dishwashers cannot adequately clean this area, which leads to an accumulation of yucky material. If you see anything, use a damp cloth to wipe the area down. Additionally, use a damp cotton swab to clean along the ridges of the seal."
        },
        {
          "headline":"Wash the filter.",
          "description":"The stainless steel dishwasher\u2019s filter collects prevents large debris from entering the drain. You\u2019ll probably have to use a screwdriver to remove the screws that hold the grate in place. Some newer stainless steel dishwashers, however, have filters that simply pop out when turned. Rinse the filter in your sink under warm water. Dip a soft-bristled toothbrush in warm, soapy water. Use the toothbrush to scrub the filter until clean. Replace it after cleaning. Not every stainless steel dishwasher has a filter."
        },
        {
          "headline":"Clean the utensil rack.",
          "description":"The utensil rack is a small container attached to the dishwasher rack. You might have just one, or one on each rack. Remove it and rinse it in the sink beneath warm water. Use a sponge dampened with warm, soapy water to clean the inside and outside of the utensil rack. If the utensil rack does not detach, just clean it inside and outside with a damp sponge or dishcloth."
        },
        {
          "headline":"Do not use bleach to clean your stainless steel dishwasher.",
          "description":"Stainless steel is pretty tough, but bleach can cause it to corrode. Instead, use a milder substance like dishwasher-safe detergent."
        }
      ]
    },
    {
      "name":"Cleaning the Spray Arm",
      "steps":[
        {
          "headline":"Remove the spray arms.",
          "description":"Most stainless steel dishwashers have two spray arms \u2013 one beneath each rack of the dishwasher. Pull each rack out. Untwist the spray arms by loosening the central bolt that holds them in place. They generally twist off quite easily by hand. The top spray arm is usually affixed to the bottom of the top dish rack. The lower spray arm is usually affixed to the bottom of the dishwasher itself."
        },
        {
          "headline":"Rinse the spray arms off.",
          "description":"Take the spray arms to your sink. Run them under warm water. Be sure to get water in the central hole and along the entire length of each spray arm."
        },
        {
          "headline":"Use a toothpick to clean the spray holes.",
          "description":"Along the top side of each spray arm is a series of small holes. When the stainless steel dishwasher is in operation, water is ejected from these holes. But over time, they might become clogged with gunk. To keep them clear, poke a toothpick through each hole to get them clean. There are usually eight to ten spray holes on each spray arm."
        }
      ]
    },
    {
      "name":"Cleaning the Outside",
      "steps":[
        {
          "headline":"Locate the grain of the stainless steel.",
          "description":"Stainless steel dishwashers and other products have a differentiated surface, with small flecks or striations in it. These flecks or striations are collectively known as the grain of the stainless steel. Conduct a close visual inspection of your stainless steel dishwasher to determine what direction the grain is oriented in. It might be up/down, left/right, or diagonally oriented."
        },
        {
          "headline":"Wash the outside of the dishwasher.",
          "description":"Dip a sponge or dishcloth in warm, soapy water. Move it along the surface of the stainless steel dishwasher in a motion consistent with its grain. For instance, if the grain of your stainless steel dishwasher is oriented up/down, wipe with your sponge or dishcloth using an up/down motion. If you wish, you could substitute a specially-formulated stainless steel cleaning product for warm, soapy water. Bar Keeper\u2019s Friend, for instance, is a popular product."
        },
        {
          "headline":"Dry the stainless steel dishwasher.",
          "description":"Once you\u2019ve washed the stainless steel dishwasher, use a dry sponge or dishcloth to dry it. Wipe away the warm, soapy water by moving the cloth or sponge along the direction of the dishwasher\u2019s grain. In other words, if the grain of your stainless steel dishwasher is oriented in an up/down direction, move the dry cloth or sponge in an up/down direction."
        },
        {
          "headline":"Do not use abrasive cleaning materials.",
          "description":"Cleaning solutions that contain chlorine should not be used to clean the exterior of your stainless steel dishwasher. This could cause corrosion. Likewise, do not use steel wool or other harsh cloths, as doing this could lead to scratching the surface."
        }
      ]
    }
  ],
  "text":" Cleaning the Interior Run the garbage disposal. Your stainless steel dishwasher drains into the same pipe your sink does. To keep the drain clear and effectively drain the water from the stainless steel dishwasher, run your garbage disposal before you start cleaning it. Check the drain. Remove the bottom rack on your stainless steel dishwasher. Examine it for clumps of debris that might cause it to drain improperly. Remove anything that might be clogging the drain. EXPERT TIP\t\t\t\t\t\t\t\t\t\t\t\t\t\t\t\t\t\t\t\t\t\t\t\t\t\t\t\t\t\t\tChris Willatt\t\t\t\t\t\t\t\t\t\t\t\t\t\t\t\tCleaning Guru\t\t\t\t\t\t\t\tChris Willatt is the owner and founder of Alpine Maids, a cleaning agency in Denver, Colorado started in 2015. Alpine Maids has received Angie's List Super Service Award for three years in a row since 2016 and has been awarded Colorado's \"Top Rated Local House Cleaning\" Award in 2018. Chris Willatt\t\t\tCleaning Guru\t\t\t\tIf the drain is easily accessible, scrub it with dish soap. Also, if your dishwasher has a filter you can access, wash it out every three months. Run the wash with vinegar. Fill a dishwasher-safe cup on the top rack of the stainless steel dishwasher with vinegar. Slide the rack back in the stainless steel dishwasher and close the door. With only the cupful of vinegar inside, turn the stainless steel dishwasher on and run it on the highest water temperature setting. The vinegar will help loosen grease and grime, and remove any odor that the dishwasher might have acquired. Use distilled white vinegar or specialized cleaning vinegar. Wash again with baking soda. When the first wash cycle is done, sprinkle the bottom of the stainless steel dishwasher with baking soda. Run the dishwasher on a short cycle with water at the highest temperature. Baking soda will help you remove stains from your dishwasher. Wipe the edges along the door. Check the area around the dishwasher door for debris and grime. Some dishwashers cannot adequately clean this area, which leads to an accumulation of yucky material. If you see anything, use a damp cloth to wipe the area down. Additionally, use a damp cotton swab to clean along the ridges of the seal. Wash the filter. The stainless steel dishwasher\u2019s filter collects prevents large debris from entering the drain. You\u2019ll probably have to use a screwdriver to remove the screws that hold the grate in place. Some newer stainless steel dishwashers, however, have filters that simply pop out when turned. Rinse the filter in your sink under warm water. Dip a soft-bristled toothbrush in warm, soapy water. Use the toothbrush to scrub the filter until clean. Replace it after cleaning. Not every stainless steel dishwasher has a filter. Clean the utensil rack. The utensil rack is a small container attached to the dishwasher rack. You might have just one, or one on each rack. Remove it and rinse it in the sink beneath warm water. Use a sponge dampened with warm, soapy water to clean the inside and outside of the utensil rack. If the utensil rack does not detach, just clean it inside and outside with a damp sponge or dishcloth. Do not use bleach to clean your stainless steel dishwasher. Stainless steel is pretty tough, but bleach can cause it to corrode. Instead, use a milder substance like dishwasher-safe detergent. Cleaning the Spray Arm Remove the spray arms. Most stainless steel dishwashers have two spray arms \u2013 one beneath each rack of the dishwasher. Pull each rack out. Untwist the spray arms by loosening the central bolt that holds them in place. They generally twist off quite easily by hand. The top spray arm is usually affixed to the bottom of the top dish rack. The lower spray arm is usually affixed to the bottom of the dishwasher itself. Rinse the spray arms off. Take the spray arms to your sink. Run them under warm water. Be sure to get water in the central hole and along the entire length of each spray arm. Use a toothpick to clean the spray holes. Along the top side of each spray arm is a series of small holes. When the stainless steel dishwasher is in operation, water is ejected from these holes. But over time, they might become clogged with gunk. To keep them clear, poke a toothpick through each hole to get them clean. There are usually eight to ten spray holes on each spray arm. Cleaning the Outside Locate the grain of the stainless steel. Stainless steel dishwashers and other products have a differentiated surface, with small flecks or striations in it. These flecks or striations are collectively known as the grain of the stainless steel. Conduct a close visual inspection of your stainless steel dishwasher to determine what direction the grain is oriented in. It might be up/down, left/right, or diagonally oriented. Wash the outside of the dishwasher. Dip a sponge or dishcloth in warm, soapy water. Move it along the surface of the stainless steel dishwasher in a motion consistent with its grain. For instance, if the grain of your stainless steel dishwasher is oriented up/down, wipe with your sponge or dishcloth using an up/down motion. If you wish, you could substitute a specially-formulated stainless steel cleaning product for warm, soapy water. Bar Keeper\u2019s Friend, for instance, is a popular product. Dry the stainless steel dishwasher. Once you\u2019ve washed the stainless steel dishwasher, use a dry sponge or dishcloth to dry it. Wipe away the warm, soapy water by moving the cloth or sponge along the direction of the dishwasher\u2019s grain. In other words, if the grain of your stainless steel dishwasher is oriented in an up/down direction, move the dry cloth or sponge in an up/down direction. Do not use abrasive cleaning materials. Cleaning solutions that contain chlorine should not be used to clean the exterior of your stainless steel dishwasher. This could cause corrosion. Likewise, do not use steel wool or other harsh cloths, as doing this could lead to scratching the surface.",
  "tyn_model":[
    "stainless steel dishwasher",
    "water",
    "sponge",
    "vinegar",
    "baking soda",
    "stainless steel dishwashers",
    "dishcloth",
    "garbage disposal",
    "alpine maids",
    "bleach",
    "dishwasher",
    "cleaning guru",
    "dish soap",
    "distilled white vinegar",
    "specialized cleaning vinegar",
    "dishwasher door",
    "dishwashers",
    "utensil",
    "dishwasher rack",
    "\u2013 one",
    "toothpick",
    "stainless steel",
    "stainless steel cleaning product",
    "keeper\u2019s friend",
    "cloth",
    "chlorine"
  ],
  "tyn_section":[

  ]
}