{
  "title":"How to Clean Brushed Aluminum",
  "url":"https://www.wikihow.com/Clean-Brushed-Aluminum",
  "category_hierarchy":[
    "Home and Garden",
    "Housekeeping",
    "Cleaning"
  ],
  "methods":[
    {
      "name":"Cleaning Brushed Aluminum Regularly",
      "steps":[
        {
          "headline":"Remove surface residue with a damp cloth.",
          "description":"Wipe any accumulated dirt or dust off your brushed aluminum surface with a damp dish rag or paper towel."
        },
        {
          "headline":"Scrub with a non-scratch cleaning pad.",
          "description":"Don\u2019t ruin the delicate design of brushed aluminum by scrubbing it with abrasive copper or steel-wool pads. Get rid of stubborn grime by using a non-scratch cleaning pad or sponge instead. Add a drop of dish soap to a damp pad and scour away."
        },
        {
          "headline":"Spray and wipe the surface with glass cleaner.",
          "description":"A window or glass cleaner will help your brushed aluminum sparkle. Spray the surface down, let the cleaner sit for about 30 seconds, and wipe it off with a dry paper towel."
        }
      ]
    },
    {
      "name":"Removing Oxidation and Deeply Cleaning",
      "steps":[
        {
          "headline":"Scrub grease off with hot water and soap.",
          "description":"Before you start tackling stains and oxidized areas on your brushed aluminum, make sure you cut through any grease or built up dirt. Wet a non-scratch scrubbing pad with hot water and dish soap to scrub the surface clean."
        },
        {
          "headline":"Use vinegar and water on oxidized areas.",
          "description":"Aluminum is less likely to get a white, dull looking build-up than silver, but the surface can still oxidize. A solution slightly acidic like 1 part white vinegar to 1 part water will clean the surface up nicely with a little bit of muscle. Dip a dish rag in the vinegar and water, rub the aluminum and repeat if necessary."
        },
        {
          "headline":"Remove spots with cream of tartar.",
          "description":"Brushed aluminum can build up stains in regularly used things like cookware. Combat this by mixing 2 tablespoons of cream of tartar to 1 tablespoon of water and apply the mixture to the discolored surface. Let it sit for several minutes and scrub with a dry wash cloth or non-scratch sponge. Wipe any left-over cream of tartar off with a dry paper towel."
        }
      ]
    },
    {
      "name":"Polishing and Sealing the Finish",
      "steps":[
        {
          "headline":"Wipe the surface down with a gentle cleaner.",
          "description":"Never use abrasive cleaners, like bleach or oven cleaners, on brushed aluminum. Spray a multi-purpose kitchen or window cleaner on the surface and wipe it off with a dry towel."
        },
        {
          "headline":"Apply metal polish by hand.",
          "description":"To shine your brushed aluminum and protect the finish, use a metal polish. The polish can be used on many types of metal, like copper and chrome. Dip a rag in the polish and apply a thick coat to the surface using circular motions."
        },
        {
          "headline":"Gently buff the metal.",
          "description":"Remember that brushed aluminum can be delicate, so you will want to gently buff the polish in the surface. If you use a rotary buffing tool, place it on the lowest setting. Use circular motions to rub the polish in by hand with a soft cloth."
        },
        {
          "headline":"Wipe any remaining polish off.",
          "description":"Create a nice shine to your brushed aluminum by wiping any remaining polish off thoroughly. Wipe the surface from top to bottom with a clean, dry, soft cloth."
        },
        {
          "headline":"Top your aluminum off with a clear sealant.",
          "description":"To protect the finish of your brushed aluminum, use a clear sealant lastly. This method works especially well for hubcaps and you can find a clear metal sealant at any auto parts store."
        }
      ]
    }
  ],
  "text":" Cleaning Brushed Aluminum Regularly Remove surface residue with a damp cloth. Wipe any accumulated dirt or dust off your brushed aluminum surface with a damp dish rag or paper towel. Scrub with a non-scratch cleaning pad. Don\u2019t ruin the delicate design of brushed aluminum by scrubbing it with abrasive copper or steel-wool pads. Get rid of stubborn grime by using a non-scratch cleaning pad or sponge instead. Add a drop of dish soap to a damp pad and scour away. Spray and wipe the surface with glass cleaner. A window or glass cleaner will help your brushed aluminum sparkle. Spray the surface down, let the cleaner sit for about 30 seconds, and wipe it off with a dry paper towel. Removing Oxidation and Deeply Cleaning Scrub grease off with hot water and soap. Before you start tackling stains and oxidized areas on your brushed aluminum, make sure you cut through any grease or built up dirt. Wet a non-scratch scrubbing pad with hot water and dish soap to scrub the surface clean. Use vinegar and water on oxidized areas. Aluminum is less likely to get a white, dull looking build-up than silver, but the surface can still oxidize. A solution slightly acidic like 1 part white vinegar to 1 part water will clean the surface up nicely with a little bit of muscle. Dip a dish rag in the vinegar and water, rub the aluminum and repeat if necessary. Remove spots with cream of tartar. Brushed aluminum can build up stains in regularly used things like cookware. Combat this by mixing 2 tablespoons of cream of tartar to 1 tablespoon of water and apply the mixture to the discolored surface. Let it sit for several minutes and scrub with a dry wash cloth or non-scratch sponge. Wipe any left-over cream of tartar off with a dry paper towel. Polishing and Sealing the Finish Wipe the surface down with a gentle cleaner. Never use abrasive cleaners, like bleach or oven cleaners, on brushed aluminum. Spray a multi-purpose kitchen or window cleaner on the surface and wipe it off with a dry towel. Apply metal polish by hand. To shine your brushed aluminum and protect the finish, use a metal polish. The polish can be used on many types of metal, like copper and chrome. Dip a rag in the polish and apply a thick coat to the surface using circular motions. Gently buff the metal. Remember that brushed aluminum can be delicate, so you will want to gently buff the polish in the surface. If you use a rotary buffing tool, place it on the lowest setting. Use circular motions to rub the polish in by hand with a soft cloth. Wipe any remaining polish off. Create a nice shine to your brushed aluminum by wiping any remaining polish off thoroughly. Wipe the surface from top to bottom with a clean, dry, soft cloth. Top your aluminum off with a clear sealant. To protect the finish of your brushed aluminum, use a clear sealant lastly. This method works especially well for hubcaps and you can find a clear metal sealant at any auto parts store.",
  "tyn_model":[
    "brushed aluminum",
    "water",
    "cream of tartar",
    "dish rag",
    "paper towel",
    "dish soap",
    "hot water",
    "vinegar",
    "metal polish",
    "clear sealant",
    "cleaning pad",
    "sponge",
    "glass cleaner",
    "window or glass cleaner",
    "soap",
    "white vinegar",
    "wash cloth or non-scratch sponge",
    "dry paper towel",
    "gentle cleaner",
    "oven cleaners",
    "multi-purpose kitchen or window cleaner",
    "rag",
    "rotary buffing tool",
    "aluminum",
    "clear metal sealant"
  ],
  "tyn_section":[

  ]
}