{
  "title":"How to Clean an Electric Grill",
  "url":"https://www.wikihow.com/Clean-an-Electric-Grill",
  "category_hierarchy":[
    "Home and Garden",
    "Housekeeping",
    "Cleaning"
  ],
  "methods":[
    {
      "name":"Cleaning an Indoor Countertop Grill",
      "steps":[
        {
          "headline":"Unplug your grill after cooking.",
          "description":"Protect yourself from electric shock by unplugging your grill before you put it anywhere near a wet sponge."
        },
        {
          "headline":"Let the grill cool down slightly.",
          "description":"The best time to clean the grill plates is when they\u2019re still warm. After you unplug the grill, let it cool down for about ten minutes."
        },
        {
          "headline":"Use a rubber spatula to scrape off leftover food.",
          "description":"It\u2019s important not to use abrasive scouring pads that can scratch the nonstick grill plates. Some electric grills come with a rubber spatula that can scrape off caked-on food, but any rubber spatula will do. Scrape along the ridges and crevices of the grill surface."
        },
        {
          "headline":"Wipe the plates down with a damp sponge.",
          "description":"Wet a soft sponge or rag and wring it out thoroughly. Rinse the sponge frequently while you wipe the plates down, because it will get greasy and grimy quickly. Use a dollop of dish soap on your sponge for tough jobs."
        },
        {
          "headline":"Remove the drip tray and wash it with soap water.",
          "description":"Dismantle your electric grill by taking the plates off and remove the drip tray. Squirt some dish soap and wash it with a soft, wet sponge or rag."
        },
        {
          "headline":"Dry all pieces with a paper towel.",
          "description":"Dry the drip tray and give the grill plates another once over with a paper towel. You\u2019ll remove any leftover gunk and get your pieces dry."
        },
        {
          "headline":"Put detachable parts in the dishwasher.",
          "description":"Some electric grills have detachable pieces that can be cleaned in the dishwasher. Follow the manufacturer's directions, but put the drip tray and cooking plates in the dishwasher if you can."
        }
      ]
    },
    {
      "name":"Cleaning an Outdoor Electric Grill",
      "steps":[
        {
          "headline":"Turn your grill off.",
          "description":"Make sure your electric grill is turned off, before you start cleaning it. Locate the power button and flip it off."
        },
        {
          "headline":"Scrape cooking grates with a stainless steel brush.",
          "description":"While the grill is slightly warm, scrape the cooking grates down with a stainless steel grill brush."
        },
        {
          "headline":"Take the removable liner off.",
          "description":"An outdoor electric grill will likely have a removable liner underneath the grates. Take this piece off and use a rubber spatula to scrape off any excess, dropped food pieces. If it\u2019s especially dirty, wash it with a wet soapy sponge."
        },
        {
          "headline":"Wipe the lid down.",
          "description":"Use a damp cloth to wipe the lid down. Make sure the cloth does not drip and never immerse this part in water."
        },
        {
          "headline":"Remove the grates to wash with soap and water.",
          "description":"If your grill is not very dirty, you may be able to skip this step. If it is, take the grates off and wash them with a wet sponge and dish soap. Scrape with a stainless steel brush as needed."
        },
        {
          "headline":"Completely dry any removable pieces.",
          "description":"Before you put the removable liner or grates back on and use your grill again, make sure it\u2019s completely dry. Use a dry dishrag or paper towel to thoroughly dry it."
        },
        {
          "headline":"Deep cleanse grates annually with vinegar and baking soda.",
          "description":"To remove all dried, burnt-on food residue, use a concoction of vinegar and baking soda by mixing 2 cups (470 mL) vinegar to 1 cup (240 mL) baking soda in a trash bag. Tie the dirty grates in the bag and leave it overnight. Dried on residue should fall off easily in the morning."
        }
      ]
    },
    {
      "name":"Using an Alternate Method to Clean an Indoor Grill",
      "steps":[
        {
          "headline":"Unplug the grill and let it cool.",
          "description":"Right after you cook with your grill, unplug it and let it cool down for about five minutes."
        },
        {
          "headline":"Place wet paper towels between the plates.",
          "description":"While the grill is still warm, lay two to three moistened paper towels on the bottom plate. How many paper towels you use will depend on how thick each one is. Use enough to be able to grab food particles without tearing them."
        },
        {
          "headline":"Close the lid and let the paper towels steam clean.",
          "description":"Let the warm grill plates and damp paper towels steam clean the grill for about 1 minute or until the plates completely cool down. Any caked-on grease will loosen up."
        },
        {
          "headline":"Open the lid and wipe the plates down.",
          "description":"Use the damp paper towels or dampen a sponge with hot water and dish soap. Scrub the grill down until it\u2019s squeaky clean."
        },
        {
          "headline":"Dry the grill before using it again.",
          "description":"Make sure your grill is dry, especially around the plug, and wipe it down from top to bottom with a clean, dry dishcloth."
        }
      ]
    }
  ],
  "text":" Cleaning an Indoor Countertop Grill Unplug your grill after cooking. Protect yourself from electric shock by unplugging your grill before you put it anywhere near a wet sponge. Let the grill cool down slightly. The best time to clean the grill plates is when they\u2019re still warm. After you unplug the grill, let it cool down for about ten minutes. Use a rubber spatula to scrape off leftover food. It\u2019s important not to use abrasive scouring pads that can scratch the nonstick grill plates. Some electric grills come with a rubber spatula that can scrape off caked-on food, but any rubber spatula will do. Scrape along the ridges and crevices of the grill surface. Wipe the plates down with a damp sponge. Wet a soft sponge or rag and wring it out thoroughly. Rinse the sponge frequently while you wipe the plates down, because it will get greasy and grimy quickly. Use a dollop of dish soap on your sponge for tough jobs. Remove the drip tray and wash it with soap water. Dismantle your electric grill by taking the plates off and remove the drip tray. Squirt some dish soap and wash it with a soft, wet sponge or rag. Dry all pieces with a paper towel. Dry the drip tray and give the grill plates another once over with a paper towel. You\u2019ll remove any leftover gunk and get your pieces dry. Put detachable parts in the dishwasher. Some electric grills have detachable pieces that can be cleaned in the dishwasher. Follow the manufacturer's directions, but put the drip tray and cooking plates in the dishwasher if you can. Cleaning an Outdoor Electric Grill Turn your grill off. Make sure your electric grill is turned off, before you start cleaning it. Locate the power button and flip it off. Scrape cooking grates with a stainless steel brush. While the grill is slightly warm, scrape the cooking grates down with a stainless steel grill brush. Take the removable liner off. An outdoor electric grill will likely have a removable liner underneath the grates. Take this piece off and use a rubber spatula to scrape off any excess, dropped food pieces. If it\u2019s especially dirty, wash it with a wet soapy sponge. Wipe the lid down. Use a damp cloth to wipe the lid down. Make sure the cloth does not drip and never immerse this part in water. Remove the grates to wash with soap and water. If your grill is not very dirty, you may be able to skip this step. If it is, take the grates off and wash them with a wet sponge and dish soap. Scrape with a stainless steel brush as needed. Completely dry any removable pieces. Before you put the removable liner or grates back on and use your grill again, make sure it\u2019s completely dry. Use a dry dishrag or paper towel to thoroughly dry it. Deep cleanse grates annually with vinegar and baking soda. To remove all dried, burnt-on food residue, use a concoction of vinegar and baking soda by mixing 2 cups (470 mL) vinegar to 1 cup (240 mL) baking soda in a trash bag. Tie the dirty grates in the bag and leave it overnight. Dried on residue should fall off easily in the morning. Using an Alternate Method to Clean an Indoor Grill Unplug the grill and let it cool. Right after you cook with your grill, unplug it and let it cool down for about five minutes. Place wet paper towels between the plates. While the grill is still warm, lay two to three moistened paper towels on the bottom plate. How many paper towels you use will depend on how thick each one is. Use enough to be able to grab food particles without tearing them. Close the lid and let the paper towels steam clean. Let the warm grill plates and damp paper towels steam clean the grill for about 1 minute or until the plates completely cool down. Any caked-on grease will loosen up. Open the lid and wipe the plates down. Use the damp paper towels or dampen a sponge with hot water and dish soap. Scrub the grill down until it\u2019s squeaky clean. Dry the grill before using it again. Make sure your grill is dry, especially around the plug, and wipe it down from top to bottom with a clean, dry dishcloth.",
  "tyn_model":[
    "grill",
    "plates",
    "sponge",
    "paper towels",
    "grill plates",
    "dish soap",
    "rubber spatula",
    "drip tray",
    "electric grill",
    "paper towel",
    "vinegar",
    "baking soda",
    "electric grills",
    "stainless steel brush",
    "water",
    "cooking grates",
    "stainless steel grill brush",
    "wet soapy sponge",
    "soap",
    "wet sponge",
    "hot water"
  ],
  "tyn_section":[

  ]
}