{
  "title":"How to Clean Anodized Cookware",
  "url":"https://www.wikihow.com/Clean-Anodized-Cookware",
  "category_hierarchy":[
    "Food and Entertaining",
    "Cooking Equipment",
    "Cookware"
  ],
  "methods":[
    {
      "name":"Using the Right Cleaners",
      "steps":[
        {
          "headline":"Clean your cookware with detergent.",
          "description":"Use a powerful dishwashing detergent to clean your anodized cookware. You can also use more mild detergents. Avoid using baking soda or any other alkaline-based cleaning products on the inside of your anodized cookware."
        },
        {
          "headline":"Use gentle scrubbers.",
          "description":"Clean your cookware with mild scouring powders, like Barkeeper\u2019s Friend, Ajax, or Comet. Scrub with non-abrasive sponges, scrubby sponges, soft-bristled cleaning brushes, dish cloths or rags. Avoid using steel wool and only use abrasive scrubbing pads sparingly."
        },
        {
          "headline":"Don\u2019t use cleaning solutions that aren\u2019t intended for cookware.",
          "description":"Never use oven cleaner or other caustic cleaning agents on your cookware. Also avoid any liquid household cleaners. This includes floor cleaners, silver polish, grout cleaner, or porcelain cleaner. Don\u2019t clean your anodized cookware with bleach."
        }
      ]
    },
    {
      "name":"Washing Your Cookware",
      "steps":[
        {
          "headline":"Wash your cookware before you use it.",
          "description":"When you first get your cookware, treat it like you would any other cookware. Wash it in warm water with a mild dish soap. Rinse it thoroughly and dry it completely. Season your cookware with oil to help prevent food from sticking to it."
        },
        {
          "headline":"Prevent warping while washing your pans.",
          "description":"Never immerse hot cookware in cold water. Rather, allow your pans to cool completely before washing. Cold water can warp a hot pan. This is only relevant for hot pans and cold water. Putting hot pans in hot water or cold pans in hot water will not warp your cookware."
        },
        {
          "headline":"Wash with soap and hot water.",
          "description":"Wash your cookware by hand. Use a mild dish washing liquid and hot or warm water. Clean your cookware as soon as possible after using it. This will help maintain it and make washing it easier."
        }
      ]
    },
    {
      "name":"Removing Stains and Burnt Residue",
      "steps":[
        {
          "headline":"Scour the outside of your cookware.",
          "description":"If you have stains or burns on the outside of your cookware, you can use a scouring agent to clean them. Mix baking soda or a mild scouring powder with a little water to make a paste. Rub the paste on the stains with a dishcloth or soft-bristled cleaning brush and rinse with warm water."
        },
        {
          "headline":"Soak your pots and pans.",
          "description":"To remove stains or burnt residue from the inside of your cookware, soak it with hot water and soap. Pour out most of the soap and water, then use a dishcloth, gentle scrubbing pad, or or soft-bristled cleaning brush to scrub at the stain or burnt food residue. Rinse well. Never put your anodized cookware in the dishwasher. Putting your pan in the dishwasher might discolor or scratch your cookware and in many cases will also void your warranty."
        },
        {
          "headline":"Simmer dish soap in the pan to remove very stubborn stains and residue.",
          "description":"Fill up the piece of cookware with water and add some dishwashing liquid. Simmer this for about 20 minutes. Give it at least 30 minutes to cool. Remove the residue or stain with a gentle scrubbing pad or soft-bristled cleaning brush. Rinse thoroughly."
        },
        {
          "headline":"Finish with a gentle scouring powder.",
          "description":"Scour the stain with a gentle scouring powder like Barkeeper\u2019s Friend and hot water. Use a gentle scrubbing pad or soft-bristled cleaning brush. Rinse out all of the scouring powder."
        }
      ]
    }
  ],
  "text":" Using the Right Cleaners Clean your cookware with detergent. Use a powerful dishwashing detergent to clean your anodized cookware. You can also use more mild detergents. Avoid using baking soda or any other alkaline-based cleaning products on the inside of your anodized cookware. Use gentle scrubbers. Clean your cookware with mild scouring powders, like Barkeeper\u2019s Friend, Ajax, or Comet. Scrub with non-abrasive sponges, scrubby sponges, soft-bristled cleaning brushes, dish cloths or rags. Avoid using steel wool and only use abrasive scrubbing pads sparingly. Don\u2019t use cleaning solutions that aren\u2019t intended for cookware. Never use oven cleaner or other caustic cleaning agents on your cookware. Also avoid any liquid household cleaners. This includes floor cleaners, silver polish, grout cleaner, or porcelain cleaner. Don\u2019t clean your anodized cookware with bleach. Washing Your Cookware Wash your cookware before you use it. When you first get your cookware, treat it like you would any other cookware. Wash it in warm water with a mild dish soap. Rinse it thoroughly and dry it completely. Season your cookware with oil to help prevent food from sticking to it. Prevent warping while washing your pans. Never immerse hot cookware in cold water. Rather, allow your pans to cool completely before washing. Cold water can warp a hot pan. This is only relevant for hot pans and cold water. Putting hot pans in hot water or cold pans in hot water will not warp your cookware. Wash with soap and hot water. Wash your cookware by hand. Use a mild dish washing liquid and hot or warm water. Clean your cookware as soon as possible after using it. This will help maintain it and make washing it easier. Removing Stains and Burnt Residue Scour the outside of your cookware. If you have stains or burns on the outside of your cookware, you can use a scouring agent to clean them. Mix baking soda or a mild scouring powder with a little water to make a paste. Rub the paste on the stains with a dishcloth or soft-bristled cleaning brush and rinse with warm water. Soak your pots and pans. To remove stains or burnt residue from the inside of your cookware, soak it with hot water and soap. Pour out most of the soap and water, then use a dishcloth, gentle scrubbing pad, or or soft-bristled cleaning brush to scrub at the stain or burnt food residue. Rinse well. Never put your anodized cookware in the dishwasher. Putting your pan in the dishwasher might discolor or scratch your cookware and in many cases will also void your warranty. Simmer dish soap in the pan to remove very stubborn stains and residue. Fill up the piece of cookware with water and add some dishwashing liquid. Simmer this for about 20 minutes. Give it at least 30 minutes to cool. Remove the residue or stain with a gentle scrubbing pad or soft-bristled cleaning brush. Rinse thoroughly. Finish with a gentle scouring powder. Scour the stain with a gentle scouring powder like Barkeeper\u2019s Friend and hot water. Use a gentle scrubbing pad or soft-bristled cleaning brush. Rinse out all of the scouring powder.",
  "tyn_model":[
    "water",
    "soap",
    "gentle scrubbing pad",
    "soft-bristled cleaning brush",
    "baking soda",
    "barkeeper\u2019s friend",
    "dish soap",
    "hot water",
    "detergent",
    "dishwashing detergent",
    "ajax",
    "comet",
    "scrubby sponges",
    "dish cloths",
    "oven cleaner",
    "household cleaners",
    "floor cleaners",
    "silver polish",
    "grout cleaner",
    "porcelain cleaner",
    "bleach",
    "oil",
    "dishcloth or",
    "pots",
    "dishcloth,",
    "dishwashing liquid"
  ],
  "tyn_section":[

  ]
}