{
  "title":"How to Clean Travertine Floors",
  "url":"https://www.wikihow.com/Clean-Travertine-Floors",
  "category_hierarchy":[
    "Home and Garden",
    "DIY",
    "Tiles and Tiling",
    "Travertine"
  ],
  "parts":[
    {
      "name":"Choosing a Cleanser",
      "steps":[
        {
          "headline":"Use a cleanser formulated for travertine.",
          "description":"Travertine can become dull and damaged if you use a harsh cleanser. Consider purchasing a floor cleaner formulated for travertine to use regularly. The label should clearly state if the cleanser is formulated specifically for travertine. Opt for a cleanser with a neutral pH of 7 or below. You can also use mild dish soap to clean travertine floors 3-4 times per year. Do not use dish soap more than 3-4 times per year to avoid soap scum."
        },
        {
          "headline":"Avoid products with harsh chemicals.",
          "description":"You should never use harsh cleaners like bleach or ammonia on travertine floors. These harsh chemicals can damage and dull the surface of your travertine floors, aging them well before their time."
        },
        {
          "headline":"Do not use vinegar or citrus to clean travertine floors.",
          "description":"You should avoid using acidic cleaning agents on travertine floors, as they can dull and damage the surface of the stone. Do not clean floors with products that contain vinegar, lemon, orange, or other citrus extracts."
        }
      ]
    },
    {
      "name":"Cleaning the Floor",
      "steps":[
        {
          "headline":"Use a dust mop to remove loose dirt.",
          "description":"Before you mop your travertine floor, you will want to make sure you remove any loose dirt or debris from the floor\u2019s surface. Try using a dust mop made of microfiber to remove loose dirt."
        },
        {
          "headline":"Fill a bucket with warm water and cleanser.",
          "description":"Carefully read the directions on the label of the travertine-friendly floor cleanser. Add the cleanser to a bucket of warm water, according to the directions on the label. If using mild dish soap, add a small squirt of soap to the bucket."
        },
        {
          "headline":"Wring out a mop in the cleaning solution.",
          "description":"Place the mop in the bucket of water and cleaning solution. Then lift the mop from the bucket and wring out the mop. Make sure you wring out as much water from the mop as possible."
        },
        {
          "headline":"Mop the floor with the cleaning solution.",
          "description":"After wringing out the mop, use side-to-side motions to mop the floor. Begin at one side of the floor and systematically mop your way to the other side. Rinse the mop in the cleaning solution frequently, thoroughly wringing out the mop after rinsing. If you are mopping a large area, make a fresh bucket of cleaning solution after cleaning half of the floor area."
        },
        {
          "headline":"Mop the floor with water.",
          "description":"After mopping the floor with cleaning solution, you will want to rinse it with fresh water. Dump the cleaning solution down the drain and fill the bucket with fresh, clean water. Mop the floor with the clean water. Fill the bucket with fresh water about halfway through and continue mopping."
        },
        {
          "headline":"Dry the floor with a soft cloth.",
          "description":"After you mop the floors with clean water, you will want to dry them. This will prevent streaks and smudges from forming on the floor as the water dries. Use a soft, non-abrasive cloth made of cotton or microfiber to thoroughly dry the floors."
        }
      ]
    },
    {
      "name":"Maintaining Your Travertine Floor",
      "steps":[
        {
          "headline":"Dust mop regularly.",
          "description":"One of the most important parts of maintaining your travertine floor is the removal of dust and debris on a regular basis. Try using a microfiber dust mop on your travertine floors several times a week."
        },
        {
          "headline":"Wet mop floors once a week.",
          "description":"You should wet mop your floors weekly, or more often if the travertine floor is in a high traffic area. Regular mopping with a travertine-friendly cleaning solution will help your floors maintain their natural beauty for years."
        },
        {
          "headline":"Clean up spills immediately.",
          "description":"You can extend the life of travertine floors and avoid unsightly stains by cleaning up spills as soon as they happen. This is especially important if you spill something acidic like tomato sauce, carbonated beverages, or wine. The acid in these products can damage travertine."
        },
        {
          "headline":"Place rugs in high traffic areas.",
          "description":"Travertine floors can scratch easily. Protect high traffic areas by placing area rugs, doormats, and runners on the floor. This will help prevent dirt and debris from scratching the surface of the floor."
        },
        {
          "headline":"Seal travertine floors yearly.",
          "description":"It is important that you seal travertine floors on a regular basis. Sealing floors helps prevent damage to the surface of the travertine. Contact the manufacturer and/or installer of your travertine floors to find a sealant that will work for you."
        }
      ]
    }
  ],
  "text":" Choosing a Cleanser Use a cleanser formulated for travertine. Travertine can become dull and damaged if you use a harsh cleanser. Consider purchasing a floor cleaner formulated for travertine to use regularly. The label should clearly state if the cleanser is formulated specifically for travertine. Opt for a cleanser with a neutral pH of 7 or below. You can also use mild dish soap to clean travertine floors 3-4 times per year. Do not use dish soap more than 3-4 times per year to avoid soap scum. Avoid products with harsh chemicals. You should never use harsh cleaners like bleach or ammonia on travertine floors. These harsh chemicals can damage and dull the surface of your travertine floors, aging them well before their time. Do not use vinegar or citrus to clean travertine floors. You should avoid using acidic cleaning agents on travertine floors, as they can dull and damage the surface of the stone. Do not clean floors with products that contain vinegar, lemon, orange, or other citrus extracts. Cleaning the Floor Use a dust mop to remove loose dirt. Before you mop your travertine floor, you will want to make sure you remove any loose dirt or debris from the floor\u2019s surface. Try using a dust mop made of microfiber to remove loose dirt. Fill a bucket with warm water and cleanser. Carefully read the directions on the label of the travertine-friendly floor cleanser. Add the cleanser to a bucket of warm water, according to the directions on the label. If using mild dish soap, add a small squirt of soap to the bucket. Wring out a mop in the cleaning solution. Place the mop in the bucket of water and cleaning solution. Then lift the mop from the bucket and wring out the mop. Make sure you wring out as much water from the mop as possible. Mop the floor with the cleaning solution. After wringing out the mop, use side-to-side motions to mop the floor. Begin at one side of the floor and systematically mop your way to the other side. Rinse the mop in the cleaning solution frequently, thoroughly wringing out the mop after rinsing. If you are mopping a large area, make a fresh bucket of cleaning solution after cleaning half of the floor area. Mop the floor with water. After mopping the floor with cleaning solution, you will want to rinse it with fresh water. Dump the cleaning solution down the drain and fill the bucket with fresh, clean water. Mop the floor with the clean water. Fill the bucket with fresh water about halfway through and continue mopping. Dry the floor with a soft cloth. After you mop the floors with clean water, you will want to dry them. This will prevent streaks and smudges from forming on the floor as the water dries. Use a soft, non-abrasive cloth made of cotton or microfiber to thoroughly dry the floors. Maintaining Your Travertine Floor Dust mop regularly. One of the most important parts of maintaining your travertine floor is the removal of dust and debris on a regular basis. Try using a microfiber dust mop on your travertine floors several times a week. Wet mop floors once a week. You should wet mop your floors weekly, or more often if the travertine floor is in a high traffic area. Regular mopping with a travertine-friendly cleaning solution will help your floors maintain their natural beauty for years. Clean up spills immediately. You can extend the life of travertine floors and avoid unsightly stains by cleaning up spills as soon as they happen. This is especially important if you spill something acidic like tomato sauce, carbonated beverages, or wine. The acid in these products can damage travertine. Place rugs in high traffic areas. Travertine floors can scratch easily. Protect high traffic areas by placing area rugs, doormats, and runners on the floor. This will help prevent dirt and debris from scratching the surface of the floor. Seal travertine floors yearly. It is important that you seal travertine floors on a regular basis. Sealing floors helps prevent damage to the surface of the travertine. Contact the manufacturer and/or installer of your travertine floors to find a sealant that will work for you.",
  "tyn_model":[
    "water",
    "bucket",
    "cleanser",
    "cleaning solution",
    "travertine floors",
    "dish soap",
    "vinegar",
    "dust mop",
    "rugs",
    "floor cleaner",
    "bleach",
    "ammonia",
    "citrus",
    "lemon",
    "warm water",
    "soap",
    "microfiber dust mop",
    "travertine-friendly cleaning solution",
    "runners",
    "sealant"
  ],
  "tyn_section":[

  ]
}