{
  "title":"How to Clean a Non\u2010Self\u2010Cleaning Oven",
  "url":"https://www.wikihow.com/Clean-a-Non%E2%80%90Self%E2%80%90Cleaning-Oven",
  "category_hierarchy":[
    "Home and Garden",
    "Housekeeping",
    "Cleaning"
  ],
  "methods":[
    {
      "name":"Cleaning the Oven with Commercial Cleaners",
      "steps":[
        {
          "headline":"Remove the oven racks.",
          "description":"Slide the oven racks out of your oven along with any other pans, thermometers or loose items inside. Set these aside to be cleaned separately. The oven should be off and completely cool when you clean it."
        },
        {
          "headline":"Apply oven cleaner inside.",
          "description":"Put on rubber gloves first. Spray or drizzle the oven cleaner on the bottom and sides of the oven. Some cleaning solutions can even be used on the glass in the door. Make sure to target any crusted spots or stains. Brands of oven cleaner that you can buy include Easy Off, Citrusafe, and Mr. Muscle. Look for \u201cfume-free\u201d oven cleaners. These will require less ventilation, and they are safer to use in the kitchen around pets and children."
        },
        {
          "headline":"Close the oven door.",
          "description":"You may need to leave the oven cleaner to soak for as long as four hours. Close the door of the oven to prevent fumes from escaping. Do not use or turn on the oven during this time. Fumes may still escape the oven. You should make sure that the room has plenty of ventilation by opening room doors and windows."
        },
        {
          "headline":"Wipe cleaner off.",
          "description":"Dampen a sponge with water, and wipe up all of the oven cleaner from the inside of the oven. You may need to scrub to get stains or burnt residue off the bottom. Rinse out the sponge, and wipe the oven down again until there are no more traces of cleaner."
        },
        {
          "headline":"Let the oven dry.",
          "description":"Leave the oven door open to let the oven completely air dry. This can take up to a few hours. Do not use the oven during this time. There should be no traces of oven cleaner left. If there are, wet a sponge, and wipe it up before letting the oven dry again."
        }
      ]
    },
    {
      "name":"Using Baking Soda Paste",
      "steps":[
        {
          "headline":"Mix baking soda and water.",
          "description":"To make a paste, mix about \u00bd cup of baking soda with two or three tablespoons of water. You want to have a thick but smooth paste that you can easily spread on the bottom of the oven. If the solution is too thick, you can add more water. If it is too runny, you can add more baking soda. Double or triple the recipe based on how much cleaning solution you need for your oven."
        },
        {
          "headline":"Spread the paste around the oven.",
          "description":"Use a sponge to evenly coat the bottom and sides of the oven with the baking soda paste. Make sure that all stains and encrusted areas are covered with the paste. You can also clean the inside of the oven window with this mixture. Open the oven door so that it is flat, and spread out the paste on top of the window."
        },
        {
          "headline":"Spray vinegar on the paste.",
          "description":"Put distilled white vinegar in a spray bottle, and spray it over the baking soda paste. It will start to fizz. This process will help break down grease and  stains caked onto the bottom of the oven. You can also do this step after the baking soda has sat for a few hours. This helps remove any remaining baking soda."
        },
        {
          "headline":"Wait.",
          "description":"Leave the baking soda paste on overnight or for at least twelve hours. This will let the baking soda break down grime, and it will make the stains easier to remove."
        },
        {
          "headline":"Wipe up paste with a damp cloth.",
          "description":"Use a warm, damp cloth to wipe up the baking soda. Most of the crust or stains should wipe up easily, but you may need to scrub to get harder stains out. If the bottom of your oven is very dirty, you may need to rinse out the sponge and wipe everything down again. Do this as needed until the oven is clean. If there are still crusted-on stains in hard to reach places, you can use a spatula to scrub them off."
        }
      ]
    },
    {
      "name":"Washing the Oven Racks",
      "steps":[
        {
          "headline":"Place towels on the bottom of your bathtub.",
          "description":"Take some old towels, and lay them over your bathtub, covering any space that might touch the oven racks. This will protect your tub from scratches and stains from the oven racks."
        },
        {
          "headline":"Fill the bath with water and soap.",
          "description":"Fill the bath with hot water. Mix half a cup of dishwashing liquid or powder into the water until the water is soapy."
        },
        {
          "headline":"Leave the racks to soak for twelve hours.",
          "description":"Place the oven racks in the bathtub, making sure that each rack is submerged under the water as much as possible. Leave them to soak overnight or up to twelve hours."
        },
        {
          "headline":"Wipe down and rinse the racks.",
          "description":"When you remove the racks, use a damp rag or sponge to wipe off grime, grease, and dirt. Rinse them with clean water from the shower or sink. To dry the racks, wipe them down with a dry rag or old towel before putting them back in the oven. You can remove the towels from the bathtub at this point, and wash them separately in a laundry machine."
        }
      ]
    }
  ],
  "text":" Cleaning the Oven with Commercial Cleaners Remove the oven racks. Slide the oven racks out of your oven along with any other pans, thermometers or loose items inside. Set these aside to be cleaned separately. The oven should be off and completely cool when you clean it. Apply oven cleaner inside. Put on rubber gloves first. Spray or drizzle the oven cleaner on the bottom and sides of the oven. Some cleaning solutions can even be used on the glass in the door. Make sure to target any crusted spots or stains. Brands of oven cleaner that you can buy include Easy Off, Citrusafe, and Mr. Muscle. Look for \u201cfume-free\u201d oven cleaners. These will require less ventilation, and they are safer to use in the kitchen around pets and children. Close the oven door. You may need to leave the oven cleaner to soak for as long as four hours. Close the door of the oven to prevent fumes from escaping. Do not use or turn on the oven during this time. Fumes may still escape the oven. You should make sure that the room has plenty of ventilation by opening room doors and windows. Wipe cleaner off. Dampen a sponge with water, and wipe up all of the oven cleaner from the inside of the oven. You may need to scrub to get stains or burnt residue off the bottom. Rinse out the sponge, and wipe the oven down again until there are no more traces of cleaner. Let the oven dry. Leave the oven door open to let the oven completely air dry. This can take up to a few hours. Do not use the oven during this time. There should be no traces of oven cleaner left. If there are, wet a sponge, and wipe it up before letting the oven dry again. Using Baking Soda Paste Mix baking soda and water. To make a paste, mix about \u00bd cup of baking soda with two or three tablespoons of water. You want to have a thick but smooth paste that you can easily spread on the bottom of the oven. If the solution is too thick, you can add more water. If it is too runny, you can add more baking soda. Double or triple the recipe based on how much cleaning solution you need for your oven. Spread the paste around the oven. Use a sponge to evenly coat the bottom and sides of the oven with the baking soda paste. Make sure that all stains and encrusted areas are covered with the paste. You can also clean the inside of the oven window with this mixture. Open the oven door so that it is flat, and spread out the paste on top of the window. Spray vinegar on the paste. Put distilled white vinegar in a spray bottle, and spray it over the baking soda paste. It will start to fizz. This process will help break down grease and  stains caked onto the bottom of the oven. You can also do this step after the baking soda has sat for a few hours. This helps remove any remaining baking soda. Wait. Leave the baking soda paste on overnight or for at least twelve hours. This will let the baking soda break down grime, and it will make the stains easier to remove. Wipe up paste with a damp cloth. Use a warm, damp cloth to wipe up the baking soda. Most of the crust or stains should wipe up easily, but you may need to scrub to get harder stains out. If the bottom of your oven is very dirty, you may need to rinse out the sponge and wipe everything down again. Do this as needed until the oven is clean. If there are still crusted-on stains in hard to reach places, you can use a spatula to scrub them off. Washing the Oven Racks Place towels on the bottom of your bathtub. Take some old towels, and lay them over your bathtub, covering any space that might touch the oven racks. This will protect your tub from scratches and stains from the oven racks. Fill the bath with water and soap. Fill the bath with hot water. Mix half a cup of dishwashing liquid or powder into the water until the water is soapy. Leave the racks to soak for twelve hours. Place the oven racks in the bathtub, making sure that each rack is submerged under the water as much as possible. Leave them to soak overnight or up to twelve hours. Wipe down and rinse the racks. When you remove the racks, use a damp rag or sponge to wipe off grime, grease, and dirt. Rinse them with clean water from the shower or sink. To dry the racks, wipe them down with a dry rag or old towel before putting them back in the oven. You can remove the towels from the bathtub at this point, and wash them separately in a laundry machine.",
  "tyn_model":[
    "oven",
    "baking soda",
    "water",
    "oven cleaner",
    "sponge",
    "oven racks",
    "towels",
    "commercial cleaners",
    "rubber gloves",
    "easy off",
    "\u201cfume",
    "\u201d oven",
    "cleaner",
    "vinegar",
    "distilled white vinegar",
    "spray bottle",
    "spatula",
    "soap",
    "hot water",
    "dishwashing liquid",
    "bathtub",
    "laundry machine"
  ],
  "tyn_section":[

  ]
}