{
  "title":"How to Clean Brass Naturally",
  "url":"https://www.wikihow.com/Clean-Brass-Naturally",
  "category_hierarchy":[
    "Hobbies and Crafts",
    "Rocks and Minerals",
    "Metals",
    "Brass"
  ],
  "methods":[
    {
      "name":"Using a Lemon and Salt",
      "steps":[
        {
          "headline":"Evaluate the brass.",
          "description":"You should first check to see if the item is brass or brass-plated. If it's brass-plated, you need to be even gentler with it, as you don't want to scrub away the plating. A magnet won't stick to pure brass, but it will stick to brass-plated items. Therefore, if the magnet doesn't stick, you have pure brass."
        },
        {
          "headline":"Add salt to one half of a cut lemon.",
          "description":"Start with a whole lemon. Cut the lemon in half, width-wise, so you have a good-sized scrubber that will squeeze out lemon juice as you rub. Sprinkle salt on the cut side of one of the halves. You can use whatever salt you prefer."
        },
        {
          "headline":"Scrub the brass.",
          "description":"Take the salted lemon half, and scrub the brass. The salt will work as a light abrasive, and the lemon juice will help remove grime. Work it in over all the brass. If you have a big piece, you may need to move to the second lemon half, adding salt to it first."
        },
        {
          "headline":"Finish with a dry cloth.",
          "description":"Use a soft cloth to remove all the salt and lemon juice. You may need to switch out cloths halfway through. You can also rinse it, if you prefer, but make sure you dry it very well afterwards."
        }
      ]
    },
    {
      "name":"Cleaning with a Natural Paste",
      "steps":[
        {
          "headline":"Create your paste.",
          "description":"Another option for cleaning more soiled items is to make a paste. Use the paste to scrub the brass down, which helps remove tarnish and grime. One paste you can try is lemon juice mixed with baking soda or salt. Just add enough juice to the dry ingredient to make a thick paste. You can also mix cream of tartar and lemon juice to form a paste. This paste can sit on the polish for up to 30 minutes. Another option is equal parts white vinegar, flour, and salt. You can let this polish sit on the brass up to an hour."
        },
        {
          "headline":"Scrub the brass.",
          "description":"Use a soft cloth to rub the paste on the brass. You can scrub it into the whole piece. However, don't rub too hard, as you can scratch the surface. Be somewhat gentle to protect your item. Let the paste sit for 30 minutes to an hour if the brass is especially dirty."
        },
        {
          "headline":"Rinse and dry.",
          "description":"Once you've applied any of these pastes, make sure to rinse the product off. You don't want to leave it on the brass. Also, dry the brass thoroughly to help prevent tarnishing."
        }
      ]
    },
    {
      "name":"Trying Other Techniques",
      "steps":[
        {
          "headline":"Mix natural soap and water.",
          "description":"Brass can be cleaned up easily with soap and water. Use hot water, and add some dish soap to the water. You can use a sink or a bucket. Let the brass soak in the solution for a few minutes, then gently scrub it with a microfiber cloth. Rinse when you're done. If the item is too big for a sink, try soaking it in a bathtub. You can also spray it on generously and let it sit for a few minutes. Spray on more if it looks like it's drying out too quickly."
        },
        {
          "headline":"Use a mild tomato-based acid.",
          "description":"Tomato products have enough acid in them to help remove grime and tarnish from brass. Reach for items like tomato paste, ketchup, or tomato sauce. Rub it on the brass, and leave it for about an hour before rinsing and drying the brass. You can also try plain lemon juice."
        },
        {
          "headline":"Apply oil to prevent tarnishing.",
          "description":"If you'd like, you can use a soft cloth to rub on mineral oil or linseed oil. This process will help keep tarnishing from forming on the brass. Only apply the oil once you've cleaned the brass."
        }
      ]
    }
  ],
  "text":" Using a Lemon and Salt Evaluate the brass. You should first check to see if the item is brass or brass-plated. If it's brass-plated, you need to be even gentler with it, as you don't want to scrub away the plating. A magnet won't stick to pure brass, but it will stick to brass-plated items. Therefore, if the magnet doesn't stick, you have pure brass. Add salt to one half of a cut lemon. Start with a whole lemon. Cut the lemon in half, width-wise, so you have a good-sized scrubber that will squeeze out lemon juice as you rub. Sprinkle salt on the cut side of one of the halves. You can use whatever salt you prefer. Scrub the brass. Take the salted lemon half, and scrub the brass. The salt will work as a light abrasive, and the lemon juice will help remove grime. Work it in over all the brass. If you have a big piece, you may need to move to the second lemon half, adding salt to it first. Finish with a dry cloth. Use a soft cloth to remove all the salt and lemon juice. You may need to switch out cloths halfway through. You can also rinse it, if you prefer, but make sure you dry it very well afterwards. Cleaning with a Natural Paste Create your paste. Another option for cleaning more soiled items is to make a paste. Use the paste to scrub the brass down, which helps remove tarnish and grime. One paste you can try is lemon juice mixed with baking soda or salt. Just add enough juice to the dry ingredient to make a thick paste. You can also mix cream of tartar and lemon juice to form a paste. This paste can sit on the polish for up to 30 minutes. Another option is equal parts white vinegar, flour, and salt. You can let this polish sit on the brass up to an hour. Scrub the brass. Use a soft cloth to rub the paste on the brass. You can scrub it into the whole piece. However, don't rub too hard, as you can scratch the surface. Be somewhat gentle to protect your item. Let the paste sit for 30 minutes to an hour if the brass is especially dirty. Rinse and dry. Once you've applied any of these pastes, make sure to rinse the product off. You don't want to leave it on the brass. Also, dry the brass thoroughly to help prevent tarnishing. Trying Other Techniques Mix natural soap and water. Brass can be cleaned up easily with soap and water. Use hot water, and add some dish soap to the water. You can use a sink or a bucket. Let the brass soak in the solution for a few minutes, then gently scrub it with a microfiber cloth. Rinse when you're done. If the item is too big for a sink, try soaking it in a bathtub. You can also spray it on generously and let it sit for a few minutes. Spray on more if it looks like it's drying out too quickly. Use a mild tomato-based acid. Tomato products have enough acid in them to help remove grime and tarnish from brass. Reach for items like tomato paste, ketchup, or tomato sauce. Rub it on the brass, and leave it for about an hour before rinsing and drying the brass. You can also try plain lemon juice. Apply oil to prevent tarnishing. If you'd like, you can use a soft cloth to rub on mineral oil or linseed oil. This process will help keep tarnishing from forming on the brass. Only apply the oil once you've cleaned the brass.",
  "tyn_model":[
    "salt",
    "lemon",
    "lemon juice",
    "water",
    "magnet",
    "oil",
    "scrubber",
    "salted lemon",
    "baking soda",
    "cream of tartar",
    "white vinegar",
    "flour",
    "natural soap",
    "soap",
    "dish soap",
    "microfiber cloth",
    "tomato-based acid",
    "tomato paste",
    "tomato sauce",
    "mineral oil",
    "linseed oil"
  ],
  "tyn_section":[

  ]
}