{
  "title":"How to Clean an Iron with Vinegar",
  "url":"https://www.wikihow.com/Clean-an-Iron-with-Vinegar",
  "category_hierarchy":[
    "Home and Garden",
    "Housekeeping",
    "Cleaning"
  ],
  "parts":[
    {
      "name":"Unclogging the Water Reservoir",
      "steps":[
        {
          "headline":"Unplug and cool the iron.",
          "description":"Before you begin, make sure the iron is unplugged. Allow it to cool off completely before you start. This can ensure you don\u2019t burn or electrocute yourself when adding the vinegar."
        },
        {
          "headline":"Inspect the steam ducts.",
          "description":"Check for white residue in the holes, or steam ducts, on the iron\u2019s soleplate. Remove any residue you see using a wood or plastic toothpick, toothbrush, or cotton swab. This can help your vinegar mixture better clean the reservation and its ducts onto the plate. Avoid using anything metal to remove residue because this can scratch the iron\u2019s surface."
        },
        {
          "headline":"Fill the water reservoir with vinegar mixture.",
          "description":"Mix one quarter cup (60ml) white vinegar and \u00be cup (180ml) distilled water in a cup with a spout. With the iron upright, pour this mixture into the water reservoir until it is about one-third full. Use a larger amount of distilled white vinegar or only vinegar for very clogged irons."
        },
        {
          "headline":"Heat up your iron.",
          "description":"Plug in your iron again and set it to the steam feature. The heat setting should be at medium to high. Allow it to heat for at least 5 minutes. This flushes out mineral deposits and makes it easier to clean the ducts."
        },
        {
          "headline":"Press the steam button.",
          "description":"Now it\u2019s time to really let the vinegar work its magic. Push down on the steam button and hold it for 20-30 seconds. Repeat at least 6 times, or until the steam flows freely from your iron."
        },
        {
          "headline":"Empty the iron.",
          "description":"Unplug your iron again and let it cool off completely. Then pour out any remaining vinegar/water mixture. This ensures that you remove mineral buildup in the reservoir."
        },
        {
          "headline":"Rinse the reservoir.",
          "description":"Fill the reservoir with one cup (240ml) plain, distilled water. Turn on the iron again and hold the steam button again. This will clear any traces of remaining mineral deposits or vinegar."
        }
      ]
    },
    {
      "name":"Removing Residue on the Soleplate",
      "steps":[
        {
          "headline":"Ensure the iron is unplugged and cool.",
          "description":"Before you begin cleaning, make sure that your iron is unplugged and cooled off. This can ensure that you don\u2019t burn or electrocute yourself while cleaning."
        },
        {
          "headline":"Clear residue from steam ducts.",
          "description":"White residue in the holes of the soleplate is often mineral deposit. Before you clean the soleplate, use a wood or plastic toothpick, toothbrush, or cotton swab to remove this. This allows the vinegar mixture to penetrate and clean the iron\u2019s surface. Avoid using metal tools to clean visible deposits. This can scratch the surface of the iron."
        },
        {
          "headline":"Make a vinegar paste using salt or baking soda.",
          "description":"Mix equal parts table or kosher salt or baking soda and distilled white vinegar. Stir them into a paste to scrub starch, mineral deposits, and or sizing residue from your iron\u2019s soleplate."
        },
        {
          "headline":"Scrub the soleplate.",
          "description":"Dip a clean, white cloth into the paste. Moving in circles, rub the mixture over the soleplate. Use slightly more pressure for heavily soiled soleplates. Scrub the steam duct opening with a dab of the paste on a cotton swab. This allows you to more effectively clear away any residue or deposits."
        },
        {
          "headline":"Rinse off the soleplate with plain water.",
          "description":"Wet a separate clean, white cloth. Wipe the surface of the soleplate to remove the paste and any residue or deposits. Repeat scrubbing and rinsing as necessary to remove all of the buildup."
        },
        {
          "headline":"Avoid using harsh scrubs.",
          "description":"Never scrub or rub your iron soleplates with a scouring pad, steel wool or abrasive cleansers. You should also gently scrub the surface. Doing this can ensure that you don\u2019t scratch the surface, which can lead to rusting and further staining."
        }
      ]
    }
  ],
  "text":" Unclogging the Water Reservoir Unplug and cool the iron. Before you begin, make sure the iron is unplugged. Allow it to cool off completely before you start. This can ensure you don\u2019t burn or electrocute yourself when adding the vinegar. Inspect the steam ducts. Check for white residue in the holes, or steam ducts, on the iron\u2019s soleplate. Remove any residue you see using a wood or plastic toothpick, toothbrush, or cotton swab. This can help your vinegar mixture better clean the reservation and its ducts onto the plate. Avoid using anything metal to remove residue because this can scratch the iron\u2019s surface. Fill the water reservoir with vinegar mixture. Mix one quarter cup (60ml) white vinegar and \u00be cup (180ml) distilled water in a cup with a spout. With the iron upright, pour this mixture into the water reservoir until it is about one-third full. Use a larger amount of distilled white vinegar or only vinegar for very clogged irons. Heat up your iron. Plug in your iron again and set it to the steam feature. The heat setting should be at medium to high. Allow it to heat for at least 5 minutes. This flushes out mineral deposits and makes it easier to clean the ducts. Press the steam button. Now it\u2019s time to really let the vinegar work its magic. Push down on the steam button and hold it for 20-30 seconds. Repeat at least 6 times, or until the steam flows freely from your iron. Empty the iron. Unplug your iron again and let it cool off completely. Then pour out any remaining vinegar/water mixture. This ensures that you remove mineral buildup in the reservoir. Rinse the reservoir. Fill the reservoir with one cup (240ml) plain, distilled water. Turn on the iron again and hold the steam button again. This will clear any traces of remaining mineral deposits or vinegar. Removing Residue on the Soleplate Ensure the iron is unplugged and cool. Before you begin cleaning, make sure that your iron is unplugged and cooled off. This can ensure that you don\u2019t burn or electrocute yourself while cleaning. Clear residue from steam ducts. White residue in the holes of the soleplate is often mineral deposit. Before you clean the soleplate, use a wood or plastic toothpick, toothbrush, or cotton swab to remove this. This allows the vinegar mixture to penetrate and clean the iron\u2019s surface. Avoid using metal tools to clean visible deposits. This can scratch the surface of the iron. Make a vinegar paste using salt or baking soda. Mix equal parts table or kosher salt or baking soda and distilled white vinegar. Stir them into a paste to scrub starch, mineral deposits, and or sizing residue from your iron\u2019s soleplate. Scrub the soleplate. Dip a clean, white cloth into the paste. Moving in circles, rub the mixture over the soleplate. Use slightly more pressure for heavily soiled soleplates. Scrub the steam duct opening with a dab of the paste on a cotton swab. This allows you to more effectively clear away any residue or deposits. Rinse off the soleplate with plain water. Wet a separate clean, white cloth. Wipe the surface of the soleplate to remove the paste and any residue or deposits. Repeat scrubbing and rinsing as necessary to remove all of the buildup. Avoid using harsh scrubs. Never scrub or rub your iron soleplates with a scouring pad, steel wool or abrasive cleansers. You should also gently scrub the surface. Doing this can ensure that you don\u2019t scratch the surface, which can lead to rusting and further staining.",
  "tyn_model":[
    "iron",
    "vinegar",
    "water",
    "distilled water",
    "distilled white vinegar",
    "baking soda",
    "plate",
    "white vinegar",
    "water reservoir",
    "salt",
    "table or",
    "kosher salt",
    "cotton swab",
    "scouring pad",
    "steel wool",
    "abrasive cleansers"
  ],
  "tyn_section":[

  ]
}