{
  "title":"How to Forage for Rose Hips",
  "url":"https://www.wikihow.com/Forage-for-Rose-Hips",
  "category_hierarchy":[
    "Home and Garden",
    "Gardening",
    "Planting and Growing",
    "Growing Flowers",
    "Roses"
  ],
  "parts":[
    {
      "name":"Finding Rosehips",
      "steps":[
        {
          "headline":"Look for round red or orange berries on rosebushes.",
          "description":"Recognize them by their shape and by the little feathery wisps that grow from their bottoms. Also identify them by their size. Look for berries that are anywhere from \u00bc\u2033 (6.35 mm) to 1\u00bc\u201d (31.75 mm)."
        },
        {
          "headline":"Look on your rosebushes.",
          "description":"Uncut rose stems will form rosehips. Don\u2019t remove all flowers when you prune your rosebushes. Leave some flowers in place so they can form rosehips after they mature."
        },
        {
          "headline":"Forage for them in the wild.",
          "description":"Roses that grow in the wild also form rosehips. Forage for rosehips on rosebushes in the woods. You can also find wild roses growing on the side of the road in some areas. And look for the very large and juicy rosehips from Rosa rugosa or rock roses along coastlines and near water, even along irrigation ditches."
        }
      ]
    },
    {
      "name":"Timing Your Foraging",
      "steps":[
        {
          "headline":"Start foraging in late summer.",
          "description":"Look for rosehips after roses bloom in July. You can find them beginning in August. Continue foraging for them through the winter. Locate rosebushes when they are in bloom, and plan to return at least four weeks later to begin harvesting your rosehips."
        },
        {
          "headline":"Wait until after the first frost.",
          "description":"Harvest rosehips after the first frost of the season passes. Plan to forage them in late fall. You can harvest them earlier, but they will have less juice and be more bitter. Make sure the rosehips are soft to the touch when you harvest them after the frost. Recognize ripened rosebushes by the fact they are easy to pull off of the bush."
        },
        {
          "headline":"Don\u2019t forage for them too late.",
          "description":"Don\u2019t wait too long for rosehips to mature, or they will begin to shrivel. Don\u2019t use older, shrivelled rosehips -- they will not process well. Be careful that they aren\u2019t too soft either -- very soft rosehips are also over ripened. Identify these over ripened rosehips by the fact they will fall apart easily when you touch them."
        }
      ]
    },
    {
      "name":"Harvesting Rosehips",
      "steps":[
        {
          "headline":"Protect yourself from thorns.",
          "description":"Wear gloves to protect your hands from rosebush thorns. Wearing gloves will also make the harvesting go faster. Try leather gloves or gardening gloves for the best protection. Also wear long sleeves. Wear long pants to protect your legs from nettles, thorns, and even poison ivy or poison oak when foraging wild rosehips."
        },
        {
          "headline":"Grab them by the handful.",
          "description":"Harvest rosehips from pulling them directly from the rosebush. Grab entire clumps of ripened rosehips at once. Remember that ripened rosehips will pull away from the stem very easily."
        },
        {
          "headline":"Remove the hairs inside the seeds after harvesting.",
          "description":"Before you use your rosehips, remove the tiny hairs surrounding the seeds. Watch out for those hairs, because they cause itching and can irritate the throat. The best way to remove them is to strain the hairs out while cooking rosehip syrups or jellies."
        }
      ]
    }
  ],
  "text":" Finding Rosehips Look for round red or orange berries on rosebushes. Recognize them by their shape and by the little feathery wisps that grow from their bottoms. Also identify them by their size. Look for berries that are anywhere from \u00bc\u2033 (6.35 mm) to 1\u00bc\u201d (31.75 mm). Look on your rosebushes. Uncut rose stems will form rosehips. Don\u2019t remove all flowers when you prune your rosebushes. Leave some flowers in place so they can form rosehips after they mature. Forage for them in the wild. Roses that grow in the wild also form rosehips. Forage for rosehips on rosebushes in the woods. You can also find wild roses growing on the side of the road in some areas. And look for the very large and juicy rosehips from Rosa rugosa or rock roses along coastlines and near water, even along irrigation ditches. Timing Your Foraging Start foraging in late summer. Look for rosehips after roses bloom in July. You can find them beginning in August. Continue foraging for them through the winter. Locate rosebushes when they are in bloom, and plan to return at least four weeks later to begin harvesting your rosehips. Wait until after the first frost. Harvest rosehips after the first frost of the season passes. Plan to forage them in late fall. You can harvest them earlier, but they will have less juice and be more bitter. Make sure the rosehips are soft to the touch when you harvest them after the frost. Recognize ripened rosebushes by the fact they are easy to pull off of the bush. Don\u2019t forage for them too late. Don\u2019t wait too long for rosehips to mature, or they will begin to shrivel. Don\u2019t use older, shrivelled rosehips -- they will not process well. Be careful that they aren\u2019t too soft either -- very soft rosehips are also over ripened. Identify these over ripened rosehips by the fact they will fall apart easily when you touch them. Harvesting Rosehips Protect yourself from thorns. Wear gloves to protect your hands from rosebush thorns. Wearing gloves will also make the harvesting go faster. Try leather gloves or gardening gloves for the best protection. Also wear long sleeves. Wear long pants to protect your legs from nettles, thorns, and even poison ivy or poison oak when foraging wild rosehips. Grab them by the handful. Harvest rosehips from pulling them directly from the rosebush. Grab entire clumps of ripened rosehips at once. Remember that ripened rosehips will pull away from the stem very easily. Remove the hairs inside the seeds after harvesting. Before you use your rosehips, remove the tiny hairs surrounding the seeds. Watch out for those hairs, because they cause itching and can irritate the throat. The best way to remove them is to strain the hairs out while cooking rosehip syrups or jellies.",
  "tyn_model":[
    "rosehips",
    "roses",
    "berries",
    "flowers",
    "gloves",
    "\u201d (",
    "gardening gloves",
    "poison ivy",
    "poison oak",
    "rosehip syrups"
  ],
  "tyn_section":[

  ]
}