{
  "title":"How to Clean Laminate Cabinets",
  "url":"https://www.wikihow.com/Clean-Laminate-Cabinets",
  "category_hierarchy":[
    "Home and Garden",
    "Housekeeping",
    "Cleaning"
  ],
  "methods":[
    {
      "name":"Performing General Cleaning",
      "steps":[
        {
          "headline":"Dust.",
          "description":"Oil and grease particles settle on all the surfaces in your kitchen--including your cabinets--and then attract dust. You can reduce the need for a deeper cleaning by dusting your cabinets with a lint-free cloth or duster 1-3 times per week. EXPERT TIP\t\t\t\t\t\t\t\t\t\t\t\t\t\t\t\t\t\t\t\t\t\t\t\t\t\t\t\t\t\t\tAshley Matuska\t\t\t\t\t\t\t\t\t\t\t\t\t\t\t\tCleaning Guru\t\t\t\t\t\t\t\tAshley Matuska is the owner and founder of Dashing Maids, a sustainably focused cleaning agency in Denver, Colorado. She has worked in the cleaning industry for over 5 years. Ashley Matuska\t\t\tCleaning Guru\t\t\t\tMoisture and grease in the air cause dust to stick to everything in your kitchen. Start by dusting up high to get the cobwebs on the tops of the cabinets and corners, then wipe down the cabinet doors."
        },
        {
          "headline":"Wash with mild dish soap.",
          "description":"Mix 1 Tablespoon (14.7 ml) of dish soap with 1 quart (946 ml) of warm water. Soak a clean washcloth in the water for 3-5 minutes and wring it out. Then use the damp wash cloth to wipe down your cabinets. Wipe down both the front and back of the cabinet doors. Pay careful attention to handles and hinges. In a busy kitchen, cabinets may need to be wiped daily. In less used kitchens, cabinets may only need to be wiped down once per week."
        },
        {
          "headline":"Rinse with warm water.",
          "description":"After you have finished wiping your cabinets down with soap and warm water, fill a bowl with clear warm water. Then use a clean washcloth to wipe your cabinets down again, rinsing off any remaining detergent."
        },
        {
          "headline":"Dry with a soft cloth.",
          "description":"Excess moisture can damage your laminate cabinets. Use a soft cloth or towel to carefully dry your laminate cabinets. Do not allow them to simply air dry."
        }
      ]
    },
    {
      "name":"Removing Grease and Grime",
      "steps":[
        {
          "headline":"Mix vinegar and water.",
          "description":"If your cabinets have accumulated a layer of grease and grime, you may need to perform a deeper cleaning. Mix together 1 cup (240 ml) of white vinegar with 2 cups (480 ml) of warm water. Soak a clean washcloth in this solution for 3-5 minutes and wring it out. Use this washcloth to wipe the grease from your cabinets."
        },
        {
          "headline":"Go back over sticky spots with straight vinegar.",
          "description":"If there are any greasy or sticky spots remaining after you have wiped the cabinets down, pour a dab of straight white vinegar onto a washcloth and wipe down these locations again. You can also place white vinegar in a spray bottle and mist sticky spots."
        },
        {
          "headline":"Rinse with warm water and dry with a soft cloth.",
          "description":"Fill a bowl or bucket with clean warm water. Dip a clean washcloth into the water and wipe down your cabinets to rinse away any remaining vinegar. Dry your cabinets with a soft towel."
        }
      ]
    },
    {
      "name":"Scrubbing Stubborn Stains",
      "steps":[
        {
          "headline":"Create a paste from vinegar and baking soda.",
          "description":"Mix together 1 Tablespoon (14.7 ml) of baking soda with 1 Tablespoon (14.7 ml) of vinegar to make a thick paste. (Add a bit more more liquid or powder as needed to create a consistency similar to peanut butter). Grab a clean wash cloth, rinse it with warm water, and wring out completely. Then use your washcloth to pick up some of the paste."
        },
        {
          "headline":"Apply this paste to stubborn stains.",
          "description":"Dab the paste onto any location with stuck on food or stains. Allow the paste to sit for 3-5 minutes. Then scrub these spots using a soft-bristle brush until the food/stains are gone. If you do not have a soft-bristled brush, you can use a damp washcloth or the textured side of a kitchen sponge."
        },
        {
          "headline":"Rinse with warm water and dry.",
          "description":"Wipe down any places where paste was applied with a clean washcloth and warm water. Be sure to remove any remaining paste. Dry using a soft cloth or towel."
        }
      ]
    }
  ],
  "text":" Performing General Cleaning Dust. Oil and grease particles settle on all the surfaces in your kitchen--including your cabinets--and then attract dust. You can reduce the need for a deeper cleaning by dusting your cabinets with a lint-free cloth or duster 1-3 times per week. EXPERT TIP\t\t\t\t\t\t\t\t\t\t\t\t\t\t\t\t\t\t\t\t\t\t\t\t\t\t\t\t\t\t\tAshley Matuska\t\t\t\t\t\t\t\t\t\t\t\t\t\t\t\tCleaning Guru\t\t\t\t\t\t\t\tAshley Matuska is the owner and founder of Dashing Maids, a sustainably focused cleaning agency in Denver, Colorado. She has worked in the cleaning industry for over 5 years. Ashley Matuska\t\t\tCleaning Guru\t\t\t\tMoisture and grease in the air cause dust to stick to everything in your kitchen. Start by dusting up high to get the cobwebs on the tops of the cabinets and corners, then wipe down the cabinet doors. Wash with mild dish soap. Mix 1 Tablespoon (14.7 ml) of dish soap with 1 quart (946 ml) of warm water. Soak a clean washcloth in the water for 3-5 minutes and wring it out. Then use the damp wash cloth to wipe down your cabinets. Wipe down both the front and back of the cabinet doors. Pay careful attention to handles and hinges. In a busy kitchen, cabinets may need to be wiped daily. In less used kitchens, cabinets may only need to be wiped down once per week. Rinse with warm water. After you have finished wiping your cabinets down with soap and warm water, fill a bowl with clear warm water. Then use a clean washcloth to wipe your cabinets down again, rinsing off any remaining detergent. Dry with a soft cloth. Excess moisture can damage your laminate cabinets. Use a soft cloth or towel to carefully dry your laminate cabinets. Do not allow them to simply air dry. Removing Grease and Grime Mix vinegar and water. If your cabinets have accumulated a layer of grease and grime, you may need to perform a deeper cleaning. Mix together 1 cup (240 ml) of white vinegar with 2 cups (480 ml) of warm water. Soak a clean washcloth in this solution for 3-5 minutes and wring it out. Use this washcloth to wipe the grease from your cabinets. Go back over sticky spots with straight vinegar. If there are any greasy or sticky spots remaining after you have wiped the cabinets down, pour a dab of straight white vinegar onto a washcloth and wipe down these locations again. You can also place white vinegar in a spray bottle and mist sticky spots. Rinse with warm water and dry with a soft cloth. Fill a bowl or bucket with clean warm water. Dip a clean washcloth into the water and wipe down your cabinets to rinse away any remaining vinegar. Dry your cabinets with a soft towel. Scrubbing Stubborn Stains Create a paste from vinegar and baking soda. Mix together 1 Tablespoon (14.7 ml) of baking soda with 1 Tablespoon (14.7 ml) of vinegar to make a thick paste. (Add a bit more more liquid or powder as needed to create a consistency similar to peanut butter). Grab a clean wash cloth, rinse it with warm water, and wring out completely. Then use your washcloth to pick up some of the paste. Apply this paste to stubborn stains. Dab the paste onto any location with stuck on food or stains. Allow the paste to sit for 3-5 minutes. Then scrub these spots using a soft-bristle brush until the food/stains are gone. If you do not have a soft-bristled brush, you can use a damp washcloth or the textured side of a kitchen sponge. Rinse with warm water and dry. Wipe down any places where paste was applied with a clean washcloth and warm water. Be sure to remove any remaining paste. Dry using a soft cloth or towel.",
  "tyn_model":[
    "water",
    "washcloth",
    "vinegar",
    "dish soap",
    "wash cloth",
    "bowl",
    "white vinegar",
    "baking soda",
    "cleaning dust",
    "lint-free cloth",
    "duster",
    "dashing maids",
    "cleaning industry",
    "soap",
    "towel",
    "straight vinegar",
    "straight white vinegar",
    "spray bottle",
    "kitchen sponge"
  ],
  "tyn_section":[

  ]
}