{
  "title":"How to Clean Stainless Steel Naturally",
  "url":"https://www.wikihow.com/Clean-Stainless-Steel-Naturally",
  "category_hierarchy":[
    "Home and Garden",
    "Housekeeping",
    "Cleaning"
  ],
  "parts":[
    {
      "name":"Using Proper Cleaning Techniques",
      "steps":[
        {
          "headline":"Read the owner\u2019s manual.",
          "description":"Some stainless steel items are treated with materials that require special cleaning procedures. Follow any instructions the manufacturer provides so that you don\u2019t damage your stainless steel. You can also call the manufacturer to ask if natural products are safe on your stainless steel."
        },
        {
          "headline":"Use a clean, lint-free cloth.",
          "description":"Gather two clean and lint-free cloths to clean the stainless steel. Paper towels, microfiber cloths, and even old pieces of clothing are good options. This can clean your stainless steel without scratching it or rubbing around any grime. Old terrycloth towels also work. Use a nylon scrubbing sponge or old toothbrush for tough grime or smudges. Use gentle pressure so you don\u2019t scratch your stainless steel."
        },
        {
          "headline":"Wipe with the grain.",
          "description":"Like wood, stainless steel has a grain that runs either horizontally or vertically. Look closely at your stainless steel and notice which way this grain runs. Follow this each time you clean or wipe your stainless steel."
        },
        {
          "headline":"Avoid abrasive cleaning materials.",
          "description":"Stainless steel can stain despite its name. It\u2019s important to avoid certain products and cleaning implements that can damage your stainless steel. Steer clear of the following things when cleaning your stainless steel:\nHard water, which can leave brown stains\nChlorine bleach\nSteel wool\nSteel brushes"
        }
      ]
    },
    {
      "name":"Using Natural Cleaners",
      "steps":[
        {
          "headline":"Wipe daily with water.",
          "description":"Start wiping down your stainless steel anytime you use it. Rinse a washcloth with clean, warm water and wipe it across your item. Dry it off with a clean and dry towel or cloth. Use distilled water on your stainless steel if your tap water is hard. This can prevent more marks or staining."
        },
        {
          "headline":"Spray on a solution of vinegar and water.",
          "description":"Vinegar is one of the best natural cleaners for stainless steel because it cuts through oils from cooking and even fingertips. Mix equal parts vinegar and water in a clean spray bottle. Mist your stainless steel item with the vinegar and water and then wipe it off with a clean and dry cloth. Mix vinegar with distilled water if your tap water is hard and leaves stains. Use undiluted vinegar for heavy staining or marks."
        },
        {
          "headline":"Create a baking soda paste.",
          "description":"Vinegar may not cut through especially tough spots. Mix water and baking soda until it forms a paste. Apply this to the stain(s) and let sit for 15-20 minutes. Scrub with a nylon scrubber or toothbrush and then wipe away the paste with a damp, clean, and lint-free cloth."
        },
        {
          "headline":"Lift stains with club soda.",
          "description":"Pour club soda into a clean spray bottle. Spray down your stainless steel with the soda water. Wipe dry with a clean, lint-free cloth. Follow the grain of the stainless steel, which will give it additional luster."
        },
        {
          "headline":"Rub on a lemon slice.",
          "description":"Lemon is another mildly acidic substance that can cut grease on stainless steel. Rub a lemon slice on your stainless steel to remove stains and grime. Wipe down with a damp, clean cloth."
        },
        {
          "headline":"Dissolve grime with rubbing alcohol.",
          "description":"Dab some rubbing oil on extra tough stains. Gently rub over the stain until it disappears. Avoid using rubbing alcohol on ovens, stoves or other appliances that conduct high heat. It is flammable and can cause fires."
        }
      ]
    },
    {
      "name":"Polishing with Natural Oils",
      "steps":[
        {
          "headline":"Buff with olive oil.",
          "description":"Oils are a great way to give your stainless steel a beautiful shine after you\u2019ve cleaned it. Dip a clean, soft cloth in some olive oil. Rub it along your stainless steel with the grain until you notice a shiny luster. Use just a dab of oil to shine your stainless steel. Dousing the cloth in olive oil may dull the shine and attract dust and other grime."
        },
        {
          "headline":"Get serious shine with lemon oil.",
          "description":"Pour a few drops of lemon oil on a clean cloth. Rub it into your stainless steel using gentle pressure. This will create a beautiful shine on your cleaned stainless steel. Avoid using lemon oil on ovens or other appliances that conduct high heat. It is flammable and can cause fires."
        },
        {
          "headline":"Add shine with mineral or baby oil.",
          "description":"Another household oil you can use to polish your stainless steel is mineral oil. You can find this most often in baby oil. Put a small amount on a clean cloth and rub it onto your stainless steel until it glimmers."
        }
      ]
    }
  ],
  "text":" Using Proper Cleaning Techniques Read the owner\u2019s manual. Some stainless steel items are treated with materials that require special cleaning procedures. Follow any instructions the manufacturer provides so that you don\u2019t damage your stainless steel. You can also call the manufacturer to ask if natural products are safe on your stainless steel. Use a clean, lint-free cloth. Gather two clean and lint-free cloths to clean the stainless steel. Paper towels, microfiber cloths, and even old pieces of clothing are good options. This can clean your stainless steel without scratching it or rubbing around any grime. Old terrycloth towels also work. Use a nylon scrubbing sponge or old toothbrush for tough grime or smudges. Use gentle pressure so you don\u2019t scratch your stainless steel. Wipe with the grain. Like wood, stainless steel has a grain that runs either horizontally or vertically. Look closely at your stainless steel and notice which way this grain runs. Follow this each time you clean or wipe your stainless steel. Avoid abrasive cleaning materials. Stainless steel can stain despite its name. It\u2019s important to avoid certain products and cleaning implements that can damage your stainless steel. Steer clear of the following things when cleaning your stainless steel:\nHard water, which can leave brown stains\nChlorine bleach\nSteel wool\nSteel brushes Using Natural Cleaners Wipe daily with water. Start wiping down your stainless steel anytime you use it. Rinse a washcloth with clean, warm water and wipe it across your item. Dry it off with a clean and dry towel or cloth. Use distilled water on your stainless steel if your tap water is hard. This can prevent more marks or staining. Spray on a solution of vinegar and water. Vinegar is one of the best natural cleaners for stainless steel because it cuts through oils from cooking and even fingertips. Mix equal parts vinegar and water in a clean spray bottle. Mist your stainless steel item with the vinegar and water and then wipe it off with a clean and dry cloth. Mix vinegar with distilled water if your tap water is hard and leaves stains. Use undiluted vinegar for heavy staining or marks. Create a baking soda paste. Vinegar may not cut through especially tough spots. Mix water and baking soda until it forms a paste. Apply this to the stain(s) and let sit for 15-20 minutes. Scrub with a nylon scrubber or toothbrush and then wipe away the paste with a damp, clean, and lint-free cloth. Lift stains with club soda. Pour club soda into a clean spray bottle. Spray down your stainless steel with the soda water. Wipe dry with a clean, lint-free cloth. Follow the grain of the stainless steel, which will give it additional luster. Rub on a lemon slice. Lemon is another mildly acidic substance that can cut grease on stainless steel. Rub a lemon slice on your stainless steel to remove stains and grime. Wipe down with a damp, clean cloth. Dissolve grime with rubbing alcohol. Dab some rubbing oil on extra tough stains. Gently rub over the stain until it disappears. Avoid using rubbing alcohol on ovens, stoves or other appliances that conduct high heat. It is flammable and can cause fires. Polishing with Natural Oils Buff with olive oil. Oils are a great way to give your stainless steel a beautiful shine after you\u2019ve cleaned it. Dip a clean, soft cloth in some olive oil. Rub it along your stainless steel with the grain until you notice a shiny luster. Use just a dab of oil to shine your stainless steel. Dousing the cloth in olive oil may dull the shine and attract dust and other grime. Get serious shine with lemon oil. Pour a few drops of lemon oil on a clean cloth. Rub it into your stainless steel using gentle pressure. This will create a beautiful shine on your cleaned stainless steel. Avoid using lemon oil on ovens or other appliances that conduct high heat. It is flammable and can cause fires. Add shine with mineral or baby oil. Another household oil you can use to polish your stainless steel is mineral oil. You can find this most often in baby oil. Put a small amount on a clean cloth and rub it onto your stainless steel until it glimmers.",
  "tyn_model":[
    "stainless steel",
    "water",
    "vinegar",
    "lemon",
    "olive oil",
    "lemon oil",
    "distilled water",
    "spray bottle",
    "baking soda",
    "club soda",
    "rubbing alcohol",
    "baby oil",
    "cloth",
    "terrycloth towels",
    "nylon scrubbing sponge",
    "chlorine bleach",
    "steel wool",
    "steel brushes",
    "natural cleaners",
    "washcloth",
    "nylon scrubber",
    "soda water",
    "rubbing oil",
    "oils",
    "oil",
    "mineral or",
    "household oil",
    "mineral oil"
  ],
  "tyn_section":[

  ]
}