{
  "title":"How to Make Resurrection Rolls",
  "url":"https://www.wikihow.com/Make-Resurrection-Rolls",
  "category_hierarchy":[
    "Food and Entertaining",
    "Recipes",
    "Baking"
  ],
  "parts":[
    {
      "name":"Mixing the Yeast Mixture",
      "steps":[
        {
          "headline":"Pour the milk into a bowl.",
          "description":"To activate the yeast, you need to mix it with a warm liquid. Add \u00bd cup (118 ml) of warm milk to the bowl of a stand mixer. The milk should be 105\u00b0F (41\u00b0C). You can use 1% or 2% milk, but whole milk usually results in the best rolls."
        },
        {
          "headline":"Sprinkle the yeast and sugar over the milk.",
          "description":"After you\u2019ve poured the milk into the mixer\u2019s bowl, add 1 tablespoon (13 g) of sugar and 2 teaspoons (7 g) of yeast to it. Stir them into the milk to help the yeast dissolve. If you\u2019re using a yeast packet for the rolls, you\u2019ll need an entire \u00bc oz (7 g) packet."
        },
        {
          "headline":"Allow the mixture to sit until it becomes frothy.",
          "description":"Once you\u2019ve gently mixed the sugar and yeast into the milk, leave the mixture to sit for 5 to 10 minutes. You\u2019ll know that it\u2019s ready when it becomes foamy."
        }
      ]
    },
    {
      "name":"Preparing the Dough",
      "steps":[
        {
          "headline":"Mix in the butter, sugar, egg, and vanilla.",
          "description":"When the yeast mixture is foamy, add 3 tablespoons (43 g) of melted butter, 3 tablespoons (38 g) of sugar, 1 lightly beaten egg, and \u00bd teaspoon (2 \u00bd ml) of pure vanilla extract. Blend the ingredients together in the stand mixer on low speed until they are fully combined. You can use egg substitute in place of the egg if you prefer. If you don\u2019t have a stand mixer, you can use a handheld electric mixer to mix the dough. You can also mix the dough by hand, but it will require more time and effort."
        },
        {
          "headline":"Stir in the salt, cinnamon, and flour until a dough forms.",
          "description":"After the ingredients are mixed, add \u00bd teaspoon (3 g) of sea salt, \u00bd teaspoon (1 g) of ground cinnamon, and 2 cups (250 g) of all-purpose flour to the bowl. Mix the ingredients in on medium-high speed until a sticky but firm dough forms. If you prefer, you can replace the all-purpose flour with a blend of 1 cup (125 g) of all-purpose flour and 1 cup (96 g) of whole wheat pastry flour."
        },
        {
          "headline":"Knead the dough until it\u2019s smooth.",
          "description":"Once the dough has come together, turn it out onto a lightly floured surface. Use clean hands to knead it until it\u2019s smooth and elastic, which should take 5 to 10 minutes. You can knead the dough in the stand mixer with the dough hook attachment in place if you prefer."
        },
        {
          "headline":"Place the dough in a bowl and cover.",
          "description":"When the dough is smooth, place it in a large bowl that\u2019s been lightly greased with butter. Turn the dough over once so it\u2019s coated with butter on both sides and then cover the bowl with plastic wrap."
        },
        {
          "headline":"Let the dough rise until it doubles in size.",
          "description":"Place the bowl in a warm place and leave it to rise. The dough should double in size, which usually takes about an hour. The oven is a good place to place the dough for rising. Turn on its light, but leave the actual heat off."
        }
      ]
    },
    {
      "name":"Forming the Rolls",
      "steps":[
        {
          "headline":"Roll the dough out into a circle.",
          "description":"When the dough is finished rising, turn it out onto a lightly floured surface again. Use a rolling pin to roll it out into a 14-inch (36-cm) circle that\u2019s approximately \u00bc-inch (6-mm) thick. If you don\u2019t have a rolling pin, you can use any heavy, cylindrical object, such as a wine bottle or thermos, for rolling out the dough."
        },
        {
          "headline":"Cut the dough into triangles.",
          "description":"Once the dough is rolled out, use a knife to cut it into a 8 equal-sized triangles. Separate the triangles so each is set out individually. A pizza cutter can be handy for cutting the dough."
        },
        {
          "headline":"Combine the cinnamon and sugar.",
          "description":"Add 3 tablespoons (38 g) of sugar and 1 teaspoon (2 g) of ground cinnamon to a small bowl. Mix the two together well until they\u2019re fully blended. You can use store-bought cinnamon sugar if you prefer. You\u2019ll need approximately 3 tablespoons (38 g)."
        },
        {
          "headline":"Dip the marshmallows in the melted butter and cinnamon sugar.",
          "description":"Place another small bowl with 2 tablespoons (28 g) of melted butter beside the bowl with the cinnamon sugar. Dip 8 marshmallows in the melted butter and then roll them in the cinnamon sugar so they\u2019re fully coated. Dip each marshmallow into the butter and cinnamon sugar one at a time. Have a piece of foil or parchment paper ready to set them down on when you\u2019re finished. If you don\u2019t want to use the butter, you can dip them into water instead."
        },
        {
          "headline":"Wrap the marshmallows in the dough.",
          "description":"Take the dough triangles and place a coated marshmallow in the center of each. Next, wrap the dough over the marshmallow and squeeze it in your hand to ensure that it is completely covered by the dough. Make sure that there are no cracks or openings in the dough, or the marshmallow may seep out during baking."
        }
      ]
    },
    {
      "name":"Baking the Rolls",
      "steps":[
        {
          "headline":"Preheat the oven and line a baking sheet.",
          "description":"To ensure that the oven is hot enough to bake the rolls, set the temperature to 350\u00b0F (177\u00b0C) and allow it to fully preheat. Next, line a large baking sheet with parchment paper so the rolls won\u2019t stick. If you prefer, you can use a silicone baking mat to line the baking sheet."
        },
        {
          "headline":"Place the rolls on the baking sheet and cover them with a towel.",
          "description":"Once the baking sheet is lined, arrange all of the rolls on it. Cover the rolls with a clean kitchen towel until the oven has finished preheating."
        },
        {
          "headline":"Bake the rolls until they are golden brown.",
          "description":"When the oven is fully preheated, place the rolls inside. Allow them to bake for 15 to 20 minutes, or until they are golden brown. Keep an eye on the rolls near the end of the baking time. The bottoms can easily burn."
        },
        {
          "headline":"Allow the rolls to cool on a wire rack.",
          "description":"When the rolls are finished baking, remove the baking sheet from the oven. Transfer them to a wire cooling rack to allow them to cool for 15 to 20 minutes or until you can handle them comfortably."
        },
        {
          "headline":"Serve and break the rolls open.",
          "description":"When you\u2019re ready to serve the rolls, instruct everyone to break them open. The marshmallow will have \u201cdisappeared\u201d during baking so it serves as an ideal way to teach the resurrection story. Store any leftover rolls in an airtight container. They should keep for 3 to 4 days."
        }
      ]
    }
  ],
  "text":" Mixing the Yeast Mixture Pour the milk into a bowl. To activate the yeast, you need to mix it with a warm liquid. Add \u00bd cup (118 ml) of warm milk to the bowl of a stand mixer. The milk should be 105\u00b0F (41\u00b0C). You can use 1% or 2% milk, but whole milk usually results in the best rolls. Sprinkle the yeast and sugar over the milk. After you\u2019ve poured the milk into the mixer\u2019s bowl, add 1 tablespoon (13 g) of sugar and 2 teaspoons (7 g) of yeast to it. Stir them into the milk to help the yeast dissolve. If you\u2019re using a yeast packet for the rolls, you\u2019ll need an entire \u00bc oz (7 g) packet. Allow the mixture to sit until it becomes frothy. Once you\u2019ve gently mixed the sugar and yeast into the milk, leave the mixture to sit for 5 to 10 minutes. You\u2019ll know that it\u2019s ready when it becomes foamy. Preparing the Dough Mix in the butter, sugar, egg, and vanilla. When the yeast mixture is foamy, add 3 tablespoons (43 g) of melted butter, 3 tablespoons (38 g) of sugar, 1 lightly beaten egg, and \u00bd teaspoon (2 \u00bd ml) of pure vanilla extract. Blend the ingredients together in the stand mixer on low speed until they are fully combined. You can use egg substitute in place of the egg if you prefer. If you don\u2019t have a stand mixer, you can use a handheld electric mixer to mix the dough. You can also mix the dough by hand, but it will require more time and effort. Stir in the salt, cinnamon, and flour until a dough forms. After the ingredients are mixed, add \u00bd teaspoon (3 g) of sea salt, \u00bd teaspoon (1 g) of ground cinnamon, and 2 cups (250 g) of all-purpose flour to the bowl. Mix the ingredients in on medium-high speed until a sticky but firm dough forms. If you prefer, you can replace the all-purpose flour with a blend of 1 cup (125 g) of all-purpose flour and 1 cup (96 g) of whole wheat pastry flour. Knead the dough until it\u2019s smooth. Once the dough has come together, turn it out onto a lightly floured surface. Use clean hands to knead it until it\u2019s smooth and elastic, which should take 5 to 10 minutes. You can knead the dough in the stand mixer with the dough hook attachment in place if you prefer. Place the dough in a bowl and cover. When the dough is smooth, place it in a large bowl that\u2019s been lightly greased with butter. Turn the dough over once so it\u2019s coated with butter on both sides and then cover the bowl with plastic wrap. Let the dough rise until it doubles in size. Place the bowl in a warm place and leave it to rise. The dough should double in size, which usually takes about an hour. The oven is a good place to place the dough for rising. Turn on its light, but leave the actual heat off. Forming the Rolls Roll the dough out into a circle. When the dough is finished rising, turn it out onto a lightly floured surface again. Use a rolling pin to roll it out into a 14-inch (36-cm) circle that\u2019s approximately \u00bc-inch (6-mm) thick. If you don\u2019t have a rolling pin, you can use any heavy, cylindrical object, such as a wine bottle or thermos, for rolling out the dough. Cut the dough into triangles. Once the dough is rolled out, use a knife to cut it into a 8 equal-sized triangles. Separate the triangles so each is set out individually. A pizza cutter can be handy for cutting the dough. Combine the cinnamon and sugar. Add 3 tablespoons (38 g) of sugar and 1 teaspoon (2 g) of ground cinnamon to a small bowl. Mix the two together well until they\u2019re fully blended. You can use store-bought cinnamon sugar if you prefer. You\u2019ll need approximately 3 tablespoons (38 g). Dip the marshmallows in the melted butter and cinnamon sugar. Place another small bowl with 2 tablespoons (28 g) of melted butter beside the bowl with the cinnamon sugar. Dip 8 marshmallows in the melted butter and then roll them in the cinnamon sugar so they\u2019re fully coated. Dip each marshmallow into the butter and cinnamon sugar one at a time. Have a piece of foil or parchment paper ready to set them down on when you\u2019re finished. If you don\u2019t want to use the butter, you can dip them into water instead. Wrap the marshmallows in the dough. Take the dough triangles and place a coated marshmallow in the center of each. Next, wrap the dough over the marshmallow and squeeze it in your hand to ensure that it is completely covered by the dough. Make sure that there are no cracks or openings in the dough, or the marshmallow may seep out during baking. Baking the Rolls Preheat the oven and line a baking sheet. To ensure that the oven is hot enough to bake the rolls, set the temperature to 350\u00b0F (177\u00b0C) and allow it to fully preheat. Next, line a large baking sheet with parchment paper so the rolls won\u2019t stick. If you prefer, you can use a silicone baking mat to line the baking sheet. Place the rolls on the baking sheet and cover them with a towel. Once the baking sheet is lined, arrange all of the rolls on it. Cover the rolls with a clean kitchen towel until the oven has finished preheating. Bake the rolls until they are golden brown. When the oven is fully preheated, place the rolls inside. Allow them to bake for 15 to 20 minutes, or until they are golden brown. Keep an eye on the rolls near the end of the baking time. The bottoms can easily burn. Allow the rolls to cool on a wire rack. When the rolls are finished baking, remove the baking sheet from the oven. Transfer them to a wire cooling rack to allow them to cool for 15 to 20 minutes or until you can handle them comfortably. Serve and break the rolls open. When you\u2019re ready to serve the rolls, instruct everyone to break them open. The marshmallow will have \u201cdisappeared\u201d during baking so it serves as an ideal way to teach the resurrection story. Store any leftover rolls in an airtight container. They should keep for 3 to 4 days.",
  "tyn_model":[
    "milk",
    "butter",
    "bowl",
    "sugar",
    "oven",
    "baking sheet",
    "cinnamon sugar",
    "stand mixer",
    "yeast",
    "all-purpose flour",
    "egg",
    "cinnamon",
    "ground cinnamon",
    "rolling pin",
    "small bowl",
    "parchment paper",
    "marshmallow",
    "mixer",
    "vanilla",
    "pure vanilla",
    "electric mixer",
    "salt",
    "flour",
    "sea salt",
    "whole wheat pastry flour",
    "plastic wrap",
    "knife",
    "pizza cutter",
    "melted butter",
    "water",
    "marshmallows",
    "baking mat",
    "kitchen towel",
    "\u201cdisappeared",
    "\u201d during",
    "airtight container"
  ],
  "tyn_section":[

  ]
}