{
  "title":"How to Clean a Nintendo 3DS Screen",
  "url":"https://www.wikihow.com/Clean-a-Nintendo-3DS-Screen",
  "category_hierarchy":[
    "Hobbies and Crafts",
    "Games",
    "Video Games",
    "Nintendo Video Game Consoles",
    "Nintendo 3DS"
  ],
  "methods":[
    {
      "name":"Cleaning the 3DS Screen",
      "steps":[
        {
          "headline":"Use a damp cloth.",
          "description":"To clean the screen of your Nintendo 3DS, use a soft, cotton cloth. Dampen it slightly with water. Only use water to clean the screen. Don\u2019t use any type of cleaner or solvent. This could damage the screen. Make sure the cloth is only slightly damp and doesn\u2019t have too much water on it. Never pour any water onto the 3DS screen. Use the cloth that comes in a 3DS cleaning kit. If you don't have one, purchase a microfiber cleaning cloth for eyeglasses."
        },
        {
          "headline":"Wipe the screen.",
          "description":"Make sure that the cloth is damp and not too wet. Use it to gently wipe off both screens on your Nintendo 3DS. Go over the screen multiple times if there are still smudges or streaks."
        },
        {
          "headline":"Dry the screen.",
          "description":"Use either the dry end of the cloth or another soft, cotton cloth. Gently wipe the screen to dry the leftover moisture. Make sure to wipe both screens and any water that got on other parts of the 3DS while cleaning."
        }
      ]
    },
    {
      "name":"Removing Dust",
      "steps":[
        {
          "headline":"Remove dust with tape.",
          "description":"If there is dust, fuzz, or a smudge left on your screen, use clear tape. Tear off a piece of clear tape long enough to make a loop. Make a circle with the tape so that the sticky side is facing outward. Gently tap the tape against the screen to pick up any fuzz or dust."
        },
        {
          "headline":"Use a cotton swab.",
          "description":"Use a cotton swab, such as a Q-tip, to remove dust. Use a clean cotton swab to go around the edges of the screen. Then go across any sections in the middle that have dust. The cotton swab should remove the dust from the screen. You may also want to use your swab to remove any dirt caked along the edge of the screen."
        },
        {
          "headline":"Remove dust with air.",
          "description":"Try to remove dust by blowing air onto the screen. Blow on the screen with your breath to get rid of dust or fuzz. Canned air can also be used if there is a lot of dust or fuzz. You can also use canned air to get rid of dirt and dust in the creases near the screen."
        }
      ]
    },
    {
      "name":"Removing Particles from the Touch Screen",
      "steps":[
        {
          "headline":"Hold the console so the edge to be cleaned is at the top.",
          "description":"When trying to get particles like crumbs out of the edge of the screen, position the Nintendo 3DS with the edge that needs to be cleaned at the top. This ensures that the particles will fall down as you clean it."
        },
        {
          "headline":"Press near the edge that needs to be cleaned.",
          "description":"With your thumb, carefully press the screen close to the edge that needs cleaning. Don\u2019t press too hard. You just want to make a slight space between the screen and the cover. If the debris is really deep in the 3DS, press a bit harder to make a slightly larger gap. However, press carefully so you don\u2019t break the screen."
        },
        {
          "headline":"Brush out the debris with a toothbrush.",
          "description":"Use a new soft toothbrush to clean the debris from the space between the screen and cover. Gently brush the bristles in the space. Move the toothbrush bristles back and forth to loosen the particles\nMake sure that the hard part of the toothbrush does not hit the screen. This can damage the screen."
        }
      ]
    }
  ],
  "text":" Cleaning the 3DS Screen Use a damp cloth. To clean the screen of your Nintendo 3DS, use a soft, cotton cloth. Dampen it slightly with water. Only use water to clean the screen. Don\u2019t use any type of cleaner or solvent. This could damage the screen. Make sure the cloth is only slightly damp and doesn\u2019t have too much water on it. Never pour any water onto the 3DS screen. Use the cloth that comes in a 3DS cleaning kit. If you don't have one, purchase a microfiber cleaning cloth for eyeglasses. Wipe the screen. Make sure that the cloth is damp and not too wet. Use it to gently wipe off both screens on your Nintendo 3DS. Go over the screen multiple times if there are still smudges or streaks. Dry the screen. Use either the dry end of the cloth or another soft, cotton cloth. Gently wipe the screen to dry the leftover moisture. Make sure to wipe both screens and any water that got on other parts of the 3DS while cleaning. Removing Dust Remove dust with tape. If there is dust, fuzz, or a smudge left on your screen, use clear tape. Tear off a piece of clear tape long enough to make a loop. Make a circle with the tape so that the sticky side is facing outward. Gently tap the tape against the screen to pick up any fuzz or dust. Use a cotton swab. Use a cotton swab, such as a Q-tip, to remove dust. Use a clean cotton swab to go around the edges of the screen. Then go across any sections in the middle that have dust. The cotton swab should remove the dust from the screen. You may also want to use your swab to remove any dirt caked along the edge of the screen. Remove dust with air. Try to remove dust by blowing air onto the screen. Blow on the screen with your breath to get rid of dust or fuzz. Canned air can also be used if there is a lot of dust or fuzz. You can also use canned air to get rid of dirt and dust in the creases near the screen. Removing Particles from the Touch Screen Hold the console so the edge to be cleaned is at the top. When trying to get particles like crumbs out of the edge of the screen, position the Nintendo 3DS with the edge that needs to be cleaned at the top. This ensures that the particles will fall down as you clean it. Press near the edge that needs to be cleaned. With your thumb, carefully press the screen close to the edge that needs cleaning. Don\u2019t press too hard. You just want to make a slight space between the screen and the cover. If the debris is really deep in the 3DS, press a bit harder to make a slightly larger gap. However, press carefully so you don\u2019t break the screen. Brush out the debris with a toothbrush. Use a new soft toothbrush to clean the debris from the space between the screen and cover. Gently brush the bristles in the space. Move the toothbrush bristles back and forth to loosen the particles\nMake sure that the hard part of the toothbrush does not hit the screen. This can damage the screen.",
  "tyn_model":[
    "water",
    "toothbrush",
    "tape",
    "air",
    "cloth",
    "clear tape",
    "3ds cleaning kit",
    "microfiber cleaning cloth",
    "nintendo 3ds.",
    "cotton swab",
    "canned air",
    "console",
    "nintendo 3ds with",
    "3ds"
  ],
  "tyn_section":[

  ]
}