{
  "title":"How to Make Lemon Fudge",
  "url":"https://www.wikihow.com/Make-Lemon-Fudge",
  "category_hierarchy":[
    "Food and Entertaining",
    "Recipes",
    "Chocolate and Candy",
    "Fudge"
  ],
  "methods":[
    {
      "name":"Whipping Up Creamy Lemon Fudge",
      "steps":[
        {
          "headline":"Line a baking pan.",
          "description":"For the fudge, you\u2019ll need an 8-inch by 8-inch (20-cm by 20-cm) baking pan. Use a piece of parchment paper to line the pan, making sure that the ends extend over the sides of the pan. You can substitute wax paper for the parchment paper if you prefer."
        },
        {
          "headline":"Heat the sugar and evaporated milk until it reaches a boil.",
          "description":"Add 2 \u00bc cups (250 g) of granulated sugar and \u00be cup (188 ml) of evaporated milk to large saucepan. Heat the mixture over medium heat until it comes to a full boil, which should take 5 to 7 minutes. Be sure to the stir the mixture constantly as you bring it to a boil."
        },
        {
          "headline":"Lower the heat and stir the mixture until it reaches the proper temperature.",
          "description":"Once the mixture comes to a boil, reduce the heat to medium-low. Place a candy thermometer in the pan, and continue to boil the mixture until it reaches 234\u00b0F (112\u00b0C), which should take approximately 5 to 6 minutes. If you don\u2019t have a candy thermometer, you can use a deep fry thermometer. Stir the mixture constantly while you heat it. If the mixture browns or starts to stick to the pan, lower the heat. However, make sure to maintain the boil until the proper temperature is reached."
        },
        {
          "headline":"Turn off the heat and mix in the white chocolate, butter, extract, and zest.",
          "description":"When the mixture has reached the desired temperature, turn off the heat. Add 8 ounces (227 g) of chopped white chocolate, \u00bd cup (113 g) of diced butter, 4 teaspoons (20 ml) of lemon extract, and the zest from 1 lemon. Quickly stir the ingredients into the hot evaporated milk mixture until the butter and chocolate are completely melted. After you combine all of the ingredients, the mixture should have a thick, smooth consistency."
        },
        {
          "headline":"Add the food coloring if desired.",
          "description":"When you\u2019re finished mixing the ingredients, the fudge will have a white color. If you want it to be yellow, add 2 to 3 drops of yellow food coloring to the mixture and stir until it\u2019s completely blended in. You can use liquid or paste food coloring to tint the fudge."
        },
        {
          "headline":"Transfer the mixture to the pan and allow it to cool until firm.",
          "description":"Once the mixture is completely blended, pour it into the lined baking dish and use a spatula to smooth it into an even layer. Let the fudge cool at room temperature for at least 2 hours, or until it is firm. It\u2019s a good idea to cover the pan with plastic wrap while you\u2019re waiting for the fudge to set."
        },
        {
          "headline":"Cut the fudge into squares and serve.",
          "description":"When the fudge is completely set, use the edges of the parchment paper to lift it out of the baking dish. Use a sharp knife to cut it into even squares, and enjoy. Store any leftover fudge at room temperature in an airtight container. It should stay fresh for up to 2 weeks."
        }
      ]
    },
    {
      "name":"Preparing Quick and Easy Lemon Fudge",
      "steps":[
        {
          "headline":"Line a baking pan.",
          "description":"For the fudge, you\u2019ll need a 9-inch by 9-inch (23-cm by 23-cm) baking dish. Use a piece of wax paper to line the pan so the fudge won\u2019t stick. You can substitute parchment paper for the wax paper if you prefer."
        },
        {
          "headline":"Melt the butter.",
          "description":"Add \u00bd cup (113 g) of butter to a saucepan. Heat the butter over medium heat until it melts completely, which should take 3 to 5 minutes."
        },
        {
          "headline":"Mix in the milk and dry pudding.",
          "description":"When the butter is melted, add \u00bd cup (118 ml) of milk and 2 small (3.4 ounce/96 g) packages of lemon cook-and-serve pudding to the pan. Stir the mixture together until it\u2019s completely blended. For the creamiest fudge, use whole milk."
        },
        {
          "headline":"Bring the mixture to a boil and cook it for a minute.",
          "description":"When the mixture is blended, raise the heat to medium-high. Allow the mixture to come to a boil, and then cook it for an additional minute to thicken it. Stir the mixture constantly as you bring it a boil."
        },
        {
          "headline":"Stir in the powdered sugar.",
          "description":"After you\u2019ve cooked the fudge mixture for a minute, remove it from the heat. Add 3 \u00be cups (469 g) of powdered sugar to the pan, and mix it until it is fully incorporated."
        },
        {
          "headline":"Transfer the fudge to the pan and dust it with powdered sugar.",
          "description":"When the fudge mixture is completely blended, pour it into the prepared pan. Use a rubber spatula to press and smooth the mixture in place. Lightly dust the top with powdered sugar if desired. Make sure to spread the fudge mixture in as even a layer as possible in the pan."
        },
        {
          "headline":"Chill the fudge for a few hours.",
          "description":"Once the fudge is in the pan, place it in the refrigerator. Let it chill for 3 to 4 hours, or until the fudge is completely set."
        },
        {
          "headline":"Cut the fudge into pieces and serve.",
          "description":"When the fudge is fully set, remove it from the refrigerator. Use a sharp knife to cut it into 1-inch (2.5-cm) pieces and serve. Keep any leftover fudge in an airtight container. It should keep for 1 to 2 weeks."
        }
      ]
    },
    {
      "name":"Mixing Up Healthy Lemon Fudge",
      "steps":[
        {
          "headline":"Combine all of the ingredients.",
          "description":"Add \u00bd cup (128 g) of melted coconut butter, 2 tablespoons (27 g) of virgin coconut oil, 1 tablespoon (15 ml) of fresh lemon juice, 1 tablespoon (20 g) of pure maple syrup, and the zest from 1 lemon to a food processor. Pulse the mixture together until it is completely smooth. You can also use a blender to mix up the fudge. You can substitute stevia drops for the maple syrup if you prefer. However, you\u2019ll need to increase the coconut butter amount by 1 tablespoon (16 g) if you use the stevia."
        },
        {
          "headline":"Transfer the mixture to a freezer-safe container and freeze until it\u2019s firm.",
          "description":"Once the fudge mixture is fully blended, use a spatula to spread it into a freezer-safe plastic container. Cover the container with the lid or plastic wrap, and chill the fudge in the freezer 2 to 3 hours, or until firm. You can also transfer the fudge mixture to candy molds if you prefer."
        },
        {
          "headline":"Slice the fudge and serve.",
          "description":"When the fudge is fully set, remove it from the freezer. Use a sharp knife to cut it into even squares, and serve. Store any leftover fudge in the refrigerator. It should stay fresh for up to a week."
        }
      ]
    }
  ],
  "text":" Whipping Up Creamy Lemon Fudge Line a baking pan. For the fudge, you\u2019ll need an 8-inch by 8-inch (20-cm by 20-cm) baking pan. Use a piece of parchment paper to line the pan, making sure that the ends extend over the sides of the pan. You can substitute wax paper for the parchment paper if you prefer. Heat the sugar and evaporated milk until it reaches a boil. Add 2 \u00bc cups (250 g) of granulated sugar and \u00be cup (188 ml) of evaporated milk to large saucepan. Heat the mixture over medium heat until it comes to a full boil, which should take 5 to 7 minutes. Be sure to the stir the mixture constantly as you bring it to a boil. Lower the heat and stir the mixture until it reaches the proper temperature. Once the mixture comes to a boil, reduce the heat to medium-low. Place a candy thermometer in the pan, and continue to boil the mixture until it reaches 234\u00b0F (112\u00b0C), which should take approximately 5 to 6 minutes. If you don\u2019t have a candy thermometer, you can use a deep fry thermometer. Stir the mixture constantly while you heat it. If the mixture browns or starts to stick to the pan, lower the heat. However, make sure to maintain the boil until the proper temperature is reached. Turn off the heat and mix in the white chocolate, butter, extract, and zest. When the mixture has reached the desired temperature, turn off the heat. Add 8 ounces (227 g) of chopped white chocolate, \u00bd cup (113 g) of diced butter, 4 teaspoons (20 ml) of lemon extract, and the zest from 1 lemon. Quickly stir the ingredients into the hot evaporated milk mixture until the butter and chocolate are completely melted. After you combine all of the ingredients, the mixture should have a thick, smooth consistency. Add the food coloring if desired. When you\u2019re finished mixing the ingredients, the fudge will have a white color. If you want it to be yellow, add 2 to 3 drops of yellow food coloring to the mixture and stir until it\u2019s completely blended in. You can use liquid or paste food coloring to tint the fudge. Transfer the mixture to the pan and allow it to cool until firm. Once the mixture is completely blended, pour it into the lined baking dish and use a spatula to smooth it into an even layer. Let the fudge cool at room temperature for at least 2 hours, or until it is firm. It\u2019s a good idea to cover the pan with plastic wrap while you\u2019re waiting for the fudge to set. Cut the fudge into squares and serve. When the fudge is completely set, use the edges of the parchment paper to lift it out of the baking dish. Use a sharp knife to cut it into even squares, and enjoy. Store any leftover fudge at room temperature in an airtight container. It should stay fresh for up to 2 weeks. Preparing Quick and Easy Lemon Fudge Line a baking pan. For the fudge, you\u2019ll need a 9-inch by 9-inch (23-cm by 23-cm) baking dish. Use a piece of wax paper to line the pan so the fudge won\u2019t stick. You can substitute parchment paper for the wax paper if you prefer. Melt the butter. Add \u00bd cup (113 g) of butter to a saucepan. Heat the butter over medium heat until it melts completely, which should take 3 to 5 minutes. Mix in the milk and dry pudding. When the butter is melted, add \u00bd cup (118 ml) of milk and 2 small (3.4 ounce/96 g) packages of lemon cook-and-serve pudding to the pan. Stir the mixture together until it\u2019s completely blended. For the creamiest fudge, use whole milk. Bring the mixture to a boil and cook it for a minute. When the mixture is blended, raise the heat to medium-high. Allow the mixture to come to a boil, and then cook it for an additional minute to thicken it. Stir the mixture constantly as you bring it a boil. Stir in the powdered sugar. After you\u2019ve cooked the fudge mixture for a minute, remove it from the heat. Add 3 \u00be cups (469 g) of powdered sugar to the pan, and mix it until it is fully incorporated. Transfer the fudge to the pan and dust it with powdered sugar. When the fudge mixture is completely blended, pour it into the prepared pan. Use a rubber spatula to press and smooth the mixture in place. Lightly dust the top with powdered sugar if desired. Make sure to spread the fudge mixture in as even a layer as possible in the pan. Chill the fudge for a few hours. Once the fudge is in the pan, place it in the refrigerator. Let it chill for 3 to 4 hours, or until the fudge is completely set. Cut the fudge into pieces and serve. When the fudge is fully set, remove it from the refrigerator. Use a sharp knife to cut it into 1-inch (2.5-cm) pieces and serve. Keep any leftover fudge in an airtight container. It should keep for 1 to 2 weeks. Mixing Up Healthy Lemon Fudge Combine all of the ingredients. Add \u00bd cup (128 g) of melted coconut butter, 2 tablespoons (27 g) of virgin coconut oil, 1 tablespoon (15 ml) of fresh lemon juice, 1 tablespoon (20 g) of pure maple syrup, and the zest from 1 lemon to a food processor. Pulse the mixture together until it is completely smooth. You can also use a blender to mix up the fudge. You can substitute stevia drops for the maple syrup if you prefer. However, you\u2019ll need to increase the coconut butter amount by 1 tablespoon (16 g) if you use the stevia. Transfer the mixture to a freezer-safe container and freeze until it\u2019s firm. Once the fudge mixture is fully blended, use a spatula to spread it into a freezer-safe plastic container. Cover the container with the lid or plastic wrap, and chill the fudge in the freezer 2 to 3 hours, or until firm. You can also transfer the fudge mixture to candy molds if you prefer. Slice the fudge and serve. When the fudge is fully set, remove it from the freezer. Use a sharp knife to cut it into even squares, and serve. Store any leftover fudge in the refrigerator. It should stay fresh for up to a week.",
  "tyn_model":[
    "butter",
    "parchment paper",
    "powdered sugar",
    "baking pan",
    "wax paper",
    "evaporated milk",
    "baking dish",
    "milk",
    "refrigerator",
    "candy thermometer",
    "white chocolate",
    "lemon",
    "food coloring",
    "spatula",
    "plastic wrap",
    "sharp knife",
    "airtight container",
    "coconut butter",
    "freezer",
    "sugar",
    "granulated sugar",
    "large saucepan",
    "deep fry thermometer",
    "diced butter",
    "lemon extract",
    "chocolate",
    "yellow food coloring",
    "saucepan",
    "pudding",
    "cook-and-serve pudding",
    "rubber spatula",
    "virgin coconut oil",
    "fresh lemon juice",
    "pure maple syrup",
    "food processor",
    "blender",
    "maple syrup",
    "freezer-safe container",
    "freezer-safe plastic container",
    "candy molds"
  ],
  "tyn_section":[

  ]
}