{
  "title":"How to Clean an Xbox",
  "url":"https://www.wikihow.com/Clean-an-Xbox",
  "category_hierarchy":[
    "Hobbies and Crafts",
    "Games",
    "Video Games",
    "Xbox"
  ],
  "methods":[
    {
      "name":"Cleaning an Xbox 360",
      "steps":[
        {
          "headline":"Unplug your console.",
          "description":"Before cleaning your console, unplug it and examine the wires to ensure that there are no damaged connections or ports. You do not want power running to the system while you clean it, or you may accidentally damage it."
        },
        {
          "headline":"Wipe the console with a soft, dry cloth.",
          "description":"Use a soft microfiber or cotton cloth to wipe down the surface of the system. Work in small circular motions to wipe away noticeable dirt build up or gunk."
        },
        {
          "headline":"Remove the faceplate.",
          "description":"Hold one end of the faceplate and push on your system with your thumbs until it detaches from the system. If it is not coming off, you can try to loosen the other side with your other hand. Removing the faceplate won't void the warranty, but opening up the system will."
        },
        {
          "headline":"Use your vacuum cleaner to suck dust out of the ventilation holes.",
          "description":"Use the hose with an attachment to suck the dust out of the holes in the front of the system. Do not push or rub over these holes, because you could push dirt and dust deeper into your system."
        },
        {
          "headline":"Wipe down the inside of the faceplate.",
          "description":"Turn the faceplate over and go over it with a damp rag. Once you're done removing the dirt and dust that's built up, make sure to let it dry completely. Do not reattach it to your system while wet."
        },
        {
          "headline":"Reattach the faceplate to the console.",
          "description":"Align the faceplate to the front of your console. Press it into the console and snap the faceplate back into place. You can jiggle it around to make sure that it's secure."
        }
      ]
    },
    {
      "name":"Cleaning an Xbox One",
      "steps":[
        {
          "headline":"Unplug your console.",
          "description":"Before cleaning your console, make sure that it is unplugged from the outlet. This will allow you to turn the system over and thoroughly wipe it down."
        },
        {
          "headline":"Wipe down the exterior with a microfiber cloth.",
          "description":"You can purchase a microfiber cloth at a computer supply store or online. Wipe down the top, bottom, sides, and ports of the system with a microfiber cloth. You can use cotton swabs to get to hard to reach areas, just make sure not to push dust deeper into the system."
        },
        {
          "headline":"Spray short bursts of compressed air to remove dust.",
          "description":"Use the detail nozzle on a can of condensed air and go over the entirety of the system, including the ventilation slots and the ports. This will remove any dust that you were unable to reach with your cloth."
        }
      ]
    },
    {
      "name":"Cleaning the Original Xbox",
      "steps":[
        {
          "headline":"Unplug the console.",
          "description":"Before you clean your Xbox, you'll want to make sure that there's no electricity running through it. Unplug the console and make sure that there are no frayed wires or broken ports. Work on a flat, static-free surface, like a kitchen table, when cleaning your console."
        },
        {
          "headline":"Pull the rubber feet off the bottom of the console.",
          "description":"Flip the console over and pick out the rubber feet on the corners of the console with your fingers. You can also use a flathead screwdriver to get the feet up if you are having issues. Note that using this cleaning method will void the warranty on your Xbox."
        },
        {
          "headline":"Remove the bottom screws from the console.",
          "description":"Once you get the feet off, you'll see four screws under each of them. These screws require a torque 20 screwdriver that you can pick up at a hardware store, or buy online. Unscrew all four screws that are under the rubber feet, then find the two screws in the center of the console. These will be located under the stickers. To find the last two screws, feel the surface of each of the stickers on the bottom of your console until you feel the rounded head of a screw."
        },
        {
          "headline":"Ground yourself.",
          "description":"To discharge static electricity, ground yourself by touching a metal object or by wearing an anti-static wristband. This will prevent shorting out the internal components of the Xbox."
        },
        {
          "headline":"Lift the plastic top of the console off of the base.",
          "description":"Once you remove all six screws on the bottom of the console, you should be able to lift the lid of the console off of the base of the system. Be careful when doing this, as it will expose the inner parts of your system."
        },
        {
          "headline":"Wipe down the exterior of the console with a damp rag.",
          "description":"Once you remove the exterior lid of the console, you can wipe it down with a damp rag and a drop of dish soap without affecting the electronic parts inside of the console. Take the lid and wipe over the surface of the console with a damp rag and dish soap. Do this far away from the electronic components of the Xbox. You can wipe down the console with a dry cloth to maintain it over time."
        },
        {
          "headline":"Spray compressed air in the console to remove the dust.",
          "description":"Compressed or canned air will disrupt the dust particles trapped in the console. Use the attachment to get into especially dusty areas and try to discharge the dust from the inside of the system."
        },
        {
          "headline":"Reattach the lid to the console.",
          "description":"Once the exterior of the console has fully dried, you can reattach it to the other part of your Xbox by placing it over the Xbox and then screwing the screws on the bottom of the Xbox back in. Do not use cleaners on the Xbox when the protective casing is screwed into it."
        }
      ]
    }
  ],
  "text":" Cleaning an Xbox 360 Unplug your console. Before cleaning your console, unplug it and examine the wires to ensure that there are no damaged connections or ports. You do not want power running to the system while you clean it, or you may accidentally damage it. Wipe the console with a soft, dry cloth. Use a soft microfiber or cotton cloth to wipe down the surface of the system. Work in small circular motions to wipe away noticeable dirt build up or gunk. Remove the faceplate. Hold one end of the faceplate and push on your system with your thumbs until it detaches from the system. If it is not coming off, you can try to loosen the other side with your other hand. Removing the faceplate won't void the warranty, but opening up the system will. Use your vacuum cleaner to suck dust out of the ventilation holes. Use the hose with an attachment to suck the dust out of the holes in the front of the system. Do not push or rub over these holes, because you could push dirt and dust deeper into your system. Wipe down the inside of the faceplate. Turn the faceplate over and go over it with a damp rag. Once you're done removing the dirt and dust that's built up, make sure to let it dry completely. Do not reattach it to your system while wet. Reattach the faceplate to the console. Align the faceplate to the front of your console. Press it into the console and snap the faceplate back into place. You can jiggle it around to make sure that it's secure. Cleaning an Xbox One Unplug your console. Before cleaning your console, make sure that it is unplugged from the outlet. This will allow you to turn the system over and thoroughly wipe it down. Wipe down the exterior with a microfiber cloth. You can purchase a microfiber cloth at a computer supply store or online. Wipe down the top, bottom, sides, and ports of the system with a microfiber cloth. You can use cotton swabs to get to hard to reach areas, just make sure not to push dust deeper into the system. Spray short bursts of compressed air to remove dust. Use the detail nozzle on a can of condensed air and go over the entirety of the system, including the ventilation slots and the ports. This will remove any dust that you were unable to reach with your cloth. Cleaning the Original Xbox Unplug the console. Before you clean your Xbox, you'll want to make sure that there's no electricity running through it. Unplug the console and make sure that there are no frayed wires or broken ports. Work on a flat, static-free surface, like a kitchen table, when cleaning your console. Pull the rubber feet off the bottom of the console. Flip the console over and pick out the rubber feet on the corners of the console with your fingers. You can also use a flathead screwdriver to get the feet up if you are having issues. Note that using this cleaning method will void the warranty on your Xbox. Remove the bottom screws from the console. Once you get the feet off, you'll see four screws under each of them. These screws require a torque 20 screwdriver that you can pick up at a hardware store, or buy online. Unscrew all four screws that are under the rubber feet, then find the two screws in the center of the console. These will be located under the stickers. To find the last two screws, feel the surface of each of the stickers on the bottom of your console until you feel the rounded head of a screw. Ground yourself. To discharge static electricity, ground yourself by touching a metal object or by wearing an anti-static wristband. This will prevent shorting out the internal components of the Xbox. Lift the plastic top of the console off of the base. Once you remove all six screws on the bottom of the console, you should be able to lift the lid of the console off of the base of the system. Be careful when doing this, as it will expose the inner parts of your system. Wipe down the exterior of the console with a damp rag. Once you remove the exterior lid of the console, you can wipe it down with a damp rag and a drop of dish soap without affecting the electronic parts inside of the console. Take the lid and wipe over the surface of the console with a damp rag and dish soap. Do this far away from the electronic components of the Xbox. You can wipe down the console with a dry cloth to maintain it over time. Spray compressed air in the console to remove the dust. Compressed or canned air will disrupt the dust particles trapped in the console. Use the attachment to get into especially dusty areas and try to discharge the dust from the inside of the system. Reattach the lid to the console. Once the exterior of the console has fully dried, you can reattach it to the other part of your Xbox by placing it over the Xbox and then screwing the screws on the bottom of the Xbox back in. Do not use cleaners on the Xbox when the protective casing is screwed into it.",
  "tyn_model":[
    "xbox",
    "damp rag",
    "microfiber cloth",
    "compressed air",
    "dish soap",
    "xbox 360",
    "vacuum cleaner",
    "hose",
    "xbox one",
    "cotton swabs",
    "condensed air",
    "cloth",
    "flathead screwdriver",
    "screwdriver",
    "screws",
    "compressed or",
    "console",
    "cleaners"
  ],
  "tyn_section":[

  ]
}