{
  "title":"How to Make Caldo Tlalpeno",
  "url":"https://www.wikihow.com/Make-Caldo-Tlalpeno",
  "category_hierarchy":[
    "Food and Entertaining",
    "Recipes",
    "Meat",
    "Poultry Recipes",
    "Chicken"
  ],
  "parts":[
    {
      "name":"Cooking the Chicken",
      "steps":[
        {
          "headline":"Bring the broth to a boil.",
          "description":"Add 6 cups (1.4 l) of chicken broth to a large saucepan, and heat it over medium-high heat. Allow the mixture to heat until it comes to a boil, which should take approximately 10 minutes. You can use store-bought or homemade broth for the soup."
        },
        {
          "headline":"Poach the chicken in the broth until it\u2019s cooked through.",
          "description":"Once the broth comes to a boil, add 1 \u00bc pound (567 g) whole chicken breast with skin and bones to the pan. Cover the pan, and lower the heat to medium-low. Allow the chicken to heat at a bare simmer for approximately 15 minutes, or until it is cooked through. The best way to tell if the chicken is cooked through is to insert an instant-read thermometer into the thickest part of the meat. It should register 165\u00b0F (74\u00b0C). You can also tell the chicken is done when the middle is opaque and no longer pink."
        },
        {
          "headline":"Allow the chicken to cool in the broth.",
          "description":"When the chicken is cooked through, remove the saucepan from the heat. Let the chicken cool for 10 to 15 in the broth before transferring it to a cutting board. Reserve the broth."
        },
        {
          "headline":"Remove the skin and bones and shred the chicken.",
          "description":"Once the chicken is cool enough to handle, use a knife to cut away the skin and remove the meat from the bones. Use a fork or clean fingers to shred chicken, and set it aside for the moment. Cover the chicken with plastic wrap, and store in the refrigerator until it\u2019s time to mix it into the soup."
        }
      ]
    },
    {
      "name":"Preparing the Tomato and Chicken Base",
      "steps":[
        {
          "headline":"Combine the tomatoes, water, chipotles, serrano pepper, water, and spices.",
          "description":"Add 3 roughly chopped Roma tomatoes, 2 chipotle peppers in adobo, 1 chopped serrano pepper, 3 sliced garlic cloves, 1 small chopped white onion, 1 cup (237 ml) of water, \u00bd teaspoon (3 g) of salt, \u00bd teaspoon (1 g) of pepper, 1 teaspoon (1 g) of dried epazote, and 1 teaspoon (1 g) of oregano to a blender. Blend the mixture until it is smooth. If you don\u2019t have a blender, you can puree the mixture in a food processor. Adding the serrano pepper is optional. You can omit it if you prefer a milder soup. Dried epazote is a Mexican herb. You can find it at Latin grocery stores, online retails, and in the international aisle of some general grocery stores. After you blend up the tomato mixture, taste it. Add more salt and pepper if necessary."
        },
        {
          "headline":"Heat the olive oil in a pot.",
          "description":"Add 2 tablespoons (30 ml) of olive oil to a large pot. Allow the oil to heat for 2 to 3 minutes on medium-high heat, or until it begins to shimmer. You can substitute vegetable or canola oil for the olive oil if you prefer."
        },
        {
          "headline":"Add the tomato mixture and bring it to a boil.",
          "description":"Once the oil is hot, pour the tomato mixture into the pot. Heat the mixture on medium-high until it comes to a boil, which should take about 5 to 7 minutes."
        },
        {
          "headline":"Reduce the heat and cook the mixture for a few more minutes.",
          "description":"When the mixture has come to a boil, lower the heat to medium. Allow it to cook for another 5 minutes. The mixture should thicken up slightly at it cooks."
        },
        {
          "headline":"Mix in the chicken broth.",
          "description":"When the tomato mixture has thickened a bit, add the chicken broth that you reserved earlier to the pot. Stir well to ensure that it is fully mixed with the tomato mixture. After you mix in the chicken broth, give the mixture a taste. Add salt if necessary."
        },
        {
          "headline":"Stir in the shredded chicken.",
          "description":"Once the broth is fully blended with the tomato mixture, add the shredded chicken that you reserved earlier to the pot. Mix well to ensure that the chicken is incorporated throughout the mixture."
        }
      ]
    },
    {
      "name":"Finishing Off the Soup",
      "steps":[
        {
          "headline":"Add the carrots, green beans, chickpeas, and bay leaves.",
          "description":"When the chicken and tomato mixture are fully combined, mix in 2 carrots that have been cut into \u215b-inch (3-mm) thick slices, \u00bd pound (225 g) of fresh green beans that have been cut into 1-inch (2.5-cm) pieces, a 19-ounce (539 g) can of chickpeas that have been rinsed and drained, and 2 bay leaves. Let the mixture cook on medium until the carrots soften, which should take approximately 5 to 10 minutes. If you prefer, you can substitute shredded carrots for the slices. Shredded carrots will soften more quickly."
        },
        {
          "headline":"Mix in the zucchini and cook for 15 minutes more.",
          "description":"Once the carrots are tender, add a zucchini that\u2019s been cut into \u00bc-inch (6-mm) thick slices. Allow the soup to cook for another 15 minutes, or until the zucchini has softened too. When the soup is finished cooking, taste it. Add salt if necessary."
        },
        {
          "headline":"Ladle the soup into bowls and add your desired toppings.",
          "description":"When the soup is finished cooking, use a ladle to transfer it to individual bowls. Top the soup with diced avocado, shredded Monterey jack, chopped cilantro, diced onion, and/or lime wedges, and serve while it\u2019s still hot. The soup pairs well with warm corn tortillas or tostadas."
        }
      ]
    }
  ],
  "text":" Cooking the Chicken Bring the broth to a boil. Add 6 cups (1.4 l) of chicken broth to a large saucepan, and heat it over medium-high heat. Allow the mixture to heat until it comes to a boil, which should take approximately 10 minutes. You can use store-bought or homemade broth for the soup. Poach the chicken in the broth until it\u2019s cooked through. Once the broth comes to a boil, add 1 \u00bc pound (567 g) whole chicken breast with skin and bones to the pan. Cover the pan, and lower the heat to medium-low. Allow the chicken to heat at a bare simmer for approximately 15 minutes, or until it is cooked through. The best way to tell if the chicken is cooked through is to insert an instant-read thermometer into the thickest part of the meat. It should register 165\u00b0F (74\u00b0C). You can also tell the chicken is done when the middle is opaque and no longer pink. Allow the chicken to cool in the broth. When the chicken is cooked through, remove the saucepan from the heat. Let the chicken cool for 10 to 15 in the broth before transferring it to a cutting board. Reserve the broth. Remove the skin and bones and shred the chicken. Once the chicken is cool enough to handle, use a knife to cut away the skin and remove the meat from the bones. Use a fork or clean fingers to shred chicken, and set it aside for the moment. Cover the chicken with plastic wrap, and store in the refrigerator until it\u2019s time to mix it into the soup. Preparing the Tomato and Chicken Base Combine the tomatoes, water, chipotles, serrano pepper, water, and spices. Add 3 roughly chopped Roma tomatoes, 2 chipotle peppers in adobo, 1 chopped serrano pepper, 3 sliced garlic cloves, 1 small chopped white onion, 1 cup (237 ml) of water, \u00bd teaspoon (3 g) of salt, \u00bd teaspoon (1 g) of pepper, 1 teaspoon (1 g) of dried epazote, and 1 teaspoon (1 g) of oregano to a blender. Blend the mixture until it is smooth. If you don\u2019t have a blender, you can puree the mixture in a food processor. Adding the serrano pepper is optional. You can omit it if you prefer a milder soup. Dried epazote is a Mexican herb. You can find it at Latin grocery stores, online retails, and in the international aisle of some general grocery stores. After you blend up the tomato mixture, taste it. Add more salt and pepper if necessary. Heat the olive oil in a pot. Add 2 tablespoons (30 ml) of olive oil to a large pot. Allow the oil to heat for 2 to 3 minutes on medium-high heat, or until it begins to shimmer. You can substitute vegetable or canola oil for the olive oil if you prefer. Add the tomato mixture and bring it to a boil. Once the oil is hot, pour the tomato mixture into the pot. Heat the mixture on medium-high until it comes to a boil, which should take about 5 to 7 minutes. Reduce the heat and cook the mixture for a few more minutes. When the mixture has come to a boil, lower the heat to medium. Allow it to cook for another 5 minutes. The mixture should thicken up slightly at it cooks. Mix in the chicken broth. When the tomato mixture has thickened a bit, add the chicken broth that you reserved earlier to the pot. Stir well to ensure that it is fully mixed with the tomato mixture. After you mix in the chicken broth, give the mixture a taste. Add salt if necessary. Stir in the shredded chicken. Once the broth is fully blended with the tomato mixture, add the shredded chicken that you reserved earlier to the pot. Mix well to ensure that the chicken is incorporated throughout the mixture. Finishing Off the Soup Add the carrots, green beans, chickpeas, and bay leaves. When the chicken and tomato mixture are fully combined, mix in 2 carrots that have been cut into \u215b-inch (3-mm) thick slices, \u00bd pound (225 g) of fresh green beans that have been cut into 1-inch (2.5-cm) pieces, a 19-ounce (539 g) can of chickpeas that have been rinsed and drained, and 2 bay leaves. Let the mixture cook on medium until the carrots soften, which should take approximately 5 to 10 minutes. If you prefer, you can substitute shredded carrots for the slices. Shredded carrots will soften more quickly. Mix in the zucchini and cook for 15 minutes more. Once the carrots are tender, add a zucchini that\u2019s been cut into \u00bc-inch (6-mm) thick slices. Allow the soup to cook for another 15 minutes, or until the zucchini has softened too. When the soup is finished cooking, taste it. Add salt if necessary. Ladle the soup into bowls and add your desired toppings. When the soup is finished cooking, use a ladle to transfer it to individual bowls. Top the soup with diced avocado, shredded Monterey jack, chopped cilantro, diced onion, and/or lime wedges, and serve while it\u2019s still hot. The soup pairs well with warm corn tortillas or tostadas.",
  "tyn_model":[
    "chicken",
    "tomato",
    "carrots",
    "broth",
    "chicken broth",
    "salt",
    "pot",
    "water",
    "serrano pepper",
    "olive oil",
    "zucchini",
    "pan",
    "pepper",
    "dried epazote",
    "blender",
    "oil",
    "chickpeas",
    "large saucepan",
    "instant-read thermometer",
    "saucepan",
    "cutting board",
    "knife",
    "fork",
    "plastic wrap",
    "refrigerator",
    "tomatoes",
    "chipotles",
    "spices",
    "roma tomatoes",
    "chipotle peppers",
    "adobo",
    "garlic",
    "white onion",
    "oregano",
    "food processor",
    "large pot",
    "vegetable or canola oil",
    "green beans",
    "bay leaves",
    "fresh green beans",
    "ladle",
    "avocado",
    "monterey jack",
    "cilantro",
    "onion",
    "lime wedges",
    "corn tortillas"
  ],
  "tyn_section":[

  ]
}