{
  "title":"How to Make Quinoa Pizza Crust",
  "url":"https://www.wikihow.com/Make-Quinoa-Pizza-Crust",
  "category_hierarchy":[
    "Food and Entertaining",
    "Recipes",
    "Sandwiches and Quick Meals",
    "Pizza"
  ],
  "methods":[
    {
      "name":"Making Pizza Crust Using Soaked Quinoa",
      "steps":[
        {
          "headline":"Soak the quinoa for at least 8 hours.",
          "description":"Put 3/4 cup (127 g) of uncooked quinoa into a small mixing bowl. Pour enough water to cover the quinoa completely. Leave the quinoa to soak in the water for at least 8 hours or overnight."
        },
        {
          "headline":"Drain and rinse the soaked quinoa.",
          "description":"Once the quinoa has soaked and softened, pour it through a fine mesh strainer. You can discard the soaking water. Rinse the quinoa with fresh water and drain the quinoa. Put the drained quinoa into a food processor or blender. If you don't have a food processor, you can use a blender."
        },
        {
          "headline":"Combine the crust ingredients in the food processor.",
          "description":"Pour 1/4 cup (60 ml) of water into the food processor with the quinoa. Add 1 teaspoon of baking powder and 1/4 teaspoon of salt. Put the lid on the processor and blend the ingredients for about 2 minutes. The quinoa dough should become smooth. You may need to stop and scrape down the sides of the food processor so the crust blends easily."
        },
        {
          "headline":"Preheat the oven and prepare a pan.",
          "description":"Turn the oven on to 425 degrees F (220 C). Get out an 8 or 9-inch (20 to 23 cm) cake pan. Spray the pan with cooking spray. Cut a piece of parchment paper into a circle that fits into the bottom of the pan. Set the paper in the pan and spray it with cooking spray."
        },
        {
          "headline":"Spread the crust in the pan and bake it for 15 minutes.",
          "description":"Scoop the quinoa dough into the prepared cake pan. Use a rubber spatula to spread it evenly in the pan. Put the crust in the preheated oven and bake it for 15 minutes. The quinoa crust should look golden brown on top."
        },
        {
          "headline":"Flip the crust and bake it for 5 to 10 minutes.",
          "description":"Carefully remove the pan from the oven and flip the crust over in the pan so the parchment is on top. Peel away and discard the parchment paper. Return the crust to the oven and bake it for 5 to 10 more minutes. The edges should become crisp and the crust will look golden brown."
        },
        {
          "headline":"Top the quinoa pizza crust and bake it for 10 minutes.",
          "description":"Remove the crust from the oven and cover it with your choice of toppings. Put the pizza in the oven and bake it for 10 more minutes. If you're using cheese on top, it should melt before you remove the pizza from the oven. Store leftover pizza in an airtight container in the refrigerator."
        }
      ]
    },
    {
      "name":"Making Pizza Crust Using Quinoa Flour",
      "steps":[
        {
          "headline":"Toast the quinoa flour.",
          "description":"Put 2 cups (240 g) plus 2 tablespoons (15 g) of freshly ground quinoa flour into a large pot. Turn the heat to medium-low and toast the quinoa flour for 10 to 15 minutes. Stir the flour once every couple of minutes so the flour browns evenly. Remove the quinoa flour and let it cool. Toasting the flour will remove the slightly bitter taste from the quinoa."
        },
        {
          "headline":"Activate the yeast in water and honey.",
          "description":"Pour 3/4 cup (180 ml) of warm water  into a large mixing bowl. The water should be about 110 to 115\u00b0F (40 to 45\u00b0C). Stir in 2 1/4 teaspoons (7 g) of yeast and 2 teaspoons (14 g) of honey. Let the mixture rest for 5 minutes. The yeast should become to foam once it's activated. If it doesn't foam, check the expiration date on the package to ensure that your yeast is still good."
        },
        {
          "headline":"Combine the quinoa dough ingredients.",
          "description":"Stir the cooled, toasted quinoa flour into the yeast mixture along with the remaining dough ingredients. You'll need:\n1 tablespoon (7 g) flaxseed meal\n3/4 teaspoon sea salt\n1 teaspoon garlic powder\n1/2 teaspoon dried oregano\n1/2 teaspoon dried thyme"
        },
        {
          "headline":"Knead the quinoa dough.",
          "description":"Sprinkle a work surface with additional quinoa flour. Scoop the quinoa dough onto it and use your hands to knead the dough for 5 minutes. It should become smooth. You can also knead the dough in a stand mixer using a dough hook."
        },
        {
          "headline":"Prove the dough.",
          "description":"Pour 1 tablespoon (13 g) of olive oil into a large bowl and spread it around with a pastry brush so the bowl is coated. Place the ball of quinoa dough into the bowl. Roll the dough a little to coat it in the oil. Cover the bowl with a kitchen towel or plastic wrap. Let the dough rest for 30 minutes to 1 hour."
        },
        {
          "headline":"Preheat the oven and roll out the crust.",
          "description":"Turn the oven on to 375 degrees F (190 C). Sprinkle a little quinoa flour on your work surface and turn the quinoa dough onto it. Use a rolling pin or your hands to roll out the crust to the size you need. Spread a little olive oil on your baking sheet and set the crust on it. You can form the crust into a circle or rectangle."
        },
        {
          "headline":"Bake the pizza.",
          "description":"Top the pizza with your choice of ingredients. Place the pizza in the preheated oven and bake it for 15 to 20 minutes. You may need more or less time depending on how thick your crust is and how many toppings you used. The crust should turn golden brown and the cheese will melt once the pizza is done."
        },
        {
          "headline":"Finished!",
          "description":""
        }
      ]
    }
  ],
  "text":" Making Pizza Crust Using Soaked Quinoa Soak the quinoa for at least 8 hours. Put 3/4 cup (127 g) of uncooked quinoa into a small mixing bowl. Pour enough water to cover the quinoa completely. Leave the quinoa to soak in the water for at least 8 hours or overnight. Drain and rinse the soaked quinoa. Once the quinoa has soaked and softened, pour it through a fine mesh strainer. You can discard the soaking water. Rinse the quinoa with fresh water and drain the quinoa. Put the drained quinoa into a food processor or blender. If you don't have a food processor, you can use a blender. Combine the crust ingredients in the food processor. Pour 1/4 cup (60 ml) of water into the food processor with the quinoa. Add 1 teaspoon of baking powder and 1/4 teaspoon of salt. Put the lid on the processor and blend the ingredients for about 2 minutes. The quinoa dough should become smooth. You may need to stop and scrape down the sides of the food processor so the crust blends easily. Preheat the oven and prepare a pan. Turn the oven on to 425 degrees F (220 C). Get out an 8 or 9-inch (20 to 23 cm) cake pan. Spray the pan with cooking spray. Cut a piece of parchment paper into a circle that fits into the bottom of the pan. Set the paper in the pan and spray it with cooking spray. Spread the crust in the pan and bake it for 15 minutes. Scoop the quinoa dough into the prepared cake pan. Use a rubber spatula to spread it evenly in the pan. Put the crust in the preheated oven and bake it for 15 minutes. The quinoa crust should look golden brown on top. Flip the crust and bake it for 5 to 10 minutes. Carefully remove the pan from the oven and flip the crust over in the pan so the parchment is on top. Peel away and discard the parchment paper. Return the crust to the oven and bake it for 5 to 10 more minutes. The edges should become crisp and the crust will look golden brown. Top the quinoa pizza crust and bake it for 10 minutes. Remove the crust from the oven and cover it with your choice of toppings. Put the pizza in the oven and bake it for 10 more minutes. If you're using cheese on top, it should melt before you remove the pizza from the oven. Store leftover pizza in an airtight container in the refrigerator. Making Pizza Crust Using Quinoa Flour Toast the quinoa flour. Put 2 cups (240 g) plus 2 tablespoons (15 g) of freshly ground quinoa flour into a large pot. Turn the heat to medium-low and toast the quinoa flour for 10 to 15 minutes. Stir the flour once every couple of minutes so the flour browns evenly. Remove the quinoa flour and let it cool. Toasting the flour will remove the slightly bitter taste from the quinoa. Activate the yeast in water and honey. Pour 3/4 cup (180 ml) of warm water  into a large mixing bowl. The water should be about 110 to 115\u00b0F (40 to 45\u00b0C). Stir in 2 1/4 teaspoons (7 g) of yeast and 2 teaspoons (14 g) of honey. Let the mixture rest for 5 minutes. The yeast should become to foam once it's activated. If it doesn't foam, check the expiration date on the package to ensure that your yeast is still good. Combine the quinoa dough ingredients. Stir the cooled, toasted quinoa flour into the yeast mixture along with the remaining dough ingredients. You'll need:\n1 tablespoon (7 g) flaxseed meal\n3/4 teaspoon sea salt\n1 teaspoon garlic powder\n1/2 teaspoon dried oregano\n1/2 teaspoon dried thyme Knead the quinoa dough. Sprinkle a work surface with additional quinoa flour. Scoop the quinoa dough onto it and use your hands to knead the dough for 5 minutes. It should become smooth. You can also knead the dough in a stand mixer using a dough hook. Prove the dough. Pour 1 tablespoon (13 g) of olive oil into a large bowl and spread it around with a pastry brush so the bowl is coated. Place the ball of quinoa dough into the bowl. Roll the dough a little to coat it in the oil. Cover the bowl with a kitchen towel or plastic wrap. Let the dough rest for 30 minutes to 1 hour. Preheat the oven and roll out the crust. Turn the oven on to 375 degrees F (190 C). Sprinkle a little quinoa flour on your work surface and turn the quinoa dough onto it. Use a rolling pin or your hands to roll out the crust to the size you need. Spread a little olive oil on your baking sheet and set the crust on it. You can form the crust into a circle or rectangle. Bake the pizza. Top the pizza with your choice of ingredients. Place the pizza in the preheated oven and bake it for 15 to 20 minutes. You may need more or less time depending on how thick your crust is and how many toppings you used. The crust should turn golden brown and the cheese will melt once the pizza is done. Finished! ",
  "tyn_model":[
    "oven",
    "quinoa flour",
    "water",
    "quinoa",
    "food processor",
    "yeast",
    "flour",
    "blender",
    "cake pan",
    "cooking spray",
    "parchment paper",
    "honey",
    "olive oil",
    "small mixing bowl",
    "fine mesh strainer",
    "baking powder",
    "salt",
    "processor",
    "rubber spatula",
    "parchment",
    "quinoa pizza",
    "airtight container",
    "large pot",
    "warm water",
    "large mixing bowl",
    "quinoa dough",
    "flaxseed meal",
    "sea salt",
    "garlic powder",
    "dried oregano",
    "thyme",
    "stand mixer",
    "large bowl",
    "pastry brush",
    "oil",
    "kitchen towel",
    "plastic wrap",
    "rolling pin",
    "baking sheet",
    "pizza"
  ],
  "tyn_section":[

  ]
}