{
  "title":"How to Wash Acrylic Fibers",
  "url":"https://www.wikihow.com/Wash-Acrylic-Fibers",
  "category_hierarchy":[
    "Home and Garden",
    "Housekeeping",
    "Laundry",
    "Cleaning Fabric",
    "Cleaning Synthetic Fabric"
  ],
  "methods":[
    {
      "name":"Cleaning Acrylic Items in a Washer",
      "steps":[
        {
          "headline":"Pretreat any stains.",
          "description":"You can\u2019t rely on detergent alone to get out a big stain on your acrylic clothes. Hit the spot with a spray stain remover and rub the remover in with your fingers so you know it\u2019s really worked in the fabric. Don\u2019t forget to spray the stain remover on the inside of the clothing too. If it\u2019s a really old or stubborn stain, try scrubbing the remover in lightly with an old -- but clean -- toothbrush."
        },
        {
          "headline":"Choose an all-purpose detergent.",
          "description":"Washable acrylic fibers aren\u2019t very fragile so you don\u2019t need to use a special laundry detergent for them. A basic all-purpose formula will do the trick just fine. All-purpose detergent works for pretty much all washable acrylic fibers but you should always check the care label for any special instructions."
        },
        {
          "headline":"Use the warm water setting for the cycle.",
          "description":"Acrylic clothes can get hard and crunchy if you wash them in cold water. Whenever you\u2019re washing a load with acrylic fibers, hit the button for the warm water setting to keep your stuff soft and fresh. Whatever you do, don\u2019t use hot water on acrylic fibers. You\u2019ll wind up shrinking them."
        },
        {
          "headline":"Add fabric softener during the last rinse cycle.",
          "description":"Even with warm water, your acrylic clothes can get hard and stiff if you wash them a lot. Keep them nice and soft by adding some fabric softener to the wash just before it goes into the last rinse cycle. Don\u2019t pour the fabric softener right on the clothing or you can wind up with stains. Add it to the water in the washer instead."
        }
      ]
    },
    {
      "name":"Hand Washing Acrylic Items",
      "steps":[
        {
          "headline":"Select a gentle detergent.",
          "description":"Some acrylic fibers are delicate so you need to use specialty detergent. Grab a gentle detergent that\u2019s mild enough to not screw up the fabric. Gentle detergent is usually clearly marked as good for delicates."
        },
        {
          "headline":"Wet the item with cool water.",
          "description":"A kitchen sink is the perfect place for handwashing your stuff. Fill it up with cool water and dunk your acrylic item in it. Make sure that it gets good and wet. Don\u2019t forget to clean the sink before you start washing your clothes. If you don\u2019t want to wash your clothes in the kitchen sink, you can always use your bathtub or a utility bucket."
        },
        {
          "headline":"Mix the detergent into the water.",
          "description":"Don\u2019t pour the detergent directly on your clothes. Add a little bit to the water and slosh it around to mix it in. Move the clothes up and down in the water in a pumping motion to get them totally clean. Don\u2019t add more than a tablespoon (15 ml) of detergent to the sink. If your clothing is really dirty, let it soak for a while. You can leave in the water and detergent for up to 60 minutes."
        },
        {
          "headline":"Drain the sink and rinse the item with cool water.",
          "description":"The water in the sink\u2019s going to get pretty dirty after you slosh your acrylic items around in it. Let the water out, and then fill it back up with cool, clean water to rinse your clothes. Swish the items around in the water to get the detergent out. If there\u2019s a ring of dirt around the sink after you drain it, clean it out before you rinse your stuff. Depending on how dirty your clothes are, you may need to rinse them more than once. You can rinse the clothes under running water at the faucet for the second rinse."
        },
        {
          "headline":"Gently squeeze out the excess water and shake out of the item.",
          "description":"You\u2019ll damage the acrylic fibers if you wring or twist the clothes to get the water out of them. Instead, just use your hands to gently press down on the fabric and then shake it out so it\u2019s not dripping wet."
        }
      ]
    },
    {
      "name":"Drying Acrylic Items",
      "steps":[
        {
          "headline":"Lay acrylic sweaters out flat to dry.",
          "description":"You shouldn\u2019t hang an acrylic sweater you\u2019ve hand washed up to dry. It will lose its shape and get stretched out. Make sure your sweater still fits by laying it out on a flat surface like a table or counter to dry. Clean off the surface you dry the sweater on. You don\u2019t want it to get all dirty just after you\u2019ve washed it."
        },
        {
          "headline":"Hang other acrylic items on a hanger to dry.",
          "description":"Lighter acrylic clothes like knitwear usually don\u2019t lose their shape if you hang them to dry. Put them on a non-rust hanger and set them out to dry."
        },
        {
          "headline":"Use lowest heat setting for acrylic items in the dryer.",
          "description":"You can throw plenty of acrylic clothes in the dryer. But you have to use the lowest temperature because they can get permanently wrinkled if the dryer\u2019s too hot."
        },
        {
          "headline":"Remove the items from the dryer as soon as the cycle is complete.",
          "description":"Leaving acrylic clothes in the dryer after the cycle ends can also cause permanent wrinkles. Get your stuff out of the dryer as soon as the tumbling cycle is done. Give the clothes a good shake after they come out to keep any wrinkles from setting."
        },
        {
          "headline":"Smooth wrinkles with a moderately hot iron.",
          "description":"If the clothes do get a little wrinkled during drying, you can use an iron on most items. Set it to the medium setting and run it over the clothes quickly. Always check the care label so you know that you can iron an item."
        }
      ]
    }
  ],
  "text":" Cleaning Acrylic Items in a Washer Pretreat any stains. You can\u2019t rely on detergent alone to get out a big stain on your acrylic clothes. Hit the spot with a spray stain remover and rub the remover in with your fingers so you know it\u2019s really worked in the fabric. Don\u2019t forget to spray the stain remover on the inside of the clothing too. If it\u2019s a really old or stubborn stain, try scrubbing the remover in lightly with an old -- but clean -- toothbrush. Choose an all-purpose detergent. Washable acrylic fibers aren\u2019t very fragile so you don\u2019t need to use a special laundry detergent for them. A basic all-purpose formula will do the trick just fine. All-purpose detergent works for pretty much all washable acrylic fibers but you should always check the care label for any special instructions. Use the warm water setting for the cycle. Acrylic clothes can get hard and crunchy if you wash them in cold water. Whenever you\u2019re washing a load with acrylic fibers, hit the button for the warm water setting to keep your stuff soft and fresh. Whatever you do, don\u2019t use hot water on acrylic fibers. You\u2019ll wind up shrinking them. Add fabric softener during the last rinse cycle. Even with warm water, your acrylic clothes can get hard and stiff if you wash them a lot. Keep them nice and soft by adding some fabric softener to the wash just before it goes into the last rinse cycle. Don\u2019t pour the fabric softener right on the clothing or you can wind up with stains. Add it to the water in the washer instead. Hand Washing Acrylic Items Select a gentle detergent. Some acrylic fibers are delicate so you need to use specialty detergent. Grab a gentle detergent that\u2019s mild enough to not screw up the fabric. Gentle detergent is usually clearly marked as good for delicates. Wet the item with cool water. A kitchen sink is the perfect place for handwashing your stuff. Fill it up with cool water and dunk your acrylic item in it. Make sure that it gets good and wet. Don\u2019t forget to clean the sink before you start washing your clothes. If you don\u2019t want to wash your clothes in the kitchen sink, you can always use your bathtub or a utility bucket. Mix the detergent into the water. Don\u2019t pour the detergent directly on your clothes. Add a little bit to the water and slosh it around to mix it in. Move the clothes up and down in the water in a pumping motion to get them totally clean. Don\u2019t add more than a tablespoon (15 ml) of detergent to the sink. If your clothing is really dirty, let it soak for a while. You can leave in the water and detergent for up to 60 minutes. Drain the sink and rinse the item with cool water. The water in the sink\u2019s going to get pretty dirty after you slosh your acrylic items around in it. Let the water out, and then fill it back up with cool, clean water to rinse your clothes. Swish the items around in the water to get the detergent out. If there\u2019s a ring of dirt around the sink after you drain it, clean it out before you rinse your stuff. Depending on how dirty your clothes are, you may need to rinse them more than once. You can rinse the clothes under running water at the faucet for the second rinse. Gently squeeze out the excess water and shake out of the item. You\u2019ll damage the acrylic fibers if you wring or twist the clothes to get the water out of them. Instead, just use your hands to gently press down on the fabric and then shake it out so it\u2019s not dripping wet. Drying Acrylic Items Lay acrylic sweaters out flat to dry. You shouldn\u2019t hang an acrylic sweater you\u2019ve hand washed up to dry. It will lose its shape and get stretched out. Make sure your sweater still fits by laying it out on a flat surface like a table or counter to dry. Clean off the surface you dry the sweater on. You don\u2019t want it to get all dirty just after you\u2019ve washed it. Hang other acrylic items on a hanger to dry. Lighter acrylic clothes like knitwear usually don\u2019t lose their shape if you hang them to dry. Put them on a non-rust hanger and set them out to dry. Use lowest heat setting for acrylic items in the dryer. You can throw plenty of acrylic clothes in the dryer. But you have to use the lowest temperature because they can get permanently wrinkled if the dryer\u2019s too hot. Remove the items from the dryer as soon as the cycle is complete. Leaving acrylic clothes in the dryer after the cycle ends can also cause permanent wrinkles. Get your stuff out of the dryer as soon as the tumbling cycle is done. Give the clothes a good shake after they come out to keep any wrinkles from setting. Smooth wrinkles with a moderately hot iron. If the clothes do get a little wrinkled during drying, you can use an iron on most items. Set it to the medium setting and run it over the clothes quickly. Always check the care label so you know that you can iron an item.",
  "tyn_model":[
    "water",
    "dryer",
    "fabric softener",
    "iron",
    "washer",
    "detergent",
    "all-purpose detergent",
    "gentle detergent",
    "acrylic clothes",
    "spray stain remover",
    "laundry detergent",
    "utility bucket",
    "acrylic sweaters",
    "acrylic sweater"
  ],
  "tyn_section":[

  ]
}