{
  "title":"How to Make Ravioli Lasagna",
  "url":"https://www.wikihow.com/Make-Ravioli-Lasagna",
  "category_hierarchy":[
    "Food and Entertaining",
    "Recipes",
    "Pasta and Noodles",
    "Lasagna"
  ],
  "methods":[
    {
      "name":"Traditional Ravioli Lasagna",
      "steps":[
        {
          "headline":"Preheat the oven and prepare a pan.",
          "description":"Turn the oven on to 350 degrees F (180 C). Get out a 9 x 13-inch (23 x 33-cm) baking dish. Spray it with cooking spray to ensure the ravioli lasagna doesn't stick. Set the pan aside while you make the lasagna."
        },
        {
          "headline":"Saute the ground beef and onion.",
          "description":"Place a large skillet on the stove and turn the heat to medium. Put 1 pound (453 g) of ground beef into the skillet. Dice half of a sweet onion and add it to the skillet. Cook the meat until it's completely browned or until it reaches 170 degrees F (60 C). Drain off any fat. Stir the beef and onion mixture as it cooks to prevent it from sticking to the skillet."
        },
        {
          "headline":"Stir in marinara sauce and garlic.",
          "description":"Open a 24-ounce (68 g) jar of marinara sauce and add it to the ground beef and onion. Stir in 2 cloves of minced garlic. Turn the heat down to medium-low. Stir the sauce occasionally and let it simmer for 5 minutes."
        },
        {
          "headline":"Combine the ricotta cheese filling.",
          "description":"Get out a medium mixing bowl. Place the cheese fillings and seasonings into it. Stir it until it's completely combined. You'll need to stir together:\n2 cups (492 g) ricotta\n1 large egg\n1/4 cup (25 g) freshly grated Parmesan\n1/4 cup (5 g) freshly chopped parsley\n1 teaspoon garlic powder"
        },
        {
          "headline":"Assemble the ravioli lasagna.",
          "description":"Spread one third of the meat sauce in the bottom of the prepared pan. Open one 25-ounce (708 g) package of frozen cheese ravioli and place a single layer of frozen ravioli over the sauce. Spread half of the ricotta filling over the ravioli and spread another third of the sauce over it. Arrange another layer of frozen ravioli and the rest of the ricotta filling over it. Spread the rest of the sauce on top."
        },
        {
          "headline":"Sprinkle cheese on the lasagna and bake it for 40 minutes.",
          "description":"Sprinkle 2 cups (226 g) of grated mozzarella evenly over the top of the ravioli lasagna. Cover the pan with a sheet of aluminum foil and put it in the preheated oven. Bake the lasagna for 40 minutes."
        },
        {
          "headline":"Remove the foil and bake it for another 10 minutes.",
          "description":"Carefully take the foil off of the pan. Bake the lasagna for 10 more minutes. This will give the cheese a chance to become golden brown and bubbly. Remove the ravioli lasagna from the oven and serve it once it's set for a few minutes. Consider serving the ravioli lasagna with extra chopped parsley."
        }
      ]
    },
    {
      "name":"Slow Cooker Ravioli Lasagna (Vegetarian)",
      "steps":[
        {
          "headline":"Prepare the slow cooker.",
          "description":"Get out a 5 to 6-quart (4 to 5 liter) slow cooker and plug it in. Generously spray the inside of the slow cooker with cooking spray or brush olive oil inside the slow cooker to prevent the lasagna from sticking. If you prefer, you can buy slow cooker liner inserts. Just put a disposable liner insert inside the slow cooker before you add your ingredients."
        },
        {
          "headline":"Season the marinara sauce.",
          "description":"Open one 24-ounce (68 g) jar of marinara sauce and pour it into a medium mixing bowl. Stir in 2 teaspoons of minced garlic and 1 handful of freshly chopped basil. Set the sauce aside. For a meaty version, you can cook 1 pound (453 g) of ground beef or Italian sausage. Stir it into the seasoned marinara sauce."
        },
        {
          "headline":"Assemble the ravioli lasagna in the slow cooker.",
          "description":"Open one 15-ounce (425 g) package of frozen cheese-filled ravioli. Place half of the frozen ravioli in the bottom of the greased slow cooker. Spread half of the seasoned sauce over the ravioli. Sprinkle 1 cup (113 g) of shredded Italian cheese over it. Arrange the rest of the ravioli on top and spread the rest of the sauce over it. Sprinkle it with another 1 cup (113 g ) of Italian cheese."
        },
        {
          "headline":"Cook the vegetarian ravioli lasagna for 4 to 6 hours.",
          "description":"Put the lid on the slow cooker and turn the cooker on to LOW. Cook the lasagna for 4 to 6 hours. The ravioli should be completely heated throughout and the cheese should melt. Garnish the lasagna with extra chopped basil and serve it right away. Store leftovers in the refrigerator for several days."
        }
      ]
    },
    {
      "name":"Spinach and Sausage Ravioli Lasagna",
      "steps":[
        {
          "headline":"Preheat the oven and cook the sausage.",
          "description":"Turn the oven on to 350 degrees F (180 C). Set a large skillet on your stove and add 1 pound (453 g) of Italian sausage. Turn the heat on to medium. Stir and break up the sausage as it cooks. It should become browned. Ensure that the sausage is cooked to 160\u00b0F (70 C)."
        },
        {
          "headline":"Stir in the baby spinach.",
          "description":"Measure out 12 ounces (340 g) of baby spinach. Look over the spinach and remove any tough stems. Add the spinach to the skillet with the sausage and stir it in. It should begin to wilt within a minute or two. Set the spinach and sausage mixture aside."
        },
        {
          "headline":"Assemble the ravioli lasagna.",
          "description":"Open a 24-ounce (680 g) jar of marinara sauce. Spread a few spoonfuls of sauce on the bottom of a 9 x 13-inch (23 x 33-cm) baking pan. Open a 20-ounce (567 g) package of frozen cheese ravioli and spread a single layer of the ravioli in the pan. Sprinkle 1 1/2 cups (170 g) of shredded mozzarella cheese over the ravioli. Layer the rest of the ravioli on top and spread the sausage spinach mixture over it. Pour the rest of the sauce over and sprinkle another 1 1/2 cups (170 g) of shredded mozzarella on top."
        },
        {
          "headline":"Bake the ravioli lasagna for 30 minutes.",
          "description":"Put the pan of ravioli lasagna in the preheated oven. Bake the ravioli lasagna for 30 minutes. The ravioli should cook completely and the cheese will become bubbly. Remove the pan and let it cool for 10 minutes. Scoop the ravioli lasagna into individual bowls and serve it immediately. You can store leftover ravioli lasagna in the refrigerator for a few days."
        },
        {
          "headline":"Finished.",
          "description":""
        }
      ]
    }
  ],
  "text":" Traditional Ravioli Lasagna Preheat the oven and prepare a pan. Turn the oven on to 350 degrees F (180 C). Get out a 9 x 13-inch (23 x 33-cm) baking dish. Spray it with cooking spray to ensure the ravioli lasagna doesn't stick. Set the pan aside while you make the lasagna. Saute the ground beef and onion. Place a large skillet on the stove and turn the heat to medium. Put 1 pound (453 g) of ground beef into the skillet. Dice half of a sweet onion and add it to the skillet. Cook the meat until it's completely browned or until it reaches 170 degrees F (60 C). Drain off any fat. Stir the beef and onion mixture as it cooks to prevent it from sticking to the skillet. Stir in marinara sauce and garlic. Open a 24-ounce (68 g) jar of marinara sauce and add it to the ground beef and onion. Stir in 2 cloves of minced garlic. Turn the heat down to medium-low. Stir the sauce occasionally and let it simmer for 5 minutes. Combine the ricotta cheese filling. Get out a medium mixing bowl. Place the cheese fillings and seasonings into it. Stir it until it's completely combined. You'll need to stir together:\n2 cups (492 g) ricotta\n1 large egg\n1/4 cup (25 g) freshly grated Parmesan\n1/4 cup (5 g) freshly chopped parsley\n1 teaspoon garlic powder Assemble the ravioli lasagna. Spread one third of the meat sauce in the bottom of the prepared pan. Open one 25-ounce (708 g) package of frozen cheese ravioli and place a single layer of frozen ravioli over the sauce. Spread half of the ricotta filling over the ravioli and spread another third of the sauce over it. Arrange another layer of frozen ravioli and the rest of the ricotta filling over it. Spread the rest of the sauce on top. Sprinkle cheese on the lasagna and bake it for 40 minutes. Sprinkle 2 cups (226 g) of grated mozzarella evenly over the top of the ravioli lasagna. Cover the pan with a sheet of aluminum foil and put it in the preheated oven. Bake the lasagna for 40 minutes. Remove the foil and bake it for another 10 minutes. Carefully take the foil off of the pan. Bake the lasagna for 10 more minutes. This will give the cheese a chance to become golden brown and bubbly. Remove the ravioli lasagna from the oven and serve it once it's set for a few minutes. Consider serving the ravioli lasagna with extra chopped parsley. Slow Cooker Ravioli Lasagna (Vegetarian) Prepare the slow cooker. Get out a 5 to 6-quart (4 to 5 liter) slow cooker and plug it in. Generously spray the inside of the slow cooker with cooking spray or brush olive oil inside the slow cooker to prevent the lasagna from sticking. If you prefer, you can buy slow cooker liner inserts. Just put a disposable liner insert inside the slow cooker before you add your ingredients. Season the marinara sauce. Open one 24-ounce (68 g) jar of marinara sauce and pour it into a medium mixing bowl. Stir in 2 teaspoons of minced garlic and 1 handful of freshly chopped basil. Set the sauce aside. For a meaty version, you can cook 1 pound (453 g) of ground beef or Italian sausage. Stir it into the seasoned marinara sauce. Assemble the ravioli lasagna in the slow cooker. Open one 15-ounce (425 g) package of frozen cheese-filled ravioli. Place half of the frozen ravioli in the bottom of the greased slow cooker. Spread half of the seasoned sauce over the ravioli. Sprinkle 1 cup (113 g) of shredded Italian cheese over it. Arrange the rest of the ravioli on top and spread the rest of the sauce over it. Sprinkle it with another 1 cup (113 g ) of Italian cheese. Cook the vegetarian ravioli lasagna for 4 to 6 hours. Put the lid on the slow cooker and turn the cooker on to LOW. Cook the lasagna for 4 to 6 hours. The ravioli should be completely heated throughout and the cheese should melt. Garnish the lasagna with extra chopped basil and serve it right away. Store leftovers in the refrigerator for several days. Spinach and Sausage Ravioli Lasagna Preheat the oven and cook the sausage. Turn the oven on to 350 degrees F (180 C). Set a large skillet on your stove and add 1 pound (453 g) of Italian sausage. Turn the heat on to medium. Stir and break up the sausage as it cooks. It should become browned. Ensure that the sausage is cooked to 160\u00b0F (70 C). Stir in the baby spinach. Measure out 12 ounces (340 g) of baby spinach. Look over the spinach and remove any tough stems. Add the spinach to the skillet with the sausage and stir it in. It should begin to wilt within a minute or two. Set the spinach and sausage mixture aside. Assemble the ravioli lasagna. Open a 24-ounce (680 g) jar of marinara sauce. Spread a few spoonfuls of sauce on the bottom of a 9 x 13-inch (23 x 33-cm) baking pan. Open a 20-ounce (567 g) package of frozen cheese ravioli and spread a single layer of the ravioli in the pan. Sprinkle 1 1/2 cups (170 g) of shredded mozzarella cheese over the ravioli. Layer the rest of the ravioli on top and spread the sausage spinach mixture over it. Pour the rest of the sauce over and sprinkle another 1 1/2 cups (170 g) of shredded mozzarella on top. Bake the ravioli lasagna for 30 minutes. Put the pan of ravioli lasagna in the preheated oven. Bake the ravioli lasagna for 30 minutes. The ravioli should cook completely and the cheese will become bubbly. Remove the pan and let it cool for 10 minutes. Scoop the ravioli lasagna into individual bowls and serve it immediately. You can store leftover ravioli lasagna in the refrigerator for a few days. Finished. ",
  "tyn_model":[
    "slow cooker",
    "oven",
    "marinara sauce",
    "ground beef",
    "skillet",
    "spinach",
    "onion",
    "ricotta",
    "cooking spray",
    "large skillet",
    "garlic",
    "medium mixing bowl",
    "parsley",
    "frozen cheese ravioli",
    "foil",
    "basil",
    "italian sausage",
    "italian cheese",
    "baby spinach",
    "sausage",
    "baking dish",
    "stove",
    "sweet onion",
    "beef",
    "ricotta cheese",
    "seasonings",
    "egg",
    "parmesan",
    "garlic powder",
    "meat sauce",
    "frozen ravioli",
    "cheese",
    "mozzarella",
    "aluminum foil",
    "slow cooker ravioli",
    "olive oil",
    "disposable liner",
    "minced garlic",
    "frozen cheese",
    "baking pan",
    "mozzarella cheese",
    "sausage spinach",
    "shredded mozzarella",
    "pan",
    "ravioli lasagna",
    "preheated oven",
    "refrigerator"
  ],
  "tyn_section":[

  ]
}