{
  "title":"How to Dust Walls",
  "url":"https://www.wikihow.com/Dust-Walls",
  "category_hierarchy":[
    "Home and Garden",
    "Housekeeping",
    "Cleaning"
  ],
  "methods":[
    {
      "name":"Using a Broom and Towel",
      "steps":[
        {
          "headline":"Protect the floor and furniture.",
          "description":"Place a drop cloth on the floor beneath the walls you will be cleaning. Pull furniture away from the walls and cover it with a sheet."
        },
        {
          "headline":"Cover a broom with a towel.",
          "description":"With your broom\u2019s head pointed up and its handle pointed down, lay a rag or towel over the broom head. Ensure as many of the bristles as possible are covered by the towel. To prevent the towel from falling off during use, wrap a piece of string around the broom head at its thickest point. If possible, use a microfiber towel."
        },
        {
          "headline":"Dust a vertical strip down the wall.",
          "description":"Place the broom head against a corner of the wall where it meets the ceiling. Drag the broom down along the wall in a slow, steady motion. After you\u2019re done, evaluate the section of the wall you just dusted. If any dust remains, run the broom along the strip again."
        },
        {
          "headline":"Switch the towel out as needed.",
          "description":"At some point, the towel will become too dusty and dirty to be effective. Evaluate the towel after moving about one-third of the way across the wall. If it is excessively dusty, unbind it from the broom and shake it out over the rubbish bin. Toss it in your laundry basket and cover the broom with another towel just as before."
        },
        {
          "headline":"Remove dust from the rest of the wall.",
          "description":"Move to the space on the wall next to the area you just cleaned. Just as before, place the broom head against the top of the wall and move it down the wall in a vertical strip. Continue in this way long the entire wall. When you\u2019ve finished the first wall, move to the one next to it and continue the process until the walls have all been dusted."
        }
      ]
    },
    {
      "name":"Using a Mop to Remove Dust",
      "steps":[
        {
          "headline":"Dampen the mop.",
          "description":"Fill a mop bucket with warm, soapy water. Dip the mop into the bucket, then remove it and wring it out. The mop should not drip, but it should be moist to the touch. The best type of mop to use is a sponge mop, but you could use a regular mop, too."
        },
        {
          "headline":"Move the damp mop up and down along the wall.",
          "description":"You could start on the left and move to the right, or the other way around, but always start at the top of the wall and move to the bottom. This will ensure that the dust from the upper area of the wall will not fall down to cover an area you already cleaned."
        },
        {
          "headline":"Move along the direction of any wallpaper seams.",
          "description":"If you\u2019re dusting a wall that has wallpaper on it, move along the direction of the seams. Typically, this will also mean moving along an up-down axis. But if the wallpaper seams run horizontally across the wall, move the mop along the wall from side to side."
        }
      ]
    },
    {
      "name":"Combining Dry and Wet Cleaning",
      "steps":[
        {
          "headline":"Equip a flat head mop with a dry dusting head or cloth.",
          "description":"Ideally, the mop head or cloth will be made of microfiber. The exact process by which you change the dusting cloth or mop head depends on the manufacturer. Generally, however, the process is as simple as laying the new cloth over the flat head of the mop, then moving the clips that bind it to the top of the mop head. Other flat head mops have replaceable heads that simply slide on. Microfiber cloth excels at collecting dust and is minimally abrasive. EXPERT TIP\t\t\t\t\t\t\t\t\t\t\t\t\t\t\t\t\t\t\t\t\t\t\t\t\t\t\t\t\t\t\tChris Willatt\t\t\t\t\t\t\t\t\t\t\t\t\t\t\t\tCleaning Guru\t\t\t\t\t\t\t\tChris Willatt is the owner and founder of Alpine Maids, a cleaning agency in Denver, Colorado started in 2015. Alpine Maids has received Angie's List Super Service Award for three years in a row since 2016 and has been awarded Colorado's \"Top Rated Local House Cleaning\" Award in 2018. Chris Willatt\t\t\tCleaning Guru\t\t\t\tUse a flat mop if your walls are textured. Chris Willatt, the owner of Alpine Maids, says: \"Textured walls can build up a lot of dust over time. A microfiber dust mop is great for clearing that out, although any flat mop will work. If you don't have one, you can even run a microfiber cloth over the walls to dust by hand.\""
        },
        {
          "headline":"Move along the wall in a \u201cW\u201d pattern.",
          "description":"Moving along the wall in a \u201cW\u201d pattern will ensure you are dusting the entire wall. Start at the top left corner of the wall, then move down and over, then up and over in a continuous motion."
        },
        {
          "headline":"Give the wall a gentle wash.  Once you\u2019ve dusted the entire wall with the the flat head mop, spray some water on a microfiber cloth.",
          "description":"Wipe the wall down using the damp microfiber cloth, especially on areas where dust seems to have been left behind."
        }
      ]
    },
    {
      "name":"Finding Other Ways to Dust Walls",
      "steps":[
        {
          "headline":"Wipe the wall with an electrostatic dry dust cloth.",
          "description":"Electrostatic dry dust cloths use static electricity to attract and trap dust. Place the cloth on the dusty wall and move it back and forth. Dispose of the cloth when you\u2019re done cleaning the wall."
        },
        {
          "headline":"Dust the wall with a lambswool duster.",
          "description":"A lambswool duster is one of the best options for dusting walls. Because of its elongated design, the best way to use the lambswool duster on walls is to place it in a vertical orientation in the leftmost corner of the wall, then drag it across the wall to the other corner. If necessary, use a ladder as you move across the room. After dusting the first horizontal strip of the wall, drag the lambswool duster back across the wall in the opposite direction. Dust along a path just below that of the first. Continue in this way until the wall is completely dusted."
        },
        {
          "headline":"Use a vacuum to dust the wall.",
          "description":"Attach a wall brush extension to your vacuum. Then, vacuum the entire surface of the wall. Move the vacuum\u2019s wall brush extension from the top edge of the wall where it meets the ceiling down to the base of the wall. This will allow you to clean the wall in a complete and consistent manner. A wall brush extension is a long tube which links the suction end of your vacuum to bristled opening on the other end. Using the wall brush extension will prevent your wall from being damaged as the vacuum tube moves across it."
        }
      ]
    }
  ],
  "text":" Using a Broom and Towel Protect the floor and furniture. Place a drop cloth on the floor beneath the walls you will be cleaning. Pull furniture away from the walls and cover it with a sheet. Cover a broom with a towel. With your broom\u2019s head pointed up and its handle pointed down, lay a rag or towel over the broom head. Ensure as many of the bristles as possible are covered by the towel. To prevent the towel from falling off during use, wrap a piece of string around the broom head at its thickest point. If possible, use a microfiber towel. Dust a vertical strip down the wall. Place the broom head against a corner of the wall where it meets the ceiling. Drag the broom down along the wall in a slow, steady motion. After you\u2019re done, evaluate the section of the wall you just dusted. If any dust remains, run the broom along the strip again. Switch the towel out as needed. At some point, the towel will become too dusty and dirty to be effective. Evaluate the towel after moving about one-third of the way across the wall. If it is excessively dusty, unbind it from the broom and shake it out over the rubbish bin. Toss it in your laundry basket and cover the broom with another towel just as before. Remove dust from the rest of the wall. Move to the space on the wall next to the area you just cleaned. Just as before, place the broom head against the top of the wall and move it down the wall in a vertical strip. Continue in this way long the entire wall. When you\u2019ve finished the first wall, move to the one next to it and continue the process until the walls have all been dusted. Using a Mop to Remove Dust Dampen the mop. Fill a mop bucket with warm, soapy water. Dip the mop into the bucket, then remove it and wring it out. The mop should not drip, but it should be moist to the touch. The best type of mop to use is a sponge mop, but you could use a regular mop, too. Move the damp mop up and down along the wall. You could start on the left and move to the right, or the other way around, but always start at the top of the wall and move to the bottom. This will ensure that the dust from the upper area of the wall will not fall down to cover an area you already cleaned. Move along the direction of any wallpaper seams. If you\u2019re dusting a wall that has wallpaper on it, move along the direction of the seams. Typically, this will also mean moving along an up-down axis. But if the wallpaper seams run horizontally across the wall, move the mop along the wall from side to side. Combining Dry and Wet Cleaning Equip a flat head mop with a dry dusting head or cloth. Ideally, the mop head or cloth will be made of microfiber. The exact process by which you change the dusting cloth or mop head depends on the manufacturer. Generally, however, the process is as simple as laying the new cloth over the flat head of the mop, then moving the clips that bind it to the top of the mop head. Other flat head mops have replaceable heads that simply slide on. Microfiber cloth excels at collecting dust and is minimally abrasive. EXPERT TIP\t\t\t\t\t\t\t\t\t\t\t\t\t\t\t\t\t\t\t\t\t\t\t\t\t\t\t\t\t\t\tChris Willatt\t\t\t\t\t\t\t\t\t\t\t\t\t\t\t\tCleaning Guru\t\t\t\t\t\t\t\tChris Willatt is the owner and founder of Alpine Maids, a cleaning agency in Denver, Colorado started in 2015. Alpine Maids has received Angie's List Super Service Award for three years in a row since 2016 and has been awarded Colorado's \"Top Rated Local House Cleaning\" Award in 2018. Chris Willatt\t\t\tCleaning Guru\t\t\t\tUse a flat mop if your walls are textured. Chris Willatt, the owner of Alpine Maids, says: \"Textured walls can build up a lot of dust over time. A microfiber dust mop is great for clearing that out, although any flat mop will work. If you don't have one, you can even run a microfiber cloth over the walls to dust by hand.\" Move along the wall in a \u201cW\u201d pattern. Moving along the wall in a \u201cW\u201d pattern will ensure you are dusting the entire wall. Start at the top left corner of the wall, then move down and over, then up and over in a continuous motion. Give the wall a gentle wash.  Once you\u2019ve dusted the entire wall with the the flat head mop, spray some water on a microfiber cloth. Wipe the wall down using the damp microfiber cloth, especially on areas where dust seems to have been left behind. Finding Other Ways to Dust Walls Wipe the wall with an electrostatic dry dust cloth. Electrostatic dry dust cloths use static electricity to attract and trap dust. Place the cloth on the dusty wall and move it back and forth. Dispose of the cloth when you\u2019re done cleaning the wall. Dust the wall with a lambswool duster. A lambswool duster is one of the best options for dusting walls. Because of its elongated design, the best way to use the lambswool duster on walls is to place it in a vertical orientation in the leftmost corner of the wall, then drag it across the wall to the other corner. If necessary, use a ladder as you move across the room. After dusting the first horizontal strip of the wall, drag the lambswool duster back across the wall in the opposite direction. Dust along a path just below that of the first. Continue in this way until the wall is completely dusted. Use a vacuum to dust the wall. Attach a wall brush extension to your vacuum. Then, vacuum the entire surface of the wall. Move the vacuum\u2019s wall brush extension from the top edge of the wall where it meets the ceiling down to the base of the wall. This will allow you to clean the wall in a complete and consistent manner. A wall brush extension is a long tube which links the suction end of your vacuum to bristled opening on the other end. Using the wall brush extension will prevent your wall from being damaged as the vacuum tube moves across it.",
  "tyn_model":[
    "broom",
    "towel",
    "mop",
    "vacuum",
    "microfiber cloth",
    "lambswool duster",
    "alpine maids",
    "water",
    "flat head mop",
    "mop head",
    "\u201cw",
    "\u201d pattern",
    "wall brush",
    "wall brush extension",
    "sheet",
    "rag",
    "microfiber towel",
    "rubbish bin",
    "laundry basket",
    "mop bucket",
    "bucket",
    "sponge mop",
    "wallpaper",
    "dry dusting head",
    "dusting cloth",
    "microfiber dust mop",
    "electrostatic dry dust cloth",
    "electrostatic dry dust cloths",
    "ladder",
    "vacuum tube"
  ],
  "tyn_section":[

  ]
}