{
  "title":"How to Connect Your Xbox to the Internet",
  "url":"https://www.wikihow.com/Connect-Your-Xbox-to-the-Internet",
  "category_hierarchy":[
    "Hobbies and Crafts",
    "Games",
    "Video Games",
    "Xbox"
  ],
  "methods":[
    {
      "name":"Wired Connection",
      "steps":[
        {
          "headline":"Use an Ethernet cable.",
          "description":"The Xbox 360 comes with an Ethernet cable that you will need to make a wired connection. You can also use other Ethernet cables as long as they are compatible with your console. Be mindful of your console\u2019s distance from the Internet source: you don't want to get a cord that is too short!"
        },
        {
          "headline":"Connect the Ethernet cable.",
          "description":"You will find the Ethernet port at the back of the Xbox 360. Connect the Ethernet cable to this port and then connect the other end to your router or directly to your Internet modem. Make sure the connection is secured."
        },
        {
          "headline":"Turn on your console.",
          "description":"You can now turn on your Xbox 360 after connecting the Ethernet cable at both ends. You can power on your console by touching the power sensor of the Xbox 360 on its front panel or by pressing the Home button on your Xbox 360 controller. You can also open the tray by touching its eject sensor and the console will automatically turn on. The console should automatically be connected to the Internet upon boot-up."
        }
      ]
    },
    {
      "name":"Wireless Connection",
      "steps":[
        {
          "headline":"Access Wi-Fi.",
          "description":"The Xbox 360 can easily access the Internet wirelessly in an instant! It has a built in Wi-Fi adapter that allows it to connect to your router automatically."
        },
        {
          "headline":"Power on your console.",
          "description":"The first time you turn on your console, it will not yet automatically connect to the Internet, since it hasn\u2019t memorized your router\u2019s access information yet."
        },
        {
          "headline":"Connect your router.",
          "description":"In the Network menu, Xbox 360 will display all the Wi-Fi hotspots within its signal\u2019s reach. Once the Xbox 360 detects your router in the Network, select it and you will be able to access the Internet. You may have to enter your router\u2019s password first, depending on your router\u2019s security settings. Xbox 360 will now remember this wireless setup and use it automatically on your following sessions. If you have an Ethernet cable connected to your console, it will automatically go into \u201cwired\u201d Internet connection mode. If you want to stay connected wirelessly just disconnect the Ethernet cable from your unit. You may need to adjust your console\u2019s wireless configuration setting if your console fails to connect to the Internet. When in doubt, set everything to automatic or simply reset to default."
        }
      ]
    }
  ],
  "text":" Wired Connection Use an Ethernet cable. The Xbox 360 comes with an Ethernet cable that you will need to make a wired connection. You can also use other Ethernet cables as long as they are compatible with your console. Be mindful of your console\u2019s distance from the Internet source: you don't want to get a cord that is too short! Connect the Ethernet cable. You will find the Ethernet port at the back of the Xbox 360. Connect the Ethernet cable to this port and then connect the other end to your router or directly to your Internet modem. Make sure the connection is secured. Turn on your console. You can now turn on your Xbox 360 after connecting the Ethernet cable at both ends. You can power on your console by touching the power sensor of the Xbox 360 on its front panel or by pressing the Home button on your Xbox 360 controller. You can also open the tray by touching its eject sensor and the console will automatically turn on. The console should automatically be connected to the Internet upon boot-up. Wireless Connection Access Wi-Fi. The Xbox 360 can easily access the Internet wirelessly in an instant! It has a built in Wi-Fi adapter that allows it to connect to your router automatically. Power on your console. The first time you turn on your console, it will not yet automatically connect to the Internet, since it hasn\u2019t memorized your router\u2019s access information yet. Connect your router. In the Network menu, Xbox 360 will display all the Wi-Fi hotspots within its signal\u2019s reach. Once the Xbox 360 detects your router in the Network, select it and you will be able to access the Internet. You may have to enter your router\u2019s password first, depending on your router\u2019s security settings. Xbox 360 will now remember this wireless setup and use it automatically on your following sessions. If you have an Ethernet cable connected to your console, it will automatically go into \u201cwired\u201d Internet connection mode. If you want to stay connected wirelessly just disconnect the Ethernet cable from your unit. You may need to adjust your console\u2019s wireless configuration setting if your console fails to connect to the Internet. When in doubt, set everything to automatic or simply reset to default.",
  "tyn_model":[
    "xbox 360",
    "ethernet cable",
    "router",
    "ethernet cables",
    "ethernet port",
    "internet modem",
    "wi-fi adapter",
    "\u201cwired",
    "\u201d internet"
  ],
  "tyn_section":[

  ]
}