{
  "title":"How to Make Pulled Pork in the Crockpot",
  "url":"https://www.wikihow.com/Make-Pulled-Pork-in-the-Crockpot",
  "category_hierarchy":[
    "Food and Entertaining",
    "Recipes",
    "Meat",
    "Pork"
  ],
  "methods":[
    {
      "name":"Easy Barbecue Pulled Pork",
      "steps":[
        {
          "headline":"Prepare the ingredients.",
          "description":"Rinse the pork well in cold water. Trim off any excess fat using a sharp knife. Roughly slice the onions."
        },
        {
          "headline":"Assemble the ingredients in the crockpot.",
          "description":"Place one sliced onion in the bottom of the crockpot. This will prevent the meat from burning. Place the roast on top, then cover with the second onion. Pour the ginger ale over the pork and onions."
        },
        {
          "headline":"Begin cooking.",
          "description":"Cover the pork and cook on low for approximately 12 hours. Depending on the size of your pork and the type of crockpot, you may need to adjust this time upwards or downwards. When it's cooked, you should be able to shred the pork easily with a fork. If you cannot, it probably needs more cooking time."
        },
        {
          "headline":"Drain and shred the meat.",
          "description":"When the meat is tender, remove the pork from the crockpot and drain the liquid. Set the onions aside for now. Using two forks, shred the meat, discarding any fat, bones or skin. Most of the fat will have melted away by now."
        },
        {
          "headline":"Return the meat to the crockpot.",
          "description":"Place the shredded meat and onions back in the crockpot. Stir in the entire bottle of barbecue sauce. Continue to cook on low heat for another 4-6 hours."
        },
        {
          "headline":"Serve.",
          "description":"Serve your barbecue pulled pork with hamburger buns or rolls and additional barbecue sauce. Any leftovers will keep well in the freezer."
        }
      ]
    },
    {
      "name":"Pulled Pork with Spice Rub",
      "steps":[
        {
          "headline":"Make the spice rub.",
          "description":"Place all of the spices in a small bowl and stir until combined."
        },
        {
          "headline":"Rub the mixed spices into the meat.",
          "description":"On a clean surface, sprinkle the spice mix evenly over the pork and massage into the meat with your fingers. Use a double layer of plastic wrap to firmly cover the meat. Leave it to sit in the refrigerator for as little as three hours, or as long as three days. The longer you leave the meat, the more flavor it will develop."
        },
        {
          "headline":"Unwrap the pork and place it in the crockpot.",
          "description":"Pour 1/4 cup of water over the meat, then add the liquid smoke, if using. Set the crockpot to a low heat and cook the pork for 8-10 hours, until the meat is tender enough to shred with a fork."
        },
        {
          "headline":"Remove the pork and drain any liquid from the crockpot.",
          "description":"Place the roast of pork on a cutting board. Then, using two forks, shred the meat, discarding any fat, bones or skin."
        },
        {
          "headline":"Continue cooking.",
          "description":"Return the shredded meat to the crockpot and stir in a cup of barbecue sauce. Continue to cook on low for 30-60 minutes, until hot."
        },
        {
          "headline":"Serve.",
          "description":"Serve the pulled pork with hamburger buns or rolls, additional barbecue sauce and some homemade coleslaw."
        }
      ]
    }
  ],
  "text":" Easy Barbecue Pulled Pork Prepare the ingredients. Rinse the pork well in cold water. Trim off any excess fat using a sharp knife. Roughly slice the onions. Assemble the ingredients in the crockpot. Place one sliced onion in the bottom of the crockpot. This will prevent the meat from burning. Place the roast on top, then cover with the second onion. Pour the ginger ale over the pork and onions. Begin cooking. Cover the pork and cook on low for approximately 12 hours. Depending on the size of your pork and the type of crockpot, you may need to adjust this time upwards or downwards. When it's cooked, you should be able to shred the pork easily with a fork. If you cannot, it probably needs more cooking time. Drain and shred the meat. When the meat is tender, remove the pork from the crockpot and drain the liquid. Set the onions aside for now. Using two forks, shred the meat, discarding any fat, bones or skin. Most of the fat will have melted away by now. Return the meat to the crockpot. Place the shredded meat and onions back in the crockpot. Stir in the entire bottle of barbecue sauce. Continue to cook on low heat for another 4-6 hours. Serve. Serve your barbecue pulled pork with hamburger buns or rolls and additional barbecue sauce. Any leftovers will keep well in the freezer. Pulled Pork with Spice Rub Make the spice rub. Place all of the spices in a small bowl and stir until combined. Rub the mixed spices into the meat. On a clean surface, sprinkle the spice mix evenly over the pork and massage into the meat with your fingers. Use a double layer of plastic wrap to firmly cover the meat. Leave it to sit in the refrigerator for as little as three hours, or as long as three days. The longer you leave the meat, the more flavor it will develop. Unwrap the pork and place it in the crockpot. Pour 1/4 cup of water over the meat, then add the liquid smoke, if using. Set the crockpot to a low heat and cook the pork for 8-10 hours, until the meat is tender enough to shred with a fork. Remove the pork and drain any liquid from the crockpot. Place the roast of pork on a cutting board. Then, using two forks, shred the meat, discarding any fat, bones or skin. Continue cooking. Return the shredded meat to the crockpot and stir in a cup of barbecue sauce. Continue to cook on low for 30-60 minutes, until hot. Serve. Serve the pulled pork with hamburger buns or rolls, additional barbecue sauce and some homemade coleslaw.",
  "tyn_model":[
    "crockpot",
    "onions",
    "barbecue sauce",
    "pork",
    "barbecue pulled pork",
    "water",
    "fork",
    "forks",
    "pulled pork",
    "spice rub",
    "spices",
    "sharp knife",
    "onion",
    "ginger ale",
    "hamburger buns",
    "small bowl",
    "spice mix",
    "plastic wrap",
    "refrigerator",
    "cutting board",
    "coleslaw"
  ],
  "tyn_section":[

  ]
}