{
  "title":"How to Clean Cowhide Leather",
  "url":"https://www.wikihow.com/Clean-Cowhide-Leather",
  "category_hierarchy":[
    "Home and Garden",
    "Housekeeping",
    "Cleaning",
    "Cleaning Animal Materials",
    "Cleaning Leather"
  ],
  "methods":[
    {
      "name":"Removing Dirt and Stains from Tanned Leather",
      "steps":[
        {
          "headline":"Brush away dirt and dust.",
          "description":"Use a soft brush like a toothbrush or a soft scrub brush. Gently brush your cowhide leather to remove dirt and dust before cleaning."
        },
        {
          "headline":"Pour a cup (240 ml) of warm water into two separate bowls.",
          "description":"One bowl will be used for cleaning, while the other will be used for rinsing. Additionally, set two to three cloths aside for cleaning and rinsing."
        },
        {
          "headline":"Add \u00bd teaspoon (2.5 ml) of dish soap to one of the bowls.",
          "description":"Use a spoon to mix the ingredients together until a soapy solution forms. This bowl will be used for cleaning the leather."
        },
        {
          "headline":"Scrub and rinse small sections of leather.",
          "description":"Dip a clean cloth into the soapy solution and squeeze out any excess water. Working in small sections, gently scrub the leather in a circular motion. Then dip a clean, dry cloth into the bowl of warm water. Squeeze out any excess water. Gently wipe the section clean with the damp cloth. Avoid scrubbing the leather with soap all at once before rinsing the entire piece. Instead, work on small sections at at time."
        },
        {
          "headline":"Use a clean side of the cloth for each new section.",
          "description":"Since dirty cloths can stain leather, use a clean side of the cloth every time you work on a new section. Additionally, use a new cloth once you run out of clean sections on the first cloth."
        },
        {
          "headline":"Air dry the leather.",
          "description":"Place the leather in a well-ventilated area to air dry. Alternatively, place it outside under a covered area like a porch to air dry. Avoid placing the leather in direct sunlight to air dry."
        },
        {
          "headline":"Apply a conditioner once the leather is nearly dry.",
          "description":"Dip a clean cloth into the leather conditioner. Rub a light coating of conditioner over the entire surface of the leather. You can purchase leather conditioners online, or from your local shoe repair store or discount retailer."
        }
      ]
    },
    {
      "name":"Spot-Cleaning Hair-On Leather",
      "steps":[
        {
          "headline":"Use a handheld vacuum to remove dirt and dust.",
          "description":"Vacuum the leather in the direction of the hair growth. If you do not have a handheld vacuum, then use a wire brush to remove dirt and dust. Gently brush the leather in the direction of the hair growth until all of the dirt and dust are removed. If you are cleaning a cowhide area rug, then simply shake the rug outside to remove dust and dirt. Try to avoid using a regular vacuum with rotating brushes. The rotating brushes may pull the hair out of the cowhide."
        },
        {
          "headline":"Pour \u00bd teaspoon (2.5 ml) of dish soap into a bowl.",
          "description":"Mix in one cup (240 ml) of warm water. Mix the ingredients together until a soapy solution forms."
        },
        {
          "headline":"Blot the leather.",
          "description":"Dip a clean cloth into the soapy solution. Squeeze out any excess water. Working on small sections at a time, gently blot the leather with the cloth. To reach dirt at the base of the hairs, gently rub the leather."
        },
        {
          "headline":"Continue to blot the leather with the cloth.",
          "description":"As you blot the leather, re-dip the cloth into the soapy solution as it becomes dry. Use a clean section of the cloth each time you re-dip it."
        },
        {
          "headline":"Rinse the leather with clean water.",
          "description":"Once the leather is clean, fill a bowl with warm water. Dip a clean, dry cloth into the bowl. Squeeze out any excess water. Blot the sections you cleaned until all of the soap is removed."
        },
        {
          "headline":"Dry and brush the cowhide leather.",
          "description":"Let the leather air dry. Avoid using a blow dryer to speed up the drying process. Once the cowhide is dry, use a soft brush to brush the hair. Additionally, do not place the cowhide in the sun to air dry either. The sun may bleach the leather."
        }
      ]
    }
  ],
  "text":" Removing Dirt and Stains from Tanned Leather Brush away dirt and dust. Use a soft brush like a toothbrush or a soft scrub brush. Gently brush your cowhide leather to remove dirt and dust before cleaning. Pour a cup (240 ml) of warm water into two separate bowls. One bowl will be used for cleaning, while the other will be used for rinsing. Additionally, set two to three cloths aside for cleaning and rinsing. Add \u00bd teaspoon (2.5 ml) of dish soap to one of the bowls. Use a spoon to mix the ingredients together until a soapy solution forms. This bowl will be used for cleaning the leather. Scrub and rinse small sections of leather. Dip a clean cloth into the soapy solution and squeeze out any excess water. Working in small sections, gently scrub the leather in a circular motion. Then dip a clean, dry cloth into the bowl of warm water. Squeeze out any excess water. Gently wipe the section clean with the damp cloth. Avoid scrubbing the leather with soap all at once before rinsing the entire piece. Instead, work on small sections at at time. Use a clean side of the cloth for each new section. Since dirty cloths can stain leather, use a clean side of the cloth every time you work on a new section. Additionally, use a new cloth once you run out of clean sections on the first cloth. Air dry the leather. Place the leather in a well-ventilated area to air dry. Alternatively, place it outside under a covered area like a porch to air dry. Avoid placing the leather in direct sunlight to air dry. Apply a conditioner once the leather is nearly dry. Dip a clean cloth into the leather conditioner. Rub a light coating of conditioner over the entire surface of the leather. You can purchase leather conditioners online, or from your local shoe repair store or discount retailer. Spot-Cleaning Hair-On Leather Use a handheld vacuum to remove dirt and dust. Vacuum the leather in the direction of the hair growth. If you do not have a handheld vacuum, then use a wire brush to remove dirt and dust. Gently brush the leather in the direction of the hair growth until all of the dirt and dust are removed. If you are cleaning a cowhide area rug, then simply shake the rug outside to remove dust and dirt. Try to avoid using a regular vacuum with rotating brushes. The rotating brushes may pull the hair out of the cowhide. Pour \u00bd teaspoon (2.5 ml) of dish soap into a bowl. Mix in one cup (240 ml) of warm water. Mix the ingredients together until a soapy solution forms. Blot the leather. Dip a clean cloth into the soapy solution. Squeeze out any excess water. Working on small sections at a time, gently blot the leather with the cloth. To reach dirt at the base of the hairs, gently rub the leather. Continue to blot the leather with the cloth. As you blot the leather, re-dip the cloth into the soapy solution as it becomes dry. Use a clean section of the cloth each time you re-dip it. Rinse the leather with clean water. Once the leather is clean, fill a bowl with warm water. Dip a clean, dry cloth into the bowl. Squeeze out any excess water. Blot the sections you cleaned until all of the soap is removed. Dry and brush the cowhide leather. Let the leather air dry. Avoid using a blow dryer to speed up the drying process. Once the cowhide is dry, use a soft brush to brush the hair. Additionally, do not place the cowhide in the sun to air dry either. The sun may bleach the leather.",
  "tyn_model":[
    "water",
    "bowl",
    "cloth",
    "vacuum",
    "dish soap",
    "soap",
    "conditioner",
    "bowls",
    "spoon",
    "leather conditioner",
    "leather conditioners",
    "wire brush",
    "blow dryer"
  ],
  "tyn_section":[

  ]
}