{
  "title":"How to Refund a Game on Steam",
  "url":"https://www.wikihow.com/Refund-a-Game-on-Steam",
  "category_hierarchy":[
    "Hobbies and Crafts",
    "Games",
    "Video Games",
    "Steam Games"
  ],
  "parts":[
    {
      "name":"Requesting Your Refund",
      "steps":[
        {
          "headline":"Go to \"Steam Help.\"",
          "description":"Log into your Steam account. Click on the \"Steam Help\" tab near the top of the screen."
        },
        {
          "headline":"Specify you need help with a purchase.",
          "description":"When you click on \"Steam Help,\" you will be redirected to a list of options. Near the bottom of the list, you should see the option \"A Purchase.\" Click on this."
        },
        {
          "headline":"Select the game you want to refund.",
          "description":"After you click \"A Purchase,\" you should be directed to a list of games you purchased on Steam. Select the game you're looking to refund."
        },
        {
          "headline":"Explain the problem.",
          "description":"You will then be presented with options to specify the problem with your purchase. Select the reason you're refunding the game. Options include things like \"Gameplay or technical issue\" or \"I purchased this by accident.\""
        },
        {
          "headline":"Request a refund.",
          "description":"On the next screen, select the option \"I'd like the request a refund.\" You can then fill out a few notes explaining the specifics and hit the \"submit\" button. For example, in the notes field, write something like, \"I meant to purchase the newer version of this game and it wasn't clearly labeled on the site.\""
        }
      ]
    },
    {
      "name":"Receiving a Response",
      "steps":[
        {
          "headline":"Check your e-mail for a confirmation.",
          "description":"You should get an email confirmation shortly after requesting your refund. If you don't receive one within a few hours, you may want to call Steam's help line to check to make sure your refund request was received."
        },
        {
          "headline":"Wait a week to hear back about your refund.",
          "description":"Be patient when waiting for your refund. While some refunds are processed quickly, it can take up to a week for your refund to be processed. It may sometimes take longer if Steam got a lot of refund requests around the time you submitted your request."
        },
        {
          "headline":"Check your bank account to make sure the money was refunded.",
          "description":"If you get confirmation your refund request was approved, keep an eye on your bank account. Within the next few days, your money should be refunded. If it's not refunded within a week, contact Steam via phone to make sure your banking information is correct."
        }
      ]
    },
    {
      "name":"Avoiding a Rejection",
      "steps":[
        {
          "headline":"Make sure to ask for refund within 14 days of purchases.",
          "description":"You usually have 14 days after purchase to request a refund. While Steam may sometimes issue a refund outside of this timeframe on a case by case basis, you're much more likely to receive a refund if you act fast."
        },
        {
          "headline":"Do not request too many refunds.",
          "description":"There is technically no limit as to how many refunds you can request. However, if you request too many refunds in a short timeframe, you may receive an e-mail with a warning. Some people have been known to mine games for rewards and achievements and then demand a refund, so Steam is suspicious of users who request refunds frequently."
        },
        {
          "headline":"Follow regulations regarding refunding gifts.",
          "description":"If you bought a game as a gift and want to refund it, you have to request the refund before gifting the item. If you've already gifted the item, only the person who received it can request a refund."
        },
        {
          "headline":"Request an appeal for a refund.",
          "description":"If your refund was rejected for any reasons, you can request an appeal. Simply issue another request, restating your concerns. Sometimes, Steam may change their minds and issue a refund."
        }
      ]
    }
  ],
  "text":" Requesting Your Refund Go to \"Steam Help.\" Log into your Steam account. Click on the \"Steam Help\" tab near the top of the screen. Specify you need help with a purchase. When you click on \"Steam Help,\" you will be redirected to a list of options. Near the bottom of the list, you should see the option \"A Purchase.\" Click on this. Select the game you want to refund. After you click \"A Purchase,\" you should be directed to a list of games you purchased on Steam. Select the game you're looking to refund. Explain the problem. You will then be presented with options to specify the problem with your purchase. Select the reason you're refunding the game. Options include things like \"Gameplay or technical issue\" or \"I purchased this by accident.\" Request a refund. On the next screen, select the option \"I'd like the request a refund.\" You can then fill out a few notes explaining the specifics and hit the \"submit\" button. For example, in the notes field, write something like, \"I meant to purchase the newer version of this game and it wasn't clearly labeled on the site.\" Receiving a Response Check your e-mail for a confirmation. You should get an email confirmation shortly after requesting your refund. If you don't receive one within a few hours, you may want to call Steam's help line to check to make sure your refund request was received. Wait a week to hear back about your refund. Be patient when waiting for your refund. While some refunds are processed quickly, it can take up to a week for your refund to be processed. It may sometimes take longer if Steam got a lot of refund requests around the time you submitted your request. Check your bank account to make sure the money was refunded. If you get confirmation your refund request was approved, keep an eye on your bank account. Within the next few days, your money should be refunded. If it's not refunded within a week, contact Steam via phone to make sure your banking information is correct. Avoiding a Rejection Make sure to ask for refund within 14 days of purchases. You usually have 14 days after purchase to request a refund. While Steam may sometimes issue a refund outside of this timeframe on a case by case basis, you're much more likely to receive a refund if you act fast. Do not request too many refunds. There is technically no limit as to how many refunds you can request. However, if you request too many refunds in a short timeframe, you may receive an e-mail with a warning. Some people have been known to mine games for rewards and achievements and then demand a refund, so Steam is suspicious of users who request refunds frequently. Follow regulations regarding refunding gifts. If you bought a game as a gift and want to refund it, you have to request the refund before gifting the item. If you've already gifted the item, only the person who received it can request a refund. Request an appeal for a refund. If your refund was rejected for any reasons, you can request an appeal. Simply issue another request, restating your concerns. Sometimes, Steam may change their minds and issue a refund.",
  "tyn_model":[
    "steam",
    "games",
    "game"
  ],
  "tyn_section":[

  ]
}