{
  "title":"How to Get Rid of Suckers from Your Rose Bush",
  "url":"https://www.wikihow.com/Get-Rid-of-Suckers-from-Your-Rose-Bush",
  "category_hierarchy":[
    "Home and Garden",
    "Gardening",
    "Planting and Growing",
    "Growing Flowers",
    "Roses"
  ],
  "methods":[
    {
      "name":"Removing a Sucker",
      "steps":[
        {
          "headline":"Determine if you have grafted roses.",
          "description":"Suckers only occur on grafted roses because they are grown on a different rootstock. Wild roses and some varieties of heritage roses are grown on their own rootstocks, so they do not get suckers. If you have grafted roses, any sprout will be a sucker. If you get a sprout from a wild or heritage rose, these are the same as the base plant and can be transplanted."
        },
        {
          "headline":"Avoid cutting off the sucker.",
          "description":"Though you may want to just get rid of it, don't cut off the suckers. Cutting them off will make them come back even worse than before. Instead, use other means to remove the sucker."
        },
        {
          "headline":"Moisten the soil to loosen the soil.",
          "description":"It's easier to get access to the sucker if the soil is slightly damp. Dry, hard soil is difficult to dig in. Before you start removing the soil to expose the roots, pour water on it or spray it with the garden hose."
        },
        {
          "headline":"Remove the soil from around the base.",
          "description":"To find the source of the sucker, you should get rid of all the soil around the base of the sucker. Expose the roots of the rose bush to find where the sucker is growing from. Use a trowel or your hands to remove the dirt that covers the sucker."
        },
        {
          "headline":"Pull off the sucker.",
          "description":"Place thick gloves on your hands to protect them from any thorns. Take the sucker in your hand firmly. Twist the sucker and pull it off. Do this for any buds or sprouts that you see. Only remove the sucker, not the stems of the healthy rose bush."
        }
      ]
    },
    {
      "name":"Identifying a Sucker",
      "steps":[
        {
          "headline":"Recognize a sucker.",
          "description":"Suckers are offshoots of your rose bush that grow from underground. They will appear as a separate stem or shoot of the bush, generally with leaves that are lighter in color. They also may have a different number of leaves. Suckers appear when the rose bush is damaged, like from a hoe or shovel."
        },
        {
          "headline":"Remove the sucker as soon as you detect it.",
          "description":"Though suckers produce rose blooms, they are harmful to your main roses. They suck all the nutrients away from your main rose bush. Suckers are also not the same variety of rose as your main rose bush, but the one used for the root stock. Avoid letting the suckers grow and deal with them as soon as possible. As soon as you detect a sucker, get rid of it."
        },
        {
          "headline":"Cut suckers away when they are newly formed.",
          "description":"Suckers are more easily eliminated if you remove them as soon as they form. New suckers are easy to get rid of, while established suckers that have been growing for a few years may never be removed."
        }
      ]
    },
    {
      "name":"Preventing Suckers",
      "steps":[
        {
          "headline":"Use caution when digging around your rose bush.",
          "description":"One of the most common reasons rose bushes produce suckers is because the roots have been damaged. This usually occurs when someone digs around the rose bush, like when you are weeding. When you are digging around your rose bush for any reason, you should take special care not to injure the roots at all."
        },
        {
          "headline":"Avoid mowing around your rose bush.",
          "description":"Mowing can cause damage the the roots of the rose bush, which may lead to suckers. Instead of mowing right next to a rose bush, use clippers to trim the grass near it. If you are worried about damaging the roots with clippers, pull the grass and weeds away with your hands."
        },
        {
          "headline":"Avoid damaging the roots when pruning.",
          "description":"Pruning your rose bushes helps keep your roses looking healthy. However, damaging the roots during pruning can cause suckers to form. You should also be careful when cutting away suckers. If you prune the suckers but damage the roots, more suckers can grow."
        }
      ]
    }
  ],
  "text":" Removing a Sucker Determine if you have grafted roses. Suckers only occur on grafted roses because they are grown on a different rootstock. Wild roses and some varieties of heritage roses are grown on their own rootstocks, so they do not get suckers. If you have grafted roses, any sprout will be a sucker. If you get a sprout from a wild or heritage rose, these are the same as the base plant and can be transplanted. Avoid cutting off the sucker. Though you may want to just get rid of it, don't cut off the suckers. Cutting them off will make them come back even worse than before. Instead, use other means to remove the sucker. Moisten the soil to loosen the soil. It's easier to get access to the sucker if the soil is slightly damp. Dry, hard soil is difficult to dig in. Before you start removing the soil to expose the roots, pour water on it or spray it with the garden hose. Remove the soil from around the base. To find the source of the sucker, you should get rid of all the soil around the base of the sucker. Expose the roots of the rose bush to find where the sucker is growing from. Use a trowel or your hands to remove the dirt that covers the sucker. Pull off the sucker. Place thick gloves on your hands to protect them from any thorns. Take the sucker in your hand firmly. Twist the sucker and pull it off. Do this for any buds or sprouts that you see. Only remove the sucker, not the stems of the healthy rose bush. Identifying a Sucker Recognize a sucker. Suckers are offshoots of your rose bush that grow from underground. They will appear as a separate stem or shoot of the bush, generally with leaves that are lighter in color. They also may have a different number of leaves. Suckers appear when the rose bush is damaged, like from a hoe or shovel. Remove the sucker as soon as you detect it. Though suckers produce rose blooms, they are harmful to your main roses. They suck all the nutrients away from your main rose bush. Suckers are also not the same variety of rose as your main rose bush, but the one used for the root stock. Avoid letting the suckers grow and deal with them as soon as possible. As soon as you detect a sucker, get rid of it. Cut suckers away when they are newly formed. Suckers are more easily eliminated if you remove them as soon as they form. New suckers are easy to get rid of, while established suckers that have been growing for a few years may never be removed. Preventing Suckers Use caution when digging around your rose bush. One of the most common reasons rose bushes produce suckers is because the roots have been damaged. This usually occurs when someone digs around the rose bush, like when you are weeding. When you are digging around your rose bush for any reason, you should take special care not to injure the roots at all. Avoid mowing around your rose bush. Mowing can cause damage the the roots of the rose bush, which may lead to suckers. Instead of mowing right next to a rose bush, use clippers to trim the grass near it. If you are worried about damaging the roots with clippers, pull the grass and weeds away with your hands. Avoid damaging the roots when pruning. Pruning your rose bushes helps keep your roses looking healthy. However, damaging the roots during pruning can cause suckers to form. You should also be careful when cutting away suckers. If you prune the suckers but damage the roots, more suckers can grow.",
  "tyn_model":[
    "sucker",
    "roses",
    "suckers",
    "clippers",
    "rose",
    "water",
    "garden hose",
    "soil",
    "trowel",
    "gloves",
    "shovel",
    "grass",
    "weeds"
  ],
  "tyn_section":[

  ]
}