{
  "title":"How to Juice a Potato",
  "url":"https://www.wikihow.com/Juice-a-Potato",
  "category_hierarchy":[
    "Food and Entertaining",
    "Drinks",
    "Juice"
  ],
  "methods":[
    {
      "name":"Using a Juicer",
      "steps":[
        {
          "headline":"Cube your potato.",
          "description":"Cut your potato in half. Then, cut each half into two to three small cubes. There are no precise measurements in terms of the size of cubes, but breaking the potato into smaller pieces can help it juice faster."
        },
        {
          "headline":"Place a glass below your juicer.",
          "description":"Juice will squirt out of a faucet on the bottom of your juicer. Place the glass under the faucet near the bottom of the juicer to collect your potato juice once you turn the juicer on."
        },
        {
          "headline":"Remove the top of the juicer.",
          "description":"Most juicers have a small cylinder compartment covering the opening where you place your fruits and veggies. This can be pulled out easily by hand."
        },
        {
          "headline":"Turn the juicer on.",
          "description":"After removing the top, figure out how to turn the juicer on. Most juicers have an \"on\" button somewhere near the side. Switch it to the high setting, as this will juice your potato the fastest. If you're unsure how your juicer works, consult your Instruction Manual. Each juicer is different."
        },
        {
          "headline":"Add your potato.",
          "description":"Place your potato into the top compartment of the juicer. If you're adding any additional fruits and veggies to your potato juice, add them now as well."
        },
        {
          "headline":"Use the lid to push the potato into the juicer.",
          "description":"Take the cylinder top piece you removed earlier. Use it to gently pushed down on the potato, squeezing it through the juicer."
        }
      ]
    },
    {
      "name":"Blending Your Potato",
      "steps":[
        {
          "headline":"Cut your potato into cubes.",
          "description":"Cut your potato in half. Then, cut each half into tiny cubes. The smaller the cubes, the better, as this will make the potato blend quicker."
        },
        {
          "headline":"Add your potato to the blender with water.",
          "description":"Place your potato in a blender and add a small amount of water. Amounts will vary depending on the size of the potato, but add just enough that the potato cubes are saturated in water."
        },
        {
          "headline":"Blend your potato.",
          "description":"Turn the blender on the highest setting possible. Blend the potato and water until you have a liquid-like, pulpy mixture. Times will vary depending on the strength of your blender."
        },
        {
          "headline":"Pour the mixture into a strainer.",
          "description":"Take a mesh strainer and position it over a bowl or glass. This will strain out any excess pulp."
        },
        {
          "headline":"Use a fork or spoon to get the juice out.",
          "description":"Take a fork or spoon and stir it on the top of the strainer. Press the back of the fork of spoon against the potato pulp to squeeze out as much juice was you can into your glass."
        }
      ]
    },
    {
      "name":"Using Potato Juice",
      "steps":[
        {
          "headline":"Drink the juice on its own.",
          "description":"Potatoes are full of nutrients like potassium. Potato juice is a healthy choice to drink on its own. You can have a glass of potato juice with a meal instead of water."
        },
        {
          "headline":"Add the juice to smoothies or other juices.",
          "description":"Potato juice doesn't have the strongest flavor. It can be added to other types of juices or smoothies to add some extra nutrients. For example, use potato juice as your liquid in a smoothie."
        },
        {
          "headline":"Use the juice for skin care.",
          "description":"Potato juice can be used to treat blemishes or acne. You can spread potato juice on your skin, let it sit for about 20 minutes, and wash it off. This can give your skin a healthy glow and may reduce things like wrinkles, blemishes, and discoloration."
        },
        {
          "headline":"Store your potato juice properly.",
          "description":"Store your juice in a air tight jar or bottle. Screw on the cap completely and don't leave a lot of headspace near the top of the jar. Keep the juice in the refrigerator at all times. Potato juice keeps for a few months when stored properly."
        }
      ]
    }
  ],
  "text":" Using a Juicer Cube your potato. Cut your potato in half. Then, cut each half into two to three small cubes. There are no precise measurements in terms of the size of cubes, but breaking the potato into smaller pieces can help it juice faster. Place a glass below your juicer. Juice will squirt out of a faucet on the bottom of your juicer. Place the glass under the faucet near the bottom of the juicer to collect your potato juice once you turn the juicer on. Remove the top of the juicer. Most juicers have a small cylinder compartment covering the opening where you place your fruits and veggies. This can be pulled out easily by hand. Turn the juicer on. After removing the top, figure out how to turn the juicer on. Most juicers have an \"on\" button somewhere near the side. Switch it to the high setting, as this will juice your potato the fastest. If you're unsure how your juicer works, consult your Instruction Manual. Each juicer is different. Add your potato. Place your potato into the top compartment of the juicer. If you're adding any additional fruits and veggies to your potato juice, add them now as well. Use the lid to push the potato into the juicer. Take the cylinder top piece you removed earlier. Use it to gently pushed down on the potato, squeezing it through the juicer. Blending Your Potato Cut your potato into cubes. Cut your potato in half. Then, cut each half into tiny cubes. The smaller the cubes, the better, as this will make the potato blend quicker. Add your potato to the blender with water. Place your potato in a blender and add a small amount of water. Amounts will vary depending on the size of the potato, but add just enough that the potato cubes are saturated in water. Blend your potato. Turn the blender on the highest setting possible. Blend the potato and water until you have a liquid-like, pulpy mixture. Times will vary depending on the strength of your blender. Pour the mixture into a strainer. Take a mesh strainer and position it over a bowl or glass. This will strain out any excess pulp. Use a fork or spoon to get the juice out. Take a fork or spoon and stir it on the top of the strainer. Press the back of the fork of spoon against the potato pulp to squeeze out as much juice was you can into your glass. Using Potato Juice Drink the juice on its own. Potatoes are full of nutrients like potassium. Potato juice is a healthy choice to drink on its own. You can have a glass of potato juice with a meal instead of water. Add the juice to smoothies or other juices. Potato juice doesn't have the strongest flavor. It can be added to other types of juices or smoothies to add some extra nutrients. For example, use potato juice as your liquid in a smoothie. Use the juice for skin care. Potato juice can be used to treat blemishes or acne. You can spread potato juice on your skin, let it sit for about 20 minutes, and wash it off. This can give your skin a healthy glow and may reduce things like wrinkles, blemishes, and discoloration. Store your potato juice properly. Store your juice in a air tight jar or bottle. Screw on the cap completely and don't leave a lot of headspace near the top of the jar. Keep the juice in the refrigerator at all times. Potato juice keeps for a few months when stored properly.",
  "tyn_model":[
    "juicer",
    "potato juice",
    "potato",
    "water",
    "blender",
    "fork",
    "glass",
    "juicers",
    "strainer",
    "spoon",
    "mesh strainer",
    "bowl",
    "potatoes",
    "bottle",
    "refrigerator"
  ],
  "tyn_section":[

  ]
}