{
  "title":"How to Know if Salmon Is Bad",
  "url":"https://www.wikihow.com/Know-if-Salmon-Is-Bad",
  "category_hierarchy":[
    "Food and Entertaining",
    "Recipes",
    "Fish and Seafood",
    "Salmon"
  ],
  "methods":[
    {
      "name":"Checking Raw Salmon",
      "steps":[
        {
          "headline":"Make sure the fish doesn't have a strong, ammonia-like smell.",
          "description":"Smell the raw salmon to see if it has a bad odor. If the fish smells pungent, fishy, or ammonia-like, it is probably bad. Fresh salmon should have a very mild scent."
        },
        {
          "headline":"Look for a milky coating to indicate the fish has gone bad.",
          "description":"A sign that raw fish has gone bad is the presence of a white, translucent skin on top of it. Before cooking, inspect your salmon to make sure it doesn't have a milky film on its surface. If you see any kind of opaque film developing on the fish, throw it away."
        },
        {
          "headline":"See if the salmon has a weak consistency.",
          "description":"Before cooking it, check the consistency of your raw salmon. If the fish feels like it is breaking up while you handle it, throw it away. Fresh salmon should always be firm and hold together."
        },
        {
          "headline":"Inspect the eyes for discoloration.",
          "description":"If you purchase salmon with the head still on, check the appearance of its eyes. Fresh salmon should have bright, clear eyes with a dark pupil in the middle. When the fish has gone bad, the eyes will appear discolored. The salmon's eyes should also appear slightly bulging. If the eyes appear sunken in, the fish has likely gone bad."
        },
        {
          "headline":"Check if the salmon has a dull, pale color.",
          "description":"Check the coloring of your salmon to see if it is still good or not. Fresh salmon should have a bright pink or orange color to it. If your salmon has a pale, dull color, it is likely spoiled. Your salmon should also have fine white lines running though it, which indicate freshness."
        },
        {
          "headline":"Check the \"best before\" and \"sell by\" dates.",
          "description":"If you are in doubt about the quality of your salmon, check the \"best before\" date indicated on the packaging. This date is not a definite prediction of when your fish will go bad, but it will give you a good idea of when it might spoil. You should also check the \"sell by\" date, which should also be indicated on the packaging. As a general rule, refrigerated fresh salmon will keep for one or two days after its \"sell by\" date."
        }
      ]
    },
    {
      "name":"Seeing If Leftover Salmon is Still Good",
      "steps":[
        {
          "headline":"Check for a foul, sour odor.",
          "description":"If your cooked salmon has a foul odor, throw it away immediately. A strong, sour smell is a clear indication that your leftover meal has gone bad. If the salmon does not have a mild, appetizing smell, do not eat it."
        },
        {
          "headline":"Check for a slimy texture.",
          "description":"A clear sign that leftover cooked salmon has gone bad is a slimy consistency. If your salmon has lost its thick, flaky texture, it is not worth eating. Throw it away if it has any sliminess to it."
        },
        {
          "headline":"Avoid leaving cooked salmon at room temperature for more than two hours.",
          "description":"Cooked salmon should be thrown away if it sits out at room temperature for longer than two hours after cooking. Bacteria will begin to grow if the fish is not refrigerated before that point. Always take note of the time you cook salmon, or the time that you order it at a restaurant, and the time you are able to put it into the fridge."
        },
        {
          "headline":"Throw away leftovers that are more than two or three days old.",
          "description":"Three days after it is cooked, throw out leftover salmon regardless of whether it appears to be spoiled. If you are unsure about the condition of your salmon after two days, dispose of it. The chance of bacterial growth and illness is not worth the risk."
        }
      ]
    },
    {
      "name":"Making Sure Salmon is Cooked Properly",
      "steps":[
        {
          "headline":"Use your fork to see if the fish flakes.",
          "description":"Use a fork to gently scrape through your salmon steak or fillet. When fish is cooked properly, it should break into flakes when nudged. If your fish feels dense or rubbery, it isn't cooked properly."
        },
        {
          "headline":"Check to see if your salmon is opaque.",
          "description":"To make sure your salmon is fully cooked, cut into it at its thickest point and inspect its color. Fully cooked fish should be opaque. If the salmon appears translucent, it needs to be cooked for longer."
        },
        {
          "headline":"Check the temperature of the fish.",
          "description":"If you have access to a meat thermometer, use it to test the temperature of your salmon. Place the thermometer in the thickest part of your salmon and let it sit for a minute to get an accurate reading. A well-cooked piece of salmon should reach 145 degrees Fahrenheit, or approximately 63 degrees Celsius. Use a digital meat thermometer for the clearest possible reading."
        }
      ]
    }
  ],
  "text":" Checking Raw Salmon Make sure the fish doesn't have a strong, ammonia-like smell. Smell the raw salmon to see if it has a bad odor. If the fish smells pungent, fishy, or ammonia-like, it is probably bad. Fresh salmon should have a very mild scent. Look for a milky coating to indicate the fish has gone bad. A sign that raw fish has gone bad is the presence of a white, translucent skin on top of it. Before cooking, inspect your salmon to make sure it doesn't have a milky film on its surface. If you see any kind of opaque film developing on the fish, throw it away. See if the salmon has a weak consistency. Before cooking it, check the consistency of your raw salmon. If the fish feels like it is breaking up while you handle it, throw it away. Fresh salmon should always be firm and hold together. Inspect the eyes for discoloration. If you purchase salmon with the head still on, check the appearance of its eyes. Fresh salmon should have bright, clear eyes with a dark pupil in the middle. When the fish has gone bad, the eyes will appear discolored. The salmon's eyes should also appear slightly bulging. If the eyes appear sunken in, the fish has likely gone bad. Check if the salmon has a dull, pale color. Check the coloring of your salmon to see if it is still good or not. Fresh salmon should have a bright pink or orange color to it. If your salmon has a pale, dull color, it is likely spoiled. Your salmon should also have fine white lines running though it, which indicate freshness. Check the \"best before\" and \"sell by\" dates. If you are in doubt about the quality of your salmon, check the \"best before\" date indicated on the packaging. This date is not a definite prediction of when your fish will go bad, but it will give you a good idea of when it might spoil. You should also check the \"sell by\" date, which should also be indicated on the packaging. As a general rule, refrigerated fresh salmon will keep for one or two days after its \"sell by\" date. Seeing If Leftover Salmon is Still Good Check for a foul, sour odor. If your cooked salmon has a foul odor, throw it away immediately. A strong, sour smell is a clear indication that your leftover meal has gone bad. If the salmon does not have a mild, appetizing smell, do not eat it. Check for a slimy texture. A clear sign that leftover cooked salmon has gone bad is a slimy consistency. If your salmon has lost its thick, flaky texture, it is not worth eating. Throw it away if it has any sliminess to it. Avoid leaving cooked salmon at room temperature for more than two hours. Cooked salmon should be thrown away if it sits out at room temperature for longer than two hours after cooking. Bacteria will begin to grow if the fish is not refrigerated before that point. Always take note of the time you cook salmon, or the time that you order it at a restaurant, and the time you are able to put it into the fridge. Throw away leftovers that are more than two or three days old. Three days after it is cooked, throw out leftover salmon regardless of whether it appears to be spoiled. If you are unsure about the condition of your salmon after two days, dispose of it. The chance of bacterial growth and illness is not worth the risk. Making Sure Salmon is Cooked Properly Use your fork to see if the fish flakes. Use a fork to gently scrape through your salmon steak or fillet. When fish is cooked properly, it should break into flakes when nudged. If your fish feels dense or rubbery, it isn't cooked properly. Check to see if your salmon is opaque. To make sure your salmon is fully cooked, cut into it at its thickest point and inspect its color. Fully cooked fish should be opaque. If the salmon appears translucent, it needs to be cooked for longer. Check the temperature of the fish. If you have access to a meat thermometer, use it to test the temperature of your salmon. Place the thermometer in the thickest part of your salmon and let it sit for a minute to get an accurate reading. A well-cooked piece of salmon should reach 145 degrees Fahrenheit, or approximately 63 degrees Celsius. Use a digital meat thermometer for the clearest possible reading.",
  "tyn_model":[
    "salmon",
    "fish",
    "fork",
    "meat thermometer",
    "thermometer"
  ],
  "tyn_section":[

  ]
}