{
  "title":"How to Make Cake Pops Without Sticks",
  "url":"https://www.wikihow.com/Make-Cake-Pops-Without-Sticks",
  "category_hierarchy":[
    "Food and Entertaining",
    "Recipes",
    "Baking",
    "Cakes"
  ],
  "parts":[
    {
      "name":"Making Your Cake",
      "steps":[
        {
          "headline":"Whisk the dry ingredients.",
          "description":"Measure out your flour, baking powder, baking soda, and salt. Place the ingredients in a mixing bowl and use a fork or wire whisk to whisk everything together into an even mixture. Set this aside for now."
        },
        {
          "headline":"Blend the butter and sugar.",
          "description":"Measure the butter and sugar into a separate mixing bowl. Using an electronic mixer, mix the butter and sugar together until you have an even mixture. If you don't have an electronic mixer, you can also mash the butter and sugar together using a wooden spoon."
        },
        {
          "headline":"Beat in the egg.",
          "description":"Add your egg to the butter and sugar mixture. Use an electronic mixer to beat the egg in until you have an even mixture. If you don't have an electronic mixer, you can stir the egg into the batter using a spoon."
        },
        {
          "headline":"Alternate adding the dry ingredients and milk.",
          "description":"Pour in a small amount of the dry ingredients and beat them in using an electronic mixer. Then, add in a splash of the milk and beat it in as well. Continue this pattern until you've added all the dry ingredients and milk. When you're done, your mixture is smooth and even throughout. Continue using a spoon if you don't have an electronic mixer."
        },
        {
          "headline":"Pour the batter into a pan.",
          "description":"Grease a 9 inch (23 centimeter) springform pan with a non-stick spray. Pour your mixture into the pan using a spatula."
        },
        {
          "headline":"Bake the cake for 30 to 36 minutes at 350 \u00b0F (177 \u00b0C).",
          "description":"Start by baking the cake for 30 minutes and add additional time one minute at a time if necessary. If you press down on the cake's top, it will spring back up when it's done. You can stick a toothpick or fork in the center of the cake. If it comes back out clean, the cake is done."
        },
        {
          "headline":"Remove the cake from the oven and cool.",
          "description":"Remove the cake from the oven and set it on a cooling rack. After a few minutes, unscrew the spring form pan and remove the cake from the baking tray. Transfer the cake to a plate and let it cool for a few hours or overnight."
        }
      ]
    },
    {
      "name":"Forming Your Cake Balls",
      "steps":[
        {
          "headline":"Mix your frosting.",
          "description":"Measure out all your frosting ingredients into a single mixing bowl. Use an electronic mixer to beat the ingredients together until you have a smooth, even frosting."
        },
        {
          "headline":"Slice off the edges of the cake.",
          "description":"Use a knife to cut along the outer edge of the cake. The outer edge is a little thicker, and difficult to roll into balls. It should be removed and discarded before you form your cake balls."
        },
        {
          "headline":"Cut the cake into four pieces.",
          "description":"Cut a criss-cross pattern running through the cake. This should break the cake into four roughly even pieces."
        },
        {
          "headline":"Crumble the cake into fine crumbs.",
          "description":"Wash your hands first. Then, use your hands to crumble all four pieces of cake into tiny crumbs over a mixing bowl. Keep crumbling until all four pieces of cake are broken into small crumbs."
        },
        {
          "headline":"Mix the frosting and cake crumbs.",
          "description":"Pour all your frosting into your crumbled pieces of cake. Use a mixing spoon to mix the ingredients together until you have an even mixture."
        },
        {
          "headline":"Form cake balls with your hands.",
          "description":"You can use a small ice cream scoop or just your hands to remove small amounts of the cake and frosting mixture. Use your hands to roll the cake mixture into firm, smooth balls. The size of your cake balls is up to you. There are no strict rules to follow regarding size."
        },
        {
          "headline":"Refrigerate your cake balls for two hours.",
          "description":"Place your cake balls on a baking tray lined with parchment paper. Place the tray in the refrigerator for two hours."
        }
      ]
    },
    {
      "name":"Coating Your Cake Balls",
      "steps":[
        {
          "headline":"Melt your coating.",
          "description":"Place your white chocolate candy melts in a microwave safe bowl. Microwave the melts for one minute. Then, remove them from the microwave and stir. Microwave the melts for an additional 15 to 20 seconds before removing and stirring again. Keep microwaving the melts in 15 to 20 second intervals until they're fully melted. If you prefer a chocolate flavor, you can use chocolate candy melts instead."
        },
        {
          "headline":"Dip your cake pops in the coating.",
          "description":"Even if you don't intend to use sticks, it can help to at least use a toothpick to avoid getting the white chocolate on your fingers. Dip each cake pop into the white chocolate until it's completely coated. Hold it over the bowl for a few seconds after dipping so excess chocolate can drip off."
        },
        {
          "headline":"Set your cake pops aside to dry.",
          "description":"Set your cake pops on a baking tray with parchment paper. Place them in a cool spot in your kitchen for a few hours until the coating dries."
        }
      ]
    },
    {
      "name":"Finding Alternatives to Sticks",
      "steps":[
        {
          "headline":"Serve the cake balls without any handles.",
          "description":"You can simply serve the cake pops without any handles. Cake pops without handles are known as cake balls and can be just as appealing at a party."
        },
        {
          "headline":"Replace lollipop sticks with stick-shaped candy.",
          "description":"If you would prefer an edible handle, use a stick-shaped candy. You can use cinnamon sticks or peppermint sticks for your cake pops."
        },
        {
          "headline":"Insert a spoon into the cake pops.",
          "description":"Take a small plastic spoon. Insert the tip into the cake pop. This can be a great alternative to a traditional lollypop stick."
        },
        {
          "headline":"Use toothpicks.",
          "description":"If you need an alternative to lollipop sticks because you can't find them, try using toothpicks. These are an easy substitute that you can buy at most grocery stores."
        }
      ]
    }
  ],
  "text":" Making Your Cake Whisk the dry ingredients. Measure out your flour, baking powder, baking soda, and salt. Place the ingredients in a mixing bowl and use a fork or wire whisk to whisk everything together into an even mixture. Set this aside for now. Blend the butter and sugar. Measure the butter and sugar into a separate mixing bowl. Using an electronic mixer, mix the butter and sugar together until you have an even mixture. If you don't have an electronic mixer, you can also mash the butter and sugar together using a wooden spoon. Beat in the egg. Add your egg to the butter and sugar mixture. Use an electronic mixer to beat the egg in until you have an even mixture. If you don't have an electronic mixer, you can stir the egg into the batter using a spoon. Alternate adding the dry ingredients and milk. Pour in a small amount of the dry ingredients and beat them in using an electronic mixer. Then, add in a splash of the milk and beat it in as well. Continue this pattern until you've added all the dry ingredients and milk. When you're done, your mixture is smooth and even throughout. Continue using a spoon if you don't have an electronic mixer. Pour the batter into a pan. Grease a 9 inch (23 centimeter) springform pan with a non-stick spray. Pour your mixture into the pan using a spatula. Bake the cake for 30 to 36 minutes at 350 \u00b0F (177 \u00b0C). Start by baking the cake for 30 minutes and add additional time one minute at a time if necessary. If you press down on the cake's top, it will spring back up when it's done. You can stick a toothpick or fork in the center of the cake. If it comes back out clean, the cake is done. Remove the cake from the oven and cool. Remove the cake from the oven and set it on a cooling rack. After a few minutes, unscrew the spring form pan and remove the cake from the baking tray. Transfer the cake to a plate and let it cool for a few hours or overnight. Forming Your Cake Balls Mix your frosting. Measure out all your frosting ingredients into a single mixing bowl. Use an electronic mixer to beat the ingredients together until you have a smooth, even frosting. Slice off the edges of the cake. Use a knife to cut along the outer edge of the cake. The outer edge is a little thicker, and difficult to roll into balls. It should be removed and discarded before you form your cake balls. Cut the cake into four pieces. Cut a criss-cross pattern running through the cake. This should break the cake into four roughly even pieces. Crumble the cake into fine crumbs. Wash your hands first. Then, use your hands to crumble all four pieces of cake into tiny crumbs over a mixing bowl. Keep crumbling until all four pieces of cake are broken into small crumbs. Mix the frosting and cake crumbs. Pour all your frosting into your crumbled pieces of cake. Use a mixing spoon to mix the ingredients together until you have an even mixture. Form cake balls with your hands. You can use a small ice cream scoop or just your hands to remove small amounts of the cake and frosting mixture. Use your hands to roll the cake mixture into firm, smooth balls. The size of your cake balls is up to you. There are no strict rules to follow regarding size. Refrigerate your cake balls for two hours. Place your cake balls on a baking tray lined with parchment paper. Place the tray in the refrigerator for two hours. Coating Your Cake Balls Melt your coating. Place your white chocolate candy melts in a microwave safe bowl. Microwave the melts for one minute. Then, remove them from the microwave and stir. Microwave the melts for an additional 15 to 20 seconds before removing and stirring again. Keep microwaving the melts in 15 to 20 second intervals until they're fully melted. If you prefer a chocolate flavor, you can use chocolate candy melts instead. Dip your cake pops in the coating. Even if you don't intend to use sticks, it can help to at least use a toothpick to avoid getting the white chocolate on your fingers. Dip each cake pop into the white chocolate until it's completely coated. Hold it over the bowl for a few seconds after dipping so excess chocolate can drip off. Set your cake pops aside to dry. Set your cake pops on a baking tray with parchment paper. Place them in a cool spot in your kitchen for a few hours until the coating dries. Finding Alternatives to Sticks Serve the cake balls without any handles. You can simply serve the cake pops without any handles. Cake pops without handles are known as cake balls and can be just as appealing at a party. Replace lollipop sticks with stick-shaped candy. If you would prefer an edible handle, use a stick-shaped candy. You can use cinnamon sticks or peppermint sticks for your cake pops. Insert a spoon into the cake pops. Take a small plastic spoon. Insert the tip into the cake pop. This can be a great alternative to a traditional lollypop stick. Use toothpicks. If you need an alternative to lollipop sticks because you can't find them, try using toothpicks. These are an easy substitute that you can buy at most grocery stores.",
  "tyn_model":[
    "electronic mixer",
    "butter",
    "sugar",
    "mixing bowl",
    "spoon",
    "milk",
    "baking tray",
    "frosting",
    "cake",
    "cake balls",
    "oven",
    "parchment paper",
    "lollipop sticks",
    "toothpicks",
    "flour",
    "baking powder",
    "baking soda",
    "salt",
    "fork or wire whisk",
    "wooden spoon",
    "egg",
    "pan",
    "springform pan",
    "non-stick spray",
    "spatula",
    "fork",
    "plate",
    "knife",
    "cake crumbs",
    "mixing spoon",
    "ice cream scoop",
    "refrigerator",
    "white chocolate candy melts",
    "microwave safe bowl",
    "microwave",
    "chocolate candy melts",
    "toothpick",
    "chocolate",
    "bowl",
    "cake pops",
    "plastic spoon",
    "lollypop stick"
  ],
  "tyn_section":[

  ]
}