{
  "title":"How to Make Coconut Liqueur",
  "url":"https://www.wikihow.com/Make-Coconut-Liqueur",
  "category_hierarchy":[
    "Food and Entertaining",
    "Drinks",
    "Alcoholic Drinks"
  ],
  "parts":[
    {
      "name":"Mixing Your Ingredients",
      "steps":[
        {
          "headline":"Heat the coconut milk, cream, desiccated coconut, sugar, and milk.",
          "description":"Place the ingredients in a saucepan over medium heat. Heat the mixture until the sugar melts, stirring on occasion."
        },
        {
          "headline":"Place the mixture in a separate container (optional).",
          "description":"You can place your mixture into an airtight container after heating it. However, you can also place your saucepan directly in the fridge if you have room."
        },
        {
          "headline":"Chill the mixture.",
          "description":"As soon as the sugar melts, remove the coconut milk mixture from the stove. Place it in the fridge and leave it there for a few hours. The mixture should be very chilled, similar to the temperature of water stored in the fridge, before you continue with the recipe."
        },
        {
          "headline":"Mix in the alcohol and coconut essence.",
          "description":"Once the mixture is cold, add your alcohol and coconut essence. Mix everything together using a spoon until you have a uniform mixture."
        }
      ]
    },
    {
      "name":"Making Your Liqueur",
      "steps":[
        {
          "headline":"Strain the mixture.",
          "description":"Pour the coconut mixture through a sieve. This will strain out any big chunks of coconut, which can be discarded after straining."
        },
        {
          "headline":"Refrigerate the mixture for a few days.",
          "description":"Place your mixture in an airtight bottle or a container like a mason jar. Leave it in the fridge for a few days to let all the ingredients mix together."
        },
        {
          "headline":"Shake the mixture.",
          "description":"After a few days have passed, give the mixture a few good shakes. This will help even out any ingredients that have separated while it was chilling in the fridge. Always shake the mixture just before serving."
        }
      ]
    },
    {
      "name":"Storing and Serving Your Liqueur",
      "steps":[
        {
          "headline":"Refrigerate before serving.",
          "description":"Coconut liqueur is best served chilled. Keep it in the refrigerator before serving it and keep it in the refrigerator in between pouring drinks."
        },
        {
          "headline":"Add a splash to any cocktail for a mild coconut flavor.",
          "description":"You can add your coconut liqueur to any cocktail you're making. It can add a slightly sweet taste to classic mixed drinks like rum and coke or gin and tonic. However, make sure to only add a shot or less to make sure the drink isn't too strong."
        },
        {
          "headline":"Use your liqueur in a pi\u00f1a colada.",
          "description":"A pi\u00f1a colada is usually made with white rum, pineapple juice, coconut milk, fresh lime juice, and demerara syrup. Swap out the coconut milk for your coconut liqueur for an extra strong twist on the classic cocktail. Simply add all the ingredients to a cocktail strainer, shake, and then pour your drink into a glass."
        },
        {
          "headline":"Discard the liqueur after a few months.",
          "description":"Coconut liqueur will not keep for more than two to three months. Write a date on the bottle you keep your liqueur in and discard it after a few months."
        }
      ]
    }
  ],
  "text":" Mixing Your Ingredients Heat the coconut milk, cream, desiccated coconut, sugar, and milk. Place the ingredients in a saucepan over medium heat. Heat the mixture until the sugar melts, stirring on occasion. Place the mixture in a separate container (optional). You can place your mixture into an airtight container after heating it. However, you can also place your saucepan directly in the fridge if you have room. Chill the mixture. As soon as the sugar melts, remove the coconut milk mixture from the stove. Place it in the fridge and leave it there for a few hours. The mixture should be very chilled, similar to the temperature of water stored in the fridge, before you continue with the recipe. Mix in the alcohol and coconut essence. Once the mixture is cold, add your alcohol and coconut essence. Mix everything together using a spoon until you have a uniform mixture. Making Your Liqueur Strain the mixture. Pour the coconut mixture through a sieve. This will strain out any big chunks of coconut, which can be discarded after straining. Refrigerate the mixture for a few days. Place your mixture in an airtight bottle or a container like a mason jar. Leave it in the fridge for a few days to let all the ingredients mix together. Shake the mixture. After a few days have passed, give the mixture a few good shakes. This will help even out any ingredients that have separated while it was chilling in the fridge. Always shake the mixture just before serving. Storing and Serving Your Liqueur Refrigerate before serving. Coconut liqueur is best served chilled. Keep it in the refrigerator before serving it and keep it in the refrigerator in between pouring drinks. Add a splash to any cocktail for a mild coconut flavor. You can add your coconut liqueur to any cocktail you're making. It can add a slightly sweet taste to classic mixed drinks like rum and coke or gin and tonic. However, make sure to only add a shot or less to make sure the drink isn't too strong. Use your liqueur in a pi\u00f1a colada. A pi\u00f1a colada is usually made with white rum, pineapple juice, coconut milk, fresh lime juice, and demerara syrup. Swap out the coconut milk for your coconut liqueur for an extra strong twist on the classic cocktail. Simply add all the ingredients to a cocktail strainer, shake, and then pour your drink into a glass. Discard the liqueur after a few months. Coconut liqueur will not keep for more than two to three months. Write a date on the bottle you keep your liqueur in and discard it after a few months.",
  "tyn_model":[
    "coconut milk",
    "liqueur",
    "coconut liqueur",
    "coconut",
    "sugar",
    "saucepan",
    "fridge",
    "alcohol",
    "coconut essence",
    "pi\u00f1a colada",
    "cream",
    "milk",
    "airtight container",
    "stove",
    "water",
    "spoon",
    "sieve",
    "airtight bottle",
    "mason jar",
    "rum",
    "white rum",
    "pineapple juice",
    "fresh lime juice",
    "demerara syrup",
    "cocktail strainer",
    "glass"
  ],
  "tyn_section":[

  ]
}