{
  "title":"How to Make a Lemon Blueberry Bundt Cake",
  "url":"https://www.wikihow.com/Make-a-Lemon-Blueberry-Bundt-Cake",
  "category_hierarchy":[
    "Food and Entertaining",
    "Recipes",
    "Baking",
    "Cakes",
    "Fruit Cakes"
  ],
  "parts":[
    {
      "name":"Making the Cake",
      "steps":[
        {
          "headline":"Preheat oven to 350\u00ba F (175\u00ba C).",
          "description":""
        },
        {
          "headline":"Prepare the pan.",
          "description":"Thoroughly and generously grease or butter a 10-inch bundt pan. Spray pan with non-stick cooking spray or grease pan with butter and flour. Learn how to Grease and Flour a Pan."
        },
        {
          "headline":"Prepare the blueberries.",
          "description":"Add the blueberries and 1 tablespoon (14.8 ml) of flour to a mixing bowl. Toss together until all of the blueberries are coated with the flour. Set it aside for now."
        },
        {
          "headline":"Mix the dry ingredients.",
          "description":"In a large bowl, mix together flour, baking powder, baking soda, and salt. Whisk until the dry ingredients are properly folded in. Set it aside for now."
        },
        {
          "headline":"Mix the butter and sugar.",
          "description":"In a separate large bowl, add butter (or margarine), and using an electric mixer beat until smooth (about 2 minutes). Add sugar and beat for 2 to 3 minutes, until light and fluffy."
        },
        {
          "headline":"Stir in the remaining wet ingredients.",
          "description":"Mix in the eggs one at a time, and beat well after each addition until they are well combined. Add the vanilla, and mix again. Slowly mix in the lemon juice, lemon zest, and oil, and beat until they are well combined."
        },
        {
          "headline":"Add the dry ingredients.",
          "description":"Add all of the dry ingredients that were set-aside in three additions, alternating with the sour cream. Begin by adding 1/3 of the dry ingredients, then add 1/2 of the sour cream. Repeat in that order until all of the ingredients have been added (you will begin and end with the dry ingredients). Learn more about alternating between dry and wet ingredients here. Mix in each addition on low speed, until well combined. Make sure not to over mix the batter. The batter will be quite thick, so it would be helpful to use a rubber spatula to turn the batter a few times, making sure that everything is combined."
        },
        {
          "headline":"Add the blueberries.",
          "description":"Grab the blueberry-flour combination that was set-aside. Gently fold the blueberries into the batter until they are well combined. Make sure not to go over the top when combining the blueberries, as you do not want to mash them."
        },
        {
          "headline":"Pour the batter.",
          "description":"Using a rubber spatula, scrape the batter into the prepared bundt pan. Spread around the batter evenly, and smooth the top."
        },
        {
          "headline":"Bake the cake.",
          "description":"Place the bundt pan in the oven to bake. Have the cake bake for 50-60 minutes, or until a toothpick inserted into the cake comes out clean. To prevent excess browning, cover the cake loosely with foil for the last 5-10 minutes of baking."
        },
        {
          "headline":"Let the cake cool.",
          "description":"After removing the pan from the oven, place it on a wire rack and allow it to cool for 20-30 minutes. Then use a sharp knife to scrape around the edges of the pan. Invert (turn out) the cake onto the wire rack. Let the cake cool completely."
        }
      ]
    },
    {
      "name":"Glazing the Cake",
      "steps":[
        {
          "headline":"Make the lemon glaze.",
          "description":"In a medium-sized bowl, mix together the lemon juice and powdered sugar. Whisk until no lumps remain, and it is well combined. Add more lemon juice if the glaze is too thick. If the glaze is too thin, add more powdered sugar to thicken it up."
        },
        {
          "headline":"Pour the glaze.",
          "description":"Using a spoon, scrape the glaze onto the bundt cake and spread it around evenly. Allow the cake to sit for 10-15 minutes so the glaze can harden. Refrigerate the cake for 10-20 minutes if you'd like to serve it cold."
        }
      ]
    }
  ],
  "text":" Making the Cake Preheat oven to 350\u00ba F (175\u00ba C).  Prepare the pan. Thoroughly and generously grease or butter a 10-inch bundt pan. Spray pan with non-stick cooking spray or grease pan with butter and flour. Learn how to Grease and Flour a Pan. Prepare the blueberries. Add the blueberries and 1 tablespoon (14.8 ml) of flour to a mixing bowl. Toss together until all of the blueberries are coated with the flour. Set it aside for now. Mix the dry ingredients. In a large bowl, mix together flour, baking powder, baking soda, and salt. Whisk until the dry ingredients are properly folded in. Set it aside for now. Mix the butter and sugar. In a separate large bowl, add butter (or margarine), and using an electric mixer beat until smooth (about 2 minutes). Add sugar and beat for 2 to 3 minutes, until light and fluffy. Stir in the remaining wet ingredients. Mix in the eggs one at a time, and beat well after each addition until they are well combined. Add the vanilla, and mix again. Slowly mix in the lemon juice, lemon zest, and oil, and beat until they are well combined. Add the dry ingredients. Add all of the dry ingredients that were set-aside in three additions, alternating with the sour cream. Begin by adding 1/3 of the dry ingredients, then add 1/2 of the sour cream. Repeat in that order until all of the ingredients have been added (you will begin and end with the dry ingredients). Learn more about alternating between dry and wet ingredients here. Mix in each addition on low speed, until well combined. Make sure not to over mix the batter. The batter will be quite thick, so it would be helpful to use a rubber spatula to turn the batter a few times, making sure that everything is combined. Add the blueberries. Grab the blueberry-flour combination that was set-aside. Gently fold the blueberries into the batter until they are well combined. Make sure not to go over the top when combining the blueberries, as you do not want to mash them. Pour the batter. Using a rubber spatula, scrape the batter into the prepared bundt pan. Spread around the batter evenly, and smooth the top. Bake the cake. Place the bundt pan in the oven to bake. Have the cake bake for 50-60 minutes, or until a toothpick inserted into the cake comes out clean. To prevent excess browning, cover the cake loosely with foil for the last 5-10 minutes of baking. Let the cake cool. After removing the pan from the oven, place it on a wire rack and allow it to cool for 20-30 minutes. Then use a sharp knife to scrape around the edges of the pan. Invert (turn out) the cake onto the wire rack. Let the cake cool completely. Glazing the Cake Make the lemon glaze. In a medium-sized bowl, mix together the lemon juice and powdered sugar. Whisk until no lumps remain, and it is well combined. Add more lemon juice if the glaze is too thick. If the glaze is too thin, add more powdered sugar to thicken it up. Pour the glaze. Using a spoon, scrape the glaze onto the bundt cake and spread it around evenly. Allow the cake to sit for 10-15 minutes so the glaze can harden. Refrigerate the cake for 10-20 minutes if you'd like to serve it cold.",
  "tyn_model":[
    "blueberries",
    "butter",
    "flour",
    "oven",
    "large bowl",
    "sugar",
    "lemon juice",
    "sour cream",
    "rubber spatula",
    "bundt pan",
    "wire rack",
    "powdered sugar",
    "10-inch bundt pan",
    "non-stick cooking spray",
    "grease pan",
    "mixing bowl",
    "baking powder",
    "baking soda",
    "salt",
    "margarine",
    "electric mixer",
    "eggs",
    "vanilla",
    "lemon zest",
    "oil",
    "blueberry",
    "cake",
    "foil",
    "sharp knife",
    "lemon",
    "spoon",
    "bundt cake"
  ],
  "tyn_section":[

  ]
}