{
  "title":"How to Fix Soggy Rice",
  "url":"https://www.wikihow.com/Fix-Soggy-Rice",
  "category_hierarchy":[
    "Food and Entertaining",
    "Recipes",
    "Rice and Beans"
  ],
  "methods":[
    {
      "name":"Saving the Rice",
      "steps":[
        {
          "headline":"Let the water evaporate if there is water sitting in the pan.",
          "description":"Take the cover off of the pan to let the steam escape. Set the heat to low and continue to cook the rice for about 5 minutes. The water should be cooked off by the end."
        },
        {
          "headline":"Drain the extra water with a fine mesh sieve or colander.",
          "description":"If there is still water in the pan, place a sieve or colander over the sink, and pour the rice into it. Let it drain for a minute. You may want to shift around the sieve or colander to help it drain. At this point, the rice may be saved. You do not have to do anything else if that is the case."
        },
        {
          "headline":"Rinse with cold water if the rice is sticking together.",
          "description":"If the rice is too sticky or gummy, it means that it is overcooked. After draining the rice, pour a light stream of cool water over the sieve or colander. Gently unstick the grains of rice with your fingers."
        },
        {
          "headline":"Bake the rice in the oven for 5 minutes to remove the excess water.",
          "description":"If the rice is still watery or soggy, you can cook off the extra water in the oven. Set the temperature to 350 \u00b0F (177 \u00b0C). Spread the rice out evenly onto a cookie sheet or baking pan. Let it cook in the oven for 5 minutes."
        },
        {
          "headline":"Make a new batch of rice.",
          "description":"In some cases, you may not be able to fix the rice. If you have time, make a fresh batch. Store the soggy rice in a plastic container. Place it in the fridge or freezer. You can use it later for some delicious recipes. Cooked rice will last for 4-6 days in the fridge and up to six months in the freezer."
        }
      ]
    },
    {
      "name":"Repurposing the Rice",
      "steps":[
        {
          "headline":"Turn the rice into fried rice.",
          "description":"Heat up a pan with oil. Cook garlic, onions, and ginger until they are translucent. Add vegetables, such as carrots or peas, as well as a tablespoon of soy sauce if desired. Add 1 spoonful of rice at a time. Stir the rice often. Once you have cooked all of the rice and the pot is steaming, it is done!"
        },
        {
          "headline":"Make rice pudding.",
          "description":"Heat the rice on the stove using low heat. Add 3 cups (735 grams) of whole milk, 1 cup (245 grams) of cream, and 1/2 cup (100 grams) of sugar. Add a whole vanilla bean. Raise the heat to a medium setting. Let the pudding cook for roughly 35 minutes, stirring often. Remove the vanilla bean and chill the pudding before serving. Before adding the vanilla bean, split open the bean and scrape out the seeds into the pudding. Then add the rest of the bean. This will help the flavor disperse through the pudding."
        },
        {
          "headline":"Transform the rice into crackers.",
          "description":"Flatten the rice onto a baking sheet as thin as possible. Bake the rice for 2 hours at 200 \u00b0F (93 \u00b0C). Once you take it out, break it up into small pieces. Fry the pieces in a pot of oil that is 400 \u00b0F (204 \u00b0C) hot. Once the crackers rise to the top, scoop them out with a slotted spoon. Drain them on a paper towel before enjoying."
        },
        {
          "headline":"Cook veggie burgers.",
          "description":"Puree 1 cup (175 grams) of rice with 2 cups (200 grams) of pinto beans, 1 cup (175 grams) of corn, 3 cloves of minced garlic, 1/3 cup (20 grams) of chopped sun-dried tomatoes, a handful of chopped basil, \u00bd teaspoon (3 grams) cumin, and 1 teaspoon (6 grams) salt. Form patties out of the puree. Fry the patties over medium-high heat for 6 minutes on each side."
        }
      ]
    },
    {
      "name":"Cooking Perfect Rice",
      "steps":[
        {
          "headline":"Rinse the rice with cool water before cooking.",
          "description":"Put the rice in a colander, fine mesh sieve, or pan. Run cool water over the rice to remove extra starch. This will prevent the rice from sticking together and becoming mushy. If you are using a pan, pour out the water and fill it up again. Rinse it out again once or twice before cooking. If you are using a colander or sieve, gently shake or stir the rice to help drain the water."
        },
        {
          "headline":"Add the right amount of water.",
          "description":"For every cup of rice, use about 1 \u00bd or 1 \u00be cups (350 or 400 ml) of water. Short grain rice needs slightly less while brown rice needs slightly more. Avoid adding too much water, however. Too much water may make the rice mushy."
        },
        {
          "headline":"Set the pan of rice over medium heat.",
          "description":"Do not turn the heat up. It will not make the rice cook faster. Instead, you might end up with unevenly cooked rice. You might even burn the rice. Just let the water slowly rise to a boil."
        },
        {
          "headline":"Place a kitchen towel between the pot and lid.",
          "description":"Once the rice begins to boil, the water should dip just below the rice. When that happens, lay a clean kitchen towel between the pot and the lid. This will prevent condensation from building up in the pot. Too much condensation can make the rice soggy. Do not let the towel hang over the side of the pan. This could start a fire. Instead, tuck the ends up under the lid."
        },
        {
          "headline":"Turn the heat off after 15 minutes of cooking.",
          "description":"Remove the rice from the heat but leave the lid on the pot. Let it sit for 5 minutes. When the time is up, remove the lid and fluff the rice with a fork. The rice is now ready to serve. Resting the rice prevents it from being too soggy on the bottom and too dry on the top."
        },
        {
          "headline":"Invest in a rice cooker.",
          "description":"A rice cooker will produce perfect rice every time as long as you use the right amount of water. Rice cookers can be found for fairly cheap at kitchen stores, home goods stores, and online."
        }
      ]
    }
  ],
  "text":" Saving the Rice Let the water evaporate if there is water sitting in the pan. Take the cover off of the pan to let the steam escape. Set the heat to low and continue to cook the rice for about 5 minutes. The water should be cooked off by the end. Drain the extra water with a fine mesh sieve or colander. If there is still water in the pan, place a sieve or colander over the sink, and pour the rice into it. Let it drain for a minute. You may want to shift around the sieve or colander to help it drain. At this point, the rice may be saved. You do not have to do anything else if that is the case. Rinse with cold water if the rice is sticking together. If the rice is too sticky or gummy, it means that it is overcooked. After draining the rice, pour a light stream of cool water over the sieve or colander. Gently unstick the grains of rice with your fingers. Bake the rice in the oven for 5 minutes to remove the excess water. If the rice is still watery or soggy, you can cook off the extra water in the oven. Set the temperature to 350 \u00b0F (177 \u00b0C). Spread the rice out evenly onto a cookie sheet or baking pan. Let it cook in the oven for 5 minutes. Make a new batch of rice. In some cases, you may not be able to fix the rice. If you have time, make a fresh batch. Store the soggy rice in a plastic container. Place it in the fridge or freezer. You can use it later for some delicious recipes. Cooked rice will last for 4-6 days in the fridge and up to six months in the freezer. Repurposing the Rice Turn the rice into fried rice. Heat up a pan with oil. Cook garlic, onions, and ginger until they are translucent. Add vegetables, such as carrots or peas, as well as a tablespoon of soy sauce if desired. Add 1 spoonful of rice at a time. Stir the rice often. Once you have cooked all of the rice and the pot is steaming, it is done! Make rice pudding. Heat the rice on the stove using low heat. Add 3 cups (735 grams) of whole milk, 1 cup (245 grams) of cream, and 1/2 cup (100 grams) of sugar. Add a whole vanilla bean. Raise the heat to a medium setting. Let the pudding cook for roughly 35 minutes, stirring often. Remove the vanilla bean and chill the pudding before serving. Before adding the vanilla bean, split open the bean and scrape out the seeds into the pudding. Then add the rest of the bean. This will help the flavor disperse through the pudding. Transform the rice into crackers. Flatten the rice onto a baking sheet as thin as possible. Bake the rice for 2 hours at 200 \u00b0F (93 \u00b0C). Once you take it out, break it up into small pieces. Fry the pieces in a pot of oil that is 400 \u00b0F (204 \u00b0C) hot. Once the crackers rise to the top, scoop them out with a slotted spoon. Drain them on a paper towel before enjoying. Cook veggie burgers. Puree 1 cup (175 grams) of rice with 2 cups (200 grams) of pinto beans, 1 cup (175 grams) of corn, 3 cloves of minced garlic, 1/3 cup (20 grams) of chopped sun-dried tomatoes, a handful of chopped basil, \u00bd teaspoon (3 grams) cumin, and 1 teaspoon (6 grams) salt. Form patties out of the puree. Fry the patties over medium-high heat for 6 minutes on each side. Cooking Perfect Rice Rinse the rice with cool water before cooking. Put the rice in a colander, fine mesh sieve, or pan. Run cool water over the rice to remove extra starch. This will prevent the rice from sticking together and becoming mushy. If you are using a pan, pour out the water and fill it up again. Rinse it out again once or twice before cooking. If you are using a colander or sieve, gently shake or stir the rice to help drain the water. Add the right amount of water. For every cup of rice, use about 1 \u00bd or 1 \u00be cups (350 or 400 ml) of water. Short grain rice needs slightly less while brown rice needs slightly more. Avoid adding too much water, however. Too much water may make the rice mushy. Set the pan of rice over medium heat. Do not turn the heat up. It will not make the rice cook faster. Instead, you might end up with unevenly cooked rice. You might even burn the rice. Just let the water slowly rise to a boil. Place a kitchen towel between the pot and lid. Once the rice begins to boil, the water should dip just below the rice. When that happens, lay a clean kitchen towel between the pot and the lid. This will prevent condensation from building up in the pot. Too much condensation can make the rice soggy. Do not let the towel hang over the side of the pan. This could start a fire. Instead, tuck the ends up under the lid. Turn the heat off after 15 minutes of cooking. Remove the rice from the heat but leave the lid on the pot. Let it sit for 5 minutes. When the time is up, remove the lid and fluff the rice with a fork. The rice is now ready to serve. Resting the rice prevents it from being too soggy on the bottom and too dry on the top. Invest in a rice cooker. A rice cooker will produce perfect rice every time as long as you use the right amount of water. Rice cookers can be found for fairly cheap at kitchen stores, home goods stores, and online.",
  "tyn_model":[
    "rice",
    "water",
    "colander",
    "pot",
    "pan",
    "sieve",
    "oven",
    "vanilla bean",
    "fine mesh sieve",
    "oil",
    "garlic",
    "pudding",
    "kitchen towel",
    "rice cooker",
    "cookie sheet or baking pan",
    "fried rice",
    "onions",
    "ginger",
    "vegetables",
    "soy sauce",
    "rice pudding",
    "stove",
    "whole milk",
    "cream",
    "sugar",
    "crackers",
    "baking sheet",
    "slotted spoon",
    "paper towel",
    "veggie burgers",
    "pinto beans",
    "corn",
    "sun-dried tomatoes",
    "basil",
    "cumin",
    "salt",
    "cooking perfect rice",
    "towel",
    "fork",
    "rice cookers"
  ],
  "tyn_section":[

  ]
}