{
  "title":"How to Cook Pork Neckbones",
  "url":"https://www.wikihow.com/Cook-Pork-Neckbones",
  "category_hierarchy":[
    "Food and Entertaining",
    "Recipes",
    "Meat",
    "Pork"
  ],
  "methods":[
    {
      "name":"Simmering Pork Neck Bones",
      "steps":[
        {
          "headline":"Rinse 2 to 3 pounds (32 to 48 oz) of meat under cold running water.",
          "description":"Place the neck bones in a colander or a bowl. Place the colander in the sink. Turn on the faucet. Using your fingers, remove blood, cartilage, and loose pieces of fat from each neck bone. Give them one final rinse. For hard to remove pieces of cartilage and fat use a knife."
        },
        {
          "headline":"Place the neck bones in a large pot.",
          "description":"Sprinkle 2 teaspoons (9.9 ml) of salt and \u20442 teaspoon (2.5 ml) of black pepper on top. Use your hands to mix the salt and pepper into the pork until it is distributed evenly. Wash your hands with soap and water afterward. Alternatively, use a Dutch oven to cook the neck bones."
        },
        {
          "headline":"Cover the neck bones with 2 to 3 inches (5.1 to 7.6 cm) of water.",
          "description":"Turn on the faucet. Fill a pitcher with water. Pour the water into the pot until the neck bones are covered with water."
        },
        {
          "headline":"Boil the water for 15 minutes.",
          "description":"Place the pot on the stove. Set the heat to medium-high. Bring the water to a boil, about 10 to 15 minutes."
        },
        {
          "headline":"Skim the foam off of the top.",
          "description":"Once the water starts to boil, foam will begin to form on the top of the water. Use a spoon to skim the foam off of the top of the water. Skim as much foam as you can."
        },
        {
          "headline":"Simmer the neck bones for an hour.",
          "description":"Reduce the heat to low. Cover the pot with a lid. Let the neck bones simmer for 1 to 1 \u00bd hours."
        },
        {
          "headline":"Add vegetables to the pot once the pork is cooked.",
          "description":"Add chopped green beans, carrots, onions, or potatoes. You can also add 2 cloves of fresh chopped garlic, or 1 tablespoon (15 ml) of garlic powder."
        },
        {
          "headline":"Cook the vegetables on low heat for 20 minutes.",
          "description":"Simmer the vegetables until tender, about 20 to 30 minutes. Serve warm with rice."
        }
      ]
    },
    {
      "name":"Baking Pork Neck Bones",
      "steps":[
        {
          "headline":"Preheat the oven to 375 \u00b0F (191 \u00b0C).",
          "description":"While the oven is heating, chop 2 onions. Also chop 5 cloves of garlic."
        },
        {
          "headline":"Wash 4 pounds (64 oz) of pork neck bones.",
          "description":"Place the neck bones in a bowl or colander in the sink. Turn on cold running water. Place each neck bone under the water to remove cartilage, fat, and blood. Once all of the cartilage and fat are removed, rinse the neck bones one last time. Drain the water. Use a knife to remove tough fat and cartilage."
        },
        {
          "headline":"Season the neck bones with salt and pepper.",
          "description":"Sprinkle 1.5 teaspoons (7.4 ml) of salt and 1 teaspoon (4.9 ml) of pepper over the neck bones. Use your hands to mix the salt and pepper into the neck bones. Mix the salt and pepper into the neck bones until they are evenly coated. Make sure to wash your hands with soap and water afterward."
        },
        {
          "headline":"Place onion, garlic, vinegar, and water into a roasting pan.",
          "description":"Spread half of the chopped onion and garlic on the bottom of a roasting pan. Pour 1 tablespoon (15 ml) of distilled white vinegar into the pan. Then add \u20444 cup (59 ml) of water to the pan."
        },
        {
          "headline":"Lay the neck bones side by side in the pan.",
          "description":"Use a spoon to spread the remaining chopped onion and garlic over the top of the pork."
        },
        {
          "headline":"Bake the pork for 2 hours.",
          "description":"Cover the pan with aluminum foil. Place the pan in the oven. Bake the neck bones for 2 hours."
        },
        {
          "headline":"Baste the pork every 30 minutes.",
          "description":"While the pork is cooking, use a spoon to scoop up the juices. Pour the juices over the neck bones. This will prevent the neck bones from drying out."
        },
        {
          "headline":"Bake the neck bones for an additional 45 minutes.",
          "description":"Remove the foil after 2 hours. Bake the neck bones uncovered for 45, or until golden brown. Remove the neck bones from the oven. Serve with rice or potatoes."
        }
      ]
    },
    {
      "name":"Slow Cooking Pork Neck Bones",
      "steps":[
        {
          "headline":"Clean 3 pounds (48 oz) of neck bones.",
          "description":"Place the neck bones in a colander or a bowl. Place the bowl in the sink under cold running water. Using your fingers, remove fat, cartilage, and blood from each neck bone. Once all of the neck bones are clean, rinse them a final time. Drain the water."
        },
        {
          "headline":"Season the neck bones with salt and pepper.",
          "description":"Sprinkle 1 teaspoon (4.9 ml) of salt and thyme over the neck bones. Add \u20442 teaspoon (2.5 ml) of garlic and onion powder. Use your hands to mix the seasoning into the neck bones until they are evenly coated with seasoning. Wash your hands with soap and water afterward."
        },
        {
          "headline":"Place the neck bones in the slow cooker.",
          "description":"Pour 1 tablespoon (15 ml) of vinegar over the neck bones. Then pour 4 cups (950 ml) of water over them."
        },
        {
          "headline":"Cook the neck bones for 5 to 6 hours.",
          "description":"Cover your slow cooker with the lid. Set the heat to high. Cook the neck bones for 5 to 6 hours on high. Alternatively, set the heat to low and cook the pork for 8 to 10 hours."
        },
        {
          "headline":"Add vegetables to the slow cooker during the last hour of cooking.",
          "description":"Add chopped carrots, green beans, onions, and/or potatoes. Turn the slow cooker off once the meat and vegetables are thoroughly cooked and tender. Serve warm with rice."
        }
      ]
    }
  ],
  "text":" Simmering Pork Neck Bones Rinse 2 to 3 pounds (32 to 48 oz) of meat under cold running water. Place the neck bones in a colander or a bowl. Place the colander in the sink. Turn on the faucet. Using your fingers, remove blood, cartilage, and loose pieces of fat from each neck bone. Give them one final rinse. For hard to remove pieces of cartilage and fat use a knife. Place the neck bones in a large pot. Sprinkle 2 teaspoons (9.9 ml) of salt and \u20442 teaspoon (2.5 ml) of black pepper on top. Use your hands to mix the salt and pepper into the pork until it is distributed evenly. Wash your hands with soap and water afterward. Alternatively, use a Dutch oven to cook the neck bones. Cover the neck bones with 2 to 3 inches (5.1 to 7.6 cm) of water. Turn on the faucet. Fill a pitcher with water. Pour the water into the pot until the neck bones are covered with water. Boil the water for 15 minutes. Place the pot on the stove. Set the heat to medium-high. Bring the water to a boil, about 10 to 15 minutes. Skim the foam off of the top. Once the water starts to boil, foam will begin to form on the top of the water. Use a spoon to skim the foam off of the top of the water. Skim as much foam as you can. Simmer the neck bones for an hour. Reduce the heat to low. Cover the pot with a lid. Let the neck bones simmer for 1 to 1 \u00bd hours. Add vegetables to the pot once the pork is cooked. Add chopped green beans, carrots, onions, or potatoes. You can also add 2 cloves of fresh chopped garlic, or 1 tablespoon (15 ml) of garlic powder. Cook the vegetables on low heat for 20 minutes. Simmer the vegetables until tender, about 20 to 30 minutes. Serve warm with rice. Baking Pork Neck Bones Preheat the oven to 375 \u00b0F (191 \u00b0C). While the oven is heating, chop 2 onions. Also chop 5 cloves of garlic. Wash 4 pounds (64 oz) of pork neck bones. Place the neck bones in a bowl or colander in the sink. Turn on cold running water. Place each neck bone under the water to remove cartilage, fat, and blood. Once all of the cartilage and fat are removed, rinse the neck bones one last time. Drain the water. Use a knife to remove tough fat and cartilage. Season the neck bones with salt and pepper. Sprinkle 1.5 teaspoons (7.4 ml) of salt and 1 teaspoon (4.9 ml) of pepper over the neck bones. Use your hands to mix the salt and pepper into the neck bones. Mix the salt and pepper into the neck bones until they are evenly coated. Make sure to wash your hands with soap and water afterward. Place onion, garlic, vinegar, and water into a roasting pan. Spread half of the chopped onion and garlic on the bottom of a roasting pan. Pour 1 tablespoon (15 ml) of distilled white vinegar into the pan. Then add \u20444 cup (59 ml) of water to the pan. Lay the neck bones side by side in the pan. Use a spoon to spread the remaining chopped onion and garlic over the top of the pork. Bake the pork for 2 hours. Cover the pan with aluminum foil. Place the pan in the oven. Bake the neck bones for 2 hours. Baste the pork every 30 minutes. While the pork is cooking, use a spoon to scoop up the juices. Pour the juices over the neck bones. This will prevent the neck bones from drying out. Bake the neck bones for an additional 45 minutes. Remove the foil after 2 hours. Bake the neck bones uncovered for 45, or until golden brown. Remove the neck bones from the oven. Serve with rice or potatoes. Slow Cooking Pork Neck Bones Clean 3 pounds (48 oz) of neck bones. Place the neck bones in a colander or a bowl. Place the bowl in the sink under cold running water. Using your fingers, remove fat, cartilage, and blood from each neck bone. Once all of the neck bones are clean, rinse them a final time. Drain the water. Season the neck bones with salt and pepper. Sprinkle 1 teaspoon (4.9 ml) of salt and thyme over the neck bones. Add \u20442 teaspoon (2.5 ml) of garlic and onion powder. Use your hands to mix the seasoning into the neck bones until they are evenly coated with seasoning. Wash your hands with soap and water afterward. Place the neck bones in the slow cooker. Pour 1 tablespoon (15 ml) of vinegar over the neck bones. Then pour 4 cups (950 ml) of water over them. Cook the neck bones for 5 to 6 hours. Cover your slow cooker with the lid. Set the heat to high. Cook the neck bones for 5 to 6 hours on high. Alternatively, set the heat to low and cook the pork for 8 to 10 hours. Add vegetables to the slow cooker during the last hour of cooking. Add chopped carrots, green beans, onions, and/or potatoes. Turn the slow cooker off once the meat and vegetables are thoroughly cooked and tender. Serve warm with rice.",
  "tyn_model":[
    "water",
    "garlic",
    "salt",
    "vegetables",
    "colander",
    "bowl",
    "pot",
    "oven",
    "slow cooker",
    "pepper",
    "soap",
    "spoon",
    "onions",
    "potatoes",
    "salt and pepper",
    "onion",
    "knife",
    "green beans",
    "carrots",
    "rice",
    "vinegar",
    "roasting pan",
    "large pot",
    "black pepper",
    "dutch oven",
    "pitcher",
    "stove",
    "pork",
    "garlic powder",
    "distilled white vinegar",
    "aluminum foil",
    "foil",
    "thyme",
    "onion powder"
  ],
  "tyn_section":[

  ]
}