{
  "title":"How to Improve Your Aim in Overwatch",
  "url":"https://www.wikihow.com/Improve-Your-Aim-in-Overwatch",
  "category_hierarchy":[
    "Hobbies and Crafts",
    "Games",
    "Video Games"
  ],
  "parts":[
    {
      "name":"Having Good Equipment",
      "steps":[
        {
          "headline":"Have a good mouse.",
          "description":"Your mouse is really important. You don't need a super expensive one but even a decent priced mouse can be good enough."
        },
        {
          "headline":"Adjust your mouse sensitivity.",
          "description":"To increase your accuracy you should lower your sensitivity. Keep your mouse sensitivity low and gradually increase it little by little until you're at a good balance point. A good rule is that you should be able to do a 360 without your hand going off your mouse pad."
        }
      ]
    },
    {
      "name":"Improving Your Aim",
      "steps":[
        {
          "headline":"Choose a crosshair that suits you.",
          "description":"Your crosshair should be small and not take up a lot of space. You need to be able to see your enemies and where you want to shoot. Consistency is very important. Keep it consistent by using that same crosshair for more than two different heroes."
        },
        {
          "headline":"Make a habit of placing your crosshair in the general area of the enemy's head.",
          "description":"Most characters are around the same height, apart from characters such as Reinhardt or Torbjorn. Keeping your crosshair at head level will make you faster to later adjust the location of your crosshair and land an accurate shot."
        },
        {
          "headline":"Practice moving around while keeping your crosshair on a target.",
          "description":"Keep your eye on an object and move around while your eyes are still locked on your target. In games, you will be dodging and running around a lot so keeping track on your target is very important."
        },
        {
          "headline":"Time your shots.",
          "description":"Characters such as Pharah and Hanzo rely on timing their shots. Predict the enemy's movements and shoot at the area they are heading."
        },
        {
          "headline":"Use a combination of aiming with both your wrist and your arm.",
          "description":"Tense the muscles in your arm and try your best to track the enemies. Your body will slowly get used to this and naturally position itself in this manner."
        },
        {
          "headline":"Spend time in the training room.",
          "description":"There is no pressure in losing the match for your teammates in the training room. You can also go to a custom game and custom game and put a bunch of Ana bots and set the mode to headshots only."
        },
        {
          "headline":"Play the game more.",
          "description":"It's true that practice makes perfect. Just keep playing, it's that simple. The more you play, the better you get. You will naturally get better as your spend more time on the game, and you can and will get better if you really want to."
        }
      ]
    }
  ],
  "text":" Having Good Equipment Have a good mouse. Your mouse is really important. You don't need a super expensive one but even a decent priced mouse can be good enough. Adjust your mouse sensitivity. To increase your accuracy you should lower your sensitivity. Keep your mouse sensitivity low and gradually increase it little by little until you're at a good balance point. A good rule is that you should be able to do a 360 without your hand going off your mouse pad. Improving Your Aim Choose a crosshair that suits you. Your crosshair should be small and not take up a lot of space. You need to be able to see your enemies and where you want to shoot. Consistency is very important. Keep it consistent by using that same crosshair for more than two different heroes. Make a habit of placing your crosshair in the general area of the enemy's head. Most characters are around the same height, apart from characters such as Reinhardt or Torbjorn. Keeping your crosshair at head level will make you faster to later adjust the location of your crosshair and land an accurate shot. Practice moving around while keeping your crosshair on a target. Keep your eye on an object and move around while your eyes are still locked on your target. In games, you will be dodging and running around a lot so keeping track on your target is very important. Time your shots. Characters such as Pharah and Hanzo rely on timing their shots. Predict the enemy's movements and shoot at the area they are heading. Use a combination of aiming with both your wrist and your arm. Tense the muscles in your arm and try your best to track the enemies. Your body will slowly get used to this and naturally position itself in this manner. Spend time in the training room. There is no pressure in losing the match for your teammates in the training room. You can also go to a custom game and custom game and put a bunch of Ana bots and set the mode to headshots only. Play the game more. It's true that practice makes perfect. Just keep playing, it's that simple. The more you play, the better you get. You will naturally get better as your spend more time on the game, and you can and will get better if you really want to.",
  "tyn_model":[
    "mouse"
  ],
  "tyn_section":[

  ]
}