{
  "title":"How to Use Tiki Torches",
  "url":"https://www.wikihow.com/Use-Tiki-Torches",
  "category_hierarchy":[
    "Home and Garden",
    "Heating and Cooling",
    "Fire"
  ],
  "parts":[
    {
      "name":"Setting Up Your Tiki Torches",
      "steps":[
        {
          "headline":"Place torches 6\u20138 feet (1.8\u20132.4 m) (1.83-2.44 m) apart.",
          "description":"Use a measuring tape to space your torches in your yard. This will help prevent accidents if you accidentally knock a torch over."
        },
        {
          "headline":"Avoid placing tiki torches near overhangs or other flammable materials.",
          "description":"Plant tiki torches away from trees, porches, awnings, or hanging party decorations. If you have a propane tank in your yard for a grill or your home, place your tiki torches at least 6 feet (1.8 m) (1.83 m) away. The more space you can allow between your torches and any potentially flammable materials, the better."
        },
        {
          "headline":"Place tiki torches at least 6 feet (1.8 m) (1.83 m) away from your home and shed.",
          "description":"These are often made of flammable materials, such as wood, and may contain combustible cleaning materials."
        },
        {
          "headline":"Use a 1 inch (2.5 cm) drill bit to create a hole for your tiki torch.",
          "description":"Hold your drill perpendicular to the ground, and drill directly into the dirt until the hole is at least 6-8 inches (15.3-20.4 cm) deep. If you\u2019re unsure how deep your hole is, withdraw your drill from the ground and check with your finger. Avoid using this method to plant tiki torches in extremely hard soil or gravel, as you could damage your drill. To find the best method for your particular soil, follow the manufacturer\u2019s directions."
        },
        {
          "headline":"Plant your tiki torches.",
          "description":"Place the bottom of your tiki torch in the hole you\u2019ve created with your drill. If the hole needs to be larger for your tiki torch to fit, use your drill to widen the hole by drilling slightly off center from your original hole. Use a torch stake for extra stability, if needed. Repeat this process with the rest of the torches as desired. You can purchase torch stakes at your local garden or home improvement store. These secure your tiki torch with a tightening pin and simply need to be pressed into the ground to be installed."
        },
        {
          "headline":"Pat dirt around the opening of your hole to secure your tiki torch.",
          "description":"Use your hands to gather dirt that was displaced by drilling the hole. Press it firmly against the base of the tiki torch as it rests in the hole. Do this until the torch feels secure. When secured properly, your torch should stand perpendicular to the ground. If you apply gentle pressure to the staff, the torch should not move."
        }
      ]
    },
    {
      "name":"Fueling and Storing Your Torches",
      "steps":[
        {
          "headline":"Use a funnel to pour fuel into the torch.",
          "description":"Buy a funnel whose stem fits snugly with the fuel opening of your tiki torches. Pour your fuel into the funnel slowly to avoid spills. Avoid overfilling the fuel reservoir by keeping an eye on the fuel level as you fill. If you don\u2019t have a funnel, pour the fuel in a thin stream directly into the torch. Avoid pouring the fuel into another container and then trying to fill the torch, which can cause spills. An overfilled fuel reservoir will overflow and leak down the sides of the tiki torch."
        },
        {
          "headline":"Soak up any spilled fuel with kitty litter.",
          "description":"Let the kitty litter sit on the spilled fuel until it is clumped and firm to the touch, at least 10 minutes. Throw away the soiled kitty litter in its own garbage bag away from other flammable materials. Use a commercial-grade cleaning solution suited to the spill surface to remove any remaining fuel residue. Keep the area well ventilated after cleaning so it can dry out completely. Typically you can apply cleaner to the stain with a damp towel and let it air dry."
        },
        {
          "headline":"Light your tiki torches.",
          "description":"Use a match or lighter to ignite the wick of your tiki torches when you\u2019re ready to use them. Avoid lighting them long before your event to keep from wasting fuel."
        },
        {
          "headline":"Use a snuffer cap to extinguish your torches.",
          "description":"When you want to extinguish your torches, place the snuffer cap completely over the wick and let the torch go out naturally. Remove the snuffer cap when the flame is out, and let the wick cool down completely. Once the wick is completely cool, replace the snuffer cap. This will protect your wick from the elements if you store your tiki torches outside. How long your torches take to cool down will depend upon how long they were lit. Hold your hand close to the torch to feel if it is still giving off heat, if you\u2019re unsure."
        },
        {
          "headline":"Store torches in an upright position when not in use.",
          "description":"Make sure your torches are firmly staked into the ground if you intend to keep them outside. Keep an eye on the weather forecast, as temperatures below 32 \u2109 (0 \u00b0C) will cause the fuel in your tiki torches to freeze. If you store your tiki torches in a garage or shed, use a tether to secure your torches upright. It is safe to let any unused oil stay in the torches while they are in storage. If the temperature hits freezing, either empty the fuel reservoirs of your outdoor tiki torches or bring them inside to a warmer area."
        }
      ]
    },
    {
      "name":"Decorating with Tiki Torches",
      "steps":[
        {
          "headline":"Throw a luau.",
          "description":"Buy some leis and mix some mai-tais to set the scene for a fun Hawaiian party. Your tiki torches will provide some cool, thematic lighting to your gathering."
        },
        {
          "headline":"Have an outdoor movie night.",
          "description":"Set up tiki torches to lend a dim, pleasant atmosphere to a movie outside. Hang a white sheet to project a movie onto. You can serve popcorn and lay down a blanket and some throw pillows for additional comfort."
        },
        {
          "headline":"Host a backyard BBQ.",
          "description":"Buy some citronella-scented torch fuel to keep bugs at bay during a mid-summer gathering. You won\u2019t have to worry about getting bitten while you chow down on ribs and pie."
        },
        {
          "headline":"Throw a themed birthday party.",
          "description":"Embrace a beach or jungle theme for a birthday party with tiki torches. You can decorate tables with coconuts, fruit or other decor to match. Cocktail umbrellas can also add a festive touch. Avoid using tiki torches around young children or rowdy pets. They are a fire hazard."
        },
        {
          "headline":"Buy custom tiki torches.",
          "description":"Explore online craft retailers, such as Etsy, to buy custom tiki torches to suit your event. There are wine bottle-torches, mason-jar torches, and more. Use your imagination!"
        }
      ]
    }
  ],
  "text":" Setting Up Your Tiki Torches Place torches 6\u20138 feet (1.8\u20132.4 m) (1.83-2.44 m) apart. Use a measuring tape to space your torches in your yard. This will help prevent accidents if you accidentally knock a torch over. Avoid placing tiki torches near overhangs or other flammable materials. Plant tiki torches away from trees, porches, awnings, or hanging party decorations. If you have a propane tank in your yard for a grill or your home, place your tiki torches at least 6 feet (1.8 m) (1.83 m) away. The more space you can allow between your torches and any potentially flammable materials, the better. Place tiki torches at least 6 feet (1.8 m) (1.83 m) away from your home and shed. These are often made of flammable materials, such as wood, and may contain combustible cleaning materials. Use a 1 inch (2.5 cm) drill bit to create a hole for your tiki torch. Hold your drill perpendicular to the ground, and drill directly into the dirt until the hole is at least 6-8 inches (15.3-20.4 cm) deep. If you\u2019re unsure how deep your hole is, withdraw your drill from the ground and check with your finger. Avoid using this method to plant tiki torches in extremely hard soil or gravel, as you could damage your drill. To find the best method for your particular soil, follow the manufacturer\u2019s directions. Plant your tiki torches. Place the bottom of your tiki torch in the hole you\u2019ve created with your drill. If the hole needs to be larger for your tiki torch to fit, use your drill to widen the hole by drilling slightly off center from your original hole. Use a torch stake for extra stability, if needed. Repeat this process with the rest of the torches as desired. You can purchase torch stakes at your local garden or home improvement store. These secure your tiki torch with a tightening pin and simply need to be pressed into the ground to be installed. Pat dirt around the opening of your hole to secure your tiki torch. Use your hands to gather dirt that was displaced by drilling the hole. Press it firmly against the base of the tiki torch as it rests in the hole. Do this until the torch feels secure. When secured properly, your torch should stand perpendicular to the ground. If you apply gentle pressure to the staff, the torch should not move. Fueling and Storing Your Torches Use a funnel to pour fuel into the torch. Buy a funnel whose stem fits snugly with the fuel opening of your tiki torches. Pour your fuel into the funnel slowly to avoid spills. Avoid overfilling the fuel reservoir by keeping an eye on the fuel level as you fill. If you don\u2019t have a funnel, pour the fuel in a thin stream directly into the torch. Avoid pouring the fuel into another container and then trying to fill the torch, which can cause spills. An overfilled fuel reservoir will overflow and leak down the sides of the tiki torch. Soak up any spilled fuel with kitty litter. Let the kitty litter sit on the spilled fuel until it is clumped and firm to the touch, at least 10 minutes. Throw away the soiled kitty litter in its own garbage bag away from other flammable materials. Use a commercial-grade cleaning solution suited to the spill surface to remove any remaining fuel residue. Keep the area well ventilated after cleaning so it can dry out completely. Typically you can apply cleaner to the stain with a damp towel and let it air dry. Light your tiki torches. Use a match or lighter to ignite the wick of your tiki torches when you\u2019re ready to use them. Avoid lighting them long before your event to keep from wasting fuel. Use a snuffer cap to extinguish your torches. When you want to extinguish your torches, place the snuffer cap completely over the wick and let the torch go out naturally. Remove the snuffer cap when the flame is out, and let the wick cool down completely. Once the wick is completely cool, replace the snuffer cap. This will protect your wick from the elements if you store your tiki torches outside. How long your torches take to cool down will depend upon how long they were lit. Hold your hand close to the torch to feel if it is still giving off heat, if you\u2019re unsure. Store torches in an upright position when not in use. Make sure your torches are firmly staked into the ground if you intend to keep them outside. Keep an eye on the weather forecast, as temperatures below 32 \u2109 (0 \u00b0C) will cause the fuel in your tiki torches to freeze. If you store your tiki torches in a garage or shed, use a tether to secure your torches upright. It is safe to let any unused oil stay in the torches while they are in storage. If the temperature hits freezing, either empty the fuel reservoirs of your outdoor tiki torches or bring them inside to a warmer area. Decorating with Tiki Torches Throw a luau. Buy some leis and mix some mai-tais to set the scene for a fun Hawaiian party. Your tiki torches will provide some cool, thematic lighting to your gathering. Have an outdoor movie night. Set up tiki torches to lend a dim, pleasant atmosphere to a movie outside. Hang a white sheet to project a movie onto. You can serve popcorn and lay down a blanket and some throw pillows for additional comfort. Host a backyard BBQ. Buy some citronella-scented torch fuel to keep bugs at bay during a mid-summer gathering. You won\u2019t have to worry about getting bitten while you chow down on ribs and pie. Throw a themed birthday party. Embrace a beach or jungle theme for a birthday party with tiki torches. You can decorate tables with coconuts, fruit or other decor to match. Cocktail umbrellas can also add a festive touch. Avoid using tiki torches around young children or rowdy pets. They are a fire hazard. Buy custom tiki torches. Explore online craft retailers, such as Etsy, to buy custom tiki torches to suit your event. There are wine bottle-torches, mason-jar torches, and more. Use your imagination!",
  "tyn_model":[
    "tiki torches",
    "torches",
    "drill",
    "tiki torch",
    "funnel",
    "torch",
    "kitty litter",
    "snuffer cap",
    "propane tank",
    "drill bit",
    "torch stake",
    "torch stakes",
    "garbage bag",
    "match",
    "lighter",
    "\u2109 (",
    "leis",
    "blanket",
    "wine bottle-torches",
    "mason-jar torches"
  ],
  "tyn_section":[

  ]
}