{
  "title":"How to Store White Wine",
  "url":"https://www.wikihow.com/Store-White-Wine",
  "category_hierarchy":[
    "Food and Entertaining",
    "Drinks",
    "Alcoholic Drinks",
    "Wine"
  ],
  "methods":[
    {
      "name":"Keeping White Wine Cool",
      "steps":[
        {
          "headline":"Store the wine in your basement if you have one.",
          "description":"Basements are ideal because they are cool, dark, and damp. Store your wine sideways in a wine rack in your basement. However, if your basement is dirty and filled with strong smelling odors, you may want to store your white wine somewhere else. Place your wine bottles against a subterranean wall if your basement is only halfway underground."
        },
        {
          "headline":"Place your wine bottles in an interior closet instead of the basement.",
          "description":"Closets are dark and stay relatively cool. Choose a hallway or stairway closet that has interior walls as opposed to exterior walls. Exterior walls face the outside, which may cause the temperature to fluctuate in the closet. If you do not have an interior closet space, then store your wine in a closet that has a shaded, northern wall."
        },
        {
          "headline":"Use a wine fridge if you don't have cool, dark place to store your wine.",
          "description":"A wine fridge will keep your white wine at the optimal temperature. While this is a convenient way to store your wine, it is also one of the more expensive ways. The cost of a wine fridge can range from $100 to $1,000. Because the temperatures are too cold and dry in a regular fridge, avoid storing unopened wine in the fridge to keep it cool. EXPERT TIP\t\t\t\t\t\t\t\t\t\t\t\t\t\t\t\t\t\t\t\t\t\t\t\t\t\t\t\t\t\t\tSamuel Bogue\t\t\t\t\t\t\t\t\t\t\t\t\t\t\t\tWine Director & Consultant\t\t\t\t\t\t\t\tSamuel Bogue is the Wine Director of the Ne Timeas Restaurant Group in San Francisco, California. He gained his Sommelier certification in 2013, is a Zagat \"30 Under 30\" award winner, and is a wine consultant for the San Francisco Bay Area's top restaurants. Samuel Bogue\t\t\tWine Director & Consultant\t\t\t\tA wine fridge is nice, but not essential. Sam Bogue, a sommelier, says: \"A wine fridge is a great accessory because you can tune them very specifically to the temperature that your wine should be stored at. It also makes for very easy access. But you can keep your wines stored in the fridge and it's fine.\""
        },
        {
          "headline":"Avoid storing your white wine in the kitchen.",
          "description":"Because the temperature fluctuates in kitchens, garages, sheds, and laundry rooms, avoid storing your wine in these places. In addition to having a fluctuating temperature, garages and laundry rooms typically contain products that have strong odors like paint, solvents, and cleaning products, which can taint the taste of your wine. Heat from appliances and light in the kitchen make it one of the hottest areas in the house."
        }
      ]
    },
    {
      "name":"Using Additional Strategies",
      "steps":[
        {
          "headline":"Store your white wine away from direct light.",
          "description":"White wine is very sensitive to ultra-violet (UV) light. Avoid placing your wine near or next to windows. Additionally, do no store your wine in an area that has fluorescent light. Fluorescent light also contains UV light."
        },
        {
          "headline":"Place the wine bottle on its side in a storage rack.",
          "description":"Dry corks may shrink, allowing oxygen to enter the bottle and oxidize the wine. By storing your wine bottles on their sides, you can keep the cork moist. If the cork stays moist, then it is less likely to dry out and shrink."
        },
        {
          "headline":"Store your wine in a space that has 50 to 75% humidity.",
          "description":"Like storing the bottle sideways, humidity will keep the cork moist, preventing it from drying out. If the area that you are storing your wine in is too dry, place a pan of water in the space to increase the humidity levels. While a humidity level of 75% or higher will not adversely affect your wine, it may cause mold to grow on the cork and label. If necessary, use a dehumidifier to decrease the level of humidity in the air."
        }
      ]
    },
    {
      "name":"Storing Opened White Wine",
      "steps":[
        {
          "headline":"Re-cork the bottle using the stained side of the cork.",
          "description":"Avoid placing the \"clean,\" external side of the cork into the wine bottle to re-cork it. Because the \u201cclean\u201d side may have particles of dust and other debris, you may taint your wine if you put this side of the cork into the bottle."
        },
        {
          "headline":"Pour the unused wine into a half bottle if you have one.",
          "description":"Oxygen is what causes leftover wine to go bad. However, by decreasing the amount of oxygen the wine comes into contact with, you can extend the life of the wine. Use a funnel to pour your unused wine into a half bottle of wine. Screw the cap on and place it in the fridge. You can purchase screw-cap half bottles from your local grocery store or wine and liquor store."
        },
        {
          "headline":"Remove the air from the bottle with a wine gadget.",
          "description":"You can use a variety of gadgets to remove air from your wine bottles. Some of these gadgets are designed to suck oxygen out of the bottle, while others are designed to coat the surface of the wine with a gas to protect it from oxygen. The price of these tools can range from $13 to $300. You can find these tools online, or at your local wine store."
        },
        {
          "headline":"Store the wine in the fridge for 3 to 5 days.",
          "description":"If your wine is sealed with a cork, the fridge will keep it cool and fresh for 3 to 5 days. However, if you are using one of the wine tools to preserve your wine, it may last for up to 7 days in the fridge."
        },
        {
          "headline":"Smell the wine before drinking it.",
          "description":"If you open your wine and it smells sweet, musty, or like vinegar, then it has gone bad. Additionally, if you see bubbles in your white wine or it tastes fizzy, then it has gone bad."
        }
      ]
    }
  ],
  "text":" Keeping White Wine Cool Store the wine in your basement if you have one. Basements are ideal because they are cool, dark, and damp. Store your wine sideways in a wine rack in your basement. However, if your basement is dirty and filled with strong smelling odors, you may want to store your white wine somewhere else. Place your wine bottles against a subterranean wall if your basement is only halfway underground. Place your wine bottles in an interior closet instead of the basement. Closets are dark and stay relatively cool. Choose a hallway or stairway closet that has interior walls as opposed to exterior walls. Exterior walls face the outside, which may cause the temperature to fluctuate in the closet. If you do not have an interior closet space, then store your wine in a closet that has a shaded, northern wall. Use a wine fridge if you don't have cool, dark place to store your wine. A wine fridge will keep your white wine at the optimal temperature. While this is a convenient way to store your wine, it is also one of the more expensive ways. The cost of a wine fridge can range from $100 to $1,000. Because the temperatures are too cold and dry in a regular fridge, avoid storing unopened wine in the fridge to keep it cool. EXPERT TIP\t\t\t\t\t\t\t\t\t\t\t\t\t\t\t\t\t\t\t\t\t\t\t\t\t\t\t\t\t\t\tSamuel Bogue\t\t\t\t\t\t\t\t\t\t\t\t\t\t\t\tWine Director & Consultant\t\t\t\t\t\t\t\tSamuel Bogue is the Wine Director of the Ne Timeas Restaurant Group in San Francisco, California. He gained his Sommelier certification in 2013, is a Zagat \"30 Under 30\" award winner, and is a wine consultant for the San Francisco Bay Area's top restaurants. Samuel Bogue\t\t\tWine Director & Consultant\t\t\t\tA wine fridge is nice, but not essential. Sam Bogue, a sommelier, says: \"A wine fridge is a great accessory because you can tune them very specifically to the temperature that your wine should be stored at. It also makes for very easy access. But you can keep your wines stored in the fridge and it's fine.\" Avoid storing your white wine in the kitchen. Because the temperature fluctuates in kitchens, garages, sheds, and laundry rooms, avoid storing your wine in these places. In addition to having a fluctuating temperature, garages and laundry rooms typically contain products that have strong odors like paint, solvents, and cleaning products, which can taint the taste of your wine. Heat from appliances and light in the kitchen make it one of the hottest areas in the house. Using Additional Strategies Store your white wine away from direct light. White wine is very sensitive to ultra-violet (UV) light. Avoid placing your wine near or next to windows. Additionally, do no store your wine in an area that has fluorescent light. Fluorescent light also contains UV light. Place the wine bottle on its side in a storage rack. Dry corks may shrink, allowing oxygen to enter the bottle and oxidize the wine. By storing your wine bottles on their sides, you can keep the cork moist. If the cork stays moist, then it is less likely to dry out and shrink. Store your wine in a space that has 50 to 75% humidity. Like storing the bottle sideways, humidity will keep the cork moist, preventing it from drying out. If the area that you are storing your wine in is too dry, place a pan of water in the space to increase the humidity levels. While a humidity level of 75% or higher will not adversely affect your wine, it may cause mold to grow on the cork and label. If necessary, use a dehumidifier to decrease the level of humidity in the air. Storing Opened White Wine Re-cork the bottle using the stained side of the cork. Avoid placing the \"clean,\" external side of the cork into the wine bottle to re-cork it. Because the \u201cclean\u201d side may have particles of dust and other debris, you may taint your wine if you put this side of the cork into the bottle. Pour the unused wine into a half bottle if you have one. Oxygen is what causes leftover wine to go bad. However, by decreasing the amount of oxygen the wine comes into contact with, you can extend the life of the wine. Use a funnel to pour your unused wine into a half bottle of wine. Screw the cap on and place it in the fridge. You can purchase screw-cap half bottles from your local grocery store or wine and liquor store. Remove the air from the bottle with a wine gadget. You can use a variety of gadgets to remove air from your wine bottles. Some of these gadgets are designed to suck oxygen out of the bottle, while others are designed to coat the surface of the wine with a gas to protect it from oxygen. The price of these tools can range from $13 to $300. You can find these tools online, or at your local wine store. Store the wine in the fridge for 3 to 5 days. If your wine is sealed with a cork, the fridge will keep it cool and fresh for 3 to 5 days. However, if you are using one of the wine tools to preserve your wine, it may last for up to 7 days in the fridge. Smell the wine before drinking it. If you open your wine and it smells sweet, musty, or like vinegar, then it has gone bad. Additionally, if you see bubbles in your white wine or it tastes fizzy, then it has gone bad.",
  "tyn_model":[
    "wine",
    "fridge",
    "wine fridge",
    "wine bottles",
    "wine bottle",
    "wine rack",
    "white wine",
    "sommelier certification",
    "wine consultant",
    "sommelier",
    "wines",
    "water",
    "dehumidifier",
    "\u201cclean",
    "\u201d side",
    "funnel",
    "screw-cap half bottles",
    "liquor store",
    "wine gadget",
    "vinegar"
  ],
  "tyn_section":[

  ]
}