{
  "title":"How to Identify Plastic Rice",
  "url":"https://www.wikihow.com/Identify-Plastic-Rice",
  "category_hierarchy":[
    "Home and Garden",
    "DIY",
    "Plastic"
  ],
  "methods":[
    {
      "name":"Trying the Water Test",
      "steps":[
        {
          "headline":"Purchase plastic rice beads if you want a comparison.",
          "description":"Plastic rice beads are available online and at some art supply stores. They\u2019re used to cushion shipped cargo and for crafts projects. When you conduct your experiments, you could compare a sample of plastic rice with the rice you want to test. Some people have seen videos of plastic rice beads being produced and assume that they're made just to be passed off as food. However, plastic rice beads are more expensive to produce than actual rice, so it wouldn\u2019t be profitable to try to substitute plastic for the real thing."
        },
        {
          "headline":"Add rice to a glass of water.",
          "description":"If you just want to test a small amount, drop a tablespoon of rice into a glass of water. To test a larger batch, add the rice to a large pot and cover it with 2 to 3 inches (5.1 to 7.6 cm) of water. If you\u2019re also testing a sample of plastic rice, add it to a separate container of water."
        },
        {
          "headline":"Stir the water and let it settle.",
          "description":"Mix up the rice and water for a few seconds. Then give the mixture about 30 seconds to stop swirling."
        },
        {
          "headline":"Look for grains that floats to the surface.",
          "description":"Because of its density, rice sinks in water. If any grains float to the surface after the water settles, you should be suspicious. The difference will be obvious if you\u2019re also testing a sample of plastic beads. You might see bits and pieces of dirt and other debris float, but all the grains of rice should sink. Aside from verifying its authenticity, soaking and rinsing rice before cooking removes impurities and helps separate the grains. In the end, you'll have a fluffier, less sticky bowl of cooked rice."
        }
      ]
    },
    {
      "name":"Observing Rice as It Boils",
      "steps":[
        {
          "headline":"Add rice to a pot or bowl of water.",
          "description":"Combine equal parts of rice and water, or use whichever ratio you prefer to use when you normally cook rice. Use a pot if you\u2019re boiling the rice on the stovetop, or combine the rice and water in a microwave-safe bowl. Use a separate container to boil plastic rice beads if you\u2019re testing a comparison sample."
        },
        {
          "headline":"Cook the rice in the microwave or on the stovetop.",
          "description":"Bring the rice to a boil over medium heat on the stovetop. Alternatively, you could microwave the rice on high for about 3 minutes."
        },
        {
          "headline":"Check the surface for a layer of thick residue.",
          "description":"If you\u2019re boiling the rice on the stovetop, check it after about 10 minutes, or take the bowl out of the microwave after 3 minutes. Skim the surface with a spoon to check for a layer of plastic residue. When boiling rice on the stovetop, you might have to lower the heat to calm a rolling boil so you can see the surface clearly. If you\u2019re testing a sample of plastic, you\u2019ll be able to skim a thick layer of melted plastic from the surface. In addition, unlike rice, the plastic won\u2019t start to fluff and absorb the water. Rice is starchy, and some stickiness or residue is normal, especially in short-grained varieties. However, there\u2019s a noticeable difference between a thin starchy residue and a thick layer of melted plastic."
        }
      ]
    },
    {
      "name":"Heating Rice on a Skillet",
      "steps":[
        {
          "headline":"Coat a skillet with oil and heat it on the stove.",
          "description":"A tablespoon of oil should be enough to coat the surface of a skillet. Alternatively, you could coat the surface with cooking spray. After coating the skillet, set your burner to high heat and get your pan hot."
        },
        {
          "headline":"Cover the skillet with a single, thin layer of rice.",
          "description":"When the oil becomes very thin and hot, add rice to the skillet. You\u2019ll need to be able to observe individual grains, so don\u2019t add too much rice. If you\u2019re testing a sample of plastic rice beads, heat them in a separate skillet."
        },
        {
          "headline":"Check for grains that contract and melt.",
          "description":"Plastic will begin to melt after a couple of minutes on the hot skillet. Look closely, and if there are any plastic grains, you'll be able to see them start to change shape and liquefy. If you\u2019re testing samples side by side, you\u2019ll have no problem seeing the plastic rice beads contract and melt. Melting plastic also has a distinct smell, which you\u2019ll also detect if you\u2019re testing a sample of plastic rice beads."
        }
      ]
    }
  ],
  "text":" Trying the Water Test Purchase plastic rice beads if you want a comparison. Plastic rice beads are available online and at some art supply stores. They\u2019re used to cushion shipped cargo and for crafts projects. When you conduct your experiments, you could compare a sample of plastic rice with the rice you want to test. Some people have seen videos of plastic rice beads being produced and assume that they're made just to be passed off as food. However, plastic rice beads are more expensive to produce than actual rice, so it wouldn\u2019t be profitable to try to substitute plastic for the real thing. Add rice to a glass of water. If you just want to test a small amount, drop a tablespoon of rice into a glass of water. To test a larger batch, add the rice to a large pot and cover it with 2 to 3 inches (5.1 to 7.6 cm) of water. If you\u2019re also testing a sample of plastic rice, add it to a separate container of water. Stir the water and let it settle. Mix up the rice and water for a few seconds. Then give the mixture about 30 seconds to stop swirling. Look for grains that floats to the surface. Because of its density, rice sinks in water. If any grains float to the surface after the water settles, you should be suspicious. The difference will be obvious if you\u2019re also testing a sample of plastic beads. You might see bits and pieces of dirt and other debris float, but all the grains of rice should sink. Aside from verifying its authenticity, soaking and rinsing rice before cooking removes impurities and helps separate the grains. In the end, you'll have a fluffier, less sticky bowl of cooked rice. Observing Rice as It Boils Add rice to a pot or bowl of water. Combine equal parts of rice and water, or use whichever ratio you prefer to use when you normally cook rice. Use a pot if you\u2019re boiling the rice on the stovetop, or combine the rice and water in a microwave-safe bowl. Use a separate container to boil plastic rice beads if you\u2019re testing a comparison sample. Cook the rice in the microwave or on the stovetop. Bring the rice to a boil over medium heat on the stovetop. Alternatively, you could microwave the rice on high for about 3 minutes. Check the surface for a layer of thick residue. If you\u2019re boiling the rice on the stovetop, check it after about 10 minutes, or take the bowl out of the microwave after 3 minutes. Skim the surface with a spoon to check for a layer of plastic residue. When boiling rice on the stovetop, you might have to lower the heat to calm a rolling boil so you can see the surface clearly. If you\u2019re testing a sample of plastic, you\u2019ll be able to skim a thick layer of melted plastic from the surface. In addition, unlike rice, the plastic won\u2019t start to fluff and absorb the water. Rice is starchy, and some stickiness or residue is normal, especially in short-grained varieties. However, there\u2019s a noticeable difference between a thin starchy residue and a thick layer of melted plastic. Heating Rice on a Skillet Coat a skillet with oil and heat it on the stove. A tablespoon of oil should be enough to coat the surface of a skillet. Alternatively, you could coat the surface with cooking spray. After coating the skillet, set your burner to high heat and get your pan hot. Cover the skillet with a single, thin layer of rice. When the oil becomes very thin and hot, add rice to the skillet. You\u2019ll need to be able to observe individual grains, so don\u2019t add too much rice. If you\u2019re testing a sample of plastic rice beads, heat them in a separate skillet. Check for grains that contract and melt. Plastic will begin to melt after a couple of minutes on the hot skillet. Look closely, and if there are any plastic grains, you'll be able to see them start to change shape and liquefy. If you\u2019re testing samples side by side, you\u2019ll have no problem seeing the plastic rice beads contract and melt. Melting plastic also has a distinct smell, which you\u2019ll also detect if you\u2019re testing a sample of plastic rice beads.",
  "tyn_model":[
    "rice",
    "water",
    "skillet",
    "plastic rice beads",
    "microwave",
    "oil",
    "pot",
    "plastic rice",
    "large pot",
    "bowl",
    "spoon",
    "stove",
    "cooking spray",
    "burner"
  ],
  "tyn_section":[

  ]
}