{
  "title":"How to Update Ps4 Games",
  "url":"https://www.wikihow.com/Update-Ps4-Games",
  "category_hierarchy":[
    "Hobbies and Crafts",
    "Games",
    "Video Games",
    "PlayStation Video Game Consoles",
    "PlayStation 4"
  ],
  "methods":[
    {
      "name":"Setting up Automatic Updates",
      "steps":[
        {
          "headline":"Turn on your PS4 by pressing the central button on your controller.",
          "description":"Press the button again if you see an additional screen that prompts you to do so. Select your user profile at the next screen that asks \u201cWho is using this controller?\u201d  Then, press the \u201cX\u201d button."
        },
        {
          "headline":"Press up on the controller and scroll over to the \u201csettings\u201d screen.",
          "description":"The settings button is orange and white, with a small logo of a toolbox in a white circle. You can find it between the power options and the trophies menu options. Use the D-pad or the left thumb stick to navigate to the settings menu option, then press \u201cX\u201d on your controller to access it."
        },
        {
          "headline":"Scroll down through the menu options to \u201csystem.\u201d  The \u201csystem\u201d option is between \u201caccessibility\u201d and \u201cinitialisation.\u201d  Press \u201cX\u201d on the controller to access it.",
          "description":""
        },
        {
          "headline":"Scroll down to \u201cautomatic downloads and uploads.\u201d  This menu option is second from the top, between \u201csystem information\u201d and \u201cvoice operation settings.\u201d  Press \u201cX\u201d on the controller to access it.",
          "description":""
        },
        {
          "headline":"Place a check mark next to \u201capplication update files.\u201d  By pressing the \u201cX\u201d button on your controller after scrolling down to \u201capplication update files,\u201d you\u2019ll activate automatic downloads on games and apps.",
          "description":"The \u201capplication update files\u201d option is between the \u201csaved data\u201d and \u201cinstall automatically\u201d options."
        },
        {
          "headline":"Navigate to the \u201cpower settings\u201d menu.",
          "description":"Press \u201cO\u201d twice on the controller to backtrack to the \u201csettings\u201d menu screen, then scroll down to the \u201cpower settings\u201d option. This menu option has a small white logo next to it in the shape of 2 hands lifting a battery. Press \u201cX\u201d on the controller to access the menu once you\u2019ve scrolled to it."
        },
        {
          "headline":"Set the functions you want available in rest mode.",
          "description":"Select the second menu option, \u201cset functions available in rest mode.\u201d  This allows games to update even when the PS4 is in rest mode. If you are a remote play user, you should also select \u201cenable turning on of PS4 from network.\u201d"
        },
        {
          "headline":"Put the PS4 into rest mode before you turn off the power.",
          "description":"Hold down the central button on the controller, then use the D-pad or left thumbstick to scroll down to the \u201cpower\u201d option. Scroll over, then select \u201cput PS4 in standby mode.\u201d"
        }
      ]
    },
    {
      "name":"Updating Games Manually",
      "steps":[
        {
          "headline":"Select the application you want to update in the main menu.",
          "description":"After turning on the PS4 and accessing your account, use the D-pad or left thumbstick to navigate to the game you\u2019re interested in updating."
        },
        {
          "headline":"Check for updates through the options menu.",
          "description":"With the game you want to update still selected, press the options button on your controller. Scroll down to the \u201ccheck for update\u201d option in the menu that pops up."
        },
        {
          "headline":"Go to downloads if the game is ready for an update.",
          "description":"If there is an update available, you\u2019ll get a notification that reads, \u201cAn update file for this application is available.\u201d  You\u2019ll then be prompted to go to the downloads screen. Press \u201cX\u201d on the controller to access the screen. If the game doesn\u2019t need an update, the PS4 will let you know."
        },
        {
          "headline":"Select the game and begin the download.",
          "description":"At the downloads screen, you\u2019ll see a full list of all updates available for your apps and games. Select the game you want to update by pressing \u201cX\u201d on the controller, then confirm your decision to update the game. Updates take time. The amount of time they take to install depends upon the size of the update file. You can play games while the update installs."
        }
      ]
    }
  ],
  "text":" Setting up Automatic Updates Turn on your PS4 by pressing the central button on your controller. Press the button again if you see an additional screen that prompts you to do so. Select your user profile at the next screen that asks \u201cWho is using this controller?\u201d  Then, press the \u201cX\u201d button. Press up on the controller and scroll over to the \u201csettings\u201d screen. The settings button is orange and white, with a small logo of a toolbox in a white circle. You can find it between the power options and the trophies menu options. Use the D-pad or the left thumb stick to navigate to the settings menu option, then press \u201cX\u201d on your controller to access it. Scroll down through the menu options to \u201csystem.\u201d  The \u201csystem\u201d option is between \u201caccessibility\u201d and \u201cinitialisation.\u201d  Press \u201cX\u201d on the controller to access it.  Scroll down to \u201cautomatic downloads and uploads.\u201d  This menu option is second from the top, between \u201csystem information\u201d and \u201cvoice operation settings.\u201d  Press \u201cX\u201d on the controller to access it.  Place a check mark next to \u201capplication update files.\u201d  By pressing the \u201cX\u201d button on your controller after scrolling down to \u201capplication update files,\u201d you\u2019ll activate automatic downloads on games and apps. The \u201capplication update files\u201d option is between the \u201csaved data\u201d and \u201cinstall automatically\u201d options. Navigate to the \u201cpower settings\u201d menu. Press \u201cO\u201d twice on the controller to backtrack to the \u201csettings\u201d menu screen, then scroll down to the \u201cpower settings\u201d option. This menu option has a small white logo next to it in the shape of 2 hands lifting a battery. Press \u201cX\u201d on the controller to access the menu once you\u2019ve scrolled to it. Set the functions you want available in rest mode. Select the second menu option, \u201cset functions available in rest mode.\u201d  This allows games to update even when the PS4 is in rest mode. If you are a remote play user, you should also select \u201cenable turning on of PS4 from network.\u201d Put the PS4 into rest mode before you turn off the power. Hold down the central button on the controller, then use the D-pad or left thumbstick to scroll down to the \u201cpower\u201d option. Scroll over, then select \u201cput PS4 in standby mode.\u201d Updating Games Manually Select the application you want to update in the main menu. After turning on the PS4 and accessing your account, use the D-pad or left thumbstick to navigate to the game you\u2019re interested in updating. Check for updates through the options menu. With the game you want to update still selected, press the options button on your controller. Scroll down to the \u201ccheck for update\u201d option in the menu that pops up. Go to downloads if the game is ready for an update. If there is an update available, you\u2019ll get a notification that reads, \u201cAn update file for this application is available.\u201d  You\u2019ll then be prompted to go to the downloads screen. Press \u201cX\u201d on the controller to access the screen. If the game doesn\u2019t need an update, the PS4 will let you know. Select the game and begin the download. At the downloads screen, you\u2019ll see a full list of all updates available for your apps and games. Select the game you want to update by pressing \u201cX\u201d on the controller, then confirm your decision to update the game. Updates take time. The amount of time they take to install depends upon the size of the update file. You can play games while the update installs.",
  "tyn_model":[
    "controller",
    "\u201d  ",
    "\u201cx",
    "ps4",
    "\u201d on",
    "\u201d option",
    "\u201csystem",
    "\u201d and",
    "\u201capplication",
    "\u201cpower",
    "\u201d button",
    "\u201csettings",
    "games",
    "\u201d menu",
    "\u201cwho",
    "\u201d screen",
    "\u201caccessibility",
    "\u201cinitialisation",
    "\u201cautomatic",
    "\u201cvoice",
    "\u201d you",
    "\u201csaved",
    "\u201cinstall",
    "\u201d options",
    "\u201co",
    "\u201d twice",
    "\u201cset",
    "\u201cenable",
    "\u201d put",
    "d-pad or left thumbstick",
    "\u201cput",
    "\u201d updating",
    "\u201ccheck",
    "\u201can",
    "ps4 will"
  ],
  "tyn_section":[

  ]
}