{
  "title":"How to Eat Smoked Salmon",
  "url":"https://www.wikihow.com/Eat-Smoked-Salmon",
  "category_hierarchy":[
    "Food and Entertaining",
    "Recipes",
    "Fish and Seafood",
    "Salmon"
  ],
  "methods":[
    {
      "name":"Using Smoked Salmon in Breakfast",
      "steps":[
        {
          "headline":"Make scrambled eggs and salmon.",
          "description":"The number of eggs you should scramble will depend on how many people you want to feed. Scramble 2 per person. Make the scrambled eggs in a hot pan. Then cut a bagel in half and toast it. Drape a slice or two of salmon over each bagel half and then top with the scrambled eggs. You can also cut 2 slices of smoked salmon into bite-size pieces and add them to the scrambled egg mixture before you cook it."
        },
        {
          "headline":"Add smoked salmon to eggs Benedict.",
          "description":"Toast 2 halves of an English muffin. Lay a slice of smoked salmon on each half. Then top each half with a poached egg and spoon a spoonful of hollandaise sauce over the top. You can season the eggs with salt and pepper to taste."
        },
        {
          "headline":"Make smoked salmon avocado toast.",
          "description":"Mash \u00bd an avocado in a small bowl until it\u2019s mostly smooth (a few chunks are okay). Brush some olive oil onto 2 slices of sourdough bread and set them on a cooking sheet. Place the sheet in a 350\u00b0 F (177\u00b0 C) oven and toast for 5 minutes. Divide the avocado between the 2 slices of bread and top with the smoked salmon and a dollop of sour cream."
        }
      ]
    },
    {
      "name":"Making Smoked Salmon Appetizers",
      "steps":[
        {
          "headline":"Top sliced cucumber with smoked salmon and brie cheese.",
          "description":"Cut \u00bd of a wheel of brie cheese into chunks and layer them into the bottom of oven-proof skillet. Bake the skillet at 375\u00b0 F (191\u00b0 C) for 10 to 12 minutes until the cheese is bubbly. Add 1 tablespoon (14.8 ml) (0.5 ounces) capers, \u00bc cup (2 ounces) finely diced scallions, and 1 minced clove of garlic to the cheese and mix it well. Then bake it for another 2 to 3 minutes. Slice 3 cucumbers into 8 pieces each. Top each slice with a spoonful of cheese mixture and top with a small slice of salmon."
        },
        {
          "headline":"Add smoked salmon to a baked potato.",
          "description":"Slice 2 baked potatoes down the middle. Fill each potato with 1 full slice of smoked salmon, 2 spoonfuls of tomatoes, and a dollop of sour cream. Season with salt and pepper if you like."
        },
        {
          "headline":"Top crusty bread with salmon.",
          "description":"Tear a loaf of warm crusty bread into chunks. Drape thin slices of smoked salmon, slightly bigger than the chunk of bread, over each chunk. Then top with a dab of sour cream and a pinch of black pepper."
        },
        {
          "headline":"Make rye and salmon squares.",
          "description":"Cut rye bread slices into 2 inch (5 cm) squares. Spoon \u00bd teaspoon of horseradish onto each square, and then top with a thin slice of salmon. Garnish with dill."
        },
        {
          "headline":"Serve simple smoked salmon.",
          "description":"Cut each slice of smoke salmon into 1-inch (2.5 cm) strips. Squeeze fresh lemon juice over each strip and then add black pepper to taste. Roll each strip of salmon up and then spear it with a toothpick."
        }
      ]
    },
    {
      "name":"Making Smoked Salmon Entrees",
      "steps":[
        {
          "headline":"Toss smoked salmon with pasta.",
          "description":"Cut 2 slices of smoked salmon into small, bite-size pieces. Boil your favorite pasta and then drain. Toss the pasta with the salmon, fresh herbs, lemon juice, and a dollop of cr\u00e8me fraiche."
        },
        {
          "headline":"Add salmon to your favorite salad.",
          "description":"Fill a bowl with spinach or your favorite greens. Add bite-size pieces of smoked salmon, fresh peas, and thin slices of red onion to the salad. Add 2 teaspoons of your favorite dressing and toss the salad."
        },
        {
          "headline":"Make smoked salmon cakes.",
          "description":"Peel and dice 2 medium potatoes. Bring them to boil in a pot of water. Lower the heat and simmer until the potatoes are soft. When the potatoes are cool, add \u00bd cup (4 ounces) chopped smoked salmon, 2 tablespoons (29.6 ml) (1 ounce) of mayonnaise, and \u00bd teaspoon lemon juice to them and mix with a fork. Form the mixture into 3-inch (7.5 cm) patties. Dip each patty in a whisked egg, then in panko bread crumbs. Bake the cakes for 8 minutes in a warm skillet with 2 tablespoons (29.6 ml) (1 ounce) of oil in the bottom, flipping halfway through."
        }
      ]
    },
    {
      "name":"Storing Smoked Salmon",
      "steps":[
        {
          "headline":"Keep the salmon in the original packaging.",
          "description":"If you\u2019re not going to use the salmon right away, keep it in the original packaging. It should come vacuum-sealed, which will keep the fish fresher longer."
        },
        {
          "headline":"Wrap opened salmon tightly in plastic.",
          "description":"If you do open the package to use some salmon, wrap the remainder tightly in plastic wrap. Make sure it\u2019s wrapped tightly enough to prevent air from getting in. If air does get in and the edges get dry and flaky, just cut that part away with a sharp knife."
        },
        {
          "headline":"Refrigerate unopened salmon for up to 2 to 3 weeks.",
          "description":"If you\u2019ve already opened the salmon, it should stay fresh in your fridge for a week."
        },
        {
          "headline":"Freeze the salmon for up to 3 months.",
          "description":"As long as you keep your smoked salmon in its original packaging, you can keep it in the freezer for up to 3 months. If you open the salmon and want to freeze part of it, put the remainder in a freezer-proof bag."
        }
      ]
    }
  ],
  "text":" Using Smoked Salmon in Breakfast Make scrambled eggs and salmon. The number of eggs you should scramble will depend on how many people you want to feed. Scramble 2 per person. Make the scrambled eggs in a hot pan. Then cut a bagel in half and toast it. Drape a slice or two of salmon over each bagel half and then top with the scrambled eggs. You can also cut 2 slices of smoked salmon into bite-size pieces and add them to the scrambled egg mixture before you cook it. Add smoked salmon to eggs Benedict. Toast 2 halves of an English muffin. Lay a slice of smoked salmon on each half. Then top each half with a poached egg and spoon a spoonful of hollandaise sauce over the top. You can season the eggs with salt and pepper to taste. Make smoked salmon avocado toast. Mash \u00bd an avocado in a small bowl until it\u2019s mostly smooth (a few chunks are okay). Brush some olive oil onto 2 slices of sourdough bread and set them on a cooking sheet. Place the sheet in a 350\u00b0 F (177\u00b0 C) oven and toast for 5 minutes. Divide the avocado between the 2 slices of bread and top with the smoked salmon and a dollop of sour cream. Making Smoked Salmon Appetizers Top sliced cucumber with smoked salmon and brie cheese. Cut \u00bd of a wheel of brie cheese into chunks and layer them into the bottom of oven-proof skillet. Bake the skillet at 375\u00b0 F (191\u00b0 C) for 10 to 12 minutes until the cheese is bubbly. Add 1 tablespoon (14.8 ml) (0.5 ounces) capers, \u00bc cup (2 ounces) finely diced scallions, and 1 minced clove of garlic to the cheese and mix it well. Then bake it for another 2 to 3 minutes. Slice 3 cucumbers into 8 pieces each. Top each slice with a spoonful of cheese mixture and top with a small slice of salmon. Add smoked salmon to a baked potato. Slice 2 baked potatoes down the middle. Fill each potato with 1 full slice of smoked salmon, 2 spoonfuls of tomatoes, and a dollop of sour cream. Season with salt and pepper if you like. Top crusty bread with salmon. Tear a loaf of warm crusty bread into chunks. Drape thin slices of smoked salmon, slightly bigger than the chunk of bread, over each chunk. Then top with a dab of sour cream and a pinch of black pepper. Make rye and salmon squares. Cut rye bread slices into 2 inch (5 cm) squares. Spoon \u00bd teaspoon of horseradish onto each square, and then top with a thin slice of salmon. Garnish with dill. Serve simple smoked salmon. Cut each slice of smoke salmon into 1-inch (2.5 cm) strips. Squeeze fresh lemon juice over each strip and then add black pepper to taste. Roll each strip of salmon up and then spear it with a toothpick. Making Smoked Salmon Entrees Toss smoked salmon with pasta. Cut 2 slices of smoked salmon into small, bite-size pieces. Boil your favorite pasta and then drain. Toss the pasta with the salmon, fresh herbs, lemon juice, and a dollop of cr\u00e8me fraiche. Add salmon to your favorite salad. Fill a bowl with spinach or your favorite greens. Add bite-size pieces of smoked salmon, fresh peas, and thin slices of red onion to the salad. Add 2 teaspoons of your favorite dressing and toss the salad. Make smoked salmon cakes. Peel and dice 2 medium potatoes. Bring them to boil in a pot of water. Lower the heat and simmer until the potatoes are soft. When the potatoes are cool, add \u00bd cup (4 ounces) chopped smoked salmon, 2 tablespoons (29.6 ml) (1 ounce) of mayonnaise, and \u00bd teaspoon lemon juice to them and mix with a fork. Form the mixture into 3-inch (7.5 cm) patties. Dip each patty in a whisked egg, then in panko bread crumbs. Bake the cakes for 8 minutes in a warm skillet with 2 tablespoons (29.6 ml) (1 ounce) of oil in the bottom, flipping halfway through. Storing Smoked Salmon Keep the salmon in the original packaging. If you\u2019re not going to use the salmon right away, keep it in the original packaging. It should come vacuum-sealed, which will keep the fish fresher longer. Wrap opened salmon tightly in plastic. If you do open the package to use some salmon, wrap the remainder tightly in plastic wrap. Make sure it\u2019s wrapped tightly enough to prevent air from getting in. If air does get in and the edges get dry and flaky, just cut that part away with a sharp knife. Refrigerate unopened salmon for up to 2 to 3 weeks. If you\u2019ve already opened the salmon, it should stay fresh in your fridge for a week. Freeze the salmon for up to 3 months. As long as you keep your smoked salmon in its original packaging, you can keep it in the freezer for up to 3 months. If you open the salmon and want to freeze part of it, put the remainder in a freezer-proof bag.",
  "tyn_model":[
    "smoked salmon",
    "salmon",
    "scrambled eggs",
    "sour cream",
    "potatoes",
    "salt and pepper",
    "avocado",
    "brie cheese",
    "skillet",
    "black pepper",
    "lemon",
    "pasta",
    "bagel",
    "scrambled egg",
    "eggs benedict",
    "english muffin",
    "poached egg",
    "hollandaise sauce",
    "eggs",
    "avocado toast",
    "small bowl",
    "olive oil",
    "sourdough bread",
    "cooking sheet",
    "cucumber",
    "oven-proof skillet",
    "capers",
    "scallions",
    "garlic",
    "cucumbers",
    "cheese",
    "baked potato",
    "baked potatoes",
    "tomatoes",
    "rye",
    "rye bread",
    "horseradish",
    "dill",
    "smoke salmon",
    "fresh herbs",
    "cr\u00e8me fraiche",
    "bowl",
    "spinach",
    "fresh peas",
    "red onion",
    "pot",
    "water",
    "mayonnaise",
    "lemon juice",
    "fork",
    "whisked egg",
    "panko bread crumbs",
    "oil",
    "plastic",
    "plastic wrap",
    "sharp knife",
    "fridge",
    "freezer",
    "freezer-proof bag"
  ],
  "tyn_section":[

  ]
}