{
  "title":"How to Tweak an Old Tomb Raider Game to Work on a New Windows Machine (Xp, Vista, 7 Etc.)",
  "url":"https://www.wikihow.com/Tweak-an-Old-Tomb-Raider-Game-to-Work-on-a-New-Windows-Machine-(Xp,-Vista,-7-Etc.)",
  "category_hierarchy":[
    "Hobbies and Crafts",
    "Games",
    "Video Games",
    "Multi Platform Games",
    "Tomb Raider Video Games"
  ],
  "methods":[
    {
      "name":"Control Panel Method (recommended)",
      "steps":[
        {
          "headline":"Put your old Tomb Raider disk in, if you haven't done so.",
          "description":"Look for the disc driver, and press \"Eject\", and then put the disc in, and close it up, it should load in 30 seconds and come up."
        },
        {
          "headline":"Ignore the screen window that comes up with buttons, This is the menu of the game, the \"Play\" button is grayed out, and only you can install.",
          "description":"But close the screen window for now..."
        },
        {
          "headline":"Click on the Start Button, its on the left bottom corner of your desktop, and its green.",
          "description":""
        },
        {
          "headline":"Do not click All Programs, because Control Panel is easier to be seen on the start menu than all programs.",
          "description":"And look for the logo and the words \"Control Panel\", when you see it, click it."
        },
        {
          "headline":"Go to Add or Remove Programs, its in the Control Panel menu.",
          "description":""
        },
        {
          "headline":"Click the button \"Add Programs\"",
          "description":""
        },
        {
          "headline":"Click \"CD or Floppy\"",
          "description":""
        },
        {
          "headline":"Click \"Next\" once the screen appears.",
          "description":""
        },
        {
          "headline":"This maybe the tricky parts for beginners, do not click \"OK\" with D:\\Setup.exe, and backspace the words \"Setup.exe\", and then, add the game execution file, like for an example, if you want to play Tomb Raider 3, you must put \"D:\\TOMB3.EXE\", or, if you are wanting to play Tomb Raider 4, put \"D:\\tomb4.exe\", and then click OK",
          "description":""
        },
        {
          "headline":"Enjoy!",
          "description":""
        }
      ]
    },
    {
      "name":"Safe Mode Method",
      "steps":[
        {
          "headline":"If you try to install an old Tomb Raider game and is starting the install wizard but it hangs up and refuses, use CTRL+ALT+DEL to open up Task Manager",
          "description":""
        },
        {
          "headline":"Go to the Processes tab, and look for the Setup.exe process, and end that process, and I'm sure that it won't damage your computer if you end it.",
          "description":""
        },
        {
          "headline":"Then, go to Start, and click \"Shut Down\" button, and click \"Restart\"",
          "description":""
        },
        {
          "headline":"Press F8 once the startup screens appear, quickly.",
          "description":"And then, use the arrows key and select with the enter key, \"Safe Mode\", so do the regular safe mode, not the others Safe Modes."
        },
        {
          "headline":"Once your desktop is now finishing loading, go to Start and click \"My Computer\", and then click on the Tomb Raider game icon, and then go ahead and install.",
          "description":""
        },
        {
          "headline":"After installing it, its not over yet...",
          "description":""
        },
        {
          "headline":"Find the exe file of the Tomb Raider game, and right click on the exe file, and then scroll to Properties and click.",
          "description":""
        },
        {
          "headline":"Go to the Compatibility tab, and then go ahead and choose an old operating system, like for an example, if you are going to play Tomb Raider or Tomb Raider II, you must go under \"Windows 95\", if you are playing Tomb Raider III or Tomb Raider 4, it must be under \"Windows 98\".",
          "description":""
        },
        {
          "headline":"Click on the game icon, and hope you enjoy the fun of Tomb Raider.",
          "description":""
        }
      ]
    },
    {
      "name":"Patch method",
      "steps":[
        {
          "headline":"Search in Google \"Tomb Raider for Windows XP, Vista, 7 patches\"",
          "description":""
        },
        {
          "headline":"Find the search result you are looking for",
          "description":""
        },
        {
          "headline":"Download it",
          "description":""
        },
        {
          "headline":"Click on the game icon",
          "description":""
        },
        {
          "headline":"Enjoy!",
          "description":"{\"smallUrl\":\"https:\\/\\/www.wikihow.com\\/images\\/thumb\\/e\\/e8\\/Tweak-an-Old-Tomb-Raider-Game-to-Work-on-a-New-Windows-Machine-%28Xp%2C-Vista%2C-7-Etc.%29-Step-24-Version-2.jpg\\/v4-460px-Tweak-an-Old-Tomb-Raider-Game-to-Work-on-a-New-Windows-Machine-%28Xp%2C-Vista%2C-7-Etc.%29-Step-24-Version-2.jpg\",\"bigUrl\":\"\\/images\\/thumb\\/e\\/e8\\/Tweak-an-Old-Tomb-Raider-Game-to-Work-on-a-New-Windows-Machine-%28Xp%2C-Vista%2C-7-Etc.%29-Step-24-Version-2.jpg\\/aid947323-v4-728px-Tweak-an-Old-Tomb-Raider-Game-to-Work-on-a-New-Windows-Machine-%28Xp%2C-Vista%2C-7-Etc.%29-Step-24-Version-2.jpg\",\"smallWidth\":460,\"smallHeight\":345,\"bigWidth\":\"728\",\"bigHeight\":\"546\",\"licensing\":\"<div class=\\\"mw-parser-output\\\"><p>License: <a rel=\\\"nofollow\\\" class=\\\"external text\\\" href=\\\"https:\\/\\/en.wikipedia.org\\/wiki\\/Fair_use\\\">Fair Use<\\/a> (screenshot)<br>\\n<\\/p><\\/div>\"}"
        }
      ]
    }
  ],
  "text":" Control Panel Method (recommended) Put your old Tomb Raider disk in, if you haven't done so. Look for the disc driver, and press \"Eject\", and then put the disc in, and close it up, it should load in 30 seconds and come up. Ignore the screen window that comes up with buttons, This is the menu of the game, the \"Play\" button is grayed out, and only you can install. But close the screen window for now... Click on the Start Button, its on the left bottom corner of your desktop, and its green.  Do not click All Programs, because Control Panel is easier to be seen on the start menu than all programs. And look for the logo and the words \"Control Panel\", when you see it, click it. Go to Add or Remove Programs, its in the Control Panel menu.  Click the button \"Add Programs\"  Click \"CD or Floppy\"  Click \"Next\" once the screen appears.  This maybe the tricky parts for beginners, do not click \"OK\" with D:\\Setup.exe, and backspace the words \"Setup.exe\", and then, add the game execution file, like for an example, if you want to play Tomb Raider 3, you must put \"D:\\TOMB3.EXE\", or, if you are wanting to play Tomb Raider 4, put \"D:\\tomb4.exe\", and then click OK  Enjoy!  Safe Mode Method If you try to install an old Tomb Raider game and is starting the install wizard but it hangs up and refuses, use CTRL+ALT+DEL to open up Task Manager  Go to the Processes tab, and look for the Setup.exe process, and end that process, and I'm sure that it won't damage your computer if you end it.  Then, go to Start, and click \"Shut Down\" button, and click \"Restart\"  Press F8 once the startup screens appear, quickly. And then, use the arrows key and select with the enter key, \"Safe Mode\", so do the regular safe mode, not the others Safe Modes. Once your desktop is now finishing loading, go to Start and click \"My Computer\", and then click on the Tomb Raider game icon, and then go ahead and install.  After installing it, its not over yet...  Find the exe file of the Tomb Raider game, and right click on the exe file, and then scroll to Properties and click.  Go to the Compatibility tab, and then go ahead and choose an old operating system, like for an example, if you are going to play Tomb Raider or Tomb Raider II, you must go under \"Windows 95\", if you are playing Tomb Raider III or Tomb Raider 4, it must be under \"Windows 98\".  Click on the game icon, and hope you enjoy the fun of Tomb Raider.  Patch method Search in Google \"Tomb Raider for Windows XP, Vista, 7 patches\"  Find the search result you are looking for  Download it  Click on the game icon  Enjoy! {\"smallUrl\":\"https:\\/\\/www.wikihow.com\\/images\\/thumb\\/e\\/e8\\/Tweak-an-Old-Tomb-Raider-Game-to-Work-on-a-New-Windows-Machine-%28Xp%2C-Vista%2C-7-Etc.%29-Step-24-Version-2.jpg\\/v4-460px-Tweak-an-Old-Tomb-Raider-Game-to-Work-on-a-New-Windows-Machine-%28Xp%2C-Vista%2C-7-Etc.%29-Step-24-Version-2.jpg\",\"bigUrl\":\"\\/images\\/thumb\\/e\\/e8\\/Tweak-an-Old-Tomb-Raider-Game-to-Work-on-a-New-Windows-Machine-%28Xp%2C-Vista%2C-7-Etc.%29-Step-24-Version-2.jpg\\/aid947323-v4-728px-Tweak-an-Old-Tomb-Raider-Game-to-Work-on-a-New-Windows-Machine-%28Xp%2C-Vista%2C-7-Etc.%29-Step-24-Version-2.jpg\",\"smallWidth\":460,\"smallHeight\":345,\"bigWidth\":\"728\",\"bigHeight\":\"546\",\"licensing\":\"<div class=\\\"mw-parser-output\\\"><p>License: <a rel=\\\"nofollow\\\" class=\\\"external text\\\" href=\\\"https:\\/\\/en.wikipedia.org\\/wiki\\/Fair_use\\\">Fair Use<\\/a> (screenshot)<br>\\n<\\/p><\\/div>\"}",
  "tyn_model":[
    "control panel",
    "tomb raider game",
    "tomb raider",
    "cd",
    "task manager",
    "computer",
    "operating system",
    "parser"
  ],
  "tyn_section":[

  ]
}