{
  "title":"How to Care for a Fig Tree",
  "url":"https://www.wikihow.com/Care-for-a-Fig-Tree",
  "category_hierarchy":[
    "Home and Garden",
    "Gardening",
    "Planting and Growing",
    "Growing Trees and Shrubs"
  ],
  "methods":[
    {
      "name":"Planting Your Fig Tree",
      "steps":[
        {
          "headline":"Choose a sunny spot to plant your fig tree.",
          "description":"Fig trees need a lot of direct sunlight to thrive. Pick any spot in your yard that gets year-round sunlight. Make sure there aren't any nearby trees or structures that will block the sun from reaching your fig tree."
        },
        {
          "headline":"Plant your fig tree in a large plastic container if you live in a cold climate.",
          "description":"If temperatures drop below 10 \u00b0F (\u221212 \u00b0C), fig trees buried in the ground may struggle to survive. Planting your fig tree in a plastic container will help shelter it from the cold. Use a large plastic patio container relative to the size of your fig tree. If you do plant your fig tree in a plastic container, make sure you have somewhere sunny to put it."
        },
        {
          "headline":"Plant your fig tree in a hole the size of the container it came in.",
          "description":"Dig the hole so it's as round and deep as the container. After you dig the hole, remove the fig tree from the container and set the roots into the hole. Then, fill the hole in with soil. Pack the soil down with your hands."
        },
        {
          "headline":"Plant your fig tree in well-draining soil.",
          "description":"Figs are hardy trees that can grow in most kinds of soil, as long as the soil has good drainage. Look for soil that contains sand, and avoid soil with a lot of clay in it."
        },
        {
          "headline":"Mulch the soil around your fig tree with 3 inches (7.6 cm) of compost.",
          "description":"The compost will help the soil around your fig tree retain water. Do this whether your fig tree is planted in the ground or planted in a container."
        },
        {
          "headline":"Repot your fig tree every 3-5 years if it's planted in a container.",
          "description":"Repot your fig tree during the winter. To repot your tree, remove about one-quarter of the soil in the pot. Then, pull your fig tree up out of the pot and cut away the large roots on the outside of the clump of roots. Place your fig tree back in the same pot and fill it in with soil. Pack the soil down with your hands."
        }
      ]
    },
    {
      "name":"Watering Your Fig Tree",
      "steps":[
        {
          "headline":"Water your fig tree when the top 1 inch (2.5 cm) of soil is dry.",
          "description":"Fig tree roots grow close to the surface of the soil, so it's important that you water the soil around your fig tree whenever it looks dry. Check the soil at least once a week to see if your fig tree needs more water."
        },
        {
          "headline":"Give your fig tree about 1 gallon (3.8 L) of water with each watering.",
          "description":"Completely soak the soil around your fig tree. If you're not sure what 1 gallon (3.8 L) of water looks like, get a 1 gallon (3.8 L) bucket and fill it up with water. Then, pour the bucket of water over the soil around your fig tree."
        },
        {
          "headline":"Water your fig tree more if it's wilting or turning yellow.",
          "description":"These are signs that your fig tree isn't getting enough water. If your fig tree exhibits these symptoms, increase the number of times you water it each week and see if that stops the wilting and discoloration."
        }
      ]
    },
    {
      "name":"Fertilizing Your Fig Tree",
      "steps":[
        {
          "headline":"Fertilize your tree weekly with liquid fertilizer while fruit is growing on it.",
          "description":"When you notice the fruit, apply a liquid fertilizer to the soil surrounding your fig tree. Use a liquid fertilizer that's high in potassium. Once you've harvested all the fruit on your fig tree, stop fertilizing it weekly. You can use tomato plant fertilizer to fertilize your fig tree. EXPERT TIP\t\t\t\t\t\t\t\t\t\t\t\t\t\t\t\t\t\t\t\t\t\t\t\t\t\t\t\t\t\t\tMaggie Moran\t\t\t\t\t\t\t\t\t\t\t\t\t\t\t\tHorticulturist\t\t\t\t\t\t\t\tMaggie Moran is a Professional Gardener in Pennsylvania. Maggie Moran\t\t\tHorticulturist\t\t\t\tOur Expert Agrees: An 8-8-8 or a 10-10-10 fertilizer blend is optimal for a fig tree. These have optimum levels of nitrogen, phosphate, and potash for healthy plant growth."
        },
        {
          "headline":"Fertilize your tree weekly during spring and summer if it's in a container.",
          "description":"Container-grown fig trees need more fertilizer to keep the limited supply of soil healthy. Rotate each week between a liquid fertilizer that's high in potassium and a general fertilizer. Add the fertilizer directly to the soil in the container."
        },
        {
          "headline":"Avoid fertilizing your fig tree more than necessary.",
          "description":"Giving your fig tree too much fertilizer can cause excessive leaf growth. The extra growth will take energy away from the fruit on the tree, which can negatively impact your harvest. Only fertilize your fig tree once you notice fruit growing on it, or throughout the spring and summer if it's planted in a container."
        }
      ]
    },
    {
      "name":"Harvesting Your Fig Tree",
      "steps":[
        {
          "headline":"Wait until the figs on your fig tree are ripe before you harvest them.",
          "description":"You'll know they're ripe when they're drooping down from the branches they're growing off of. If a fig is still perpendicular to the branch it's growing off of, it's not ripe. Keep in mind that not all of the figs on your fig tree will ripen at the same time. The figs on your fig tree should be ripe around late summer or early fall."
        },
        {
          "headline":"Use your hands to pick the ripened figs off your fig tree.",
          "description":"Search the branches of your fig tree for a ripened fig. When you find one, grab it by the thin stem connecting the fig to the branch. Then, gently pull the stem away from the branch until it breaks off. Carry a basket with you as you're harvesting your fig tree so you have something to put the figs in as you pick them off the tree."
        },
        {
          "headline":"Put bird netting over your fig tree if birds are eating your figs.",
          "description":"Wrap the netting over the branches of your fig tree and tie it off around the trunk. When you're ready to harvest some of your figs, untie the netting and lift it off the tree. When you're finished harvesting, put the netting back over your fig tree. You can find bird netting online or at your local gardening center."
        }
      ]
    },
    {
      "name":"Preventing and Treating Common Diseases",
      "steps":[
        {
          "headline":"Spray your fig tree with neem oil to get rid of fig rust.",
          "description":"Fig rust is a fungus that causes the leaves on fig trees to turn yellow and fall off. If you see signs of fig rust on your tree, spray neem oil over the roots and leaves once a week until the leaves stop yellowing and dropping."
        },
        {
          "headline":"Remove any leaves that show signs of having leaf blight.",
          "description":"Leaf blight is a fungus that affects fig trees. Symptoms of the fungus include moist yellow spots, small holes in the leaves, and webs of fungus underneath the leaves. If you see signs of leaf blight, remove the infected leaves and dispose of them in the trash so the fungus doesn't spread."
        },
        {
          "headline":"Cut off branches that have a pink and white coating on them.",
          "description":"This could be a sign that your fig tree is infected with a fungus called pink blight. It's important that you cut off infected branches so the fungus doesn't spread and kill your fig tree.You can help prevent pink blight by removing a third of the smaller branches on your tree so it gets better air circulation."
        }
      ]
    }
  ],
  "text":" Planting Your Fig Tree Choose a sunny spot to plant your fig tree. Fig trees need a lot of direct sunlight to thrive. Pick any spot in your yard that gets year-round sunlight. Make sure there aren't any nearby trees or structures that will block the sun from reaching your fig tree. Plant your fig tree in a large plastic container if you live in a cold climate. If temperatures drop below 10 \u00b0F (\u221212 \u00b0C), fig trees buried in the ground may struggle to survive. Planting your fig tree in a plastic container will help shelter it from the cold. Use a large plastic patio container relative to the size of your fig tree. If you do plant your fig tree in a plastic container, make sure you have somewhere sunny to put it. Plant your fig tree in a hole the size of the container it came in. Dig the hole so it's as round and deep as the container. After you dig the hole, remove the fig tree from the container and set the roots into the hole. Then, fill the hole in with soil. Pack the soil down with your hands. Plant your fig tree in well-draining soil. Figs are hardy trees that can grow in most kinds of soil, as long as the soil has good drainage. Look for soil that contains sand, and avoid soil with a lot of clay in it. Mulch the soil around your fig tree with 3 inches (7.6 cm) of compost. The compost will help the soil around your fig tree retain water. Do this whether your fig tree is planted in the ground or planted in a container. Repot your fig tree every 3-5 years if it's planted in a container. Repot your fig tree during the winter. To repot your tree, remove about one-quarter of the soil in the pot. Then, pull your fig tree up out of the pot and cut away the large roots on the outside of the clump of roots. Place your fig tree back in the same pot and fill it in with soil. Pack the soil down with your hands. Watering Your Fig Tree Water your fig tree when the top 1 inch (2.5 cm) of soil is dry. Fig tree roots grow close to the surface of the soil, so it's important that you water the soil around your fig tree whenever it looks dry. Check the soil at least once a week to see if your fig tree needs more water. Give your fig tree about 1 gallon (3.8 L) of water with each watering. Completely soak the soil around your fig tree. If you're not sure what 1 gallon (3.8 L) of water looks like, get a 1 gallon (3.8 L) bucket and fill it up with water. Then, pour the bucket of water over the soil around your fig tree. Water your fig tree more if it's wilting or turning yellow. These are signs that your fig tree isn't getting enough water. If your fig tree exhibits these symptoms, increase the number of times you water it each week and see if that stops the wilting and discoloration. Fertilizing Your Fig Tree Fertilize your tree weekly with liquid fertilizer while fruit is growing on it. When you notice the fruit, apply a liquid fertilizer to the soil surrounding your fig tree. Use a liquid fertilizer that's high in potassium. Once you've harvested all the fruit on your fig tree, stop fertilizing it weekly. You can use tomato plant fertilizer to fertilize your fig tree. EXPERT TIP\t\t\t\t\t\t\t\t\t\t\t\t\t\t\t\t\t\t\t\t\t\t\t\t\t\t\t\t\t\t\tMaggie Moran\t\t\t\t\t\t\t\t\t\t\t\t\t\t\t\tHorticulturist\t\t\t\t\t\t\t\tMaggie Moran is a Professional Gardener in Pennsylvania. Maggie Moran\t\t\tHorticulturist\t\t\t\tOur Expert Agrees: An 8-8-8 or a 10-10-10 fertilizer blend is optimal for a fig tree. These have optimum levels of nitrogen, phosphate, and potash for healthy plant growth. Fertilize your tree weekly during spring and summer if it's in a container. Container-grown fig trees need more fertilizer to keep the limited supply of soil healthy. Rotate each week between a liquid fertilizer that's high in potassium and a general fertilizer. Add the fertilizer directly to the soil in the container. Avoid fertilizing your fig tree more than necessary. Giving your fig tree too much fertilizer can cause excessive leaf growth. The extra growth will take energy away from the fruit on the tree, which can negatively impact your harvest. Only fertilize your fig tree once you notice fruit growing on it, or throughout the spring and summer if it's planted in a container. Harvesting Your Fig Tree Wait until the figs on your fig tree are ripe before you harvest them. You'll know they're ripe when they're drooping down from the branches they're growing off of. If a fig is still perpendicular to the branch it's growing off of, it's not ripe. Keep in mind that not all of the figs on your fig tree will ripen at the same time. The figs on your fig tree should be ripe around late summer or early fall. Use your hands to pick the ripened figs off your fig tree. Search the branches of your fig tree for a ripened fig. When you find one, grab it by the thin stem connecting the fig to the branch. Then, gently pull the stem away from the branch until it breaks off. Carry a basket with you as you're harvesting your fig tree so you have something to put the figs in as you pick them off the tree. Put bird netting over your fig tree if birds are eating your figs. Wrap the netting over the branches of your fig tree and tie it off around the trunk. When you're ready to harvest some of your figs, untie the netting and lift it off the tree. When you're finished harvesting, put the netting back over your fig tree. You can find bird netting online or at your local gardening center. Preventing and Treating Common Diseases Spray your fig tree with neem oil to get rid of fig rust. Fig rust is a fungus that causes the leaves on fig trees to turn yellow and fall off. If you see signs of fig rust on your tree, spray neem oil over the roots and leaves once a week until the leaves stop yellowing and dropping. Remove any leaves that show signs of having leaf blight. Leaf blight is a fungus that affects fig trees. Symptoms of the fungus include moist yellow spots, small holes in the leaves, and webs of fungus underneath the leaves. If you see signs of leaf blight, remove the infected leaves and dispose of them in the trash so the fungus doesn't spread. Cut off branches that have a pink and white coating on them. This could be a sign that your fig tree is infected with a fungus called pink blight. It's important that you cut off infected branches so the fungus doesn't spread and kill your fig tree.You can help prevent pink blight by removing a third of the smaller branches on your tree so it gets better air circulation.",
  "tyn_model":[
    "water",
    "fertilizer",
    "soil",
    "pot",
    "liquid fertilizer",
    "container",
    "compost",
    "bucket",
    "bird netting",
    "neem oil",
    "fungus",
    "large plastic container",
    "tomato plant fertilizer",
    "gardener",
    "nitrogen",
    "phosphate",
    "potash",
    "fig tree",
    "basket",
    "leaf blight"
  ],
  "tyn_section":[

  ]
}