{
  "title":"How to Use Pesto",
  "url":"https://www.wikihow.com/Use-Pesto",
  "category_hierarchy":[
    "Food and Entertaining",
    "Herbs and Spices",
    "Pesto"
  ],
  "methods":[
    {
      "name":"Blending Pesto with Breakfast",
      "steps":[
        {
          "headline":"Top scrambled eggs with a spoonful of pesto.",
          "description":"Instead of salt and pepper, season your scrambled eggs with a touch of pesto and cheese for a unique, but flavorful breakfast. If the pesto is too thick to drizzle, add a tablespoon of olive oil or water to make it thinner. Add the pesto to your eggs while they\u2019re still hot to maximize the flavor."
        },
        {
          "headline":"Mix pesto into an omelette or frittata.",
          "description":"For a stronger pesto flavor, add in a spoonful of pesto to the raw eggs before whisking them. Blend until the pesto has completely combined with the rest of the mixture, with no chunks or dollops. Then cook your omelette or frittata as normal. For only a light hint of pesto, pour a small amount of pesto on top of your omelette before serving."
        },
        {
          "headline":"Spread pesto over your morning toast.",
          "description":"Pesto can be a tasty (and healthier) alternative to butter or jelly on your toast. Just scoop out a small dollop of pesto with your butter knife and smear it onto your slice of morning toast. You can do the same thing with a bagel, swapping out the cream cheese for pesto."
        }
      ]
    },
    {
      "name":"Incorporating Pesto into Lunch and Dinner",
      "steps":[
        {
          "headline":"Add pesto to freshly cooked pasta.",
          "description":"Cook a fresh bowl of pasta (preferably al dente) and drain it of any water. Do not allow the pasta to cool. Instead, move it to a clean bowl and add a generous amount (around 0.25 cups (59 ml)) of pesto, then toss the pasta until the pesto is thoroughly coating the pasta. You should notice the pasta taking on a green color once the pesto is mixed in. Serve and eat immediately."
        },
        {
          "headline":"Mix pesto into a bowl of soup.",
          "description":"Tomato soup, potato soup, and many other vegetable soups are prime dishes to enhance with pesto. Scoop up a spoonful of pesto and stir it into a bowl of soup, or pour a tablespoon of freshly made pesto onto your soup as a topping. Alternatively, you can add pesto to your soup base to infuse pesto flavor into every bite."
        },
        {
          "headline":"Spread diluted pesto over cooked chicken or steak for a delicious sauce.",
          "description":"Add a tablespoon or 2 of water to the pesto to dilute it. Slice and plate your chicken or steak however you\u2019d like. Then pour the pesto over the meat before serving. The pesto will create a refreshing sauce that enhances the flavor of the meat. Use pesto as a topping for freshly cooked meats for extra flavor."
        },
        {
          "headline":"Use pesto as a vegetable topping or dressing.",
          "description":"Pesto mixes nicely with all sorts of vegetables, from potatoes to broccoli. Dump a generous spoonful into freshly steamed or roasted vegetables as a healthy alternative to butter. The pesto will still keep your vegetables flavorful, but in a more nutritious way."
        },
        {
          "headline":"Spread a dollop of pesto onto your sandwich.",
          "description":"Pesto adds a zesty kick to even the plainest of sandwiches. You can spread pesto directly onto your sandwich bread, or combine it with another condiment, such as mayonnaise. Add your favorite fillings (such as ham or prosciutto) and put your sandwich together."
        },
        {
          "headline":"Replace tomato sauce with pesto on your pizza.",
          "description":"Pesto is naturally stronger in flavor, so use only a couple of spoonfuls to start out with and adjust as needed. Spread it out evenly over raw pizza dough, then add the rest of your toppings. Parmesan cheese and chicken or sliced tomatoes make excellent toppings for pesto pizza. Bake your pizza, then let it cool before you slice it and enjoy!"
        }
      ]
    },
    {
      "name":"Using Pesto in Appetizers and Snacks",
      "steps":[
        {
          "headline":"Blend pesto into bread dough before baking.",
          "description":"If you prefer making your own bread at home, incorporating 0.5 cups (120 ml) of pesto into your homemade bread dough can add a wonderful touch to its flavor. Simply add in the pesto alongside the dry ingredients of your bread dough before letting the dough rest and rise. Pesto-infused bread makes a wonderful side item for pasta and comfort food dinners!"
        },
        {
          "headline":"Combine pesto with your favorite dipping sauce.",
          "description":"Pesto can add a noticeable flavor boost to guacamole, sour cream, and hummus. Simply stir a spoonful into your readymade dip and enjoy with crackers or mini toasts!"
        },
        {
          "headline":"Drop a spoonful of pesto over unbuttered popcorn.",
          "description":"Pesto can not only give your popcorn extra flavor, but it also supplies an additional healthy fat to your diet. Measure out 0.25 cups (59 ml) of pesto and add it to a bag or bowl of popcorn, alongside a generous serving of Parmesan cheese. Shake up the popcorn and enjoy it while it\u2019s fresh!"
        }
      ]
    }
  ],
  "text":" Blending Pesto with Breakfast Top scrambled eggs with a spoonful of pesto. Instead of salt and pepper, season your scrambled eggs with a touch of pesto and cheese for a unique, but flavorful breakfast. If the pesto is too thick to drizzle, add a tablespoon of olive oil or water to make it thinner. Add the pesto to your eggs while they\u2019re still hot to maximize the flavor. Mix pesto into an omelette or frittata. For a stronger pesto flavor, add in a spoonful of pesto to the raw eggs before whisking them. Blend until the pesto has completely combined with the rest of the mixture, with no chunks or dollops. Then cook your omelette or frittata as normal. For only a light hint of pesto, pour a small amount of pesto on top of your omelette before serving. Spread pesto over your morning toast. Pesto can be a tasty (and healthier) alternative to butter or jelly on your toast. Just scoop out a small dollop of pesto with your butter knife and smear it onto your slice of morning toast. You can do the same thing with a bagel, swapping out the cream cheese for pesto. Incorporating Pesto into Lunch and Dinner Add pesto to freshly cooked pasta. Cook a fresh bowl of pasta (preferably al dente) and drain it of any water. Do not allow the pasta to cool. Instead, move it to a clean bowl and add a generous amount (around 0.25 cups (59 ml)) of pesto, then toss the pasta until the pesto is thoroughly coating the pasta. You should notice the pasta taking on a green color once the pesto is mixed in. Serve and eat immediately. Mix pesto into a bowl of soup. Tomato soup, potato soup, and many other vegetable soups are prime dishes to enhance with pesto. Scoop up a spoonful of pesto and stir it into a bowl of soup, or pour a tablespoon of freshly made pesto onto your soup as a topping. Alternatively, you can add pesto to your soup base to infuse pesto flavor into every bite. Spread diluted pesto over cooked chicken or steak for a delicious sauce. Add a tablespoon or 2 of water to the pesto to dilute it. Slice and plate your chicken or steak however you\u2019d like. Then pour the pesto over the meat before serving. The pesto will create a refreshing sauce that enhances the flavor of the meat. Use pesto as a topping for freshly cooked meats for extra flavor. Use pesto as a vegetable topping or dressing. Pesto mixes nicely with all sorts of vegetables, from potatoes to broccoli. Dump a generous spoonful into freshly steamed or roasted vegetables as a healthy alternative to butter. The pesto will still keep your vegetables flavorful, but in a more nutritious way. Spread a dollop of pesto onto your sandwich. Pesto adds a zesty kick to even the plainest of sandwiches. You can spread pesto directly onto your sandwich bread, or combine it with another condiment, such as mayonnaise. Add your favorite fillings (such as ham or prosciutto) and put your sandwich together. Replace tomato sauce with pesto on your pizza. Pesto is naturally stronger in flavor, so use only a couple of spoonfuls to start out with and adjust as needed. Spread it out evenly over raw pizza dough, then add the rest of your toppings. Parmesan cheese and chicken or sliced tomatoes make excellent toppings for pesto pizza. Bake your pizza, then let it cool before you slice it and enjoy! Using Pesto in Appetizers and Snacks Blend pesto into bread dough before baking. If you prefer making your own bread at home, incorporating 0.5 cups (120 ml) of pesto into your homemade bread dough can add a wonderful touch to its flavor. Simply add in the pesto alongside the dry ingredients of your bread dough before letting the dough rest and rise. Pesto-infused bread makes a wonderful side item for pasta and comfort food dinners! Combine pesto with your favorite dipping sauce. Pesto can add a noticeable flavor boost to guacamole, sour cream, and hummus. Simply stir a spoonful into your readymade dip and enjoy with crackers or mini toasts! Drop a spoonful of pesto over unbuttered popcorn. Pesto can not only give your popcorn extra flavor, but it also supplies an additional healthy fat to your diet. Measure out 0.25 cups (59 ml) of pesto and add it to a bag or bowl of popcorn, alongside a generous serving of Parmesan cheese. Shake up the popcorn and enjoy it while it\u2019s fresh!",
  "tyn_model":[
    "pesto",
    "eggs",
    "water",
    "popcorn",
    "butter",
    "salt and pepper",
    "scrambled eggs",
    "cheese",
    "olive oil",
    "jelly",
    "butter knife",
    "bagel",
    "cream cheese",
    "pasta",
    "tomato soup",
    "potato soup",
    "mayonnaise",
    "tomato sauce",
    "pizza dough",
    "tomatoes",
    "pesto pizza",
    "bread dough",
    "guacamole",
    "sour cream",
    "hummus",
    "parmesan cheese"
  ],
  "tyn_section":[

  ]
}