{
  "title":"How to Pick Kale",
  "url":"https://www.wikihow.com/Pick-Kale",
  "category_hierarchy":[
    "Home and Garden",
    "Gardening",
    "Harvest and Storage"
  ],
  "parts":[
    {
      "name":"Harvesting Kale Leaves",
      "steps":[
        {
          "headline":"Wait about 70 days after planting to harvest.",
          "description":"In general, this is how long it takes kale plants to produce its first leaves that are ready to pick. Your plant should be around 8\u201310 inches (20\u201325 cm) high before you harvest its leaves. You can harvest baby kale leaves sooner, but be sure not to pick too many or the plant will have difficulty maturing properly."
        },
        {
          "headline":"Get pruning shears and a clean container.",
          "description":"Pruning shears make harvesting kale much easier. Purchase them at any gardening or home improvement store. Find a bucket, basket, or bag that you can place the leaves you pick in."
        },
        {
          "headline":"Cut the largest leaves off with your pruning shears.",
          "description":"The largest and oldest leaves on a kale plant are always near the bottom. Smaller and younger leaves are near the top. Hold the leaf you want to cut with 1 hand. Then use your other hand to cut the stem of that leaf with your shears. Cut the stem near its base to make sure you remove the entire leaf."
        },
        {
          "headline":"Discard any leaves that appear yellow or damaged.",
          "description":"Sometimes pests will eat parts of kale leaves, leaving small holes in them. Make sure you cut off all of these leaves, but keep them separate from the ones you want to use. Compost or throw away the damaged or yellow kale leaves."
        },
        {
          "headline":"Avoid cutting the root of the plant.",
          "description":"Kale plants can be harvested many times, so make sure you leave the plant intact. Only cut the stems of the leaves that you want to pick, and leave the root alone."
        },
        {
          "headline":"Return in 1 week and pick the new large leaves.",
          "description":"Kale needs to be harvested routinely. If you don\u2019t harvest for more than a week, the plant could be eaten by pests. Additionally, cutting the larger, older leaves helps the smaller, younger leaves grow. After about a week, there should now be more large leaves that  are ready to be picked. Again, only pick these and avoid picking the new, small leaves on the plant."
        }
      ]
    },
    {
      "name":"Storing Kale Leaves",
      "steps":[
        {
          "headline":"Wash all the leaves you picked.",
          "description":"Run the kale under cool water to remove any dirt or debris. Remove the stems now, if you don\u2019t plan to eat them. Don\u2019t use hot water or soak the leaves, as this could lead to wilting."
        },
        {
          "headline":"Let the leaves dry.",
          "description":"Pat them with a paper towel to absorb some of the water on them. Let them air dry on a clean surface for at least 10 minutes. Make sure they are completely dry before storing them. If you try to store them when they\u2019re wet, they will quickly become wilted and slimy."
        },
        {
          "headline":"Place the leaves in a resealable plastic bag.",
          "description":"Place a paper towel in the bag with the kale to help prevent the leaves from being harmed by moisture. Push on the bag to try to get as much air out of it as you can before you seal it. Then, seal the bag and place it in the vegetable drawer of your refrigerator. If you don\u2019t have a vegetable drawer, choose a low shelf in your refrigerator."
        },
        {
          "headline":"Use the leaves within 1-2 weeks.",
          "description":"The kale is good until it becomes yellow, wilted, or slimy. Mix the kale with some of your favorite vegetables to make a salad, or search online for creative recipes that feature kale."
        }
      ]
    }
  ],
  "text":" Harvesting Kale Leaves Wait about 70 days after planting to harvest. In general, this is how long it takes kale plants to produce its first leaves that are ready to pick. Your plant should be around 8\u201310 inches (20\u201325 cm) high before you harvest its leaves. You can harvest baby kale leaves sooner, but be sure not to pick too many or the plant will have difficulty maturing properly. Get pruning shears and a clean container. Pruning shears make harvesting kale much easier. Purchase them at any gardening or home improvement store. Find a bucket, basket, or bag that you can place the leaves you pick in. Cut the largest leaves off with your pruning shears. The largest and oldest leaves on a kale plant are always near the bottom. Smaller and younger leaves are near the top. Hold the leaf you want to cut with 1 hand. Then use your other hand to cut the stem of that leaf with your shears. Cut the stem near its base to make sure you remove the entire leaf. Discard any leaves that appear yellow or damaged. Sometimes pests will eat parts of kale leaves, leaving small holes in them. Make sure you cut off all of these leaves, but keep them separate from the ones you want to use. Compost or throw away the damaged or yellow kale leaves. Avoid cutting the root of the plant. Kale plants can be harvested many times, so make sure you leave the plant intact. Only cut the stems of the leaves that you want to pick, and leave the root alone. Return in 1 week and pick the new large leaves. Kale needs to be harvested routinely. If you don\u2019t harvest for more than a week, the plant could be eaten by pests. Additionally, cutting the larger, older leaves helps the smaller, younger leaves grow. After about a week, there should now be more large leaves that  are ready to be picked. Again, only pick these and avoid picking the new, small leaves on the plant. Storing Kale Leaves Wash all the leaves you picked. Run the kale under cool water to remove any dirt or debris. Remove the stems now, if you don\u2019t plan to eat them. Don\u2019t use hot water or soak the leaves, as this could lead to wilting. Let the leaves dry. Pat them with a paper towel to absorb some of the water on them. Let them air dry on a clean surface for at least 10 minutes. Make sure they are completely dry before storing them. If you try to store them when they\u2019re wet, they will quickly become wilted and slimy. Place the leaves in a resealable plastic bag. Place a paper towel in the bag with the kale to help prevent the leaves from being harmed by moisture. Push on the bag to try to get as much air out of it as you can before you seal it. Then, seal the bag and place it in the vegetable drawer of your refrigerator. If you don\u2019t have a vegetable drawer, choose a low shelf in your refrigerator. Use the leaves within 1-2 weeks. The kale is good until it becomes yellow, wilted, or slimy. Mix the kale with some of your favorite vegetables to make a salad, or search online for creative recipes that feature kale.",
  "tyn_model":[
    "kale",
    "pruning shears",
    "water",
    "paper towel",
    "vegetable drawer",
    "refrigerator",
    "container",
    "gardening or home improvement store",
    "bucket",
    "shears",
    "resealable plastic bag",
    "vegetables"
  ],
  "tyn_section":[

  ]
}