{
  "title":"How to Plant Bulbs in Pots",
  "url":"https://www.wikihow.com/Plant-Bulbs-in-Pots",
  "category_hierarchy":[
    "Home and Garden",
    "Gardening",
    "Planting and Growing"
  ],
  "parts":[
    {
      "name":"Choosing Pots and Soil",
      "steps":[
        {
          "headline":"Choose a pot with drainage holes.",
          "description":"Drainage holes are necessary to let any excess water out of the pot. If you water the bulbs and the excess water doesn't have anywhere to go, your plants could drown."
        },
        {
          "headline":"Make sure the pot is big enough to insulate the bulbs.",
          "description":"If you're planning on leaving your pot outside during the winter, you'll need to add enough soil to keep the bulbs warm. Look for a pot that's at least 24 in (61 cm) in diameter. This is true whether you're using indoor or outdoor bulbs."
        },
        {
          "headline":"Select a high-quality potting mix.",
          "description":"Regular gardening soil won't have the nutrients your bulbs need to thrive. Look for houseplant potting mix. If you like, you can also add fertilizer to the soil and mix it in to the soil. A granular 5-10-10 or 9-9-6 bulb formulation fertilizer is the best to use with your bulbs."
        },
        {
          "headline":"Pick a pot tall and wide enough to accommodate your bulb type.",
          "description":"Different types of bulb require different depths of planting. Give them at least 2 in (5.1 cm) of soil below them, and about 2 in (5.1 cm) of space above the top of the soil. For example, tulips and daffodils should be planted about 6 in (15 cm) deep. So your pot should be at least 10 in (25 cm) tall."
        }
      ]
    },
    {
      "name":"Potting Your Bulbs",
      "steps":[
        {
          "headline":"Plant your bulbs about 6 weeks before spring.",
          "description":"Depending on where you live, you'll have to pot your bulbs at a different time. You want your potted bulbs to begin to bloom around the same time as bulbs planted outdoors, usually in early spring. Planting your bulbs 6 weeks before their blooming time gives them enough time to grow. You may need to alter your schedule based on your growing region, as cold weather could damage or kill the plant. If the temperature drops, you may need to bring your plant back inside to protect it from the cold."
        },
        {
          "headline":"Fill your pot with potting mix.",
          "description":"Pour the potting mix directly from the bag into the pot. Fill the pot with at least 2 in (5.1 cm) of soil. If you're planting bulbs that require a shallower planting depth, fill the pot with about 4 in (10 cm). Tulips and daffodils should be planted in deeper soil. Bearded irises should be planted in shallow soil. EXPERT TIP\t\t\t\t\t\t\t\t\t\t\t\t\t\t\t\t\t\t\t\t\t\t\t\t\t\t\t\t\t\t\tMaggie Moran\t\t\t\t\t\t\t\t\t\t\t\t\t\t\t\tHorticulturist\t\t\t\t\t\t\t\tMaggie Moran is a Professional Gardener in Pennsylvania. Maggie Moran\t\t\tHorticulturist\t\t\t\tPlant your bulb at the recommended depth for its species. According to horticulturalist Maggie Moran, \u201cThe proper planting depth depends on the type of bulbs you are planting. The common rule is to plant the bulb 2 or 3 times deeper than the bulb's height.\u201d"
        },
        {
          "headline":"Secure your bulbs in the soil.",
          "description":"Place your bulbs in the soil and give them a quarter turn so they take hold in the soil. Plant them about 0.5 in (1.3 cm) apart in the soil. Then pour more potting soil around the bulbs, allowing just the tip of the bulb to show through. Plants like tulips and daffodils should be planted at least 6 in (15 cm) deep. Smaller plants, like crocus, should be planted about 4 in (10 cm) deep. If you like, you can plant just 1 bulb in the pot. Make sure you plant your bulbs at least 0.5 in (1.3 cm) from the edge of the pot."
        },
        {
          "headline":"Layer different types of bulbs.",
          "description":"If you want to plant more than 1 type of bulb in 1 pot, plant them in layers by height. The bulbs that need to be planted deepest should go in first. Plant that bulb as you normally would, cover it over with soil, and then plant the shallower bulbs next. Make sure you stagger the bulbs in the second layer so they aren't growing directly on top of the deepest bulbs."
        },
        {
          "headline":"Water the potted bulbs.",
          "description":"Once you've covered your bulbs with soil, use a watering can or garden hose to water the soil. Keep watering until water runs out of the drainage holes at the bottom of the pot. You can use room temperature or cool water, either from a hose or your tap."
        }
      ]
    },
    {
      "name":"Caring for Your Bulbs",
      "steps":[
        {
          "headline":"Keep bulbs planted in small containers in a cold, protected space.",
          "description":"If you don't have a large enough pot to leave your bulbs outside during the winter, you can stash them in an enclosed space. A shed or garage that will stay cold but provide protection from snow and extreme cold are perfect. You can leave larger, well-insulated pots outside. The cold air actually helps the bulbs bloom later in the spring. As long as your bulbs are well-insulated, the outside air temperature won't matter much."
        },
        {
          "headline":"Check the moisture of the soil regularly.",
          "description":"Every few days, stick your finger into the potting soil around the bulbs. If the soil feels dry down to 1 in (2.5 cm), water the soil until water runs out of the drainage holes."
        },
        {
          "headline":"Move the pot outside after you see new growth.",
          "description":"After about 6 to 8 weeks in a chilly environment, you should see some green growth from your bulbs. If you're keeping your pot inside a garage or shed, you can move it outside once you see this growth."
        },
        {
          "headline":"Make sure the bulbs get some light.",
          "description":"Too much sunlight can cause the bulb growth to wilt. An area with light shade gets about 60% shade and 40% sunlight and is the perfect place for your potted bulbs."
        },
        {
          "headline":"Check the water level daily after the bulbs bloom.",
          "description":"Once your bulbs bloom, they'll need more water than they did when they were growing. Stick your finger into the soil to a depth of 1 in (2.5 cm) and check if the soil is dry. If it is, water the soil until water runs out of the drainage holes."
        },
        {
          "headline":"Protect your plants from pests and disease.",
          "description":"Squirrels are likely to try to dig into your pots and get at the bulbs. You can cover the top of the pot with mesh wiring to protect the bulbs from squirrels and other critters. Bugs shouldn't be a problem during the winter, but if you start to notice some buzzing around, you can use a general insect repellent."
        }
      ]
    }
  ],
  "text":" Choosing Pots and Soil Choose a pot with drainage holes. Drainage holes are necessary to let any excess water out of the pot. If you water the bulbs and the excess water doesn't have anywhere to go, your plants could drown. Make sure the pot is big enough to insulate the bulbs. If you're planning on leaving your pot outside during the winter, you'll need to add enough soil to keep the bulbs warm. Look for a pot that's at least 24 in (61 cm) in diameter. This is true whether you're using indoor or outdoor bulbs. Select a high-quality potting mix. Regular gardening soil won't have the nutrients your bulbs need to thrive. Look for houseplant potting mix. If you like, you can also add fertilizer to the soil and mix it in to the soil. A granular 5-10-10 or 9-9-6 bulb formulation fertilizer is the best to use with your bulbs. Pick a pot tall and wide enough to accommodate your bulb type. Different types of bulb require different depths of planting. Give them at least 2 in (5.1 cm) of soil below them, and about 2 in (5.1 cm) of space above the top of the soil. For example, tulips and daffodils should be planted about 6 in (15 cm) deep. So your pot should be at least 10 in (25 cm) tall. Potting Your Bulbs Plant your bulbs about 6 weeks before spring. Depending on where you live, you'll have to pot your bulbs at a different time. You want your potted bulbs to begin to bloom around the same time as bulbs planted outdoors, usually in early spring. Planting your bulbs 6 weeks before their blooming time gives them enough time to grow. You may need to alter your schedule based on your growing region, as cold weather could damage or kill the plant. If the temperature drops, you may need to bring your plant back inside to protect it from the cold. Fill your pot with potting mix. Pour the potting mix directly from the bag into the pot. Fill the pot with at least 2 in (5.1 cm) of soil. If you're planting bulbs that require a shallower planting depth, fill the pot with about 4 in (10 cm). Tulips and daffodils should be planted in deeper soil. Bearded irises should be planted in shallow soil. EXPERT TIP\t\t\t\t\t\t\t\t\t\t\t\t\t\t\t\t\t\t\t\t\t\t\t\t\t\t\t\t\t\t\tMaggie Moran\t\t\t\t\t\t\t\t\t\t\t\t\t\t\t\tHorticulturist\t\t\t\t\t\t\t\tMaggie Moran is a Professional Gardener in Pennsylvania. Maggie Moran\t\t\tHorticulturist\t\t\t\tPlant your bulb at the recommended depth for its species. According to horticulturalist Maggie Moran, \u201cThe proper planting depth depends on the type of bulbs you are planting. The common rule is to plant the bulb 2 or 3 times deeper than the bulb's height.\u201d Secure your bulbs in the soil. Place your bulbs in the soil and give them a quarter turn so they take hold in the soil. Plant them about 0.5 in (1.3 cm) apart in the soil. Then pour more potting soil around the bulbs, allowing just the tip of the bulb to show through. Plants like tulips and daffodils should be planted at least 6 in (15 cm) deep. Smaller plants, like crocus, should be planted about 4 in (10 cm) deep. If you like, you can plant just 1 bulb in the pot. Make sure you plant your bulbs at least 0.5 in (1.3 cm) from the edge of the pot. Layer different types of bulbs. If you want to plant more than 1 type of bulb in 1 pot, plant them in layers by height. The bulbs that need to be planted deepest should go in first. Plant that bulb as you normally would, cover it over with soil, and then plant the shallower bulbs next. Make sure you stagger the bulbs in the second layer so they aren't growing directly on top of the deepest bulbs. Water the potted bulbs. Once you've covered your bulbs with soil, use a watering can or garden hose to water the soil. Keep watering until water runs out of the drainage holes at the bottom of the pot. You can use room temperature or cool water, either from a hose or your tap. Caring for Your Bulbs Keep bulbs planted in small containers in a cold, protected space. If you don't have a large enough pot to leave your bulbs outside during the winter, you can stash them in an enclosed space. A shed or garage that will stay cold but provide protection from snow and extreme cold are perfect. You can leave larger, well-insulated pots outside. The cold air actually helps the bulbs bloom later in the spring. As long as your bulbs are well-insulated, the outside air temperature won't matter much. Check the moisture of the soil regularly. Every few days, stick your finger into the potting soil around the bulbs. If the soil feels dry down to 1 in (2.5 cm), water the soil until water runs out of the drainage holes. Move the pot outside after you see new growth. After about 6 to 8 weeks in a chilly environment, you should see some green growth from your bulbs. If you're keeping your pot inside a garage or shed, you can move it outside once you see this growth. Make sure the bulbs get some light. Too much sunlight can cause the bulb growth to wilt. An area with light shade gets about 60% shade and 40% sunlight and is the perfect place for your potted bulbs. Check the water level daily after the bulbs bloom. Once your bulbs bloom, they'll need more water than they did when they were growing. Stick your finger into the soil to a depth of 1 in (2.5 cm) and check if the soil is dry. If it is, water the soil until water runs out of the drainage holes. Protect your plants from pests and disease. Squirrels are likely to try to dig into your pots and get at the bulbs. You can cover the top of the pot with mesh wiring to protect the bulbs from squirrels and other critters. Bugs shouldn't be a problem during the winter, but if you start to notice some buzzing around, you can use a general insect repellent.",
  "tyn_model":[
    "pot",
    "water",
    "soil",
    "fertilizer",
    "tulips",
    "potting mix",
    "potting soil",
    "pots",
    "houseplant potting mix",
    "daffodils",
    "irises",
    "gardener",
    "horticulturalist maggie",
    "\u201cthe",
    "\u201d secure",
    "watering can",
    "garden hose",
    "insect repellent"
  ],
  "tyn_section":[

  ]
}