{
  "title":"How to Make Instant Coffee",
  "url":"https://www.wikihow.com/Make-Instant-Coffee",
  "category_hierarchy":[
    "Food and Entertaining",
    "Drinks",
    "Coffee",
    "Instant Coffee"
  ],
  "methods":[
    {
      "name":"Making Basic Instant Coffee",
      "steps":[
        {
          "headline":"Heat up a cup of water.",
          "description":"To heat a cup of water quickly and easily, microwave it for 1 minute. You could also heat it on the stovetop using a pot or kettle. Heat it over medium-high heat, then take the water off of the stove just before it starts to boil. For 1 serving, heat 1 cup (240 mL) of water. Use more water if you want to make additional servings. Using a kettle will make it easier to pour the hot water into your mug."
        },
        {
          "headline":"Add 1 to 2 teaspoons of instant coffee to a mug.",
          "description":"Check your instant coffee container\u2019s label to see how much you should use to get the best taste. Most companies recommend using 1 to 2 teaspoons for 1 cup (240 mL) of water. Use more if you like stronger coffee and less if you like weaker coffee."
        },
        {
          "headline":"Dissolve the coffee with a tablespoon of cold water.",
          "description":"Mixing the coffee with a bit of cold water gently dissolves it. Gently dissolving the coffee instead of shocking it with hot water will improve the flavor."
        },
        {
          "headline":"Pour the hot water into the mug.",
          "description":"Add the water carefully, especially if you\u2019re not using a kettle. Remember to leave room for milk or creamer if you don\u2019t like your coffee black."
        },
        {
          "headline":"Mix in sugar or spices, if desired.",
          "description":"For a richer coffee flavor, add sugar or spices after mixing the coffee with hot water. If you\u2019d like, add a teaspoon of sugar, cocoa powder, cinnamon, or allspice. You could also use a flavored coffee creamer. Keep in mind that most flavored coffee creamers are really sweet, so you probably won\u2019t need any extra sugar."
        },
        {
          "headline":"Add milk or cream if you\u2019re not a fan of black coffee.",
          "description":"Spoon dairy milk, almond milk, or another non-dairy option, cream, or flavored creamer into your coffee. The right amount to use depends on how light or dark you like your coffee. You can also skip the milk or creamer and drink your instant coffee black."
        },
        {
          "headline":"Stir your coffee and serve it.",
          "description":"Give the coffee a good stir before enjoying it or serving it to someone else. Mix it until it\u2019s uniform in color to evenly blend the milk and sugar (if you\u2019re using them)."
        }
      ]
    },
    {
      "name":"Making Instant Iced Coffee",
      "steps":[
        {
          "headline":"Mix 2 teaspoons of instant coffee with \u20442 cup (120 mL) of hot water.",
          "description":"Heat the water in the microwave for 30 seconds to 1 minute. Stir the coffee and hot water together until the coffee granules are dissolved. Mix your coffee in the glass you want to drink from or in a separate cup. Just make sure the cup you use is microwaveable. If you\u2019ll pour the coffee over ice in a separate cup, microwave the water in a measuring cup or other vessel with a spout."
        },
        {
          "headline":"Stir sugar or spices into the warm mixture, if desired.",
          "description":"If you\u2019re using sugar or spices, add them before the ice and cold water or milk. Sugar, cinnamon, allspice, and other ingredients will dissolve better in the warm mixture. You can also add flavored coffee creamer or syrup instead of sugar and spices."
        },
        {
          "headline":"Add \u20442 cup (120 mL) of cold water or milk to the warm mixture.",
          "description":"For creamier iced coffee, use cold milk instead of water. Stir until everything is combined and evenly distributed."
        },
        {
          "headline":"Pour your cold coffee over some ice.",
          "description":"Fill a tall glass with ice cubes, and slowly pour your cold coffee over the ice. If you made the coffee in the glass you want to drink from, just add ice to it."
        },
        {
          "headline":"Serve the instant iced coffee immediately.",
          "description":"Sip your iced coffee straight from the glass or add a straw to it. Serve or drink it before all the ice melts and waters it down."
        }
      ]
    },
    {
      "name":"Whipping up an Instant Latte",
      "steps":[
        {
          "headline":"Mix a tablespoon of instant coffee with \u20444 cup (59 mL) of hot water.",
          "description":"Heat the water in the microwave for 20 to 30 seconds. Add the instant coffee, and stir until the coffee granules are completely dissolved. Combine the water and coffee in the mug you plan on using. The mug should fit at least 1 cup (240 mL)."
        },
        {
          "headline":"Add sugar or spices, if desired.",
          "description":"If you like your latte sweet or flavored, add a teaspoon of sugar, cinnamon, pumpkin spice, vanilla extract, or a flavored coffee syrup. Add it to the mug and stir until it\u2019s well combined."
        },
        {
          "headline":"Shake \u20442 cup (120 mL) of milk in a sealed jar.",
          "description":"Pour the milk into a lidded microwave-safe jar, seal the lid, then shake it hard for 30 to 60 seconds. This will froth the milk for your classic latte."
        },
        {
          "headline":"Microwave the milk uncovered for 30 seconds.",
          "description":"Remove the jar\u2019s lid, then heat the milk. The foam will rise to the top of the warm milk."
        },
        {
          "headline":"Pour the hot milk into the mug.",
          "description":"Use a large spoon to hold back the froth as you pour the hot milk into the coffee base. Gently stir the mixture until it\u2019s uniform in color. If you like your latte darker, don\u2019t add all of the steamed milk. Add just enough to reach your desired color."
        },
        {
          "headline":"Top the latte with the milk foam or whipped cream.",
          "description":"Spoon the milk froth from the jar over the latte, or add a dollop of whipped cream for extra richness."
        },
        {
          "headline":"Garnish with a sprinkle of spices and serve the latte immediately.",
          "description":"Lightly dust the milk foam or whipped cream with cinnamon, nutmeg, cocoa, or other spice of your choice. Sip or serve it promptly while it\u2019s hot and the milk is still frothy."
        }
      ]
    },
    {
      "name":"Blending an Instant Coffee Shake",
      "steps":[
        {
          "headline":"Set up your blender and plug it in.",
          "description":"Take your blender out of storage, make sure it\u2019s off, and plug it in. Double check that you have the lid and that it fits tightly."
        },
        {
          "headline":"Add the ice, instant coffee, milk, vanilla extract, and sugar to the blender.",
          "description":"Combine 6 ice cubes, 1 teaspoon of instant coffee, \u20444 cup (180 mL) of milk, 1 teaspoon of vanilla extract, and 2 teaspoons of sugar. If you\u2019d like, you can also add 2 teaspoons of chocolate syrup."
        },
        {
          "headline":"Blend the mixture on high for 2 to 3 minutes, or until it becomes smooth.",
          "description":"Put the lid on the blender and turn it on. Hold your hand on the lid as you blend everything until the ice is completely crushed. The final product should be smooth and thick with a smoothie-like consistency. If the consistency is too thick, add a little bit more milk. If the consistency is too thin, add an ice cube."
        },
        {
          "headline":"Pour the coffee shake into a tall glass.",
          "description":"Turn the blender off and remove the lid, then slowly pour the shake into the glass. You may have to use a spoon or spatula to scrape the sides."
        },
        {
          "headline":"Garnish with a swirl of chocolate syrup or chips.",
          "description":"Add final touches like whipped cream, chocolate syrup, or shaved pieces of chocolate. Try topping the shake with whipped cream, then dust it with cocoa or drizzle chocolate or caramel over it."
        },
        {
          "headline":"Serve your coffee shake immediately.",
          "description":"Start sipping or serve your shake before it has a chance to melt. Drink it straight from the glass or with a large straw. A spoon might come in handy, especially if you\u2019ve garnished it with chocolate shavings or whipped cream."
        }
      ]
    }
  ],
  "text":" Making Basic Instant Coffee Heat up a cup of water. To heat a cup of water quickly and easily, microwave it for 1 minute. You could also heat it on the stovetop using a pot or kettle. Heat it over medium-high heat, then take the water off of the stove just before it starts to boil. For 1 serving, heat 1 cup (240 mL) of water. Use more water if you want to make additional servings. Using a kettle will make it easier to pour the hot water into your mug. Add 1 to 2 teaspoons of instant coffee to a mug. Check your instant coffee container\u2019s label to see how much you should use to get the best taste. Most companies recommend using 1 to 2 teaspoons for 1 cup (240 mL) of water. Use more if you like stronger coffee and less if you like weaker coffee. Dissolve the coffee with a tablespoon of cold water. Mixing the coffee with a bit of cold water gently dissolves it. Gently dissolving the coffee instead of shocking it with hot water will improve the flavor. Pour the hot water into the mug. Add the water carefully, especially if you\u2019re not using a kettle. Remember to leave room for milk or creamer if you don\u2019t like your coffee black. Mix in sugar or spices, if desired. For a richer coffee flavor, add sugar or spices after mixing the coffee with hot water. If you\u2019d like, add a teaspoon of sugar, cocoa powder, cinnamon, or allspice. You could also use a flavored coffee creamer. Keep in mind that most flavored coffee creamers are really sweet, so you probably won\u2019t need any extra sugar. Add milk or cream if you\u2019re not a fan of black coffee. Spoon dairy milk, almond milk, or another non-dairy option, cream, or flavored creamer into your coffee. The right amount to use depends on how light or dark you like your coffee. You can also skip the milk or creamer and drink your instant coffee black. Stir your coffee and serve it. Give the coffee a good stir before enjoying it or serving it to someone else. Mix it until it\u2019s uniform in color to evenly blend the milk and sugar (if you\u2019re using them). Making Instant Iced Coffee Mix 2 teaspoons of instant coffee with \u20442 cup (120 mL) of hot water. Heat the water in the microwave for 30 seconds to 1 minute. Stir the coffee and hot water together until the coffee granules are dissolved. Mix your coffee in the glass you want to drink from or in a separate cup. Just make sure the cup you use is microwaveable. If you\u2019ll pour the coffee over ice in a separate cup, microwave the water in a measuring cup or other vessel with a spout. Stir sugar or spices into the warm mixture, if desired. If you\u2019re using sugar or spices, add them before the ice and cold water or milk. Sugar, cinnamon, allspice, and other ingredients will dissolve better in the warm mixture. You can also add flavored coffee creamer or syrup instead of sugar and spices. Add \u20442 cup (120 mL) of cold water or milk to the warm mixture. For creamier iced coffee, use cold milk instead of water. Stir until everything is combined and evenly distributed. Pour your cold coffee over some ice. Fill a tall glass with ice cubes, and slowly pour your cold coffee over the ice. If you made the coffee in the glass you want to drink from, just add ice to it. Serve the instant iced coffee immediately. Sip your iced coffee straight from the glass or add a straw to it. Serve or drink it before all the ice melts and waters it down. Whipping up an Instant Latte Mix a tablespoon of instant coffee with \u20444 cup (59 mL) of hot water. Heat the water in the microwave for 20 to 30 seconds. Add the instant coffee, and stir until the coffee granules are completely dissolved. Combine the water and coffee in the mug you plan on using. The mug should fit at least 1 cup (240 mL). Add sugar or spices, if desired. If you like your latte sweet or flavored, add a teaspoon of sugar, cinnamon, pumpkin spice, vanilla extract, or a flavored coffee syrup. Add it to the mug and stir until it\u2019s well combined. Shake \u20442 cup (120 mL) of milk in a sealed jar. Pour the milk into a lidded microwave-safe jar, seal the lid, then shake it hard for 30 to 60 seconds. This will froth the milk for your classic latte. Microwave the milk uncovered for 30 seconds. Remove the jar\u2019s lid, then heat the milk. The foam will rise to the top of the warm milk. Pour the hot milk into the mug. Use a large spoon to hold back the froth as you pour the hot milk into the coffee base. Gently stir the mixture until it\u2019s uniform in color. If you like your latte darker, don\u2019t add all of the steamed milk. Add just enough to reach your desired color. Top the latte with the milk foam or whipped cream. Spoon the milk froth from the jar over the latte, or add a dollop of whipped cream for extra richness. Garnish with a sprinkle of spices and serve the latte immediately. Lightly dust the milk foam or whipped cream with cinnamon, nutmeg, cocoa, or other spice of your choice. Sip or serve it promptly while it\u2019s hot and the milk is still frothy. Blending an Instant Coffee Shake Set up your blender and plug it in. Take your blender out of storage, make sure it\u2019s off, and plug it in. Double check that you have the lid and that it fits tightly. Add the ice, instant coffee, milk, vanilla extract, and sugar to the blender. Combine 6 ice cubes, 1 teaspoon of instant coffee, \u20444 cup (180 mL) of milk, 1 teaspoon of vanilla extract, and 2 teaspoons of sugar. If you\u2019d like, you can also add 2 teaspoons of chocolate syrup. Blend the mixture on high for 2 to 3 minutes, or until it becomes smooth. Put the lid on the blender and turn it on. Hold your hand on the lid as you blend everything until the ice is completely crushed. The final product should be smooth and thick with a smoothie-like consistency. If the consistency is too thick, add a little bit more milk. If the consistency is too thin, add an ice cube. Pour the coffee shake into a tall glass. Turn the blender off and remove the lid, then slowly pour the shake into the glass. You may have to use a spoon or spatula to scrape the sides. Garnish with a swirl of chocolate syrup or chips. Add final touches like whipped cream, chocolate syrup, or shaved pieces of chocolate. Try topping the shake with whipped cream, then dust it with cocoa or drizzle chocolate or caramel over it. Serve your coffee shake immediately. Start sipping or serve your shake before it has a chance to melt. Drink it straight from the glass or with a large straw. A spoon might come in handy, especially if you\u2019ve garnished it with chocolate shavings or whipped cream.",
  "tyn_model":[
    "milk",
    "water",
    "sugar",
    "instant coffee",
    "ice",
    "whipped cream",
    "hot water",
    "blender",
    "microwave",
    "cinnamon",
    "cold water",
    "vanilla extract",
    "chocolate syrup",
    "coffee creamer",
    "cream",
    "coffee",
    "spices",
    "ice cubes",
    "iced coffee",
    "mug",
    "milk foam",
    "cocoa",
    "coffee shake",
    "spoon",
    "kettle",
    "instant coffee container",
    "cocoa powder",
    "coffee creamers",
    "dairy milk",
    "almond milk",
    "flavored creamer",
    "creamer",
    "measuring cup",
    "cold milk",
    "tall glass",
    "pumpkin spice",
    "coffee syrup",
    "jar",
    "large spoon",
    "nutmeg",
    "ice cube",
    "chocolate",
    "glass",
    "large straw",
    "chocolate shavings"
  ],
  "tyn_section":[

  ]
}