{
  "title":"How to Identify Abs Plastic",
  "url":"https://www.wikihow.com/Identify-Abs-Plastic",
  "category_hierarchy":[
    "Home and Garden",
    "DIY",
    "Plastic"
  ],
  "methods":[
    {
      "name":"Checking the Density",
      "steps":[
        {
          "headline":"Cut off a small section of the plastic.",
          "description":"Use sharp scissors or a razor blade to cut a small square out of the plastic \u2014 a 1 inch (2.5 cm) square will work, but you can also use a slightly larger piece if desired. If you\u2019re using a razor blade, put down a cutting board or other thick surface so that the razor blade doesn\u2019t damage your table. If you aren't able to cut up the plastic, you can use a different method that won't cause damage."
        },
        {
          "headline":"Place the piece of plastic in a glass of water.",
          "description":"Fill a cup or small container with cool or room temperature water. Drop the cut piece of plastic into the water. You don\u2019t need to fill the container all the way up with water \u2014 the plastic just needs enough room to either float or sink to the bottom."
        },
        {
          "headline":"Watch to see if the plastic sinks or floats in the water.",
          "description":"If the plastic floats, it isn\u2019t ABS plastic. If the piece of plastic sinks, it\u2019s possible that it\u2019s ABS plastic."
        },
        {
          "headline":"Conduct another test using glycerin to be more certain it\u2019s ABS, if desired.",
          "description":"While ABS plastic sinks in water, so do several other plastics. If you\u2019d like to be more sure, you can fill a cup with glycerin. If the plastic floats in the glycerin, it\u2019s likely ABS. It floats because glycerin is denser than ABS plastic."
        }
      ]
    },
    {
      "name":"Conducting a Burn Test",
      "steps":[
        {
          "headline":"Place the plastic against a flame.",
          "description":"Start a small flame, using something like a lighter or a small candle. Hold the plastic so that it\u2019s touching the flame, being careful not to burn yourself. A long neck lighter would be the best and safest option since the flame won\u2019t be near your fingers. You don't need to cut the plastic into smaller sections when holding it in the flame."
        },
        {
          "headline":"Observe the color of the flame when the plastic is in the fire.",
          "description":"ABS plastic will produce a yellow flame while other plastics may produce a green, blue, or orange flame. Look for blue edges around the yellow flame, indicating it\u2019s ABS plastic."
        },
        {
          "headline":"Notice a pungent smell if the plastic is ABS.",
          "description":"ABS plastic has a very strong, acrid smell when it burns. If the plastic is giving off a stinging smell that\u2019s irritating to your nose, it could be ABS. Don\u2019t inhale too much of the fumes when smelling the plastic, as some plastics can be toxic when melted. ABS plastic has also been said to smell rubbery."
        },
        {
          "headline":"Look for black smoke coming from the flame.",
          "description":"When you\u2019re holding the plastic in the flame, you should see black smoke if it\u2019s ABS. The air will also have a sooty quality."
        },
        {
          "headline":"Remove the plastic from the flame to see if it continues burning.",
          "description":"ABS plastic is one that continues to burn even after the flame is taken away or shut off. Look for drips produced from the fire as well, indicating it\u2019s ABS plastic."
        }
      ]
    },
    {
      "name":"Doing a Non-Damaging Test",
      "steps":[
        {
          "headline":"Look for a label.",
          "description":"Many plastics now have labels on them telling which type of plastic they are for recycling purposes. Look for the letters \"ABS\" on the piece of plastic \u2014 they may be in very small print. Sometimes ABS will be labeled as \"Other.\" If you see abbreviations such as PETE, PVC, HDPE, or PP, these are other types of plastics, meaning it isn't ABS."
        },
        {
          "headline":"Try bending the plastic.",
          "description":"You won't be able to do this if your plastic is super thick, but try bending the plastic in half with your hands if it's thinner. ABS plastic tends to bend instead of break in half like other plastics. If it bends, you may see a white line form in the crease."
        },
        {
          "headline":"Drop the plastic or scratch it to see if it's effected.",
          "description":"ABS plastic is incredibly tough and durable. If you drop the plastic and it immediately gets scuff marks all over it, it's not ABS. You can also try scratching the plastic with your fingernails \u2014 ABS plastic won't get scratched easily. ABS plastic is also known for its shock absorbency."
        },
        {
          "headline":"Wipe acetone on a small section of the plastic.",
          "description":"Dip a cotton swab in acetone and lightly rub it on a tiny part of the plastic, just for a few seconds. If it's ABS plastic, you'll see the spot that you rubbed become smooth and obviously effected by the acetone. If you leave ABS plastic in acetone, it will eventually disintegrate, almost as if it's melting."
        }
      ]
    }
  ],
  "text":" Checking the Density Cut off a small section of the plastic. Use sharp scissors or a razor blade to cut a small square out of the plastic \u2014 a 1 inch (2.5 cm) square will work, but you can also use a slightly larger piece if desired. If you\u2019re using a razor blade, put down a cutting board or other thick surface so that the razor blade doesn\u2019t damage your table. If you aren't able to cut up the plastic, you can use a different method that won't cause damage. Place the piece of plastic in a glass of water. Fill a cup or small container with cool or room temperature water. Drop the cut piece of plastic into the water. You don\u2019t need to fill the container all the way up with water \u2014 the plastic just needs enough room to either float or sink to the bottom. Watch to see if the plastic sinks or floats in the water. If the plastic floats, it isn\u2019t ABS plastic. If the piece of plastic sinks, it\u2019s possible that it\u2019s ABS plastic. Conduct another test using glycerin to be more certain it\u2019s ABS, if desired. While ABS plastic sinks in water, so do several other plastics. If you\u2019d like to be more sure, you can fill a cup with glycerin. If the plastic floats in the glycerin, it\u2019s likely ABS. It floats because glycerin is denser than ABS plastic. Conducting a Burn Test Place the plastic against a flame. Start a small flame, using something like a lighter or a small candle. Hold the plastic so that it\u2019s touching the flame, being careful not to burn yourself. A long neck lighter would be the best and safest option since the flame won\u2019t be near your fingers. You don't need to cut the plastic into smaller sections when holding it in the flame. Observe the color of the flame when the plastic is in the fire. ABS plastic will produce a yellow flame while other plastics may produce a green, blue, or orange flame. Look for blue edges around the yellow flame, indicating it\u2019s ABS plastic. Notice a pungent smell if the plastic is ABS. ABS plastic has a very strong, acrid smell when it burns. If the plastic is giving off a stinging smell that\u2019s irritating to your nose, it could be ABS. Don\u2019t inhale too much of the fumes when smelling the plastic, as some plastics can be toxic when melted. ABS plastic has also been said to smell rubbery. Look for black smoke coming from the flame. When you\u2019re holding the plastic in the flame, you should see black smoke if it\u2019s ABS. The air will also have a sooty quality. Remove the plastic from the flame to see if it continues burning. ABS plastic is one that continues to burn even after the flame is taken away or shut off. Look for drips produced from the fire as well, indicating it\u2019s ABS plastic. Doing a Non-Damaging Test Look for a label. Many plastics now have labels on them telling which type of plastic they are for recycling purposes. Look for the letters \"ABS\" on the piece of plastic \u2014 they may be in very small print. Sometimes ABS will be labeled as \"Other.\" If you see abbreviations such as PETE, PVC, HDPE, or PP, these are other types of plastics, meaning it isn't ABS. Try bending the plastic. You won't be able to do this if your plastic is super thick, but try bending the plastic in half with your hands if it's thinner. ABS plastic tends to bend instead of break in half like other plastics. If it bends, you may see a white line form in the crease. Drop the plastic or scratch it to see if it's effected. ABS plastic is incredibly tough and durable. If you drop the plastic and it immediately gets scuff marks all over it, it's not ABS. You can also try scratching the plastic with your fingernails \u2014 ABS plastic won't get scratched easily. ABS plastic is also known for its shock absorbency. Wipe acetone on a small section of the plastic. Dip a cotton swab in acetone and lightly rub it on a tiny part of the plastic, just for a few seconds. If it's ABS plastic, you'll see the spot that you rubbed become smooth and obviously effected by the acetone. If you leave ABS plastic in acetone, it will eventually disintegrate, almost as if it's melting.",
  "tyn_model":[
    "plastic",
    "abs plastic",
    "water",
    "glycerin",
    "plastics",
    "acetone",
    "razor blade",
    "lighter",
    "abs",
    "scissors",
    "\u2014 a",
    "cutting board",
    "\u2014 the",
    "\u2014 they",
    "\u2014 abs"
  ],
  "tyn_section":[

  ]
}