{
  "title":"How to Prevent Clothes from Shrinking",
  "url":"https://www.wikihow.com/Prevent-Clothes-from-Shrinking",
  "category_hierarchy":[
    "Home and Garden",
    "Housekeeping",
    "Laundry"
  ],
  "methods":[
    {
      "name":"Washing Your Clothes Properly",
      "steps":[
        {
          "headline":"Wash your clothes in cold water to prevent shrinkage.",
          "description":"Simply set the temperature on your washing machine to \u201ccold.\u201d With many detergents being specially-made for cold-water washing, using cold water still works to get your clothes clean. As a bonus, washing your laundry in cold water requires less energy, and can save you money on your utility bill."
        },
        {
          "headline":"Use the preset \u201cdelicate\u201d cycle to help clothes keep their original size and shape.",
          "description":"This setting uses low agitation (so less moving and shaking) and a slower, shorter spin cycle to drain the water, which makes it more likely that your clothes will remain the size and shape they were meant to be. Sometimes these cycles will automatically default to a warm wash. Use the controls on your machine to override the setting to change it to a cold wash."
        },
        {
          "headline":"Hand-wash cotton, linen, and silk garments to avoid shrinkage.",
          "description":"All you need is a little laundry detergent and some water. It takes a little more time and effort, but hand washing your clothes is one of the safest bets to prevent shrinkage and maintain shape."
        },
        {
          "headline":"Take wool and cashmere garments to a dry cleaner.",
          "description":"The labels on your clothes will tell you what type of material they are. If your item contains any cashmere or wool at all, it should be taken to the dry cleaner for proper cleaning. Any sort of agitation can cause these animal-based fabrics to shrink, so for these items, it\u2019s best to spend a few dollars to have them professionally cleaned."
        }
      ]
    },
    {
      "name":"Drying Your Clothes Carefully",
      "steps":[
        {
          "headline":"Use the lowest heat setting on your dryer.",
          "description":"The less heat, the less shrinkage. If you forget to change this setting, and leave the temperature on medium or high, there is a chance you may shrink your clothes. Some dryers even have the option to air dry. This setting doesn\u2019t use heat at all, and instead works to dry clothes by tumbling only. This can take a long time, so be sure to only use this option with small loads."
        },
        {
          "headline":"Remove clothes from the dryer while they are still damp.",
          "description":"Drying your clothes in the machine for 15-20 minutes can help speed up the drying process, but removing them while they are still damp will help avoid over-drying and can help prevent shrinkage. Hang these items on a drying rack or lay them on a flat surface to finish drying."
        },
        {
          "headline":"Air-dry your clothes.",
          "description":"After washing, hang your items inside on a rod or drying rack, or outside on a clothesline, for an energy-efficient and shrink-proof way to dry your clothes. This is a good option if you are washing multiple delicate items at a time and/or have limited space for laying items flat. If you are drying your clothes outside, be sure to avoid hanging wool in the direct sunlight to avoid shrinkage, and all clothes in high winds or storms to avoid stretching or damage."
        }
      ]
    },
    {
      "name":"Following Good Laundry Practices",
      "steps":[
        {
          "headline":"Follow the directions on the tags of your garments.",
          "description":"These washing and drying instructions are material-specific, and are included to help you care for your clothing properly."
        },
        {
          "headline":"Sort clothing by fabric type prior to washing.",
          "description":"If you are using a washing machine, after sorting your clothes by color, group your cotton, linen, and silk garments to wash in a separate load. This will cut down on time, and will be a lot easier than sorting through a large load of wet clothes to find the items you want to avoid shrinking. A good trick is to have a separate hamper for the clothes you\u2019ll need to pay special attention to. This way, they will already be sorted come laundry day."
        },
        {
          "headline":"Remove laundry from the dryer immediately after drying.",
          "description":"This will reduce wrinkling upfront, so you don\u2019t have to iron or permanent press your clothes in the dryer later--which could contribute to additional heat shrinkage. Sometimes you won\u2019t be able to remove your clothes as soon as the cycle is finished. If this happens, try throwing a damp rag into the dryer and running it for 5-10 minutes. The dampness will create a bit of steam and work to get the wrinkles out quickly."
        }
      ]
    }
  ],
  "text":" Washing Your Clothes Properly Wash your clothes in cold water to prevent shrinkage. Simply set the temperature on your washing machine to \u201ccold.\u201d With many detergents being specially-made for cold-water washing, using cold water still works to get your clothes clean. As a bonus, washing your laundry in cold water requires less energy, and can save you money on your utility bill. Use the preset \u201cdelicate\u201d cycle to help clothes keep their original size and shape. This setting uses low agitation (so less moving and shaking) and a slower, shorter spin cycle to drain the water, which makes it more likely that your clothes will remain the size and shape they were meant to be. Sometimes these cycles will automatically default to a warm wash. Use the controls on your machine to override the setting to change it to a cold wash. Hand-wash cotton, linen, and silk garments to avoid shrinkage. All you need is a little laundry detergent and some water. It takes a little more time and effort, but hand washing your clothes is one of the safest bets to prevent shrinkage and maintain shape. Take wool and cashmere garments to a dry cleaner. The labels on your clothes will tell you what type of material they are. If your item contains any cashmere or wool at all, it should be taken to the dry cleaner for proper cleaning. Any sort of agitation can cause these animal-based fabrics to shrink, so for these items, it\u2019s best to spend a few dollars to have them professionally cleaned. Drying Your Clothes Carefully Use the lowest heat setting on your dryer. The less heat, the less shrinkage. If you forget to change this setting, and leave the temperature on medium or high, there is a chance you may shrink your clothes. Some dryers even have the option to air dry. This setting doesn\u2019t use heat at all, and instead works to dry clothes by tumbling only. This can take a long time, so be sure to only use this option with small loads. Remove clothes from the dryer while they are still damp. Drying your clothes in the machine for 15-20 minutes can help speed up the drying process, but removing them while they are still damp will help avoid over-drying and can help prevent shrinkage. Hang these items on a drying rack or lay them on a flat surface to finish drying. Air-dry your clothes. After washing, hang your items inside on a rod or drying rack, or outside on a clothesline, for an energy-efficient and shrink-proof way to dry your clothes. This is a good option if you are washing multiple delicate items at a time and/or have limited space for laying items flat. If you are drying your clothes outside, be sure to avoid hanging wool in the direct sunlight to avoid shrinkage, and all clothes in high winds or storms to avoid stretching or damage. Following Good Laundry Practices Follow the directions on the tags of your garments. These washing and drying instructions are material-specific, and are included to help you care for your clothing properly. Sort clothing by fabric type prior to washing. If you are using a washing machine, after sorting your clothes by color, group your cotton, linen, and silk garments to wash in a separate load. This will cut down on time, and will be a lot easier than sorting through a large load of wet clothes to find the items you want to avoid shrinking. A good trick is to have a separate hamper for the clothes you\u2019ll need to pay special attention to. This way, they will already be sorted come laundry day. Remove laundry from the dryer immediately after drying. This will reduce wrinkling upfront, so you don\u2019t have to iron or permanent press your clothes in the dryer later--which could contribute to additional heat shrinkage. Sometimes you won\u2019t be able to remove your clothes as soon as the cycle is finished. If this happens, try throwing a damp rag into the dryer and running it for 5-10 minutes. The dampness will create a bit of steam and work to get the wrinkles out quickly.",
  "tyn_model":[
    "water",
    "dryer",
    "washing machine",
    "dry cleaner",
    "drying rack",
    "\u201ccold",
    "\u201d with",
    "\u201cdelicate",
    "\u201d cycle",
    "laundry detergent",
    "dryers",
    "wool",
    "laundry",
    "iron",
    "rag"
  ],
  "tyn_section":[

  ]
}