{
  "title":"How to Block Drafts from a Fireplace",
  "url":"https://www.wikihow.com/Block-Drafts-from-a-Fireplace",
  "category_hierarchy":[
    "Home and Garden",
    "Heating and Cooling",
    "Fire",
    "Fireplaces"
  ],
  "methods":[
    {
      "name":"Operating a Chimney Damper",
      "steps":[
        {
          "headline":"Hire a professional to install a damper if you don\u2019t have one.",
          "description":"A damper rests inside of or on top of your chimney and prevents drafts from coming down the chimney. Since improper installation could result in a chimney fire or chimney blockage, hire a professional service. A top damper sits on top of the chimney and has a cord that runs down the length of the chimney. Top dampers can also protect against animals getting into your chimney. A throat damper sits just above the area the fire is lit and requires more work to install."
        },
        {
          "headline":"Pull the lever or cord to open and close the damper.",
          "description":"The cord or lever be on the top or side of the fireplace. The position of the damper control will depend on the which damper you have installed. Pay attention to which position is open and which position is closed when the damper is installed."
        },
        {
          "headline":"Open the damper before you light a fire.",
          "description":"If you fail to the open the damper before you light your fire, smoke or gas could build up inside your home. If you see or smell smoke or gas, open the damper as soon as you can. If you lit the fire and forgot to open the damper, use pliers or an oven mitt to pull the lever so you don\u2019t burn yourself. To help clear the air in your home, open a few windows."
        },
        {
          "headline":"Close the damper after all the embers are burnt out.",
          "description":"Make sure your fire is completely out or else residual smoke could fill your home. When the embers are cold to the touch, pull the cord or lever to close the damper. Keep the damper closed when the fireplace is not in use."
        },
        {
          "headline":"Wait 5 minutes before closing the damper on gas fireplaces.",
          "description":"This allows time for any unburned excess gas to escape without it entering your home."
        }
      ]
    },
    {
      "name":"Covering the Fireplace with a Draft Guard",
      "steps":[
        {
          "headline":"Measure the width and height of the fireplace opening.",
          "description":"Use a tape measure so you can determine what size draft guard you need."
        },
        {
          "headline":"Purchase a draft guard online or in store.",
          "description":"Once you find the measurements, make sure you buy a guard that is at least the size of the opening. Buy a guard that is at least 3 inches (7.6 cm) larger on each side of the hole so you have some wiggle room. Draft guards are sold in hardware stores or online. Buy a guard in a color that accents the inside of your house."
        },
        {
          "headline":"Unfold the guard and place it over the hole.",
          "description":"Place the guard so it\u2019s flush with the opening of your fireplace. The guard is sturdy enough to stand on its own and will block any draft coming down your chimney. Keep the guard over your fireplace whenever you aren\u2019t using it."
        },
        {
          "headline":"Remove the guard and fold it flat when you want to use the fireplace.",
          "description":"The guard folds flat for compact storage when you want to light a fire. Stand it next to the fireplace or hide it underneath a piece of furniture so it\u2019s not in the way. Once the fireplace is cool again, place the guard over the hole."
        }
      ]
    },
    {
      "name":"Installing a Chimney Balloon",
      "steps":[
        {
          "headline":"Purchase a chimney balloon.",
          "description":"Chimney balloons are reusable and inflatable plastic pieces that fit inside your chimney to block any drafts. They are easy to use, but only if you have access to the interior of your chimney. Chimney balloons can be purchased from online retailers."
        },
        {
          "headline":"Inflate the balloon partially so it resembles a floppy pillow.",
          "description":"Blow air into the plastic tube attached to the handle of the balloon. A few breaths should be enough to spread the balloon out. This helps you work with the balloon so it fits easily into the chimney."
        },
        {
          "headline":"Place the balloon in the chimney flue.",
          "description":"Take the balloon by the handle and hold it up to the opening of your chimney above the main firebox. The balloon should be parallel to the opening so it fills the entire area. If you need to make the balloon fit better, push the corners of the balloon up into the chimney with your fingers."
        },
        {
          "headline":"Blow up the balloon until it holds firmly in the chimney.",
          "description":"Hold the balloon by the handle as you blow into the plastic tube. Make sure the balloon holds tight once you inflate it. After it is inflated enough to fill the chimney, close the valve on the handle. Remove the plastic tube so it doesn\u2019t hang down in your fireplace."
        },
        {
          "headline":"Remove the balloon before you light a fire.",
          "description":"The balloon needs to be removed before you start a fire so smoke or gas doesn\u2019t fill your home. Chimney balloons have a fail-safe if you forget to remove them and will deflate when it\u2019s heated. Keep a reminder card or tie something to the handle of the balloon so you don\u2019t forget it\u2019s there. Reinflate the chimney balloon once the chimney is cold. Place the balloon back into the chimney so it fits firmly. Chimney balloons can be reused as long as it holds air. If it has a leak, replace the balloon."
        }
      ]
    }
  ],
  "text":" Operating a Chimney Damper Hire a professional to install a damper if you don\u2019t have one. A damper rests inside of or on top of your chimney and prevents drafts from coming down the chimney. Since improper installation could result in a chimney fire or chimney blockage, hire a professional service. A top damper sits on top of the chimney and has a cord that runs down the length of the chimney. Top dampers can also protect against animals getting into your chimney. A throat damper sits just above the area the fire is lit and requires more work to install. Pull the lever or cord to open and close the damper. The cord or lever be on the top or side of the fireplace. The position of the damper control will depend on the which damper you have installed. Pay attention to which position is open and which position is closed when the damper is installed. Open the damper before you light a fire. If you fail to the open the damper before you light your fire, smoke or gas could build up inside your home. If you see or smell smoke or gas, open the damper as soon as you can. If you lit the fire and forgot to open the damper, use pliers or an oven mitt to pull the lever so you don\u2019t burn yourself. To help clear the air in your home, open a few windows. Close the damper after all the embers are burnt out. Make sure your fire is completely out or else residual smoke could fill your home. When the embers are cold to the touch, pull the cord or lever to close the damper. Keep the damper closed when the fireplace is not in use. Wait 5 minutes before closing the damper on gas fireplaces. This allows time for any unburned excess gas to escape without it entering your home. Covering the Fireplace with a Draft Guard Measure the width and height of the fireplace opening. Use a tape measure so you can determine what size draft guard you need. Purchase a draft guard online or in store. Once you find the measurements, make sure you buy a guard that is at least the size of the opening. Buy a guard that is at least 3 inches (7.6 cm) larger on each side of the hole so you have some wiggle room. Draft guards are sold in hardware stores or online. Buy a guard in a color that accents the inside of your house. Unfold the guard and place it over the hole. Place the guard so it\u2019s flush with the opening of your fireplace. The guard is sturdy enough to stand on its own and will block any draft coming down your chimney. Keep the guard over your fireplace whenever you aren\u2019t using it. Remove the guard and fold it flat when you want to use the fireplace. The guard folds flat for compact storage when you want to light a fire. Stand it next to the fireplace or hide it underneath a piece of furniture so it\u2019s not in the way. Once the fireplace is cool again, place the guard over the hole. Installing a Chimney Balloon Purchase a chimney balloon. Chimney balloons are reusable and inflatable plastic pieces that fit inside your chimney to block any drafts. They are easy to use, but only if you have access to the interior of your chimney. Chimney balloons can be purchased from online retailers. Inflate the balloon partially so it resembles a floppy pillow. Blow air into the plastic tube attached to the handle of the balloon. A few breaths should be enough to spread the balloon out. This helps you work with the balloon so it fits easily into the chimney. Place the balloon in the chimney flue. Take the balloon by the handle and hold it up to the opening of your chimney above the main firebox. The balloon should be parallel to the opening so it fills the entire area. If you need to make the balloon fit better, push the corners of the balloon up into the chimney with your fingers. Blow up the balloon until it holds firmly in the chimney. Hold the balloon by the handle as you blow into the plastic tube. Make sure the balloon holds tight once you inflate it. After it is inflated enough to fill the chimney, close the valve on the handle. Remove the plastic tube so it doesn\u2019t hang down in your fireplace. Remove the balloon before you light a fire. The balloon needs to be removed before you start a fire so smoke or gas doesn\u2019t fill your home. Chimney balloons have a fail-safe if you forget to remove them and will deflate when it\u2019s heated. Keep a reminder card or tie something to the handle of the balloon so you don\u2019t forget it\u2019s there. Reinflate the chimney balloon once the chimney is cold. Place the balloon back into the chimney so it fits firmly. Chimney balloons can be reused as long as it holds air. If it has a leak, replace the balloon.",
  "tyn_model":[
    "balloon",
    "damper",
    "fireplace",
    "chimney balloons",
    "draft guard",
    "chimney balloon",
    "chimney damper",
    "top damper",
    "top dampers",
    "pliers",
    "oven mitt",
    "gas fireplaces",
    "tape measure",
    "draft guards",
    "air",
    "chimney flue"
  ],
  "tyn_section":[

  ]
}