{
  "title":"How to Open a Paint Can",
  "url":"https://www.wikihow.com/Open-a-Paint-Can",
  "category_hierarchy":[
    "Home and Garden",
    "DIY"
  ],
  "methods":[
    {
      "name":"Using a Tool to Open the Can",
      "steps":[
        {
          "headline":"Select a paint can opener for the easiest option.",
          "description":"Paint can openers are small tools designed to effortlessly pry the lid off of your can. When you buy your paint from a home supply store, ask the associate for a paint can opener as well. Oftentimes they give these out for free along with the purchase of your paint. Paint can openers are also available for purchase at most home supply stores. Paint can openers have a small, curved tip that easily gets underneath the lip of the paint can so you can lift it up."
        },
        {
          "headline":"Use a flathead screwdriver if you don\u2019t have a paint can opener.",
          "description":"While a paint can opener is the best way to open a paint can, you can also use a screwdriver. Be careful not to put too much pressure on the lid when using a screwdriver, or it can get deformed. For best results, use a screwdriver with a tip about \u20444\u2013\u20442 in (0.64\u20131.27 cm) big. If you use a smaller screwdriver, opening the can may put too much pressure on the rim of the can and it can get deformed. If your lid is deformed, it will be harder to close and take off next time."
        },
        {
          "headline":"Try a stiff, 1\u20132 in (2.5\u20135.1 cm) putty knife if you have one handy.",
          "description":"In addition to paint can removers and screwdrivers, putty knives work well to open paint cans. If you choose a putty knife, use the side of the knife to maximize your surface area. These work well because you can easily pry the lid off with the thick, wide blade of the putty knife."
        },
        {
          "headline":"Hold your tool under the lip of the lid to easily pry it off.",
          "description":"Place the tip of your tool underneath the lip. If using a screwdriver or putty knife, it is helpful to use the side of the tool to gain more leverage."
        },
        {
          "headline":"Press down on the handle of the tool to pry open the lid.",
          "description":"After you position your tool under the lid, use moderate force on the handle. With a little bit of effort, the lid will separate from the paint can. If the lid does not come off the can in 1 motion, reposition your tool and try again."
        },
        {
          "headline":"Open the paint can a little bit at a time to maintain the shape of the lid.",
          "description":"Continue prying the lid off in a consecutive motion. To do this, scoot the tool across the lid and lift up every \u20442\u20131 in (1.3\u20132.5 cm) or so. Prying all of the lid off before opening the can prevents the lid from getting deformed and bent. If the lid loses its flat shape, it will be hard to put the lid back on. If you take the lid off from 1 side, you will bend it."
        },
        {
          "headline":"Take the lid off with your hands.",
          "description":"Once you pry the lid off all the way around, place 1 hand on the lid, and gently lift up. Put the lid down on a flat surface with the paint side facing upwards. This way, you can easily pick up the lid when you are finished painting."
        }
      ]
    },
    {
      "name":"Closing the Paint Can",
      "steps":[
        {
          "headline":"Wipe the rim of the can with a paint brush to remove any excess paint.",
          "description":"When you are finished painting, hold the tip of your brush up to the rim of your can, and move it around in a circle. Then, wipe the tip of your brush against the lid. This moves the paint on the rim back into the can. This way, your lid will not get sticky with paint. Alternatively, you can use a rag instead of a paintbrush."
        },
        {
          "headline":"Place the lid on top on the rim when you are finished painting.",
          "description":"After you wipe around the rim, lift up your lid and put it on top of the paint can with the paint side facing down."
        },
        {
          "headline":"Tap the lid into place using a hammer or rubber mallet.",
          "description":"Once the lid is in place, make small tapping motions on the lid. Continue tapping around the lid clockwise until the lid is securely in place. For best results, use a tool with a small head. You don\u2019t need to pound the lid into place, and you can more easily tap the lid closed using a small tool."
        }
      ]
    }
  ],
  "text":" Using a Tool to Open the Can Select a paint can opener for the easiest option. Paint can openers are small tools designed to effortlessly pry the lid off of your can. When you buy your paint from a home supply store, ask the associate for a paint can opener as well. Oftentimes they give these out for free along with the purchase of your paint. Paint can openers are also available for purchase at most home supply stores. Paint can openers have a small, curved tip that easily gets underneath the lip of the paint can so you can lift it up. Use a flathead screwdriver if you don\u2019t have a paint can opener. While a paint can opener is the best way to open a paint can, you can also use a screwdriver. Be careful not to put too much pressure on the lid when using a screwdriver, or it can get deformed. For best results, use a screwdriver with a tip about \u20444\u2013\u20442 in (0.64\u20131.27 cm) big. If you use a smaller screwdriver, opening the can may put too much pressure on the rim of the can and it can get deformed. If your lid is deformed, it will be harder to close and take off next time. Try a stiff, 1\u20132 in (2.5\u20135.1 cm) putty knife if you have one handy. In addition to paint can removers and screwdrivers, putty knives work well to open paint cans. If you choose a putty knife, use the side of the knife to maximize your surface area. These work well because you can easily pry the lid off with the thick, wide blade of the putty knife. Hold your tool under the lip of the lid to easily pry it off. Place the tip of your tool underneath the lip. If using a screwdriver or putty knife, it is helpful to use the side of the tool to gain more leverage. Press down on the handle of the tool to pry open the lid. After you position your tool under the lid, use moderate force on the handle. With a little bit of effort, the lid will separate from the paint can. If the lid does not come off the can in 1 motion, reposition your tool and try again. Open the paint can a little bit at a time to maintain the shape of the lid. Continue prying the lid off in a consecutive motion. To do this, scoot the tool across the lid and lift up every \u20442\u20131 in (1.3\u20132.5 cm) or so. Prying all of the lid off before opening the can prevents the lid from getting deformed and bent. If the lid loses its flat shape, it will be hard to put the lid back on. If you take the lid off from 1 side, you will bend it. Take the lid off with your hands. Once you pry the lid off all the way around, place 1 hand on the lid, and gently lift up. Put the lid down on a flat surface with the paint side facing upwards. This way, you can easily pick up the lid when you are finished painting. Closing the Paint Can Wipe the rim of the can with a paint brush to remove any excess paint. When you are finished painting, hold the tip of your brush up to the rim of your can, and move it around in a circle. Then, wipe the tip of your brush against the lid. This moves the paint on the rim back into the can. This way, your lid will not get sticky with paint. Alternatively, you can use a rag instead of a paintbrush. Place the lid on top on the rim when you are finished painting. After you wipe around the rim, lift up your lid and put it on top of the paint can with the paint side facing down. Tap the lid into place using a hammer or rubber mallet. Once the lid is in place, make small tapping motions on the lid. Continue tapping around the lid clockwise until the lid is securely in place. For best results, use a tool with a small head. You don\u2019t need to pound the lid into place, and you can more easily tap the lid closed using a small tool.",
  "tyn_model":[
    "paint",
    "screwdriver",
    "paint can",
    "paint can opener",
    "putty knife",
    "paint can openers",
    "tool",
    "paint can removers",
    "screwdrivers",
    "putty knives",
    "paint cans",
    "knife",
    "paint brush",
    "paintbrush",
    "hammer",
    "rubber mallet"
  ],
  "tyn_section":[
    "Can of paint",
    "Paint can opener, screwdriver, or putty knife",
    "Paintbrush or rag",
    "Hammer or rubber mallet"
  ]
}