{
  "title":"How to Make Ikura",
  "url":"https://www.wikihow.com/Make-Ikura",
  "category_hierarchy":[
    "Food and Entertaining",
    "Food Preparation"
  ],
  "methods":[
    {
      "name":"Making Simple Ikura",
      "steps":[
        {
          "headline":"Stir together the soy sauce, mirin, and dashi.",
          "description":"Pour \u20444 cup (59 mL) of dashi into a medium-sized bowl. Add 1 tablespoon (15 mL) of mirin and 1 tablespoon (15 mL) of soy sauce. Stir everything together with a spoon. You can use sake instead of mirin. You can use homemade or store-bought dashi."
        },
        {
          "headline":"Add 4 ounces (115 g) of cured salmon roe.",
          "description":"Make sure that you use cured salmon roe and not fresh salmon roe. Fresh salmon roe is still raw and requires additional preparation, while cured salmon roe has already been cleaned and prepared for you. Give the mixture a quick stir to ensure that all of the roe pearls are submerged."
        },
        {
          "headline":"Refrigerate the roe for 15 to 30 minutes.",
          "description":"Cover the bowl with plastic wrap, then tuck it into the fridge. Leave it there for 15 to 30 minutes so that the roe pearls can soak up the flavors. The roe has already been cured for you; this step is simply making it more flavorful."
        },
        {
          "headline":"Drain the roe.",
          "description":"Pour the roe into a strainer over a sink. Gently shake the strainer to remove the excess sauce. Do not reuse the drained sauce. You do not want to reuse the sauce for sanitary purposes, just how you would not want to reuse marinade."
        },
        {
          "headline":"Serve the ikura as desired.",
          "description":"Spoon it over some short-grain Japanese rice to make ikura don, or add it to sushi. If you are making ikura don, you can even add some wasabi, nori, a shiso leaf, or even slices of salmon sashimi. Use about 1 to 2 tablespoons (40 to 80 g) of ikura for each serving. Store any leftover ikura in a covered container in the fridge. Eat it within 1 week."
        }
      ]
    },
    {
      "name":"Making Ikura from Scratch",
      "steps":[
        {
          "headline":"Combine the dashi, soy sauce, sake, salt, and sugar.",
          "description":"Pour 1 \u20442 cups (350 mL) dashi into a large bowl. Add 2 tablespoons (30 mL) of soy sauce, 1 tablespoon (15 mL) of sake, 1 tablespoon (17 g) of salt, and 1 tablespoon (12 g) of sugar. Stir everything together until the salt and sugar dissolve. Set the brine aside for later. Homemade dashi would be better, but you can use store-bought too."
        },
        {
          "headline":"Set a wire screen over a large bowl.",
          "description":"Use a round, wire screen with holes big enough for the pearls (roe) to easily fit through. The wires should be thin and delicate, otherwise, they won't scrape the pearls off the skein. A wire cooling rack is a great option, but you can also use a wire screen meant for grilling things in a skillet. Make sure that the bowl is big enough to hold all of the pearls."
        },
        {
          "headline":"Spread open a skein of salmon roe.",
          "description":"One side of the skein will be smooth and flat, while the other will have the pearls attached to it. Spread apart the skein to reveal both sides. It would be a good idea to wear plastic gloves for this step. This is not the same thing as the salmon roe that comes in plastic tubs. It's still attached to the sack, and hasn't been cured at all. You can buy fresh skeins of salmon roe from a fishmonger or fish market."
        },
        {
          "headline":"Drag the skein, pearl-side-down, across the screen.",
          "description":"Place the end of the skein on top of the screen, press down on it, and drag it towards the other end. This should remove the first few inches/centimeters or so of pearls. Repeat this process as often as necessary until you scrape off most of the pearls. Work your way down the length of the skein. Apply pressure to the next 2 inches (5.1 cm) or so as you drag it across the screen, and so forth."
        },
        {
          "headline":"Wrap the skein around 2 chopsticks to scrape off the rest of the pearls.",
          "description":"Pinch the end of the skein between 2 chopsticks. Wrap the skein around the chopsticks, like hair around a hair roller. Pop the pearls off as you go. Roll the chopsticks towards the pearls, not away from them."
        },
        {
          "headline":"Rinse the pearls in cold water.",
          "description":"Transfer the pearls to a fine, mesh strainer. Hold the strainer under cold, running water. Gently sift the pearls with your fingers to move them around. Keep rinsing them until the water runs clear. Gently shake the strainer afterwards to dislodge any excess moisture."
        },
        {
          "headline":"Transfer the roe into a bowl, then pour the prepared brine over them.",
          "description":"You only need to use enough brine to cover the roe. If you have extra brine left over, you can save it for another recipe, or just add it to the roe."
        },
        {
          "headline":"Refrigerate the ikura for 1 day.",
          "description":"Since you used fresh, not cured, roe, you need to cure it yourself. Simply cover the bowl with plastic wrap, then put the bowl into the fridge. Leave it there for 1 full day. The brine will help cure the roe as well as add flavor to it. Do not cure the roe at room temperature or it will spoil. Don't cure it for longer than 1 day, or the flavor will become too intense."
        },
        {
          "headline":"Strain the brine.",
          "description":"Pour the ikura into a strainer over a sink, then gently jiggle the strainer to dislodge any excess brine. Do not reuse this brine, as it would have been in contact with raw roe."
        },
        {
          "headline":"Use the ikura as desired.",
          "description":"Use the roe in sushi rolls or serve it over short-grain Japanese rice to make ikura don. If you are making the latter, garnish it with wasabi, nori, or shiso leaves for extra flavor. You can even add some slices of salmon sashimi. Plan on using 1 to 2 tablespoons (40 to 80 g) of ikura per serving. Put any leftover ikura in a covered container and store it in the fridge. Consume it within 1 week."
        }
      ]
    }
  ],
  "text":" Making Simple Ikura Stir together the soy sauce, mirin, and dashi. Pour \u20444 cup (59 mL) of dashi into a medium-sized bowl. Add 1 tablespoon (15 mL) of mirin and 1 tablespoon (15 mL) of soy sauce. Stir everything together with a spoon. You can use sake instead of mirin. You can use homemade or store-bought dashi. Add 4 ounces (115 g) of cured salmon roe. Make sure that you use cured salmon roe and not fresh salmon roe. Fresh salmon roe is still raw and requires additional preparation, while cured salmon roe has already been cleaned and prepared for you. Give the mixture a quick stir to ensure that all of the roe pearls are submerged. Refrigerate the roe for 15 to 30 minutes. Cover the bowl with plastic wrap, then tuck it into the fridge. Leave it there for 15 to 30 minutes so that the roe pearls can soak up the flavors. The roe has already been cured for you; this step is simply making it more flavorful. Drain the roe. Pour the roe into a strainer over a sink. Gently shake the strainer to remove the excess sauce. Do not reuse the drained sauce. You do not want to reuse the sauce for sanitary purposes, just how you would not want to reuse marinade. Serve the ikura as desired. Spoon it over some short-grain Japanese rice to make ikura don, or add it to sushi. If you are making ikura don, you can even add some wasabi, nori, a shiso leaf, or even slices of salmon sashimi. Use about 1 to 2 tablespoons (40 to 80 g) of ikura for each serving. Store any leftover ikura in a covered container in the fridge. Eat it within 1 week. Making Ikura from Scratch Combine the dashi, soy sauce, sake, salt, and sugar. Pour 1 \u20442 cups (350 mL) dashi into a large bowl. Add 2 tablespoons (30 mL) of soy sauce, 1 tablespoon (15 mL) of sake, 1 tablespoon (17 g) of salt, and 1 tablespoon (12 g) of sugar. Stir everything together until the salt and sugar dissolve. Set the brine aside for later. Homemade dashi would be better, but you can use store-bought too. Set a wire screen over a large bowl. Use a round, wire screen with holes big enough for the pearls (roe) to easily fit through. The wires should be thin and delicate, otherwise, they won't scrape the pearls off the skein. A wire cooling rack is a great option, but you can also use a wire screen meant for grilling things in a skillet. Make sure that the bowl is big enough to hold all of the pearls. Spread open a skein of salmon roe. One side of the skein will be smooth and flat, while the other will have the pearls attached to it. Spread apart the skein to reveal both sides. It would be a good idea to wear plastic gloves for this step. This is not the same thing as the salmon roe that comes in plastic tubs. It's still attached to the sack, and hasn't been cured at all. You can buy fresh skeins of salmon roe from a fishmonger or fish market. Drag the skein, pearl-side-down, across the screen. Place the end of the skein on top of the screen, press down on it, and drag it towards the other end. This should remove the first few inches/centimeters or so of pearls. Repeat this process as often as necessary until you scrape off most of the pearls. Work your way down the length of the skein. Apply pressure to the next 2 inches (5.1 cm) or so as you drag it across the screen, and so forth. Wrap the skein around 2 chopsticks to scrape off the rest of the pearls. Pinch the end of the skein between 2 chopsticks. Wrap the skein around the chopsticks, like hair around a hair roller. Pop the pearls off as you go. Roll the chopsticks towards the pearls, not away from them. Rinse the pearls in cold water. Transfer the pearls to a fine, mesh strainer. Hold the strainer under cold, running water. Gently sift the pearls with your fingers to move them around. Keep rinsing them until the water runs clear. Gently shake the strainer afterwards to dislodge any excess moisture. Transfer the roe into a bowl, then pour the prepared brine over them. You only need to use enough brine to cover the roe. If you have extra brine left over, you can save it for another recipe, or just add it to the roe. Refrigerate the ikura for 1 day. Since you used fresh, not cured, roe, you need to cure it yourself. Simply cover the bowl with plastic wrap, then put the bowl into the fridge. Leave it there for 1 full day. The brine will help cure the roe as well as add flavor to it. Do not cure the roe at room temperature or it will spoil. Don't cure it for longer than 1 day, or the flavor will become too intense. Strain the brine. Pour the ikura into a strainer over a sink, then gently jiggle the strainer to dislodge any excess brine. Do not reuse this brine, as it would have been in contact with raw roe. Use the ikura as desired. Use the roe in sushi rolls or serve it over short-grain Japanese rice to make ikura don. If you are making the latter, garnish it with wasabi, nori, or shiso leaves for extra flavor. You can even add some slices of salmon sashimi. Plan on using 1 to 2 tablespoons (40 to 80 g) of ikura per serving. Put any leftover ikura in a covered container and store it in the fridge. Consume it within 1 week.",
  "tyn_model":[
    "ikura",
    "bowl",
    "strainer",
    "dashi",
    "soy sauce",
    "salmon roe",
    "skein",
    "mirin",
    "sake",
    "salt",
    "sugar",
    "water",
    "plastic wrap",
    "fridge",
    "rice",
    "brine",
    "medium-sized bowl",
    "spoon",
    "marinade",
    "large bowl",
    "wire screen",
    "skillet",
    "hair roller",
    "chopsticks",
    "fine, mesh strainer",
    "salmon sashimi"
  ],
  "tyn_section":[
    "Simple Ikura",
    "Medium-sized bowl",
    "Spoon",
    "Strainer",
    "Plastic wrap",
    "Ikura from Scratch",
    "2 large bowls",
    "Metal screen or wire cooking rack",
    "Chopsticks",
    "Plastic gloves"
  ]
}