{
  "title":"How to Clean a Toilet Brush",
  "url":"https://www.wikihow.com/Clean-a-Toilet-Brush",
  "category_hierarchy":[
    "Home and Garden",
    "Home Maintenance",
    "Bathrooms"
  ],
  "methods":[
    {
      "name":"Soaking in Bleach",
      "steps":[
        {
          "headline":"Fill a bucket with hot water and bleach.",
          "description":"Make sure the bucket is deep enough to hold enough water to fully submerge the toilet brush and holder. Once you get the bucket, fill it with the hottest water you have access to. Then, pour 2 cups (470 mL) of bleach into the water. Read the back of your bleach bottle. If it gives you specific instructions, follow them. If you don't have a bucket, add the bleach to the toilet bowl. Then, put the toilet brush into the toilet bowl and let it sit for a few hours or overnight."
        },
        {
          "headline":"Submerge the brush and holder in the bleach for 1 hour.",
          "description":"Drop them into the bucket carefully and try not to splash. Wear gloves if you have them to make sure you don\u2019t get bleach on your skin or in your eyes. Leave the brush and holder to soak for at least 1 hour."
        },
        {
          "headline":"Rinse the brush and holder under hot water.",
          "description":"Use the hottest water that you have access to. Keep both under the water for at least 30 seconds. The hot water decomposes the active ingredient in bleach, making it safe for you to touch the bristles."
        },
        {
          "headline":"Dry the brush and holder before storing them.",
          "description":"Set the brush and holder on a towel to air-dry. Don\u2019t store them until they are completely dry. Storing a wet or damp brush will result in bacteria growth."
        },
        {
          "headline":"Repeat the bleaching process every month.",
          "description":"Even if you don\u2019t use the toilet brush that often, the brush will still host bacterial growth and collect filth. It is a good idea to clean it monthly. However, you can bleach it less frequently if you rarely use it."
        }
      ]
    },
    {
      "name":"Disinfecting the Toilet Brush",
      "steps":[
        {
          "headline":"Spray the toilet brush thoroughly with disinfectant.",
          "description":"You can use any disinfectant spray. Make sure when you spray the brush that you cover its entire surface area. Don\u2019t stop spraying until the bristles are dripping. Spray the brush over the toilet bowl."
        },
        {
          "headline":"Place the brush handle under the toilet seat for 10 minutes.",
          "description":"The weight of the toilet seat will hold the brush handle in place. You want to position the brush so that the bristles are hanging over the toilet bowl. Let all the excess disinfectant drip into the toilet. Keep the brush there to drip dry for at least 10 minutes. You can also dry the brush over a sink or tub. However, if you decide to do this, make sure to clean the sink and tub thoroughly afterward."
        },
        {
          "headline":"Run the brush under hot water.",
          "description":"Try to use the hottest water you can find. Place the brush bristles under the water and run the water over them. Keep the brush there until the water running off of the brush is completely clear."
        },
        {
          "headline":"Repeat the disinfection process with the brush holder.",
          "description":"Spray the holder with disinfectant and let it sit for 10 minutes. You can set the holder to dry on a towel or paper towel. After 10 minutes, run the holder under hot water."
        },
        {
          "headline":"Dry and store the brush and holder.",
          "description":"Set the brush and holder on a towel to air-dry. When both are completely dry, put the brush in the holder and store them. Make sure both are fully dry, as storing them wet or damp will encourage bacteria growth."
        }
      ]
    },
    {
      "name":"Cleaning with Natural Products",
      "steps":[
        {
          "headline":"Submerge the brush and holder in a vinegar-water solution overnight.",
          "description":"Fill a bucket halfway with vinegar and fill the rest with water. Make sure the bucket is big enough to fully submerge the toilet brush and holder. After soaking the brush and holder overnight, put on gloves and remove the brush and holder."
        },
        {
          "headline":"Scrub the brush with 2 grams (0.071 oz) of baking soda.",
          "description":"Wear rubber gloves. Sprinkle the 2 grams (0.071 oz) baking soda over the surface area of the brush. Use a separate brush to scrub, making sure to get in between all the bristles. While this step isn\u2019t necessary, its helpful to get an even deeper clean."
        },
        {
          "headline":"Run the brush and holder under hot water.",
          "description":"Use the hottest water you have access to. Leave the brush and holder under the water for at least 30 seconds. Don\u2019t remove either from the water until the water running off of them is completely clear."
        },
        {
          "headline":"Leave the brush and holder out to dry and then store them.",
          "description":"Leave them on a towel to air-dry. Wait until both are completely dry before storing them. Storing them damp or wet will result in bacteria growth."
        }
      ]
    }
  ],
  "text":" Soaking in Bleach Fill a bucket with hot water and bleach. Make sure the bucket is deep enough to hold enough water to fully submerge the toilet brush and holder. Once you get the bucket, fill it with the hottest water you have access to. Then, pour 2 cups (470 mL) of bleach into the water. Read the back of your bleach bottle. If it gives you specific instructions, follow them. If you don't have a bucket, add the bleach to the toilet bowl. Then, put the toilet brush into the toilet bowl and let it sit for a few hours or overnight. Submerge the brush and holder in the bleach for 1 hour. Drop them into the bucket carefully and try not to splash. Wear gloves if you have them to make sure you don\u2019t get bleach on your skin or in your eyes. Leave the brush and holder to soak for at least 1 hour. Rinse the brush and holder under hot water. Use the hottest water that you have access to. Keep both under the water for at least 30 seconds. The hot water decomposes the active ingredient in bleach, making it safe for you to touch the bristles. Dry the brush and holder before storing them. Set the brush and holder on a towel to air-dry. Don\u2019t store them until they are completely dry. Storing a wet or damp brush will result in bacteria growth. Repeat the bleaching process every month. Even if you don\u2019t use the toilet brush that often, the brush will still host bacterial growth and collect filth. It is a good idea to clean it monthly. However, you can bleach it less frequently if you rarely use it. Disinfecting the Toilet Brush Spray the toilet brush thoroughly with disinfectant. You can use any disinfectant spray. Make sure when you spray the brush that you cover its entire surface area. Don\u2019t stop spraying until the bristles are dripping. Spray the brush over the toilet bowl. Place the brush handle under the toilet seat for 10 minutes. The weight of the toilet seat will hold the brush handle in place. You want to position the brush so that the bristles are hanging over the toilet bowl. Let all the excess disinfectant drip into the toilet. Keep the brush there to drip dry for at least 10 minutes. You can also dry the brush over a sink or tub. However, if you decide to do this, make sure to clean the sink and tub thoroughly afterward. Run the brush under hot water. Try to use the hottest water you can find. Place the brush bristles under the water and run the water over them. Keep the brush there until the water running off of the brush is completely clear. Repeat the disinfection process with the brush holder. Spray the holder with disinfectant and let it sit for 10 minutes. You can set the holder to dry on a towel or paper towel. After 10 minutes, run the holder under hot water. Dry and store the brush and holder. Set the brush and holder on a towel to air-dry. When both are completely dry, put the brush in the holder and store them. Make sure both are fully dry, as storing them wet or damp will encourage bacteria growth. Cleaning with Natural Products Submerge the brush and holder in a vinegar-water solution overnight. Fill a bucket halfway with vinegar and fill the rest with water. Make sure the bucket is big enough to fully submerge the toilet brush and holder. After soaking the brush and holder overnight, put on gloves and remove the brush and holder. Scrub the brush with 2 grams (0.071 oz) of baking soda. Wear rubber gloves. Sprinkle the 2 grams (0.071 oz) baking soda over the surface area of the brush. Use a separate brush to scrub, making sure to get in between all the bristles. While this step isn\u2019t necessary, its helpful to get an even deeper clean. Run the brush and holder under hot water. Use the hottest water you have access to. Leave the brush and holder under the water for at least 30 seconds. Don\u2019t remove either from the water until the water running off of them is completely clear. Leave the brush and holder out to dry and then store them. Leave them on a towel to air-dry. Wait until both are completely dry before storing them. Storing them damp or wet will result in bacteria growth.",
  "tyn_model":[
    "water",
    "bleach",
    "toilet brush",
    "bucket",
    "toilet bowl",
    "towel",
    "toilet seat",
    "vinegar",
    "baking soda",
    "hot water",
    "bleach bottle",
    "disinfectant spray",
    "natural products"
  ],
  "tyn_section":[
    "Bleach",
    "plastic apron",
    "Large bucket",
    "Plastic gloves",
    "Disinfectant spray",
    "White vinegar",
    "Baking soda",
    "Scrub brush",
    "Towels"
  ]
}