{
  "title":"How to Eat Panettone",
  "url":"https://www.wikihow.com/Eat-Panettone",
  "category_hierarchy":[
    "Food and Entertaining",
    "Recipes",
    "World Cuisines",
    "European Cuisine",
    "Italian Cuisine"
  ],
  "methods":[
    {
      "name":"Eating Panettone Traditionally",
      "steps":[
        {
          "headline":"Remove the wrapping paper from the sides of the panettone.",
          "description":"Most panettone come with cellophane or paper wrapping around the sides, sometimes both. Remove these exterior wrappings and throw them away before slicing into your panettone."
        },
        {
          "headline":"Warm your panettone if you like warm breads.",
          "description":"This step is optional, but if you like warm breads, simply place the unwrapped panettone in your oven at 200 \u00b0F (93 \u00b0C) for 5-10 minutes. Remove it from the oven before starting to slice it."
        },
        {
          "headline":"Slice your panettone in narrow triangular pieces with a bread knife.",
          "description":"Just like you would slice into a cake, take a bread knife and cut into your panettone from the top to the bottom. Starting from the same center point, make another cut going out just a little bit from the center to make your first narrow slice. Continue cutting the panettone in this manner until you have as many narrow slices as you need for you and your guests."
        },
        {
          "headline":"Eat a slice of panettone with your morning coffee as breakfast.",
          "description":"Europeans often eat panettone with breakfast around the holidays. Simply slice it into narrow pieces and serve it with cups of your favorite coffee, by itself or with other breakfast foods. Some people like to dip their panettone into their coffee before eating it. If this sounds good to you, give it a try!"
        },
        {
          "headline":"Serve slices of panettone with glasses of Marsala as a mid-day treat.",
          "description":"If your family enjoys having a tea time or small afternoon meal, as many Europeans do, serve slices of panettone with Marsala or other Italian wine at this time. Get enough small plates and wine glasses for each of your guests, slice your panettone and pour the wine accordingly."
        },
        {
          "headline":"Eat panettone after dinner with a glass of Moscato as dolce.",
          "description":"Try your slice of panettone with a glass of sparkling white wine, such as Moscato or Spumante, after dinner as your dessert, or dolce. Find Italian sparkling white wine at your nearest grocery or wine store."
        },
        {
          "headline":"Add whipped cream to the inside before serving as an extra sweet surprise.",
          "description":"If you\u2019re serving your panettone for dessert, try slicing the top of the loaf off and carving a bit of the inside out. Save the pieces as morsels for snacking. Fill the cavity with whipped cream and put the top of the loaf back on. Slice your filled panettone in thin slices as you normally would to serve to your guests."
        },
        {
          "headline":"Tear your panettone and eat it in a glass of milk instead of slicing it.",
          "description":"Another way that Italians enjoy panettone doesn\u2019t involve slicing it at all. Try simply unwrapping your panettone and setting it out. Give each person a 16  fl oz (470 mL) glass and have them tear off pieces of the panettone to place in their glass. Fill the rest of each glass with whole milk. Have each person enjoy their milk-soaked glass of panettone with a dessert spoon."
        }
      ]
    },
    {
      "name":"Making Panettone-Based Desserts",
      "steps":[
        {
          "headline":"Try double-chocolate filled panettone as a decadent dessert.",
          "description":"To make double-chocolate filled panettone, warm 150 mL (5.1  fl oz) double cream in a pan on the stove without letting it boil, then add 150 g (5.3 oz) white chocolate and stir it until smooth. Do this again with the same amount of double cream and 150 g (5.3 oz) dark chocolate in a separate pan. Cut your panettone horizontally into 5 slices and spread the white chocolate ganache between each layer before reassembling the loaf. Pour the dark chocolate ganache over the reassembled loaf and allow it to set before serving. Cut the filled panettone into thin slices like you normally would to serve it."
        },
        {
          "headline":"Make panettone pudding if your family likes bread puddings.",
          "description":"Cut your panettone loaf into 5 medium wedges and butter 1 side of each of them. Cut the wedges in half and arrange them buttered-side up in a 850 mL (29  fl oz) shallow, greased baking dish. In a bowl, whisk 2 eggs, 150 mL (5.1  fl oz) double cream, 225 mL (7.6  fl oz) milk, 1  tsp (4.9 mL) vanilla extract, and 2 US tbsp (30 mL) caster sugar together and pour it over the bread slices. Bake the panettone pudding at 160 \u00b0C (320 \u00b0F) for 35 minutes, or until the pudding is just set."
        },
        {
          "headline":"Make Santa Claus\u2019s dessert for adults on Christmas eve.",
          "description":"Beat 250 mL (8.5  fl oz) double cream and 50 g (1.8 oz) icing sugar with an electric mixer until it stiffens. Cut your panettone loaf into large chunks and place them in a serving bowl. Drizzle 175 mL (5.9  fl oz) Vin Santo over the panettone and scoop your whipped cream out evenly over the dessert. Sprinkle the top with mixed candied peel or dried fruit before serving."
        }
      ]
    },
    {
      "name":"Cooking Italian Sausage and Panettone Stuffing",
      "steps":[
        {
          "headline":"Chop 1 lb (450 g) panettone into 1 in (2.5 cm) cubes.",
          "description":"If your panettone has a sugar crust on top, slice this off with a bread knife before slicing your cubes. After your cubes are sliced, lay them out on a large baking sheet so they\u2019re not touching."
        },
        {
          "headline":"Bake panettone cubes on for 10 minutes at 400 \u00b0F (204 \u00b0C).",
          "description":"Preheat your oven, and when it\u2019s ready, put your panettone cubes in and let them bake for 10 minutes, or until their edges are gold and crispy. Allow them to cool completely. If you want, do these steps ahead of time and store your panettone cubes in an airtight container until you\u2019re ready to make your stuffing."
        },
        {
          "headline":"Chop 2 onions and 3 stalks of celery into small pieces.",
          "description":"You want your pieces to be small, but not so small that they\u2019ll be mushy when you cook them. Begin warming a large sautee pan on the stove for the next step."
        },
        {
          "headline":"Sautee your onions and celery with 2 US tbsp (30 mL) oil for 10 minutes.",
          "description":"Add the oil to your sautee pan and let it warm. Add your chopped vegetables and cook them for 10 minutes. Stir them frequently to prevent any of the sides from burning. Remove the vegetables from heat before 10 minutes if they appear to be fully cooked or are becoming mushy."
        },
        {
          "headline":"Add 2 lb (910 g) Italian sausage and 2  fl oz (59 mL) oil to your pan.",
          "description":"When your vegetables have cooked for 10 minutes, add sausage and oil to the pan. Cook the sausage for 10 minutes, breaking it up into small pieces as you stir it to allow it to cook evenly. Continue stirring the mixture for the entire 10 minutes, or until the sausage is brown and fully cooked."
        },
        {
          "headline":"Combine panettone and sausage mixture in a 3 in \u00d7 8 in (7.6 cm \u00d7 20.3 cm) baking dish.",
          "description":"When your sausage is fully cooked, remove the mixture from the stove and spoon it into your baking dish. Add your toasted panettone cubes and stir everything together in the dish."
        },
        {
          "headline":"Whisk 4 eggs in a bowl and add 16  fl oz (470 mL) chicken broth.",
          "description":"Crack 4 eggs into a separate bowl and whisk them until the whites and yolks are combined. Taste your chicken broth and add salt to it until you feel it\u2019s salty enough. Then add the chicken broth and stir the liquids together. Do not taste the mixture again after adding the eggs, as consuming raw eggs can be a potential risk of salmonella contamination."
        },
        {
          "headline":"Pour chicken broth over the stuffing mixture and bake for 45 minutes.",
          "description":"Your oven should still be heated at 400 \u00b0F (204 \u00b0C) from toasting your panettone cubes. Stir the combined broth and stuffing mixture so the bread cubes and sausage are coated in broth, then put the pan in the oven for 45 minutes. Chop a large handful of fresh parsley and sprinkle it over the stuffing before you serve it."
        }
      ]
    }
  ],
  "text":" Eating Panettone Traditionally Remove the wrapping paper from the sides of the panettone. Most panettone come with cellophane or paper wrapping around the sides, sometimes both. Remove these exterior wrappings and throw them away before slicing into your panettone. Warm your panettone if you like warm breads. This step is optional, but if you like warm breads, simply place the unwrapped panettone in your oven at 200 \u00b0F (93 \u00b0C) for 5-10 minutes. Remove it from the oven before starting to slice it. Slice your panettone in narrow triangular pieces with a bread knife. Just like you would slice into a cake, take a bread knife and cut into your panettone from the top to the bottom. Starting from the same center point, make another cut going out just a little bit from the center to make your first narrow slice. Continue cutting the panettone in this manner until you have as many narrow slices as you need for you and your guests. Eat a slice of panettone with your morning coffee as breakfast. Europeans often eat panettone with breakfast around the holidays. Simply slice it into narrow pieces and serve it with cups of your favorite coffee, by itself or with other breakfast foods. Some people like to dip their panettone into their coffee before eating it. If this sounds good to you, give it a try! Serve slices of panettone with glasses of Marsala as a mid-day treat. If your family enjoys having a tea time or small afternoon meal, as many Europeans do, serve slices of panettone with Marsala or other Italian wine at this time. Get enough small plates and wine glasses for each of your guests, slice your panettone and pour the wine accordingly. Eat panettone after dinner with a glass of Moscato as dolce. Try your slice of panettone with a glass of sparkling white wine, such as Moscato or Spumante, after dinner as your dessert, or dolce. Find Italian sparkling white wine at your nearest grocery or wine store. Add whipped cream to the inside before serving as an extra sweet surprise. If you\u2019re serving your panettone for dessert, try slicing the top of the loaf off and carving a bit of the inside out. Save the pieces as morsels for snacking. Fill the cavity with whipped cream and put the top of the loaf back on. Slice your filled panettone in thin slices as you normally would to serve to your guests. Tear your panettone and eat it in a glass of milk instead of slicing it. Another way that Italians enjoy panettone doesn\u2019t involve slicing it at all. Try simply unwrapping your panettone and setting it out. Give each person a 16  fl oz (470 mL) glass and have them tear off pieces of the panettone to place in their glass. Fill the rest of each glass with whole milk. Have each person enjoy their milk-soaked glass of panettone with a dessert spoon. Making Panettone-Based Desserts Try double-chocolate filled panettone as a decadent dessert. To make double-chocolate filled panettone, warm 150 mL (5.1  fl oz) double cream in a pan on the stove without letting it boil, then add 150 g (5.3 oz) white chocolate and stir it until smooth. Do this again with the same amount of double cream and 150 g (5.3 oz) dark chocolate in a separate pan. Cut your panettone horizontally into 5 slices and spread the white chocolate ganache between each layer before reassembling the loaf. Pour the dark chocolate ganache over the reassembled loaf and allow it to set before serving. Cut the filled panettone into thin slices like you normally would to serve it. Make panettone pudding if your family likes bread puddings. Cut your panettone loaf into 5 medium wedges and butter 1 side of each of them. Cut the wedges in half and arrange them buttered-side up in a 850 mL (29  fl oz) shallow, greased baking dish. In a bowl, whisk 2 eggs, 150 mL (5.1  fl oz) double cream, 225 mL (7.6  fl oz) milk, 1  tsp (4.9 mL) vanilla extract, and 2 US tbsp (30 mL) caster sugar together and pour it over the bread slices. Bake the panettone pudding at 160 \u00b0C (320 \u00b0F) for 35 minutes, or until the pudding is just set. Make Santa Claus\u2019s dessert for adults on Christmas eve. Beat 250 mL (8.5  fl oz) double cream and 50 g (1.8 oz) icing sugar with an electric mixer until it stiffens. Cut your panettone loaf into large chunks and place them in a serving bowl. Drizzle 175 mL (5.9  fl oz) Vin Santo over the panettone and scoop your whipped cream out evenly over the dessert. Sprinkle the top with mixed candied peel or dried fruit before serving. Cooking Italian Sausage and Panettone Stuffing Chop 1 lb (450 g) panettone into 1 in (2.5 cm) cubes. If your panettone has a sugar crust on top, slice this off with a bread knife before slicing your cubes. After your cubes are sliced, lay them out on a large baking sheet so they\u2019re not touching. Bake panettone cubes on for 10 minutes at 400 \u00b0F (204 \u00b0C). Preheat your oven, and when it\u2019s ready, put your panettone cubes in and let them bake for 10 minutes, or until their edges are gold and crispy. Allow them to cool completely. If you want, do these steps ahead of time and store your panettone cubes in an airtight container until you\u2019re ready to make your stuffing. Chop 2 onions and 3 stalks of celery into small pieces. You want your pieces to be small, but not so small that they\u2019ll be mushy when you cook them. Begin warming a large sautee pan on the stove for the next step. Sautee your onions and celery with 2 US tbsp (30 mL) oil for 10 minutes. Add the oil to your sautee pan and let it warm. Add your chopped vegetables and cook them for 10 minutes. Stir them frequently to prevent any of the sides from burning. Remove the vegetables from heat before 10 minutes if they appear to be fully cooked or are becoming mushy. Add 2 lb (910 g) Italian sausage and 2  fl oz (59 mL) oil to your pan. When your vegetables have cooked for 10 minutes, add sausage and oil to the pan. Cook the sausage for 10 minutes, breaking it up into small pieces as you stir it to allow it to cook evenly. Continue stirring the mixture for the entire 10 minutes, or until the sausage is brown and fully cooked. Combine panettone and sausage mixture in a 3 in \u00d7 8 in (7.6 cm \u00d7 20.3 cm) baking dish. When your sausage is fully cooked, remove the mixture from the stove and spoon it into your baking dish. Add your toasted panettone cubes and stir everything together in the dish. Whisk 4 eggs in a bowl and add 16  fl oz (470 mL) chicken broth. Crack 4 eggs into a separate bowl and whisk them until the whites and yolks are combined. Taste your chicken broth and add salt to it until you feel it\u2019s salty enough. Then add the chicken broth and stir the liquids together. Do not taste the mixture again after adding the eggs, as consuming raw eggs can be a potential risk of salmonella contamination. Pour chicken broth over the stuffing mixture and bake for 45 minutes. Your oven should still be heated at 400 \u00b0F (204 \u00b0C) from toasting your panettone cubes. Stir the combined broth and stuffing mixture so the bread cubes and sausage are coated in broth, then put the pan in the oven for 45 minutes. Chop a large handful of fresh parsley and sprinkle it over the stuffing before you serve it.",
  "tyn_model":[
    "panettone",
    "eggs",
    "oven",
    "double cream",
    "oil",
    "sausage",
    "chicken broth",
    "bread knife",
    "whipped cream",
    "milk",
    "vegetables",
    "marsala",
    "sparkling white wine",
    "white chocolate",
    "dark chocolate",
    "panettone pudding",
    "bowl",
    "onions",
    "celery",
    "stove",
    "pan",
    "baking dish",
    "broth",
    "cellophane",
    "paper",
    "coffee",
    "small plates",
    "wine glasses",
    "moscato",
    "dessert spoon",
    "butter",
    "shallow, greased baking dish",
    "vanilla extract",
    "caster sugar",
    "icing sugar",
    "electric mixer",
    "serving bowl",
    "vin santo",
    "mixed candied peel",
    "baking sheet",
    "airtight container",
    "large sautee pan",
    "sautee pan",
    "italian sausage",
    "\u00d7 8",
    "\u00d7 20.3",
    "salt",
    "bread",
    "parsley"
  ],
  "tyn_section":[
    "Bread knife",
    "Small plates",
    "Wine glasses",
    "Medium sauce pans",
    "Large baking pans",
    "Large serving bowls"
  ]
}