{
  "title":"How to Steam Brussel Sprouts",
  "url":"https://www.wikihow.com/Steam-Brussel-Sprouts",
  "category_hierarchy":[
    "Food and Entertaining",
    "Recipes",
    "Fruits and Vegetables",
    "Cruciferous Vegetables"
  ],
  "methods":[
    {
      "name":"Using a Steamer Basket",
      "steps":[
        {
          "headline":"Wash and cut the Brussels sprouts.",
          "description":"Rinse the Brussels sprouts with water to remove dirt and debris. Pull off any yellow or brown leaves you see, then remove the tip of each sprout and cut them in half lengthwise with a sharp knife. You may want to pat the Brussels sprouts dry before you start chopping them to prevent any accidents with the knife."
        },
        {
          "headline":"Boil about 1 inch (2.5 cm) of water in a pot that fits your steamer.",
          "description":"Make sure the bottom of the steamer basket isn't touching the water. That way, only steam will cook your Brussels sprouts. The basket should sit 1\u20132 inches (2.5\u20135.1 cm) over the boiling water."
        },
        {
          "headline":"Place the Brussels sprouts into the basket and position the basket in the pot.",
          "description":"Once you've put the sprouts in the basket, carefully place the basket over the boiling water. Be careful not to burn yourself on the steam! Cover the pot but leave a small gap. This small gap allows steam to escape during the cooking process and helps the sprouts retain their color."
        },
        {
          "headline":"Steam the Brussels sprouts for 6-8 minutes until they get tender.",
          "description":"They're cooked to the right tenderness when you can stick a knife or fork into the stem and it slides in easily. This should take 6-8 minutes, depending on the size of your sprouts. Be sure to check your Brussels sprouts often to avoid overcooking them! If you're using an electric steamer, don't forget to set the timer."
        }
      ]
    },
    {
      "name":"Using a Pot or Pan",
      "steps":[
        {
          "headline":"Wash and cut the Brussels sprouts.",
          "description":"Run the Brussels sprouts under lukewarm water and remove any yellow or brown leaves. Remove just the tip of each sprout and cut them in half from the top to the stem. Pat the veggies dry before you cut them to prevent your hands from slipping."
        },
        {
          "headline":"Bring 1\u20132 inches (2.5\u20135.1 cm) of water to boil in a large pan or pot.",
          "description":"Add enough water to just cover the Brussels sprouts. If desired, you can add 1 tablespoon (14.8 ml) of salt to the water once it starts boiling. Waiting until the water is boiling ensures the salt properly dissolves once you add it to the water."
        },
        {
          "headline":"Add your Brussels sprouts to the pot and cover it with a lid.",
          "description":"You can gently drop them into the pot or use a pair of tongs to place the Brussels sprouts in the boiling water. If desired, sprinkle a little salt over the sprouts before putting the lid on the pot."
        },
        {
          "headline":"Reduce the heat to medium-low and simmer for 5 minutes.",
          "description":"After 5 minutes, the water should be evaporated. Check to make sure the sprouts are tender by inserting a knife or fork into one of them. The time can vary depending on the size of your Brussels sprouts and how tender you prefer them. If the water doesn't evaporate completely, drain Brussels sprouts before serving through a colander."
        }
      ]
    },
    {
      "name":"Using a Microwave",
      "steps":[
        {
          "headline":"Wash and trim the Brussels sprouts.",
          "description":"Rinse the Brussels sprouts with lukewarm water and remove any leaves that look yellow or brown. Cut the tip off of each sprout and cut them in half lengthwise. You may want to pat the sprouts dry before you start trimming them to prevent slipperiness."
        },
        {
          "headline":"Place your Brussels sprouts in a large, microwave-safe bowl.",
          "description":"Transfer the Brussels sprouts to a container that can be heated, like a large glass bowl. Avoid using flimsy plastic bowls for this, since those could melt in the microwave."
        },
        {
          "headline":"Add about 1 tablespoon of water to the bowl and cover it.",
          "description":"The water should just barely cover the Brussels sprouts. Place a microwave-safe lid or plate on top of the bowl to trap in the steam, but don't snap the lid closed."
        },
        {
          "headline":"Cook the Brussels sprouts on HIGH for 1 minute until they're tender.",
          "description":"After 1 minute, test how cooked the Brussels sprouts are by inserting a knife or fork into the stem. If the utensil slips in and comes out easily, your Brussels sprouts are cooked through. If needed, repeat at 30-second intervals until the Brussels sprouts are tender."
        },
        {
          "headline":"Drain any excess liquid from the bowl and serve the Brussels sprouts.",
          "description":"If the water doesn't evaporate completely, you may have to drain Brussels sprouts before serving. Place a colander in your sink and pour the sprouts into it to drain the water."
        }
      ]
    }
  ],
  "text":" Using a Steamer Basket Wash and cut the Brussels sprouts. Rinse the Brussels sprouts with water to remove dirt and debris. Pull off any yellow or brown leaves you see, then remove the tip of each sprout and cut them in half lengthwise with a sharp knife. You may want to pat the Brussels sprouts dry before you start chopping them to prevent any accidents with the knife. Boil about 1 inch (2.5 cm) of water in a pot that fits your steamer. Make sure the bottom of the steamer basket isn't touching the water. That way, only steam will cook your Brussels sprouts. The basket should sit 1\u20132 inches (2.5\u20135.1 cm) over the boiling water. Place the Brussels sprouts into the basket and position the basket in the pot. Once you've put the sprouts in the basket, carefully place the basket over the boiling water. Be careful not to burn yourself on the steam! Cover the pot but leave a small gap. This small gap allows steam to escape during the cooking process and helps the sprouts retain their color. Steam the Brussels sprouts for 6-8 minutes until they get tender. They're cooked to the right tenderness when you can stick a knife or fork into the stem and it slides in easily. This should take 6-8 minutes, depending on the size of your sprouts. Be sure to check your Brussels sprouts often to avoid overcooking them! If you're using an electric steamer, don't forget to set the timer. Using a Pot or Pan Wash and cut the Brussels sprouts. Run the Brussels sprouts under lukewarm water and remove any yellow or brown leaves. Remove just the tip of each sprout and cut them in half from the top to the stem. Pat the veggies dry before you cut them to prevent your hands from slipping. Bring 1\u20132 inches (2.5\u20135.1 cm) of water to boil in a large pan or pot. Add enough water to just cover the Brussels sprouts. If desired, you can add 1 tablespoon (14.8 ml) of salt to the water once it starts boiling. Waiting until the water is boiling ensures the salt properly dissolves once you add it to the water. Add your Brussels sprouts to the pot and cover it with a lid. You can gently drop them into the pot or use a pair of tongs to place the Brussels sprouts in the boiling water. If desired, sprinkle a little salt over the sprouts before putting the lid on the pot. Reduce the heat to medium-low and simmer for 5 minutes. After 5 minutes, the water should be evaporated. Check to make sure the sprouts are tender by inserting a knife or fork into one of them. The time can vary depending on the size of your Brussels sprouts and how tender you prefer them. If the water doesn't evaporate completely, drain Brussels sprouts before serving through a colander. Using a Microwave Wash and trim the Brussels sprouts. Rinse the Brussels sprouts with lukewarm water and remove any leaves that look yellow or brown. Cut the tip off of each sprout and cut them in half lengthwise. You may want to pat the sprouts dry before you start trimming them to prevent slipperiness. Place your Brussels sprouts in a large, microwave-safe bowl. Transfer the Brussels sprouts to a container that can be heated, like a large glass bowl. Avoid using flimsy plastic bowls for this, since those could melt in the microwave. Add about 1 tablespoon of water to the bowl and cover it. The water should just barely cover the Brussels sprouts. Place a microwave-safe lid or plate on top of the bowl to trap in the steam, but don't snap the lid closed. Cook the Brussels sprouts on HIGH for 1 minute until they're tender. After 1 minute, test how cooked the Brussels sprouts are by inserting a knife or fork into the stem. If the utensil slips in and comes out easily, your Brussels sprouts are cooked through. If needed, repeat at 30-second intervals until the Brussels sprouts are tender. Drain any excess liquid from the bowl and serve the Brussels sprouts. If the water doesn't evaporate completely, you may have to drain Brussels sprouts before serving. Place a colander in your sink and pour the sprouts into it to drain the water.",
  "tyn_model":[
    "brussels sprouts",
    "water",
    "pot",
    "bowl",
    "knife",
    "fork",
    "salt",
    "steamer basket",
    "basket",
    "colander",
    "sharp knife",
    "steamer",
    "electric steamer",
    "pan wash",
    "large pan",
    "microwave wash",
    "bowls",
    "microwave",
    "microwave-safe lid",
    "plate"
  ],
  "tyn_section":[
    "Using a Steamer Basket",
    "Steamer basket",
    "Large pot",
    "Knife",
    "Paper towels",
    "Using a Pot or Pan",
    "Large pot or pan",
    "Colander",
    "Using the Microwave",
    "Large microwave-safe bowl",
    "Large spoon"
  ]
}