{
  "title":"How to Bake Kabocha Squash",
  "url":"https://www.wikihow.com/Bake-Kabocha-Squash",
  "category_hierarchy":[
    "Food and Entertaining",
    "Recipes",
    "Fruits and Vegetables",
    "Squash"
  ],
  "methods":[
    {
      "name":"Cutting the Squash",
      "steps":[
        {
          "headline":"Cut the stem off the top of the squash.",
          "description":"Place the tip of a sharp kitchen knife 1 inch (2.5 cm) from the stem of the squash. Penetrate the skin of the squash and cut around the stem. Then, pull up on the stem to remove it. You need a sharp knife to cut through the thick skin of the squash."
        },
        {
          "headline":"Cut the squash in half.",
          "description":"Use the kitchen knife to make a vertical cut in the squash so that it\u2019s 2 separate and equal-sized pieces. You should now be able to see the seeds in the center of the squash."
        },
        {
          "headline":"Scoop the seeds out of the center of the squash.",
          "description":"Scrape out the seeds and the soft flesh in the center of each of the halves with a spoon. Continue scraping until the interior of the squash is smooth. You can discard the seeds or bake them as you would pumpkin seeds."
        },
        {
          "headline":"Cut the squash into slices.",
          "description":"Cut the halves in half, and then cut them again. This should create a total of 8 slices. If you want thicker slices of squash, you can stop cutting when you have 4 pieces."
        },
        {
          "headline":"Run the slices under cold water.",
          "description":"Cleaning off the squash will remove any potential pesticides or dirt that was on the squash. This is an important step before you start cooking it."
        }
      ]
    },
    {
      "name":"Making Basic Roasted Kabocha Squash",
      "steps":[
        {
          "headline":"Preheat the oven to 400 \u00b0F (204 \u00b0C).",
          "description":"Place the slices of kabocha squash evenly apart on a baking sheet. Turn your oven to 400 \u00b0F (204 \u00b0C) to start the preheating process. You can use a metal or glass baking sheet. A preheated oven will ensure an even cook in your squash."
        },
        {
          "headline":"Coat the squash with the oil.",
          "description":"Sprinkle 2 tablespoons (30 ml) of olive oil, avocado oil, or melted coconut oil on top of the slices of squash. Coat the slices evenly, making sure to get the oil on both sides. You can smooth the oil on the slices with a pastry brush or your fingers."
        },
        {
          "headline":"Season the slices with cayenne pepper or cinnamon.",
          "description":"If you want savory and spicy flavors in your squash, use cayenne pepper. If you want sweeter tasting squash, sprinkle the slices with cinnamon instead. The oil will help the spices stick to the slices of squash."
        },
        {
          "headline":"Roast the squash in the oven for 30-35 minutes.",
          "description":"Flip the slices after they have cooked for 15 minutes so that both sides cook evenly. Once the squash is finished cooking, poke it with a fork. The flesh should be soft."
        },
        {
          "headline":"Let the squash cool and serve.",
          "description":"Remove the cooking sheet from the oven and let it sit at room temperature for 5 minutes. You can then eat the slices with a fork or with your hands. Wear oven mitts when you remove the squash from the oven. You can store the squash in an airtight container for up to 4 days in the refrigerator."
        }
      ]
    },
    {
      "name":"Cooking Sweet and Spicy Squash",
      "steps":[
        {
          "headline":"Preheat the oven to 400 \u00b0F (204 \u00b0C).",
          "description":"Turn the oven to 400 \u00b0F (204 \u00b0C) and wait for the preheating indicator light to come on or for your oven to beep. Doing this will ensure an even cook on your squash. Prepare the other ingredients while your oven preheats."
        },
        {
          "headline":"Combine the sugar, cayenne pepper, and other dry ingredients in a bowl.",
          "description":"Mix all of the dry ingredients in a bowl until they are well incorporated. This mixture will act as a dry rub that will infuse a sweet and spicy taste to your squash."
        },
        {
          "headline":"Coat the squash slices with the dry spices.",
          "description":"Sprinkle the slices with the dry rub that you created. Make sure to get even coverage over all of the squash for an even flavor."
        },
        {
          "headline":"Pour the soy sauce and oil over the slices.",
          "description":"Put 1.25 teaspoons (6.2 ml) of soy sauce and 2 tablespoons (30 ml) olive oil, avocado oil, or melted coconut oil onto the slices. Get an equal coverage of the wet ingredients onto all of the squash. If you are using coconut oil, you can put it in the microwave for 15 seconds to melt it."
        },
        {
          "headline":"Bake the slices in the oven for 15 minutes and turn them over.",
          "description":"As the squash cooks, it should turn golden brown. Once they have cooked for 15 minutes, flip them over with tongs or a spatula so that the other side also browns. If you fail to do this, one side of the squash may be soggy."
        },
        {
          "headline":"Sprinkle the slices with more sugar and cook for another 15 minutes.",
          "description":"Adding the sugar to the other side of the slices will let them caramelize. If you want your squash to be sweeter, use more sugar."
        },
        {
          "headline":"Remove the slices from the oven and serve.",
          "description":"Remove the slices from the oven and let them cool for 5 minutes in the container before you serve them. They should be aromatic and caramelized. Eat the squash with a fork. Store leftovers in an airtight container for up to 4 days in your fridge."
        }
      ]
    }
  ],
  "text":" Cutting the Squash Cut the stem off the top of the squash. Place the tip of a sharp kitchen knife 1 inch (2.5 cm) from the stem of the squash. Penetrate the skin of the squash and cut around the stem. Then, pull up on the stem to remove it. You need a sharp knife to cut through the thick skin of the squash. Cut the squash in half. Use the kitchen knife to make a vertical cut in the squash so that it\u2019s 2 separate and equal-sized pieces. You should now be able to see the seeds in the center of the squash. Scoop the seeds out of the center of the squash. Scrape out the seeds and the soft flesh in the center of each of the halves with a spoon. Continue scraping until the interior of the squash is smooth. You can discard the seeds or bake them as you would pumpkin seeds. Cut the squash into slices. Cut the halves in half, and then cut them again. This should create a total of 8 slices. If you want thicker slices of squash, you can stop cutting when you have 4 pieces. Run the slices under cold water. Cleaning off the squash will remove any potential pesticides or dirt that was on the squash. This is an important step before you start cooking it. Making Basic Roasted Kabocha Squash Preheat the oven to 400 \u00b0F (204 \u00b0C). Place the slices of kabocha squash evenly apart on a baking sheet. Turn your oven to 400 \u00b0F (204 \u00b0C) to start the preheating process. You can use a metal or glass baking sheet. A preheated oven will ensure an even cook in your squash. Coat the squash with the oil. Sprinkle 2 tablespoons (30 ml) of olive oil, avocado oil, or melted coconut oil on top of the slices of squash. Coat the slices evenly, making sure to get the oil on both sides. You can smooth the oil on the slices with a pastry brush or your fingers. Season the slices with cayenne pepper or cinnamon. If you want savory and spicy flavors in your squash, use cayenne pepper. If you want sweeter tasting squash, sprinkle the slices with cinnamon instead. The oil will help the spices stick to the slices of squash. Roast the squash in the oven for 30-35 minutes. Flip the slices after they have cooked for 15 minutes so that both sides cook evenly. Once the squash is finished cooking, poke it with a fork. The flesh should be soft. Let the squash cool and serve. Remove the cooking sheet from the oven and let it sit at room temperature for 5 minutes. You can then eat the slices with a fork or with your hands. Wear oven mitts when you remove the squash from the oven. You can store the squash in an airtight container for up to 4 days in the refrigerator. Cooking Sweet and Spicy Squash Preheat the oven to 400 \u00b0F (204 \u00b0C). Turn the oven to 400 \u00b0F (204 \u00b0C) and wait for the preheating indicator light to come on or for your oven to beep. Doing this will ensure an even cook on your squash. Prepare the other ingredients while your oven preheats. Combine the sugar, cayenne pepper, and other dry ingredients in a bowl. Mix all of the dry ingredients in a bowl until they are well incorporated. This mixture will act as a dry rub that will infuse a sweet and spicy taste to your squash. Coat the squash slices with the dry spices. Sprinkle the slices with the dry rub that you created. Make sure to get even coverage over all of the squash for an even flavor. Pour the soy sauce and oil over the slices. Put 1.25 teaspoons (6.2 ml) of soy sauce and 2 tablespoons (30 ml) olive oil, avocado oil, or melted coconut oil onto the slices. Get an equal coverage of the wet ingredients onto all of the squash. If you are using coconut oil, you can put it in the microwave for 15 seconds to melt it. Bake the slices in the oven for 15 minutes and turn them over. As the squash cooks, it should turn golden brown. Once they have cooked for 15 minutes, flip them over with tongs or a spatula so that the other side also browns. If you fail to do this, one side of the squash may be soggy. Sprinkle the slices with more sugar and cook for another 15 minutes. Adding the sugar to the other side of the slices will let them caramelize. If you want your squash to be sweeter, use more sugar. Remove the slices from the oven and serve. Remove the slices from the oven and let them cool for 5 minutes in the container before you serve them. They should be aromatic and caramelized. Eat the squash with a fork. Store leftovers in an airtight container for up to 4 days in your fridge.",
  "tyn_model":[
    "squash",
    "oven",
    "sugar",
    "oil",
    "coconut oil",
    "cayenne pepper",
    "fork",
    "kitchen knife",
    "baking sheet",
    "olive oil",
    "avocado oil",
    "cinnamon",
    "airtight container",
    "bowl",
    "soy sauce",
    "sharp knife",
    "spoon",
    "pumpkin seeds",
    "water",
    "kabocha squash",
    "pastry brush",
    "cooking sheet",
    "oven mitts",
    "refrigerator",
    "spices",
    "microwave",
    "spatula"
  ],
  "tyn_section":[
    "Baking sheet",
    "Knife",
    "Spoon",
    "Spatula or tongs"
  ]
}