{
  "title":"How to Grill Ham Slices",
  "url":"https://www.wikihow.com/Grill-Ham-Slices",
  "category_hierarchy":[
    "Food and Entertaining",
    "Recipes",
    "Meat",
    "Pork"
  ],
  "methods":[
    {
      "name":"Making a Glaze",
      "steps":[
        {
          "headline":"Combine ingredients for a buttery pineapple glaze.",
          "description":"For a rich glaze, melt 1/4 cup (56 g) of butter in a mixing bowl. Stir in 1 cup (240 ml) of pineapple juice, 1 cup (240 ml) of sherry or apple juice, 1 tablespoon (14.8 ml) (6 g) of ground mustard, and 1/4 teaspoon (0.5 g) ground cloves. Stir until the sugar dissolves."
        },
        {
          "headline":"Mix and microwave a spicy brown sugar glaze for 1 minute.",
          "description":"If you'd like a sweet glaze with a little heat, stir together 1 cup (200 g) of packed brown sugar, \u20444 cup (59 ml) of lemon juice, and 1/3 cup (79 g) of prepared horseradish. Microwave the glaze until the sugar dissolves and the glaze is warm."
        },
        {
          "headline":"Simmer a maple orange glaze on the stove top.",
          "description":"Put the juice from 1 orange into a small skillet or saucepan. Stir in \u20444 cup (59 ml) of maple syrup, 1 clove of garlic, 4 whole cloves, 1 pinch of ground cinnamon, and 1 pinch of crushed red pepper flakes. Heat the glaze over medium and stir it frequently. Keep simmering the glaze until half of the liquid has evaporated. If you like, strain out the cloves and garlic before using the glaze."
        },
        {
          "headline":"Cook a cider ginger glaze on the stove.",
          "description":"Measure 1 cup (240 ml) of apple cider, 2 cups (400 g) of dark brown sugar, 7 whole cloves, and \u00bd teaspoon (0.5 g) of ground ginger or 1 tablespoon (14.8 ml) (7 g) of grated fresh ginger into a saucepan. Stir and heat the glaze over medium heat until the glaze becomes syrupy. Half of the liquid should evaporate as the glaze cooks."
        },
        {
          "headline":"Simmer a sweet and spicy rosemary glaze.",
          "description":"Put 1/3 cup (105 g) of orange marmalade, 1 tablespoon (15 ml) of cider vinegar, 1 1/2 teaspoons (0.8 g) of chopped fresh rosemary, 1/2 teaspoon (0.5 g) of dry mustard, \u20442 teaspoon (2.5 ml) of soy sauce, and 1 pinch of crushed red pepper flakes. Stir and heat the glaze over medium until the glaze is syrupy. The glaze should cook for 2 to 3 minutes."
        },
        {
          "headline":"Use your favorite store-bought glaze.",
          "description":"If you don't have the time or inclination to make your own ham glaze, use your favorite purchased glaze, sauce, or dressing. For example, you can baste the ham slices with:\nBarbecue sauce\nItalian dressing\nMaple dijon dressing\nTeriyaki sauce"
        }
      ]
    },
    {
      "name":"Cooking the Ham on the Grill",
      "steps":[
        {
          "headline":"Heat a gas or charcoal grill to medium-hot.",
          "description":"Turn on a gas grill to medium-high or fill a chimney with charcoal briquettes. Light the charcoal and dump them on the center of the grill once the briquettes are hot and lightly ashy."
        },
        {
          "headline":"Oil the grill grate.",
          "description":"To prevent the ham slices from sticking, dip a paper towel in a little vegetable oil. Use tongs to hold the oiled paper towel and rub it over the grill grates."
        },
        {
          "headline":"Arrange the ham slices on the grill and brush them with glaze.",
          "description":"Lay one to two 1 lb (453 g) ham slices on the oiled grill grate. Dip a basting brush in whichever glaze you prepared and brush the glaze over the ham. Place the slices at least 1 in (2.5 cm) apart on the grill."
        },
        {
          "headline":"Grill the ham for 3 to 4 minutes.",
          "description":"Leave the lid off of the grill and let the ham slices cook so they brown a little on the bottom."
        },
        {
          "headline":"Baste the other side with glaze and grill them for 3 to 4 more minutes.",
          "description":"Use tongs to turn the ham slices over. Dip the basting brush in glaze and brush the other side of the ham. Grill the ham until it's completely warm throughout. Consider basting the ham slices with more glaze as they grill or refrigerate leftover glaze in an airtight container for 2 to 3 days. Store the leftover ham in an airtight container for up to 3 to 4 days."
        },
        {
          "headline":"Enjoy your grilled ham.",
          "description":""
        }
      ]
    }
  ],
  "text":" Making a Glaze Combine ingredients for a buttery pineapple glaze. For a rich glaze, melt 1/4 cup (56 g) of butter in a mixing bowl. Stir in 1 cup (240 ml) of pineapple juice, 1 cup (240 ml) of sherry or apple juice, 1 tablespoon (14.8 ml) (6 g) of ground mustard, and 1/4 teaspoon (0.5 g) ground cloves. Stir until the sugar dissolves. Mix and microwave a spicy brown sugar glaze for 1 minute. If you'd like a sweet glaze with a little heat, stir together 1 cup (200 g) of packed brown sugar, \u20444 cup (59 ml) of lemon juice, and 1/3 cup (79 g) of prepared horseradish. Microwave the glaze until the sugar dissolves and the glaze is warm. Simmer a maple orange glaze on the stove top. Put the juice from 1 orange into a small skillet or saucepan. Stir in \u20444 cup (59 ml) of maple syrup, 1 clove of garlic, 4 whole cloves, 1 pinch of ground cinnamon, and 1 pinch of crushed red pepper flakes. Heat the glaze over medium and stir it frequently. Keep simmering the glaze until half of the liquid has evaporated. If you like, strain out the cloves and garlic before using the glaze. Cook a cider ginger glaze on the stove. Measure 1 cup (240 ml) of apple cider, 2 cups (400 g) of dark brown sugar, 7 whole cloves, and \u00bd teaspoon (0.5 g) of ground ginger or 1 tablespoon (14.8 ml) (7 g) of grated fresh ginger into a saucepan. Stir and heat the glaze over medium heat until the glaze becomes syrupy. Half of the liquid should evaporate as the glaze cooks. Simmer a sweet and spicy rosemary glaze. Put 1/3 cup (105 g) of orange marmalade, 1 tablespoon (15 ml) of cider vinegar, 1 1/2 teaspoons (0.8 g) of chopped fresh rosemary, 1/2 teaspoon (0.5 g) of dry mustard, \u20442 teaspoon (2.5 ml) of soy sauce, and 1 pinch of crushed red pepper flakes. Stir and heat the glaze over medium until the glaze is syrupy. The glaze should cook for 2 to 3 minutes. Use your favorite store-bought glaze. If you don't have the time or inclination to make your own ham glaze, use your favorite purchased glaze, sauce, or dressing. For example, you can baste the ham slices with:\nBarbecue sauce\nItalian dressing\nMaple dijon dressing\nTeriyaki sauce Cooking the Ham on the Grill Heat a gas or charcoal grill to medium-hot. Turn on a gas grill to medium-high or fill a chimney with charcoal briquettes. Light the charcoal and dump them on the center of the grill once the briquettes are hot and lightly ashy. Oil the grill grate. To prevent the ham slices from sticking, dip a paper towel in a little vegetable oil. Use tongs to hold the oiled paper towel and rub it over the grill grates. Arrange the ham slices on the grill and brush them with glaze. Lay one to two 1 lb (453 g) ham slices on the oiled grill grate. Dip a basting brush in whichever glaze you prepared and brush the glaze over the ham. Place the slices at least 1 in (2.5 cm) apart on the grill. Grill the ham for 3 to 4 minutes. Leave the lid off of the grill and let the ham slices cook so they brown a little on the bottom. Baste the other side with glaze and grill them for 3 to 4 more minutes. Use tongs to turn the ham slices over. Dip the basting brush in glaze and brush the other side of the ham. Grill the ham until it's completely warm throughout. Consider basting the ham slices with more glaze as they grill or refrigerate leftover glaze in an airtight container for 2 to 3 days. Store the leftover ham in an airtight container for up to 3 to 4 days. Enjoy your grilled ham. ",
  "tyn_model":[
    "ham",
    "grill",
    "sugar",
    "brown sugar",
    "saucepan",
    "garlic",
    "crushed red pepper",
    "grill grate",
    "basting brush",
    "airtight container",
    "butter",
    "mixing bowl",
    "pineapple juice",
    "sherry or apple juice",
    "ground mustard",
    "ground cloves",
    "lemon juice",
    "prepared horseradish",
    "maple orange glaze",
    "stove top",
    "small skillet",
    "maple syrup",
    "ground cinnamon",
    "cider ginger",
    "stove",
    "apple cider",
    "dark brown sugar",
    "ground ginger",
    "grated fresh ginger",
    "orange marmalade",
    "cider vinegar",
    "fresh rosemary",
    "dry mustard",
    "soy sauce",
    "dressing",
    "barbecue sauce",
    "italian dressing",
    "maple dijon dressing",
    "teriyaki sauce",
    "gas or charcoal grill",
    "gas grill",
    "charcoal",
    "paper towel",
    "vegetable oil",
    "grill grates"
  ],
  "tyn_section":[
    "Mixing bowls",
    "Measuring cups and spoons",
    "Spoon or whisk",
    "Skillet",
    "Gas or charcoal grill",
    "Tongs",
    "Serving platter",
    "Basting brush",
    "Paper towels",
    "Vegetable oil",
    "Microwave, optional"
  ]
}