{
  "title":"How to Prune Oregano",
  "url":"https://www.wikihow.com/Prune-Oregano",
  "category_hierarchy":[
    "Home and Garden",
    "Gardening",
    "Planting and Growing",
    "Growing Herbs and Spices"
  ],
  "methods":[
    {
      "name":"Caring for Oregano During Growing Season",
      "steps":[
        {
          "headline":"Wait until your plant is at least 4 inches (10 cm) tall.",
          "description":"Trimming the plant too early could cause your plant to fail to thrive, so be patient. Luckily, oregano usually grows quickly. Pruning your oregano will encourage new growth. Not only will it grow more leaves, it'll even grow more stems!"
        },
        {
          "headline":"Cut back no more than 1/3rd of the plant at a time.",
          "description":"This prevents over-pruning. If you cut away too much of the plant at once, your plant may not survive. Before pruning your oregano again, make sure it's grown back to at least 4 inches (10 cm) tall."
        },
        {
          "headline":"Cut the stems when you need to remove several at once.",
          "description":"Place a pair of scissors or small pruning shears against the stem above the leaves where you plan to make your cut. Then, make a clean cut to remove the stalk. You may try to cut several stems at once, depending on the size of your plant. It's best if you cut just 1 stalk at a time."
        },
        {
          "headline":"Pinch off the stems for easy pruning.",
          "description":"Pinching is a quick, easy way to prune your herbs. Place your fingers on the stem just above the leaves, then use your fingernails to pinch off the stem. It helps to hold the base of the stem with your other hand to avoid damaging the rest of the stalk. This is a great option for removing 1 or 2 stems at a time."
        },
        {
          "headline":"Set the stalks aside while you continue pruning.",
          "description":"If you plan to use them in your kitchen, you should place them in a clean, dry container. Continue to cut until you've trimmed all of the stems you'd like to prune. If the removed stems are still green, you can use them in your kitchen! However, dead stems should be composted or thrown away."
        }
      ]
    },
    {
      "name":"Tending to Dormant Oregano",
      "steps":[
        {
          "headline":"Deadhead the flowers after they fade at the end of summer.",
          "description":"This allows the plant to direct its nutrients toward new growth instead of seeding. Using scissors or pruning shears, cut just below the flowers. You can also trim further down the stem, as long as you don't cut more than \u2153 of the stalk. As an alternative, you can deadhead the flowers by simply pinching off the old flower. This works better if the flower is dead or dying."
        },
        {
          "headline":"Stop pruning at least 2 weeks before cold weather is forecast.",
          "description":"Your plant will be vulnerable during cold weather, so it's a good idea to stop pruning it before winter comes. This increases the likelihood that it will survive winter! If you want to use your oregano during winter, it's best to rely on dried herbs that you've stored."
        },
        {
          "headline":"Remove dead stems during the winter.",
          "description":"Wait until late winter to prepare the oregano for regrowth in the spring. Look for stems that are dry, brown, and lack leaves. Trim them down to the base of the plant, just above the roots. You can use scissors or small pruning shears."
        },
        {
          "headline":"Add an organic liquid fertilizer to the oregano.",
          "description":"This will provide it with extra nutrients to help it go into the next growing season. For best results, mix the fertilizer into water and pour it over the plant at its next watering. Be sure to follow the label to ensure that you provide the right amount of fertilizer. You can find a liquid fertilizer at your local gardening store or online."
        }
      ]
    },
    {
      "name":"Harvesting Oregano",
      "steps":[
        {
          "headline":"Harvest oregano just before the plant flowers, or as needed.",
          "description":"Oregano is most flavorful right before the plant flowers, so this is the perfect time to harvest if you plan to dry or freeze your herbs. However, you can also harvest small amounts of oregano to use fresh in your kitchen. Keep in mind that the oregano may taste bitter after the plant flowers, so it's a good idea to harvest the remaining stems before your plant flowers. You can dry them by hanging them in bunches or using a dehydrator. Alternatively, you could freeze them. The best time to harvest oregano is in the morning after the dew dries. The flavor of your oregano will be strongest during warm weather."
        },
        {
          "headline":"Place your scissors 1/3rd of the way down a stem of oregano.",
          "description":"You can harvest less, but not more. Position the scissors against the stem in a spot that's in between the leaves to prevent damaging the leaves."
        },
        {
          "headline":"Run your fingers along the stem to remove just the leaves if you prefer.",
          "description":"Place your thumb and middle finger just below the leaves you want to harvest. Slowly run your hand up the stem to pull off the leaves, collecting them as you go. Place the leaves in a clean, dry container for use in your kitchen. Cut away the bare stem using your scissors. This is a great alternative for days when you just want a few leaves to season a dish."
        }
      ]
    }
  ],
  "text":" Caring for Oregano During Growing Season Wait until your plant is at least 4 inches (10 cm) tall. Trimming the plant too early could cause your plant to fail to thrive, so be patient. Luckily, oregano usually grows quickly. Pruning your oregano will encourage new growth. Not only will it grow more leaves, it'll even grow more stems! Cut back no more than 1/3rd of the plant at a time. This prevents over-pruning. If you cut away too much of the plant at once, your plant may not survive. Before pruning your oregano again, make sure it's grown back to at least 4 inches (10 cm) tall. Cut the stems when you need to remove several at once. Place a pair of scissors or small pruning shears against the stem above the leaves where you plan to make your cut. Then, make a clean cut to remove the stalk. You may try to cut several stems at once, depending on the size of your plant. It's best if you cut just 1 stalk at a time. Pinch off the stems for easy pruning. Pinching is a quick, easy way to prune your herbs. Place your fingers on the stem just above the leaves, then use your fingernails to pinch off the stem. It helps to hold the base of the stem with your other hand to avoid damaging the rest of the stalk. This is a great option for removing 1 or 2 stems at a time. Set the stalks aside while you continue pruning. If you plan to use them in your kitchen, you should place them in a clean, dry container. Continue to cut until you've trimmed all of the stems you'd like to prune. If the removed stems are still green, you can use them in your kitchen! However, dead stems should be composted or thrown away. Tending to Dormant Oregano Deadhead the flowers after they fade at the end of summer. This allows the plant to direct its nutrients toward new growth instead of seeding. Using scissors or pruning shears, cut just below the flowers. You can also trim further down the stem, as long as you don't cut more than \u2153 of the stalk. As an alternative, you can deadhead the flowers by simply pinching off the old flower. This works better if the flower is dead or dying. Stop pruning at least 2 weeks before cold weather is forecast. Your plant will be vulnerable during cold weather, so it's a good idea to stop pruning it before winter comes. This increases the likelihood that it will survive winter! If you want to use your oregano during winter, it's best to rely on dried herbs that you've stored. Remove dead stems during the winter. Wait until late winter to prepare the oregano for regrowth in the spring. Look for stems that are dry, brown, and lack leaves. Trim them down to the base of the plant, just above the roots. You can use scissors or small pruning shears. Add an organic liquid fertilizer to the oregano. This will provide it with extra nutrients to help it go into the next growing season. For best results, mix the fertilizer into water and pour it over the plant at its next watering. Be sure to follow the label to ensure that you provide the right amount of fertilizer. You can find a liquid fertilizer at your local gardening store or online. Harvesting Oregano Harvest oregano just before the plant flowers, or as needed. Oregano is most flavorful right before the plant flowers, so this is the perfect time to harvest if you plan to dry or freeze your herbs. However, you can also harvest small amounts of oregano to use fresh in your kitchen. Keep in mind that the oregano may taste bitter after the plant flowers, so it's a good idea to harvest the remaining stems before your plant flowers. You can dry them by hanging them in bunches or using a dehydrator. Alternatively, you could freeze them. The best time to harvest oregano is in the morning after the dew dries. The flavor of your oregano will be strongest during warm weather. Place your scissors 1/3rd of the way down a stem of oregano. You can harvest less, but not more. Position the scissors against the stem in a spot that's in between the leaves to prevent damaging the leaves. Run your fingers along the stem to remove just the leaves if you prefer. Place your thumb and middle finger just below the leaves you want to harvest. Slowly run your hand up the stem to pull off the leaves, collecting them as you go. Place the leaves in a clean, dry container for use in your kitchen. Cut away the bare stem using your scissors. This is a great alternative for days when you just want a few leaves to season a dish.",
  "tyn_model":[
    "oregano",
    "scissors",
    "pruning shears",
    "herbs",
    "fertilizer",
    "\u2153 of",
    "organic liquid fertilizer",
    "water",
    "liquid fertilizer",
    "dehydrator",
    "dish"
  ],
  "tyn_section":[
    "Scissors or small pruning shears",
    "Liquid fertilizer",
    "Water",
    "Watering can or container",
    "Clean, dry food container (optional)",
    "Food dehydrator (optional)"
  ]
}