{
  "title":"How to Make a Chicken Wrap",
  "url":"https://www.wikihow.com/Make-a-Chicken-Wrap",
  "category_hierarchy":[
    "Food and Entertaining",
    "Recipes",
    "Sandwiches and Quick Meals"
  ],
  "methods":[
    {
      "name":"Grilled Chicken Ranch Wraps",
      "steps":[
        {
          "headline":"Divide the chicken, ranch, cheese, and cilantro between 4 tortillas.",
          "description":"Lay the tortillas on a work surface and put about 1/2 cup (62 g) of the chopped chicken on each. Top the chicken on each tortilla with 1 tablespoon (14.8 ml) (15 g) of ranch dressing and 2 tablespoons (29.6 ml) (14 g) of mozzarella cheese. If you'd like to include minced cilantro, put about 1 tablespoon (15 ml) (4 g) on each wrap."
        },
        {
          "headline":"Fold each tortilla to secure the ends and side.",
          "description":"Bring 2 sides of the tortilla up so the filling settles in the center. Then tuck the ends of the tortilla towards the center. Hold these in place and use your thumbs to roll a long side of the tortilla over the filling. Keep rolling the wrap over so it's completely closed."
        },
        {
          "headline":"Heat a grill pan and cook the wraps for a few minutes on each side.",
          "description":"Put a grill pan on the stove and turn the burner to medium or heat a small grill to medium. Spread a little oil or cooking spray on the grill so your wraps don't stick and place the wraps on the hot grill. Cook them for 1 to 2 minutes on each side. The tortilla will become crisp and golden brown once it's grilled long enough."
        },
        {
          "headline":"Slice and serve the chicken ranch wraps.",
          "description":"Turn the burner off and put the wraps on serving plates. Cut each wrap in half and serve them immediately. Store the leftover wraps in an airtight container in the refrigerator for up to 2 to 3 days. Keep in mind that the wrap will become softer as it's stored."
        }
      ]
    },
    {
      "name":"Making Healthy Chicken Avocado Wraps with Yogurt Sauce",
      "steps":[
        {
          "headline":"Mix the yogurt, mustard, honey, salt, and pepper to make the sauce.",
          "description":"Measure 1 cup (245 g) of plain yogurt into a bowl and whisk in 1 teaspoon (5 g) of mustard, and 2 teaspoons (14 g) of honey. Taste the sauce and add salt and pepper according to your taste. Set the sauce aside while you make the chicken wraps."
        },
        {
          "headline":"Warm 4 whole-wheat tortillas or chapati.",
          "description":"To make the tortillas or chapatis easier to wrap, heat them in the oven, microwave, or skillet just until they're warm enough to bend easily."
        },
        {
          "headline":"Divide chicken, veggies, and avocado between the wraps.",
          "description":"Lay the 4 warm tortillas on your work surface and place 1/2 cup (62 g) of chicken on each wrap. Lay 1 lettuce leaf, a few of the halved cherry tomatoes, long cucumber slices, and a few slivers of avocado on each wrap. Cut the cucumber lengthwise into thin slices."
        },
        {
          "headline":"Drizzle sauce over the filling and fold the tortillas into wraps.",
          "description":"Top the wrap fillings with a few spoonfuls of the yogurt sauce. To fold the wraps, tuck the ends of each tortilla towards the center. Then fold 1 side over the filling and keep rolling until the wrap is enclosed."
        },
        {
          "headline":"Serve the wraps with more yogurt sauce.",
          "description":"Leave the wraps whole or slice them in half before serving. Offer more of the yogurt sauce on the side for dipping or drizzling. Refrigerate the leftover wraps in an airtight container for up to 2 to 3 days."
        }
      ]
    },
    {
      "name":"Creating Spicy Buffalo Chicken Wraps",
      "steps":[
        {
          "headline":"Saut\u00e9 \u20442 pound (230 g) of cubed chicken for 6 minutes.",
          "description":"Heat \u20442 teaspoon (2.5 ml) of canola or vegetable oil in a nonstick skillet over medium heat. Add the chicken breast to the skillet and cook it until it's almost cooked throughout. Stir the chicken frequently as it cooks to prevent it from sticking to the pan."
        },
        {
          "headline":"Stir in the hot sauce and simmer the chicken for 3 to 5 minutes.",
          "description":"Add 2 tablespoons (30 ml) of Louisiana-style hot sauce into the skillet and keep heating the chicken until the sauce begins to bubble. Stir and cook the chicken until it reaches 165 \u00b0F (74 \u00b0C) according to an instant-read meat thermometer. Turn off the burner. Keep the skillet uncovered so the sauce thickens as it cooks."
        },
        {
          "headline":"Divide the lettuce, chicken, ranch, and cheese between 2 tortillas.",
          "description":"Lay the tortillas on your work surface and put 1/2 cup (18 g) of shredded lettuce on each tortilla. Divide the buffalo chicken mixture between the tortillas and then pour 1 teaspoon (4.9 ml) of ranch salad dressing on each. Sprinkle 1 tablespoon (14.8 ml) (9 g) of crumbled blue cheese on both wraps."
        },
        {
          "headline":"Roll and serve the spicy chicken wraps.",
          "description":"Tuck both ends of the tortillas towards the center and then fold 1 long side over the filling. Continue to roll the tortilla over the filling to completely seal up the filling. Serve the wraps immediately. Refrigerate the leftovers in an airtight container for up to 2 to 3 days."
        }
      ]
    }
  ],
  "text":" Grilled Chicken Ranch Wraps Divide the chicken, ranch, cheese, and cilantro between 4 tortillas. Lay the tortillas on a work surface and put about 1/2 cup (62 g) of the chopped chicken on each. Top the chicken on each tortilla with 1 tablespoon (14.8 ml) (15 g) of ranch dressing and 2 tablespoons (29.6 ml) (14 g) of mozzarella cheese. If you'd like to include minced cilantro, put about 1 tablespoon (15 ml) (4 g) on each wrap. Fold each tortilla to secure the ends and side. Bring 2 sides of the tortilla up so the filling settles in the center. Then tuck the ends of the tortilla towards the center. Hold these in place and use your thumbs to roll a long side of the tortilla over the filling. Keep rolling the wrap over so it's completely closed. Heat a grill pan and cook the wraps for a few minutes on each side. Put a grill pan on the stove and turn the burner to medium or heat a small grill to medium. Spread a little oil or cooking spray on the grill so your wraps don't stick and place the wraps on the hot grill. Cook them for 1 to 2 minutes on each side. The tortilla will become crisp and golden brown once it's grilled long enough. Slice and serve the chicken ranch wraps. Turn the burner off and put the wraps on serving plates. Cut each wrap in half and serve them immediately. Store the leftover wraps in an airtight container in the refrigerator for up to 2 to 3 days. Keep in mind that the wrap will become softer as it's stored. Making Healthy Chicken Avocado Wraps with Yogurt Sauce Mix the yogurt, mustard, honey, salt, and pepper to make the sauce. Measure 1 cup (245 g) of plain yogurt into a bowl and whisk in 1 teaspoon (5 g) of mustard, and 2 teaspoons (14 g) of honey. Taste the sauce and add salt and pepper according to your taste. Set the sauce aside while you make the chicken wraps. Warm 4 whole-wheat tortillas or chapati. To make the tortillas or chapatis easier to wrap, heat them in the oven, microwave, or skillet just until they're warm enough to bend easily. Divide chicken, veggies, and avocado between the wraps. Lay the 4 warm tortillas on your work surface and place 1/2 cup (62 g) of chicken on each wrap. Lay 1 lettuce leaf, a few of the halved cherry tomatoes, long cucumber slices, and a few slivers of avocado on each wrap. Cut the cucumber lengthwise into thin slices. Drizzle sauce over the filling and fold the tortillas into wraps. Top the wrap fillings with a few spoonfuls of the yogurt sauce. To fold the wraps, tuck the ends of each tortilla towards the center. Then fold 1 side over the filling and keep rolling until the wrap is enclosed. Serve the wraps with more yogurt sauce. Leave the wraps whole or slice them in half before serving. Offer more of the yogurt sauce on the side for dipping or drizzling. Refrigerate the leftover wraps in an airtight container for up to 2 to 3 days. Creating Spicy Buffalo Chicken Wraps Saut\u00e9 \u20442 pound (230 g) of cubed chicken for 6 minutes. Heat \u20442 teaspoon (2.5 ml) of canola or vegetable oil in a nonstick skillet over medium heat. Add the chicken breast to the skillet and cook it until it's almost cooked throughout. Stir the chicken frequently as it cooks to prevent it from sticking to the pan. Stir in the hot sauce and simmer the chicken for 3 to 5 minutes. Add 2 tablespoons (30 ml) of Louisiana-style hot sauce into the skillet and keep heating the chicken until the sauce begins to bubble. Stir and cook the chicken until it reaches 165 \u00b0F (74 \u00b0C) according to an instant-read meat thermometer. Turn off the burner. Keep the skillet uncovered so the sauce thickens as it cooks. Divide the lettuce, chicken, ranch, and cheese between 2 tortillas. Lay the tortillas on your work surface and put 1/2 cup (18 g) of shredded lettuce on each tortilla. Divide the buffalo chicken mixture between the tortillas and then pour 1 teaspoon (4.9 ml) of ranch salad dressing on each. Sprinkle 1 tablespoon (14.8 ml) (9 g) of crumbled blue cheese on both wraps. Roll and serve the spicy chicken wraps. Tuck both ends of the tortillas towards the center and then fold 1 long side over the filling. Continue to roll the tortilla over the filling to completely seal up the filling. Serve the wraps immediately. Refrigerate the leftovers in an airtight container for up to 2 to 3 days.",
  "tyn_model":[
    "chicken",
    "tortillas",
    "yogurt sauce",
    "skillet",
    "airtight container",
    "lettuce",
    "ranch",
    "cheese",
    "cilantro",
    "grill pan",
    "grill",
    "mustard",
    "honey",
    "salt",
    "pepper",
    "avocado",
    "cucumber",
    "grilled chicken ranch wraps",
    "ranch dressing",
    "mozzarella cheese",
    "small grill",
    "chicken ranch",
    "burner",
    "serving plates",
    "refrigerator",
    "yogurt",
    "plain yogurt",
    "bowl",
    "whole-wheat tortillas",
    "oven",
    "microwave",
    "veggies",
    "cherry tomatoes",
    "canola or vegetable oil",
    "nonstick skillet",
    "hot sauce",
    "louisiana-style hot sauce",
    "instant-read meat thermometer",
    "buffalo chicken",
    "ranch salad dressing",
    "blue cheese",
    "spicy chicken",
    "tortilla"
  ],
  "tyn_section":[
    "Grilled Chicken Ranch Wraps",
    "Measuring cups and spoons",
    "Knife and cutting board",
    "Grill pan or grill",
    "Tongs",
    "Knife",
    "Serving plates",
    "Healthy Chicken Avocado Wraps with Yogurt Sauce",
    "Bowl",
    "Whisk",
    "Skillet, oven, or microwave",
    "Spicy Buffalo Chicken Wraps",
    "Skillet",
    "Spoon",
    "Instant-read meat thermometer"
  ]
}