{
  "title":"How to Harvest Lentils",
  "url":"https://www.wikihow.com/Harvest-Lentils",
  "category_hierarchy":[
    "Home and Garden",
    "Gardening",
    "Planting and Growing"
  ],
  "parts":[
    {
      "name":"Checking for Plant Maturity",
      "steps":[
        {
          "headline":"Wait until July or August to harvest.",
          "description":"Dried lentils should be harvested around 110 days after sowing. In most areas, this will be in July or August. Make sure that the weather is dry when you start to harvest. If you harvest the lentils during rainy or wet weather, they may not dry out properly."
        },
        {
          "headline":"Shake the plants to hear if they rattle.",
          "description":"Lightly grasp the top of the plant before shaking it. If it is ready to harvest, you should hear the pods rattling. This rattle means that the pods on the bottom of the plant are mature and dried."
        },
        {
          "headline":"Inspect the bottom of the plants for brown and yellow pods.",
          "description":"Lentils mature from the bottom of the plant up. While the top pods may not be mature yet, you should look at the bottom for hard, dry brown or yellow pods. This means that you can start to harvest the plants. Don't try to wait for the top pods to mature if the bottom pods are ready. Most of your harvest will come from the lower pods. If you wait too long, they may shatter."
        }
      ]
    },
    {
      "name":"Harvesting and Drying the Lentils",
      "steps":[
        {
          "headline":"Apply desiccant about 1 week before harvest to speed up drying.",
          "description":"Since plants can dry unevenly, spraying a chemical desiccant onto the plants can help them reach the right moisture level at the same time. Some common desiccants include glyphosate, glufosinate, and diquat. Different products may vary in how long they take to desiccate the plant. Always read the label see how long you need to give the plants, and follow all instructions as you use the product. Check in advance to ensure that the product you purchased is safe to use on foods. While this can help dry out pods, it will not make immature pods ripen faster. It will help speed up the drying process, however, if you live in an area with a short growing season."
        },
        {
          "headline":"Pull the lentil plants from the ground when they are ready to harvest.",
          "description":"Once mature and dry, lentil plants should be easy to pull up from the ground. Grasp the plant as close to the ground as possible before lifting up. Set the plants aside in a pile until you have removed them all. It is a good idea to wear gardening gloves as you do this to protect your hands."
        },
        {
          "headline":"Lay the harvested plants to dry in the sun for an organic approach.",
          "description":"Once the plants have been pulled from the ground, spread them out in a straight line outdoors. The weather must be sunny and dry without any wind for this to work. After a week, the plants will turn brown, making it easy to harvest the lentils from the plants. This works well if you want to speed up the drying process without the use of chemical desiccants. It does require the right type of weather, however."
        },
        {
          "headline":"Dry lentils indoors if the weather is too wet or cloudy.",
          "description":"Choose a shed, garage, or room with good ventilation. Hang the stems upside down on a drying rack. After 1-2 weeks, the plants may turn brown and dry. This is also a good idea if the weather is very windy. Wind can damage lentil plants that have been pulled up from the ground. If you have picked your plants but have noticed that some are still unripe, you can let them ripen and dry out using this same method. Leave them to dry until the pods turn brown or yellow and rattle when shaken."
        }
      ]
    },
    {
      "name":"Separating the Lentils from the Plants",
      "steps":[
        {
          "headline":"Thresh the lentils to shake them loose from the plant.",
          "description":"There are many ways you can thresh the lentils. You can start with small stems and rub the plants between your hands until the lentils fall off. Or you can put the lentils in a bag or pillowcase. Hit the bag with a stick or walk on top of the bag to free the lentils. Threshing can also help shell the lentils, breaking them away from their pods."
        },
        {
          "headline":"Remove pods by hand if any remain after threshing.",
          "description":"You can also remove the lentils by hand. If they are mature, they should come off easily when you pull them from the plant. Since this can be time consuming, only do this for lentils that did not come off from shaking the plant. Try rubbing off any remaining pods. Put the stem in the palm of your hand and use your fingers to separate the lentils. If the lentils don't fall off easily, they may not be ripe enough. Try leaving them on a drying rack for a few days."
        },
        {
          "headline":"Winnow the lentils to remove the chaff and other debris.",
          "description":"Get 2 buckets that can hold your harvest. Stand outside and pour the lentils into 1 bucket. Lift up the bucket and pour the lentils into the second bucket. Keep pouring the lentils between the buckets until most of the chaff blows away. When you pour the lentils into the bucket, chaff blows away in the wind while the heavier lentils remain in the buckets. If you can't go outside, stand in front of a fan on a low setting. Chaff includes leaves, stems, and other bits of dirt that might become mixed in with the lentils. It can also include shattered seed bits."
        },
        {
          "headline":"Store the lentils in a dry, cool place.",
          "description":"Keep dried lentils in a jar or plastic container, preferably one that is airtight. Put the container in a pantry, cabinet, or another dry place. Dried lentils will last for about 10-12 months if stored properly. It can be difficult to tell when lentils have gone bad. If they appear hard and brittle or if they take longer to cook than normal, you may wish to toss them."
        }
      ]
    }
  ],
  "text":" Checking for Plant Maturity Wait until July or August to harvest. Dried lentils should be harvested around 110 days after sowing. In most areas, this will be in July or August. Make sure that the weather is dry when you start to harvest. If you harvest the lentils during rainy or wet weather, they may not dry out properly. Shake the plants to hear if they rattle. Lightly grasp the top of the plant before shaking it. If it is ready to harvest, you should hear the pods rattling. This rattle means that the pods on the bottom of the plant are mature and dried. Inspect the bottom of the plants for brown and yellow pods. Lentils mature from the bottom of the plant up. While the top pods may not be mature yet, you should look at the bottom for hard, dry brown or yellow pods. This means that you can start to harvest the plants. Don't try to wait for the top pods to mature if the bottom pods are ready. Most of your harvest will come from the lower pods. If you wait too long, they may shatter. Harvesting and Drying the Lentils Apply desiccant about 1 week before harvest to speed up drying. Since plants can dry unevenly, spraying a chemical desiccant onto the plants can help them reach the right moisture level at the same time. Some common desiccants include glyphosate, glufosinate, and diquat. Different products may vary in how long they take to desiccate the plant. Always read the label see how long you need to give the plants, and follow all instructions as you use the product. Check in advance to ensure that the product you purchased is safe to use on foods. While this can help dry out pods, it will not make immature pods ripen faster. It will help speed up the drying process, however, if you live in an area with a short growing season. Pull the lentil plants from the ground when they are ready to harvest. Once mature and dry, lentil plants should be easy to pull up from the ground. Grasp the plant as close to the ground as possible before lifting up. Set the plants aside in a pile until you have removed them all. It is a good idea to wear gardening gloves as you do this to protect your hands. Lay the harvested plants to dry in the sun for an organic approach. Once the plants have been pulled from the ground, spread them out in a straight line outdoors. The weather must be sunny and dry without any wind for this to work. After a week, the plants will turn brown, making it easy to harvest the lentils from the plants. This works well if you want to speed up the drying process without the use of chemical desiccants. It does require the right type of weather, however. Dry lentils indoors if the weather is too wet or cloudy. Choose a shed, garage, or room with good ventilation. Hang the stems upside down on a drying rack. After 1-2 weeks, the plants may turn brown and dry. This is also a good idea if the weather is very windy. Wind can damage lentil plants that have been pulled up from the ground. If you have picked your plants but have noticed that some are still unripe, you can let them ripen and dry out using this same method. Leave them to dry until the pods turn brown or yellow and rattle when shaken. Separating the Lentils from the Plants Thresh the lentils to shake them loose from the plant. There are many ways you can thresh the lentils. You can start with small stems and rub the plants between your hands until the lentils fall off. Or you can put the lentils in a bag or pillowcase. Hit the bag with a stick or walk on top of the bag to free the lentils. Threshing can also help shell the lentils, breaking them away from their pods. Remove pods by hand if any remain after threshing. You can also remove the lentils by hand. If they are mature, they should come off easily when you pull them from the plant. Since this can be time consuming, only do this for lentils that did not come off from shaking the plant. Try rubbing off any remaining pods. Put the stem in the palm of your hand and use your fingers to separate the lentils. If the lentils don't fall off easily, they may not be ripe enough. Try leaving them on a drying rack for a few days. Winnow the lentils to remove the chaff and other debris. Get 2 buckets that can hold your harvest. Stand outside and pour the lentils into 1 bucket. Lift up the bucket and pour the lentils into the second bucket. Keep pouring the lentils between the buckets until most of the chaff blows away. When you pour the lentils into the bucket, chaff blows away in the wind while the heavier lentils remain in the buckets. If you can't go outside, stand in front of a fan on a low setting. Chaff includes leaves, stems, and other bits of dirt that might become mixed in with the lentils. It can also include shattered seed bits. Store the lentils in a dry, cool place. Keep dried lentils in a jar or plastic container, preferably one that is airtight. Put the container in a pantry, cabinet, or another dry place. Dried lentils will last for about 10-12 months if stored properly. It can be difficult to tell when lentils have gone bad. If they appear hard and brittle or if they take longer to cook than normal, you may wish to toss them.",
  "tyn_model":[
    "lentils",
    "lentil",
    "plants",
    "buckets",
    "bucket",
    "chaff",
    "chemical desiccant",
    "glyphosate",
    "glufosinate",
    "diquat",
    "threshing",
    "winnow",
    "fan",
    "jar"
  ],
  "tyn_section":[
    "Gardening gloves",
    "Airtight jar or container",
    "Chemical desiccant",
    "Drying rack",
    "Bag or pillowcase",
    "Buckets"
  ]
}