{
  "title":"How to Make Greek Yogurt with Goat's Milk",
  "url":"https://www.wikihow.com/Make-Greek-Yogurt-with-Goat%27s-Milk",
  "category_hierarchy":[
    "Food and Entertaining",
    "Recipes",
    "Eggs and Dairy",
    "Yogurt"
  ],
  "parts":[
    {
      "name":"Adding Live Cultures",
      "steps":[
        {
          "headline":"Heat 2 US quarts (1.9 L) of goat\u2019s milk in a dutch oven.",
          "description":"Slowly heat the milk until little bubbles form around its edges. This should happen at around 170 \u00b0F (77 \u00b0C) to 180 \u00b0F (82 \u00b0C). Try to use the thickest and freshest goat\u2019s milk that you can find. Measure the milk\u2019s temperature with a candy thermometer."
        },
        {
          "headline":"Cool the milk to 110 \u00b0F (43 \u00b0C) to 120 \u00b0F (49 \u00b0C).",
          "description":"Turn the heat off and let the dutch oven sit to cool. This step should take you around 30 minutes. Be careful, if you let the milk cool too much, the yogurt won\u2019t set well. And, if you don\u2019t let it cool enough, you\u2019ll kill off too much bacteria."
        },
        {
          "headline":"Add 4 tablespoons (59 mL) of yogurt starter to the dutch oven.",
          "description":"Use a starter that has either Bifidus, L. acidophilus L. bulgaricus, S. thermophiles, or L. casei in it. Once you\u2019ve added the starter, use a whisk to mix it in the milk. You can get the yogurt starter from multiple places. For instance, you can use store-bought freeze-dried yogurt starter packets with live cultures or plain store-bought yogurt with no additives."
        }
      ]
    },
    {
      "name":"Baking the Yogurt",
      "steps":[
        {
          "headline":"Preheat the oven to 100 \u00b0F (38 \u00b0C).",
          "description":"Use a timer to indicate when you\u2019ve reached your desired heat. If your oven often falls below or above its set temperature, consider using an oven thermometer. This is more common with gas ovens."
        },
        {
          "headline":"Wrap the dutch oven in a towel.",
          "description":"Place the dutch oven in the center of a towel. Then, wrap the excess towel around the sides of the dutch oven. Make sure that the towel is tightly hugging the dutch oven to make incubation most effective. This is important because one of the common reasons yogurt making fails is not being able to keep the yogurt at the right temperature. Use a towel you don\u2019t care about because your towel can get oven marks on it."
        },
        {
          "headline":"Place the dutch oven in the oven for 6 to 12 hours.",
          "description":"Set a loud timer and let the yogurt sit. You can mess with its cultures if you disturb the yogurt. Be careful when opening the oven and inserting the dutch oven. Use heat protection, like oven mitts, and keep your arms and legs away from the inside of the oven."
        },
        {
          "headline":"Check to see if the yogurt has set after 6 hours.",
          "description":"Set yogurt will have pool of cloudy whey liquid on top and a  custard-like consistency underneath. If the yogurt hasn\u2019t set, continue to check every 30 to 60 minutes. To check, look first for the whey liquid. If there is a layer of liquid, insert a toothpick or straw and in the yogurt and look for the custardy consistency\nIf you mess up the towel wrapping when you check, just rewrap it."
        },
        {
          "headline":"Remove the dutch oven from the oven.",
          "description":"When the yogurt has set, take out the dutch oven and place it on a heat-safe surface. The dutch oven will be hot, so use heat protection!"
        }
      ]
    },
    {
      "name":"Straining the Yogurt",
      "steps":[
        {
          "headline":"Pour out the whey liquid.",
          "description":"Whey is the liquid that is sitting at the top of your yogurt. It should look cloudy and yellowish in color. Hold the dutch oven steady while you slowly pour out the whey liquid. Save the whey liquid for a nutrient-rich milk substitute!"
        },
        {
          "headline":"Line the strainer with cheesecloth.",
          "description":"Use a strainer with prongs, hooks, or a handle so it can sit comfortably over the opening of a large bowl. Place up to 2 layers of cheesecloth over the strainer and press the cheesecloth down. If you don\u2019t have cheesecloth, you can use a coffee filter or tea cloth in its place."
        },
        {
          "headline":"Secure the strainer over a bowl.",
          "description":"Place the cheesecloth covered strainer over the opening of a large bowl. Hook it or secure the prongs on the side of the bowl to make sure that the strainer doesn\u2019t fall into the bowl later on. You can also help secure the strainer by putting a large rubber band around the ends of the cheesecloth and side of the bowl."
        },
        {
          "headline":"Scoop the yogurt into the strainer and let most of the liquid strain through.",
          "description":"Use a large spoon or ladle to scoop the yogurt into the strainer. If you don\u2019t have a spoon or ladle, slowly pour the yogurt into the strainer. Let the whey liquid quickly drip out. Refrain from pushing down on the yogurt to speed up the straining."
        },
        {
          "headline":"Put the bowl in the fridge to let strain for 2 hours.",
          "description":"Do this once the dripping whey liquid has slowed dramatically. Let the yogurt continue to strain and thicken for 2 hours. Don\u2019t let it strain for too long or else you\u2019ll make cheese instead of yogurt. You can pour out they whey liquid or save it. You can freeze the liquid and use it in smoothies or baked goods!."
        },
        {
          "headline":"Store and refrigerate your yogurt.",
          "description":"Scoop your yogurt out of the cheesecloth and move it to an airtight container. You can keep it refrigerated for up to a week before it goes bad. Enjoy or gift your goat milk greek yogurt! If you don\u2019t have an airtight container, move your yogurt to a bowl and secure it with plastic wrap."
        }
      ]
    }
  ],
  "text":" Adding Live Cultures Heat 2 US quarts (1.9 L) of goat\u2019s milk in a dutch oven. Slowly heat the milk until little bubbles form around its edges. This should happen at around 170 \u00b0F (77 \u00b0C) to 180 \u00b0F (82 \u00b0C). Try to use the thickest and freshest goat\u2019s milk that you can find. Measure the milk\u2019s temperature with a candy thermometer. Cool the milk to 110 \u00b0F (43 \u00b0C) to 120 \u00b0F (49 \u00b0C). Turn the heat off and let the dutch oven sit to cool. This step should take you around 30 minutes. Be careful, if you let the milk cool too much, the yogurt won\u2019t set well. And, if you don\u2019t let it cool enough, you\u2019ll kill off too much bacteria. Add 4 tablespoons (59 mL) of yogurt starter to the dutch oven. Use a starter that has either Bifidus, L. acidophilus L. bulgaricus, S. thermophiles, or L. casei in it. Once you\u2019ve added the starter, use a whisk to mix it in the milk. You can get the yogurt starter from multiple places. For instance, you can use store-bought freeze-dried yogurt starter packets with live cultures or plain store-bought yogurt with no additives. Baking the Yogurt Preheat the oven to 100 \u00b0F (38 \u00b0C). Use a timer to indicate when you\u2019ve reached your desired heat. If your oven often falls below or above its set temperature, consider using an oven thermometer. This is more common with gas ovens. Wrap the dutch oven in a towel. Place the dutch oven in the center of a towel. Then, wrap the excess towel around the sides of the dutch oven. Make sure that the towel is tightly hugging the dutch oven to make incubation most effective. This is important because one of the common reasons yogurt making fails is not being able to keep the yogurt at the right temperature. Use a towel you don\u2019t care about because your towel can get oven marks on it. Place the dutch oven in the oven for 6 to 12 hours. Set a loud timer and let the yogurt sit. You can mess with its cultures if you disturb the yogurt. Be careful when opening the oven and inserting the dutch oven. Use heat protection, like oven mitts, and keep your arms and legs away from the inside of the oven. Check to see if the yogurt has set after 6 hours. Set yogurt will have pool of cloudy whey liquid on top and a  custard-like consistency underneath. If the yogurt hasn\u2019t set, continue to check every 30 to 60 minutes. To check, look first for the whey liquid. If there is a layer of liquid, insert a toothpick or straw and in the yogurt and look for the custardy consistency\nIf you mess up the towel wrapping when you check, just rewrap it. Remove the dutch oven from the oven. When the yogurt has set, take out the dutch oven and place it on a heat-safe surface. The dutch oven will be hot, so use heat protection! Straining the Yogurt Pour out the whey liquid. Whey is the liquid that is sitting at the top of your yogurt. It should look cloudy and yellowish in color. Hold the dutch oven steady while you slowly pour out the whey liquid. Save the whey liquid for a nutrient-rich milk substitute! Line the strainer with cheesecloth. Use a strainer with prongs, hooks, or a handle so it can sit comfortably over the opening of a large bowl. Place up to 2 layers of cheesecloth over the strainer and press the cheesecloth down. If you don\u2019t have cheesecloth, you can use a coffee filter or tea cloth in its place. Secure the strainer over a bowl. Place the cheesecloth covered strainer over the opening of a large bowl. Hook it or secure the prongs on the side of the bowl to make sure that the strainer doesn\u2019t fall into the bowl later on. You can also help secure the strainer by putting a large rubber band around the ends of the cheesecloth and side of the bowl. Scoop the yogurt into the strainer and let most of the liquid strain through. Use a large spoon or ladle to scoop the yogurt into the strainer. If you don\u2019t have a spoon or ladle, slowly pour the yogurt into the strainer. Let the whey liquid quickly drip out. Refrain from pushing down on the yogurt to speed up the straining. Put the bowl in the fridge to let strain for 2 hours. Do this once the dripping whey liquid has slowed dramatically. Let the yogurt continue to strain and thicken for 2 hours. Don\u2019t let it strain for too long or else you\u2019ll make cheese instead of yogurt. You can pour out they whey liquid or save it. You can freeze the liquid and use it in smoothies or baked goods!. Store and refrigerate your yogurt. Scoop your yogurt out of the cheesecloth and move it to an airtight container. You can keep it refrigerated for up to a week before it goes bad. Enjoy or gift your goat milk greek yogurt! If you don\u2019t have an airtight container, move your yogurt to a bowl and secure it with plastic wrap.",
  "tyn_model":[
    "yogurt",
    "dutch oven",
    "strainer",
    "milk",
    "oven",
    "cheesecloth",
    "bowl",
    "towel",
    "goat\u2019s milk",
    "spoon",
    "candy thermometer",
    "yogurt starter",
    "whisk",
    "freeze-dried yogurt",
    "oven thermometer",
    "oven mitts",
    "toothpick",
    "coffee filter",
    "tea cloth",
    "fridge",
    "airtight container",
    "goat milk greek yogurt",
    "plastic wrap"
  ],
  "tyn_section":[
    "Dutch oven",
    "Candy thermometer",
    "Large glass bowl",
    "Whisk",
    "Large strainer with front prongs",
    "2 squares of cheesecloth"
  ]
}