{
  "title":"How to Cook Arroz Caldo",
  "url":"https://www.wikihow.com/Cook-Arroz-Caldo",
  "category_hierarchy":[
    "Food and Entertaining",
    "Recipes",
    "World Cuisines",
    "Asian Cuisine",
    "Philippine Dishes"
  ],
  "parts":[
    {
      "name":"Saut\u00e9ing the Aromatics",
      "steps":[
        {
          "headline":"Heat 8 cloves of the garlic in \u20442 cup (120 ml) of the oil for 1 to 2 minutes.",
          "description":"Mince 8 of the garlic cloves and place them in a small saucepan. Stir in \u20442 cup (120 ml) of the canola oil and turn the burner to medium. Cook the garlic and stir it frequently until it turns pale brown. If you don't have canola oil, you can use vegetable oil."
        },
        {
          "headline":"Drain the garlic and set it aside.",
          "description":"Place a fine mesh strainer over a bowl and carefully pour the oil and garlic into it. Lay paper towels on a plate and transfer the drained garlic onto it. Set the garlic aside while you prepare the rest of the arroz caldo. Once the oil cools, you can discard it or save it for another recipe."
        },
        {
          "headline":"Saut\u00e9 1 onion in the remaining 2 \u20442 tablespoons (37 ml) of oil for 5 minutes.",
          "description":"Heat the rest of the oil in a large pot over medium-high heat. When the oil simmers, stir in 1 medium sliced onion. Stir and cook the onion until it becomes clear and softens a little."
        },
        {
          "headline":"Stir in the ginger and 4 remaining cloves of garlic.",
          "description":"Mince 1 tablespoon (6 g) of ginger and the rest of the garlic. Stir them into the onions and continue to cook them over medium-high heat for 1 minute. The garlic and ginger should become fragrant."
        }
      ]
    },
    {
      "name":"Adding the Chicken and Rice",
      "steps":[
        {
          "headline":"Add 1 \u20442 pounds (680 g) of chicken and brown the meat on all sides.",
          "description":"Cut the boneless, skinless chicken thighs into bite-sized pieces. Stir them into the pot and cook them for 3 to 5 minutes. The chicken should be golden brown on every side, but the inside won't be cooked completely. The chicken will finish cooking as the dish simmers."
        },
        {
          "headline":"Stir in the fish sauce and ground black pepper.",
          "description":"Add 1 tablespoon (15 ml) of Asian fish sauce and 1 teaspoon (2.3 g) of freshly ground black pepper to the pot. Stir the mixture well and let it cook for 1 minute."
        },
        {
          "headline":"Add the rice and chicken stock.",
          "description":"Measure 1/2 cup (97 g) of uncooked jasmine or medium-grain rice and 1/2 cup (97 g) of glutinous rice. Stir the rices into the pot so that they're combined with the saut\u00e9ed chicken and onion. Then pour in 6 cups (1,400 ml) of chicken stock. Using a mix of rices will give the arroz caldo the best texture. Ensure that you stir along the bottom of the pan to prevent ingredients from sticking."
        }
      ]
    },
    {
      "name":"Simmering the Arroz Caldo",
      "steps":[
        {
          "headline":"Bring the mixture to a boil and reduce the heat.",
          "description":"Cook the arroz caldo until the chicken stock comes to a boil. Then turn the burner down to medium or medium-low so that the liquid bubbles gently."
        },
        {
          "headline":"Cover and simmer the arroz caldo for about 20 minutes.",
          "description":"Put the lid on the pot and let the mixture bubble gently until the rice softens. Most of the chicken stock will be absorbed by the rice as it cooks and the chicken will finish cooking."
        },
        {
          "headline":"Stir in calamansi juice along with salt and pepper to taste.",
          "description":"Squeeze 1 tablespoon (15 ml) of calamansi, key lime, or lime juice into the arroz caldo. Taste the dish and add salt and pepper depending on your desired taste."
        },
        {
          "headline":"Garnish and serve.",
          "description":"Ladle the arroz caldo into serving bowls and top it with the fried garlic that you set aside. Garnish with sliced scallions, lime or calamansi wedges, and slices of hard-boiled eggs. Store leftover arroz caldo in an airtight container and keep in the refrigerator for up to 4 days."
        }
      ]
    }
  ],
  "text":" Saut\u00e9ing the Aromatics Heat 8 cloves of the garlic in \u20442 cup (120 ml) of the oil for 1 to 2 minutes. Mince 8 of the garlic cloves and place them in a small saucepan. Stir in \u20442 cup (120 ml) of the canola oil and turn the burner to medium. Cook the garlic and stir it frequently until it turns pale brown. If you don't have canola oil, you can use vegetable oil. Drain the garlic and set it aside. Place a fine mesh strainer over a bowl and carefully pour the oil and garlic into it. Lay paper towels on a plate and transfer the drained garlic onto it. Set the garlic aside while you prepare the rest of the arroz caldo. Once the oil cools, you can discard it or save it for another recipe. Saut\u00e9 1 onion in the remaining 2 \u20442 tablespoons (37 ml) of oil for 5 minutes. Heat the rest of the oil in a large pot over medium-high heat. When the oil simmers, stir in 1 medium sliced onion. Stir and cook the onion until it becomes clear and softens a little. Stir in the ginger and 4 remaining cloves of garlic. Mince 1 tablespoon (6 g) of ginger and the rest of the garlic. Stir them into the onions and continue to cook them over medium-high heat for 1 minute. The garlic and ginger should become fragrant. Adding the Chicken and Rice Add 1 \u20442 pounds (680 g) of chicken and brown the meat on all sides. Cut the boneless, skinless chicken thighs into bite-sized pieces. Stir them into the pot and cook them for 3 to 5 minutes. The chicken should be golden brown on every side, but the inside won't be cooked completely. The chicken will finish cooking as the dish simmers. Stir in the fish sauce and ground black pepper. Add 1 tablespoon (15 ml) of Asian fish sauce and 1 teaspoon (2.3 g) of freshly ground black pepper to the pot. Stir the mixture well and let it cook for 1 minute. Add the rice and chicken stock. Measure 1/2 cup (97 g) of uncooked jasmine or medium-grain rice and 1/2 cup (97 g) of glutinous rice. Stir the rices into the pot so that they're combined with the saut\u00e9ed chicken and onion. Then pour in 6 cups (1,400 ml) of chicken stock. Using a mix of rices will give the arroz caldo the best texture. Ensure that you stir along the bottom of the pan to prevent ingredients from sticking. Simmering the Arroz Caldo Bring the mixture to a boil and reduce the heat. Cook the arroz caldo until the chicken stock comes to a boil. Then turn the burner down to medium or medium-low so that the liquid bubbles gently. Cover and simmer the arroz caldo for about 20 minutes. Put the lid on the pot and let the mixture bubble gently until the rice softens. Most of the chicken stock will be absorbed by the rice as it cooks and the chicken will finish cooking. Stir in calamansi juice along with salt and pepper to taste. Squeeze 1 tablespoon (15 ml) of calamansi, key lime, or lime juice into the arroz caldo. Taste the dish and add salt and pepper depending on your desired taste. Garnish and serve. Ladle the arroz caldo into serving bowls and top it with the fried garlic that you set aside. Garnish with sliced scallions, lime or calamansi wedges, and slices of hard-boiled eggs. Store leftover arroz caldo in an airtight container and keep in the refrigerator for up to 4 days.",
  "tyn_model":[
    "garlic",
    "arroz caldo",
    "oil",
    "onion",
    "chicken",
    "rice",
    "pot",
    "chicken stock",
    "ginger",
    "canola oil",
    "burner",
    "salt and pepper",
    "lime",
    "small saucepan",
    "vegetable oil",
    "fine mesh strainer",
    "bowl",
    "paper towels",
    "plate",
    "large pot",
    "onions",
    "fish sauce",
    "ground black pepper",
    "asian fish sauce",
    "freshly ground black pepper",
    "jasmine",
    "glutinous rice",
    "key lime",
    "fried garlic",
    "scallions",
    "hard-boiled eggs",
    "airtight container",
    "refrigerator"
  ],
  "tyn_section":[
    "Measuring cups and spoons",
    "Knife and cutting board",
    "Small saucepan",
    "Large pot with lid",
    "Spoon",
    "Fine mesh strainer",
    "Bowl",
    "Paper towels",
    "Plate"
  ]
}