{
  "title":"How to Cook Chicken Heart",
  "url":"https://www.wikihow.com/Cook-Chicken-Heart",
  "category_hierarchy":[
    "Food and Entertaining",
    "Recipes",
    "Meat",
    "Poultry Recipes",
    "Chicken"
  ],
  "methods":[
    {
      "name":"Frying in a Pan",
      "steps":[
        {
          "headline":"Combine olive oil, garlic, salt, and pepper to create a simple marinade.",
          "description":"Use about 2 tablespoons (30 ml) olive oil, 1 clove of minced garlic, 1 pinch of salt and pepper to make this marinade. This is a really quick and easy marinade but you can get as creative as you like here to really explore different flavors. Some possible ingredients to mix in are:\nChipotle peppers\nOnions\nPaprika\nCayenne pepper"
        },
        {
          "headline":"Put your chicken hearts into the marinade for 30 minutes.",
          "description":"Store in the refrigerator while the hearts are marinating but when they are about to be cooked, the hearts should be close to room temperature and never frozen. Marinades allow flavors to develop and will also help to make the meat more tender. The length of time you marinate your hearts for can be as little as 10 minutes all the way up to several hours. The longer you marinate your hearts for, the more intense the flavor of the marinade will be."
        },
        {
          "headline":"Heat 2 tablespoons (30 ml) of vegetable oil over high heat in a skillet.",
          "description":"Use a vegetable oil here rather than olive oil, as olive oil has a lower smoking point and you're cooking over a fairly high heat. Nonstick skillets work best for frying chicken hearts. It will take around 2-3 minutes for your oil to get up to temperature."
        },
        {
          "headline":"Place the hearts into the hot skillet to brown them quickly.",
          "description":"There should be a nice sizzle when the hearts make contact with the pan. If you don\u2019t hear this sizzle, don\u2019t put the hearts in the pan as this means the oil is not hot enough. When the oil isn\u2019t hot enough, it means your meat isn\u2019t getting a brown sear on the outside. Without this sear, the caramelization and browning of the outer layer will not occur."
        },
        {
          "headline":"Cook the hearts for 7-10 minutes after the initial browning.",
          "description":"Make sure you stir frequently to ensure the meat is getting cooked on all sides. It also helps to cover the pan when not stirring to help lock in some of the heat from the skillet. Chicken hearts cook really quickly and can be quite tough if cooked past medium rare."
        },
        {
          "headline":"Serve the hearts once the hearts are cooked all the way through.",
          "description":"To check if the hearts are cooked through, slice one open and it should be a soft pink in the middle. Let sit for a minute or two as they will be hot. Enjoy with salad, sauteed vegetables, or all on their own!"
        }
      ]
    },
    {
      "name":"Grilling over Charcoal",
      "steps":[
        {
          "headline":"Trim fat, membrane, or any other tissue attached to the heart.",
          "description":"When you purchase the hearts it\u2019s possible that they still have ventricles, veins, or fat still attached to them. Trim these off as they will detract from the flavor. Cutting the heart in half helps you see if there are any things to be trimmed inside. Ventricles and veins have a stringy, white look about them and can be removed with scissors or a paring knife."
        },
        {
          "headline":"Soak your skewers in warm water for 10-30 minutes prior to grilling.",
          "description":"Cooking with wooden skewers means that there is a small fire hazard. Soaking the skewers in water for 10-30 minutes will counteract this. It will also mean the skewers simply get a nice char rather than going up in flames. You can also find non-wooden skewers from most home goods stores if the fire hazard is still a concern for you."
        },
        {
          "headline":"Put 3-4 chicken hearts on a skewer .5 inches (1.3 cm) apart.",
          "description":"Do your best to get as close to going straight through the middle of the heart as you can. Ideally you will have around 4 hearts on a skewer. Piercing straight through the middle will mean that you cook the hearts as evenly as possible."
        },
        {
          "headline":"Heat your charcoal grill to a medium-high heat.",
          "description":"The time you need to give your grill to heat up may vary here, but you want the temperature to be fairly high. Chicken hearts cook fast so get a nice brown outer layer by heating the grill well first. Here you can also experiment with using wood chips in the charcoal to get a bit of a smokey flavor in the meat."
        },
        {
          "headline":"Season the hearts with salt and pepper.",
          "description":"As with many meat dishes, this will help elicit much of the flavor from the meat and add vibrancy. It will also assist in the browning process to caramelize the outside layer."
        },
        {
          "headline":"Cook for 5-10 minutes while turning occasionally.",
          "description":"Chicken hearts cook fairly quickly so keep an eye on them because your grill is on a relatively high temperature. As raw chicken is a huge health risk, the hearts should be thoroughly cooked through before taking them off the heat. Although making sure the hearts are cooked through is important, if they are overcooked they will be very tough. Make sure the hearts have a nice brown char on the outside, as this will really add to the flavor."
        }
      ]
    }
  ],
  "text":" Frying in a Pan Combine olive oil, garlic, salt, and pepper to create a simple marinade. Use about 2 tablespoons (30 ml) olive oil, 1 clove of minced garlic, 1 pinch of salt and pepper to make this marinade. This is a really quick and easy marinade but you can get as creative as you like here to really explore different flavors. Some possible ingredients to mix in are:\nChipotle peppers\nOnions\nPaprika\nCayenne pepper Put your chicken hearts into the marinade for 30 minutes. Store in the refrigerator while the hearts are marinating but when they are about to be cooked, the hearts should be close to room temperature and never frozen. Marinades allow flavors to develop and will also help to make the meat more tender. The length of time you marinate your hearts for can be as little as 10 minutes all the way up to several hours. The longer you marinate your hearts for, the more intense the flavor of the marinade will be. Heat 2 tablespoons (30 ml) of vegetable oil over high heat in a skillet. Use a vegetable oil here rather than olive oil, as olive oil has a lower smoking point and you're cooking over a fairly high heat. Nonstick skillets work best for frying chicken hearts. It will take around 2-3 minutes for your oil to get up to temperature. Place the hearts into the hot skillet to brown them quickly. There should be a nice sizzle when the hearts make contact with the pan. If you don\u2019t hear this sizzle, don\u2019t put the hearts in the pan as this means the oil is not hot enough. When the oil isn\u2019t hot enough, it means your meat isn\u2019t getting a brown sear on the outside. Without this sear, the caramelization and browning of the outer layer will not occur. Cook the hearts for 7-10 minutes after the initial browning. Make sure you stir frequently to ensure the meat is getting cooked on all sides. It also helps to cover the pan when not stirring to help lock in some of the heat from the skillet. Chicken hearts cook really quickly and can be quite tough if cooked past medium rare. Serve the hearts once the hearts are cooked all the way through. To check if the hearts are cooked through, slice one open and it should be a soft pink in the middle. Let sit for a minute or two as they will be hot. Enjoy with salad, sauteed vegetables, or all on their own! Grilling over Charcoal Trim fat, membrane, or any other tissue attached to the heart. When you purchase the hearts it\u2019s possible that they still have ventricles, veins, or fat still attached to them. Trim these off as they will detract from the flavor. Cutting the heart in half helps you see if there are any things to be trimmed inside. Ventricles and veins have a stringy, white look about them and can be removed with scissors or a paring knife. Soak your skewers in warm water for 10-30 minutes prior to grilling. Cooking with wooden skewers means that there is a small fire hazard. Soaking the skewers in water for 10-30 minutes will counteract this. It will also mean the skewers simply get a nice char rather than going up in flames. You can also find non-wooden skewers from most home goods stores if the fire hazard is still a concern for you. Put 3-4 chicken hearts on a skewer .5 inches (1.3 cm) apart. Do your best to get as close to going straight through the middle of the heart as you can. Ideally you will have around 4 hearts on a skewer. Piercing straight through the middle will mean that you cook the hearts as evenly as possible. Heat your charcoal grill to a medium-high heat. The time you need to give your grill to heat up may vary here, but you want the temperature to be fairly high. Chicken hearts cook fast so get a nice brown outer layer by heating the grill well first. Here you can also experiment with using wood chips in the charcoal to get a bit of a smokey flavor in the meat. Season the hearts with salt and pepper. As with many meat dishes, this will help elicit much of the flavor from the meat and add vibrancy. It will also assist in the browning process to caramelize the outside layer. Cook for 5-10 minutes while turning occasionally. Chicken hearts cook fairly quickly so keep an eye on them because your grill is on a relatively high temperature. As raw chicken is a huge health risk, the hearts should be thoroughly cooked through before taking them off the heat. Although making sure the hearts are cooked through is important, if they are overcooked they will be very tough. Make sure the hearts have a nice brown char on the outside, as this will really add to the flavor.",
  "tyn_model":[
    "olive oil",
    "skillet",
    "oil",
    "grill",
    "garlic",
    "salt",
    "pepper",
    "vegetable oil",
    "chicken hearts",
    "charcoal",
    "water",
    "skewer",
    "chipotle peppers",
    "onions",
    "paprika",
    "refrigerator",
    "marinades",
    "fat",
    "scissors",
    "paring knife",
    "skewers",
    "charcoal grill",
    "salt and pepper",
    "chicken"
  ],
  "tyn_section":[
    "Skillet",
    "Large glass bowl",
    "Tongs",
    "Gas stove",
    "Charcoal grill",
    "Skewers",
    "Scissors or sharp knife"
  ]
}