{
  "title":"How to Trash Talk on Xbox Live",
  "url":"https://www.wikihow.com/Trash-Talk-on-Xbox-Live",
  "category_hierarchy":[
    "Hobbies and Crafts",
    "Games",
    "Video Games",
    "Xbox",
    "Xbox Live"
  ],
  "steps":[
    {
      "headline":"Be brave.",
      "description":"Who cares that you came in last place: Yeah, trash talking after owning everyone in the room gives you a clear advantage but so what, brag about your kill death ratio or point out someone for \"camping\" the whole time."
    },
    {
      "headline":"Don't be too loud.",
      "description":"Just because you want to tell someone how much they suck, doesn't mean you have to hog the sound waves, let other people make their lame comebacks so you can spike it back at them showing your true ownage."
    },
    {
      "headline":"Point out someone: If someone sat around and camped the whole time say something, most likely other people are going to back you up if they were really doing something wrong.",
      "description":""
    },
    {
      "headline":"Do it for the laughs.",
      "description":"As much as you want to dominate someone, make it funny because everyone likes that one hilarious kid in the lobby."
    },
    {
      "headline":"Avoid being obnoxious.",
      "description":"Don't whine and be annoying because chances are, you're the one that's gonna get dominated."
    },
    {
      "headline":"Make friends.",
      "description":"You don't have to friend request them but making some lobby friends is always good, especially if a lobby fight breaks out you want them to have your back."
    },
    {
      "headline":"Know when it's appropriate.",
      "description":"If no one is talking when you enter a lobby it's probably not a good idea to try to trash talk."
    },
    {
      "headline":"Be careful what you say.",
      "description":"There are people who report trash talkers if you use overly swear filled language (so trash talk all you want, just lay off the f-bombs)."
    },
    {
      "headline":"Be funny.",
      "description":"You don't have to trash on other people. In most cases, you will find that the subject matter is far away from video games, in general just don't talk about racist or controversial subjects, unless you are in that sort of company. Still, try to avoid stuff like that."
    }
  ],
  "text":" Be brave. Who cares that you came in last place: Yeah, trash talking after owning everyone in the room gives you a clear advantage but so what, brag about your kill death ratio or point out someone for \"camping\" the whole time. Don't be too loud. Just because you want to tell someone how much they suck, doesn't mean you have to hog the sound waves, let other people make their lame comebacks so you can spike it back at them showing your true ownage. Point out someone: If someone sat around and camped the whole time say something, most likely other people are going to back you up if they were really doing something wrong.  Do it for the laughs. As much as you want to dominate someone, make it funny because everyone likes that one hilarious kid in the lobby. Avoid being obnoxious. Don't whine and be annoying because chances are, you're the one that's gonna get dominated. Make friends. You don't have to friend request them but making some lobby friends is always good, especially if a lobby fight breaks out you want them to have your back. Know when it's appropriate. If no one is talking when you enter a lobby it's probably not a good idea to try to trash talk. Be careful what you say. There are people who report trash talkers if you use overly swear filled language (so trash talk all you want, just lay off the f-bombs). Be funny. You don't have to trash on other people. In most cases, you will find that the subject matter is far away from video games, in general just don't talk about racist or controversial subjects, unless you are in that sort of company. Still, try to avoid stuff like that.",
  "sentences":[
    " Be brave.",
    "Who cares that you came in last place: Yeah, trash talking after owning everyone in the room gives you a clear advantage but so what, brag about your kill death ratio or point out someone for \"camping\" the whole time.",
    "Don't be too loud.",
    "Just because you want to tell someone how much they suck, doesn't mean you have to hog the sound waves, let other people make their lame comebacks so you can spike it back at them showing your true ownage.",
    "Point out someone: If someone sat around and camped the whole time say something, most likely other people are going to back you up if they were really doing something wrong.",
    "Do it for the laughs.",
    "As much as you want to dominate someone, make it funny because everyone likes that one hilarious kid in the lobby.",
    "Avoid being obnoxious.",
    "Don't whine and be annoying because chances are, you're the one that's gonna get dominated.",
    "Make friends.",
    "You don't have to friend request them but making some lobby friends is always good, especially if a lobby fight breaks out you want them to have your back.",
    "Know when it's appropriate.",
    "If no one is talking when you enter a lobby it's probably not a good idea to try to trash talk.",
    "Be careful what you say.",
    "There are people who report trash talkers if you use overly swear filled language (so trash talk all you want, just lay off the f-bombs).",
    "Be funny.",
    "You don't have to trash on other people.",
    "In most cases, you will find that the subject matter is far away from video games, in general just don't talk about racist or controversial subjects, unless you are in that sort of company.",
    "Still, try to avoid stuff like that."
  ],
  "tyn_section":[
    "Xbox controller",
    "Xbox mic",
    "Xbox Live Gold membership",
    "Friends",
    "The best comebacks",
    "Xbox 360/Xbox One"
  ],
  "tyn_model":[
    "video games"
  ],
  "simple_metrics":{
    "r":0.0,
    "p":0.0,
    "f1":0,
    "avg_pos":0
  },
  "jacc_metrics_0.5":{
    "r":0.0,
    "p":0.0,
    "f1":0
  },
  "jacc_metrics_0.3333333333333333":{
    "r":0.0,
    "p":0.0,
    "f1":0
  },
  "jacc_metrics_0.6666666666666666":{
    "r":0.0,
    "p":0.0,
    "f1":0
  }
}