{
  "title":"How to Whittle a Chain out of Wood",
  "url":"https://www.wikihow.com/Whittle-a-Chain-out-of-Wood",
  "category_hierarchy":[
    "Hobbies and Crafts",
    "Crafts"
  ],
  "steps":[
    {
      "headline":"Start with a piece of wood that's relatively square and is already as long as the chain that you wish to carve.",
      "description":"Basswood is recommended and you can get this fairly easily at lots of woodworking supply stores. You could also use a 2x2 from the lumberyard, but pine wood splits easier than basswood and this will be frustrating until you get more advanced at wood carving art. You will also need a sharp wood carving knife or a jack knife."
    },
    {
      "headline":"Cut a notch into the length of the wood on each corner of the wood so that the wood's profile becomes a cross instead of a square.",
      "description":""
    },
    {
      "headline":"Draw the desired shape of each link onto the piece of wood using a lead pencil.",
      "description":"The example shown in this tutorial has a variety of shapes. While you can use any shape that you wish, it is suggested that for your first attempt at whittling a wood chain that it is best to select one shape only to ensure consistency and ease of getting used to the whittling. For example, choose all rectangles or all ovals."
    },
    {
      "headline":"Begin to rough out the shapes with the knife, following the lines you've marked.",
      "description":"Carefully hollow out the insides of the links, freeing the links of the chain as you go."
    },
    {
      "headline":"Refine the shapes of each link, and shape the individual profile of each link.",
      "description":"For the tutorial example, the octagon links have an octagonal profile, the diamond shaped links have diamond shaped profiles, the square links have a square profile, while the round links have a round profile. For your first attempt, it is suggested to keep to using just the round profile."
    },
    {
      "headline":"Make use of the chain.",
      "description":"You could use the chain as a decoration, a piece of jewelry or perhaps as a baby or pet toy."
    }
  ],
  "text":" Start with a piece of wood that's relatively square and is already as long as the chain that you wish to carve. Basswood is recommended and you can get this fairly easily at lots of woodworking supply stores. You could also use a 2x2 from the lumberyard, but pine wood splits easier than basswood and this will be frustrating until you get more advanced at wood carving art. You will also need a sharp wood carving knife or a jack knife. Cut a notch into the length of the wood on each corner of the wood so that the wood's profile becomes a cross instead of a square.  Draw the desired shape of each link onto the piece of wood using a lead pencil. The example shown in this tutorial has a variety of shapes. While you can use any shape that you wish, it is suggested that for your first attempt at whittling a wood chain that it is best to select one shape only to ensure consistency and ease of getting used to the whittling. For example, choose all rectangles or all ovals. Begin to rough out the shapes with the knife, following the lines you've marked. Carefully hollow out the insides of the links, freeing the links of the chain as you go. Refine the shapes of each link, and shape the individual profile of each link. For the tutorial example, the octagon links have an octagonal profile, the diamond shaped links have diamond shaped profiles, the square links have a square profile, while the round links have a round profile. For your first attempt, it is suggested to keep to using just the round profile. Make use of the chain. You could use the chain as a decoration, a piece of jewelry or perhaps as a baby or pet toy.",
  "sentences":[
    " Start with a piece of wood that's relatively square and is already as long as the chain that you wish to carve.",
    "Basswood is recommended and you can get this fairly easily at lots of woodworking supply stores.",
    "You could also use a 2x2 from the lumberyard, but pine wood splits easier than basswood and this will be frustrating until you get more advanced at wood carving art.",
    "You will also need a sharp wood carving knife or a jack knife.",
    "Cut a notch into the length of the wood on each corner of the wood so that the wood's profile becomes a cross instead of a square.",
    "Draw the desired shape of each link onto the piece of wood using a lead pencil.",
    "The example shown in this tutorial has a variety of shapes.",
    "While you can use any shape that you wish, it is suggested that for your first attempt at whittling a wood chain that it is best to select one shape only to ensure consistency and ease of getting used to the whittling.",
    "For example, choose all rectangles or all ovals.",
    "Begin to rough out the shapes with the knife, following the lines you've marked.",
    "Carefully hollow out the insides of the links, freeing the links of the chain as you go.",
    "Refine the shapes of each link, and shape the individual profile of each link.",
    "For the tutorial example, the octagon links have an octagonal profile, the diamond shaped links have diamond shaped profiles, the square links have a square profile, while the round links have a round profile.",
    "For your first attempt, it is suggested to keep to using just the round profile.",
    "Make use of the chain.",
    "You could use the chain as a decoration, a piece of jewelry or perhaps as a baby or pet toy."
  ],
  "tyn_section":[
    "Wood",
    "Sharp carving knife",
    "Lead pencil",
    "Comfortable area to sit and carve"
  ],
  "tyn_model":[
    "wood carving art",
    "wood carving knife",
    "jack knife",
    "lead pencil",
    "knife",
    "chain"
  ],
  "simple_metrics":{
    "r":0.25,
    "p":0.1666666667,
    "f1":0.2,
    "avg_pos":0
  },
  "jacc_metrics_0.5":{
    "r":0.5,
    "p":0.3333333333,
    "f1":0.4
  },
  "jacc_metrics_0.3333333333333333":{
    "r":0.75,
    "p":0.6666666667,
    "f1":0.7058823529
  },
  "jacc_metrics_0.6666666666666666":{
    "r":0.25,
    "p":0.1666666667,
    "f1":0.2
  }
}