{
    "title": "How to Cover a Corset",
    "url": "https://www.wikihow.com/Cover-a-Corset",
    "category_hierarchy": [
        "Personal Care and Style",
        "Clothing",
        "Clothes by Type",
        "Undergarments",
        "Corsets"
    ],
    "methods": [
        {
            "name": "Sewing on New Fabric",
            "steps": [
                {
                    "headline": "Pin your corset down flat on a stretch of paper.",
                    "description": "Unbutton your corset and lay it flat on a stretch of white paper. Use sewing pins to hold down the ends of your corset so that it doesn\u2019t move around.Try using a long stretch of parchment paper if you can\u2019t find any sheets that are big enough to fit your corset."
                },
                {
                    "headline": "Poke pins around the outline of each section to mark out a pattern.",
                    "description": "Find the sections of your corset that have been sewn together by looking for the seams in your garment. Hold a sharp sewing pin and poke holes straight down into the seams of your corset every 0.5 inches (1.3 cm) or so to create a pattern on your paper.Tip: If you have a corset pattern already, you don\u2019t need to make one out of your existing corset. Most corsets have about 6 sections on the front and back, but it can vary."
                },
                {
                    "headline": "Remove the corset from the paper.",
                    "description": "Take out the sewing pins from your corset and gently pick it up off of the paper. Make sure you don\u2019t crease or wrinkle your piece of paper as you move your corset around."
                },
                {
                    "headline": "Cut out each section from the paper.",
                    "description": "Use sharp scissors to cut out each section of your pattern to separate the pieces. Make sure each section lines up with the fabric sections on your corset by double checking them against your garment after you\u2019ve cut them out.You don\u2019t need to add a seam allowance to the pieces of paper, since you can do that later on when cutting out your fabric."
                },
                {
                    "headline": "Pin the pattern pieces onto your new fabric.",
                    "description": "Lay out your new fabric on a flat surface. Set each piece of pattern paper onto the fabric with a 1 in (2.5 cm) margin on each side. Use 2 to 3 sewing pins on each edge of the pattern paper to pin them down onto the fabric.Look for a non-stretchy fabric that will be easier to sew, like cotton or a linen blend. Leaving a margin is important so you have room to sew your pieces onto your corset."
                },
                {
                    "headline": "Cut pattern pieces out of your new fabric.",
                    "description": "Use sharp scissors to cut around each piece of paper, leaving the 1 in (2.5 cm) margin around each edge. Make sure each piece is cut straight and without many jagged edges."
                },
                {
                    "headline": "Line up each new fabric piece with your corset.",
                    "description": "Remove the paper from the new fabric pieces and align each one with their corresponding spaces on your corset. Fold over the edges of each fabric piece about 1 in (2.5 cm) so that they match the size of each section. Use sewing pins around the edges to pin them into place by inserting them perpendicular to the seams of each fabric piece.Folding over the edges makes a nice hem line so you can\u2019t see the raw edges of the fabric."
                },
                {
                    "headline": "Sew the new fabric onto your corset with a running stitch.",
                    "description": "Pick your needle up through the corset and the fabric and then bring it back down again. Then, bring your needle back up through both layers. Attach all of your pieces of fabric in the same way.A running stitch is easy to remove if you decide to uncover your corset later."
                }
            ]
        },
        {
            "name": "Wearing Undergarments to Hide Your Corset",
            "steps": [
                {
                    "headline": "Choose a corset cover for the simplest option.",
                    "description": "Corset covers are designed to be worn over corsets underneath your clothes. They are usually made of thin, cream-colored fabric with buttons or snaps on the front and hit around your natural waistline. They may have small cap sleeves or they could be strapless. Put one of these on to hide the color or appearance of your corset.You can find corset covers and other undergarments at most costume stores, or you can make one yourself by finding a pattern online."
                },
                {
                    "headline": "Wear an underbodice for more coverage.",
                    "description": "Underbodices are similar to corset covers, but they are usually thicker and may have longer sleeves. Put an underbodice on for extra silhouette support or another layer of warmth on a chilly day.Some underbodices have boning in them to help support your silhouette."
                },
                {
                    "headline": "Add a chemisette to your outfit for an extra collar.",
                    "description": "Chemisettes, which can be sleeveless or have small cap sleeves, are made to fit loosely around a corset and hide the harsh outlines, but they also have large, fantastic collars that stick out of your shirt. Put one of these on for a fancy occasion or to add some flair to your look.Chemisettes look great under simple dresses to add a touch of flair."
                },
                {
                    "headline": "Put on a loose camisole for an easy solution.",
                    "description": "Tight tank tops or camisoles can adhere to your corset and make the harsh boning lines stand out more. Try putting on a camisole that is 2 sizes larger than you would normally wear to hide the curves of your corset and make your silhouette look smoother.Tip: Camisoles usually have spaghetti straps so they are easier to hide under T-shirts."
                }
            ]
        }
    ],
    "tyn": [
        "Sewing on New Fabric",
        "Paper",
        "Sewing pins",
        "Scissors",
        "Fabric",
        "Sewing needle",
        "Thread"
    ],
    "text": " Sewing on New Fabric Pin your corset down flat on a stretch of paper. Unbutton your corset and lay it flat on a stretch of white paper. Use sewing pins to hold down the ends of your corset so that it doesn\u2019t move around.Try using a long stretch of parchment paper if you can\u2019t find any sheets that are big enough to fit your corset. Poke pins around the outline of each section to mark out a pattern. Find the sections of your corset that have been sewn together by looking for the seams in your garment. Hold a sharp sewing pin and poke holes straight down into the seams of your corset every 0.5 inches (1.3 cm) or so to create a pattern on your paper.Tip: If you have a corset pattern already, you don\u2019t need to make one out of your existing corset. Most corsets have about 6 sections on the front and back, but it can vary. Remove the corset from the paper. Take out the sewing pins from your corset and gently pick it up off of the paper. Make sure you don\u2019t crease or wrinkle your piece of paper as you move your corset around. Cut out each section from the paper. Use sharp scissors to cut out each section of your pattern to separate the pieces. Make sure each section lines up with the fabric sections on your corset by double checking them against your garment after you\u2019ve cut them out.You don\u2019t need to add a seam allowance to the pieces of paper, since you can do that later on when cutting out your fabric. Pin the pattern pieces onto your new fabric. Lay out your new fabric on a flat surface. Set each piece of pattern paper onto the fabric with a 1 in (2.5 cm) margin on each side. Use 2 to 3 sewing pins on each edge of the pattern paper to pin them down onto the fabric.Look for a non-stretchy fabric that will be easier to sew, like cotton or a linen blend. Leaving a margin is important so you have room to sew your pieces onto your corset. Cut pattern pieces out of your new fabric. Use sharp scissors to cut around each piece of paper, leaving the 1 in (2.5 cm) margin around each edge. Make sure each piece is cut straight and without many jagged edges. Line up each new fabric piece with your corset. Remove the paper from the new fabric pieces and align each one with their corresponding spaces on your corset. Fold over the edges of each fabric piece about 1 in (2.5 cm) so that they match the size of each section. Use sewing pins around the edges to pin them into place by inserting them perpendicular to the seams of each fabric piece.Folding over the edges makes a nice hem line so you can\u2019t see the raw edges of the fabric. Sew the new fabric onto your corset with a running stitch. Pick your needle up through the corset and the fabric and then bring it back down again. Then, bring your needle back up through both layers. Attach all of your pieces of fabric in the same way.A running stitch is easy to remove if you decide to uncover your corset later. Wearing Undergarments to Hide Your Corset Choose a corset cover for the simplest option. Corset covers are designed to be worn over corsets underneath your clothes. They are usually made of thin, cream-colored fabric with buttons or snaps on the front and hit around your natural waistline. They may have small cap sleeves or they could be strapless. Put one of these on to hide the color or appearance of your corset.You can find corset covers and other undergarments at most costume stores, or you can make one yourself by finding a pattern online. Wear an underbodice for more coverage. Underbodices are similar to corset covers, but they are usually thicker and may have longer sleeves. Put an underbodice on for extra silhouette support or another layer of warmth on a chilly day.Some underbodices have boning in them to help support your silhouette. Add a chemisette to your outfit for an extra collar. Chemisettes, which can be sleeveless or have small cap sleeves, are made to fit loosely around a corset and hide the harsh outlines, but they also have large, fantastic collars that stick out of your shirt. Put one of these on for a fancy occasion or to add some flair to your look.Chemisettes look great under simple dresses to add a touch of flair. Put on a loose camisole for an easy solution. Tight tank tops or camisoles can adhere to your corset and make the harsh boning lines stand out more. Try putting on a camisole that is 2 sizes larger than you would normally wear to hide the curves of your corset and make your silhouette look smoother.Tip: Camisoles usually have spaghetti straps so they are easier to hide under T-shirts.",
    "sentences": [
        " Sewing on New Fabric Pin your corset down flat on a stretch of paper.",
        "Unbutton your corset and lay it flat on a stretch of white paper.",
        "Use sewing pins to hold down the ends of your corset so that it doesn\u2019t move around.Try using a long stretch of parchment paper if you can\u2019t find any sheets that are big enough to fit your corset.",
        "Poke pins around the outline of each section to mark out a pattern.",
        "Find the sections of your corset that have been sewn together by looking for the seams in your garment.",
        "Hold a sharp sewing pin and poke holes straight down into the seams of your corset every 0.5 inches (1.3 cm) or so to create a pattern on your paper.Tip: If you have a corset pattern already, you don\u2019t need to make one out of your existing corset.",
        "Most corsets have about 6 sections on the front and back, but it can vary.",
        "Remove the corset from the paper.",
        "Take out the sewing pins from your corset and gently pick it up off of the paper.",
        "Make sure you don\u2019t crease or wrinkle your piece of paper as you move your corset around.",
        "Cut out each section from the paper.",
        "Use sharp scissors to cut out each section of your pattern to separate the pieces.",
        "Make sure each section lines up with the fabric sections on your corset by double checking them against your garment after you\u2019ve cut them out.You don\u2019t need to add a seam allowance to the pieces of paper, since you can do that later on when cutting out your fabric.",
        "Pin the pattern pieces onto your new fabric.",
        "Lay out your new fabric on a flat surface.",
        "Set each piece of pattern paper onto the fabric with a 1 in (2.5 cm) margin on each side.",
        "Use 2 to 3 sewing pins on each edge of the pattern paper to pin them down onto the fabric.Look for a non-stretchy fabric that will be easier to sew, like cotton or a linen blend.",
        "Leaving a margin is important so you have room to sew your pieces onto your corset.",
        "Cut pattern pieces out of your new fabric.",
        "Use sharp scissors to cut around each piece of paper, leaving the 1 in (2.5 cm) margin around each edge.",
        "Make sure each piece is cut straight and without many jagged edges.",
        "Line up each new fabric piece with your corset.",
        "Remove the paper from the new fabric pieces and align each one with their corresponding spaces on your corset.",
        "Fold over the edges of each fabric piece about 1 in (2.5 cm) so that they match the size of each section.",
        "Use sewing pins around the edges to pin them into place by inserting them perpendicular to the seams of each fabric piece.Folding over the edges makes a nice hem line so you can\u2019t see the raw edges of the fabric.",
        "Sew the new fabric onto your corset with a running stitch.",
        "Pick your needle up through the corset and the fabric and then bring it back down again.",
        "Then, bring your needle back up through both layers.",
        "Attach all of your pieces of fabric in the same way.A running stitch is easy to remove if you decide to uncover your corset later.",
        "Wearing Undergarments to Hide Your Corset Choose a corset cover for the simplest option.",
        "Corset covers are designed to be worn over corsets underneath your clothes.",
        "They are usually made of thin, cream-colored fabric with buttons or snaps on the front and hit around your natural waistline.",
        "They may have small cap sleeves or they could be strapless.",
        "Put one of these on to hide the color or appearance of your corset.You can find corset covers and other undergarments at most costume stores, or you can make one yourself by finding a pattern online.",
        "Wear an underbodice for more coverage.",
        "Underbodices are similar to corset covers, but they are usually thicker and may have longer sleeves.",
        "Put an underbodice on for extra silhouette support or another layer of warmth on a chilly day.Some underbodices have boning in them to help support your silhouette.",
        "Add a chemisette to your outfit for an extra collar.",
        "Chemisettes, which can be sleeveless or have small cap sleeves, are made to fit loosely around a corset and hide the harsh outlines, but they also have large, fantastic collars that stick out of your shirt.",
        "Put one of these on for a fancy occasion or to add some flair to your look.Chemisettes look great under simple dresses to add a touch of flair.",
        "Put on a loose camisole for an easy solution.",
        "Tight tank tops or camisoles can adhere to your corset and make the harsh boning lines stand out more.",
        "Try putting on a camisole that is 2 sizes larger than you would normally wear to hide the curves of your corset and make your silhouette look smoother.Tip: Camisoles usually have spaghetti straps so they are easier to hide under T-shirts."
    ]
}