{
    "title": "How to Wrap a Gift in Tissue and Tulle",
    "url": "https://www.wikihow.com/Wrap-a-Gift-in-Tissue-and-Tulle",
    "category_hierarchy": [
        "Hobbies and Crafts",
        "Crafts",
        "Sewing",
        "Fabrics for Sewing and Crafts",
        "Tulle"
    ],
    "steps": [
        {
            "headline": "Use this wrapping method for a substantial gift.",
            "description": "It's ideal for a cube shape and for a gift that has a reasonable amount of \"bulk\"."
        },
        {
            "headline": "Wrap the box in tissue paper first.",
            "description": "Use clear tape to hold the wrapping in place. Keep the wrapping as neat and flat as possible."
        },
        {
            "headline": "Cut a large square or rectangle of doubled-up tulle.",
            "description": "The doubling up is important to ensure that the tulle looks substantial. The amount needed will depend on the size of your gift; check if it will reach well over the top of the gift when pulled up."
        },
        {
            "headline": "Begin lifting the tulle over the wrapped gift from one corner.",
            "description": "With the other hand, hold the tulle that has been brought up in the center of the top of the gift. Continue to pull up small sections of the tulle, bringing them to be held in the center. Continue working around the box until all of the tulle has been drawn into the center, held by your other hand."
        },
        {
            "headline": "Hold the bunched up top firmly.",
            "description": "With your other hand, work around the box to arrange the folds and pleats neatly."
        },
        {
            "headline": "Slip the satin ribbon underneath the gift and bring it up the sides.",
            "description": "Wrap it around the bunched topping of tulle. Wrap it around one more time to ensure it is securely holding the bunched up portion in place. Tie a generous bow. More bows can be tied on with separate pieces of ribbon for a fuller look, as desired. {\"smallUrl\":\"https:\\/\\/www.wikihow.com\\/images\\/thumb\\/e\\/e8\\/Wrap-a-Gift-in-Tissue-and-Tulle-Step-6Bullet1.jpg\\/v4-460px-Wrap-a-Gift-in-Tissue-and-Tulle-Step-6Bullet1.jpg\",\"bigUrl\":\"https:\\/\\/www.wikihow.com\\/images\\/thumb\\/e\\/e8\\/Wrap-a-Gift-in-Tissue-and-Tulle-Step-6Bullet1.jpg\\/v4-760px-Wrap-a-Gift-in-Tissue-and-Tulle-Step-6Bullet1.jpg\",\"smallWidth\":460,\"smallHeight\":345,\"bigWidth\":760,\"bigHeight\":570,\"licensing\":\"<div class=\\\"mw-parser-output\\\"><p>License: <a rel=\\\"nofollow\\\" class=\\\"external text\\\" href=\\\"https:\\/\\/en.wikipedia.org\\/wiki\\/Fair_use\\\">Fair Use<\\/a> (screenshot)<br>\\n<\\/p><\\/div>\"}"
        },
        {
            "headline": "Trim the ends of the ribbon.",
            "description": "Use either slanted edges or \"V\" shapes. This prevents fraying and provides a neater finish."
        },
        {
            "headline": "Finish off by fluffing out the tulle topping so that it stands upright and billows out over the gift.",
            "description": "Trim off any loose or wayward bits."
        },
        {
            "headline": "Finished.",
            "description": "The gift is now ready for your lucky recipient. Attach a card and it's all set."
        }
    ],
    "tyn": [
        "Tissue paper in color of choice",
        "Clear tape",
        "Tulle (netting/net fabric) in color of choice or plain white (choose a good contrast with the paper)",
        "Scissors",
        "Silk ribbon, of a good length, in a complementary color matching the tissue paper"
    ],
    "text": " Use this wrapping method for a substantial gift. It's ideal for a cube shape and for a gift that has a reasonable amount of \"bulk\". Wrap the box in tissue paper first. Use clear tape to hold the wrapping in place. Keep the wrapping as neat and flat as possible. Cut a large square or rectangle of doubled-up tulle. The doubling up is important to ensure that the tulle looks substantial. The amount needed will depend on the size of your gift; check if it will reach well over the top of the gift when pulled up. Begin lifting the tulle over the wrapped gift from one corner. With the other hand, hold the tulle that has been brought up in the center of the top of the gift. Continue to pull up small sections of the tulle, bringing them to be held in the center. Continue working around the box until all of the tulle has been drawn into the center, held by your other hand. Hold the bunched up top firmly. With your other hand, work around the box to arrange the folds and pleats neatly. Slip the satin ribbon underneath the gift and bring it up the sides. Wrap it around the bunched topping of tulle. Wrap it around one more time to ensure it is securely holding the bunched up portion in place. Tie a generous bow. More bows can be tied on with separate pieces of ribbon for a fuller look, as desired. {\"smallUrl\":\"https:\\/\\/www.wikihow.com\\/images\\/thumb\\/e\\/e8\\/Wrap-a-Gift-in-Tissue-and-Tulle-Step-6Bullet1.jpg\\/v4-460px-Wrap-a-Gift-in-Tissue-and-Tulle-Step-6Bullet1.jpg\",\"bigUrl\":\"https:\\/\\/www.wikihow.com\\/images\\/thumb\\/e\\/e8\\/Wrap-a-Gift-in-Tissue-and-Tulle-Step-6Bullet1.jpg\\/v4-760px-Wrap-a-Gift-in-Tissue-and-Tulle-Step-6Bullet1.jpg\",\"smallWidth\":460,\"smallHeight\":345,\"bigWidth\":760,\"bigHeight\":570,\"licensing\":\"<div class=\\\"mw-parser-output\\\"><p>License: <a rel=\\\"nofollow\\\" class=\\\"external text\\\" href=\\\"https:\\/\\/en.wikipedia.org\\/wiki\\/Fair_use\\\">Fair Use<\\/a> (screenshot)<br>\\n<\\/p><\\/div>\"} Trim the ends of the ribbon. Use either slanted edges or \"V\" shapes. This prevents fraying and provides a neater finish. Finish off by fluffing out the tulle topping so that it stands upright and billows out over the gift. Trim off any loose or wayward bits. Finished. The gift is now ready for your lucky recipient. Attach a card and it's all set.",
    "sentences": [
        " Use this wrapping method for a substantial gift.",
        "It's ideal for a cube shape and for a gift that has a reasonable amount of \"bulk\".",
        "Wrap the box in tissue paper first.",
        "Use clear tape to hold the wrapping in place.",
        "Keep the wrapping as neat and flat as possible.",
        "Cut a large square or rectangle of doubled-up tulle.",
        "The doubling up is important to ensure that the tulle looks substantial.",
        "The amount needed will depend on the size of your gift; check if it will reach well over the top of the gift when pulled up.",
        "Begin lifting the tulle over the wrapped gift from one corner.",
        "With the other hand, hold the tulle that has been brought up in the center of the top of the gift.",
        "Continue to pull up small sections of the tulle, bringing them to be held in the center.",
        "Continue working around the box until all of the tulle has been drawn into the center, held by your other hand.",
        "Hold the bunched up top firmly.",
        "With your other hand, work around the box to arrange the folds and pleats neatly.",
        "Slip the satin ribbon underneath the gift and bring it up the sides.",
        "Wrap it around the bunched topping of tulle.",
        "Wrap it around one more time to ensure it is securely holding the bunched up portion in place.",
        "Tie a generous bow.",
        "More bows can be tied on with separate pieces of ribbon for a fuller look, as desired.",
        "{\"smallUrl\":\"https:\\/\\/www.wikihow.com\\/images\\/thumb\\/e\\/e8\\/Wrap-a-Gift-in-Tissue-and-Tulle-Step-6Bullet1.jpg\\/v4-460px-Wrap-a-Gift-in-Tissue-and-Tulle-Step-6Bullet1.jpg\",\"bigUrl\":\"https:\\/\\/www.wikihow.com\\/images\\/thumb\\/e\\/e8\\/Wrap-a-Gift-in-Tissue-and-Tulle-Step-6Bullet1.jpg\\/v4-760px-Wrap-a-Gift-in-Tissue-and-Tulle-Step-6Bullet1.jpg\",\"smallWidth\":460,\"smallHeight\":345,\"bigWidth\":760,\"bigHeight\":570,\"licensing\":\"<div class=\\\"mw-parser-output\\\"><p>License: <a rel=\\\"nofollow\\\" class=\\\"external text\\\" href=\\\"https:\\/\\/en.wikipedia.org\\/wiki\\/Fair_use\\\">Fair Use<\\/a> (screenshot)<br>\\n<\\/p><\\/div>\"} Trim the ends of the ribbon.",
        "Use either slanted edges or \"V\" shapes.",
        "This prevents fraying and provides a neater finish.",
        "Finish off by fluffing out the tulle topping so that it stands upright and billows out over the gift.",
        "Trim off any loose or wayward bits.",
        "Finished.",
        "The gift is now ready for your lucky recipient.",
        "Attach a card and it's all set."
    ]
}