{
    "title": "How to Make Fake Lip Piercings",
    "url": "https://www.wikihow.com/Make-Fake-Lip-Piercings",
    "category_hierarchy": [
        "Personal Care and Style",
        "Tattoos and Piercing",
        "Piercings",
        "Fake Piercing"
    ],
    "methods": [
        {
            "name": "Making a Lip Ring",
            "steps": [
                {
                    "headline": "Wrap earring wire or a paperclip twice around a pen.",
                    "description": "You can purchase a spool of earring wire from a craft supply store, or you can use a paperclip that you\u2019ve unwound into a straight line. Grab a standard-sized pen or marker and wrap the wire around the body of the pen twice to make 2 small loops.Don\u2019t worry about making the loops fit your lip just yet\u2014you\u2019ll be able to adjust the size later on."
                },
                {
                    "headline": "Cut the ends of the wire off to make an open loop.",
                    "description": "Slide the wire off of the pen and trim away the excess wire with wire cutters, leaving a 0.5 in (1.3 cm) ring. Then, trim away the second loop so that you\u2019re left with 1 loop of wire with an opening in 1 side.If you don\u2019t have wire cutters, you can carefully use very sharp scissors. However, they may not cut as smooth or clean as wire cutters."
                },
                {
                    "headline": "File the edges or add dots of hot glue so they aren\u2019t sharp anymore.",
                    "description": "The raw edges of the metal wire can be a little scratchy, and they might hurt your mouth if you put them in right away. Either use a strong metal file to sand down the edges until they\u2019re dull, or add 1 dot of hot glue on either edge and wait for them to dry.If you use hot glue, you\u2019ll be able to see the small dot of glue on the outside edge of your piercing."
                },
                {
                    "headline": "Bend the wire until it\u2019s about as wide as your lip.",
                    "description": "Hold the loop of wire in your hands and use your fingers to bend it open until it can fit around your lip. This shouldn\u2019t be too hard to do, since earring wire or paper clips aren\u2019t super strong.Tip: If you\u2019re having trouble, hold 1 side of the wire in a pair of pliers and use your fingers to pull on the other side to open it."
                },
                {
                    "headline": "Slide the opening over your lip and move it to one side of your mouth.",
                    "description": "Position the ring so that the open side rests against your lip. Slide it downwards so that it\u2019s hooked flat over the top of your lip, then adjust the size or position if you\u2019d like to. You can put your piercing on 1 side of your lip for a classic lip ring look. Keep it right in the center of your bottom lip for a modern style."
                }
            ]
        },
        {
            "name": "Wearing a Fake Stud",
            "steps": [
                {
                    "headline": "Mark a spot just beneath your lower lip with eyeliner.",
                    "description": "Most real lip studs are positioned just below your bottom lip one 1 or both sides, but you can pick wherever you\u2019d like your piercing to go. Make a small dot on your skin with liquid eyeliner so you can map out where you\u2019d like your piercing to be, and try to place it on the skin that\u2019s just below your lower lip.To make fake snake bites, put 2 studs beneath your bottom lip, 1 on either side. For a fake Monroe piercing, add a stud just above the right side of your top lip. For a classic lip piercing, make a dot on just 1 side below your bottom lip."
                },
                {
                    "headline": "Dip the back of a fake diamond into eyelash glue.",
                    "description": "To mimic a stud piercing, find a small fake diamond or jewel that has a flat back. Pick it up with tweezers, then dip the back into some eyelash glue.Eyelash glue is safe for your skin, which is why it\u2019s okay to use for body jewelry. You can find fake diamonds at most craft supply stores."
                },
                {
                    "headline": "Press the fake diamond onto the dot you made for about 10 seconds.",
                    "description": "Make sure the jewel is in the exact spot that you want it before you press it to your skin. Hold it onto your face for about 10 seconds to let the glue dry a little bit so it adheres to your skin.If the jewel isn\u2019t in the exact spot that you want, you can reposition it while the glue is still wet."
                },
                {
                    "headline": "Remove the glue with makeup remover when you want to take it off.",
                    "description": "The great thing about eyelash glue is that it comes off super easily with makeup remover. Dab a little bit onto a cotton swab and press it against the fake piercing for about 10 seconds, then wipe the jewel away.Warning: Eyelash glue doesn\u2019t have a super strong hold, so the jewel may fall off on its own throughout the day. You can reuse the fake jewel as many times as you\u2019d like to."
                }
            ]
        }
    ],
    "tyn": [
        "Making a Lip Ring",
        "Earring wire or a paperclip",
        "Pen",
        "Wire cutters",
        "File or hot glue gun",
        "Wearing a Fake Stud",
        "Liquid eyeliner",
        "Fake jewel",
        "Tweezers",
        "Eyelash glue",
        "Makeup remover"
    ],
    "text": " Making a Lip Ring Wrap earring wire or a paperclip twice around a pen. You can purchase a spool of earring wire from a craft supply store, or you can use a paperclip that you\u2019ve unwound into a straight line. Grab a standard-sized pen or marker and wrap the wire around the body of the pen twice to make 2 small loops.Don\u2019t worry about making the loops fit your lip just yet\u2014you\u2019ll be able to adjust the size later on. Cut the ends of the wire off to make an open loop. Slide the wire off of the pen and trim away the excess wire with wire cutters, leaving a 0.5 in (1.3 cm) ring. Then, trim away the second loop so that you\u2019re left with 1 loop of wire with an opening in 1 side.If you don\u2019t have wire cutters, you can carefully use very sharp scissors. However, they may not cut as smooth or clean as wire cutters. File the edges or add dots of hot glue so they aren\u2019t sharp anymore. The raw edges of the metal wire can be a little scratchy, and they might hurt your mouth if you put them in right away. Either use a strong metal file to sand down the edges until they\u2019re dull, or add 1 dot of hot glue on either edge and wait for them to dry.If you use hot glue, you\u2019ll be able to see the small dot of glue on the outside edge of your piercing. Bend the wire until it\u2019s about as wide as your lip. Hold the loop of wire in your hands and use your fingers to bend it open until it can fit around your lip. This shouldn\u2019t be too hard to do, since earring wire or paper clips aren\u2019t super strong.Tip: If you\u2019re having trouble, hold 1 side of the wire in a pair of pliers and use your fingers to pull on the other side to open it. Slide the opening over your lip and move it to one side of your mouth. Position the ring so that the open side rests against your lip. Slide it downwards so that it\u2019s hooked flat over the top of your lip, then adjust the size or position if you\u2019d like to. You can put your piercing on 1 side of your lip for a classic lip ring look. Keep it right in the center of your bottom lip for a modern style. Wearing a Fake Stud Mark a spot just beneath your lower lip with eyeliner. Most real lip studs are positioned just below your bottom lip one 1 or both sides, but you can pick wherever you\u2019d like your piercing to go. Make a small dot on your skin with liquid eyeliner so you can map out where you\u2019d like your piercing to be, and try to place it on the skin that\u2019s just below your lower lip.To make fake snake bites, put 2 studs beneath your bottom lip, 1 on either side. For a fake Monroe piercing, add a stud just above the right side of your top lip. For a classic lip piercing, make a dot on just 1 side below your bottom lip. Dip the back of a fake diamond into eyelash glue. To mimic a stud piercing, find a small fake diamond or jewel that has a flat back. Pick it up with tweezers, then dip the back into some eyelash glue.Eyelash glue is safe for your skin, which is why it\u2019s okay to use for body jewelry. You can find fake diamonds at most craft supply stores. Press the fake diamond onto the dot you made for about 10 seconds. Make sure the jewel is in the exact spot that you want it before you press it to your skin. Hold it onto your face for about 10 seconds to let the glue dry a little bit so it adheres to your skin.If the jewel isn\u2019t in the exact spot that you want, you can reposition it while the glue is still wet. Remove the glue with makeup remover when you want to take it off. The great thing about eyelash glue is that it comes off super easily with makeup remover. Dab a little bit onto a cotton swab and press it against the fake piercing for about 10 seconds, then wipe the jewel away.Warning: Eyelash glue doesn\u2019t have a super strong hold, so the jewel may fall off on its own throughout the day. You can reuse the fake jewel as many times as you\u2019d like to.",
    "sentences": [
        " Making a Lip Ring Wrap earring wire or a paperclip twice around a pen.",
        "You can purchase a spool of earring wire from a craft supply store, or you can use a paperclip that you\u2019ve unwound into a straight line.",
        "Grab a standard-sized pen or marker and wrap the wire around the body of the pen twice to make 2 small loops.Don\u2019t worry about making the loops fit your lip just yet\u2014you\u2019ll be able to adjust the size later on.",
        "Cut the ends of the wire off to make an open loop.",
        "Slide the wire off of the pen and trim away the excess wire with wire cutters, leaving a 0.5 in (1.3 cm) ring.",
        "Then, trim away the second loop so that you\u2019re left with 1 loop of wire with an opening in 1 side.If you don\u2019t have wire cutters, you can carefully use very sharp scissors.",
        "However, they may not cut as smooth or clean as wire cutters.",
        "File the edges or add dots of hot glue so they aren\u2019t sharp anymore.",
        "The raw edges of the metal wire can be a little scratchy, and they might hurt your mouth if you put them in right away.",
        "Either use a strong metal file to sand down the edges until they\u2019re dull, or add 1 dot of hot glue on either edge and wait for them to dry.If you use hot glue, you\u2019ll be able to see the small dot of glue on the outside edge of your piercing.",
        "Bend the wire until it\u2019s about as wide as your lip.",
        "Hold the loop of wire in your hands and use your fingers to bend it open until it can fit around your lip.",
        "This shouldn\u2019t be too hard to do, since earring wire or paper clips aren\u2019t super strong.Tip: If you\u2019re having trouble, hold 1 side of the wire in a pair of pliers and use your fingers to pull on the other side to open it.",
        "Slide the opening over your lip and move it to one side of your mouth.",
        "Position the ring so that the open side rests against your lip.",
        "Slide it downwards so that it\u2019s hooked flat over the top of your lip, then adjust the size or position if you\u2019d like to.",
        "You can put your piercing on 1 side of your lip for a classic lip ring look.",
        "Keep it right in the center of your bottom lip for a modern style.",
        "Wearing a Fake Stud Mark a spot just beneath your lower lip with eyeliner.",
        "Most real lip studs are positioned just below your bottom lip one 1 or both sides, but you can pick wherever you\u2019d like your piercing to go.",
        "Make a small dot on your skin with liquid eyeliner so you can map out where you\u2019d like your piercing to be, and try to place it on the skin that\u2019s just below your lower lip.To make fake snake bites, put 2 studs beneath your bottom lip, 1 on either side.",
        "For a fake Monroe piercing, add a stud just above the right side of your top lip.",
        "For a classic lip piercing, make a dot on just 1 side below your bottom lip.",
        "Dip the back of a fake diamond into eyelash glue.",
        "To mimic a stud piercing, find a small fake diamond or jewel that has a flat back.",
        "Pick it up with tweezers, then dip the back into some eyelash glue.Eyelash glue is safe for your skin, which is why it\u2019s okay to use for body jewelry.",
        "You can find fake diamonds at most craft supply stores.",
        "Press the fake diamond onto the dot you made for about 10 seconds.",
        "Make sure the jewel is in the exact spot that you want it before you press it to your skin.",
        "Hold it onto your face for about 10 seconds to let the glue dry a little bit so it adheres to your skin.If the jewel isn\u2019t in the exact spot that you want, you can reposition it while the glue is still wet.",
        "Remove the glue with makeup remover when you want to take it off.",
        "The great thing about eyelash glue is that it comes off super easily with makeup remover.",
        "Dab a little bit onto a cotton swab and press it against the fake piercing for about 10 seconds, then wipe the jewel away.Warning: Eyelash glue doesn\u2019t have a super strong hold, so the jewel may fall off on its own throughout the day.",
        "You can reuse the fake jewel as many times as you\u2019d like to."
    ]
}