{
    "title": "How to Create Your First Website",
    "url": "https://www.wikihow.com/Create-Your-First-Website",
    "category_hierarchy": [
        "Computers and Electronics",
        "Internet",
        "Website and Blog Creation",
        "Creating and Enhancing a Website"
    ],
    "steps": [
        {
            "headline": "Choose a domain name.",
            "description": "There  are various tools you can use to pick a name if that gets difficult for you. Check out Nameboy.com, makewords.com, and eBay also has some. You can determine if the domain name is available by using sites like http://www.instantdomainsearch.com/ which can also help you find out if a similar site name has not been registered."
        },
        {
            "headline": "Determine what kind of hosting package you will need.",
            "description": "Many web hosting companies offer different packages, some of which are free, which will usually fit almost any web hosting needs. Some popular web hosting companies with low-cost starting packages are:\nGoDaddy.com\n1&1 Internet Hosting\nHostGator.com\nHostmonster.com\nBlueHost.com\nDreamHost.com\nand countless other"
        },
        {
            "headline": "Website navigation/ Website content - Make sure your idea for your website is clear.",
            "description": "Get a notebook and sketch out what you want the pages to look like and write out as much of the content as you can."
        },
        {
            "headline": "You might also want to use a web template to make it easier for you as well if you don't have time to do it yourself.",
            "description": "Some of these are really good and very cheap. Freewebtemplates.com and templatesbox.com."
        },
        {
            "headline": "Design your website - Decide what software you're going to use to design your website.",
            "description": "Some of the software platforms that you can use to create and edit your websites are:\nFrontpage office.microsoft.com/en-us/frontpage/default.aspx\nDreamweaver www.adobe.com/products/dreamweaver/\nNVU www.nvu.com/\nBluefish bluefish.openoffice.nl/\nAmaya www.w3.org/Amaya/\nNotepad and Notepad++ notepad-plus.sourceforge.net/uk/site.htm"
        },
        {
            "headline": "Text/Graphics and Web buttons - Use Adobe Photoshop to generate a page header for your website.",
            "description": "There are websites that can help if you're not a pro at Photoshop. You can use these sites to generate banner ads, buttons and everything else you need. Check out freebuttons.com, freebuttons.org, buttongenerator.com and flashbuttons.com - You can always use these sites to create advertisement banners for your website."
        },
        {
            "headline": "Website design and development tools - There are many sites available for learning how to design and develop websites:",
            "description": "W3Schools Online www.w3schools.com/ PHPForms.net tutorials www.phpforms.net/tutorials/ Enter www.entheosweb.com/website_design/default.asp How-to-build-websites.com http://www.how-to-build-websites.com/  Web Design Tutorials www.webdesigntutorials.net/ About.com webdesign.about.com/ HTML Help Central Forum www.htmlhelpcentral.com/messageboard/"
        },
        {
            "headline": "Search engine submission - Don't forget try to get it on all the big guys, Google, Yahoo!, MSN, AOL, and Ask.com",
            "description": ""
        },
        {
            "headline": "Their pages will walk you through the submission progress, from adding your sitemap and including your child pages as well.",
            "description": "Don't forget to submit to DMOZ and Searchit.com too."
        },
        {
            "headline": "Last but not least advertise, you can always use Yahoo or Google Adwords and maintain your own budget.",
            "description": ""
        }
    ],
    "tyn": [
        "Notebook",
        "Computer",
        "Internet connection",
        "Website editing software",
        "Photo editing software",
        "Some knowledge on computer science (coding)"
    ],
    "text": " Choose a domain name. There  are various tools you can use to pick a name if that gets difficult for you. Check out Nameboy.com, makewords.com, and eBay also has some. You can determine if the domain name is available by using sites like http://www.instantdomainsearch.com/ which can also help you find out if a similar site name has not been registered. Determine what kind of hosting package you will need. Many web hosting companies offer different packages, some of which are free, which will usually fit almost any web hosting needs. Some popular web hosting companies with low-cost starting packages are:\nGoDaddy.com\n1&1 Internet Hosting\nHostGator.com\nHostmonster.com\nBlueHost.com\nDreamHost.com\nand countless other Website navigation/ Website content - Make sure your idea for your website is clear. Get a notebook and sketch out what you want the pages to look like and write out as much of the content as you can. You might also want to use a web template to make it easier for you as well if you don't have time to do it yourself. Some of these are really good and very cheap. Freewebtemplates.com and templatesbox.com. Design your website - Decide what software you're going to use to design your website. Some of the software platforms that you can use to create and edit your websites are:\nFrontpage office.microsoft.com/en-us/frontpage/default.aspx\nDreamweaver www.adobe.com/products/dreamweaver/\nNVU www.nvu.com/\nBluefish bluefish.openoffice.nl/\nAmaya www.w3.org/Amaya/\nNotepad and Notepad++ notepad-plus.sourceforge.net/uk/site.htm Text/Graphics and Web buttons - Use Adobe Photoshop to generate a page header for your website. There are websites that can help if you're not a pro at Photoshop. You can use these sites to generate banner ads, buttons and everything else you need. Check out freebuttons.com, freebuttons.org, buttongenerator.com and flashbuttons.com - You can always use these sites to create advertisement banners for your website. Website design and development tools - There are many sites available for learning how to design and develop websites: W3Schools Online www.w3schools.com/ PHPForms.net tutorials www.phpforms.net/tutorials/ Enter www.entheosweb.com/website_design/default.asp How-to-build-websites.com http://www.how-to-build-websites.com/  Web Design Tutorials www.webdesigntutorials.net/ About.com webdesign.about.com/ HTML Help Central Forum www.htmlhelpcentral.com/messageboard/ Search engine submission - Don't forget try to get it on all the big guys, Google, Yahoo!, MSN, AOL, and Ask.com  Their pages will walk you through the submission progress, from adding your sitemap and including your child pages as well. Don't forget to submit to DMOZ and Searchit.com too. Last but not least advertise, you can always use Yahoo or Google Adwords and maintain your own budget. ",
    "sentences": [
        " Choose a domain name.",
        "There  are various tools you can use to pick a name if that gets difficult for you.",
        "Check out Nameboy.com, makewords.com, and eBay also has some.",
        "You can determine if the domain name is available by using sites like http://www.instantdomainsearch.com/ which can also help you find out if a similar site name has not been registered.",
        "Determine what kind of hosting package you will need.",
        "Many web hosting companies offer different packages, some of which are free, which will usually fit almost any web hosting needs.",
        "Some popular web hosting companies with low-cost starting packages are:\nGoDaddy.com\n1&1 Internet Hosting\nHostGator.com\nHostmonster.com\nBlueHost.com\nDreamHost.com\nand countless other Website navigation/ Website content - Make sure your idea for your website is clear.",
        "Get a notebook and sketch out what you want the pages to look like and write out as much of the content as you can.",
        "You might also want to use a web template to make it easier for you as well if you don't have time to do it yourself.",
        "Some of these are really good and very cheap.",
        "Freewebtemplates.com and templatesbox.com.",
        "Design your website - Decide what software you're going to use to design your website.",
        "Some of the software platforms that you can use to create and edit your websites are:\nFrontpage office.microsoft.com/en-us/frontpage/default.aspx\nDreamweaver www.adobe.com/products/dreamweaver/\nNVU www.nvu.com/\nBluefish bluefish.openoffice.nl/\nAmaya www.w3.org/Amaya/\nNotepad and Notepad++ notepad-plus.sourceforge.net/uk/site.htm Text/Graphics and Web buttons - Use Adobe Photoshop to generate a page header for your website.",
        "There are websites that can help if you're not a pro at Photoshop.",
        "You can use these sites to generate banner ads, buttons and everything else you need.",
        "Check out freebuttons.com, freebuttons.org, buttongenerator.com and flashbuttons.com - You can always use these sites to create advertisement banners for your website.",
        "Website design and development tools - There are many sites available for learning how to design and develop websites: W3Schools Online www.w3schools.com/ PHPForms.net tutorials www.phpforms.net/tutorials/ Enter www.entheosweb.com/website_design/default.asp How-to-build-websites.com http://www.how-to-build-websites.com/  Web Design Tutorials www.webdesigntutorials.net/ About.com webdesign.about.com/ HTML Help Central Forum www.htmlhelpcentral.com/messageboard/ Search engine submission - Don't forget try to get it on all the big guys, Google, Yahoo!, MSN, AOL, and Ask.com  Their pages will walk you through the submission progress, from adding your sitemap and including your child pages as well.",
        "Don't forget to submit to DMOZ and Searchit.com too.",
        "Last but not least advertise, you can always use Yahoo or Google Adwords and maintain your own budget."
    ]
}