{
    "title": "How to Verify a GPG Signature",
    "url": "https://www.wikihow.com/Verify-a-GPG-Signature",
    "category_hierarchy": [
        "Computers and Electronics",
        "Software"
    ],
    "parts": [
        {
            "name": "Downloading What You Need",
            "steps": [
                {
                    "headline": "Acquire the Public Key.",
                    "description": "Import the Public Key into GPG."
                },
                {
                    "headline": "Acquire a copy of the file in question.",
                    "description": "Save it in a Folder."
                },
                {
                    "headline": "Acquire a copy of the signature-file in question.",
                    "description": "Save it in the same Folder."
                }
            ]
        },
        {
            "name": "Using GPG to Verify that someone's Secret Key Signed the File in Question",
            "steps": [
                {
                    "headline": "Open a command-line interface.",
                    "description": "Change the working directory to the Folder where your file and signature-file are saved."
                },
                {
                    "headline": "Verify the signature.",
                    "description": "Type the following command into a command-line interface:\ngpg --verify [signature-file] [file]\nE.g., if you have acquired\n(1) the Public Key 0x416F061063FEE659,\n(2) the Tor Browser Bundle file (tor-browser.tar.gz), and\n(3) the signature-file posted alongside the Tor Browser Bundle file (tor-browser.tar.gz.asc),\nYou would type the following:\ngpg --verify tor-browser.tar.gz.asc tor-browser.tar.gz"
                }
            ]
        }
    ],
    "tyn": [
        "GPG Encryption Engine",
        "Signed file",
        "Signature-file",
        "GPG Public Key"
    ],
    "text": " Downloading What You Need Acquire the Public Key. Import the Public Key into GPG. Acquire a copy of the file in question. Save it in a Folder. Acquire a copy of the signature-file in question. Save it in the same Folder. Using GPG to Verify that someone's Secret Key Signed the File in Question Open a command-line interface. Change the working directory to the Folder where your file and signature-file are saved. Verify the signature. Type the following command into a command-line interface:\ngpg --verify [signature-file] [file]\nE.g., if you have acquired\n(1) the Public Key 0x416F061063FEE659,\n(2) the Tor Browser Bundle file (tor-browser.tar.gz), and\n(3) the signature-file posted alongside the Tor Browser Bundle file (tor-browser.tar.gz.asc),\nYou would type the following:\ngpg --verify tor-browser.tar.gz.asc tor-browser.tar.gz",
    "sentences": [
        " Downloading What You Need Acquire the Public Key.",
        "Import the Public Key into GPG.",
        "Acquire a copy of the file in question.",
        "Save it in a Folder.",
        "Acquire a copy of the signature-file in question.",
        "Save it in the same Folder.",
        "Using GPG to Verify that someone's Secret Key Signed the File in Question Open a command-line interface.",
        "Change the working directory to the Folder where your file and signature-file are saved.",
        "Verify the signature.",
        "Type the following command into a command-line interface:\ngpg --verify [signature-file] [file]\nE.g., if you have acquired\n(1) the Public Key 0x416F061063FEE659,\n(2) the Tor Browser Bundle file (tor-browser.tar.gz), and\n(3) the signature-file posted alongside the Tor Browser Bundle file (tor-browser.tar.gz.asc),\nYou would type the following:\ngpg --verify tor-browser.tar.gz.asc tor-browser.tar.gz"
    ]
}