{
    "title": "How to Make Fake Blood with Chocolate Syrup",
    "url": "https://www.wikihow.com/Make-Fake-Blood-with-Chocolate-Syrup",
    "category_hierarchy": [
        "Arts and Entertainment",
        "Costumes",
        "Costume Makeup"
    ],
    "methods": [
        {
            "name": "Chocolate syrup fake blood",
            "steps": [
                {
                    "headline": "Gather the ingredients.",
                    "description": "For this method of fake blood, you'll need:\nHershey's chocolate syrup\nRed food coloring\nBlue food coloring."
                },
                {
                    "headline": "Blend the chocolate syrup and red food coloring.",
                    "description": ""
                },
                {
                    "headline": "Add a couple drops of blue food coloring to create a more realistic color.",
                    "description": ""
                },
                {
                    "headline": "Put the mixture in the fridge to help it thicken.",
                    "description": ""
                },
                {
                    "headline": "Apply liberally, in splatters, droplets and smears.",
                    "description": ""
                }
            ]
        },
        {
            "name": "Chocolate syrup and corn syrup fake blood",
            "steps": [
                {
                    "headline": "Gather the ingredients.",
                    "description": "For this method of fake blood, you'll need:\n1 tablespoon light corn syrup\n1/2 tablespoon chocolate syrup\n4 drops red food coloring."
                },
                {
                    "headline": "Place the ingredients together in a small mixing bowl.",
                    "description": "Stir to combine."
                },
                {
                    "headline": "Use.",
                    "description": "Decorate yourself (skin, unwanted old clothes, face, etc.). Or, since this is edible, you can add it to food that needs a tinge of fake blood for Halloween."
                }
            ]
        },
        {
            "name": "Chocolate syrup thicker fake blood",
            "steps": [
                {
                    "headline": "Gather the ingredients.",
                    "description": "For this method of fake blood, you'll need:\n1/2 cup light corn syrup\n1-2 drops liquid red food coloring\n1 tablespoon cornstarch (helps to thicken and add opacity to the fake blood)\n1-2 tablespoons chocolate syrup\n1 teaspoon cocoa powder (or drinking chocolate)."
                },
                {
                    "headline": "Place the ingredients together in a small mixing bowl.",
                    "description": "Stir to combine."
                },
                {
                    "headline": "Use.",
                    "description": "Decorate yourself (skin, unwanted old clothes, face, etc.). Or, since this is edible, you can add it to food that needs a tinge of fake blood for Halloween."
                }
            ]
        },
        {
            "name": "Chocolate syrup and tropical punch fake blood",
            "steps": [
                {
                    "headline": "Gather the ingredients.",
                    "description": "For this method of fake blood, you'll need:\n1/2 cup tropical fruit punch (or a cup of coffee if you'd like to experiment)\n1 cup corn syrup\n2 tablespoons red food coloring\n1 tablespoon chocolate syrup\n2 tablespoons cornstarch\n1 tablespoon cocoa powder."
                },
                {
                    "headline": "Drop all of the ingredients into a blender.",
                    "description": "Blend for 10 seconds."
                },
                {
                    "headline": "Check the color.",
                    "description": "You may need to adjust a little, depending on the brand of fruit punch you've added. Try different amounts of punch, chocolate syrup or cocoa powder until it's just right for your needs."
                },
                {
                    "headline": "Use.",
                    "description": "Decorate yourself (skin, unwanted old clothes, face, etc.). Or, since this is edible, you can add it to food that needs a tinge of fake blood for Halloween."
                }
            ]
        }
    ],
    "tyn": [
        "Mixing bowl",
        "Mixing implement",
        "Applicator (such as an ear-bud, craft stick, etc.) (optional)"
    ],
    "text": " Chocolate syrup fake blood Gather the ingredients. For this method of fake blood, you'll need:\nHershey's chocolate syrup\nRed food coloring\nBlue food coloring. Blend the chocolate syrup and red food coloring.  Add a couple drops of blue food coloring to create a more realistic color.  Put the mixture in the fridge to help it thicken.  Apply liberally, in splatters, droplets and smears.  Chocolate syrup and corn syrup fake blood Gather the ingredients. For this method of fake blood, you'll need:\n1 tablespoon light corn syrup\n1/2 tablespoon chocolate syrup\n4 drops red food coloring. Place the ingredients together in a small mixing bowl. Stir to combine. Use. Decorate yourself (skin, unwanted old clothes, face, etc.). Or, since this is edible, you can add it to food that needs a tinge of fake blood for Halloween. Chocolate syrup thicker fake blood Gather the ingredients. For this method of fake blood, you'll need:\n1/2 cup light corn syrup\n1-2 drops liquid red food coloring\n1 tablespoon cornstarch (helps to thicken and add opacity to the fake blood)\n1-2 tablespoons chocolate syrup\n1 teaspoon cocoa powder (or drinking chocolate). Place the ingredients together in a small mixing bowl. Stir to combine. Use. Decorate yourself (skin, unwanted old clothes, face, etc.). Or, since this is edible, you can add it to food that needs a tinge of fake blood for Halloween. Chocolate syrup and tropical punch fake blood Gather the ingredients. For this method of fake blood, you'll need:\n1/2 cup tropical fruit punch (or a cup of coffee if you'd like to experiment)\n1 cup corn syrup\n2 tablespoons red food coloring\n1 tablespoon chocolate syrup\n2 tablespoons cornstarch\n1 tablespoon cocoa powder. Drop all of the ingredients into a blender. Blend for 10 seconds. Check the color. You may need to adjust a little, depending on the brand of fruit punch you've added. Try different amounts of punch, chocolate syrup or cocoa powder until it's just right for your needs. Use. Decorate yourself (skin, unwanted old clothes, face, etc.). Or, since this is edible, you can add it to food that needs a tinge of fake blood for Halloween.",
    "sentences": [
        " Chocolate syrup fake blood Gather the ingredients.",
        "For this method of fake blood, you'll need:\nHershey's chocolate syrup\nRed food coloring\nBlue food coloring.",
        "Blend the chocolate syrup and red food coloring.",
        "Add a couple drops of blue food coloring to create a more realistic color.",
        "Put the mixture in the fridge to help it thicken.",
        "Apply liberally, in splatters, droplets and smears.",
        "Chocolate syrup and corn syrup fake blood Gather the ingredients.",
        "For this method of fake blood, you'll need:\n1 tablespoon light corn syrup\n1/2 tablespoon chocolate syrup\n4 drops red food coloring.",
        "Place the ingredients together in a small mixing bowl.",
        "Stir to combine.",
        "Use.",
        "Decorate yourself (skin, unwanted old clothes, face, etc.).",
        "Or, since this is edible, you can add it to food that needs a tinge of fake blood for Halloween.",
        "Chocolate syrup thicker fake blood Gather the ingredients.",
        "For this method of fake blood, you'll need:\n1/2 cup light corn syrup\n1-2 drops liquid red food coloring\n1 tablespoon cornstarch (helps to thicken and add opacity to the fake blood)\n1-2 tablespoons chocolate syrup\n1 teaspoon cocoa powder (or drinking chocolate).",
        "Place the ingredients together in a small mixing bowl.",
        "Stir to combine.",
        "Use.",
        "Decorate yourself (skin, unwanted old clothes, face, etc.).",
        "Or, since this is edible, you can add it to food that needs a tinge of fake blood for Halloween.",
        "Chocolate syrup and tropical punch fake blood Gather the ingredients.",
        "For this method of fake blood, you'll need:\n1/2 cup tropical fruit punch (or a cup of coffee if you'd like to experiment)\n1 cup corn syrup\n2 tablespoons red food coloring\n1 tablespoon chocolate syrup\n2 tablespoons cornstarch\n1 tablespoon cocoa powder.",
        "Drop all of the ingredients into a blender.",
        "Blend for 10 seconds.",
        "Check the color.",
        "You may need to adjust a little, depending on the brand of fruit punch you've added.",
        "Try different amounts of punch, chocolate syrup or cocoa powder until it's just right for your needs.",
        "Use.",
        "Decorate yourself (skin, unwanted old clothes, face, etc.).",
        "Or, since this is edible, you can add it to food that needs a tinge of fake blood for Halloween."
    ]
}